Title	Description	Link	pubDate	Image
Israeli strikes target Gaza’s Bureij refugee camp amid negotiations	Israeli strikes on Gaza’s Bureij refugee camp killed several people amid negotiations between Israel and Hamas.	https://www.aljazeera.com/program/newsfeed/2025/1/15/israeli-strikes-target-gazas-bureij-refugee-camp-amid-negotiations?traffic_source=rss	2025-01-15T09:24:42-08:00	
What to know about the LA Fire Department’s budget	Have budget cuts fuelled the Los Angeles fires? Mayor Bass defends decisions as winds drive blazes.	https://www.aljazeera.com/news/2025/1/15/what-to-know-about-the-la-fire-departments-budget?traffic_source=rss	2025-01-15T08:55:53-08:00	
Rubio, pro-Israel hawk set to be Trump’s top diplomat, vows ‘America First’	US Senator Marco Rubio says, under Donald Trump, the State Department's top priority 'will be the United States'.	https://www.aljazeera.com/news/2025/1/15/rubio-pro-israel-hawk-set-to-be-trumps-top-diplomat-vows-america-first?traffic_source=rss	2025-01-15T08:24:40-08:00	
Video: Mozambique’s Chapo sworn in as president after disputed election	Daniel Chapo was sworn in as the president of Mozambique in a low-key ceremony in the nation’s capital.	https://www.aljazeera.com/program/newsfeed/2025/1/15/video-mozambiques-chapo-sworn-in-as-president-after-disputed-election?traffic_source=rss	2025-01-15T08:09:23-08:00	
UN’s Volker Turk meets with Syria’s al-Sharaa, visits Sednaya prison	Volker Turk has become the first UN High Commissioner for Human Rights to visit Syria.	https://www.aljazeera.com/program/newsfeed/2025/1/15/uns-volker-turk-meets-with-syrias-al-sharaa-visits-sednaya-prison?traffic_source=rss	2025-01-15T07:32:15-08:00	
No child should ever see the horrors of Gaza	As a nurse working in the disintegrating healthcare system, I have seen too many Palestinian children suffer.	https://www.aljazeera.com/opinions/2025/1/15/no-child-should-ever-see-the-horrors-of-gaza?traffic_source=rss	2025-01-15T07:14:52-08:00	
What concerns does the use of AI in news raise?	AI's role in news raises concerns about journalistic integrity, deepfakes, misinformation and accountability.	https://www.aljazeera.com/program/the-stream/2025/1/15/what-concerns-does-the-use-of-ai-in-news-raise?traffic_source=rss	2025-01-15T06:30:00-08:00	
Moscow hopes for talks with Trump that sideline Ukraine and Europe	The incoming US leader's terms to help end the war remain unclear as fighting rages in western Russia and east Ukraine.	https://www.aljazeera.com/news/2025/1/15/moscow-hopes-for-talks-with-trump-that-sideline-ukraine-and-europe?traffic_source=rss	2025-01-15T06:13:25-08:00	
Biden says ‘soul of America’ at stake as Trump inauguration nears	Outgoing US president urges unity before farewell address from the White House, just days before Trump takes office.	https://www.aljazeera.com/news/2025/1/15/biden-says-soul-of-america-at-stake-as-trump-inauguration-nears?traffic_source=rss	2025-01-15T06:10:48-08:00	
Mensik dumps Ruud out of Australian Open but Djokovic powers on	Sixth-seeded Ruud becomes latest victim of a teenaged player's dominance over favourites on day four in Melbourne.	https://www.aljazeera.com/sports/2025/1/15/mensik-dumps-ruud-out-of-australian-open-but-djokovic-powers-on?traffic_source=rss	2025-01-15T05:57:19-08:00	
Who is Tulip Siddiq and why has she resigned as UK minister?	The MP resigned on Tuesday over links to her aunt, former Bangladesh Prime Minister Sheikh Hasina.	https://www.aljazeera.com/news/2025/1/15/who-is-tulip-siddiq-and-why-has-she-resigned-as-uk-minister?traffic_source=rss	2025-01-15T05:52:53-08:00	
‘We’re not pirates’, say hijackers who seized Chinese ship off Somali coast	After seven-week hijack, Puntland locals say they are victims of foreign trawlers. But China calls the attack 'vicious'.	https://www.aljazeera.com/features/2025/1/15/were-not-pirates-say-hijackers-aboard-chinese-ship-off-somalia-coast?traffic_source=rss	2025-01-15T05:41:13-08:00	
Israel has declared war on the promise of a strong, democratic Syria	After being quite comfortable with al-Assad’s tyranny for decades, Israel now fears what Syrian democracy could do.	https://www.aljazeera.com/opinions/2025/1/15/israel-has-declared-war-on-the-promise-of-a-strong-democratic-syria?traffic_source=rss	2025-01-15T05:37:10-08:00	
The man behind the graffiti that sparked the Syrian revolution	The Syrian revolution was sparked by a few teens who wrote anti-government graffiti on the walls of their school.	https://www.aljazeera.com/program/newsfeed/2025/1/15/the-man-behind-the-graffiti-that-sparked-the-syrian-revolution?traffic_source=rss	2025-01-15T05:33:56-08:00	
Chapo sworn in following Mozambique’s disputed presidential election	Security was tight around ceremony as opposition says more than 300 killed in protests claiming election fraud.	https://www.aljazeera.com/news/2025/1/15/chapo-sworn-in-following-mozambiques-disputed-presidential-election?traffic_source=rss	2025-01-15T05:30:10-08:00	
What would be the global impact of Trump’s economic policies?	Tariffs and tax cuts are at the core of Donald Trump's economic policies.	https://www.aljazeera.com/program/counting-the-cost/2025/1/15/what-would-be-the-global-impact-of-trumps-economic-policies?traffic_source=rss	2025-01-15T05:19:29-08:00	
Fact check: Did Joe Biden keep these 99 promises?	Joe Biden's campaign focused on COVID-19, racial justice, climate change and tax reforms. We tracked 99 promises.	https://www.aljazeera.com/news/2025/1/15/fact-check-did-joe-biden-keep-these-99-promises?traffic_source=rss	2025-01-15T05:17:18-08:00	
Armed conflict and climate change driving global economic uncertainty: WEF	The World Economic Forum's Global Risks Report 2025 warns wars and extreme weather are buffeting economic confidence.	https://www.aljazeera.com/news/2025/1/15/armed-conflict-and-climate-change-driving-global-economic-uncertainty-wef?traffic_source=rss	2025-01-15T05:14:58-08:00	
Bangladesh top court acquits ex-PM Khaleda Zia in corruption case	Verdict is latest judicial victory for Zia who was released from house arrest following Sheikh Hasina's ouster.	https://www.aljazeera.com/news/2025/1/15/bangladesh-top-court-acquits-ex-pm-khaleda-zia-in-corruption-case?traffic_source=rss	2025-01-15T04:50:32-08:00	
Conor Benn vs Chris Eubank Jr boxing bout scheduled for April in London	The 'second generation' contest will see the British boxers face-off after Benn's suspension delayed the original fight.	https://www.aljazeera.com/sports/2025/1/15/conor-benn-vs-chris-eubank-jr-boxing-bout-scheduled-for-april-in-london?traffic_source=rss	2025-01-15T04:48:25-08:00	
Fact-check: What did Pete Hegseth say in defence confirmation hearing?	From his comments on waterboarding to claims about his military record, did Hegseth tell the truth?	https://www.aljazeera.com/news/2025/1/15/fact-check-what-did-pete-hegseth-say-in-defence-confirmation-hearing?traffic_source=rss	2025-01-15T04:37:00-08:00	
India’s jaded batting stars return to domestic cricket in search of runs	Rohit Sharma, Shubman Gill and Rishabh Pant turn up for Ranji Trophy after failing to impress against Australia.	https://www.aljazeera.com/sports/2025/1/15/indias-jaded-batting-stars-return-to-domestic-cricket-in-search-of-runs?traffic_source=rss	2025-01-15T04:33:18-08:00	
South Korea’s president arrested: what happened?	South Korea’s Yoon Suk Yeol has been arrested on insurrection charges for martial law attempt.	https://www.aljazeera.com/program/newsfeed/2025/1/15/south-koreas-president-arrested-what-happened?traffic_source=rss	2025-01-15T04:16:17-08:00	
South Korea’s President Yoon arrested: What happened and what’s next	Hundreds of officers push past Yoon’s small army of personal security to take the impeached leader into custody.	https://www.aljazeera.com/news/2025/1/15/south-koreas-president-yoon-arrested-all-you-need-to-know?traffic_source=rss	2025-01-15T04:03:56-08:00	
India’s navy expands fleet with eyes on Indian Ocean rivalry	New Delhi launches three domestically built vessels as it seeks to compete with China for influence across Asia Pacific.	https://www.aljazeera.com/news/2025/1/15/indias-navy-expands-fleet-with-eyes-on-indian-ocean-rivalry?traffic_source=rss	2025-01-15T03:47:09-08:00	
What is this pink powder coating Los Angeles?	A bright pink powder has coated homes and hillsides around Los Angeles during the devastating wildfires. What is it?	https://www.aljazeera.com/program/newsfeed/2025/1/15/what-is-this-pink-powder-coating-los-angeles?traffic_source=rss	2025-01-15T03:46:03-08:00	
Rescue operation to free trapped miners in South Africa	Al Jazeera’s Hatu Mutasa reports from Stilfontein, South Africa, as rescue workers bring trapped miners to the surface.	https://www.aljazeera.com/program/newsfeed/2025/1/15/rescue-operation-to-free-trapped-miners-in-south-africa?traffic_source=rss	2025-01-15T03:15:47-08:00	
The genocide has left me feeling like a stranger in my own homeland	The war has destroyed my community, my city, my sense of belonging and has left me in a state of deep alienation.	https://www.aljazeera.com/opinions/2025/1/15/the-genocide-has-left-me-feeling-like-a-stranger-in-my-own-homeland?traffic_source=rss	2025-01-15T03:14:46-08:00	
LA construction crew on self-appointed mission to clean up fire debris	After fighting blazes, local contractor and his team stay behind to clean up Pacific Palisades streets.	https://www.aljazeera.com/gallery/2025/1/15/la-construction-crew-in-self-appointed-mission-to-clean-up-fires-debris?traffic_source=rss	2025-01-15T03:08:05-08:00	
Russian attacks force power cuts in Ukraine	Russia continues to target Ukraine's energy grid.	https://www.aljazeera.com/news/2025/1/15/russian-attacks-force-power-cuts-in-ukraine?traffic_source=rss	2025-01-15T02:29:40-08:00	
US calls for post-conflict vision as Gaza ceasefire nears	Hamas has recruited nearly as many fighters as it has lost amid Israel's war on Gaza, US official says.	https://www.aljazeera.com/news/2025/1/15/us-calls-for-post-conflict-vision-as-gaza-ceasefire-nears?traffic_source=rss	2025-01-15T02:11:44-08:00	
Tunisia’s revolution 14 years on: ‘The emperor has no clothes’	The Arab Spring did not bring democracy to the region, but it remains a beacon of hope for struggling Arabs.	https://www.aljazeera.com/opinions/2025/1/15/tunisias-revolution-14-years-on-the-emperor-has-no?traffic_source=rss	2025-01-15T01:03:52-08:00	
Japan’s tourist arrivals hit all-time high as weak currency draws masses	Asian country welcomed record 36.8 million visitors in 2024, tourism agency says.	https://www.aljazeera.com/economy/2025/1/15/japans-tourist-arrivals-hit-all-time-high-as-weak-currency-draws-masses?traffic_source=rss	2025-01-15T00:40:10-08:00	
Six Palestinians killed by Israeli drone attack on Jenin camp	At least six Palestinians were killed in an Israeli drone attack on the Jenin refugee camp in the occupied West Bank.	https://www.aljazeera.com/program/newsfeed/2025/1/15/six-palestinians-killed-by-israeli-drone-attack-on-jenin-camp?traffic_source=rss	2025-01-15T00:31:13-08:00	
WHO says at least 8 dead in suspected Marburg outbreak in Tanzania	Marburg virus can spread between people through direct contact or via blood and other bodily fluids of infected people.	https://www.aljazeera.com/news/2025/1/15/who-says-at-least-8-dead-in-suspected-marburg-outbreak-in-tanzania?traffic_source=rss	2025-01-15T00:28:17-08:00	
Iran president denies plot to kill Trump, calls for him to pursue peace	Interview comes less than a week before Trump, who has previously followed a tough line with Tehran, returns to power.	https://www.aljazeera.com/news/2025/1/15/iran-president-denies-plot-to-kill-trump-calls-for-him-to-pursue-peace?traffic_source=rss	2025-01-14T23:46:43-08:00	
LA wildfires day 9: What’s the latest, who are victims and what’s next?	Fires continue to blaze across California, prompting authorities to issue a Red Flag Warning for Wednesday.	https://www.aljazeera.com/news/2025/1/15/la-wildfires-day-9-whats-the-latest-who-are-victims-and-whats-next?traffic_source=rss	2025-01-14T23:28:00-08:00	
Olympic champion Zheng ousted as Australian Open 2025 delivers first shock	Zheng exits after second round loss to unseeded Siegemund as former champions Sabalenka and Osaka battle through.	https://www.aljazeera.com/sports/2025/1/15/olympic-champion-zheng-ousted-as-australian-open-2025-delivers-first-shock?traffic_source=rss	2025-01-14T21:49:27-08:00	
TikTok users in US flock to ‘China’s Instagram’ ahead of ban	Chinese users of Xiaohongshu welcome influx of Americans, but caution that sensitive topics are off-limits.	https://www.aljazeera.com/economy/2025/1/15/tiktok-users-in-us-flock-to-chinas-instagram-ahead-of-ban?traffic_source=rss	2025-01-14T21:35:03-08:00	
India’s disappearing camels: How a law to save them is wiping them out	As global camel population rises, it's on drastic decline in India. Experts say law passed in Rajasthan is main reason.	https://www.aljazeera.com/news/2025/1/15/indias-disappearing-camels-how-a-law-to-save-them-is-wiping-them-out?traffic_source=rss	2025-01-14T20:32:47-08:00	
Russia-Ukraine war: List of key events, day 1,056	Here are the key developments on the 1,056th day of Russia’s full-scale invasion of Ukraine.	https://www.aljazeera.com/news/2025/1/15/russia-ukraine-war-list-of-key-events-day-1056?traffic_source=rss	2025-01-14T20:29:06-08:00	
6 killed in Israeli drone strike on occupied West Bank’s Jenin refugee camp	An Israeli military drone reportedly fired three missiles at a group of people in the Jenin refugee camp.	https://www.aljazeera.com/news/2025/1/15/israeli-drone-strike-kills-6-in-occupied-west-banks-jenin-refugee-camp?traffic_source=rss	2025-01-14T19:51:58-08:00	
US watchdog sues Elon Musk over late disclosure of Twitter stake	US Securities and Exchange Commission says Musk's failure to disclose stake allowed him to underpay $150m for shares.	https://www.aljazeera.com/economy/2025/1/15/us-watchdog-sues-elon-musk-over-late-disclosure-of-twitter-stake?traffic_source=rss	2025-01-14T19:01:42-08:00	
Australia warns of ‘strongest possible action’ if citizen killed in Ukraine	Prime Minister Anthony Albanese says gov't working to verify report that volunteer fight was killed by Russian forces.	https://www.aljazeera.com/news/2025/1/15/australia-warns-of-strongest-possible-action-if-citizen-killed-in-ukraine?traffic_source=rss	2025-01-14T17:37:57-08:00	
South Korean investigators enter president’s home in second arrest attempt	Investigators used ladders to climb into President Yoon Suk-yeol's home after he failed to appear at impeachment trial.	https://www.aljazeera.com/news/2025/1/15/south-korean-investigators-enter-presidents-home-in-second-arrest-attempt?traffic_source=rss	2025-01-14T16:35:02-08:00	
Liverpool hold at Forest while Man City stumbles as two-goal lead lets slip	Premier League leaders Liverpool come back to draw at Nottingham Forest but Man City let lead slip at Brentford.	https://www.aljazeera.com/sports/2025/1/14/liverpool-held-at-forest-while-man-city-stumble-as-two-goal-lead-let-slip?traffic_source=rss	2025-01-14T14:41:30-08:00	
Biden administration expected to lift ‘terror’ designation for Cuba: Report	The decision would reverse a move during Donald Trump's first term to re-name Cuba a 'state sponsor of terrorism'.	https://www.aljazeera.com/news/2025/1/14/biden-administration-expected-to-lift-terror-designation-for-cuba-report?traffic_source=rss	2025-01-14T13:21:40-08:00	
Video: Hope in Gaza amid talk of ceasefire	Palestinians in Deir el-Balah share hopes for what is to come after the war on Gaza ends.	https://www.aljazeera.com/program/newsfeed/2025/1/14/video-hope-in-gaza-amid-talk-of-ceasefire?traffic_source=rss	2025-01-14T13:08:24-08:00	
Ukraine launches largest air attacks on Russia since start of war	The Russian military says the attacks will not go unanswered and launches more projectiles towards Ukraine.	https://www.aljazeera.com/news/2025/1/14/ukraine-launches-largest-air-attacks-on-russia-since-start-of-war?traffic_source=rss	2025-01-14T12:22:41-08:00	
UK minister resigns after being named in Bangladesh corruption probe	Anticorruption minister Tulip Siddiq quits amid questions over ties to toppled Bangladeshi leader, Sheikh Hasina.	https://www.aljazeera.com/news/2025/1/14/uk-minister-resigns-after-being-named-in-bangladesh-corruption-probe?traffic_source=rss	2025-01-14T12:22:14-08:00	
Analysis: Sudan faces possible Darfur division as war progresses	A de facto partition of Sudan between army and RSF could lead to total state disintegration, analysts say.	https://www.aljazeera.com/news/2025/1/14/analysis-sudan-faces-possible-darfur-division-as-war-progresses?traffic_source=rss	2025-01-14T12:17:00-08:00	
Trump announces ‘external revenue service’ to collect foreign tariffs	Trump said on social media that the new department would be created on his first day when he takes office on January 20.	https://www.aljazeera.com/news/2025/1/14/trump-announces-external-revenue-service-to-collect-foreign-revenue?traffic_source=rss	2025-01-14T12:09:55-08:00	
How the Trump administration threatens internet freedoms	Trump picks to lead gov't agencies like FCC, FTC may censor speech and make the internet less free.	https://www.aljazeera.com/economy/2025/1/14/how-the-trump-administration-threatens-internet-freedoms?traffic_source=rss	2025-01-14T11:41:07-08:00	
Estimated 20 million gather so far for India’s Maha Kumbh Mela	An estimated 20 million people have so far gathered in northern India for the Maha Kumbh Mela.	https://www.aljazeera.com/program/newsfeed/2025/1/14/estimated-20-million-gather-so-far-for-indias-maha-kumbh-mela?traffic_source=rss	2025-01-14T11:21:56-08:00	
Rescuers recover 36 bodies and 82 survivors from South African gold mine	Hundreds more survivors and dozens more bodies still underground, according to a miners rights group.	https://www.aljazeera.com/news/2025/1/14/rescuers-recover-dozens-more-bodies-and-survivors-from-south-africa-gold-mine?traffic_source=rss	2025-01-14T10:42:15-08:00	
Who is Nawaf Salam, Lebanon’s PM-designate amid political shift?	Pro-reform movement sees new hope with Salam's appointment as prime minister.	https://www.aljazeera.com/news/2025/1/14/who-is-nawaf-salam-lebanons-pm-designate-amid-political-shift?traffic_source=rss	2025-01-14T10:21:36-08:00	
Brazil expresses concern over Meta’s changes to content moderation	Brazilian attorney general says that Meta's move to loosen curbs on hate speech may put it at odds with country's laws.	https://www.aljazeera.com/news/2025/1/14/brazil-expresses-concern-over-metas-changes-to-content-moderation?traffic_source=rss	2025-01-14T10:00:51-08:00	
Is a Gaza ceasefire deal possible this time?	Hopes are running high that a ceasefire deal between Israel and Hamas in Gaza might finally be reached.	https://www.aljazeera.com/program/inside-story/2025/1/14/is-a-gaza-ceasefire-deal-possible-this-time?traffic_source=rss	2025-01-14T09:28:27-08:00	
France’s new PM announces renegotiation of contested pension reforms	Francois Bayrou wants to hold more talks in order to prevent another collapse of government amid budget debates.	https://www.aljazeera.com/news/2025/1/14/france-new-pm-announces-renegotiation-of-contested-pension-reforms?traffic_source=rss	2025-01-14T08:59:18-08:00	
Biden will be remembered for genocide in Gaza | #AJOPINION	Biden will be remembered as the American president who oversaw the genocide of Gaza, says Omar H. Rahman.	https://www.aljazeera.com/program/newsfeed/2025/1/14/biden-will-be-remembered-for-genocide-in-gaza-ajopinion?traffic_source=rss	2025-01-14T07:54:09-08:00	
Israeli historian says Zionism entering its ‘last phase’	Israeli historian Ilan Pappe has told Al Jazeera that he believes Zionism is entering its -last phase-.	https://www.aljazeera.com/program/newsfeed/2025/1/14/israeli-historian-says-zionism-entering-its-last?traffic_source=rss	2025-01-14T07:52:15-08:00	
Ugandan military court rules opposition figure can be tried for treachery	The move escalates the case against Kizza Besigye as a treachery conviction is punishable by the death penalty.	https://www.aljazeera.com/news/2025/1/14/ugandan-military-court-rules-opposition-figure-can-be-tried-for-treachery?traffic_source=rss	2025-01-14T07:38:53-08:00	
Israel maintains furious rate of attacks on Gaza amid hopes for ceasefire	Israeli attacks kill at least 32 Palestinians in Gaza on Tuesday, raising death toll since October 7, 2023 to 46,645.	https://www.aljazeera.com/gallery/2025/1/14/israel-maintains-furious-rate-of-attacks-on-gaza-amid-hopes-for-truce?traffic_source=rss	2025-01-14T06:59:28-08:00	
The whataboutery in African debates on solidarity with Gaza is misplaced	Not standing in solidarity with Gaza because of the need to make African conflicts visible is the wrong approach.	https://www.aljazeera.com/opinions/2025/1/14/the-whataboutery-in-african-debates-on-solidarity-with-gaza-is-misplaced?traffic_source=rss	2025-01-14T06:37:47-08:00	
Why I won’t stop telling Gaza’s stories	I continue to report from Gaza because I want to make a record of our existence - our dignity, resilience and hope.	https://www.aljazeera.com/opinions/2025/1/14/why-i-wont-stop-telling-gazas-stories?traffic_source=rss	2025-01-14T06:15:34-08:00	
Lebanon’s PM-designate Nawaf Salam promises to ‘rescue, reform and rebuild’	Salam says he is reaching out across the political spectrum in nod to Hezbollah, which opposed his nomination.	https://www.aljazeera.com/news/2025/1/14/lebanons-pm-designate-nawaf-salam-promises-to-rescue-reform-and-rebuild?traffic_source=rss	2025-01-14T05:58:24-08:00	
Pete Hegseth, Trump’s Pentagon pick, faces Senate confirmation hearing	US senators set to grill Hegseth, who has Republican backing, over contentious past statements and controversies.	https://www.aljazeera.com/news/2025/1/14/pete-hegseth-trumps-pentagon-pick-faces-senate-confirmation-hearing?traffic_source=rss	2025-01-14T05:44:19-08:00	
Brazilian teen Fonseca lights up Australian Open as Medvedev faces fine	Fonseca beats ninth seed Rublev in men's draw while Paolini, Rybakina and Raducanu advance in women's draw on day three.	https://www.aljazeera.com/sports/2025/1/14/brazilian-teen-fonseca-lights-up-australian-open-as-medvedev-faces-fine?traffic_source=rss	2025-01-14T05:38:01-08:00	
Message from the Amazon	earthrise meets the Ashaninka who are mobilising global action for the planet from their ancestral lands in the Amazon.	https://www.aljazeera.com/program/earthrise/2025/1/14/message-from-the-amazon?traffic_source=rss	2025-01-14T05:30:00-08:00	
NATO launches new Baltic Sea mission to protect undersea cables	NATO chief Mark Rutte says 'Baltic Sentry' mission to protect critical undersea cables following string of incidents.	https://www.aljazeera.com/news/2025/1/14/nato-launches-new-baltic-sea-mission-to-protect-undersea-cables?traffic_source=rss	2025-01-14T05:21:00-08:00	
Lebanon appoints new prime minister after two years of political paralysis	After two years of political turmoil and paralysis, Lebanon has appointed a new prime minister.	https://www.aljazeera.com/program/newsfeed/2025/1/14/lebanon-appoints-new-prime-minister-after-two-years-of-political-paralysis?traffic_source=rss	2025-01-14T05:16:48-08:00	
Gaza ceasefire deal in ‘final stages’: Qatar	Moderators say negotiations are at their 'closest point' yet, with expectations of a imminent deal.	https://www.aljazeera.com/news/2025/1/14/gaza-ceasefire-deal-in-final-stages-qatar?traffic_source=rss	2025-01-14T05:03:06-08:00	
Haiti displacement surpasses one million people: UN	Children account for more than half of Haiti's displaced population, which has tripled amid relentless gang violence.	https://www.aljazeera.com/news/2025/1/14/haiti-displacement-surpasses-one-million-people-un?traffic_source=rss	2025-01-14T04:50:42-08:00	
Irregular migration into EU dropped sharply in 2024: Border agency	Despite falling total, number of people crossing border from Belarus and Russia jumped 192 percent.	https://www.aljazeera.com/news/2025/1/14/irregular-migration-into-eu-dropped-sharply-in-2024-border-agency?traffic_source=rss	2025-01-14T04:34:19-08:00	
Qatar says Gaza ceasefire closer than any time before	Qatar’s foreign ministry spokesman has said major issues that have prevented a Gaza ceasefire deal have been addressed.	https://www.aljazeera.com/program/newsfeed/2025/1/14/qatar-says-gaza-ceasefire-closer-than-any-time-before?traffic_source=rss	2025-01-14T04:16:46-08:00	
Ben Gvir says ceasefire plan is a ‘surrender’ to Hamas	Itamar Ben Gvir, Israel’s far-right national security minister, says the ceasefire talks constitute a ‘surrender' deal.	https://www.aljazeera.com/program/newsfeed/2025/1/14/ben-gvir-says-ceasefire-plan-is-a-surrender-to-hamas?traffic_source=rss	2025-01-14T04:15:05-08:00	
Where are the LA fires still burning, and why are they so destructive?	The wildfires raging through Los Angeles are the most destructive and likely the deadliest in the county's history.	https://www.aljazeera.com/news/2025/1/14/where-are-the-la-fires-still-burning-and-why-are-they-so-destructive?traffic_source=rss	2025-01-14T03:46:48-08:00	
Gaza attacks continue despite advanced ceasefire talks	Israel’s attacks across Gaza have not slowed, despite widespread optimism over a ceasefire deal to end Gaza genocide.	https://www.aljazeera.com/program/newsfeed/2025/1/14/gaza-attacks-continue-despite-advanced-ceasefire-talks?traffic_source=rss	2025-01-14T03:39:36-08:00	
Russia accuses US and Ukraine of targeting TurkStream gas pipeline	Washington encouraging Ukraine to sabotage last remaining pipeline carrying Russian gas into the EU, claims Moscow.	https://www.aljazeera.com/news/2025/1/14/russia-accuses-us-and-ukraine-of-targeting-turkstream-gas-pipeline?traffic_source=rss	2025-01-14T03:31:19-08:00	
