Title	Description	Link	pubDate	Image
Gauff dominates Fernandez at Austalian Open but Osaka retires injured	World number three Coco Gauff beats Leylah Fernandez in straight sets to reach third round at Australia Open.	https://www.aljazeera.com/sports/2025/1/17/imperious-gauff-rolls-past-fernandez-into-australian-open-last-16?traffic_source=rss	2025-01-17T03:05:41-08:00	
More than 100 people killed in Gaza since ceasefire agreed	Israel’s war in Gaza has killed at least 46,788 Palestinians and wounded 110,453 since October 7, 2023.	https://www.aljazeera.com/gallery/2025/1/17/more-than-100-people-killed-in-gaza-since-truce-deal?traffic_source=rss	2025-01-17T02:46:59-08:00	
Searching for hope in Syria	The Assad regime disappeared my brother in 2018. Now that my country is free, I have renewed hope that I may find him.	https://www.aljazeera.com/opinions/2025/1/17/searching-for-hope-in-syria?traffic_source=rss	2025-01-17T02:09:07-08:00	
Haaland and Manchester City agree new 10-year contract	Norway striker Erling Haaland will be aged 34 when his deal with Premier League champions expires.	https://www.aljazeera.com/sports/2025/1/17/haaland-and-manchester-city-agree-new-ten-year-contract?traffic_source=rss	2025-01-17T01:49:24-08:00	
ICC chief prosecutor says Israel made ‘no real effort’ to probe Gaza crimes	Karim Khan's defence of Gaza war crimes allegations against Netanyahu comes amid delays over ceasefire ratification.	https://www.aljazeera.com/news/2025/1/17/israel-made-no-real-effort-to-probe-gaza-crimes-says-icc-prosecutor?traffic_source=rss	2025-01-17T01:47:55-08:00	
‘Make Russia Small Again’: Ukraine on edge as Trump heads to White House	Everyday Ukrainians hope Trump can bring peace while Kyiv's forces are on the back foot on the front lines.	https://www.aljazeera.com/news/2025/1/17/make-russia-small-again-ukraine-on-edge-as-trump-heads-to-white-house?traffic_source=rss	2025-01-17T01:42:21-08:00	
LA wildfires day 11: What is the latest, and what do investigations show?	Firefighters progressed due to a temporary easing of winds, but officials caution that hazardous conditions could return	https://www.aljazeera.com/news/2025/1/17/la-wildfires-day-11-what-is-the-latest-and-what-do-investigations-show?traffic_source=rss	2025-01-17T00:52:23-08:00	
Will Pam Bondi, attorney general pick, retract claims of ‘stolen’ election?	Fact checking what Bondi said about Trump claims, election falsehoods, crime rates at her Senate confirmation hearing.	https://www.aljazeera.com/news/2025/1/17/will-pam-bondi-attorney-general-pick-retract-claims-of-stolen-election?traffic_source=rss	2025-01-17T00:41:43-08:00	
SpaceX Starship explodes, leaving a trail of fiery debris across the sky	SpaceX’s Starship spacecraft has exploded only minutes after taking off on a test flight, leaving trails of debris.	https://www.aljazeera.com/program/newsfeed/2025/1/17/spacex-starship-explodes-leaving-a-trail-of-fiery-debris-across-the-sky?traffic_source=rss	2025-01-16T23:57:23-08:00	
Nintendo shares tumble as Switch 2 reveal disappoints fans	Japanese gaming company’s stock price falls as much as 7.2 percent as teaser for new console fails to impress.	https://www.aljazeera.com/economy/2025/1/17/nintendo-shares-tumble-as-switch-2-reveal-disappoints-fans?traffic_source=rss	2025-01-16T23:16:54-08:00	
Pakistan’s ex-PM Imran Khan, wife sentenced to jail in corruption case	The convictions threaten to derail talks between Khan's PTI and the government aimed at settling a long-running feud.	https://www.aljazeera.com/news/2025/1/17/pakistans-ex-pm-imran-khan-wife-sentenced-to-jail-in-corruption-case?traffic_source=rss	2025-01-16T23:10:09-08:00	
At least 12 Maoist rebels killed by India’s security forces	About 3,000 officers were involved in the operation in Chhattisgarh state, a stronghold of the armed rebellion.	https://www.aljazeera.com/news/2025/1/17/at-least-12-maoist-rebels-killed-by-indias-security-forces?traffic_source=rss	2025-01-16T22:20:54-08:00	
South Korea’s Yoon refuses questioning as authorities seek longer detention	Anticorruption agency says it will ask court to extend impeached president's detention by up to 20 days.	https://www.aljazeera.com/news/2025/1/17/south-koreas-yoon-refuses-questioning-as-authorities-seek-longer-detention?traffic_source=rss	2025-01-16T21:52:39-08:00	
Israel’s national security minister threatens to resign over ceasefire	Itamar Ben-Gvir and his far-right party threaten to leave government over Gaza ceasefire deal.	https://www.aljazeera.com/news/2025/1/17/israels-national-security-minister-threatens-to-resign-over-ceasefire?traffic_source=rss	2025-01-16T21:50:38-08:00	
China’s population falls for third year in a row as birthrate declines	China's population continues to fall for third straight year due to declining birthrate and amid concerns for economy.	https://www.aljazeera.com/news/2025/1/17/chinas-population-falls-for-third-year-in-a-row-as-birthrate-declines?traffic_source=rss	2025-01-16T20:49:42-08:00	
What to know about TikTok’s looming US ban	TikTok is due to shut down in the US on Sunday, but a reprieve from the White House seems likely.	https://www.aljazeera.com/news/2025/1/17/what-to-know-about-tiktoks-looming-us-ban?traffic_source=rss	2025-01-16T20:24:07-08:00	
Russia-Ukraine war: List of key events, day 1,058	Here are the key developments on the 1,058th day of Russia’s full-scale invasion of Ukraine.	https://www.aljazeera.com/news/2025/1/17/russia-ukraine-war-list-of-key-events-day-1058?traffic_source=rss	2025-01-16T19:47:53-08:00	
Pakistan pulls closer to post-Hasina Bangladesh amid shared India concerns	Pakistan and Bangladesh have edged closer as politics in both countries ride on a general anti-India sentiment.	https://www.aljazeera.com/news/2025/1/17/pakistan-pulls-closer-to-post-hasina-bangladesh-amid-shared-india-concerns?traffic_source=rss	2025-01-16T19:40:19-08:00	
SpaceX’s Starship breaks up mid-flight, forcing airlines to avoid debris	Elon Musk acknowledges mission failure, posting on X that 'success is uncertain, but entertainment is guaranteed'.	https://www.aljazeera.com/economy/2025/1/17/spacexs-starship-breaks-up-mid-flight-forcing-airlines-to-avoid-debris?traffic_source=rss	2025-01-16T18:01:23-08:00	
Trump’s role in Gaza ceasefire fuels Arab American anger with Biden	Incoming US president suggests that he pressured Israel to take the deal, which is supposed to go into effect on Sunday.	https://www.aljazeera.com/news/2025/1/17/trumps-role-in-gaza-ceasefire-fuels-arab-american-anger-with-biden?traffic_source=rss	2025-01-16T16:18:07-08:00	
Brazil Supreme Court nixes Bolsonaro’s effort to attend Trump inauguration	The passport of Jair Bolsonaro, a former far-right president, had been confiscated as part of ongoing investigations.	https://www.aljazeera.com/news/2025/1/16/brazil-supreme-court-nixes-bolsonaros-effort-to-attend-trump-inauguration?traffic_source=rss	2025-01-16T14:35:30-08:00	
Mark Carney, ex-Bank of Canada governor, launches bid to replace Trudeau	Carney slams Conservative leader Pierre Poilievre at his leadership campaign launch and vows to build Canada's economy.	https://www.aljazeera.com/news/2025/1/16/mark-carney-ex-bank-of-canada-governor-launches-bid-to-replace-trudeau?traffic_source=rss	2025-01-16T14:26:29-08:00	
‘We lost so many’: Gaza cautiously waits for ceasefire as bombing continues	Palestinians express hope that the worst is now over, but Israel keeps up heavy bombardments.	https://www.aljazeera.com/news/2025/1/16/we-lost-so-many-gaza-cautiously-waits-for-ceasefire-as-bombing-continues?traffic_source=rss	2025-01-16T13:01:16-08:00	
Can the ceasefire agreement lead to lasting peace in Gaza?	Deal between Israel and Hamas seeks to end 15 months of war.	https://www.aljazeera.com/program/inside-story/2025/1/16/can-the-ceasefire-agreement-lead-to-lasting-peace-in-gaza?traffic_source=rss	2025-01-16T12:48:52-08:00	
‘Devastating’: Wildfire ravages historic Black community in Los Angeles	In Altadena, California, a community rallies together to respond to deadly wildfires, despite widespread property loss.	https://www.aljazeera.com/news/2025/1/16/devastating-wildfire-ravages-historic-black-community-in-los-angeles?traffic_source=rss	2025-01-16T12:34:01-08:00	
Journalists interrupt Blinken with questions about US support for Israel	Two Journalists interrupted Secretary Antony Blinken’s remarks at the State Department about Us support for Israel.	https://www.aljazeera.com/program/newsfeed/2025/1/16/journalists-interrupt-blinken-with-questions-about-us-support-for-israel?traffic_source=rss	2025-01-16T12:24:34-08:00	
US imposes sanctions on Sudan’s army chief Abdel Fattah al-Burhan	The Sudanese general has been accused of 'lethal attacks' on civilians during an ongoing war with the RSF paramilitary.	https://www.aljazeera.com/news/2025/1/16/us-imposes-sanctions-on-sudans-army-chief-abdel-fattah-al-burhan?traffic_source=rss	2025-01-16T12:21:30-08:00	
US filmmaker David Lynch, famous for Twin Peaks, dead at 78	Lynch won acclaim for his strange and dreamlike sequences and was honoured with a lifetime achievement Oscar in 2019.	https://www.aljazeera.com/news/2025/1/16/iconic-us-filmmaker-david-lynch-famous-for-twin-peaks-dead-at-78?traffic_source=rss	2025-01-16T12:14:21-08:00	
Trump will keep TikTok from ‘going dark’, adviser says	TikTok is planning to shut its app in the US on Sunday when a ban kicks in.	https://www.aljazeera.com/economy/2025/1/16/trump-will-keep-tiktok-from-going-dark-adviser-says?traffic_source=rss	2025-01-16T12:08:37-08:00	
Romania sets May date for new presidential election	The first round will take place on May 4, with a second on May 18 if no candidate wins more than 50 percent.	https://www.aljazeera.com/news/2025/1/16/romania-sets-may-date-for-new-presidential-election?traffic_source=rss	2025-01-16T11:30:59-08:00	
Who is Steve Witkoff, Trump’s envoy in the Gaza ceasefire talks?	Steve Witkoff was little known to the public before he turned out to be a key player in Israel-Hamas ceasefire talks.	https://www.aljazeera.com/program/newsfeed/2025/1/16/who-is-steve-witkoff-trumps-envoy-in-the-gaza-ceasefire-talks?traffic_source=rss	2025-01-16T11:26:20-08:00	
Palestinian doctors hope ceasefire will revive Gaza’s healthcare sector	Hospital staff in Gaza say truce will go a long way in restoring medical services and vital supplies.	https://www.aljazeera.com/news/2025/1/16/palestinian-doctors-hope-ceasefire-will-revive-gazas-healthcare-sector?traffic_source=rss	2025-01-16T10:56:44-08:00	
UK government announces new local inquiries into child sex abuse	Home Secretary Yvette Cooper says government will also undertake a 'rapid' review of child sexual abuse in the UK.	https://www.aljazeera.com/news/2025/1/16/uk-government-announces-new-local-inquiries-into-child-sex-abuse?traffic_source=rss	2025-01-16T10:44:17-08:00	
Venezuela releases prominent rights advocate Carlos Correa from detention	The free-speech advocate was among several activists detained ahead of President Nicolas Maduro's swearing-in last week.	https://www.aljazeera.com/news/2025/1/16/venezuela-releases-prominent-rights-advocate-carlos-correa-from-detention?traffic_source=rss	2025-01-16T09:47:02-08:00	
How will Trump handle protesters? Critics point to his 2017 inauguration	The 'J20' prosecutions set a dangerous precedent for future crackdowns on dissent, advocates warn.	https://www.aljazeera.com/news/longform/2025/1/16/how-will-trump-handle-protesters-critics-point-to-his-2017-inauguration?traffic_source=rss	2025-01-16T09:43:03-08:00	
Israel-Hamas ceasefire: What’s left of Gaza and its people?	A ceasefire agreement has been announced between Israel and Hamas, but what will displaced Palestinians come back to?	https://www.aljazeera.com/news/2025/1/16/israel-hamas-ceasefire-whats-left-of-gaza-and-its-people?traffic_source=rss	2025-01-16T09:07:02-08:00	
Video: Gaza activist pre-records will days before his killing	Video shows the will of Palestinian activist and journalist Ahmed Abu al-Roos who was killed in Gaza.	https://www.aljazeera.com/program/newsfeed/2025/1/16/video-gaza-activist-pre-records-will-days-before-his-killing?traffic_source=rss	2025-01-16T09:04:04-08:00	
UK, Ukraine leaders sign ‘landmark’ 100-year agreement	PM Keir Starmer says UK will deliver a 'mobile air defence system' and bolster maritime cooperation with Ukraine.	https://www.aljazeera.com/news/2025/1/16/uk-ukraine-leaders-sign-landmark-100-year-agreement?traffic_source=rss	2025-01-16T08:54:20-08:00	
Medvedev makes shock exit at Australian Open; Sinner, Swiatek progress	Defending champ Jannik Sinner moved through to the third round while last year's runner-up, Daniil Medvedev, is out.	https://www.aljazeera.com/sports/2025/1/16/medvedev-makes-shock-exit-at-australian-open-sinner-swiatek-progress?traffic_source=rss	2025-01-16T08:45:49-08:00	
Deciphering Trump: How much is talk, how much is real?	US President-elect Donald Trump assumes office with a wide-ranging 'Day One' list of executive orders.	https://www.aljazeera.com/program/the-bottom-line/2025/1/16/deciphering-trump-how-much-is-talk-how-much-is-real?traffic_source=rss	2025-01-16T08:30:00-08:00	
Qatar’s PM calls on Israeli forces to withdraw from Syria buffer zone	Sheikh Mohammed also promises to support the new administration and the rehabilitation of Syria's infrastructure.	https://www.aljazeera.com/news/2025/1/16/qatars-pm-calls-on-israeli-forces-to-withdraw-from-syria-buffer-zone?traffic_source=rss	2025-01-16T07:57:11-08:00	
Celebrations across the world after Gaza ceasefire deal is announced	There were scenes of celebration on the streets across the Middle East and beyond after the Gaza ceasefire deal.	https://www.aljazeera.com/program/newsfeed/2025/1/16/celebrations-across-the-world-after-gaza-ceasefire-deal-is-announced?traffic_source=rss	2025-01-16T07:25:19-08:00	
‘Massacre’: Did South Africa starve dozens of trapped miners to death?	Rights groups say police used starvation as a weapon to force out illegal miners, resulting in close to 80 deaths.	https://www.aljazeera.com/news/2025/1/16/did-south-africa-starve-dozens-of-trapped-miners-to-death?traffic_source=rss	2025-01-16T07:24:53-08:00	
What would be the global impact of Trump’s economic policies?	Tariffs and tax cuts are at the core of Donald Trump's economic policies.	https://www.aljazeera.com/program/counting-the-cost/2025/1/16/what-would-be-the-global-impact-of-trumps-economic-policies?traffic_source=rss	2025-01-16T07:00:00-08:00	
Frankfurt’s Omar Marmoush a Manchester City transfer target: All to know	The Eintracht Frankfurt star is having a breakout Bundesliga season, and his profile is growing rapidly outside Germany.	https://www.aljazeera.com/sports/2025/1/16/frankfurts-omar-marmoush-a-manchester-city-transfer-target-all-to-know?traffic_source=rss	2025-01-16T06:58:15-08:00	
Israeli attacks kill dozens in Gaza after ceasefire announcement	The Israeli military has launched attacks across Gaza hours after the ceasefire announcement between Israel and Hamas.	https://www.aljazeera.com/program/newsfeed/2025/1/16/israeli-attacks-kill-dozens-in-gaza-after-ceasefire-announcement?traffic_source=rss	2025-01-16T06:08:22-08:00	
Biden showed ‘double standard’ on human rights amid Israel’s Gaza war: HRW	Human Rights Watch’s annual report says liberal democracies were generally ‘not reliable’ on human rights.	https://www.aljazeera.com/news/2025/1/16/biden-showed-double-standard-on-human-rights-amid-israels-gaza-war-hrw?traffic_source=rss	2025-01-16T06:03:20-08:00	
This how the Gaza ceasefire announcement unfolded in Gaza and Israel	The announcement of a Gaza ceasefire agreement has left many Palestinians and Israelis with ‘mixed feelings.'	https://www.aljazeera.com/program/newsfeed/2025/1/16/this-how-the-gaza-ceasefire-announcement-unfolded-in-gaza-and-israel?traffic_source=rss	2025-01-16T05:36:13-08:00	
Trump versus the Gulf of Mexico	At the end of the day, there is nothing ‘beautiful’ about imperialism.	https://www.aljazeera.com/opinions/2025/1/16/trump-versus-the-gulf-of-mexico?traffic_source=rss	2025-01-16T04:34:09-08:00	
Donald Trump plans to ‘save’ TikTok from looming US ban	His camp says he is exploring options to 'create space to put deal in place' after media report on executive order plan.	https://www.aljazeera.com/news/2025/1/16/trump-plans-to-save-tiktok-from-looming-us-ban?traffic_source=rss	2025-01-16T04:09:26-08:00	
What is Red Dye 3 and why has the US FDA banned it in food and drinks?	The Food and Drug Administration (FDA) granted a 2022 petition by consumer advocacy groups to ban the use of the dye.	https://www.aljazeera.com/news/2025/1/16/what-is-red-dye-3-and-why-has-the-us-fda-banned-it-in-food-and-drinks?traffic_source=rss	2025-01-16T03:49:54-08:00	
Fact-check: Did Gavin Newsom cut $100m in fire prevention funding?	Online posts, citing a January 10 Newsweek article, claim Newsom cut $101m in fire prevention funding. Is this true?	https://www.aljazeera.com/news/2025/1/16/fact-check-did-gavin-newsom-cut-100m-in-fire-prevention-funding?traffic_source=rss	2025-01-16T03:28:24-08:00	
Israel and Hamas reach Gaza ceasefire deal, what are the next steps?	The deal spread over 84 days will see a surge in humanitarian aid, withdrawal of Israeli forces and captive exchange.	https://www.aljazeera.com/news/2025/1/16/israel-and-hamas-reach-gaza-ceasefire-deal-what-are-the-next-steps?traffic_source=rss	2025-01-16T02:51:05-08:00	
What’s in the Hamas-Israel Gaza ceasefire deal?	The deal to end 15-months of war in Gaza comes in 3 main stages. Soraya Lennie breaks down the details.	https://www.aljazeera.com/program/newsfeed/2025/1/16/whats-in-the-hamas-israel-gaza-ceasefire-deal?traffic_source=rss	2025-01-16T02:00:24-08:00	
Teary Ons Jabeur struggles with asthma flare-up at Australian Open	Asthma attack leaves the Tunisian tennis player in tears as she battles her way through her second-round match.	https://www.aljazeera.com/sports/2025/1/16/teary-ons-jabeur-struggles-with-asthma-flare-up-at-australian-open?traffic_source=rss	2025-01-16T01:28:43-08:00	
Israel’s Netanyahu says cabinet will not meet to approve ceasefire deal	Netanyahu's office blames Hamas for causing 'last-minute crisis'; Palestinian group says it is committed to agreement.	https://www.aljazeera.com/news/2025/1/16/israels-netanyahu-says-cabinet-will-not-meet-to-approve-ceasefire-deal?traffic_source=rss	2025-01-16T01:20:51-08:00	
Los Angeles wildfires day 10: What’s the latest, and how can you help?	Wind conditions will ease but authorities warn another round of Santa Ana winds could develop early next week.	https://www.aljazeera.com/news/2025/1/16/los-angeles-wildfires-day-10-whats-the-latest-and-how-can-you-help?traffic_source=rss	2025-01-16T00:54:25-08:00	
Blinken’s statements on Israel’s objective and failure to destroy Hamas	According to the Biden administration, has Israel destroyed Hamas?	https://www.aljazeera.com/program/compare-contrast/2025/1/16/blinkens-statements-on-israels-objective-and-failure-to-destroy-hamas?traffic_source=rss	2025-01-16T00:40:17-08:00	
‘Russians in Kherson train on civilians’: Deadly drones stalk south Ukraine	Residents and officials accuse Russians of 'human safaris' with fatal effects in a city they once occupied.	https://www.aljazeera.com/news/2025/1/16/russians-in-kherson-train-on-civilians-deadly-drones-stalk-south-ukraine?traffic_source=rss	2025-01-16T00:29:57-08:00	
Jeff Bezos’s Blue Origin launches New Glenn rocket on test flight	The rocket's first attempt to launch on Monday was scrubbed around because ice had accumulated on a propellant line.	https://www.aljazeera.com/news/2025/1/16/jeff-bezoss-blue-origin-launches-new-glenn-rocket-on-test-flight?traffic_source=rss	2025-01-16T00:24:00-08:00	
Muckraking financial firm Hindenburg Research to disband, founder says	Renowned short-seller Nate Anderson says his work has been 'intense, and at times, all-encompassing'.	https://www.aljazeera.com/economy/2025/1/16/muckraking-financial-firm-hindenburg-research-to-disband-founder-says?traffic_source=rss	2025-01-16T00:21:57-08:00	
What Palestinians are hoping for after Gaza ceasefire	We spoke to Palestinians in Gaza about their hopes for after the ceasefire agreement takes effect.	https://www.aljazeera.com/program/newsfeed/2025/1/16/what-palestinians-are-hoping-for-after-gaza-ceasefire?traffic_source=rss	2025-01-16T00:04:33-08:00	
Bollywood star Saif Ali Khan stabbed in ‘attempted burglary’ at Mumbai home	Khan is currently in surgery after receiving six stab wounds as police search for suspect.	https://www.aljazeera.com/news/2025/1/16/bollywood-star-saif-ali-khan-stabbed-in-attempted-burglary-at-mumbai-home?traffic_source=rss	2025-01-15T23:04:41-08:00	
Al Jazeera reporter in Gaza removes protective gear	Al Jazeera journalist Anas al-Sharif greeted the announcement of a Gaza ceasefire deal by taking off his press gear.	https://www.aljazeera.com/program/newsfeed/2025/1/16/al-jazeera-reporter-in-gaza-removes-protective-gear?traffic_source=rss	2025-01-15T23:03:22-08:00	
‘Key to space ambitions’: India succeeds in historic space docking mission	Only the US, Russia and China have previously docked in space. The expertise is critical for advanced missions.	https://www.aljazeera.com/news/2025/1/16/key-to-space-ambitions-india-succeeds-in-historic-space-docking-mission?traffic_source=rss	2025-01-15T22:02:15-08:00	
Israeli attacks kill 30 Palestinians in Gaza after ceasefire deal announced	One Israeli strike on a house in Gaza City killed 18 people as Palestinians await the start of the ceasefire on Sunday.	https://www.aljazeera.com/news/2025/1/16/israeli-attacks-kill-30-palestinians-in-gaza-after-ceasefire-deal-announced?traffic_source=rss	2025-01-15T21:48:42-08:00	
TikTok planning complete US shutdown as ban deadline looms, reports say	Popular video-sharing platform preparing to go fully dark in the US from Sunday, reports say.	https://www.aljazeera.com/economy/2025/1/16/tiktok-planning-complete-us-shutdown-as-ban-deadline-looms-reports-say?traffic_source=rss	2025-01-15T21:26:57-08:00	
Bannon vs Musk: How Trump’s U-turn on H-1B visas has split MAGA	Trump's tech allies are at loggerheads with the MAGA camp over a visa programme that brings in foreign workers.	https://www.aljazeera.com/economy/2025/1/16/bannon-vs-musk-how-trumps-u-turn-on-h-1b-visas-has-split-maga?traffic_source=rss	2025-01-15T21:18:29-08:00	
Russia-Ukraine war: List of key events, day 1,057	Here are the key developments on the 1,057th day of Russia’s full-scale invasion of Ukraine.	https://www.aljazeera.com/news/2025/1/16/russia-ukraine-war-list-of-key-events-day-1057?traffic_source=rss	2025-01-15T21:12:57-08:00	
Biden’s role in Israel-Hamas ceasefire deal overshadowed by nemesis Trump	As Biden seeks foreign policy win in his final days, his biggest political rival is seeking to steal the limelight.	https://www.aljazeera.com/news/2025/1/16/bidens-role-in-israel-hamas-ceasefire-deal-overshadowed-by-nemesis-trump?traffic_source=rss	2025-01-15T20:59:45-08:00	
Biden takes aim at oligarchs and extreme wealth in farewell address	US President Joe Biden said 'powerful forces' threatened to undo his climate policies as Trump prepares to take office.	https://www.aljazeera.com/news/2025/1/16/biden-takes-aim-at-oligarchs-and-extreme-wealth-in-farewell-address?traffic_source=rss	2025-01-15T20:36:07-08:00	
Key takeaways as Trump nominees face US Senate confirmation hearings	Figures like Pam Bondi and John Ratcliffe faced questions over concerns about Trump prosecuting political rivals.	https://www.aljazeera.com/news/2025/1/16/key-takeaways-as-trump-nominees-face-us-senate-confirmation-hearings?traffic_source=rss	2025-01-15T16:38:25-08:00	
How will Trump approach — and possibly transform — presidential power?	The power of the presidency has grown for decades, but experts say Trump could go further in his second term.	https://www.aljazeera.com/news/2025/1/16/how-will-trump-approach-and-possibly-transform-presidential?traffic_source=rss	2025-01-15T16:16:06-08:00	
Four words that bear significance to the happy news of a Gaza ceasefire	Relief. Gratitude. Acknowledge. Shame.	https://www.aljazeera.com/opinions/2025/1/15/four-words-that-bear-significance-to-the-happy-news-of-a-gaza-ceasefire?traffic_source=rss	2025-01-15T15:32:21-08:00	
Arsenal 2-1 Tottenham Hotspur – Premier League match report	Arsenal close to within four points of Premier League leaders Liverpool after North London turnaround against Spurs.	https://www.aljazeera.com/sports/2025/1/15/arsenal-2-1-tottenham-hotspur-premier-league-match-report?traffic_source=rss	2025-01-15T15:05:30-08:00	
What’s in the first stage of the Israel-Hamas ceasefire deal?	The first stage of the Israel-Hamas ceasefire agreement is the same as what was presented in spring 2024.	https://www.aljazeera.com/program/newsfeed/2025/1/15/whats-in-the-first-stage-of-the-israel-hamas-ceasefire-deal?traffic_source=rss	2025-01-15T14:22:39-08:00	
US firms boost imports ahead of Trump tariffs	Companies built strategic inventories as Trump has threatened to slap tariffs of 10 to 60 percent on Chinese imports.	https://www.aljazeera.com/economy/2025/1/15/us-firms-boost-imports-ahead-of-trump-tariffs?traffic_source=rss	2025-01-15T14:03:35-08:00	
World reacts to Israel-Hamas Gaza ceasefire announcement	Officials welcome announcement of truce agreement, call for surge in humanitarian aid to Gaza.	https://www.aljazeera.com/news/2025/1/15/world-reacts-to-israel-hamas-ceasefire-announcement?traffic_source=rss	2025-01-15T13:09:26-08:00	
