Title	Description	Link	pubDate	Image
Amid genocide, the tide is turning on Palestine	Pro-Palestine activists could not end Israel's genocide, but managed to shift the public opinion on the conflict.	https://www.aljazeera.com/opinions/2025/1/10/amid-genocide-the-tide-is-turning-on-palestine?traffic_source=rss	2025-01-10T09:35:47-08:00	
Amorim says Man Utd keen to keep Mainoo and Garnacho	Manchester United coach Ruben Amorim says the club are keen to extend Kobbie Mainoo and Alejandro Garnacho's contracts.	https://www.aljazeera.com/sports/2025/1/10/amorim-says-man-utd-keen-to-keep-hold-of-mainoo-garnacho-football?traffic_source=rss	2025-01-10T09:23:56-08:00	
Venezuela’s Nicolas Maduro sworn in for third term after disputed election	The Venezuelan president promises period of peace and prosperity as the opposition and US continue to reject his rule.	https://www.aljazeera.com/news/2025/1/10/venezuelas-nicolas-maduro-sworn-in-for-third-term-after-disputed-election?traffic_source=rss	2025-01-10T08:29:39-08:00	
Israeli settlers set fires, vandalise buildings in occupied West Bank	Israeli settlers have set fire to farmland and wrote racist slogans in Abu Falah village in the occupied West Bank.	https://www.aljazeera.com/program/newsfeed/2025/1/10/israeli-settlers-set-fires-vandalise-buildings-in-occupied-west-bank?traffic_source=rss	2025-01-10T07:19:19-08:00	
Italian FM meets Syria’s new rulers, discusses easing of EU sanctions	Antonio Tajani says Italy wants to serve as a bridge between Damascus and the European Union.	https://www.aljazeera.com/news/2025/1/10/italian-fm-meets-syrias-new-rulers-pointing-to-easing-of-sanctions?traffic_source=rss	2025-01-10T07:17:53-08:00	
Trump sentenced in New York hush-money case days before taking office	Donald Trump avoids jail time or a fine but the US president-elect's criminal conviction will be on his record.	https://www.aljazeera.com/news/2025/1/10/trump-sentenced-in-new-york-hush-money-case-days-before-taking-office?traffic_source=rss	2025-01-10T07:09:29-08:00	
Why does Trump want Greenland?	Incoming President Donald Trump has repeated his desire to take control of Greenland, despite being condemned.	https://www.aljazeera.com/program/newsfeed/2025/1/10/why-does-trump-want-greenland?traffic_source=rss	2025-01-10T06:48:36-08:00	
Lakurawa, the new armed group wreaking havoc on the Nigeria-Niger border	Strained relations between Abuja and Niamey have disrupted joint military patrols and allowed the armed group to expand.	https://www.aljazeera.com/news/2025/1/10/lakurawa-the-new-armed-group-wreaking-havoc-on-the-nigeria-niger-border?traffic_source=rss	2025-01-10T06:11:35-08:00	
Union Berlin appeals court ruling over Bochum goalkeeper hit by lighter	Union Berlin appeal decision to award match to Bochum after their keeper was struck by a lighter in December.	https://www.aljazeera.com/sports/2025/1/10/union-berlin-appeal-decision-to-award-match-to-bochum-after-their-keeper-was-struck-by-a-firelighter-in-december-football-germany?traffic_source=rss	2025-01-10T05:13:02-08:00	
Liverpool wary of Accrington’s ‘Champions League final’ in FA Cup	Double-chasing Liverpool will not underestimate Accrington Stanley in the FA Cup on Saturday, according to Arne Slot.	https://www.aljazeera.com/sports/2025/1/10/premier-and-champions-league-chasing-liverpool-wont-underestimate-fa-cup-football?traffic_source=rss	2025-01-10T05:00:08-08:00	
Sense of impunity ‘absolute’: The NGO holding Israeli soldiers to account	The Hind Rajab Foundation is using Israeli soldiers' own social media footage as proof of war crimes.	https://www.aljazeera.com/news/2025/1/10/impunity-and-accountability-the-ngo-holding-israeli-troops-to-account?traffic_source=rss	2025-01-10T04:55:15-08:00	
Israeli soldiers hide in white van to arrest Palestinian man	Security camera video captured the moment Israeli forces hiding in a commercial vehicle arrested a Palestinian man.	https://www.aljazeera.com/program/newsfeed/2025/1/10/israeli-soldiers-hide-in-white-van-to-arrest-palestinian-man?traffic_source=rss	2025-01-10T04:17:35-08:00	
England captain Buttler should be spared Afghanistan boycott decision	Former England bowler Steve Harmison says any decision to boycott playing Afghanistan must not land with the captain.	https://www.aljazeera.com/sports/2025/1/10/england-captain-buttler-should-be-spared-afghanistan-boycott-decision?traffic_source=rss	2025-01-10T04:15:38-08:00	
Trump sentencing to proceed in New York after Supreme Court rejects appeal	Two conservative justices join three liberal members in a 5-4 decision to clear the way for the sentencing.	https://www.aljazeera.com/news/2025/1/10/trump-sentencing-to-proceed-in-new-york-after-supreme-court-rejects-appeal?traffic_source=rss	2025-01-10T04:10:39-08:00	
Israeli settlers commit arson and vandalism in spate of West Bank attacks	Settlers burn Palestinian farm shed and spray racist slogans in Hebrew on the outskirts of Khirbet Abu Falah.	https://www.aljazeera.com/news/2025/1/10/israeli-settlers-commit-arson-and-vandalism-in-spate-of-west-bank-attacks?traffic_source=rss	2025-01-10T02:21:25-08:00	
Venezuelan opposition leader arrested on eve of Maduro swearing-in	Venezuela opposition leader Maria Corina Machado was arrested after appearing in public for the first time in months.	https://www.aljazeera.com/program/newsfeed/2025/1/10/venezuelan-opposition-leader-arrested-on-eve-of-maduro-swearing-in?traffic_source=rss	2025-01-10T01:58:09-08:00	
Which Hollywood stars have lost their homes in the California wildfires?	Celebrities have lost homes but a social media post showing the Hollywood sign burning proved to be false.	https://www.aljazeera.com/news/2025/1/10/which-hollywood-stars-have-lost-their-homes-in-the-california-wildfires?traffic_source=rss	2025-01-10T01:50:24-08:00	
Aerial views show widespread destruction from LA fire	Aerial views over Los Angeles’ Pacific Palisades area show entire neighbourhoods destroyed.	https://www.aljazeera.com/program/newsfeed/2025/1/10/aerial-views-show-widespread-destruction-from-la-fire?traffic_source=rss	2025-01-10T01:12:40-08:00	
Deaths from Israeli attacks in Gaza undercounted by 41 percent, study finds	The Lancet medical journal estimates actual number of deaths in first nine months of war much higher than official toll.	https://www.aljazeera.com/news/2025/1/10/deaths-from-israeli-attacks-in-gaza-undercounted-by-41-percent-study-finds?traffic_source=rss	2025-01-10T01:08:35-08:00	
Sudan’s RSF tried to polish its image but its crimes are being recognised	Paramilitary force's image tarnished by US genocide designation, say experts, as survivors hope for justice.	https://www.aljazeera.com/news/2025/1/10/sudan-rsf-tried-to-polish-its-image-but-its-crimes-are-being-recognised?traffic_source=rss	2025-01-10T01:07:19-08:00	
South Korea’s presidential security chief resigns after ‘bloodshed’ warning	Park Jong-joon says citizens concerned about violence if authorities push ahead with bid to arrest suspended president.	https://www.aljazeera.com/news/2025/1/10/south-koreas-presidential-security-chief-resigns-after-bloodshed-warning?traffic_source=rss	2025-01-10T00:46:14-08:00	
Canada PM Justin Trudeau’s Liberal Party to elect new leader on March 9	Former Finance Minister Chrystia Freeland and former central banker Mark Carney poised to seek party leadership.	https://www.aljazeera.com/news/2025/1/10/canada-pm-justin-trudeaus-liberal-party-to-elect-new-leader-on-march-9?traffic_source=rss	2025-01-10T00:13:57-08:00	
Australia violated rights of asylum seekers held in Nauru, UN watchdog says	UN Human Rights Committee ruling covers cases involving 25 refugees who endured years of arbitrary detention.	https://www.aljazeera.com/news/2025/1/10/australia-violated-rights-of-asylum-seekers-held-in-nauru-un-watchdog-says?traffic_source=rss	2025-01-10T00:05:18-08:00	
Donald Trump says a meeting with Russia’s Vladimir Putin is being set up	Trump calls the Russia-Ukraine war 'a bloody mess' and signals his intention to discuss the conflict with Putin.	https://www.aljazeera.com/news/2025/1/10/donald-trump-says-meeting-with-russias-vladimir-putin-being-set-up?traffic_source=rss	2025-01-10T00:00:16-08:00	
Meta, Facebook to drop fact-checkers: What does this mean for social media?	Meta owned social media platforms ends third-party fact-checking, adopting community notes as its replacement.	https://www.aljazeera.com/news/2025/1/10/meta-facebook-to-drop-fact-checkers-what-does-this-mean-for-social-media?traffic_source=rss	2025-01-09T23:26:31-08:00	
Russia-Ukraine war: List of key events, day 1,051	Here are the key developments on the 1,051st day of Russia’s full-scale invasion of Ukraine.	https://www.aljazeera.com/news/2025/1/10/russia-ukraine-war-list-of-key-events-day-1051?traffic_source=rss	2025-01-09T22:42:26-08:00	
Earth records hottest ever year in 2024 and crosses key 1.5C threshold	EU's climate monitor says climate crisis is pushing temperatures to levels never experienced by modern humans.	https://www.aljazeera.com/news/2025/1/10/earth-records-hottest-ever-year-in-2024-and-crosses-key-1-5c-threshold?traffic_source=rss	2025-01-09T22:31:48-08:00	
Los Angeles fires burn 10,000 structures as new blaze spreads	Third blaze breaks out in West Hills as authorities battle to bring existing fires under control.	https://www.aljazeera.com/news/2025/1/10/los-angeles-fires-burn-10000-structures-as-new-blaze-spreads?traffic_source=rss	2025-01-09T21:18:24-08:00	
Meta’s move to end fact-checking reflects turn toward freewheeling internet	Mark Zuckerberg's invocation of 'cultural tipping point' comes as number of fact-checking initiatives has plateaued.	https://www.aljazeera.com/economy/2025/1/10/metas-decision-to-end-fact-checking-captures-freewheeling-zeitgeist?traffic_source=rss	2025-01-09T20:29:45-08:00	
‘Much more persecution’: Venezuela braces for Nicolas Maduro’s inauguration	On Friday, Maduro is set to start a third term. Will his inauguration continue his post-election crackdown on dissent?	https://www.aljazeera.com/news/2025/1/10/much-more-persecution-venezuela-braces-for-nicolas-maduros-inauguration?traffic_source=rss	2025-01-09T18:01:13-08:00	
Vanishing Voices: The Fight for Cultural Preservation	On The Stream: How conflict and neglect threaten humanity’s cultural heritage?	https://www.aljazeera.com/program/the-stream/2025/1/10/vanishing-voices-the-fight-for-cultural-preservation?traffic_source=rss	2025-01-09T18:00:00-08:00	
Historians say Jimmy Carter’s human rights legacy includes grim failures	While experts say the late US president set a high bar for human rights, he also had notable failings while in office.	https://www.aljazeera.com/news/longform/2025/1/10/historians-say-jimmy-carters-human-rights-legacy-includes-grim-failures?traffic_source=rss	2025-01-09T17:33:41-08:00	
US House votes to advance bill to sanction ICC over Israel arrest warrants	The legislation is in retaliation for the International Criminal Court seeking arrest warrants for Netanyahu over Gaza.	https://www.aljazeera.com/news/2025/1/9/us-house-votes-to-advance-bill-to-sanction-icc-over-israel-arrest-warrants?traffic_source=rss	2025-01-09T14:17:43-08:00	
Real Madrid meet Barcelona in Supercopa final after defeating Mallorca	European and Spanish champions Real Madrid beat Mallorca 3-0 to set up a Spanish Supercopa final with Barcelona.	https://www.aljazeera.com/sports/2025/1/9/real-madrid-meet-barcelona-in-supercopa-final-after-defeating-mallorca?traffic_source=rss	2025-01-09T14:06:47-08:00	
Elon Musk hosts leader of Germany’s far-right AfD on X ahead of election	Billionaire’s interest in Europe divides opinion - while some leaders raise alarm, Italy’s Meloni insists ‘no danger'.	https://www.aljazeera.com/news/2025/1/9/elon-musk-urges-germans-to-back-far-right-afd-in-february-election?traffic_source=rss	2025-01-09T12:59:51-08:00	
Venezuela opposition leader arrested a day before Maduro’s inauguration	Machado was arrested after re-appearing in public for the first time in months to join an antigovernment protest.	https://www.aljazeera.com/news/2025/1/9/venezuela-opposition-leader-arrested-a-day-before-maduros-inauguration?traffic_source=rss	2025-01-09T12:59:21-08:00	
Is the world at greater risk of more wars?	Conflicts rage globally as arms spending hits record levels.	https://www.aljazeera.com/program/inside-story/2025/1/9/is-the-world-at-greater-risk-of-more-wars?traffic_source=rss	2025-01-09T12:46:36-08:00	
Poland says it will protect Benjamin Netanyahu from potential arrest	PM Donald Tusk says Israeli prime minister will not be detained despite ICC arrest warrant for Benjamin Netanyahu.	https://www.aljazeera.com/news/2025/1/9/poland-says-it-will-protect-benjamin-netanyahu-from-potential-arrest?traffic_source=rss	2025-01-09T12:44:03-08:00	
Swiss national held by Iran on spying charges dies in prison	Swiss embassy in Tehran confirms death, seeks clarification on how prisoner died.	https://www.aljazeera.com/news/2025/1/9/swiss-national-held-by-iran-on-spying-charges-dies-in-jail?traffic_source=rss	2025-01-09T11:36:10-08:00	
US presidents gather for state funeral of Jimmy Carter	Former US presidents Barack Obama and Donald Trump sat next to each at the state funeral service for Jimmy Carter.	https://www.aljazeera.com/program/newsfeed/2025/1/9/us-presidents-gather-for-state-funeral-of-jimmy-carter?traffic_source=rss	2025-01-09T11:24:09-08:00	
Who is Joseph Aoun, the new president of Lebanon?	Joseph Aoun, the former Lebanese army commander, is country's 14th president after a two-year vacancy.	https://www.aljazeera.com/news/2025/1/9/who-is-joseph-aoun-the-new-president-of-lebanon?traffic_source=rss	2025-01-09T09:47:40-08:00	
No, Sri Lanka’s Tamil question has not been resolved	The nationwide electoral success of the anti-establishment NPP does not mean Tamil nationalism is on the decline.	https://www.aljazeera.com/opinions/2025/1/9/no-sri-lankas-tamil-question-has-not-been-resolved?traffic_source=rss	2025-01-09T09:38:19-08:00	
Lebanese lawmakers elect president after more than two-year gap	Lebanon’s parliament selected army chief Joseph Aoun as the country’s president, ending a more than two-year gap.	https://www.aljazeera.com/program/newsfeed/2025/1/9/lebanese-lawmakers-elect-president-after-more-than-two-year-gap?traffic_source=rss	2025-01-09T08:27:01-08:00	
Chad’s presidency attacked: Coup attempt, Boko Haram or ‘drunk’ fighters?	Assault on N'Djamena comes amid visit by China FM, withdrawal of French troops, and instability caused by armed groups.	https://www.aljazeera.com/news/2025/1/9/chads-presidency-attacked-coup-attempt-boko-haram-or-drunk-fighters?traffic_source=rss	2025-01-09T08:21:57-08:00	
Russia says closely watching Trump’s Greenland claims	Europena Union foreign policy chief Kaja Kallas says that Greenland's sovereignty must be respected.	https://www.aljazeera.com/news/2025/1/9/russia-says-closely-watching-trumps-greenland-claims?traffic_source=rss	2025-01-09T08:19:55-08:00	
New York’s top court rejects Trump bid to delay hush-money case sentencing	US president-elect is already appealing to Supreme Court to prevent sentencing this week for his criminal conviction.	https://www.aljazeera.com/news/2025/1/9/new-yorks-top-court-rejects-trump-bid-to-delay-hush-money-case-sentencing?traffic_source=rss	2025-01-09T08:13:33-08:00	
Soft Skin	Soft Skin is a short film from the &quot;From Ground Zero&quot; collection.	https://www.aljazeera.com/program/digidocs/2025/1/9/soft-skin?traffic_source=rss	2025-01-09T08:06:43-08:00	
Jimmy Carter being honoured with state funeral in Washington, DC	President Joe Biden will deliver eulogy for Carter, remembered for his defence of democracy and humanitarian work.	https://www.aljazeera.com/news/2025/1/9/jimmy-carter-being-honoured-with-state-funeral-in-washington-dc?traffic_source=rss	2025-01-09T07:08:46-08:00	
Creating warm clothes for Gaza’s displaced children	Two siblings in Gaza are keeping displaced children warm by making clothes and distributing them free of charge.	https://www.aljazeera.com/program/newsfeed/2025/1/9/creating-warm-clothes-for-gazas-displaced-children?traffic_source=rss	2025-01-09T07:06:40-08:00	
Can Syria’s new leaders fix the broken economy?	After almost 14 years of civil war, Syria's economy is in ruins.	https://www.aljazeera.com/program/counting-the-cost/2025/1/9/can-syrias-new-leaders-fix-the-broken-economy?traffic_source=rss	2025-01-09T07:00:00-08:00	
How big are the California wildfires – and why did they spread so fast?	Here's what started the deadly California wildfires, prompting evacuation of at least 130,000 people.	https://www.aljazeera.com/news/2025/1/9/how-big-are-the-california-wildfires-and-why-did-they-spread-so-fast?traffic_source=rss	2025-01-09T05:05:46-08:00	
Scenes of destruction from Los Angeles wildfires	A drive along streets in the US state of California shows the kind of destruction left by several wildfires.	https://www.aljazeera.com/program/newsfeed/2025/1/9/scenes-of-destruction-from-los-angeles-wildfires?traffic_source=rss	2025-01-09T05:04:44-08:00	
South Africa’s sports minister joins calls for Afghanistan cricket boycott	McKenzie urges his country’s cricket governing body not to honour the Champions Trophy fixture against Afghanistan.	https://www.aljazeera.com/sports/2025/1/9/south-africas-sports-minister-joins-calls-for-afghanistan-cricket-boycott?traffic_source=rss	2025-01-09T04:53:29-08:00	
Lebanon parliament elects army chief Joseph Aoun as president	The appointment breaks a deadlock that has left the country without a head of state since October 2022.	https://www.aljazeera.com/news/2025/1/9/lebanon-parliament-elects-army-chief-joseph-aoun-as-president?traffic_source=rss	2025-01-09T04:43:45-08:00	
Israeli soldiers told not to publish war videos as some flee vacations	A holidaying Israeli soldier was forced to flee Brazil after a judge ordered an investigation into his wartime conduct.	https://www.aljazeera.com/program/newsfeed/2025/1/9/israeli-soldiers-told-not-to-publish-war-videos-as-some-flee-vacations?traffic_source=rss	2025-01-09T04:21:59-08:00	
Three Gaza hospitals face imminent closure as latest Israeli raids kill 50	UN warns that lack of fuel threatens to shut down more medical facilities across the besieged territory.	https://www.aljazeera.com/news/2025/1/9/three-gaza-hospitals-face-imminent-closure-as-latest-israeli-raids-kill-50?traffic_source=rss	2025-01-09T04:21:03-08:00	
Hollywood stars lose homes as out-of-control wildfires engulf Los Angeles	Fast-moving blaze kills at least five and puts 130,000 under evacuation orders in the heartland of US film industry.	https://www.aljazeera.com/gallery/2025/1/9/hollywood-stars-lose-homes-as-out-of-control-los-angeles-wildfires-rages-on?traffic_source=rss	2025-01-09T03:27:54-08:00	
Behind Trump’s threat: Why is Greenland so strategically important?	The US President-elect does not rule out force to take over the Danish territory - home to a US military base.	https://www.aljazeera.com/news/2025/1/9/behind-trumps-threat-why-is-greenland-so-strategically-important?traffic_source=rss	2025-01-09T03:06:14-08:00	
Elon Musk in politics – the pros and cons | Start Here	‘President’ Elon Musk – what to make of the billionaire’s new political power.	https://www.aljazeera.com/program/start-here/2025/1/9/elon-musk-in-politics-the-pros-and-cons-start?traffic_source=rss	2025-01-09T03:03:44-08:00	
Mozambique’s opposition leader returns as supporters clash with police	Mozambique’s main opposition leader Venancio Mondlane returned to the country on Thursday from self-imposed exile.	https://www.aljazeera.com/program/newsfeed/2025/1/9/mozambiques-opposition-leader-returns-as-supporters-clash-with-police?traffic_source=rss	2025-01-09T02:54:46-08:00	
Why are Donald Trump’s allies cheering for Pakistan’s Imran Khan?	From Richard Grenell to Matt Gaetz, their comments reflect overseas PTI campaigning for Khan's release. Will it work?	https://www.aljazeera.com/news/2025/1/9/why-are-donald-trumps-allies-cheering-for-pakistans-imran-khan?traffic_source=rss	2025-01-09T02:29:35-08:00	
Ukraine takes another bite out of Russia as Moscow grinds on in Donetsk	Ukraine also announced significant investments in unmanned and long-range systems, where it has an edge.	https://www.aljazeera.com/news/2025/1/9/ukraine-takes-another-bite-out-of-russia-as-moscow-grinds-on-in-donetsk?traffic_source=rss	2025-01-09T02:23:43-08:00	
Burning house collapses in California wildfires	Video shows the moment a house in Los Angeles collapsed as it was consumed by one of several wildfires in California.	https://www.aljazeera.com/program/newsfeed/2025/1/9/burning-house-collapses-in-california-wildfires?traffic_source=rss	2025-01-09T02:21:00-08:00	
Draft exemption for ultra-Orthodox Jews in Israel -untenable-	Dan Perry talks about the -conundrum- Netanyahu faces regarding military service exemption for ultra-Orthodox Jews.	https://www.aljazeera.com/program/quotable/2025/1/9/aje-onl-qt_dan_perry-090125?traffic_source=rss	2025-01-09T02:02:39-08:00	
Taliban calls India a ‘significant regional partner’ after officials meet	Senior foreign ministry officials of two countries hold highest-level talks since group's takeover of Kabul in 2021.	https://www.aljazeera.com/news/2025/1/9/taliban-calls-india-a-significant-regional-partner-after-officials-meet?traffic_source=rss	2025-01-09T01:43:19-08:00	
Muslims of the world are much more united than they think	Those mistaking the Ummah's political and cultural diversity for disunity are playing into the hands of our oppressors.	https://www.aljazeera.com/opinions/2025/1/9/muslims-of-the-world-are-much-more-united-than-they-think?traffic_source=rss	2025-01-09T01:31:46-08:00	
Will Lebanon finally elect a president?	Lebanon's parliament is to vote for the country's next president after a two-year void.	https://www.aljazeera.com/features/2025/1/9/explainer-lebanons-presidential-election?traffic_source=rss	2025-01-09T01:21:53-08:00	
19 killed in assault on Chad presidential complex	At least 19 people have been killed in Chad where security forces said they had prevented an attack by armed fighters.	https://www.aljazeera.com/program/newsfeed/2025/1/9/19-killed-in-assault-on-chad-presidential-complex?traffic_source=rss	2025-01-09T01:01:34-08:00	
Clashes in Mozambique as main opposition leader Mondlane returns from exile	Injuries reported as police fire tear gas and live ammunition as Venancio Mondlane lands in Maputo after disputed vote.	https://www.aljazeera.com/news/2025/1/9/clashes-in-mozambique-as-main-opposition-leader-mondlane-returns-from-exile?traffic_source=rss	2025-01-09T00:55:28-08:00	
‘For Ethiopia’s heritage’: Family fights to reclaim a hero’s stolen medal	Medal Italian colonial soldiers stole from Prince Damtew resurfaces at auction 87 years after the war hero was executed.	https://www.aljazeera.com/features/2025/1/9/for-ethiopias-heritage-family-fights-to-reclaim-a-heros-stolen-medal?traffic_source=rss	2025-01-09T00:44:05-08:00	
US recognises RSF genocide vs. US Denies Gaza genocide	The US's hypocritical stance on genocide.	https://www.aljazeera.com/program/compare-contrast/2025/1/9/us-recognises-rsf-genocide-vs-us-denies-gaza-genocide?traffic_source=rss	2025-01-09T00:03:37-08:00	
Brazil’s Neymar says FIFA World Cup 2026 will be his last	Injury-prone forward wants to 'work very hard' to be with the Brazilian team at the next World Cup.	https://www.aljazeera.com/sports/2025/1/9/brazils-neymar-says-fifa-world-cup-2026-will-be-his-last?traffic_source=rss	2025-01-09T00:02:32-08:00	
Syrians mark a month since al-Assad’s overthrow with concert in capital	Thousands attend the concert in Damascus to mark the end of al-Assad family rule and almost 14 years of civil war.	https://www.aljazeera.com/news/2025/1/9/syrians-mark-a-month-since-al-assads-overthrow-with-concert-in-capital?traffic_source=rss	2025-01-08T23:49:42-08:00	
US withholds WADA dues; calls for reforms to global anti-doping watchdog	The move comes in the wake of WADA's controversial handling of positive doping tests by Chinese swimmers.	https://www.aljazeera.com/sports/2025/1/9/us-withholds-wada-dues-calls-for-reforms-to-global-anti-doping-watchdog?traffic_source=rss	2025-01-08T23:33:42-08:00	
Crowd crush at India’s Tirupati temple kills six as thousands seek entry	Dozens of others injured after thousands of devotees queue outside one of the most visited Hindu temples in south India.	https://www.aljazeera.com/news/2025/1/9/crowd-crush-at-indias-tirupati-temple-kills-six-as-thousands-seek-entry?traffic_source=rss	2025-01-08T23:01:33-08:00	
Tump shows he -doesn’t really have a plan- for Middle East	Rami Khouri, comments on Trump saying that -all hell- will break loose if Hamas doesn’t release Israeli captives.	https://www.aljazeera.com/program/quotable/2025/1/9/aje-onl-qt-rami_khouri-080125?traffic_source=rss	2025-01-08T21:58:14-08:00	
The -broader legacy- of Jean-Marie Le Pen and France’s far right	Hugo Drochon, talks about the death of French far-right politician, Jean-Marie Le Pen	https://www.aljazeera.com/program/quotable/2025/1/9/aje-onl-hugodrochon-v4-080125?traffic_source=rss	2025-01-08T21:25:37-08:00	
Japanese crime boss admits to conspiring to sell nuclear material to Iran	Takeshi Ebisawa faces a maximum punishment of life in prison after pleading guilty to six counts in a Manhattan court.	https://www.aljazeera.com/news/2025/1/9/japanese-crime-boss-admits-to-conspiring-to-sell-nuclear-material-to-iran?traffic_source=rss	2025-01-08T19:59:18-08:00	
