Title	Description	Link	pubDate	Image
Israel maintains furious rate of attacks on Gaza amid hopes for ceasefire	Israeli attacks kill at least 32 Palestinians in Gaza on Tuesday, raising death toll since October 7, 2023 to 46,645.	https://www.aljazeera.com/gallery/2025/1/14/israel-maintains-furious-rate-of-attacks-on-gaza-amid-hopes-for-truce?traffic_source=rss	2025-01-14T06:59:28-08:00	
The whataboutery in African debates on solidarity with Gaza is misplaced	Not standing in solidarity with Gaza because of the need to make African conflicts visible is the wrong approach.	https://www.aljazeera.com/opinions/2025/1/14/the-whataboutery-in-african-debates-on-solidarity-with-gaza-is-misplaced?traffic_source=rss	2025-01-14T06:37:47-08:00	
Why I won’t stop telling Gaza’s stories	I continue to report from Gaza because I want to make a record of our existence - our dignity, resilience and hope.	https://www.aljazeera.com/opinions/2025/1/14/why-i-wont-stop-telling-gazas-stories?traffic_source=rss	2025-01-14T06:15:34-08:00	
Lebanon’s PM-designate Nawaf Salam promises to ‘rescue, reform and rebuild’	Salam says he is reaching out across the political spectrum in nod to Hezbollah, which opposed his nomination.	https://www.aljazeera.com/news/2025/1/14/lebanons-pm-designate-nawaf-salam-promises-to-rescue-reform-and-rebuild?traffic_source=rss	2025-01-14T05:58:24-08:00	
Pete Hegseth, Trump’s Pentagon pick, faces Senate confirmation hearing	US senators set to grill Hegseth, who has Republican backing, over contentious past statements and controversies.	https://www.aljazeera.com/news/2025/1/14/pete-hegseth-trumps-pentagon-pick-faces-senate-confirmation-hearing?traffic_source=rss	2025-01-14T05:44:19-08:00	
Brazilian teen Fonseca lights up Australian Open as Medvedev faces fine	Fonseca beats ninth seed Rublev in men's draw while Paolini, Rybakina and Raducanu advance in women's draw on day three.	https://www.aljazeera.com/sports/2025/1/14/brazilian-teen-fonseca-lights-up-australian-open-as-medvedev-faces-fine?traffic_source=rss	2025-01-14T05:38:01-08:00	
Message from the Amazon	earthrise meets the Ashaninka who are mobilising global action for the planet from their ancestral lands in the Amazon.	https://www.aljazeera.com/program/earthrise/2025/1/14/message-from-the-amazon?traffic_source=rss	2025-01-14T05:30:00-08:00	
NATO launches new Baltic Sea mission to protect undersea cables	NATO chief Mark Rutte says 'Baltic Sentry' mission to protect critical undersea cables following string of incidents.	https://www.aljazeera.com/news/2025/1/14/nato-launches-new-baltic-sea-mission-to-protect-undersea-cables?traffic_source=rss	2025-01-14T05:21:00-08:00	
Lebanon appoints new prime minister after two years of political paralysis	After two years of political turmoil and paralysis, Lebanon has appointed a new prime minister.	https://www.aljazeera.com/program/newsfeed/2025/1/14/lebanon-appoints-new-prime-minister-after-two-years-of-political-paralysis?traffic_source=rss	2025-01-14T05:16:48-08:00	
Gaza ceasefire deal in ‘final stages’: Qatar	Moderators say negotiations are at their 'closest point' yet, with expectations of a imminent deal.	https://www.aljazeera.com/news/2025/1/14/gaza-ceasefire-deal-in-final-stages-qatar?traffic_source=rss	2025-01-14T05:03:06-08:00	
Haiti displacement surpasses one million people: UN	Children account for more than half of Haiti's displaced population, which has tripled amid relentless gang violence.	https://www.aljazeera.com/news/2025/1/14/haiti-displacement-surpasses-one-million-people-un?traffic_source=rss	2025-01-14T04:50:42-08:00	
Irregular migration into EU dropped sharply in 2024: Border agency	Despite falling total, number of people crossing border from Belarus and Russia jumped 192 percent.	https://www.aljazeera.com/news/2025/1/14/irregular-migration-into-eu-dropped-sharply-in-2024-border-agency?traffic_source=rss	2025-01-14T04:34:19-08:00	
Qatar says Gaza ceasefire closer than any time before	Qatar’s foreign ministry spokesman has said major issues that have prevented a Gaza ceasefire deal have been addressed.	https://www.aljazeera.com/program/newsfeed/2025/1/14/qatar-says-gaza-ceasefire-closer-than-any-time-before?traffic_source=rss	2025-01-14T04:16:46-08:00	
Ben Gvir says ceasefire plan is a ‘surrender’ to Hamas	Itamar Ben Gvir, Israel’s far-right national security minister, says the ceasefire talks constitute a ‘surrender' deal.	https://www.aljazeera.com/program/newsfeed/2025/1/14/ben-gvir-says-ceasefire-plan-is-a-surrender-to-hamas?traffic_source=rss	2025-01-14T04:15:05-08:00	
Where are the LA fires still burning, and why are they so destructive?	The wildfires raging through Los Angeles are the most destructive and likely the deadliest in the county's history.	https://www.aljazeera.com/news/2025/1/14/where-are-the-la-fires-still-burning-and-why-are-they-so-destructive?traffic_source=rss	2025-01-14T03:46:48-08:00	
Gaza attacks continue despite advanced ceasefire talks	Israel’s attacks across Gaza have not slowed, despite widespread optimism over a ceasefire deal to end Gaza genocide.	https://www.aljazeera.com/program/newsfeed/2025/1/14/gaza-attacks-continue-despite-advanced-ceasefire-talks?traffic_source=rss	2025-01-14T03:39:36-08:00	
Russia accuses US and Ukraine of targeting TurkStream gas pipeline	Washington encouraging Ukraine to sabotage last remaining pipeline carrying Russian gas into the EU, claims Moscow.	https://www.aljazeera.com/news/2025/1/14/russia-accuses-us-and-ukraine-of-targeting-turkstream-gas-pipeline?traffic_source=rss	2025-01-14T03:31:19-08:00	
Los Angeles wildfires day 8: What’s the latest, what’s next as winds rage?	As authorities continue battling dangerous blazes, we explore what lies ahead this Tuesday.	https://www.aljazeera.com/news/2025/1/14/los-angeles-wildfires-day-8-whats-the-latest-whats-next-as-winds-rage?traffic_source=rss	2025-01-14T03:09:15-08:00	
Hundreds of prisoners fighting LA fires for barely a dollar a day	Almost 1,000 US prisoners have been fighting the Los Angeles fires for pay as little as roughly a dollar a day.	https://www.aljazeera.com/program/newsfeed/2025/1/14/hundreds-of-prisoners-fighting-la-fires-for-barely-a-dollar-a-day?traffic_source=rss	2025-01-14T02:56:46-08:00	
What’s happening with South Korea’s impeachment?	Al Jazeera's Patrick Fok reports from Seoul as President Yoon Suk's impeachment trial was adjourned.	https://www.aljazeera.com/program/newsfeed/2025/1/14/whats-happening-with-south-koreas-impeachment?traffic_source=rss	2025-01-14T02:46:21-08:00	
Israeli historian Ilan Pappe: ‘This is the last phase of Zionism’	Pappe talks to Al Jazeera on 'neo-Zionism', ceasefire talks, the second coming of Trump and 'indoctrination' in Israel.	https://www.aljazeera.com/news/2025/1/14/israeli-historian-ilan-pappe-this-is-the-last-phase-of-zionism?traffic_source=rss	2025-01-14T02:00:51-08:00	
Saudi Arabia announces plans to enrich and sell uranium	Energy minister says yellowcake project is part of strategy to monetise all minerals.	https://www.aljazeera.com/news/2025/1/14/saudi-arabia-announces-plans-to-enrich-and-sell-uranium?traffic_source=rss	2025-01-14T01:48:30-08:00	
Trump escaped conviction for ‘criminal efforts to retain power’: Report	Special counsel says Trump would have been convicted for bid to overturn 2020 poll if not for his 2024 election win.	https://www.aljazeera.com/news/2025/1/14/trump-escaped-conviction-for-criminal-efforts-to-retain-power-report?traffic_source=rss	2025-01-14T01:26:52-08:00	
Los Angeles wildfires prompt sports teams, fans to honour first responders	The Rams, Lakers and Clippers all dedicated their games to the community and first responders amid the LA wildfires.	https://www.aljazeera.com/sports/2025/1/14/los-angeles-sports-teams-and-fans-honour-first-responders-in-nba-nfl-games?traffic_source=rss	2025-01-14T01:20:29-08:00	
Miners in South Africa standoff call for help as health declines	Video filmed by South African miners involved in a months-long standoff with police shows dire conditions underground.	https://www.aljazeera.com/program/newsfeed/2025/1/14/miners-in-south-africa-standoff-call-for-help-as-health-declines?traffic_source=rss	2025-01-14T00:56:55-08:00	
Young people mark Coming of Age Day in Japan	People gathered to admire the elaborate outfits worn to celebrate the transition from childhood to adulthood.	https://www.aljazeera.com/gallery/2025/1/14/young-people-mark-coming-of-age-day-in-japan?traffic_source=rss	2025-01-14T00:25:24-08:00	
Guardiola admits Man City should have signed more players in the summer	The Premier League title-holders have been hit by injury problems and poor form as they trail Liverpool by 12 points.	https://www.aljazeera.com/sports/2025/1/14/guardiola-admits-man-city-should-have-signed-more-players-in-the-summer?traffic_source=rss	2025-01-14T00:10:09-08:00	
South Korea adjourns impeachment trial as Yoon remains elusive	Seeking to evade arrest, suspended president skips hearing over a failed martial law bid.	https://www.aljazeera.com/news/2025/1/14/south-korea-adjourns-impeachment-trial-as-yoon-remains-elusive?traffic_source=rss	2025-01-14T00:05:15-08:00	
Firefighter village sprouts on Malibu beach	Firefighters from across North America are battling the fires in Los Angeles while living on a beach in Malibu.	https://www.aljazeera.com/gallery/2025/1/14/firefighter-village-sprouts-on-malibu-beach?traffic_source=rss	2025-01-13T23:11:58-08:00	
Sierra Leone declares emergency over mpox outbreak	The West African country has confirmed two cases of mpox in recent days.	https://www.aljazeera.com/news/2025/1/14/sierra-leone-declares-emergency-over-mpox-outbreak?traffic_source=rss	2025-01-13T22:51:23-08:00	
TikTok says report of potential sale to Elon Musk ‘pure fiction’	Video-sharing platform dismisses report claiming Chinese government is considering sale to tech billionaire.	https://www.aljazeera.com/economy/2025/1/14/tiktok-says-report-of-potential-sale-to-elon-musk-pure-fiction?traffic_source=rss	2025-01-13T21:55:53-08:00	
US man charged with stalking WNBA and Indiana Fever star Caitlin Clark	Clark told police she feared for her safety and had altered her appearance in public after receiving the messages on X.	https://www.aljazeera.com/sports/2025/1/14/us-man-charged-with-stalking-wnba-and-indiana-fever-star-caitlin-clark?traffic_source=rss	2025-01-13T21:51:46-08:00	
Philippines protests China’s deployment of ‘monster ship’ in maritime zone	Philippines National Security Council spokesperson said Manila was surprised by China's 'increasing aggression'.	https://www.aljazeera.com/news/2025/1/14/philippines-protests-chinas-deployment-of-monster-ship-in-maritime-zone?traffic_source=rss	2025-01-13T20:24:15-08:00	
Hunter Biden prosecutor chastises president for maligning justice system	Special Counsel David Weiss says president's claims that his son was selectively prosecuted undermine rule of law.	https://www.aljazeera.com/news/2025/1/14/hunter-biden-prosecutor-chastises-president-for-maligning-justice-system?traffic_source=rss	2025-01-13T20:07:34-08:00	
Russia-Ukraine war: List of key events, day 1,055	Here are the key developments on the 1,055th day of Russia’s full-scale invasion of Ukraine.	https://www.aljazeera.com/news/2025/1/14/russia-ukraine-war-list-of-key-events-day-1055?traffic_source=rss	2025-01-13T19:37:07-08:00	
Australia’s economy was the envy of the world. Now it’s falling behind	After record-breaking streak of growth, Australia is lagging behind its peers amid cost-of-living and productivity woes.	https://www.aljazeera.com/economy/2025/1/14/australias-economy-was-the-envy-of-the-world-now-its-falling-behind?traffic_source=rss	2025-01-13T19:05:45-08:00	
What is ‘waste colonialism’ and why has Thailand banned imports of plastic?	China had taken in nearly half of the world's plastic waste since 1992 until it imposed an import ban in 2018.	https://www.aljazeera.com/news/2025/1/14/what-is-waste-colonialism-and-why-has-thailand-banned-imports-of-plastic?traffic_source=rss	2025-01-13T18:56:59-08:00	
Why is thyroid cancer more common in women?	One woman talks about being diagnosed with two autoimmune diseases and thyroid cancer after years of medical oversight.	https://www.aljazeera.com/program/now-you-know/2025/1/14/why-is-thyroid-cancer-more-common-in-women?traffic_source=rss	2025-01-13T18:27:57-08:00	
North Korea launches multiple, short-range ballistic missiles	South Korea's Joint Chiefs of Staff said the missiles travelled up to 250km (155 miles) before landing in the sea.	https://www.aljazeera.com/news/2025/1/14/north-korea-launches-multiple-short-range-ballistic-missiles?traffic_source=rss	2025-01-13T18:18:04-08:00	
Operation under way to rescue trapped miners from South African gold mine	The Mining Affected Communities United in Action group says at least 400 men remain trapped in the abandoned mine.	https://www.aljazeera.com/news/2025/1/14/operation-under-way-to-rescue-illegal-miners-trapped-in-south-african-gold-mine?traffic_source=rss	2025-01-13T17:42:17-08:00	
Biden delivers final foreign policy speech as Gaza ceasefire talks continue	US president seeks to defend legacy on the global stage before Donald Trump takes office on January 20.	https://www.aljazeera.com/news/2025/1/13/biden-delivers-final-foreign-policy-speech-as-gaza-ceasefire-talks-continue?traffic_source=rss	2025-01-13T14:48:10-08:00	
Southern California Edison faces lawsuits over LA wildfires	In one suit, multiple witnesses are cited as having seen a fire at base of a transmission tower owned by the utility.	https://www.aljazeera.com/economy/2025/1/13/southern-california-edison-faces-lawsuits-over-la-wildfires?traffic_source=rss	2025-01-13T14:31:10-08:00	
Israel and Hamas -on the brink- of ceasefire deal, Biden says	US President Joe Biden said Israel and Hamas are -on the brink- of a Gaza ceasefire deal.	https://www.aljazeera.com/program/newsfeed/2025/1/13/israel-and-hamas-on-the-brink-of-ceasefire-deal-biden-says?traffic_source=rss	2025-01-13T12:46:35-08:00	
In scorched neighbourhoods, a few Los Angeles homes stand untouched	The blazes have killed at least 24 people in one of the most devastating natural disasters in United States history.	https://www.aljazeera.com/gallery/2025/1/13/in-scorched-neighbourhoods-a-few-los-angeles-homes-stand-untouched?traffic_source=rss	2025-01-13T12:31:43-08:00	
Video: Amputee doctor in Gaza carries on hospital work despite injury	Dr. Khaled al-Saedni works at a hospital in Gaza and tells how he cares for patients after losing a leg.	https://www.aljazeera.com/program/newsfeed/2025/1/13/video-amputee-doctor-in-gaza-carries-on-hospital-work-despite-injury?traffic_source=rss	2025-01-13T12:27:16-08:00	
Venezuela’s attorney general seeks arrest of opposition leader	Attorney General Tarek Saab says he has appealed to Interpol for the arrest of Leopoldo Lopez, who lives in exile.	https://www.aljazeera.com/news/2025/1/13/venezuelas-attorney-general-seeks-arrest-of-opposition-leader?traffic_source=rss	2025-01-13T11:57:09-08:00	
US lists white supremacist Terrorgram network as ‘terrorist group’	The network, which largely operates on Telegram, has been linked to a series of violent attacks, officials say.	https://www.aljazeera.com/news/2025/1/13/us-lists-white-supremacist-terrorgram-network-as-terrorist-group?traffic_source=rss	2025-01-13T11:24:51-08:00	
Will the West move fast enough to lift al-Assad-era sanctions on Syria?	Damascus launches a diplomatic outreach to push for an end to restrictions.	https://www.aljazeera.com/program/inside-story/2025/1/13/will-the-west-move-fast-enough-to-lift-al-assad-era-sanctions-on-syria?traffic_source=rss	2025-01-13T10:02:46-08:00	
Biden administration proposes new rules to tighten grip on AI chip flows	Regulations would restrict access to AI chips for gaming and AI products and data centres in 120 countries.	https://www.aljazeera.com/economy/2025/1/13/biden-administration-proposes-new-rules-to-tighten-grip-on-ai-chip-flows?traffic_source=rss	2025-01-13T09:45:28-08:00	
US says Gaza truce deal ‘possible’ this week as Israel ramps up attacks	Nothing is guaranteed yet, but an agreement could take shape soon, angering hardliners in Israel.	https://www.aljazeera.com/news/2025/1/13/us-sees-gaza-truce-deal-as-possible-this-week-as-israel-ramps-up-attacks?traffic_source=rss	2025-01-13T09:29:46-08:00	
Israel may burn Gaza schools, but Palestinians shall resist	Education is at the core of Palestinian identity and even at the risk of death, Palestinians still pursue it.	https://www.aljazeera.com/opinions/2025/1/13/israel-may-burn-gaza-schools-but-palestinians-shall-resist?traffic_source=rss	2025-01-13T09:10:10-08:00	
Iran releases dual German national as it attends talks with European powers	Tehran and E3 countries of France, Germany and UK hold consultations on Iran's nuclear programme and other issues.	https://www.aljazeera.com/news/2025/1/13/iran-releases-dual-german-national-as-it-attends-talks-with-european-powers?traffic_source=rss	2025-01-13T08:35:38-08:00	
The short shelf life of corporate DEI	Wokeism' is out, bigotry is in. Meanwhile, inequality continues unabated.	https://www.aljazeera.com/opinions/2025/1/13/the-short-shelf-life-of-corporate-dei?traffic_source=rss	2025-01-13T08:30:47-08:00	
Video: Saudi Arabia hosts diplomatic meetings on lifting Syria sanctions	Talks among Western and Middle Eastern diplomats were held in Riyadh on Sunday.	https://www.aljazeera.com/program/newsfeed/2025/1/13/video-saudi-arabia-hosts-diplomatic-meetings-on-lifting-syria-sanctions?traffic_source=rss	2025-01-13T08:24:54-08:00	
Armed groups kill at least 40 farmers in Nigeria’s Borno State	Officials say Boko Haram and ISWAP groups suspected of being behind the attacks on farmers in the Dumba region.	https://www.aljazeera.com/news/2025/1/13/armed-groups-kill-at-least-40-farmers-in-nigerias-borno-state?traffic_source=rss	2025-01-13T07:51:17-08:00	
Mozambique opens new parliament amid opposition protests and boycotts	About 250 lawmakers sworn in, while the opposition calls for a strike to protest against disputed election results.	https://www.aljazeera.com/news/2025/1/13/mozambique-opens-new-parliament-amid-opposition-protests-and-boycotts?traffic_source=rss	2025-01-13T07:28:30-08:00	
Nawaf Salam wins enough backing to become Lebanon’s prime minister	Support for Salam shows a big shift in the power balance in Lebanon as Hezbollah wanted PM Mikati to keep the job.	https://www.aljazeera.com/news/2025/1/13/nawaf-salam-wins-enough-backing-to-become-lebanons-prime-minister?traffic_source=rss	2025-01-13T07:26:51-08:00	
Tyson Fury, former world heavyweight champ, announces boxing retirement	The British boxer made the decision less than a month after his world heavyweight title defeat to Oleksandr Usyk.	https://www.aljazeera.com/sports/2025/1/13/tyson-fury-former-world-heavyweight-champ-announces-boxing-retirement?traffic_source=rss	2025-01-13T07:00:44-08:00	
Pakistan watches with caution as old ally Taliban gets closer to India	While some analysts say Pakistan need not worry, others warn that Indian influence in Afghanistan could strain ties.	https://www.aljazeera.com/news/2025/1/13/pakistan-watches-with-caution-as-old-ally-taliban-gets-closer-to-india?traffic_source=rss	2025-01-13T07:00:09-08:00	
Djokovic, Alcaraz and Sinner in Australian Open round two, but Kyrgios out	Aussie favourite Kyrgios says his first-round loss might be his last singles appearance in Melbourne.	https://www.aljazeera.com/sports/2025/1/13/djokovic-alcaraz-and-sinner-in-australian-open-round-two-but-kyrgios-out?traffic_source=rss	2025-01-13T06:21:45-08:00	
100 days of siege in north Gaza	5,000 Palestinians have been killed during Israel’s 100-day siege of northern Gaza.	https://www.aljazeera.com/program/newsfeed/2025/1/13/100-days-of-siege-in-north-gaza?traffic_source=rss	2025-01-13T06:06:57-08:00	
Why fire hydrants and water supply failed during Los Angeles wildfires	The LA wildfires continue to burn, with Santa Ana winds set to intensify and challenges hampering rescue efforts.	https://www.aljazeera.com/news/2025/1/13/why-fire-hydrants-and-water-supply-failed-during-los-angeles-wildfires?traffic_source=rss	2025-01-13T05:45:21-08:00	
Coaching ‘pods’ get mixed reaction from top players at Australian Open 2025	New court-side seating allows players to communicate with coaches and other team members during the match.	https://www.aljazeera.com/sports/2025/1/13/coaching-pods-get-mixed-reaction-from-top-players-at-australian-open-2025?traffic_source=rss	2025-01-13T05:27:27-08:00	
Nigerian air raid targeting bandits mistakenly kills civilians	Nigerian air force launches investigation after reports say at least 15 people killed in air attack in Zamfara State.	https://www.aljazeera.com/news/2025/1/13/nigerian-air-raid-targeting-bandits-mistakenly-kills-civilians?traffic_source=rss	2025-01-13T05:04:44-08:00	
Death threats, interrogation: Why football referee Mahsa Ghorbani left Iran	Ghorbani, a female Iranian international football referee, fled to Sweden after security threats and unfair treatment.	https://www.aljazeera.com/sports/2025/1/13/death-threats-interrogation-why-football-referee-mahsa-ghorbani-left-iran?traffic_source=rss	2025-01-13T04:54:31-08:00	
Syrian engineers disarm landmines planted by Assad regime	Bomb disposal teams in Idlib are working to disarm landmines planted by the Assad regime.	https://www.aljazeera.com/program/newsfeed/2025/1/13/syrian-engineers-disarm-landmines-planted-by-assad-regime?traffic_source=rss	2025-01-13T04:52:21-08:00	
Trump’s ‘all hell’ comments a threat to Hamas, says US VP-elect Vance	JD Vance warns of consequences if Gaza captive deal does not happen, including knocking out 'final' Hamas battalions.	https://www.aljazeera.com/news/2025/1/13/trumps-all-hell-comments-a-threat-to-hamas-says-us-vp-elect-vance?traffic_source=rss	2025-01-13T04:40:17-08:00	
Why are California inmates deployed to help fight LA wildfires?	Canada and Mexico have offered to deploy firefighters as US inmates join in efforts to put out LA's wildfires.	https://www.aljazeera.com/news/2025/1/13/why-are-california-inmates-deployed-to-help-fight-la-wildfires?traffic_source=rss	2025-01-13T04:37:00-08:00	
Russia ‘prepared for any scenario’ on Ukraine war as Trump presidency nears	The US president-elect has promised to end the conflict in Ukraine but the Kremlin has not endorsed any tentative plans.	https://www.aljazeera.com/news/2025/1/13/russia-prepared-for-any-scenario-on-ukraine-war-as-trump-presidency-nears?traffic_source=rss	2025-01-13T04:30:37-08:00	
Before and after images show destruction of LA fires	A before and after video of a walking tour around the LA neighbourhood of Pacific Palisades shows the destruction caused	https://www.aljazeera.com/program/newsfeed/2025/1/13/before-and-after-images-show-destruction-of-la-fires?traffic_source=rss	2025-01-13T03:22:08-08:00	
Lebanon President Joseph Aoun starts consultations for PM selection	Caretaker Prime Minister Najib Mikati and top ICJ judge Nawaf Salam seen as frontrunners.	https://www.aljazeera.com/news/2025/1/13/lebanon-president-joseph-aoun-starts-consultations-for-pm-selection?traffic_source=rss	2025-01-13T02:37:24-08:00	
Donald Trump and the Bitcoin rise	Bitcoin rose to more than $100,000 in 2024. Donald Trump has been pro-crypto for some time. Did that influence its rise?	https://www.aljazeera.com/program/by-the-numbers-3/2025/1/13/donald-trump-and-the-bitcoin-rise?traffic_source=rss	2025-01-13T02:08:05-08:00	
DR Congo says several towns recaptured from rebels, but fighting persists	Despite recent military gains, eastern DRC remains mired in conflict, mainly as a result of the M23 rebellion.	https://www.aljazeera.com/news/2025/1/13/dr-congo-says-several-towns-recaptured-from-rebels-but-fighting-persists?traffic_source=rss	2025-01-13T02:06:18-08:00	
Photos: India kicks off a huge Hindu festival, Maha Kumbh Mela	Millions of Hindu devotees will gather for the Kumbh Mela festival, the largest religious congregation on earth.	https://www.aljazeera.com/gallery/2025/1/13/photos-india-kicks-off-a-huge-hindu-festival-maha-kumbh-mela?traffic_source=rss	2025-01-13T01:53:47-08:00	
Seoul says 300 North Korean soldiers killed, 2,700 wounded fighting Ukraine	Casualties among North Koreans assisting Russia 'have surpassed 3,000', according to South Korea's intelligence agency.	https://www.aljazeera.com/news/2025/1/13/seoul-says-300-north-korean-soldiers-killed-2700-wounded-fighting-ukraine?traffic_source=rss	2025-01-13T01:04:28-08:00	
Rehearsal and walkthrough for Donald Trump’s inauguration	A rehearsal with stand-ins is held at the Capitol before the inauguration of US President-elect Trump.	https://www.aljazeera.com/gallery/2025/1/13/rehearsal-and-walkthrough-for-donald-trumps-inauguration?traffic_source=rss	2025-01-13T00:18:41-08:00	
Cummins, Hazlewood return as Australia name ICC Champions Trophy squad	World champions Australia rely on experience and all-round abilities as they seek third Champions Trophy title.	https://www.aljazeera.com/sports/2025/1/13/cummins-hazlewood-return-as-australia-name-icc-champions-trophy-squad?traffic_source=rss	2025-01-13T00:18:01-08:00	
The Khalistan Assassinations	A murder that rocked the Sikh community in British Columbia, Canada.	https://www.aljazeera.com/program/true-crime-reports/2025/1/13/the-khalistan-assassinations?traffic_source=rss	2025-01-12T23:58:51-08:00	
Austrian woman kidnapped by unknown assailants in Niger	Residents and local media report that the victim is a 73-year-old who was taken in the city of Agadez.	https://www.aljazeera.com/news/2025/1/13/austrian-woman-kidnapped-by-unknown-assailants-in-niger?traffic_source=rss	2025-01-12T23:29:33-08:00	
