Title	Description	Link	pubDate	Image
Colombia seeks to reassert control as rebel fighting kills over 100	Government sends troops into coca-rich northeast Catatumbo region in bid to quell hostilities among rebel groups.	https://www.aljazeera.com/news/2025/1/22/colombia-seeks-to-reassert-control-as-rebel-fighting-kills-over-100?traffic_source=rss	2025-01-22T03:26:36-08:00	
Lewis Hamilton drives Ferrari F1 car for the first time	The seven-time world champion delighted Italian fans with his debut behind the wheel of a 2023-specification F1 Ferrari.	https://www.aljazeera.com/sports/2025/1/22/lewis-hamilton-drives-ferrari-f1-car-for-the-first-time?traffic_source=rss	2025-01-22T03:13:19-08:00	
Mapping 1,800 Israeli settler attacks in the West Bank since October 2023	An average of four incidents of settler violence have taken place each day in the occupied West Bank since October 7.	https://www.aljazeera.com/news/2025/1/22/mapping-1800-israeli-settler-attacks-in-the-occupied-west-bank-since-october-7?traffic_source=rss	2025-01-22T03:08:27-08:00	
See Trump’s reaction as bishop pleads for protection of minorities	Donald Trump’s reaction as a bishop made a direct plea to the US president to protect minorities.	https://www.aljazeera.com/program/newsfeed/2025/1/22/see-trumps-reaction-as-bishop-pleads-for-protection-of-minorities?traffic_source=rss	2025-01-22T02:24:51-08:00	
Australia probes suspected foreign funding of anti-Semitic attacks	Police believe 'foreign actors' paying local criminals to commit crimes amid a surge in anti-Semitic incidents.	https://www.aljazeera.com/news/2025/1/22/australia-probes-suspected-foreign-funding-of-anti-semitic-attacks?traffic_source=rss	2025-01-22T01:29:39-08:00	
As gold prices surge, Ghana faces ‘looming crisis’ over illegal mining	Illegal and small-scale mining known as galamsey is contaminating the country's rivers and soil, activists say.	https://www.aljazeera.com/features/2025/1/22/as-gold-prices-surge-ghana-faces-looming-crisis-over-illegal-mining?traffic_source=rss	2025-01-22T01:02:14-08:00	
Rescuers in Indonesia search for survivors after landslide kills 19 in Java	Heavy rains in Pekalongan cause a devastating landslide, blocking a main road and burying houses.	https://www.aljazeera.com/news/2025/1/22/indonesia-resumes-search-for-survivors-after-deadly-landslide-central-java?traffic_source=rss	2025-01-21T23:48:09-08:00	
Israel’s scorched earth campaign leaves Gaza in ruins	As Palestinians return home, mounds of rubble stretch across Gaza's refugee camps and cities.	https://www.aljazeera.com/gallery/2025/1/22/israels-scorched-earth-campaign-leaves-gaza-in-ruins?traffic_source=rss	2025-01-21T23:34:16-08:00	
‘Skull without a jaw’: Gaza survivors search for what remains of the dead	Palestinians are taking the opportunity provided by the Israel-Hamas ceasefire to search for the remains of loved ones.	https://www.aljazeera.com/news/2025/1/22/skull-without-a-jaw-gaza-survivors-search-for-what-remains-of-the-dead?traffic_source=rss	2025-01-21T23:23:52-08:00	
Turkiye arrests nine amid anger over deadly hotel fire	Questions rise over safety measures at the Grand Kartal Hotel at a ski resort in the Bolu Mountains.	https://www.aljazeera.com/news/2025/1/22/turkiye-arrests-nine-amid-anger-over-deadly-hotel-fire?traffic_source=rss	2025-01-21T22:59:33-08:00	
Turkiye’s Victory Party leader Umit Ozdag faces trial for ‘inciting hatred’	Turkish court orders Umit Ozdag's custody over accusations of public incitement and anti-Syrian refugee riots.	https://www.aljazeera.com/news/2025/1/22/turkiyes-victory-party-leader-umit-ozdag-faces-trial-for-inciting-hatred?traffic_source=rss	2025-01-21T22:37:50-08:00	
Have Trump’s tariff threats helped China boost its exports?	Trump has said he is considering imposing a 10 percent tariff on China from February.	https://www.aljazeera.com/news/2025/1/22/have-trumps-tariff-threats-helped-china-boost-its-exports?traffic_source=rss	2025-01-21T22:25:01-08:00	
Israel launches deadly raid on occupied West Bank’s Jenin refugee camp	Israeli forces kill at least 10 people and injure dozens in an assault expected to last several days.	https://www.aljazeera.com/gallery/2025/1/22/israel-launches-deadly-raid-on-occupied-west-banks-jenin-refugee-camp?traffic_source=rss	2025-01-21T22:08:13-08:00	
Superb Swiatek, resilient Keys set up Australian Open semifinal	Swiatek continues her ruthless run with a straight-sets win over Navarro as Keys stages comeback to beat Svitolina.	https://www.aljazeera.com/sports/2025/1/22/superb-swiatek-resilient-keys-set-up-australian-open-semifinal?traffic_source=rss	2025-01-21T21:59:38-08:00	
Russia-Ukraine war: List of key events – day 1,063	Here are the key developments on the 1,063rd day of Russia’s full-scale invasion of Ukraine.	https://www.aljazeera.com/news/2025/1/22/russia-ukraine-war-list-of-key-events-day-one-thousand-sixty-three?traffic_source=rss	2025-01-21T20:55:05-08:00	
Trump announces $500bn ‘Stargate’ venture to build up AI infrastructure	US president says venture will be the largest AI infrastructure project in history 'by far'.	https://www.aljazeera.com/news/2025/1/22/trump-announces-500bn-stargate-venture-to-build-up-ai-infrastucture?traffic_source=rss	2025-01-21T19:27:48-08:00	
ADL faces backlash for defending Elon Musk’s raised-arm gesture	After previously feuding with Musk, pro-Israel group rushes to defend gesture, which critics compared with Nazi salute.	https://www.aljazeera.com/news/2025/1/22/adl-faces-backlash-for-defending-elon-musks-raised-arm-gesture?traffic_source=rss	2025-01-21T17:48:37-08:00	
Trump pardons Ross Ulbricht, creator of dark web marketplace Silk Road	Ulbricht was given two life sentences, plus 40 years for running site that allegedly facilitated $183m in drug sales.	https://www.aljazeera.com/economy/2025/1/22/trump-pardons-ross-ulbricht-creator-of-dark-web-marketplace-silk-road?traffic_source=rss	2025-01-21T17:22:00-08:00	
Trump rescinds guidance protecting ‘sensitive areas’ from immigration raids	For more than a decade, agencies like ICE and CBP avoided raids on places that provide vital services, like hospitals.	https://www.aljazeera.com/news/2025/1/22/trump-rescinds-guidance-protecting-sensitive-areas-from-immigration-raids?traffic_source=rss	2025-01-21T16:26:21-08:00	
Trump administration removes four-star Coast Guard leader in firing spree	Linda Fagan, the first woman to lead a branch of the US Armed Forces, was among those removed by Trump on his first day.	https://www.aljazeera.com/news/2025/1/21/trump-administration-removes-four-star-coast-guard-leader-in-firing-spree?traffic_source=rss	2025-01-21T15:44:31-08:00	
Controversial Raphinha winner seals nine-goal thriller for Barca at Benfica	Benfica are denied a penalty in the build-up to an injury-time winner for Barcelona in the Champions League.	https://www.aljazeera.com/sports/2025/1/21/controversial-raphinha-winner-seals-nine-goal-thriller-for-barca-in-benfica?traffic_source=rss	2025-01-21T15:08:22-08:00	
‘There will be changes’: Marco Rubio confirmed as US secretary of state	In a speech on Tuesday, Rubio defended his department's employees but warned of alterations to come under Trump.	https://www.aljazeera.com/news/2025/1/21/there-will-be-changes-marco-rubio-confirmed-as-us-secretary-of-state?traffic_source=rss	2025-01-21T14:50:28-08:00	
Xi and Putin discuss relations with Trump, Ukraine and Taiwan	Leaders discussed their prospective contacts with new US administration during a wide-ranging video call, Kremlin says.	https://www.aljazeera.com/news/2025/1/21/xi-and-putin-discuss-relations-with-trump-ukraine-and-taiwan?traffic_source=rss	2025-01-21T13:14:48-08:00	
Trump’s UN ambassador pick says Israel has ‘biblical right’ to West Bank	At a hearing, Elise Stefanik pledged to continue the US's defence of Israel and advance Trump's 'America First' agenda.	https://www.aljazeera.com/news/2025/1/21/trumps-un-ambassador-pick-says-israel-has-biblical-right-to-west-bank?traffic_source=rss	2025-01-21T12:43:58-08:00	
How is the world viewing Donald Trump’s inaugural address?	The US president laid out a populist agenda in speech to the nation.	https://www.aljazeera.com/program/inside-story/2025/1/21/how-is-the-world-viewing-donald-trumps-inaugural-address?traffic_source=rss	2025-01-21T12:12:01-08:00	
M23 rebels seize key eastern DRC town of Minova	Authorities say M23 rebels have seized the town of Minova, a trade hub for the eastern provincial capital of Goma.	https://www.aljazeera.com/news/2025/1/21/m23-rebels-seize-key-eastern-drc-town-of-minova?traffic_source=rss	2025-01-21T12:00:16-08:00	
Qatar PM hopes Palestinian Authority will return to Gaza when war ends	Sheikh Mohammed says Palestinians in Gaza - and not any other country - should dictate the way the enclave is governed.	https://www.aljazeera.com/news/2025/1/21/qatar-pm-hopes-palestinian-authority-will-return-to-gaza-when-war-ends?traffic_source=rss	2025-01-21T11:20:25-08:00	
Trump’s pick for UN ambassador dodges question on Palestinian rights	Elise Stefanik refused to say whether she believes Palestinians have a right to self-determination.	https://www.aljazeera.com/program/newsfeed/2025/1/21/trumps-pick-for-un-ambassador-dodges-question-on-palestinian-rights?traffic_source=rss	2025-01-21T11:01:22-08:00	
Far-right Oath Keepers, ex-Proud Boys leaders released after Trump pardons	Stewart Rhodes and Enrique Tarrio, who received some of longest sentences for the US Capitol attack, freed from prison.	https://www.aljazeera.com/news/2025/1/21/far-right-oath-keepers-ex-proud-boys-leaders-released-after-trump-pardons?traffic_source=rss	2025-01-21T10:49:10-08:00	
First raft of lawsuits target US birthright citizenship, other Trump orders	Donald Trump signs record 26 executive orders on second term's first day, including an effort to restrict citizenship.	https://www.aljazeera.com/news/2025/1/21/first-raft-of-lawsuits-target-us-birthright-citizenship-other-trump-orders?traffic_source=rss	2025-01-21T10:42:40-08:00	
Aid trucks arriving in Gaza but distribution will be a challenge	Aid has started to flow into Gaza following the ceasefire announcement, but the main challenge is getting it to people.	https://www.aljazeera.com/program/newsfeed/2025/1/21/aid-trucks-arriving-in-gaza-but-distribution-will-be-a-challenge?traffic_source=rss	2025-01-21T10:13:24-08:00	
Prince Harry court battle against Murdoch UK newspapers delayed	British prince and former senior MP Tom Watson are suing News Group Newspapers over alleged unlawful activities.	https://www.aljazeera.com/news/2025/1/21/prince-harry-court-battle-against-murdoch-uk-newspapers-delayed?traffic_source=rss	2025-01-21T09:26:13-08:00	
Israel’s top general resigns over ‘terrible’ 7 October failures	Herzi Halevi is the most senior Israeli figure to resign over the October 7, 2023 Hamas-led attack.	https://www.aljazeera.com/news/2025/1/21/israels-top-general-resigns-over-terrible-7-october-failures?traffic_source=rss	2025-01-21T09:17:08-08:00	
Trump policies raise concern over Palestine’s future	Trump’s presidency raises concern for Palestinians over the rebuilding of Gaza and revoked sanctions on Israeli settlers	https://www.aljazeera.com/program/newsfeed/2025/1/21/trump-policies-raise-concern-over-palestines-future?traffic_source=rss	2025-01-21T09:15:51-08:00	
Trump pardons 1500 Jan 6 prisoners, commutes other sentences	US President Donald Trump has pardoned more than 1500 prisoners who participated in the attack on the US Capitol.	https://www.aljazeera.com/program/newsfeed/2025/1/21/trump-pardons-1500-jan-6-prisoners-commutes-other-sentences?traffic_source=rss	2025-01-21T08:29:21-08:00	
Rubio officially sworn into office as US Secretary of State	Former Senator Marco Rubio has officially begun his tenure as US Secretary of State.	https://www.aljazeera.com/program/newsfeed/2025/1/21/rubio-officially-sworn-into-office-as-us-secretary-of-state?traffic_source=rss	2025-01-21T08:06:35-08:00	
Israeli army launches attack on Jenin refugee camp in West Bank	Israel has launched an attack on Jenin refugee camp in the occupied West Bank, killing at least seven Palestinians.	https://www.aljazeera.com/program/newsfeed/2025/1/21/israeli-army-launches-attack-on-jenin-refugee-camp-in-west-bank?traffic_source=rss	2025-01-21T07:41:40-08:00	
‘We will drill, baby, drill’: Why Trump wants US out of Paris climate deal	For a second time, Donald Trump promises to pull the US from a global agreement that most countries are party to.	https://www.aljazeera.com/news/2025/1/21/drill-baby-whats-the-paris-climate-deal-why-does-trump-want-out?traffic_source=rss	2025-01-21T07:37:15-08:00	
How Israel shaped the narrative and its impact on Dutch politics	Israel's portrayal of Amsterdam Maccabi violence as anti-Semitic sparked a debate on anti-Islam and immigration issues.	https://www.aljazeera.com/program/featured-documentaries/2025/1/21/how-israel-shaped-the-narrative-and-its-impact-on-dutch-politics?traffic_source=rss	2025-01-21T07:30:00-08:00	
Ukraine’s Zelenskyy questions Trump’s commitment to Europe & NATO	Ukrainian President Volodymyr Zelenskyy questioned the commitment of US President Donald Trump to Europe’s security.	https://www.aljazeera.com/program/newsfeed/2025/1/21/ukraines-zelenskyy-questions-trumps-commitment-to-europe-nato?traffic_source=rss	2025-01-21T07:04:39-08:00	
Alcaraz vs Djokovic – Australian Open quarterfinal: Serb beats Spaniard	Ten-time Melbourne champion fights back to win 4-6, 6-4, 6-3, 6-4 and set up a semifinal against Zverev.	https://www.aljazeera.com/sports/2025/1/21/alcaraz-vs-djokovic-australian-open-quarterfinal-serb-beats-spaniard?traffic_source=rss	2025-01-21T06:30:11-08:00	
Mbappe says mental shift helped change his Real Madrid ‘situation’	French superstar has silenced his doubters in recent weeks after struggling to settle in with the Spanish giants.	https://www.aljazeera.com/sports/2025/1/21/mbappe-says-mental-shift-helped-change-his-real-madrid-situation?traffic_source=rss	2025-01-21T06:20:04-08:00	
I dream of a quiet, drone-free Gaza	A ceasefire has been declared, but the torment from the skies has not stopped.	https://www.aljazeera.com/opinions/2025/1/21/i-dream-of-a-quiet-drone-free-gaza?traffic_source=rss	2025-01-21T05:50:09-08:00	
Elon Musk at Trump’s inauguration: What’s the history of the Nazi salute?	SpaceX and Tesla CEO Elon Musk comes under fire for making gesture at President Trump rally similar to Nazi salute.	https://www.aljazeera.com/news/2025/1/21/elon-musk-at-trumps-inauguration-whats-the-history-of-the-nazi-salute?traffic_source=rss	2025-01-21T05:38:13-08:00	
The call to remember	earthrise explores how the Indigenous call to remember our place within nature is resonating in the UK.	https://www.aljazeera.com/program/earthrise/2025/1/21/the-call-to-remember?traffic_source=rss	2025-01-21T05:30:00-08:00	
Sabalenka won’t let Badosa friendship dent Grand Slam ‘three-peat’ dream	The best friends will meet in the Australian Open semifinals as Sabalenka looks for a third straight title in Melbourne.	https://www.aljazeera.com/sports/2025/1/21/sabalenka-wont-let-badosa-friendship-dent-grand-slam-three-peat-dream?traffic_source=rss	2025-01-21T05:25:08-08:00	
Russia, Ukraine continue strikes despite Trump promise to bring swift peace	Trump says Zelenskyy 'wants peace deal' and Putin must accept; Moscow says 'no specific proposals' from Washington.	https://www.aljazeera.com/news/2025/1/21/russia-ukraine-continue-strikes-despite-trump-promise-to-bring-swift-peace?traffic_source=rss	2025-01-21T05:17:55-08:00	
Former Syrian prisoner on torture and imprisonment	Mahmoud was arrested at the age of 17 for protesting during Bashar al-Assad's regime and was released 7 years later.	https://www.aljazeera.com/program/unmute/2025/1/21/former-syrian-prisoner-on-torture-and-imprisonment-2?traffic_source=rss	2025-01-21T05:00:21-08:00	
After 15-months of war, how strong is Hamas?	Israel vowed to eliminate Hamas, but armed members have been out in the open in Gaza. So how strong is Hamas?	https://www.aljazeera.com/program/newsfeed/2025/1/21/after-15-months-of-war-how-strong-is-hamas?traffic_source=rss	2025-01-21T04:52:35-08:00	
World leaders express hope, fear as Donald Trump returns to White House	Political leaders across the world urge good relations with the new president, with some expressing concern.	https://www.aljazeera.com/news/2025/1/21/world-leaders-express-hope-fear-as-donald-trump-returns-to-white-house?traffic_source=rss	2025-01-21T04:23:08-08:00	
Full speech: Donald Trump’s second inauguration address	Beginning his second term, Trump takes oath as 47th president, pledging to 'restore America promise'.	https://www.aljazeera.com/news/2025/1/21/full-speech-donald-trumps-second-inauguration-address?traffic_source=rss	2025-01-21T04:05:32-08:00	
Video: What Gaza doctors are saying about the ceasefire	The ceasefire in Gaza has brought respite for doctors after 15 months of relentless work helping casualties of war.	https://www.aljazeera.com/program/newsfeed/2025/1/21/video-what-gaza-doctors-are-saying-about-the-ceasefire?traffic_source=rss	2025-01-21T04:01:37-08:00	
Can Trump really take over the Panama Canal, rename the Gulf of Mexico?	Trump repeated his desire to do so in his inaugural address on Monday. But it would not be easy.	https://www.aljazeera.com/news/2025/1/21/can-trump-really-take-over-the-panama-canal-rename-the-gulf-of-mexico?traffic_source=rss	2025-01-21T03:50:28-08:00	
Israeli army launches deadly attack on Jenin refugee camp in West Bank	At least two Palestinians killed, 25 wounded in attack on the camp.	https://www.aljazeera.com/news/2025/1/21/israeli-army-launches-deadly-attack-on-jenin-refugee-camp-in-west-bank?traffic_source=rss	2025-01-21T03:44:25-08:00	
What is an executive order, and what orders did Trump sign on day 1?	We take a look at some of the most significant executive actions signed by President Donald Trump.	https://www.aljazeera.com/news/2025/1/21/what-is-an-executive-order-and-what-orders-did-trump-sign-on-day-1?traffic_source=rss	2025-01-21T03:22:53-08:00	
Fire at ski resort in Turkiye kills at least 10	A hotel fire broke out in a ski resort in northwestern Turkiye, killing at least 10 people and injuring dozens more.	https://www.aljazeera.com/program/newsfeed/2025/1/21/fire-at-ski-resort-in-turkiye-kills-at-least-10?traffic_source=rss	2025-01-21T03:12:22-08:00	
Trump on Mars	The destructive policies Trump outlined at his inauguration may indeed make an escape to other planets more appealing.	https://www.aljazeera.com/opinions/2025/1/21/trump-on-mars?traffic_source=rss	2025-01-21T03:10:41-08:00	
South Korea’s President Yoon defends martial law call at impeachment trial	Yoon says special forces soldiers sent to National Assembly on December 3 were not there to disable the legislature.	https://www.aljazeera.com/news/2025/1/21/korea-president-yoon-martial-law?traffic_source=rss	2025-01-21T02:40:52-08:00	
Trump lifts US sanctions on Israeli settlers in the occupied West Bank	Israeli officials welcome new president's decision to remove sanctions imposed by the Biden administration.	https://www.aljazeera.com/news/2025/1/21/trump-lifts-us-sanctions-on-israeli-settlers-in-the-occupied-west-bank?traffic_source=rss	2025-01-21T02:23:10-08:00	
Landslides and flash floods kill at least 16 in Indonesia	Authorities warn that heavy rain is expected to continue for several days as they search for missing people.	https://www.aljazeera.com/news/2025/1/21/landslides-and-flash-floods-kill-at-least-16-in-indonesia?traffic_source=rss	2025-01-21T01:57:24-08:00	
Is Hezbollah weakened as Lebanon shifts towards new governance?	Lebanon has a new president and prime minister - but can they challenge groups like Hezbollah for dominance?	https://www.aljazeera.com/news/2025/1/21/is-hezbollah-weakened-as-lebanon-shifts-towards-new-governance?traffic_source=rss	2025-01-21T01:17:33-08:00	
Biden hands preemptive pardons to family, allies citing Trump retaliation	Republican lawmaker Liz Cheney and immunologist Anthony Fauci among those offered protection.	https://www.aljazeera.com/news/2025/1/21/biden-hands-preemptive-pardons-to-family-allies-citing-trump-retaliation?traffic_source=rss	2025-01-21T00:52:03-08:00	
How climate change fuelled the LA wildfires	Climate change has extended wildfire seasons in California, turning winter fires into a year-round crisis.	https://www.aljazeera.com/program/by-the-numbers-3/2025/1/21/how-climate-change-fuelled-the-la-wildfires?traffic_source=rss	2025-01-21T00:46:03-08:00	
Elon Musk accused of Nazi salutes at Trump inauguration event	Tech mogul Elon Musk has denied making Nazi salutes at an inauguration event for US President Donald Trump.	https://www.aljazeera.com/program/newsfeed/2025/1/21/elon-musk-accused-of-nazi-salutes-at-trump-inauguration-event?traffic_source=rss	2025-01-21T00:39:20-08:00	
Elon Musk believes he got Trump elected. Now he’s coming for Europe	Experts say the EU can wield its digital services rules against election interference – but even that won’t be easy.	https://www.aljazeera.com/news/2025/1/21/elon-musk-believes-he-got-trump-elected-now-hes-coming-for-europe?traffic_source=rss	2025-01-21T00:37:30-08:00	
Israeli settlers attack West Bank villages under army’s protection	Israeli settlers attack Palestinian villages, set vehicles on fire and injure several residents in the West Bank.	https://www.aljazeera.com/news/2025/1/21/israeli-settlers-attack-west-bank-villages-under-armys-protection?traffic_source=rss	2025-01-20T23:50:03-08:00	
Hotel fire at Turkiye ski resort kills at least 10	Officials say fire broke out overnight in the restaurant of the hotel in the northwestern Bolu province.	https://www.aljazeera.com/news/2025/1/21/hotel-fire-at-turkiye-ski-resort-kills-at-least-10?traffic_source=rss	2025-01-20T23:26:04-08:00	
Video: Trump ‘not confident’ on Gaza ceasefire future	US President Donald Trump told reporters he was -not confident- of the Gaza ceasefire deal holding.	https://www.aljazeera.com/program/newsfeed/2025/1/21/video-trump-not-confident-on-gaza-ceasefire-future?traffic_source=rss	2025-01-20T23:15:46-08:00	
Gauff stunned by Badosa in Australian Open quarters; Zverev beats Paul	Paula Badosa, who almost quit tennis in 2024, has reached her first Grand Slam semifinal with a straight-sets win.	https://www.aljazeera.com/sports/2025/1/21/gauff-stunned-by-badosa-in-australian-open-quarters-zverev-beats-paul?traffic_source=rss	2025-01-20T22:56:03-08:00	
Trump critics say inauguration optics show oligarchy in action	In a break with tradition, Silicon Valley CEOs feature prominently at presidential inauguration.	https://www.aljazeera.com/news/2025/1/21/trump-critics-say-inauguration-optics-show-oligarchy-in-action?traffic_source=rss	2025-01-20T22:49:42-08:00	
Taliban announces release of two US citizens in prisoner swap deal	Taliban government in Afghanistan says US nationals released in exchange for Afghan serving life sentence in California.	https://www.aljazeera.com/news/2025/1/21/taliban-announces-release-of-two-us-citizens-in-prisoner-swap-deal?traffic_source=rss	2025-01-20T22:26:18-08:00	
South African humanitarian in pro-Israeli crosshairs over Palestine support	Imtiaz Sooliman, driving force behind prominent African aid agency Gift of the Givers, says his work is not political.	https://www.aljazeera.com/features/2025/1/21/south-africa-humanitarian-in-israel-crosshairs-over-palestine-support?traffic_source=rss	2025-01-20T22:21:41-08:00	
Fact check: Was Trump truthful in his inauguration day speeches?	Trump targeted the Panama Canal and undocumented migrants, repeating old claims and making new ones. We fact check them.	https://www.aljazeera.com/news/2025/1/21/fact-check-was-trump-truthful-in-his-inauguration-day-speeches?traffic_source=rss	2025-01-20T22:13:54-08:00	
Trump grants clemency to all charged over January 6 US Capitol attack	US president sweeps away years-long effort to punish those responsible for trying to overturn the 2020 election.	https://www.aljazeera.com/news/2025/1/21/trump-grants-clemency-to-all-charged-over-january-six-us-capitol-attack?traffic_source=rss	2025-01-20T20:35:41-08:00	
Russia-Ukraine war: List of key events – day 1,062	Here are the key developments on the 1,062nd day of Russia’s full-scale invasion of Ukraine.	https://www.aljazeera.com/news/2025/1/21/russia-ukraine-war-list-of-key-events-day-one-thousand-sixty-two?traffic_source=rss	2025-01-20T19:11:38-08:00	
Musk accused of giving Nazi salute during Trump inauguration celebrations	Anti-Defamation League defends tech billionaire for making 'awkward gesture in a moment of enthusiasm'.	https://www.aljazeera.com/economy/2025/1/21/musk-accused-of-giving-nazi-salute-during-trump-inauguration-celebrations?traffic_source=rss	2025-01-20T18:32:02-08:00	
Trump gives preview of next four years as president	It is only Donald Trump’s first day back in office as US president, but he has given a clear preview of what to expect.	https://www.aljazeera.com/program/newsfeed/2025/1/20/trump-gives-preview-of-next-four-years-as-president?traffic_source=rss	2025-01-20T15:19:47-08:00	
Supporters swarm US capital as Donald Trump sworn in for second term	Trump assumes office at an indoor inauguration ceremony, while supporters gather at the Capital One Arena to celebrate.	https://www.aljazeera.com/news/2025/1/20/supporters-swarm-us-capital-as-donald-trump-sworn-in-for-second-term?traffic_source=rss	2025-01-20T15:17:33-08:00	
Palestinians find dozens of bodies under rubble in Gaza	An estimated 10,000 bodies are believed to be buried under the debris covering Gaza after the devastating 15-month war.	https://www.aljazeera.com/program/newsfeed/2025/1/20/palestinians-find-dozens-of-bodies-under-rubble-in-gaza?traffic_source=rss	2025-01-20T15:15:25-08:00	
