Title	Description	Link	pubDate	Image
Chad say military foiled armed assault on presidential complex, 19 killed	The attack came just hours after China's Foreign Minister Wang Yi met with government officials in the capital N'Djamena	https://www.aljazeera.com/news/2025/1/9/chad-say-military-foiled-armed-assault-on-presidential-complex-19-killed?traffic_source=rss	2025-01-08T19:42:20-08:00	
Russia-Ukraine war: List of key events, day 1,050	Here are the key developments on the 1,050th day of Russia’s full-scale invasion of Ukraine.	https://www.aljazeera.com/news/2025/1/9/russia-ukraine-war-list-of-key-events-day-1050?traffic_source=rss	2025-01-08T18:52:07-08:00	
Brazil marks the anniversary of the January 8 attack on its capital	President Lula attended the event to denounce the 'coup' against him, led by supporters of Jair Bolsonaro.	https://www.aljazeera.com/news/2025/1/9/brazil-marks-the-anniversary-of-the-january-8-attack-on-its-capital?traffic_source=rss	2025-01-08T16:16:31-08:00	
As Trump talks up trade war with China, fears rise for rare earths supply	Beijing dominates the production of critical elements used in the production of electronics, vehicles and weapons.	https://www.aljazeera.com/economy/2025/1/9/as-trump-talks-up-trade-war-with-china-fears-rise-for-rare-earths-supply?traffic_source=rss	2025-01-08T16:08:15-08:00	
Barcelona defeat Athletic without Olmo to reach Spanish Super Cup final	Barcelona reach the final of the Spanish Super Cup with a 2-0 win against Athletic Bilbao in Saudi Arabia.	https://www.aljazeera.com/sports/2025/1/8/barcelona-reach-the-final-of-the-supercopa-de-espana-with-a-2-0-win-against-athletic-bilbao-in-saudi-arabia?traffic_source=rss	2025-01-08T13:55:36-08:00	
US Fed officials expected slower rate cuts in 2025, say December minutes	Minutes of the December meeting show a division on decision to cut rates and the 0.25 percent cut was 'close call'.	https://www.aljazeera.com/economy/2025/1/8/us-fed-officials-expected-slower-rate-cuts-in-2025-say-december-minutes?traffic_source=rss	2025-01-08T13:43:35-08:00	
How is Sudan’s conflict worsening the humanitarian crisis?	Half of Sudan's population faces acute food shortages.	https://www.aljazeera.com/program/inside-story/2025/1/8/how-is-sudans-conflict-worsening-the-humanitarian-crisis?traffic_source=rss	2025-01-08T12:49:33-08:00	
‘We must stand together’: European leaders warn Trump over Greenland threat	Trump's refusal to rule out using military force, economic coercion to seize island causes disquiet, calls for unity.	https://www.aljazeera.com/news/2025/1/8/we-must-stand-together-european-leaders-warn-trump-over-greenland-threat?traffic_source=rss	2025-01-08T12:42:20-08:00	
Russian strike kills 13 in Ukraine’s Zaporizhzhia	The attack came hours after Ukraine’s military struck a depot deep inside Russia.	https://www.aljazeera.com/news/2025/1/8/russian-strike-kills-13-in-ukraines-zaporizhzhia?traffic_source=rss	2025-01-08T12:10:54-08:00	
Industry groups sue over Biden ban on medical debt in credit reports	Consumer watchdog said new rule would lead to rising credit scores and an additional 22,000 low-cost mortgages annually.	https://www.aljazeera.com/economy/2025/1/8/industry-groups-sue-over-biden-ban-on-medical-debt-in-credit-reports?traffic_source=rss	2025-01-08T11:40:23-08:00	
Fourth wildfire erupts in Los Angeles as flames rapidly spread	Four separate wildfires have now been reported in the Los Angeles area.	https://www.aljazeera.com/program/newsfeed/2025/1/8/fourth-wildfire-erupts-in-los-angeles-as-flames-rapidly-spread?traffic_source=rss	2025-01-08T11:15:14-08:00	
Israeli attacks kill 46 in Gaza as ceasefire talks continue	Death toll rises as Gaza healthcare further collapses, deadly raids continue in occupied West Bank.	https://www.aljazeera.com/news/2025/1/8/israeli-attacks-kill-46-in-gaza-as-ceasefire-talks-continue?traffic_source=rss	2025-01-08T11:00:47-08:00	
US Justice Department to release only part of Trump investigation report	It's unlikely that the rest of the report, on the mishandling of classified documents, will be released under Trump.	https://www.aljazeera.com/news/2025/1/8/us-justice-department-to-release-only-part-of-trump-investigation-report?traffic_source=rss	2025-01-08T10:59:10-08:00	
Rebel leader tells Al Jazeera they’re ‘fighting for survival’ in DR Congo	M23 leader Bertrand Bisimwa has told Al Jazeera that the rebel group’s fight in eastern DR Congo is one for survival.	https://www.aljazeera.com/program/newsfeed/2025/1/8/rebel-leader-tells-al-jazeera-theyre-fighting-for-survival-in-dr-congo?traffic_source=rss	2025-01-08T10:06:38-08:00	
Spain’s Sanchez says Musk incites hatred, warns against fascism in Europe	Billionaire businessman Elon Musk has raised alarm across Europe with a string of attacks on the continent's leaders.	https://www.aljazeera.com/news/2025/1/8/spains-sanchez-says-musk-incites-hatred-warns-against-fascism-in-europe?traffic_source=rss	2025-01-08T08:57:41-08:00	
Wildfires, evacuations across California’s Los Angeles: What we know	With strong winds in California, the Palisades, Hurst, and Eaton fires to continue to blaze through Los Angeles.	https://www.aljazeera.com/news/2025/1/8/wildfires-evacuations-across-californias-los-angeles-what-we-know?traffic_source=rss	2025-01-08T08:34:04-08:00	
‘Forgotten’: How one Mexican city struggles against big industry for water	A Coca-Cola plant pumps millions of litres of water in San Cristóbal de las Casas. But locals say their faucets run dry.	https://www.aljazeera.com/news/longform/2025/1/8/forgotten-how-one-mexican-city-struggles-against-big-industry-for-water?traffic_source=rss	2025-01-08T08:33:06-08:00	
Trump asks US Supreme Court to halt sentencing in New York hush-money case	US president-elect set to be sentenced in New York criminal case 10 days before beginning second term.	https://www.aljazeera.com/news/2025/1/8/trump-asks-us-supreme-court-to-halt-sentencing-in-new-york-hush-money-case?traffic_source=rss	2025-01-08T07:18:34-08:00	
A disturbing pattern of repression is emerging in Europe	Authoritarianism is creeping into Europe under the guise of cracking down on pro-Palestinian activism.	https://www.aljazeera.com/opinions/2025/1/8/a-disturbing-pattern-of-repression-is-emerging-in-europe?traffic_source=rss	2025-01-08T06:39:40-08:00	
Trump hints at military moves in Middle East and Americas	Incoming US President Donald Trump said -all hell will break out- in the Middle East if Israeli captives aren't released	https://www.aljazeera.com/program/newsfeed/2025/1/8/trump-hints-at-military-moves-in-middle-east-and-americas?traffic_source=rss	2025-01-08T06:18:52-08:00	
Children killed by Israeli drone strike in occupied West Bank	Two children were among three Palestinians from the same family killed in an Israeli drone attack in Tammun.	https://www.aljazeera.com/program/newsfeed/2025/1/8/children-killed-by-israeli-drone-strike-in-occupied-west-bank?traffic_source=rss	2025-01-08T05:56:57-08:00	
Ukraine says ready to replace Hungary in EU and NATO	Kyiv says it will fill in should Budapest elect to join Russian-led blocs instead.	https://www.aljazeera.com/news/2025/1/8/ukraine-says-ready-to-replace-hungary-in-eu-and-nato?traffic_source=rss	2025-01-08T05:41:51-08:00	
Why has the US accused Sudanese militias of genocide – but not Israel?	The US says forces active within Sudan are guilty of many of the same war crimes that Israel is accused of.	https://www.aljazeera.com/news/2025/1/8/why-has-the-us-accused-sudanese-militias-of-genocide-but-not-israel?traffic_source=rss	2025-01-08T05:11:58-08:00	
Fakhar Zaman confident of returning for Pakistan at ICC Champions Trophy	The opener aims for comeback as the defending champions host their first ICC event in 29 years.	https://www.aljazeera.com/sports/2025/1/8/fakhar-zaman-confident-of-returning-for-pakistan-at-icc-champions-trophy?traffic_source=rss	2025-01-08T05:03:12-08:00	
Iran releases Italian journalist Cecilia Sala from jail	Tehran denies Sala's December 19 detainment was linked to an Iranian businessman's arrest in Italy on a US warrant.	https://www.aljazeera.com/news/2025/1/8/iran-releases-italian-journalist-cecilia-sala-from-jail?traffic_source=rss	2025-01-08T04:39:23-08:00	
Alois Brunner, the Nazi ‘butcher’ who trained Syrian security	Brunner hid in Damascus for decades and is said to have taught torture tactics to Hafez al-Assad’s intelligence service.	https://www.aljazeera.com/gallery/2025/1/8/alois-brunner-the-nazi-butcher-who-trained-syrian-security?traffic_source=rss	2025-01-08T04:17:16-08:00	
Syria’s stolen lives	Former Syrian detainee Bassam Ezzedine is on a mission to help prisoners of the fallen regime to find their families.	https://www.aljazeera.com/program/al-jazeera-close-up/2025/1/8/syrias-stolen-lives?traffic_source=rss	2025-01-08T04:15:36-08:00	
Former Assad military officers reconcile with Syria’s new authorities	Former Syrian military officers who worked under the Assad regime are registering with the new administration.	https://www.aljazeera.com/program/newsfeed/2025/1/8/former-assad-military-officers-reconcile-with-syrias-new-authorities?traffic_source=rss	2025-01-08T03:45:09-08:00	
Can Syria’s new leaders fix the broken economy?	After almost 14 years of civil war, Syria's economy is in ruins.	https://www.aljazeera.com/program/counting-the-cost/2025/1/8/can-syrias-new-leaders-fix-the-broken-economy?traffic_source=rss	2025-01-08T03:44:32-08:00	
Strong winds drive wildfires across Los Angeles	Tens of thousands are evacuated as wildfires spread rapidly, causing panic and traffic jams.	https://www.aljazeera.com/gallery/2025/1/8/strong-winds-drive-wildfires-across-los-angeles?traffic_source=rss	2025-01-08T03:30:21-08:00	
Sudan’s military pushes back rebels in second city of Omdurman	Army takes control of RSF territories in Mansoura, Murabaat and Elfitihab, and seizes weapons and ammunition depot.	https://www.aljazeera.com/news/2025/1/8/sudans-military-pushes-back-rebels-in-second-city-of-omdurman?traffic_source=rss	2025-01-08T02:38:44-08:00	
NATO, Gaza and Greenland: Key takeaways from Trump’s news conference	Trump's grandstanding covered Ukraine joining NATO, Israel's war on Gaza, and Greenland.	https://www.aljazeera.com/news/2025/1/8/nato-gaza-and-greenland-key-takeaways-from-trumps-news-conference?traffic_source=rss	2025-01-08T02:30:13-08:00	
Thousands flee as winds drive wildfires into Los Angeles	Some frightened residents were forced to abandon their cars and flee on foot from rapidly growing conflagration.	https://www.aljazeera.com/news/2025/1/8/thousands-flee-as-winds-drive-wildfires-into-los-angeles?traffic_source=rss	2025-01-08T01:53:15-08:00	
France coach Didier Deschamps says he’ll leave after FIFA World Cup 2026	Deschamps, who led France to the FIFA World Cup title in 2018, will step away after the 2026 edition in North America.	https://www.aljazeera.com/sports/2025/1/8/france-coach-didier-deschamps-says-hell-leave-after-fifa-world-cup-2026?traffic_source=rss	2025-01-08T01:45:37-08:00	
Thai police hunt hitman for shooting of Cambodian opposition figure	Bangkok police chief says initial investigation suggests a gunman was hired to carry out Tuesday's shooting.	https://www.aljazeera.com/news/2025/1/8/thai-police-hunt-hitman-for-shooting-of-cambodian-opposition-figure?traffic_source=rss	2025-01-08T01:03:30-08:00	
EU blasts Russia for weaponising gas in Moldova	Moscow blames Ukraine and Moldova for halting supplies; Chisinau suspects Russia seeks to influence upcoming election.	https://www.aljazeera.com/news/2025/1/8/eu-blasts-russia-for-weaponising-gas-in-moldova?traffic_source=rss	2025-01-08T00:30:31-08:00	
Russia gained 4,000sq km of Ukraine in 2024. How many soldiers did it lose?	Verifying casualty figures for soldier in the Russia-Ukraine war is difficult, as experts call it 'a war of narratives'.	https://www.aljazeera.com/news/2025/1/8/russia-gained-4000sq-km-of-ukraine-in-2024-how-many-soldiers-did-it-lose?traffic_source=rss	2025-01-08T00:05:05-08:00	
What is HMPV, the respiratory virus surging in China?	HMPV infections are spreading in China while cases of flu-like disease have also been found in India and the UK.	https://www.aljazeera.com/news/2025/1/8/what-is-hmpv-the-respiratory-virus-surging-in-china?traffic_source=rss	2025-01-07T23:54:24-08:00	
Even Salah would struggle for goals at Spurs: Tottenham’s Postecoglou	Tottenham manager berates his team's recent slump in form ahead of their League Cup semifinal against Liverpool.	https://www.aljazeera.com/sports/2025/1/8/even-salah-would-struggle-for-goals-at-spurs-tottenhams-postecoglou?traffic_source=rss	2025-01-07T23:54:12-08:00	
Rebuilding Syria’s economy: Can stability return after war?	Syria's new leadership faces an economy devastated by war and sanctions, with inflation and a decimated currency.	https://www.aljazeera.com/economy/2025/1/8/rebuilding-syrias-economy-can-stability-return-after-war?traffic_source=rss	2025-01-07T23:52:52-08:00	
Turkiye threatens military action against Kurdish forces in Syria	Foreign Minister Fidan threatens military action against PKK-linked YPG group if they fail to meet Ankara's demands.	https://www.aljazeera.com/news/2025/1/8/turkiye-threatens-military-action-against-kurdish-forces-in-syria?traffic_source=rss	2025-01-07T23:14:49-08:00	
Light aircraft crashes at tourist hotspot in Australia, killing 3	Authorities say they are investigating the cause of the crash off island located near Perth, Western Australia.	https://www.aljazeera.com/news/2025/1/8/light-aircraft-crashes-at-tourist-hotspot-in-australia-killing-3?traffic_source=rss	2025-01-07T22:41:02-08:00	
With Trump looming, Pakistan braces for foreign policy challenges in 2025	Analysts predict a tough year, as Islamabad prepares for more US belligerence towards China, the closest Pakistan ally.	https://www.aljazeera.com/news/2025/1/8/with-trump-looming-pakistan-braces-for-foreign-policy-challenges-in-2025?traffic_source=rss	2025-01-07T21:08:08-08:00	
Venezuela’s Maduro says US nationals among group of ‘mercenaries’ detained	President Maduro said the group included mercenaries and 'hit men', describing two US detainees as 'very high level'.	https://www.aljazeera.com/news/2025/1/8/venezuelas-maduro-says-us-nationals-among-group-of-mercenaries-detained?traffic_source=rss	2025-01-07T21:05:34-08:00	
Russia-Ukraine war: List of key events, day 1,049	Here are the key developments on the 1,049th day of Russia’s full-scale invasion of Ukraine.	https://www.aljazeera.com/news/2025/1/8/russia-ukraine-war-list-of-key-events-day-1049?traffic_source=rss	2025-01-07T20:14:47-08:00	
US bans medical debt from credit reports as Biden nears exit	Consumer Financial Protection Bureau says change will strike $49bn in medical debt from credit reports.	https://www.aljazeera.com/economy/2025/1/8/us-bans-medical-debt-from-credit-reports-as-biden-nears-exit?traffic_source=rss	2025-01-07T18:54:00-08:00	
Former Cambodian opposition MP shot dead in Bangkok ‘assassination’	Lim Kimya, 74, had refused to flee Cambodia even after former PM Hun Sen threatened to make opposition MPs lives 'hell'.	https://www.aljazeera.com/news/2025/1/8/former-cambodian-opposition-mp-shot-dead-in-bangkok-assassination?traffic_source=rss	2025-01-07T18:51:02-08:00	
‘Massacres’: Women, children killed as Israel bombs Gaza’s ‘safe zone’	Al Jazeera's correspondent says fear dominates in Gaza as Israeli attacks intensify, targeting 'humanitarian safe zone'.	https://www.aljazeera.com/news/2025/1/8/massacres-women-children-killed-as-israel-bombs-gazas-safe-zone?traffic_source=rss	2025-01-07T17:47:02-08:00	
China’s millionaires eye the exit as economic storm clouds gather	Some 15,200 Chinese millionaires were expected to relocate in 2024, according to Henley &amp; Partners.	https://www.aljazeera.com/economy/2025/1/8/chinese-millionaires-eye-the-exit-as-economic-storm-clouds-gather?traffic_source=rss	2025-01-07T17:06:10-08:00	
Venezuelan opposition candidate claims son-in-law has been kidnapped	Edmundo Gonzalez, who competed against Nicolas Maduro in July elections, says masked men abducted son-in-law in Caracas.	https://www.aljazeera.com/news/2025/1/7/venezuelan-opposition-candidate-claims-son-in-law-has-been-kidnapped?traffic_source=rss	2025-01-07T12:44:36-08:00	
‘Hell will break loose’: Trump hints at military moves in Mideast, Americas	Trump does not rule out US military force to retake Panama Canal, doubles down on Gaza threats in broad news conference.	https://www.aljazeera.com/news/2025/1/7/hell-will-break-loose-trump-hints-at-military-moves-in-mideast-americas?traffic_source=rss	2025-01-07T12:41:23-08:00	
Will Austria’s Freedom Party form a coalition and create stable government?	Herbert Kickle first far-right leader since World War II to be invited to form a government.	https://www.aljazeera.com/program/inside-story/2025/1/7/will-austrias-freedom-party-form-a-coalition-and-create-stable-government?traffic_source=rss	2025-01-07T12:26:20-08:00	
Trump previews -hell- in Middle East if Israel-Hamas deal not reached	Officials with the Biden and Trump administrations say Israel-Hamas negotiations are on the verge of a deal.	https://www.aljazeera.com/program/newsfeed/2025/1/7/trump-previews-hell-in-middle-east-if-israel-hamas-deal-not-reached?traffic_source=rss	2025-01-07T11:56:07-08:00	
US judge temporarily blocks release of Trump investigations report	Trump has denounced the investigations against him as politically motivated and the special counsel report as 'fake'.	https://www.aljazeera.com/news/2025/1/7/us-judge-temporarily-blocks-release-of-trump-investigations-report?traffic_source=rss	2025-01-07T11:28:25-08:00	
Lebanon approves extradition of Egyptian activist al-Qaradawi to UAE	Amnesty International warns Abdul Rahman al-Qaradawi could be at risk of human rights violations if extradited to UAE.	https://www.aljazeera.com/news/2025/1/7/lebanon-approves-extradition-of-egyptian-activist-al-qaradawi-to-uae?traffic_source=rss	2025-01-07T11:18:35-08:00	
International flights resume at Damascus airport	Syrians rejoice as they return home onboard the first international flight to Damascus in 13 years.	https://www.aljazeera.com/program/newsfeed/2025/1/7/international-flights-resume-at-damascus-airport?traffic_source=rss	2025-01-07T11:06:16-08:00	
Hope for a new Syria	Journalist Nour Qormosh shares his experience covering the days before and after the fall of Bashar al-Assad.	https://www.aljazeera.com/program/between-us/2025/1/7/hope-for-a-new-syria-2?traffic_source=rss	2025-01-07T10:40:16-08:00	
France’s far-right Jean-Marie Le Pen dies at 96	Jean-Marie Le Pen was instrumental in shaping French far-right politics, even though he never won the presidency.	https://www.aljazeera.com/program/newsfeed/2025/1/7/frances-far-right-jean-marie-le-pen-dies-at-96?traffic_source=rss	2025-01-07T10:32:46-08:00	
US says Sudan’s RSF committed genocide, announces sanctions on leaders	US Secretary of State Antony Blinken says US committed to 'holding accountable those responsible for these atrocities'.	https://www.aljazeera.com/news/2025/1/7/us-says-sudans-rsf-committed-genocide-announces-sanctions-on-leaders?traffic_source=rss	2025-01-07T09:52:03-08:00	
Social media giant Meta scraps fact-checking for ‘community notes’	Meta, which owns Facebook and Instagram, says allowing fact-checkers to assess content 'became a tool to censor'.	https://www.aljazeera.com/news/2025/1/7/social-media-giant-meta-scraps-fact-checking-for-community-notes?traffic_source=rss	2025-01-07T09:08:23-08:00	
First international flight since al-Assad’s removal lands in Syria	Qatar Airways flight lands at Damascus International Airport, carrying nationals returning after years away.	https://www.aljazeera.com/news/2025/1/7/first-international-flight-since-al-assads-removal-lands-in-syria?traffic_source=rss	2025-01-07T09:01:09-08:00	
US authorities seek to identify bodies found in JetBlue wheel well	Workers had found the bodies during a routine inspection after the flight landed in Florida from New York.	https://www.aljazeera.com/news/2025/1/7/us-authorities-seek-to-identify-bodies-found-in-jetblue-wheel-well?traffic_source=rss	2025-01-07T08:46:20-08:00	
Danish PM says Greenland ‘not for sale’ as Donald Trump Jr visits island	Before his son's 'private' visit, President-elect Donald Trump again says he wants Greenland to 'become part of' US.	https://www.aljazeera.com/news/2025/1/7/danish-pm-says-gr-donald-trump-jr?traffic_source=rss	2025-01-07T08:23:30-08:00	
John Mahama sworn in as Ghana’s president, promises to ‘reset’ the country	With around 20 African leaders in attendance, the 66-year-old is sworn in as Ghana's president for third time.	https://www.aljazeera.com/news/2025/1/7/john-mahama-sworn-in-as-ghanas-president-promises-to-reset-the-country?traffic_source=rss	2025-01-07T08:09:51-08:00	
Paris marks ten years since Charlie Hebdo, Jewish supermarket attacks	France commemorated the tenth anniversary of attacks against Charlie Hebdo and a Jewish supermarket.	https://www.aljazeera.com/program/newsfeed/2025/1/7/paris-marks-ten-years-since-charlie-hebdo-jewish-supermarket-attacks?traffic_source=rss	2025-01-07T07:31:23-08:00	
Who will replace Trudeau as Canada’s Liberal party leader?	With Trudeau's nine-year stint as prime minister ending, several politicians are frontrunners to take over his role.	https://www.aljazeera.com/news/2025/1/7/who-will-replace-trudeau-as-canadas-liberal-party-leader?traffic_source=rss	2025-01-07T07:31:14-08:00	
French far-right leader Jean-Marie Le Pen dies aged 96	Co-founder of the National Front led the party for decades and was known for fiery rhetoric against immigration.	https://www.aljazeera.com/news/2025/1/7/french-far-right-leader-jean-marie-le-pen-dies-aged-96?traffic_source=rss	2025-01-07T06:58:18-08:00	
At least 126 killed after strong earthquake hits China’s Tibet	Rescue efforts are under way after an earthquake hits Tibet, with tremors felt as far away as Nepal, India and Bhutan.	https://www.aljazeera.com/gallery/2025/1/7/at-least-126-killed-after-strong-earthquake-hits-chinas-tibet?traffic_source=rss	2025-01-07T06:56:39-08:00	
Last Days of the Bibby Stockholm: Life aboard the UK’s migrant barge	Living on a UK migrant barge, an asylum seeker battles depression through running while awaiting an asylum decision.	https://www.aljazeera.com/program/witness/2025/1/7/last-days-of-the-bibby-stockholm-life-aboard-the-uks-migrant-barge?traffic_source=rss	2025-01-07T06:00:00-08:00	
The secret to a balanced diet? Better roads, say scientists	A new study challenges the conventional wisdom that crop diversity alone addresses nutritional deficiencies.	https://www.aljazeera.com/news/2025/1/7/the-secret-to-a-balanced-diet-better-roads-say-scientists?traffic_source=rss	2025-01-07T05:51:08-08:00	
Gang violence killed more than 5,600 people in Haiti in 2024: UN	Violent gangs control most of the Caribbean country's capital, Port-au-Prince.	https://www.aljazeera.com/news/2025/1/7/gang-violence-killed-more-than-5600-people-in-haiti-in-2024-un?traffic_source=rss	2025-01-07T05:19:35-08:00	
South Korean court extends arrest warrant for impeached Yoon	The impeached former president has refused questioning three times since his bungled December 3 martial law decree.	https://www.aljazeera.com/news/2025/1/7/south-korean-court-extends-arrest-warrant-for-impeached-yoon?traffic_source=rss	2025-01-07T05:05:52-08:00	
Israel extends closure of Al Jazeera office in occupied West Bank	The move follows a raid last September by Israeli forces that shut Al Jazeera's Ramallah office for 45 days.	https://www.aljazeera.com/news/2025/1/7/israel-extends-closure-of-al-jazeera-office-in-occupied-west-bank?traffic_source=rss	2025-01-07T04:41:42-08:00	
As battles against Russia intensify, Ukraine’s manpower struggles worsen	Ukrainian soldiers say Russia is waging fierce battles in the east while they attempt a renewed offensive in Kursk.	https://www.aljazeera.com/news/2025/1/7/as-battles-against-russia-intensify-ukraines-manpower-struggles-worsen?traffic_source=rss	2025-01-07T04:40:13-08:00	
‘It’s the only way’: Migrants, army face-off along S Africa-Zimbabwe border	South Africa's military has enhanced border operations along the Limpopo River to halt smugglers and illegal crossings.	https://www.aljazeera.com/features/2025/1/7/its-the-only-way-migrants-army-face-off-along-s-africa-zimbabwe-border?traffic_source=rss	2025-01-07T04:26:23-08:00	
Good riddance, Justin Trudeau	The outgoing Canadian prime minister was a 'progressive' fraud and a liar. History will judge him harshly.	https://www.aljazeera.com/opinions/2025/1/7/good-riddance-justin-trudeau?traffic_source=rss	2025-01-07T04:12:01-08:00	
Carnival season offers New Orleans hope following attack	Hundreds take part in a parade honouring the life of Joan of Arc in the heart of the historic French Quarter.	https://www.aljazeera.com/gallery/2025/1/7/carnival-season-offers-new-orleans-hope-following-attack?traffic_source=rss	2025-01-07T04:09:25-08:00	
Israeli settler attacks against Palestinians in the occupied West Bank	Israeli settlers have carried out a series of arson attacks across the occupied West Bank.	https://www.aljazeera.com/program/newsfeed/2025/1/7/israeli-settler-attacks-against-palestinians-in-the-occupied-west-bank?traffic_source=rss	2025-01-07T03:41:54-08:00	
US diverting military funds from Egypt to Lebanon, report claims	The White House is to send $95m to Lebanon, citing regional security, while eyeing human rights concerns in Egypt.	https://www.aljazeera.com/news/2025/1/7/us-diverting-military-funds-from-egypt-to-lebanon-report-claims?traffic_source=rss	2025-01-07T03:11:11-08:00	
