Title	Description	Link	pubDate	Image
Lukashenko: Before 2025 election, ‘still afraid of the people’	As Belarus votes amid repression, what drives Alexander Lukashenko, the president likely to secure a seventh term.	https://www.aljazeera.com/features/2025/1/25/lukashenko-ahead-of-2025-election-still-afraid-of-the-people?traffic_source=rss	2025-01-25T02:06:04-08:00	
Hamas releases four Israeli soldiers held in Gaza as part of ceasefire deal	Israel expected to release dozens of Palestinians held in Israeli jails as part of the ceasefire deal.	https://www.aljazeera.com/news/2025/1/25/hamas-releases-four-israeli-soldiers-held-in-gaza?traffic_source=rss	2025-01-25T01:10:20-08:00	
Protests in Slovakia after Prime Minister Fico tilts towards Russia	Massive turnout in nationwide rallies, as Fico brandishes intel report alleging 'coup d’etat' in league with foreigners.	https://www.aljazeera.com/news/2025/1/25/slovaks-take-to-streets-as-pm-fico-tilts-towards-russia?traffic_source=rss	2025-01-25T00:32:35-08:00	
Spain plans 100% house tax on foreigners: Will it fix the housing crisis?	Socialist PM Sanchez announces several measures, including 100 percent tax on foreigners, to tackle the housing crisis.	https://www.aljazeera.com/news/2025/1/25/spain-plans-100-house-tax-on-foreigners-will-it-fix-the-housing-crisis?traffic_source=rss	2025-01-25T00:26:18-08:00	
US hits record arms sales in 2024 driven by Ukraine demand	US arms export growth was driven by countries seeking to replenish weapons stocks that were donated to Ukraine.	https://www.aljazeera.com/news/2025/1/25/us-hits-record-arms-sales-in-2024-driven-by-ukraine-demand?traffic_source=rss	2025-01-24T23:58:23-08:00	
Philippines stops research survey in disputed sea amid China’s ‘harassment’	Several Chinese coastguard vessels accused of making 'aggressive manoeuvres' towards Philippine fisheries boats.	https://www.aljazeera.com/news/2025/1/25/philippines-stops-research-survey-in-disputed-sea-amid-chinas?traffic_source=rss	2025-01-24T23:17:58-08:00	
Between bombs and books: The lasting impact of war on Lebanese students	A young man from Beirut's Dahiyeh suburbs, another from a south Lebanon village - both students marked by war forever.	https://www.aljazeera.com/features/2025/1/25/between-bombs-and-books-the-lasting-impact-of-war-on-lebanese-students?traffic_source=rss	2025-01-24T22:55:43-08:00	
Pete Hegseth confirmed as US defence chief in tiebreaker Senate vote	Hegseth's nomination had been rocked by allegations of alcohol abuse and sexual misconduct.	https://www.aljazeera.com/news/2025/1/25/pete-hegseth-confirmed-as-us-defence-chief-in-tiebreaker-senate-vote?traffic_source=rss	2025-01-24T22:45:51-08:00	
Russia-Ukraine war: List of key events – day 1,066	Here are the key developments on the 1,066th day of Russia’s full-scale invasion of Ukraine.	https://www.aljazeera.com/news/2025/1/25/russia-ukraine-war-list-of-key-events-day-6?traffic_source=rss	2025-01-24T19:59:50-08:00	
US suspends new funds for aid programmes, excepting Israel and Egypt	Trump administration freezes new funding for anti-HIV programme and other health services, excepts key food programmes.	https://www.aljazeera.com/news/2025/1/25/us-suspends-new-funds-for-aid-programmes-excepting-israel-and-egypt?traffic_source=rss	2025-01-24T16:21:58-08:00	
‘Fear is the point’: Immigrant rights groups brace for fight against Trump	Advocates say Trump entered office for his second term more prepared to implement hardline immigration policies.	https://www.aljazeera.com/news/2025/1/24/fear-is-the-point-immigrant-rights-groups-brace-for-fight-against-trump?traffic_source=rss	2025-01-24T14:37:43-08:00	
US President Trump threatens to abolish FEMA during tour of North Carolina	After visiting hurricane-ravaged North Carolina, the Republican leader travelled to California to inspect fire response.	https://www.aljazeera.com/gallery/2025/1/24/us-president-trump-threatens-to-abolish-fema-during-tour-of-north-carolina?traffic_source=rss	2025-01-24T14:13:12-08:00	
Trump decree paves way for ‘Muslim ban’, targeting pro-Palestine students	Newly signed executive order has 'broader implications' than travel ban Trump imposed in his first term, experts say.	https://www.aljazeera.com/news/2025/1/24/trump-decree-paves-way-for-muslim-ban-targeting-pro-palestine-students?traffic_source=rss	2025-01-24T14:04:52-08:00	
Target becomes latest US firm to end DEI initiatives	The move comes after US President Trump ended DEI hiring in gov't jobs and encouraged the private sector to do the same.	https://www.aljazeera.com/economy/2025/1/24/target-becomes-latest-us-firm-to-end-dei-initiatives?traffic_source=rss	2025-01-24T13:24:07-08:00	
Israeli drone attack kills two in expanding occupied West Bank operation	Israeli attack on vehicle close to Qabatiya comes during ongoing assault on nearby Jenin, which has displaced thousands.	https://www.aljazeera.com/news/2025/1/24/israeli-drone-strike-kills-two-expanding-occupied-west-bank-operation?traffic_source=rss	2025-01-24T12:24:18-08:00	
Who are the female Israeli soldiers being released by Hamas?	A second round of prisoners are to be exchanged between Hamas and Israel on Saturday as part of a ceasefire.	https://www.aljazeera.com/news/2025/1/24/who-are-the-female-israeli-soldiers-being-released-by-hamas?traffic_source=rss	2025-01-24T10:56:56-08:00	
Palestinian family returns to destroyed home in Gaza	The Israel-Hamas ceasefire was meant to mark an end to the misery of displacement for Palestinians...	https://www.aljazeera.com/program/newsfeed/2025/1/24/palestinian-family-returns-to-destroyed-home-in-gaza?traffic_source=rss	2025-01-24T10:41:49-08:00	
US judge bans some January 6 rioters from capital without court permission	Order comes days after President Trump pardoned more than 1,500 people sentenced in relation to the January 6 attack.	https://www.aljazeera.com/news/2025/1/24/us-judge-bans-some-january-6-rioters-from-capital-without-court-permission?traffic_source=rss	2025-01-24T10:02:11-08:00	
Military governor of DRC’s North Kivu province killed in M23 rebel assault	Local authorities say Major General Peter Cirimwami dies after being wounded on the front lines.	https://www.aljazeera.com/news/2025/1/24/military-governor-drc-north-kivu-province-killed-m23-rebel-offensive?traffic_source=rss	2025-01-24T09:51:13-08:00	
Fire at major Russian oil refinery after Ukrainian drone attack	People were filmed fleeing a fire at a Russian oil refinery in Ryazan after a Ukrainian drone attack.	https://www.aljazeera.com/program/newsfeed/2025/1/24/fire-at-major-russian-oil-refinery-after-ukrainian-drone-attack?traffic_source=rss	2025-01-24T09:48:57-08:00	
Israeli bulldozer filmed destroying roadway in occupied West Bank	An Israeli bulldozer was filmed ripping up parts of a road in the occupied West Bank town of al-Yamoun.	https://www.aljazeera.com/program/newsfeed/2025/1/24/israeli-bulldozer-filmed-destroying-roadway-in-occupied-west-bank?traffic_source=rss	2025-01-24T09:40:48-08:00	
How is education in Gaza defying Israel’s war?	Teachers in tents keep the flame of learning burning brightly.	https://www.aljazeera.com/program/inside-story/2025/1/24/how-is-education-in-gaza-defying-israels-war?traffic_source=rss	2025-01-24T09:30:42-08:00	
Australian Open women’s singles final preview: How to watch, follow, stream	Aryna Sabalenka of Belarus and Madison Keys of the US are set for epic women's singles final in Melbourne on Saturday.	https://www.aljazeera.com/sports/2025/1/24/australian-open-womens-singles-final-preview-how-to-watch-stream-follow-sabalenka-keys?traffic_source=rss	2025-01-24T09:22:38-08:00	
Hamas names four Israeli captives to be released in latest ceasefire swap	Israel is expected to release 200 Palestinian prisoners in exchange for four female soldiers slated for Saturday.	https://www.aljazeera.com/news/2025/1/24/hamas-names-four-israeli-captives-to-be-released-in-latest-ceasefire-swap?traffic_source=rss	2025-01-24T08:29:21-08:00	
‘Less than slaves’: The Palestinians detained by Israel despite ceasefire	Israel has arrested more Palestinians than it has released as a result of its ceasefire deal with Hamas.	https://www.aljazeera.com/features/2025/1/24/less-than-slaves-the-palestinians-detained-by-israel-despite-ceasefire?traffic_source=rss	2025-01-24T08:29:00-08:00	
Colombia’s Petro decrees emergency powers amid deadly border area violence	Violence between armed groups in the Catatumbo region has displaced more than 32,000 people, rights groups estimate.	https://www.aljazeera.com/news/2025/1/24/colombias-petro-decrees-emergency-powers-amid-deadly-border-area-violence?traffic_source=rss	2025-01-24T08:13:44-08:00	
Cradock Four: Why apartheid victims are suing South Africa’s government	Families of the murdered activists are among two dozen suing government for failure to deliver justice for past crimes.	https://www.aljazeera.com/news/2025/1/24/cradock-four-why-apartheid-victims-are-suing-south-africas-government?traffic_source=rss	2025-01-24T07:58:04-08:00	
Arsenal’s Arteta eager to bolster attacking options in January window	Manager says the club are looking for a new striker to bolster their Premier League title bid.	https://www.aljazeera.com/sports/2025/1/24/arsenal-boss-arteta-keen-to-bolster-attacking-options-in-january-window?traffic_source=rss	2025-01-24T07:26:30-08:00	
Why is Trump releasing the last files on JFK, RFL, MLK assassinations?	Donald Trump wants to declassify remaining documents related to the assassination of John F Kennedy, RFK and MLK.	https://www.aljazeera.com/news/2025/1/24/why-is-trump-releasing-the-last-files-on-jfk-rfl-mlk-assassinations?traffic_source=rss	2025-01-24T07:13:32-08:00	
Man City vs Chelsea: EPL preview – kickoff time, how to follow, stream	Pep Guardiola's Manchester City entertain Chelsea on Saturday in the Premier League before facing Club Brugge in Europe.	https://www.aljazeera.com/sports/2025/1/24/man-city-vs-chelsea-epl-preview-kickoff-time-how-to-follow-stream?traffic_source=rss	2025-01-24T07:00:02-08:00	
UN suspends trips into Houthi-held areas of Yemen after more staff detained	The Iran-backed group also detains people associated with the US embassy in Sanaa and aid groups.	https://www.aljazeera.com/news/2025/1/24/un-suspends-trips-into-houthi-held-areas-of-yemen-after-more-staff-detained?traffic_source=rss	2025-01-24T06:39:33-08:00	
Guerrilla violence sparks displacement crisis in northeast Colombia	Thousands have escaped a sudden outbreak of drug-related violence between two armed groups in northeastern Colombia.	https://www.aljazeera.com/program/newsfeed/2025/1/24/guerrilla-violence-sparks-displacement-crisis-in-northeast-colombia?traffic_source=rss	2025-01-24T06:35:58-08:00	
UN says Israel using ‘unlawful lethal force’ in raids on Jenin	Israeli forces block all four main entrances to the occupied West Bank city as the deadly raids enter a fourth day.	https://www.aljazeera.com/gallery/2025/1/24/photos-un-says-israel-using-unlawful-lethal-force-in-raids-on-jenin?traffic_source=rss	2025-01-24T05:59:38-08:00	
Ruined Gaza mosque hosts first Friday prayers since ceasefire	Worshippers gathered in a ruined Gaza mosque for their first Friday prayers since the Israel-Hamas ceasefire deal.	https://www.aljazeera.com/program/newsfeed/2025/1/24/ruined-gaza-mosque-hosts-first-friday-prayers-since-ceasefire?traffic_source=rss	2025-01-24T05:38:41-08:00	
Afghanistan: The price of peace	The disastrous 20-year US mission in Afghanistan which ended in failure, the limits of power and long-term scars of war.	https://www.aljazeera.com/program/featured-documentaries/2025/1/24/afghanistan-the-price-of-peace?traffic_source=rss	2025-01-24T05:30:00-08:00	
Canada’s Liberal leadership race: Who’s running to replace Justin Trudeau?	Former Finance Minister Chrystia Freeland and ex-Bank of Canada governor Mark Carney are frontrunners, experts say.	https://www.aljazeera.com/news/2025/1/24/canadas-liberal-leadership-race-whos-running-to-replace-justin-trudeau?traffic_source=rss	2025-01-24T05:20:00-08:00	
Israel targets southern Lebanon; Netanyahu says army to not leave by Sunday	Under a ceasefire deal with Hezbollah, Israeli forces were to withdraw from Lebanon by January 26.	https://www.aljazeera.com/news/2025/1/24/israel-steps-up-attacks-in-lebanons-south-as-ceasefire-deadline-looms?traffic_source=rss	2025-01-24T04:57:06-08:00	
Inside the Lebanese border town Israeli forces turned to ruins	All signs of life have disappeared from this ruined Lebanese town near the border with Israel.	https://www.aljazeera.com/program/newsfeed/2025/1/24/inside-the-lebanese-border-town-israeli-forces-turned-to-ruins?traffic_source=rss	2025-01-24T04:46:40-08:00	
Pakistan’s political deadlock deepens as PTI withdraws from negotiations	Analysts expect ex-PM Imran Khan's party to return to street agitations, but some experts believe it's making a mistake.	https://www.aljazeera.com/news/2025/1/24/pakistans-political-deadlock-deepens-as-pti-withdraws-from-negotiations?traffic_source=rss	2025-01-24T04:45:43-08:00	
Australian Open: Sinner sets up Zverev final after trouncing Shelton	World number one Jannick Sinner overcomes American Ben Shelton in straight sets to reach Australian Open final.	https://www.aljazeera.com/sports/2025/1/24/australian-open-sinner-sets-up-zverev-final-after-trouncing-shelton?traffic_source=rss	2025-01-24T04:41:43-08:00	
Fact check: Can Trump really erase Biden’s ‘health legacy’?	Trump's early health moves suggest he aims to dismantle Biden's drug cost and insurance expansions. What's next?	https://www.aljazeera.com/news/2025/1/24/fact-check-can-trump-really-erase-bidens-health-legacy?traffic_source=rss	2025-01-24T04:22:57-08:00	
UK’s ‘100-year partnership’ with Ukraine is a meaningless political stunt	The century-long commitment will not do much to counter the shift in Western policy towards Ukraine under Trump.	https://www.aljazeera.com/opinions/2025/1/24/uks-100-year-partnership-with-ukraine-is-a-meaningless-political-stunt?traffic_source=rss	2025-01-24T03:52:57-08:00	
‘This guy is dangerous’: British Pakistanis fear Musk is stoking racism	Some fear collective punishment could be a consequence of the billionaire's relentless posts on child sex abuse cases.	https://www.aljazeera.com/news/2025/1/24/this-guy-is-dangerous-british-pakistanis-fear-musk-is-stoking?traffic_source=rss	2025-01-24T03:39:33-08:00	
Development done right: Why Africa needs more than good intentions	Leaders in Davos should focus on taking tangible steps to accelerate Africa's inclusive growth agenda.	https://www.aljazeera.com/opinions/2025/1/24/development-done-right-why-africa-needs-more-than-good-intentions?traffic_source=rss	2025-01-24T02:11:57-08:00	
Trump latest: JFK killing files released, birthright citizenship bar halted	We also delve into the latest from Davos, cryptocurrency, and other executive orders.	https://www.aljazeera.com/news/2025/1/24/trump-latest-jfk-killing-files-released-birthright-citizenship-bar-halted?traffic_source=rss	2025-01-24T01:41:55-08:00	
Israeli forces ‘block entrances to Jenin’ as deadly raid enters fourth day	In addition to Jenin governorate, Israeli forces have been stepping up their operation across the occupied West Bank.	https://www.aljazeera.com/news/2025/1/24/israeli-forces-block-entrances-to-jenin-as-deadly-raid-enters-fourth-day?traffic_source=rss	2025-01-24T01:34:06-08:00	
Progress made as firefighters battle new blaze near Los Angeles	Massive response under way as 4,000 firefighters combat blaze near Los Angeles.	https://www.aljazeera.com/gallery/2025/1/24/progress-made-as-firefighters-battle-new-blaze-near-los-angeles?traffic_source=rss	2025-01-24T01:19:24-08:00	
Australian Open: Injured Djokovic booed off but targets more Grand Slams	Serbia's Novak Djokovic will seek a record 25th Grand Slam title despite retiring injured from the Australian Open.	https://www.aljazeera.com/sports/2025/1/24/defiant-djokovic-booed-off-in-australia-by-still-targeting-grand-slam-wins?traffic_source=rss	2025-01-24T00:35:02-08:00	
ICC lawyer seeks arrest of Taliban leaders over persecution of women	The ICC's chief prosecutor announced he is seeking arrest warrants for two Taliban leaders.	https://www.aljazeera.com/program/newsfeed/2025/1/24/icc-lawyer-seeks-arrest-of-taliban-leaders-over-persecution-of-women?traffic_source=rss	2025-01-23T23:37:37-08:00	
Thousands flock to smell plant that reeks of dead rat, rotting rubbish	Huge crowds queued in Sydney to catch a whiff of the flower that smells like 'hot rubbish'	https://www.aljazeera.com/news/2025/1/24/thousands-flock-to-smell-plant-that-reeks-of-dead-rat-rotting-rubbish?traffic_source=rss	2025-01-23T23:25:10-08:00	
Drug marketplace founder Ross Ulbricht makes first remarks on Trump pardon	Silk Road founder thanks US president for 'amazing blessing' in video message after his release from prison.	https://www.aljazeera.com/news/2025/1/24/drug-marketplace-founder-ross-ulbricht-makes-first-remarks-on-trump-pardon?traffic_source=rss	2025-01-23T22:51:46-08:00	
Two killed in Russian drone attack on Ukraine’s Kyiv region	Ukraine also sends volley of drones into Russia, with air defences intercepting attacks on 13 regions, including Moscow.	https://www.aljazeera.com/news/2025/1/24/two-killed-in-russian-drone-attack-on-kyiv-region?traffic_source=rss	2025-01-23T22:38:51-08:00	
Donald Trump says he plans to reach out to North Korea’s Kim Jong Un	During his first term in office, Trump met with Kim on three occasions between 2018 and 2019.	https://www.aljazeera.com/news/2025/1/24/donald-trump-says-he-plans-to-reach-out-to-north-koreas-kim-jong-un?traffic_source=rss	2025-01-23T22:24:29-08:00	
‘Dam for a dam’: India, China edge towards a Himalayan water war	Despite protests from locals, India is building a giant hydro dam on the Siang River to counter a Chinese dam.	https://www.aljazeera.com/features/2025/1/24/dam-for-a-dam-india-china-edge-towards-a-himalayan-water-war?traffic_source=rss	2025-01-23T21:58:53-08:00	
Captain Cook statue vandalised again before controversial ‘Australia Day’	A statue of the British explorer is splashed with red paint and vandalised in Sydney's eastern suburbs.	https://www.aljazeera.com/news/2025/1/24/captain-cook-statue-vandalised-again-before-controversial-australia-day?traffic_source=rss	2025-01-23T21:52:44-08:00	
Air pollution in Thailand’s Bangkok forces more than 350 schools to close	Thai capital ranked as eighth-most polluted city worldwide as microparticles levels soar.	https://www.aljazeera.com/news/2025/1/24/more-than-250-schools-close-in-bangkok-as-air-pollution-soars?traffic_source=rss	2025-01-23T21:19:32-08:00	
Russia-Ukraine war: List of key events – day 1,065	Here are the key developments on the 1,065th day of Russia’s full-scale invasion of Ukraine.	https://www.aljazeera.com/news/2025/1/24/russia-ukraine-war-list-of-key-events-day-5?traffic_source=rss	2025-01-23T21:07:45-08:00	
Extreme weather disrupts schooling for nearly 250 million kids, UNICEF says	UN agency says students in 85 countries experienced climate-related disruptions last year.	https://www.aljazeera.com/news/2025/1/24/extreme-weather-disrupts-schooling-for-nearly-250-million-kids-unicef-says?traffic_source=rss	2025-01-23T20:57:59-08:00	
United Nations confirms US will leave World Health Organization in 2026	The UN body has received a formal request from Washington to withdraw next year as Trump orders a pause on WHO funding.	https://www.aljazeera.com/news/2025/1/24/united-nations-confirms-us-will-leave-world-health-organization-in-2026?traffic_source=rss	2025-01-23T19:42:43-08:00	
Trump orders release of last files on assassinations of JFK, RFK and MLK	US president says 'everything will be revealed' on JFK assassination that has fuelled conspiracy theories for decades.	https://www.aljazeera.com/news/2025/1/24/trump-orders-release-of-last-files-on-assassinations-of-jfk-rfk-and-mlk?traffic_source=rss	2025-01-23T18:30:04-08:00	
After stabbings, China’s social media firms face scrutiny over hate speech	Chinese platforms have pledged to crack down on hate, but anti-foreigner sentiment still circulates widely online.	https://www.aljazeera.com/economy/2025/1/24/after-stabbings-chinas-social-media-firms-face-scrutiny-over-hate-speech?traffic_source=rss	2025-01-23T16:07:18-08:00	
Trump pulls security protections for Mike Pompeo, John Bolton	Hawkish foreign policy advisers from Trump's first presidency have faced alleged assassination threats from Iran.	https://www.aljazeera.com/news/2025/1/23/trump-pulls-security-protections-for-mike-pompeo-john-bolton?traffic_source=rss	2025-01-23T14:01:30-08:00	
Sudan’s army accused of ethnic killings after recapturing strategic city	Sudan's army was welcomed after taking Wad Madani, but has been accused of carrying out reprisal attacks since then.	https://www.aljazeera.com/features/longform/2025/1/23/sudans-army-accused-of-ethnic-killings-after-recapturing-strategic-city?traffic_source=rss	2025-01-23T13:49:38-08:00	
Italy defends expulsion of Libyan war crimes suspect	Some senators express dismay that Italy ignored its obligations to the ICC to turn over suspects.	https://www.aljazeera.com/news/2025/1/23/italy-defends-expulsion-of-libyan-war-crimes-suspect?traffic_source=rss	2025-01-23T13:16:50-08:00	
What is Israel’s deadly ‘Iron Wall’ military raid in the West Bank’s Jenin?	The military attack on Jenin began on Tuesday. At least 12 Palestinians have been killed across the governorate.	https://www.aljazeera.com/news/2025/1/23/what-is-israels-deadly-iron-wall-military-raid-in-the-west-banks-jenin?traffic_source=rss	2025-01-23T13:05:16-08:00	
US judge blocks Trump’s order restricting birthright citizenship	Trump's order targets a constitutional right automatically granting citizenship to anyone born in the country.	https://www.aljazeera.com/news/2025/1/23/us-judge-blocks-trumps-order-restricting-birthright-citizenship?traffic_source=rss	2025-01-23T12:40:14-08:00	
Purdue Pharma, Sacklers to pay $7.4bn in new opioid settlement	The deal is $1bn more than a settlement from last year that was rejected by the US Supreme Court.	https://www.aljazeera.com/economy/2025/1/23/purdue-pharma-sacklers-to-pay-7-4bn-in-new-opioid-settlement?traffic_source=rss	2025-01-23T12:29:24-08:00	
Peace, prosperity, & respect: Trump lays out lofty goals at Davos	US President Donald Trump told the World Economic Forum about his lofty goals.	https://www.aljazeera.com/program/newsfeed/2025/1/23/peace-prosperity-respect-trump-lays-out-lofty-goals-at-davos?traffic_source=rss	2025-01-23T12:11:30-08:00	
Who got the nod? The complete list of 2025 Oscar nominations	The nominations for the 97th Academy Awards were delayed after deadly wildfires raged through the Los Angeles area.	https://www.aljazeera.com/news/2025/1/23/who-got-the-nod-the-complete-list-of-2025-oscar-nominations?traffic_source=rss	2025-01-23T11:11:58-08:00	
ICC prosecutor applies for arrest warrants for two Taliban leaders	Prosecutor Karim Khan says there are reasonable grounds to believe two leaders responsible for 'crime against humanity'.	https://www.aljazeera.com/news/2025/1/23/icc-prosecutor-applies-for-arrest-warrants-for-two-taliban-leaders?traffic_source=rss	2025-01-23T11:09:20-08:00	
UK teen who killed three girls at dance class sentenced to 52 years	Southport attacker Axel Rudakubana will likely spend the rest of his life in jail for murdering three girls.	https://www.aljazeera.com/news/2025/1/23/uk-teen-who-killed-three-girls-at-dance-class-sentenced-to-52-years?traffic_source=rss	2025-01-23T10:49:35-08:00	
US President Trump threatens tariffs at 2025 Davos World Economic Forum	Trump repeated familiar grievances and threatened allies like Canada and the European Union with tariffs.	https://www.aljazeera.com/news/2025/1/23/us-president-trump-threatens-tariffs-at-2025-davos-world-economic-forum?traffic_source=rss	2025-01-23T10:34:08-08:00	
How do Donald Trump’s pardons compare with other US presidents?	Just hours into his second term, Trump pardons about 1,500 people charged in the January 6, 2001, Capitol attack.	https://www.aljazeera.com/news/2025/1/23/how-do-donald-trumps-pardons-compare-with-other-us-presidents?traffic_source=rss	2025-01-23T09:55:18-08:00	
Hezbollah demands Israeli forces complete withdrawal from Lebanon on time	Israel says the ceasefire agreement is not being implemented fast enough.	https://www.aljazeera.com/news/2025/1/23/hezbollah-demands-israeli-forces-complete-withdrawal-from-lebanon-on-time?traffic_source=rss	2025-01-23T09:25:59-08:00	
Israel continues Jenin raid as two Palestinians killed in West Bank	Thousands of Palestinians have been forcibly displaced as the Israeli army ordered evacuations of multiple areas.	https://www.aljazeera.com/gallery/2025/1/23/israel-continues-jenin-raid-as-two-palestinians-killed-in-west-bank?traffic_source=rss	2025-01-23T09:24:56-08:00	
The January 6 pardons: Who has Trump ordered to be released?	As one of his first actions as president, Trump pardoned hundreds of his supporters. Here's a look at who he set free.	https://www.aljazeera.com/news/2025/1/23/the-january-6-pardons-who-has-trump-ordered-to-be-released?traffic_source=rss	2025-01-23T08:44:51-08:00	
Micheal Martin returns as Irish prime minister	The Fianna Fail leader was elected for a second time after chaos in Ireland's parliament subsided.	https://www.aljazeera.com/news/2025/1/23/micheal-martin-returns-as-irish-prime-minister?traffic_source=rss	2025-01-23T07:52:05-08:00	
Why is Ukraine struggling to mobilise its citizens to fight?	Many Ukrainians have come to the realisation that their state is distributing the burdens and benefits of war unfairly.	https://www.aljazeera.com/opinions/2025/1/23/why-is-ukraine-struggling-to-mobilise-its-citizens-to-fight?traffic_source=rss	2025-01-23T07:43:50-08:00	
