Title	Description	Link	pubDate	Image
Islam Makhachev retains lightweight belt against Renato Moicano at UFC 311	In an epic, action-filled bantamweight title match, Merab Dvalishvili defends his title against Umar Nurmagomedov.	https://www.aljazeera.com/sports/2025/1/19/islam-makhachev-retains-lightweight-belt-against-renato-moicano-at-ufc-311?traffic_source=rss	2025-01-18T23:21:56-08:00	
Israel delays Gaza ceasefire due to captive names not provided	Israeli PM says the ceasefire in Gaza will not begin until Hamas releases the names of the first phase captives.	https://www.aljazeera.com/program/newsfeed/2025/1/19/israel-delays-gaza-ceasefire-due-to-captive-names-not-provided?traffic_source=rss	2025-01-18T22:55:22-08:00	
Palestinians in Gaza desperate to travel abroad for life-saving treatment	Patients eagerly await the reopening of the Rafah crossing to get the critical medical care they need to survive.	https://www.aljazeera.com/news/2025/1/19/palestinians-in-gaza-desperate-to-travel-abroad-for-life-saving-treatment?traffic_source=rss	2025-01-18T22:34:14-08:00	
Netanyahu says Gaza ceasefire won’t start until Hamas gives captives list	Israeli PM Netanyahu orders the Israeli military not to begin the ceasefire in Gaza until hostage names released.	https://www.aljazeera.com/news/2025/1/19/netanyahu-warns-gaza-ceasefire-wont-begin-until-hamas-gives-captives-list?traffic_source=rss	2025-01-18T21:55:55-08:00	
Trump admin to launch immigration raids on day one amid deportation push	Several large cities are reportedly expected to be hit by Trump's immigration authorities shortly after inauguration.	https://www.aljazeera.com/news/2025/1/18/trump-admin-to-launch-immigration-raids-on-day-one-amid-deportation-push?traffic_source=rss	2025-01-18T12:58:22-08:00	
South Korea’s impeached president, Yoon Suk Yeol, formally arrested	A court in Seoul grants request for an arrest warrant, saying there was 'concern' that Yoon could 'destroy evidence'.	https://www.aljazeera.com/news/2025/1/18/south-koreas-impeached-president-yoon-suk-yeol-formally-arrested?traffic_source=rss	2025-01-18T12:07:23-08:00	
Israel must withdraw from Lebanon by January 26 deadline: President Aoun	Lebanon's new president's comments come after the UN chief called on Israel to end its 'occupation' of southern Lebanon.	https://www.aljazeera.com/news/2025/1/18/israel-must-withdraw-from-lebanon-by-january-26-deadline-president-aoun?traffic_source=rss	2025-01-18T11:33:12-08:00	
Ceasefire deal: What do we know about Israel’s captives held in Gaza?	There are believed to be about 100 Israeli captives still being held in Gaza, including soldiers and civilians.	https://www.aljazeera.com/news/2025/1/18/ceasefire-deal-what-do-we-know-about-israels-captives-held-in-gaza?traffic_source=rss	2025-01-18T10:26:21-08:00	
Liverpool leave it late as Nunez brace downs Brentford	Liverpool striker Darwin Nunez scores twice in injury time at Brentford as Reds' extend lead at top to seven points.	https://www.aljazeera.com/sports/2025/1/18/liverpool-leave-it-late-as-nunez-brace-downs-brentford?traffic_source=rss	2025-01-18T09:59:41-08:00	
‘Heartbreaking’: More than 60 killed in Nigeria tanker explosion	The death toll likely to go up in the latest tanker explosion in Africa's largest economy amid rising fuel cost.	https://www.aljazeera.com/news/2025/1/18/heartbreaking-more-than-60-killed-in-nigeria-tanker-explosion?traffic_source=rss	2025-01-18T09:41:43-08:00	
Houthis to halt Israel, Red Sea attacks if Gaza truce comes into force	Spokesman al-Bukhaiti says Houthis will stop operations in support of Gaza when truce comes into effect on Sunday.	https://www.aljazeera.com/news/2025/1/18/houthis-to-halt-israel-red-sea-attacks-if-gaza-truce-comes-into-force?traffic_source=rss	2025-01-18T09:21:44-08:00	
Who is Steve Witkoff, Trump’s man at the Gaza ceasefire talks?	The real estate magnate and Trump golf partner is said to have played a key role in the deal.	https://www.aljazeera.com/news/2025/1/18/who-is-steve-witkoff-trumps-man-at-the-gaza-ceasefire-talks?traffic_source=rss	2025-01-18T07:47:07-08:00	
Biden’s Ukraine disaster was decades in the making	US securocrats pushed for expansionist policies in the 1990s that set the West and Russia on a path of confrontation.	https://www.aljazeera.com/opinions/2025/1/18/bidens-ukraine-disaster-was-decades-in-the-making?traffic_source=rss	2025-01-18T07:39:09-08:00	
A ceasefire agreement at last – but will it hold?	Understanding the details of the ceasefire deal and why so much remains in the balance.	https://www.aljazeera.com/program/the-listening-post/2025/1/18/a-ceasefire-agreement-at-last-but-will-it-hold?traffic_source=rss	2025-01-18T06:51:01-08:00	
Doctors on the front lines in Gaza – Dr Victoria Rose & Fatima Bhutto	Fatima Bhutto interviews plastic surgeon Victoria Rose on the destruction of the healthcare system in Gaza by Israel.	https://www.aljazeera.com/program/reframe/2025/1/18/doctors-on-the-front-lines-in-gaza-dr-victoria-rose-fatima-bhutto?traffic_source=rss	2025-01-18T05:55:24-08:00	
What has Donald Trump promised to do on day one of his second term?	The president-elect takes office on January 20, after a campaign that featured dozens of promises of executive action.	https://www.aljazeera.com/news/2025/1/18/what-has-donald-trump-promised-to-do-on-day-one-of-his-second-term?traffic_source=rss	2025-01-18T05:31:54-08:00	
Israeli government agrees on Gaza ceasefire	Israel’s government has approved a deal with Hamas for a ceasefire in Gaza, which is to begin on Sunday morning.	https://www.aljazeera.com/program/newsfeed/2025/1/18/israeli-government-agrees-on-gaza-ceasefire?traffic_source=rss	2025-01-18T04:40:59-08:00	
Australian Open: Iga Swiatek routs Emma Raducanu in straight sets	Poland's Iga Swiatek cruises past Emma Raducanu in straight sets in battle of former Grand Slam winners in Melbourne.	https://www.aljazeera.com/sports/2025/1/18/australian-open-iga-swiatek-routs-emma-raducanu-in-straight-sets?traffic_source=rss	2025-01-18T04:20:12-08:00	
The Women’s March faced controversy and division. Will a rebrand be enough?	In 2017, the Women’s March rallied record crowds to protest Donald Trump’s presidency. This year its aims are different.	https://www.aljazeera.com/news/longform/2025/1/18/the-womens-march-faced-controversy-and-division-will-a-rebrand-be-enough?traffic_source=rss	2025-01-18T04:15:59-08:00	
‘Pretty crazy’: Tien youngest since Nadal into Australian Open last 16	At 19 years of age, Learner Tien becomes the youngest man to reach the Australian Open fourth round since Rafael Nadal.	https://www.aljazeera.com/sports/2025/1/18/pretty-crazy-tien-youngest-since-nadal-into-australian-open-last-16?traffic_source=rss	2025-01-18T03:20:43-08:00	
Police volunteer found guilty in India doctor rape case	Female doctor's bloodied body was found in a classroom at a state-run college and hospital in Kolkata last August.	https://www.aljazeera.com/news/2025/1/18/indian-court-finds-police-volunteer-guilty-in-kolkata-rape-case?traffic_source=rss	2025-01-18T03:28:33-08:00	
Forgotten no more: The Black South Africans who died in WWI Africa	A memorial being unveiled in Cape Town this week recognises the deaths of 1,772 predominantly Black non-combatants.	https://www.aljazeera.com/features/2025/1/18/forgotten-no-more-the-black-south-africans-who-died-in-wwi?traffic_source=rss	2025-01-18T02:24:07-08:00	
Two Iranian Supreme Court justices killed in shooting attack in Tehran	Assailant kills himself after shooting senior justices in central Tehran.	https://www.aljazeera.com/news/2025/1/18/two-iranian-supreme-court-justices-killed-in-shooting-attack-in-tehran?traffic_source=rss	2025-01-18T01:58:51-08:00	
What is ‘Dreams on a Pillow’, the Palestinian game about the Nakba?	The game is based on the events of the 1948 Nakba, referring to the ethnic cleansing of 750,000 Palestinians.	https://www.aljazeera.com/news/2025/1/18/what-is-dreams-on-a-pillow-the-palestinian-game-about-the-nakba?traffic_source=rss	2025-01-18T00:53:09-08:00	
Four killed in Russian drone and missile attack on Ukraine’s Kyiv	Explosions in Kyiv at dawn as Russian missiles and drones strike the city's central district.	https://www.aljazeera.com/news/2025/1/18/russian-attacks-on-centre-of-kyiv-leave-four-dead?traffic_source=rss	2025-01-18T00:04:49-08:00	
Analysis: Russia, Iran strengthen alliance after Syria setback	The two countries signed 20-year cooperation pact, but despite anti-US stance there are limits to their partnership.	https://www.aljazeera.com/news/2025/1/18/iran-russia-analysis-syria-setback?traffic_source=rss	2025-01-17T23:31:31-08:00	
Israel-Hamas ceasefire in Gaza to come into effect Sunday morning	This is a breaking news story, more details to follow.	https://www.aljazeera.com/news/2025/1/18/israel-hamas-ceasefire-in-gaza-to-come-into-effect-sunday-morning?traffic_source=rss	2025-01-17T23:23:24-08:00	
Palestine’s President Abbas says ready to govern Gaza after ceasefire deal	Palestinian president reiterates call for 'an immediate ceasefire and full Israeli withdrawal' from besieged territory.	https://www.aljazeera.com/news/2025/1/18/palestinian-authority-says-ready-to-govern-gaza-after-ceasefire?traffic_source=rss	2025-01-17T22:28:46-08:00	
Israel-Gaza ceasefire deal: Which Palestinian prisoners could be released?	Thousands of Palestinian prisoners could be released in exchange for Israeli captives as part of the ceasefire deal.	https://www.aljazeera.com/news/2025/1/18/israel-gaza-ceasefire-deal-which-palestinian-prisoners-will-be-released?traffic_source=rss	2025-01-17T22:13:14-08:00	
Russia-Ukraine war: List of key events, day 1,059	Here are the key developments on the 1,059th day of Russia’s full-scale invasion of Ukraine.	https://www.aljazeera.com/news/2025/1/18/russia-ukraine-war-list-of-key-events-day-1059?traffic_source=rss	2025-01-17T21:48:45-08:00	
Does Imran Khan conviction threaten Pakistan’s PTI-government negotiations?	The conviction of the ex-PM comes amid talks aimed at easing political tensions within Pakistan. What now?	https://www.aljazeera.com/news/2025/1/18/does-imran-khan-conviction-threaten-pakistans-pti-government-negotiations?traffic_source=rss	2025-01-17T21:11:23-08:00	
Man Utd vs Brighton preview: Kickoff time, team news, how to follow, stream	Manchester United manager Ruben Amorim warns of ongoing 'rollercoaster' as club attempt at stormy rebuild continues.	https://www.aljazeera.com/sports/2025/1/18/man-utd-vs-brighton-preview-kickoff-time-team-news-how-to-follow-stream?traffic_source=rss	2025-01-17T16:21:19-08:00	
‘Fields were solitary’: Migration raids send chill across rural California	With Trump set to take office Monday, advocates fear the raids signal a new push to target undocumented labourers.	https://www.aljazeera.com/news/2025/1/17/fields-were-solitary-migration-raids-send-chill-across-rural-california?traffic_source=rss	2025-01-17T15:45:35-08:00	
Israeli cabinet approves Gaza ceasefire deal with Hamas	The deal is due to take effect from Sunday and involves the exchange of captives held in Gaza for Palestinian prisoners.	https://www.aljazeera.com/news/2025/1/17/israeli-cabinet-approves-gaza-ceasefire-deal?traffic_source=rss	2025-01-17T15:15:46-08:00	
Gaza atrocities will ‘haunt’ Antony Blinken, says former US diplomat	Hala Rharrit calls for accountability for US officials who ensured the flow of arms to Israel despite abuses in Gaza.	https://www.aljazeera.com/news/2025/1/17/gaza-atrocities-will-haunt-antony-blinken-says-former-us-diplomat?traffic_source=rss	2025-01-17T13:50:33-08:00	
More than 230,000 displaced in DRC since start of the year, UN says	The UN says the forced displacement is one of 'the most alarming' humanitarian crises in the world.	https://www.aljazeera.com/news/2025/1/17/more-than-230000-displaced-in-drc-since-start-of-the-year-un-says?traffic_source=rss	2025-01-17T12:31:24-08:00	
Former CIA employee pleads guilty to leaking files on Israel’s Iran strikes	Asif William Rahman has pled guilty to transmitting classified national defence information, US Justice Department says.	https://www.aljazeera.com/news/2025/1/17/former-cia-employee-pleads-guilty-to-leaking-files-on-israels-iran-strikes?traffic_source=rss	2025-01-17T12:25:36-08:00	
Qatari PM details Gaza ceasefire implementation, monitoring	Qatar’s prime minister detailed monitoring mechanisms for the Gaza ceasefire and defended his country’s role.	https://www.aljazeera.com/program/newsfeed/2025/1/17/qatari-pm-details-gaza-ceasefire-implementation-monitoring?traffic_source=rss	2025-01-17T12:03:37-08:00	
What’s needed on the ground to implement the Gaza ceasefire deal?	Palestinians in Gaza desperately need aid as 15 months of war has caused a humanitarian crisis.	https://www.aljazeera.com/program/inside-story/2025/1/17/whats-needed-on-the-ground-to-implement-the-gaza-ceasefire-deal?traffic_source=rss	2025-01-17T11:39:09-08:00	
CNN found guilty for defaming US navy veteran evacuating Afghans for a fee	Plaintiff had accused CNN of his destroying his reputation by branding him a profiteer who exploited desperate Afghans.	https://www.aljazeera.com/economy/2025/1/17/cnn-found-guilty-for-defaming-us-navy-veteran-evacuating-afghans-for-a-fee?traffic_source=rss	2025-01-17T11:19:14-08:00	
Qatar’s PM calls for Gaza ceasefire agreement to be ‘fully implemented’	In an exclusive interview with Al Jazeera Sheikh Mohammed shares details on Gaza truce negotiations and Syria talks.	https://www.aljazeera.com/news/2025/1/17/qatars-pm-calls-for-gaza-ceasefire-agreement-to-be-fully-implemented?traffic_source=rss	2025-01-17T11:15:18-08:00	
A frosty presidential inauguration? Trump moves ceremony indoors	US President-elect Donald Trump faces one of the coldest inauguration days in modern history when he is sworn in Monday.	https://www.aljazeera.com/news/2025/1/17/a-frosty-presidential-inauguration-trump-moves-ceremony-indoors?traffic_source=rss	2025-01-17T11:13:36-08:00	
ICC chief prosecutor meets Syria’s de facto leader	ICC's Karim Khan makes unannounced visit to Damascus for talks on 'accountability for alleged crimes'.	https://www.aljazeera.com/news/2025/1/17/icc-chief-prosecutor-meets-syrias-de-facto-leader?traffic_source=rss	2025-01-17T10:29:02-08:00	
What has Netanyahu won and lost by agreeing to Israel-Gaza ceasefire?	Israeli PM may lose influential supporters but could still rework his alliances and survive politically.	https://www.aljazeera.com/news/2025/1/17/what-has-netanyahu-won-and-lost-by-agreeing-to-israel-gaza-ceasefire?traffic_source=rss	2025-01-17T09:55:40-08:00	
‘Law of the land:’ Biden signals Equal Rights Amendment should be ratified	The outgoing US president called on others to 'affirm' the amendment, which bars discrimination on the basis of sex.	https://www.aljazeera.com/news/2025/1/17/law-of-the-land-biden-signals-equal-rights-amendment-should-be-ratified?traffic_source=rss	2025-01-17T09:40:46-08:00	
Trump speaks with China’s Xi, says leaders will make world ‘more peaceful’	It is my expectation that we will solve many problems together,' incoming US president says after call with Xi Jinping.	https://www.aljazeera.com/news/2025/1/17/trump-speaks-with-chinas-xi-says-leaders-will-make-world-more-peaceful?traffic_source=rss	2025-01-17T08:50:42-08:00	
Brentford vs Liverpool preview: Kickoff time, team news, how to stream	Liverpool manager Arne Slot says before Brentford trip that Premier League leaders face sterner tests to come.	https://www.aljazeera.com/sports/2025/1/17/brentford-vs-liverpool-preview-premier-league-team-news-how-to-follow?traffic_source=rss	2025-01-17T08:41:35-08:00	
Macron urges Israel to accelerate troop withdrawal from southern Lebanon	Emmanuel Macron is the first foreign head of state to visit Beirut since Joseph Aoun was elected as Lebanon's president.	https://www.aljazeera.com/news/2025/1/17/macron-urges-israel-to-accelerate-troop-withdrawal-from-southern-lebanon?traffic_source=rss	2025-01-17T08:01:20-08:00	
Djokovic ‘big fan’ of Collins’s Melbourne crowd response; Alcaraz advances	Novak Djokovic, who is on course to face Carlos Alcaraz, backs Danielle Collins's kisses to hostile spectators.	https://www.aljazeera.com/sports/2025/1/17/1306?traffic_source=rss	2025-01-17T07:50:23-08:00	
US Supreme Court upholds law banning TikTok	The court rules unanimously that the law did not violate free speech protections.	https://www.aljazeera.com/economy/2025/1/17/us-supreme-court-upholds-law-banning-tiktok?traffic_source=rss	2025-01-17T07:40:41-08:00	
Russia and Iran presidents sign partnership treaty in Moscow	Iranian and Russian leaders praise deal covering areas including politics, security, trade, transport and energy.	https://www.aljazeera.com/news/2025/1/17/russia-and-iran-presidents-sign-partnership-treaty-in-moscow?traffic_source=rss	2025-01-17T07:27:47-08:00	
What has the UK promised Ukraine in Starmer’s 100-year deal?	Prime Minister Keir Starmer said the partnership agreement would ensure Ukraine's 'security'.	https://www.aljazeera.com/news/2025/1/17/what-has-the-uk-promised-ukraine-in-starmers-100-year-deal?traffic_source=rss	2025-01-17T07:09:09-08:00	
Colombia’s Petro suspends talks with ELN rebels	Move comes in response to ELN attacks in country's northeast, which President Gustavo Petro describes as war crimes.	https://www.aljazeera.com/news/2025/1/17/colombias-petro-suspends-talks-with-eln-rebels?traffic_source=rss	2025-01-17T06:45:22-08:00	
Can a ceasefire end settler colonial genocide?	The ceasefire may put an end to mass slaughter in Gaza, but it won't halt the structural genocide of Palestinians.	https://www.aljazeera.com/opinions/2025/1/17/can-a-ceasefire-end-settler-colonial-genocide?traffic_source=rss	2025-01-17T06:18:43-08:00	
What is left of Gaza after 15 months of Israel’s war?	Most of Gaza’s buildings and landscape are in ruins after 15 months of Israel’s war.	https://www.aljazeera.com/program/newsfeed/2025/1/17/what-is-left-of-gaza-after-15-months-of-israels-war?traffic_source=rss	2025-01-17T06:17:27-08:00	
Starlink’s global power play	What is the cost of Starlink's unmatched internet access?	https://www.aljazeera.com/program/digital-dilemma/2025/1/17/starlinks-global-power-play?traffic_source=rss	2025-01-17T05:51:16-08:00	
Biden grants clemency to 2,500 people convicted of nonviolent drug crimes	Outgoing US president says move is 'important step toward righting historic wrongs, correcting sentencing disparities'.	https://www.aljazeera.com/news/2025/1/17/biden-grants-clemency-to-2500-people-convicted-of-nonviolent-drug-crimes?traffic_source=rss	2025-01-17T05:44:43-08:00	
Gaza ceasefire won’t last without political process, warn analysts	Israeli government has repeatedly sought to back out of truce deals, and this time could be no different, experts say.	https://www.aljazeera.com/news/2025/1/17/gaza-ceasefire-wont-last-without-political-process-warn-analysts?traffic_source=rss	2025-01-17T05:40:19-08:00	
Former Pakistani PM Imran Khan jailed for 14 years over corruption	Supporters of Imran Khan have protested outside Pakistan's parliament, after a court sentenced Khan to jail.	https://www.aljazeera.com/program/newsfeed/2025/1/17/former-pakistani-pm-imran-khan-jailed-for-14-years-over-corruption?traffic_source=rss	2025-01-17T04:42:48-08:00	
Gaza ceasefire deal, explained | Start Here	Will the ceasefire deal lead to a permanent end to Israel’s war on Gaza?	https://www.aljazeera.com/program/start-here/2025/1/17/gaza-ceasefire-deal-explained-start-here?traffic_source=rss	2025-01-17T04:37:52-08:00	
‘Symbol of resistance’: Lumumba, the Congolese hero killed before his prime	Many are still haunted by the aborted legacy of DR Congo's first prime minister, who was murdered on January 17, 1961.	https://www.aljazeera.com/features/2025/1/17/symbol-of-resistance-lumumba-the-congolese-hero-killed-before-his-prime?traffic_source=rss	2025-01-17T03:59:24-08:00	
LA wildfires: Is insurance the next battlefront for California residents?	Before the Los Angeles wildfires, insurers such as State Farm started to pull out of fire-prone California.	https://www.aljazeera.com/economy/2025/1/17/la-wildfires-is-insurance-the-next-battlefront-for-california-residents?traffic_source=rss	2025-01-17T03:54:26-08:00	
Russia hands jail sentences to three Alexey Navalny lawyers	Lawyers face up to five years in jail on charges of links to Navalny's groups, which the Kremlin deems 'extremist'.	https://www.aljazeera.com/news/2025/1/17/russia-hands-jail-sentences-to-three-alexey-navalny-lawyers?traffic_source=rss	2025-01-17T03:22:33-08:00	
Gauff dominates Fernandez at Austalian Open but Osaka retires injured	World number three Coco Gauff beats Leylah Fernandez in straight sets to reach third round at Australia Open.	https://www.aljazeera.com/sports/2025/1/17/imperious-gauff-rolls-past-fernandez-into-australian-open-last-16?traffic_source=rss	2025-01-17T03:05:41-08:00	
More than 100 people killed in Gaza since ceasefire agreed	Israel’s war in Gaza has killed at least 46,788 Palestinians and wounded 110,453 since October 7, 2023.	https://www.aljazeera.com/gallery/2025/1/17/more-than-100-people-killed-in-gaza-since-truce-deal?traffic_source=rss	2025-01-17T02:46:59-08:00	
Searching for hope in Syria	The Assad regime disappeared my brother in 2018. Now that my country is free, I have renewed hope that I may find him.	https://www.aljazeera.com/opinions/2025/1/17/searching-for-hope-in-syria?traffic_source=rss	2025-01-17T02:09:07-08:00	
Haaland and Manchester City agree new 10-year contract	Norway striker Erling Haaland will be aged 34 when his deal with Premier League champions expires.	https://www.aljazeera.com/sports/2025/1/17/haaland-and-manchester-city-agree-new-ten-year-contract?traffic_source=rss	2025-01-17T01:49:24-08:00	
ICC chief prosecutor says Israel made ‘no real effort’ to probe Gaza crimes	Karim Khan's defence of Gaza war crimes allegations against Netanyahu comes amid delays over ceasefire ratification.	https://www.aljazeera.com/news/2025/1/17/israel-made-no-real-effort-to-probe-gaza-crimes-says-icc-prosecutor?traffic_source=rss	2025-01-17T01:47:55-08:00	
‘Make Russia Small Again’: Ukraine on edge as Trump heads to White House	Everyday Ukrainians hope Trump can bring peace while Kyiv's forces are on the back foot on the front lines.	https://www.aljazeera.com/news/2025/1/17/make-russia-small-again-ukraine-on-edge-as-trump-heads-to-white-house?traffic_source=rss	2025-01-17T01:42:21-08:00	
LA wildfires day 11: What is the latest, and what do investigations show?	Firefighters progressed due to a temporary easing of winds, but officials caution that hazardous conditions could return	https://www.aljazeera.com/news/2025/1/17/la-wildfires-day-11-what-is-the-latest-and-what-do-investigations-show?traffic_source=rss	2025-01-17T00:52:23-08:00	
Will Pam Bondi, attorney general pick, retract claims of ‘stolen’ election?	Fact checking what Bondi said about Trump claims, election falsehoods, crime rates at her Senate confirmation hearing.	https://www.aljazeera.com/news/2025/1/17/will-pam-bondi-attorney-general-pick-retract-claims-of-stolen-election?traffic_source=rss	2025-01-17T00:41:43-08:00	
SpaceX Starship explodes, leaving a trail of fiery debris across the sky	SpaceX’s Starship spacecraft has exploded only minutes after taking off on a test flight, leaving trails of debris.	https://www.aljazeera.com/program/newsfeed/2025/1/17/spacex-starship-explodes-leaving-a-trail-of-fiery-debris-across-the-sky?traffic_source=rss	2025-01-16T23:57:23-08:00	
Nintendo shares tumble as Switch 2 reveal disappoints fans	Japanese gaming company’s stock price falls as much as 7.2 percent as teaser for new console fails to impress.	https://www.aljazeera.com/economy/2025/1/17/nintendo-shares-tumble-as-switch-2-reveal-disappoints-fans?traffic_source=rss	2025-01-16T23:16:54-08:00	
Pakistan’s ex-PM Imran Khan, wife sentenced to jail in corruption case	The convictions threaten to derail talks between Khan's PTI and the government aimed at settling a long-running feud.	https://www.aljazeera.com/news/2025/1/17/pakistans-ex-pm-imran-khan-wife-sentenced-to-jail-in-corruption-case?traffic_source=rss	2025-01-16T23:10:09-08:00	
At least 12 Maoist rebels killed by India’s security forces	About 3,000 officers were involved in the operation in Chhattisgarh state, a stronghold of the armed rebellion.	https://www.aljazeera.com/news/2025/1/17/at-least-12-maoist-rebels-killed-by-indias-security-forces?traffic_source=rss	2025-01-16T22:20:54-08:00	
South Korea’s Yoon refuses questioning as authorities seek longer detention	Anticorruption agency says it will ask court to extend impeached president's detention by up to 20 days.	https://www.aljazeera.com/news/2025/1/17/south-koreas-yoon-refuses-questioning-as-authorities-seek-longer-detention?traffic_source=rss	2025-01-16T21:52:39-08:00	
Israel’s national security minister threatens to resign over ceasefire	Itamar Ben-Gvir and his far-right party threaten to leave government over Gaza ceasefire deal.	https://www.aljazeera.com/news/2025/1/17/israels-national-security-minister-threatens-to-resign-over-ceasefire?traffic_source=rss	2025-01-16T21:50:38-08:00	
China’s population falls for third year in a row as birthrate declines	China's population continues to fall for third straight year due to declining birthrate and amid concerns for economy.	https://www.aljazeera.com/news/2025/1/17/chinas-population-falls-for-third-year-in-a-row-as-birthrate-declines?traffic_source=rss	2025-01-16T20:49:42-08:00	
What to know about TikTok’s looming US ban	TikTok is due to shut down in the US on Sunday, but a reprieve from the White House seems likely.	https://www.aljazeera.com/news/2025/1/17/what-to-know-about-tiktoks-looming-us-ban?traffic_source=rss	2025-01-16T20:24:07-08:00	
