Title	Description	Link	pubDate	Image
Path of war in Ukraine has direct repercussions in other parts of world: NATO chief	- Moscow provides missile technology to North Korea, money to Iran in return to their assistance in its war effort against Ukraine, says Mark Rutte	https://www.aa.com.tr/en/live/path-of-war-in-ukraine-has-direct-repercussions-in-other-parts-of-world-nato-chief/3393365	2024-11-13T14:51:35-08:00	
Lavrov says Trump's election victory will not change US attitude toward Ukraine conflict	Russian foreign minister argues Washington wants to keep everything under its control	https://www.aa.com.tr/en/live/lavrov-says-trumps-election-victory-will-not-change-us-attitude-toward-ukraine-conflict/3393356	2024-11-13T14:04:51-08:00	
South Africa condemns Israeli minister's call to annex West Bank	Finance Minister Bezalel Smotrich's statement that 2025 will be 'the year of annexation' of the West Bank met with condemnation worldwide	https://www.aa.com.tr/en/live/south-africa-condemns-israeli-ministers-call-to-annex-west-bank/3393354	2024-11-13T13:51:48-08:00	
Spain strongly rejects Israeli statements favoring annexation of West Bank	The International Court of Justice has ruled that the Israeli occupation of the Palestinian territories is illegal and must end as soon as possible,’ Foreign Ministry says	https://www.aa.com.tr/en/live/spain-strongly-rejects-israeli-statements-favoring-annexation-of-west-bank/3393347	2024-11-13T13:25:13-08:00	
San Antonio Spurs head coach Gregg Popovich suffers 'mild stroke'	5-time NBA champion suffers stroke on Nov. 2 at Spurs' home court, NBA team confirms	https://www.aa.com.tr/en/live/san-antonio-spurs-head-coach-gregg-popovich-suffers-mild-stroke/3393346	2024-11-13T13:23:08-08:00	
Biden to meet with China's Xi in Peru this week: White House	This will be 3rd in-person meeting between the two leaders since President Biden came into office,' says White House	https://www.aa.com.tr/en/live/biden-to-meet-with-chinas-xi-in-peru-this-week-white-house-/3393341	2024-11-13T13:15:17-08:00	
UNRWA chief vows to operate 'until the day we cannot operate anymore'	UN agency for Palestinian refugees 'is a softer target for anyone who views its presence or its activities as a threat,' says Philippe Lazzarini	https://www.aa.com.tr/en/live/unrwa-chief-vows-to-operate-until-the-day-we-cannot-operate-anymore/3393325	2024-11-13T12:48:13-08:00	
Biden to become first sitting US President to visit Amazon rainforest	Biden will visit the rainforest, engage with local leaders who are working to preserve and protect this critical ecosystem,' says National Security Advisor	https://www.aa.com.tr/en/live/biden-to-become-first-sitting-us-president-to-visit-amazon-rainforest/3393324	2024-11-13T12:46:55-08:00	
Trump taps Marco Rubio for US Secretary of State post	President-elect says Rubio will be strong advocate of US, ‘true friend’ to allies. ‘fearless Warrior’ to adversaries	https://www.aa.com.tr/en/live/trump-taps-marco-rubio-for-us-secretary-of-state-post/3393323	2024-11-13T12:45:27-08:00	
Israeli fighter jets target Beirut’s southern suburb with fresh strikes	Israeli warplanes launch renewed strikes on southern Beirut, following warnings to evacuate buildings	https://www.aa.com.tr/en/live/israeli-fighter-jets-target-beirut-s-southern-suburb-with-fresh-strikes/3393322	2024-11-13T12:44:38-08:00	
US says it secured 'further commitments' from Israel as Gaza aid situation deteriorates	We want to see those commitments followed through on,' says National Security Advisor	https://www.aa.com.tr/en/live/us-says-it-secured-further-commitments-from-israel-as-gaza-aid-situation-deteriorates/3393320	2024-11-13T12:42:21-08:00	
Right-wing groups in European Parliament block Left group’s proposal to debate on Israel’s UNRWA ban	This emboldens Israel’s unliteral aggression on Gaza, Left group warns	https://www.aa.com.tr/en/live/right-wing-groups-in-european-parliament-block-left-group-s-proposal-to-debate-on-israel-s-unrwa-ban/3393318	2024-11-13T12:33:06-08:00	
Pakistan, Bangladesh establish direct maritime link for first time since relations severed in 1971	Cargo ship from Karachi docks at Chittagong port amid wave of ties between 2 south Asian nations	https://www.aa.com.tr/en/live/pakistan-bangladesh-establish-direct-maritime-link-for-first-time-since-relations-severed-in-1971/3393312	2024-11-13T12:25:35-08:00	
Pro-Palestinian protesters breach defense firm Leonardo’s offices in Italy's Turin	Action comes in response to Leonardo’s ‘complicity’ in Israeli genocide in Gaza, protesters say	https://www.aa.com.tr/en/live/pro-palestinian-protesters-breach-defense-firm-leonardo-s-offices-in-italys-turin/3393308	2024-11-13T12:10:23-08:00	
Israel launches new airstrike on Syria’s Homs region: Report	Syria’s state news agency reports new Israeli airstrike on Al Qusayr area near Lebanon’s border	https://www.aa.com.tr/en/live/israel-launches-new-airstrike-on-syria-s-homs-region-report/3393306	2024-11-13T12:04:00-08:00	
Moscow court orders arrest in absentia of International Criminal Court judge	Basmanny District Court puts International Criminal Court Vice-President Reine Alapini-Gansou on wanted list	https://www.aa.com.tr/en/live/moscow-court-orders-arrest-in-absentia-of-international-criminal-court-judge/3393282	2024-11-13T11:08:54-08:00	
Fenerbahce Beko guard Devon Hall to undergo surgery after hand fracture	29-year-old US player has ‘fracture in his left hand's metacarpal bone,’ says Istanbul club	https://www.aa.com.tr/en/live/fenerbahce-beko-guard-devon-hall-to-undergo-surgery-after-hand-fracture/3393280	2024-11-13T11:05:46-08:00	
Russia warns Paris that Ukraine may hit French Embassy in Moscow if Kyiv gets nod to use long-range missiles	Moscow warns West of 'inevitable and destructive' response to authorization for Ukraine to use long-range missiles on Russian territory	https://www.aa.com.tr/en/live/russia-warns-paris-that-ukraine-may-hit-french-embassy-in-moscow-if-kyiv-gets-nod-to-use-long-range-missiles/3393276	2024-11-13T11:00:42-08:00	
Security Council condemns attacks on UN peacekeepers in Lebanon amid Israeli strikes	Council members urge 'all parties to take all measures to respect the safety and security of UNIFIL personnel and premises'	https://www.aa.com.tr/en/live/security-council-condemns-attacks-on-un-peacekeepers-in-lebanon-amid-israeli-strikes/3393274	2024-11-13T10:58:50-08:00	
Turkish vice president greets Romania on national day	There is strong desire on both sides to strengthen relations in many areas of mutual interests, including security, economy, and culture, says Cevdet Yilmaz	https://www.aa.com.tr/en/live/turkish-vice-president-greets-romania-on-national-day/3393273	2024-11-13T10:57:05-08:00	
Israel continues to block aid missions delivering life-saving assistance to northern Gaza: UN	Yesterday and today, 6 attempts to deliver life-saving assistance to besieged areas in North Gaza governorate were blocked,' says spokesman	https://www.aa.com.tr/en/live/israel-continues-to-block-aid-missions-delivering-life-saving-assistance-to-northern-gaza-un/3393270	2024-11-13T10:54:27-08:00	
Hezbollah says it launched 1st drone, ballistic missile attack on Israeli Defense Ministry HQ in Tel Aviv	Hezbollah says it fired squadron of drones, ballistic missiles at Kirya base, which houses headquarters of Israeli Defense Ministry	https://www.aa.com.tr/en/live/hezbollah-says-it-launched-1st-drone-ballistic-missile-attack-on-israeli-defense-ministry-hq-in-tel-aviv/3393267	2024-11-13T10:52:54-08:00	
UN welcomes Sudanese authorities' decision to extend opening of Adre border crossing	On the sidelines of the COP29 the Secretary-General (Antonio Guterres) spoke with Gen. al-Burhan on that very subject,' spokesman says	https://www.aa.com.tr/en/live/un-welcomes-sudanese-authorities-decision-to-extend-opening-of-adre-border-crossing/3393249	2024-11-13T10:24:49-08:00	
‘Time to end war’ in Gaza: US secretary of state	‘Israel, by the standards it set itself, has accomplished goals that it set for itself,’ Antony Blinken says	https://www.aa.com.tr/en/live/-time-to-end-war-in-gaza-us-secretary-of-state/3393247	2024-11-13T10:20:50-08:00	
Uganda to cut nearly all external borrowing to curb rising debt	Decision comes as country grapples with rising public debt, which rose to $25.6B in June from $23.7B the previous year, according to Finance Ministry data	https://www.aa.com.tr/en/live/uganda-to-cut-nearly-all-external-borrowing-to-curb-rising-debt/3393245	2024-11-13T10:18:50-08:00	
No agreement with Lebanon unless Hezbollah disarms: Israeli defense chief	Israel Katz says Israel would not consider cease-fire unless its objectives met -- Hezbollah disarms, retreats beyond Litani River, safe return of Israelis to homes in north	https://www.aa.com.tr/en/live/no-agreement-with-lebanon-unless-hezbollah-disarms-israeli-defense-chief/3393243	2024-11-13T10:16:51-08:00	
Palestinian leader Khalida Jarrar faces abuse campaign in Israeli custody: Rights group	Handala Center for Prisoners and Ex-prisoners reports Palestinian leader facing systematic abuse that endangers her life at Israeli Ramla Prison	https://www.aa.com.tr/en/live/palestinian-leader-khalida-jarrar-faces-abuse-campaign-in-israeli-custody-rights-group/3393236	2024-11-13T10:07:07-08:00	
John Thune elected US Senate majority leader	Thune will replace Mitch McConnell who will step down at year’s end	https://www.aa.com.tr/en/live/john-thune-elected-us-senate-majority-leader/3393234	2024-11-13T10:03:18-08:00	
Trump names key campaign advisors to administration	Dan Scavino, Stephen Mille, James Blair, Taylor Budowich to assume senior roles in White House, Trump announces	https://www.aa.com.tr/en/live/trump-names-key-campaign-advisors-to-administration/3393214	2024-11-13T09:34:45-08:00	
Biden, Trump agree to have 'smooth' transition of power	Congratulations and I look forward to having a smooth transition,' Biden tells Trump at White House	https://www.aa.com.tr/en/live/biden-trump-agree-to-have-smooth-transition-of-power/3393211	2024-11-13T09:31:45-08:00	
Biden, Trump agree to have peaceful transition of power	Congratulations and I look forward to having a smooth transition,' Biden tells Trump at White House	https://www.aa.com.tr/en/live/biden-trump-agree-to-have-peaceful-transition-of-power/3393211	2024-11-13T09:31:45-08:00	
Droughts, floods, failing crops: Weather extremes test Italy's agricultural heartland	We’re harvesting in November what we should have harvested in August. Production is very low in both quantity and quality,' Gian Enrico Grugni, a local Lombardy farmer, tells Anadolu	https://www.aa.com.tr/en/live/droughts-floods-failing-crops-weather-extremes-test-italys-agricultural-heartland/3393204	2024-11-13T09:28:16-08:00	
Study reveals surge in xenophobic and anti-Muslim sentiment in Germany	Over 48% of respondents in Western Germany reported ‘feeling like strangers in their own country due to Muslim presence,’ and nearly 33 % expressed support for banning immigration from Muslim countries	https://www.aa.com.tr/en/live/study-reveals-surge-in-xenophobic-and-anti-muslim-sentiment-in-germany/3393198	2024-11-13T09:18:13-08:00	
Russian president, Saudi crown prince discuss Palestinian-Israeli conflict, situation with oil markets	Vladimir Putin, Mohammed Bin Salman mark position on possible Palestinians, Israeli settlement	https://www.aa.com.tr/en/live/russian-president-saudi-crown-prince-discuss-palestinian-israeli-conflict-situation-with-oil-markets/3393197	2024-11-13T09:15:36-08:00	
Lebanon says 78 more killed in Israeli attacks as death toll soars to 3,365	Over 14,300 injured in Israeli attacks since last year, Health Ministry says	https://www.aa.com.tr/en/live/lebanon-says-78-more-killed-in-israeli-attacks-as-death-toll-soars-to-3-365/3393192	2024-11-13T09:12:07-08:00	
Turkish TV dramas focus of university course in Qatar	Turkish dramas position Türkiye as cultural force, enhance its global influence in media, tourism, trade, international relations, says member of university faculty	https://www.aa.com.tr/en/live/turkish-tv-dramas-focus-of-university-course-in-qatar/3393190	2024-11-13T09:07:05-08:00	
Survivors demand justice in UK as Archbishop of Canterbury resigns over abuse cover-up	Decision sends shockwaves through Church and amplifies calls for greater accountability, with survivors and clergy members demanding more resignations from those involved in decades-long scandal	https://www.aa.com.tr/en/live/survivors-demand-justice-in-uk-as-archbishop-of-canterbury-resigns-over-abuse-cover-up/3393189	2024-11-13T09:03:30-08:00	
Bangladesh's army arrests 2,500 for possessing illegal arms as military operation continues	Joint operations resulted in arrest of over 700 drug dealers or people associated with drug trading, says senior military officer	https://www.aa.com.tr/en/live/bangladeshs-army-arrests-2-500-for-possessing-illegal-arms-as-military-operation-continues/3393184	2024-11-13T09:01:00-08:00	
UN Security Council unanimously renews Yemen sanctions	Resolution includes targeted financial, travel ban measures until Nov. 15, 2025	https://www.aa.com.tr/en/live/un-security-council-unanimously-renews-yemen-sanctions/3393179	2024-11-13T08:57:58-08:00	
Trump meets with Republicans on Capitol Hill	Isn't it nice to win? It's nice to win. It's always nice to win,' president-elect says	https://www.aa.com.tr/en/live/trump-meets-with-republicans-on-capitol-hill/3393169	2024-11-13T08:38:49-08:00	
All diplomatic opportunities should be used to end Russia-Ukraine war: Bulgarian president	Renewal of energy cooperation with Russia depends on dialogue between European Commission, Kremlin, says Rumen Radev	https://www.aa.com.tr/en/live/all-diplomatic-opportunities-should-be-used-to-end-russia-ukraine-war-bulgarian-president/3393158	2024-11-13T08:16:55-08:00	
Palestinian child injured by Israeli army fire in West Bank raid	14-year-old boy shot in both legs by Israeli forces near Nablus, Red Crescent Society says	https://www.aa.com.tr/en/live/palestinian-child-injured-by-israeli-army-fire-in-west-bank-raid/3393143	2024-11-13T08:01:17-08:00	
Türkiye's BIST 100 closes Wednesday in the green	Benchmark index gains 73.44 points at closing session	https://www.aa.com.tr/en/live/turkiyes-bist-100-closes-wednesday-in-the-green/3393141	2024-11-13T07:57:47-08:00	
Floods caused by torrential rain severely hit Italy's Sicily	Flood was particularly strong in Torre Archirafi, where it tossed cars around and dragged some of them into sea, reports local media	https://www.aa.com.tr/en/live/floods-caused-by-torrential-rain-severely-hit-italys-sicily/3393136	2024-11-13T07:52:32-08:00	
Recycled waste made up 11.8% of materials used in EU last year	Highest circularity rate seen in Netherlands at 30.6%, lowest in Romania at 1.3%, says Eurostat data	https://www.aa.com.tr/en/live/recycled-waste-made-up-118-of-materials-used-in-eu-last-year/3393134	2024-11-13T07:48:05-08:00	
Lithuanian parliament adopts law to block Chinese access to solar, wind farm systems	China among countries posing threat to national security, according to Lithuania’s National Security Strategy	https://www.aa.com.tr/en/live/lithuanian-parliament-adopts-law-to-block-chinese-access-to-solar-wind-farm-systems/3393105	2024-11-13T07:06:43-08:00	
UCI Nirvana Gran Fondo World Series' cycling event to begin Friday	3-day event to feature 880 cyclists from 35 different countries in southwestern resort city of Antalya	https://www.aa.com.tr/en/live/uci-nirvana-gran-fondo-world-series-cycling-event-to-begin-friday/3393101	2024-11-13T07:04:36-08:00	
Israel says 20 rockets, 4 combat drones fired from Lebanon	Hezbollah says its rockets targeted Israeli soldiers in southern Lebanon, settlement in northern Israel	https://www.aa.com.tr/en/live/israel-says-20-rockets-4-combat-drones-fired-from-lebanon-/3393095	2024-11-13T06:59:44-08:00	
China tells Taiwan to uphold ‘1992 Consensus’ to resume talks	Taiwan remains inalienable part of China's territory, Beijing insists	https://www.aa.com.tr/en/live/china-tells-taiwan-to-uphold-1992-consensus-to-resume-talks/3393092	2024-11-13T06:57:29-08:00	
German lawmakers initiate process to ban far-right AfD party	113 lawmakers sign application for party ban, citing concerns over far-right AfD’s anti-democratic behavior, anti-constitutional goals	https://www.aa.com.tr/en/live/german-lawmakers-initiate-process-to-ban-far-right-afd-party/3393091	2024-11-13T06:57:18-08:00	
Israeli airstrikes kill at least 9, including children, in Gaza’s ‘safe zone’	Children among victims in 2 airstrikes targeting al-Mawasi area, west of Khan Younis, according to medical source	https://www.aa.com.tr/en/live/israeli-airstrikes-kill-at-least-9-including-children-in-gaza-s-safe-zone-/3393086	2024-11-13T06:55:27-08:00	
Kremlin says Russia to take measures in response to opening of US missile base in Poland	Goal of opening such a base is to 'militarily contain' Russia’s potential, says Kremlin spokesman	https://www.aa.com.tr/en/live/kremlin-says-russia-to-take-measures-in-response-to-opening-of-us-missile-base-in-poland/3393084	2024-11-13T06:54:49-08:00	
British premier tells UK parliament there’s no genocide in Gaza	Keir Starmer says he’s aware of the term genocide and that’s why he never used that term to describe Israeli actions	https://www.aa.com.tr/en/live/british-premier-tells-uk-parliament-there-s-no-genocide-in-gaza/3393082	2024-11-13T06:53:17-08:00	
France condemns Israeli minister’s call for West Bank annexation	Bezalel Smotrich's remarks 'against international law and efforts for de-escalation of regional tensions,' Foreign Ministry says	https://www.aa.com.tr/en/live/france-condemns-israeli-minister-s-call-for-west-bank-annexation/3393079	2024-11-13T06:52:26-08:00	
Israeli court rejects Netanyahu's request to delay testimony in corruption trial	Netanyahu is scheduled to testify before court on Dec. 2	https://www.aa.com.tr/en/live/israeli-court-rejects-netanyahus-request-to-delay-testimony-in-corruption-trial/3393078	2024-11-13T06:52:18-08:00	
BioNTech to buy Chinese biotech firm to boost oncology strategy	German drugmaker to use state-of-art antibody in tandem with advanced therapies to more effectively fight cancer, detect tumor cells in patients	https://www.aa.com.tr/en/live/biontech-to-buy-chinese-biotech-firm-to-boost-oncology-strategy/3393074	2024-11-13T06:50:00-08:00	
India calls for early cease-fire in Gaza	Visiting Saudi Foreign Minister Faisal bin Farhan Al Saud meets with S. Jaishankar in New Delhi	https://www.aa.com.tr/en/live/india-calls-for-early-cease-fire-in-gaza/3393049	2024-11-13T06:22:25-08:00	
Israeli army plans to remain in Gaza until end of 2025: Report	Haaretz says army is acting to hold no fewer than 4 large areas in different parts of Gaza Strip	https://www.aa.com.tr/en/live/israeli-army-plans-to-remain-in-gaza-until-end-of-2025-report/3393046	2024-11-13T06:19:20-08:00	
Russia claims to have taken control of another settlement in Ukraine	Rivnopil village now under control of Russian forces, according to Defense Ministry	https://www.aa.com.tr/en/live/russia-claims-to-have-taken-control-of-another-settlement-in-ukraine/3393043	2024-11-13T06:16:07-08:00	
US annual consumer inflation ticks up to 2.6% in October	Consumer prices index increases by 0.2% in October, according to official data	https://www.aa.com.tr/en/live/us-annual-consumer-inflation-ticks-up-to-26-in-october/3393036	2024-11-13T06:10:08-08:00	
Electric vehicle sales break record for sales led by China	China’s ascent in electric vehicle sales carry record to October, according to UK-based research firm	https://www.aa.com.tr/en/live/electric-vehicle-sales-break-record-for-sales-led-by-china/3393032	2024-11-13T06:07:18-08:00	
Azerbaijan’s president urges countries with 'colonial past' to help small island nations in fight against climate crisis	Ilham Aliyev says France has caused 'severe soil and water contamination' in French Polynesia by conducting over 190 nuclear tests between 1966 and 1996	https://www.aa.com.tr/en/live/azerbaijan-s-president-urges-countries-with-colonial-past-to-help-small-island-nations-in-fight-against-climate-crisis/3393022	2024-11-13T05:56:24-08:00	
Israeli hostage slams army attacks in Gaza, calls for protests to press for swap deal	‘I am afraid of the moment the army will reach me or the moment they bomb the place where I am being held,’ says Israeli hostage held in Gaza	https://www.aa.com.tr/en/live/israeli-hostage-slams-army-attacks-in-gaza-calls-for-protests-to-press-for-swap-deal/3393018	2024-11-13T05:53:39-08:00	
Barcelona's Ansu Fati sustains hamstring injury	22-year-old winger to be out for approximately 4 weeks	https://www.aa.com.tr/en/live/barcelonas-ansu-fati-sustains-hamstring-injury/3393013	2024-11-13T05:48:35-08:00	
Russia to lift ban on gasoline exports	Energy minister says as prices stable in domestic market, ban on gasoline exports possible to be removed	https://www.aa.com.tr/en/live/russia-to-lift-ban-on-gasoline-exports/3393010	2024-11-13T05:46:52-08:00	
German Chancellor Scholz defends coalition breakup, seeks opposition’s support for key laws	In his address to parliament, Social Democrat Olaf Scholz calls on opposition Christian Democrats to support passing crucial legislation ahead of early elections in February 2025	https://www.aa.com.tr/en/live/german-chancellor-scholz-defends-coalition-breakup-seeks-opposition-s-support-for-key-laws/3393007	2024-11-13T05:44:06-08:00	
Turkish company Karmod completes prefabricated housing project in Georgia	Designed as standalone residences, houses are built to meet specific needs of individual homeowners in Georgia, company says	https://www.aa.com.tr/en/live/turkish-company-karmod-completes-prefabricated-housing-project-in-georgia/3393002	2024-11-13T05:41:42-08:00	
US envoy to Kenya resigns in wake of Trump win	Ambassador Meg Whitman announces she is stepping down while reflecting on some US diplomatic achievements in Kenya	https://www.aa.com.tr/en/live/us-envoy-to-kenya-resigns-in-wake-of-trump-win/3392998	2024-11-13T05:38:16-08:00	
Increasing negativity, extremism: The Guardian withdraws from X	British newspaper cites far-right conspiracy theories, instances of racism as factors in its choice to exit platform	https://www.aa.com.tr/en/live/increasing-negativity-extremism-the-guardian-withdraws-from-x/3392992	2024-11-13T05:33:49-08:00	
Roadside bomb blast kills 3 in Somali capital	Attack took place in Mogadishu’s Daynile neighborhood and was caused by roadside bomb explosion that killed 2 security personnel and 1 civilian, security official tells Anadolu	https://www.aa.com.tr/en/live/roadside-bomb-blast-kills-3-in-somali-capital/3392983	2024-11-13T05:29:20-08:00	
UK’s 13M low-to-middle-income families vulnerable to poor health or disability: Report	People in low-to-middle income families now over 3 times more likely to be economically inactive due to ill health, says Resolution Foundation study	https://www.aa.com.tr/en/live/uk-s-13m-low-to-middle-income-families-vulnerable-to-poor-health-or-disability-report/3392981	2024-11-13T05:27:03-08:00	
Ukraine slams ECOWAS commissioner accusing Kyiv of ‘genocide’ in Donbas region	Remarks trying to blame Ukraine for degrading security situation in Sahel undermine relations, damages reputation of ECOWAS, says Foreign Ministry	https://www.aa.com.tr/en/live/ukraine-slams-ecowas-commissioner-accusing-kyiv-of-genocide-in-donbas-region/3392972	2024-11-13T05:23:10-08:00	
Sudan war: End in sight as army gains ground against RSF?	Analysts say Sudanese army’s progress has changed the situation on the ground but a complete halt to hostilities is still far off	https://www.aa.com.tr/en/live/sudan-war-end-in-sight-as-army-gains-ground-against-rsf/3392969	2024-11-13T05:18:30-08:00	
Greece calls for pragmatic climate strategy to preserve Europe's competitiveness at COP29	We cannot focus so much on 2050 that we forget 2024,' says Kyriakos Mitsotakis	https://www.aa.com.tr/en/live/greece-calls-for-pragmatic-climate-strategy-to-preserve-europes-competitiveness-at-cop29/3392964	2024-11-13T05:16:03-08:00	
Palestinian shot dead by Israeli army fire in West Bank	Israeli media say Palestinian allegedly attempted to take soldier’s weapon in southern West Bank	https://www.aa.com.tr/en/live/palestinian-shot-dead-by-israeli-army-fire-in-west-bank/3392961	2024-11-13T05:10:51-08:00	
Egypt says working to halt Israeli onslaught on Lebanon	Egypt’s foreign minister visits Beirut for talks with Lebanese officials	https://www.aa.com.tr/en/live/egypt-says-working-to-halt-israeli-onslaught-on-lebanon/3392953	2024-11-13T05:04:00-08:00	
Attacks on UN agency part of Israel's effort to 'erase' Palestinians from history: Former UNRWA official	With 30,000 employees, UNRWA major public service provider offering education, healthcare, social services in region, Lex Takkenberg says	https://www.aa.com.tr/en/live/attacks-on-un-agency-part-of-israels-effort-to-erase-palestinians-from-history-former-unrwa-official/3392947	2024-11-13T04:59:46-08:00	
Italy's president criticizes Musk for 'interfering' with country's internal affairs	Mattarella restates country's full sovereignty after tech tycoon attacked Italian judges for their ruling on migrants	https://www.aa.com.tr/en/live/italys-president-criticizes-musk-for-interfering-with-countrys-internal-affairs/3392943	2024-11-13T04:53:52-08:00	
Israel demolishes 3 Palestinian structures in West Bank	Israel widely uses the pretext of lack of construction permits to demolish Palestinian homes	https://www.aa.com.tr/en/live/israel-demolishes-3-palestinian-structures-in-west-bank/3392936	2024-11-13T04:48:29-08:00	
