Title	Description	Link	pubDate	Image
Turkish firm Karmod to support quake recovery with prefab facilities for contractors	Company also supports economic revitalization by constructing commercial shops in quake-hit cities of Hatay, Adiyaman, Kahramanmaras, and Osmaniye	https://www.aa.com.tr/en/live/turkish-firm-karmod-to-support-quake-recovery-with-prefab-facilities-for-contractors/3386887	2024-11-07T00:34:06-08:00	
European Political Community convenes in Budapest to discuss major global issues	European leaders to discuss Ukraine, Middle East, Trump's presidential election victory	https://www.aa.com.tr/en/live/european-political-community-convenes-in-budapest-to-discuss-major-global-issues/3386862	2024-11-07T00:14:46-08:00	
Israeli warplanes strike near Beirut's airport, eastern Bekaa region	Army uses internationally banned cluster bombs in town of Yohmor, eastern Lebanon	https://www.aa.com.tr/en/live/israeli-warplanes-strike-near-beiruts-airport-eastern-bekaa-region/3386829	2024-11-07T00:06:25-08:00	
6 Palestinians killed in Israeli airstrikes on northern Gaza	This comes as Israeli army carries out airstrikes, artillery shelling on homes in northern Gaza, medical source says	https://www.aa.com.tr/en/live/6-palestinians-killed-in-israeli-airstrikes-on-northern-gaza/3386768	2024-11-06T23:33:56-08:00	
Myanmar junta leader attends major international event in China	2-day summit in Kunming also attended by leaders o Cambodia, Laos, Myanmar, Thailand and Vietnam	https://www.aa.com.tr/en/live/myanmar-junta-leader-attends-major-international-event-in-china/3386757	2024-11-06T23:25:28-08:00	
Myanmar junta leader attends 1st major international event in China	2-day event in southern China also attended by leaders of China, Cambodia, Laos, Myanmar, Thailand and Vietnam	https://www.aa.com.tr/en/live/myanmar-junta-leader-attends-1st-major-international-event-in-china/3386757	2024-11-06T23:25:28-08:00	
Turkish stock exchange up at open	BIST 100 index earns 11 points at opening session	https://www.aa.com.tr/en/live/turkish-stock-exchange-up-at-open/3386756	2024-11-06T23:24:06-08:00	
UK house prices rise 3.9% year-on-year in October	Typical property price at $380,600 in UK	https://www.aa.com.tr/en/live/uk-house-prices-rise-39-year-on-year-in-october/3386752	2024-11-06T23:22:25-08:00	
UK house prices rise 4.7% year-on-year in September	Typical property price at $379,400 in UK, hitting highest level since June 2022	https://www.aa.com.tr/en/live/uk-house-prices-rise-47-year-on-year-in-september/3386752	2024-11-06T23:22:25-08:00	
Israeli soldier killed in Hezbollah rocket attack on northern Israel	New death brings number of personnel killed since last October to 781	https://www.aa.com.tr/en/live/israeli-soldier-killed-in-hezbollah-rocket-attack-on-northern-israel/3386739	2024-11-06T23:13:09-08:00	
In a first, Japan retrieves tiny amount of melted fuel from crippled Fukushima nuclear plant	Tokyo Electric Power Company says it collected small amount of melted fuel with gripper on tip of telescopic device	https://www.aa.com.tr/en/live/in-a-first-japan-retrieves-tiny-amount-of-melted-fuel-from-crippled-fukushima-nuclear-plant/3386726	2024-11-06T22:56:03-08:00	
Israeli youth killed by shrapnel from rocket fired from Lebanon	18-year-old Israeli was killed in Kfar Masaryk settlement in western Galilee	https://www.aa.com.tr/en/live/israeli-youth-killed-by-shrapnel-from-rocket-fired-from-lebanon/3386721	2024-11-06T22:48:38-08:00	
11 more Palestinians killed in Israeli airstrikes on Gaza	Israeli strikes target multiple areas across Gaza, leaving casualties, destruction amid ongoing conflict	https://www.aa.com.tr/en/live/11-more-palestinians-killed-in-israeli-airstrikes-on-gaza/3386720	2024-11-06T22:46:04-08:00	
Xi speaks with Trump, says China, US would ‘benefit from cooperation’	Indonesian, Maldivian, South Korean presidents also send congratulatory messages to president-elect	https://www.aa.com.tr/en/live/xi-speaks-with-trump-says-china-us-would-benefit-from-cooperation-/3386716	2024-11-06T22:42:38-08:00	
Xi congratulates Trump, says China, US would ‘benefit from cooperation’	Chinese president says two countries should properly manage their differences	https://www.aa.com.tr/en/live/xi-congratulates-trump-says-china-us-would-benefit-from-cooperation-/3386716	2024-11-06T22:42:38-08:00	
Canada prepares for ‘massive influx’ of migrants after Trump win	Trump promised mass deportation of millions of migrants from US	https://www.aa.com.tr/en/live/canada-prepares-for-massive-influx-of-migrants-after-trump-win/3386693	2024-11-06T22:15:11-08:00	
Morning Briefing: Nov. 7, 2024	Anadolu’s recap of top stories from around the globe	https://www.aa.com.tr/en/live/morning-briefing-nov-7-2024/3386680	2024-11-06T21:55:42-08:00	
Israeli army kills Palestinian in Jenin raid amid escalating West Bank violence	Army shoots Abdullah al-Saadi 3 times, says Palestine Red Crescent Society	https://www.aa.com.tr/en/live/israeli-army-kills-palestinian-in-jenin-raid-amid-escalating-west-bank-violence/3386677	2024-11-06T21:46:48-08:00	
Tim Walz thanks Harris, urges Democrats to 'continue fighting' for campaign's values	Now more than ever, we need you to continue fighting for those values and the country we all love,' Walz tells voters in his 1st public statement since Harris' loss	https://www.aa.com.tr/en/live/tim-walz-thanks-harris-urges-democrats-to-continue-fighting-for-campaigns-values/3386671	2024-11-06T21:28:03-08:00	
Trump could announce staff picks within days: Report	US president-elect gathered with potential candidates for his second administration in Palm Beach, Florida on Wednesday night, CNN reports	https://www.aa.com.tr/en/live/trump-could-announce-staff-picks-within-days-report/3386651	2024-11-06T21:05:17-08:00	
Bernie Sanders slams Democratic Party's 'disastrous' campaign strategy following Harris' loss	US senator criticizes disconnect with working-class Americans, continued American military aid to Israel	https://www.aa.com.tr/en/live/bernie-sanders-slams-democratic-partys-disastrous-campaign-strategy-following-harris-loss/3386648	2024-11-06T20:51:09-08:00	
TikTok to challenge Canada order to shut offices in country	Decision taken citing national security concerns; Canadians can still use the app	https://www.aa.com.tr/en/live/tiktok-to-challenge-canada-order-to-shut-offices-in-country/3386647	2024-11-06T20:47:18-08:00	
Canada bans TikTok from operating in country due to security risks: Cabinet minister	Canadians can still use the popular app, but exercise caution	https://www.aa.com.tr/en/live/canada-bans-tiktok-from-operating-in-country-due-to-security-risks-cabinet-minister/3386647	2024-11-06T20:47:18-08:00	
EU faces many existential threats: Defense chief	Conventional warfare, hybrid attacks and militarization of space among the threats, says Andrius Kubilius	https://www.aa.com.tr/en/live/eu-faces-many-existential-threats-defense-chief/3386646	2024-11-06T20:43:32-08:00	
Trump wins US state of Alaska, pushing Electoral College votes to 295	Alaska's three Electoral College votes have pushed Trump's tally far beyond Harris' 226, according to The Associated Press	https://www.aa.com.tr/en/live/trump-wins-us-state-of-alaska-pushing-electoral-college-votes-to-295/3386645	2024-11-06T20:40:39-08:00	
Inter Milan upset Arsenal 1-0 in UEFA Champions League	Hakan Calhanoglu converts penalty kick at Giuseppe Meazza Stadium	https://www.aa.com.tr/en/live/inter-milan-upset-arsenal-1-0-in-uefa-champions-league/3386644	2024-11-06T20:33:23-08:00	
Uzbek president congratulates Trump, looks forward to his official visit	We look forward to welcoming you in Uzbekistan to further elevate our comprehensive partnership,' says Shavkat Mirziyoyev	https://www.aa.com.tr/en/live/uzbek-president-congratulates-trump-looks-forward-to-his-official-visit/3386643	2024-11-06T20:31:02-08:00	
Kyrgyz president congratulates Trump on winning 2nd term	I believe we can elevate our partnership to a new level for prosperity and the future of our peoples,' says Sadyr Japarov	https://www.aa.com.tr/en/live/kyrgyz-president-congratulates-trump-on-winning-2nd-term/3386641	2024-11-06T20:19:08-08:00	
German business community braces for possible trade restrictions after Trump win	Trump’s promised high tariffs may impact trade with Germany	https://www.aa.com.tr/en/live/german-business-community-braces-for-possible-trade-restrictions-after-trump-win/3386640	2024-11-06T20:01:50-08:00	
UK premier congratulates Trump over ‘historic election victory’	Keir Starmer and Donald Trump agree that relations between UK and US are 'incredibly strong and would continue to thrive for many years to come'	https://www.aa.com.tr/en/live/uk-premier-congratulates-trump-over-historic-election-victory-/3386633	2024-11-06T14:37:36-08:00	
Harris calls on supporters to accept election results, vows peaceful transfer of power	I know folks are feeling and experiencing a range of emotions right now. I get it. But we must accept the results of this election,' says vice president	https://www.aa.com.tr/en/live/harris-calls-on-supporters-to-accept-election-results-vows-peaceful-transfer-of-power/3386631	2024-11-06T14:12:34-08:00	
Deployment of North Korean troops to Russia threat to global security: NATO	Military alliance to deepen ties with Indo-Pacific partners in response, says Secretary General Mark Rutte	https://www.aa.com.tr/en/live/deployment-of-north-korean-troops-to-russia-threat-to-global-security-nato/3386624	2024-11-06T14:02:32-08:00	
Ireland to hold snap elections most likely on Nov. 29: Prime minister	Simon Harris says he intends to seek dissolution of parliament on Friday	https://www.aa.com.tr/en/live/ireland-to-hold-snap-elections-most-likely-on-nov-29-prime-minister/3386619	2024-11-06T13:54:32-08:00	
Türkiye's president holds phone call with Trump	Recep Tayyip Erdogan expresses hope for stronger cooperation between Türkiye and US in coming term	https://www.aa.com.tr/en/live/turkiyes-president-holds-phone-call-with-trump/3386618	2024-11-06T13:50:10-08:00	
Jordan’s King, British premier call for Gaza cease-fire, unhindered humanitarian aid	King Abdullah II, Keir Starmer call for mobilizing effective efforts towards de-escalation, criticize Israel’s UNRWA ban during London meeting,	https://www.aa.com.tr/en/live/jordan-s-king-british-premier-call-for-gaza-cease-fire-unhindered-humanitarian-aid/3386616	2024-11-06T13:47:34-08:00	
German government coalition collapses; early elections expected by end of March 2025	Chancellor Olaf Scholz dismisses liberal finance minister over policy disputes, calls for vote of confidence to hold early elections	https://www.aa.com.tr/en/live/german-government-coalition-collapses-early-elections-expected-by-end-of-march-2025/3386593	2024-11-06T13:27:16-08:00	
Thousands protest against Israeli Premier Netanyahu for dismissing Gallant as defense minister	Thousands of Israelis protests outside parliament in West Jerusalem, then march to Prime Minister Benjamin Netanyahu's home to oppose removal of former Defense Minister Yoav Gallant	https://www.aa.com.tr/en/live/thousands-protest-against-israeli-premier-netanyahu-for-dismissing-gallant-as-defense-minister/3386590	2024-11-06T13:24:42-08:00	
Paris Saint-Germain fans display pro-Palestine banners during UEFA Champions League match	Fans raise ‘Free Palestine’, ‘Battle on the field, but peace in the world’ banners	https://www.aa.com.tr/en/live/paris-saint-germain-fans-display-pro-palestine-banners-during-uefa-champions-league-match/3386582	2024-11-06T13:11:20-08:00	
Hans Vanaken's penalty kick give Club Brugge win against Aston Villa	Tyrone Mings picks ball up in penalty area, concedes bizarre penalty at Jan Breydelstadion	https://www.aa.com.tr/en/live/hans-vanakens-penalty-kick-give-club-brugge-win-against-aston-villa/3386567	2024-11-06T12:46:50-08:00	
US Muslim group urges Trump to honor campaign pledge for peace, ending war in Gaza	We expect all elected officials to genuinely address the urgent concerns of Muslim voters,' says CAIR executive	https://www.aa.com.tr/en/live/us-muslim-group-urges-trump-to-honor-campaign-pledge-for-peace-ending-war-in-gaza/3386565	2024-11-06T12:45:33-08:00	
German intellectual group warns of negative impacts of new antisemitism bill in parliament	The resolution, which critics argue will effectively stifle any criticism of Israel, is scheduled to be introduced to parliament later this week, with vote on its ratification	https://www.aa.com.tr/en/live/german-intellectual-group-warns-of-negative-impacts-of-new-antisemitism-bill-in-parliament/3386563	2024-11-06T12:44:22-08:00	
5 Palestinian children suffer tear gas injuries during Israeli raid in West Bank	Israeli forces dispatch tear gas in Al-Khader near Bethlehem as part of wider operation in West Bank	https://www.aa.com.tr/en/live/5-palestinian-children-suffer-tear-gas-injuries-during-israeli-raid-in-west-bank/3386560	2024-11-06T12:35:56-08:00	
Biden congratulates President-elect Trump on election victory ahead of national address	President Biden expressed his commitment to ensuring a smooth transition and emphasized the importance of working to bring the country together,' White House says	https://www.aa.com.tr/en/live/biden-congratulates-president-elect-trump-on-election-victory-ahead-of-national-address/3386555	2024-11-06T12:22:28-08:00	
German Chancellor Scholz dismisses liberal Finance Minister Lindner	Government spokesman confirms dismissal amid growing disputes within the coalition government	https://www.aa.com.tr/en/live/german-chancellor-scholz-dismisses-liberal-finance-minister-lindner/3386552	2024-11-06T12:20:24-08:00	
Hospital in northern Gaza struggles to operate due to supply shortages amid Israeli attacks	Hospital facing 'a critical shortage of medicines and medical supplies for more than three months, compounded by a fuel supply cut,' Al-Awda Hospital Director Mohammad Saleha tells Anadolu	https://www.aa.com.tr/en/live/hospital-in-northern-gaza-struggles-to-operate-due-to-supply-shortages-amid-israeli-attacks/3386545	2024-11-06T12:09:48-08:00	
Organization of Turkic States leaders call for immediate cease-fire in Lebanon	Bishkek Declaration expresses ‘deep concern’ over ‘catastrophic’ humanitarian situation in Gaza	https://www.aa.com.tr/en/live/organization-of-turkic-states-leaders-call-for-immediate-cease-fire-in-lebanon/3386541	2024-11-06T12:01:54-08:00	
Mexico's front pages: How US neighbor, largest trade partner reacted to Trump's victory	As Trump readies for second term, Mexico calls for tranquility	https://www.aa.com.tr/en/live/mexicos-front-pages-how-us-neighbor-largest-trade-partner-reacted-to-trumps-victory/3386538	2024-11-06T12:00:01-08:00	
Targeting UNRWA is 'attack on the General Assembly,' Türkiye's UN envoy says	It is now incumbent upon us as member states to stand firmly against any attempts to dismantle UNRWA,' says Ahmet Yildiz	https://www.aa.com.tr/en/live/targeting-unrwa-is-attack-on-the-general-assembly-turkiyes-un-envoy-says/3386535	2024-11-06T11:58:16-08:00	
Turkish foreign minister to visit Greece on Friday	Hakan Fidan's tour follows his Greek counterpart George Gerapetritis' working visit to Ankara in September of last year	https://www.aa.com.tr/en/live/turkish-foreign-minister-to-visit-greece-on-friday/3386515	2024-11-06T11:31:02-08:00	
Harris calls Trump to concede presidential election	Harris 'discussed the importance of a peaceful transfer of power and being a president for all Americans,' CNN reports	https://www.aa.com.tr/en/live/harris-calls-trump-to-concede-presidential-election/3386509	2024-11-06T11:25:14-08:00	
Russia accuses Ukraine of 'unreliability' in gas deliveries	European countries want affordable energy supplies, but Kyiv has put them in difficult situation, says Russian deputy prime minister	https://www.aa.com.tr/en/live/russia-accuses-ukraine-of-unreliability-in-gas-deliveries/3386504	2024-11-06T11:22:21-08:00	
Leaders from all around world congratulate Donald Trump over his winning US Presidential elections	Donald Trump elected as 47th president of the US, making him serving 2 different terms	https://www.aa.com.tr/en/live/leaders-from-all-around-world-congratulate-donald-trump-over-his-winning-us-presidential-elections/3386497	2024-11-06T11:15:19-08:00	
Israeli airstrike hits historic building near ancient Baalbek Castle in eastern Lebanon	Manshieh building dates to Ottoman era, says governor	https://www.aa.com.tr/en/live/israeli-airstrike-hits-historic-building-near-ancient-baalbek-castle-in-eastern-lebanon/3386493	2024-11-06T11:10:19-08:00	
Belarusian president congratulates Trump on US election victory	Lukashenko wishes Trump good health, 'well-aimed political decisions that will make America great again'	https://www.aa.com.tr/en/live/belarusian-president-congratulates-trump-on-us-election-victory/3386483	2024-11-06T10:57:30-08:00	
Palestinians 'starving while the world watches': UN	For the past month, North Gaza has been under a near-total brutal siege,' says official	https://www.aa.com.tr/en/live/palestinians-starving-while-the-world-watches-un/3386477	2024-11-06T10:49:50-08:00	
UN rights chief urges de-escalation in post-election tensions in Mozambique	It is crucial that post-electoral grievances are resolved peacefully through inclusive dialogue and independent judicial processes, consistent with human rights and the rule of law,' says Volker Turk	https://www.aa.com.tr/en/live/un-rights-chief-urges-de-escalation-in-post-election-tensions-in-mozambique/3386468	2024-11-06T10:36:07-08:00	
Latin American leaders react to Trump's election win	Left-, right-wing regional presidents congratulate Donald ​​Trump after beating Harris	https://www.aa.com.tr/en/live/latin-american-leaders-react-to-trumps-election-win/3386466	2024-11-06T10:33:02-08:00	
Besiktas secures narrow win over Malmo in UEFA Europa League	Goals by Ernest Muci, Semih Kilicsoy bring 2-1 victory to Turkish club in Istanbul	https://www.aa.com.tr/en/live/besiktas-secures-narrow-win-over-malmo-in-uefa-europa-league/3386456	2024-11-06T10:18:43-08:00	
At least 30 killed, 35 injured in Israeli airstrikes in Lebanon’s Baalbek	Israeli warplanes launch 20 airstrikes in Baalbek, according to Lebanese governor	https://www.aa.com.tr/en/live/at-least-30-killed-35-injured-in-israeli-airstrikes-in-lebanon-s-baalbek/3386455	2024-11-06T10:16:22-08:00	
Harris loses swing state Michigan, where many Arab Americans supported Trump	Republican presidential candidate Trump secures 15 electoral votes in Michigan	https://www.aa.com.tr/en/live/harris-loses-swing-state-michigan-where-many-arab-americans-supported-trump/3386454	2024-11-06T10:12:50-08:00	
Gaza 'genocide will not end by itself’: Palestinian envoy to UN	Every state represented here and the UN as a whole have a duty to stop it,' Riyad Mansour tells General Assembly	https://www.aa.com.tr/en/live/gaza-genocide-will-not-end-by-itself-palestinian-envoy-to-un/3386449	2024-11-06T10:11:02-08:00	
Lebanon says 37 killed in Israeli attacks in last day as death toll hits 3,050	Nearly 13,700 injured in attacks since last year, Health Ministry says	https://www.aa.com.tr/en/live/lebanon-says-37-killed-in-israeli-attacks-in-last-day-as-death-toll-hits-3-050/3386448	2024-11-06T10:09:14-08:00	
Hezbollah claims rocket attacks on military sites, settlements in Israel	Hezbollah rockets target 3 military bases, 9 settlements in northern, central Israel	https://www.aa.com.tr/en/live/hezbollah-claims-rocket-attacks-on-military-sites-settlements-in-israel/3386447	2024-11-06T10:07:16-08:00	
Harris to address supporters in Washington, DC after election loss	Vice president to address supporters at site where she was to have delivered victory speech	https://www.aa.com.tr/en/live/harris-to-address-supporters-in-washington-dc-after-election-loss/3386444	2024-11-06T10:04:59-08:00	
UN agency’s chief urges action from UN members as Palestinians plunging into 'chaos'	Dismantling UNRWA will not terminate the refugee status of Palestinians. These statues exist independently of the agency,' Philippe Lazzarini says	https://www.aa.com.tr/en/live/un-agency-s-chief-urges-action-from-un-members-as-palestinians-plunging-into-chaos/3386441	2024-11-06T10:00:46-08:00	
US election recap: Trump wins 2nd presidency, Republicans gain control of Senate	We overcame obstacles that nobody ever thought we could,' Trump said in victory speech	https://www.aa.com.tr/en/live/us-election-recap-trump-wins-2nd-presidency-republicans-gain-control-of-senate/3386426	2024-11-06T09:35:32-08:00	
Trump's win to boost US stock market via fiscal policies: Expert	Rise in cryptocurrencies attributed to not only Trump win but also Musk's association with Trump, says international markets specialist	https://www.aa.com.tr/en/live/trumps-win-to-boost-us-stock-market-via-fiscal-policies-expert/3386419	2024-11-06T09:27:25-08:00	
Tesla shares jump after Trump's election victory	Trump's possible tariff hike on imported electric vehicles to strengthen dominance of Tesla in US EV market	https://www.aa.com.tr/en/live/tesla-shares-jump-after-trumps-election-victory/3386399	2024-11-06T09:07:12-08:00	
Women pensioners speak out against UK's 'unfair' new rules	A group of British women born in the 1950s is pushing for compensation after the government raised the state pension age, leaving many financially vulnerable as the cost of living remains high	https://www.aa.com.tr/en/live/women-pensioners-speak-out-against-uks-unfair-new-rules/3386396	2024-11-06T09:04:23-08:00	
China’s Premier Li urges Myanmar junta leader to advance internal political reconciliation	Beijing will always support Myanmar in choosing development path suited to China’s national conditions, says Li	https://www.aa.com.tr/en/live/china-s-premier-li-urges-myanmar-junta-leader-to-advance-internal-political-reconciliation/3386394	2024-11-06T08:57:40-08:00	
Formation of single currency within BRICS 'not possible' at the moment: Kremlin	Not all countries are yet ready to cooperate in establishing an alternative payment system also, says Kremlin spokesman	https://www.aa.com.tr/en/live/formation-of-single-currency-within-brics-not-possible-at-the-moment-kremlin/3386391	2024-11-06T08:53:57-08:00	
Central banks eased monetary policy in October	Central banks of Europe, Canada, South Korea cut rates in October, while Japan, Türkiye left rates unchanged	https://www.aa.com.tr/en/live/central-banks-eased-monetary-policy-in-october/3386390	2024-11-06T08:52:22-08:00	
Turkish stock exchange up 2.8% at close	Benchmark BIST 100 index earns over 240 points at Wednesday’s close	https://www.aa.com.tr/en/live/turkish-stock-exchange-up-28-at-close/3386377	2024-11-06T08:37:49-08:00	
Majority of Belgians want sanctions on Israel: Survey	More than 70% of respondents also support immediate, permanent cease-fire in Gaza	https://www.aa.com.tr/en/live/majority-of-belgians-want-sanctions-on-israel-survey/3386371	2024-11-06T08:32:11-08:00	
China congratulates Trump on election victory	Beijing says it respects choice of Americans	https://www.aa.com.tr/en/live/china-congratulates-trump-on-election-victory/3386369	2024-11-06T08:30:26-08:00	
Somalia urges Germany against ‘forced’ deportation of Africans	Visiting Somali president holds talks with German chancellor in Berlin on deportation of migrants	https://www.aa.com.tr/en/live/somalia-urges-germany-against-forced-deportation-of-africans/3386355	2024-11-06T07:53:01-08:00	
EuroLeague leaders Zalgiris Kaunas to visit Bayern Munich on Thursday	Lithuanian team has 6-1 win/loss record to top Turkish Airlines EuroLeague standings	https://www.aa.com.tr/en/live/euroleague-leaders-zalgiris-kaunas-to-visit-bayern-munich-on-thursday/3386353	2024-11-06T07:49:53-08:00	
Greek coastguards recover bodies of 4 irregular migrants off Rhodes island	Police say they found another 25 irregular migrants who survived shipwreck and managed to swim to shore	https://www.aa.com.tr/en/live/greek-coastguards-recover-bodies-of-4-irregular-migrants-off-rhodes-island/3386338	2024-11-06T07:32:25-08:00	
Russia summons Moldovan envoy over 'discrimination' of observers during presidential election	3 Russian observers denied entry at Chisinau Airport despite having official accreditation from Moldova’s Central Election Commission, says Foreign Ministry	https://www.aa.com.tr/en/live/russia-summons-moldovan-envoy-over-discrimination-of-observers-during-presidential-election/3386336	2024-11-06T07:29:45-08:00	
Italy, Albania dismantle drug trafficking network: Europol	Operation leads to arrest of 29 suspects accused of smuggling cocaine, other drugs from South America	https://www.aa.com.tr/en/live/italy-albania-dismantle-drug-trafficking-network-europol/3386334	2024-11-06T07:27:10-08:00	
UK premier dodges question on foreign secretary's 'derogatory' remarks about Trump	Conservative Party leader Kemi Badenoch claims British Prime Minister Keir Starmer has no plans whatsoever to build on special relationship with US	https://www.aa.com.tr/en/live/uk-premier-dodges-question-on-foreign-secretarys-derogatory-remarks-about-trump/3386322	2024-11-06T07:10:20-08:00	
Climate protesters paint US Embassy in London as Trump declares victory	2 protesters arrested on suspicion of criminal damage, say Metropolitan police	https://www.aa.com.tr/en/live/climate-protesters-paint-us-embassy-in-london-as-trump-declares-victory/3386318	2024-11-06T07:05:46-08:00	
Israel issues evacuation orders for residents in southern Beirut ahead of attacks	Israeli army orders residents to move 500 meters away from what it calls Hezbollah facilities in Borj al-Barajneh neighborhood	https://www.aa.com.tr/en/live/israel-issues-evacuation-orders-for-residents-in-southern-beirut-ahead-of-attacks/3386316	2024-11-06T07:02:54-08:00	
