Title	Description	Link	pubDate	Image
Netanyahu says he spoke with Trump 3 times in past few days	Israeli premier describes conversations with US president-elect 'very good and important'	https://www.aa.com.tr/en/live/netanyahu-says-he-spoke-with-trump-3-times-in-past-few-days/3390128	2024-11-10T11:00:35-08:00	
6.8 magnitude earthquake jolts Cuba	No immediate reports of damage or injuries	https://www.aa.com.tr/en/live/68-magnitude-earthquake-jolts-cuba/3390127	2024-11-10T10:58:32-08:00	
Republic of Türkiye's founder Ataturk commemorated in US	2-minute silence observed at Turkish Embassy in Washington DC to honor Mustafa Kemal Ataturk	https://www.aa.com.tr/en/live/republic-of-turkiyes-founder-ataturk-commemorated-in-us/3390125	2024-11-10T10:55:25-08:00	
19 injured Palestinians moved from north to Gaza City	Wounded shifted in cooperation with International Committee of Red Cross and Palestine Red Crescent Society	https://www.aa.com.tr/en/live/19-injured-palestinians-moved-from-north-to-gaza-city/3390124	2024-11-10T10:53:13-08:00	
Türkiye cannot stand idle in face of dynamic changes in global system: President	Ankara determined to dismantle 'bloody, treacherous death plot' fueled by terror barons in northern Iraq, says Recep Tayyip Erdogan	https://www.aa.com.tr/en/live/turkiye-cannot-stand-idle-in-face-of-dynamic-changes-in-global-system-president/3390089	2024-11-10T09:39:33-08:00	
Hamas calls for urgent action to stop Israeli genocide in Gaza	Israel accuses Israel of carrying out ethnic cleansing against Palestinians in northern Gaza	https://www.aa.com.tr/en/live/hamas-calls-for-urgent-action-to-stop-israeli-genocide-in-gaza/3390020	2024-11-10T07:53:46-08:00	
Turkish Republic's founder Ataturk honored globally on 86th anniversary of his passing	Mustafa Kemal Ataturk, who led battle of Turkish independence, passed away in 1938 at age of 57	https://www.aa.com.tr/en/live/turkish-republics-founder-ataturk-honored-globally-on-86th-anniversary-of-his-passing/3390018	2024-11-10T07:50:30-08:00	
3 executives of Australian gold miner arrested in Mali	Resolute Mining Ltd. owns 80% of shares in Syama gold mine in country's southwest	https://www.aa.com.tr/en/live/3-executives-of-australian-gold-miner-arrested-in-mali/3390015	2024-11-10T07:43:24-08:00	
Neglect, starvation add to misery of Palestinian detainees in Israel’s Negev Prison	Around 11,600 Palestinians are detained in Israeli prisons, according to Palestinian figures	https://www.aa.com.tr/en/live/neglect-starvation-add-to-misery-of-palestinian-detainees-in-israel-s-negev-prison/3390013	2024-11-10T07:39:34-08:00	
Israeli prime minister admits responsibility for mass pager explosions in Lebanon	‘Before the pager operation, they told me that the US would oppose it, but I did not listen to them,' Netanyahu says	https://www.aa.com.tr/en/live/israeli-prime-minister-admits-responsibility-for-mass-pager-explosions-in-lebanon/3390007	2024-11-10T07:32:10-08:00	
Turkish foreign minister calls on Islamic world to press for arms embargo on Israel	Türkiye's UN initiative to stop arms transfers to Israel received support of 52 countries, including permanent members of Security Council, says Hakan Fidan	https://www.aa.com.tr/en/live/turkish-foreign-minister-calls-on-islamic-world-to-press-for-arms-embargo-on-israel/3389989	2024-11-10T06:55:33-08:00	
South Africans protest against Israeli attacks on Gaza, Lebanon	Protesters demand South Africa close Israeli Embassy in Pretoria as firm stance against its ongoing aggression on Gaza, West Bank, Lebanon	https://www.aa.com.tr/en/live/south-africans-protest-against-israeli-attacks-on-gaza-lebanon/3389987	2024-11-10T06:52:54-08:00	
3 injured in Hezbollah rocket attack in northern Israel	Israeli army says 25 rockets fired from Lebanon toward Nahariya, Shomera in northern Israel	https://www.aa.com.tr/en/live/3-injured-in-hezbollah-rocket-attack-in-northern-israel/3389982	2024-11-10T06:47:57-08:00	
South Korea blames North Korea for over 300 GPS disruptions this month	Alleged jamming however didn't cause any 'major issues or damage,' says Seoul	https://www.aa.com.tr/en/live/south-korea-blames-north-korea-for-over-300-gps-disruptions-this-month-/3389910	2024-11-10T04:48:06-08:00	
32 drones flying towards Moscow shot down: Official	No damage or casualties at site of falling debris, says Moscow mayor	https://www.aa.com.tr/en/live/32-drones-flying-towards-moscow-shot-down-official/3389905	2024-11-10T04:39:21-08:00	
Somalia excludes Ethiopia from taking part in new AU mission	Addis Ababa excluded from mission due to its ‘violations against Somalia’s sovereignty and territorial integrity,’ says defense minister	https://www.aa.com.tr/en/live/somalia-excludes-ethiopia-from-taking-part-in-new-au-mission/3389898	2024-11-10T04:23:53-08:00	
Kuwait, UAE call for cease-fire in Gaza, Lebanon amid Israeli attacks	UAE president arrives in Kuwait for talks on bilateral ties, regional developments	https://www.aa.com.tr/en/live/kuwait-uae-call-for-cease-fire-in-gaza-lebanon-amid-israeli-attacks/3389897	2024-11-10T04:19:55-08:00	
Several Chadian soldiers killed in clashes with Boko Haram terrorist group: Reports	President Mahamat Idriss Deby Itno sends ‘condolences to families of the martyrs who died defending the homeland’ weeks after 40 soldiers killed	https://www.aa.com.tr/en/live/several-chadian-soldiers-killed-in-clashes-with-boko-haram-terrorist-group-reports/3389894	2024-11-10T04:14:58-08:00	
US freezes delivery of bulldozers to Israel over Gaza home demolitions: Report	US suspends delivery of 130 D9 bulldozers over their use in demolishing homes in Gaza, according to Israeli media	https://www.aa.com.tr/en/live/us-freezes-delivery-of-bulldozers-to-israel-over-gaza-home-demolitions-report/3389891	2024-11-10T04:11:56-08:00	
Russia claims it took control of another settlement in Ukraine’s Donetsk region	Russian forces captured village of Vovchenka, claims Defense Ministry	https://www.aa.com.tr/en/live/russia-claims-it-took-control-of-another-settlement-in-ukraine-s-donetsk-region/3389888	2024-11-10T04:00:16-08:00	
Israeli airstrikes kill 30 people, including 7 children, in Lebanon	3 paramedics killed in Israeli airstrike in southern Lebanon	https://www.aa.com.tr/en/live/israeli-airstrikes-kill-30-people-including-7-children-in-lebanon/3389868	2024-11-10T03:35:23-08:00	
Israeli airstrikes kill 27 people, including 3 children, in Lebanon	3 paramedics killed in Israeli airstrike in southern Lebanon	https://www.aa.com.tr/en/live/israeli-airstrikes-kill-27-people-including-3-children-in-lebanon/3389868	2024-11-10T03:35:23-08:00	
1 missing, another hospitalized after fire breaks out on Japan navy ship	Japan Maritime Self-Defense Force, Japan Coast Guard working to put out fire	https://www.aa.com.tr/en/live/1-missing-another-hospitalized-after-fire-breaks-out-on-japan-navy-ship/3389856	2024-11-10T03:17:37-08:00	
1 hospitalized after fire breaks out on Japan navy ship	Japan Maritime Self-Defense Force, Japan Coast Guard working to put out fire, says local media	https://www.aa.com.tr/en/live/1-hospitalized-after-fire-breaks-out-on-japan-navy-ship/3389856	2024-11-10T03:17:37-08:00	
World leaders condemn deadly terror attack in Pakistan	At least 26 killed in bomb explosion at Quetta city railway station on Saturday	https://www.aa.com.tr/en/live/world-leaders-condemn-deadly-terror-attack-in-pakistan/3389851	2024-11-10T03:07:37-08:00	
China dubs Philippines' new maritime laws as violation of its 'territorial sovereignty'	Philippines' President Ferdinand Marcos Jr. signed 2 new bills Friday targeted at disputed South China Sea	https://www.aa.com.tr/en/live/china-dubs-philippines-new-maritime-laws-as-violation-of-its-territorial-sovereignty/3389842	2024-11-10T02:57:35-08:00	
Israel kills 51 more Gazans as death toll surpasses 43,600	More than 102,900 Palestinians injured in Israeli onslaught since Oct. 7, 2023, Gaza’s Health Ministry says	https://www.aa.com.tr/en/live/israel-kills-51-more-gazans-as-death-toll-surpasses-43-600/3389827	2024-11-10T02:43:56-08:00	
China's import expo logs new-high of $80B in tentative deals	7th China International Import Expo ends in Shanghai, unveiling 400 new products, new technologies, new services	https://www.aa.com.tr/en/live/chinas-import-expo-logs-new-high-of-80b-in-tentative-deals/3389787	2024-11-10T01:50:25-08:00	
Ukraine says 2 injured due to overnight Russian drone attack on Odesa region	Governor says 6 residential buildings, gas station damaged as a result of attack	https://www.aa.com.tr/en/live/ukraine-says-2-injured-due-to-overnight-russian-drone-attack-on-odesa-region/3389785	2024-11-10T01:47:43-08:00	
34 Ukrainian drones flying towards Moscow shot down: Russia	Total of 70 Ukrainian drones downed over 6 different regions Sunday morning, claims Defense Ministry	https://www.aa.com.tr/en/live/34-ukrainian-drones-flying-towards-moscow-shot-down-russia/3389781	2024-11-10T01:42:23-08:00	
Over 18,000 Lebanese citizens enter Iraq amid Israeli onslaught	Iraq says influx follows orders from Iraqi prime minister to allow visa-free entry for Lebanese citizens	https://www.aa.com.tr/en/live/over-18-000-lebanese-citizens-enter-iraq-amid-israeli-onslaught/3389774	2024-11-10T01:40:02-08:00	
3 more European airlines cancel flights to Israel amid regional tension	ITA Airways, Air France, Aegean Airlines cancel flights to Israel, according to Israeli media	https://www.aa.com.tr/en/live/3-more-european-airlines-cancel-flights-to-israel-amid-regional-tension/3389763	2024-11-10T01:33:13-08:00	
Thousands of juvenile online gamblers identified in South Korea	National Police Agency says 4,715 under-19 individuals involved in gambling	https://www.aa.com.tr/en/live/thousands-of-juvenile-online-gamblers-identified-in-south-korea/3389738	2024-11-10T01:23:08-08:00	
Israeli warplanes launch fresh airstrikes on Lebanon’s Bekaa	Attacks target 3 towns in Bekaa Valley	https://www.aa.com.tr/en/live/israeli-warplanes-launch-fresh-airstrikes-on-lebanon-s-bekaa/3389728	2024-11-10T01:18:01-08:00	
Turkish president marks 86th anniversary of passing of founding father Ataturk	‘August Ataturk, we once again remember your excellency with grace on 86th anniversary of your passing to eternity,’ Recep Tayyip Erdogan writes in Anitkabir memorial book	https://www.aa.com.tr/en/live/turkish-president-marks-86th-anniversary-of-passing-of-founding-father-ataturk/3389723	2024-11-10T01:13:34-08:00	
UN Climate Change Conference set to start in Azerbaijan	Leaders from around world gathering in Baku as COP29 begins Monday to address escalating climate challenges	https://www.aa.com.tr/en/live/un-climate-change-conference-set-to-start-in-azerbaijan/3389710	2024-11-10T01:07:51-08:00	
In a first, snow leopards spotted in southwest China	2 endangered snow leopards seen in Shangri-La city, Deqen County, according to authorities	https://www.aa.com.tr/en/live/in-a-first-snow-leopards-spotted-in-southwest-china/3389663	2024-11-10T00:14:27-08:00	
US unlikely to halt arms sales to Israel due to AIPAC lobbying: Expert	Politicians who see Israel as sacred receive substantial campaign funding, says Max Blumenthal	https://www.aa.com.tr/en/live/us-unlikely-to-halt-arms-sales-to-israel-due-to-aipac-lobbying-expert/3389652	2024-11-10T00:07:26-08:00	
15 children among 42 Palestinians killed in Israeli attacks in northern Gaza	Several people still under rubble after Israeli jets struck inhabited home in Jabalia, medical source says	https://www.aa.com.tr/en/live/15-children-among-42-palestinians-killed-in-israeli-attacks-in-northern-gaza/3389646	2024-11-10T00:00:44-08:00	
32 Palestinians killed in Israeli strike on northern Gaza Strip	Several others also injured as Israeli army bombed house in Jabalia, medical sources tell Anadolu	https://www.aa.com.tr/en/live/32-palestinians-killed-in-israeli-strike-on-northern-gaza-strip/3389646	2024-11-10T00:00:44-08:00	
Türkiye commemorates founder Ataturk on 86th anniversary of his passing	Mustafa Kemal Ataturk, founder of the Republic of Türkiye, passed away in 1938 at age of 57	https://www.aa.com.tr/en/live/turkiye-commemorates-founder-ataturk-on-86th-anniversary-of-his-passing/3389616	2024-11-09T23:18:56-08:00	
Türkiye comes to halt for 2 minutes to pay respect to founding father Ataturk	At 9.05 a.m., sirens wailed nationwide to mark exact moment of passing of nation's beloved founder at age 57	https://www.aa.com.tr/en/live/turkiye-comes-to-halt-for-2-minutes-to-pay-respect-to-founding-father-ataturk/3389595	2024-11-09T22:34:22-08:00	
Ryan Babel, former Ajax, Liverpool winger retires from football	37-year-old Dutchman also played for Turkish archrivals Besiktas, Galatasaray	https://www.aa.com.tr/en/live/ryan-babel-former-ajax-liverpool-winger-retires-from-football/3389590	2024-11-09T22:28:09-08:00	
12 paramedics, civil defense volunteers killed in Israeli airstrikes on southern Lebanon	Strikes target Ain Baal, Deir Qanoun Ras Al-Ain, Hanouiyeh in Tyre	https://www.aa.com.tr/en/live/12-paramedics-civil-defense-volunteers-killed-in-israeli-airstrikes-on-southern-lebanon/3389583	2024-11-09T22:24:52-08:00	
Russia ratifies strategic military partnership with North Korea, pledges mutual defense assistance	Treaty commits to immediate military assistance should either nation face armed attack, in line with Article 51 of UN Charter	https://www.aa.com.tr/en/live/russia-ratifies-strategic-military-partnership-with-north-korea-pledges-mutual-defense-assistance/3389577	2024-11-09T22:13:41-08:00	
Belgian envoy to Türkiye says one of his priorities is to improve Türkiye-EU relations	Belgium is in favor' of Ankara's membership to EU, Hendrik Van de Velde tells Anadolu	https://www.aa.com.tr/en/live/belgian-envoy-to-turkiye-says-one-of-his-priorities-is-to-improve-turkiye-eu-relations/3389572	2024-11-09T22:00:19-08:00	
Liverpool shoutout Aston Villa 2-0, go 5 points clear at top of English Premier League	Nunez, Salah score for Reds at Anfield Stadium; nearest opponents, Man City, lose at Brighton	https://www.aa.com.tr/en/live/liverpool-shoutout-aston-villa-2-0-go-5-points-clear-at-top-of-english-premier-league/3389570	2024-11-09T21:50:08-08:00	
Juventus earn 2-0 derby win against Torino in Italian league	US midfielder Timothy Weah, Turkish star Kenan Yildiz score for home team	https://www.aa.com.tr/en/live/juventus-earn-2-0-derby-win-against-torino-in-italian-league/3389568	2024-11-09T21:44:34-08:00	
Trump excludes Haley, Pompeo from new administration	President-elect Donald Trump confirms former UN ambassador, ex-Secretary of State will not join Cabinet	https://www.aa.com.tr/en/live/trump-excludes-haley-pompeo-from-new-administration/3389567	2024-11-09T21:40:19-08:00	
Trump secures final swing state win in Arizona	President-elect has secured 312 electoral votes with 11 from Arizona	https://www.aa.com.tr/en/live/trump-secures-final-swing-state-win-in-arizona-/3389566	2024-11-09T21:36:35-08:00	
Morning Briefing: Nov. 10, 2024	Anadolu’s recap of top stories from around the globe	https://www.aa.com.tr/en/live/morning-briefing-nov-10-2024/3389563	2024-11-09T21:24:26-08:00	
Jamal Musiala scores stunner as German leaders Bayern Munich fight to win at St. Pauli	Visitors Bayern Munich secure 1-0 win to be 5 points clear of RB Leipzig at top of German Bundesliga table	https://www.aa.com.tr/en/live/jamal-musiala-scores-stunner-as-german-leaders-bayern-munich-fight-to-win-at-st-pauli/3389529	2024-11-09T12:43:23-08:00	
Netanyahu faces scandal over halted war cabinet recordings amid security probe	Israeli Prime Minister’s Office faces scrutiny for allegedly stopping recordings of key security meetings amid Gaza conflict, says local media	https://www.aa.com.tr/en/live/netanyahu-faces-scandal-over-halted-war-cabinet-recordings-amid-security-probe/3389527	2024-11-09T12:38:45-08:00	
Outrage sweeps Valencia as 130,000 protest Spain flood response	Protesters call for president of Valencia to step down after more than 220 people died	https://www.aa.com.tr/en/live/outrage-sweeps-valencia-as-130-000-protest-spain-flood-response/3389526	2024-11-09T12:35:45-08:00	
20 killed in fresh Israeli airstrikes in Baalbek, eastern Lebanon	Airstrikes hit towns of Kniseh, Hadath, Jamaliyah, Nabi Chit, Majdaloun, according to Health Ministry	https://www.aa.com.tr/en/live/20-killed-in-fresh-israeli-airstrikes-in-baalbek-eastern-lebanon/3389524	2024-11-09T12:30:40-08:00	
Real Madrid win over Osasuna, but lose defender Eder Militao to major injury	Vinicius Junior scores hat-trick as Whites earn 4-0 win in Madrid; Militao tore his knee ligament to be carried on stretcher	https://www.aa.com.tr/en/live/real-madrid-win-over-osasuna-but-lose-defender-eder-militao-to-major-injury/3389523	2024-11-09T12:19:10-08:00	
Israel kills 3 Palestinians shortly after their release in northern Gaza	Bodies were brought to Al-Shifa Hospital in Gaza City, according to witnesses and medical sources	https://www.aa.com.tr/en/live/israel-kills-3-palestinians-shortly-after-their-release-in-northern-gaza/3389520	2024-11-09T12:15:25-08:00	
Qatar denies withdrawing from Gaza cease-fire mediation	Foreign Ministry spokesman says efforts stalled temporarily	https://www.aa.com.tr/en/live/qatar-denies-withdrawing-from-gaza-cease-fire-mediation/3389517	2024-11-09T11:54:05-08:00	
Israeli strikes in Lebanon kill 19 more, taking death toll to 3,136	Nearly 14,000 others also injured in attacks since October 2023, Health Ministry says	https://www.aa.com.tr/en/live/israeli-strikes-in-lebanon-kill-19-more-taking-death-toll-to-3-136/3389507	2024-11-09T11:37:21-08:00	
Number of journalists killed in Israeli attacks on Gaza rises to 188	Media office identifies 4 more correspondents targeted in Palestinian enclave	https://www.aa.com.tr/en/live/number-of-journalists-killed-in-israeli-attacks-on-gaza-rises-to-188/3389506	2024-11-09T11:34:22-08:00	
French rail unions call for indefinite strike ahead of Christmas	Action to start on Dec. 11, unions say in joint statement	https://www.aa.com.tr/en/live/french-rail-unions-call-for-indefinite-strike-ahead-of-christmas/3389448	2024-11-09T09:43:47-08:00	
Biden and Trump to meet at White House on Wednesday	Meeting will take place at Oval Office, spokesperson says	https://www.aa.com.tr/en/live/biden-and-trump-to-meet-at-white-house-on-wednesday/3389445	2024-11-09T09:37:42-08:00	
Israeli airstrikes damage Lebanese University buildings in Beirut	Institution will 'remain resilient in the face of Israeli war machinery,' says university president	https://www.aa.com.tr/en/live/israeli-airstrikes-damage-lebanese-university-buildings-in-beirut/3389444	2024-11-09T09:36:11-08:00	
Ankara supports full membership of Turkish Republic of Northern Cyprus to Organization of Turkic States	As the Turkish world embraces the just cause of the Turkish Cypriots, our unity and solidarity will become even stronger,' Turkish vice president says	https://www.aa.com.tr/en/live/ankara-supports-full-membership-of-turkish-republic-of-northern-cyprus-to-organization-of-turkic-states/3389440	2024-11-09T09:21:35-08:00	
Rwanda discharges last patient of Marburg virus disease: WHO	Outbreak under control but surveillance measures continue, according to Health Ministry	https://www.aa.com.tr/en/live/rwanda-discharges-last-patient-of-marburg-virus-disease-who/3389392	2024-11-09T07:46:28-08:00	
Turkish foreign minister to attend OIC-Arab League foreign ministers meeting on Gaza crisis	Meeting to be held as part of extraordinary Joint Arab-Islamic follow-up summit in Saudi capital Riyadh	https://www.aa.com.tr/en/live/turkish-foreign-minister-to-attend-oic-arab-league-foreign-ministers-meeting-on-gaza-crisis/3389390	2024-11-09T07:44:31-08:00	
Turkish president congratulates Azerbaijan on its National Flag Day	I congratulate our friend, brother, and fateful partner Azerbaijan on State Flag Day,' says Recep Tayyip Erdogan	https://www.aa.com.tr/en/live/turkish-president-congratulates-azerbaijan-on-its-national-flag-day/3389388	2024-11-09T07:41:54-08:00	
Pentagon allows military contractors to work in Ukraine	US contractors to carry out repair and maintenance works of US-supplied weapons and military equipment	https://www.aa.com.tr/en/live/pentagon-allows-military-contractors-to-work-in-ukraine/3389384	2024-11-09T07:34:21-08:00	
2 killed, 26 injured in Israeli airstrike on central Gaza’s Al-Aqsa Matryrs Hospital	Army bombed tents for journalists, displaced people within hospital grounds for 9th time since Oct. 7, 2023, says media office	https://www.aa.com.tr/en/live/2-killed-26-injured-in-israeli-airstrike-on-central-gaza-s-al-aqsa-matryrs-hospital/3389383	2024-11-09T07:31:21-08:00	
US, UN discuss security challenges in Haiti, Somalia, Yemen	Over phone, Antony Blinken, Antonio Guterres share concerns over security situations in Haiti, Somalia, as well as detainees held by Houthis in Yemen	https://www.aa.com.tr/en/live/us-un-discuss-security-challenges-in-haiti-somalia-yemen/3389305	2024-11-09T04:58:10-08:00	
French court rejects plea to cancel pro-Israel Paris gala	Request to cancel gala with participation of Israeli finance minister dismissed despite opposition from rights groups, lawmakers	https://www.aa.com.tr/en/live/french-court-rejects-plea-to-cancel-pro-israel-paris-gala/3389295	2024-11-09T04:42:31-08:00	
Starvation signs appeared in northern Gaza amid Israeli blockade, warns Kamal Adwan Hospital director	Situation becomes ‘catastrophic’, injured patients lost their lives due to lack of resources, says Hussam Abu Safiya	https://www.aa.com.tr/en/live/starvation-signs-appeared-in-northern-gaza-amid-israeli-blockade-warns-kamal-adwan-hospital-director/3389291	2024-11-09T04:35:47-08:00	
Pakistan marks 147th birth anniversary of national poet Iqbal	Social, literary organizations hold seminars, exhibitions to honor Allama Mohammad Iqbal	https://www.aa.com.tr/en/live/pakistan-marks-147th-birth-anniversary-of-national-poet-iqbal/3389288	2024-11-09T04:33:57-08:00	
Chinese, Indonesian presidents vow to further strengthen ties	Indonesian leader Prabowo Subianto pays his 1st overseas trip to Beijing since being inaugurated as president last month	https://www.aa.com.tr/en/live/chinese-indonesian-presidents-vow-to-further-strengthen-ties/3389272	2024-11-09T04:10:41-08:00	
UAE, US discuss efforts to reach cease-fire in Gaza, Lebanon	Foreign Minister Al Nahyan, Secretary of State Blinken exchange views on recent developments in Middle East	https://www.aa.com.tr/en/live/uae-us-discuss-efforts-to-reach-cease-fire-in-gaza-lebanon/3389260	2024-11-09T03:54:54-08:00	
WHO chief warns of imminent famine in Northern Gaza, calls for urgent humanitarian aid	‘We call for an immediate scale-up and safe access for humanitarian aid within days not weeks,’ says Tedros Ghebreyesus	https://www.aa.com.tr/en/live/who-chief-warns-of-imminent-famine-in-northern-gaza-calls-for-urgent-humanitarian-aid/3389258	2024-11-09T03:52:23-08:00	
Azerbaijani flag included in Guinness Book as largest in world	Flag weighed over 500 kilograms, 6 master tailors sewed it in 2 weeks, according to Guinness World Records	https://www.aa.com.tr/en/live/azerbaijani-flag-included-in-guinness-book-as-largest-in-world/3389254	2024-11-09T03:38:19-08:00	
Fire causes significant damage in central Beirut	Power generator triggers massive fire in Hamra district, damaging buildings, cars	https://www.aa.com.tr/en/live/fire-causes-significant-damage-in-central-beirut/3389253	2024-11-09T03:36:01-08:00	
Türkiye ‘strongly condemns’ deadly terror attack in Pakistan	‘We will continue to support Pakistan in its fight against terrorism,’ Turkish Foreign Ministry says	https://www.aa.com.tr/en/live/turkiye-strongly-condemns-deadly-terror-attack-in-pakistan/3389251	2024-11-09T03:34:09-08:00	
Israeli army kills Palestinian in northern occupied West Bank	2 people also injured in Aqaba town due to Israeli army’s incursion, according to official sources	https://www.aa.com.tr/en/live/israeli-army-kills-palestinian-in-northern-occupied-west-bank/3389249	2024-11-09T03:32:09-08:00	
Hamas urges Arab-Islamic summit in Saudi Arabia to assume responsibility for occupied Jerusalem	Next week’s summit in Riyadh to address ongoing Israeli aggression against Palestinian territories, Lebanon	https://www.aa.com.tr/en/live/hamas-urges-arab-islamic-summit-in-saudi-arabia-to-assume-responsibility-for-occupied-jerusalem/3389247	2024-11-09T03:28:33-08:00	
Israel kills 44 more Palestinians in Gaza, death toll tops over 43,550	More than 102,700 Palestinians injured in Israeli onslaught since Oct. 7, 2023, Gaza’s Health Ministry says	https://www.aa.com.tr/en/live/israel-kills-44-more-palestinians-in-gaza-death-toll-tops-over-43-550/3389244	2024-11-09T03:25:40-08:00	
Palestine condemns terror attack in Pakistan	At least 26 killed in bomb explosion at Quetta city railway station	https://www.aa.com.tr/en/live/palestine-condemns-terror-attack-in-pakistan/3389238	2024-11-09T03:19:51-08:00	
Floods in South Sudan affect 1.4M people: UN	Over 379,000 people displaced by flooding, says UN Office for the Coordination of Humanitarian Affairs in East African country	https://www.aa.com.tr/en/live/floods-in-south-sudan-affect-14m-people-un/3389191	2024-11-09T02:24:46-08:00	
Türkiye’s Zero Waste Project to open pavilion at UN climate summit in Azerbaijan	Joint pavilion of Azerbaijan's Heydar Aliyev Foundation, Zero Waste project to be featured at COP29, scheduled on Nov.11-22	https://www.aa.com.tr/en/live/turkiye-s-zero-waste-project-to-open-pavilion-at-un-climate-summit-in-azerbaijan/3389179	2024-11-09T02:15:24-08:00	
Turkish first lady calls for gender balance, justice in technology	‘Just as it’s impossible for a bird to fly with one wing, a system where women are sidelined cannot function properly,’ says Emine Erdogan	https://www.aa.com.tr/en/live/turkish-first-lady-calls-for-gender-balance-justice-in-technology/3389176	2024-11-09T02:10:10-08:00	
