Title	Description	Link	pubDate	Image
Una delegación israelí llega a Egipto para hablar de la segunda f...	Una delegación negociadora israelí llegó este lunes a El Cairo en un intento de reavivar las conversaciones de la segunda fase del acuerdo de alto el fuego en Gaza sobre la liberación de rehenes israelíes a cambio de terroristas palestinos encarcelados en Israel.El equipo negociador israelí tiene previsto reunirse con el jefe de los servicios de Inteligencia egipcios, Hasan Rashad, según dijo una fuente de seguridad egipcia que pidió permanecer en el anonimato.Indicó que la delegación está encabezada por el coordinador de asuntos de los rehenes, Gal Hirsch, y entre cuyos miembros se encuentra el director del servicio de Inteligencia Exterior israelí (Mossad), David Barnea.Se trata del primer contacto anunciado con los mediadores desde que Hirsch y Barnea, entre otros representantes israelíes, abordaran el pasado día 9 en Qatar 'cuestiones técnicas' de la primera fase del acuerdo, ya que ese equipo no estaba autorizado para debatir sobre la segunda.Un comunicado de la Oficina del Primer Ministro, Benjamín Netanyahu, indicó el domingo que la delegación israelí fue autorizada a viajar a El Cairo para discutir la continuación de la primera fase del alto el fuego en Gaza, así como para que aborde la segunda fase, cuyas conversaciones se encontraban paralizadas.Egipto y Qatar, que mediaron junto con Estados Unidos el acuerdo de alto el fuego, han subrayado en los últimos días la necesidad de iniciar las negociaciones para la segunda fase que se encuentran paralizadas, y que debería haber comenzado el pasado 3 de febrero.El acuerdo entre Hamás e Israel ha sido ensombrecido por acusaciones mutuas de violar el pacto, mientras se instala en la escena el plan del presidente de EE.UU., Donald Trump, de reubicar temporal o permanentemente a los habitantes de Gaza a Egipto y Jordania, que los países árabes rechazan de forma categórica.Netanyahu, por su parte, ha defendido en reiteradas ocasiones el plan de Trump.Durante la primera fase de la tregua en Gaza, de 42 días de duración, Hamás debe liberar a 33 rehenes (19 lo han sido ya) a cambio de unos 1.900 terroristas palestinos presos.En Gaza quedan aún 70 rehenes israelíes de los 251 secuestrados el 7 de octubre de 2023, de los que al menos 34 están muertos, según las Fuerzas de Defensa de Israel (FDI).Además, hay tres rehenes desde hace una década, entre ellos un soldado muerto. Todos ellos están incluidos en el acuerdo de alto el fuego e intercambio de rehenes por terroristas palestinos presos, que entró en vigor el 19 de enero. Agencias colaboraron con este artículo de Aurora La entrada Una delegación israelí llega a Egipto para hablar de la segunda fase del acuerdo por los rehenes se publicó primero en Aurora Israel Noticias en Español.	https://aurora-israel.co.il/una-delegacion-israeli-llega-a-egipto-para-hablar-de-la-segunda-fase-del-acuerdo-de-gaza/	2025-02-17T03:51:28-08:00	
Putin designó a sus enviados para iniciar las negociaciones entre...	El Kremlin estará representado por el canciller Serguei Lavrov y el asesor presidencial Yuri Ushakov. El secretario de Estado estadounidense, Marco Rubio, ya se encuentra en Riad El Kremlin anunció hoy una reunión para el martes entre representantes de Rusia y Estados Unidos en la capital de Arabia Saudita, Riad, para abordar la normalización de las relaciones bilaterales, los preparativos para una cumbre entre los presidentes de ambos países y unas futuras negociaciones de paz sobre Ucrania. Por orden del presidente, Vladimir Putin, Rusia estará representada por el ministro de Exteriores, Serguei Lavrov, y el asesor del Kremlin, Yuri Ushakov, quienes ya partieron hacia Riad, explicó Dmitri Peskov, portavoz presidencial, en su rueda de prensa telefónica diaria. 'Se espera que el martes en Riad ellos mantengan una reunión con sus homólogos estadounidenses, que estará centrada primero de todo en el restablecimiento de todo el abanico de las relaciones rusas-estadounidenses', dijo. Peskov añadió que el encuentro también estará dedicado 'a la preparación de las posibles negociaciones para el arreglo en Ucrania y la organización de la reunión' entre Putin y su colega estadounidense, Donald Trump. El portavoz del Kremlin destacó que a día de hoy en el mundo 'todos ahora intentan hablar de lo que hay que hacer para parar, sea como sea, la guerra'. 'Esto es algo positivo', dijo. Mientras tanto, el secretario de Estado estadounidense, Marco Rubio, ya se encuentra en Riad para las conversaciones. Junto con Rubio, se espera que funcionarios estadounidenses como el asesor de seguridad nacional de Trump, Mike Waltz, y el enviado de la Casa Blanca para el Medio Oriente, Steve Witkoff, también participen en las reuniones. Estas conversaciones se producen después de que el presidente de los EEUU, Donald Trump, hablara por teléfono la semana pasada Putin y ordenara a los altos funcionarios estadounidenses iniciar negociaciones para acabar con el conflicto, una promesa que Trump reiteró durante su campaña presidencial. Riad, que también está involucrada en negociaciones con Washington sobre el futuro de la Franja de Gaza, ha desempeñado un papel clave en los primeros contactos entre la administración Trump y Moscú, facilitando un intercambio de prisioneros la semana pasada. Estas conversaciones serán de alto nivel y marcan uno de los primeros encuentros presenciales entre funcionarios estadounidenses y rusos en años. En declaraciones hechas el domingo, Rubio comentó que las próximas semanas determinarán si Putin está realmente interesado en lograr la paz. Al mismo tiempo, el presidente ucraniano Volodimir Zelensky también se encuentra en la región. El domingo llegó a los Emiratos Árabes Unidos, y aunque tiene previsto visitar Arabia Saudita y Turquía, no se ha establecido una fecha para estos viajes. Zelensky aclaró que no tiene planes de reunirse con funcionarios rusos o estadounidenses, y no se espera que Ucrania participe en las conversaciones organizadas por Arabia Saudita. Conversaciones sobre Gaza Rubio se reunirá con el Príncipe Heredero Mohammed bin Salman (MbS) de Arabia Saudita. En la agenda también se incluye la propuesta de Trump sobre el reasentamiento de los palestinos de Gaza en otros países árabes, con EEUU liderando la reconstrucción de la región. Esta propuesta ha generado indignación en el mundo árabe y ha aumentado los temores entre los palestinos en Gaza de ser desplazados de la franja costera. Arabia Saudita, junto con otras naciones árabes, ha rechazado cualquier plan que implique el reasentamiento de los palestinos. En cambio, Riad lidera los esfuerzos árabes para desarrollar una contrapropuesta que podría incluir un fondo de reconstrucción encabezado por los países del Golfo y un acuerdo para dejar de lado a Hamás. El príncipe heredero MbS también ha insistido en que Arabia Saudita no normalizará sus relaciones con Israel, un objetivo de larga data de Washington, sin que se logre un acuerdo sobre la creación de un estado palestino. El domingo, Rubio también visitó Israel y se reunió con el primer ministro Benjamín Netanyahu, reafirmando el apoyo estadounidense a Israel en su rivalidad regional con Irán. Fuente: INFOBAE y Aurora La entrada Putin designó a sus enviados para iniciar las negociaciones entre Rusia, Estados Unidos y Ucrania para poner fin a la guerra se publicó primero en Aurora Israel Noticias en Español.	https://aurora-israel.co.il/putin-designo-a-sus-enviados-para-iniciar-las-negociaciones-entre-rusia-estados-unidos-y-ucrania-para-poner-fin-a-la-guerra/	2025-02-17T03:17:20-08:00	
Israel enviará un equipo negociador a Egipto para tratar la conti...	Benjamín Netanyahu dio instrucciones a la delegación para que viaje a El Cairo este lunes. El premier tomó la decisión en coordinación con el enviado especial del presidente de Estados Unidos para Medio Oriente, Steve Witkoff El primer ministro de Israel, Benjamín Netanyahu, dio instrucciones a la delegación negociadora israelí para que viaje a El Cairo este lunes a discutir la continuación de la primera fase del alto el fuego en Gaza, así como para que aborde la segunda fase, cuyas conversaciones se encontraban paralizadas. 'Tras la reunión del gabinete programada para mañana, el equipo recibirá instrucciones para la continuación de las negociaciones sobre las cuestiones de la Fase B', recogió este domingo un comunicado de la Oficina del primer ministro. Netanyahu tomó la decisión en coordinación con el enviado especial del presidente de Estados Unidos para Oriente Medio, Steve Witkoff, con quien mantuvo hoy una llamada telefónica en la que también le informó de su intención de reunir al gabinete de seguridad el lunes para tratar la segunda fase de la tregua. En función del rumbo que tome la reunión del gabinete de seguridad israelí, que gestiona el curso de la guerra, la delegación recibirá pautas para abordar las negociaciones de la segunda fase del alto el fuego, en la que se plantea la puesta en libertad de los rehenes que quedan vivos en Gaza y el fin definitivo de las hostilidades en el enclave. El 9 de febrero, Israel envió a Qatar una delegación negociadora compuesta por representantes del Mosad (el servicio de inteligencia exterior), el Shin Bet (el interior) y el coordinador de asuntos de los rehenes, Gal Hirsch, para que abordara 'cuestiones técnicas' de la primera fase del acuerdo. El equipo no estaba autorizado para debatir sobre la segunda. Las negociaciones de la segunda fase del alto el fuego en Gaza deberían haber comenzado el pasado 3 de febrero, pero se encontraban paralizadas. Este domingo, los islamistas apremiaron a los mediadores (Qatar, Egipto y Estados Unidos) para que impulsaran las conversaciones. 'Lo que puedo asegurar es que las negociaciones no empezaron hasta ahora. Esto es una violación muy grave que demuestra las malas intenciones (de Israel) con respecto al futuro del acuerdo', dijo este domingo a EFE Basem Naim, miembro del buró político de Hamás. En un comunicado conjunto por el encuentro entre Netanyahu y el secretario de Estado de EEUU, Marco Rubio, el israelí aseguró que Trump y él comparten una estrategia sobre la región cuyos detalles no siempre pueden hacerse públicos, entre ellos 'cuándo se abrirán las puertas del infierno' sobre Gaza. Por otro lado, el jefe del Estado Mayor israelí, Herzi Halevi, aseguró el sábado que Israel prepara 'planes ofensivos' en Gaza, mientras hace 'enormes esfuerzos' para traer de vuelta a los rehenes que todavía permanecen en el enclave. El grupo terrorista Hamás liberó este sábado a tres rehenes como parte del alto el fuego en la Franja de Gaza, vigente desde mediados de enero. Se trata de Sasha Trufanov, un ruso-israelí de 29 años; Sagui Dekel-Chen, de 36 años, con ascendencia estadounidense; y Iair Horn, un argentino-israelí de 46 años. El ministro de Defensa de Israel, Israel Katz, celebró la puesta en libertad de tres rehenes israelíes, aunque advirtió que las tropas en el enclave palestino están 'completamente desplegadas y preparadas para cualquier escenario' en caso de que el grupo terrorista Hamas trate de 'violar el acuerdo' de alto el fuego. (Con información de EFE)Fuente: INFOBAE La entrada Israel enviará un equipo negociador a Egipto para tratar la continuación de la primera fase del alto el fuego en Gaza se publicó primero en Aurora Israel Noticias en Español.	https://aurora-israel.co.il/israel-enviara-un-equipo-negociador-a-egipto-para-tratar-la-continuacion-de-la-primera-fase-del-alto-el-fuego-en-gaza/	2025-02-16T14:35:23-08:00	
Rubio y Netanyahu ratificaron la alianza de EE.UU. e Israel para ...	En su declaración conjunta, el premier israelí destacó la existencia de una estrategia común, incluida 'cuándo se abrirán las puertas del infierno', si no se libera a todos los rehenes Román LejtmanEnviado especial a Jerusalén Marco Rubio se reunió este domingo con el primer ministro israelí, Benjamín Netanyahu, para analizar la situación en Medio Oriente y tratar la iniciativa de Donald Trump destinada a trasladar a los palestinos de Gaza y derrotar a la organización terrorista Hamás. Tras el encuentro, el premier israelí y el secretario de Estado ratificaron la vigencia del proyecto de Trump respecto a Gaza y coincidieron en señalar a Irán como el principal enemigo regional de Estados Unidos e Israel. 'El presidente Trump y yo estamos totalmente coordinados con una estrategia compartida. No todo puede revelarse, ni siquiera cuándo se abrirán las puertas del infierno, como seguramente ocurrirá si no se libera hasta el último de todos nuestros rehenes', advirtió Netanyahu durante su declaración pública. A su lado, se encontraba Rubio, que aprovechó la oportunidad para confirmar el apoyo de la Casa Blanca a Israel. Marco Rubio recuerda a las víctimas judías asesinadas por los nazis, durante su visita al Museo del Holocausto Yad Vashem en Jerusalén, (Israel) 'Quiero transmitir a la gente de este gran país, por todo lo que han pasado y por lo que pasarán, que son un país extraordinario. Se han levantado de las cenizas de un momento muy bajo en la historia de la humanidad, enfrentándose a amenazas de todos lados y son un ejemplo para todo el mundo. Si hubiera más Israel en Oriente Medio, habría más paz y tranquilidad'. Durante la reunión a solas, Rubio y Netanyahu coincidieron en la necesidad de 'eliminar' a Hamás, y afirmaron que Teherán despliega sus recursos financieros y militares para sostener a todas las organizaciones terroristas de Medio Oriente. 'Hamás no puede continuar como una fuerza militar ni de gobierno&#8230; deben ser eliminados', dijo el jefe de la diplomacia norteamericana durante su presentación pública. Rubio cree que la iniciativa de Washington para reconstruir la Franja también puede contener las actividades fundamentalistas que ejecutan Hezbollah, los Huties y la Jihad Islámica. Y lo más importante, la administración israelí está de acuerdo: 'Discutimos la audaz visión de Trump para el futuro de Gaza y trabajaremos para asegurar que esa visión se convierta en realidad', aseguró Netanyahu al concluir la cita con Rubio. Además de abordar la situación en Gaza, Siria y Líbano, Netanyahu y el secretario de Estado debatieron acerca del rol de Irán en Medio Oriente. Rubio y el premier israelí coincidieron sobre el papel desestabilizador que protagoniza el régimen de los ayatolas con su proyecto nuclear. 'Irán nunca podrá ser nuclear, un Irán nuclear que pueda entonces considerarse inmune a presiones y acciones. Eso nunca podrá suceder', señaló el secretario de Estado norteamericano. La agenda de Rubio también incluyó una reunión con Gideon Saar, ministro de Relaciones Exteriores de Israel, y con el presidente de Israel, Isaac Herzog, antes de visitar el Museo del Holocausto Yad Vashem. Rubio y Saar trataron la vigencia de los Acuerdos de Abraham -firmados durante la primera administración de Trump-, el traslado de la embajada de Estados Unidos desde Tel Aviv a Jerusalén, la lucha contra el antisemitismo global y las negociaciones para avanzar hacia la segunda etapa del cese del fuego. Esa agenda se repitió en el cónclave que protagonizaron Rubio y Herzog, adonde se analizó la marcha de las negociaciones para iniciar la segunda fase de la tregua pactada entre Israel y Hamás. 'Es un honor para nosotros tenerlo entre nosotros, en nuestro país. No tiene idea de lo mucho que significa para nosotros en estos días y tiempos difíciles que nuestra nación ha atravesado y soportado desde el 7 de octubre. Agradecemos al presidente Donald Trump su amistad y solidaridad con el pueblo de Israel y el Estado de Israel, y estamos agradecidos por su participación directa en el regreso de nuestros rehenes', afirmó Herzog cuando recibió al secretario de Estado. A continuación, el secretario de Estado reiteró el apoyo político de la administración republicana para recuperar a los cautivos secuestrados por Hamás en Gaza. 'En cuanto a la cuestión que usted mencionó sobre los rehenes, quiero decirles, en nombre del presidente, que está firme y profundamente comprometido con el objetivo de que todos los rehenes regresen a casa, todos y cada uno, y que no descansará, no guardará silencio, no olvidará hasta que todos regresen a casa. Trabajamos en estrecha coordinación con el gobierno aquí, como usted sabe, para que eso se haga realidad, y esa sigue siendo una prioridad muy importante', preciso Rubio. Las declaraciones del secretario de Estado revelan la preocupación que tiene la Casa Blanca acerca de los casi 80 rehenes -entre vivos y muertos- que aún están a merced de la organización terrorista. Ya se negocia una segunda fase de la tregua, y la incertidumbre política complica las conversaciones que tienen a Doha (Qatar) como escenario principal. La segunda etapa del cese del fuego establece que Hamás debe liberar a todos los rehenes -vivos y muertos-, mientras que Netanyahu debe ordenar la retirada de todas las Fuerzas de Defensa de Israel que están desplegadas en Gaza. El premier israelí no quiere retirar las tropas, y eso implicaría que la organización terrorista no entregará un solo rehén más. La negativa de Netanyahu tiene una razón militar: si las tropas propias se van de Gaza, Hamás se queda con el control territorial y puede atacar de nuevo. A su vez, el 61 por ciento de la sociedad israelí -última encuesta publicada- exige que se logre la libertad de los cautivos. Sólo un 18 por ciento optó por ir a la guerra contra Hamás, en lugar de recuperar a los secuestrados en la Franja. Trump advirtió a Hamás que si no liberaba a todos los rehenes a las 12 AM del sábado (hora del Este), se rompía el cese del fuego y la guerra se iniciaba otra vez. Hubo una intensa negociación liderada por Egipto y Qatar que permitió la libertad de tres rehenes y la continuidad de las conversaciones para avanzar hacia la segunda fase de la tregua. En su red social, Trump festejó la libertad de los tres secuestrados y ratificó que avalaría todas las medidas que asuma Israel respecto a Gaza y Hamás. 'Estados Unidos apoyará las decisiones que tome', posteó el líder republicano. Desde esta perspectiva, Netanyahu y Rubio trabajarán en Jerusalén para diseñar una respuesta a Hamás que permita liberar a los rehenes y mantener a las tropas del ejército israelí en la Franja. Los dos objetivos corren a la par, y no son excluyentes para el primer ministro y el secretario de Estado. Cuando termine su gira por Israel, Rubio partirá a Emiratos Árabes Unidos y Arabia Saudita. En Abu Dabi y Riad, el secretario de Estado se encontrará con otro escenario geopolítico. Estos países árabes rechazan a Hamás y condenan sus actos terroristas, pero respaldan la existencia de Palestina y descartan el plan de Trump para Gaza. Rubio deberá extremar su capacidad diplomática para regresar de los Emiratos y Arabia Saudita con un resultado positivo. La gira del secretario de Estado es un desafío geopolítico. Israel acepta la iniciativa del presidente de los Estados Unidos, pero no ha logrado un mínimo consenso en el mundo árabe. Jordania, Egipto, Arabia Saudita, Irán, Emiratos Árabes Unidos, Qatar y Líbano rechazaron la propuesta de Trump para terminar con Hamás en Gaza. La iniciativa de la Casa Blanca tiene tres etapas: trasladar a los países vecinos -todos árabes- a los casi dos millones de palestinos que viven en Gaza, derrotar a Hamás que aún se esconde en los túneles de la Franja, y por último, convertir la actual zona de conflicto en la 'Riviera de Medio Oriente', como caracterizó Trump. Los estados árabes se niegan a recibir a los palestinos de Gaza, y esa resistencia política pone en un callejón sin salida a la propuesta de la Casa Blanca. Trump intentó convencer al rey Abdullah II de Jordania, a quien invitó a Washington, pero todo quedó en la nada. El líder republicano también había acordado un encuentro con Abdelfatah El-Sisi -presidente de Egipto- para explicar su propuesta en detalle. El-Sisi canceló la visita para evitar un roce diplomático con Estados Unidos. El presidente de Egipto, como el rey de Jordania, tampoco avala la propuesta de Trump para Gaza. 'Todos estos países árabes dicen lo mucho que les importan los palestinos, pero ninguno de ellos quiere recibir a ningún palestino, ninguno de ellos tiene antecedentes de hacer algo por Gaza en ese sentido. Y entonces el presidente (Trump) dice, muy bien, esto es lo que vamos a hacer. Nos encargaremos. Tendremos que trasladar a la gente. Es el único plan que hay en este momento', dijo Rubio antes de volar a Medio Oriente. Y agregó en un comentario directo al mundo árabe: 'Ahora bien, si alguien tiene un plan mejor –y esperamos que así sea–, si los países árabes tienen un plan mejor, entonces será estupendo. Entonces, si dicen que lo tienen, lo van a presentar, lo vamos a analizar, a ver qué incluye y qué hace. Obviamente, puedo decirles que cualquier plan que deje a Hamás allí va a ser un problema, porque Israel no lo va a tolerar. Vamos a volver a estar donde estábamos. Pero les vamos a dar la oportunidad de presentar un plan'. Si los estados árabes no acompañan la propuesta de Trump, quedan dos caminos hacia adelante: Hamás permanece en Gaza y mantiene un jaque perpetuo a Israel, o Israel avanza sobre la Franja para terminar con la organización terrorista. 'Hamás tiene armas. Alguien tiene que enfrentarse a esos tipos. ¿Quiénes serán? No van a ser los soldados estadounidenses. Si los países de la región no pueden resolver ese aspecto, entonces Israel tendrá que hacerlo, y entonces volveremos a estar donde estábamos', explicó el secretario de Estado para justificar la propuesta de Trump. En Medio Oriente, los espejismos forman parte del ejercicio del poder. Fuente: INFOBAE La entrada Rubio y Netanyahu ratificaron la alianza de EE.UU. e Israel para eliminar a Hamás en Gaza se publicó primero en Aurora Israel Noticias en Español.	https://aurora-israel.co.il/rubio-y-netanyahu-ratificaron-la-alianza-de-eeuu-e-israel-para-eliminar-a-hamas-en-gaza/	2025-02-16T14:18:31-08:00	
El jefe de las Fuerzas de Defensa de Israel viaja a EEUU mientras...	El comandante en jefe saliente del Estado Mayor de las Fuerzas de Defensa de Israel (FDI), teniente general Herzi Halevi, viajará esta noche a Estados Unidos para reunirse con la cúpula militar de este país aliado, mientras aumentan las dudas sobre el futuro del alto el fuego en la Franja de Gaza.En su viaje, que durará del 17 al 20 de febrero, Halevi mantendrá reuniones con el jefe del Estado Mayor Conjunto de EE.UU., general Charles Brown, con el jefe del Comando Central, general Michael Kurilla, y con otros altos cargos militares 'para tratar asuntos estratégicos y operativos clave', dijeron las FDI en un comunicado.Durante su ausencia, el subjefe del Estado Mayor, general Amir Baram, ejercerá el cargo de jefe de las fuerzas armadas.Halevi, que anunció su dimisión a mediados de enero y dejará el cargo el 6 de marzo, aprovechará además el viaje para agradecer la cooperación militar estadounidense durante la guerra contra el grupo terrorista islámico Hamás en Gaza y 'explorar maneras de impulsar aún más esta cooperación', según el comunicado.El anuncio se produce después de que esta mañana llegara a Israel un cargamento con bombas estadounidenses de casi una tonelada de peso cada una, que el Gobierno del anterior presidente, Joe Biden, había congelado por temor a que fueran utilizadas en Gaza.Trump dio ayer su apoyo al Gobierno de Jerusalén para hacer lo que considere con el acuerdo de alto el fuego en curso en la Franja de Gaza, días después de haberle dado un ultimátum a Hamás para liberar a todos los rehenes antes del sábado; sin especificar si se refería a los 9 que quedaban de la primera fase o a los más de 70.Anoche, el primer ministro, Benjamín Netanyahu, dijo que tiene pensado reunir 'lo antes posible' a su Gabinete de Seguridad para decidir los próximos pasos del alto el fuego, pese a que las negociaciones para la segunda fase siguen sin haber comenzado dos semanas después de la fecha fijada para hacerlo. Agencias colaboraron con este artículo de Aurora La entrada El jefe de las Fuerzas de Defensa de Israel viaja a EEUU mientras crecen dudas sobre la tregua se publicó primero en Aurora Israel Noticias en Español.	https://aurora-israel.co.il/el-jefe-de-las-fuerzas-de-defensa-de-israel-viaja-a-eeuu-mientras-crecen-dudas-sobre-la-tregua/	2025-02-16T02:36:12-08:00	
