Title	Description	Link	pubDate	Image
Estados Unidos apoya una presencia indefinida de Israel en el sur...	El ministro de Defensa israelí, Israel Katz, anunció que Estados Unidos ha dado 'luz verde' a Israel para permanecer 'indefinidamente' en la zona de amortiguación en la que mantiene a sus tropas en el sur de Líbano. 'En la zona de amortiguación de Líbano nos quedamos indefinidamente: depende de la situación, no del tiempo. Hemos recibido luz verde de Estados Unidos', dijo Katz en una conferencia ante los jefes de los consejos regionales israelíes. De la misma forma, el titular de Defensa dijo que las Fuerzas de Defensa de Israel (FDI) permanecerán de forma indefinida en la zona de amortiguación en la frontera con Siria, tanto en la cumbre del Monte Hermón como en otros puntos que no especificó. Katz anunció el 18 de febrero que el Ejército permanecería en cinco puntos próximos a la frontera entre Israel y Líbano más allá de lo estipulado por el acuerdo de alto el fuego en este país. '¿Cuál es la principal conclusión que sacáis del 7 de octubre?', asegura el ministro que preguntó a varios comandantes de las fuerzas armadas: 'Ellos dijeron que no podemos permitir a organizaciones extremistas de este tipo estar cerca de la frontera con Israel, ya sea en Siria, en el norte (con Líbano) en Siria o cerca de los asentamientos en Judea y Samaria'. La entrada Estados Unidos apoya una presencia indefinida de Israel en el sur libanés se publicó primero en Aurora Israel Noticias en Español.	https://aurora-israel.co.il/estados-unidos-apoya-una-presencia-indefinida-de-israel-en-el-sur-libanes/	2025-02-27T06:07:50-08:00	
Netanyahu envía una delegación a El Cairo para seguir con las con...	El primer ministro israelí, Benjamín Netanyahu, informó este jueves que ha enviado a una delegación negociadora a El Cairo para continuar las negociaciones del alto el fuego con Hamás, a dos días del fin de la primera fase del alto el fuego. 'El primer ministro Netanyahu ordenó el envío hoy de una delegación negociadora a El Cairo para continuar las conversaciones', indicó su oficina en escueto comunicado publicado después del canje de rehenes israelíes por terroristas presos palestinos que tuvo lugar esta madrugada. Este canje es el último de la primera fase del alto el fuego, que concluye este sábado sin que se sepa qué ocurrirá después, ya que no hay acuerdo sobre la segunda fase. Hamás dijo esta madrugada estar dispuesto a iniciar conversaciones con Israel para definir una segunda etapa del alto el fuego y aseguró que la única forma de liberar a los restantes rehenes israelíes es mediante el compromiso con dicho acuerdo. El grupo terrorista entregó en Gaza a la medianoche del jueves los últimos cuatro cuerpos rehenes previstos en la primera fase sin ningún tipo de ceremonia, como había acordado con Israel. Por su parte, Israel liberó esta madrugada 620 criminales palestinos de prisiones israelíes, correspondientes a seis rehenes vivos liberados la semana pasada junto a cuatro cuerpos de cautivos. Se espera que este jueves libere a unos 40 más, correspondientes a los cuatro cuerpos entregados en la noche del jueves. La entrada Netanyahu envía una delegación a El Cairo para seguir con las conversaciones de la tregua se publicó primero en Aurora Israel Noticias en Español.	https://aurora-israel.co.il/netanyahu-envia-una-delegacion-a-el-cairo-para-seguir-con-las-conversaciones-de-la-tregua/	2025-02-27T05:58:43-08:00	
Katz: Israel está listo para volver a la guerra a dos días del fi...	El ministro de Defensa israelí, Israel Katz, afirmó este jueves que las Fuerzas de Defensa de Israel (FDI) están preparadas para volver a la guerra en Gaza, a falta de dos días para que concluya la primera fase del alto el fuego y sin que hayan trascendido detalles sobre el paso a la segunda. 'Queremos recuperarlos a todos (los rehenes cautivos en Gaza) y la forma más significativa de continuar es que Hamás sepa que las Fuerzas de Defensa de Israel están preparadas para volver a la guerra, y esa es la verdad', dijo el titular de Defensa en una conferencia ante los jefes de los consejos regionales israelíes. Katz aseguró que las tropas están preparadas en materia defensiva, alegando que 'incluso durante el alto el fuego' Israel ha recibido informaciones sobre planes de los terroristas palestinos para atacar tanto a sus soldados como los asentamientos en Judea y Samaria. El ministro se refirió también a la presencia del Ejército en el corredor de Filadelfia, la franja de 14 kilómetros que separa Gaza de Egipto. Esta mañana, un alto funcionario israelí anunció en un comunicado que Israel pretende mantener su presencia en esta frontera. Aseguró que ha visitado el corredor y ha visto allí túneles que entran a Gaza desde el lado egipcio: 'En el momento en que hay túneles que cruzan, de no controlar esa ruta, en estos 42 días (la primera fase de la tregua) todo se habría llenado de armas', añadió. 'El Ejército mantiene una zona de amortiguación definida en Gaza, incluidas posiciones dentro del territorio más allá de lo dispuesto en nuestro lado, incluido el corredor de Filadelfia', dijo Katz, en referencia a las tropas israelíes que se encuentran en territorio gazatí. La entrada Katz: Israel está listo para volver a la guerra a dos días del final de primera fase de tregua se publicó primero en Aurora Israel Noticias en Español.	https://aurora-israel.co.il/katz-israel-esta-listo-para-volver-a-la-guerra-a-dos-dias-del-final-de-primera-fase-de-tregua/	2025-02-27T05:50:28-08:00	
Netanyahu envía sus condolencias a familiares de cuatro rehenes a...	El primer ministro, Benjamín Netanyahu, envió este jueves sus condolencias en un mensaje en su cuenta de X a los familiares de los cuatro rehenes Itzik Elgarat, Ohad Yahalomi, Shlomo Mansur y Tsahi Idan cuyos cuerpos entregó Hamás esta pasada noche como parte del acuerdo del alto el fuego.'Mi esposa Sarah y yo enviamos nuestras más profundas condolencias a las familias de (&#8230;) nuestros cuatro rehenes caídos a quienes devolvimos del cautiverio de Hamas a Israel esta noche. Que su memoria sea bendita. Dios levantará su sangre', escribió el mandatario.En un comunicado anterior, su oficina confirmó que había concluido satisfactoriamente el proceso de identificación de los cuatro cuerpos por parte del Centro Nacional de Medicina Forense y la Policía de Israel.Asimismo, en la nota también informaron de que según los servicios de inteligencia, Ohad, Tsahi e Itzik 'fueron asesinados en cautiverio en Gaza' mientras que Shlomo 'fue asesinado en la masacre del 7 de octubre de 2023 y su cuerpo fue retenido en la Franja de Gaza'.'A las queridas familias, estamos de luto con ustedes. Todo el pueblo de Israel os abraza y comparte vuestro dolor. Seguiremos trabajando incansablemente hasta que todos regresen', añadió Netanyahu en su mensaje.Sobre el inicio de las conversaciones para la segunda fase de la tregua, que debería comenzar este domingo, Netanyahu no se ha pronunciado, mientras que el grupo terrorista palestino en un comunicado dijo estar dispuesto a retomar el diálogo y recordó que es la única forma de que los 59 rehenes restantes (cerca de una treintena de ellos muertos, según las Fuerzas de Defensa de Israel) salgan del enclave. Agencias colaboraron con este artículo de Aurora La entrada Netanyahu envía sus condolencias a familiares de cuatro rehenes asesinados por Hamás se publicó primero en Aurora Israel Noticias en Español.	https://aurora-israel.co.il/netanyahu-envia-sus-condolencias-a-familiares-de-cuatro-rehenes-asesinados-por-hamas/	2025-02-27T04:21:28-08:00	
Israel permitirá a los palestinos abandonar Gaza a través de un p...	El ministro de Defensa, Israel Katz, afirmó este jueves que permitirá a los palestinos que quieran abandonar Gaza voluntariamente hacerlo a través del puerto de Ashdod y del aeropuerto de Ramon, ambos en territorio israelí.'Estoy en un proceso acelerado para establecer una administración de emigración voluntaria y permitir que aquellos que quieran abandonar Gaza voluntariamente, lo hagan a través del puerto de Ashdod y a través del aeropuerto de Ramon', dijo en un comunicado sobre este plan, que anunció hace días tras el mensaje del presidente de Estados Unidos, Donald Trump, de reubicar a la población de Gaza, y ahora concreta con esos dos posibles puntos de salida.En el comunicado, publicado coincidiendo con el último canje de rehenes israelíes cautivos en Gaza por terroristas palestinos presos que pone fin a la primera fase de la tregua, Katz añade que 'Hamás no seguirá teniendo el control de Gaza, ni civil ni militar', algo que 'no podrá ser porque no puede ser'.Y continúa diciendo que espera que el plan de Trump de reubicar un número de sus dos millones de habitantes para reconstruir y convertir Gaza en un centro de turismo se haga realidad.'Espero que así sea, y espero que sea después de que las Fuerzas de Defensa de Israel decidan', agrega el ministro de Defensa.El pasado 15 de febrero, tras las palabras de Trump, Katz anunció el establecimiento de un 'Directorio para la Salida Voluntaria de los Residentes de Gaza' dentro de su cartera, que busca asistir a los palestinos de la Franja que quieran abandonar ese territorio puedan hacerlo.'El plan incluye asistencia extensiva que permitirá a cualquier residente de Gaza que quiera emigrar voluntariamente a un tercer país a recibir un paquete que incluye, entre otras cosas, disposiciones especiales de salida por tierra, mar y aire', recogió entonces un comunicado del ministerio de Defensa. Agencias colaboraron con este artículo de Aurora La entrada Israel permitirá a los palestinos abandonar Gaza a través de un puerto y un aeropuerto se publicó primero en Aurora Israel Noticias en Español.	https://aurora-israel.co.il/israel-permitira-a-los-palestinos-abandonar-gaza-a-traves-de-un-puerto-y-un-aeropuerto/	2025-02-27T03:58:54-08:00	
¿Quiénes son los rehenes asesinados por Hamás que fueron entregad...	Anoche, el grupo terrorista islámico palestino Hamás entregó a Israel los últimos cuatro cuerpos de rehenes pactados para esta primera fase del acuerdo del alto el fuego que corresponden a Itzik Elgarat, de 70 años; Ohad Yahalomi, de 50; Shlomo Mansur, de 85; y Tsahi Idan, de 50 cuyas identidades confirmó Israel. La Oficina del Primer Ministro, Benjamín Netanyahu, recalcó en un comunicado que, según los servicios de inteligencia, Ohad, Tsahi e Itzik fueron 'asesinados en cautiverio' mientras que Shlomo 'fue asesinado' durante los ataques del 7 de octubre. Itzik Elgarat, 70 años Vivió muchos años en Dinamarca y después se mudó al kibutz Nir Oz, donde desempeñaba tareas de mantenimiento. Padre de dos hijos, el 7 de octubre de 2023 fue secuestrado por terroristas palestinos de su casa mientras hablaba por teléfono con su hermano Danny. Tsahi Idan, de 50 años Residente del kibutz Nahal Oz, trabajaba en la industria de la tecnología. El 7 de octubre fue también secuestrado en su casa por terroristas islámicos que asesinaron a su hija mayor, Maayan, de 18 años. Su mujer y sus dos hijos pequeños sobrevivieron. Shlomo Mansur, de 85 años Residente del kibutz Kissufim que ayudó a fundar a los 16 años después de emigrar a Israel desde Irak en 1951, tras haber sobrevivido el pogromo contra los judíos conocido como el 'Farhud'. Padre de cinco hijos y abuelo de doce nietos. A lo largo de su vida se dedicó a la jardinería y trabajó en varias fábricas. El 7 de octubre terroristas palestinos irrumpieron en su casa secuestrándolo a él y a su esposa Mazal. De camino al vehículo, su esposa logró escapar. Ohad Yahalomi, de 50 años Residente del kibutz Nir Oz y padre de tres hijos, trabajó como instructor y guardabosques. El de 7 octubre, Yahalomi encerró a su familia en el refugio de su casa mientras él se quedó afuera donde se enfrentó a los terroristas gazatíes a tiros. Finalmente, su esposa y sus tres hijos fueron secuestrados, aunque lograron escapar. El tercer hijo Eitan fue liberado en el primer acuerdo de tregua firmado entre la organización terrorista Hamás e Israel en noviembre de 2023. Agencias colaboraron con este artículo de Aurora La entrada ¿Quiénes son los rehenes asesinados por Hamás que fueron entregados anoche a Israel? se publicó primero en Aurora Israel Noticias en Español.	https://aurora-israel.co.il/quienes-son-los-rehenes-asesinados-por-hamas-que-fueron-entregados-anoche-a-israel/	2025-02-27T03:44:57-08:00	
Israel confirma que los cuerpos entregados por Hamás corresponden...	El presidente, Isaac Herzog, confirmó este jueves que los cuatro cuerpos entregados por el grupo terrorista islámico Hamás esta noche corresponden a los rehenes Itzik Elgarat, Ohad Yahalomi, Shlomo Mansur y Tsahi Idan.'El corazón duele al recibir la amarga noticia de la identificación de los cuerpos de Ohad Yahalomi, Tshai Idan, Itzik Elgarat y Shlomo Mansur, de bendita memoria, que fueron devueltos durante la noche del cautiverio por los asesinos de Hamás. En esta hora difícil, hay cierto consuelo en el hecho de que serán enterrados en la tumba de Israel', lamentó Herzog en un mensaje en su cuenta de X.El grupo terrorista palestino entregó la noche del jueves estos cuatro cuerpos a la Cruz Roja sin ceremonias degradantes, tal y como se vio obligado a acordar previamente con el Gobierno israelí.El intercambio estuvo supervisado por representantes de Egipto, país mediador en las negociaciones del alto el fuego en Gaza, a diferencia de en ocasiones previas, según confirmó Basem Naim, miembro del buró político de Hamás. Los rehenes Itzik Elgarat, Ohad Yahalomi, y Tsahi Idan fueron secuestrados vivos en territorio israelí y asesinados durante su cautiverio en Gaza. En cambio Shlomo Mansur fue asesinado el 7 de octubre y su cuerpo secuestrado y trasladado cautivo a la Franja. 'Tsahi, Itzik y Ohad fueron secuestrados vivos de sus hogares en los kibutz Nahal Oz y Nir Oz y soportaron un período prolongado en cautiverio de Hamás en Gaza. Deberían haber regresado con vida; Podrían haber sido salvados y traídos de vuelta mediante un acuerdo. Shlomo fue secuestrado de su casa en el kibutz Kissufim y asesinado el 7 de octubre', lamentó el Foro de los Familiares de los Rehenes en un comunicado.Con esta identificación, Israel ha recibido los 33 primeros rehenes (25 de ellos vivos y ocho muertos) que Hamás se comprometió a entregar en esta primera fase de alto el fuego que arrancó el pasado 19 de enero a cambio de la liberación de 1.900 terroristas palestinos presos y otros detenidos.El grupo terrorista palestino, por su parte, confirmó este jueves la excarcelación de un total de 642 terroristas palestinos presos por parte de Israel durante esta noche.Este grupo formaba parte del séptimo canje que se llevó a cabo el sábado pasado cuando los terroristas palestinas liberaron a seis rehenes.El primer ministro, Benjamín Netanyahu, no lo autorizó debido a las 'ceremonias humillantes' de Hamás durante las entregas de rehenes.Este miércoles ambas partes y a través de los mediadores del conflicto -Qatar, Egipto y Estados Unidos- acordaron la entrega de los últimos cuatro cuerpos de esta primera fase sin ceremonias y la salida de los más de 600 terroristas palestinos presos.'Renovamos nuestro pleno compromiso con el acuerdo de alto el fuego con todos sus detalles y disposiciones y nuestra disposición a iniciar negociaciones relacionadas con la segunda fase del acuerdo', expresó el grupo terrorista islámico palestino Hamás este jueves.La segunda fase del acuerdo de alto el fuego prevé la salida del resto de rehenes y la retirada total de las Fuerzas de Defensa de Israel de la Franja de Gaza. De momento, se desconoce cuando comenzarán las negociaciones que, según el texto, deberían haber empezado hace semanas. Agencias colaboraron con este artículo de Aurora La entrada Israel confirma que los cuerpos entregados por Hamás corresponden a los cuatro rehenes se publicó primero en Aurora Israel Noticias en Español.	https://aurora-israel.co.il/israel-confirma-que-los-cuerpos-entregados-por-hamas-corresponden-a-los-cuatro-rehenes/	2025-02-27T00:53:57-08:00	
Macron confirma que uno de los cuerpos entregados por Hamás es el...	El presidente francés, Emmanuel Macron, trasladó su pesar por la confirmación de la muerte de Ohad Yahalomi, un ciudadano de nacionalidad francesa e israelí que figura entre los cuatro cuerpos de los rehenes que el grupo terrorista islámico Hamás entregó esta noche a Israel como parte del acuerdo de alto al fuego.'La muerte de nuestro compatriota Ohad Yahalomi acaba de ser confirmada. Comparto el inmenso dolor de su familia y sus allegados', dijo Macron en un mensaje de su cuenta de X.Yahalomi, que trabajaba en la Autoridad de Parques y Naturaleza, fue secuestrado por Hamás junto a su hijo, Eitan, que fue liberado en el primer acuerdo, y también intentó secuestrar a su mujer y a sus hijas, que sobrevivieron, según explicó hoy el presidente, Isaac Herzog.Herzog además confirmó la identificación de los otros tres cuerpos entregados por los terroristas palestinos: Tzachi Idan, Itzik Elgert y Shlomo Manzur.'El corazón duele al recibir la amarga noticia de la identificación de los cuerpos de Ohad Yahalomi, Tzachi Idan, Itzik Elgert y Shlomo Manzur, de bendita memoria, que fueron devueltos durante la noche del cautiverio por los asesinos de Hamás. En esta hora difícil, hay cierto consuelo en el hecho de que serán enterrados en la tumba de Israel', lamentó Herzog en un mensaje en su cuenta de X.El grupo terrorista islámico entregó la noche del jueves estos cuatro cuerpos a la Cruz Roja sin ceremonias degradantes, tal y como se vio obligado a acordar previamente a partir de las exigencias del Gobierno israelí.Según el presidente francés, con Yahalomi, cincuenta franceses han perdido la vida en la 'infamia' del 7 de octubre de 2023, en los ataques de Hamás a Israel.El ministro de Exteriores francés, Jean-Noël Barrot, también se mostró 'conmocionado' por la confirmación de la muerte de Yahalomi, 'víctima de la innoble barbarie de Hamás', y trasladó su pésame a la familia.Después de que Hamás entregara a Cruz Roja los cuerpos de los cuatro rehenes como parte del acuerdo del alto al fuego, esta pasada noche Israel ha entregado un total de 642 terroristas y otros detenidos palestinos. Agencias colaboraron con este artículo de Aurora La entrada Macron confirma que uno de los cuerpos entregados por Hamás es el de un ciudadano francés se publicó primero en Aurora Israel Noticias en Español.	https://aurora-israel.co.il/macron-confirma-que-uno-de-los-cuerpos-entregados-por-hamas-es-el-de-un-ciudadano-frances/	2025-02-27T00:32:02-08:00	
Macron sobre el asesinato de Yahalomi: 'Los actos de barbarie de ...	Tras la identificación del cuerpo del rehén Ohad Yahalomi, que contaba con doble ciudadanía, fracesa e israelí, el presidente de Francia, Emmanuel Macron, manifestó en un mensaje en la red social X que 'Los actos de barbarie de Hamás deben terminar'. 'Comparto el inmenso dolor de su familia y sus seres queridos', apuntó el mandatario galo. 'Francia ha perdido 50 de sus hijos en la infamia del 7 de octubre'. El kibutz Nir Oz anunció que el rehén Ohad Yahalomi fue asesinado en cautiverio, luego de que su cuerpo fuera regresado anoche desde la Franja de Gaza, controlada por la organización terrorista islámica palestina Hamás. El cuerpo de Ohad Yahalomi fue regresado anoche junto con los restos mortales de otros tres rehenes israelíes en el marco de la primera fase del acuerdo entre Israel y Hamás que incluye el canje a cambio de la liberación de terroristas palestinos presos en Israel. 'Ohad, que tenía 50 años en el momento de su muerte, era un hombre de familia devoto y amoroso. Era un deportista apasionado y un ávido viajero, íntimamente familiarizado con cada sendero y camino del desierto que tanto amaba', añade el comunicado emitido por el kibutz Nir Oz 'Durante años trabajó en la Autoridad de Naturaleza y Parques de Israel, dedicando su vida a la preservación de la naturaleza. Debido a su profundo amor por el desierto, escribió junto con sus socios una guía de campo sobre escorpiones y participó en iniciativas educativas dentro de la comunidad beduina'. Ohad Yahalomi ha sido sobrevivido por su esposa y sus tres hijos pequeños. 'Siempre lo recordaremos como un hombre de valores, lleno de compasión, amante de la gente y de la tierra. Que su recuerdo sea una bendición. La entrada Macron sobre el asesinato de Yahalomi: 'Los actos de barbarie de Hamás deben terminar' se publicó primero en Aurora Israel Noticias en Español.	https://aurora-israel.co.il/macron-sobre-el-crimen-de-yahalomi-los-actos-de-barbarie-de-hamas-deben-terminar/	2025-02-27T00:05:27-08:00	
Irán acelera el ritmo de enriquecimiento de uranio cercano al uso...	Irán ha multiplicado al menos por cuatro en los últimos meses el ritmo al que enriquece uranio a una pureza del 60%, cercano al 90% necesario para ser usado en un arma atómica, una situación que genera una 'grave preocupación', según señaló el Organismo Internacional de Energía Atómica (OIEA).Este organismo de la ONU confirmó, en un informe restringido, que Irán ha cumplido su anuncio de instalar y emplear más maquinaria para enriquecer uranio al 60%, un material del que acumula ya 274,8 kilos, un 50% más que el pasado octubre.Irán está enriqueciendo ahora mensualmente entre 34 y 40 kilos de uranio al 60 %, mientras que antes de este acelerón el ritmo era de entre 6 y 9 kilos.Además, los técnicos iraníes tienen ya el conocimiento y la capacidad para dar el siguiente paso y empezar a producir uranio al 90%, el nivel necesario para un arma atómica.Para ello, tendrían que configurar de una forma especial las cascadas de centrifugadoras, las máquinas empleadas para producir ese combustible atómico.'Tienen toda la capacidad y todo el conocimiento. Podrían hacerlo en cualquier momento', señaló una fuente diplomática con conocimiento cercano de este tema.Con todo, si Irán diera ese paso, el OIEA tardaría sólo entre dos o cuatro días en detectarlo, se mostró absolutamente segura esa fuente.Eso significaría que el OIEA podría denunciar ese avance antes de que Irán fuera capaz de completar el proceso.'No sé si Irán quiere asumir ese riesgo', señaló ese diplomático, que pidió no ser identificado debido a lo delicado de la materia y a que se trata de un informe restringido.Ese informe señala que el OIEA está muy preocupado por la falta de colaboración por parte de Irán para resolver una serie de dudas sobre la naturaleza de sus actividades y que, mientras se mantengan, esta agencia de la ONU 'no estará en condiciones de facilitar garantías de que el programa nuclear iraní es exclusivamente pacífico'.Entre esos asuntos está aclarar el origen de uranio modificado artificialmente en dos instalaciones que Irán nunca declaró como parte de su programa nuclear.Irán comenzó a aumentar el ritmo de enriquecimiento de uranio a principios del pasado diciembre, días después de que la Junta de Gobernadores del OIEA aprobara una resolución de condena por la falta de colaboración del país para aclarar que su programa atómico es, tal y como asegura Teherán, pacífico.Esa resolución se aprobó pese a que Irán había aceptado frenar el enriquecimiento de uranio al 60 %.Irán y las grandes potencias cerraron en 2015 un acuerdo que limitaba el alcance y la capacidad del programa atómico iraní a cambio del levantamiento de sanciones.Ese acuerdo se debilitó primero tras abandonarlo Estados Unidos, durante la primera Administración de Donald Trump, y luego tras decidir Irán ignorar sus obligaciones, como la de no enriquecer uranio por encima del 3,67%.En su reporte, el OIEA recuerda que Irán es el único país sin arsenal nuclear que enriquece uranio al 60%.Además, subraya que han pasado ya cuatro años desde que Irán suspendió la aplicación del protocolo del Tratado de No Proliferación de armas nucleares que permite inspecciones más severas de sus instalaciones.En el informe, publicado antes de la reunión de la Junta de Gobernadores de la semana que viene, el OIEA critica también a Irán por haber vuelto a rechazar el nombramiento de inspectores especializados en la verificación de su programa atómico.Esa negativa, así como la retirada de parte de los instrumentos de verificación y vigilancia del OIEA han perjudicado, según este organismo, su capacidad de 'dar garantías sobre la naturaleza pacífica del programa nuclear iraní'. EFE La entrada Irán acelera el ritmo de enriquecimiento de uranio cercano al uso militar se publicó primero en Aurora Israel Noticias en Español.	https://aurora-israel.co.il/iran-acelera-el-ritmo-de-enriquecimiento-de-uranio-cercano-al-uso-militar/	2025-02-26T23:13:04-08:00	
