Title	Description	Link	pubDate	Image
El ataque a los buscapersonas de Hezbollah puso de relieve la gue...	Una fuente de seguridad occidental dijo a Reuters que la Unidad 8200, una sección militar que no forma parte de Mossad, estuvo involucrada en la etapa de desarrollo de la operación que duró más de un año El ataque masivo con dispositivos buscapersonas contra Hezbollah en el Líbano ha puesto el foco en la secreta Unidad 8.200 israelí, la entidad de inteligencia de las Fuerzas de Defensa de Israel que, según una fuente de seguridad occidental, estuvo involucrada en la planificación de la operación. Las autoridades israelíes han guardado silencio sobre la audaz operación de inteligencia que el martes mató a 12 personas e hirió a miles de agentes de Hezbollah. Al menos una persona murió el miércoles cuando detonaron radios portátiles utilizadas por Hezbollah. Una importante fuente de seguridad libanesa y otra fuente dijeron a la agencia de noticias Reuters que la central de espionaje israelí Mossad fue responsable de una sofisticada operación para colocar una pequeña cantidad de explosivos dentro de 5.000 buscapersonas ordenados por Hezbollah. Una fuente de seguridad occidental dijo a Reuters que la Unidad 8200, una sección militar que no forma parte de la agencia de espionaje, estuvo involucrada en la etapa de desarrollo de la operación contra Hezbollah, que duró más de un año. La fuente dijo que la Unidad 8200 estaba involucrada en el aspecto técnico de las pruebas de cómo podrían insertar material explosivo dentro del proceso de fabricación. El ejército israelí se negó a hacer comentarios. La oficina del primer ministro, que supervisa el Mossad, no respondió de inmediato a una solicitud de comentarios. Yossi Kuperwasser, ex funcionario de inteligencia militar y ahora director de investigación del Foro de Defensa y Seguridad de Israel, dijo que no había confirmación de que la unidad de inteligencia militar estuviera involucrada en el ataque. Pero afirmó que los miembros de 8.200 eran algunos de los mejores y más brillantes miembros del ejército israelí, y que prestaban servicio en un departamento en el centro de las capacidades de defensa de Israel. 'Los desafíos que enfrentan son inmensos, muy exigentes y necesitamos que las mejores personas se involucren en eso', dijo. La unidad -y su legión de soldados jóvenes cuidadosamente seleccionados- desarrolla y opera herramientas de recopilación de inteligencia y a menudo se la compara con la Agencia de Seguridad Nacional de Estados Unidos. En una declaración pública poco frecuente sobre las actividades de la unidad, las FDI dijeron en 2018 que habían ayudado a frustrar un ataque aéreo del Estado Islámico contra un país occidental. En ese momento, dijeron que las operaciones de la unidad iban desde la recopilación de inteligencia y la ciberdefensa hasta 'ataques y ataques tecnológicos'. Aunque Israel nunca ha confirmado su participación, se informó que la Unidad 8.200 estuvo involucrada en el ataque Stuxnet que desactivó las centrifugadoras nucleares iraníes, así como en una serie de otras operaciones de alto perfil fuera de Israel. La unidad es efectivamente el sistema de alerta temprana de Israel y, como gran parte del resto del sistema de defensa y seguridad, asumió parte de la culpa por no detectar el ataque de Hamas del 7 de octubre al sur de Israel. Su comandante anunció la semana pasada que dimitiría. En su carta de dimisión difundida por los medios israelíes, afirmó que no había cumplido su misión. La unidad es famosa por una cultura de trabajo que enfatiza el pensamiento innovador para abordar problemas que antes no se habían planteado ni imaginado. Esto ayudó a algunos graduados a construir el sector de alta tecnología de Israel y algunas de sus empresas más grandes. 'Ya sea un problema con la debilidad del software, matemáticas, cifrado, un problema para hackear algo&#8230; debes ser capaz de hacerlo por tu cuenta', dijo Avi Shua, un graduado de 8.200, quien luego cofundó Orca Security, un unicornio de seguridad en la nube. La unidad tiene una alta tasa de rotación de jóvenes reclutas que reemplazan a los veteranos, dijo Kobi Samboursky, otro ex miembro de 8.200 y socio gerente de Glilot Capital Partners, un fondo de etapa inicial que invierte en ciberseguridad e inteligencia artificial. 'Lo más importante aquí es la cultura del &#8216;se puede hacer', donde todo es posible', dijo Samboursky. (Con información de Reuters)Fuente: INFOBAE	https://aurora-israel.co.il/el-ataque-a-los-buscapersonas-de-hezbollah-puso-de-relieve-la-guerra-cibernetica-de-la-unidad-8-200-israeli/	2024-09-18T16:09:56-07:00	
Nuevas explosiones en Líbano: estallaron walkie talkies de Hezbol...	Fuentes del grupo terrorista dijeron que los aparatos utilizados por sus miembros explotaron en su bastión de Beirut. Los medios de comunicación estatales informaron de estallidos similares de buscapersonas y 'dispositivos' en el este y el sur del país Varios aparatos de comunicación volvieron a explotar este miércoles en puntos del Líbano controlados por Hezbollah, sin que todavía esté clara la magnitud de la nueva oleada y apenas 24 horas después de que una primera causara doce muertos y 2.800 heridos en el país. Una fuente cercana al grupo terrorista libanés declaró que los walkie talkies utilizados por miembros del grupo explotaron en su bastión de Beirut, y los medios de comunicación estatales informaron de explosiones similares de buscapersonas y 'dispositivos' en el este y el sur de Líbano. 'Varios walkie talkies explotaron en los suburbios del sur de Beirut', dijo la fuente a la agencia AFP, y los equipos de rescate afiliados a Hezbollah confirmaron que los dispositivos habían estallado dentro de dos coches en la zona. La cadena de televisión Al Manar, de Hezbollah, también informó de explosiones en varias zonas del Líbano, que, según dijo, se debieron a la detonación de walkie-talkies. Según la Agencia Nacional de Noticias libanesa, la explosión causó la muerte de tres personas en Sohmor, en el este del país, y según una fuente médica, otras 15 resultaron heridas en la ciudad de Baalbek, mientras que en otros bastiones de Hezbollah se registraron explosiones similares. De acuerdo al Ministerio de Salud Pública, al menos una persona murió y otras cien resultaron heridas. Varias de las explosiones se produjeron el funeral de tres miembros del grupo terrorista y un niño muertos ayer por la explosión de unos buscapersonas, según informaron periodistas de Associated Press en el lugar de los hechos. Cómo fue el ataque del martes Las nuevas explosiones se producen cuando el Líbano sigue sumido en la confusión y la ira tras los ataques con buscapersonas del martes, que parecían ser un complejo ataque israelí dirigido contra miembros de Hezbollah. Al menos 12 personas murieron, entre ellas dos niños, y unas 2.800 resultaron heridas cuando cientos de localizadores utilizados por miembros de Hezbollah empezaron a detonar en varias partes del Líbano y en Siria. El ataque en el Líbano comenzó el martes por la tarde, cuando los localizadores en las manos o bolsillos de sus propietarios comenzaron a calentarse y luego a explotar, dejando escenas salpicadas de sangre y transeúntes en pánico. Los expertos creen que se introdujo material explosivo en los localizadores antes de su entrega. Al parecer, la mayoría de las personas alcanzadas eran miembros de Hezbollah o estaban vinculadas a miembros de Hezbollah -combatientes o civiles-, pero no estaba claro si también habían sido alcanzadas personas sin vínculos con Hezbollah. Este miércoles se empezaron a conocer nuevos detalles de la operación. Los localizadores fueron fabricados por una empresa con sede en Hungría, según informó el miércoles otra empresa. Un funcionario estadounidense dijo que Israel informó a Estados Unidos tras el ataque, en el que se habían ocultado pequeñas cantidades de explosivo en los localizadores. La persona habló bajo condición de anonimato porque no estaba autorizada a discutir la información públicamente. El atentado, que Israel no ha comentado, reavivó los temores de que el conflicto latente entre Israel y Hezbollah pudiera desembocar en una guerra total. El secretario de Estado, Antony Blinken, dijo el miércoles que Estados Unidos aún está evaluando cómo el ataque podría afectar a los esfuerzos para negociar un alto el fuego en la guerra entre Israel y Hamás en Gaza. Israel comenzó a desplazar más tropas a su frontera con Líbano el miércoles como medida de precaución, según un funcionario con conocimiento de los movimientos que habló bajo condición de anonimato porque no estaba autorizado a hablar con los medios de comunicación. Hezbollah y las fuerzas israelíes han intercambiado disparos casi a diario desde el 8 de octubre, el día después de que un mortífero asalto dirigido por Hamás en el sur de Israel desencadenara la guerra. Desde entonces, cientos de personas han muerto en los ataques en Líbano y docenas en Israel, mientras que decenas de miles a cada lado de la frontera se han visto desplazadas. Hamás y Hezbollah son aliados y ambos cuentan con el apoyo de Irán. Los dirigentes israelíes han lanzado una serie de advertencias en las últimas semanas de que podrían aumentar las operaciones contra Hezbollah en Líbano, afirmando que deben poner fin a los intercambios para permitir que la población regrese a sus hogares cerca de la frontera. Hezbollah dijo en un comunicado el miércoles por la mañana que continuaría sus ataques normales contra Israel como parte de lo que describe como un frente de apoyo a Hamás y a los palestinos de Gaza. 'Este camino es continuo y separado del difícil ajuste de cuentas que el enemigo criminal debe esperar por su masacre del martes', dijo. 'Este es otro ajuste de cuentas que llegará, si Dios quiere'. Fuente: INFOBAE	https://aurora-israel.co.il/nuevas-explosiones-en-libano-estallaron-walkie-talkies-de-hezbollah-y-se-registran-incendios-en-vehiculos-y-viviendas/	2024-09-18T09:03:23-07:00	
Un empleado y beneficios al alza: así es la firma vinculada a los...	La empresa húngara BAC Consulting, que ha sido señalada como la fabricante de los buscapersonas del grupo Hezbollah que explotaron el martes, es una entidad fundada en 2022, con un único empleado y que en 2023 tuvo unos beneficios de 46.396 euros, el triple que el año anterior. BAC Consulting, que funciona como una sociedad de responsabilidad limitada, según la página de información empresarial companywall.hu, fue fundada en Budapest en 2022 y cuenta con una sede en esa ciudad. En el primer año de su funcionamiento, la facturación de la empresa fue de 668.309 euros, mientras que en 2023 bajó a 545.558. Pese a esa caída de ingresos, la compañía triplicó sus beneficios de los 14.630 euros de 2022 hasta los 46.396 en 2023. El portal independiente Telex.hu informa de que la sede de BAC se encuentra en un inmueble que aloja a diferentes entidades. La empresa, según su página, se ocupa de muy variadas actividades, desde la edición de periódicos hasta las relacionadas con la industria petrolera, la fabricación de azúcar y servicios de informática. La empresa taiwanesa Gold Apollo, dueña de la marca de los buscapersonas que explotaron, ha asegurado que cedió a BAC el uso de la marca y que es la compañía húngara la que diseñó y fabricó los aparatos. La cadena televisiva estadounidense NBC News pudo hablar con la gerente y propietaria de BAC, Cristina Bársony-Arcidiacono, quien negó haber fabricado los buscapersonas, según recoge el portal 444.hu. 'Yo no fabrico los buscapersonas, sólo soy un intermediario. Algo se habrá malinterpretado', dijo Bársony-Arcidiacono. Sea como sea, poco después de que la prensa señalara a BAC como el posible fabricante de los aparatos, la entidad bloqueó su página web, a la que actualmente es imposible acceder. Agencias contribuyeron con este artículo de Aurora.	https://aurora-israel.co.il/un-empleado-y-beneficios-al-alza-asi-es-la-firma-vinculada-a-los-buscapersonas-explosivos/	2024-09-18T09:00:05-07:00	
Suben a doce los muertos por explosiones de beepers en Líbano	El número de muertos por la explosión en cadena de buscapersonas en el Líbano aumentó este miércoles a doce, mientras que unos 1.800 de los más de 2.800 heridos requirieron ingreso hospitalario, anunció el ministro de Salud Pública, Firas Abiad. El titular informó en rueda de prensa de la muerte de doce personas 'que llevaban los buscapersonas' mientras se encontraban en un hospital de los suburbios meridionales de Beirut conocidos como el Dahye. Abiad explicó que la mayoría de los heridos, unos 1.850, se concentraron en Beirut y sus alrededores, mientras que en el sur del país resultaron heridas unas 750 personas y, en el oriental Valle de la Bekaa, otras 150. A excepción de la capital propiamente dicha, todas esas zonas son bastiones del grupo Hezbollah, que el martes confirmó que miembros de diversas unidades e instituciones del movimiento portaban los mensáfonos afectados por las deflagraciones simultáneas, atribuidas a Israel. Según dijo, unos 1.800 de los heridos requirieron ingreso hospitalario y algo menos de 300 de ellos se encuentran en estado crítico, mientras que cerca de 460 han sido sometidos a cirugías, principalmente en las manos, lo que incluye algunas amputaciones. 'El ataque fue masivo, no teníamos ni idea y ocurrió de pronto (&#8230;) Los hospitales recibieron 70 o 80 pacientes de golpe, era una posibilidad que el sistema sanitario no fuera capaz de responder, pero el plan de emergencia jugó un papel importante', apuntó Abiad. El departamento que encabeza Abiad tiene trazado un plan de emergencia coordinado con los diferentes hospitales del país para lidiar con potenciales casos de víctimas en masa, una situación que el ministro consideró clave para que 'el número de muertos no fuese alto en comparación con la envergadura de los ataques'. 'Parece que Israel está avanzando hacia una escalada y nosotros, como Gobierno del Líbano, no queremos guerra. Lo que sucedió ayer fue una gran prueba para el plan de emergencia que pusimos en marcha por adelantado', agregó. El ministro de Salud Pública también confirmó que ya han recibido ayuda médica por parte de Irak, Irán o Jordania, y que algunos de los heridos han sido trasladados a Siria desde las áreas fronterizas del Líbano o a Irán. Agencias contribuyeron con este artículo de Aurora.	https://aurora-israel.co.il/suben-a-doce-los-muertos-por-explosiones-en-libano-donde-1-800-heridos-fueron-ingresados/	2024-09-18T06:53:46-07:00	
Israel insiste en que está preparado para cualquier misión en la ...	Las Fuerzas de Defensa de Israel (FDI) insistieron este miércoles en que están preparadas para 'cualquier misión' en la frontera con Líbano, después de que anoche explotaran miles de dispositivos buscapersonas del grupo Hezbollah, en una operación atribuida a Israel por la que la milicia terrorista libanesa ha jurado venganza. 'La misión está clara. Tenemos la determinación de cambiar la situación de seguridad lo más rápido posible', dijo el responsable del Comando Norte israelí, el mayor general Ori Gordin, después de que dos brigadas del Ejército completasen una serie de ejercicios para simular combates 'en territorio enemigo'. Gordin insistió en que las tropas 'están extremadamente preparadas para cualquier misión que se les asigne'. Israel lleva en máxima alerta desde anoche, cuando miles de buscapersonas asociados al grupo libanés explotaron por todo Líbano y Siria, matando a doce personas e hiriendo a miles. El incidente ha hecho saltar las alarmas por la posibilidad de que la tensión entre los terroristas e Israel, que llevan más de once meses enfrascados en un intenso intercambio de fuego a través de la frontera, desemboque en una temida guerra regional. Las autoridades israelíes no han reconocido la autoría del suceso. Israel lleva enzarzado en un intenso intercambio de fuego con el grupo libanés desde el 8 de octubre, cuando Hezbollah empezó a lanzar ataques contra la zona norte. El martes pasado, Yoav Gallant, el ministro de Defensa, dijo que con sus misiones en Gaza casi cumplidas, el foco de Israel se está trasladando ahora a la frontera con Líbano, donde el constante fuego cruzado obliga a unas 60.000 personas a vivir evacuadas en hoteles o casas de familiares por todo el país. Agencias contribuyeron con este artículo de Aurora.	https://aurora-israel.co.il/israel-insiste-en-que-esta-preparada-para-cualquier-mision-en-la-frontera-con-libano/	2024-09-18T06:53:19-07:00	
Un avión de combate israelí intercepta un dron lanzado desde Irak	Esta madrugada un dron lanzado desde Irak fue interceptado por aviones de combate israelíes, anunciaron este miércoles las Fuerzas de Defensa de Israel (FDI) en un comunicado, sin que causara heridos o daños en Israel.'Se hicieron sonar las sirenas de (aviso de) cohetes y misiles ante la posibilidad de que cayera metralla (esquirlas) tras la intercepción. No se reportaron heridos', detalla el texto castrense.Las alarmas aéreas sonaron entre las 4:32 y 4:36 de la madrugada, en el área del Mar de Galilea, en la región homónima del norte del Estado de Israel.Según las FDI, hoy temprano un segundo objeto aéreo sospechoso cruzó desde el Líbano, donde opera el grupo terrorista chií pro-iraní Hezbollah, hacia el área fronteriza de Rosh Hanikra, antes de ser interceptado.Desde el inicio de la guerra en Gaza el pasado 7 de octubre, milicias proiraníes de Irak lanzaron cientos de ataques contra objetivos militares estadounidenses en Irak y Siria desde el estallido desde esta misma fecha, pero se detuvieron después de que un ataque lanzado por estos grupos matara a tres soldados estadounidenses en la frontera entre Siria y Jordania en enero.Sin embargo, continuaron lanzando de manera esporádica drones y cohetes contra territorio israelí y, desde principios de junio, se aliaron en operaciones conjuntas con los rebeldes hutíes del Yemen contra objetivos del norte de Israel, que fueron interceptados.A su vez, el norte de Israel afronta el lanzamiento casi diario de cohetes de Hezbollah, lo que ha provocado que unos 60.000 israelíes hayan sido evacuados de sus hogares próximos a la divisoria. En el Líbano, los ataques israelíes han dejado más de 120 civiles muertos, y más de 400 bajas letales en las filas de Hezbollah.Ayer, miles de buscapersonas en manos de efectivos de esta organización terrorista chií explotaron simultáneamente en varios puntos del Líbano, principalmente en el sur y en suburbios meridionales de Beirut, lo que hace temer una respuesta en represalia contra Israel o un enfrentamiento abierto. Agencias colaboraron con este artículo de Aurora	https://aurora-israel.co.il/un-avion-de-combate-israeli-intercepta-un-dron-lanzado-desde-irak/	2024-09-18T03:17:39-07:00	
Lufhansa cancela vuelos a Tel Aviv y Teherán tras el ataque a gra...	El grupo alemán Lufhansa anunció este miércoles la cancelación de todos los vuelos con aterrizaje o despegue en Tel Aviv o Teherán por lo menos hasta este jueves, después del ataque a gran escala contra el grupo terrorista chií libanés Hezbollah atribuido a Israel.'En vista de la repentina modificación de la situación de seguridad, las aerolíneas del Grupo Lufhansa han decidido con efecto inmediato suspender todas las conexiones desde y hacia Tel Aviv (TLV) y Teherán (IKA), hasta el 19 de septiembre inclusive', informó el grupo en su web.'Durante este tiempo todas las aerolíneas del Grupo Lufhansa evitarán también sobrevolar el espacio aéreo israelí e iraní', agregó la información de vuelo dirigida a los pasajeros.Los viajeros afectados podrán obtener sin coste adicional billetes para una fecha posterior o solicitar el reembolso de los billetes anulados.'El Grupo Lufthansa seguirá observando la situación de cerca y volverá a evaluar la situación en los próximos días', concluyó el breve texto.Pertenecen al grupo además de Lufthansa Airlines las aerolíneas de pasajeros SWISS, Austrian Airlines, Brussels Airlines, Eurowings, así como el servicio logístico Lufhansa Cargo.Este martes explotaron en el Líbano miles de buscapersonas en manos de miembros de la organización terrorista proiraní Hezbollah de forma simultánea y en diversos puntos del país, en una operación a gran escala atribuida a Israel que causó la muerte de al menos nueve personas y heridas a otras casi 3.000. EFE y Aurora	https://aurora-israel.co.il/lufhansa-cancela-vuelos-a-tel-aviv-y-teheran-tras-el-ataque-a-gran-escala-contra-hezbollah/	2024-09-18T02:34:49-07:00	
Dispositivos manipulados y un mensaje falso, lo que se sabe de la...	Un cargamento nuevo de mensáfonos empleados por miembros del grupo terrorista chií libanés Hezbollah que fueron manipulados en origen antes de llegar al Líbano y un mensaje falso que detonó en remoto los aparatos es una de las hipótesis más plausibles de la cadena de explosiones que ayer provocó al menos nueve muertos en una operación atribuida a Israel, según informaron diversas fuentes. A falta de conocer los detalles exactos, incluido quién fue el autor de ese ataque cibernético que desde Líbano se atribuye a Israel, el ministro de Telecomunicaciones libanés, Johnny Corn, aseguró ayer que los dispositivos que explotaron formaban parte de un cargamento que llegó 'recientemente' al Líbano y planteó que 'a lo mejor se activó a distancia', aunque no sabía aún cómo. De hecho, indicó que, según las informaciones preliminares, 'las baterías de los buscapersonas se calentaron', por lo que incluso algunas personas tiraron esos aparatos antes de que explotaran. Esto es lo que se sabe hasta ahora sobre esta inusual y sofisticada operación. ¿Cómo podrían haber explotado? Desde el ataque simultáneo, que hirió a miles de personas, incluido el embajador iraní en el Líbano, Mojtaba Amani, y que afectó a miembros de formación terrorista chií en Siria, han surgido numerosas hipótesis de cómo se podría haber producido este ataque. La más plausible y que algunos expertos están apuntando, como el analista militar y político independiente, Elijah J. Magnier, es que se colocó una trampa explosiva dentro de los dispositivos, los cuales 'no se importaron directamente al Líbano, sino que se detuvieron en un país cercano durante tres meses, donde Israel implantó el explosivo'. En lo que sería una sofisticada infiltración en la cadena de suministro de esos aparatos, Israel habría colocado los explosivos en ese lote de dispositivos, en total alrededor de unos 3.000, según afirmaron varios medios norteamericanos, incluido el The New York Times, siempre citando fuentes anónimas. Dichos explosivos habrían sido implantados junto a la batería de cada uno de los mensáfonos, razón por la que hubo un sobrecalentamiento previo a la explosión, a lo que se añadió un mecanismo para detonarlos de forma remota. Ese mecanismo era un mensaje falso, que supuestamente provenía de la cúpula de Hezbollah, y que al pinchar activaba los explosivos. Antes de la detonación, de acuerdo a las fuentes, el dispositivo estaba programado para emitir un pitido durante varios segundos. Este tipo de ataques a cadenas de suministros es una preocupación en el campo de la ciberseguridad por los potenciales &#8216;hackeos' que puede haber en las fases de desarrollo, aunque dichas acciones se limitan normalmente al software y no al hardware, ya que para esto último requiere haber accedido al dispositivo durante la cadena de montaje. Quién fabricó los dispositivos Varios expertos informáticos respaldaron la teoría de que, para que se produzca esas explosiones, los aparatos tendrían que haber sido manipulados en origen o en destino, señalando que los fabricantes de los componentes de esos mensáfonos son los que deberían responder ante ello. Y lo han hecho, ya que según el New York Times, Hezbollah encargó a la empresa taiwanesa Gold Apollo los aparatos. Sin embargo, la compañía asiática negó en un comunicado haber fabricado esos dispositivos e indicó que la responsable de producirlos es una compañía denominada &#8216;BAC', que tiene sede en Budapest. Respecto al &#8216;buscapersonas' AR-924 que habría sido empleado en las explosiones, la empresa taiwanesa reiteró que se trata de un modelo 'producido y vendido' por BAC. 'Nosotros solo proporcionamos la autorización de la marca registrada y no estamos involucrados en el diseño ni en la fabricación de este producto. Siempre nos adherimos a las regulaciones pertinentes y mantenemos una cooperación transparente y conforme con nuestros socios', concluyó el comunicado. Por qué estos dispositivos El grupo terrorista chií usa entre sus miembros esta clase de dispositivos como medio de comunicación para evitar ser geolocalizados por Israel, que habitualmente lleva a cabo asesinatos selectivos contra miembros de Hezbollah, entre otras facciones presentes en el Líbano y Siria. Los mensáfonos, que se quedaron obsoletos con la llegada del teléfono móvil, son dispositivos inalámbricos de baja tecnología que básicamente reciben mensajes alfanuméricos y bidireccionales, con la capacidad de enviar y recibir mensajes cortos. EFE y Aurora	https://aurora-israel.co.il/dispositivos-manipulados-y-un-mensaje-falso-lo-que-se-sabe-de-las-explosiones-en-libano/	2024-09-18T01:31:27-07:00	
