Title	Description	Link	pubDate	Image
Hamás entrega a la Cruz Roja los cuerpos de cuatro rehenes israel...	Efectivos del grupo terrorista islámico Hamás, acompañados de sus colegas de la Yihad Islámica Palestina y las Brigadas Muyahidines, entregaron este jueves en Khan Yunis (sur de Gaza) a la Cruz Roja los restos mortales de al parecer cuatro rehenes israelíes, tras exponer sus ataúdes.Los terroristas islámicos palestinos dispusieron sobre un escenario los ataúdes, de color negro y con los nombres de Shiri Bibas Silberman, mujer de ascendencia peruana y argentina secuestrada el 7 de octubre de 2023 con 32 años, y sus hijos, Ariel y Kfir Bibas, con 4 años y 9 meses respectivamente, así como el de Oded Lifshitz, que tenía 83 cuando fue tomado de rehén.En el siniestro escenario montado por Hamás, los terroristas islamistas diseñaron una pancarta con la imagen del primer ministro, Benjamín Netanyahu, alterada con colmillos y manchas de sangre, sobre los rostros de los cuatro fallecidos.Los equipos de la Cruz Roja prepararon biombos y soportes de madera para intentar introducir con privacidad los ataúdes en sus furgonetas, una por cada fallecido.El primer ataúd que recibieron portaba la imagen de Shiri Silberman, seguido de un segundo con la de Kfir Bibas, un tercero con la foto de su hermano Ariel y, finalmente, el cuarto con la foto de Liftshitz.Antes de subirlos, cubrieron cada ataúd con una sábana blanca.El punto de entrega fue una explanada en Beni Suhaila, en el este de la ciudad de Khan Yunis.La Brigada Izz ad Din Al Qassam, ala militar de la organización terrorista Hamás, sostiene que tanto los Bibas como Lifshitz murieron en bombardeos de las Fuerzas de Defensa de Israel (FDI) contra los puntos en los que permanecían cautivos.Ya el 29 de noviembre de 2023, cuando Gaza atravesaba la primera tregua de la guerra (que terminó dos días después), Hamás alegó que Shiri, Ariel y Kfir habían muerto en uno de los bombardeos israelíes previos a ese alto el fuego. Hasta esta semana, no habían hecho alusiones a Lifshitz.Tras la entrega, Cruz Roja pondrá a disposición de las Fuerzas de Defensa de Israel los cuerpos mortales de los rehenes en un punto aún dentro de la Franja donde se celebrará una ceremonia en la que estarán presentes miembros de las familias de los fallecidos.Desde allí, los vehículos militares los llevarán al instituto forense Abu Kabir de Tel Aviv para que pasen por un proceso de identificación que puede durar hasta dos días. Agencias colaboraron con este artículo de Aurora La entrada Hamás entrega a la Cruz Roja los cuerpos de cuatro rehenes israelíes se publicó primero en Aurora Israel Noticias en Español.	https://aurora-israel.co.il/hamas-entrega-a-la-cruz-roja-los-cuerpos-de-cuatro-rehenes-israelies/	2025-02-20T01:04:05-08:00	
Fiji se transforma en el séptimo país en abrir una embajada en Je...	El gobierno de Fiji anunció su decisión de abrir una embajada en Jerusalén. La medida se oficilizó este martes, a través de un comunicado del Ministerio de Relaciones Exteriores de Fiji, que destacó que antes de la apertura se llevarán a cabo evaluaciones de seguridad en coordinación con el Ministerio de Defensa y otras agencias pertinentes. Así, Fiji se convierte en el séptimo país en establecer su misión diplomática en la ciudad, luego de Estados Unidos, Guatemala, Honduras, Kosovo, Papúa Nueva Guinea y Paraguay. La medida fue elogiada por el ministro de Relaciones Exteriores de Israel, Gideon Sa’ar: 'aplaudo al gobierno de la República de Fiji por su histórica decisión de abrir una embajada en Jerusalén, la capital eterna del pueblo judío', expresó en su cuenta de X. La decisión se produce después de que el primer ministro y canciller de Fiji, Sitiveni Rabuka, informara a Sa’ar la semana pasada en Múnich sobre su intención de trasladar la embajada desde Tel Aviv a Jerusalén. Rabuka, quien asumió el poder en 2022 liderando una coalición de tres partidos, ha manifestado en varias ocasiones su respaldo a Israel, y en 2023 declaró al embajador israelí Roi Rosenblit que su sentimiento personal era que la embajada de Fiji debía estar en Jerusalén, aunque reconoció que debía convencer a sus socios de coalición. La entrada Fiji se transforma en el séptimo país en abrir una embajada en Jerusalén se publicó primero en Aurora Israel Noticias en Español.	https://aurora-israel.co.il/fiji-se-transforma-en-el-septimo-pais-en-abrir-una-embajada-en-jerusalen/	2025-02-19T16:23:36-08:00	
El Vaticano en alerta por la salud del Papa Francisco	A sus 88 años, el Papa Francisco se encuentra internado desde el 14 de febrero en la clínica Gemelli de Roma debido a una neumonía bilateral. La enfermedad ha generado una fuerte inquietud dentro de la Santa Sede, donde ya se han activado protocolos en caso de un desenlace fatal. El Vaticano indicó en un comunicado que el Papa se había sometido el martes por la tarde a una tomografía computarizada de tórax que reveló 'la aparición de una neumonía bilateral que requiere terapia farmacológica adicional'. El diagnóstico del Papa generó revuelo a nivel internacional. Esta semana se difundieron falsos reportes sobre su fallecimiento en redes sociales, y si bien el Vaticano desmintió esos rumores, asegurando que respira por sus propios medios y ha logrado sentarse en una silla y comunicarse con allegados, los especialistas advierten que la neumonía bilateral sigue representando un cuadro grave. El cardenal italiano Angelo Comastri afirmó que Francisco enfrenta la situación con serenidad. La entrada El Vaticano en alerta por la salud del Papa Francisco se publicó primero en Aurora Israel Noticias en Español.	https://aurora-israel.co.il/el-vaticano-en-alerta-por-la-salud-del-papa-francisco/	2025-02-19T13:34:04-08:00	
Trump llama 'dictador' a Zelenski y le avisa que si no actúa 'ráp...	El presidente de Estados Unidos, Donald Trump, llamó este miércoles 'dictador' a su homólogo ucraniano, Volodímir Zelenski, y le advirtió de que, si no actúa 'rápido', su país podría desaparecer. 'Un dictador sin elecciones. Zelenski más vale que se mueva rápido o se quedará sin país', escribió Trump en su red social, Truth Social, donde criticó al mandatario ucraniano por 'negarse a celebrar elecciones' y por estar 'muy bajo en las encuestas en Ucrania'. Zelenski, que fue elegido presidente en 2019, podría haberse presentado a la reelección en unos comicios que deberían haberse celebrado en marzo o abril de 2024, pero no han tenido lugar debido a la imposición de la ley marcial por la guerra. Trump consideró que 'lo único' en lo que Zelenski era bueno era en 'manejar a su antojo' al expresidente de EE.UU. Joe Biden (2021-2025), quien se distinguió por su apoyo a Ucrania y por haber presentado un frente unificado ante Rusia, coordinándose con la Unión Europea en sanciones y ayuda militar. 'Mientras tanto, estamos negociando con éxito el fin de la guerra con Rusia, algo que todos admiten que solo 'TRUMP' y la Administración Trump pueden hacer', subrayó el líder estadounidense. Una subida de tono El mensaje de Trump supone una subida de tono después de que el martes ya culpara a Ucrania de haber 'iniciado' la guerra con Rusia y ridiculizara a Zelenski como un negociador ineficaz y 'sumamente incompetente', afirmando que el país debería haber alcanzado un acuerdo tras tres años de conflicto. 'Piénsenlo bien: un cómico de éxito moderado, Volodímir Zelenski, convenció a Estados Unidos de gastar 350.000 millones de dólares en una guerra que no se podía ganar, que nunca tuvo por qué haber empezado, pero que él, sin EE.UU. y sin 'TRUMP', nunca podrá resolver', escribió Trump. Trump, que ha sido muy crítico con la cantidad de dinero que EE.UU. ha enviado a Ucrania, aseguró que el país ha gastado 200.000 millones de dólares más que Europa en esta causa y se preguntó por qué su antecesor, Joe Biden, al que despectivamente llama 'Sleepy Joe Biden', no exigió un reparto más equitativo del gasto. En realidad, los países europeos, incluyendo la Unión Europea, han enviado más ayuda a Ucrania que EE.UU., con una asignación de 132.000 millones de euros frente a los 114.000 millones de Washington, aunque este sí supera a Europa en la entrega de ayuda militar, según datos oficiales. 'Esta guerra es mucho más importante para Europa que para nosotros. Tenemos un gran y hermoso océano que nos separa', afirmó Trump, repitiendo una idea que ha expresado en otras ocasiones y que refleja su visión aislacionista de EE.UU. debido a su situación geográfica. El dinero 'desaparecido' Pese a las grandes sumas de dinero enviadas por EE.UU. a Ucrania, Trump criticó que Zelenski haya admitido que 'la mitad' del dinero que se le ha enviado está 'DESAPARECIDO'. Esos comentarios del presidente hacen referencia a una entrevista que Zelenski concedió a la agencia Associated Press el 2 de febrero, en la que afirmó que, de los 177.000 millones de dólares que se decía que EE.UU. había destinado a Ucrania, su país solo había recibido 75.000 millones. Sus declaraciones generaron confusión y llevaron a algunos medios a cuestionar qué había sucedido con los 100.000 millones restantes que supuestamente estaban 'desaparecidos'. En realidad, según el centro de pensamiento Center for Strategic and International Studies (CSIS), solo una parte del dinero que EE.UU. asigna a la guerra en Ucrania queda bajo control ucraniano, ya que gran parte de los fondos se destinan a otras actividades relacionadas con el conflicto de manera indirecta, como el entrenamiento de tropas ucranianas. Por último, Trump concluyó su publicación con críticas tanto a Zelenski como a Biden y a Europa. 'Biden nunca lo intentó, Europa ha fracasado en lograr la paz y Zelenski probablemente quiera que el 'grifo de dinero' siga abierto. Amo a Ucrania, pero Zelenski ha hecho un trabajo terrible, su país está devastado y MILLONES han muerto innecesariamente. Y así continúa…', sentenció. La relación entre Trump y Zelenski se ha agriado a raíz de las conversaciones mantenidas esta semana en Arabia Saudí entre una delegación estadounidense y representantes rusos para poner fin a la guerra, en las que ni Ucrania ni sus aliados europeos participaron. La entrada Trump llama 'dictador' a Zelenski y le avisa que si no actúa 'rápido' su país desaparecerá se publicó primero en Aurora Israel Noticias en Español.	https://aurora-israel.co.il/trump-llama-dictador-a-zelenski-y-le-avisa-que-si-no-actua-rapido-su-pais-desaparecera/	2025-02-19T10:54:50-08:00	
FDI ultiman preparativos para recibir el jueves los cuerpos de cu...	Las Fuerzas de Defensa de Israel (FDI) ultiman este miércoles los preparativos para recibir el jueves los cadáveres de cuatro rehenes de la Franja de Gaza -tres de la familia Bibas y el del anciano Oded Lifshitz- con una modesta ceremonia militar, según informaron fuentes castrenses. Las fuerzas armadas celebrarán una ceremonia litúrgica dentro de Gaza en el punto de encuentro con el personal del Comité Internacional de la Cruz Roja, que mediará como en canjes anteriores entre estos y los terroristas. Las FDI espera que la entrega se produzca por la mañana, como en las últimas semanas, aunque no confirmó una hora específica. A la ceremonia acudirán un rabino y miembros de las familias de los fallecidos. Los cuerpos devueltos serán los de la familia Bibas (la madre, Shiri, y sus hijos Kfir y Ariel, de dos y cinco años), y el de Oded Lifshitz, un anciano de 84 años también del Kibutz de Nir Oz, según reveló hoy el portavoz de las brigadas de Hamás, Abu Obeida. Los ataúdes, que estarán envueltos con banderas de Israel, viajarán en vehículos militares al centro forense Abu Kabir, en Tel Aviv, donde comenzará un proceso de identificación y para determinar la causa de muerte, cuya duración puede variar según el estado de los cuerpos. Israel no liberará a losterroristas prisioneros palestinos correspondientes por los cuatro cadáveres hasta que estos sean identificados, si bien se estima que su puesta en libertad ocurra el sábado junto a los liberados a cambio de los seis rehenes aún con vida. El próximo jueves día 27, el proceso será el mismo: ese día saldrán de Gaza los últimos cuatro rehenes sin vida de la primera fase del alto el fuego; mientras que los terroristas presos palestinos lo harán el sábado. La entrada FDI ultiman preparativos para recibir el jueves los cuerpos de cuatro rehenes se publicó primero en Aurora Israel Noticias en Español.	https://aurora-israel.co.il/fdi-ultiman-preparativos-para-recibir-el-jueves-los-cuerpos-de-cuatro-rehenes/	2025-02-19T10:54:12-08:00	
Netanyahu: mi corazón 'está desgarrado' con la entrega de los cue...	El primer ministro de Israel, Benjamín Netanyahu, dijo este miércoles que su corazón y el de todo Israel 'está desgarrado' con la entrega prevista mañana de cuatro cadáveres -entre ellos los de los niños Bibas- más de 16 meses después de su rapto en la Franja de Gaza. 'Abrazamos a las familias. El corazón de toda la nación está desgarrado. Mi propio corazón está desgarrado. También el vuestro', afirmó el mandatario israelí en un videocomunicado, en el que calificó de nuevo a los terroristas de Hamás de 'monstruos'. 'Mañana será un día muy difícil para el Estado de Israel. Un día desgarrador, un día de dolor. Traemos a casa a cuatro de nuestros queridos rehenes, fallecidos', confirmó Netanyahu, quien instó a que no permitirá que otro ataque como el del 7 de octubre de 2023 'vuelta a suceder'. Además de los cuerpos de la familia de orígenes argentinos Bibas -el de la madre Shiri y sus hijos Ariel y Kfir, de 5 y 2 años, respectivamente-, Hamás confirmó hoy que el cuarto fallecido devuelto mañana será Oded Lifshitz, de 84 años y también tomado a la fuerza del kibutz Nir Oz. Ya el 29 de noviembre de 2023, el brazo armado de Hamás anunció que los tres Bibas habían muerto en un bombardeo israelí unos días antes, algo que Israel no confirmó hasta ahora. El padre, Yarden, fue liberado en el canje del pasado 1 de febrero. La mujer de Lifshitz, Yocheved, fue liberada durante la primera y única tregua de la guerra en noviembre de 2023, cuando 105 rehenes (entre ellos todos los menores con vida) fueron puestos en libertad por 240 terroristas presos y detenidos palestinos. Desde el inicio del actual alto el fuego, el pasado 19 de enero, un total de 24 rehenes con vida -incluidos cinco tailandeses de forma imprevista- han sido liberados a cambio de cientos de terroristas, según lo pactado. El próximo jueves, 27 de febrero, concluirán las liberaciones previstas en la primera fase del alto el fuego: tras la puesta en libertad el sábado 22 de seis rehenes más con vida y la entrega de otros cuatro cadáveres ese jueves. La entrada Netanyahu: mi corazón 'está desgarrado' con la entrega de los cuerpos de rehenes se publicó primero en Aurora Israel Noticias en Español.	https://aurora-israel.co.il/netanyahu-mi-corazon-esta-desgarrado-con-la-entrega-de-los-cuerpos-de-rehenes/	2025-02-19T10:30:27-08:00	
Conversaciones sobre segunda fase de alto el fuego en Gaza comenz...	Las negociaciones indirectas entre Israel y Hamás sobre la segunda fase del acuerdo de alto el fuego en la Franja de Gaza comenzará la semana que viene tras la llegada de una delegación israelí a Doha, informaron fuentes de seguridad egipcias y del grupo terrorista palestino. Según los informantes, que pidieron mantener el anonimato por la sensibilidad del asunto, 'Israel enviará una delegación negociadora a Qatar la semana que viene para abordar la segunda fase del acuerdo de Gaza' después de que el primer ministro israelí, Benjamín Netanyahu, afirmara a los mediadores su compromiso con esta ronda de consultas. La fuente de Hamás añadió que Egipto y Qatar -los principales mediadores- advirtieron al equipo negociador de los palestinos de que Israel 'quiere desarmar' al movimiento terrorista y transferir el control de Gaza a la Autoridad Palestina (AP), algo que el grupo rechaza 'rotundamente'. Medios informaron el martes de que Netanyahu sustituyó a los líderes de las agencias de inteligencia israelíes (el Mossad y el Shin Bet) por su ministro de Asuntos Estratégicos, Ron Dermer, para liderar la delegación negociadora israelí de cara a las conversaciones para la segunda fase de la tregua en Gaza. Esto tuvo lugar después de que el líder negociador de Hamás, Jalil al Haya, ofreciera en un discurso televisado liberar al resto de los rehenes israelíes con vida de una sola vez durante la segunda fase, a cambio de la retirada total de las fuerzas israelíes de Gaza y el fin definitivo de la guerra. Algunos miembros del Gobierno israelí como el ministro de Finanzas, Bezalel Smotrich, han exigido que Israel vuelva a combatir en Gaza una vez termine la primera fase de la tregua, en la que deben ser liberados 33 rehenes (19 han salido ya) a cambio de unos 1.900 terroristas presos palestinos. Una vez completada la primera fase, quedarían en el enclave 59 israelíes, de los que al menos 35 están muertos, según Israel. La entrada Conversaciones sobre segunda fase de alto el fuego en Gaza comenzarán la semana que viene se publicó primero en Aurora Israel Noticias en Español.	https://aurora-israel.co.il/conversaciones-sobre-segunda-fase-de-alto-el-fuego-en-gaza-comenzaran-la-semana-que-viene/	2025-02-19T08:53:20-08:00	
Egipto dice que la Franja de Gaza puede ser reconstruida en un pe...	El primer ministro de Egipto, Mustafa Madbuli, afirmó este miércoles que la Franja de Gaza puede ser reconstruida en tres años, un periodo que consideró 'más que suficiente' a nivel técnico si hay una colaboración entre empresas constructoras egipcias y de otros países de Oriente Medio. 'Tres años es un periodo bastante aceptable para concluir el proyecto', dijo Madbuli en una rueda de prensa al término de una reunión del Consejo de Ministros egipcio, donde afirmó que Egipto tiene 'la capacidad de reconstruir toda la Franja de una forma mejor a la que se encontraba antes de ser destruida'. Asimismo, afirmó que su Gobierno está elaborando un 'marco general' para empezar las obras y que 'las empresas egipcias, árabes y regionales de los países musulmanes tienen la capacidad y la experiencia de implementar los planes de reconstrucción durante este periodo' de tres años. 'Desde el punto técnico este periodo es más que suficiente para la reconstrucción', insistió Madbuli, sin ofrecer más detalles sobre el coste del proyecto, su financiación y su viabilidad una vez expire el acuerdo de alto el fuego entre Israel y el grupo terrorista palestino Hamás. Egipto ha insistido en las últimas semanas en que cuenta con un plan de tres etapas para reconstruir la devastada Franja de Gaza sin tener que desplazar a los palestinos, un proyecto con el que El Cairo quiere hacer frente a las intenciones del presidente estadounidense Donald Trump de construir ahí la 'Riviera de Oriente Medio'', algo a lo que Egipto en particular y la comunidad internacional en general se oponen de plano.'. Según estimaciones de Naciones Unidas, el Banco Mundial y la Unión Europea (UE) publicadas el martes, la reconstrucción de la Franja de Gaza podría costar alrededor de 53.000 millones de dólares. La semana pasada el magnate inmobiliario egipcio Talaat Mustafa recordó en una entrevista a la cadena MBC Masr que reconstruir Gaza requeriría edificar unas 200.000 unidades de vivienda para albergar a unos 1,2 millones de personas, algo que se podría conseguir en tres años si colaboran 'entre 40 y 50' constructoras. La entrada Egipto dice que la Franja de Gaza puede ser reconstruida en un periodo de tres años se publicó primero en Aurora Israel Noticias en Español.	https://aurora-israel.co.il/egipto-dice-que-la-franja-de-gaza-puede-ser-reconstruida-en-un-periodo-de-tres-anos/	2025-02-19T08:50:24-08:00	
Israel presenta cargos contra cinco reservistas por abusar presun...	La Fiscalía Militar presentó cargos este miércoles contra cinco soldados reservistas de la 'Fuerza 17', especializada en control antidisturbios de la prisión, por abusar presuntamente de un preso de seguridad palestino en el campo de detención de Sde Teiman, en el sur de Israel, informaron las Fuerzas de Defensa de Israel (FDI) en un comunicado.El caso, que fue revelado en verano del año pasado, causó conmoción en el país, pero también muestras de apoyo a los reservistas, que fueron detenidos durante varias semanas entre julio y agosto de 2024.El incidente en cuestión habría ocurrido el 5 de julio de 2024, cuando los reservistas, entre ellos dos oficiales, le dieron una paliza a un detenido -un presunto terrorista- que se encontraba esposado y con los ojos vendados durante un registro, llegando a causarle un desgarramiento anal tras apuñalarle con un 'objeto punzante' en las nalgas, según la acusación.Los acusados patearon, arrastraron y dispararon con un táser (una pistola eléctrica) al preso en la cabeza, añade la acusación.El detenido fue descubierto después por el personal del centro de detención en su cama, sangrando por el ano y con problemas para respirar, y fue trasladado a un hospital.Sufrió fracturas en siete costillas, un pulmón perforado y tuvo que ser operado para abrirle un estoma en el abdomen.Antes de la acusación, las Fuerzas de Defensa de Israel recogieron aparentemente numerosas pruebas, como grabaciones de las cámaras de seguridad del centro de detención, añade el documento.No es el único caso de presuntos abusos registrados en el centro de Sde Teiman contra presos de seguridad palestinos detenidos durante la guerra de Israel en Gaza, muchos de los cuales se encuentran en detención administrativa, sin cargos ni juicio.A principios de agosto del año pasado, la ONG B'Tselem publicó un informe detallando el supuesto abuso sufrido por decenas de presos de seguridad en custodia tras el comienzo de la guerra en Gaza.Agencias colaboraron con este artículo de Aurora La entrada Israel presenta cargos contra cinco reservistas por abusar presuntamente de un preso de seguridad palestino se publicó primero en Aurora Israel Noticias en Español.	https://aurora-israel.co.il/israel-presenta-cargos-contra-cinco-reservistas-por-abusar-presuntamente-de-un-preso-de-seguridad-palestino/	2025-02-19T03:33:38-08:00	
Fiyi declara su apoyo a Netanyahu y anuncia el traslado de su emb...	El primer ministro de Fiyi, Sitiveni Rabuka, manifestó este miércoles su apoyo a su par israelí, Benjamín Netanyahu, en una conversación telefónica, en la que le transmitió su decisión de trasladar de Tel Aviv a Jerusalén la embajada del archipiélago.'Recibí una llamada telefónica de mi amigo, el primer ministro Netanyahu esta mañana, expresando su gratitud por la decisión de Fiyi de abrir una misión diplomática en Jerusalén', dijo el político de Oceanía en un comunicado difundido hoy a través de Facebook.En esa conversación, ambos reafirmaron el 'compromiso con el fortalecimiento de los vínculos' bilaterales, al tiempo que Rabuka expresó sus condolencias al mandatario israelí por los 'trágicos acontecimientos del 7 de octubre de 2023, cuando Hamás atacó vidas inocentes en Israel', señala el escrito.El último encuentro conocido entre ambos políticos tuvo lugar en Nueva York, en el marco de la Asamblea General de Naciones Unidas de 2023, cuando Rabuka manifestó su admiración por Netanyahu, semanas antes de los ataques de Hamás, que desencadenaron la guerra entre el Estado hebreo y la organización terrorista islámica en Gaza.La conversación se produce un día después de que Fiyi anunciara su decisión de trasladar su embajada de Tel Aviv a Jerusalén, siguiendo la senda marcada en 2018 por Estados Unidos y copiada en los últimos años por países como Guatemala, Honduras, Kosovo, Papúa Nueva Guinea y Paraguay.Israel considera Jerusalén (incluida su parte este, liberada en 1967 y anexada en 1980) como su capital única e indivisible.Agencias colaboraron con este artículo de Aurora La entrada Fiyi declara su apoyo a Netanyahu y anuncia el traslado de su embajada a Jerusalén se publicó primero en Aurora Israel Noticias en Español.	https://aurora-israel.co.il/fiyi-declara-su-apoyo-a-netanyahu-y-anuncia-el-traslado-de-su-embajada-a-jerusalen/	2025-02-19T02:33:27-08:00	
