Title	Description	Link	pubDate	Image
Colombia’s president had a bold peace plan. It is not working	Negotiations that are not backed up by military muscle merely let armed groups expand	https://www.economist.com/the-americas/2024/12/01/colombias-president-had-a-bold-peace-plan-it-is-not-working	2024-12-01T11:00:41-08:00	
Suffering from the Bhopal disaster in India continues, 40 years on	So does the search for justice for victims of the world’s worst industrial accident	https://www.economist.com/asia/2024/12/01/suffering-from-the-bhopal-disaster-in-india-continues-40-years-on	2024-12-01T07:21:54-08:00	
Syrian rebels sweep into Aleppo in an embarrassing rout for Bashar al-Assad	The Syrian dictator will not be able to count on help from Russia and Iran, his closest allies	https://www.economist.com/middle-east-and-africa/2024/11/30/syrian-rebels-sweep-into-aleppo-in-an-embarrassing-rout-for-bashar-al-assad	2024-11-30T09:27:13-08:00	
Emmanuel Macron shows off the gloriously restored Notre Dame	Five years after it was gutted by fire, the cathedral is more beautiful than ever	https://www.economist.com/europe/2024/11/29/emmanuel-macron-shows-off-the-gloriously-restored-notre-dame-to-the-world	2024-11-29T07:53:57-08:00	
Entrevista con Javier Milei, presidente de Argentina	Transcripción de su encuentro con nuestro corresponsal	https://www.economist.com/the-americas/2024/11/29/entrevista-con-javier-milei-presidente-de-argentina	2024-11-29T03:19:20-08:00	
An interview with Javier Milei, Argentina’s president	A transcript of his meeting with our journalist	https://www.economist.com/the-americas/2024/11/28/an-interview-with-javier-milei-argentinas-president	2024-11-28T12:01:21-08:00	
Ursula von der Leyen has a new doctrine for handling the hard right	The boss of the European Commission embarks on a second term	https://www.economist.com/europe/2024/11/28/ursula-von-der-leyen-has-a-new-doctrine-for-handling-the-hard-right	2024-11-28T05:53:31-08:00	
Mexico and Canada brace for Donald Trump’s tariff thrashing	Mexico’s Claudia Sheinbaum and Canada’s Justin Trudeau are taking different approaches to looming trade war	https://www.economist.com/the-americas/2024/11/28/mexico-and-canada-brace-for-donald-trumps-tariff-thrashing	2024-11-28T05:53:31-08:00	
Donald Trump’s new Arab pal	Will a Lebanese-American businessman influence the incoming administration in the region?	https://www.economist.com/middle-east-and-africa/2024/11/28/donald-trumps-new-arab-pal	2024-11-28T05:53:31-08:00	
America under Joe Biden plays the pragmatist in Africa	Donald Trump is likely to follow suit	https://www.economist.com/middle-east-and-africa/2024/11/28/america-under-joe-biden-plays-the-pragmatist-in-africa	2024-11-28T05:53:31-08:00	
New cures for Africa’s most gruesome diseases	Sleeping sickness, riverblindess and more could be tackled	https://www.economist.com/middle-east-and-africa/2024/11/28/new-cures-for-africas-most-gruesome-diseases	2024-11-28T05:53:31-08:00	
Nigeria seeks to restore pride in its artefacts, ancient and modern	A new museum in Benin City will showcase 'a cauldron of creativity'	https://www.economist.com/middle-east-and-africa/2024/11/28/nigeria-seeks-to-restore-pride-in-its-artefacts-ancient-and-modern	2024-11-28T05:53:31-08:00	
Fathers are doing more child care in East Asia	About time, too	https://www.economist.com/asia/2024/11/28/fathers-are-doing-more-child-care-in-east-asia	2024-11-28T05:53:31-08:00	
Ice Age antelopes surge back from the brink of extinction	Even better, these peers of sabre-toothed tigers can help with carbon capture	https://www.economist.com/asia/2024/11/28/ice-age-antelopes-surge-back-from-the-brink-of-extinction	2024-11-28T05:53:31-08:00	
Indonesia’s Prabowo is desperate to impress Trump and Xi	The new president’s first foreign tour was a shambles	https://www.economist.com/asia/2024/11/28/indonesias-prabowo-is-desperate-to-impress-trump-and-xi	2024-11-28T05:53:31-08:00	
China suffers eruptions from its simmering discontents	Amid random violence and increasing protests, fears mount for social stability	https://www.economist.com/china/2024/11/28/china-suffers-eruptions-from-its-simmering-discontents	2024-11-28T05:53:31-08:00	
China’s government is badgering women to have babies	It is testing an expanded pro-natalist playbook	https://www.economist.com/china/2024/11/28/chinas-government-is-badgering-women-to-have-babies	2024-11-28T05:53:31-08:00	
Wegovy hits the People’s Republic, at last	China mainlines 'Musk’s miracle medicine', at a fraction of the cost in America	https://www.economist.com/china/2024/11/28/wegovy-hits-the-peoples-republic-at-last	2024-11-28T05:53:31-08:00	
Tariffers' v 'traders': the new contest for Donald Trump’s ear	Eye-witnesses to the drama of the first Trump presidency brace for the sequel	https://www.economist.com/international/2024/11/28/tariffers-v-traders-the-new-contest-for-donald-trumps-ear	2024-11-28T05:53:31-08:00	
Is India’s education system the root of its problems?	A recent comparison with China suggests that may be so	https://www.economist.com/asia/2024/11/28/is-indias-education-system-the-root-of-its-problems	2024-11-28T03:14:00-08:00	
Meet the outspoken maverick who could lead India	Nitin Gadkari, India’s highways minister, talks to The Economist	https://www.economist.com/asia/2024/11/28/meet-the-outspoken-maverick-who-could-lead-india	2024-11-28T03:12:28-08:00	
Javier Milei, free-market revolutionary	Argentina’s president explains how he has overturned the old economic order	https://www.economist.com/the-americas/2024/11/28/javier-milei-free-market-revolutionary	2024-11-28T03:04:24-08:00	
Marine Le Pen spooks the bond markets	She threatens to bring down the French government, but also faces a possible ban from politics	https://www.economist.com/europe/2024/11/27/marine-le-pen-spooks-the-bond-markets	2024-11-27T09:58:31-08:00	
Israel and Hizbullah strike a fragile deal to end their war	Joe Biden’s last roll of the dice on peace in the Middle East	https://www.economist.com/middle-east-and-africa/2024/11/26/israel-and-hizbullah-strike-a-fragile-deal-to-end-their-war	2024-11-26T13:10:51-08:00	
The world is losing the fight against international gangs	Globalisation and technological progress are leading to a boom in organised crime	https://www.economist.com/international/2024/11/26/the-world-is-losing-the-fight-against-international-gangs	2024-11-26T05:10:02-08:00	
The maths of Europe’s military black hole	It needs to spend to defend, but voters may balk	https://www.economist.com/europe/2024/11/25/the-maths-of-europes-military-black-hole	2024-11-25T13:36:31-08:00	
The frightening maths of Europe’s military black hole	It needs to spend to defend, but voters may balk	https://www.economist.com/europe/2024/11/25/the-frightening-maths-of-europes-military-black-hole	2024-11-25T13:36:31-08:00	
Is Uruguay too stable for its own good?	The new president must deal with serious problems with growth, education and crime	https://www.economist.com/the-americas/2024/11/25/is-uruguay-too-stable-for-its-own-good	2024-11-25T04:37:25-08:00	
Half a loaf, at best, from the climate talks	This year’s negotiations made very modest progress	https://www.economist.com/international/2024/11/24/half-a-loaf-at-best-from-the-climate-talks	2024-11-24T09:30:03-08:00	
The Adani scandal creates a storm for Narendra Modi	The tycoon’s indictment clouds the prime minister’s prospects following important state elections	https://www.economist.com/asia/2024/11/24/the-adani-scandal-creates-a-storm-for-narendra-modi	2024-11-24T07:01:09-08:00	
Ukraine’s warriors brace for a Kremlin surge in the south	Vladimir Putin’s war machine is pushing harder and crushing Ukrainian morale	https://www.economist.com/europe/2024/11/24/ukraines-warriors-brace-for-a-kremlin-surge-in-the-south	2024-11-24T06:11:02-08:00	
Priyanka Gandhi: dynastic scion, and hope of India’s opposition	Poised to enter parliament, she may have bigger ambitions than that	https://www.economist.com/asia/2024/11/23/priyanka-gandhi-dynastic-scion-and-hope-of-indias-opposition	2024-11-23T09:03:29-08:00	
Bolsonaro’s bid to regain Brazil’s presidency may end in prison	Brazilian police have accused some his backers of involvement not just in a coup, but in an assassination plot	https://www.economist.com/the-americas/2024/11/22/bolsonaros-bid-to-regain-brazils-presidency-may-end-in-prison	2024-11-22T09:02:22-08:00	
Vladimir Putin fires a new missile to amplify his nuclear threats	The attack on Ukraine is part of a new era of missile warfare	https://www.economist.com/europe/2024/11/21/vladimir-putin-fires-a-new-missile-to-amplify-his-nuclear-threats	2024-11-21T14:58:22-08:00	
The arrest warrant is a diplomatic disaster for Netanyahu	But may also undermine the International Criminal Court	https://www.economist.com/middle-east-and-africa/2024/11/21/the-arrest-warrant-for-netanyahu-will-have-big-consequences	2024-11-21T12:38:04-08:00	
Israel’s hardliners reckon Gaza’s chaos shows they must control it	Only 11 out of a recent convoy of 109 aid trucks managed to get in	https://www.economist.com/middle-east-and-africa/2024/11/21/israels-hardliners-reckon-gazas-chaos-shows-they-must-control-it	2024-11-21T05:52:31-08:00	
A genocidal militia’s quest for legitimacy	A warring party in Sudan claims it wants to talk peace	https://www.economist.com/middle-east-and-africa/2024/11/21/a-genocidal-militias-quest-for-legitimacy	2024-11-21T05:52:31-08:00	
Why GM crops aren’t feeding Africa	Despite decades of research, few countries grow them there	https://www.economist.com/middle-east-and-africa/2024/11/21/why-gm-crops-arent-feeding-africa	2024-11-21T05:52:31-08:00	
A rise in antisemitism puts Europe’s liberal values to the test	The return of Europe’s oldest scourge	https://www.economist.com/europe/2024/11/21/a-rise-in-antisemitism-puts-europes-liberal-values-to-the-test	2024-11-21T05:52:31-08:00	
Parlacen, a bizarre parliament, is a refuge for bent politicians	A seat in the Central American body offers immunity from prosecution	https://www.economist.com/the-americas/2024/11/21/parlacen-a-bizarre-parliament-is-a-refuge-for-bent-politicians	2024-11-21T05:52:31-08:00	
The mafia’s latest bonanza: salmon heists	Fish farming is big business in Chile. Stealing fish is, too	https://www.economist.com/the-americas/2024/11/21/the-mafias-latest-bonanza-salmon-heists	2024-11-21T05:52:31-08:00	
Racial tensions boil over in New Zealand	A controversial bill regarding Maori people punctures its relative harmony	https://www.economist.com/asia/2024/11/21/racial-tensions-boil-over-in-new-zealand	2024-11-21T05:52:31-08:00	
The Caspian Sea is shrinking rapidly	This has big implications for Russia, which has come to rely on Central Asian ports	https://www.economist.com/asia/2024/11/21/the-caspian-sea-is-shrinking-rapidly	2024-11-21T05:52:31-08:00	
Helping America’s hawks get inside the head of Xi Jinping	China’s leader is a risk-taker. How far will he go in confronting America?	https://www.economist.com/china/2024/11/21/helping-americas-hawks-get-inside-the-head-of-xi-jinping	2024-11-21T05:52:31-08:00	
Trump, trade and feeding China’s pigs	As a trade war looms, China looks to cut its reliance on America	https://www.economist.com/china/2024/11/21/trump-trade-and-feeding-chinas-pigs	2024-11-21T05:52:31-08:00	
Once a free-market pioneer, Sri Lanka takes a leap to the left	A new president with Marxist roots now dominates parliament too	https://www.economist.com/asia/2024/11/21/once-a-free-market-pioneer-sri-lanka-takes-a-leap-to-the-left	2024-11-21T04:28:21-08:00	
The mystery of India’s female labour-force participation rate	A good news story? Maybe	https://www.economist.com/asia/2024/11/21/the-mystery-of-indias-female-labour-force-participation-rate	2024-11-21T04:28:01-08:00	
Why is it so hard for Indians to get a visa?	Outsourcing firms are capitalising on Indians’ misery	https://www.economist.com/asia/2024/11/21/why-is-it-so-hard-for-indians-to-get-a-visa	2024-11-21T04:27:45-08:00	
The surprising stagnation of Asia’s middle classes	It could shake-up everything from profits to politics	https://www.economist.com/asia/2024/11/21/the-surprising-stagnation-of-asias-middle-classes	2024-11-21T04:27:25-08:00	
Once dominant, Germany is now desperate	As an election looms its business model is breaking down	https://www.economist.com/europe/2024/11/20/once-dominant-germany-is-now-desperate	2024-11-20T10:39:35-08:00	
Germany election 2025 tracker: who’s ahead in the polls?	Follow the latest odds for which parties may form the next government	https://www.economist.com/interactive/2025-german-election	2024-11-20T08:31:12-08:00	
Get ready for 'Maximum Pressure 2.0' on Iran	The Trump White House may bomb and penalise the regime into a deal	https://www.economist.com/middle-east-and-africa/2024/11/19/get-ready-for-maximum-pressure-20-on-iran	2024-11-19T10:56:50-08:00	
Snuffing out the flame of freedom in Hong Kong	Dozens of democracy activists are thrown into jail for up to a decade	https://www.economist.com/china/2024/11/19/snuffing-out-the-flame-of-freedom-in-hong-kong	2024-11-19T10:37:14-08:00	
Is your master’s degree useless?	New data show a shockingly high proportion of courses are a waste of money	https://www.economist.com/international/2024/11/18/is-your-masters-degree-useless	2024-11-18T14:39:06-08:00	
Ukraine can, at last, use its Western missiles inside Russia	Joe Biden wants to send North Korea a message	https://www.economist.com/europe/2024/11/18/ukraine-can-at-last-use-its-western-missiles-inside-russia	2024-11-18T02:47:45-08:00	
Firing American missiles at Russia won’t change Ukraine’s fortunes	But Joe Biden wants to send North Korea a message	https://www.economist.com/europe/2024/11/18/firing-american-missiles-at-russia-wont-change-ukraines-fortunes	2024-11-18T02:47:45-08:00	
Ukraine can, at last, use its American missiles inside Russia	Joe Biden wants to send North Korea a message	https://www.economist.com/europe/2024/11/18/ukraine-can-at-last-use-its-american-missiles-inside-russia	2024-11-18T02:47:45-08:00	