Title	Description	Link	pubDate	Image
TikTok to ‘go dark’ this weekend unless US assures non-enforcement of shutdown	The Supreme Court in its ruling held that the risk to national security posed by TikTok's ties to China overcomes concerns about limiting speech by the app or its 170 million users in the United States	https://www.firstpost.com/world/tiktok-to-go-dark-this-weekend-unless-us-assures-non-enforcement-of-shutdown-13854016.html	2025-01-18T00:38:42-08:00	https://images.firstpost.com/uploads/2025/01/TikTok-is-pushing-users-in-the-US-to-sister-app-Lemon8-as-it-faces-potential-ban-2025-01-6a1aee1a9f5f9886e9f02cefb9d1b5f5-1200x675.jpg
Gaza ceasefire to take effect at 6:30 am GMT Sunday: Qatar	The Qatari Foreign Ministry issued an advisory to Palestinians 'to take precaution, exercise the utmost caution, and wait for directions from official sources'	https://www.firstpost.com/world/gaza-ceasefire-to-take-effect-at-630-am-gmt-sunday-qatar-13854011.html	2025-01-18T00:12:19-08:00	https://images.firstpost.com/uploads/2025/01/israel1-2025-01-20bc42c5de726f1c9248d992ab4901d2.jpg
Israel's justice ministry approves release of 737 prisoners in first phase of Gaza truce deal	Israel's cabinet voted to approve the ceasefire deal early Saturday, according to Prime Minister Benjamin Netanyahu's office, ending days of uncertainty about whether the truce would go into effect this weekend	https://www.firstpost.com/world/israels-justice-ministry-approves-release-of-737-prisoners-in-first-phase-of-gaza-truce-deal-13854013.html	2025-01-18T00:10:23-08:00	https://images.firstpost.com/uploads/2025/01/Israel-Hamas-ceasefire-announcement-celebrations-in-Gaza-2025-01-1ef5f1ce0727acdec2c1125d112f7c70-1200x675.jpg
We escaped death, 20-25 minutes apart': Sheikh Hasina reveals assassination plot in Bangladesh	Hasina insisted that she survived multiple assassination attempts and called it a 'divine intervention'	https://www.firstpost.com/world/we-escaped-death-20-25-minutes-apart-sheikh-hasina-reveals-assassination-plot-in-bangladesh-13853989.html	2025-01-17T22:55:48-08:00	https://images.firstpost.com/uploads/2025/01/hasina-rehana-2025-01-3015ef51b381d3195239e3697d45b059.jpg
Gangs clash with police in Brazilian Amazon, 13 dead	Eight people were killed in attacks by criminal gangs and another five died in clashes with the police since Tuesday morning, according to Rondonia's security department	https://www.firstpost.com/world/gangs-clash-with-police-in-brazilian-amazon-13-dead-13853981.html	2025-01-17T21:50:27-08:00	https://images.firstpost.com/uploads/2024/11/Brazil-security-G20-Summit-2024-11-4c646d0703c785c8dc2524b8bdc6ca44-1200x675.jpg
Court in Bolivia orders arrest of former President Evo Morales for abusing minor when he was in office	The judge ordered Morles's assets to be frozen and banned the former president from leaving the country	https://www.firstpost.com/world/court-in-bolivia-orders-arrest-of-former-president-evo-morales-for-abusing-minor-when-he-was-in-office-13853968.html	2025-01-17T21:37:55-08:00	https://images.firstpost.com/uploads/2024/10/Untitled-design-2024-10-27T202926.825-2024-10-b69b75f3880cdda8f5b49af69183b7bd.jpg
Nicaragua swears in 1,400 masked civilians as ‘volunteer’ police force	More than 4,000 people have been inducted into the force over just three days this week across the Central American nation, according to the government's official news site	https://www.firstpost.com/world/nicaragua-swears-in-1400-masked-civilians-as-volunteer-police-force-13853970.html	2025-01-17T21:28:45-08:00	https://images.firstpost.com/uploads/2025/01/Nicaragua-2025-01-5544aebdd3110d52b6ec9dc54efbdbe8-1200x675.jpg
TikTok ban looms as Supreme Court upholds law, raising questions about enforcement	In a unanimous decision on Friday, the Supreme Court upheld a federal law that will ban TikTok unless it's sold by its China-based parent company before Jan. 19 — ruling that a risk to national security posed by the platform's ties to China overcomes First Amendment concerns about limiting free speech on and by the app	https://www.firstpost.com/world/tiktok-ban-looms-as-supreme-court-upholds-law-raising-questions-about-enforcement-13853965.html	2025-01-17T20:30:40-08:00	https://images.firstpost.com/uploads/2025/01/TikTok-is-pushing-users-in-the-US-to-sister-app-Lemon8-as-it-faces-potential-ban-2025-01-6a1aee1a9f5f9886e9f02cefb9d1b5f5-1200x675.jpg
South Korea's Yoon likely to explain to court why he imposed martial law	Yoon on Wednesday became the country's first sitting president to be arrested, in a criminal probe related to his short-lived declaration of martial law on Dec. 3	https://www.firstpost.com/world/south-koreas-yoon-likely-to-explain-to-court-why-he-imposed-martial-law-13853962.html	2025-01-17T20:10:00-08:00	https://images.firstpost.com/uploads/2024/12/South-Korean-President-Yoon-Suk-Yeol-2024-12-7ceccd15f890ac283873fd1ce05ad1b9-1200x675.jpg
Days after Musk live-streamed chat with AfD leader, EU steps up scrutiny of X	The European Commission stated on Friday that it will add extra stages to a probe that began in December 2023. That investigation became politically charged as Musk, who will play a crucial role in the new Trump administration, partnered with European far-right groups such as the German Alternative for Germany ahead of a Feb. 23 election	https://www.firstpost.com/world/days-after-musk-live-streamed-chat-with-afd-leader-eu-steps-up-scrutiny-of-x-13853956.html	2025-01-17T19:45:45-08:00	https://images.firstpost.com/uploads/2025/01/Elon-Musk-2025-01-5e2aed68ae1b3561060b7fa7fa60eebc-1200x675.jpg
US grounds SpaceX's Starship after it exploded mid-air during 7th test mission	In a statement following the accident, the FAA said that it was working with SpaceX and other authorities to confirm the property damage caused by the debris that fell in the Turks and Islands	https://www.firstpost.com/world/us-grounds-spacexs-starship-after-it-exploded-mid-air-during-7th-test-mission-13853957.html	2025-01-17T19:24:21-08:00	https://images.firstpost.com/uploads/2025/01/F250116YS406-640x400-1-2025-01-35820848ff39d7f2f2f2f3535e5f20e4.jpg
5 things about Asean foreign ministers' retreat in Malaysia	The retreat, hosted at the Langkawi International Convention Centre, is expected to see the participation of over 200 delegates. It will bring together foreign ministers from the 10 Asean member states and Timor-Leste, an observer	https://www.firstpost.com/world/5-things-about-asean-foreign-ministers-retreat-in-malaysia-13853943.html	2025-01-17T18:30:54-08:00	https://images.firstpost.com/uploads/2025/01/ASEAN-foreign-ministers-meeting-2025-01-ea4434bc155ee9c9d06f3fa435f58cbd.jpg
Pakistan International Airlines apologies for '9/11-like' Eiffel Tower ad	The creative shared by the airline showed a plane aiming at the French landmark with the caption 'Paris, we’re coming today'. The advertisement received major flak online with many comparing it to the devastating 9/11 attacks on New York Twin Towers in the United States	https://www.firstpost.com/world/pakistan-international-airlines-apologies-for-9-11-like-eiffel-tower-ad-13853953.html	2025-01-17T17:51:55-08:00	https://images.firstpost.com/uploads/2025/01/2025-01-15_183810-2025-01-69a3087968ddfd35eb4ea1cbb1d2a1ba.jpg
Russian court hands 3 Navalny lawyers prison sentences for relaying opposition leader's messages	Navalny's lawyers Vadim Kobzev, Alexei Liptser and Igor Sergunin were found guilty of participating in an 'extremist organisation' by a court in the town of Petushki	https://www.firstpost.com/world/russian-court-hands-3-navalny-lawyers-prison-sentences-for-relaying-opposition-leaders-messages-13853949.html	2025-01-17T17:25:06-08:00	https://images.firstpost.com/uploads/2025/01/5682-2025-01-7b59a13babafe74656d65dd75127e532.jpg
After security cabinet, Israel's government approves Gaza ceasefire deal, paving way for Sunday implementation	The full cabinet meeting ended in the early hours of Saturday as the lawmakers agreed that a six-week ceasefire would come into effect on Sunday	https://www.firstpost.com/world/after-security-cabinet-israels-government-approves-gaza-ceasefire-deal-paving-way-for-sunday-implementation-13853947.html	2025-01-17T16:47:49-08:00	https://images.firstpost.com/uploads/2025/01/2084-2025-01-1ea537354dab8945b1e43dfa44872c38.jpg
39 killed in Colombia guerilla violence, govt suspends peace talks with the group	President Gustavo Petro paused already-spluttering peace negotiations with the National Liberation Army (ELN), accusing them of 'war crimes' during a fresh wave of unrest	https://www.firstpost.com/world/39-killed-in-colombia-guerilla-violence-govt-suspends-peace-talks-with-the-group-13853945.html	2025-01-17T16:16:25-08:00	https://images.firstpost.com/uploads/2025/01/AFP__20250117__36UC6ZK__v1__HighRes__ColombiaConflictAttack-1-2025-01-3e0bbc1a9a4bd3c74f60b383c4b183e8.jpg
Biden has kept up the trend of controversial 'midnight regulations': What is it and will it trouble Trump?	The 'midnight regulations' could be Biden's way of cementing his legacy and getting past administrative hurdles. But for Trump, who might want to roll them back, these rules are likely to open up a time-taking, resource-intensive process	https://www.firstpost.com/world/united-states/biden-has-kept-up-the-trend-of-controversial-midnight-regulations-what-is-it-and-will-it-trouble-trump-13853939.html	2025-01-17T12:33:43-08:00	https://images.firstpost.com/uploads/2024/12/Representational-Image-2024-12-25T003001.671-2024-12-036153ef2807547568e8d7c10bd2dcbe.jpg
Dutch diplomat Sigrid Kaag appointed as UN West Asia envoy by Antonio Guterres	United Nations SecretaryGeneral Antonio Guterres on Friday named former Dutch Foreign Minister Sigrid Kaag as the new U.N. Middle East envoy, a U.N. spokesperson said.	https://www.firstpost.com/world/dutch-diplomat-sigrid-kaag-appointed-as-un-west-asia-envoy-by-antonio-guterres-13853927.html	2025-01-17T09:53:16-08:00	https://images.firstpost.com/uploads/2025/01/Representational-Image-48-2025-01-91eb975856e0d0be9b1938533def6dcb.jpg
Israel releases list of 95 Palestinian prisoners eligible to walk out of jail starting Sunday	The Israeli justice ministry published a list of 95 Palestinian prisoners who are to be freed starting Sunday as part of the first exchange for Israeli captives under a Gaza ceasefire deal	https://www.firstpost.com/world/israel-releases-list-of-95-palestinian-prisoners-eligible-to-walk-out-of-jail-starting-sunday-13853921.html	2025-01-17T09:51:13-08:00	https://images.firstpost.com/uploads/2025/01/PalestinianIsraelConflict1200-1-2025-01-dacf384f8af88d3638e61cff730531f3.jpg
Violence over cocaine trade thwarts Colombia's peace negotiations with country's largest guerilla group	Colombian President Gustavo Petro accused the ELN, the country's largest guerilla group, of committing 'war crimes' and declared on social media, 'The ELN shows no willingness to make peace'	https://www.firstpost.com/world/violence-over-cocaine-trade-thwarts-colombias-peace-negotiations-with-countrys-largest-guerilla-group-13853926.html	2025-01-17T09:40:44-08:00	https://images.firstpost.com/uploads/2025/01/Colombia-war-Colombia-conflict-2025-01-504277c6bf34677ffed6a172007aeb7c.jpg
Over 1,000 Syrians withdraw asylum bids in Cyprus, plan return after Assad's fall	Cyprus has adopted tougher policies in the last few years to stem the arrival of thousands of migrants either by boat from neighboring Lebanon, Syria or Turkey via the island’s breakaway Turkish Cypriot north. Cypriot officials had said that the percentage of irregular migrants relative to the population had been as high as 6% — six times the European average.	https://www.firstpost.com/world/over-1000-syrians-withdraw-asylum-bids-in-cyprus-plan-return-after-assads-fall-13853920.html	2025-01-17T08:38:21-08:00	https://images.firstpost.com/uploads/2025/01/Representational-Image-47-2025-01-6011d06dc4053e5256a7780f6966246e.jpg
Why are shipping companies avoiding Red Sea trade route despite Gaza ceasefire?	I'll spend the extra money, and I'll send everything around the tip of Africa...There is no way I'm putting any of my merchandise on a boat that's going to go through the Red Sea,' one toy supplier said	https://www.firstpost.com/world/why-are-shipping-companies-avoiding-red-sea-trade-route-despite-gaza-ceasefire-13853917.html	2025-01-17T08:09:40-08:00	https://images.firstpost.com/uploads/2024/10/WhatsApp-Image-2024-10-10-at-11.49.44-2024-10-ff199ea75f979c07b9ddcbff6b70b12f-1200x675.jpeg
After Canada, Mexico partners with EU to counter Trump's tariff plan	Trump, who returns to the White House Monday, has made sweeping threats of tariffs against US trading partners -- including the EU, Canada, Mexico and China	https://www.firstpost.com/world/after-canada-mexico-partners-with-eu-to-counter-trumps-tariff-plan-13853919.html	2025-01-17T08:09:06-08:00	https://images.firstpost.com/uploads/2024/11/Food-import-export-India-2024-11-518968463c8213423c9eea407b8fb674-1200x675.jpg
Truly a breakthrough document': Putin, Pezeshkian ink strategic partnership treaty	It is truly a breakthrough document,' said Russian President Vladimir Putin at the signing ceremony, adding that the two heavily sanctioned countries were 'united.. in taking our relationship to a new level'	https://www.firstpost.com/world/truly-a-breakthrough-document-putin-pezeshkian-ink-strategic-partnership-treaty-13853897.html	2025-01-17T07:26:52-08:00	https://images.firstpost.com/uploads/2025/01/RUSSIA-IRAN1200-1-2025-01-672e542298de344d6d80e3dec1743868.jpg
US Supreme Court upholds TikTok ban, law to take effect on Jan 19	The top court said in a unanimous judgment that the risk to national security posed by TikTok's ties to China overcomes concerns about limiting speech by the app or its 170 million users in the United States	https://www.firstpost.com/world/us-supreme-court-upholds-law-banning-tiktok-app-to-go-off-phones-from-sunday-13853911.html	2025-01-17T07:21:24-08:00	https://images.firstpost.com/uploads/2025/01/TikTok-is-pushing-users-in-the-US-to-sister-app-Lemon8-as-it-faces-potential-ban-2025-01-6a1aee1a9f5f9886e9f02cefb9d1b5f5-1200x675.jpg
Ex-Mozambique finance minister faces sentencing in New York over $2B ‘tuna bond’ scandal	Manuel Chang, 69, was convicted last year of accepting payoffs to put his homeland secretly on the hook for about $2 billion in loans from major overseas banks.	https://www.firstpost.com/world/ex-mozambique-finance-minister-faces-sentencing-in-new-york-over-2b-tuna-bond-scandal-13853901.html	2025-01-17T07:09:22-08:00	https://images.firstpost.com/uploads/2025/01/Representational-Image-46-2025-01-8d4afe9390100ea481cab044cd95095b.jpg
Xi Jinping holds phone talks with Donald Trump amid simmering US-China tensions	In-depth information regarding the contents of the phone conversation, which took place on Friday (January 17), has not yet been revealed. Trump did post about it on social media, though	https://www.firstpost.com/world/xi-jinping-holds-phone-talks-with-donald-trump-amid-simmering-us-china-tensions-13853891.html	2025-01-17T06:44:27-08:00	https://images.firstpost.com/uploads/2025/01/Donald-Trump-and-Xi-Jinping-2025-01-ab313e7931d92b76f1e6dfe6f9391a35-1200x675.jpg
TikTok, Shein and counting: Facing global flak, China denies forcing firms to share data in unlawful manner	Austrian advocacy group None of Your Business (Nyob) has lodged six complaints across four European countries, calling for the suspension of data transfers to China and pursuing fines that could amount to up to 4 per cent of a company's global revenue	https://www.firstpost.com/world/tiktok-shein-and-counting-facing-global-flak-china-denies-forcing-firms-to-share-data-in-unlawful-manner-13853896.html	2025-01-17T06:38:46-08:00	https://images.firstpost.com/uploads/2025/01/TikTok-2025-01-f8aee86921b94b3d01d3703185921cdf-1200x675.jpg
Former Canada finance minister Freeland enters Liberal leadership race to replace Trudeau	Former Canadian finance minister Chrystia Freeland, who was one of Trudeau’s closest political allies for a decade, quit last month after resisting his demands for more spending and wrote a letter denouncing his governing style.	https://www.firstpost.com/world/former-canada-finance-minister-freeland-enters-liberal-leadership-race-to-replace-trudeau-13853890.html	2025-01-17T06:14:09-08:00	https://images.firstpost.com/uploads/2025/01/Representational-Image-45-2025-01-39876f33798c74a6e6237fb4b2bc1649.jpg
In meeting with Trump, Meta CEO Zuckerberg blames COO Sheryl Sandberg for DEI hiring policy: Report	In the high-level Mar-a-Lago resort meeting with Trump and his advisers, Zuckerberg alleged that Sandberg was behind the 'inclusivity initiative' at Facebook that encouraged self-expression of employees in the workplace, according to a report	https://www.firstpost.com/world/in-meeting-with-trump-meta-ceo-zuckerberg-blames-coo-sheryl-sandberg-for-dei-hiring-policy-report-13853881.html	2025-01-17T06:09:45-08:00	https://images.firstpost.com/uploads/2025/01/zucks2-2025-01-e03c87fa111f9cee4b6032e7e223b1da.jpg
Trump’s Russia sanction plan to take cue from global oil markets, treasury pick Bessent drops hint	A more aggressive approach to Russian sanctions could involve stricter enforcement of secondary measures, targeting European shipping firms and Asian buyers, including major players in China and India	https://www.firstpost.com/world/trumps-russia-sanction-plan-to-take-cue-from-global-oil-markets-treasury-pick-bessent-drops-hint-13853878.html	2025-01-17T05:49:59-08:00	https://images.firstpost.com/uploads/2025/01/Donald-Trump-and-Vladimir-Putin-2025-01-abd654f498d4005089e3517cffb8a452-1200x675.jpg
Biden commutes sentences of 2,500 non-violent drug offenders in final act before leaving office	The move provides clemency relief to individuals who were sentenced based on discredited distinctions between crack and powder cocaine and outdated sentencing enhancements for drug crimes, according to the statement issued by the White House.	https://www.firstpost.com/world/biden-commutes-sentences-of-2500-non-violent-drug-offenders-in-final-act-before-leaving-office-13853879.html	2025-01-17T05:28:14-08:00	https://images.firstpost.com/uploads/2025/01/Biden-1-2025-01-8b8fde2130a43d09ee759aa93ce26b78.jpg
While Israel debates Gaza peace deal, Arab nations press for enforcing ceasefire ‘without any delay’	Egyptian and Israeli officials said an Israeli delegation from the military and its Shin Bet internal security agency were going to Cairo Friday to discuss the reopening of the Rafah crossing. Both officials spoke on condition of anonymity to discuss the negotiations	https://www.firstpost.com/world/while-israel-debates-gaza-peace-deal-arab-nations-press-for-enforcing-ceasefire-without-any-delay-13853876.html	2025-01-17T05:15:58-08:00	https://images.firstpost.com/uploads/2025/01/palestinian-1-2025-01-e27790d649eb3bb39e173cdd256e4cb1.jpg
Pezeshkian meets Putin in Moscow, says Iran and Russia can finalise nuclear plant agreements	Iranian President Masoud Pezeshkian told his Russian counterpart Vladimir Putin he believed their two countries could finalise agreements on the construction of a nuclear power plant in Iran as the two leaders held talks in Moscow on Friday	https://www.firstpost.com/world/pezeshkian-meets-putin-in-moscow-says-iran-and-russia-can-finalise-nuclear-plant-agreements-13853860.html	2025-01-17T05:06:37-08:00	https://images.firstpost.com/uploads/2025/01/RUSSIA-IRAN1200-2025-01-8b0dcfd093e6cdd05d9d35d83ee5fe8f.jpg
China hits 5% growth target, but critics question data accuracy as households continue to struggle	It seems dubious that China precisely hit its growth target for 2024 at a time when the economy continues to face tepid domestic demand, persistent deflationary pressures, and flailing property and equity markets,' said Eswar Prasad, a former China director at the IMF	https://www.firstpost.com/world/china-hits-5-growth-target-but-critics-question-data-accuracy-as-households-continue-to-struggle-13853863.html	2025-01-17T04:37:41-08:00	https://images.firstpost.com/uploads/2024/10/China-economy-2024-10-65968d397b7bc97919c0465e8bcdb6e7-1200x675.jpg
As Ukrainians flee country to escape military duty, police launch nationwide raids to nab draft evaders	Ukrainian police said Friday its officers were conducting 200 searches nationwide as part of an ongoing probe into the illegal exit of military-aged men from the country.	https://www.firstpost.com/world/as-ukrainians-flee-country-to-escape-military-duty-police-launch-nationwide-raids-to-nab-draft-evaders-13853807.html	2025-01-17T04:29:53-08:00	https://images.firstpost.com/uploads/2025/01/Representational-Image-42-2025-01-ba099e3dc18a178441d8ce7c8a925b03.jpg
Netanyahu to convene full Cabinet meeting today to ratify Israel-Hamas deal, says spokesperson	Israeli Prime Minister Benjamin Netanyahu will convene the full Cabinet's meeting today to ratify the Israel-Hamas deal, according to a spokesperson	https://www.firstpost.com/world/netanyahu-to-convene-full-cabinet-meeting-today-to-ratify-israel-hamas-deal-says-spokesperson-13853867.html	2025-01-17T04:29:50-08:00	https://images.firstpost.com/uploads/2025/01/Firstpost-2025-01-17T175701.210-2025-01-3a4554ebb9cf61066a0849a321c23ebe.jpg
IIT Mumbai promoting pseudoscience? Campus flutters over ‘science of begetting a good progeny' event	IIT-Mumbai is facing controversy over a January 18 event on 'the science of begetting a good progeny,' led by an Ayurveda expert from Sanskruti Arya Gurukulam. The talk, focused on topics like pregnancy health and 'garbhasanskar,' has raised concerns about promoting pseudoscience and sparked protests from students	https://www.firstpost.com/world/iit-mumbai-promoting-pseudoscience-campus-flutters-over-science-of-begetting-a-good-progeny-event-13853837.html	2025-01-17T04:21:08-08:00	https://images.firstpost.com/uploads/2024/04/thisweek1-2024-04-cca84d5cfa6d37c4090052e1463f3e79.jpg
Already in jail, Imran gets 14-yr sentence, wife Bushra arrested for 7-yr prison term: What are the cases	The verdict in the case, the largest in terms of financial wrongdoing faced by Khan, was delivered by an anti-graft court in a prison in the garrison city of Rawalpindi, where Khan has been jailed since August 2023	https://www.firstpost.com/world/already-in-jail-imran-gets-14-yr-sentence-wife-bushra-arrested-for-7-yr-prison-term-what-are-the-cases-13853858.html	2025-01-17T04:10:43-08:00	https://images.firstpost.com/uploads/2025/01/Untitled-design-2025-01-17T173846.120-2025-01-1fbe83dda8d0b66e07fb5f632b0216f8.jpg
Musk meddling in Germany, UK politics ‘unacceptable’ to over two-thirds of people: YouGov poll	A recent poll has shown that a majority of people in the UK and Germany view Elon Musk's attempts to sway their national politics as unacceptable, saying that the US tech magnate lacks a deep understanding of either country and the challenges they face, according to a report	https://www.firstpost.com/world/musk-meddling-in-germany-uk-politics-unacceptable-to-over-two-thirds-of-people-yougov-poll-13853841.html	2025-01-17T04:02:22-08:00	https://images.firstpost.com/uploads/2025/01/musk-2025-01-a9e3c9ea0d477964214a9dad4a3f4356.jpg
Polls showing Reform UK just behind Labour, Nigel Farage modulates tone: ‘Not anti-immigration’	On immigration, Farage said Reform UK is 'pro-control,' adding that 'we are not putting up the barriers entirely.' Farage’s comments mark a departure from his past. During the 2016 Brexit referendum, he controversially linked EU membership to an influx of migrants	https://www.firstpost.com/world/polls-showing-reform-uk-just-behind-labour-nigel-farage-modulates-tone-not-anti-immigration-13853820.html	2025-01-17T04:00:39-08:00	https://images.firstpost.com/uploads/2024/08/Frankfurt-airport-halts-flights-as-climate-activists-block-runway-42-2024-08-35529ff5e69bfd24a5fda4513f13e9dd.jpg
‘Worrying element’: Russia warns West over UK-Ukraine 100-yr partnership Starmer, Zelenskyy inked	Russia has warned that British military presence in Ukraine under the 100-year partnership announced this week would be a 'worried element'	https://www.firstpost.com/world/worrying-element-russia-warns-west-over-uk-ukraine-100-year-partnership-starmer-zelenskyy-inked-13853847.html	2025-01-17T03:41:48-08:00	https://images.firstpost.com/uploads/2024/12/Untitled-design-2024-12-19T200003.944-2024-12-7e5ef7df68ba36bdd966e07daa3013d9.jpg
On first India tour, Singapore President Tharman says 'exploring new initiatives beyond existing'	Singaporean President Tharman Shanmugaratnam, who is on a five-day India visit, said, business links between Singapore and India are thriving and the 'natural partnership' between the two countries is on a new trajectory	https://www.firstpost.com/world/on-first-india-tour-singapore-president-tharman-says-exploring-new-initiatives-beyond-existing-13853771.html	2025-01-17T03:37:54-08:00	https://images.firstpost.com/uploads/2025/01/Singapore-president-India-visit-2025-01-f392a5d2b0624b867d7196995b018978-1200x675.jpg
Ahead of Trump inauguration, FBI shuts down diversity office	The development comes at a time when Trump and other Republican leaders have been increasingly critical of government agencies prioritising diversity, equity and inclusion over national security	https://www.firstpost.com/world/ahead-of-trump-inauguration-fbi-shuts-down-diversity-office-13853818.html	2025-01-17T03:32:49-08:00	https://images.firstpost.com/uploads/2024/10/download-2024-10-05T125929.805-2024-10-734d73c39aa39bec3bd3f49e5ec02fa1.jpg
