Title	Description	Link	pubDate	Image
Trump said he'd end Russia-Ukraine war on Day One. Now his advisers say it’ll take months	Trump associates described the Day One promise as a mix of campaign bravado and an underestimation of the time needed to assemble a new administration capable of addressing the deeply entrenched conflict	https://www.firstpost.com/world/trump-said-hed-end-russia-ukraine-war-on-day-one-now-his-advisers-say-itll-take-months-13853122.html	2025-01-15T05:04:45-08:00	https://images.firstpost.com/uploads/2025/01/Donald-Trump-and-Vladimir-Putin-2025-01-abd654f498d4005089e3517cffb8a452-1200x675.jpg
Thailand's PM latest to 'almost' fall victim to 'call-centre' scam	So-called 'call centre scams' are common in Thailand, in which fraudsters impersonate police, government officials or bank staff -- often using automated 'robocalls' to make the first contact	https://www.firstpost.com/world/thailands-pm-latest-to-almost-fall-victim-to-call-centre-scam-13853145.html	2025-01-15T04:48:29-08:00	https://images.firstpost.com/uploads/2025/01/Untitled-design-43-2025-01-50e5bcb316448c0129f00c42ec5e116b.jpg
Pakistan was never a technical ally of US, says White House	In response to a question on the Joe Biden administration's efforts to revitalise the US-Pakistan alliance, the White House said that Pakistan has never been an ally of the United States	https://www.firstpost.com/world/pakistan-was-never-a-technical-ally-of-us-says-white-house-13853118.html	2025-01-15T04:17:09-08:00	https://images.firstpost.com/uploads/2025/01/Firstpost-2025-01-15T174455.402-2025-01-ee6bfcda3cba4cc505789bff9a351605.jpg
LA fires ‘a crisis that impacts the nation,’ says mayor as police arrest 50 for looting, other crimes	LA Police Chief Jim McDonnell said that out of the 50 people, three have been arrested on suspicion of arson after they were seen setting small fires that were immediately put out	https://www.firstpost.com/world/la-fires-a-crisis-that-impacts-the-nation-says-mayor-as-police-arrest-50-for-looting-other-crimes-13853102.html	2025-01-15T04:01:56-08:00	https://images.firstpost.com/uploads/2025/01/Los-Angeles-fires_AP-2025-01-ad8cb2088dfcb992581fee89e4b2ab3a.jpg
Bangladesh: Khaleda Zia acquitted in corruption case as Supreme Court overturns high court ruling	The verdict was delivered by a bench led by Chief Justice Dr Syed Refaat Ahmed after reviewing 79-year-old Zia’s appeal against the High Court’s ruling on Wednesday, the Dhaka Tribune reported.	https://www.firstpost.com/world/bangladesh-khaleda-zia-acquitted-in-corruption-case-as-supreme-court-overturns-high-court-ruling-13853110.html	2025-01-15T04:00:28-08:00	https://images.firstpost.com/uploads/2024/08/Untitled-2024-08-05T221110.996-2024-08-2da2020ba48d04cae929c90ca42845da.jpg
Trump worry in China: Export hubs Shanghai, Guangdong cut GDP targets over external pressure	Shanghai and Guangdong, key economic powerhouses, both announced growth targets of 'around 5 per cent,' down from the 5.5-6 per cent range set by several central and eastern provinces earlier this week	https://www.firstpost.com/world/trump-worry-in-china-export-hubs-shanghai-guangdong-cut-gdp-targets-over-external-pressure-13853101.html	2025-01-15T03:48:45-08:00	https://images.firstpost.com/uploads/2024/12/trump-and-Xi-1-2024-12-5db3d9c0aae47bf25e125fdb244780bc.jpg
India to join 'Afghan Quad'? Russia says New Delhi's increased role in Afghanistan will be 'right step'	Russian Foreign Minister Sergey Lavrov has said that India's inclusion in 'Afghan Quad', comprising Russia, China, Pakistan, and Iran, would be the 'right step'	https://www.firstpost.com/world/india-to-join-afghan-quad-russia-says-new-delhi-increased-role-in-afghanistan-will-be-right-step-13853094.html	2025-01-15T03:30:25-08:00	https://images.firstpost.com/uploads/2024/04/Untitled-2-2024-04-ad6661d33d9836bd37e8a0562dc4a22f.jpg
Vanuatu: Country with shortest work-week of 24.7 hrs votes in snap election tomorrow	The parliament consists of 52 members, elected from 18 constituencies. According to the data shared by the Vanuatu Electoral Office, there are 217 candidates in the fray. Among the candidates, seven are women.	https://www.firstpost.com/world/vanuatu-country-with-shortest-work-week-of-24-7-hrs-votes-in-snap-election-tomorrow-13853061.html	2025-01-15T03:03:27-08:00	https://images.firstpost.com/uploads/2025/01/Vanuatu_and_Port_Vila_Flags_282346674219929-2025-01-78dabbd3823055fd27b5f2a3ed1aa0b5-1200x675.jpeg
Palestinian Authority stakes claim to run Gaza govt post Israel-Hamas ceasefire	Palestinian prime minister Mohammad Mustafa said, 'While we’re waiting for the ceasefire, it’s important to stress that it will not be acceptable for any entity to govern Gaza Strip but the legitimate Palestinian leadership and the government of the State of Palestine'	https://www.firstpost.com/world/palestinian-authority-stakes-claim-to-run-gaza-govt-post-israel-hamas-ceasefire-13853067.html	2025-01-15T02:52:09-08:00	https://images.firstpost.com/uploads/2025/01/Palestinian-President-Mahmoud-Abbas-2025-01-4800c767720d88f6d9bf53e5dc21c248-1200x675.jpg
Shanghai plans to do a Singapore, courts 'walking GDP' Taylor Swift for concert	Inspired by how Taylor Swift's concerts have given a boost to various countries across the world, Shanghai officials have called for ease of restrictions on international singers so they can also host high-profile shows	https://www.firstpost.com/world/shanghai-plans-to-do-a-singapore-courts-walking-gdp-taylor-swift-for-concert-13853059.html	2025-01-15T02:48:05-08:00	https://images.firstpost.com/uploads/2024/08/Untitled-design-2024-08-08T134833.294-2024-08-38f85566f99b9820f536de65d44ba6a3.jpg
Bangladesh police killed, injured 20 unarmed protesters on Aug 5 during student agitation, says rights group	New video clips analysed by the International Truth and Justice Project (ITJP), a human rights group documenting alleged abuses, found evidence that Bangladeshi police deliberately targeted peaceful protesters during two previously undocumented incidents in Dhaka on August 5	https://www.firstpost.com/world/bangladesh-police-killed-injured-20-unarmed-protesters-on-aug-5-during-student-agitation-says-rights-group-13853045.html	2025-01-15T02:33:16-08:00	https://images.firstpost.com/uploads/2025/01/Bangladesh-anti-government-protests-August-5-2025-01-ca4811887811c73103ee3fe4185af6bd-1200x675.jpg
Battling political crisis, Germany’s economy shrinks in 2024 for second straight year	Gross domestic product in the eurozone's largest economy declined 0.2 percent last year, according to preliminary figures from federal statistics agency Destatis, coming after a 0.3 percent contraction in 2023.	https://www.firstpost.com/world/battling-political-crisis-germanys-economy-shrinks-in-2024-for-second-straight-year-13853062.html	2025-01-15T02:24:40-08:00	https://images.firstpost.com/uploads/2025/01/Germany-economy-2025-01-9a854a40ffa99b299c1099c253e299ef-1200x675.jpg
Hamas has replaced all terrorists killed by Israel in Gaza with new recruits, says Blinken	Highlighting the reality that the defeat of Hamas cannot be achieved simply by winning on the battlefield and instead requires a political solution, US Secretary of State Antony Blinken has said that Hamas has replaced nearly all terrorists killed by Israel in the Gaza Strip with new recruits	https://www.firstpost.com/world/hamas-has-replaced-all-terrorists-killed-by-israel-in-gaza-with-new-recruits-says-blinken-13853060.html	2025-01-15T02:21:28-08:00	https://images.firstpost.com/uploads/2024/04/Untitled-5-2024-04-ff271ba5149d842d903e7a1009c44c85.jpg
Japan records 37 mn tourists in 2024 thanks to post-Covid global surge and weaker yen	Foreign travellers increased by 47% to a record 36.9 million last year, driven by tourists from South Korea, Taiwan, and China, according to data issued by the Japan National Tourism Organisation on Wednesday	https://www.firstpost.com/world/japan-records-37-mn-tourists-in-2024-thanks-to-post-covid-global-surge-and-weaker-yen-13853054.html	2025-01-15T02:08:11-08:00	https://images.firstpost.com/uploads/2025/01/Japan-Tourist-2025-01-12f1425127e526c375ac8081ccb0fcc5-1200x675.jpg
Indian-origin nurse stabbed in UK’s Greater Manchester, battles ‘life-changing injuries’ in hospital	The nurse, named at Manchester Magistrates’ Court as Achamma Cherian, was attacked on Saturday night following which 37-year-old Rumon Haque was arrested	https://www.firstpost.com/world/indian-origin-nurse-stabbed-in-uks-greater-manchester-battles-life-changing-injuries-in-hospital-13853051.html	2025-01-15T01:57:30-08:00	https://images.firstpost.com/uploads/2025/01/Indian-Nurse-2025-01-05e5adc95e1e19fbf1522c346923161b.jpg
Unexpected respite for Starmer as UK inflation slows against predictions by economists	The annual rate of inflation edged down to 2.5% in December from 2.6% in November, the Office for National Statistics said	https://www.firstpost.com/world/unexpected-respite-for-starmer-as-uk-inflation-slows-against-predictions-by-economists-13853028.html	2025-01-15T01:47:55-08:00	https://images.firstpost.com/uploads/2025/01/UK-market-2025-01-1217a3fdae05e97243be3f8b589e24f7-1200x675.jpg
TikTok fights for survival in US but it gave China its third richest woman	Zhou Chaonan, 64, is the owner of data centre operator Range Intelligent Computing Technology Group Co. The establishment is responsible for providing research and data enabling TikTok's parent company ByteDance's AI ambitions. In fact, ByteDance is the company's main client	https://www.firstpost.com/world/tiktok-fights-for-survival-in-us-but-it-gave-china-its-third-richest-woman-13853021.html	2025-01-15T01:36:42-08:00	https://images.firstpost.com/uploads/2025/01/TikTok-2025-01-f8aee86921b94b3d01d3703185921cdf-1200x675.jpg
Xiaohongshu: Another Chinese app rises in US as the sun sets on TikTok	With ByteDance-owned TikTok facing imminent ban in the US this week, users in America are switching to another Chinese social media app Xiaohongshu or RedNote which has seen a surge in downloads over the last few days	https://www.firstpost.com/world/xiaohongshu-another-chinese-app-rises-in-us-as-the-sun-sets-on-tiktok-13852989.html	2025-01-15T01:28:31-08:00	https://images.firstpost.com/uploads/2025/01/Xiaohongshu-2025-01-9baf74a4eef0c6176d6babe2691c51a6-1200x675.jpg
3 Chinese nationals receive 7-year prison sentences and fines for illegal mineral activities in Congo	The defendants were also found guilty of fraud, money laundering and looting. It is unclear if they will remain in the eastern city of Bukavu, where they are held, or if they will be transferred elsewhere	https://www.firstpost.com/world/3-chinese-nationals-receive-7-year-prison-sentences-and-fines-for-illegal-mineral-activities-in-congo-13853013.html	2025-01-15T01:02:00-08:00	https://images.firstpost.com/uploads/2024/06/Lok-Sabha-election-results-2024-2024-06-0843c6f6b4a6a2c7d769f07d8275db7c.jpg
Israel-Hamas truce talks: Ceasefire in Gaza is coming, hostages too, but...	While Hamas has accepted the draft deal, Benjamin Netanyahu is facing strong opposition from hardliners in his government as the proposal needs the final approval of the Cabinet	https://www.firstpost.com/world/israel-hamas-truce-talks-ceasefire-in-gaza-is-coming-hostages-too-but-13853003.html	2025-01-15T00:32:01-08:00	https://images.firstpost.com/uploads/2025/01/Gaza-Ceasefire-2025-01-6b534602588ce40d1c61e88f590b2b5c-1200x675.jpg
Iranian President Pezeshkian calls for peace, not war, in region and world	Washington has not maintained formal diplomatic relations with Tehran for nearly 45 years, and Trump threatened during his recent presidential campaign that US ally Israel could strike Iranian nuclear facilities	https://www.firstpost.com/world/iranian-president-pezeshkian-calls-for-peace-not-war-in-region-and-world-13852996.html	2025-01-15T00:17:30-08:00	https://images.firstpost.com/uploads/2024/12/Iran-President-2024-12-97d7a221290ac4469775d1db7446c2fd-1200x675.jpg
Dissanayake in Beijing: Why Sri Lanka must look harder at what it’s signing on with China	As Sri Lankan President Dissanayake meets Xi Jinping in Beijing, a look at China's economic grip on Sri Lanka’s economic sovereignty, and the goodwill that India has shown towards its southern neighbour during financial hardship and political turmoil	https://www.firstpost.com/world/dissanayake-in-beijing-why-sri-lanka-must-look-harder-at-what-its-signing-on-with-china-13852940.html	2025-01-14T23:49:18-08:00	https://images.firstpost.com/uploads/2024/12/Sri-Lankan-President-Anura-Kumara-Dissanayake-2024-12-a42d9198aeaee8c6d3337d6c99d4b663-1200x675.jpg
LA inferno: Fire tornadoes may hit California amid raging wildfires, warns US weather agency	The National Weather Service warned Tuesday that the combination of high winds and severely dry conditions have created a 'particularly dangerous situation' in which any new fire could explode in size.	https://www.firstpost.com/world/la-inferno-fire-tornadoes-may-hit-california-amid-raging-wildfires-warns-us-weather-agency-13852987.html	2025-01-14T23:44:28-08:00	https://images.firstpost.com/uploads/2025/01/Los-Angeles-California-Wildfires-2025-01-64d0ed30dde94cc1a6539991f91975a7-1200x675.jpg
Opposition leader threatens to ‘paralyse’ Mozambique as President-elect Chapo takes office	Chapo, 48, called for stability on Monday, telling journalists at the national assembly 'we can continue to work and together, united... to develop our country'	https://www.firstpost.com/world/opposition-leader-threatens-to-paralyse-mozambique-as-president-elect-chapo-takes-office-13852976.html	2025-01-14T23:42:04-08:00	https://images.firstpost.com/uploads/2025/01/Daniel-Chapo-2025-01-b5f23b95a78fdab5c8bd09637b94f665-1200x675.jpg
Musk-backed Germany’s AfD distributes fake plane tickets to migrants for deportation	In a chilling throwback to fake tickets Nazis sent out fake to Jews offering to send them to Jerusalem, Germany's far-right party AfD has distributed fake plane tickets to migrants telling them to leave for their native countries	https://www.firstpost.com/world/musk-backed-germany-afd-distributes-fake-plane-tickets-to-migrants-for-deportation-13852992.html	2025-01-14T23:39:25-08:00	https://images.firstpost.com/uploads/2025/01/WhatsApp-Image-2025-01-15-at-13.06.47-2025-01-b398c20a2fa28024ee604bde7853e61b.jpeg
South Africa gold mine tragedy: 36 bodies recovered, 86 survivors arrested for illegal mining	The police said that the operation will continue for several days, as it involves the use of a metal cage to recover men and bodies from a mine shaft more than 2 km underground.	https://www.firstpost.com/world/south-africa-gold-mine-tragedy-36-bodies-recovered-86-survivors-arrested-for-illegal-mining-13852979.html	2025-01-14T23:22:52-08:00	https://images.firstpost.com/uploads/2025/01/South-Africa-miners-2025-01-700db5c08e45544b8f9fdaf82843570a-1200x675.jpg
Australia summons Russian envoy over 'killing' of captured Melbourne man fighting for Ukraine	Amid reports of a Melbourne man killed after being captured by Russia while fighting for Ukraine, the Australian government on Wednesday summoned Russian ambassador and said if he will be harmed, it will take the 'strongest action possible'	https://www.firstpost.com/world/australia-summons-russian-envoy-over-killing-of-captured-melbourne-man-fighting-for-ukraine-13852973.html	2025-01-14T23:05:47-08:00	https://images.firstpost.com/uploads/2025/01/Australian-Oscar-Jenkins-fighting-for-Ukraine-captured-by-Russia-2025-01-d304d5b41f2bcc60437ab2960fe35181-1200x675.jpg
She failed leadership test': Pressure mounts on LA mayor over fires response as toll rises to 25	Los Angeles Mayor Karen Bass has been facing criticism over her response to the wildfires in southern California as she travelled to Ghana when the deadly Palisades and Eaton fires broke out on Tuesday	https://www.firstpost.com/world/she-failed-leadership-test-pressure-mounts-on-la-mayor-over-fires-response-as-toll-rises-to-25-13852953.html	2025-01-14T22:33:29-08:00	https://images.firstpost.com/uploads/2025/01/Los-Angeles-Mayor-Karen-Bass-and-California-Governor-Gavin-Newsom-2025-01-9bead4e741e7c0ed6b203011b2f6d72d-1200x675.jpg
‘Kryivy Rig…take cover’: Ukraine sounds air alert for Russian cruise missiles day after its ‘largest’ strike	The warnings come a day after Ukraine said it carried out its largest aerial attack on Russian territory of the nearly three-year war, hitting factories and energy hubs hundreds of kilometres from the frontline	https://www.firstpost.com/world/kryivy-rigtake-cover-ukraine-sounds-air-alert-for-russian-cruise-missiles-day-after-its-largest-strike-13852958.html	2025-01-14T22:21:14-08:00	https://images.firstpost.com/uploads/2024/12/Russia-missile-attack-on-Ukraine-on-Christmas-2024-12-311a7aea14367597a46a4858ecf96451-1200x675.jpg
France: PM Bayrou outlines his vision days before he may face a no-confidence vote	Ahead of an expected trust vote, French Prime Minister Francois Bayrou has opened negotiations regarding a pension reforms to reach an understanding with left-wing lawmakers	https://www.firstpost.com/world/france-pm-bayrou-outlines-his-vision-days-before-he-may-face-a-no-confidence-vote-13852961.html	2025-01-14T22:17:15-08:00	https://images.firstpost.com/uploads/2025/01/FrenchPMBayrou1200-2025-01-d4eb58e5735fbcfe2bb32ab868b400c6.jpg
As Gaza nears truce, Israel sees street protests for and against ceasefire deal with Hamas	At a time when a deal between Israel and Hamas for a ceasefire in the Gaza Strip and release of hostages appears imminent, thousands of Israelis have taken to streets. While families of hostages are holding rallies calling for their return, far-right extremists are holding protests against the deal.	https://www.firstpost.com/world/as-gaza-nears-truce-israel-sees-street-protests-for-and-against-ceasefire-deal-with-hamas-13852927.html	2025-01-14T21:53:26-08:00	https://images.firstpost.com/uploads/2025/01/Firstpost-2025-01-15T111404.170-2025-01-de9de05c0c67f99764e878e58c28782a.jpg
Once US drops Cuba from terror list, Havana to free over 550 prisoners	The White House said President Joe Biden was removing Cuba from the list of state sponsors of terrorism in one of his last official acts before Donald Trump is sworn in next Monday	https://www.firstpost.com/world/once-us-drops-cuba-from-terror-list-havana-to-free-over-550-prisoners-13852939.html	2025-01-14T21:39:43-08:00	https://images.firstpost.com/uploads/2025/01/US-Cuba-2025-01-99562c09281244be1f8403f5960a227d-1200x675.jpg
Singapore President Tharman in India on 5-day visit, to hold talks with Modi	Shanmugaratnam, accompanied by a high-level delegation, was received at the airport by Union Minister Jitin Prasada	https://www.firstpost.com/world/singapore-president-tharman-in-india-on-5-day-visit-to-hold-talks-with-modi-13852925.html	2025-01-14T21:22:37-08:00	https://images.firstpost.com/uploads/2024/09/Frankfurt-airport-halts-flights-as-climate-activists-block-runway-2024-09-05T194808.348-2024-09-2509f69c70c926bac1a011a267049fc4.jpg
Bangladesh: Khaleda Zia’s BNP mounts pressure on Yunus, sets August deadline for national polls	Bangladesh’s interim government-led by Muhammad Yunus faces mounting pressure from former Prime Minister Khaleda Zia's BNP to conduct the parliamentary election by August 2025. The BNP says 'the longer the election is delayed, the deeper the political and economic crisis will become'.	https://www.firstpost.com/world/bangladesh-khaleda-zias-bnp-mounts-pressure-on-yunus-sets-august-deadline-for-national-polls-13852914.html	2025-01-14T21:21:22-08:00	https://images.firstpost.com/uploads/2025/01/Bangladesh-Muhammad-Yunus-2025-01-20e8e252fd0913d6fa973b0a14f2e134-1200x675.jpg
Trump announces new department to collect foreign revenue to ‘charge those making money off us’	Trump, who has vowed to shrink the size of government, would be creating a new agency to do functions already handled by existing agencies, including the Commerce Department and the Customs and Border Patrol, which collect duties and revenues from other nations.	https://www.firstpost.com/world/trump-to-set-up-external-revenue-service-to-collect-revenue-from-foreign-sources-13852863.html	2025-01-14T20:49:04-08:00	https://images.firstpost.com/uploads/2025/01/2025-01-08T221450Z_1225422734_RC2X5CA570MG_RTRMADP_3_USA-TRUMP-AFGHANISTAN-1-2025-01-320461b61456b3bd1c4f73dc9eba977a.jpg
US Secretary of State Blinken touts post-war governance proposal for Gaza	Blinken said the plan, which he has referenced in the past, envisions the Palestinian Authority inviting 'international partners' to stand up an interim governing authority to run critical services and oversee the territory	https://www.firstpost.com/world/us-secretary-of-state-blinken-touts-post-war-governance-proposal-for-gaza-13852909.html	2025-01-14T19:58:33-08:00	https://images.firstpost.com/uploads/2024/12/Antony-Blinken-2024-12-1981880b44e06c1879cb08073f185946-1200x675.jpg
Trump's Secretary of State nominee to reject ‘liberal world order’	Marco Rubio will face fellow senators at his confirmation hearing in what is likely to be among the least contentious sessions for Trump's motley array of nominees	https://www.firstpost.com/world/trumps-secretary-of-state-nominee-to-reject-liberal-world-order-13852906.html	2025-01-14T19:45:34-08:00	https://images.firstpost.com/uploads/2024/11/Trump-Rubio-1-Reuters-2024-11-191861b281bd0f050e9af2c4c57b79bd.jpg
US market watchdog sues Musk for hiding stakes in Twitter, buying it at 'artificial lower price'	The US's Securities and Exchange Commission (SEC) filed a lawsuit against Elon Musk, alleging the billionaire committed securities fraud in 2022 by failing to disclose he had amassed an active stake in Twitter, a secrecy that allowed him to buy shares at 'artificially low prices'	https://www.firstpost.com/world/us-market-watchdog-sues-musk-for-hiding-stakes-in-twitter-buying-it-at-artificial-lower-price-13852879.html	2025-01-14T19:31:22-08:00	https://images.firstpost.com/uploads/2025/01/Elon-Musk-2025-01-5e2aed68ae1b3561060b7fa7fa60eebc-1200x675.jpg
Venezuela restricts diplomats from France, Italy, and the Netherlands amid diplomatic tensions	Due to the new travel restrictions, any trip outside the capital will now require a government permit. The international airport, Simon Bolivar, which serves Caracas, is 23 kilometers from the Plaza Bolivar	https://www.firstpost.com/world/venezuela-restricts-diplomats-from-france-italy-and-the-netherlands-amid-diplomatic-tensions-13852886.html	2025-01-14T19:16:21-08:00	https://images.firstpost.com/uploads/2025/01/Representational-Image-30-2025-01-8a29cb507d79f7135beeb042c10d272f.jpg
South Korea: Yoon Suk Yeol arrested over botched martial law	Yoon left his heavily-fortified residence in central Seoul in a convoy to the offices of the Corruption Investigation Office (CIO) after a joint team of investigators and police said they had executed the arrest warrant	https://www.firstpost.com/world/south-korea-yoon-suk-yeols-arrest-warrant-executed-as-he-faces-charges-over-failed-martial-law-bid-13852878.html	2025-01-14T18:21:35-08:00	https://images.firstpost.com/uploads/2025/01/South-Korea-Yoon-2025-01-b401d0329b4662e821c437724509ca68-1200x675.jpg
South Korea: Investigators enter Yoon's residence, supporters gather to block his arrest	Yoon has resisted arrest since his short-lived December 3 power grab plunged the country into its worst political crisis in decades, after he directed soldiers to storm parliament in a bid to stop lawmakers from voting down his move	https://www.firstpost.com/world/south-korea-investigators-enter-yoons-residence-supporters-gather-to-block-his-arrest-13852876.html	2025-01-14T17:43:28-08:00	https://images.firstpost.com/uploads/2025/01/South-Korea-2025-01-287828a8d33e7d817cb66798643b909d-1200x675.jpg
Mediators still await response': Blinken 'dismisses' reports Hamas has accepted Gaza draft proposal	Hours after media reports suggested that Hamas has agreed to a draft ceasefire agreement for the Gaza Strip and the release of hostages, US Secretary of State Antony Blinken on Tuesday appeared to deny such claims saying that the terror group has yet to give a final answer to the deal on the table, according to a report	https://www.firstpost.com/world/mediators-still-await-response-blinken-dismisses-reports-hamas-has-accepted-gaza-draft-proposal-13852855.html	2025-01-14T09:42:29-08:00	https://images.firstpost.com/uploads/2025/01/Hostages1200-1-2025-01-b5b07e8aa6791a913e321f799eee0e4e.jpg
Venezuela restricts French, Italian and Dutch diplomats over 'hostile' stance on Maduro's inauguration	Nicolas Maduro's inauguration for a third term as Venezuela's president drew widespread admonishment from countries that have accused him of stealing the July election.	https://www.firstpost.com/world/venezuela-restricts-diplomats-from-france-italy-netherlands-over-maduros-inauguration-13852859.html	2025-01-14T09:41:01-08:00	https://images.firstpost.com/uploads/2025/01/Representational-Image-30-2025-01-8a29cb507d79f7135beeb042c10d272f.jpg
EAM Jaishankar meets President Sanchez, reaffirms 'long-standing' India-Spain partnership	Jaishankar also held 'productive' talks with Spanish Defence Minister Margarita Robles on enhancing bilateral defence cooperation.	https://www.firstpost.com/world/eam-jaishankar-meets-president-sanchez-reaffirms-long-standing-india-spain-partnership-13852856.html	2025-01-14T09:06:25-08:00	https://images.firstpost.com/uploads/2025/01/Representational-Image-38-2025-01-220deb0f50067b03b625bd057566366d.jpg
