Title	Description	Link	pubDate	Image
Philippines suspends scientific survey in South China Sea amid China's ‘harassment’	Manila and Beijing have had a series of escalating confrontations in disputed waters of the South China Sea. China claims almost all the strategic waterway - through which $3 trillion in commerce moves annually - overlapping sovereignty claims by the Philippines, Indonesia, Malaysia and Vietnam	https://www.firstpost.com/world/philippines-suspends-scientific-survey-in-south-china-sea-amid-chinas-harassment-13856226.html	2025-01-24T22:29:50-08:00	https://images.firstpost.com/uploads/2025/01/Philippines-2025-01-07c77ae2b39bbfe54535d1909b33407b-1200x675.jpg
DR Congo descends into chaos as army battles rebels, civilians flee	US, British, and French people were asked to leave Goma while airports and crossings were open, according to internet declarations or messages made directly by email or text	https://www.firstpost.com/world/dr-congo-descends-into-chaos-as-army-battles-rebels-civilians-flee-13856224.html	2025-01-24T22:25:27-08:00	https://images.firstpost.com/uploads/2025/01/Congo-2025-01-bbe475b279b8b16518066c114e193e89-1200x675.jpg
Trump's deportation plan hit as Mexico refuses to allow US military aircraft to land	Mexico's foreign ministry said in a statement late Friday that the nation has a 'very great relationship' with the United States and works together on matters like immigration	https://www.firstpost.com/world/trumps-deportation-plan-hit-as-mexico-refuses-to-allow-us-military-aircraft-to-land-13856214.html	2025-01-24T22:17:58-08:00	https://images.firstpost.com/uploads/2025/01/Venezuela-2025-01-7f503a8d14d92db2eb5c9d8267eed8af-1200x675.jpg
Bushfires wreak havoc in West Australia as thousands told it is 'too late' to leave	As per the report, at least two houses had been lost in the fire with authorities warning that more homes can witness a similar fate	https://www.firstpost.com/world/bushfires-wreak-havoc-in-west-australia-as-thousands-told-it-is-too-late-to-leave-13856207.html	2025-01-24T21:47:52-08:00	https://images.firstpost.com/uploads/2024/12/25391c1d-ea30-4286-8535-d3370cafb03b_cx0_cy10_cw0_w1023_r1_s-2024-12-0aae96e0ece2a544300847d229ce094c.jpg
Public health experts unite against Robert F. Kennedy Jr.'s nomination to lead top US health agency	Most of the opposition to Kennedy is driven by his stance on vaccines, but a group founded by former Republican Vice President Mike Pence also objects to Kennedy's comments in support of abortion rights	https://www.firstpost.com/world/public-health-experts-unite-against-robert-f-kennedy-jr-s-nomination-to-lead-top-us-health-agency-13856205.html	2025-01-24T20:31:22-08:00	https://images.firstpost.com/uploads/2024/11/2024-01-13T035937Z_1876668711_RC2OG5AQ1J5I_RTRMADP_3_USA-ELECTION-RFK-1-2024-11-00996076b0aa88c20fdae76ae5dcd1bc.jpg
US Supreme Court clears 2008 Mumbai terror attack convict Tahawwur Rana's extradition to India	After a long drawn-out legal battle, the US Supreme Court approved the extradition of Tahawwur Rana to India. Rana was convicted for his involvement in the devastating 2008 Mumbai terror attack	https://www.firstpost.com/world/us-supreme-court-clears-2008-mumbai-terror-attack-convict-tahawwur-ranas-extradition-to-india-13856202.html	2025-01-24T20:20:46-08:00	https://images.firstpost.com/uploads/2024/08/Frankfurt-airport-halts-flights-as-climate-activists-block-runway-44-2024-08-f4a3db3d368e2ba826f41f53261f28fb.jpg
Gaza ceasefire brings surge in aid deliveries, but challenges remain	The U.N. Office for the Coordination of Humanitarian Affairs (OCHA) said 339 aid trucks crossed into Gaza on Friday, citing information from Israeli authorities and the guarantors for the ceasefire agreement - the United States, Egypt and Qatar	https://www.firstpost.com/world/gaza-ceasefire-brings-surge-in-aid-deliveries-but-challenges-remain-13856197.html	2025-01-24T19:44:41-08:00	https://images.firstpost.com/uploads/2025/01/Firstpost-2025-01-20T190539.816-2025-01-2e0dfb08bc8e8798d2efceda73f06ab1.jpg
Belarusian President Lukashenko grants clemency to 15 prisoners in election eve gesture	According to state media, Lukashenko pardoned eight persons convicted of extremist involvement and seven jailed for narcotics charges. It did not provide any names	https://www.firstpost.com/world/belarusian-president-lukashenko-grants-clemency-to-15-prisoners-in-election-eve-gesture-13856179.html	2025-01-24T18:44:43-08:00	https://images.firstpost.com/uploads/2025/01/Lukashenko-2025-01-8e2830d260a5a513360ce203d069bf30-1200x675.jpg
Colombia deploys army on Venezuela border to fight 'leftist guerillas'	Colombia is struggling to contain violence in the mountainous northeastern Catatumbo region, where a 5,800-strong ELN has targeted rival armed groups and their alleged sympathizers	https://www.firstpost.com/world/colombia-deploys-army-on-venezuela-border-to-fight-leftist-guerillas-13856177.html	2025-01-24T18:08:41-08:00	https://images.firstpost.com/uploads/2025/01/AFP__20250124__36VR2TC__v1__HighRes__ColombiaConflictRebels-1-2025-01-b48795cb642863a26243be4bfb88b79a.jpg
US Supreme Court weighs use of public funds for religious charter school	The conservative-dominated Supreme Court has issued a number of recent rulings blurring the boundaries between church and state, including a decision that a public high school football coach can lead his players in prayer	https://www.firstpost.com/world/us-supreme-court-weighs-use-of-public-funds-for-religious-charter-school-13856175.html	2025-01-24T17:14:59-08:00	https://images.firstpost.com/uploads/2024/04/US-Supreme-Court-2024-04-7b5b788f9369cd7c219f8e9c18486377.jpg
Trump and Vance rally with anti-abortion activists, pledge continued support	Vance praised Trump's earlier abortion policies, claiming that the president 'delivered on his promise of ending Roe' by appointing hundreds of anti-abortion justices	https://www.firstpost.com/world/trump-and-vance-rally-with-anti-abortion-activists-pledge-continued-support-13856173.html	2025-01-24T17:07:59-08:00	https://images.firstpost.com/uploads/2025/01/March-for-Life-2025-01-9cd0668205c59f563bf7231dd46f9074-1200x675.jpg
Hamas to free four Israeli female soldiers in exchange for Palestinian prisoners	The four soldiers, Karina Ariev, Daniela Gilboa, Naama Levy, and Liri Albag, were all stationed at an observation post on the Gaza border when they were kidnapped by Hamas gunmen who overran their position during the onslaught on Israel on October 7, 2023	https://www.firstpost.com/world/hamas-to-free-four-israeli-female-soldiers-in-exchange-for-palestinian-prisoners-13856171.html	2025-01-24T16:38:00-08:00	https://images.firstpost.com/uploads/2025/01/Gaza-Hostage_1-2025-01-825e3ce6d77fb7213d4ed822c7600f5e.jpg
UN chief calls for unconditional release of humanitarian staff seized by Yemen's Houthis	The detentions come after United States President Donald Trump ordered the Houthis placed back on the US list of foreign terrorist organisations	https://www.firstpost.com/world/un-chief-calls-for-unconditional-release-of-humanitarian-staff-seized-by-yemens-houthis-13856169.html	2025-01-24T16:28:00-08:00	https://images.firstpost.com/uploads/2024/12/YEMEN-HOUTHIS1200-2024-12-e92378d21aa59db3fc2a6cf83c77258d.jpg
US foreign aid in jeopardy as Trump orders review of allocation	The decision threatens cutting off billions of dollars in life-saving support. The United States is the world's greatest single giver of help; in fiscal year 2023, it provided $72 billion in assistance	https://www.firstpost.com/world/us-foreign-aid-in-jeopardy-as-trump-orders-review-of-allocation-13856167.html	2025-01-24T16:17:09-08:00	https://images.firstpost.com/uploads/2025/01/State-Department-2025-01-33ca578cebf5f72348a357a012ef3cb1-1200x675.jpg
US President Trump calls for FEMA overhaul, accusing agency of incompetence	Trump, on his first trip since recovering the office on Monday, accused the Federal Emergency Management Agency (FEMA) of failing to coordinate emergency relief operations in North Carolina, which was ravaged by Hurricane Helene floods in September	https://www.firstpost.com/world/us-president-trump-calls-for-fema-overhaul-accusing-agency-of-incompetence-13856165.html	2025-01-24T16:03:27-08:00	https://images.firstpost.com/uploads/2025/01/Trump-2025-01-28e7f45cd3cf255b2f67c8a932ee2d64-1200x675.jpg
Fauci loses federal protection as Trump urges self-funded security for former health official	Fauci, who continues to be a target of ire years after the pandemic ended by Trump ally and billionaire Elon Musk and others, will pay for private security detail. Former President Joe Biden gave Fauci and others a preemptive pardon before leaving office, saying he worried about politically motivated prosecutions.	https://www.firstpost.com/world/fauci-stripped-of-federal-protection-as-trump-calls-for-self-funded-security-13856158.html	2025-01-24T11:32:24-08:00	https://images.firstpost.com/uploads/2025/01/Representational-Image-98-2025-01-e28007b0926735aacff65aa2bf493c29.jpg
Here's why China’s birth figures are set to resume their downward spiral in 2025 after brief hiatus last year	Without significant changes, China’s population decline could accelerate, undermining economic growth and social stability	https://www.firstpost.com/world/heres-why-chinas-birth-figures-are-set-to-resume-their-downward-spiral-in-2025-after-brief-hiatus-last-year-13856152.html	2025-01-24T10:27:35-08:00	https://images.firstpost.com/uploads/2025/01/China-HMPV-2025-01-b34b2926e9ce77d597a4670549bfe49c-1200x675.jpg
Clashes erupt near DR Congo's Goma, US, UK, and France issue evacuation orders	The DR Congo army and M23 on Friday clashed outside Goma as the UK, US and France urged citizens to leave the main city in DR Congo's volatile east, warning the situation could deteriorate rapidly	https://www.firstpost.com/world/clashes-near-dr-congos-goma-prompt-evacuation-warnings-from-us-uk-and-france-13856135.html	2025-01-24T09:24:49-08:00	https://images.firstpost.com/uploads/2025/01/DRCongo1200-2025-01-4774a6f65f2e9b935518a2c0ce7e10d4.jpg
International Criminal Court moves to protect staff, operations as US sanctions threaten its survival	The US House of Representatives voted this month to punish the court for issuing arrest warrants for Israeli Prime Minister Benjamin Netanyahu and his former defence minister over Israel's campaign in Gaza	https://www.firstpost.com/world/international-criminal-court-moves-to-protect-staff-operations-as-us-sanctions-threaten-its-survival-13856140.html	2025-01-24T09:02:20-08:00	https://images.firstpost.com/uploads/2024/11/Firstpost-16-2024-11-aa6ac31ffa9dbb76881e42c239654edf.jpg
Trump expands fast-track deportations, targets Biden-era parole migrants	President Donald Trump issued a series of executive orders after returning to the White House on Monday intended to deter illegal immigration and position the U.S. to deport millions of immigrants without legal status.	https://www.firstpost.com/world/trump-expands-fast-track-deportations-targets-biden-era-parole-migrants-13856136.html	2025-01-24T08:46:19-08:00	https://images.firstpost.com/uploads/2025/01/Donald-Trump-inauguration-signing-executive-order-2025-01-e9e1e3311c0671823936cbca9705971a-1200x675.jpg
Over 100 dolphins found dead on Somalia's Puntland coast, cause a mystery	Local residents and soldiers gathered to look at the grim sight, holding their noses because of the smell from the carcasses.	https://www.firstpost.com/world/over-100-dolphins-found-dead-on-somalias-puntland-coast-cause-a-mystery-13856137.html	2025-01-24T08:41:38-08:00	https://images.firstpost.com/uploads/2025/01/Representational-Image-96-2025-01-d0928d3f7ba69a333acc41a9111e9a39.jpg
After ANI, Indian book publishers sue OpenAI over copyright concerns with ChatGPT: Report	The Federation of Indian Publishers, which includes members such as Bloomsbury, Penguin Random House, Cambridge University Press, Pan Macmillan, Rupa Publications, and S. Chand and Co., said the case was filed in December	https://www.firstpost.com/india/after-ani-indian-book-publishers-sue-openai-over-copyright-concerns-with-chatgpt-report-13856139.html	2025-01-24T08:35:05-08:00	https://images.firstpost.com/uploads/2025/01/Cannot-delete-training-data-as-Indian-courts-have-no-jurisdiction-OpenAI-in-copyright-case-2025-01-43031adada23d60ea8f94fe54bc4b245-1200x675.jpg
South Korea court rejects request to extend Yoon's detention	A South Korean court on Friday rejected a request from the prosecutors' office to extend the detention of impeached President Yoon Suk Yeol over a criminal investigation into his short-lived martial law declaration on December 3, according to a report	https://www.firstpost.com/world/south-korea-court-rejects-request-to-extend-yoons-detention-13856125.html	2025-01-24T07:48:49-08:00	https://images.firstpost.com/uploads/2025/01/FirstUp-1-22-2025-01-efbc0952ab3441c76d8d45d122c3a36b.jpg
Putin says ready for talks with Trump on Ukraine conflict, Kyiv warns against excluding it and Europe	Russian President Vladimir Putin on Friday said that he was ready for talks with Donald Trump on the Ukraine conflict and asserted that 'Ukraine crisis' would not have happened in the first place had Trump been the US president	https://www.firstpost.com/world/putin-says-ready-for-talks-with-trump-on-ukraine-conflict-kyiv-warns-against-excluding-it-and-europe-13856127.html	2025-01-24T07:41:46-08:00	https://images.firstpost.com/uploads/2024/11/Trump-Putin-G20-Reuters-2024-11-c2f6c8b1efcff6de9b3f29efeab71bb9.jpg
Hamas names four Israeli 'women soldiers' to be freed on Saturday	The exchange is part of a ceasefire agreement between Israel and Hamas in the Gaza war, which took effect on Sunday and saw three women hostages and 90 Palestinian prisoners freed.	https://www.firstpost.com/world/hamas-names-four-israeli-women-soldiers-to-be-freed-on-saturday-13856128.html	2025-01-24T07:36:34-08:00	https://images.firstpost.com/uploads/2025/01/Representational-Image-95-2025-01-5b6e7816b11766ed3d564d3763d942ae.jpg
Belarus: Putin's ally Lukashenko frees eight political prisoners in 'act of mercy' before elections	Belarus has more than 1,000 political prisoners, many of them detained during the mass protests that erupted after Lukashenko’s contentious re-election in 2020	https://www.firstpost.com/world/belarus-putins-ally-lukashenko-frees-eight-political-prisoners-in-act-of-mercy-before-elections-13856100.html	2025-01-24T07:05:20-08:00	https://images.firstpost.com/uploads/2024/12/BELARUS-RUSSIA1200-2024-12-9129ddfb2e40b1f2676b9f610ac41bc8.jpg
UN suspends operations in Houthi-controlled Yemen as some staff detained	The United Nations said on Friday that the Houthis who control northern Yemen had detained an unspecified number of UN personnel, and it was suspending movement in all Houthi-held areas while seeking the detainees' immediate release	https://www.firstpost.com/world/un-suspends-operations-in-houthi-controlled-yemen-as-some-staff-detained-13856084.html	2025-01-24T06:48:02-08:00	https://images.firstpost.com/uploads/2025/01/UKRAINE-CRISIS-UN1200-3-2025-01-e2e4fb81d64aac4404633115b490cb7b.jpg
Serbia: Massive general strike called by students goes into effect; theatres, schools & bookstores shuttered	Protesters allege corruption, nepotism, and substandard construction led to the tragedy in Novi Sad, where a concrete awning of the station roof caved in and killed 15 in November 2024	https://www.firstpost.com/world/serbia-massive-general-strike-called-by-students-goes-into-effect-theatres-schools-bookstores-shuttered-13856077.html	2025-01-24T06:27:06-08:00	https://images.firstpost.com/uploads/2025/01/Serbia-Student-protest-2025-01-a237e9e63a26e8a4c9800ad41bcfbd92-1200x675.jpg
‘Free speech can’t be selective’: India expects UK’s strong action over ‘Emergency’ disruption in London	Media reports say masked Khalistanis stormed into London's Harrow Vue Cinema during the screening of 'Emergency' and shouted anti-India slogans	https://www.firstpost.com/world/free-speech-cant-be-selective-india-expects-uks-strong-action-over-emergency-disruption-in-london-13856062.html	2025-01-24T06:10:15-08:00	https://images.firstpost.com/uploads/2025/01/MEAspox1200-2025-01-c1b7934b651c50e2e62004c13bd8422e.jpg
Belarus: Pro-Putin Lukashenko eyes another term in election rivals dub as ‘sham’	With many of his political opponents either jailed or exiled abroad, the 70-year-old Lukashenko is back on the ballot, and when the election concludes on Sunday, he is all but certain to add a seventh term as the only leader most people in post-Soviet Belarus have ever known.	https://www.firstpost.com/world/belarus-pro-putin-lukashenko-eyes-another-term-in-election-rivals-dub-as-sham-13856051.html	2025-01-24T06:09:35-08:00	https://images.firstpost.com/uploads/2025/01/Representational-Image-93-2025-01-e6bd737fa15f6f286d6f6c59d589fd5e.jpg
Can Sheikh Hasina make a comeback in Bangladesh? Report says Awami League leaders hiding but hopeful	Despite the challenges, leaders who are in hiding say that Awami League's party structure remains intact through communication networks that keep leaders connected to workers	https://www.firstpost.com/world/can-sheikh-hasina-make-a-comeback-in-bangladesh-report-says-awami-league-leaders-hiding-but-hopeful-13856046.html	2025-01-24T05:19:36-08:00	https://images.firstpost.com/uploads/2025/01/Sheikh-Hasina-2025-01-5f8dd51344c5fa4af3fbe30d58315c11-1200x675.jpg
Even as Trump bashes Nato, most members spend over 2% on defence — some more than US	Even as US President Donald Trump continues to trash Nato, most members are spending more than 2% of their economy on defence and some of them are spending even more than the United States	https://www.firstpost.com/world/even-as-trump-bashes-nato-most-members-spend-over-2-per-cent-on-defence-some-more-than-us-13856054.html	2025-01-24T05:15:36-08:00	https://images.firstpost.com/uploads/2025/01/Firstpost-2025-01-24T184522.193-2025-01-3be60f761ee6b1bc9d80e2231185c98a.jpg
As Trump heads to Los Angeles, a look at wildfire-hit California’s water availability	In the first hours of his second term, Trump called on federal officials to draft plans to route more water to the crop-rich Central Valley and densely populated cities in the southern part of the state	https://www.firstpost.com/world/as-trump-heads-to-los-angeles-a-look-at-wildfire-hit-californias-water-availability-13856053.html	2025-01-24T05:08:48-08:00	https://images.firstpost.com/uploads/2025/01/canadawildfires-2025-01-b1624f24b2a0ebf34f0413bdfd15755e.jpg
Exodus: Is Pakistan's Hindu community leaving Sindh?'	The Human Rights Commission of Pakistan has released a fact-finding study titled Exodus: Is the Hindu Community Leaving Sindh?, which highlights the government's failure to protect the vulnerable Hindu minority in the province. The study reveals that many Hindu families are migrating not only due to faith-based violence but also economic hardships and climate change	https://www.firstpost.com/world/exodus-is-pakistans-hindu-community-leaving-sindh-13856041.html	2025-01-24T05:08:42-08:00	https://images.firstpost.com/uploads/2025/01/Pakistan1200-2025-01-d0155f6fdd349da9b972baea882e434e.jpg
Trump pardons 23 anti-abortion activists ahead of March for Life rally	A day before an annual anti-abortion rally the March for Life, scheduled to be held in Washington, DC, US President Trump has pardoned 23 anti-abortion activists, including people convicted of blockading a reproductive health clinic and intimidating its staff and patients.	https://www.firstpost.com/world/trump-pardons-23-anti-abortion-activists-ahead-of-march-for-life-rally-13856028.html	2025-01-24T04:50:20-08:00	https://images.firstpost.com/uploads/2025/01/Representational-Image-91-2025-01-1a1335eb7d45165086c116f8ce3d8cb7.jpg
Reeling under Trump 2.0, WHO freezes hiring and restricts travel	Days after President Trump announced he is withdrawing the US from the World Health Organization, the UN health agency on Thursday informed its staff that it is freezing recruitment and slashing travel in response to the US move, which is its biggest funder, according to a report	https://www.firstpost.com/world/reeling-under-trump-2-0-who-freezes-hiring-and-restricts-travel-13855979.html	2025-01-24T04:04:58-08:00	https://images.firstpost.com/uploads/2024/11/WHO-chief-labyrinthitis-2024-11-3c1fa7b44f049d437e7c648e57864401.jpg
India’s Border Security Force launches ‘Ops Alert’ along Bangladesh border	Ops Alert' has been launched across all field formations along the 4,096-km India-Bangladesh border to ensure heightened security and strengthen border outposts, said the BSF, adding that during this exercise, patrolling and other domination duties along the Indo-Bangladesh border will be intensified.	https://www.firstpost.com/world/indias-border-security-force-launches-ops-alert-along-bangladesh-border-13856007.html	2025-01-24T04:03:20-08:00	https://images.firstpost.com/uploads/2025/01/Representational-Image-90-2025-01-8b89ad878c88753a7e5c83e66246a37c.jpg
Killed for blocking spoiled rice smuggling in 2007, Rwanda 'martyr' inspiring central Africa now	In 2007, Floribert Bwana Chui Bin Kositi was kidnapped and killed over his decision to not allow spoiled rice from Rwanda to come into Congo. Now, he is on the path to achieve sainthood	https://www.firstpost.com/world/killed-for-blocking-spoiled-rice-smuggling-in-2007-rwanda-martyr-inspiring-central-africa-now-13856016.html	2025-01-24T04:00:09-08:00	https://images.firstpost.com/uploads/2025/01/Floriberl-Kositi-2025-01-0830885bc2e8b642b5ea7f012d6c6912.jpg
‘Will take back verified citizens’: India says ‘against illegal immigration’, flags organised crime threats	MEA spokesperson Randhir Jaiswal said that Indians who are 'overstaying' or living without proper documentation not just in the US but in other countries too will be brought back provided they can prove their nationality and that they are 'indeed Indians'	https://www.firstpost.com/world/will-take-back-verified-citizens-india-says-against-illegal-immigration-flags-organised-crime-threats-13856005.html	2025-01-24T03:57:56-08:00	https://images.firstpost.com/uploads/2024/12/Untitled-design-93-2024-12-ac2440eb9d899791a2c14edb8be8f1a7.jpg
‘Putin ready, waiting for signals’: Russia counters Trump, says Ukraine war ‘doesn’t depend on oil prices’	After US President Donald Trump said Russia should enter negotiations to end the war in Ukraine, Kremlin said that Vladimir Putin is ready to meet Trump and Moscow is wating for signals from Washington DC	https://www.firstpost.com/world/putin-ready-waiting-for-signals-russia-counters-trump-says-ukraine-war-does-not-depend-on-oil-prices-13855971.html	2025-01-24T03:43:10-08:00	https://images.firstpost.com/uploads/2024/11/ukraine2-2024-11-f006b137da73a699075affaabe0691f9.jpg
Winds at 183 kmph lash Ireland as Atlantic storm Eowyn brings strongest-ever gusts to island	Tens of thousands of homes lost power on Friday, as gusts of 183 kilometres (114 miles) per hour were recorded early in the morning near the Galway coast in the west, the island's Met Eireann said on X	https://www.firstpost.com/world/winds-at-183-kmph-lash-ireland-as-atlantic-storm-eowyn-brings-strongest-ever-gusts-to-island-13855997.html	2025-01-24T03:05:27-08:00	https://images.firstpost.com/uploads/2025/01/Untitled-design-2025-01-24T163421.664-2025-01-a481de10009d954d27c674c5d220496d.jpg
Pollution forces closure of over 350 schools in Bangkok, employees asked to work from home	The popular tourist destination recorded an Air Quality Index of 168 which is considered 'unhealthy' while the level of PM2.5 pollutants – cancer-causing microparticles small enough to enter the bloodstream through the lungs – hit 108 micrograms a cubic metre	https://www.firstpost.com/world/pollution-forces-closure-of-over-350-schools-in-bangkok-employees-asked-to-work-from-home-13855959.html	2025-01-24T02:17:57-08:00	https://images.firstpost.com/uploads/2025/01/Untitled-design-2025-01-24T154728.010-2025-01-d786fe9b6c593d3c35cf2979b4718d0b.jpg
Even as Trump wages tariff wars, 75% Americans don't know what it means	Even as US President Donald Trump has assured his supporters that tariffs are a solution to everything, most of the Americans are completely clueless about what tariffs are and how they function	https://www.firstpost.com/world/even-as-trump-wages-tariff-wars-75-per-cent-americans-do-not-know-what-it-means-13855956.html	2025-01-24T02:01:50-08:00	https://images.firstpost.com/uploads/2025/01/Firstpost-2025-01-21T090814.186-2025-01-94283af5e1e80147c99cfed56a9c98e9.jpg
Elon Musk fans flame with a Nazi joke soon after Netanyahu defends his hand gesture	Musk sparked a major political debate after he performed what appeared to be a Nazi salute at US President Donald Trump's inauguration parade	https://www.firstpost.com/world/elon-musk-fans-flame-with-a-nazi-joke-soon-after-netanyahu-defends-his-hand-gesture-13855923.html	2025-01-24T01:39:29-08:00	https://images.firstpost.com/uploads/2023/09/AI-X-Anti-Semitism-Heres-what-Israel-PM-Netanyahu-and-Elon-Musk-spoke-about-at-their-meeting-.jpg
China calls for ‘dialogue’ to solve differences with US as Trump flexes tariff muscle. But there's a catch	While US President Donald Trump pushes for high tariffs on Chinese goods, Beijing tries to open its diplomatic channels to prevent it from happening	https://www.firstpost.com/world/china-calls-for-dialogue-to-solve-differences-with-us-as-trump-flexes-tariff-muscle-but-theres-a-catch-13855875.html	2025-01-24T00:37:41-08:00	https://images.firstpost.com/uploads/2024/11/Firstpost-6-2024-11-d292205644c5baa0172b787203728ab7.jpg
