Title	Description	Link	pubDate	Image
US exits Paris pact, again: In Trump’s playbook, climate change is earth’s problem not his or America’s	With President Trump withdrawing the United States from the Paris climate agreement once again, the world faces renewed uncertainty in its fight against the escalating climate crisis, raising critical questions about global unity and environmental accountability	https://www.firstpost.com/world/us-exits-paris-pact-again-in-trumps-playbook-climate-change-is-earths-problem-not-his-or-americas-13854774.html	2025-01-21T03:44:54-08:00	https://images.firstpost.com/uploads/2025/01/ind-lea-2025-01-2b1901e1683dc86374140c9c485dd353.jpg
Hamas to free 4 women hostages on Saturday after Israel says displaced Gazans may go home next week	The Israel Defense Forces (IDF) has announced that Palestinians who had fled to southern Gaza at the peak of the war will now be able to return to the northern part of the region, provided Hamas upholds the truce deal	https://www.firstpost.com/world/hamas-to-free-4-women-hostages-on-saturday-after-israel-says-displaced-gazans-may-go-home-next-week-13855010.html	2025-01-21T03:03:38-08:00	https://images.firstpost.com/uploads/2025/01/GAZA-CEASEFIRE-HOSTAGES1200-2025-01-f34eadf281e3406a5d0ef0ab92422297.jpg
As Trump rethinks China tariff plan, a look at US-China phase-1 trade deal that he signed in 2020	Even though US President Donald Trump promised to impose tariffs on China after assuming office, he has now put the plans on holds. It appears that he is exploring the possibility of a trade deal with China.	https://www.firstpost.com/world/as-trump-rethinks-china-tariff-plan-a-look-at-us-china-phase-1-trade-deal-that-he-signed-in-2020-13855012.html	2025-01-21T02:57:02-08:00	https://images.firstpost.com/uploads/2024/11/Firstpost-6-2024-11-d292205644c5baa0172b787203728ab7.jpg
Trump’s inauguration happened in frigid cold and with great pomp. Have you seen these pics?	The swearing-in ceremony for Donald Trump as the 47th President of the United States took place indoors at the Capitol Rotunda due to freezing weather. Chief Justice John Roberts administered the oath to President Trump.	https://www.firstpost.com/world/trumps-inauguration-happened-in-frigid-cold-and-with-great-pomp-have-you-seen-these-pics-13854995.html	2025-01-21T02:56:17-08:00	https://images.firstpost.com/uploads/2025/01/viral3-2025-01-ab5b0c19282ace9dd8a7c713b3857a59.jpg
‘No military service if…’: Ukraine urges over a million who fled to Germany to return home	By late 2024, around 240,000 Ukrainian refugees in Germany were employed in socially insured jobs, marking a significant increase compared to the previous year, according to data from Germany’s Federal Employment Agency	https://www.firstpost.com/world/no-military-service-if-ukraine-urges-over-a-million-who-fled-to-germany-to-return-home-13854970.html	2025-01-21T02:24:55-08:00	https://images.firstpost.com/uploads/2025/01/Representational-Image-44-2025-01-4bcf0f5898c7c88a27c370449e4facc3.jpg
Is Trump taking leaves out of Modi's book of politics?	In his second term, whether it's the invitation to foreign leaders for Inauguration or the nationalist pitch, US President Donald Trump appears to be taking leaves from Indian Prime Minister Narendra Modi's playbook	https://www.firstpost.com/world/is-trump-taking-leaves-out-of-modis-book-of-politics-13854978.html	2025-01-21T02:01:18-08:00	https://images.firstpost.com/uploads/2025/01/Firstpost-2025-01-21T152714.143-2025-01-eb9227db8809cc22582ccf9240d9691a.jpg
‘India a world leader’: Ukraine seeks New Delhi’s support as it hopes Trump will end war with Russia	Expecting an expedited process to negotiations aimed at ending the Russia-Ukraine war, Kyiv looks up to India with hope. Ukrainian President Zelenskyy’s close aide says his country considers India among the countries that can help in the ongoing conflict	https://www.firstpost.com/world/india-a-world-leader-ukraine-seeks-new-delhis-support-as-it-hopes-trump-will-end-war-with-russia-13854936.html	2025-01-21T01:10:19-08:00	https://images.firstpost.com/uploads/2025/01/Donald-Trump-inauguration-signing-executive-order-2025-01-e9e1e3311c0671823936cbca9705971a-1200x675.jpg
‘Not aligned with MAGA vision’: Trump to fire over 1,000 Biden appointees	The newly inducted president has workplace reforms planned as he takes office. Trump has ordered federal officials to return to the office five days a week and weakened job protections for civil servants on Monday, the first salvoes in his campaign to gut the federal bureaucracy	https://www.firstpost.com/world/not-aligned-with-maga-vision-trump-to-fire-over-1000-biden-appointees-13854942.html	2025-01-21T01:01:35-08:00	https://images.firstpost.com/uploads/2025/01/Trump1200-7-2025-01-6f67a2c7f32f64d2f940225c26aa9d65.jpg
750,000 Indians among 11 million undocumented immigrants in US as Trump vows mass deportation	Declaring illegal immigration a national emergency, Trump ordered the Pentagon to provide support for border wall construction, detention space, and migrant transportation and empowered the secretary of Defense to send troops to the border as needed	https://www.firstpost.com/world/750000-indians-among-11-million-undocumented-immigrants-in-us-as-trump-vows-mass-deportation-13854926.html	2025-01-21T00:34:35-08:00	https://images.firstpost.com/uploads/2025/01/Untitled-design-2025-01-21T140400.578-2025-01-236bcc68943a9800c3465517a8dca416.jpg
Trump pardons White Supremacists moments after vowing to realise Martin Luther King Jr’s ‘dream'	Hours after vowing to realise the dreams of Black American civil rights leader Martin Luther King Jr, President Donald Trump pardoned leaders of White supremacist groups Proud Boys and Oath Keepers, including Enrique Tarrio, who was convicted for vandalising a Black church	https://www.firstpost.com/world/trump-pardons-white-supremacists-moments-after-vowing-to-realise-martin-luther-king-jr-dream-13854929.html	2025-01-21T00:20:22-08:00	https://images.firstpost.com/uploads/2025/01/Firstpost-2025-01-21T090814.186-2025-01-94283af5e1e80147c99cfed56a9c98e9.jpg
Indonesia: 16 dead, 9 missing as flash floods trigger landslides on Java island	Indonesian rescuers recovered 16 bodies and are searching for nine missing people after flash floods and landslides struck hilly villages on Java island.	https://www.firstpost.com/world/indonesia-16-dead-9-missing-as-flash-floods-trigger-landslides-on-java-island-13854921.html	2025-01-20T23:47:13-08:00	https://images.firstpost.com/uploads/2024/11/DR-Congo-Africa-landslide-floods-2024-11-d070fc642ef43e35635480124ccdd378.jpg
Turkey: 10 killed, 32 injured in fire at ski resort,	A fire broke out at a hotel in the popular Kartalkaya ski resort in northwestern Turkey early Tuesday, killing 10 people and injuring 32 others.	https://www.firstpost.com/world/turkey-10-killed-32-injured-in-fire-at-ski-resort-13854899.html	2025-01-20T23:42:17-08:00	https://images.firstpost.com/uploads/2025/01/AFP__20250108__36TB3ZH__v1__HighRes__UsWeatherFire-1-2025-01-cd789d65b7815291d2a7d0dc91637d90.jpg
Watch | Donald Trump returns to the White House in a triumphant mood	Donald Trump made a stunning comeback to the White House as the 47th President of the United States after overcoming impeachments, criminal charges, and assassination attempts during the 2024 election campaign.	https://www.firstpost.com/world/watch-donald-trump-returns-to-the-white-house-in-a-triumphant-mood-13854880.html	2025-01-20T23:01:24-08:00	https://images.firstpost.com/uploads/2025/01/Donald-Trump-2025-01-d07e7089e09d85402ddc4e279bf45925-1200x675.jpg
Xi telephone effect? Trump delays tariff against China, calls for global trade reform	Taking charge as the President of the United States (Potus), Donald Trump delayed imposing China-specific tariffs, focusing instead on global trade practices and compliance with previous agreements	https://www.firstpost.com/world/xi-jinping-telephone-effect-trump-delays-tariff-against-china-calls-for-global-trade-reform-13854891.html	2025-01-20T22:42:36-08:00	https://images.firstpost.com/uploads/2025/01/Donald-Trump-and-Xi-Jinping-2025-01-31fca675c5c75c089caed5d4654ecc41-1200x675.jpg
Hours after Trump inauguration, Afghan Taliban govt announces prisoner swap deal with US	Moments after Donald Trump's inauguration as the 47th President of the United States, the Afghanistan foreign ministry on Tuesday confirmed that an Afghan fighter Khan Mohammad imprisoned in US has been released in exchange for American citizens	https://www.firstpost.com/world/hours-after-trump-inauguration-afghan-taliban-govt-announces-prisoner-swap-deal-with-us-13854817.html	2025-01-20T22:31:21-08:00	https://images.firstpost.com/uploads/2025/01/Donald-Trump-2025-01-d07e7089e09d85402ddc4e279bf45925-1200x675.jpg
We need it for international security': From Panama to Greenland, Trump does a Putin on Day 1	Echoing the rationale of Russian leader Vladimir Putin, US President Donald Trump has floated security concerns to annex Greenland and Panama Canal	https://www.firstpost.com/world/we-need-it-for-international-security-from-panama-to-greenland-trump-does-a-putin-on-day-1-13854869.html	2025-01-20T21:50:28-08:00	https://images.firstpost.com/uploads/2025/01/Firstpost-2025-01-21T090814.186-2025-01-94283af5e1e80147c99cfed56a9c98e9.jpg
Trump redefines gender, makes biological sex a person’s identity: 8 key takeaways from his executive order	Trump's executive order clearly defines biological sex as unchangeable and impacts various government policies, possibly changing how sex and gender are handled in law and healthcare across the US	https://www.firstpost.com/world/trump-redefines-gender-makes-biological-sex-a-persons-identity-8-key-takeaways-from-his-executive-order-13854776.html	2025-01-20T21:29:16-08:00	https://images.firstpost.com/uploads/2025/01/MaleFemale-2025-01-e1419a99985dfa9b5cee6bcb96fe0f28.jpg
Trump signs executive order to defer TikTok ban by 75 days	US President Donald Trump signed an executive order to delay the TikTok ban for 75 days, giving the platform more time to meet the requirements. Trump earlier proposed that TikTok could be a joint venture, with an US entity holding 50 per cent stake	https://www.firstpost.com/world/trump-signs-executive-order-to-defer-tiktok-ban-by-75-days-13854811.html	2025-01-20T20:58:02-08:00	https://images.firstpost.com/uploads/2025/01/Trump-Tiktok-US-restores-service-2025-01-81e5519e4c0cd2a6a5385068c2fbb1d9-1200x675.jpg
Joe Biden bids farewell to DC after 50 years but 'not leaving the fight'	Joe Biden wrapped up his over 50-year political career as he handed over the charge of US administration to newly sworn-in President Donald Trump and flew to California, but promised that 'we're not leaving the fight'	https://www.firstpost.com/world/joe-biden-bids-farewell-to-dc-after-50-years-but-not-leaving-the-fight-13854797.html	2025-01-20T19:49:15-08:00	https://images.firstpost.com/uploads/2025/01/Joe-Biden-Donald-Trump-leave-White-House-2025-01-f8b4e743964c158cf80dffad319b7087-1200x675.jpg
Police officers attacked on Capitol Hill condemn Trump's pardons to January 6 attackers	On January 6, 2021, a mob egged on by US President Donald Trump attacked the US Capitol to illegally overturn the 2020 election result in his favour	https://www.firstpost.com/world/police-officers-attacked-on-capitol-hill-condemn-trump-pardons-to-january-6-attackers-13854786.html	2025-01-20T19:39:55-08:00	https://images.firstpost.com/uploads/2025/01/Firstpost-2025-01-21T090814.186-2025-01-94283af5e1e80147c99cfed56a9c98e9.jpg
Reversing Biden's decision, Trump puts Cuba back on state sponsors of terrorism list	Hours after taking oath as the 47th President of the United States, Donald Trump reversed the Biden administration's decision to remove Cuba from the US list of state sponsors of terrorism.	https://www.firstpost.com/world/reversing-bidens-decision-trump-puts-cuba-back-on-state-sponsors-of-terrorism-list-13854777.html	2025-01-20T19:01:52-08:00	https://images.firstpost.com/uploads/2025/01/US-President-Donald-Trump-signs-executive-orders-2025-01-d9f4923636c478117f036eb7abb7d089-1200x675.jpg
Trump 2.0: 25% tariff on Canada, Mexico likely from February 1; dollar rebounds	US President Donald Trump said that his team has been thinking of announcing around 25 per cent tariffs on Canada and Mexico on February 1	https://www.firstpost.com/world/trump-2-0-25-per-cent-tariff-on-canada-mexico-likely-from-february-1-dollar-rebounds-13854783.html	2025-01-20T18:50:47-08:00	https://images.firstpost.com/uploads/2025/01/US-dollars-2025-01-c759b3dd725c867f560bf88e4243e84d-1200x675.jpg
India-US protocol upgrade: At Trump's inauguration, EAM Jaishankar gets front row seat	In a significant upgrade in official protocol, India's External Affairs Minister S Jaishankar was offered seat in the front row, while his Japanese counterpart was seated two rows behind, at Donald Trump's inauguration as the 47th US President on Monday	https://www.firstpost.com/world/india-us-protocol-upgrade-at-trumps-inauguration-eam-jaishankar-gets-front-row-seat-13854773.html	2025-01-20T18:34:15-08:00	https://images.firstpost.com/uploads/2025/01/Jaishankar-front-row-Trump-inauguration-2025-01-600ada121c728d80db5f6db7c57da38d-1200x675.jpg
Marco Rubio, a China hawk & Israel backer, becomes Trump’s first nominee to get senate confirmation	Republican Senator Marco Rubio became the first Cabinet nominees of Donald Trump to be confirmed by the Senate, just hours after the president was sworn in for a second White House term. The Senate backed Rubio by a vote of 99-0	https://www.firstpost.com/world/marco-rubio-a-china-hawk-israel-backer-becomes-trumps-first-nominee-to-get-senate-confirmation-13854768.html	2025-01-20T17:26:23-08:00	https://images.firstpost.com/uploads/2025/01/Marco-Rubio-and-Donald-Trump-2025-01-9bc0c3cb453766a7914783575e67141d-1200x675.jpg
Trump signs executive order to pull US out of Paris agreement to fight climate change	President Donald Trump on Monday has, for the second time, signed an executive order to begin the process of pulling the US out of the Paris Climate Agreement. The order to exit from the deal was signed by Trump during his first hours in office on Monday	https://www.firstpost.com/world/trump-signs-executive-order-to-pull-us-out-of-paris-agreement-to-fight-climate-change-13854766.html	2025-01-20T16:58:38-08:00	https://images.firstpost.com/uploads/2025/01/US-President-Donald-Trump-signs-executive-orders-2025-01-d9f4923636c478117f036eb7abb7d089-1200x675.jpg
6 ways Trump 2.0 may change the world	Donald Trump’s 2025 return to the White House signals major shifts in trade, immigration, global alliances and climate policies with worldwide impact	https://www.firstpost.com/world/6-ways-trump-2-0-may-change-the-world-13854654.html	2025-01-20T16:17:38-08:00	https://images.firstpost.com/uploads/2025/01/Donald-Trump-inauguration-2025-01-1cb8c02ff62e0ebf22c5bcf187e2840d.jpg
As Gaza ceasefire stabilises, 915 aid trucks enter war-ravaged territory	The UN reports 915 aid trucks entered Gaza on Monday during a fragile ceasefire. Despite increased deliveries, looting, displacement, and logistical hurdles hinder relief efforts for 2.3 million residents	https://www.firstpost.com/world/as-gaza-ceasefire-stabilises-915-aid-trucks-enter-war-ravaged-territory-13854754.html	2025-01-20T14:45:19-08:00	https://images.firstpost.com/uploads/2024/06/Untitled-45-2024-06-2b8f5a894ad23ca803b7a611588a1a12.jpg
Trump's crypto empire soars to $10 billion as president promises ‘golden age’ for cryptocurrencies	Trump's new memecoin, branded $TRUMP, was launched Friday night during the first-ever Crypto Ball in Washington, D.C., in conjunction with festivities for the inauguration. The coin surged on Monday from less than $10 on Saturday morning to as high as $74.59 before giving up some of its huge rise on Monday	https://www.firstpost.com/world/trumps-crypto-empire-soars-to-10-billion-as-president-promises-golden-age-for-cryptocurrencies-13854758.html	2025-01-20T14:36:07-08:00	https://images.firstpost.com/uploads/2025/01/Trump-2025-01-2f790e845be98afd66da8462a756c5c6-1200x675.jpg
Kyiv and Moscow weigh Trump's intentions on Ukraine conflict	During his campaign, Trump criticised this aid and promised to resolve the conflict quickly -- raising fears in Europe and Ukraine that Kyiv, which aspires to join the EU and NATO, would be forced to make major concessions	https://www.firstpost.com/world/kyiv-and-moscow-weigh-trumps-intentions-on-ukraine-conflict-13854753.html	2025-01-20T14:32:15-08:00	https://images.firstpost.com/uploads/2025/01/Ukraine-Russia-2025-01-4d09ea05fb06df220d71314045c1da9d-1200x675.jpg
EU vows to defend economic interests amid Trump's tariff threats	Before taking office this time around, Trump made sweeping threats of tariffs including against the United States' largest trading partner the EU, its neighbours Canada and Mexico and its strategic rival China	https://www.firstpost.com/world/eu-vows-to-defend-economic-interests-amid-trumps-tariff-threats-13854743.html	2025-01-20T14:18:42-08:00	https://images.firstpost.com/uploads/2025/01/Trump1200-7-2025-01-6f67a2c7f32f64d2f940225c26aa9d65.jpg
Palestinian Authority president congratulates Trump, says 'ready to work on two-state solution'	In his first presidential term, from 2017 to 2021, Trump's administration put together a peace proposal which would have involved Israel annexing much of the occupied West Bank while handing over some territory to a future Palestinian state in return	https://www.firstpost.com/world/palestinian-authority-president-congratulates-trump-says-ready-to-work-on-two-state-solution-13854740.html	2025-01-20T13:49:21-08:00	https://images.firstpost.com/uploads/2024/10/Untitled-design-2024-10-24T175904.640-2024-10-fd59d4eac2cbb56c411a665689769b72.jpg
Trump begins crackdown on immigrants: US govt shuts down CBP One app for border crossings from Mexico	The CBP One app, which allowed 1,450 people a day to enter the US on parole, had been a cornerstone of the previous administration's efforts to manage border crossings	https://www.firstpost.com/world/trump-begins-crackdown-on-immigrants-us-govt-shuts-down-cbp-one-app-for-border-crossings-from-mexico-13854738.html	2025-01-20T13:37:09-08:00	https://images.firstpost.com/uploads/2024/12/US-Mexico-border-Dec-18-2024-Reuters-2024-12-9537ceff7895a60146238c7a9580bfb3.jpg
What's in a name? Trump repeats promise to rename Gulf of Mexico. Can he do it?	Even if the US administration unilaterally decides to change the name of the Gulf of Mexico to the Gulf of America, it would not necessarily change how it is referred to worldwide. Other countries don't have to follow the US's decision	https://www.firstpost.com/world/whats-in-a-name-trump-repeats-promise-to-rename-gulf-of-mexico-can-he-do-it-13854731.html	2025-01-20T12:53:59-08:00	https://images.firstpost.com/uploads/2024/11/download-2024-11-28T073846.863-1-2024-11-30a853b542bf5e2206aec0124ed8394d.jpg
Trump says will take back 'Chinese-operated' Panama Canal, Latin American country says no	China is operating the Panama Canal[...]We gave it to Panama. And we're taking it back,' Trump declared. The Panama Canal is a key trade route that handles around 6 per cent of global maritime traffic	https://www.firstpost.com/world/trump-says-will-take-back-chinese-operated-panama-canal-latin-american-country-says-no-13854722.html	2025-01-20T11:55:48-08:00	https://images.firstpost.com/uploads/2025/01/Panama-Canal-Donald-Trump-2025-01-507fd5cee4cacb526d7ec5947cce920f.jpg
President Trump is always decisive': World leaders react to Trump's inauguration	Global leaders responded to Trump's return to the White House with congratulatory messages and calls for positive relations with the mercurial leader	https://www.firstpost.com/world/president-trump-is-always-decisive-world-leaders-react-to-trumps-inauguration-13854701.html	2025-01-20T10:28:56-08:00	https://images.firstpost.com/uploads/2025/01/Trump1200-6-2025-01-5c944dde150275e7d76bc45228d3476f.jpg
Donald Trump's Inauguration: Full speech text of his address from Capitol	Trump began his speech by saying '	https://www.firstpost.com/world/donald-trumps-inauguration-full-speech-text-of-his-address-from-capitol-13854703.html	2025-01-20T10:07:27-08:00	https://images.firstpost.com/uploads/2025/01/Untitled-design-2025-01-20T223540.470-2025-01-45e8c651ae4f9e3b3a8d3b1ba7063bab.jpg
Greater, stronger and far more exceptional': Donald Trump becomes president of the United States	Donald Trump is now President Donald Trump– the head of the state and the head of the government of the United States of America	https://www.firstpost.com/world/united-states/donald-trump-becomes-president-of-the-united-states-for-a-historic-second-term-13854671.html	2025-01-20T09:06:07-08:00	https://images.firstpost.com/uploads/2025/01/Donald-Trump-2025-01-05184bb84701aea34a59ddc711f220f5-1200x675.jpeg
Biden's last act as president: Pardon to family members shielding them from Trump action	In a statement, Biden said, that his family has been subjected to unrelenting attacks and threats, 'motivated solely by a desire to hurt me—the worst kind of partisan politics. Unfortunately, I have no reason to believe these attacks will end,' he said in a statement	https://www.firstpost.com/world/united-states/bidens-last-act-as-president-pardon-to-family-members-shielding-them-from-trump-action-13854663.html	2025-01-20T08:55:02-08:00	https://images.firstpost.com/uploads/2025/01/Biden-1-2025-01-8b8fde2130a43d09ee759aa93ce26b78.jpg
Bitcoin celebrates Trump inauguration with record high of over $109,000	The world's largest cryptocurrency surged to an all-time peak of $109,241 ahead of Trump's swearing-in ceremony, before easing back to around $107,000	https://www.firstpost.com/business/bitcoin-celebrates-trump-inauguration-with-record-high-of-over-109000-13854656.html	2025-01-20T08:28:44-08:00	https://images.firstpost.com/uploads/2024/12/Bitcoin-2024-12-ae0564da9c3a224362faf3b053ba5d8f-1200x675.jpg
Trump to declare national emergency on US-Mexico border on Day One: Report	Trump administration would declare a national emergency at the US-Mexico border and direct the Department of Defence to send armed forces to 'erect physical barriers' and complete border wall construction, according to a report, citing incoming White House officials on Monday	https://www.firstpost.com/world/trump-to-declare-national-emergency-on-us-mexico-border-on-day-one-report-13854652.html	2025-01-20T08:13:02-08:00	https://images.firstpost.com/uploads/2025/01/Donald-Trump-2025-01-8315a16235e0fbf78b56735f9743177e-1200x675.jpg
South Korea's suspended President Yoon Suk Yeol to attend his impeachment hearing tomorrow	Yoon, currently suspended from his duties with his powers transferred to an acting president, did not attend two previous hearings earlier this month. The court has until June 11 to decide whether to uphold or reject Yoon’s impeachment	https://www.firstpost.com/world/south-koreas-suspended-president-yoon-suk-yeol-to-attend-his-impeachment-hearing-tomorrow-13854647.html	2025-01-20T07:24:24-08:00	https://images.firstpost.com/uploads/2025/01/South-Korea-President-Yoon-Suk-Yeol-2025-01-fd23fd5a01e7486c2d0b7e4189de128f-1200x675.jpg
Putin congratulates Trump ahead of inauguration, says open to talks on Ukraine and nuclear arms	Russian President Vladimir Putin congratulated US President-elect Donald Trump on taking office hours before Trump's inauguration in Washington and said he was open to talks on the Ukraine and nuclear arms with Trump's incoming administration	https://www.firstpost.com/world/putin-congratulates-trump-ahead-of-inauguration-says-open-to-talks-on-ukraine-and-nuclear-arms-13854641.html	2025-01-20T07:18:01-08:00	https://images.firstpost.com/uploads/2025/01/Putin-TRUMP1200-2025-01-ecf635617c85a015dc58e0311e46748f.jpg
EU launches yet another WTO challenge against China, this time over high-tech patents	This case follows a related WTO challenge launched by the EU in 2022, accusing China of preventing European patent holders from pursuing legal action in European courts to protect their intellectual property	https://www.firstpost.com/world/eu-launches-yet-another-wto-challenge-against-china-this-time-over-high-tech-patents-13854629.html	2025-01-20T06:19:40-08:00	https://images.firstpost.com/uploads/2024/11/Representational-Image-2024-11-25T204840.160-2024-11-6cffb086d046435d1d439ff68d259c28.jpg
7 things about Pakistan's biggest airport built by China	Situated in Balochistan, a province long plagued by insurgency and calls for independence, Gwadar airport aims to bolster connectivity in a strategically important yet volatile area	https://www.firstpost.com/world/7-things-about-pakistans-biggest-airport-built-by-china-13854613.html	2025-01-20T05:45:40-08:00	https://images.firstpost.com/uploads/2025/01/Gwadar1200-2025-01-1a44449eb7b6f4809d1809ef6e2d4ef1.jpg
92% homes destroyed or damaged in Gaza, says UN	Even as Palestinians have started returning to their homes in the Gaza Strip, most of them are unlikely to find anything resembling a home as figures with the United Nations (UN) say that up to 92% homes have been either destroyed completely or partially damaged in the war	https://www.firstpost.com/world/92-per-cent-homes-in-gaza-destroyed-or-damaged-in-gaza-says-un-13854619.html	2025-01-20T05:42:42-08:00	https://images.firstpost.com/uploads/2025/01/Firstpost-2025-01-20T190440.678-2025-01-92b154c23ae55e02546748ddfc25f068.jpg
