Title	Description	Link	pubDate	Image
Four doctors attending Netanyahu's surgery	Hadassah staff requested that an additional expert from Assaf Harofeh attend Prime Minister Benjamin Netanyahu's surgery; Justice Minister Yariv Levin to replace Prime Minister until he is released.	https://www.israelnationalnews.com/news/401490	2024-12-29T11:38:35-08:00	
El Al extends fixed price plan to Frankfurt	El Al ha announced the extension of its fixed price plan for selected destinations into January and February 2025, swapping Larnaca with Frankfurt.	https://www.israelnationalnews.com/news/401489	2024-12-29T10:48:10-08:00	
Chief of Staff in Lebanon: True victory will be when many residen...	IDF Chief of Staff Herzi Halevi holds situational assessment in northern Israel, stresses that true victory over Hezbollah will only come when many residents return to live in northern Israel.	https://www.israelnationalnews.com/news/401488	2024-12-29T10:27:26-08:00	
In Gaza operation: 14 Hamas terrorists eliminated, including Oct....	Six of the 14 terrorists eliminated in Jabaliya and Beit Lahia participated in the October 7 massacre.	https://www.israelnationalnews.com/news/401487	2024-12-29T09:44:11-08:00	
Red Notice: Interpol pursuing Lev Tahor cult member who escaped r...	Interpol has issued an international warrant after a member of the cult slipped away from Guatemalan police a week and a half ago.	https://www.israelnationalnews.com/news/401486	2024-12-29T09:40:11-08:00	
Watch: Infiltrator attempting to escape police officers caught by...	Palestinian Authority Arab crosses into pre-1967 Israel illegally, is arrested thanks to guidance from a drone.	https://www.israelnationalnews.com/news/401482	2024-12-29T09:33:42-08:00	
Haredi party warns: 'We're closer to elections than to a Draft La...	Hasidic-haredi Agudat Yisrael faction warns that the Draft Law in its current format may bring about the end of the government.	https://www.israelnationalnews.com/news/401484	2024-12-29T09:31:20-08:00	
Unique Hanukkah initiative: Prayers for hostages at candlelightin...	Over 20,000 people are dedicating a few minutes after lighting candles to pray for the recovery of the remaining hostages.	https://www.israelnationalnews.com/news/401483	2024-12-29T08:40:08-08:00	
Staff Sergeant Yuval Shoham, 22, fell in battle in Gaza	Staff Sergeant Yuval Shoham, 22 years old from Jerusalem, served in the 401st Brigade and fell in combat in northern Gaza.	https://www.israelnationalnews.com/news/401485	2024-12-29T08:36:00-08:00	
Footage from Gaza: This is how the IDF conducted a raid on a Jaba...	Over 240 terrorists apprehended at the Kamal Adwan Hospital, 15 of whom participated in the October 7th massacre.	https://www.israelnationalnews.com/news/401481	2024-12-29T07:25:18-08:00	
Five rockets launched towards Sderot, two intercepted	At least two rockets intercepted after sirens sound in Sderot, Ibim, and Nir Am, near the Gaza border.	https://www.israelnationalnews.com/news/401480	2024-12-29T07:06:44-08:00	
Azerbaijan demands Russia apologize for shooting down plane	President Ilham Aliyev of Azerbaijan called on Russia to apologize and compensate for the downing of an Azerbaijani plane over Kazakhstan last week, which led to numerous casualties.	https://www.israelnationalnews.com/news/401479	2024-12-29T06:39:40-08:00	
Mark Langfan: Israel emerges as a stabilizing force amid Middle E...	In an in-depth interview, Mark Langfan discusses the collapse of the Assad regime, the waning Iranian hegemony, and Israel's pivotal role in the Middle East. Langfan highlights opportunities, dangers, and the critical shifts reshaping the region's future.	https://www.israelnationalnews.com/news/401478	2024-12-29T06:29:56-08:00	
Tel Aviv: Daycare staff arrested on suspicion of abuse	Daycare owner and two assistants, employed in childcare center in northern Tel Aviv, arrested on suspicion of child abuse.	https://www.israelnationalnews.com/news/401477	2024-12-29T06:02:11-08:00	
Israel Prison Service ends use of draft soldiers	The Israeli Prison Service has completely eliminated the use of soldiers in conscript service as correctional staff.	https://www.israelnationalnews.com/news/401476	2024-12-29T05:54:24-08:00	
Ludmilla's grandson: 'Who thought that this could happen in hoste...	Alon Bondarchuk spoke about his grandmother, Ludmilla Lipovsky, who was murdered in a terror attack in Herzliya. 'I see her as the hero in the incident.'	https://www.israelnationalnews.com/news/401475	2024-12-29T04:32:13-08:00	
Report: Hezbollah selects new deputy leader	Saudi media reports that Mohammed Raed, the head of the Hezbollah faction in the Lebanese parliament, has been appointed deputy leader of the terrorist organization under Secretary-General Naim Qassem.	https://www.israelnationalnews.com/news/401474	2024-12-29T04:14:19-08:00	
Real Talk: The Rabbi of Capitol Hill tells all	Executive Vice President of American Friends of Lubavitch Rabbi Levi Shemtov speaks about his work in Washington, which he describes as 'walking a tightrope over a cesspool, wearing a straightjacket, with everyone demanding that I dance.'	https://www.israelnationalnews.com/news/401473	2024-12-29T03:58:20-08:00	
Rabbi Grossman urges: 24 hours left to save Jew In prison	With just one day left until his trial, Nosson’s life hangs in the balance.	https://www.israelnationalnews.com/news/401470	2024-12-29T03:21:16-08:00	
IAF strikes Hamas command and control center in former hospital	The command and control center in the El-Wafa Hospital in the area of Gaza City was used by the terrorists to plan and execute terrorist attacks against IDF troops in the immediate future, the military said.	https://www.israelnationalnews.com/news/401472	2024-12-29T03:14:19-08:00	
Report: Nasrallah thought he was safe from Israel until the end	New details of Israel's decades-long intelligence efforts against Hezbollah revealed in new report from the New York Times.	https://www.israelnationalnews.com/news/401471	2024-12-29T02:48:00-08:00	
2 grooms detained on Temple Mount on their wedding day	Attorney Nati Rom accuses police of selective enforcement after 2 grooms taken to police station for dancing on the Temple Mount.	https://www.israelnationalnews.com/news/401469	2024-12-29T02:00:51-08:00	
Request to court revealed: Surgery under full anesthesia, Netanya...	Prime Minister Benjamin Netanyahu asked the court to reschedule this week's hearings in his case due to a procedure he will undergo to remove his colon.	https://www.israelnationalnews.com/news/401468	2024-12-29T01:28:18-08:00	
New film 'The 2,000 Kidnapped Spanish Jewish Children' dedicated ...	Film to shed light on the tragic story of 2,000 Jewish children from Spain who, after their families fled to Portugal in 1492 following the Edict of Expulsion, were forcibly kidnapped by Portuguese King Dom João II.	https://www.israelnationalnews.com/news/401467	2024-12-29T01:16:34-08:00	
Unusual and precedent-setting incident in Jenin	Terrorists in Jenin turned themselves in to IDF forces fearing arrest by the PA security forces.	https://www.israelnationalnews.com/news/401466	2024-12-29T00:54:57-08:00	
Herzog: 'UN has facts on hostages, morally obliged to bring them ...	Israeli President comments on the report on the conditions the hostages are and were held in Israel submitted to the UN. 'Torture. Physical and psychological torture. Starvation. Sexual abuse. Beatings. Branding.'	https://www.israelnationalnews.com/news/401465	2024-12-29T00:24:59-08:00	
Tzfat: Fire breaks out after lit menorah falls over	Crews searched for trapped individuals, aired out the smoke, and extinguished the flames which were suspected to have been caused by a lit menorah that fell over.	https://www.israelnationalnews.com/news/401464	2024-12-29T00:17:46-08:00	
Bus strikes pedestrians in Ashkelon, killing 1, terror attack rul...	20-year-old killed, another person injured in what police say was a traffic accident.	https://www.israelnationalnews.com/news/401462	2024-12-28T23:44:00-08:00	
Help Shira and Itiel: Couple's future hangs in the balance after ...	Despite their sacrifices, the couple is struggling to make ends meet.	https://www.israelnationalnews.com/news/401459	2024-12-28T23:17:56-08:00	
Gaza: IAF strikes rocket launchers used to fire rockets at Jerusa...	‏The IAF struck the launchers that were used yesterday to fire projectiles toward the Lachish, HaShfela, Yarkon, Western Negev, Yehuda, and Jerusalem areas.	https://www.israelnationalnews.com/news/401461	2024-12-28T23:14:03-08:00	
In the heart of Tehran: New details on Ismail Haniyeh's eliminati...	The bomb planted in the Hamas diplomatic bureau chief's room was nearly discovered because of a faulty air conditioner.	https://www.israelnationalnews.com/news/401460	2024-12-28T23:12:06-08:00	
Jerusalem's rabbinic elections: Who will be the capital's next Ch...	Minister of Religious Affairs Michael Malkieli sent an official letter to Jerusalem Mayor Moshe Lion asking him to select representatives for a committee to oversee the selection of new chief rabbis for the city.	https://www.israelnationalnews.com/news/401458	2024-12-28T22:40:07-08:00	
Murder suspect arrested at airport moments before fleeing the cou...	Man arrested at Ben Gurion Airport moments before fleeing Israel after being identified as the suspect in the murder of a young woman in Ashkelon.	https://www.israelnationalnews.com/news/401457	2024-12-28T22:18:44-08:00	
The Jews and the Greeks	G-d charged the Jews, with responsibility for the spiritual perfection of the world, and He charged the Greeks with responsibility for the physical perfection of the world. A harmonious symbiosis which collapsed when the Greeks sought control.	https://www.israelnationalnews.com/news/401456	2024-12-28T22:08:00-08:00	
As Israel searches for Eli Cohen's remains...	Let's remember the legendary Eli Cohen's doctrine - and continue his legacy. Opinion.	https://www.israelnationalnews.com/news/401455	2024-12-28T21:58:13-08:00	
Report: Israel considering remaining in Lebanon beyond agreed-on ...	Israel is considering remaining in southern Lebanon even after the 60-day deadline due to the slow deployment of Lebanese troops and the reformation of Hezbollah.	https://www.israelnationalnews.com/news/401454	2024-12-28T21:57:30-08:00	
Khamenei: Iran’s warmonger leading Iran to ruin	There is no meaningful distinction between Khamenei, Abu Bakr al-Baghdadi, Osama bin Laden, Hassan Nasrallah, Yahya Sinwar, Ismail Haniyeh, and Qasem Soleimani—they all share the same doctrine of terrorism and oppression. Op-ed.	https://www.israelnationalnews.com/news/401453	2024-12-28T21:46:53-08:00	
Jewish Democratic lawmaker switches to Republican Party	Rep. Hillary Cassel of the Florida State Legislature announces that in light of the Democrats' failure to fully support Israel and tolerance for extremists, she is switching parties.	https://www.israelnationalnews.com/news/401452	2024-12-28T21:46:43-08:00	
Qatar PM meets Hamas delegation to discuss Gaza ceasefire deal	Qatar’s Prime Minister meets with a Hamas delegation in Doha in attempt to push forward ceasefire and hostage release deal.	https://www.israelnationalnews.com/news/401451	2024-12-28T20:56:20-08:00	
What good is a law if the courts do not uphold it?	Who gets hurt by that?	https://www.israelnationalnews.com/news/401450	2024-12-28T20:33:09-08:00	
Two relatives of Assad arrested while attempting to flee Lebanon	Wife and daughter of Duraid Al-Assad, a cousin of Syria’s deposed President Bashar Al-Assad, were arrested at Beirut's airport while attempting to leave the country using allegedly forged passports.	https://www.israelnationalnews.com/news/401449	2024-12-28T20:17:52-08:00	
Photos: IDF soldiers in the snow in Syria	IDF Spokesperson's Unit publishes photos of soldiers from the 810th Heharim Regional Brigade in the snow from the Syrian border.	https://www.israelnationalnews.com/news/401448	2024-12-28T20:00:00-08:00	
Iranian Foreign Minister: 2025 will be an ‘important year’ for nu...	Iranian Foreign Minister Abbas Araqchi says Iran is preparing for what it anticipates will be a pivotal year for its nuclear issue in 2025, does not provide further details.	https://www.israelnationalnews.com/news/401447	2024-12-28T19:31:33-08:00	
Watch: Iliza Shlesinger and Noa Tishby light Hanukkah candles	On the fourth night of Hanukkah, Israeli actress and activist Noa Tishby is joined for candle lighting by comedian, actress and television host, Iliza Shlesinger, who makes an argument that Hanukkah might just be the most American holiday.	https://www.israelnationalnews.com/news/401446	2024-12-28T18:47:13-08:00	
Son of hostage: Our strength is in our unity!	Yocheved Lifshitz, who was kidnapped by Hamas and freed after 17 days, lights Hanukkah candles at Hostages Square in Tel Aviv: The 449 days that have passed are now one painful day until all our hostages return.	https://www.israelnationalnews.com/news/401445	2024-12-28T18:18:18-08:00	
South Korea: Plane with 181 people aboard crashes while landing, ...	At least 28 dead after a plane with 181 people aboard crashes at Muan International Airport in South Korea.	https://www.israelnationalnews.com/news/401444	2024-12-28T17:33:17-08:00	
Will Trump save TikTok?	US President-elect calls on Supreme Court to delay the implementation of TikTok ban scheduled to take effect next month in order to 'pursue a negotiated resolution'.	https://www.israelnationalnews.com/news/401443	2024-12-28T17:19:44-08:00	
Report: Biden regrets withdrawing, thinks he could've defeated Tr...	White House sources quoted by The Washington Post say US President regrets withdrawing from this year’s presidential race, expressing confidence that he could have defeated Donald Trump despite polling that suggested otherwise.	https://www.israelnationalnews.com/news/401442	2024-12-28T16:15:22-08:00	
Danon: UN is trying to ignore the horrors of October 7, we won't ...	Israel’s Ambassador to the UN comments on Health Ministry report on the conditions of the hostages which will be submitted to the UN this week: We will continue to remind the UN of the sexual abuse, starvation, neglect and humiliation that our hostages are going through.	https://www.israelnationalnews.com/news/401441	2024-12-28T15:12:09-08:00	
Torah scroll dedicated in memory of soldier killed in Oct. 7 mass...	Yeshiva staff and students, as well as Ashdod's mayor, attend Torah scroll dedication honoring Major Chen Bouchris, who fell in battle on the morning of October 7 while defending southern Israel from the invading Hamas terrorists.	https://www.israelnationalnews.com/news/401440	2024-12-28T14:10:38-08:00	
Erin Molan to the Pope: 'Use your power to recover the hostages'	Australian television presenter Erin Molan urged the Pope to blame those truly responsible for the suffering in Gaza.	https://www.israelnationalnews.com/news/401438	2024-12-28T13:37:00-08:00	
The information that could've saved six hostages	Qaid Farhan al-Qadi, rescued from Gaza, related that he heard a woman say, 'Good morning' in Hebrew in the tunnels. Despite his testimony, no changes were made to the IDF's operational plans.	https://www.israelnationalnews.com/news/401439	2024-12-28T13:31:43-08:00	
Netanyahu to undergo surgery on Sunday	Prime Minister Benjamin Netanyahu suffered from UTI caused by benign enlargement of his prostrate gland, and was treated with antibiotics.	https://www.israelnationalnews.com/news/401437	2024-12-28T12:45:48-08:00	
24 years later: Parha Yousouf, mother of fallen soldier Madahat Y...	Parha Yousouf, mother of Druze IDF soldier Madahat Yousouf, who the Ehud Barak government abandoned to death, dies at 85.	https://www.israelnationalnews.com/news/401436	2024-12-28T12:13:40-08:00	
Health Ministry to present report on hostages to the United Natio...	Report highlights horrors the hostages endured, reveals the brutality of the enemy with whom Israel is engaged; global community must utilize all available means to end this cruelty and bring the hostages home,' Health Minister Uriel Busso says.	https://www.israelnationalnews.com/news/401434	2024-12-28T11:11:13-08:00	
Sara Netanyahu: 'Investigation is a politicized witch hunt'	Sara Netanyahu's attorney claims the legal inquiry against Sara is politically motivated, illegal and biased.	https://www.israelnationalnews.com/news/401435	2024-12-28T11:05:09-08:00	
Police to examine suspected incitement against AG	Israel Police open investigation into incitement against Attorney General Gali Baharav-Miara, MK Yair Lapid.	https://www.israelnationalnews.com/news/401433	2024-12-28T10:59:23-08:00	
Iranian plot to abduct Israeli journalist foiled	An IRGC plot to kidnap the Israeli journalist Babak Itzhaki was foiled by noncooperation from an agent.	https://www.israelnationalnews.com/news/401432	2024-12-28T10:34:43-08:00	
2024's most popular baby name in Berlin: Mohammed	In the German cities of Berlin and Brandenburg, the Muslim name 'Mohammed' ranks as 2024's most popular name for baby boys.	https://www.israelnationalnews.com/news/401431	2024-12-28T10:07:44-08:00	
Palestinian journalist demands end to war	A journalist from Jabaliya demands and end to the war due to the disaster it has brought to the Palestinian people.	https://www.israelnationalnews.com/news/401430	2024-12-28T10:00:51-08:00	
Putin apologizes for Azerbaijani plane incident in Kazakhstan	Russian President Vladimir Putin apologized to Azerbaijani President Ilham Aliyev for the downing of an Azerbaijani plane in Kazakhstan.	https://www.israelnationalnews.com/news/401429	2024-12-28T09:29:09-08:00	
The ideological foundations of the Ba’ath	Despite its proclaimed allegiance to socialist principles, Arab Socialism in practice leaned heavily on populism, charismatic leadership, and militarism. With Assad’s fall, the Ba’ath ceased to exist as a governing body in the Arab world, but that may not be the last word. Op-ed.	https://www.israelnationalnews.com/news/401428	2024-12-28T09:22:31-08:00	
From darkness to light: Menorah made of missile fragments display...	Large Hanukkah menorah made of rocket fragments, created by artist Eli Gross, is set up in Hostages Square.	https://www.israelnationalnews.com/news/401427	2024-12-28T09:20:21-08:00	
New details emerge on Herzliya stabbing attack	Defense echelon continues investigation of Herzliya stabbing attack, which left 83-year-old Ludmilla Lipovsky dead.	https://www.israelnationalnews.com/news/401426	2024-12-28T09:15:03-08:00	
A sense of Déjà vu	All the current 'mainstream' proposals for the 'Day After' in Gaza represent the triumph of misguided hope—or at least, misconceived correctness—over bitter experience. Op-ed.	https://www.israelnationalnews.com/news/401425	2024-12-28T09:01:00-08:00	
IDF begins operating in Beit Hanoun	Gaza Division begins operational activity to dismantle terror targets in Beit Hanoun in northern Gaza.	https://www.israelnationalnews.com/news/401424	2024-12-28T08:47:04-08:00	
Auschwitz commander's grandson denounces antisemitism	Kai Höss, grandson of an Auschwitz commandant, speaks out against anti-Semitism and anti-Israel protests.	https://www.israelnationalnews.com/news/401422	2024-12-28T08:46:34-08:00	
Watch: IDF soldiers light Hanukkah candles in Syria	Soldiers from the Egoz Unit and Sayeret Golani light candles at an IDF base in Syria. Watch.	https://www.israelnationalnews.com/news/401423	2024-12-28T08:38:22-08:00	
240 terrorists arrested: IDF moves in after Hamas turned Gaza hos...	IDF, ISA, complete targeted operation against Hamas command center in the Kamal Adwan Hospital in Jabaliya, apprehending over 240 terrorists in the area.	https://www.israelnationalnews.com/news/401421	2024-12-28T08:20:00-08:00	
Watch: Police officers rescue youth caught in a storm mid-hike	Three youths plan to sleep outdoors in the Galilee, find themselves caught in a storm, suffering from brutal cold, and unable to leave the area. Police officers arrive to rescue them.	https://www.israelnationalnews.com/news/401419	2024-12-28T08:06:56-08:00	
Watch: IDF forces in a Radwan Force tunnel that was destroyed	IDF announces: Underground infrastructure 100 meters long and leading to a Radwan Force rest area is destroyed.	https://www.israelnationalnews.com/news/401418	2024-12-28T07:43:00-08:00	
Over Shabbat: Projectiles towards Israel from Gaza and Yemen	Sirens sound near Dead Sea, Jerusalem, Negev, and lowlands, at 2:00 a.m. and 4:00 p.m., due to projectiles launched from Yemen and Gaza.	https://www.israelnationalnews.com/news/401417	2024-12-28T07:31:17-08:00	
Watch: Mayim Bialik and Noa Tishby light Hanukkah candles	For the third night of Hanukkah, Israeli actress and activist Noa Tishby is joined by actress Mayim Bialik.	https://www.israelnationalnews.com/news/401416	2024-12-27T12:38:31-08:00	
Biden in final Hanukkah message: Hold on to hope, keep the faith	US President publishes his final Hanukkah message as President on X.	https://www.israelnationalnews.com/news/401415	2024-12-27T12:09:36-08:00	
John Kirby: Hamas is the obstacle to a hostage release deal	White House National security communications adviser John Kirby says US is 'actively working' to broker a ceasefire-hostage agreement between Israel and Hamas, but the terror group continues throwing up obstacles.	https://www.israelnationalnews.com/news/401414	2024-12-27T11:43:18-08:00	
Strike on Houthi targets reported in Yemen's capital	Al-Arabiya reports the strike in Sanaa targeted Houthi weapons manufacturing workshops. The Houthis blame the US Army for the latest strike, which follows Israel's strikes on Thursday.	https://www.israelnationalnews.com/news/401413	2024-12-27T11:18:01-08:00	
Foreign Ministry blasts UN chief's condemnation of Yemen strikes:...	Israel's Foreign Ministry blasts UN Secretary-General Antonio Guterres, who criticized Israel’s strikes against Houthi targets in Yemen, while failing to mention that the Houthi missile attacks on Israel.	https://www.israelnationalnews.com/news/401412	2024-12-27T10:46:50-08:00	
For the first time: US THAAD system successfully intercepts Houth...	The US-supplied Terminal High Altitude Area Defense system, which has been stationed in Israel since October, successfully intercepted the missile fired by Houthi rebels early Friday morning.	https://www.israelnationalnews.com/news/401411	2024-12-27T10:10:06-08:00	
Shabbat Shalom from Israel! Updates continue from North America	Shabbat about to begin in Israel. INN's North America desk will continue to update the site until Shabbat begins in New York.	https://www.israelnationalnews.com/news/383503	2024-12-27T06:20:00-08:00	
Podcast: Jew hatred in the Middle Ages and today	Antisemitism and assimilation.	https://www.israelnationalnews.com/news/401409	2024-12-27T06:19:00-08:00	
German government collapses, sets date for elections	The government dissolved in the wake of a no-confidence vote in Chancellor Olaf Scholz.	https://www.israelnationalnews.com/news/401410	2024-12-27T06:01:49-08:00	
Snow begins falling on Mount Hermon	Rain, snow, and flooding expected over weekend as temperatures drop below seasonal average.	https://www.israelnationalnews.com/news/401404	2024-12-27T05:24:21-08:00	
Truck with 40 rocket launchers located in Lebanese pharmacy	IDF's 226th Brigade locates truck with 40 rocket launchers, barrels and weapons storage facility inside pharmacy in southern Lebanon.	https://www.israelnationalnews.com/news/401408	2024-12-27T05:12:44-08:00	
IDF confirms: Captain Amit Levi was killed by terrorists, not fri...	Amit Levi fell as a result of a clash with terrorists, while searching a building used for terror activity,' IDF spokesman says.	https://www.israelnationalnews.com/news/401407	2024-12-27T05:04:27-08:00	
Watch: IDF soldier's heartbreaking audition to The Next Star	Ido Malka, a Golani Brigade reservist, auditioned for 'The Next Star' with a moving performance dedicated to his comrades in the field.	https://www.israelnationalnews.com/news/401405	2024-12-27T04:23:44-08:00	
Watch: Harel Sharvit, killed in battle in Gaza, marked Hanukkah 2...	Exactly one year ago, Harel Sharvit celebrated Hanukkah 2023 in Gaza, singing 'Al Hanissim' beside the holiday lights. Watch.	https://www.israelnationalnews.com/news/401406	2024-12-27T04:23:02-08:00	
Minister Yitzhak Wasserlauf criticizes Attorney General	Minister of the Negev, Galilee, and National Resilience, Yitzhak Wasserlauf, harshly criticizes Attorney General Gali Baharav-Miara, accusing her of selective enforcement.	https://www.israelnationalnews.com/news/401402	2024-12-27T03:39:39-08:00	
Two injured after Hanukkah menorah ignites blaze	Fire breaks out in children's room due to Hanukkah menorah, father and daughter lightly injured due to smoke inhalation.	https://www.israelnationalnews.com/news/401401	2024-12-27T03:37:53-08:00	
Parshat Mikeitz: The Truest Wisdom is the Domain of the Torah	This week’s Parshah continues the story of Yosef, and his rising from the ashes of an Egyptian prison to the rank of Viceroy, second only to Pharaoh	https://www.israelnationalnews.com/news/401403	2024-12-27T03:25:24-08:00	
Hanukkah: The sacred protects itself	Rabbi Kook explains that Knesset Yisrael knows how to join heaven and earth.	https://www.israelnationalnews.com/news/401393	2024-12-27T03:22:00-08:00	
Bereaved Brother: 'We are heartbroken, Amit was out strength'	Brothers of fallen IDF soldier Amit Levi speak about the memories he left them and the lessons he wished to leave behind.	https://www.israelnationalnews.com/news/401399	2024-12-27T03:04:34-08:00	
IDF evacuates civilians near Kamal Adwan Hospital in Gaza	IDF, ISA, carry out intelligence-based operation targeting terror infrastructure and operatives near Jabaliya's Kamal Adwan Hospital.	https://www.israelnationalnews.com/news/401400	2024-12-27T03:03:51-08:00	
