Title	Description	Link	pubDate	Image
Should the NFL tolerate support for Hamas?	The 'My Cause My Cleat' program is a wonderful concept, but it must be limited to just causes - and the truth. Opinion.	https://www.israelnationalnews.com/news/401042	2024-12-19T20:00:00-08:00	
Sa'ar: We decided to put Ireland in the antisemitic corner	Foreign Minister Sa'ar meets dozens of influencers, opinion leaders, advocacy organizations, and experts: 'You can see from the statements in Ireland that they are under great pressure.'	https://www.israelnationalnews.com/news/401035	2024-12-19T19:39:37-08:00	
Putin: Israel is the main beneficiary of the situation in Syria	Russian President refutes claims that Russia's nine-year intervention in Syria was a failure, voices concerns about Israel's military activities in the region following the ousting of Assad.	https://www.israelnationalnews.com/news/401034	2024-12-19T19:16:32-08:00	
Abbas: A Palestinian state will bring security and stability to t...	PA chairman accuses Israel of carrying out daily massacres, genocide, starvation, and of attempts to expel Palestinian Arab residents.	https://www.israelnationalnews.com/news/401033	2024-12-19T18:52:12-08:00	
Blinken: Hamas knows the calvary’s not coming to the rescue	Secretary of State expresses optimism that a hostage release deal can be achieved. 'If Hamas really purports to care about the Palestinian people, they will say yes and do it now.'	https://www.israelnationalnews.com/news/401032	2024-12-19T18:25:21-08:00	
Podcast | The secret of clothing and the chronicles of Jacob: Yos...	Yaakov and Yosef: A lesson for all parents.	https://www.israelnationalnews.com/news/401030	2024-12-19T17:21:46-08:00	
House rejects GOP stopgap funding bill, shutdown looms	House of Representatives votes down GOP's temporary funding bill which replaced an earlier deal that had been criticized by Trump.	https://www.israelnationalnews.com/news/401031	2024-12-19T16:11:18-08:00	
US disagrees with HRW’s genocide accusations against Israel	State Department spokesperson says US disagrees with Human Rights Watch's claims that Israel's actions in the Gaza Strip amounted to 'acts of genocide'.	https://www.israelnationalnews.com/news/401029	2024-12-19T15:24:34-08:00	
Drama: IDF soldier forced to leave Sri Lanka over potential arres...	Soldier identified by pro-Palestinian Arab organizations in Sri Lanka, ordered by defense establishment to immediately return to Israel over concerns he would be arrested.	https://www.israelnationalnews.com/news/401028	2024-12-19T14:12:20-08:00	
Smotrich in Metula: We will continue to invest in the rehabilitat...	Finance Minister Bezalel Smotrich visits Metula with the leadership of the Finance Ministry: We are committed to a thorough reconstruction of the entire region.	https://www.israelnationalnews.com/news/401027	2024-12-19T13:45:22-08:00	
Rachashei Lev's new home for cancer-stricken children	Rachashei Lev completes renovation of Beit HaYeled for sick children and wounded soldiers.	https://www.israelnationalnews.com/news/401014	2024-12-19T13:27:04-08:00	
Herzog speaks to Trudeau after firebombing of Montreal synagogue	Israeli President tells Canadian PM that 'words would not suffice, and that firm and decisive action must be taken to bring the perpetrators to justice, to stamp out antisemitism' after syangogue firebombed for 2nd time since October 7.	https://www.israelnationalnews.com/news/401026	2024-12-19T12:53:42-08:00	
FBI foils massive terror attack on Israeli consulate in New York	The FBI arrested Abdullah Azz al-Din Hassan after he shared his plans with an undercover agent.	https://www.israelnationalnews.com/news/401024	2024-12-19T12:37:00-08:00	
The night before the massacre: The partial situational assessment...	An investigation into the night of the massacre found that IDF Chief of Staff Herzi Halevi did not order a full situational assessment despite understanding that something unusual was happening.	https://www.israelnationalnews.com/news/401023	2024-12-19T11:51:04-08:00	
IDF, ISA eliminate Iran-funded Tulkarm Terrorist Network leader	Over the past year, Tarek Doush recruited numerous terrorists, armed and funded by Iran and by Lebanese terror operatives with relations to the Maqdah family, to plan and execute terrorist attacks against Israelis.	https://www.israelnationalnews.com/news/401022	2024-12-19T11:45:40-08:00	
Yosef's two dreams	Selected commentaries explain why Joseph's brothers were angered by his dreams.	https://www.israelnationalnews.com/news/401025	2024-12-19T11:34:00-08:00	
Where do they need me?	The greatest test of Emunah is to make changes to one’s life when things are going well.	https://www.israelnationalnews.com/news/401021	2024-12-19T11:30:48-08:00	
Three guarantors	Three guarantors for the coming of Mashiach are alluded to in the three pieces of collateral that Yehudah gave to Tamar, the ancestress of the Mashiach.	https://www.israelnationalnews.com/news/401020	2024-12-19T11:24:00-08:00	
Estonian university cuts ties with Israeli institution, is rebuke...	Estonian officials, led by the country's Prime Minister, criticized the Estonian Academy of Arts after it canceled a workshop with a visiting Israeli professor.	https://www.israelnationalnews.com/news/401019	2024-12-19T11:13:16-08:00	
If only Israel had a government that thinks more like Daniel Penn...	And if only we had more Daniel Pennys in the USA. Op-ed.	https://www.israelnationalnews.com/news/401018	2024-12-19T11:12:44-08:00	
Living Jewish Art: The Work of Itshak Holtz by Richard McBee with...	The newly released book on Itshak Holtz (1925–2018) offers a profound and intimate exploration of Jewish life through the eyes of one of the most notable Jewish artists of the 20th century.	https://www.israelnationalnews.com/news/401011	2024-12-19T10:34:36-08:00	
UNGA passes resolution asking ICJ to force Israel to save UNRWA	Israel's Ambassador to the UN, Danny Danon says UN General Assembly 'clings to past' with pro-UNRWA resolution.	https://www.israelnationalnews.com/news/401017	2024-12-19T10:32:00-08:00	
Supreme Court to state: Why no provision for 'sufficient food' fo...	Court issues order on petition demanding that security prisoners and terrorists be provided with the same amount as food as other prisoners	https://www.israelnationalnews.com/news/401016	2024-12-19T10:26:45-08:00	
Houthi leader: 'We are in a state of war and open confrontation w...	Abdul-Malik al-Houthi warned international airlines not to return to flying to Israel and pledged: 'The Israeli bombing will not deter us from supporting Gaza.'	https://www.israelnationalnews.com/news/401015	2024-12-19T10:26:21-08:00	
Watch: IDF jets strike targets in Yemen	The IDF released footage of the extensive attack on Houthi targets in Yemen.	https://www.israelnationalnews.com/news/401013	2024-12-19T09:06:00-08:00	
Former Mossad agents to reveal Hezbollah beeper secrets for 1st t...	Israeli intelligence agents who participated in the operation to trick Hezbollah into purchasing the pagers that exploded in September will reveal new details of the operation in an interview on American media this Sunday.	https://www.israelnationalnews.com/news/401012	2024-12-19T08:48:59-08:00	
Help with the legal fees: Time running out for Israeli man impris...	If they do not somehow find a way to afford the legal fees, Nosson could spend the rest of his life wasting away in prison, and if the threats of his fellow prisoners are legitimate, the rest of his life may not be long.	https://www.israelnationalnews.com/news/401006	2024-12-19T08:45:31-08:00	
IDF estimates: Iran will attempt to increase terror in Judea and ...	IDF Central Command says it was instructed by the political echelon to strengthen the security coordination with the Palestinian Authority and its security forces.	https://www.israelnationalnews.com/news/401010	2024-12-19T08:42:33-08:00	
Paraguayan President: 'I want to raise my voice that we're going ...	President of Paraguay Santiago Peña spoke about his visit to Israel and his nation's connection to the Jewish state.	https://www.israelnationalnews.com/news/401009	2024-12-19T08:18:57-08:00	
How Biden was shielded during his presidency	Wall Street Journal report reveals how Biden's staff shielded him during his presidency, including fewer and shorter meetings with Cabinet members and lawmakers and preventing him from seeing negative news coverage.	https://www.israelnationalnews.com/news/401008	2024-12-19T08:15:02-08:00	
Suspected terror attack: 74-year-old women severely wounded in st...	The police are investigating a suspected terror attack after a 74-year-old woman was found in severe condition with stab wounds in a home in Jerusalem. The Shin Bet (ISA) is also involved in the investigation.	https://www.israelnationalnews.com/news/401007	2024-12-19T07:10:00-08:00	
Guterres: 'Israeli airstrikes are violations of Syria's sovereign...	UN Secretary-General Antonio Guterres called for Israel to stop striking strategic weapons and military infrastructure in Syria and called on both sides to respect the buffer zone.	https://www.israelnationalnews.com/news/401005	2024-12-19T07:01:03-08:00	
House Republicans find 'systemic' failure to address antisemitism...	42-page report finds 'disturbing' avoidance of disciplinary action against students who commit antisemitc crimes by schools like Columbia University, failure to pressure schools by the Biden Administration.	https://www.israelnationalnews.com/news/401004	2024-12-19T06:57:07-08:00	
Hezbollah artillery cannon, rocket launchers seized in Lebanon	The troops of the 300th Brigade combat team, under the command of the 146th Division, located a weapons storage facility during continued defensive activities to remove threats in southern Lebanon.	https://www.israelnationalnews.com/news/401003	2024-12-19T05:48:25-08:00	
Netanyahu: 'Houthis are learning and will learn that whoever hurt...	Israeli Prime Minister Benjamin Netanyahu spoke for the first time on Thursday about the airstrike overnight on Houthi targets in Yemen.	https://www.israelnationalnews.com/news/401002	2024-12-19T05:34:00-08:00	
Hebron Fund 2024 Campaign: Protecting Jewish Hebron and supportin...	In the historic city of Hebron, Jewish residents and Israel Defense Forces (IDF) soldiers stand on the front lines of safety and security in Israel.	https://www.israelnationalnews.com/news/400997	2024-12-19T05:14:36-08:00	
Four months later: IDF maps homes of terrorists who murdered Yeho...	IDF maps homes of three terrorists who participated in shooting attack, killing released soldier Yehonatan Deutsch at the Mehola Junction.	https://www.israelnationalnews.com/news/401001	2024-12-19T04:59:51-08:00	
Defense Minister: 'No appointments before investigation'	Defense Minister Israel Katz has set an ultimatum for Chief of Staff Herzi Halevi, stating he will not approve new generals in the IDF until investigation reports for October 7 are presented.	https://www.israelnationalnews.com/news/401000	2024-12-19T04:52:07-08:00	
Footage shows pilots taking off for Yemen strike	IDF publishes footage of IAF planes taking off for strike on Houthi targets in Yemen, as well as from the command center during the moments of the strike. Watch.	https://www.israelnationalnews.com/news/400999	2024-12-19T04:27:37-08:00	
Indictment filed: Resident of Nazareth passed information to Hezb...	Mohammed Sa'adi, 19 years old from Nazareth, reached out to Hezbollah asking to join their ranks as a fighter, offered Hezbollah-affiliated news outlet information, photos, and videos.	https://www.israelnationalnews.com/news/400998	2024-12-19T04:17:46-08:00	
Watch: 22 illegal Arab infiltrators arrested in Bnei Brak	Israel Police carry out operation aiming to prevent terror, criminal activity, arresting 27 Palestinian Authority Arab infiltrators.	https://www.israelnationalnews.com/news/400994	2024-12-19T03:25:01-08:00	
Wounded Soldier Speaks: 'I thought I would die, I felt sorry for ...	Lieutenant Yinon Granot, a tank officer seriously injured in Jabaliya, shares his journey of recovery and determination to be back in action.	https://www.israelnationalnews.com/news/400996	2024-12-19T02:48:06-08:00	
Interceptor fragment found outside Knesset building	Routine searches reveal two interceptor fragments outside Knesset building; no damage caused.	https://www.israelnationalnews.com/news/400995	2024-12-19T02:27:39-08:00	
New research reveals cognitive potential for individuals with Dow...	New findings by Bar-Ilan University researchers and collaborators pave the way for targeted interventions and educational programs to improve quality of life as life expectancy continues to rise.	https://www.israelnationalnews.com/news/400992	2024-12-19T01:57:21-08:00	
Report: New investigation accuses Israelis of instigating Amsterd...	A Washington Post article disputes claims of one-sided violence against Maccabi Tel Aviv fans in Amsterdam, citing footage showing that both sides engaged in aggression.	https://www.israelnationalnews.com/news/400991	2024-12-19T01:41:19-08:00	
Reservist imprisoned for leaking documents asks for pardon	The soldier accused of leaking classified information has asked that President Herzog pardon him.	https://www.israelnationalnews.com/news/400990	2024-12-19T01:05:27-08:00	
Hamas sources: Disagreements remain on two issues critical to pri...	Excellent' progress on ceasefire negotiations, only two key issues remain, Hamas sources tell Lebanon's Al-Akhbar.	https://www.israelnationalnews.com/news/400986	2024-12-19T01:04:11-08:00	
With toilet paper | Watch: Protest held outside home of justice w...	Im Tirtzu activists protest outside home of Supreme Court Justice Ruth Ronen, following Ronen's visit to Nukhba terrorists in Ofer Prison. 'Winter clothes for terrorists? What about the hostages?'	https://www.israelnationalnews.com/news/400988	2024-12-19T01:01:29-08:00	
Torah Scroll Inauguration for ZAKA's bereavement support unit	A poignant Torah scroll dedication event took place in Petah Tikva for ZAKA's bereavement support service. The scroll was dedicated with the participation of the Health Minister and in honor of the late Zohar family.	https://www.israelnationalnews.com/news/400989	2024-12-19T00:34:12-08:00	
Israel denounces Human Rights Watch report on Gaza water supply	The Foreign Ministry spokesman has published a rebuttal of several claims made by a recent report claiming that Israel is depriving Gazans of water.	https://www.israelnationalnews.com/news/400987	2024-12-19T00:02:52-08:00	
Smotrich on the IAF's strike on Houthis: 'Very good things were d...	Finance Minister Bezalel Smotrich prays at Kiryat Shmona yeshiva as its hundreds of students celebrate a return to their city, praises IAF strike on Houthi targets in Yemen.	https://www.israelnationalnews.com/news/400985	2024-12-18T23:56:46-08:00	
Hamas official: We're close to an agreement to end the war in Gaz...	Hamas official says agreement between Israel and Hamas is in the final stages, after the sides succeeded in reaching agreements on most of the issues causing disagreement.	https://www.israelnationalnews.com/news/400982	2024-12-18T23:45:58-08:00	
Cleared for publication: New details on the bombings in Yemen	The main objective of the IDF bombings last night in Yemen was to shut down all three ports controlled by the Houthis.	https://www.israelnationalnews.com/news/400984	2024-12-18T23:14:50-08:00	
The ancient source of Jewish resilience	Jewish resilience is incomparable, but when we understand who our ancestors were and the values they inculcated into us, we begin to understand where it comes from.	https://www.israelnationalnews.com/news/400983	2024-12-18T22:56:17-08:00	
How can we bring peace between rivals?	Parashat Vayeishev portrays the dilemma of Jacob and his rival sons.	https://www.israelnationalnews.com/news/400981	2024-12-18T22:26:11-08:00	
Search operation for unsolved cases in Meron region	A special search operation was held in northern Israel to locate five missing persons who have disappeared over the last five years.	https://www.israelnationalnews.com/news/400978	2024-12-18T22:23:59-08:00	
The impure sources of Redemption	First, how could the Mashiach be the product of a problematic union? Surely his ancestry has to be unblemished!	https://www.israelnationalnews.com/news/400980	2024-12-18T22:23:03-08:00	
Shrapnel from interceptor falls in Ramat Gan school, causing heav...	Ballistic missile launched from Yemen towards central Israel intercepted, fragments fall in Ramat Gan school, causing damage to the building and nearby vehicles.	https://www.israelnationalnews.com/news/400977	2024-12-18T22:05:00-08:00	
Watch: John Kirby recites moving prayer for the hostages	White House National Security Spokesperson John Kirby dons kippah before reciting the prayer for the hostages at the Israeli embassy.	https://www.israelnationalnews.com/news/400976	2024-12-18T21:21:00-08:00	
Miracles amid the challenges	While not minimizing the tragedies that caused and accompany this war, we must be grateful for the great miracles with which we have been blessed in such a short time period. Opinion.	https://www.israelnationalnews.com/news/400975	2024-12-18T21:06:25-08:00	
Blinken meets Marco Rubio, Trump's nominee for Secretary of State	State Department says the meeting between Blinken and Rubio was good, constructive, and substantive: We continue to stand ready to help support a seamless transition.	https://www.israelnationalnews.com/news/400974	2024-12-18T20:51:18-08:00	
After Assad: Recalibrating risks of an Israel-Iran nuclear war	Israel must be prepared for an Iranian nuclear conflict that is deliberate, unintentional or even accidental. Opinion.	https://www.israelnationalnews.com/news/400973	2024-12-18T20:44:05-08:00	
Why tackling the Iranian Regime should be on top of Trump's Admin...	If Trump's upcoming second term is to be deemed a successful one four years from now, a lot of that success will be measured on how his administration will firmly deal with the Iranian regime. Opinion.	https://www.israelnationalnews.com/news/400972	2024-12-18T20:33:20-08:00	
Vile antisemitic attack': Canadian politicians condemn Montreal ...	Canadian leaders condemn firebomb attack on Congregation Beth Tikvah in Montreal, the second time the synagogue has been attacked since October 7, 2023.	https://www.israelnationalnews.com/news/400971	2024-12-18T20:29:14-08:00	
Likud MK to Arutz Sheva: We need to act smartly, not hastily, on ...	MK Kathrin Shitrit criticizes behavior of Otzma Yehudit when it voted against the first reading of the budget: It only played into the hands of the opposition.	https://www.israelnationalnews.com/news/400970	2024-12-18T20:12:11-08:00	
A vision for a second Trump term	There are several items worthy of the new administration’s agenda that can solidify the advances made in the first Trump administration and further promote peace and security in the region. Op-ed.	https://www.israelnationalnews.com/news/400979	2024-12-18T20:10:00-08:00	
Syrian rebel leader: Syria is no longer a threat to the West, lif...	Ahmed Al-Sharaa, head of Hayat Tahrir al-Sham and de facto leader of Syria, says the country is exhausted by the ongoing war and is no longer a threat to its neighbors or to the West.	https://www.israelnationalnews.com/news/400969	2024-12-18T19:52:11-08:00	
Hagari on Yemen strikes: We will continue to act against anyone t...	IDF Spokesperson Daniel Hagari speaks about the strikes in Yemen: The Houthis have become a global threat, we will continue to act against anyone- anyone in the Middle East that threatens the State of Israel.	https://www.israelnationalnews.com/news/400968	2024-12-18T19:34:27-08:00	
Minister Kisch to Arutz Sheva: We will remain in Syria as long as...	Minister Yoav Kisch speaks to Arutz Sheva-Israel National News during a visit to Sheba Hospital: The price paid by the wounded and the bereaved families is not in vain.	https://www.israelnationalnews.com/news/400967	2024-12-18T18:48:15-08:00	
Supreme Court agrees to hear TikTok's appeal against US ban	US Supreme Court decides to take up TikTok's appeal against a law that would compel its Chinese parent company to divest from the platform or face its shutdown in the United States. Oral arguments are set for January 10.	https://www.israelnationalnews.com/news/400966	2024-12-18T18:26:22-08:00	
US sanctions Iranian drone companies	US Treasury Department sanctions two individuals and two entities for their involvement in developing and purchasing components for the Iran Revolutionary Guard Corps.	https://www.israelnationalnews.com/news/400965	2024-12-18T17:43:11-08:00	
MK Avichay Buaron: It is impossible to end the war without destro...	Likud MK Avichay Buaron expresses his position on the proposed hostage release deal: The fundamental understanding is that the hostage deal cannot be tied to the destruction of Hamas.	https://www.israelnationalnews.com/news/400964	2024-12-18T17:19:27-08:00	
Sirens in central Israel, missile from Yemen intercepted before c...	Sirens sounded in Tel Aviv and many other towns in central Israel following a missile launch from Yemen. Residents report hearing explosions. IDF says the missile was intercepted before it crossed into Israeli territory.	https://www.israelnationalnews.com/news/400963	2024-12-18T16:50:00-08:00	
European powers: No justification for Iran's uranium enrichment	Britain, France, and Germany accuse Iran of amassing high enriched uranium to 'unprecedented levels' without 'any credible civilian justification'.	https://www.israelnationalnews.com/news/400962	2024-12-18T16:07:13-08:00	
Trump slams agreement to prevent government shutdown	President-elect Trump and Vice President-elect Vance criticize the agreement brokered by House Speaker Mike Johnson, which was meant to avert a shutdown and keep federal operations running until March 14.	https://www.israelnationalnews.com/news/400961	2024-12-18T15:14:39-08:00	
Smotrich warns: Releasing hundreds of terrorists will rehabilitat...	Minister Bezalel Smotrich explains his opposition to the hostage release deal in its current form: 'Releasing hundreds of terrorists who will rehabilitate Hamas' leadership is very bad.'	https://www.israelnationalnews.com/news/400960	2024-12-18T14:23:05-08:00	
Blinken: Saudis are even more convinced now of the need for a Pal...	US Secretary of State tells Foreign Affairs magazine that Hamas has been more productive on getting a ceasefire and hostage release deal done 'because they’ve seen that the cavalry is not coming to the rescue.'	https://www.israelnationalnews.com/news/400959	2024-12-18T13:41:24-08:00	
Erdoğan: 'Turkey is bigger than Turkey, we can't limit ourselves'	Turkish President Recep Tayyip Erdoğan said that history assigned Turkey a mission to expand its borders.	https://www.israelnationalnews.com/news/400958	2024-12-18T12:34:27-08:00	
Be'er Sheva fears violent revenge by Sakhnin	After the last game between the two was canceled due to a violent incident between fans, Hapoel Be'er Sheva will face Sakhnin again and fears reprisal by the Arab team's fans.	https://www.israelnationalnews.com/news/400957	2024-12-18T11:39:11-08:00	
Hamas keeps fooling the media because they want to be fooled	The idea that maybe things Hamas says should not be instantly believed in their entirety never occurrs to the people who are supposed to value the truth. Op-ed.	https://www.israelnationalnews.com/news/400956	2024-12-18T11:31:04-08:00	
BBC's pro-Palestinian study	BBC claims that since the onset of the war, Facebook has limited the ability of Palestinian news outlets to reach their audience.	https://www.israelnationalnews.com/news/400955	2024-12-18T11:06:09-08:00	
Congressional press conference calls for release of hostages	Hostage family members and female leaders of the US Bipartisan Women’s Caucus hold joint press conference urging the immediate Release of All Hostages.	https://www.israelnationalnews.com/news/400954	2024-12-18T11:04:28-08:00	
Minister Chikli: 'Kurdistan must be granted independence and Turk...	Diaspora Affairs and Combating Antisemitism Minister Amichai Chikli calls for recognition of Kurdish independence, consequences for Erdogan as Turkish and Turkish-backed forces threaten Kurdish areas of northern Syria.	https://www.israelnationalnews.com/news/400953	2024-12-18T10:35:49-08:00	
Danon to Iranian people: Don't miss historic opportunity, People ...	Israeli Amb. to the UN Danny Danon tells UN Security Council the time to act is now to 'prevent a nuclear Iran and define the Revolutionary Guards as a terrorist organization.'	https://www.israelnationalnews.com/news/400952	2024-12-18T10:09:19-08:00	
Chief of Staff in Rafah: 'We're pressuring Hamas every day to ret...	IDF Chief of Staff Herzi Halevi holds situational assessment in Gaza, says communities near Gaza are 'coming back to life.'	https://www.israelnationalnews.com/news/400951	2024-12-18T09:55:37-08:00	
Yesh Atid to permanently cover Gallant's absence in Knesset votes	Yesh Atid sees that Gallant getting closer to its ranks serves it politically. 'When there's a chance of the government falling - Gallant will participate fully.'	https://www.israelnationalnews.com/news/400950	2024-12-18T09:53:06-08:00	
Mayor Adams at Hanukkah party: 'I'm a modern-day Maccabee'	New York City Mayor Eric Adams hosted hundreds of Jewish New Yorkers at his residence for a pre-Hanukkah celebration that featured kosher food and celebrity guests.	https://www.israelnationalnews.com/news/400949	2024-12-18T09:35:00-08:00	
Iranian rial sinks to lowest level ever following Trump's victory	Rial loses 10% of its value as Iran braces for the return of American pressure after the reelection of Donald Trump.	https://www.israelnationalnews.com/news/400948	2024-12-18T09:23:48-08:00	
