Title	Description	Link	pubDate	Image
Ted Cruz: 'Antisemitic protests at universities will end next yea...	Texas Senator says once Republicans take power on January 20, those who commit acts of antisemitism on college campuses will begin to face consequences, including arrest and deportation.	https://www.israelnationalnews.com/news/401130	2024-12-22T09:04:00-08:00	
IDF preparing northern Israel for civilian life	Engineering teams have been dispatched to remove waste, ordnance, and military equipment before civilians return home.	https://www.israelnationalnews.com/news/401128	2024-12-22T08:28:00-08:00	
Netanyahu: 'Gantz, who can't help, should at least not hurt'	Prime Minister Netanyahu's staff have denounced the accusations that he is deliberately hampering a hostage deal.	https://www.israelnationalnews.com/news/401125	2024-12-22T08:02:40-08:00	
From Syria with hate	If you’re a clever Islamist, you’ll assume a moderate, even ‘progressive’ vocabulary. You’ll talk about bringing back peace and social justice. You might even force yourself to pronounce the name ‘Israel’ and declare that the Jews have nothing to fear. Opinion.	https://www.israelnationalnews.com/news/401127	2024-12-22T07:55:34-08:00	
Netanyahu: As we acted strongly against Iran's proxies, so we wil...	PM convenes Security Cabinet at the northern border, says the 'result will be the same' against the Houthis as against Hamas and Hezbollah.	https://www.israelnationalnews.com/news/401126	2024-12-22T07:53:00-08:00	
Jewish leaders call to boycott NY school association	The call follows extensive antisemitism at an annual conference of approximately 8000 people. The association has since issued an apology.	https://www.israelnationalnews.com/news/401123	2024-12-22T07:29:42-08:00	
Bill barring teachers who studied in PA from teaching in Israel a...	Ministerial Committee for Legislation advances bill barring teachers who got their degrees in the PA despite opposition for Attorney General.	https://www.israelnationalnews.com/news/401124	2024-12-22T07:18:16-08:00	
Benny Gantz: 'Netanyahu is intentionally hampering a hostage deal...	National Unity leader Benny Gantz criticized the Prime Minister as trying to prevent a hostage deal for political reasons.	https://www.israelnationalnews.com/news/401121	2024-12-22T06:27:04-08:00	
Report: Iran facing deep energy crisis, blackouts	Israeli attacks on Iranian gas pipelines nearly a year ago partially to blame for serious energy crisis plaguing Iran, along with mismanagement and sanctions, according to New York Times report.	https://www.israelnationalnews.com/news/401122	2024-12-22T06:26:43-08:00	
Khamenei claims: 'The Islamic Republic doesn’t have proxy forces'	In a long rant on X, Iranian Supreme Leader Ali Khamenei attacked the US and Israel for their involvement in Syria and claimed: 'You Zionists haven’t won; you’ve been defeated.'	https://www.israelnationalnews.com/news/401120	2024-12-22T05:00:20-08:00	
Prisoner of Zion Eduard Kuznetsov passes away at age 85	Prisoner of Zion Eduard Kuznetsov was sentenced to death in the USSR after he planned to hijack an empty plane and land it in Sweden. His sentence was commuted and in 1979 he was released and immigrated to Israel.	https://www.israelnationalnews.com/news/401119	2024-12-22T04:49:42-08:00	
Comparing hostages, 1981 and now	One of the greatest differences between the coverage of the hostages held in Iran 45 years ago for 444 days and of the hostages in Gaza today is that no one was on Iran's side then, while many are on Hamas's side today. Tomorrow marks day 444 for hostages in Gaza.	https://www.israelnationalnews.com/news/401118	2024-12-22T04:02:11-08:00	
Kfir Brigade begins operating west of Beit Hanoun	After completing operations in Beit Lahia, the Kfir Brigade combat team, under the command of the 162nd Division, began operating in the area west of Beit Hanoun based on intelligence indicating the presence of terrorists in the area.	https://www.israelnationalnews.com/news/401117	2024-12-22T03:53:22-08:00	
Watch: IDF destroys Hezbollah long-term terrorist hideout	IDF's 188th Brigade locates and destroys Hezbollah long-term hideout facility with weapons storages.	https://www.israelnationalnews.com/news/401116	2024-12-22T03:14:35-08:00	
Israel considering travel warning for Egypt	The Israeli defense establishment notified Egypt of intelligence regarding Iranian attempts to carry out attacks on Israelis on Egyptian soil.	https://www.israelnationalnews.com/news/401115	2024-12-22T03:02:17-08:00	
Defense Minister in Lebanon: 'If Hezbollah breaches ceasefire, we...	Defense Minister Israel Katz visited southern Lebanon in preparation for the next stages of implementing the ceasefire agreement. 'We have hit Hezbollah with unprecedented strength. We have removed the fangs of the snake.'	https://www.israelnationalnews.com/news/401113	2024-12-22T02:34:00-08:00	
During the war: Millions of Israelis enlisted; donations arrived ...	New data reveals extensive solidarity and unprecedented volunteering across all sectors of society during the war.	https://www.israelnationalnews.com/news/401111	2024-12-22T02:07:00-08:00	
50 years later: Part of crashed IDF helicopter found on Mt. Hermo...	IDF soldiers found the rotor of Super Hornet 017, which crashed on the slopes of Mt. Hermon in 1974, shortly before the area was relinquished to the Syrians.	https://www.israelnationalnews.com/news/401112	2024-12-22T02:02:40-08:00	
Arabs from Jerusalem charged with assisting Hezbollah	Two Arabs from Jerusalem were charged with being in contact with a Hezbollah operative and giving her information, including photos from the Caesarea area.	https://www.israelnationalnews.com/news/401110	2024-12-22T01:18:09-08:00	
Avoid expensive roaming fees while traveling internationally	Avoiding expensive roaming fees while traveling internationally requires a combination of planning, research, and leveraging technology. Check the options here.	https://www.israelnationalnews.com/news/401109	2024-12-22T00:59:25-08:00	
Ukraine: Body of Jewish soldier located after more than six month...	More than six months after his sudden disappearance in the Ukraine war, the body of soldier David Strauber was located.	https://www.israelnationalnews.com/news/401107	2024-12-22T00:32:00-08:00	
Prof. Aumann: Hostage families' campaign only raises their price	Prof. Robert Aumann expressed anger over the campaign by the families of the hostages, called to embrace them but not to agree to all deals, and wants to see Jews returning to settle Gaza.	https://www.israelnationalnews.com/news/401106	2024-12-22T00:27:25-08:00	
Senior government official: The hostage deal is partial - unclear...	A senior political official sent messages to the families of hostages who are not expected to be included in the first round of the deal saying there is no guarantee that it will continue to the next round.	https://www.israelnationalnews.com/news/401105	2024-12-21T23:27:53-08:00	
IDF Spokesman participates in Hassidic event	Thousands of participants filled the Beit Menachem Synagogue in Kfar Chabad last week at the celebration marking the 19th of Kislev.	https://www.israelnationalnews.com/news/401104	2024-12-21T22:15:20-08:00	
Mystery in Ashdod: Where is David Kilberg?	The 83-year-old man disappeared from his home on December 18th and has not been heard from since.	https://www.israelnationalnews.com/news/401103	2024-12-21T22:12:59-08:00	
The Al Aqsa Flood and the Olive Branch	When Hamas named their godless day of live-streamed murder 'Temple Mount Flood,' the name they chose accidentally contains a whole essay on why, and how profoundly, they are going to lose. Op-ed.	https://www.israelnationalnews.com/news/401101	2024-12-21T21:42:55-08:00	
Prominent rebel figure appointed Syrian defense minister	Syria's new leadership appoints Murhaf Abu Qasra, a prominent figure in Hayat Tahrir Al-Sham, as defense minister in the interim government.	https://www.israelnationalnews.com/news/401100	2024-12-21T20:58:05-08:00	
US Navy pilots shot down in Red Sea friendly fire incident amid H...	US military says two Navy pilots were shot down over the Red Sea. Both pilots ejected from their aircraft and were recovered alive.	https://www.israelnationalnews.com/news/401099	2024-12-21T20:41:00-08:00	
Who in the US can stand strong against Iran's regime?	I believe that Tulsi Gabbard for DNI is the right person for the daunting job. Opinion.	https://www.israelnationalnews.com/news/401102	2024-12-21T20:30:00-08:00	
French court issues heavy sentences in beheading of teacher	French court delivers severe sentences to several individuals found guilty of involvement in beheading of schoolteacher Samuel Paty after he showed cartoons of the Prophet Mohammed in class.	https://www.israelnationalnews.com/news/401098	2024-12-21T20:07:10-08:00	
Amnesty criticizes Hezbollah over rocket fire on Israel	Amnesty International criticizes Hezbollah for launching unguided rocket salvos at civilian areas in Israel during the recent conflict.	https://www.israelnationalnews.com/news/401097	2024-12-21T19:16:45-08:00	
US approves sale of military equipment to Egypt, despite human ri...	State Department notifies Congress it approved the sale of $4.69 billion worth of equipment to Egypt.	https://www.israelnationalnews.com/news/401096	2024-12-21T18:29:23-08:00	
US judge rules against Israeli firm NSO Group	US judge rules favor of WhatsApp in a lawsuit accusing Israel's NSO Group of exploiting a vulnerability in the messaging app to deploy spyware.	https://www.israelnationalnews.com/news/401095	2024-12-21T17:45:20-08:00	
PA official: Talks on ceasefire deal are 90% complete	Palestinian Arab official tells BBC that if solution is found to unresolved issues, the parties could agree on a three-stage ceasefire within days.	https://www.israelnationalnews.com/news/401094	2024-12-21T17:02:08-08:00	
Trump's daughter-in-law will not seek to replace Rubio in Senate	Lara Trump announces she is removing her name from consideration for US Senate seat in Florida which is expected to become available.	https://www.israelnationalnews.com/news/401093	2024-12-21T16:14:44-08:00	
Iran protests US arrests of Iranian citizens	Iran summons Swiss ambassador in Tehran, who represents US interests in the country, to protest arrest of two Iranian nationals in connection with attack on US troops in Jordan.	https://www.israelnationalnews.com/news/401092	2024-12-21T15:11:15-08:00	
Slovenia calls to disqualify Israel from Eurovision 2025	Slovenia broadcasting corporation pens official letter asking that Israel be disqualified from the 2025 Eurovision Song Contest.	https://www.israelnationalnews.com/news/401091	2024-12-21T14:13:10-08:00	
Two dead, one seriously injured on Route 772	A 25-year-old man and woman were killed in a collision between two vehicles on route 772. Another woman in her 30s was seriously injured.	https://www.israelnationalnews.com/news/401090	2024-12-21T14:12:26-08:00	
Hamas passes Israel list of terrorists to be freed in prisoner sw...	Israel presents Hamas with a list of 34 hostages to be released in the first stage of a deal, 'including 11 who do not meet the criteria. Hamas agreed - in exchange for special compensation.'	https://www.israelnationalnews.com/news/401089	2024-12-21T13:37:12-08:00	
Foreign Ministry to Pope Francis: 'Cruelty is holding 100 hostage...	Pope Francis claims Israel's war against the Hamas terror group is 'cruelty, not war'; Israeli Foreign Ministry slams back: 'Israel makes extraordinary efforts to prevent harm to innocents, enough with the double standards and the singling out of the Jewish state and its people.'	https://www.israelnationalnews.com/news/401088	2024-12-21T13:03:01-08:00	
TV host fired for being pro-Israel visits Nir Oz	Erin Molan, a pro-Israel host who was fired by Sky News Australia, recently visited Nir Oz - one of the towns targeted by the Hamas invasion, which killed nearly a quarter of its population.	https://www.israelnationalnews.com/news/401087	2024-12-21T12:37:00-08:00	
Report: Strike in Sana'a, Yemen	Yemeni TV channel reports strike in Sana'a, capital of Yemen; it is unclear who is behind the attack.	https://www.israelnationalnews.com/news/401086	2024-12-21T12:17:00-08:00	
An Innocent Mistake:' IDF invites family of hostages to ceremony...	The parents of Nimrod Cohen, a missing soldier, received an invitation for a bereaved families' event despite several signs of life from their son.	https://www.israelnationalnews.com/news/401085	2024-12-21T12:16:29-08:00	
UC agrees to Department of Education's resolution for campus anti...	Department of Ed resolves Title VI antisemitism complaints against 5 U of California campuses, U of Cincinnati.	https://www.israelnationalnews.com/news/401084	2024-12-21T12:03:49-08:00	
Hostages' families: We demand a deal that will ensure the return ...	Families of hostages oppose partial deal, stress, 'We demand a deal that leaves no one behind!'	https://www.israelnationalnews.com/news/401083	2024-12-21T11:21:26-08:00	
The Jewish heart is beating stronger than ever	No, we have not betrayed our mission: Yehudah, Tamar and a Hanukkah Drama.	https://www.israelnationalnews.com/news/401082	2024-12-21T11:02:47-08:00	
Chief Rabbis: 'President must pardon soldier arrested for leaking...	The Chief Rabbis of Israel, Rabbi David Yosef and Rabbi Kalman Ber, have asked President Herzog to pardon the soldier who leaked classified documents to PM's spokesman Eli Feldstein.	https://www.israelnationalnews.com/news/401080	2024-12-21T11:01:15-08:00	
Ballistic missile strike: Sirens sounded ten minutes after launch	At 3:34 a.m. the Houthis in Yemen fired a ballistic missile; sirens sounded only at 3:44 a.m. When that happened, the missile had already exploded in Jaffa, causing great damage.	https://www.israelnationalnews.com/news/401081	2024-12-21T10:54:00-08:00	
Diplomatic source: Archterrorist Marwan Barghouti won't be releas...	Head of Fatah's Tanzim group says archterrorist Marwan Barghouti at top of Hamas' list of terrorists to be freed in a prisoner swap deal; diplomatic source says Barghouti won't be freed.	https://www.israelnationalnews.com/news/401077	2024-12-21T10:51:33-08:00	
Our G-d	Though Hashem created all human beings in His image, He chose us as His children.	https://www.israelnationalnews.com/news/401079	2024-12-21T10:42:29-08:00	
The Sunnis can smell blood	Middle East scholar Mordechai Kedar lays out the opportunities developing in Syria and the potential Sunni wave that may topple Iran—with Israeli help.	https://www.israelnationalnews.com/news/401078	2024-12-21T10:13:06-08:00	
160 children rescued from Lev Tahor cult compound	Guatemalan police raided the Lev Tahor cult compound on Friday due to allegations of abuse, human trafficking, and rape, and rescued 160 children and 40 women. Authorities are investigating the bodies of children found nearby.	https://www.israelnationalnews.com/news/401076	2024-12-21T10:01:28-08:00	
Man faints, dies, following siren in central Israel	Binyamin Bleacher, 68, faints during siren in central Israel, suffers cardiac arrest shortly thereafter.	https://www.israelnationalnews.com/news/401075	2024-12-21T09:32:51-08:00	
Arab report: 'Cautious optimism' for ceasefire deal	Negotiators for ceasefire-prisoner swap deal between Israel and the Hamas terror group report 'significant progress' in reaching two-stage deal, Lebanese outlet reports.	https://www.israelnationalnews.com/news/401073	2024-12-21T09:31:24-08:00	
Netanyahu: 'I will not agree to a deal that will end the war'	Netanyahu said he would not agree to end the war before eliminating Hamas. 'We will not leave them in power in Gaza, 50 kilometers from Tel Aviv. It will not happen.'	https://www.israelnationalnews.com/news/401074	2024-12-21T09:08:00-08:00	
Blaming 'ethnic Jews': Putin claims the church is 'being tortured...	Vladimir Putin accuses ‘ethnic Jews’ of tearing apart the Russian Orthodox Church. 'They're godless people, ethnic Jews, but has anyone seen them in a synagogue? I don't think so.'	https://www.israelnationalnews.com/news/401072	2024-12-21T08:17:10-08:00	
Elon Musk interfering in German elections?	Elon Musk endorses far-right German party: ‘Only the AfD can save Germany.’	https://www.israelnationalnews.com/news/401071	2024-12-21T07:59:55-08:00	
Ballistic missile from Yemen explodes in Jaffa, 16 injured	Millions of Israelis raced Saturday morning to bomb shelters as sirens sounded in central Israel. Sixteen people were lightly injured after the Houthi-launched ballistic missile exploded in Jaffa.	https://www.israelnationalnews.com/news/401070	2024-12-21T07:25:00-08:00	
Sweden to cease funding to UNRWA	Sweden says it will cease funding the UN 'Palestinian refugee' agency, cites difficulties from Israeli decision to bar the agency.	https://www.israelnationalnews.com/news/401069	2024-12-20T12:39:06-08:00	
Talks on hostage deal: Israel demands that 'heavy' freed terroris...	Sources with knowledge of the details say Israel has demanded that 'heavy' terrorist prisoners who would be released as part of the upcoming hostage release deal be expelled abroad, rather than be transferred to Judea and Samaria.	https://www.israelnationalnews.com/news/401068	2024-12-20T12:11:22-08:00	
Report: Signs of life received from several hostages	Channel 12 News reports that several families of hostages being held in the Gaza Strip recently received signs of life from their loved ones, after a lengthy period during which almost no such signs were received.	https://www.israelnationalnews.com/news/401067	2024-12-20T11:46:05-08:00	
Germany: At least 20 hurt as car drives into Christmas market	Car drives into group of people at a Christmas market in the eastern German city of Magdeburg, injuring at least 20. Driver reportedly arrested.	https://www.israelnationalnews.com/news/401066	2024-12-20T11:20:00-08:00	
IDF to demolish homes of two terrorists	IDF announces intention to demolish homes of terrorist who murdered Staff Sergeant Geri Gideon Hanghal as well as of terrorist who murdered Sergeant First Class (res.) Elhanan Klein.	https://www.israelnationalnews.com/news/401065	2024-12-20T11:15:10-08:00	
US lifts bounty on leader of Syrian rebels	Top US diplomat for the Middle East meets Syria's de facto leader Ahmed Al-Sharaa, tells him that Washington would no longer pursue a reward for his arrest.	https://www.israelnationalnews.com/news/401064	2024-12-20T10:47:00-08:00	
Shots fired at Toronto Jewish girls' school, for the third time i...	Shots fired at Bais Chaya Mushka Elementary School around 2:30 a.m. No injuries reported. Toronto's Integrated Gun and Gang Task Force is leading the investigation, with support from the Hate Crime Unit.	https://www.israelnationalnews.com/news/401063	2024-12-20T10:08:28-08:00	
The Saving of Yosef, and Reuvain's Purity of Heart	This week’s Parshah contains the unfortunate saga of Yosef and his brothers–Yosef	https://www.israelnationalnews.com/news/401062	2024-12-20T06:16:16-08:00	
Poll shows Likud losing support	A recent survey indicates a shift in political support, with the coalition under Netanyahu weakening.	https://www.israelnationalnews.com/news/401060	2024-12-20T06:03:58-08:00	
Israel Ganz in the US: 'The Jewish people look forward to the Tru...	Binyamin Regional Governor and Yesha Council Chairman Israel Ganz is currently US and has been meeting with senior US officials to promote the future of Judea and Samaria.	https://www.israelnationalnews.com/news/401061	2024-12-20T05:39:53-08:00	
IDF destroys three 7.5 km long tunnels in Gaza	In one of the tunnel routes, IDF equipment that had been captured by Hamas terrorists on October 7th was discovered, along with maps of Israeli communities near the Gaza Strip, weapons, and living quarters.	https://www.israelnationalnews.com/news/401059	2024-12-20T05:11:31-08:00	
Families of hostages: 'Not in a month - now!'	Families of the hostages have urged both the Trump and Biden administrations, as well as the Israeli government, not to wait for Trump's inauguration to secure a prisoner exchange deal.	https://www.israelnationalnews.com/news/401058	2024-12-20T04:54:46-08:00	
In Depth: The leaked documents scandal	Israeli media has been filled over the past weeks with reports about a soldier who leaked classified information. What happened - and what might it mean for Israel's security?	https://www.israelnationalnews.com/news/401057	2024-12-20T04:35:00-08:00	
Mother of hostage: 'National unity is my obligation to my daughte...	Meirav Leshem Gonen, mother of hostage Romi, tells Arutz Sheva about her work trying to bridge the gaps in the approaches to hostage negotiations.	https://www.israelnationalnews.com/news/401046	2024-12-20T04:01:29-08:00	
Eastern Jerusalem resident arrested in stabbing of 74-year-old wo...	Suspicion that home invasion and stabbing that left an elderly woman in serious condition had nationalist motives grows.	https://www.israelnationalnews.com/news/401056	2024-12-20T03:15:46-08:00	
Diaspora Minister to Pope: 'Clarify your stand on genocide blood ...	Diaspora Minister Amichai Chikli wrote to the Pope to demand an explanation of the Pope's support for the Palestinian narrative.	https://www.israelnationalnews.com/news/401053	2024-12-20T03:09:58-08:00	
Vayeishev: The special teshuvah of Reuben	After repairing his soul, Reuben returned and looked at the pit.	https://www.israelnationalnews.com/news/401055	2024-12-20T03:06:00-08:00	
Netanyahu won't fly to Poland for 80th anniversary of Auschwitz l...	Israeli PM reportedly to skip events in Poland marking the 80th anniversary of the Auschwitz death camp due to concerns he will be arrested in accordance with the ICC warrants against him.	https://www.israelnationalnews.com/news/401054	2024-12-20T02:42:57-08:00	
Street where Lubavitcher Rebbe lived to renamed for him	NY City Council votes to rename one block of President Street in Brooklyn will be renamed 'Lubavitcher Rebbe Way.'	https://www.israelnationalnews.com/news/401052	2024-12-20T01:27:46-08:00	
Jerusalem resident chargedwith spying for Iran	Suspect charged with documenting targets for Iran, including attempting to determine the identities of the residents of buildings, and with attempting to purchase weapons.	https://www.israelnationalnews.com/news/401051	2024-12-20T01:13:43-08:00	
Vayeishev: Joseph's complete trust in God	Everyone knows the wounds of their own heart, and everyone knows in what places they must strive to become stronger to completely trust in God.	https://www.israelnationalnews.com/news/401050	2024-12-20T01:05:00-08:00	
Palestinine trafficking (Parts 2 and 3)	Palestinine is a powerful hallucinogen available on the web. A primer in three parts.	https://www.israelnationalnews.com/news/401048	2024-12-20T00:21:29-08:00	
Can You Hear Me? Powerful social experiment in New York highlight...	Visionary filmmaker Jonathan Dekel created an underground experiment to see if he could make people care about the 100 people who are held hostage underground in Hamas tunnels, 7 of whom are Americans.	https://www.israelnationalnews.com/news/401047	2024-12-20T00:01:05-08:00	
Wounded Reservist: 'It is hard to believe I am now a wounded sold...	Reservist fighter Sagi Mazar shares his story of being injured in southern Lebanon and his road to recovery.	https://www.israelnationalnews.com/news/401043	2024-12-19T23:37:48-08:00	
Singer Eliezer Botzer suddenly passes away at 43	Minister Amichai Eliyahu eulogized Botzer as 'my dear brother' after his unexpected passing Friday morning.	https://www.israelnationalnews.com/news/401045	2024-12-19T23:01:14-08:00	
Meta’s Oversight Board is stacking the decks against Zionism	The reality is that in 2018 Meta – which owns Facebook and Instagram - handed over content decisions to an unelected Oversight Board that it cannot fire. Read on.	https://www.israelnationalnews.com/news/401049	2024-12-19T23:00:00-08:00	
Liberman: 'I'll join coalition if there is universal conscription...	Yisrael Beyteny chairman details his conditions for joining the coalition, says Netanyahu may quietly make agreements on a Palestinian state and catch coalition members off guard.	https://www.israelnationalnews.com/news/401044	2024-12-19T22:37:29-08:00	
Sudden and extreme changes	Something big is happening now in our world; changes which are on a Biblical scale.	https://www.israelnationalnews.com/news/401041	2024-12-19T21:44:15-08:00	
Pentagon acknowledges doubling US forces in Syria amid fight agai...	Pentagon press secretary acknowledges the US has quietly more than doubled its troop presence in Syria to combat ISIS. Approximately 2,000 US forces are now stationed there.	https://www.israelnationalnews.com/news/401040	2024-12-19T21:30:14-08:00	
The diplomatic crisis between Israel and Ireland	The venomous Irish campaign of demonization reserved uniquely for the Jewish state has long been on eye-watering display.	https://www.israelnationalnews.com/news/401039	2024-12-19T20:59:44-08:00	
Arizona man indicted for antisemitic threats against New Yorkers	Donovan Hall, 34, of Mesa, indicted for making threatening phone calls laced with antisemitic language and sending text messages featuring violent imagery to multiple victims.	https://www.israelnationalnews.com/news/401038	2024-12-19T20:57:17-08:00	
Photos: IAF prepares and takes off for attack in Yemen	IDF releases photos from the preparation and deployment of Israel Air Force troops ahead of Thursday’s attack in Yemen.	https://www.israelnationalnews.com/news/401037	2024-12-19T20:29:45-08:00	
US imposes sanctions targeting Houthis and Iranian oil network	US Treasury Department announces sanctions against 19 individuals, companies, and vessels accused of involvement in Houthi operations and the illegal trade of Iranian oil and gas.	https://www.israelnationalnews.com/news/401036	2024-12-19T20:13:13-08:00	
