Title	Description	Link	pubDate	Image
President Herzog: 'We must act with all our might to secure a hos...	President Isaac Herzog lit Hanukkah candles with injured veterans and IDF soldiers and called on the government to finalize a hostage deal: 'This is your duty. This is your responsibility. You have my full support!'	https://www.israelnationalnews.com/news/401306	2024-12-25T10:32:44-08:00	
Badly wounded soldier lights Hanukkah candle with Dr. who saved h...	At Assuta Hospital in Ashdod, Noam Levy lit a Hanukkah candle in the nursery alongside the doctor who treated him in the field.	https://www.israelnationalnews.com/news/401305	2024-12-25T10:17:14-08:00	
Miketz: Rejoicing in another's happiness	Pity comes naturally; sympathy doesn't.	https://www.israelnationalnews.com/news/401304	2024-12-25T10:12:00-08:00	
A non-Jewish perspective on 'People Love Dead Jews'	Jewish power presents a theological and ideological dilemma for many Westerners. Opinion.	https://www.israelnationalnews.com/news/401303	2024-12-25T09:47:31-08:00	
Watch: DJ Raphi's new song - Tamid Ohev Oti	DJ Raphi releases new song and dance to coincide with the beginning of the Hanukkah holiday and to provide light in dark times.	https://www.israelnationalnews.com/news/401302	2024-12-25T08:57:20-08:00	
Gush Etzion: One moderately wounded in ramming attack	Security forces are in pursuit of the terrorist who fled the scene.	https://www.israelnationalnews.com/news/401301	2024-12-25T08:52:00-08:00	
85,000 Hezbollah weapons seized in southern Lebanon since October	Since the beginning of the ground operation in southern Lebanon, the IDF has confiscated over 85,000 weapons, missiles, and military items, including rocket launchers, anti-tank missiles, RPGs, rifles, explosives, munitions, anti-aircraft missiles, observation devices, and military vehicles.	https://www.israelnationalnews.com/news/401300	2024-12-25T08:24:00-08:00	
UAV from Yemen lands near Ashkelon	A UAV launched by the Houthi terrorist rebels in Yemen set off sirens on Wednesday evening in the Ashkelon area. The aircraft crashed in an open area and no one was injured.	https://www.israelnationalnews.com/news/401299	2024-12-25T08:17:57-08:00	
Chief of Staff: 'Forces were searching for hostages in Rafah befo...	IDF Chief of Staff Herzi Halevi spoke at the 189th IAF Pilots Course Graduation Ceremony and praised the IAF's accomplishments during the war.	https://www.israelnationalnews.com/news/401298	2024-12-25T08:10:39-08:00	
Chief Rabbi: 'It is permitted and even required to release terror...	Israel's Sephardic Chief Rabbi David Yosef noted that while he does not know all the details of the negotiations, he is sure that Israel must release terrorists, even those who murdered Jews, in exchange for the hostages.	https://www.israelnationalnews.com/news/401297	2024-12-25T07:57:54-08:00	
For fear of terror attack: Hostage families event in Tel Aviv eva...	The police have decided to evacuate a Hanukkah candle-lighting event held by family members of hostages across from the IDF headquarters in Tel Aviv due to a fear of a security incident.	https://www.israelnationalnews.com/news/401296	2024-12-25T07:46:16-08:00	
Help the Brands: How can an Israeli family survive in these condi...	With seven children, they’ve faced challenges, but nothing could prepare them for the state they’re in now.	https://www.israelnationalnews.com/news/401290	2024-12-25T07:01:54-08:00	
Minister Katz in Gaza: 'Security control of Gaza will remain in t...	Defense Minister Israel Katz visited the Philadelphi Corridor in the Gaza Strip and stated: 'There will not be a political Hamas here and there will not be a militant Hamas here - there will be a different reality here thanks to the fighting that continues every day.'	https://www.israelnationalnews.com/news/401294	2024-12-25T06:44:43-08:00	
Hostage's father: 'Ireland helped free Emily but now rewards Hama...	Thomas Hand, the father of Emily Hand, who was nine years old when she was kidnapped during the October 7 massacre and spent 50 days as a hostage in Gaza, said that he would 'hesiate' to return to Ireland given the country's moves against Israel in the war against the Hamas terrorist organization.	https://www.israelnationalnews.com/news/401293	2024-12-25T06:37:57-08:00	
Hanukkah - When the New Morality is just the Old Immorality	Just like our ancestors, the mighty Maccabees, armed with a Torah in one hand and an Iron Dome missile interception battery in the other, the Israeli people are defending the only true morality. Op-ed.	https://www.israelnationalnews.com/news/401292	2024-12-25T06:29:50-08:00	
Hanukkah this year has a very special meaning	Of course, Aliyah is the only answer, but while the Rabbis I met are aware of the instability of continued Diaspora existence, in my opinion, a lingering spirit of denial prevents them from seeing how immediate the danger is.	https://www.israelnationalnews.com/news/401291	2024-12-25T06:04:00-08:00	
Tzohar rabbis: Add a special prayer when lighting Hanukkah candle...	Tzohar, in collaboration with the Atid Le'Otef Movement, composed a special prayer dedicated to the People of Israel, the hostages and their families, IDF soldiers, and all those who have been affected by the war.	https://www.israelnationalnews.com/news/401289	2024-12-25T05:59:47-08:00	
Hamas claims: Israel presented new conditions which delayed cease...	Serious negotiations for ceasefire deal are ongoing, Hamas has shown responsibility and flexibility,' terror group claims in statement.	https://www.israelnationalnews.com/news/401285	2024-12-25T05:44:00-08:00	
For Francesca Albanese, if you want to save Kfir Bibas, you’re de...	The argument that since more people have been killed since October 7 than on October 7, that makes the war automatically wrong, is rubbish. Opinion	https://www.israelnationalnews.com/news/401288	2024-12-25T05:42:18-08:00	
MK Osher Shkalim: 'Instead of promoting unity, Lapid is quoted on...	MK Osher Shkalim sharply criticizes opposition head and responds to government criticism from the National Unity party: 'They acted with false unity.'	https://www.israelnationalnews.com/news/401287	2024-12-25T05:09:00-08:00	
MK Liberman: 'We need to deal the Houthis a crushing blow'	After second consecutive day of early-morning Houthi missile launch, MK Avigdor Liberman urges: 'We need to deal the Houthis and Iran a crushing blow - now!'	https://www.israelnationalnews.com/news/401286	2024-12-25T05:01:01-08:00	
Watch: Two tunnels spanning two kilometers each destroyed in Gaza	IDF troops from the Southern Brigade of the Gaza Division dismantle two terror tunnels in southern and central Gaza.	https://www.israelnationalnews.com/news/401284	2024-12-25T04:39:57-08:00	
Ehud Yaari: 'Aim at what will truly agitate the Houthis'	Israel must change its aggressive approach in Yemen and focus on steps that will undermine the Houthis' status in the region,' Arab affairs commentator recommends.	https://www.israelnationalnews.com/news/401283	2024-12-25T03:54:15-08:00	
Youngest mother in Lev Tahor cult is 14 years old	Member of extremist 'Lev Tahor' cult tells local media in Guatemala that the youngest mother in the group is a young teen. 'We marry off minors.'	https://www.israelnationalnews.com/news/401279	2024-12-25T03:48:22-08:00	
Massive menoras built in freezing Russia	In preparation for the lighting of the first candle of Hanukah, Jews in Tyumen in Siberia, and Samara in Russia build large and spectacular menoras from ice.	https://www.israelnationalnews.com/news/401282	2024-12-25T02:57:07-08:00	
Watch: IDF improving readiness on Israel's eastern border	IDF holds brigade-wide exercise in Jordan Valley, as forces practice responding to terror threats, infiltrations, and more.	https://www.israelnationalnews.com/news/401278	2024-12-25T02:53:28-08:00	
Health Ministry: Teen from Jerusalem area diagnosed with polio	Unvaccinated 17-year-old from the Jerusalem area diagnosed with polio, Health Ministry conducts epidemiological investigation.	https://www.israelnationalnews.com/news/401280	2024-12-25T01:55:44-08:00	
New security project aims to protect Diaspora Jews from antisemit...	To meet rising antisemitic threats, Diaspora Affairs Ministry and Yael Foundation launch new security project for Jewish communities.	https://www.israelnationalnews.com/news/401277	2024-12-25T01:30:18-08:00	
Mor, from Be'er Yaakov: 'We heard a loud boom and shrapnel fell b...	A piece of shrapnel fell in our garden and we saw the damage it caused to our property; scared to think what it could do to people,' says Mor Steinberg-Golan, from Be'er Yaakov.	https://www.israelnationalnews.com/news/401276	2024-12-25T00:36:00-08:00	
Holocaust survivor who lost family on 10/7 passes away	97-year-old Holocaust survivor, Yosef Winner, who lost his grandson Yahav Winner, his granddaughter Hadar Berdichesky and her husband Itay, on October 7, passes away.	https://www.israelnationalnews.com/news/401274	2024-12-25T00:34:32-08:00	
Footage: Plane with 72 aboard crashes en route to Russia	Plane carrying dozens of passengers from Baku to Grozny crashes in Kazakhstan, fate of those aboard unclear.	https://www.israelnationalnews.com/news/401275	2024-12-24T23:54:19-08:00	
Delay in hostage deal negotiations due to Hamas foot-dragging	Hamas ignoring pressure from mediators, leader Mohammed Sinwar refusing to compromise, sources say.	https://www.israelnationalnews.com/news/401272	2024-12-24T23:00:33-08:00	
Tragedy in Elazar: The small village that lost 8 residents in the...	Elazar in Gush Etzion has suffered heavy losses since the outbreak of the war: 8 residents were murdered or fell since October 7.	https://www.israelnationalnews.com/news/401273	2024-12-24T22:25:25-08:00	
Here's what happened when Israel removed fluoride from tap water	RFK Jr. wants fluoride out of drinking water. Israel has a decade of lessons to offer.	https://www.israelnationalnews.com/news/401271	2024-12-24T21:39:41-08:00	
Saudi Arabia's execution toll hits record high despite promises o...	Saudi Arabia executed 330 individuals this year, marking the highest annual total in decades, according to tally published by Reuters.	https://www.israelnationalnews.com/news/401266	2024-12-24T20:55:30-08:00	
Rabbi Sacks resources for Hanukkah	The Jewish People kept hope alive and hope kept the Jewish People alive.' What words can better uplift the Jewish People today?	https://www.israelnationalnews.com/news/401265	2024-12-24T20:26:31-08:00	
Canada: First Sephardi woman appointed to join federal cabinet	Rachel Bendayan, a Canadian Member of Parliament representing the district of Outremont in Montreal, makes history after being named Canada’s new Minister of Official Languages and Associate Minister of Public Safety in cabinet reshuffle by Prime Minister Trudeau.	https://www.israelnationalnews.com/news/401264	2024-12-24T20:13:00-08:00	
Lights of unity	Not only is it possible to prevent a war between Jews, but moreover, we can bring them to love one another. We must dispel the darkness by increasing the light, as we gaze at the Hanukkah candles.	https://www.israelnationalnews.com/news/401268	2024-12-24T20:01:00-08:00	
Hanukkah’s Warning: Do not repeat History!	The other Arab countries are watching us closely and we can change this region for decades to come if we play our cards right. We must not repeat the fatal errors of the Hasmonean kings who snatched defeat from the jaws of victory.	https://www.israelnationalnews.com/news/401269	2024-12-24T20:00:00-08:00	
First night of Hanukkah: One candle or eight?	The famous dispute between the Sages is another instance where Hillel's school of thought sees the world as it is, Shammai's sees the world as it should ideally be. In today’s imperfect world, we follow Hillel’s rulings.	https://www.israelnationalnews.com/news/401267	2024-12-24T20:00:00-08:00	
Why do Syria's Druze communities want to join Israel?	As jihadist forces march through the region, minority communities know that aligning with Israel is their only chance for survival. Opinion.	https://www.israelnationalnews.com/news/401270	2024-12-24T19:52:00-08:00	
Iran removes restrictions on WhatsApp and Google Play	Iranian authorities remove restrictions on Meta's messaging platform WhatsApp and on Google Play, marking an initial move to ease internet limitations.	https://www.israelnationalnews.com/news/401263	2024-12-24T19:48:32-08:00	
Five men sentenced over Amsterdam soccer pogrom	Amsterdam District Court sentences five men to prison terms of up to six months for their involvement in the violence against Israeli soccer fans in November.	https://www.israelnationalnews.com/news/401262	2024-12-24T19:24:12-08:00	
Syrian rebels demand compensation from Iran	In light of Iran's support for the Assad regime over the years, the rebels in Syria are demanding compensation of hundreds of billions of dollars from Iran.	https://www.israelnationalnews.com/news/401261	2024-12-24T18:52:08-08:00	
Second night in a row: Sirens in central Israel due to a rocket l...	Sirens activated in central Israel, the Shfela and Judea, following a launch from Yemen. Residents report hearing explosions. IDF confirms one rocket was intercepted before it crossed into Israeli territory.	https://www.israelnationalnews.com/news/401260	2024-12-24T18:36:00-08:00	
Report: Abbas making it difficult to reach a ceasefire agreement ...	Palestinian Arab official accuses Abbas of placing obstacles in the path to reaching a ceasefire agreement because of his opposition to establishing a committee to manage the Gaza Strip.	https://www.israelnationalnews.com/news/401259	2024-12-24T18:10:12-08:00	
Israeli negotiating team to return from Qatar 'after significant ...	Prime Minister's Office announces that the Israeli negotiation team, which had been in Qatar over the past week, will return to Israel for consultations.	https://www.israelnationalnews.com/news/401258	2024-12-24T17:45:12-08:00	
Podcast | From spam to scam: Safeguard your cross-border finances...	What you need to know to avoid falling victim to fraud.	https://www.israelnationalnews.com/news/401256	2024-12-24T17:21:09-08:00	
IAF strikes Hamas terrorist in Humanitarian Area in Khan Yunis	IDF says the strike was conducted with the direction of IDF and Shin Bet intelligence. Prior to the strike, numerous steps were taken to minimize the risk of harming civilians.	https://www.israelnationalnews.com/news/401257	2024-12-24T16:19:00-08:00	
Menashe Regional Brigade Commander lightly injured by explosive i...	David' APC hit by an explosive device during a counterterrorism operation in the area of Tulkarm, lightly injuring the Commander of the Menashe Regional Brigade, Col. Ayub Kayouf.	https://www.israelnationalnews.com/news/401255	2024-12-24T15:26:00-08:00	
Iran responds to Katz's claim of responsibility for Haniyeh's eli...	Iran's ambassador to the UN writes to Secretary-General Antonio Guterres, says Iranian attack on Israel in October should be recognized as legitimate after Defense Minister Katz claimed responsibility for the elimination of Hamas leader.	https://www.israelnationalnews.com/news/401254	2024-12-24T14:15:59-08:00	
Yonatan Brand Hy'd, the soldier who went to Mt. Herzl for advice	We do not know what answers Yonatan Brand Hy'd heard in his heart, but we know that that he sat facing the graves of IDF heroes trying to imagine what they would tell him to do about enlisting in the IDF. And he is buried near them.	https://www.israelnationalnews.com/news/401253	2024-12-24T13:52:52-08:00	
Otzma Yehudit votes against the position of the coalition	Otzma Yehudit accuses Smotrich of blocking the transfer of hundreds of millions of shekels to the police, votes against budget laws in the Knesset.	https://www.israelnationalnews.com/news/401252	2024-12-24T13:39:14-08:00	
Bereaved Grandfather: 'Journalists - stop tearing the nation apar...	A grandfather urges the media to promote unity and understanding in the wake of his grandson's death.	https://www.israelnationalnews.com/news/401250	2024-12-24T12:48:41-08:00	
MDA receives 3 bulletproof ambulances for deployment in Samaria	Yossi Dagan, Head of the Samaria Regional Council, says 'The new ambulances are a critical addition to strengthening preparedness and enhancing security in the region.'	https://www.israelnationalnews.com/news/401251	2024-12-24T12:22:57-08:00	
Catch-22: Young father stuck in impossible predicament	Diagnosed with a rare liver disease, a father of seven may be forced to go against doctors orders.	https://www.israelnationalnews.com/news/401240	2024-12-24T11:49:25-08:00	
IDF investigation: IDF didn't know 6 hostages were in area before...	Investigation finds that Carmel Gat, Eden Yerushalmi, Hersh Goldberg-Polin, Alexander Lobanov, Almog Sarusi, and MSG Ori Danino were murderde on August 29, their bodies were discovered on August 31.	https://www.israelnationalnews.com/news/401249	2024-12-24T10:24:00-08:00	
IDF: Area of sirens to be broadened after late sirens during Hout...	Investigation determines cause of siren activating 10 minutes late when 16 people were injured in a Houthi ballistic missile attack on Jaffa on Saturday morning.	https://www.israelnationalnews.com/news/401247	2024-12-24T10:06:30-08:00	
Haredim block Bnei Brak streets to protest draft	Dozens of haredi protesters are blocking Jabotinsky Street in Bnei Brak in protest against draft notices sent to young haredi men.	https://www.israelnationalnews.com/news/401245	2024-12-24T09:58:14-08:00	
Human Rights Expert: 'WHO has gaping hole in goals: The health of...	Professor Anne Bayefsky, the President of the Human Rights Voices human rights organization, speaks with Arutz Sheva about reports the Trump Administration may immediately withdraw from the World Health Organization.	https://www.israelnationalnews.com/news/401246	2024-12-24T09:57:00-08:00	
Former President Bill Clinton released from hospital	Clinton was treated for the flu after being admitted to MedStar Georgetown University Hospital with a fever.	https://www.israelnationalnews.com/news/401244	2024-12-24T09:06:50-08:00	
Their Fathers Died For Israel - Let’s Light Up Their Chanuka	Avital’s father was a sharpshooter who held his position under heavy enemy fire until he succumbed to his wounds.	https://www.israelnationalnews.com/news/401239	2024-12-24T09:00:05-08:00	
Defense Minister: 'IDF must release full recordings of fallen sol...	Defense Minister Israel Katz directed the IDF to release nearly complete recordings from the night of October 7th to the families of soldiers killed in the massacre.	https://www.israelnationalnews.com/news/401243	2024-12-24T08:59:09-08:00	
IDF raids Indonesian Hospital in Gaza	IDF and ISA forces conducted and completed a limited operation against terrorist operatives and infrastructure in the area of the Indonesian Hospital in northern Gaza.	https://www.israelnationalnews.com/news/401242	2024-12-24T07:56:41-08:00	
Multiple Syrian rebel groups agree to dissolve to join government	Ahmed Al-Sharaa, the de facto leader of the post-Assad Syria, announces that he reached an agreement with the leaders of the various rebel groups to consolidate their forces under the new Defense Ministry.	https://www.israelnationalnews.com/news/401241	2024-12-24T07:20:39-08:00	
IDF Spokesman apologizes for criticizing proposed law	IDF Spokesman Daniel Hagari apologized for his criticism of the 'Feldstein Law', admitting he overstepped his boundaries.	https://www.israelnationalnews.com/news/401238	2024-12-24T06:42:51-08:00	
Religious judge saved from gunfire in Gaza returns to scene of mi...	Rabbi Avi Zarbiv, member of the Tel Aviv rabbinical court who fought in Gaza, returns to the scene where terrorists fired at him just a few weeks ago.	https://www.israelnationalnews.com/news/401232	2024-12-24T06:15:38-08:00	
UK Chief Rabbi says Met failing to protect Jews from anti-Israel ...	British Chief Rabbi Ephraim Mirvis criticizes London police for failing to ensure that a Saturday protest planned for next month will not target local synagogues.	https://www.israelnationalnews.com/news/401237	2024-12-24T05:58:19-08:00	
Addressing Post-Traumatic Stress in Lone Soldiers	War tragically leaves many physically and mentally affected. For soldiers without the embrace of family support, its scars can run especially deep.	https://www.israelnationalnews.com/news/401224	2024-12-24T05:39:00-08:00	
Defense Minister: We'll deal with the Houthi leaders in Sana'a an...	Defense Minister Israel Katz visits Arrow missile defense battery which intercepted a ballistic missile launched by the Houthis in Yemen. 'Whoever sponsors Houthi terror will pay the price.'	https://www.israelnationalnews.com/news/401235	2024-12-24T05:19:03-08:00	
American Airlines grounds all flights on Christmas eve	Airline announces no flights can take off more multiple hours on the day before major holiday due to unspecified 'technical problem.'	https://www.israelnationalnews.com/news/401236	2024-12-24T05:16:51-08:00	
California: Two Democratic representatives face lawsuit for suppo...	Mike Thompson and Jared Huffman, two Bay Area House representatives, face class-action suit for supporting Israel aid.	https://www.israelnationalnews.com/news/401234	2024-12-24T04:24:22-08:00	
Prosecutor: Arabs attacked Jerusalem man 'without nationalist mot...	A young man in Jerusalem was attacked by three individuals for asking them to clear a blocked road.	https://www.israelnationalnews.com/news/401233	2024-12-24T04:11:59-08:00	
IDF, US Cyber Command, hold joint 'Cyberdome' exercise	IDF, US Cyber Command, hold joint exercise, preventing dozens of cyberattacks and targeting enemy systems.	https://www.israelnationalnews.com/news/401229	2024-12-24T03:17:24-08:00	
Watch Live: First sergeant Netanel Pessach laid to rest	First sergeant Netanel Pessach was laid to rest today in Gush Etzion after being killed in action in Gaza yesterday.	https://www.israelnationalnews.com/news/401231	2024-12-24T03:05:00-08:00	
Amb. Lew: Report on northern Gaza irresponsible, inaccurate	Report issued on Gaza by FEWS NET relies on data that is outdated and inaccurate; at a time when inaccurate information is causing confusion and accusations, it is irresponsible to issue a report like this,' US Ambassador to Israel Jack Lew says.	https://www.israelnationalnews.com/news/401230	2024-12-24T02:27:38-08:00	
Bereaved father: 'IDF cheated us'	Eyal Eshel, father of the fallen soldier Roni Eshel, criticized the IDF's release of the radio recordings from the night before the October 7th massacre.	https://www.israelnationalnews.com/news/401228	2024-12-24T02:13:45-08:00	
Nefesh B'Nefesh and Friends of the IDF host driver's license conv...	The event, co-hosted by Israel’s Ministry of Transportation and the IDF streamlined the license conversion for some 900 Lone Soldiers and National Service Volunteers in just one day - under one roof.	https://www.israelnationalnews.com/news/401227	2024-12-24T02:04:00-08:00	
Justice Minister bars judges from academia	Yariv Levin has decided to prevent judges from taking on teaching roles.	https://www.israelnationalnews.com/news/401226	2024-12-24T01:08:02-08:00	
New mothers to be able to split maternity pay into three installm...	Knesset to vote on new bill allowing new mothers to receive maternity pay in one lump sum or three equal installments.	https://www.israelnationalnews.com/news/401222	2024-12-24T00:23:27-08:00	
Non-Jewish holidays and Gregorian Calendar dates	It is forbidden for a Jew to celebrate the holidays of another religion and it is not appropriate to celebrate civil holidays that were originally religious holidays.	https://www.israelnationalnews.com/news/401225	2024-12-24T00:17:41-08:00	
Watch: Tanya video/lecture on Igeret Hakodesh	The Tanya compacts four millennia of Jewish wisdom to answer the great personal and existential questions of life. It has revolutionized the way we think about G -d the human soul, the world and our place in it.	https://www.israelnationalnews.com/news/401223	2024-12-23T23:59:39-08:00	
Israel working to push European nations to recognize Houthis as t...	Following increase in Houthi attacks on Israel, Foreign Minister Gideon Sa'ar working to advance international recognition of Houthi rebels as a terror organization. 'Houthis continue to disrupt regional stability, present a challenge to world order.'	https://www.israelnationalnews.com/news/401218	2024-12-23T23:54:51-08:00	
Netanyahu to Christians: 'You've stood by our side as Israel defe...	The Prime Minister sent his Christmas wishes to Christians around the world and thanked them for their support.	https://www.israelnationalnews.com/news/401221	2024-12-23T23:31:09-08:00	
Hannah Katzir, who survived Hamas captivity, passes away	Chana (Hannah) Katzir, 77, passes away just over one year after her release in a November 2023 prisoner swap deal with Hamas.	https://www.israelnationalnews.com/news/401220	2024-12-23T23:05:00-08:00	
Shouting and violence: Lev Tahor members attack haredim	Members of the Lev Tahor cult violently attacked haredim who came to the aid of the cult's children who were rescued in a Guatemalan police raid.	https://www.israelnationalnews.com/news/401219	2024-12-23T22:56:41-08:00	
Why I don't go to rallies to free the hostages	The best thing that can be done for the hostages is not to give Hamas any means of pressure and not let them see our pain.	https://www.israelnationalnews.com/news/401217	2024-12-23T21:59:48-08:00	
Important Milestone: 35 Million NIS donation secures new emergenc...	During meetings at a large fundraising gala in New York, attended by Ambassador-designate Governor Mike Huckabee, a significant sum was raised to complete the construction of the first medical complex in Binyamin, which will serve as its emergency and trauma center.	https://www.israelnationalnews.com/news/401216	2024-12-23T21:42:00-08:00	
