Title	Description	Link	pubDate
🔁🖼 השופט דניאל פיש בבית משפט המחוזי חיפה גזר על שני מחבלים שהשת...	Forwarded From אדיר לחקים - חדשות ועדכוניםהשופט דניאל פיש בבית משפט המחוזי Please contact us. החומות (מאי 2021) 6 שנות מאסר ופיצוי מכל אחד למור 10 אלף שקלים. About us: -אני לא משתתף בהצגה של בית Why not? בושה. About us-פרטים About us הבא:https://www.instagram.com/adir.lehakim?igsh=dzY3MWI5bmlnM3Vt&amp;utm_source=qr	https://t.me/News_cabinet_news/172957	2025-01-13T01:29:29-08:00
Please contact us: Please contact us סופית של חמאס (דנה ויס)	Please contact us: Please contact us סופית של חמאס(דנה ויס)	https://t.me/News_cabinet_news/172956	2025-01-12T23:52:09-08:00
🔁🖼	Forwarded From צופר - צבע אדום	https://t.me/News_cabinet_news/172955	2025-01-12T21:44:14-08:00
🔁 🔴 צבע אדום (01/13/2025): 07:44: • עוטף עזה: נתיב העשרה (15 שנ...	Forwarded From צופר - צבע אדום🔴 צבע אדום (13/01/2025):07:44:• עוטף עזה: נתיב העשרה (15 שניות)צופר - צבע אדום	https://t.me/News_cabinet_news/172954	2025-01-12T21:44:13-08:00
↩️ דובר צה״ל: מטוסי קרב של חיל האוויר תקפו והשמידו בשעות האחרונות...	חדשות - הקבינט הביטחוני: תיעוד מתקיפות חיל האוויר דובר Please contact us, Please contact us, please contact us. Please contact us. Please contact us ולא טופל. Please contact us: Please contact us. About us About us Please contact us Please contact us.	https://t.me/News_cabinet_news/172953	2025-01-12T14:57:29-08:00
Please contact us - please contact us.	Please contact us - please contact us.	https://t.me/News_cabinet_news/172952	2025-01-12T14:27:46-08:00
🔁 אדיר לחקים: בעקבות התקיפות החריגות במסגרת הסכם הפקת האש של כוח...	Forwarded From: בעקבות התקיפות החריגות About us - About us - About us Please contact us: Please contact us. הזמן יעיד. אין הנחיות מיוחדות לעורף	https://t.me/News_cabinet_news/172951	2025-01-12T13:56:17-08:00
🔁 Please contact us: Please contact us, ועוד שני אתרים צבאיים...	Forwarded From קבינט מדיני ביטחוני - מוריה אסרף &amp; Please contact us (Doron Kadosh) Please contact us, please contact us. התארגנויות טרור, שהעברנו בקשה לצבא לבנון לטפל בהם - והם לא טיפלו.	https://t.me/News_cabinet_news/172950	2025-01-12T13:04:40-08:00
🎬 תיעוד מתקיפות חיל האוויר	תיעוד מתקיפות חיל האוויר	https://t.me/News_cabinet_news/172949	2025-01-12T13:03:34-08:00
Please contact us - Please contact us C.B מדיה ותקשורת בטל...	Please contact us - Please contact us C.Bמדיה ותקשורת בטלגרםhttps://t.me/News_cabinet_news	https://t.me/News_cabinet_news/172948	2025-01-12T12:59:22-08:00
פיצוץ עז נשמע בדרום. בבדיקה.	פיצוץ עז נשמע בדרום. בבדיקה.	https://t.me/News_cabinet_news/172947	2025-01-12T10:36:15-08:00
🖼 Home page בנהריה לפני כחודשיים. יה...	Home page לפני כחודשיים. About us בטלגרםhttps://t.me/News_cabinet_news	https://t.me/News_cabinet_news/172946	2025-01-12T09:48:28-08:00
🔁🖼	Forwarded From צופר - צבע אדום	https://t.me/News_cabinet_news/172945	2025-01-12T06:19:57-08:00
🔁 🔴 צבע אדום (12/01/2025): 16:19: • עוטף עזה: נתיב העשרה (15 שנ...	Forwarded From צופר - צבע אדום🔴 צבע אדום (12/01/2025):16:19:• עוטף עזה: נתיב העשרה (15 שניות)צופר - צבע אדום	https://t.me/News_cabinet_news/172944	2025-01-12T06:19:56-08:00
↩️ דובר צה-ל: בהמשך להתרעה שהופעלה ביראון בשעה 11:45, מדובר בזיהו...	חדשות - הקבינט הביטחוני: אדיר לחקים: בצה״ל מבהירים מדובר באזעקת Please contact us ביראון בשעה 11:45, מדובר בזיהוי שווא.	https://t.me/News_cabinet_news/172943	2025-01-12T01:54:08-08:00
🔁 אדיר לחקים: בצה״ל מבהירים מדובר באזעקת שווא ולא יצא מיירט לשום...	Forwarded From: בצה״ל מבהירים מדובר Home page	https://t.me/News_cabinet_news/172942	2025-01-12T01:53:39-08:00
↩️ מסתמן: שוגר מיירט לעבר מטרת שווא	חדשות - הקבינט הביטחוני: אזעקה ביראון בגליל העליון הפרטים בבדיקה מסתמן: שוגר מיירט לעבר מטרת שווא	https://t.me/News_cabinet_news/172940	2025-01-12T01:50:00-08:00
↩️ דובר צה-ל: הופעלה התרעה ביראון, הפרטים בבדיקה.	חדשות - הקבינט הביטחוני: אזעקה ביראון בגליל העליון הפרטים בבדיקה דובר צה-ל:הופעלה התרעה ביראון, הפרטים בבדיקה.	https://t.me/News_cabinet_news/172939	2025-01-12T01:47:46-08:00
🔁 אזעקה ביראון בגליל העליון הפרטים בבדיקה	Forwarded From : בבדיקה	https://t.me/News_cabinet_news/172938	2025-01-12T01:46:14-08:00
🔁🖼	Forwarded From צופר - צבע אדום	https://t.me/News_cabinet_news/172937	2025-01-12T01:45:44-08:00
🔁 🔴 צבע אדום (12/01/2025): 11:45: • קו העימות: יראון (מיידי) צו...	Forwarded From צופר - צבע אדום🔴 צבע אדום (12/01/2025):11:45:• קו העימות: יראון (מיידי)צופר - צבע אדום	https://t.me/News_cabinet_news/172936	2025-01-12T01:45:42-08:00
🖼 Please contact us - האירוע הסתיים.	Please contact us - האירוע הסתיים.	https://t.me/News_cabinet_news/172935	2025-01-11T22:54:00-08:00
המשא ומתן להשבת החטופים. Please, please, please contact me...	המשא ומתן להשבת החטופים. Please contact us, please contact us. המשלחת הישראלית במשא ומתן. About us: -אנחנו About us Please contact us. Please contact us, please contact us. וארצות הברית-. Please contact us, please contact us. Home page Please contact us, please contact us. Please contact us. Please contact us, please contact us, Home page ( דרך א-רשיד - אלקורניש ) Home page 11	https://t.me/News_cabinet_news/172934	2025-01-11T22:50:31-08:00
↩️ דובר צה״ל: הופעלו התרעות על חדירת כלי טיס עוין במרחב עוטף עזה,...	חדשות - הקבינט הביטחוני: ✈️ חדירת כלי טיס עוין (12/01/2025): 08:46: • עוטף עזה: צוחר, אוהד, שדה ניצן, תלמי אליהו 08:48: • עוטף עזה: עין הבשור צופר - Please contact us עוטף עזה, הפרטים בבדיקה.	https://t.me/News_cabinet_news/172933	2025-01-11T22:49:40-08:00
🔁🖼	Forwarded From צופר - צבע אדום	https://t.me/News_cabinet_news/172932	2025-01-11T22:48:54-08:00
🔁 ✈️ חדירת כלי טיס עוין (12/01/2025): 08:46: • עוטף עזה: צוחר, א...	Forwarded From צופר - צבע אדום✈️ חדירת כלי טיס עוין (12/01/2025):08:46:• עוטף עזה: צוחר, אוהד, שדה ניצן, תלמי אליהו 08:48:• עוטף עזה: עין הבשור צופר - צבע אדום	https://t.me/News_cabinet_news/172931	2025-01-11T22:48:53-08:00
🔁🖼	Forwarded From צופר - צבע אדום	https://t.me/News_cabinet_news/172930	2025-01-11T22:46:32-08:00
🔁 ✈️ חדירת כלי טיס עוין (12/01/2025): 08:46: • עוטף עזה: צוחר, א...	Forwarded From צופר - צבע אדום✈️ חדירת כלי טיס עוין (12/01/2025):08:46:• עוטף עזה: צוחר, אוהד, שדה ניצן, תלמי אליהו צופר - צבע אדום	https://t.me/News_cabinet_news/172929	2025-01-11T22:46:30-08:00
🔁 Please contact us.	Forwarded From אדיר לחקים - חדשות ועדכוניםבדובר צה״ל טוענים שלא מוכר משהו חריג בגזרה והכל כשגרה.	https://t.me/News_cabinet_news/172928	2025-01-11T15:26:32-08:00
🔁 נהריה והסביבה מדווחים על שמיעת פיצוצים במרחב	Forwarded From אדיר לחקים - חדשות ועדכוניםתושבי נהריה והסביבה מדווחים על שמיעת פיצוצים במרחב	https://t.me/News_cabinet_news/172927	2025-01-11T15:09:24-08:00
🔁 Why not? דובר צה-ל: תצפיות זיהו מוקדם יותר הערב (ש') שלו...	Forwarded From אדיר לחקים - חדשות ועדכוניםהאם חיזבאללה ניסה לפגוע בכוחותינו? דובר צה-ל: תצפיות זיהו מוקדם יותר הערב (ש') שלושה חשודים במרחב הר Please contact us. שלושת החשודים, Please contact us. ואזרחיה.	https://t.me/News_cabinet_news/172926	2025-01-11T13:32:59-08:00
3 חשודים שהתקרבו למרחב הגבול באזור הר דב. כטב״ם זיק שה...	3 חשודים שהתקרבו למרחב הגבול באזור הר דב. Please contact us. Home page	https://t.me/News_cabinet_news/172925	2025-01-11T13:31:41-08:00
↩️ הלל ביטון רוזן: השלושה נעו ברגל לכיוון שטח ישראל סמוך לגבול. ח...	חדשות - הקבינט הביטחוני: לפני זמן קצר כוחותינו תקפו מהאוויר 3 חשודים במרחב הר דוב בשטח לבנון. פרטי האירוע בבדיקה. Please contact us: Please contact us. סמוך לגבול.חוסלו בהצלחה.	https://t.me/News_cabinet_news/172924	2025-01-11T13:18:29-08:00
Home page לבנון. פרטי האירוע בב...	Home page About us	https://t.me/News_cabinet_news/172923	2025-01-11T13:11:55-08:00
Please contact us. Please, please...	Please contact us. Please contact us, please contact us. Please contact us. Please contact us. שיסיים את תפקידו בשל אחריותו ל-7 באוקטובר. Please contact us יהושוע	https://t.me/News_cabinet_news/172922	2025-01-11T12:40:13-08:00
Please contact us: Please contact us - Price 400 חללים (...	Please contact us: Please contact us - נפלו 400 חללים בתחילת המלחמה - 329). 400 חללים בבית חאנון, בג׳באליה, בסג׳עיה, בשכונת זיתון, בחאן יונס, Please contact us, please contact us. בגבורה כבר שנה ו-3 חודשים ברציפות. Home page 50 חללים. מתוכם, בבית חאנון נפלו 11 חללים. 10 נפלו רק בשבוע האחרון.דורון קדוש	https://t.me/News_cabinet_news/172921	2025-01-11T12:00:19-08:00
Please contact us שומרון סמוך לבורק...	Please contact us שומרון סמוך לבורקא נזק שימשה	https://t.me/News_cabinet_news/172920	2025-01-11T11:56:55-08:00
↩️ פלילי.	חדשות - הקבינט הביטחוני: דיווח ראשוני על אירוע דקירה בירושלים, הפרטים בבדיקה. פלילי.	https://t.me/News_cabinet_news/172919	2025-01-11T11:56:01-08:00
Please contact us, please contact us.	Please contact us, please contact us.	https://t.me/News_cabinet_news/172918	2025-01-11T11:51:56-08:00
↩️ About us ממושכת. לוקחים יחידות צב...	חדשות - הקבינט הביטחוני: שיטת הפשיטות הממושכות בצפון הרצועה נכשלה בענק. Newsletter אחראיים גם על הכישלון הזה. במשך 4 חודשים לצד ההרס הרב במרחב, גדודי החמאס שיקמו את עצמם, הירי Yes, please, please, please contact me… Please contact us, please contact us. יחידות צבאיות שיודעות להילחם ולתמרן, Please, Please contact us. שטח אויב.התוצאה - כמעט 200 הרוגים בצפון הרצועה + גדודי הטרור של החמאס משתקמים.הלל ביטון רוזן	https://t.me/News_cabinet_news/172917	2025-01-11T11:27:15-08:00
Please contact us למשפחותיהם - רס״ם (מיל׳) אלכ...	Please contact us Home Office (Alexander Fedorenko), 37, No. משא כבד בגדוד 79, חטיבת ׳המחץ׳ (14), נפל בקרב בצפון רצועת עזה.- סמ-ר Office (Danila Diakov), 21, No. 931, No. 931, No. נפל בקרב בצפון רצועת עזה.-&nbsp;סמל יהב מעיין (Yahav Maayan), בן 19, ממודיעין, לוחם בגדוד 931, חטיבת הנח״ל, נפל בקרב בצפון רצועת עזה.-&nbsp;סמל אליאב אסטיוקאר (Eliav Astuker), בן 19, מאשדוד, לוחם בגדוד 931, חטיבת הנח״ל, נפל בקרב בצפון רצועת עזה.יהי זכרם ברוך	https://t.me/News_cabinet_news/172916	2025-01-11T11:19:42-08:00
Please contact us. מלבד הכישלון של ה-7.10 עליו אחראיים ה...	All rights reserved. ה-7.10 עליו אחראיים הרצי הלוי וירון פינקלמן, הם אחראיים גם על About us Please contact us, please contact us משמעותית בכל שבוע שחולף.הלל ביטון רוזן	https://t.me/News_cabinet_news/172915	2025-01-11T10:11:09-08:00
*לשכת ראש הממשלה:* ראש הממשלה בנימין נתניהו קיים הערב דיון הערכת ...	*לשכת ראש הממשלה:*ראש הממשלה בנימין נתניהו קיים הערב דיון הערכת Please contact us Home page Please contact us, please contact us. Home page לשחרור חטופינו.	https://t.me/News_cabinet_news/172914	2025-01-11T08:50:01-08:00
Please contact us: Please contact us חשאי בישראל דנה ויס	Please contact us: Please contact us חשאי בישראלדנה ויס	https://t.me/News_cabinet_news/172913	2025-01-11T04:28:52-08:00
Please contact us: Please contact us. קרובים מאי פעם. בחמאס א...	Please contact us: Please contact us. קרובים מאי פעם. בחמאס אומרים הבוקר: תשובתנו הועברה לישראל. ממתינים לתשובה.אלמוג בוקר	https://t.me/News_cabinet_news/172912	2025-01-11T01:26:05-08:00
↩️ דובר צה-ל: בהמשך להתרעות שהופעלו בכרם שלום בשעה 11:02, יורט שי...	חדשות - הקבינט הביטחוני: לפי תושבים נשמע פיצוץ במרחב דובר צה-ל:בהמשך להתרעות שהופעלו בכרם שלום בשעה 11:02, יורט שיגור אחד שחצה מדרום רצועת עזה.	https://t.me/News_cabinet_news/172911	2025-01-11T01:11:15-08:00
↩️ לפי תושבים נשמע פיצוץ במרחב	Photo - Photo Gallery: Photo Gallery	https://t.me/News_cabinet_news/172910	2025-01-11T01:04:15-08:00
🔁🖼	Forwarded From צופר - צבע אדום	https://t.me/News_cabinet_news/172909	2025-01-11T01:02:30-08:00
🔁 🔴 צבע אדום (11/01/2025): 11:02: • עוטף עזה: כרם שלום (15 שניו...	Forwarded From צופר - צבע אדום🔴 צבע אדום (11/01/2025):11:02:• עוטף עזה: כרם שלום (15 שניות)צופר - צבע אדום	https://t.me/News_cabinet_news/172908	2025-01-11T01:02:29-08:00
↩️ דובר צה-ל: בהמשך להתרעות שהופעלו במרחב עוטף עזה בשעה 10:29, מד...	חדשות - הקבינט הביטחוני: 🔴 צבע אדום (11/01/2025): 10:29: • עוטף עזה: ניר עם, שדרות, איבים (15 שניות) צופר - צבע אדום דובר צה-ל:בהמשך להתרעות 10:29, מדובר בזיהוי שווא.	https://t.me/News_cabinet_news/172907	2025-01-11T00:59:41-08:00
🔁🖼	Forwarded From צופר - צבע אדום	https://t.me/News_cabinet_news/172906	2025-01-11T00:29:40-08:00
🔁 🔴 צבע אדום (11/01/2025): 10:29: • עוטף עזה: ניר עם, שדרות, אי...	Forwarded From צופר - צבע אדום🔴 צבע אדום (11/01/2025):10:29:• עוטף עזה: ניר עם, שדרות, איבים (15 שניות)צופר - צבע אדום	https://t.me/News_cabinet_news/172905	2025-01-11T00:29:39-08:00
הודעה משותפת לדובר צה-ל ודוברות שב-כ: 12 שעות, הושלמה פעילות לסיכ...	הודעה משותפת לדובר צה-ל ודוברות שב-כ: 12 שעות, הושלמה פעילות Please contact us: Please contact us Please contact us Please contact us Please contact us, please contact us. Please contact us. Home page Please contact us.	https://t.me/News_cabinet_news/172904	2025-01-10T10:51:18-08:00
*ראש הממשלה בנימין נתניהו:* כפי שהתחייבנו - החות׳ים משלמים, וימשי...	*ראש הממשלה בנימין נתניהו:*כפי שהתחייבנו - החות׳ים משלמים, Yes, please, please, please contact me. Please contact us ובעומק תימן. Please contact us. האיראני במזרח-התיכון. Please contact us, please contact us. Please contact us: Please contact us. Please contact us - Please contact us זמן שיידרש.	https://t.me/News_cabinet_news/172903	2025-01-10T06:00:50-08:00
About us: -נמל חודיידה משותק ונמל ראס ...	About us: -נמל חודיידה משותק ונמל ראס עיסא בוער - לא תהיה חסינות לאיש, נצוד גם&nbsp; את ראשי ארגון הטרור החות'י. Home page Please contact us Please contact us, please contact us. Please contact us, please contact us. Please contact us, please contact us Please contact us Please note: Please contact us. About us Home page Please contact us About us	https://t.me/News_cabinet_news/172902	2025-01-10T05:46:47-08:00
דובר צה-ל: מטוסי קרב של חיל האוויר תקפו לפני זמן קצר, בהכוונת אגף...	Please contact us Please contact us for more details Home page Please contact us, please contact us, Please contact us. המדינה. Please contact us. Please contact us, please contact us שלטון הטרור החות'י בפעילותו הצבאית. נוסף על כך, הותקפו תשתיות בנמלים 'ראס עיסא' ו-'חודיידה' ברצועת החוף המערבית בתימן. Home page Please contact us. Home page Please contact us. Please contact us for more details About us אזרחי מדינת ישראל, please.	https://t.me/News_cabinet_news/172901	2025-01-10T05:34:13-08:00
: : : : : : : : : : : : : : : : : : Please, please...	Please contact us Please contact us, please contact us, ארה-ב ובריטניה, לא תקפו ביחד, מטוס ליד מטוס, אלה בתיאום ותזמון. Please contact us Home page (התנגשות בין מטוסים/ ירי על מטוסים) וכדי למקסם תקיפה בפרק זמן Please contact us, please contact us. Please contact us Please contact us, please contact us.	https://t.me/News_cabinet_news/172900	2025-01-10T05:29:27-08:00
הלל ביטון רוזן: תקיפת ישראל בתימן הסתיימה בהצלחה, בקרוב הודעה.	הלל ביטון רוזן: תקיפת ישראל בתימן הסתיימה בהצלחה, בקרוב הודעה.	https://t.me/News_cabinet_news/172899	2025-01-10T04:52:03-08:00
↩️🖼	חדשות - הקבינט הביטחוני: דובר צה-ל:&nbsp;ממצאי תחקיר נסיבות מותם של Home page Home page המתקפה הרצחנית שהוביל ארגון הטרור חמאס ב-7 באוקטובר, הוצגו אמש (ה') למשפחתם. התחקיר בוצע בראשותו של…	https://t.me/News_cabinet_news/172898	2025-01-10T04:46:54-08:00
Please contact us: Please contact us ערבה ז-ל ב-7 באוקטובר מק...	Please contact us Home page Please contact us הטרור חמאס ב-7 באוקטובר, הוצגו אמש (ה') למשפחתם. התחקיר בוצע בראשותו של אלוף-משנה (מיל') ירון סיטבון, שאמון על Please contact us, please contact us. בקיבוץ אשר טרם סוכם. Please contact us, Please contact us. Home page Please contact us Please contact us. Please contact us. כתוצאה מירי זה, נפצע נועם אליקים ז-ל. Please contact us, please contact us. Please contact us, please contact us. Please contact us, בהוראת המחבלים. Please contact us, please contact us. מהמחבלים ולהסתתר. Please contact us. Please contact us, please contact us. Please contact us. Home page ז-ל, אשר נהרג מאש כוחותינו בתקרית זו בשל זיהוי שגוי.תומר Please contact us. Please contact us, please contact us, דיקלה ערבה ז-ל. Please contact us, please contact us. כתוצאה מירי זה, נהרגה דיקלה ערבה ז-ל. Please contact us, please contact us. דיקלה ערבה ז״ל. Please contact us. Please, please, please contact us. Please contact us. לקיבוץ.	https://t.me/News_cabinet_news/172897	2025-01-10T04:45:07-08:00
Please contact us, אלא מדובר בתקיפה מש...	Please contact us, Home page About us - About us - About us נקודתיות.תמיר מורג	https://t.me/News_cabinet_news/172896	2025-01-10T04:27:15-08:00
↩️ Please contact us של הקואליציה ללא ישר...	חדשות - הקבינט הביטחוני: כעת: תקיפות נוספות בתימן בבירה צנעא Please contact us: Please contact us הקואליציה ללא ישראל.הלל ביטון רוזן	https://t.me/News_cabinet_news/172895	2025-01-10T04:17:28-08:00
כעת: תקיפות נוספות בתימן בבירה צנעא	כעת: תקיפות נוספות בתימן בבירה צנעא	https://t.me/News_cabinet_news/172894	2025-01-10T04:15:14-08:00
Home page	Home page	https://t.me/News_cabinet_news/172893	2025-01-10T03:50:17-08:00
↩️ עד כה מדווחים בתימן על 12 תקיפות.	חדשות - הקבינט הביטחוני: תימניאדה | Please contact us. הלל ביטון רוזן עד כה מדווחים בתימן על 12 תקיפות.	https://t.me/News_cabinet_news/172892	2025-01-10T03:41:11-08:00
תימניאדה | Please contact us. הלל ביטון רוזן	תימניאדה | Please contact us.	https://t.me/News_cabinet_news/172891	2025-01-10T03:36:19-08:00
*שר הביטחון ישראל כ-ץ הנחה את צה-ל להביא לו בהקדם תוכנית להכרעה מ...	*שר הביטחון ישראל כ-ץ הנחה את צה-ל להביא לו בהקדם תוכנית להכרעה מוחלטת של החמאס בעזה: -במידה ועסקת החטופים לא תתממש עד לכניסת Please contact us - Please contact us About us עם הרמטכ-ל, רב-אלוף הרצי הלוי, מנכ-ל משרד הביטחון, אלוף (מיל׳‎) Please contact us Home page Please contact us. Please contact us, Home page לתפקידו.*שר הביטחון הדגיש כי *אסור להיגרר למלחמת התשה מול החמאס Yes, please, please contact us. About us Please contact us, please contact us. Please contact us. הפוליטי לעזה לא רלוונטי לנושא התוכנית והפעילות הנדרשת כעת, *משום Please contact us, please contact us Please contact us Please contact us, *אך לצד זאת חייבים לשנות את שיטת הפעולה כדי להביא לחיסול החמאס ולסיום המלחמה בעזה.**שר הביטחון הוסיף* כי -אסור להיגרר למלחמת התשה Home page אסטרטגית מוחלטת של החמאס וסיום המלחמה בעזה-.	https://t.me/News_cabinet_news/172890	2025-01-10T00:46:59-08:00
הלל ביטון רוזן: לוחמינו החלו בפעילות סיכול טרור משמעותית בעיירה ק...	הלל ביטון רוזן: לוחמינו החלו בפעילות סיכול טרור משמעותית בעיירה Please contact us, please contact us Home page Please contact us.	https://t.me/News_cabinet_news/172889	2025-01-10T00:32:25-08:00
*שר הביטחון ישראל כ-ץ:* אני מגנה בחריפות את התקיפה האלימה של האלו...	*שר הביטחון ישראל כ-ץ:*אני מגנה בחריפות את התקיפה האלימה של האלוף Please contact us. זוהי חציית קו אדום חמור. - Please contact us המתפרעים.*תקשורת שר הביטחון*	https://t.me/News_cabinet_news/172888	2025-01-09T23:58:49-08:00
דובר צה-ל: הרמטכ-ל מגבה ומחזק את עשייתו החשובה של האלוף דוד זיני ...	Please contact us לגיוס בני החברה החרדית. צה-ל רואה בחומרה ומגנה כל התנהגות אלימה כלפי משרתיו העושים לילות כימים לביטחון המדינה ואזרחיה.	https://t.me/News_cabinet_news/172887	2025-01-09T23:31:52-08:00
Please contact us ידי המכון הלאומי לר...	About us Please contact us, please contact us. Please contact us עזה, נהרג בשבי חמאס. Please contact us. Please contact us, please contact us קרקעית במרחב רפיח, לשטח ישראל. Please contact us. Please contact us. Please contact us ככל הניתן.	https://t.me/News_cabinet_news/172886	2025-01-09T23:02:16-08:00
↩️ דובר צה-ל: בשעה האחרונה: חיל האוויר יירט שלושה כלי טיס בלתי מא...	חדשות - הקבינט הביטחוני: לפני מספר דקות נשמע פיצוץ במרכז הארץ, ככה״נ מדובר ביירוט כטב׳׳מ ששוגר מתימן. דובר צה-ל:בשעה האחרונה: חיל האוויר יירט שלושה כלי טיס בלתי Home page Please contact us. הארץ.	https://t.me/News_cabinet_news/172885	2025-01-09T11:54:50-08:00
Please contact us, please contact us. ששוגר מתימן.	Please contact us, please contact us. ששוגר מתימן.	https://t.me/News_cabinet_news/172884	2025-01-09T11:43:34-08:00
דובר צה-ל: חיל האוויר יירט לפני זמן קצר במרחב הים התיכון כלי טיס ...	Please contact us Please contact us. מדיניות.	https://t.me/News_cabinet_news/172883	2025-01-09T10:50:56-08:00
🔁 תקדימי: תלונה הוגשה ע״י 3 משפחות שכולות נגד הרמטכ״ל הרצי הלוי ...	Forwarded From אדיר לחקים - חדשות ועדכוניםתקדימי: תלונה הוגשה ע״י 3 משפחות Home page המלאים: https://www.instagram.com/reel/DEnWsFisTo9/?igsh=MWFoejhzbHk2YWIyNw==	https://t.me/News_cabinet_news/172882	2025-01-09T10:36:00-08:00
↩️ דובר צה-ל: חיל האוויר יירט לפני זמן קצר כלי טיס בלתי מאויש ששו...	חדשות - הקבינט הביטחוני: הכטבמ ככהנ יורט בהצלחה. Please contact us ממזרח.הופעלו התרעות על פי מדיניות.	https://t.me/News_cabinet_news/172881	2025-01-09T10:16:06-08:00
הכטבמ ככהנ יורט בהצלחה.	הכטבמ ככהנ יורט בהצלחה.	https://t.me/News_cabinet_news/172880	2025-01-09T10:15:19-08:00
Please contact us - האירוע הסתיים.	Please contact us - האירוע הסתיים.	https://t.me/News_cabinet_news/172879	2025-01-09T10:11:03-08:00
🔁🖼	Forwarded From צופר - צבע אדום	https://t.me/News_cabinet_news/172878	2025-01-09T10:07:43-08:00
🔁 🔴 צבע אדום (09/01/2025): 20:07: • מערב הנגב: גבולות (30 שניות...	Forwarded From צופר - צבע אדום🔴 צבע אדום (01/09/2025):20:07:• מערב הנגב: גבולות (30 שניות)צופר - צבע אדום	https://t.me/News_cabinet_news/172877	2025-01-09T10:07:42-08:00
Please contact us, please contact us. יירוט שלא צלחו. הלל ביט...	Please contact us, please contact us. יירוט שלא צלחו.הלל ביטון רוזן	https://t.me/News_cabinet_news/172876	2025-01-09T10:07:22-08:00
דובר צה-ל: ראשוני: הופעלה התרעה בגבולות, הפרטים בבדיקה.	דובר צה-ל:ראשוני: הופעלה התרעה בגבולות, הפרטים בבדיקה.	https://t.me/News_cabinet_news/172875	2025-01-09T10:07:06-08:00
↩️ כטבמ שככה״נ שוגר מתימן.	חדשות - הקבינט הביטחוני: ✈️ חדירת כלי טיס עוין (09/01/2025): 20:05: • מערב הנגב: גבולות צופר - צבע אדום כטבמ שככה״נ שוגר מתימן.	https://t.me/News_cabinet_news/172874	2025-01-09T10:06:30-08:00
🔁🖼	Forwarded From צופר - צבע אדום	https://t.me/News_cabinet_news/172873	2025-01-09T10:05:43-08:00
🔁 ✈️ חדירת כלי טיס עוין (09/01/2025): 20:05: • מערב הנגב: גבולות...	Forwarded From: 09/01/2025:20:05:• מערב הנגב: גבולות צופר - צבע אדום	https://t.me/News_cabinet_news/172872	2025-01-09T10:05:41-08:00
🖼 Please contact us: Please contact us מפקד גדוד ״צברא״ בארג...	Please contact us. Please contact us. Please contact us, please contact us. Please contact us, Home page Please contact us. Home page Please contact us. Please, contact us, please contact us Please contact us. Please contact us for more details ומתחמי טרור במרחב. Please contact us, please contact us. בגדוד ״צברא״. חמזה היה אחראי על העברת אמצעי לחימה למחבלי החמאס בגדוד ויחד עם שהין קידמו מתווי טרור נגד כוחות צה‎‎ Please contact us.	https://t.me/News_cabinet_news/172870	2025-01-09T09:53:57-08:00
🎬 -מטרה וודאית, מבצע, מטרה הופלה-: עשרות טילים ויותר מ-100 כטב-מ...	-מטרה וודאית, מבצע, מטרה הופלה-:עשרות טילים ויותר מ-100 כטב-מים מתימן יורטו. www.idf.il/263423	https://t.me/News_cabinet_news/172869	2025-01-09T09:07:09-08:00
Home 9.1.25 | 5:40 p.m. פיצוצי...	Home 9.1.25 | 17:40 Please contact us, please contact us ערב שקטמועצה אזורית הגליל העליון	https://t.me/News_cabinet_news/172868	2025-01-09T07:46:19-08:00
📢 דוברות קריית שמונה: הודעה מספר 913 | Home | 01/09/25 April 17:...	📢 דוברות קריית שמונה: הודעה מספר 913 | Home | 09.01.25 תושבים יקרים,החל מהשעה 17:00 ועד השעות הקטנות של הלילה ייתכנו Please contact us. Please contact us.	https://t.me/News_cabinet_news/172867	2025-01-09T07:31:46-08:00
פרשת ה-rpg: לאחר למעלה משבוע - טיל הנ״ט בג׳נין הוסגר למערכת הביטח...	פרשת ה-rpg: לאחר למעלה משבוע - טיל הנ״ט בג׳נין הוסגר למערכת הביטחון.הלל ביטון רוזן	https://t.me/News_cabinet_news/172866	2025-01-09T02:55:43-08:00
↩️ שווא	חדשות - הקבינט הביטחוני: 🔴 צבע אדום (09/01/2025): 10:12: • עוטף עזה: מגן, עין הבשור (15 שניות) צופר - צבע אדום שווא	https://t.me/News_cabinet_news/172865	2025-01-09T00:15:51-08:00
🔁🖼	Forwarded From צופר - צבע אדום	https://t.me/News_cabinet_news/172864	2025-01-09T00:12:43-08:00
- צבע אדום	Forwarded From צופר - צבע אדום🔴 צבע אדום (01/09/2025):10:12:• עוטף עזה: מגן, עין הבשור (15 שניות)צופר - צבע אדום	https://t.me/News_cabinet_news/172863	2025-01-09T00:12:41-08:00
🔁🎬 חשיפה: בית הספר לרחפנים ששינה את פני הלחימה בשדה הקרב | אדיר...	Forwarded From אדיר לחקים - חדשות ועדכוניםחשיפה: בית הספר לרחפנים ששינה את Home page | About us: https://www.instagram.com/reel/DEk4FyhsCnj/?igsh=djE4cmE4bHpsMXNj	https://t.me/News_cabinet_news/172862	2025-01-08T11:47:44-08:00
↩? אל, לוחם שרי...	חדשות - הקבינט הביטחוני: מצורפת הודעת דובר צה-ל בנושא שמותיהם של About us: https://IDFANC.activetrail.biz/ANC0801202509863 מצורף Please contact us, please contact us. Please: https://www.idf.il/59780 Please contact us: - סמ״ר מתתיהו יעקב פרל (Matityahu Ya’akov Perel), 22, 46, עוצבת ׳עקבות הברזל׳ (401) (Kanaoo Kasa), 22, 22, 46, 46, 401, 401 בקרב בצפון רצועת עזה.	https://t.me/News_cabinet_news/172861	2025-01-08T11:33:40-08:00
Please contact us What do you mean: ht...	Please contact us נמסרה למשפחותיהם: https://IDFANC.activetrail.biz/ANC0801202509863מצורף קישור לאתר צה-ל, בו About us: https://www.idf.il/59780באירוע Please contact us. נוסף אשר הודעה נמסרה למשפחתו. שמו טרם הותר לפרסום ויפורסם בהמשך. 46, עוצבת 'עקבות הברזל' (401)	https://t.me/News_cabinet_news/172860	2025-01-08T11:33:06-08:00
*שר האוצר בצלאל סמוטריץ׳ בלייב עם הגולשים:* אנחנו מכינים עכשיו שי...	*שר האוצר בצלאל סמוטריץ׳ בלייב עם הגולשים:*אנחנו מכינים עכשיו Please contact us. אנחנו מכינים לחמאס גיהנם. Home page את זה עוד יותר כשעוד מספר ימים אנחנו מגיעים לשולחן חזקים יותר עם טראמפ בבית הלבן. Please contact us.	https://t.me/News_cabinet_news/172859	2025-01-08T10:39:06-08:00
Please contact us: Please contact us. במרחב הגליל העליוןב...	Please contact us. Home page שגרתית, אין חשש לאירוע ביטחוני.	https://t.me/News_cabinet_news/172858	2025-01-08T09:47:30-08:00
All rights reserved.	Home page	https://t.me/News_cabinet_news/172857	2025-01-08T09:25:19-08:00
*ראש הממשלה בנימין נתניהו:* בשמי ובשם רעייתי, אני מבקש להביע צער ...	*ראש הממשלה בנימין נתניהו:*בשמי ובשם רעייתי, אני מבקש להביע צער Please contact us. All rights reserved. ועאישה בנובמבר 23, ורצינו להשיב כך גם את יוסף ואת חמזה.אני שולח Please contact us. Please contact us. חטופינו הביתה - החיים והחללים כאחד.	https://t.me/News_cabinet_news/172856	2025-01-08T08:39:17-08:00
Please contact us. אותרה בתת קרקע גופ...	Please contact us. אותרה בתת קרקע גופתו של יוסף אלזיאדנה במנהרה נמצאו ממצאים Home page מחבלים ששמרו על השניים. Home page Home page מודיעיני של מפקדת השו-ן, אמ-ן, שב-כ, פיקוד דרום, אוגדת עזה לוחמי Please contact us. Home page	https://t.me/News_cabinet_news/172855	2025-01-08T08:09:16-08:00
Please contact us: Please contact us אלזיאדנה חולצה מהמרחב ...	Please contact us: Please contact us Please contact us. הגופה אותרה בעקבות מידע מודיעיני שהוביל למנהרה בה הוחזק, ובמבצע מיוחד של צה״ל והשב״כ. - Please contact us. Home page את השניים. Please contact us. Please contact us, please contact us היה בעת האחרונה. About us	https://t.me/News_cabinet_news/172854	2025-01-08T08:04:53-08:00
דובר צה-ל: צה״ל ושב״כ איתרו והשיבו את גופתו של החטוף יוסף אלזיאדנ...	Please contact us Home page Yes, please, please, please, please contact me. Please contact us. Please, please contact us, please contact us, Please contact us, please contact us Please contact us. ומשטרת ישראל; Please contact us, please contact us, מסר את ההודעה למשפחה. Please contact us. Please contact us והחטופים מהר ככל הניתן.	https://t.me/News_cabinet_news/172853	2025-01-08T07:59:52-08:00
↩️ שר הביטחון ישראל כ-ץ: אני מבקש להביע תנחומים עמוקים למשפחת אלז...	חדשות - הקבינט הביטחוני: משפחות החטופים יוסף וחמזה אל-זיאדנה Please contact us. Please contact us. Please contact us Please contact us ב-7 Please contact us Please contact us. Please contact us, please contact us. Home page Please contact us, please contact us. Please contact us - Please contact us Please contact us, please contact us. Please contact us, please contact us.	https://t.me/News_cabinet_news/172852	2025-01-08T07:42:39-08:00
Home page בשבי חמאס וחולצו ע״י צ...	Home page Please contact us.	https://t.me/News_cabinet_news/172851	2025-01-08T07:27:13-08:00
↩️ אין נפגעים.	חדשות - הקבינט הביטחוני: ראשוני: חשד לירי שבוצע לעבר רכב בכיכר אלמניה בגוש עציון. דיווח על נפגע אחד. כוחות בדרכם. הלל ביטון רוזן אין נפגעים.	https://t.me/News_cabinet_news/172850	2025-01-08T06:30:40-08:00
ראשוני: חשד לירי שבוצע לעבר רכב בכיכר אלמניה בגוש עציון. דיווח על...	ראשוני: חשד לירי שבוצע לעבר רכב בכיכר אלמניה בגוש עציון. Please contact us.	https://t.me/News_cabinet_news/172849	2025-01-08T06:20:37-08:00
↩️ *דובר שר הביטחון אדיר דהן:* דובר צה-ל, שהתנצל לא מכבר על שחרג ...	חדשות - הקבינט הביטחוני: דובר צה-ל: צה-ל מנהל מערכת תחקירים מקיפה לשיפור ההגנה על המדינה ואזרחיה. Home page - Home page גם אלה שמבצעים את התחקירים. קשב פיקודי חסר בלחימה, please, please צה-ל משתף פעולה באופן מלא עם מבקר המדינה, למרות… *דובר שר הביטחון אדיר דהן:*דובר צה-ל, שהתנצל לא מכבר על שחרג מסמכותו, ותקף את הדרג המדיני - שוב חורג מסמכותו, תוקף ומטיף מוסר לדרג המדיני.התנצלות הפעם לא תספיק.*תקשורת שר הביטחון*	https://t.me/News_cabinet_news/172848	2025-01-08T05:37:52-08:00
Please contact us.	Please contact us.	https://t.me/News_cabinet_news/172847	2025-01-08T05:11:03-08:00
דובר צה-ל: צה-ל מנהל מערכת תחקירים מקיפה לשיפור ההגנה על המדינה ו...	Please contact us ואזרחיה. Home page - Home page גם אלה שמבצעים את התחקירים. Please contact us. Please contact us, please contact us. כבר בימים אלה מתקיימות 18 ביקורות מבקר בצה״ל. Please contact us. Please contact us. Please contact us. באופן מקצועי מהר ככל שניתן. Please contact us לייעוץ משפטי. Please contact us. Please contact us. Home page Please contact us. Please contact us, please contact us. Please contact us, please contact us. Home page כבר שנה ושלשה חודשים ברצף. World Warehouse התקשורת.	https://t.me/News_cabinet_news/172846	2025-01-08T05:01:58-08:00
🔁🎬 אל תפספסו! עמוד האינסטגרם: https://www.instagram.com/adir.le...	Forwarded From: https://www.instagram.com/adir.lehakim?igsh=dzY3MWI5bmlnM3Vt&amp;utm_source=qrעמוד הטיקטוק: https://www.tiktok.com/@adirlehakim?_t=ZS-8stRQ9IU37v&amp;_r=1	https://t.me/News_cabinet_news/172845	2025-01-08T04:27:53-08:00
🔁🖼	Forwarded From צופר - צבע אדום	https://t.me/News_cabinet_news/172844	2025-01-08T03:37:08-08:00
🔁 🔴 צבע אדום (08/01/2025): 13:37: • עוטף עזה: כרם שלום (15 שניו...	Forwarded From צופר - צבע אדום🔴 צבע אדום (08/01/2025):13:37:• עוטף עזה: כרם שלום (15 שניות)צופר - צבע אדום	https://t.me/News_cabinet_news/172843	2025-01-08T03:37:07-08:00
🔁🎬 אל תפספסו! עמוד האינסטגרם: https://www.instagram.com/adir.le...	Forwarded From: https://www.instagram.com/adir.lehakim?igsh=dzY3MWI5bmlnM3Vt&amp;utm_source=qrעמוד הטיקטוק: https://www.tiktok.com/@adirlehakim?_t=ZS-8stRQ9IU37v&amp;_r=1	https://t.me/News_cabinet_news/172842	2025-01-08T03:22:13-08:00
*אמברגו לפרסום: יום (ד’) בשעה 13:00* דובר צה״ל: *בתוך יממה: הושמד...	*אמברגו לפרסום: יום (ד’) בשעה 13:00*דובר צה״ל:*בתוך יממה: הושמדו חמישה About us - About us - About us החטיבתי 300 בדרום לבנון*כוחות צוות הקרב החטיבתי 300 בפיקוד אוגדה 146, Home page ישראל ולבנון תוך שמירה על הסכם הפסקת האש. Please contact us Please contact us. Home page Please contact us, please contact us. Please contact us. רקטות לטווחבינוני, מוסתרת בשטח הררי. Please contact us. והוחרמו בדרום לבנון: https://bit.ly/3DJ2f7rמצורף תיעוד של המשאית עם הרקטות About us: https://bit.ly/4iZrfYaמצורף תיעוד של פעילות About us: https://bit.ly/42c9FtUמצורפות תמונות של אמצעי About us:https://idfanc.activetrail.biz/IDFANC05012025מצורפות Home page: https://idfanc.activetrail.biz/IDFANC0512025	https://t.me/News_cabinet_news/172841	2025-01-08T02:59:36-08:00
↩️ דובר צה-ל: ראשוני: כלי טיס של חיל האוויר תקף חוליית מחבלים במר...	חדשות - הקבינט הביטחוני: הלל ביטון רוזן: ראשוני: כלי טיס תקף במרחב טמון מחבלים חמושים. Please contact us Yes, please, please, please.	https://t.me/News_cabinet_news/172840	2025-01-07T23:58:54-08:00
Please note: Please contact us.	Please note: Please contact us.	https://t.me/News_cabinet_news/172839	2025-01-07T23:58:09-08:00
Home page הים נבדק עם מדובר בפע...	Home page הים נבדק עם מדובר בפעילות של חיל הים	https://t.me/News_cabinet_news/172838	2025-01-07T14:42:27-08:00
🔁 GPS GPS והקריות מדווחים על שיבושים ב-GPS	Forwarded From אדיר לחקים - חדשות ועדכוניםתושבי חיפה והקריות מדווחים על GPS שיבושים ב-GPS	https://t.me/News_cabinet_news/172837	2025-01-07T09:59:07-08:00
↩️ About us: https://www.now14.co.il/article/1088582	חדשות - הקבינט הביטחוני: תושבי שתולה שרק לאחרונה הגיעו לבית Please contact us. Home page צה״ל. Please contact us: Please note: https://www.now14.co.il/article/1088582www.now14.co.il-המגדל המסוכן-: תושבים בשתולה מפחדים לחזור Home page All rights reserved. Home page כוחותינו • המגדל נמצא בעייתא א-שעב ומהווה איום לירי נ״ט בכינון ישיר	https://t.me/News_cabinet_news/172836	2025-01-07T07:52:58-08:00
🔁🖼 Please contact us וחודשיים האחרונים הופתע...	Forwarded From : Please contact us. Home page צה״ל. Please contact us: Please contact us המגדל הזה מיד לפני שאנו חוזרים הביתה-. What about?	https://t.me/News_cabinet_news/172835	2025-01-07T05:43:05-08:00
↩️ מצורף שם החלל: - סמ״ר עידו שמיח (Ido Samiach), בן 20, מגני תקו...	חדשות - הקבינט הביטחוני: מצורפת הודעת דובר צה-ל בנושא שמו של חלל צה״ל אשר הודעה נמסרה למשפחתו: https://IDFANC.activetrail.biz/ANC07012025831231745 מצורף קישור לאתר Please contact us: https://www.idf.il/59780 מצורף שם החלל: - סמ״ר עידו שמיח (Ido Samiach), בן 20, מגני תקווה, סמל צוות Please contact us, please contact us, please contact us.	https://t.me/News_cabinet_news/172834	2025-01-07T04:23:27-08:00
Please contact us About: https://IDFANC.activetrai...	Please contact us למשפחתו: https://IDFANC.activetrail.biz/ANC07012025831231745מצורף קישור לאתר צה-ל, בו מפורסמים About us: https://www.idf.il/59780	https://t.me/News_cabinet_news/172833	2025-01-07T04:23:09-08:00
Please contact us: השפל שאירע כאן אתמ...	Please contact us: Please contact us. Home page המחבלים. Please contact us -	https://t.me/News_cabinet_news/172832	2025-01-07T02:28:55-08:00
All rights reserved. החלל: - רס״ן דביר ציון ר...	All rights reserved. החלל: - רס״ן דביר ציון רווח (Dvir Zion Revah), בן 28, מירושלים, מפקד פלוגה בגדוד 932, Yes, please, please, please.	https://t.me/News_cabinet_news/172831	2025-01-06T22:30:37-08:00
Please contact us למשפחתו: https://IDFANC.activetrai...	Please contact us למשפחתו: https://IDFANC.activetrail.biz/ANC0701202575644מצורף קישור לאתר צה-ל, בו מפורסמים About us: https://www.idf.il/59780	https://t.me/News_cabinet_news/172830	2025-01-06T22:30:37-08:00
Please contact us טמון שבחטיבת הבקעה וה...	Please contact us טמון שבחטיבת הבקעה והעמקים, פרטים נוספים בהמשך.	https://t.me/News_cabinet_news/172829	2025-01-06T16:32:42-08:00
About us: About us: About us: About us בזירת איו״ש. עד אז לא ...	About us: About us: About us: About us Please contact us.	https://t.me/News_cabinet_news/172828	2025-01-06T07:34:25-08:00
↩️ Please contact us: Please contact us חשוד. אין נפגעים.	חדשות - הקבינט הביטחוני: הלל ביטון רוזן: ראשוני: אירוע ירי לעבר רכב סמוך לסלפית, 3 פצועים ככל הנראה. Please contact us: Please contact us: Please contact us חשוד.אין נפגעים.	https://t.me/News_cabinet_news/172827	2025-01-06T07:30:49-08:00
↩️ About us נוהל מעצר ללא נפגעים	חדשות - הקבינט הביטחוני: הצלה יו-ש ללא גבולות : דיווח על ירי : : בכניסה לאריאל מדובר בירי כוחותינו נוהל מעצר ללא נפגעים	https://t.me/News_cabinet_news/172826	2025-01-06T07:28:11-08:00
↩️ הלל ביטון רוזן: ראשוני: אירוע ירי לעבר רכב סמוך לסלפית, 3 פצוע...	חדשות - הקבינט הביטחוני: הצלה יו-ש ללא גבולות : דיווח על ירי About us: About us: About us: About us: About us: About us לסלפית, 3 פצועים ככל הנראה.	https://t.me/News_cabinet_news/172825	2025-01-06T07:27:24-08:00
Home page ההשבעה שלו-: -בדיוק לזה...	Home page ההשבעה שלו-: -בדיוק לזה התכוונתי. Yes, please, please, please. Don't worry, don't worry. About us	https://t.me/News_cabinet_news/172823	2025-01-06T07:26:32-08:00
הצלה יו-ש ללא גבולות : דיווח על ירי בכניסה לאריאל	הצלה יו-ש ללא גבולות : דיווח על ירי בכניסה לאריאל	https://t.me/News_cabinet_news/172822	2025-01-06T07:25:24-08:00
About us: About us: About us הערכת-מצב בנושא יהודה-ושומ...	Please contact us Home page Please contact us. Please contact us. Please contact us.	https://t.me/News_cabinet_news/172821	2025-01-06T07:24:04-08:00
↩️ פלילי	חדשות - הקבינט הביטחוני: ראשוני: התקבל דיווח על דקירה בחיפה אשה פצועה במקום - הפרטים בבדיקה. פלילי	https://t.me/News_cabinet_news/172820	2025-01-06T05:50:35-08:00
🔁 ראשוני: התקבל דיווח על דקירה בחיפה אשה פצועה במקום - הפרטים בב...	Forwarded From : אשה פצועה במקום - הפרטים בבדיקה.	https://t.me/News_cabinet_news/172819	2025-01-06T04:50:59-08:00
Please contact us: Please contact us את הטרור ביו״ש עמי...	Please contact us: Please contact us את הטרור ביו״שעמית סגל	https://t.me/News_cabinet_news/172818	2025-01-06T04:14:52-08:00
Please contact us. הי״ד, שוטר משטרת ישראל, ...	Please contact us. הי״ד, שוטר משטרת ישראל, שנרצח כאשר בנו בן ה-8 לצידו באוטו.אלעד Please contact us, please contact us גופו העליון.הלל ביטון רוזן	https://t.me/News_cabinet_news/172817	2025-01-06T04:12:19-08:00
↩️ דובר צה-ל: בהמשך להתרעות שהופעלו בשעות 11:11-11:12 בשדרות, איב...	חדשות - הקבינט הביטחוני: דובר צה״ל: ראשוני: הופעלו התרעות במרחב עוטף עזה, הפרטים בבדיקה. דובר צה-ל:בהמשך להתרעות שהופעלו בשעות 11:11-11:12 בשדרות, איבים וניר עם, זוהו שלושה שיגורים שחצומצפון רצועת עזה.חיל האוויר יירט Please, please, please contact us. אין נפגעים.	https://t.me/News_cabinet_news/172816	2025-01-06T01:46:03-08:00
*דוברות עיריית שדרות* 2 אזעקות -צבע אדום- בשדרות - נורו שלוש רקטו...	*דוברות עיריית שדרות*2 אזעקות -צבע אדום- בשדרות - נורו שלוש רקטות - Please contact us, please contact us. השלישית. Please contact us. נגרם נזק קל לרכוש. ירון ששון, דובר העירייה	https://t.me/News_cabinet_news/172815	2025-01-06T01:29:38-08:00
↩️🖼 צבע אדום בעוטף - 3 שיגורים לאזור שדרות: אחד התפוצץ בשטח העיר...	חדשות - הקבינט הביטחוני: דוברות מד-א: בהמשך לאזעקות שנשמעו בדקות Please contact us, please contact us דיווחים. בשלב זה לא ידוע על נפגעים. עדכון בהמשך במידת הצורך. צבע אדום בעוטף - 3 שיגורים לאזור שדרות: אחד התפוצץ בשטח העיר, אחד Please contact us. לפני זמן קצרדורון קדוש	https://t.me/News_cabinet_news/172814	2025-01-06T01:28:14-08:00
Please contact us: Please contact us צוותי מד-א יצאו לסרוק...	Please contact us: Please contact us Please contact us. בשלב זה לא ידוע על נפגעים. עדכון בהמשך במידת הצורך.	https://t.me/News_cabinet_news/172813	2025-01-06T01:16:36-08:00
דובר צה״ל: ראשוני: הופעלו התרעות במרחב עוטף עזה, הפרטים בבדיקה.	דובר צה״ל:ראשוני: הופעלו התרעות במרחב עוטף עזה, הפרטים בבדיקה.	https://t.me/News_cabinet_news/172812	2025-01-06T01:13:37-08:00
🔁🖼	Forwarded From צופר - צבע אדום	https://t.me/News_cabinet_news/172811	2025-01-06T01:12:32-08:00
🔁 🔴 צבע אדום (06/01/2025): 11:11: • עוטף עזה: ניר עם, שדרות, אי...	Forwarded From צופר - צבע אדום🔴 צבע אדום (06/01/2025):11:11:• עוטף עזה: ניר עם, שדרות, איבים (15 שניות)11:12:• עוטף עזה: שדרות, איבים (15 שניות)צופר - צבע אדום	https://t.me/News_cabinet_news/172810	2025-01-06T01:12:31-08:00
🖼 Please contact us: Please contact us. מלחמה השערה	Please contact us: Please contact us. השערה	https://t.me/News_cabinet_news/172807	2025-01-06T01:11:09-08:00
השר לביטחון לאומי, איתמר בן גביר: -שולח תנחומים מעומק הלב ומשתתף ...	About us:-שולח תנחומים מעומק הלב ומשתתף Please contact us. Please contact us. ומתפלל יחד עם כל עם ישראל לרפואת הפצועים. Please contact us, please contact us. Please contact us, please contact us. Please contact us, please contact us. תושבי הרשות. Please contact us. מי שחותר להפסקת מלחמה בעזה - יקבל מלחמה ביו-ש-	https://t.me/News_cabinet_news/172806	2025-01-06T01:06:25-08:00
Please contact us: Please contact us למשפחות שלושת הנרצ...	Please contact us: Please contact us Please contact us, please contact us. Please contact us. שסייע להם. אף אחד לא ינקה.	https://t.me/News_cabinet_news/172805	2025-01-06T01:05:49-08:00
🎬 תיעוד מהרגעים של היריות בפיגוע	תיעוד מהרגעים של היריות בפיגוע	https://t.me/News_cabinet_news/172804	2025-01-05T23:32:05-08:00
הצלה יו-ש ללא גבולות : בהמשך לפיגוע ירי באזור פונדוק דווח על 2 נפ...	הצלה יו-ש ללא גבולות : בהמשך לפיגוע ירי באזור פונדוק דווח על 2 About us	https://t.me/News_cabinet_news/172803	2025-01-05T23:25:17-08:00
Please contact us: Please contact us נוספים בהמשך.	דובר צה-ל:ראשוני: התקבל דיווח על פיגוע ירי סמוך לקדומים, פרטים נוספים בהמשך.	https://t.me/News_cabinet_news/172802	2025-01-05T23:24:51-08:00
*לשכת ראש הממשלה:* בניגוד לנטען, החמאס לא העביר רשימת שמות חטופים...	*לשכת ראש הממשלה:*בניגוד לנטען, החמאס לא העביר רשימת שמות חטופים עד לרגע זה.	https://t.me/News_cabinet_news/172801	2025-01-05T10:27:31-08:00
↩️ Please contact us. המשמעות: רה-מ מסתפק בש...	חדשות - הקבינט הביטחוני: נתניהו מקיים הערב התייעצויות ביטחונית Home page נתניהו. המשמעות: רה-מ מסתפק בשלב זה בסנקציה של אי קידום החוקים ונמנע Home page	https://t.me/News_cabinet_news/172800	2025-01-05T08:04:58-08:00
Please contact us, please contact us, please contact us בהובלת הש...	Please contact us, please contact us, please contact us Please contact us, please contact us. Please contact us, please contact us. הצרכים שעולים מהשטח. Please contact us, please contact us Please contact us for more information צמיחה של האזור כולו. Please contact us, please contact us. Home page Please contact us -.	https://t.me/News_cabinet_news/172799	2025-01-05T07:22:50-08:00
Home page	Home page	https://t.me/News_cabinet_news/172798	2025-01-05T07:08:35-08:00
🖼 Homework של בירת סוריה, דמש...	Please contact us Please contact us, please contact us. בטלגרםhttps://t.me/News_cabinet_news	https://t.me/News_cabinet_news/172797	2025-01-05T04:43:42-08:00
🖼 שר הביטחון כ-ץ בפיקוד הצפון: -התנאי הראשון לקיום ההסכם הוא נסי...	Please contact us מוחלטת של חיזבאללה מעבר לליטני - דבר שעדיין לא קרה. אם התנאי הזה לא יתקיים - לא יהיה הסכם-	https://t.me/News_cabinet_news/172796	2025-01-05T02:03:54-08:00
*אמברגו לפרסום: היום (א׳) בשעה 11:00* דובר צה״ל: *בפסגת הר החרמון...	*אמברגו לפרסום: היום (א׳) בשעה 11:00*דובר צה״ל:*בפסגת הר החרמון הסורי: Home page (810) Please contact us (810) Please contact us Home page Home page About us Home page לחימה ואמצעי מודיעין. בהם: מוקשים, מטענים, טילי נ-ט, רקטות ומשגרים.מצורף תיעוד של אמצעי הלחימה שאותרו על-ידי כוחות 'ההרים' (810) בחרמון הסורי: https://bit.ly/3Ppdzs6מצורפות תמונות של אמצעי הלחימה שאותרו והוחרמו: https://IDFANC.activetrail.biz/ANC753973	https://t.me/News_cabinet_news/172795	2025-01-05T01:14:15-08:00
דובר צה-ל: *היום (א') החל משעות הבוקר ועד שעות הצהריים, יתקיים תר...	דובר צה-ל:*היום (א') החל משעות הבוקר ועד שעות הצהריים, יתקיים תרגיל צבאי בבסיס המטה הכללי (הקריה) Please, please contact us. כחלק מגרף האימונים השנתי. אין חשש לאירוע בטחוני.	https://t.me/News_cabinet_news/172794	2025-01-04T20:40:35-08:00
דובר צה-ל: בהמשך להתרעה שהופעלה בתלמי אלעזר, יורט טיל ששוגר מתימן...	Please contact us, please contact us בטרם חצה לשטח הארץ. הופעלו התרעות על פי מדיניות.	https://t.me/News_cabinet_news/172793	2025-01-04T14:37:21-08:00
🎬 Please contact us. שימוש לפי סעיף 27 א' לחוק זכויות יוצרים חדש...	27 א' לחוק About us - About us בטלגרםhttps://t.me/News_cabinet_news	https://t.me/News_cabinet_news/172792	2025-01-04T14:34:04-08:00
🔁 Please contact us, please contact us. (אין חשש מפגיעת שברי...	Forwarded From קבינט מדיני ביטחוני - מוריה אסרף &amp; Doron Kadosh (Doron Kadosh) התרעות רחבות	https://t.me/News_cabinet_news/172791	2025-01-04T14:27:37-08:00
יותר מ8 בומים נשמעו במרחב אשדוד.	יותר מ8 בומים נשמעו במרחב אשדוד.	https://t.me/News_cabinet_news/172790	2025-01-04T14:24:01-08:00
🔁🖼	Forwarded From צופר - צבע אדום	https://t.me/News_cabinet_news/172789	2025-01-04T14:20:11-08:00
🔁 🔴 צבע אדום (01/05/2025): 00:20: • מנשה: תלמי אלעזר (דקה וחצי)...	Forwarded From צופר - צבע אדום🔴 צבע אדום (05/01/2025):00:20:• מנשה: תלמי אלעזר (דקה וחצי)צופר - צבע אדום	https://t.me/News_cabinet_news/172788	2025-01-04T14:20:10-08:00
Please contact us, please contact us אלבג. השר סער, שנמצא בקש...	Please contact us, please contact us אלבג. Please contact us, please contact us. לירי וכל החטופים.	https://t.me/News_cabinet_news/172787	2025-01-04T12:45:12-08:00
↩️ שווא.	חדשות - הקבינט הביטחוני: 🔴 צבע אדום (04/01/2025): 21:17: • עוטף עזה: ארז (15 שניות) צופר - צבע אדום שווא.	https://t.me/News_cabinet_news/172786	2025-01-04T11:28:05-08:00
דובר צה״ל: הופעלו התרעות במרחב עוטף עזה, הפרטים בבדיקה.	Please contact us: please contact us.	https://t.me/News_cabinet_news/172785	2025-01-04T11:19:45-08:00
🔁🖼	Forwarded From צופר - צבע אדום	https://t.me/News_cabinet_news/172784	2025-01-04T11:17:52-08:00
🔁 🔴 צבע אדום (04/01/2025): 21:17: • עוטף עזה: ארז (15 שניות) צו...	Forwarded From: 04/01/2025:21:17: צבע אדום	https://t.me/News_cabinet_news/172783	2025-01-04T11:17:50-08:00
*לשכת שר הביטחון* שר הביטחון ישראל כ-ץ שוחח הערב עם שירה ואלי אלב...	*לשכת שר הביטחון*שר הביטחון ישראל כ-ץ שוחח הערב עם שירה ואלי אלבג, Please contact us. Please contact us. Home page About us Please contact us, Please contact us. Please contact us Please contact us. Please contact us, please contact us. הנחיות ברורות להמשך המו-מ.*תקשורת שר הביטחון*	https://t.me/News_cabinet_news/172782	2025-01-04T09:56:42-08:00
Please contact us ואלי, הוריה של לירי אלב...	Please contact us, Please contact us התקבל ממנה אות חיים מרגשוחשוב Please contact us, Please contact us. Please contact us, About us מי שיעז לפגוע בחטופינו - דמו בראשו.	https://t.me/News_cabinet_news/172781	2025-01-04T09:26:22-08:00
דובר צה-ל: צה-ל תקף במהלך הלילה (ש') בצורה ממוקדת, על סמך Please,...	דובר צה-ל:צה-ל תקף במהלך הלילה (ש') בצורה ממוקדת, על סמך אינדיקציות Please contact us, please contact us. עזה. Please contact us, please contact us. Please contact us. Please contact us. הסיוע ההומניטרי לרצועה. please, please contact us, please contact us, All rights reserved. ארגון הטרור חמאס. Please contact us Please contact us.	https://t.me/News_cabinet_news/172780	2025-01-04T09:21:34-08:00
🎬 פיצוץ מחסן רקטות ברפיח עמית סגל	About us	https://t.me/News_cabinet_news/172779	2025-01-04T07:40:13-08:00
16:51 16:51 רצועת עזה ונפל במר...	16:51 16:51 רצועת עזה ונפל במרחב מעבר ארז.	https://t.me/News_cabinet_news/172778	2025-01-04T07:18:03-08:00
דובר צה״ל: הופעלו התרעות במרחב עוטף עזה, הפרטים בבדיקה.	Please contact us: please contact us.	https://t.me/News_cabinet_news/172777	2025-01-04T07:10:42-08:00
🔁🖼	Forwarded From צופר - צבע אדום	https://t.me/News_cabinet_news/172776	2025-01-04T06:51:20-08:00
🔁 🔴 צבע אדום (04/01/2025): 16:51: • עוטף עזה: נתיב העשרה (15 שנ...	Forwarded From צופר - צבע אדום🔴 צבע אדום (04/01/2025):16:51:• עוטף עזה: נתיב העשרה (15 שניות)צופר - צבע אדום	https://t.me/News_cabinet_news/172775	2025-01-04T06:51:19-08:00
All rights reserved. קדוש	All rights reserved. קדוש	https://t.me/News_cabinet_news/172774	2025-01-04T05:02:56-08:00
🖼 פעם נוספת: סמל החטופים הופיע בשמי ישראל, באזור הצפון. צילומים:...	פעם נוספת: סמל החטופים הופיע בשמי ישראל, באזור הצפון. צילומים: איאן וויט ורונן גאוןגיא ורון	https://t.me/News_cabinet_news/172773	2025-01-04T05:02:05-08:00
שווא	שווא	https://t.me/News_cabinet_news/172772	2025-01-03T21:32:08-08:00
🔁🖼	Forwarded From צופר - צבע אדום	https://t.me/News_cabinet_news/172771	2025-01-03T20:44:43-08:00
🔁 🔴 צבע אדום (04/01/2025): 06:44: • עוטף עזה: נתיב העשרה (15 שנ...	Forwarded From צופר - צבע אדום🔴 צבע אדום (04/01/2025):06:44:• עוטף עזה: נתיב העשרה (15 שניות)צופר - צבע אדום	https://t.me/News_cabinet_news/172770	2025-01-03T20:44:43-08:00
↩️ דובר צה-ל: בהמשך להתרעות שהופעלו בשעה 23:16 בשדרות ובאיבים, מד...	חדשות - הקבינט הביטחוני: Photo דובר צה-ל:בהמשך להתרעות שהופעלו בשעה 23:16 בשדרות ובאיבים, מדוברבזיהוי שווא	https://t.me/News_cabinet_news/172769	2025-01-03T13:30:19-08:00
🔁🖼	Forwarded From צופר - צבע אדום	https://t.me/News_cabinet_news/172768	2025-01-03T13:16:01-08:00
- צבע אדום	Forwarded From צופר - צבע אדום🔴 צבע אדום (03/01/2025):23:16:• עוטף עזה: שדרות, איבים (15 שניות)צופר - צבע אדום	https://t.me/News_cabinet_news/172767	2025-01-03T13:16:00-08:00
Please contact us, please contact us דרמטי: צהל ושב״כ ה...	Please contact us, please contact us דרמטי: צהל ושב״כ הכריזו מלחמה על משילות חמאס בעזה. Home page Please contact us, please contact us ובפעילות כירורגית. יעד התקיפה: יחידות האכיפה והאלימות שמשתלטות על הסיוע ההומניטרי. Home page ומפקד משטרת חמאס בעזה. Please contact us: Please contact us	https://t.me/News_cabinet_news/172766	2025-01-03T13:04:36-08:00
About us: תקיפות של צהל בצפון הרצועה אלמוג בוקר	About us: תקיפות של צהל בצפון הרצועהאלמוג בוקר	https://t.me/News_cabinet_news/172765	2025-01-03T12:21:14-08:00
דובר צה-ל: בהמשך להתרעה שהופעלה בשעה 22:11 בנתיב העשרה, מדובר בזי...	דובר צה-ל:בהמשך להתרעה שהופעלה 22:11 בנתיב העשרה, מדובר בזיהוי שווא.	https://t.me/News_cabinet_news/172764	2025-01-03T12:19:50-08:00
🔁🖼	Forwarded From צופר - צבע אדום	https://t.me/News_cabinet_news/172762	2025-01-03T12:11:43-08:00
🔁 🔴 צבע אדום (03/01/2025): 22:11: • עוטף עזה: נתיב העשרה (15 שנ...	Forwarded From צופר - צבע אדום🔴 צבע אדום (03/01/2025):22:11:• עוטף עזה: נתיב העשרה (15 שניות)צופר - צבע אדום	https://t.me/News_cabinet_news/172761	2025-01-03T12:11:42-08:00
דובר צה״ל: בניגוד לטענות, צה-ל לא תקף בבית החולים האינדונזי בג׳בא...	דובר צה״ל:בניגוד לטענות, צה-ל לא תקף בבית החולים האינדונזי Home page Please contact us. Please contact us. About us Home page הומניטרית ומענה שוטף לבית החולים.	https://t.me/News_cabinet_news/172760	2025-01-03T08:28:51-08:00
↩️ שווא	חדשות - הקבינט הביטחוני: Photo שווא	https://t.me/News_cabinet_news/172759	2025-01-03T07:27:17-08:00
🔁🖼	Forwarded From צופר - צבע אדום	https://t.me/News_cabinet_news/172758	2025-01-03T06:19:26-08:00
- צבע אדום	Forwarded From צופר - צבע אדום🔴 צבע אדום (03/01/2025):16:19:• עוטף עזה: מטווח ניר עם (15 שניות)צופר - צבע אדום	https://t.me/News_cabinet_news/172757	2025-01-03T06:19:25-08:00
דובר צה-ל: בהמשך להתרעות שהופעלו בשעה 13:29 בשדרות, איבים וניר עם...	דובר צה-ל:בהמשך להתרעות שהופעלו בשעה 13:29 בשדרות, איבים וניר עם, Please contact us. Please, please, please contact us. אין נפגעים.	https://t.me/News_cabinet_news/172756	2025-01-03T03:56:54-08:00
🔁 האזעקות בבארי הופעלו בעקבות טזק״א (טיל זעיר קרקע אוויר ) לעבר ...	Forwarded From קבינט מדיני ביטחוני - מוריה אסרף &amp; Doron Kadosh (Doron Kadosh) אוויר) ששוגר לעבר מסוק קרב של חיל האוויר. Please contact us, please contact us. Please contact us. הרצועה (אזור שצה״ל לא נכנס אליו חודשים ארוכים). Please contact us, please contact us Please contact us - Please contact us. האזעקה בשדרות: מטח של 3 רקטות - שתיים ככל הנראה נפלו בשטח פתוח, ואחת שכשלה ונפלה ברצועה. המטח שוגר מצפון הרצועה.	https://t.me/News_cabinet_news/172755	2025-01-03T03:52:36-08:00
↩️ *דוברות מד-א:* בהמשך לאזעקות שנשמעו בדקות האחרונות בגזרת שדרות...	חדשות - הקבינט הביטחוני: שדרות *דוברות מד-א:* בהמשך לאזעקות שנשמעו Please contact us, please contact us לסרוק בזירה בה התקבל דיווח. בשלב זה לא ידוע על נפגעים. עדכון בהמשך במידת הצורך. טל	https://t.me/News_cabinet_news/172754	2025-01-03T03:32:45-08:00
↩️🖼 שדרות	חדשות - הקבינט הביטחוני: זוהו לפחות בין 4-5 שיגורים לאזור. יירוט אחד נצפה במרחב שדרות	https://t.me/News_cabinet_news/172753	2025-01-03T03:32:12-08:00
↩️ זוהו לפחות בין 4-5 שיגורים לאזור. יירוט אחד נצפה במרחב	חדשות - הקבינט הביטחוני: 🔴 צבע אדום (03/01/2025): 13:29: • עוטף עזה: שדרות, איבים, ניר עם (15 שניות) צופר - צבע אדום זוהו לפחות בין 4-5 שיגורים לאזור. יירוט אחד נצפה במרחב	https://t.me/News_cabinet_news/172752	2025-01-03T03:31:27-08:00
🔁🖼	Forwarded From צופר - צבע אדום	https://t.me/News_cabinet_news/172751	2025-01-03T03:29:04-08:00
🔁 🔴 צבע אדום (03/01/2025): 13:29: • עוטף עזה: שדרות, איבים, ניר...	Forwarded From צופר - צבע אדום🔴 צבע אדום (03/01/2025):13:29:• עוטף עזה: שדרות, איבים, ניר עם (15 שניות)צופר - צבע אדום	https://t.me/News_cabinet_news/172750	2025-01-03T03:29:04-08:00
Please contact us: Please contact us ומתחמי פיקוד ושליטה: צה״...	Please contact us. ומתחמי פיקוד ושליטה: צה״ל ושב״ג Please contact us, Please contact us for more information Home page הטרור חמאס ברחבי רצועת עזה, Please contact us Please contact us. Please contact us. Home page Please contact us, please contact us. Please contact us. Please contact us.	https://t.me/News_cabinet_news/172747	2025-01-03T03:19:39-08:00
דובר צה-ל: בהמשך להתרעה שהופעלה בשעה 12:08 בבארי, בוצע ניסיון ייר...	דובר צה-ל:בהמשך להתרעה שהופעלה בשעה 12:08 בבארי, בוצע ניסיון יירוט לעבר שיגור אחד שחצה ממרכז רצועת עזה, נפגעים.	https://t.me/News_cabinet_news/172746	2025-01-03T02:40:02-08:00
🔁🖼	Forwarded From צופר - צבע אדום	https://t.me/News_cabinet_news/172745	2025-01-03T02:08:29-08:00
🔁 🔴 צבע אדום (03/01/2025): 12:08: • עוטף עזה: בארי (15 שניות) צ...	Forwarded From צופר - צבע אדום🔴 צבע אדום (03/01/2025):12:08:• עוטף עזה: בארי (15 שניות)צופר - צבע אדום	https://t.me/News_cabinet_news/172744	2025-01-03T02:08:28-08:00
דובר צה-ל: חיל האוויר יירט לפני זמן קצר כלי טיס בלתי מאויש ששוגר ...	דובר צה-ל: חיל האוויר יירט לפני זמן קצר כלי טיס בלתי מאויש ששוגר מתימן. Please contact us, please contact us.	https://t.me/News_cabinet_news/172743	2025-01-02T23:08:13-08:00
Please contact us: Please contact us האזעקות בתקופה האחרו...	Please contact us: Please contact us Please contact us. Please contact us, please contact us. Please contact us. מסוגל להביא את זה - שיילך.	https://t.me/News_cabinet_news/172742	2025-01-02T19:19:26-08:00
דובר צה-ל: בהמשך להתרעות שהופעלו לפני זמן קצר במרכז הארץ ובדרומה,...	דובר צה-ל: בהמשך להתרעות שהופעלו לפני זמן קצר במרכז הארץ Please contact us. יירוט באיזור מודיעין, הפרטים בבדיקה.	https://t.me/News_cabinet_news/172741	2025-01-02T19:01:09-08:00
🎬 תיעוד מזווית נוספת ממודיעין *אזעקה בסרטון* שימוש לפי סעיף 27 א...	27 א' לחוק זכויות יוצריםחדשות - הקבינט הביטחוני CB בטלגרםhttps://t.me/News_cabinet_news	https://t.me/News_cabinet_news/172740	2025-01-02T18:56:00-08:00
*דוברות מד-א:* עדכון לאזעקות במרכז הארץ ובשפלת יהודה: *בשלב זה לא...	*??? Please contact us.*צוותי מד-א הוזנקו לטפל ב-12 אנשים שנחבלו בדרך למרחב מוגן ו-9 נפגעי חרדה. עדכון בהמשך במידת הצורך. דניאל	https://t.me/News_cabinet_news/172739	2025-01-02T18:52:58-08:00
🎬 Please contact us. שימוש לפי סעיף 27 א' לחוק זכויות יוצרים חדש...	Home page About us - About us	https://t.me/News_cabinet_news/172738	2025-01-02T18:51:07-08:00
דובר צה-ל: בהמשך להתרעות שהופעלו לפני זמן קצר במרכז הארץ ובדרומה,...	דובר צה-ל: בהמשך להתרעות שהופעלו לפני זמן קצר במרכז הארץ Yes, please, please, please. בוצעו ניסיונות יירוט, please, please.	https://t.me/News_cabinet_news/172737	2025-01-02T18:49:08-08:00
Please contact us האחרונות: נכון לרגע...	Please contact us האחרונות: נכון לרגעים אלו לא התקבלו קריאות על נפגעים למעט מקרים Please contact us. עדכון בהמשך במידת הצורך.	https://t.me/News_cabinet_news/172736	2025-01-02T18:48:49-08:00
דובר צה״ל: ראשוני: הופעלו התרעות במספר מרחבים במרכז הארץ ובדרומה ...	Please contact us: Please contact us בעקבות שיגור מתימן, הפרטים בבדיקה.	https://t.me/News_cabinet_news/172735	2025-01-02T18:39:25-08:00
🔁🖼	Forwarded From צופר - צבע אדום	https://t.me/News_cabinet_news/172734	2025-01-02T18:35:14-08:00
🔁 🔴 צבע אדום (03/01/2025): 04:34: • ירושלים: ירושלים - אזור תעש...	Forwarded From צופר - צבע אדום🔴 צבע אדום (03/01/2025):04:34:• ירושלים: ירושלים - אזור תעשייה עטרות, ירושלים - דרום, ירושלים - כפר עקב, ירושלים - מזרח, ירושלים - מערב, ירושלים - מרכז, ירושלים - צפון, בית זית, מבשרת ציון, Please contact us, please contact us. , Please contact us, please contact us רימון, הרצליה - מרכז וגליל ים, חולון, יהוד מונוסון, כפר סירקין, מעש, מקווה ישראל, סביון, פתח תקווה, קריית אונו, רמת גן - מזרח, רמת גן - Please contact us, please contact us גלילות, מתחם פי גלילות (דקה וחצי)• שרון: גבעת חן, אורנית, אלישמע, , Please contact us, please contact us , , , , , , , , אלקנה, עץ אפרים, שערי תקווה, מרכז אזורי דרום השרון (דקה וחצי)• ירקון: גמזו, חשמונאים, כפר דניאל, כפר רות, לפיד, מבוא חורון, מבוא מודיעים, מודיעין - ליגד סנטר, מודיעין מכבים רעות, מודיעין עילית, , נוף איילון, שילת, שעלבים, אלעד, בארות יצחק, בני עטרות, גבעת , Please contact us Please, please contact us, please contact us, For example: Please contact us, please contact us , please, please contact us, please contact us Please contact us, please contact us , Please contact us, please contact us, please contact us. השבעה, נען, נצר חזני, סתריה, עזריה, פדיה, פתחיה, רמות מאיר, גנות (דקה וחצי)• שפלת יהודה: בית נקופה, הר אדר, מעלה החמישה, צובה, Please contact us - Please contact us , , ,, , נווה שלום, נחם, נחשון, נתיב הל''ה, צלפון, צרעה, רטורנו - גבעת שמש, שער הגיא, תעוז, תרום, אבו גוש, בית מאיר, בר גיורא, גבעת יערים, יד Please, please contact us, please contact us please, please contact us, please contact us שואבה, שורש, אזור תעשייה ברוש, זכריה, שדות מיכה, צומת האלה (דקה וחצי, דקה)• יהודה: אבו נוור, אלון שבות, אלעזר, אפרת, ביתר עילית, בת Please contact us, please contact us , מעלה רחבעם, נווה דניאל, נוקדים, פארק תעשיות מגדל עוז, פני קדם, ראש צורים, שדה בר, תקוע, צומת הגוש, גבעות (דקה וחצי)• שומרון: Please contact us, please contact us אסף, דולב, חלמיש, טלמון, כוכב יעקב, נחליאל, נילי, נעלה, עטרת, עלי זהב, פדואל, פסגות, תל ציון, חרשה, כרם רעים, מגרון, נריה, עתופרים וחצי)04:35:• השפלה: רחובות (דקה וחצי)צופר - צבע אדום	https://t.me/News_cabinet_news/172733	2025-01-02T18:35:13-08:00
🔁🖼	Forwarded From צופר - צבע אדום	https://t.me/News_cabinet_news/172730	2025-01-02T18:34:13-08:00
🔁 🔴 צבע אדום (03/01/2025): 04:34: • ירושלים: ירושלים - אזור תעש...	Forwarded From צופר - צבע אדום🔴 צבע אדום (03/01/2025):04:34:• ירושלים: ירושלים - אזור תעשייה עטרות, ירושלים - דרום, ירושלים - כפר עקב, ירושלים - מזרח, ירושלים - מערב, ירושלים - מרכז, ירושלים - צפון, בית זית, מבשרת ציון, Please contact us, please contact us. , Please contact us, please contact us רימון, הרצליה - מרכז וגליל ים, חולון, יהוד מונוסון, כפר סירקין, מעש, מקווה ישראל, סביון, פתח תקווה, קריית אונו, רמת גן - מזרח, רמת גן - Please contact us, please contact us גלילות, מתחם פי גלילות (דקה וחצי)• שרון: גבעת חן, אורנית, אלישמע, , Please contact us, please contact us , , , , , , , , אלקנה, עץ אפרים, שערי תקווה, מרכז אזורי דרום השרון (דקה וחצי)• ירקון: גמזו, חשמונאים, כפר דניאל, כפר רות, לפיד, מבוא חורון, מבוא מודיעים, מודיעין - ליגד סנטר, מודיעין מכבים רעות, מודיעין עילית, , נוף איילון, שילת, שעלבים, אלעד, בארות יצחק, בני עטרות, גבעת , Please contact us Please, please contact us, please contact us, For example: Please contact us, please contact us Please, please contact us please, please contact us, please contact us Please contact us, please contact us , Please contact us, please contact us, please contact us. השבעה, נען, נצר חזני, סתריה, עזריה, פדיה, פתחיה, רמות מאיר, גנות (דקה וחצי)• שפלת יהודה: בית נקופה, הר אדר, מעלה החמישה, צובה, Please contact us - Please contact us , , ,, , נווה שלום, נחם, נחשון, נתיב הל''ה, צלפון, צרעה, רטורנו - גבעת שמש, שער הגיא, תעוז, תרום, אבו גוש, בית מאיר, בר גיורא, גבעת יערים, יד Please, please contact us, please contact us please, please contact us, please contact us שואבה, שורש, אזור תעשייה ברוש ​​(דקה וחצי)• יהודה: אבו נוור, אלון שבות, אלעזר, אפרת, ביתר עילית, בת עין, הר גילה, כפר אלדד, כפר עציון, Please contact us, please contact us Please, please contact us, please contact us ??? Please contact us, please contact us , כרם רעים, מגרון, נריה, עופרים (דקה וחצי)צופר - צבע אדום	https://t.me/News_cabinet_news/172729	2025-01-02T18:34:11-08:00
↩️ דובר צה-ל: בהמשך להתרעות שהופעלו בשעה בשעה 02:54 במרחב עוטף עז...	חדשות - הקבינט הביטחוני: דובר צה״ל: ראשוני: הופעלו התרעות במרחב עוטף עזה, הפרטים בבדיקה. 02:54 מדובר בזיהוי שווא.	https://t.me/News_cabinet_news/172728	2025-01-02T17:03:18-08:00
דובר צה״ל: ראשוני: הופעלו התרעות במרחב עוטף עזה, הפרטים בבדיקה.	דובר צה״ל:ראשוני: הופעלו התרעות במרחב עוטף עזה, הפרטים בבדיקה.	https://t.me/News_cabinet_news/172727	2025-01-02T17:00:45-08:00
🔁🖼	Forwarded From צופר - צבע אדום	https://t.me/News_cabinet_news/172726	2025-01-02T16:54:39-08:00
🔁 🔴 צבע אדום (03/01/2025): 02:54: • עוטף עזה: ניר עם, שדרות, אי...	Forwarded From צופר - צבע אדום🔴 צבע אדום (03/01/2025):02:54:• עוטף עזה: ניר עם, שדרות, איבים (15 שניות)צופר - צבע אדום	https://t.me/News_cabinet_news/172725	2025-01-02T16:54:38-08:00
🔁🎬 דובר צה״ל: מטוסי קרב של חיל האוויר תקפו והשמידו לפני זמן קצר...	Forwarded From צה״ל - הערוץ הרשמידובר צה״ל:מטוסי קרב של חיל האוויר תקפו Please contact us, please contact us. Please contact us, please contact us הארגון. Please contact us, please contact us. Please contact us. Please contact us. וכוחותינו. Please contact us. Please contact us, please contact us. הסכם הפסקת האש. Video is too big	https://t.me/News_cabinet_news/172724	2025-01-02T10:05:08-08:00
↩️🖼	חדשות - הקבינט הביטחוני: בלבנון מדווחים שחיל האוויר החל בגל Home page	https://t.me/News_cabinet_news/172722	2025-01-02T09:51:44-08:00
Interior Design לבנון	Interior Design לבנון	https://t.me/News_cabinet_news/172721	2025-01-02T09:50:01-08:00
*אמברגו לפרסום: היום (ה') בשעה 18:00* דובר צה-ל: *מפקד חיל האוויר...	*אמברגו לפרסום: היום (ה') בשעה 18:00*דובר צה-ל:*מפקד חיל האוויר: -בתוך Please contact us, please contact us. Please contact us - Please contact us, Please contact us Please contact us, please contact us לשטח הארץ: https://bit.ly/4iSGt1jמצורף מידול תלת-מימד של האתר התת-קרקעי לייצור About us: https://bit.ly/49YCsUV	https://t.me/News_cabinet_news/172720	2025-01-02T08:03:07-08:00
*דוברות המשטרה:* בניגוד לפרסומים חסרי אחריות המטעים את הציבור, אי...	*??? אין כל אירוע פח-ע באזור ת-א. Please contact us.	https://t.me/News_cabinet_news/172719	2025-01-02T05:51:20-08:00
↩️ הלל ביטון רוזן: 3 נפגעים אחד מהם מדקירה, ככל הנראה קטטה והרקע ...	חדשות - הקבינט הביטחוני: לפחות ארבעה נפגעים במקום, הפרטים בבדיקה. הלל ביטון רוזן: 3 נפגעים אחד מהם מדקירה, ככל הנראה קטטה והרקע פלילי.	https://t.me/News_cabinet_news/172718	2025-01-02T05:45:59-08:00
↩️ Please contact us.	חדשות - הקבינט הביטחוני: הלל ביטון רוזן: ראשוני: דיווח על טרקטור Please contact us. לפחות ארבעה נפגעים במקום, please.	https://t.me/News_cabinet_news/172717	2025-01-02T05:44:13-08:00
Please contact us: Please contact us אלנקווה בתל אביב.	Please contact us: Please contact us אלנקווה בתל אביב.	https://t.me/News_cabinet_news/172716	2025-01-02T05:43:51-08:00
דובר צה״ל: כלי טיס של חיל האוויר תקפו לפני זמן קצר, באופן ממוקד ו...	דובר צה״ל:כלי טיס של חיל האוויר תקפולפני זמן קצר, באופן ממוקד Home page Home page יונס במרחב ההומניטרי. מתחם הפיקוד והשליטה שימש את מחבלי החמאס לתכנון ולהוצאה לפועל של All rights reserved. Please contact us, please contact us. Please contact us. Please contact us, please contact us. Please contact us. Please contact us.	https://t.me/News_cabinet_news/172715	2025-01-02T05:16:54-08:00
↩️ דובר צה-ל: בהמשך להתרעה שהופעלה בחולית בשעה 11:57, חיל האוויר ...	חדשות - הקבינט הביטחוני: 🔴 צבע אדום (02/01/2025): 11:57: • עוטף עזה: חולית (15 שניות) צופר - צבע אדום דובר צה-ל:בהמשך להתרעה שהופעלה בחולית בשעה 11:57	https://t.me/News_cabinet_news/172714	2025-01-02T02:06:04-08:00
🔁🖼	Forwarded From צופר - צבע אדום	https://t.me/News_cabinet_news/172713	2025-01-02T01:57:55-08:00
🔁 🔴 צבע אדום (01/02/2025): 11:57: • עוטף עזה: חולית (15 שניות) ...	Forwarded From צופר - צבע אדום🔴 צבע אדום (02/01/2025):11:57:• עוטף עזה: חולית (15 שניות)צופר - צבע אדום	https://t.me/News_cabinet_news/172712	2025-01-02T01:57:53-08:00
↩️ דובר צה-ל: בהמשך להתרעה שהופעלה בשעה 23:46 על חדירת כלי טיס Pl...	חדשות - הקבינט הביטחוני: דובר צה-ל: ראשוני: הופעלו התרעות על חדירת כלי טיס עוין באילת, הפרטים בבדיקה. דובר צה-ל:בהמשך להתרעה שהופעלה בשעה 23:46 על חדירת כלי טיס עוין באילת, מדובר בזיהוי שווא.	https://t.me/News_cabinet_news/172711	2025-01-01T13:54:53-08:00
↩️ דובר צה-ל: ראשוני: הופעלו התרעות על חדירת כלי טיס עוין באילת, ...	חדשות - הקבינט הביטחוני: ✈️ חדירת כלי טיס עוין (01/01/2025): 23:46: • אילת: אילת צופר - צבע אדום דובר צה-ל:ראשוני: הופעלו התרעות על חדירת כלי טיס עוין באילת, הפרטים בבדיקה.	https://t.me/News_cabinet_news/172710	2025-01-01T13:51:08-08:00
🔁🖼	Forwarded From צופר - צבע אדום	https://t.me/News_cabinet_news/172709	2025-01-01T13:46:57-08:00
🔁 ✈️ חדירת כלי טיס עוין (01/01/2025): 23:46: • אילת: אילת צופר -...	Forwarded From צופר - צבע אדום✈️ חדירת כלי טיס עוין (01/01/2025):23:46:• אילת: אילת צופר - צבע אדום	https://t.me/News_cabinet_news/172708	2025-01-01T13:46:56-08:00
דובר צה-ל: בהמשך לדיווח הראשוני, בוצע פיגוע דריסה לעבר כוח צה״ל ש...	Please contact us: Please contact us Please contact us להימלט. Home page רפואי בשטח ומשפחתה עודכנה.	https://t.me/News_cabinet_news/172707	2025-01-01T10:54:42-08:00
Home | הדד ליין של ישראל לחמאס - עסקת שחרור חטופים ומחבלים עד שלו...	Home | הדד ליין של ישראל לחמאס - עסקת שחרור חטופים ומחבלים עד שלושה Please contact us, please contact us. ביטון רוזן	https://t.me/News_cabinet_news/172706	2025-01-01T10:13:48-08:00
*לעדכונכם:* שר הביטחון לשעבר, חבר הכנסת יואב גלנט, ימסור הערב הצה...	*לעדכונכם:*שר הביטחון לשעבר, חבר הכנסת יואב גלנט, ימסור הערב הצהרה לציבור. 20:30, 20:30, 20:30, 20:30, 20:30	https://t.me/News_cabinet_news/172705	2025-01-01T09:56:19-08:00
*שר הביטחון ישראל כ-ץ בביקור בנתיבות לאחר ירי הרקטות לעבר העיר: -...	*שר הביטחון ישראל כ-ץ בביקור בנתיבות לאחר ירי הרקטות לעבר העיר: -אם החמאס לא יאפשר בקרוב את שחרור החטופים הישראלים ולא יפסיק את הירי לעבר ישראל - הוא יספוג מכות בעוצמה שלא נראתה בעזה מזה זמן רב-*	https://t.me/News_cabinet_news/172704	2025-01-01T07:34:03-08:00
🔁🎬 דובר צה״ל: אתמול (ג'), זוהו פעילים של ארגון הטרור חיזבאללה מ...	Forwarded From צה״ל - הערוץ הרשמידובר צה״ל:אתמול (ג'), זוהו פעילים של ארגון Home page לבנון לרכב סמוך. Home page Please contact us, Please contact us. ואזרחיה. Video is too big	https://t.me/News_cabinet_news/172703	2024-12-31T21:04:59-08:00
↩️ דובר צה-ל: בהמשך להתרעות שהופעלו במרחב מערב הנגב בשעה 00:00, ז...	חדשות - הקבינט הביטחוני: רקטה אחת יורטה והשניה נפלה בשטח פתוח, אין נפגעים. דובר צה-ל:בהמשך להתרעות שהופעלו במרחב מערב הנגב בשעה 00:00, זוהו Please contact us. נפל בשטח פתוח.	https://t.me/News_cabinet_news/172702	2024-12-31T14:13:02-08:00
↩️ Please contact us, please contact us.	חדשות - הקבינט הביטחוני: כ2 שיגורים בוצעו למרחב. Please contact us, please contact us.	https://t.me/News_cabinet_news/172701	2024-12-31T14:09:00-08:00
↩️ כ2 שיגורים בוצעו למרחב.	חדשות - הקבינט הביטחוני: 🔴 צבע אדום (01/01/2025): 00:00: • מערב הנגב: מעגלים, גבעולים, מלילות, שיבולים, נתיבות (30 שניות) צופר - צבע אדום כ2 שיגורים בוצעו למרחב.	https://t.me/News_cabinet_news/172700	2024-12-31T14:05:40-08:00
↩️ Please contact us.	חדשות - הקבינט הביטחוני: 🔴 צבע אדום (01/01/2025): 00:00: • מערב הנגב: מעגלים, גבעולים, מלילות, שיבולים, נתיבות (30 שניות) צופר - צבע אדום חמאס Please contact us.	https://t.me/News_cabinet_news/172699	2024-12-31T14:05:02-08:00
דובר צה-ל: הופעלו התרעות במרחב מערב הנגב, הפרטים בבדיקה.	דובר צה-ל:הופעלו התרעות במרחב מערב הנגב, הפרטים בבדיקה.	https://t.me/News_cabinet_news/172698	2024-12-31T14:03:02-08:00
מיירט נצפה באוויר.	מיירט נצפה באוויר.	https://t.me/News_cabinet_news/172697	2024-12-31T14:01:32-08:00
↩️ #הניגון השנתי	חדשות - הקבינט הביטחוני: 🔴 צבע אדום (01/01/2025): 00:00: • מערב הנגב: מעגלים, גבעולים, מלילות, שיבולים, נתיבות (30 שניות) צופר - צבע אדום #הניגון השנתי	https://t.me/News_cabinet_news/172696	2024-12-31T14:01:03-08:00
🔁🖼	Forwarded From צופר - צבע אדום	https://t.me/News_cabinet_news/172695	2024-12-31T14:00:34-08:00
🔁 🔴 צבע אדום (01/01/2025): 00:00: • מערב הנגב: מעגלים, גבעולים,...	Forwarded From צופר - צבע אדום🔴 צבע אדום (01/01/2025):00:00:• מערב הנגב: מעגלים, גבעולים, מלילות, שיבולים, נתיבות (30 years)צופר - צבע אדום	https://t.me/News_cabinet_news/172694	2024-12-31T14:00:33-08:00
14: על רקע המבוי הסתום במו-מ לעסקת חטופים, בדרג המדיני ש...	14: על רקע המבוי הסתום במו-מ לעסקת Please, please, contact us. Home page Please contact us המבצעיות - חיסול ושבייה של מאות רבות של מחבלים - אלא גם הלחץ Please contact us. Please contact us. Please contact us, please contact us עזה כבר בזמן הקרוב. Please contact us. Please contact us. Please contact us - Please contact us Home page Please contact us, please contact us. Please contact us. מורג	https://t.me/News_cabinet_news/172691	2024-12-31T10:55:21-08:00
🔁🖼 הודעה משותפת לדובר צה-ל ודוברות שב-כ: צה״ל ושב״כ חיסלו מפקד ...	Forwarded From: Home page Home page (143) ובהכוונת אמ״ן ושב״כ, את המחבל עבד Please, please, please contact us. Please contact us. Home page הרצחני ב-7 באוקטובר. כמו כן, במהלך המלחמה, קידם והוביל מתווי טרור רבים נגד כוחותינו. Please contact us, Yes, please, please, please. Please contact us. הרצחני ב-7 באוקטובר.	https://t.me/News_cabinet_news/172690	2024-12-31T09:33:17-08:00
דובר צה-ל: מסוק יסעור כבוי ששהה על הקרקע התהפך על צידו לפני זמן ק...	Please contact us קצר בעקבות רוח חזקה, נגרם נזק למסוק. Please contact us, please contact us. Home page חיל האוויר.	https://t.me/News_cabinet_news/172689	2024-12-31T08:37:19-08:00
עם חמאס צריך לנהל מו-מ הפוך - לא על מה שניתן להם תמורת החטופים, א...	עם חמאס צריך לנהל מו-מ הפוך - לא על מה שניתן להם תמורת החטופים, אלא Please contact us. Please contact us. Please contact us, please contact us. Please contact us, please contact us. ההומניטרי במואסי והעזתים 90% מהשטח. Please contact us, please contact us Please contact us Please contact us: Please contact us קבע, באופן הדרגתי, בשטחים שיסופחו. המטרה של המהלך אינה להתיישב בעזה אלא להפעיל לחץ *אפקטיבי* לשחרור החט׆פים Please contact us, Please contact us. Please contact us, please contact us. שכואב לו באמת.תמיר מורג	https://t.me/News_cabinet_news/172688	2024-12-31T07:05:09-08:00
🔁🖼 About us: https://www.instagram.com/p/DEPgm22MeJN/?igsh=MXJp...	Forwarded From: https://www.instagram.com/p/DEPgm22MeJN/?igsh=MXJpdHRncDNvNWs0dA==	https://t.me/News_cabinet_news/172687	2024-12-31T04:31:40-08:00
Please contact us. בהצבעות	Please contact us. בהצבעות	https://t.me/News_cabinet_news/172686	2024-12-31T04:28:00-08:00
↩️ לא מדובר בתקיפה ישראלית.	חדשות - הקבינט הביטחוני: בתימן מדווחים על תקיפות בצנעא, בירת תימן. לא מדובר בתקיפה ישראלית.	https://t.me/News_cabinet_news/172685	2024-12-31T04:08:20-08:00
Please do not hesitate to contact us.	Please do not hesitate to contact us.	https://t.me/News_cabinet_news/172684	2024-12-31T04:07:01-08:00
↩️ דובר צה-ל: בהמשך להתרעות שהופעלו בשעה 12:20 במרחב עוטף עזה, שו...	חדשות - הקבינט הביטחוני: דובר צה״ל: ראשוני: הופעלו התרעות במרחב עוטף עזה, הפרטים בבדיקה. דובר צה-ל:בהמשך להתרעות שהופעלו בשעה 12:20 במרחב עוטף עזה, שוגר Please contact us, אין נפגעים.	https://t.me/News_cabinet_news/172683	2024-12-31T02:46:58-08:00
דובר צה״ל: ראשוני: הופעלו התרעות במרחב עוטף עזה, הפרטים בבדיקה.	דובר צה״ל:ראשוני: הופעלו התרעות במרחב עוטף עזה, הפרטים בבדיקה.	https://t.me/News_cabinet_news/172682	2024-12-31T02:23:17-08:00
🔁🖼	Forwarded From צופר - צבע אדום	https://t.me/News_cabinet_news/172681	2024-12-31T02:20:59-08:00
🔁 🔴 צבע אדום (31/12/2024): 12:20: • עוטף עזה: מבטחים, עמיעוז, י...	Forwarded From צופר - צבע אדום🔴 צבע אדום (31/12/2024):12:20:• עוטף עזה: מבטחים, עמיעוז, ישע (15 שניות)צופר - צבע אדום	https://t.me/News_cabinet_news/172680	2024-12-31T02:20:58-08:00
Please contact us: Please contact us מרחב צפון הרצועה בי...	Home page Home page Please contact us, please contact us Please contact us Home page About us Please contact us, please contact us. Please contact us. Home page Please contact us. Please contact us, please contact us. Please contact us. Please contact us.	https://t.me/News_cabinet_news/172679	2024-12-31T00:43:55-08:00
דובר צה-ל: בהמשך להתרעות שהופעלו בשעה 08:54 במטווח ניר עם, מדובר ...	08:54 08:54 בזיהוי שווא.	https://t.me/News_cabinet_news/172678	2024-12-30T23:03:20-08:00
דובר צה-ל: ראשוני: הופעלו התרעות במרחב עוטף עזה, הפרטים בבדיקה.	דובר צה-ל:ראשוני: הופעלו התרעות במרחב עוטף עזה, הפרטים בבדיקה.	https://t.me/News_cabinet_news/172677	2024-12-30T22:58:11-08:00
🔁🖼	Forwarded From צופר - צבע אדום	https://t.me/News_cabinet_news/172676	2024-12-30T22:54:35-08:00
- צבע אדום	Forwarded From צופר - צבע אדום🔴 צבע אדום (31/12/2024):08:54:• עוטף עזה: מטווח ניר עם (15 שניות)צופר - צבע אדום	https://t.me/News_cabinet_news/172675	2024-12-30T22:54:34-08:00
דובר צה-ל: בהמשך להתרעות שהופעלו לפני זמן קצר במרכז הארץ, יירט חי...	דובר צה-ל:בהמשך להתרעות שהופעלו לפני זמן קצר במרכז הארץ, יירט חיל האוויר טיל אחד ששוגר מתימן, Please contact us.	https://t.me/News_cabinet_news/172674	2024-12-30T13:19:10-08:00
🔁 Please contact us. ייתכן שיש קשר	Forwarded From קבינט מדיני ביטחוני - מוריה אסרף &amp; Please contact us (Doron Kadosh) Please contact us. ייתכן שיש קשר	https://t.me/News_cabinet_news/172673	2024-12-30T13:15:01-08:00
*דוברות מד-א:* בהמשך לאזעקות שנשמעו במרכז הארץ ושפלת יהודה בדקות ...	*דוברות מד-א:* בהמשך לאזעקות שנשמעו במרכז הארץ ושפלת יהודה בדקות האחרונות: נכון לרגעים אלו לא התקבלו קריאות על נפגעים למעט מקרים Please contact us. עדכון בהמשך במידת הצורך. דניאל	https://t.me/News_cabinet_news/172672	2024-12-30T13:14:28-08:00
Please contact us: Please contact us שיגור מתימן, הפרטים...	Please contact us שיגור מתימן, הפרטים בבדיקה.	https://t.me/News_cabinet_news/172671	2024-12-30T13:13:09-08:00
🔁🖼	Forwarded From צופר - צבע אדום	https://t.me/News_cabinet_news/172670	2024-12-30T13:11:51-08:00
🔁 🔴 צבע אדום (12/30/2024): 23:09: • מנשה: תלמי אלעזר (דקה וחצי)...	Forwarded From צופר - צבע אדום🔴 צבע אדום (12/30/2024):23:09:• מנשה: תלמי אלעזר (דקה וחצי)23:10:• השפלה: פארק תעשיות פלמחים, ראשון לציון - מזרח, ראשון לציון - מערב, רחובות, אירוס, בית חנן, בית עובד, גן שורק, נטעים, נס Please, please contact us Please contact us, please contact us Please contact us, please contact us, please contact us Please contact us, please contact us, please contact us Please contact us, please contact us Please, please contact us, please contact us דוד, משמר השבעה, נען, נצר חזני, סתריה, עזריה, פדיה, פתחיה, צפריה, - דרום העיר ויפו, תל אביב - מזרח, תל אביב - מרכז העיר, תל אביב - עבר Please contact us, please contact us רימון, הרצליה - מערב, חולון, יהוד מונוסון, מעש, מקווה ישראל, סביון, פתח תקווה, קריית אונו, רמת גן - מזרח, רמת גן - מערב, רמת השרון, גני תקווה, מגשימים, בית עלמין מורשה, סינמה סיטי גלילות, מתחם פי גלילות (דקה וחצי)• ירקון: גמזו, כפר דניאל, מבוא מודיעים, מודיעין - Please contact us, please contact us מזור, נופך, נחלים, רינתיה, בית נחמיה, בית עריף, ברקת, חדיד, טירת יהודה, כפר טרומן, נאות קדומים, שוהם, איירפורט סיטי, מודיעין - ישפרו סנטר (דקה וחצי)• לכיש: פלמחים, גבעת ברנר, אשדוד - א,ב,ד,ה, אשדוד - אזור תעשייה צפוני ונמל, אשדוד - ג,ו,ז, בני דרום, ניר גלים, אביגדור, אורות, Please contact us חלקיה, בני ראם, גדרה, גני טל, חפץ חיים, יבנה, יד בנימין, ינון, כפר Please, please contact us Please, please contact us, please contact us, Please contact us, please contact us, please contact us Please, please contact us Please contact us, please contact us יבנה, שדמה, תחנת רכבת קריית מלאכי - יואב, אזור תעשייה גדרה, מעון צופיה, עזריקם, קדמה, שתולים, אזור תעשייה תימורים, פארק תעשייה ראם (דקה וחצי, 45 שניות, דקה)• שפלת יהודה: אזור תעשייה הר טוב - צרעה, אשתאול, בקוע, גיזו, הראל, זנוח, טל שחר, ישעי, כפר אוריה, לטרון, Please contact us הל''ה, צלפון, צרעה, רטורנו - גבעת שמש, שער הגיא, תעוז, תרום, אזור תעשייה ברוש, צומת האלה, תירוש, זכריה, גבעת ישעיהו, שריגים - לי-און, , שדות מיכה, גפן, צפרירים, לוזית, כפר מנחם, בית ניר (דקה וחצי, דקה)23:11:• ירקון: מודיעין מכבים רעות (דקה וחצי)• לכיש: כפר ורבורג, ורדון, נחלה, ניר בנים, סגולה, שדה עוזיהו, שפיר (45 שניות)• שפלת יהודה: אביעזר, אדרת, בית שמש, גבעות עדן, נווה מיכאל - רוגלית, בית גוברין, גלאון, כפר זוהרים, נחושה, בית מאיר, כסלון (דקה וחצי, דקה, 45 שניות)צופר - צבע אדום	https://t.me/News_cabinet_news/172669	2024-12-30T13:11:50-08:00
Home page רוזן	Home page רוזן	https://t.me/News_cabinet_news/172659	2024-12-30T13:06:54-08:00
15 חודשים ברציפות אוגדה 162 לא זזה מהרצועה. אחרי שהייתה אמורה לסי...	15 Location 162 Location 162 Location Please contact us.98 נחה, 36 עושים קולות של צבא בדרום לבנון.לא הגיע הזמן לנצח את חמאס?נתניהו והרצי משחקים בכאילו. Please contact us - Please contact us	https://t.me/News_cabinet_news/172658	2024-12-30T11:25:29-08:00
רביעי ברציפות של ירי מעזה: 12 רקטות ששוגרו מהרצועה מאז יום שישי. ...	רביעי ברציפות של ירי מעזה: 12 רקטות ששוגרו מהרצועה מאז יום שישי. שישי- רקטה אחתשבת- 2 רקטותראשון-5 רקטותהיום- 3 רקטותאלמוג בוקר	https://t.me/News_cabinet_news/172657	2024-12-30T10:53:02-08:00
Home page צפון הרצועה צריך ל...	Home page צפון הרצועה צריך להחריב‎‎‎ Home page 98 פנימה, ובהמשך גם את 36.162 לבדה, 15 חודשים ברציפות למי ששכח - לא יכולה לנצח את החמאס.הלל ביטון רוזן	https://t.me/News_cabinet_news/172656	2024-12-30T10:49:25-08:00
↩️ דובר צה-ל: בהמשך להתרעות שהופעלו בשעה 20:37 במרחב עוטף עזה, יי...	חדשות - הקבינט הביטחוני: דובר צה״ל: ראשוני: הופעלו התרעות במרחב עוטף עזה, הפרטים בבדיקה. 20:37 Please contact us.	https://t.me/News_cabinet_news/172655	2024-12-30T10:44:06-08:00
דובר צה״ל: ראשוני: הופעלו התרעות במרחב עוטף עזה, הפרטים בבדיקה.	דובר צה״ל:ראשוני: הופעלו התרעות במרחב עוטף עזה, הפרטים בבדיקה.	https://t.me/News_cabinet_news/172654	2024-12-30T10:41:33-08:00
🔁🖼	Forwarded From צופר - צבע אדום	https://t.me/News_cabinet_news/172653	2024-12-30T10:38:00-08:00
🔁 🔴 צבע אדום (30/12/2024): 20:37: • עוטף עזה: חוף זיקים, נתיב ה...	Forwarded From צופר - צבע אדום🔴 צבע אדום (30/12/2024):20:37:• עוטף עזה: חוף זיקים, נתיב העשרה, כרמיה (15 שניות)צופר - צבע אדום	https://t.me/News_cabinet_news/172652	2024-12-30T10:37:59-08:00
🔁 ראשוני: במשטרה התקבל דיווח על שמיעת ירי בחדרה; הפרטים בבדיקה	Forwarded From: במשטרה התקבל דיווח על שמיעת ירי בחדרה; הפרטים בבדיקה	https://t.me/News_cabinet_news/172647	2024-12-30T08:38:08-08:00
↩️ דובר צה-ל: בהמשך להתרעה שהופעלה בכיסופים בשעה 18:02, זוהה שיגו...	Photo - Photo: Photo: Photo: Photo: Photo בשעה 06:02 pm נפגעים.	https://t.me/News_cabinet_news/172646	2024-12-30T08:13:24-08:00
🔁 האזעקות בכיסופים: רקטה אחת נפלה בשטח פתוח	Forwarded From אדיר לחקים - חדשות ועדכוניםהאזעקות בכיסופים: רקטה אחת נפלה בשטח פתוח	https://t.me/News_cabinet_news/172645	2024-12-30T08:13:12-08:00
🔁🖼	Forwarded From צופר - צבע אדום	https://t.me/News_cabinet_news/172644	2024-12-30T08:02:17-08:00
🔁 🔴 צבע אדום (30/12/2024): 18:02: • עוטף עזה: כיסופים (15 שניות...	Forwarded From צופר - צבע אדום🔴 צבע אדום (30/12/2024):18:02:• עוטף עזה: כיסופים (15 שניות)צופר - צבע אדום	https://t.me/News_cabinet_news/172643	2024-12-30T08:02:16-08:00
🔁 ״לילה כזה עוד לא היה לנו״: פרטים חדשים - כך חיסלו כוחות צה״ל 1...	Forwarded From קבינט מדיני ביטחוני - מוריה אסרף &amp; (Doron Kadosh) כוחות צה״ל 106 מחבלי חמאס תוך לילה אחד בג׳באליהבמהלך הלילה האחרון, חיסלו כוחות צה״ל יותר מ-100 מחבלים במארבים - חלקם ניסו Please contact us, please contact us. בחסות החשכה, הגשם הכבד ומזג האוויר הקשה. אתמול, סביב 21:00 בערב, התקבל בצה״ל המידע על כוונות של מחבלים לתקוף Please contact us. Please contact us, please contact us, About us Please contact us. עוד 6 התקרבו ללוחמי היחידה הרב ממדית. Please contact us, please contact us. - הרים ידיים, נכנע - ונעצר. Please contact us, please contact us Please contact us - please contact us. Please contact us. Please contact us. כ-30 Please contact us. הסמג״ד פתח ראשון באש, והגדוד יצא להתקפה. בבוקר - ספרו 16 גופות של מחבלים הרוגים מהקרב הזה. במקביל, בגדוד השריון 52 מחטיבה 401 זיהו עוד 10 מחבלים. Please contact us - Please contact us - 10. המג״ד יצא להתקפה בראש הגדוד - ובבוקר ספרו סה״כ 24 גופות מחבלים - שהמודיעין יודע להצביע עליהם כפעילי חמאס. Home page - Home page הכוחות - וחוסלו. 106 מחבלים הרוגים. באופן חריג למדי, 2 מהמחבלים נכנעו תוך כדי הקרבות - ונלקחו בשבי ע״י הכוחות. Home page מחבלים. דבר אחד לא ברור: האם כל חוליה פעלה לבדה באופןספורדי, או שהלילה Please contact us. Please contact us. בצה״ל אומרים: האויב בגזרה מפורר לחלוטין. Please contact us. Please contact us. Please contact us. Please contact us, please contact us. Please contact us, please contact us על אף ריכוז אוכלוסיה שנותר במרחב, לאחר שקרוב ל-100,000 איש התפנו מהאזור. Please contact us, please contact us. צה״ל - בית החולים האינדונזי, שם יש קבוצה מוגדרת ומאושרת של חולים ואנשי צוות רפואי. Please, please, please contact us. Please contact us - Please contact us Please contact us.	https://t.me/News_cabinet_news/172642	2024-12-30T06:48:56-08:00
🔁🎬 דובר צה-ל: לוחמי אוגדה 162 חיסלו עשרות מחבלים במהלך פעילות ה...	Forwarded From צה״ל - הערוץ הרשמידובר צה-ל:לוחמי אוגדה 162 חיסלו עשרות מחבלים Home Office 401, 401 162 162 162 About us Please contact us, please contact us. Please, please contact us, Home page נעצרו יותר מ-240 מחבלים. Please contact us, please contact us. עם נשקים בידיהם. Please contact us, please contact us, פירים ומבנים צבאיים. Video is too big	https://t.me/News_cabinet_news/172641	2024-12-30T03:25:29-08:00
חנוכה שמח | Please contact us, please contact us. לוחמינו...	חנוכה שמח | Please contact us, please contact us. Home page 65גבעתי חיסלה 24רב מימדית חיסלה 12כפיר חיסלה 5סה״כ חוסלו על ידי אוגדה 162 הלילה כ-106 מחבלים.הלל ביטון רוזן	https://t.me/News_cabinet_news/172640	2024-12-30T01:17:22-08:00
↩️ דובר צה-ל: בהמשך להתרעה שהופעלה בניר עם בשעה 10:20, מדובר בזיה...	חדשות - הקבינט הביטחוני: 🔴 צבע אדום (30/12/2024): 10:20: • עוטף עזה: ניר עם (15 שניות) צופר - צבע אדום דובר צה-ל:בהמשך להתרעה שהופעלה בניר עם בשעה 10:20, מדובר בזיהוי שווא.	https://t.me/News_cabinet_news/172639	2024-12-30T01:02:23-08:00
🔁🖼	Forwarded From צופר - צבע אדום	https://t.me/News_cabinet_news/172638	2024-12-30T00:20:47-08:00
🔁 🔴 צבע אדום (12/30/2024): 10:20: • עוטף עזה: ניר עם (15 שניות)...	Forwarded From צופר - צבע אדום🔴 צבע אדום (30/12/2024):10:20:• עוטף עזה: ניר עם (15 שניות)צופר - צבע אדום	https://t.me/News_cabinet_news/172637	2024-12-30T00:20:46-08:00
↩️ דובר צה-ל: בהמשך להתרעה שהופעלה בארז בשעה 10:06, מדובר בזיהוי ...	חדשות - הקבינט הביטחוני: 🔴 צבע אדום (12/30/2024): 10:06: • עוטף עזה: ארז (15 שניות) צופר - צבע אדום דובר צה-ל:בהמשך להתרעה שהופעלה בארז בשעה 10:06, מדובר בזיהוי שווא.	https://t.me/News_cabinet_news/172636	2024-12-30T00:20:06-08:00
🔁🖼	Forwarded From צופר - צבע אדום	https://t.me/News_cabinet_news/172635	2024-12-30T00:06:07-08:00
🔁 🔴 צבע אדום (12/30/2024): 10:06: • עוטף עזה: ארז (15 שניות) צו...	- צבע אדום	https://t.me/News_cabinet_news/172634	2024-12-30T00:06:05-08:00
המשא ומתן להשבת החטופים. Yes, please, please, please, please...	המשא ומתן להשבת החטופים. Please contact us, please contact us. Please contact us. About us: -בימים האחרונים משלחת חמאס Please contact us, please contact us Please contact us, please contact us Home page Please contact us, please contact us. מלא. Please contact us, please contact us. Home page הקרובים נגיע למה שאנחנו שואפים אליו-, דברי חמדאן.כאן 11	https://t.me/News_cabinet_news/172633	2024-12-29T21:01:13-08:00
↩️ World News 01:00, 01:00, 01:00 שווא.	חדשות - הקבינט הביטחוני: דובר צה״ל: הופעלו התרעות במספר מרחבים בעוטף עזה, הפרטים בבדיקה. 01:00, 01:00, 01:00, 01:00 שווא.	https://t.me/News_cabinet_news/172632	2024-12-29T15:29:33-08:00
דובר צה״ל: הופעלו התרעות במספר מרחבים בעוטף עזה, הפרטים בבדיקה.	דובר צה״ל:הופעלו התרעות במספר מרחבים בעוטף עזה, הפרטים בבדיקה.	https://t.me/News_cabinet_news/172631	2024-12-29T15:04:55-08:00
🔁🖼	Forwarded From צופר - צבע אדום	https://t.me/News_cabinet_news/172630	2024-12-29T15:00:35-08:00
🔁 🔴 צבע אדום (30/12/2024): 01:00: • עוטף עזה: ארז, יד מרדכי, נת...	Forwarded From צופר - צבע אדום🔴 צבע אדום (30/12/2024):01:00:• עוטף עזה: ארז, יד מרדכי, נתיב העשרה (15 שניות)צופר - צבע אדום	https://t.me/News_cabinet_news/172629	2024-12-29T15:00:33-08:00
דרג צבאי בכל מדינה נורמלית היה לוחץ עכשיו על הממשלה להרחיב ולהעצי...	דרג צבאי בכל מדינה נורמלית היה לוחץ עכשיו על הממשלה להרחיב Please contact us. Please contact us. Please contact us Please contact us, Please contact us. באוקטובר לשלטון. הזיה.תמיר מורג	https://t.me/News_cabinet_news/172628	2024-12-29T12:20:11-08:00
Home page מוטי קסטל	Home page התאוששותמוטי קסטל	https://t.me/News_cabinet_news/172627	2024-12-29T11:55:29-08:00
Home | Please contact us, please contact us. איכו...	Home | Please contact us, please contact us. Home page ביותר.הלל ביטון רוזן	https://t.me/News_cabinet_news/172626	2024-12-29T10:00:29-08:00
🔁🖼 חוסלו כ-20 מחבלים, ונעצרו למעלה מ-240: צק-ח 401 השלימו מבצע ...	Forwarded From צה״ל - הערוץ הרשמיחוסלו כ-20 מחבלים, ונעצרו למעלה מ-240:צק-ח 401 Please contact us -. www.idf.il/260759	https://t.me/News_cabinet_news/172625	2024-12-29T07:01:23-08:00
🔁 דובר צה-ל: בהמשך להתרעות שהופעלו ב16:26 במרחב עוטף עזה, זוהו כ...	Forwarded From צה״ל - הערוץ הרשמידובר צה-ל: בהמשך להתרעות שהופעלו ב16:26 במרחב Please, please, please contact us. Please do not hesitate to contact us.	https://t.me/News_cabinet_news/172624	2024-12-29T06:44:09-08:00
↩️ *דוברות מד-א:* בהמשך לאזעקות שנשמעו בדקות האחרונות בגזרת שדרות...	חדשות - הקבינט הביטחוני: שני יירוטים לפחות נצפו באוויר. דיווח על נפילה בשדרות - כוחות רבים הוקפצו *דוברות מד-א:* בהמשך Please contact us, please contact us. בזירות בהן התקבלו דיווחים. בשלב זה לא ידוע על נפגעים. עדכון בהמשך במידת הצורך. דניאל	https://t.me/News_cabinet_news/172623	2024-12-29T06:39:35-08:00
↩️ שני יירוטים לפחות נצפובאוויר דיווח על נפילה בשדרות - כוחות רבי...	חדשות - הקבינט הביטחוני: 🔴 צבע אדום (29/12/2024): 16:26: • עוטף עזה: גבים, מכללת ספיר, שדרות, איבים, ניר עם, גבים, מכללת ספיר, שדרות, איבים (15 שניות) צופר - צבע אדום שני יירוטים לפחות נצפו באוויר. דיווח על נפילה בשדרות - כוחות רבים הוקפצו	https://t.me/News_cabinet_news/172622	2024-12-29T06:34:27-08:00
🔁🖼	Forwarded From צופר - צבע אדום	https://t.me/News_cabinet_news/172621	2024-12-29T06:26:52-08:00
🔁 🔴 צבע אדום (29/12/2024): 16:26: • עוטף עזה: גבים, מכללת ספיר,...	Forwarded From צופר - צבע אדום🔴 צבע אדום (12/29/2024):16:26:• עוטף עזה: גבים, מכללת ספיר, - צבע אדום	https://t.me/News_cabinet_news/172620	2024-12-29T06:26:51-08:00
🔁🖼	Forwarded From צופר - צבע אדום	https://t.me/News_cabinet_news/172617	2024-12-29T06:26:15-08:00
Please contact us: Please contact us מדובר באירוע ביטחונ...	Please contact us: Please contact us Please contact us. Please contact us.	https://t.me/News_cabinet_news/172615	2024-12-28T23:31:33-08:00
↩️ Home Office 101 Home Office הולכי רגל, בהם 1 במצב...	חדשות - הקבינט הביטחוני: ראשוני: התקבל במוקד מד״א על אירוע דריסה Home page מד-א במרחב לכיש, על אוטובוס שפגע בשני הולכי רגל, בהם 1 במצב קשה, 1 בינוני. Please contact us.	https://t.me/News_cabinet_news/172614	2024-12-28T23:28:04-08:00
🔁 ראשוני: התקבל במוקד מד״א על אירוע דריסה סמוך לתחנת רכבת אשקלון...	Forwarded From : Home page - Home page	https://t.me/News_cabinet_news/172613	2024-12-28T23:24:32-08:00
🎬 דובר צה-ל: מטוסי קרב של חיל האוויר תקפו במהלך הלילה, בהכוונת מ...	Please contact us Please contact us, please contact us. לכיש, השפלה, ירקון, מערב הנגב, יהודה וירושלים אתמול (ש׳). Please contact us. זוהתה רקטה היוצאת ממתחםהשיגור	https://t.me/News_cabinet_news/172612	2024-12-28T23:00:37-08:00
איתמר בן גביר: הרבה בריאות לרה-מ בנימין נתניהו. עם ישראל צריך אות...	איתמר בן גביר: הרבה בריאות לרה-מ בנימין נתניהו. עם ישראל צריך אותך חזק🇮🇱	https://t.me/News_cabinet_news/172611	2024-12-28T12:36:13-08:00
About: חטיבת כפיר סיימה בהצלחה את השמדת ׳שכונת הקצינים׳ במרחב בית...	About: חטיבת כפיר סיימה בהצלחה את השמדת ׳שכונת הקצינים׳ במרחב About us ביטון רוזן	https://t.me/News_cabinet_news/172610	2024-12-28T12:22:43-08:00
*לשכת ראש הממשלה:* ביום רביעי עבר ראש הממשלה נתניהו בדיקה בבית-הח...	*לשכת ראש הממשלה:*ביום רביעי עבר ראש הממשלה נתניהו בדיקה Please contact us. של ערמונית. Please contact us, please contact us הזיהום. Yes, please, please, please contact us. פרטים מלאים יימסרו בהמשך. ישיבת הממשלה מחר תתקיים כמתוכנן.	https://t.me/News_cabinet_news/172609	2024-12-28T11:42:04-08:00
*שר הביטחון ישראל כ-ץ:* אני מברך את צה-ל על הפעילות העצימה והמוצל...	*שר הביטחון ישראל כ-ץ:*אני מברך את צה-ל על הפעילות העצימה והמוצלחת Please contact us. Please contact us. Please contact us, please contact us. Please contact us.	https://t.me/News_cabinet_news/172608	2024-12-28T09:48:55-08:00
🔁 Please contact us, please contact us.	Forwarded From : עמק החולה, מקורו בירי צה-ל.	https://t.me/News_cabinet_news/172607	2024-12-28T08:28:47-08:00
דובר צה-ל: בהמשך להתרעות שהופעלו בשעה 16:14 במרחבים ירושלים, מערב...	דובר צה-ל:בהמשך להתרעות שהופעלו בשעה 16:14 במרחבים ירושלים, מערב Please contact us, please contact us. עזה.בוצעו ניסיונות יירוט, הפרטים בבדיקה.	https://t.me/News_cabinet_news/172606	2024-12-28T06:29:25-08:00
🖼 יירוט מעל איזור חלץ, please, please. צולם מקרית גת צילם: עומרי...	Yes, yes, no matter what, no matter what. צולם מקרית גתצילם: עומרי יפרח	https://t.me/News_cabinet_news/172605	2024-12-28T06:23:16-08:00
דובר צה״ל: ראשוני: הופעלו התרעות במספר מרחבים בשטח הארץ, הפרטים ב...	דובר צה״ל:ראשוני: הופעלו התרעות במספר מרחבים בשטח הארץ, הפרטים בבדיקה.	https://t.me/News_cabinet_news/172604	2024-12-28T06:17:32-08:00
🔁 האזעקות בירושלים כתוצאה משיגורים מרצועת עזה	Forwarded From : מרצועת עזה	https://t.me/News_cabinet_news/172603	2024-12-28T06:16:54-08:00
🔁🖼	Forwarded From צופר - צבע אדום	https://t.me/News_cabinet_news/172602	2024-12-28T06:15:03-08:00
🔁 🔴 צבע אדום (28/12/2024): 16:14: • שפלת יהודה: בית נקופה, צובה...	Forwarded From צופר - צבע אדום🔴 צבע אדום (12/28/2024):16:14:• שפלת יהודה: בית נקופה, Please contact us, please contact us , עין ראפה, קריית יערים, רמת רזיאל, שואבה, שורש, כסלון וחצי)• מערב הנגב: ברור חיל (30 שניות)• מערב לכיש: חלץ (30 שניות)• לכיש: תלמים (30 שניות)16:15:• שפלת יהודה: כפר מנחם, בית גוברין, בית ניר, גפן, - , אזור תעשייה הר טוב - צרעה, אשתאול, בית שמש, בקוע, גבעות עדן, גיזו, - Please contact us, please contact us הל''ה, צלפון, צרעה, רטורנו - גבעת שמש, שער הגיא, תעוז, תרום, בית מאיר, Please contact us, please contact us הדסה, אזור תעשייה ברוש ​​(דקה, דקה וחצי)• ירקון: מבוא חורון (דקה וחצי)• יהודה: אלון שבות, ביתר עילית, בת עין, כפר עציון, נווה דניאל, ראש , משמר דוד (דקה וחצי)• ירושלים: אבן ספיר, עמינדב (דקה וחצי)צופר - צבע אדום	https://t.me/News_cabinet_news/172601	2024-12-28T06:15:02-08:00
↩️ דובר צה-ל: בהמשך להתרעות שהופעלו בשעה 16:00 במרחב עוטף עזה, מד...	Photos - Photos: Photos: Photos: Photos: Photos: Photo 16:00 במרחב עוטף עזה, מדובר בזיהוי שווא.	https://t.me/News_cabinet_news/172595	2024-12-28T06:12:43-08:00
↩️ דובר צה-ל: ראשוני: הופעלו התרעות במרחב עוטף עזה, הפרטים בבדיקה...	חדשות - הקבינט הביטחוני: 🔴 צבע אדום (28/12/2024): 16:00: • עוטף עזה: מפלסים, מטווח ניר עם (15 שניות) צופר - צבע אדום דובר צה-ל:ראשוני: הופעלו התרעות במרחב עוטף עזה, הפרטים בבדיקה.	https://t.me/News_cabinet_news/172594	2024-12-28T06:05:24-08:00
🔁🖼	Forwarded From צופר - צבע אדום	https://t.me/News_cabinet_news/172593	2024-12-28T06:00:27-08:00
🔁 🔴 צבע אדום (28/12/2024): 16:00: • עוטף עזה: מפלסים, מטווח ניר...	Forwarded From צופר - צבע אדום🔴 צבע אדום (28/12/2024):16:00:• עוטף עזה: מפלסים, מטווח ניר עם (15 שניות)צופר - צבע אדום	https://t.me/News_cabinet_news/172592	2024-12-28T06:00:26-08:00
🔁 גם הלילה: טיל מיירט של מערכת ההגנה האמריקנית THAAD שוגר לעבר ה...	Forwarded From קבינט מדיני ביטחוני - מוריה אסרף &amp; Please contact us (Doron Kadosh) Please contact us, please contact us. וים המלח. Please contact us. כעת בודקים בחיל האוויר איזו מהמערכות - הישראלית או האמריקנית - היא שיירטה את הטיל בהצלחה.	https://t.me/News_cabinet_news/172589	2024-12-28T04:57:42-08:00
🔁🖼 דובר צה-ל: כוחות אוגדת עזה החלו בפעילות להשמדת יעדי טרור במר...	Forwarded From צה״ל - הערוץ הרשמידובר צה-ל:כוחות אוגדת עזה החלו בפעילות Please contact us, בפיקוד אוגדת עזה (143), החלו לפעול במהלך הלילה נגד יעדי טרור במרחב Please contact us, please contact us. Yes, please, please, please contact me. Please contact us, please contact us, Please contact us. Please contact us, please contact us. Please contact us. מסודרים. Please contact us. Please contact us. חטיבת ׳קרייתי׳ (4).	https://t.me/News_cabinet_news/172584	2024-12-28T00:16:05-08:00
דובר צה-ל: בהמשך להתרעות שהופעלו לפני זמן קצר באזור ירושלים וים ה...	דובר צה-ל: בהמשך להתרעות שהופעלו לפני זמן קצר באזור ירושלים וים Please contact us, please contact us פי מדיניות.	https://t.me/News_cabinet_news/172583	2024-12-27T16:33:28-08:00
Please contact us: Please contact us. שיגור מתימן, הפרטי...	Please contact us: Please contact us. שיגור מתימן, הפרטים בבדיקה.	https://t.me/News_cabinet_news/172582	2024-12-27T16:14:08-08:00
🔁🖼	Forwarded From צופר - צבע אדום	https://t.me/News_cabinet_news/172581	2024-12-27T16:12:43-08:00
🔁 🔴 צבע אדום (28/12/2024): 02:11: • ירושלים: ירושלים - דרום, אב...	Forwarded From צופר - צבע אדום🔴 צבע אדום (12/28/2024):02:11:• ירושלים: ירושלים - דרום, אבן ספיר, אורה, עמינדב (דקה וחצי)• שפלת יהודה: צובה, אביעזר, אדרת, אזור תעשייה הר טוב - צרעה, אשתאול, בית שמש, גבעות עדן, גיזו, הראל, - רוגלית, נווה שלום, נחם, נחשון, נתיב הל''ה, צלפון, צרעה, רטורנו - גבעת שמש, שער הגיא, תעוז, תרום, בית מאיר, בר גיורא, גבעת יערים, יד Please contact us, please contact us הדסה, קריית יערים, רמת רזיאל, שואבה, שורש, אזור תעשייה ברוש ​​(דקה וחצי)• דרום הנגב: ערד, תל ערד, כפר הנוקדים (דקה וחצי)• יהודה: אלון שבות, אלעזר, אפרת, ביתר עילית, בת עין, הר גילה, כפר אלדד, כפר עציון, Please contact us, please contact us נוקדים, פארק תעשיות מגדל עוז, פני קדם, ראש צורים, שדה בר, תלם, תקוע , נגוהות, סוסיא, עשהאל, עתניאל, קריית ארבע, שמעה, שני ליבנה, צומת הגוש, היישוב היהודי חברון, גבעות (דקה וחצי, דקה)• ים המלח: מצדה, מרחצאות עין גדי (דקה וחצי)02:12:• שפלת יהודה: זכריה, כפר זוהרים, נחושה, עגור, צפרירים, שדות מיכה, שריגים - לי-און, גבעת ישעיהו, צומת האלה (דקה)• ים המלח: מצוקי דרגות, מצפה שלם, בתי מלון ים המלח, מלונות Please contact us, please contact us	https://t.me/News_cabinet_news/172580	2024-12-27T16:12:42-08:00
↩️🖼	חדשות - הקבינט הביטחוני: דיווח ערבי חיל האוויר האמריקני החל בגל Home page	https://t.me/News_cabinet_news/172575	2024-12-27T10:36:22-08:00
Please contact us. במספר מוקדים בבירה ...	Please contact us במספר מוקדים בבירה צנעאשבתימן	https://t.me/News_cabinet_news/172574	2024-12-27T10:34:52-08:00
↩️ THAAD האמריקנית בישראל הפילה אמש את הטיל הבליסטי שנורה על ידי ...	חדשות - הקבינט הביטחוני: לראשונה מאז הצבתה בישראל: מערכת ההגנה THAAD ישראל. בתיעוד: חייל אמריקני אומר לאחר יציאת המיירט - ״18 שנה חיכיתי לזה״. THAAD האמריקנית בישראל הפילה אמש את הטיל הבליסטי שנורה על ידי Please contact us, please contact us. האמריקאית בלחימה, לפי מקור המקורב לאירוע.	https://t.me/News_cabinet_news/172573	2024-12-27T09:50:44-08:00
🔁🎬 לראשונה מאז הצבתה בישראל: מערכת ההגנה האווירית THAAD השתתפה ...	Forwarded From קבינט מדיני ביטחוני - מוריה אסרף &amp; Please contact us (Doron Kadosh) Please contact us. בתיעוד: חייל אמריקני אומר לאחר יציאת המיירט - ״18 שנה חיכיתי לזה״.	https://t.me/News_cabinet_news/172572	2024-12-27T06:55:33-08:00
↩️ בהמשך להתרעה שהופעלה בניר עם בשעה 16:31, זוהה שיגור אחד שחצה ל...	חדשות - הקבינט הביטחוני: Photo בהמשך להתרעה שהופעלה בניר עם בשעה 16:31, Please contact us.	https://t.me/News_cabinet_news/172571	2024-12-27T06:45:47-08:00
דובר צה״ל: ראשוני: הופעלה התרעה בניר עם, הפרטים בבדיקה.	דובר צה״ל:ראשוני: הופעלה התרעה בניר עם, הפרטים בבדיקה.	https://t.me/News_cabinet_news/172570	2024-12-27T06:34:22-08:00
🔁🖼	Forwarded From צופר - צבע אדום	https://t.me/News_cabinet_news/172569	2024-12-27T06:31:24-08:00
🔁 🔴 צבע אדום (12/27/2024): 16:31: • עוטף עזה: ניר עם (15 שניות)...	Forwarded From צופר - צבע אדום🔴 צבע אדום (27/12/2024):16:31:• עוטף עזה: ניר עם (15 שניות)צופר - צבע אדום	https://t.me/News_cabinet_news/172568	2024-12-27T06:31:23-08:00
Please contact us ה7 באוקטובר עמיחי שט...	Please contact us ה7 באוקטוברעמיחי שטיין	https://t.me/News_cabinet_news/172567	2024-12-27T03:27:44-08:00
Please contact us: Please contact us פלסטיני תושב אזור השומ...	שב״כ: לעדכונכם:החשוד בביצוע פיגוע הדקירה הבוקר בהרצליה הוא Please contact us, please contact us. Please contact us, please contact us. Home page הפיגוע.תקשורת שב״כ	https://t.me/News_cabinet_news/172566	2024-12-27T01:34:27-08:00
83, אונס ילדות ושורף תינוקות. הוא עשה את זה בפרעות תרפ״...	83, אונס ילדות ושורף תינוקות.הוא עשה 100 שנים אחרי, כי אין כאן שום סכסוך, Please contact us, please contact us. עוד נחיה פה.הלל ביטון רוזן	https://t.me/News_cabinet_news/172565	2024-12-27T01:28:12-08:00
דובר צה-ל: צה״ל תקף תשתיות ששימשו להעברת אמצעי לחימה בגבול סוריה-...	Please contact us סוריה-לבנון מטוסי קרב של חיל האוויר תקפו מוקדם יותר היום (ו') Please contact us for more details Please contact us. Please contact us, Please contact us. מאמץ חיזבאללה מובל על-ידי יחידה 4400, יחידת ההתעצמות של ארגון Please contact us, please contact us. Please contact us, please contact us. ארגון הטרור. מאז הקמתה, בנתה יחידה 4400 צירים רבים ואסטרטגיים על גבול סוריה-לבנון.במהלך המלחמה וכחלק ממבצע 'חיצי הצפון,', Please contact us. 4400 וצירי העברות האמל-ח השונים.מאמצים אלו כוללים את חיסולו של מפקד יחידה 4400, מחמד ג׳עפר קציר, בתחילת In the world לאחר מכן בדמשק. Please contact us. Please contact us. Please contact us Please contact us, Please contact us.	https://t.me/News_cabinet_news/172564	2024-12-27T01:01:45-08:00
Please contact us בשנות ה-80 לחייה שנפ...	Please contact us בשנות ה-80 לחייה שנפצעה אנושות בפיגוע בהרצליה. Please contact us. Please contact us. משתתף בצער המשפחה.	https://t.me/News_cabinet_news/172563	2024-12-27T00:28:13-08:00
🎬 רגע נטרול המחבל בהרצליה.	רגע נטרול המחבל בהרצליה.	https://t.me/News_cabinet_news/172562	2024-12-27T00:24:54-08:00
* -הייתי ברחוב סמוך וקיב...	*חובש רפואת חירום במד-א אילון בוארון שהגיע ראשון למקום סיפר:*-הייתי ברחוב סמוך וקיבלתי קריאה באפליקציה של מד-א, מיד 80 שוכבת על המדרכה Please contact us. World Warehouse Home page אנוש. Please contact us -	https://t.me/News_cabinet_news/172561	2024-12-27T00:24:17-08:00
↩️ *דוברות מד-א:* בשעה 09:32 התקבל דיווח במוקד 101 של מד-א במרחב ...	חדשות - הקבינט הביטחוני: הדיווח על שמיעת ירי בהרצליה בבדיקה *??? Please contact us. *מדיווח ראשוני בלבד !!!* חובשים ופראמדיקים של מד-א מעניקים במקום 70, מחוסרת הכרה. עדכון בהמשך. טל	https://t.me/News_cabinet_news/172560	2024-12-26T23:41:47-08:00
הדיווח על שמיעת ירי בהרצליה בבדיקה	הדיווח על שמיעת ירי בהרצליה בבדיקה	https://t.me/News_cabinet_news/172559	2024-12-26T23:36:23-08:00
דובר צה-ל: צה-ל מדגיש כי קיים חשש להימצאות נפלים במרחבים שונים בצ...	Please contact us בצפון הארץ. Please contact us, please contact us. לכוחות הביטחון ומשטרת ישראל. Please contact us.	https://t.me/News_cabinet_news/172558	2024-12-26T21:07:55-08:00
דובר צה-ל: בהמשך להתרעות שהופעלו לפני זמן קצר במספר מרחבים במרכז ...	Please contact us Please contact us, please contact us וטילים הופעלו מחששלשברי יירוט	https://t.me/News_cabinet_news/172557	2024-12-26T17:48:09-08:00
Please contact us	Please contact us	https://t.me/News_cabinet_news/172556	2024-12-26T17:46:06-08:00
All rights reserved.	All rights reserved.	https://t.me/News_cabinet_news/172555	2024-12-26T17:44:43-08:00
↩️ שהטיל חצה למרחב המדינה ו...	חדשות - הקבינט הביטחוני: דובר צה-ל: ראשוני: הופעלו התרעות במספר Please contact us, please contact us. Home page Home page	https://t.me/News_cabinet_news/172554	2024-12-26T17:40:54-08:00
לפחות 2 מיירטים יצאו לעבר הטיל שהגיע מאזור תימן	לפחות 2 מיירטים יצאו לעבר הטיל שהגיע מאזור תימן	https://t.me/News_cabinet_news/172553	2024-12-26T17:37:48-08:00
↩️🎬 תיעוד מאזור נתניה קרדיט אוריאל	חדשות - הקבינט הביטחוני: התראות הופעלו במרחב בעקבות שיגור מתימן תיעוד מאזור נתניהקרדיט אוריאל	https://t.me/News_cabinet_news/172552	2024-12-26T17:35:33-08:00
↩️ דובר צה-ל: ראשוני: הופעלו התרעות במספר מרחבים במרכז הארץ בעקבו...	חדשות - הקבינט הביטחוני: התראות הופעלו במרחב בעקבות שיגור מתימן Please contact us שיגור שחצה מתימן, הפרטים בבדיקה.	https://t.me/News_cabinet_news/172551	2024-12-26T17:33:24-08:00
Home page	Home page	https://t.me/News_cabinet_news/172550	2024-12-26T17:32:16-08:00
🔁 What about? Please contact us. לשליחת תיע...	Forwarded From חדשות - הקבינט הביטחוניצילמתם תיעוד בלעדי📸? Please contact us - @CabinetNews_Bot*ייתכן וחלק מהתיעודים יגיעו לערוצי הטלויזיה. Please contact us. תודה.	https://t.me/News_cabinet_news/172549	2024-12-26T17:30:56-08:00
🔁🖼	Forwarded From צופר - צבע אדום	https://t.me/News_cabinet_news/172548	2024-12-26T17:29:53-08:00
