Title	Description	Link	pubDate	Image
Japan Cabinet to OK 39 tril. yen economic package to ease price p...	Prime Minister Shigeru Ishiba's Cabinet is set to approve a 39 trillion yen ($252 billion) economic package to support consumer spending as disposable incomes continue to be whittled away by resurgent prices, sources familiar with the matter said Thursday. The economic stimulus will include subsidies to offset high electricity, gas and gasoline prices and deliver cash handouts to low-income households. Read full story here	https://english.kyodonews.net/news/2024/11/d9f7042344f8-cabinet-to-ok-39-tril-yen-economic-package-to-ease-price-pain.html	2024-11-20T22:43:00-08:00	
Japan study shows simple questions can help detect Alzheimer's	A method developed by a Japanese team using three questions allows easy screening of Alzheimer's disease and mild cognitive impairment, it said Thursday, with a rising number of patients calling for early diagnosis and treatment. The Keio University and Saiseikai Yokohamashi Tobu Hospital researchers asked three questions: 'Do you feel that you have more difficulties in your daily life than you used to?'; 'Could you tell me about your daily pleasures or pastimes?'; and 'What are the most notable current/recent news/topics?' Read full story here	https://english.kyodonews.net/news/2024/11/c1c28f5b0e4c-japan-study-shows-simple-questions-can-help-detect-alzheimers.html	2024-11-20T22:23:00-08:00	
Foreign tourists showing appetite for Japan's art of food replica...	Hands-on lessons in the art of creating food replicas have caught on with foreign visitors keen to learn more about a distinctive Japanese craft that has evolved for over 100 years. Food replicas are now used not only as window-display enticements by restaurants but also as training tools for farmers and as souvenirs. Read full story here	https://english.kyodonews.net/news/2024/11/35b814e231b7-foreign-tourists-showing-appetite-for-japans-art-of-food-replicas.html	2024-11-20T22:00:00-08:00	
Japan police seek arrest of Chinese boy over Yasukuni shrine graf...	Tokyo police have obtained an arrest warrant for a Chinese teenage boy for alleged property damage after graffiti was found at the war-linked Yasukuni shrine in August, investigative sources said Thursday. The suspect, who also faces a charge of desecration of a place of worship, has already left Japan for Hong Kong. He is accused of writing Chinese characters meaning 'toilet' on a stone pillar of the Tokyo shrine using a black felt-tip pen shortly after 10 p.m. on Aug. 18. Read full story here	https://english.kyodonews.net/news/2024/11/ef1005b0021e-japan-police-seek-arrest-of-chinese-boy-over-yasukuni-shrine-graffiti.html	2024-11-20T21:21:00-08:00	
Sumo: Former yokozuna, popular TV pundit Kitanofuji dies at 82	Former yokozuna and 10-time Emperor's Cup winner Kitanofuji, who also mentored two grand champions including legendary Chiyonofuji before becoming a popular TV sumo pundit, has died, a source familiar with the matter said Wednesday. He was 82. Kitanofuji left the Japan Sumo Association in 1998 at 55 after serving on its board and became a beloved television commentator known for his candid and humorous style. Read full story here	https://english.kyodonews.net/news/2024/11/3342a083db24-sumo-former-yokozuna-popular-tv-pundit-kitanofuji-dies-at-82.html	2024-11-20T20:28:00-08:00	
WHO OKs emergency use of Japanese mpox vaccine amid surge	The World Health Organization said Tuesday it has granted emergency use of a Japanese mpox vaccine, its second approval of a product to inoculate against the infectious disease, to combat a recent outbreak mainly in Africa. The approval of the vaccine, developed by KM Biologics Co., a group firm of food and pharmaceutical company Meiji Holdings Co., follows the acceptance of a vaccine manufactured by Bavarian Nordic A/S of Denmark in September. Read full story here	https://english.kyodonews.net/news/2024/11/9f1e0cc3ee91-who-oks-emergency-use-of-japanese-mpox-vaccine-amid-surge.html	2024-11-20T17:22:00-08:00	
Japan coalition accepts opposition party's demand over stimulus s...	Japan's minority government accepted on Wednesday an opposition party's demand to raise the tax-free income threshold, paving the way for compilation of an inflation relief package. Prime Minister Shigeru Ishiba's ruling Liberal Democratic Party and its junior coalition partner Komeito are set to finalize measures to mitigate the negative impact of rising prices before gaining Cabinet approval, possibly on Friday. Read full story here	https://english.kyodonews.net/news/2024/11/baa4bb99e8a9-update1-japan-coalition-accepts-opposition-partys-demand-over-stimulus-steps.html	2024-11-20T16:22:00-08:00	
Kyodo News Digest: Nov. 21, 2024	The following is the latest list of selected news summaries by Kyodo News. ---------- Read full story here	https://english.kyodonews.net/news/2024/11/5e15238072c9-kyodo-news-digest-nov-21-2024.html	2024-11-20T16:14:00-08:00	
Tokyo prosecutors drop assault case against Kenyan Olympic medali...	Prosecutors on Wednesday dropped their case against former Kenyan marathon runner and two-time Olympic medalist Eric Wainaina, who had been accused of assaulting a woman and a station worker in the capital in March. The Tokyo District Public Prosecutors Office did not provide a reason for dropping the charges against Wainaina. The 50-year-old former athlete won a bronze medal in Atlanta in 1996 and silver in Sydney in 2000. Read full story here	https://english.kyodonews.net/news/2024/11/34b4a6983386-tokyo-prosecutors-drop-assault-case-against-kenyan-olympic-medalist.html	2024-11-20T03:14:00-08:00	
Sumo: Takanosho beats new ozeki Onosato to stay in 3-way title ra...	No. 6 maegashira Takanosho upset new ozeki Onosato on Wednesday to remain in a three-way title race after 11 days of action at the Kyushu Grand Sumo Tournament. Former sekiwake Takanosho (10-1) moved to his left at the opening clash and followed with a right-handed shove to the throat to unbalance Autumn meet champion Onosato (7-4), who was easily pushed out at Fukuoka Kokusai Center. Read full story here	https://english.kyodonews.net/news/2024/11/3429d0ca2afa-sumo-takanosho-beats-new-ozeki-onosato-to-stay-in-3-way-title-race.html	2024-11-20T02:12:00-08:00	
Japan sees foreign visitors top 30 mil. in Jan.-Oct. at fastest p...	The number of foreign visitors to Japan surpassed 30 million in the period between January and October, marking the fastest pace ever, and is poised to break the annual record amid a boom in inbound tourism, government data showed Wednesday. The total stood at 30,192,600 during the 10-month period, crossing the 30 million threshold for the first time since 2019, before the coronavirus pandemic began in early 2020, the Japan National Tourism Organization said. Read full story here	https://english.kyodonews.net/news/2024/11/d0412e1a75e1-urgent-japan-sees-foreign-visitors-top-30-mil-in-jan-oct-at-fastest-pace.html	2024-11-20T01:36:00-08:00	
Japan government ordered to pay damages over noise at Atsugi air ...	A Japanese court on Wednesday ordered the government to pay damages to residents around Atsugi air base near Tokyo over excessive noise but rejected their call for suspending Self-Defense Forces and U.S. military flights. The Yokohama District Court ordered the state to pay approximately 5.9 billion yen ($38 million) for past disturbances but rejected the plaintiffs' demand for compensation for future noise pollution. Read full story here	https://english.kyodonews.net/news/2024/11/60d8aca22b55-japan-govt-ordered-to-pay-damages-over-noise-at-atsugi-air-base.html	2024-11-20T01:24:00-08:00	
BREAKING NEWS: Japan sees foreign visitors reach 30 mil. in Jan.-...	BREAKING NEWS: Japan sees foreign visitors reach 30 mil. in Jan.-Oct., fastest pace ==KyodoRead full story here	https://english.kyodonews.net/news/2024/11/23a77093c8d5-breaking-news-japan-sees-foreign-visitors-reach-30-mil-in-jan-oct-fastest-pace.html	2024-11-19T23:30:26-08:00	
Earthquake alert (automated)	The following is an earthquake alert issued by the Japan Meteorological Agency. Day and Time: Nov. 20, 2024, 3:40 p.m. Epicenter: Off Aomori Prefecture. N 41.0 , E 141.1 Depth: 10 kilometers Preliminary magnitude: 5.1 Seismic intensity scale: 4 out of maximum 7 Read full story here	https://english.kyodonews.net/news/2024/11/425d35ada3ce-earthquake-alert-automated.html	2024-11-19T22:45:08-08:00	
Japan PM Ishiba criticized for 'bad manners' at APEC summit	Prime Minister Shigeru Ishiba is being criticized online by people in Japan for his 'bad manners' after footage of the APEC forum summit in Peru showed him greeting other leaders while remaining seated. Footage showed Ishiba checking his smartphone while seated as leaders including Canadian counterpart Justin Trudeau and Malaysia's Anwar Ibrahim approached him. Ishiba looked up from his phone and shook hands but did not stand up. Read full story here	https://english.kyodonews.net/news/2024/11/398241f3b9b9-japan-pm-ishiba-criticized-for-bad-manners-at-apec-summit.html	2024-11-19T18:43:55-08:00	
G20 summit ends with internal rifts showing ahead of Trump's retu...	The Group of 20 economies on Tuesday wrapped up their two-day meeting, underscoring the need for collective action to combat climate change, poverty and other global challenges. While the G20 leaders managed to put out a joint statement covering a wide range of topics, they mostly stuck to generalities ahead of the expected return of Donald Trump as U.S. president to the forum, already split in recent years over Russia's war on Ukraine. Read full story here	https://english.kyodonews.net/news/2024/11/97c08274da62-g20-summit-ends-with-internal-rifts-showing-ahead-of-trumps-return.html	2024-11-19T16:46:00-08:00	
Kyodo News Digest: Nov. 20, 2024	The following is the latest list of selected news summaries by Kyodo News. ---------- Read full story here	https://english.kyodonews.net/news/2024/11/aa3cb5224ba5-kyodo-news-digest-nov-20-2024.html	2024-11-19T16:00:00-08:00	
BREAKING NEWS: Japan logs 461.2 bil. yen trade deficit in Oct.	BREAKING NEWS: Japan logs 461.2 bil. yen trade deficit in Oct. ==KyodoRead full story here	https://english.kyodonews.net/news/2024/11/c88159b2f63e-breaking-news-japan-logs-4612-bil-yen-trade-deficit-in-oct.html	2024-11-19T15:51:08-08:00	
Japan PM Ishiba hopes to work with Trump, not confront him	Japanese Prime Minister Shigeru Ishiba said Tuesday he will pursue cooperation, not confrontation, with U.S. President-elect Donald Trump as a mutual effort to deepen the longtime bilateral alliance should benefit not just the two nations but the wider Indo-Pacific region. Ishiba's remarks came as he wrapped up a South American trip to Peru and Brazil. The Japanese leader hoped to travel from there to the United States for a meeting with Trump, which would have been the first with the Republican since he won the presidential election in early November. Read full story here	https://english.kyodonews.net/news/2024/11/2494575e778a-urgent-japan-pm-ishiba-hopes-to-work-with-trump-not-confront-him.html	2024-11-19T15:24:00-08:00	
Podcast [English World] Episode 72: Popular Names	What's in a name? File photo taken Dec. 15, 2022, shows newborn babies at a hospital nursery in Kumamoto, southwestern Japan. (Kyodo) Read full story here	https://english.kyodonews.net/news/2024/11/420ef125b11f-podcast-english-world-episode-72-popular-names.html	2024-11-19T15:00:00-08:00	
Japan, Britain, Italy to work closely in fighter jet development	Japan, Britain and Italy agreed Tuesday to coordinate closely in developing a next-generation fighter jet in a joint project that Tokyo hopes will serve as the 'basis' for even wider cooperation over the next few decades. Japanese Prime Minister Shigeru Ishiba, British Prime Minister Keir Starmer and Italian Prime Minister Giorgia Meloni confirmed that they will complete the project as a key pillar of trilateral defense cooperation as they met on the fringes of the Group of 20 meeting in Rio de Janeiro, the Japanese government said. Read full story here	https://english.kyodonews.net/news/2024/11/8b0deeb65dc0-japan-britain-italy-to-work-closely-in-fighter-jet-development.html	2024-11-19T14:24:00-08:00	
BREAKING NEWS: Japan PM Ishiba hopes to work with Trump, not conf...	BREAKING NEWS: Japan PM Ishiba hopes to work with Trump, not confront him ==KyodoRead full story here	https://english.kyodonews.net/news/2024/11/017c580e7ed2-breaking-news-japan-pm-ishiba-hopes-to-work-with-trump-not-confront-him.html	2024-11-19T13:01:47-08:00	
China admits plane entered Japan airspace in August but unintenti...	China has admitted that one of its military planes entered Japan's airspace in August but said it was unintentional and vowed to take measures to prevent similar incidents from happening again, Japanese government officials said Tuesday. The Japanese government, despite China's explanation, maintains that the Aug. 26 incident involving the Chinese military Y-9 spy plane was an airspace breach that was 'a grave violation' of the nation's sovereignty, they said. Read full story here	https://english.kyodonews.net/news/2024/11/28fd78dfe096-urgent-china-admits-plane-entered-japan-airspace-in-aug-but-unintentional.html	2024-11-19T05:05:00-08:00	
BREAKING NEWS: Sony Group mulls acquiring Japan publisher Kadokaw...	BREAKING NEWS: Sony Group mulls acquiring Japan publisher Kadokawa: sources ==KyodoRead full story here	https://english.kyodonews.net/news/2024/11/4898d0a67860-breaking-news-sony-group-mulls-acquiring-japan-publisher-kadokawa-sources.html	2024-11-19T02:09:22-08:00	
Sumo: Birthday boy Kotozakura downs Tobizaru to keep share of lea...	Ozeki Kotozakura celebrated his 27th birthday Tuesday at the Kyushu Grand Sumo Tournament with a victory over rank-and-file opponent Tobizaru that kept the joint overnight leader on top of the standings. Kotozakura continued to share the top rung with fellow ozeki Hoshoryu and No. 6 maegashira Takanosho at 9-1, but new ozeki Onosato dropped further off the pace with an unexpected loss to sekiwake Daieisho that left him at 7-3 on Day 10 at Fukuoka Kokusai Center. Read full story here	https://english.kyodonews.net/news/2024/11/1c8984ca5dc3-sumo-birthday-boy-kotozakura-downs-tobizaru-to-keep-share-of-lead.html	2024-11-19T01:49:26-08:00	
BREAKING NEWS: Turbulence caused Chinese plane to enter Japanese ...	BREAKING NEWS: Turbulence caused Chinese plane to enter Japanese airspace: gov't ==KyodoRead full story here	https://english.kyodonews.net/news/2024/11/81e6303d7bb1-breaking-news-turbulence-caused-chinese-plane-to-enter-japanese-airspace-govt.html	2024-11-19T01:22:18-08:00	
BREAKING NEWS: China says did not intend airspace breach in Aug.:...	BREAKING NEWS: China says did not intend airspace breach in Aug.: Japan gov't ==KyodoRead full story here	https://english.kyodonews.net/news/2024/11/a26b1c94f183-breaking-news-china-says-did-not-intend-airspace-breach-in-aug-japan-govt.html	2024-11-19T01:21:46-08:00	
BREAKING NEWS: China admits plane entered Japanese airspace in Au...	BREAKING NEWS: China admits plane entered Japanese airspace in Aug: Japan gov't ==KyodoRead full story here	https://english.kyodonews.net/news/2024/11/c6eb0f241478-breaking-news-china-admits-plane-entered-japanese-airspace-in-aug-japan-govt.html	2024-11-19T01:21:02-08:00	
45 Hong Kong democracy activists sentenced to up 10 years	A Hong Kong court on Tuesday sentenced 45 pro-democracy activists to jail terms of up to 10 years over their roles in an unofficial primary election held in 2020, in the territory's biggest national security case to date under a law imposed by Beijing the same year. Legal scholar Benny Tai, accused of being an organizer of the primary election, was sentenced to 10 years behind bars by the Hong Kong High Court, while notable activists Au Nok-hin and Joshua Wong received prison terms of six years and nine months and four years and eight months, respectively. Read full story here	https://english.kyodonews.net/news/2024/11/ad21c5f400fb-45-hong-kong-democracy-activists-sentenced-to-up-10-years.html	2024-11-18T22:09:21-08:00	
New alpha takes charge at monkey park in Kagawa	A leadership shake-up has taken place at the Choshikei Monkey Park on Shodo Island in Kagawa Prefecture, home to about 300 wild Japanese macaques.The former boss, who led nearly 100 monkeys in Group B, one of the main troops at the zoo, was succeeded after he passed away on Nov. 10. With a new leader rising in Group A as well, the park is experiencing a generational shift. A day after the previous Group B head died, the former third-in-command overpowered the second-in-command 'sub' in a battle for dominance to take the title of 'tiger' boss. Read full story here	https://english.kyodonews.net/news/2024/11/f72c48934d44-new-alpha-takes-charge-at-monkey-park-in-kagawa.html	2024-11-18T21:41:00-08:00	
Golden retriever becomes mayor of city in Kyoto on Dog Day	The Kyoto Prefecture city of Kameoka celebrated 'Dog Day' on Nov. 1 with a charming new mayor -- a golden retriever named Maggie.Maggie, a 5-year-old public relations dog for the Kansai Guide Dogs For The Blind Association, was appointed 'Mayor Dog for a Day' and took on duties with gentle enthusiasm. She attended an award ceremony for a local photo contest, toured the city hall, and shared encouraging tail wags with employees along the way. Read full story here	https://english.kyodonews.net/news/2024/11/9ce8dd745d42-golden-retriever-becomes-mayor-of-city-in-kyoto-on-dog-day.html	2024-11-18T21:19:00-08:00	
FEATURE: Rising pit bull attacks in Japan put spotlight on neglig...	A Japanese octogenarian, who had part of her ear bitten off when she was mauled by a pit bull on a street corner nearly two years ago, has suffered ongoing trauma and is unable to live an ordinary life. The same dog later attacked and injured another passerby, and a district court in Gifu, central Japan, convicted the owner, a 28-year-old woman, of gross negligence resulting in injuries in handing down a suspended sentence in July. Read full story here	https://english.kyodonews.net/news/2024/11/042e4f27af70-feature-rising-pit-bull-attacks-in-japan-put-spotlight-on-negligent-owners.html	2024-11-18T20:41:00-08:00	
FOCUS: Biden's guardrails on U.S.-China ties may live on under Tr...	U.S. President Joe Biden's third face-to-face meeting with Chinese President Xi Jinping took place as widely expected, capping his multiyear efforts to put guardrails on the increasingly tense relationship between Washington and Beijing before he leaves office in January. However, Donald Trump is returning to the presidency with a quickly assembled second-term team, some key members of which are fervent China hawks, and an inner circle of loyalists who are unlikely to push back against the Republican leader. Read full story here	https://english.kyodonews.net/news/2024/11/b749a9437236-focus-bidens-guardrails-on-us-china-ties-may-live-on-under-trump-20.html	2024-11-18T17:36:00-08:00	
Shuntaro Tanikawa, noted poet and translator of 'Peanuts,' dies a...	Shuntaro Tanikawa, a leading poet in postwar Japan also known for his translations of the U.S. cartoon series 'Peanuts' and the British 'Mother Goose' nursery rhymes, has died, sources close to the matter said Tuesday. He was 92. The Tokyo native gained prominence after the 1952 release of his first book of poetry, 'Niju Oku Konen no Kodoku' (Two Billion Light Years of Solitude), with critics praising his vibrant use of the Japanese language. He died last Wednesday of natural causes. Read full story here	https://english.kyodonews.net/news/2024/11/02dbfb070453-shuntaro-tanikawa-noted-poet-and-translator-of-peanuts-dies-at-92.html	2024-11-18T16:59:25-08:00	
G20 leaders discuss global challenges ahead of Trump's return	The leaders of the Group of 20 economies began a two-day meeting on Monday in Brazil to address global challenges, including geopolitical conflicts and climate change, ahead of Donald Trump's return as U.S. president in January. The leaders gathered as Trump's comeback revives memories of his disruption of the G20 and other multilateral frameworks during his first term, when his 'America First' stance tested international unity. His embrace of protectionism has also added a layer of uncertainty to the global economy. Read full story here	https://english.kyodonews.net/news/2024/11/efe83619028d-update2-g20-leaders-discuss-global-challenges-ahead-of-trumps-return.html	2024-11-18T16:41:00-08:00	
Kyodo News Digest: Nov. 19, 2024	The following is the latest list of selected news summaries by Kyodo News. ---------- Read full story here	https://english.kyodonews.net/news/2024/11/e348f2494b20-kyodo-news-digest-nov-19-2024.html	2024-11-18T16:18:00-08:00	
BREAKING NEWS: G20 notes human suffering, negative impact of war ...	BREAKING NEWS: G20 notes human suffering, negative impact of war in Ukraine ==KyodoRead full story here	https://english.kyodonews.net/news/2024/11/0abc59cd32d0-breaking-news-g20-notes-human-suffering-negative-impact-of-war-in-ukraine.html	2024-11-18T15:50:57-08:00	
BREAKING NEWS: G20 airs deep concern about humanitarian situation...	BREAKING NEWS: G20 airs deep concern about humanitarian situation in Gaza, Lebanon ==KyodoRead full story here	https://english.kyodonews.net/news/2024/11/e9d2dcd0104e-breaking-news-g20-airs-deep-concern-about-humanitarian-situation-in-gaza-lebanon.html	2024-11-18T15:49:10-08:00	
BREAKING NEWS: G20 sees good prospects of global economic soft la...	BREAKING NEWS: G20 sees good prospects of global economic soft landing, cites risks ==KyodoRead full story here	https://english.kyodonews.net/news/2024/11/a9f5416c5474-breaking-news-g20-sees-good-prospects-of-global-economic-soft-landing-cites-risks.html	2024-11-18T15:48:04-08:00	
BREAKING NEWS: G20 'united' in resolve to achieve goals of Paris ...	BREAKING NEWS: G20 'united' in resolve to achieve goals of Paris climate accord ==KyodoRead full story here	https://english.kyodonews.net/news/2024/11/1ddf522a4a5c-breaking-news-g20-united-in-resolve-to-achieve-goals-of-paris-climate-accord.html	2024-11-18T15:41:15-08:00	
BREAKING NEWS: G20 says political, geopolitical tensions hamper g...	BREAKING NEWS: G20 says political, geopolitical tensions hamper growth ==Kyodo Read full story here	https://english.kyodonews.net/news/2024/11/b3de3fdbc7dc-breaking-news-g20-says-political-geopolitical-tensions-hamper-growth.html	2024-11-18T15:38:38-08:00	
BREAKING NEWS: G20 leaders drop mention of protectionism in joint...	BREAKING NEWS: G20 leaders drop mention of protectionism in joint statement ==KyodoRead full story here	https://english.kyodonews.net/news/2024/11/e8538b20cf9b-breaking-news-g20-leaders-drop-mention-of-protectionism-in-joint-statement.html	2024-11-18T15:37:09-08:00	
BREAKING NEWS: G20 commits to rules-based, nondiscriminatory, fai...	BREAKING NEWS: G20 commits to rules-based, nondiscriminatory, fair trade: statement ==KyodoRead full story here	https://english.kyodonews.net/news/2024/11/3091da64e5d7-breaking-news-g20-commits-to-rules-based-nondiscriminatory-fair-trade-statement.html	2024-11-18T15:36:15-08:00	
Japan, Britain to launch ministerial dialogue on economic securit...	Japan and Britain agreed Monday to launch a new framework for dialogue among their economic and foreign ministers to discuss trade, security and other shared challenges. The agreement was reached at a meeting between Japanese Prime Minister Shigeru Ishiba and British Prime Minister Keir Starmer on the margins of the Group of 20 summit in Brazil's Rio de Janeiro, according to the Japanese Foreign Ministry. Read full story here	https://english.kyodonews.net/news/2024/11/f5e9da631736-update1-japan-britain-to-launch-ministerial-dialogue-on-economic-security.html	2024-11-18T13:23:08-08:00	
BREAKING NEWS: Japan, Britain to launch ministerial dialogue on e...	BREAKING NEWS: Japan, Britain to launch ministerial dialogue on economic security ==KyodoRead full story here	https://english.kyodonews.net/news/2024/11/dc0591eb0009-breaking-news-japan-britain-to-launch-ministerial-dialogue-on-economic-security.html	2024-11-18T12:29:11-08:00	
Sumo: Hoshoryu, Kotozakura remain among leaders on Day 9	Ozeki Hoshoryu reeled off another commanding victory Monday at the Kyushu Grand Sumo Tournament as the leading pack was whittled to three wrestlers. The Mongolian star improved to 8-1 along with fellow ozeki Kotozakura and former sekiwake Takanosho after the other overnight leader, No. 15 maegashira Onokatsu, dropped onto the second rung alongside four other wrestlers on Day 9 at Fukuoka Kokusai Center. Read full story here	https://english.kyodonews.net/news/2024/11/d2b4b88ef295-sumo-hoshoryu-kotozakura-remain-among-leaders-on-day-9.html	2024-11-18T02:09:00-08:00	
Mt. Fuji tram idea derailed by environmental concerns	A proposal by Yamanashi Prefecture to build a light rail connection to the fifth station on Mt. Fuji has been given up amid public concerns over its environmental impact, sources close to the matter said Monday. The central Japan prefecture had explored the possibility of connecting the foot of the country's tallest peak to the intermediate station in an attempt to deal with the large influx of summer tourists and reduce vehicle emissions. Read full story here	https://english.kyodonews.net/news/2024/11/324894eef202-mt-fuji-tram-idea-derailed-by-environmental-concerns.html	2024-11-17T21:29:00-08:00	
BREAKING NEWS: BOJ's monetary policy adjustments to help curb sha...	BREAKING NEWS: BOJ's monetary policy adjustments to help curb sharp inflation: Ueda ==KyodoRead full story here	https://english.kyodonews.net/news/2024/11/cac2e38cda6f-breaking-news-bojs-monetary-policy-adjustments-to-help-curb-sharp-inflation-ueda.html	2024-11-17T21:04:15-08:00	
