Title	Description	Link	pubDate	Image
PM Ishiba's vehicle rear-ends police car in western Japan	The vehicle carrying Prime Minister Shigeru Ishiba rear-ended a police car Sunday in Tottori Prefecture, western Japan. Ishiba was not injured, according to government officials. At around 10:30 a.m. the prime minister's vehicle apparently hit the security police car that had stopped for a red light at an intersection. Read full story here	https://english.kyodonews.net/news/2024/12/a2cc11009b8f-pm-ishibas-vehicle-rear-ends-police-car-in-western-japan.html	2024-11-30T20:16:30-08:00	
Princess Aiko turns 23, takes on more official duties while worki...	Princess Aiko, the only child of Emperor Naruhito and Empress Masako, turned 23 on Sunday, marking her first year as a working adult while growing into her role as a member of the Japanese imperial family. Having graduated from university in the spring, the princess has been participating more frequently in official duties and ceremonies and has expressed her gratitude for the warm support of the people, according to the Imperial Household Agency. Read full story here	https://english.kyodonews.net/news/2024/12/0d303a81a883-princess-aiko-turns-23-takes-on-more-official-duties-while-working.html	2024-11-30T16:15:00-08:00	
Kyodo News Digest: Dec. 1, 2024	The following is the latest list of selected news summaries by Kyodo News. ---------- Read full story here	https://english.kyodonews.net/news/2024/12/2bccb8c66a4c-kyodo-news-digest-dec-1-2024.html	2024-11-30T16:12:55-08:00	
Japan to provide defense equipment to Philippines, 3 other nation...	Japan plans to provide defense equipment to the Philippines, Indonesia, Mongolia and Djibouti under its official security assistance to the armed forces of like-minded countries that share its values, a government source said Saturday. The four countries have been designated as the recipients of the OSA grant aid for fiscal 2024 through March next year, with Japan earmarking 5 billion yen ($33 million) in its initial budget for the current fiscal year, the source said. Read full story here	https://english.kyodonews.net/news/2024/12/841b1ed83b58-japan-to-provide-defense-equipment-to-philippines-3-other-nations.html	2024-11-30T16:00:00-08:00	
30% of tourists to Japan experienced overtourism problems in 2024	Over 30 percent of foreign tourists to Japan experienced problems associated with overtourism during their trips in 2024 and more than 60 percent said they are willing to accept higher charges as a way to ease congestion and protect natural and cultural resources, according to a recent survey. The survey of 7,796 foreigners about their travel plans and experiences, jointly conducted by the Development Bank of Japan and the Japan Travel Bureau Foundation and released in October, found that congestion of tourist destinations was the most common problem, with 32 percent of respondents saying they experienced it during their stay. Read full story here	https://english.kyodonews.net/news/2024/12/d896639c60bf-30-of-tourists-to-japan-experienced-overtourism-problems-in-2024.html	2024-11-30T15:47:00-08:00	
Plan emerges for Japan retailer Seven & i to spin off noncore sto...	A plan for Japanese retail giant Seven & i Holdings Co. to separately sell some of its noncore specialty store businesses is being floated as part of an effort to offload shares in its intermediate subsidiary York Holdings Co., a source close to the matter said Saturday. The idea to spin off the noncore businesses, such as those in lifestyle goods and children's apparel, was proposed by potential buyers, the source said. Read full story here	https://english.kyodonews.net/news/2024/11/ebfe8080b7b5-japan-retailer-seven--i-eyes-spinning-off-noncore-specialty-stores.html	2024-11-30T06:01:00-08:00	
Olympics: Japan's Paris medalists parade in Tokyo to thank fans	Around 100 Japanese athletes who competed at the Paris Olympics and Paralympics paraded Saturday on a famous street in Tokyo's Nihombashi area for about 700 meters to thank fans for their support. About 10,000 spectators gathered on Chuo Street to catch a glimpse of the athletes, including Olympic men's judo 66-kilogram champion Hifumi Abe, women's wrestling 53-kg gold medalist Akari Fujinami and Paralympic women's badminton singles gold medalist Sarina Satomi. Read full story here	https://english.kyodonews.net/news/2024/11/ee15a82a18c8-olympics-japans-paris-medalists-parade-in-tokyo-to-thank-fans.html	2024-11-30T01:17:00-08:00	
Chinese police make arrest in fatal stabbing of Japan boy in Shen...	Chinese police have formally arrested and are expected to prosecute a Chinese man in his 40s on suspicion of murder in the fatal stabbing of a Japanese schoolboy in September, diplomatic sources said Saturday. The Japanese government has requested China share details of its investigation into the killing of the 10-year-old pupil in Shenzhen, southern China, but Chinese authorities have yet to disclose the motive or any background to the case. Read full story here	https://english.kyodonews.net/news/2024/11/7c6428c28247-chinese-police-make-arrest-in-fatal-stabbing-of-japan-boy-in-shenzhen.html	2024-11-29T23:43:00-08:00	
Japan firm's wearable robot suits to help injured Ukraine soldier...	Wearable suits developed by a Japanese robotics company are set to be used to help former Ukrainian soldiers who suffered severe injuries in the war against Russia regain muscular functions. Cyberdyne Inc. said it has won a 360 million yen ($2.4 million) order to deliver 46 units of its HAL robotic suit series as part of a Japanese government-backed agency's project to help Ukraine reconstruct in the wake of the Russian invasion launched in February 2022. Read full story here	https://english.kyodonews.net/news/2024/11/b1c1951048b9-japan-firms-wearable-robot-suits-to-help-injured-ukraine-soldiers.html	2024-11-29T17:09:00-08:00	
Japan crown prince hopes female imperial members' opinions are he...	Crown Prince Fumihito, the younger brother of Emperor Naruhito, said ahead of his 59th birthday on Saturday that the opinions of female royal members must be heard as lawmakers consider allowing them to retain their imperial status even after they marry a commoner. The crown prince made the remarks to reporters in Tokyo earlier in the week following an interim report compiled by ruling and opposition parties in September, in which they said such female members should be allowed to keep their imperial status as a way to address the shrinking royal household. Read full story here	https://english.kyodonews.net/news/2024/11/604962a87dc8-japan-crown-prince-hopes-female-imperial-members-opinions-are-heard.html	2024-11-29T16:49:00-08:00	
China resumes visa-free scheme for short-term Japan visitors	China restarted its unilateral visa-free arrangement for short-term Japanese visitors on Saturday, allowing stays of up to 30 days in a move believed to be aimed at promoting tourism and trade amid a downturn in the world's second-largest economy. The preferential treatment had been suspended since March 2020 due to the COVID-19 pandemic. The step will be effective through the end of next year. Read full story here	https://english.kyodonews.net/news/2024/11/8578c51d8a1f-china-resumes-visa-free-scheme-for-short-term-japan-visitors.html	2024-11-29T16:40:00-08:00	
Kyodo News Digest: Nov. 30, 2024	The following is the latest list of selected news summaries by Kyodo News. ---------- Read full story here	https://english.kyodonews.net/news/2024/11/5b80085e212f-kyodo-news-digest-nov-30-2024.html	2024-11-29T16:29:00-08:00	
Japan, Britain, Italy weigh Saudi Arabia joining fighter jet proj...	Japan, Britain and Italy are considering inviting Saudi Arabia to join their next-generation fighter jet development project with its financial support, a British government source said Friday. Britain is looking to provide support for engineers in the Middle Eastern nation and its defense industry in return for its financial contribution to the trilateral project, under which the three countries aim to deploy the first jet by 2035, the source said. Read full story here	https://english.kyodonews.net/news/2024/11/7ad5c6de6943-update1-japan-britain-italy-weigh-saudi-arabia-joining-fighter-jet-project.html	2024-11-29T05:22:00-08:00	
Sumo association to visit London after 20-year overseas hiatus	The Japan Sumo Association's first overseas exhibitions in 20 years will take place next October in London, the organizing body revealed Friday. In advance of the tour, JSA President Hakkaku will attend Wednesday's press conference in London. Read full story here	https://english.kyodonews.net/news/2024/11/055ea8429616-sumo-association-to-visit-london-after-20-year-overseas-hiatus.html	2024-11-29T03:41:00-08:00	
Greece withdraws from 2025 World Expo in Osaka, becoming 8th nati...	Greece has decided to withdraw from the World Expo scheduled for next year in Osaka, Japan, the organizer said Friday, with the European country citing fiscal constraints. It is the eighth country to drop out after initially planning to participate in the expo, to be hosted by the commercial hub of western Japan, amid concerns about the event's ballooning costs. Read full story here	https://english.kyodonews.net/news/2024/11/852cbb9a60e2-greece-withdraws-from-2025-world-expo-in-osaka-becoming-8th-nation.html	2024-11-29T03:10:00-08:00	
BREAKING NEWS: Japan, Britain, Italy weigh Saudi Arabia joining f...	BREAKING NEWS: Japan, Britain, Italy weigh Saudi Arabia joining fighter jet project ==KyodoRead full story here	https://english.kyodonews.net/news/2024/11/14bec37c7cfa-breaking-news-japan-britain-italy-weigh-saudi-arabia-joining-fighter-jet-project.html	2024-11-29T03:02:05-08:00	
Mt. Fuji photo spot to get new fences to curb jaywalking	A central Japan town plans to put up new fences along a road in front of a Lawson convenience store offering scenic views of Mt. Fuji, local authorities said Friday, aiming to prevent people from stepping into traffic at the spot popular among foreign tourists. The site in Fujikawaguchiko, Yamanashi Prefecture, has been inundated with visitors looking to photograph the famous mountain as if perched above the store. The development has prompted the town's government to take preventative measures. Read full story here	https://english.kyodonews.net/news/2024/11/ebdb99e4a5fa-mt-fuji-photo-spot-to-get-new-fences-to-curb-jaywalking.html	2024-11-29T02:15:00-08:00	
BREAKING NEWS: Japan gov't OKs 13.9 tril. yen extra budget to cur...	BREAKING NEWS: Japan gov't OKs 13.9 tril. yen extra budget to curb inflation burden ==KyodoRead full story here	https://english.kyodonews.net/news/2024/11/35659fdce1c8-breaking-news-japan-govt-oks-139-tril-yen-extra-budget-to-curb-inflation-burden.html	2024-11-29T00:00:56-08:00	
Japan PM vows cross-party approach in Diet to achieve policies	Japanese Prime Minister Shigeru Ishiba said Friday he will strive to build consensus across party lines as his minority government looks for opposition support to achieve policy goals after a dismal election outcome. In his first policy speech in parliament since his ruling coalition lost its majority of the House of Representatives in a late October general election, Ishiba vowed to realize an opposition plan to raise the income threshold for tax payments. Read full story here	https://english.kyodonews.net/news/2024/11/fdc4dfcb6b28-japan-pm-vows-cross-party-approach-in-diet-to-achieve-policies.html	2024-11-28T23:43:00-08:00	
Over 3,000 Toshiba group staff apply for early retirement program	Over 3,000 employees of Toshiba Corp.'s group companies in Japan have applied for its early retirement program as part of the company's turnaround plans, sources familiar with the matter said Friday. The number represents about 5 percent of the domestic workforce at the Toshiba group, which is trying to rebuild itself after going private late last year in a 2 trillion yen ($13 billion) buyout from a consortium led by Japan Industrial Partners Inc. Read full story here	https://english.kyodonews.net/news/2024/11/8710b7c4a406-update1-over-3000-toshiba-group-staff-apply-for-early-retirement-program.html	2024-11-28T23:38:00-08:00	
BREAKING NEWS: Over 3,000 Toshiba group staff apply for early ret...	BREAKING NEWS: Over 3,000 Toshiba group staff apply for early retirement program ==KyodoRead full story here	https://english.kyodonews.net/news/2024/11/9621e22bde81-breaking-news-over-3000-toshiba-group-staff-apply-for-early-retirement-program.html	2024-11-28T22:14:14-08:00	
PFAS chemicals detected in 20% of Japanese tap water in gov't sur...	Chemicals potentially harmful to human health, collectively known as PFAS, were detected in about 20 percent of tap water in Japan, though no samples contained the maximum permissible amount tentatively set by the government, a survey showed Friday. In the government's first large-scale survey covering even small water utility companies, the chemicals were detected in water samples from 332 water companies in 46 of the country's 47 prefectures out of 1,745 companies surveyed. Read full story here	https://english.kyodonews.net/news/2024/11/b401245db5c0-pfas-chemicals-detected-in-20-of-japanese-tap-water-in-govt-survey.html	2024-11-28T22:09:00-08:00	
Chinese man admits to role in Yasukuni shrine graffiti case	A Chinese national living in Japan on Friday admitted to his involvement in a graffiti incident at the war-linked Yasukuni shrine in Tokyo in May. Jiang Zhuojun, 29, pleaded guilty at the Tokyo District Court to charges of damaging property and disrespecting a place of worship, and said the motive behind his actions was not related to history issues. Read full story here	https://english.kyodonews.net/news/2024/11/42707006303b-chinese-man-admits-to-role-in-yasukuni-shrine-graffiti-case.html	2024-11-28T21:14:00-08:00	
Ex-China editor accused of info leak to Japan given 7-yr jail ter...	A Beijing court on Friday gave a seven-year jail term to a former senior editor at a major Chinese newspaper affiliated with the ruling Communist Party who had been accused of leaking information to Japanese diplomats, sources familiar with the matter said. Dong Yuyu, a former deputy head of the Guangming Daily editorial department, had pleaded not guilty to the charge. He was detained in February 2022 after meeting with a Japanese Embassy official in Beijing and was indicted in March last year for alleged espionage, the sources said. Read full story here	https://english.kyodonews.net/news/2024/11/f8ce983a7676-ex-china-editor-accused-of-info-leak-to-japan-given-7-yr-jail-term.html	2024-11-28T19:59:00-08:00	
Social media now bears responsibility to protect children: Austra...	Australian Prime Minister Anthony Albanese said Friday that social media platforms now have a responsibility to ensure the safety of children, after the country's parliament passed a world-first bill banning children under 16 from the services. The legislation will require social media companies to 'take reasonable steps' to prevent those under 16 from creating or holding an account on platforms such as TikTok, Facebook, Snapchat, Instagram, Reddit and X, or face fines of up to AU$49.5 million ($32 million). Read full story here	https://english.kyodonews.net/news/2024/11/4c43bbadfaf0-social-media-now-bears-responsibility-to-protect-children-aus-pm.html	2024-11-28T19:45:00-08:00	
BREAKING NEWS: U.S. dollar falls below 150 yen for 1st time since...	BREAKING NEWS: U.S. dollar falls below 150 yen for 1st time since late Oct. ==KyodoRead full story here	https://english.kyodonews.net/news/2024/11/5070076565a6-breaking-news-us-dollar-falls-below-150-yen-for-1st-time-since-late-oct.html	2024-11-28T17:48:53-08:00	
Kyodo News Digest: Nov. 29, 2024	The following is the latest list of selected news summaries by Kyodo News. ---------- Read full story here	https://english.kyodonews.net/news/2024/11/66ebb2a57fd1-kyodo-news-digest-nov-29-2024.html	2024-11-28T16:25:00-08:00	
BREAKING NEWS: Japan's industrial output in Oct. rises 3.0% on mo...	BREAKING NEWS: Japan's industrial output in Oct. rises 3.0% on month ==KyodoRead full story here	https://english.kyodonews.net/news/2024/11/77a528e2aa0a-breaking-news-japans-industrial-output-in-oct-rises-30-on-month.html	2024-11-28T15:51:16-08:00	
BREAKING NEWS: Japan's jobless rate rises to 2.5% in Oct.	BREAKING NEWS: Japan's jobless rate rises to 2.5% in Oct. ==KyodoRead full story here	https://english.kyodonews.net/news/2024/11/233bc56a040a-breaking-news-japans-jobless-rate-rises-to-25-in-oct.html	2024-11-28T15:31:34-08:00	
Australian Senate passes world's 1st social media ban for under-1...	The Australian Senate on Thursday passed a bill banning children under 16 from using social media, positioning Australia to become the first country to enact such a law as governments worldwide seek to protect young people from the mental and physical health risks posed by social networking sites. The legislation will require social media companies to 'take reasonable steps' to prevent those under 16 from creating or holding an account on platforms such as TikTok, Facebook, Snapchat, Instagram, Reddit and X, or face fines of up to AU$49.5 million ($32 million). Read full story here	https://english.kyodonews.net/news/2024/11/0e210a7590a6-australian-senate-passes-worlds-1st-social-media-ban-for-under-16s.html	2024-11-28T06:59:00-08:00	
Basketball: Watanabe ready to mediate in Hachimura's row with JBA	Japan forward Yuta Watanabe voiced hope he might calm the waters after his national teammate Rui Hachimura openly questioned Tom Hovasse staying on as the men's team head coach. 'I'm looking to communicate with Tom, Rui and also the Japan Basketball Association in order to make the national team better,' Watanabe, who played six seasons in the NBA before returning home with Chiba Jets this summer, told reporters Thursday. Read full story here	https://english.kyodonews.net/news/2024/11/b440119301e7-basketball-watanabe-ready-to-mediate-in-hachimuras-row-with-jba.html	2024-11-28T02:45:00-08:00	
Japan PM Ishiba mulls South Korea visit in early Jan. to meet wit...	Japanese Prime Minister Shigeru Ishiba is considering visiting South Korea in early January for talks with President Yoon Suk Yeol, diplomatic sources said Thursday. The planned trip will be part of their 'shuttle diplomacy,' or regular mutual visits, resumed between Tokyo and Seoul in 2023 before the 60th anniversary of the normalization of their ties next year. Read full story here	https://english.kyodonews.net/news/2024/11/9bde76507300-update1-japan-pm-ishiba-mulls-s-korea-visit-in-early-jan-to-meet-with-yoon.html	2024-11-28T00:59:00-08:00	
Earthquake alert (automated)	The following is an earthquake alert issued by the Japan Meteorological Agency. Day and Time: Nov. 28, 2024, 5:31 p.m. Epicenter: Off Ishikawa Prefecture. N 36.9 , E 136.4 Depth: 10 kilometers Preliminary magnitude: 4.8 Seismic intensity scale: 4 out of maximum 7 Read full story here	https://english.kyodonews.net/news/2024/11/81c2f366db64-earthquake-alert-automated.html	2024-11-28T00:34:45-08:00	
Lawmaker's husband, daughter remain missing after Tokyo condo fir...	The husband and eldest daughter of Liberal Democratic Party lawmaker Kuniko Inoguchi remained unaccounted for Thursday after a fire at the family's Tokyo condominium, metropolitan police said, though two bodies found at the scene have yet to be positively identified. Inoguchi's husband, Takashi, 80, a professor emeritus of politics and international relations at the University of Tokyo, and her 33-year-old eldest daughter were captured on security camera footage in the building late Wednesday afternoon, according to investigative sources. Read full story here	https://english.kyodonews.net/news/2024/11/a9688a393492-lawmakers-husband-daughter-remain-missing-after-tokyo-condo-fire.html	2024-11-28T00:34:00-08:00	
BREAKING NEWS: Japan PM mulls S. Korea visit in Jan. for summit t...	BREAKING NEWS: Japan PM mulls S. Korea visit in Jan. for summit talks with Yoon ==KyodoRead full story here	https://english.kyodonews.net/news/2024/11/27bd7982af56-breaking-news-japan-pm-mulls-s-korea-visit-in-jan-for-summit-talks-with-yoon.html	2024-11-28T00:30:09-08:00	
Extra Diet session begins with minority government eyeing budget,...	Japan's parliament convened an extraordinary session Thursday for deliberations on a supplementary budget to help inflation-hit households and a revision of the political funds law following a bruising scandal, in the first major test for Prime Minister Shigeru Ishiba's minority government. The 24-day session through Dec. 21 will see Ishiba engage in substantive parliamentary debate for the first time since his ruling coalition lost its majority in the House of Representatives in late October. Read full story here	https://english.kyodonews.net/news/2024/11/3952c7f648a0-extra-diet-session-begins-with-minority-govt-eyeing-budget-reforms.html	2024-11-28T00:02:00-08:00	
Japan's popular Nozomi bullet trains eye reducing nonreserved sea...	The operators of Nozomi bullet train services connecting Tokyo and Fukuoka's Hakata Station in southwestern Japan are considering reducing the number of nonreserved seats from next spring, sources close to the matter said Thursday. The move comes as the growing use of online reservation systems has increased demand for reserved seats for the super-express services on the Tokaido and Sanyo shinkansen lines linking Tokyo with major western Japanese cities including Osaka and Kyoto. Read full story here	https://english.kyodonews.net/news/2024/11/ea27497c2085-tokyo-hakata-nozomi-bullet-trains-eye-reducing-nonreserved-seats.html	2024-11-27T20:38:00-08:00	
Japan's ex-top currency diplomat Masato Kanda picked as next ADB ...	Former top Japanese currency diplomat Masato Kanda has been selected as the next president of the Asian Development Bank, the Manila-based international lender said Thursday. Kanda, 59, currently a special adviser to Japan's prime minister, will take office on Feb. 24, 2025 as the 11th president, succeeding Masatsugu Asakawa, another former senior official of Japan's Finance Ministry, the ADB said. Read full story here	https://english.kyodonews.net/news/2024/11/8a33aaf84c63-japans-ex-top-currency-diplomat-kanda-picked-as-next-adb-chief.html	2024-11-27T18:55:00-08:00	
Japan to offer interest-free loans to elderly to quake-proof home...	Japan is considering offering interest-free loans to people aged 70 and older to reinforce their homes against earthquakes in the wake of a devastating temblor on New Year's Day, a government source said Wednesday. Under the new plan, borrowers will be able to use their homes and land as collateral to secure loans for retrofitting their residences, while the government will cover the monthly interest payments, the source added. Read full story here	https://english.kyodonews.net/news/2024/11/1c8425595349-japan-to-offer-interest-free-loans-to-elderly-to-quake-proof-homes.html	2024-11-27T16:25:00-08:00	
Kyodo News Digest: Nov. 28, 2024	The following is the latest list of selected news summaries by Kyodo News. ---------- Read full story here	https://english.kyodonews.net/news/2024/11/fa331b5870ac-kyodo-news-digest-nov-28-2024.html	2024-11-27T16:05:00-08:00	
FOCUS: Kin of 1985 JAL crash victim shines as beacon for disaster...	Kuniko Miyajima, 77, had been expecting a day like any other, with her family gathered around the dinner table, smiling and enjoying the meal she lovingly prepared. But her life changed forever when her 9-year-old son Ken died in the 1985 Japan Airlines jumbo jet crash. The mother has since led an association of the families bereaved by the world's deadliest single-aircraft accident, which started off as a mutual support group and has, over the decades, become a beacon for others in Japan dealing with similar tragedies. Read full story here	https://english.kyodonews.net/news/2024/11/b50e594e7875-focus-kin-of-1985-jal-crash-victim-shines-as-beacon-for-disaster-bereaved.html	2024-11-27T15:40:00-08:00	
China shows support for Osaka Expo, vows safety for expats from J...	Chinese Vice Premier He Lifeng showed support for the upcoming World Exposition in Osaka and pledged to ensure the safety of Japanese nationals in China as he met Wednesday with a business delegation from the neighboring country, the group said. He told the business leaders from western Japan's Kansai area, which includes the expo's host city, that it is important to 'overcome challenges and achieve win-win' outcomes, according to group members. Read full story here	https://english.kyodonews.net/news/2024/11/3f6931541c92-china-shows-support-for-osaka-expo-vows-safety-for-expats-from-japan.html	2024-11-27T15:13:00-08:00	
2 die in fire at Japan lawmaker's residence, family unaccounted f...	A fire broke out Wednesday in the Tokyo apartment building where Liberal Democratic Party lawmaker Kuniko Inoguchi lives with her family, and two unidentified bodies have been found at the scene, police said, noting that her husband and one of their daughters remain unaccounted for. Four people were living in the 72-year-old House of Councillors member's residence and contact was made with Inoguchi and her other daughter, the metropolitan police said. Read full story here	https://english.kyodonews.net/news/2024/11/89bd07bbc875-urgent-fire-breaks-out-at-apartment-unit-of-ldp-lawmaker-inoguchi-in-tokyo.html	2024-11-27T13:55:00-08:00	
BREAKING NEWS: Inoguchi contacted after fire, safety of husband, ...	BREAKING NEWS: Inoguchi contacted after fire, safety of husband, daughter unknown ==KyodoRead full story here	https://english.kyodonews.net/news/2024/11/faaff4ee9fcc-breaking-news-inoguchi-contacted-after-fire-safety-of-husband-daughter-unknown.html	2024-11-27T05:58:35-08:00	
