Title	Description	Link	pubDate	Image
BREAKING NEWS: Fire breaks out apartment unit of LDP lawmaker Ino...	BREAKING NEWS: Fire breaks out apartment unit of LDP lawmaker Inoguchi in Tokyo ==KyodoRead full story here	https://english.kyodonews.net/news/2024/11/388fe6779298-breaking-news-fire-breaks-out-apartment-unit-of-ldp-lawmaker-inoguchi-in-tokyo.html	2024-11-27T05:53:57-08:00	
One Piece-themed shinkansen to run in western Japan in 2025	A shinkansen bullet train adorned with characters from the popular manga series 'One Piece' will start operations in western Japan next spring, its operator said Wednesday. The service will mark the 50th anniversary of the Sanyo Shinkansen Line between Osaka and Fukuoka prefectures and coincides with the 2025 World Exposition to be held in Osaka between April and October. Read full story here	https://english.kyodonews.net/news/2024/11/818db53fd8ae-one-piece-themed-shinkansen-to-run-in-western-japan-in-2025.html	2024-11-27T04:54:00-08:00	
Japan to revise duty-free rules, refund consumption tax on return	Japan plans to revise its duty-free rules for foreign visitors from the latter half of fiscal 2026, sources close to the matter said Wednesday. Among the proposed changes is reimbursing the consumption tax upon their return to their home country. Read full story here	https://english.kyodonews.net/news/2024/11/f6648b18dcb2-japan-to-revise-duty-free-rules-refund-consumption-tax-on-return.html	2024-11-27T02:12:00-08:00	
Reelected Hyogo governor denies violating election law in his cam...	Hyogo Gov. Motohiko Saito on Wednesday denied growing accusations that he violated the election law by involving a public relations agency to run his social media campaign in the gubernatorial race that saw him reelected despite losing his job over abuse of power allegations. Saito reclaimed his position as governor of the western Japan prefecture in the Nov. 17 election but has come under renewed scrutiny following the firm's disclosure in a blog post on Nov. 20 that it was in charge of public relations operations for Saito's campaign in general. Read full story here	https://english.kyodonews.net/news/2024/11/fc870292d398-reelected-hyogo-gov-denies-violating-election-law-in-his-campaign.html	2024-11-27T02:02:00-08:00	
Laos-China railway boosts trade and tourism, but also Beijing's c...	In the Laotian border town of Boten, the arrival of a sleek, modern train on a route that connects with southern China is a sign of growing trade and tourism links between one of Southeast Asia's poorest countries and its giant neighbor. But it also signifies a marked rise in Chinese influence in Laos, and the drawing of the country closer into Beijing's orbit. The 1,035-kilometer line connecting Kunming in southwest China's Yunnan Province with the Laotian capital Vientiane opened in late 2021, although trains only started crossing the border after the lifting of COVID-19 restrictions in April 2023. Read full story here	https://english.kyodonews.net/news/2024/11/6290c3c6c7e5-feature-laos-china-railway-boosts-trade-and-tourism-but-also-beijings-clout.html	2024-11-27T00:04:00-08:00	
Man in jail for murder newly accused of killing another girl in 2...	A man serving a life term for murdering an elementary schoolgirl was served a fresh arrest warrant on Wednesday for allegedly killing another girl in western Japan, local police said, marking a major development in a case that has remained unsolved for 17 years. Kunihiko Katsuta, 45, is newly accused of killing a 7-year-old girl by stabbing her in the chest and stomach in front of her home in Kakogawa, Hyogo Prefecture, on Oct. 16, 2007, the police said, adding he has remained silent about the case. Read full story here	https://english.kyodonews.net/news/2024/11/9cd7006bad77-man-in-jail-for-murder-newly-accused-of-killing-another-girl-in-2007.html	2024-11-26T23:28:00-08:00	
Court upholds rejection of call to halt Miyagi Prefecture nuclear...	The Sendai High Court on Wednesday upheld a lower court ruling rejecting local residents' call to halt a nuclear reactor in northeastern Japan. The decision followed a ruling by the Sendai District Court in May last year that dismissed the plaintiffs' concerns about flaws in emergency evacuation plans for the Onagawa nuclear power plant's No. 2 unit in Miyagi Prefecture, stating they were not relevant as it could not be assumed a serious accident was likely. Read full story here	https://english.kyodonews.net/news/2024/11/00a430dfc21d-court-upholds-rejection-of-call-to-halt-miyagi-pref-nuclear-reactor.html	2024-11-26T22:49:00-08:00	
Japan prosecutor apologizes to man acquitted of 1966 murders	A chief public prosecutor in central Japan on Wednesday apologized in person to an 88-year-old man who was acquitted in a retrial over a 1966 quadruple murder case, after spending more than four decades on death row. 'I am deeply sorry that you were placed in an uncertain legal status for a long time,' Hideo Yamada, chief of the Shizuoka District Public Prosecutors Office told Iwao Hakamata during a visit to his house in Hamamatsu, Shizuoka Prefecture. Read full story here	https://english.kyodonews.net/news/2024/11/4305b539b9de-japan-prosecutor-apologizes-to-man-acquitted-of-1966-murders.html	2024-11-26T20:38:00-08:00	
Kyodo News Digest: Nov. 27, 2024	The following is the latest list of selected news summaries by Kyodo News. ---------- Read full story here	https://english.kyodonews.net/news/2024/11/a2b124bd2fd3-kyodo-news-digest-nov-27-2024--1-.html	2024-11-26T16:23:00-08:00	
Podcast [English World] Episode 73: Soy sauce	How often do you use soy sauce? Read full story here	https://english.kyodonews.net/news/2024/11/7e986a375f11-podcast-english-world-episode-73-soy-sauce.html	2024-11-26T15:44:00-08:00	
G7 raps North Korean troops in Russia as threat to Indo-Pacific s...	The Group of Seven foreign ministers on Tuesday criticized 'in the strongest possible terms' the deepening military collaboration between North Korea and Russia. In a statement issued after two-day talks in Italy, the ministers said that Pyongyang's troop dispatch to help Moscow's war efforts in Ukraine 'marks a dangerous expansion of the conflict' and will result in 'serious consequences for European and Indo-Pacific security.' Read full story here	https://english.kyodonews.net/news/2024/11/fda2ff9d74fa-update1-g7-raps-n-korean-troops-in-russia-as-threat-to-indo-pacific-security.html	2024-11-26T15:32:00-08:00	
Japan ruling, opposition blocs vow to scrap undisclosed policy fu...	Japan's ruling and opposition parties agreed Tuesday to work toward abolishing policy activity funds, which are not subject to disclosure even when such income reaches hundreds of millions of yen, during their first meeting on political reforms. But the ruling Liberal Democratic Party has expressed reluctance to eliminate corporate donations, which have benefited the pro-business LDP, lawmakers said, despite criticism that the practice is considered a form of bribery that could distort policy outcomes. Read full story here	https://english.kyodonews.net/news/2024/11/968a9355e421-japan-ruling-opposition-blocs-vow-to-scrap-undisclosed-policy-funds.html	2024-11-26T15:14:00-08:00	
BREAKING NEWS: N. Korea troop dispatch to Russia threatens Indo-P...	BREAKING NEWS: N. Korea troop dispatch to Russia threatens Indo-Pacific security: G7 ==KyodoRead full story here	https://english.kyodonews.net/news/2024/11/240a38a4c6c1-breaking-news-n-korea-troop-dispatch-to-russia-threatens-indo-pacific-security-g7.html	2024-11-26T07:46:50-08:00	
BREAKING NEWS: G7 top diplomats rap Russia-N. Korea military ties	BREAKING NEWS: G7 top diplomats rap Russia-N. Korea military ties ==KyodoRead full story here	https://english.kyodonews.net/news/2024/11/a9112eed5fe2-breaking-news-g7-top-diplomats-rap-russia-n-korea-military-ties.html	2024-11-26T07:44:10-08:00	
M6.4 quake hits central Japan, no tsunami warning issued	An earthquake with a preliminary magnitude of 6.4 struck Ishikawa and other central Japan prefectures Tuesday, the weather agency said, but no tsunami warning was issued. The 10:47 p.m. quake measured a lower 5 on the Japanese seismic scale of 7 in Noto, a region in Ishikawa where recovery efforts have been continuing following a devastating earthquake on New Year's Day, the Japan Meteorological Agency said. It occurred at a depth of around 10 kilometers off the western coast of the prefecture. Read full story here	https://english.kyodonews.net/news/2024/11/a86e1a506a33-urgent-m64-quake-hits-off-ishikawa-other-central-japan-areas.html	2024-11-26T06:51:00-08:00	
BREAKING NEWS: No abnormalities reported at Shika nuclear power p...	BREAKING NEWS: No abnormalities reported at Shika nuclear power plant in Ishikawa ==KyodoRead full story here	https://english.kyodonews.net/news/2024/11/3daeb0afdd08-breaking-news-no-abnormalities-reported-at-shika-nuclear-power-plant-in-ishikawa.html	2024-11-26T06:33:18-08:00	
BREAKING NEWS: No tsunami warning issued after quake in central J...	BREAKING NEWS: No tsunami warning issued after quake in central Japan ==KyodoRead full story here	https://english.kyodonews.net/news/2024/11/271afe06edd2-breaking-news-no-tsunami-warning-issued-after-quake-in-central-japan.html	2024-11-26T05:56:34-08:00	
BREAKING NEWS: M6.4 quake hits Ishikawa where recovery efforts co...	BREAKING NEWS: M6.4 quake hits Ishikawa where recovery efforts continuing ==KyodoRead full story here	https://english.kyodonews.net/news/2024/11/fcaa1ec8094b-breaking-news-m64-quake-hits-ishikawa-where-recovery-efforts-continuing.html	2024-11-26T05:55:31-08:00	
Earthquake alert (automated)	The following is an earthquake alert issued by the Japan Meteorological Agency. Day and Time: Nov. 26, 2024, 10:47 p.m. Epicenter: Off Ishikawa Prefecture. N 37.0 , E 136.5 Depth: 10 kilometers Preliminary magnitude: 6.4 Seismic intensity scale: Lower 5 out of maximum 7 Read full story here	https://english.kyodonews.net/news/2024/11/5fe985bcefb2-earthquake-alert-automated.html	2024-11-26T05:51:57-08:00	
BREAKING NEWS: Strong quake hits off Ishikawa Pref., central Japa...	BREAKING NEWS: Strong quake hits off Ishikawa Pref., central Japan ==KyodoRead full story here	https://english.kyodonews.net/news/2024/11/33f43c3f4bc6-breaking-news-strong-quake-hits-off-ishikawa-pref-central-japan.html	2024-11-26T05:51:24-08:00	
False report on Yasukuni visit 'regrettable': Japan government sp...	An erroneous report by Japan's Kyodo News claiming that House of Councillors lawmaker Akiko Ikuina visited the war-linked Yasukuni shrine in Tokyo was 'extremely regrettable,' the top government spokesman said Tuesday. Chief Cabinet Secretary Yoshimasa Hayashi said at a press conference that the report had had a negative impact on an event held Sunday on Sado Island to commemorate Japanese and Korean victims who worked at a gold and silver mine complex. Read full story here	https://english.kyodonews.net/news/2024/11/18ca522b8498-false-report-on-yasukuni-visit-regrettable-japan-govt-spokesman.html	2024-11-26T05:33:00-08:00	
1985 JAL crash victim's kin urges disaster family support globall...	A Japanese parent bereaved by the 1985 Japan Airlines jumbo jet crash on Tuesday called for support for families of air accident victims in their sorrow and search for the truth, as the U.N. aviation agency explores ways to globally enhance assistance for those most affected. 'Grief never recedes,' Kuniko Miyajima, 77, told an event organized by the International Civil Aviation Organization, recalling the loss of her 9-year-old son in the world's deadliest single-aircraft accident and underscoring the need for preparedness to assist families in the event of future tragedies. Read full story here	https://english.kyodonews.net/news/2024/11/44acadac0050-1985-jal-crash-victims-kin-urges-disaster-family-support-globally.html	2024-11-26T05:26:00-08:00	
Ukraine to participate in 2025 World Expo in Osaka: governor	Osaka Gov. Hirofumi Yoshimura said Tuesday that Ukraine, which has been under invasion by Russia since February 2022, will participate in the 2025 World Expo in the prefecture. Yoshimura's remarks come amid concerns that Ukraine may face difficulties in allocating funds for the international event, as the country is burdened by the financial strain of the war with Russia. Read full story here	https://english.kyodonews.net/news/2024/11/3a9f482938f5-update1-ukraine-to-participate-in-2025-world-expo-in-osaka-governor.html	2024-11-26T04:49:00-08:00	
BREAKING NEWS: Ukraine to participate in 2025 World Expo in Osaka...	BREAKING NEWS: Ukraine to participate in 2025 World Expo in Osaka: governor ==KyodoRead full story here	https://english.kyodonews.net/news/2024/11/a868500ead02-breaking-news-ukraine-to-participate-in-2025-world-expo-in-osaka-governor.html	2024-11-26T04:12:15-08:00	
Mental, family records among info items for Japan security cleara...	The Japanese government said Tuesday that it is considering requiring not only employment and travel history but also mental health records and the nationality of family members determining access to critical information under a 'security clearance' system. When seeking access to information designated by the government as classified, individuals -- whether from the private or public sector -- may also need to report their drinking habits, according to a draft proposal. Read full story here	https://english.kyodonews.net/news/2024/11/96ca1ee8ca7e-mental-family-records-among-info-items-for-japan-security-clearance.html	2024-11-26T02:55:00-08:00	
BREAKING NEWS: Japan's PM to vow in Diet speech to use IT to boos...	BREAKING NEWS: Japan's PM to vow in Diet speech to use IT to boost local economies ==KyodoRead full story here	https://english.kyodonews.net/news/2024/11/95cf21a1dae3-breaking-news-japans-pm-to-vow-in-diet-speech-to-use-it-to-boost-local-economies.html	2024-11-26T01:01:36-08:00	
Amazon Japan suspected of forcing retailers to cut product prices	Japan's antitrust watchdog conducted an on-site investigation of the Japanese unit of Amazon.com Inc. on Tuesday for allegedly forcing retailers to cut prices of products sold on its online shopping website, sources close to the matter said. Amazon Japan G.K. is alleged to have violated the antimonopoly law by forcing retailers to reduce prices in return for displaying their products in the most visible positions for users of its platform, with the involvement of its U.S. headquarters also suspected. Read full story here	https://english.kyodonews.net/news/2024/11/31005cec2285-amazon-japan-suspected-of-forcing-retailers-to-cut-product-prices.html	2024-11-25T22:39:00-08:00	
Epsilon rocket engine catches fire at Japan space agency test cen...	An engine being developed for use in the Epsilon S small rocket went up in flames Tuesday during a combustion test at a facility in southwestern Japan, the Japan Aerospace Exploration Agency said. The fire at the Tanegashima Space Center in Kagoshima Prefecture follows another incident in July 2023 when the same engine exploded during a test at the Noshiro Testing Center in northeastern Japan. Read full story here	https://english.kyodonews.net/news/2024/11/10a91243a1b1-epsilon-rocket-engine-catches-fire-at-japan-space-agency-test-center.html	2024-11-25T18:54:00-08:00	
Japan's Princess Yuriko's funeral held at Tokyo cemetery	The main funeral ceremony for Princess Yuriko, the oldest member of the Japanese imperial family and great-aunt of Emperor Naruhito, was held Tuesday at a cemetery in Tokyo after her death aged 101 earlier this month. Following a wake on Sunday and Monday, the Shinto ritual, called Renso-no-Gi, took place at the Toshimagaoka Cemetery for the imperial family in Tokyo's Bunkyo Ward, with her granddaughter Princess Akiko serving as the chief mourner. Read full story here	https://english.kyodonews.net/news/2024/11/2e75867d8486-princess-yurikos-funeral-held-at-tokyo-cemetery.html	2024-11-25T18:25:00-08:00	
Japan eyes cutting emissions by 60% by FY 2035 from FY 2013 level...	The Japanese government said Monday it is considering cutting greenhouse gas emissions by 60 percent by fiscal 2035 compared with fiscal 2013 levels. The Environment Ministry and the Economy, Trade and Industry Ministry proposed the new target, up 14 percentage points from the current goal, at a joint meeting, saying that a more aggressive cut is necessary to achieve net zero emissions by 2050. Read full story here	https://english.kyodonews.net/news/2024/11/b20ae37bebe0-japan-eyes-cutting-emissions-by-60-by-fy-2035-from-fy-2013-levels.html	2024-11-25T16:18:00-08:00	
Kyodo News Digest: Nov. 26, 2024	The following is the latest list of selected news summaries by Kyodo News. ---------- Read full story here	https://english.kyodonews.net/news/2024/11/f1402b0fdc85-kyodo-news-digest-nov-26-2024--1-.html	2024-11-25T16:11:00-08:00	
Trading house Itochu looks to finance Seven & i management buyout	Trading house Itochu Corp. is considering helping finance the potential buyout of Seven & i Holdings Co. by its management, responding to a request from the founding family of the Japanese retail giant, sources close to the matter said Monday. Itochu, the parent of convenience store chain operator FamilyMart Co., is apparently in the initial phase of the study, the sources said. The move could complicate the around 7 trillion yen ($45 billion) buyout offer by Canada's Alimentation Couche-Tard Inc. toward Seven & i. Read full story here	https://english.kyodonews.net/news/2024/11/def78a93df89-trading-house-itochu-looks-to-finance-seven--i-management-buyout.html	2024-11-25T06:00:00-08:00	
G7 foreign ministers begin talks in Italy with Middle East in foc...	The Group of Seven foreign ministers began their two-day talks in Italy on Monday, with the first day's sessions focusing on the Middle East amid tensions between Israel and Iran. On the second day of the meeting, discussions are likely to center on Russia's invasion of Ukraine, now involving North Korean troops, and the situation in the Indo-Pacific region, where China has shown increasingly provocative behavior, Japanese officials said. Read full story here	https://english.kyodonews.net/news/2024/11/2a8ec10e58f2-g7-foreign-ministers-begin-talks-in-italy-with-middle-east-in-focus.html	2024-11-25T05:00:00-08:00	
Toyota to close JV sales base in Beijing amid stiff competition	Toyota Motor Corp. is considering closing the sales base of its Chinese joint venture in Beijing and consolidating it with another base in Tianjin as part of restructuring efforts amid intensifying competition with local brands, sources familiar with the matter said Monday. The restructuring at Tianjin FAW Toyota Motor Co. will not involve a reduction in production, and the automaker will continue launching new products in China to pursue growth, as the country remains one of its strategically important markets, the sources said. Read full story here	https://english.kyodonews.net/news/2024/11/fd4da0bbc1d2-toyota-to-close-jv-sales-base-in-beijing-amid-stiff-competition.html	2024-11-25T03:58:00-08:00	
93-year-old driver in fatal Tokyo crash dies in prison	A 93-year-old former top bureaucrat who was serving a sentence for a high-profile 2019 Tokyo car accident that left two people dead has died in prison, apparently of natural causes, a source close to the matter said Monday. Kozo Iizuka, a former chief of the now-defunct Agency of Industrial Science and Technology, died last month around three years into his five-year term. Read full story here	https://english.kyodonews.net/news/2024/11/f3a18533b8ca-93-year-old-driver-in-fatal-tokyo-crash-dies-in-prison.html	2024-11-24T22:45:00-08:00	
Sumo: Kotozakura eyes yokozuna promotion following breakthrough t...	Kyushu Grand Sumo Tournament winner Kotozakura said Monday he plans to seize the opportunity for yokozuna promotion in the wake of his maiden Emperor's Cup. The 27-year-old from Chiba Prefecture was crowned champion of the 15-day tournament at Fukuoka Kokusai Center with a 14-1 record after defeating fellow ozeki Hoshoryu in Sunday's winner-take-all closing bout. Read full story here	https://english.kyodonews.net/news/2024/11/781126b23541-sumo-kotozakura-eyes-yokozuna-promotion-following-breakthrough-title.html	2024-11-24T21:48:00-08:00	
Japan, Germany shortlisted to build new Australian frigates	Australia said Monday it has shortlisted Japan and Germany to build its new fleet of general purpose frigates in a program worth up to A$10 billion ($6.5 billion) over the next decade. Japan has proposed vessels based on the Maritime Self-Defense Force's cutting-edge Mogami-class frigate, Canberra said, with a final decision set to be made next year. Read full story here	https://english.kyodonews.net/news/2024/11/bedf4b05d8b3-japan-germany-shortlisted-to-build-new-australian-frigates.html	2024-11-24T21:15:00-08:00	
Doctor's 18-yr term for consensual killing of ALS sufferer upheld	The Osaka High Court on Monday upheld a lower court ruling that sentenced a doctor to 18 years in prison for the consensual killing of a woman with amyotrophic lateral sclerosis, a rare neurological disease also known as Lou Gehrig's disease, in 2019 in western Japan. The defense for 46-year-old Yoshikazu Okubo had argued that finding him guilty of murder would violate the Constitution's right to self-determination. But the high court rejected the appeal, stating that the Constitution presumes the right to life but does not recognize a 'right to seek assistance from others to end one's life.' Read full story here	https://english.kyodonews.net/news/2024/11/f04cf452894a-doctors-18-yr-term-for-consensual-killing-of-als-sufferer-upheld.html	2024-11-24T20:39:00-08:00	
Rugby: Japan finish European tour with 59-14 loss to England	Tries to Naoto Saito and Kazuki Himeno were among the rare bright moments for Japan in a heavy 59-14 defeat to England at Twickenham on Sunday. The hosts ran in nine tries as they snapped a run of five losses and spoiled former England head coach Eddie Jones' return to the 'Home of Rugby.' Read full story here	https://english.kyodonews.net/news/2024/11/b1ebdd5af9d3-rugby-japan-finish-european-tour-with-59-14-loss-to-england.html	2024-11-24T19:59:00-08:00	
Kyodo News Digest: Nov. 25, 2024	The following is the latest list of selected news summaries by Kyodo News. ---------- Read full story here	https://english.kyodonews.net/news/2024/11/4839075f4cd1-kyodo-news-digest-nov-25-2024--1-.html	2024-11-24T16:10:00-08:00	
U.S. to deploy missile units to Japan islands in Taiwan contingen...	The U.S. military will set up temporary bases along Japan's southwestern Nansei island chain and the Philippines to deploy missile units in the event of a Taiwan contingency, sources familiar with Japan-U.S. relations said Sunday. The deployment of the missile units will be incorporated in the first joint operation plan for the United States and Japan to cope with a contingency involving Taiwan and China, which regards the self-ruled island as its own, to be formulated in December. Read full story here	https://english.kyodonews.net/news/2024/11/981708e1601f-us-to-deploy-missile-units-to-japan-islands-in-taiwan-contingency.html	2024-11-24T15:12:00-08:00	
Japan holds Sado mine laborers' commemoration, South Korea abstai...	An event to commemorate Japanese and Korean laborers who worked at the gold and silver mine complex on Japan's Sado Island during World War II was held Sunday, following an agreement between Japan and South Korea to hold the event before the site's addition to UNESCO's World Heritage list earlier this year. However, South Korean officials and families of the Korean laborers scheduled to participate in the event did not attend, as the country's Foreign Ministry stated Saturday that it was difficult for the two nations to reach a consensus on the event. Read full story here	https://english.kyodonews.net/news/2024/11/12169d6b054f-japan-holds-sado-mine-laborers-commemoration-s-korea-abstains.html	2024-11-24T04:41:00-08:00	
Basketball: Hachimura reiterates issues regarding Japan national ...	Japan star Rui Hachimura said Saturday he is ready to step away from the national team if the Japan Basketball Association fails to change its management approach. The Los Angeles Lakers forward on Nov. 13 criticized the association for what he perceived as its profit-oriented direction and its choice of men's head coach. On Wednesday, the JBA said the player's comments resulted from 'miscommunication.' Read full story here	https://english.kyodonews.net/news/2024/11/99ee4da81907-basketball-hachimura-reiterates-issues-regarding-national-team.html	2024-11-24T04:23:00-08:00	
Sumo: Kotozakura beats fellow ozeki Hoshoryu to Kyushu championsh...	Kotozakura outwrestled fellow ozeki Hoshoryu in the winner-take-all closing bout Sunday at the Kyushu Grand Sumo Tournament to claim his maiden top-division championship with a 14-1 record. The 27-year-old Kotozakura stayed cool under pressure to win by slap down after Hoshoryu gained the upper hand in the tie-breaking battle between the two remaining contenders at Fukuoka Kokusai Center. Read full story here	https://english.kyodonews.net/news/2024/11/a0a85ee023e6-sumo-kotozakura-beats-fellow-ozeki-hoshoryu-to-kyushu-championship.html	2024-11-24T02:01:48-08:00	
