Title	Description	Link	pubDate	Image
Iran to hold nuclear talks with Britain, France, Germany: sources	Iran will hold talks with Britain, France, Germany, and the European Union on Friday to revive a stalled 2015 nuclear deal between the country and six major powers, including the three European nations and the United States, Iranian diplomatic sources told Kyodo News on Sunday. The talks, which are set to take place in Geneva, according to the sources, would coincide with President-elect Donald Trump's return to the White House in January. Trump withdrew from the accord during his first administration in 2018. Read full story here	https://english.kyodonews.net/news/2024/11/85f866a30772-update2-iran-to-hold-nuclear-talks-with-britain-france-germany-sources.html	2024-11-24T01:34:17-08:00	
BREAKING NEWS: Iran arranging nuclear talks with Britain, France,...	BREAKING NEWS: Iran arranging nuclear talks with Britain, France, Germany: sources+ ==KyodoRead full story here	https://english.kyodonews.net/news/2024/11/ac093d17520f-breaking-news-iran-arranging-nuclear-talks-with-britain-france-germany-sources.html	2024-11-24T00:02:54-08:00	
MUFG Bank fires worker for stealing over 1 billion yen from custo...	MUFG Bank has fired an employee for allegedly stealing assets worth between 1 billion ($6 million) and 2 billion yen from safe deposit boxes of some 60 customers in Tokyo, the Japanese megabank said. The worker was dismissed on Nov. 14 after admitting to stealing the assets at two branches from April 2020 to October this year. The bank is investigating the theft and consulting with police, it said Friday. Read full story here	https://english.kyodonews.net/news/2024/11/958e046f1c20-mufg-bank-fires-worker-for-stealing-over-1-bil-yen-from-customers.html	2024-11-23T21:31:57-08:00	
Dam fine vintage: Japan sake brewers take novel approach to stora...	Just as with wine, aging a sake can produce a smoother drink, but there is a cost in maintaining the right conditions for storage. A group of brewers in central Japan, however, has found a virtually free alternative -- storing the drink inside tunnels in dams. Thirteen brewers are storing products in the Maruyama, Agigawa and Origawa dams in Gifu Prefecture and the Yahagi Dam that straddles it and neighboring Aichi Prefecture at no cost from the operators. Read full story here	https://english.kyodonews.net/news/2024/11/b23fa26aa321-dam-fine-vintage-japan-sake-brewers-take-novel-approach-to-storage.html	2024-11-23T18:52:37-08:00	
Atomic bomb survivors meet fundraising target for Nobel prize awa...	Dozens of members of Nihon Hidankyo, Japan's leading group of atomic bomb survivors that won this year's Nobel Peace Prize, are set to travel to Oslo next month to attend the award ceremony after achieving its crowdfunding target of 10 million yen ($65,000) to help cover travel expenses. The group, also known as the Japan Confederation of A- and H-Bomb Sufferers Organizations, met its goal in just one day after launching the appeal Nov. 15 but will continue its online campaign through Dec. 15, saying it intends to allocate surplus funds toward its efforts to abolish nuclear weapons. Read full story here	https://english.kyodonews.net/news/2024/11/b8190f4e43d6-a-bomb-survivors-meet-fundraising-target-for-nobel-prize-awarding.html	2024-11-23T17:39:36-08:00	
Kyodo News Digest: Nov. 24, 2024	The following is the latest list of selected news summaries by Kyodo News. ---------- Read full story here	https://english.kyodonews.net/news/2024/11/b159fbdb3968-kyodo-news-digest-nov-24-2024.html	2024-11-23T16:05:00-08:00	
Japan to draw up new strategy to beef up defense industry, export...	Japan has started devising a strategy to strengthen its defense industry and promote exports of equipment, hoping to lay out medium to long-term goals for a sector that has struggled with small market scale and other challenges, government sources said Friday. The so-called national defense industry strategy may be compiled next year. The planning will involve not only the Defense Ministry but also others such as the Economy, Trade and Industry Ministry, making the process different from the strategy the Defense Ministry came up with in 2014 on defense production and technological bases. Read full story here	https://english.kyodonews.net/news/2024/11/62ffc0958d18-japan-to-draw-up-new-strategy-to-beef-up-defense-industry-exports.html	2024-11-23T05:42:00-08:00	
Figure skating: Japan's Sato, Chiba earn spots in Grand Prix Fina...	Japan's Shun Sato won the men's competition at the ISU Grand Prix of Figure Skating's Cup of China on Saturday, and compatriot Mone Chiba was second among the women as both qualified for the Grand Prix for the first time. Sato's victory was the first of his career on the circuit, while Chiba's finish earned Japan's women a record five berths in the field at December's final in Grenoble, France. Read full story here	https://english.kyodonews.net/news/2024/11/3792efa717b0-figure-skating-japans-sato-chiba-earn-spots-in-grand-prix-final.html	2024-11-23T05:35:00-08:00	
China says it will remove buoy set up in Japan's EEZ near Senkaku...	China has told Japan it intends to remove a buoy it installed inside Japan's exclusive economic zone near the Senkaku Islands in the East China Sea, diplomatic sources said Saturday. While it is hoped the move will help stabilize strained relations between the two countries, China has not removed the buoy from the area. Japan is urging China to move the object immediately, the sources said. Read full story here	https://english.kyodonews.net/news/2024/11/666c6d9a57fe-china-says-it-will-remove-buoy-set-up-in-japans-eez-near-senkakus.html	2024-11-23T05:03:00-08:00	
South Korea to skip Japan's Sado mine event to remember laborers	South Korea said Saturday it will not send any officials to a memorial event to be held on Japan's Sado Island to commemorate laborers, including Koreans, who worked during World War II at the island's gold and silver mine complex. The announcement by Seoul came after Tokyo said Parliamentary Vice Foreign Minister Akiko Ikuina would attend Sunday's event at the mine, which was designated as a World Heritage site earlier this year. Read full story here	https://english.kyodonews.net/news/2024/11/2bbad858ec6a-s-korea-to-skip-japans-sado-mine-event-to-remember-laborers.html	2024-11-23T04:05:00-08:00	
Japan foreign minister planning China visit in late December	Japanese Foreign Minister Takeshi Iwaya is planning to visit China in late December for talks with his Chinese counterpart Wang Yi, as the two countries seek to resume high-level bilateral exchanges, government sources said Saturday. The two sides are also considering holding a ministerial-level human and cultural exchange dialogue during the visit by Iwaya, who assumed his post in October, they said. The dialogue has not been held since it was first held in November 2019 in Tokyo. Read full story here	https://english.kyodonews.net/news/2024/11/91a9a6579c36-japan-foreign-minister-planning-china-visit-in-late-dec.html	2024-11-23T03:18:00-08:00	
Sumo: Ozeki Kotozakura, Hoshoryu set up final-day title showdown	Ozeki Kotozakura and Hoshoryu are set for a final-day, head-to-head title showdown after both improved to 13-1 with solid wins Saturday at the Kyushu Grand Sumo Tournament. Kotozakura, who turned 27 this week, will be bidding for his first Emperor's Cup on Sunday, while the 25-year-old Mongolian-born Hoshoryu, the nephew of former yokozuna Asashoryu, will seek his second title after his first at last year's July meet in Nagoya. Read full story here	https://english.kyodonews.net/news/2024/11/2dbbd1091b09-sumo-ozeki-kotozakura-hoshoryu-set-up-final-day-title-showdown.html	2024-11-23T02:17:00-08:00	
Etsuro Sotoo becomes 1st Japanese, sculptor to win famed Vatican ...	Sculptor Etsuro Sotoo on Friday became the first Japanese to be awarded the Ratzinger Prize by a Vatican City foundation for his work on the Sagrada Familia church in Barcelona, Spain. Sotoo, 71, is also the first sculptor to win the prize usually awarded to scholars that have stood out for their scientific research in theology. He has been involved for over 40 years in work on the Sagrada Familia, which is still under construction. Read full story here	https://english.kyodonews.net/news/2024/11/bdf823b207ca-sotoo-becomes-1st-japanese-sculptor-to-win-famed-vatican-prize.html	2024-11-23T00:55:00-08:00	
FOCUS: Defining dangerous driving faces tough going in Japan	With a series of incidents on the rise of people being killed or injured due to reckless driving in Japan, the government is moving to clarify criminal penalties in so-called dangerous driving cases. Behind the push for legal reform is an urgency, mainly by bereaved family members who demand clearly defined punishments for crimes involving high-speed and intoxicated driving under the current law punishing dangerous driving that results in death or injuries. Read full story here	https://english.kyodonews.net/news/2024/11/a72f852dca02-focus-defining-dangerous-driving-faces-tough-going-in-japan.html	2024-11-22T21:54:00-08:00	
FEATURE: Victims of little-known WWII maritime tragedy gone but n...	While the sinking of the Tsushima Maru by a U.S. submarine during World War II is etched in Japan's collective memory due to the many children and civilian adults who died, a similar tragedy befell another, lesser-known evacuation boat not long after. In August 1944, the Tsushima Maru was torpedoed close to the Tokara Islands in southwestern Japan en route to Nagasaki from Okinawa while complying with a government evacuation order. A little over a month later, the Bushu Maru was sunk off the same island chain as the Japanese Empire was readying for an invasion of the nearby Ryukyu Islands by the United States. Read full story here	https://english.kyodonews.net/news/2024/11/4d001bf07f70-feature-victims-of-little-known-wwii-maritime-tragedy-gone-but-not-forgotten.html	2024-11-22T18:24:00-08:00	
Japan libraries to trial book sales amid decline in bookstores	Some public libraries in Japan will trial sales of new books from fiscal 2025 to fill the void caused by a nationwide decline in the number of physical bookstores, industry officials said. The program is aimed at increasing opportunities for people to buy books, particularly the elderly who may be unfamiliar with the process of using online shopping sites. Read full story here	https://english.kyodonews.net/news/2024/11/b2b0de69ee4c-japan-libraries-to-trial-book-sales-amid-decline-in-bookstores.html	2024-11-22T18:08:00-08:00	
Shinkansen services delayed due to maintenance problem	Some shinkansen bullet train services were delayed Saturday morning due to a malfunctioning maintenance vehicle, affecting around 4,900 passengers, railway operator JR East said. Services were temporarily suspended between Omiya and Takasaki stations near Tokyo, resuming shortly after 7 a.m., according to the company. Read full story here	https://english.kyodonews.net/news/2024/11/bd7ff4eca98a-shinkansen-services-delayed-due-to-maintenance-problem.html	2024-11-22T17:22:00-08:00	
Japanese becomes 1st non-Spanish to win prestigious flamenco cont...	A Japanese woman recently made waves in Spain after becoming the first foreigner to win the dance division of a prestigious flamenco competition in the European country. 'I have overcome a barrier as a foreigner,' 48-year-old dancer Junko Hagiwara told Kyodo News in early November, although her success at the annual Festival Internacional del Cante de las Minas in August drew discriminatory comments online. Read full story here	https://english.kyodonews.net/news/2024/11/1b5d0a1737cb-japanese-becomes-1st-non-spanish-to-win-prestigious-flamenco-contest.html	2024-11-22T17:10:00-08:00	
Kyodo News Digest: Nov. 23, 2024	The following is the latest list of selected news summaries by Kyodo News. ---------- Read full story here	https://english.kyodonews.net/news/2024/11/2a4a21bb78fd-kyodo-news-digest-nov-23-2024--1-.html	2024-11-22T16:07:00-08:00	
BREAKING NEWS: Trump says hedge fund CEO Scott Bessent to be Trea...	BREAKING NEWS: Trump says hedge fund CEO Scott Bessent to be Treasury secretary ==KyodoRead full story here	https://english.kyodonews.net/news/2024/11/0ecc1241ee67-breaking-news-trump-says-hedge-fund-ceo-scott-bessent-to-be-treasury-secretary.html	2024-11-22T16:02:25-08:00	
U.S. says North Korea ready for nuclear test, awaits political go...	North Korea is only a 'political decision' away from carrying out its seventh nuclear test, a senior U.S. official said Friday, at a time when the world is closely watching for any shifts in Pyongyang's policy direction in connection with Donald Trump's upcoming return to the White House. 'The United States assesses that (North Korea) has prepared its Punggye-ri test site for its potential seventh explosive nuclear test,' said Alexandra Bell, deputy assistant secretary of state for nuclear affairs. Read full story here	https://english.kyodonews.net/news/2024/11/a25c08014ea0-us-says-n-korea-ready-for-nuclear-test-awaits-political-go-ahead.html	2024-11-22T15:18:00-08:00	
Figure skating: Chiba, Sato lead Cup of China after SP	Japan's Mone Chiba topped the women's short program and Shun Sato the men's Friday at the ISU Grand Prix of Figure Skating's Cup of China, the sixth and last event on the circuit this season. Chiba scored 70.86 points to take a slender 0.02 lead over second-placed Amber Glenn of the United States in Chongqing, where the top five skaters were separated by just 1.78 points. Read full story here	https://english.kyodonews.net/news/2024/11/c1bd8b9918be-figure-skating-chiba-sato-lead-cup-of-china-after-sp.html	2024-11-22T05:41:00-08:00	
Sumo: Hoshoryu, Kotozakura win big to continue 2-way title race	Ozeki Hoshoryu and Kotozakura will head into the final weekend of the Kyushu Grand Sumo Tournament tied for the lead at 12-1 after both earned momentous victories on Friday. Hoshoryu won his blockbuster battle with new ozeki Onosato before Kotozakura overpowered former joint leader Takanosho in the final bout of Day 13 at Fukuoka Kokusai Center. Read full story here	https://english.kyodonews.net/news/2024/11/b19531df0bb3-update1-sumo-hoshoryu-kotozakura-win-big-to-continue-2-way-title-race.html	2024-11-22T03:22:00-08:00	
Japan gov't OKs 39 tril. yen economic package to ease inflation p...	The Japanese government on Friday approved an economic package worth 39 trillion yen ($250 billion), featuring subsidies to curb rising energy costs and cash handouts to low-income households, as inflation triggered by a weaker yen continues to weigh on consumer spending. In the package, Prime Minister Shigeru Ishiba's administration pledged to boost disposable incomes by raising the tax-free salary threshold, after it conceded to demands from an opposition party to secure the passage of a supplementary budget to finance it. Read full story here	https://english.kyodonews.net/news/2024/11/c0096bc410e8-update1-japan-govt-oks-39-tril-yen-economic-package-to-ease-inflation-pain.html	2024-11-22T02:54:00-08:00	
BREAKING NEWS: Gov't to take steps to revitalize regional economi...	BREAKING NEWS: Gov't to take steps to revitalize regional economies: Japan PM Ishiba ==KyodoRead full story here	https://english.kyodonews.net/news/2024/11/0c2b8bc5545f-breaking-news-govt-to-take-steps-to-revitalize-regional-economies-japan-pm-ishiba.html	2024-11-22T01:26:05-08:00	
BREAKING NEWS: Wage growth necessary to boost Japan's economy: PM...	BREAKING NEWS: Wage growth necessary to boost Japan's economy: PM Ishiba ==KyodoRead full story here	https://english.kyodonews.net/news/2024/11/41f9135c1add-breaking-news-wage-growth-necessary-to-boost-japans-economy-pm-ishiba.html	2024-11-22T01:23:37-08:00	
1,000 Nissan employees in Thailand to be let go or relocated	Around 1,000 employees of Nissan Motor Co. in Thailand are expected to be let go or relocated by fall 2025, with the Japanese automaker grappling with a downturn in profits, an industrial source said Friday. The move is in line with a pledge that Japan's third-largest car company has made to cut its global workforce by about 7 percent, or 9,000 employees, by fiscal 2026 ending in March 2027, the source said. Read full story here	https://english.kyodonews.net/news/2024/11/15d39cdb9e85-1000-nissan-employees-in-thailand-to-be-let-go-or-relocated.html	2024-11-22T01:01:00-08:00	
BREAKING NEWS: Japan gov't OKs 39 tril. yen economic package to e...	BREAKING NEWS: Japan gov't OKs 39 tril. yen economic package to ease inflation pain ==KyodoRead full story here	https://english.kyodonews.net/news/2024/11/32f8bc656c35-breaking-news-japan-govt-oks-39-tril-yen-economic-package-to-ease-inflation-pain.html	2024-11-22T00:16:13-08:00	
Japan's weekly COVID-19 cases rise for 1st time in 3 months	The weekly average of new coronavirus cases at designated hospitals across Japan rose for the first time in three months in the seven days through last Sunday, health ministry data showed Friday. The average among some 5,000 medical institutions stood at 1.90 in the week, with newly infected patients totaling 9,406, up 29 percent from the previous week, according to the Ministry of Health, Labor and Welfare. Read full story here	https://english.kyodonews.net/news/2024/11/5959d54d14af-japans-weekly-covid-19-cases-rise-for-1st-time-in-3-months.html	2024-11-21T23:54:00-08:00	
BREAKING NEWS: China to allow 30-day visa exemption for Japan tra...	BREAKING NEWS: China to allow 30-day visa exemption for Japan travelers from Nov. 30 ==KyodoRead full story here	https://english.kyodonews.net/news/2024/11/33ee2ef6ee76-breaking-news-china-to-allow-30-day-visa-exemption-for-japan-travelers-from-nov-30.html	2024-11-21T23:28:49-08:00	
BREAKING NEWS: Japan chipmaker Kioxia to list in Tokyo on Dec. 18	BREAKING NEWS: Japan chipmaker Kioxia to list in Tokyo on Dec. 18 ==KyodoRead full story here	https://english.kyodonews.net/news/2024/11/0686206d4823-breaking-news-japan-chipmaker-kioxia-to-list-in-tokyo-on-dec-18.html	2024-11-21T23:11:57-08:00	
China to resume unilateral visa exemption for Japan travelers	China is arranging to restart its unilateral visa-free arrangement for short-term Japanese visitors, possibly later this month, several travel industry sources in Beijing said Friday. China has yet to revive the pre-COVID practice of visa exemption for Japanese nationals, although it has given such preferential treatment to about 30 other countries, including South Korea. Read full story here	https://english.kyodonews.net/news/2024/11/5febc4d2e71c-update1-china-to-resume-unilateral-visa-exemption-for-japan-travelers.html	2024-11-21T20:49:00-08:00	
BREAKING NEWS: China to restart unilateral visa exemption for Jap...	BREAKING NEWS: China to restart unilateral visa exemption for Japanese travelers ==KyodoRead full story here	https://english.kyodonews.net/news/2024/11/598582655c23-breaking-news-china-to-restart-unilateral-visa-exemption-for-japanese-travelers.html	2024-11-21T17:35:09-08:00	
Kyodo News Digest: Nov. 22, 2024	The following is the latest list of selected news summaries by Kyodo News. ---------- Read full story here	https://english.kyodonews.net/news/2024/11/50976e91b1d5-kyodo-news-digest-nov-22-2024.html	2024-11-21T16:04:00-08:00	
BREAKING NEWS: Dodger Ohtani wins record-extending 3rd unanimous ...	BREAKING NEWS: Dodger Ohtani wins record-extending 3rd unanimous MVP award ==KyodoRead full story here	https://english.kyodonews.net/news/2024/11/95b22ff695f6-breaking-news-dodger-ohtani-wins-record-extending-3rd-unanimous-mvp-award.html	2024-11-21T15:53:04-08:00	
BREAKING NEWS: Japan's core consumer prices in Oct. rise 2.3% on ...	BREAKING NEWS: Japan's core consumer prices in Oct. rise 2.3% on year ==KyodoRead full story here	https://english.kyodonews.net/news/2024/11/4d95d95826f8-breaking-news-japans-core-consumer-prices-in-oct-rise-23-on-year.html	2024-11-21T15:31:11-08:00	
Japan research team develops plastic that breaks down in seawater	A Japanese research team has developed a type of plastic that can break down in seawater in a bid to decrease environmental pollution and the accumulation of plastics in oceans, it said in Friday's edition of the U.S. academic journal Science. The material called 'supramolecular' plastic has similar tensile strength and can also be processed like petroleum-based plastics, according to the joint research team with members from the national science research institute Riken and the University of Tokyo. Read full story here	https://english.kyodonews.net/news/2024/11/c7fd63e044f0-japan-research-team-develops-plastic-that-breaks-down-in-seawater.html	2024-11-21T15:20:00-08:00	
FOCUS: Japan PM's diplomatic knack in doubt amid blunders, no Tru...	Japanese Prime Minister Shigeru Ishiba may be learning the hard way that diplomacy is more difficult than it sounds following his trip to South America to attend multilateral summits, but his inexperience is raising doubts over whether he is up to the job he has been in for over a month. The absence of Ishiba in a group photo at a summit gathering due to a traffic jam, his perceived bad manners in greeting foreign leaders and a missed opportunity to secure an in-person meeting with Donald Trump, who is set to lead the United States, Japan's closest ally, all added to his gloom. Read full story here	https://english.kyodonews.net/news/2024/11/574c8814f891-focus-japan-pms-diplomatic-knack-in-doubt-amid-blunders-no-trump-meet.html	2024-11-21T05:47:00-08:00	
2025 Osaka Expo centerpiece 'Grand Ring' lit up for first time	A giant circular timber roof known as the 'Grand Ring' that is to be the centerpiece of the 2025 World Exposition in Osaka was illuminated for the first time Thursday in a test run. The massive structure, with a circumference of approximately 2 kilometers and a maximum height of around 20 meters, appeared to float in the evening darkness on Yumeshima, an artificial island in Osaka Bay. Read full story here	https://english.kyodonews.net/news/2024/11/9082e4679349-2025-osaka-expo-centerpiece-grand-ring-lit-up-for-first-time.html	2024-11-21T04:47:00-08:00	
BREAKING NEWS: Japan, China defense ministers agree to promote di...	BREAKING NEWS: Japan, China defense ministers agree to promote dialogue ==KyodoRead full story here	https://english.kyodonews.net/news/2024/11/3346a7832608-breaking-news-japan-china-defense-ministers-agree-to-promote-dialogue.html	2024-11-21T03:38:00-08:00	
BREAKING NEWS: Japan defense chief warns China not to repeat airs...	BREAKING NEWS: Japan defense chief warns China not to repeat airspace breach ==KyodoRead full story here	https://english.kyodonews.net/news/2024/11/0b939890055f-breaking-news-japan-defense-chief-warns-china-not-to-repeat-airspace-breach.html	2024-11-21T03:37:45-08:00	
Sumo: Hoshoryu, Kotozakura tie for lead as Takanosho takes 2nd lo...	Front-running ozeki Hoshoryu and Kotozakura moved into a two-way tie at 11-1 on Thursday at the Kyushu Grand Sumo Tournament after fellow overnight leader Takanosho stumbled in his pursuit of a maiden title. Hoshoryu overwhelmed komusubi Shodai, Kotozakura pushed out sekiwake Daieisho, while sixth-ranked maegashira Takanosho (10-2) was driven over the edge by sekiwake Kirishima on Day 12 at Fukuoka Kokusai Center. Read full story here	https://english.kyodonews.net/news/2024/11/44d48f2fdb24-sumo-hoshoryu-kotozakura-tie-for-lead-as-takanosho-takes-2nd-loss.html	2024-11-21T02:45:00-08:00	
Japan, China defense chiefs meet amid airspace, maritime tensions	The defense ministers of Japan and China began talks in Laos on Thursday, the Japanese government said, as the Asian neighbors explore ways to stabilize relations amid airspace and maritime tensions. Japanese Defense Minister Gen Nakatani and his Chinese counterpart Dong Jun held their first meeting on the margins of a defense ministerial gathering of the Association of Southeast Asian Nations and their regional partners in Vientiane. Read full story here	https://english.kyodonews.net/news/2024/11/52a1a54f2e0b-japan-china-defense-chiefs-meet-amid-airspace-maritime-tensions.html	2024-11-21T02:23:00-08:00	
6% of Nissan employees in U.S. to retire early in restructuring	Nissan Motor Co. said Thursday it expects some 6 percent, or around 1,000, of its employees in the United States to retire early by the end of the year as the Japanese automaker proceeds with global restructuring efforts. The struggling automaker had about 17,000 employees in the world's second-biggest auto market as of the end of March, according to a company filing. Read full story here	https://english.kyodonews.net/news/2024/11/9bedd602415c-urgent-6-of-nissan-employees-in-us-to-retire-early-in-restructuring.html	2024-11-21T02:10:00-08:00	
BREAKING NEWS: 6% of Nissan employees in U.S. to retire early	BREAKING NEWS: 6% of Nissan employees in U.S. to retire early ==KyodoRead full story here	https://english.kyodonews.net/news/2024/11/68886b717994-breaking-news-6-of-nissan-employees-in-us-to-retire-early.html	2024-11-21T01:10:03-08:00	
Basketball: Yuki Kawamura records 1st double-double in G-League	Japanese Olympic men's basketball star Yuki Kawamura scored 15 points and dished 16 assists for his first double-double in the developmental G-League as he marshaled the Memphis Hustle to a 123-118 win over the visiting Osceola Magic on Wednesday. The point guard shot 3-from-8 from three-point range while providing several sharp passes into and around the paint during 31 minutes on the court. He delivered several assists to the game's high scorer, big man Colin Castleton, who had 26 points. Read full story here	https://english.kyodonews.net/news/2024/11/3ad38fafa803-basketball-kawamura-records-1st-double-double-in-g-league.html	2024-11-20T23:45:00-08:00	
