Title	Description	Link	pubDate	Image
Unesco certifica que restauración de Notre Dame cumplió con regla...	La Unesco apuntó que la restauración de Notre Dame, en París, muestra la importancia y el 'apego' de la humanidad a su patrimonio La entrada Unesco certifica que restauración de Notre Dame cumplió con reglas de patrimonio aparece primero en López-Dóriga Digital.	https://lopezdoriga.com/internacional/unesco-certifica-restauracion-notre-dame-cumplio-reglas-patrimonio/	2024-12-07T16:30:52-08:00	
Estos fueron los 5 años de trabajos para reconstruir la catedral ...	Esta es la cronología de la reconstrucción de la catedral de Notre Dame, en París, que fue reabierta de forma oficial este 7 de diciembre La entrada Estos fueron los 5 años de trabajos para reconstruir la catedral de Notre Dame aparece primero en López-Dóriga Digital.	https://lopezdoriga.com/internacional/cinco-anos-trabajos-reconstruir-catedral-notre-dame-paris-francia/	2024-12-07T16:18:29-08:00	
Sheinbaum anuncia cifra histórica de 800 mil mdp para programas d...	La inversión histórica en programas del Bienestar fue anunciada por la presidenta Sheinbaum en Santiago Astata, Oaxaca La entrada Sheinbaum anuncia cifra histórica de 800 mil mdp para programas del Bienestar en 2025 aparece primero en López-Dóriga Digital.	https://lopezdoriga.com/nacional/sheinbaum-anuncia-cifra-historica-800-mil-mdp-programas-bienestar-2025/	2024-12-07T16:10:33-08:00	
Matan a un adulto mayor en restaurante de la Miguel Hidalgo, en C...	Un hombre de 72 años fue asesinado a balazos tras una discusión al interior de un restaurante ubicado en la alcaldía Miguel Hidalgo, CDMX La entrada Matan a un adulto mayor en restaurante de la Miguel Hidalgo, en CDMX aparece primero en López-Dóriga Digital.	https://lopezdoriga.com/nacional/matan-adulto-mayor-restaurante-miguel-hidalgo-cdmx/	2024-12-07T15:50:51-08:00	
Zelenski considera 'buena y productiva' su entrevista con Trump y...	El presidente ucraniano, Volodímir Zelenski, se reunió hoy con el presidente electo de EE.UU., Donald Trump, y el jefe del Estado francés, Emmanuel Macron La entrada Zelenski considera 'buena y productiva' su entrevista con Trump y Macron en París aparece primero en López-Dóriga Digital.	https://lopezdoriga.com/internacional/el-mundo/zelenski-considera-buena-productiva-entrevista-trump-macron-paris/	2024-12-07T14:11:47-08:00	
Realizan en Nueva York un concurso de gente parecida al sospechos...	Hasta el momento, solo hay una foto en la que se puede ver con claridad la cara del presunto asesino del CEO de UnitedHealthcare La entrada Realizan en Nueva York un concurso de gente parecida al sospechoso de matar al CEO de UnitedHealthcare aparece primero en López-Dóriga Digital.	https://lopezdoriga.com/internacional/nueva-york-concurso-gente-parecida-sospechoso-matar-ceo-unitedhealthcare/	2024-12-07T14:02:41-08:00	
Detienen a hombre con dron y explosivos en Apatzingán, Michoacán	Fuerzas federales y de Michoacán detuvieron a un sujeto en Apatzingán, quien llevaba un dron y varios explosivos La entrada Detienen a hombre con dron y explosivos en Apatzingán, Michoacán aparece primero en López-Dóriga Digital.	https://lopezdoriga.com/nacional/detienen-hombre-dron-explosivos-apatzingan-michoacan/	2024-12-07T13:44:02-08:00	
París y el mundo celebran la reapertura de la catedral de Notre D...	Este sábado se realizó el rito de apertura de la catedral de Notre Dame, en París, tras ser devastada por un incendio en 2019 La entrada París y el mundo celebran la reapertura de la catedral de Notre Dame aparece primero en López-Dóriga Digital.	https://lopezdoriga.com/internacional/puertas-notre-dame-abren-organo-resuena-paris-recupera-catedral/	2024-12-07T13:19:38-08:00	
García Harfuch comparte con Mesa de Seguridad de Sinaloa los resu...	El titular de SSPC, Omar García Harfuch, compartió en dicha Mesa de Seguridad los resultados de operativos en Sinaloa La entrada García Harfuch comparte con Mesa de Seguridad de Sinaloa los resultados de operativos aparece primero en López-Dóriga Digital.	https://lopezdoriga.com/nacional/garcia-harfuch-comparte-mesa-de-seguridad-sinaloa-resultados-operativos/	2024-12-07T12:58:06-08:00	
Periodistas en la FIL de México piden justicia por sus colegas as...	La Organización Reporteros sin fronteras afirma que cada día son heridos ocho periodistas, tres desaparecen y más de 130 han muerto La entrada Periodistas en la FIL de México piden justicia por sus colegas asesinados en Gaza aparece primero en López-Dóriga Digital.	https://lopezdoriga.com/sin-categoria/periodistas-en-la-fil-de-mexico-piden-justicia-por-sus-colegas-asesinados-en-gaza/	2024-12-05T17:35:14-08:00	
La batalla por la primera sentencia de violencia sexual con IA co...	La sentencia absolutoria del juez Francisco Salazar Silva del Reclusorio Oriente y, si se mantiene, recurrirían a un amparo La entrada La batalla por la primera sentencia de violencia sexual con IA continúa en México aparece primero en López-Dóriga Digital.	https://lopezdoriga.com/nacional/la-batalla-por-la-primera-sentencia-de-violencia-sexual-con-ia-continua-en-mexico/	2024-12-05T17:19:03-08:00	
California declara el estado de emergencia para ayudar en la resp...	El gobernador de California emitió el estado de emergencia para dar refuerzo a las zonas afectadas por el terremoto de magnitud 7.0 La entrada California declara el estado de emergencia para ayudar en la respuesta al terremoto aparece primero en López-Dóriga Digital.	https://lopezdoriga.com/internacional/california-declara-el-estado-de-emergencia-para-ayudar-en-la-respuesta-al-terremoto/	2024-12-05T16:13:09-08:00	
El Instituto Cervantes presenta en México el Anuario que analiza ...	Se espera que el anuario ayude a conocer el estado del español y reflexionar sobre las políticas para su conservación y uso La entrada El Instituto Cervantes presenta en México el Anuario que analiza la vitalidad del español aparece primero en López-Dóriga Digital.	https://lopezdoriga.com/internacional/el-instituto-cervantes-presenta-en-mexico-el-anuario-que-analiza-la-vitalidad-del-espanol/	2024-12-05T16:09:15-08:00	
Claudia Sheinbaum se reúne con el Consejo Mexicano de Negocios	Claudia Sheinbaum se reunió esta tarde con empresarios agrupados en el Consejo mexicano de Negocios (CMN) en el Museo Kaluz La entrada Claudia Sheinbaum se reúne con el Consejo Mexicano de Negocios aparece primero en López-Dóriga Digital.	https://lopezdoriga.com/nacional/claudia-sheinbaum-se-reune-con-el-consejo-mexicano-de-negocios/	2024-12-05T16:01:10-08:00	
México crea 24 mil 696 empleos formales en noviembre y acumula má...	El IMSS registró un total de 22 millones 43 mil 638 empleos formales, lo que representa un avance en el año de 3.2% La entrada México crea 24 mil 696 empleos formales en noviembre y acumula más de 619 mil en el año aparece primero en López-Dóriga Digital.	https://lopezdoriga.com/nacional/mexico-crea-24-mil-696-empleos-formales-en-noviembre-y-acumula-mas-de-619-mil-en-el-ano/	2024-12-05T15:03:16-08:00	
AIFA recibe reconocimiento por ser uno de los aeropuertos más bel...	AIFA recibe reconocimiento por ser uno de los aeropuertos más bellos del mundo; entrevista con el general de División, ingeniero constructor del Estado Mayor, Gustavo Ricardo Vallejo Suárez, comandante del Agrupamiento de ingenieros de la Defensa La entrada AIFA recibe reconocimiento por ser uno de los aeropuertos más bellos del mundo aparece primero en López-Dóriga Digital.	https://lopezdoriga.com/lopez-doriga-tv/aifa-recibe-reconocimiento-por-ser-uno-de-los-aeropuertos-mas-bellos-del-mundo/	2024-12-05T13:15:16-08:00	
AIFA ganó premio internacional por ser un 'proyecto muy peculiar'...	El general de División, Ricardo Vallejo, aseguró que el AIFA destacó por su integración arquitectónica y funcional con el entorno La entrada AIFA ganó premio internacional por ser un 'proyecto muy peculiar': general de División aparece primero en López-Dóriga Digital.	https://lopezdoriga.com/nacional/aifa-gano-premio-internacional-proyecto-muy-peculiar-general-de-division/	2024-12-05T13:01:21-08:00	
Cuba reconecta su sistema eléctrico, pero los largos apagones per...	Cuba sufrió en la previa su tercer apagón nacional en menos de dos meses, el cual tuvo una duración de 22 horas La entrada Cuba reconecta su sistema eléctrico, pero los largos apagones persisten aparece primero en López-Dóriga Digital.	https://lopezdoriga.com/internacional/cuba-reconecta-sistema-electrico-largos-apagones-persisten/	2024-12-05T12:45:49-08:00	
Asociación de Cruceros asegura que México perderá competitividad ...	La FCCA advierte que el impuesto adicional 'unilateral' hará del turismo de cruceros en México un 213 por ciento más caro La entrada Asociación de Cruceros asegura que México perderá competitividad por subida de impuestos aparece primero en López-Dóriga Digital.	https://lopezdoriga.com/economia-y-finanzas/asociacion-de-cruceros-asegura-que-mexico-perdera-competitividad-por-subida-de-impuestos/	2024-12-05T12:32:58-08:00	
Más de 150 globos aerostáticos vuelan diariamente sobre Capadocia	Las formaciones geológicas de Capadocia, Turquía, son el resultado de millones de años de actividad tectónica y erupciones volcánicas. Hace 60 millones de años el fondo del mar empezó a elevarse. Con el tiempo, las erupciones volcánicas cubrieron la meseta con ceniza y lava, que finalmente se solidificó en una roca blanda llamada toba. Con &#8230; Continued La entrada Más de 150 globos aerostáticos vuelan diariamente sobre Capadocia aparece primero en López-Dóriga Digital.	https://lopezdoriga.com/vida-y-estilo/viajes/mas-de-150-globos-aerostaticos-vuelan-diariamente-sobre-capadocia/	2024-12-05T12:28:22-08:00	
Llega al Museo de Historia Natural de NY el fósil de dinosaurio m...	El estegosaurio Apex, el fósil de dinosaurio más caro del mundo y completo en un 80 por ciento, será exhibido en un museo de NY durante cuatro años La entrada Llega al Museo de Historia Natural de NY el fósil de dinosaurio más caro aparece primero en López-Dóriga Digital.	https://lopezdoriga.com/internacional/llega-museo-de-historia-natural-ny-fosil-dinosaurio-estegosaurio/	2024-12-05T12:15:31-08:00	
Enrique de la Madrid anuncia su salida del PRI	Enrique de la Madrid apuntó que para seguir influyendo en la vida pública del país debe cambiar a un espacio distinto al PRI La entrada Enrique de la Madrid anuncia su salida del PRI aparece primero en López-Dóriga Digital.	https://lopezdoriga.com/nacional/enrique-de-la-madrid-anuncia-salida-pri/	2024-12-05T12:09:27-08:00	
Balas disparadas al ejecutivo de UnitedHealthcare tenían mensajes...	Autoridades hallaron escritas las palabras 'retrasar' y 'destituir' en dos de las balas disparadas contra Brian Thompson, ejecutivo de UnitedHealthcare La entrada Balas disparadas al ejecutivo de UnitedHealthcare tenían mensajes escritos, según autoridades aparece primero en López-Dóriga Digital.	https://lopezdoriga.com/internacional/balas-disparadas-ejecutivo-unitedhealthcare-tenian-mensajes-escritos-segun-autoridades/	2024-12-05T11:36:20-08:00	
Sismo de magnitud 7 sacude California y provoca alerta de tsunami	El Servicio Geológico de Estados Unidos (USGS) informó de un sismo que sacudió esta jueves el norte de California La entrada Sismo de magnitud 7 sacude California y provoca alerta de tsunami aparece primero en López-Dóriga Digital.	https://lopezdoriga.com/internacional/el-mundo/sismo-magnitud-7-sacude-california-y-provoca-alerta-de-tsunami/	2024-12-05T11:25:46-08:00	
Investigan 13 muertes de niños por brote de bacteria en hospitale...	La Secretaría de Salud investiga si la causa de muerte de 13 niños en el Edomex está asociada a un brote de Klebsiella oxytoca MDR La entrada Investigan 13 muertes de niños por brote de bacteria en hospitales del Edomex aparece primero en López-Dóriga Digital.	https://lopezdoriga.com/nacional/edomex-investigan-13-muertes-ninos-brote-de-bacteria-hospitales/	2024-12-05T11:13:05-08:00	
Más de 160 países piden en la ONU un tratado que prohíba los ‘rob...	Más de 160 países piden a la ONU negociar un tratado que prohíba el uso legal de los 'robots asesinos' por su impacto en la seguridad global La entrada Más de 160 países piden en la ONU un tratado que prohíba los 'robots asesinos' aparece primero en López-Dóriga Digital.	https://lopezdoriga.com/internacional/paises-piden-onu-tratado-prohiba-robots-asesinos/	2024-12-05T10:20:24-08:00	
República Democrática del Congo en alerta máxima por enfermedad d...	Los síntomas de la enfermedad incluyen fiebre, dolores de cabeza, secreción nasal, tos, dificultad para respirar y anemia La entrada República Democrática del Congo en alerta máxima por enfermedad desconocida que ha dejado al menos 71 muertos aparece primero en López-Dóriga Digital.	https://lopezdoriga.com/internacional/republica-democratica-congo-alerta-maxima-enfermedad-desconocida-71-muertos/	2024-12-05T09:42:40-08:00	
Logran en Mazatlán, Sinaloa, el récord Guinness de la Banda de Mú...	Un total de 255 de diversos estados del país se dieron cita en el puerto de Mazatlán para conseguir dicho récord Guinness La entrada Logran en Mazatlán, Sinaloa, el récord Guinness de la Banda de Música Folclórica más Grande aparece primero en López-Dóriga Digital.	https://lopezdoriga.com/nacional/logran-mazatlan-sinaloa-record-guinness-banda-musica-folclorica-mas-grande/	2024-12-05T09:19:12-08:00	
África registra más de 60 mil casos y mil 200 muertes de viruela ...	Autoridades sanitarias de África apuntaron que los contagios por la viruela del mono siguen creciendo en la recta final del 2024 La entrada África registra más de 60 mil casos y mil 200 muertes de viruela del mono aparece primero en López-Dóriga Digital.	https://lopezdoriga.com/internacional/africa-registra-mas-60-mil-casos-mil-200-muertes-viruela-del-mono-2024/	2024-12-05T09:02:03-08:00	
Detienen en Sinaloa a ‘el Gallero’, sujeto relacionado al decomis...	El Gallero' es identificado como 'cocinero' de una célula del Cártel de Sinaloa liderada por 'Tito' La entrada Detienen en Sinaloa a 'el Gallero', sujeto relacionado al decomiso histórico de fentanilo aparece primero en López-Dóriga Digital.	https://lopezdoriga.com/nacional/sinaloa-detienen-el-gallero-sujeto-relacionado-decomiso-historico-fentanilo/	2024-12-05T08:32:22-08:00	
Sheinbaum promete a padres de Ayotzinapa una 'nueva visión' del c...	La mandataria mexicana se refirió a la primera charla que tuvo en el cargo con los padres de los 43 estudiantes desaparecidos de Ayotzinapa La entrada Sheinbaum promete a padres de Ayotzinapa una 'nueva visión' del caso sin 'confrontación' aparece primero en López-Dóriga Digital.	https://lopezdoriga.com/nacional/sheinbaum-promete-padres-ayotzinapa-nueva-vision-caso-sin-confrontacion/	2024-12-05T08:25:28-08:00	
No regresarán ‘moches’ y etiquetados al Presupuesto 2025: Sheinba...	La presidenta Sheinbaum dejó en claro que la negociación de 'moches' y etiquetados en el presupuesto hicieron micho daño al país La entrada No regresarán 'moches' y etiquetados al Presupuesto 2025: Sheinbaum aparece primero en López-Dóriga Digital.	https://lopezdoriga.com/nacional/no-regresaran-moches-etiquetados-presupuesto-2025-sheinbaum/	2024-12-05T07:39:58-08:00	
Sheinbaum buscará acuerdo con Trump para que deporte a migrantes ...	Sheinbaum espera tener un acuerdo con el próximo Gobierno de Trump para enviar a migrantes deportados directo a sus países de origen La entrada Sheinbaum buscará acuerdo con Trump para que deporte a migrantes directo a sus países aparece primero en López-Dóriga Digital.	https://lopezdoriga.com/nacional/sheinbaum-buscara-acuerdo-trump-deporte-migrantes-directo-paises/	2024-12-05T07:24:27-08:00	
Mujer en Arizona confiesa que ha estado involucrada en el tráfico...	Tonya Romero se declaró culpable por el tráfico y transporte de indocumentados dentro del país, por lo que fue condenada a 33 meses de prisión La entrada Mujer en Arizona confiesa que ha estado involucrada en el tráfico de migrantes desde que era menor de edad aparece primero en López-Dóriga Digital.	https://lopezdoriga.com/internacional/mujer-en-arizona-confiesa-que-ha-estado-involucrada-en-el-trafico-de-migrantes-desde-que-era-menor-de-edad/	2024-12-02T17:18:04-08:00	
Establecen en CDMX criterios para baños públicos inclusivos	El pronunciamiento responde a las crecientes denuncias de discriminación y violencia hacia las personas trans y no binarias en el acceso a baños públicos, explicó el Copred en un comunicado La entrada Establecen en CDMX criterios para baños públicos inclusivos aparece primero en López-Dóriga Digital.	https://lopezdoriga.com/nacional/establecen-en-cdmx-criterios-para-banos-publicos-inclusivos/	2024-12-02T17:12:12-08:00	
Muere a los 76 años la señora Marisa Servitje Montull	Por medio de redes sociales, empresarios y organizaciones lamentaron el fallecimiento de Marisa Servitje Montull La entrada Muere a los 76 años la señora Marisa Servitje Montull aparece primero en López-Dóriga Digital.	https://lopezdoriga.com/nacional/muere-a-los-76-anos-la-senora-marisa-servitje-montull/	2024-12-02T17:02:18-08:00	
Concanaco Servytur alerta sobre impacto económico de nuevo impues...	Octavio de la Torre, presidente de la Concanaco Servytur, destacó que esta disposición amenaza la economía de comunidades portuarias del país La entrada Concanaco Servytur alerta sobre impacto económico de nuevo impuesto a cruceristas aparece primero en López-Dóriga Digital.	https://lopezdoriga.com/nacional/concanaco-servytur-alerta-sobre-impacto-economico-de-nuevo-impuesto-a-cruceristas/	2024-12-02T15:39:42-08:00	
Magistrada Julia María del Carmen García ve corrupción en caso de...	En conferencia de prensa, la juzgadora expuso que el caso de Yunes Márquez es 'rarísimo' La entrada Magistrada Julia María del Carmen García ve corrupción en caso de Miguel Ángel Yunes Márquez aparece primero en López-Dóriga Digital.	https://lopezdoriga.com/nacional/magistrada-julia-maria-del-carmen-garcia-ve-corrupcion-en-caso-de-miguel-angel-yunes-marquez/	2024-12-02T15:37:46-08:00	
Adiós Citi, hola Banamex: Todo sobre la nueva era del banco	Manuel Romo Villafuerte, director de Banamex, anunció que tras la decisión de Citi de salir de la banca de consumo en México, surge un nuevo Banamex enfocado en atender a personas y Pymes La entrada Adiós Citi, hola Banamex: Todo sobre la nueva era del banco aparece primero en López-Dóriga Digital.	https://lopezdoriga.com/lopez-doriga-tv/adios-citi-hola-banamex-todo-sobre-la-nueva-era-del-banco/	2024-12-02T14:27:44-08:00	
¿Sientes tristeza en Invierno? Podrías tener depresión invernal	La ‘depresión invernal’ es un trastorno emocional que, según especialistas de la UNAM, se manifiesta con pérdida de interés, problemas para dormir y trastornos alimenticios, similares a otros malestares emocionales. Es importante estar atentos a estos síntomas y cuidar de nuestra salud mental durante esta temporada La entrada ¿Sientes tristeza en Invierno? Podrías tener depresión invernal aparece primero en López-Dóriga Digital.	https://lopezdoriga.com/lopez-doriga-tv/sientes-tristeza-en-invierno-podrias-tener-depresion-invernal/	2024-12-02T14:26:09-08:00	
Aeropuertos de EE.UU. registran récord de más de 3 millones de vi...	De acuerdo a esta agencia federal, sus puestos en los aeródromos procesaron 3.09 millones de personas, una cifra que supera al anterior récord La entrada Aeropuertos de EE.UU. registran récord de más de 3 millones de viajeros en un solo día aparece primero en López-Dóriga Digital.	https://lopezdoriga.com/internacional/aeropuertos-de-ee-uu-registran-record-de-mas-de-3-millones-de-viajeros-en-un-solo-dia/	2024-12-02T14:20:36-08:00	
EE.UU. autoriza un nuevo paquete de ayuda a Ucrania valorado en 7...	El paquete que autorizó EE.UU. incluye munición de 155 milímetros, drones, misiles y material para proteger infraestructura nacional La entrada EE.UU. autoriza un nuevo paquete de ayuda a Ucrania valorado en 725 millones aparece primero en López-Dóriga Digital.	https://lopezdoriga.com/internacional/ee-uu-autoriza-un-nuevo-paquete-de-ayuda-a-ucrania-valorado-en-725-millones/	2024-12-02T14:20:31-08:00	
BID apoyará a México para implementar una política nacional de cu...	El BID apoyará a México en crear un sistema articulado que atienda las necesidades tanto de quienes requieren de cuidados como de las personas cuidadoras La entrada BID apoyará a México para implementar una política nacional de cuidados aparece primero en López-Dóriga Digital.	https://lopezdoriga.com/economia-y-finanzas/bid-apoyara-mexico-implementar-politica-nacional-de-cuidados/	2024-12-02T13:00:17-08:00	
Resurge Banamex, clientes no deben preocuparse tras separación de...	Manuel Romo Villafuerte, director general de Banamex, apuntó que al banco le depara un gran futuro tras su separación con Citi La entrada Resurge Banamex, clientes no deben preocuparse tras separación de Citi: Manuel Romo aparece primero en López-Dóriga Digital.	https://lopezdoriga.com/economia-y-finanzas/resurge-banamex-clientes-no-deben-preocuparse-separacion-citi-manuel-romo/	2024-12-02T13:00:06-08:00	
Matan a pollero en mercado de Coyoacán; había denunciado amenazas	Un comerciante de pollo que había denunciado amenazas fue asesinado al interior del Mercado Siglo XXI de Coyoacán La entrada Matan a pollero en mercado de Coyoacán; había denunciado amenazas aparece primero en López-Dóriga Digital.	https://lopezdoriga.com/nacional/cdmx-matan-pollero-mercado-coyoacan-denuncio-amenazas/	2024-12-02T12:29:51-08:00	
Aseguran 290 kilos de metanfetamina en Veracruz; su destino era C...	En la aduana del puerto fueron asegurados 3 mil 840 rollos de película plástica emplayada, que contenían 592 bolsas de metanfetamina La entrada Aseguran 290 kilos de metanfetamina en Veracruz; su destino era Camerún aparece primero en López-Dóriga Digital.	https://lopezdoriga.com/nacional/aseguran-290-kilos-metanfetamina-veracruz-destino-camerun/	2024-12-02T12:27:05-08:00	
Indulto a Hunter Biden siembra la incomprensión demócrata y alien...	La decisión del presidente de EE.UU., Joe Biden llegó por sorpresa el domingo, donde eximió a su hijo Hunter de una posible pena de cárcel La entrada Indulto a Hunter Biden siembra la incomprensión demócrata y alienta a los republicanos aparece primero en López-Dóriga Digital.	https://lopezdoriga.com/internacional/indulto-hunter-biden-siembra-incomprension-democrata-alienta-republicanos/	2024-12-02T12:02:49-08:00	
Caravana migrante sale de Tapachula pese a las declaraciones de T...	Una nueva caravana de migrantes partió desde Tapachula ante la advertencia de Trump de cerrar la frontera e imponer aranceles La entrada Caravana migrante sale de Tapachula pese a las declaraciones de Trump y Sheinbaum aparece primero en López-Dóriga Digital.	https://lopezdoriga.com/nacional/caravana-migrante-sale-tapachula-pese-declaraciones-trump-sheinbaum/	2024-12-02T11:58:11-08:00	
Activan Alerta Naranja en la CDMX por pronósticos de temperaturas...	Protección Civil de la Ciudad de México activó Alerta Naranja por bajas temperaturas para la mañana del 3 de diciembre La entrada Activan Alerta Naranja en la CDMX por pronósticos de temperaturas bajas para la mañana del 3 de diciembre aparece primero en López-Dóriga Digital.	https://lopezdoriga.com/nacional/activan-alerta-naranja-cdmx-pronosticos-temperaturas-bajas-3-diciembre-2024/	2024-12-02T11:46:15-08:00	
Luces y símbolos de paz, protagonistas de la última Navidad de Bi...	Unos 300 voluntarios han estado trabajando una semana entera para poner a punto la decoración de Navidad en la Casa Blanca La entrada Luces y símbolos de paz, protagonistas de la última Navidad de Biden en la Casa Blanca aparece primero en López-Dóriga Digital.	https://lopezdoriga.com/vida-y-estilo/luces-simbolos-paz-protagonistas-ultima-navidad-biden-casa-blanca/	2024-12-02T11:39:50-08:00	
Sector privado eleva a 1.55 % el pronóstico de crecimiento de Méx...	Asimismo, la previsión para 2025 creció a 1.23 por ciento tras una estimación anterior de 1.22 por ciento La entrada Sector privado eleva a 1.55 % el pronóstico de crecimiento de México para 2024 aparece primero en López-Dóriga Digital.	https://lopezdoriga.com/economia-y-finanzas/mexico-sector-privado-eleva-pronostico-de-crecimiento-2024/	2024-12-02T11:33:30-08:00	
Tasa de desempleo se ubica en 3% durante tercer trimestre de 2024...	El Inegi destacó que, frente al mismo periodo de 2023, la tasa de desempleo no mostró cambios significativos La entrada Tasa de desempleo se ubica en 3% durante tercer trimestre de 2024: Inegi aparece primero en López-Dóriga Digital.	https://lopezdoriga.com/economia-y-finanzas/tasa-desempleo-3-por-ciento-tercer-trimestre-2024-inegi/	2024-12-02T11:26:56-08:00	
Guerra del Cártel de Sinaloa supera los 500 homicidios en tres me...	Sinaloa registraba entre 30 y 40 asesinatos al mes, pero a raíz de la ola de violencia los homicidios ascendieron a 144 en septiembre La entrada Guerra del Cártel de Sinaloa supera los 500 homicidios en tres meses aparece primero en López-Dóriga Digital.	https://lopezdoriga.com/nacional/guerra-cartel-de-sinaloa-supera-500-homicidios-tres-meses/	2024-12-02T11:15:49-08:00	
Empresarios de Sinaloa piden auxilio al Gobierno Federal ante pér...	Coparmex Sinaloa cifra en 18 mil millones de pesos las pérdidas económicas y en 25 mil los empleos perdidos por la violencia La entrada Empresarios de Sinaloa piden auxilio al Gobierno Federal ante pérdidas por violencia aparece primero en López-Dóriga Digital.	https://lopezdoriga.com/nacional/sinaloa-empresarios-piden-auxilio-gobierno-federal-perdidas-violencia/	2024-12-02T10:48:58-08:00	
