Title	Description	Link	pubDate	Image
Hezbolá promete cooperar con el Ejército de Líbano para implement...	El líder de Hezbolá afirmó que la cooperación entre el Ejército libanés y la Resistencia será de alto nivel para implementar los compromisos del acuerdo La entrada Hezbolá promete cooperar con el Ejército de Líbano para implementar la tregua aparece primero en López-Dóriga Digital.	https://lopezdoriga.com/internacional/hezbola-cooperara-ejercito-libano-implementar-tregua/	2024-11-29T10:43:06-08:00	
Vamos a ponernos de acuerdo': Sheinbaum confía en que México evi...	La presidenta Sheinbaum se mostró confiada en que su Gobierno llegará a acuerdos con Trump en migración y narcotráfico La entrada 'Vamos a ponernos de acuerdo': Sheinbaum confía en que México evite los aranceles de Trump: aparece primero en López-Dóriga Digital.	https://lopezdoriga.com/nacional/vamos-ponernos-acuerdo-sheinbaum-confia-mexico-evite-aranceles-trump/	2024-11-29T09:59:38-08:00	
Joaquín, Marín de do Pingüé (Temporada 4, capítulo 36)	La amenaza arancelaria de Donald Trump; los Yunes reciben su plato de lentejas y todo listo para la Navidad La entrada Joaquín, Marín de do Pingüé (Temporada 4, capítulo 36) aparece primero en López-Dóriga Digital.	https://lopezdoriga.com/lopez-doriga-tv/joaquin-marin-de-do-pingue-temporada-4-capitulo-36/	2024-11-29T09:56:00-08:00	
#Video Balacera paraliza el tráfico en carretera de Culiacán, Sin...	En redes sociales, usuarios reportaron una balacera que paralizó el tráfico en la carretera Culiacán-Eldorado La entrada #Video Balacera paraliza el tráfico en carretera de Culiacán, Sinaloa aparece primero en López-Dóriga Digital.	https://lopezdoriga.com/nacional/video-balacera-paraliza-trafico-carretera-culiacan-sinaloa/	2024-11-29T09:34:04-08:00	
Aranceles de Trump afectarían al canal de Panamá y los precios en...	Los aranceles anunciados por Trump podrían 'tener un efecto negativo' en el canal de Panamá y la escalada de la inflación La entrada Aranceles de Trump afectarían al canal de Panamá y los precios en Centroamérica aparece primero en López-Dóriga Digital.	https://lopezdoriga.com/economia-y-finanzas/aranceles-trump-afectarian-canal-de-panama-precios-centroamerica/	2024-11-29T09:06:01-08:00	
Con Estados Unidos se buscará una relación de respeto, no de subo...	Nonos subordinamos', dijo la presidenta Claudia Sheinbaum sobre la relación que tendrá su Gobierno con Estados Unidos La entrada Con Estados Unidos se buscará una relación de respeto, no de subordinación: Sheinbaum aparece primero en López-Dóriga Digital.	https://lopezdoriga.com/nacional/estados-unidos-una-relacion-respeto-no-subordinacion-sheinbaum/	2024-11-29T08:54:52-08:00	
Acaba feroz temporada atlántica, con ‘Helene’ como el huracán más...	Si un huracán resultó destructivo y sobrecogedor esta temporada fue 'Helene', que tocó tierra en Florida La entrada Acaba feroz temporada atlántica, con 'Helene' como el huracán más mortífero aparece primero en López-Dóriga Digital.	https://lopezdoriga.com/internacional/acaba-feroz-temporada-atlantica-helene-huracan-mas-mortifero/	2024-11-29T08:43:01-08:00	
Ganaderos de la frontera norte resienten el bloqueo de EE.UU. por...	La detección del gusano barrenador esta semana provocó que Estados Unidos suspendiera la importación del ganado mexicano La entrada Ganaderos de la frontera norte resienten el bloqueo de EE.UU. por el gusano barrenador aparece primero en López-Dóriga Digital.	https://lopezdoriga.com/economia-y-finanzas/ganaderos-de-la-frontera-norte-resienten-el-bloqueo-de-ee-uu-por-el-gusano-barrenador/	2024-11-29T08:39:05-08:00	
Órganos autónomos se crearon para evitar que Pemex y CFE fueran r...	La presidenta Sheinbaum rechazó que con la desaparición de siete órganos autónomos se conduzca al país hacia el autoritarismo La entrada Órganos autónomos se crearon para evitar que Pemex y CFE fueran reconocidas como empresas públicas: Sheinbaum aparece primero en López-Dóriga Digital.	https://lopezdoriga.com/nacional/organos-autonomos-crearon-evitar-pemex-cfe-reconocidas-empresas-publicas-sheinbaum/	2024-11-29T08:28:56-08:00	
Marchan en Chiapas contra la violencia y la impunidad	Habitantes de Chiapas critican que las autoridades no toman medidas efectivas para garantizar su seguridad y la impartición de justicia La entrada Marchan en Chiapas contra la violencia y la impunidad aparece primero en López-Dóriga Digital.	https://lopezdoriga.com/nacional/marchan-en-chiapas-contra-la-violencia-y-la-impunidad/	2024-11-29T08:19:46-08:00	
Sheinbaum respalda a Javier May tras ola de violencia en Tabasco	La presidenta Sheinbaum dijo que al menos una vez a la semana el Gabinete de Seguridad trata el tema de la violencia en Tabasco La entrada Sheinbaum respalda a Javier May tras ola de violencia en Tabasco aparece primero en López-Dóriga Digital.	https://lopezdoriga.com/nacional/sheinbaum-respalda-javier-may-ola-violencia-tabasco/	2024-11-29T08:01:11-08:00	
Advierten inusual aumento de migrantes europeos y de Medio Orient...	Organizaciones civiles consideran que el flujo migratorio desde Europa del Este y Medio Oriente podría saturar aún más Tapachula La entrada Advierten inusual aumento de migrantes europeos y de Medio Oriente en México aparece primero en López-Dóriga Digital.	https://lopezdoriga.com/nacional/mexico-advierten-inusual-aumento-migrantes-europeos-medio-oriente/	2024-11-29T07:54:58-08:00	
‘Canelo’ Álvarez y CMB visitan a Sheinbaum; le entregan cinturón ...	La presidenta Sheinbaum recibió la visita en la mañana del presidente del CMB, Mauricio Sulaimán, y del boxeador 'Canelo' Álvarez La entrada 'Canelo' Álvarez y CMB visitan a Sheinbaum; le entregan cinturón de campeona mundial y 'guantes de la paz' aparece primero en López-Dóriga Digital.	https://lopezdoriga.com/nacional/canelo-alvarez-cmb-visitan-sheinbaum-entregan-cinturon-campeona-mundial-guantes-paz/	2024-11-29T07:50:28-08:00	
Manfred Mauricio Quintanilla enfrenta problemas fiscales con el G...	Manfred Mauricio Quintanilla se encuentra fuera de México y, de acuerdo con diversas fuentes, se encuentra en Los Ángeles, California La entrada Manfred Mauricio Quintanilla enfrenta problemas fiscales con el Gobierno de EE.UU. aparece primero en López-Dóriga Digital.	https://lopezdoriga.com/economia-y-finanzas/manfred-mauricio-quintanilla-enfrenta-problema-fiscales-gobierno-eeuu/	2024-11-29T07:33:53-08:00	
Sheinbaum advierte del incremento de las burocracias en universid...	La presidenta Sheinbaum indicó que las universidades públicas deben revisar la forma en que gastan sus recursos financieros La entrada Sheinbaum advierte del incremento de las burocracias en universidades públicas y pide austeridad aparece primero en López-Dóriga Digital.	https://lopezdoriga.com/nacional/sheinbaum-advierte-incremento-burocracias-universidades-publicas-pide-austeridad/	2024-11-29T07:14:52-08:00	
Revelan el nuevo 'resplandor' de la catedral de Notre Dame	La nueva apariencia de la catedral de Notre Dame fue revelada durante la visita del presidente francés, Emmanuel Macron La entrada Revelan el nuevo 'resplandor' de la catedral de Notre Dame aparece primero en López-Dóriga Digital.	https://lopezdoriga.com/internacional/revelan-nuevo-resplandor-catedral-notre-dame-paris-francia/	2024-11-29T06:05:02-08:00	
Nueva jornada de violencia en Sinaloa deja al menos 14 muertos	Sinaloa tuvo nuevos hechos de violencia en la última jornada, donde se registraron al menos 14 homicidios en tres municipios La entrada Nueva jornada de violencia en Sinaloa deja al menos 14 muertos aparece primero en López-Dóriga Digital.	https://lopezdoriga.com/nacional/nueva-jornada-violencia-sinaloa-14-muertos-28-noviembre-2024/	2024-11-29T05:54:00-08:00	
Cae grúa en Tailandia; tres muertos y dos desaparecidos	Tres personas perdieron la vida y dos permanecen desaparecidas por la caída de una gigantesca grúa de construcción desplegada para los trabajos de una nueva autopista elevada en el oeste de Bangkok, informaron este viernes las autoridades La entrada Cae grúa en Tailandia; tres muertos y dos desaparecidos aparece primero en López-Dóriga Digital.	https://lopezdoriga.com/lopez-doriga-tv/cae-grua-en-tailandia-tres-muertos-y-dos-desaparecidos/	2024-11-29T05:38:51-08:00	
México refrenda su apoyo al 'derecho a la libre determinación' de...	La SRE refrendó su apoyo al derecho a la libre determinación del pueblo palestino e hizo votos por una paz justa y duradera en Medio Oriente La entrada México refrenda su apoyo al 'derecho a la libre determinación' del pueblo palestino aparece primero en López-Dóriga Digital.	https://lopezdoriga.com/internacional/mexico-refrenda-apoyo-derecho-libre-determinacion-pueblo-palestino/	2024-11-29T05:35:07-08:00	
Con caballos dan terapia a niños con discapacidad	Con motivo del Día Internacional de las Personas con Discapacidad, que se conmemora el 3 de diciembre, presentamos la historia de fisioterapeutas de la UNAM, quienes a través de la equinoterapia ayudan al desarrollo emocional y motriz de niñas y niños La entrada Con caballos dan terapia a niños con discapacidad aparece primero en López-Dóriga Digital.	https://lopezdoriga.com/lopez-doriga-tv/con-caballos-dan-terapia-a-infancias-con-discapacidad/	2024-11-29T05:26:12-08:00	
CMB y ‘Canelo’ Álvarez entregan a Sheinbaum cinturón de campeonat...	Conferencia matutina de la presidenta Claudia Sheinbaum Pardo correspondiente al viernes 29 de noviembre de 2024 La entrada CMB y 'Canelo' Álvarez entregan a Sheinbaum cinturón de campeonato mundial y 'guantes de la paz' aparece primero en López-Dóriga Digital.	https://lopezdoriga.com/lopez-doriga-tv/cmb-canelo-alvarez-entregan-sheinbaum-cinturon-campeonato-mundial-guantes-paz/	2024-11-29T05:10:03-08:00	
China renueva hasta final de febrero la exención de aranceles a a...	China anunció la exención de aranceles adicionales a más de un centenar de productos provenientes de Estados Unidos La entrada China renueva hasta final de febrero la exención de aranceles a algunos productos de EE.UU. aparece primero en López-Dóriga Digital.	https://lopezdoriga.com/economia-y-finanzas/china-renueva-febrero-exencion-aranceles-algunos-productos-eeuu/	2024-11-29T05:04:59-08:00	
Frente frío 11 ocasionará chubascos y lluvias fuertes en el nores...	El Meteorológico Nacional también ocasionará lluvias puntuales muy fuertes en Puebla, Veracruz, Oaxaca, Chiapas y Tabasco La entrada Frente frío 11 ocasionará chubascos y lluvias fuertes en el noreste, oriente y sureste del país aparece primero en López-Dóriga Digital.	https://lopezdoriga.com/nacional/frente-frio-11-ocasionara-chubascos-lluvias-fuertes-noreste-oriente-sureste-29-noviembre-2024/	2024-11-29T04:52:14-08:00	
Celebran ‘Día de Acción de Gracias’ en un albergue migrante en la...	El director del albergue Pan de Vida, Ismael Martínez, señaló que buscan que todos los migrantes 'se sientan como si estuvieran en su casa' La entrada Celebran 'Día de Acción de Gracias' en un albergue migrante en la frontera norte de México aparece primero en López-Dóriga Digital.	https://lopezdoriga.com/internacional/celebran-dia-de-accion-de-gracias-en-un-albergue-migrante-en-la-frontera-norte-de-mexico/	2024-11-29T03:45:56-08:00	
Trump, no cambia, ni cambiará	Claudia Sheinbaum tuvo el primer contacto directo con el próximo presidente de Estados Unidos y confirmó, personalmente, el personal estilo de lo que será su relación, y la de su gobierno, con él durante los próximos cuatro años de su gestión La entrada Trump, no cambia, ni cambiará aparece primero en López-Dóriga Digital.	https://lopezdoriga.com/nacional/trump-no-cambia-ni-cambiara/	2024-11-29T03:00:23-08:00	
Comisionada Blanca Ibarra lamenta 'retroceso' por desaparición de...	La comisionada lamentó el retroceso que implica la desaparición del INAI, 'que surgió de una exigencia ciudadana por gobiernos transparentes' La entrada Comisionada Blanca Ibarra lamenta 'retroceso' por desaparición del Inai aparece primero en López-Dóriga Digital.	https://lopezdoriga.com/nacional/comisionada-blanca-ibarra-lamenta-retroceso-por-desaparicion-del-inai/	2024-11-28T21:42:29-08:00	
Senado aprueba reforma que extingue siete organismos autónomos	El Pleno del Senado aprobó en lo general con 86 votos a favor el dictamen de la reforma que extingue siete organismos autónomos La entrada Senado aprueba reforma que extingue siete organismos autónomos aparece primero en López-Dóriga Digital.	https://lopezdoriga.com/nacional/senado-aprueba-reforma-que-extingue-siete-organismos-autonomos/	2024-11-28T17:35:41-08:00	
Detienen a dos sujetos señalados por tráfico de personas en Chiap...	Josué Porfirio Cárdenas Molina, alias ‘Pilo’, y José Alejandro Ibarra Sánchez son señalados por tráfico de personas en Chiapas La entrada Detienen a dos sujetos señalados por tráfico de personas en Chiapas aparece primero en López-Dóriga Digital.	https://lopezdoriga.com/nacional/detienen-a-dos-sujetos-senalados-por-trafico-de-personas-en-chiapas/	2024-11-28T14:46:27-08:00	
Nombran a Claudia Arlett Espino como secretaria Ejecutiva del INE	En la sesión se le tomó la protesta de ley correspondiente a Claudia Arlett Espino en su cargo La entrada Nombran a Claudia Arlett Espino como secretaria Ejecutiva del INE aparece primero en López-Dóriga Digital.	https://lopezdoriga.com/nacional/nombran-a-claudia-arlett-espino-como-secretaria-ejecutiva-del-ine/	2024-11-28T14:38:19-08:00	
Ebrard presume que la amenaza de Trump es una etapa de negociació...	Marcelo Ebrard niega que México sea el patio trasero de EE.UU. y albergue plantas automotrices de China, ambas versiones de Canadá La entrada Ebrard presume que la amenaza de Trump es una etapa de negociación que durará hasta el 20 de enero aparece primero en López-Dóriga Digital.	https://lopezdoriga.com/lopez-doriga-tv/ebrard-presume-que-la-amenaza-de-trump-es-una-etapa-de-negociacion-que-durara-hasta-el-20-de-enero/	2024-11-28T14:23:03-08:00	
Trump no está en condiciones de asumir costo por aranceles a Méxi...	Marcelo Ebrard detalló que aplicar aranceles a México provocaría un 'daño gigante' tan solo a la industria automotriz de EE.UU. La entrada Trump no está en condiciones de asumir costo por aranceles a México, advierte Marcelo Ebrard aparece primero en López-Dóriga Digital.	https://lopezdoriga.com/economia-y-finanzas/trump-no-esta-en-condiciones-de-asumir-costo-por-aranceles-a-mexico-advierte-marcelo-ebrard/	2024-11-28T12:57:51-08:00	
Banxico anticipa recortes a la tasa de interés pese a repunte en ...	La Junta de Gobierno de Banxico reveló la minuta con motivo de la decisión de política monetaria anunciada el 14 de noviembre La entrada Banxico anticipa recortes a la tasa de interés pese a repunte en la inflación aparece primero en López-Dóriga Digital.	https://lopezdoriga.com/economia-y-finanzas/banxico-anticipa-recortes-tasa-interes-repunte-inflacion/	2024-11-28T12:45:36-08:00	
Senado ratifica a Raquel Buenrostro como titular de SFP	La Cámara Alta ratificó el nombramiento de Buenrostro Sánchez en SFP con 95 votos a favor, uno en contra y 17 abstenciones La entrada Senado ratifica a Raquel Buenrostro como titular de SFP aparece primero en López-Dóriga Digital.	https://lopezdoriga.com/nacional/senado-ratifica-raquel-buenrostro-titular-sfp-funcion-publica/	2024-11-28T12:37:20-08:00	
Casi nueve millones de mexicanos declararon tener alguna discapac...	El Inegi reveló estadísticas con motivo del Día Internacional de las Personas con Discapacidad, que se conmemora el 3 de diciembre La entrada Casi nueve millones de mexicanos declararon tener alguna discapacidad aparece primero en López-Dóriga Digital.	https://lopezdoriga.com/nacional/casi-nueve-millones-mexicanos-declararon-tener-alguna-discapacidad/	2024-11-28T12:16:19-08:00	
Luis María Aguilar se despide como ministro con dura crítica a la...	Aguilar Morales advirtió un contexto difícil para la judicatura en México y la impartición de justicia La entrada Luis María Aguilar se despide como ministro con dura crítica a la reforma judicial aparece primero en López-Dóriga Digital.	https://lopezdoriga.com/nacional/luis-maria-aguilar-se-despide-ministro-dura-critica-reforma-judicial/	2024-11-28T12:08:16-08:00	
IP de Cozumel, Quintana Roo, pide a senadores reconsiderar cobro ...	Carmen Joaquín Hernández, presidenta del CCE de Cozumel apuntó que este cobro a cruceros internacionales fue un 'albazo' de diputados La entrada IP de Cozumel, Quintana Roo, pide a senadores reconsiderar cobro a cruceros turísticos que lleguen a México aparece primero en López-Dóriga Digital.	https://lopezdoriga.com/economia-y-finanzas/ip-cozumel-quintana-roo-pide-senadores-reconsiderar-cobro-cruceros-turisticos-lleguen-mexico/	2024-11-28T12:04:39-08:00	
Códigos QR, nueva forma para robar contraseñas y datos bancarios	La SSC-CDMX alerta de códigos QR maliciosos en sitios públicos que redirigen a sitios web fraudulentos o descargan software malicioso en los dispositivos La entrada Códigos QR, nueva forma para robar contraseñas y datos bancarios aparece primero en López-Dóriga Digital.	https://lopezdoriga.com/nacional/codigos-qr-nueva-forma-robar-contrasenas-datos-bancarios/	2024-11-28T11:38:07-08:00	
Advierten del impacto que tendría si Trump restringe las visas la...	Medios de EE.UU. han reportado que el programa de visas temporales no agrícolas peligra durante la próxima Presidencia de Trump La entrada Advierten del impacto que tendría si Trump restringe las visas laborales temporales aparece primero en López-Dóriga Digital.	https://lopezdoriga.com/internacional/advierten-impacto-tendria-trump-restringe-visas-laborales-temporales/	2024-11-28T11:36:31-08:00	
De elefantes a explosiones de globos gigantes, un siglo del desfi...	En sus inicios, el desfile de Acción de Gracias no tenían globos gigantescos y su gran atracción eran los animales del zoológico de Central Park La entrada De elefantes a explosiones de globos gigantes, un siglo del desfile de Acción de Gracias aparece primero en López-Dóriga Digital.	https://lopezdoriga.com/internacional/eeuu-elefantes-globos-gigantes-un-siglo-desfile-accion-de-gracias/	2024-11-28T11:01:46-08:00	