Title	Description	Link	pubDate	Image
Aplazan elección de terna para nuevo titular de la Fiscalía CDMX	La elección de la terna para la Fiscalía CDMX fue aplazada porque faltan los resultados de los exámenes de control de confianza de los aspirantes La entrada Aplazan elección de terna para nuevo titular de la Fiscalía CDMX aparece primero en López-Dóriga Digital.	https://lopezdoriga.com/nacional/aplazan-eleccion-terna-nuevo-titular-fiscalia-cdmx/	2024-12-02T10:27:22-08:00	
Gabinete de Seguridad anuncia detenciones, cateos y aseguramiento...	La SSPC detalló las acciones realizadas el 29 de noviembre al 1 de diciembre para garantizar la seguridad en en el país La entrada Gabinete de Seguridad anuncia detenciones, cateos y aseguramientos realizados el fin de semana aparece primero en López-Dóriga Digital.	https://lopezdoriga.com/nacional/gabinete-seguridad-detenciones-cateos-aseguramientos-realizados-29-30-noviembre-1-diciembre/	2024-12-02T10:06:32-08:00	
Incendio en la alcaldía Tlalpan deja 3 muertos	Equipos de emergencias laboraron para sofocar un incendio registrado en un inmueble de la colonia Isidro Fabela, en Tlalpan La entrada Incendio en la alcaldía Tlalpan deja 3 muertos aparece primero en López-Dóriga Digital.	https://lopezdoriga.com/nacional/incendio-alcaldia-tlalpan-deja-3-muertos/	2024-12-02T09:09:17-08:00	
Llaman rectores a defender las humanidades, ante el avance vertig...	Rectores de varias universidades participaron en la mesa 'La Universidad del Futuro', dentro de la FIL Guadalajara 2024 La entrada Llaman rectores a defender las humanidades, ante el avance vertiginoso de las tecnologías aparece primero en López-Dóriga Digital.	https://lopezdoriga.com/nacional/llaman-rectores-defender-humanidades-avance-vertiginoso-tecnologias/	2024-12-02T08:26:22-08:00	
Sheinbaum firma decretos para garantizar vivienda, proteger a ani...	La presidenta Sheinbaum firmó decretos que serán publicados en las siguientes horas en el Diario Oficial de la Federación La entrada Sheinbaum firma decretos para garantizar vivienda, proteger a animales y crear la Universidad Nacional Rosario Castellanos aparece primero en López-Dóriga Digital.	https://lopezdoriga.com/nacional/sheinbaum-firma-decretos-garantizar-vivienda-proteger-animales-crear-universidad-nacional-rosario-castellanos/	2024-12-02T08:02:00-08:00	
Bruselas da la bienvenida a la Navidad entre luces, adornos y chu...	Bruselas, tras los primeros copos de nieve de la temporada, da oficialmente la bienvenida a la Navidad con la inauguración de sus mercadillos navideños, que ornamentan la ciudad e invitan a visitantes de todo el mundo a cantar villancicos, patinar sobre hielo o comer churros La entrada Bruselas da la bienvenida a la Navidad entre luces, adornos y churros aparece primero en López-Dóriga Digital.	https://lopezdoriga.com/lopez-doriga-tv/bruselas-da-la-bienvenida-a-la-navidad-entre-luces-adornos-y-churros/	2024-12-02T08:01:18-08:00	
Gobierno de Sheinbaum no tiene información sobre reclutamiento de...	La presidenta Sheinbaum reaccionó a la nota de The New York Times sobre el reclutamiento de estudiantes de química por parte de cárteles La entrada Gobierno de Sheinbaum no tiene información sobre reclutamiento de estudiantes de química por parte de cárteles aparece primero en López-Dóriga Digital.	https://lopezdoriga.com/nacional/gobierno-sheinbaum-no-tiene-informacion-reclutamiento-estudiantes-quimica-parte-carteles/	2024-12-02T07:45:51-08:00	
No estamos de acuerdo en una invasión': Sheinbaum sobre operativ...	La presidenta Sheinbaum manifestó su desacuerdo con que fuerzas especiales estadounidenses realicen operativos militares en nuestro país La entrada 'No estamos de acuerdo en una invasión': Sheinbaum sobre operativos militares de EE.UU. en México aparece primero en López-Dóriga Digital.	https://lopezdoriga.com/nacional/no-estamos-acuerdo-invasion-sheinbaum-operativos-militares-eeuu-mexico/	2024-12-02T07:29:40-08:00	
#Video Hombre arroja a mujer policía al paso del Metrobús; ya fue...	Autoridades denunciaron por tentativa de feminicidio al sujeto que arrojó a una mujer policía al paso del Metrobús en la Línea 2 La entrada #Video Hombre arroja a mujer policía al paso del Metrobús; ya fue detenido aparece primero en López-Dóriga Digital.	https://lopezdoriga.com/nacional/cdmx-hombre-arroja-mujer-policia-paso-metrobus/	2024-12-02T07:26:07-08:00	
Asesinan a cinco personas en vivienda de Zamora, Michoacán	Todas las víctimas presentaban impactos por arma de fuego, pero también extremidades mutiladas La entrada Asesinan a cinco personas en vivienda de Zamora, Michoacán aparece primero en López-Dóriga Digital.	https://lopezdoriga.com/nacional/michoacan-asesinan-cinco-personas-vivienda-zamora/	2024-12-02T07:02:55-08:00	
No caeremos en provocación, a México se le respeta': Sheinbaum t...	La presidenta Sheinbaum reaccionó a las declaraciones sobre México de la embajadora de Canadá en EE.UU., Kirsten Hillman La entrada 'No caeremos en provocación, a México se le respeta': Sheinbaum tras declaraciones de la embajadora de Canadá en EE.UU. aparece primero en López-Dóriga Digital.	https://lopezdoriga.com/nacional/no-caeremos-provocacion-mexico-respeta-sheinbaum-declaraciones-embajadora-canada-eeuu/	2024-12-02T06:55:33-08:00	
Aseguran casi 300 kilos de metanfetamina en puerto de Veracruz	El Ministerio Público Federal (MPF) abrió una carpeta de investigación por delitos contra la salud La entrada Aseguran casi 300 kilos de metanfetamina en puerto de Veracruz aparece primero en López-Dóriga Digital.	https://lopezdoriga.com/nacional/aseguran-casi-300-kilos-de-metanfetamina-en-puerto-de-veracruz/	2024-12-01T20:59:35-08:00	
Negociaciones para un tratado de plásticos cierran sin acuerdo y ...	El principal punto de desencuentro lo han protagonizado una coalición que integran casi 70 países, incluidos ocho de Latinoamérica o todos los de la Unión Europea (UE) La entrada Negociaciones para un tratado de plásticos cierran sin acuerdo y se reanudarán en 2025 aparece primero en López-Dóriga Digital.	https://lopezdoriga.com/economia-y-finanzas/negociaciones-para-un-tratado-de-plasticos-cierran-sin-acuerdo-y-se-reanudaran-en-2025/	2024-12-01T19:32:59-08:00	
Familiares de desaparecidos marchan en Chiapas	Los familiares pidieron al gobernador saliente, Rutilio Escandón, y al entrante Eduardo Ramírez, y a la presidenta Sheinbaum priorizar la búsqueda de sus familiares La entrada Familiares de desaparecidos marchan en Chiapas aparece primero en López-Dóriga Digital.	https://lopezdoriga.com/nacional/familiares-de-desaparecidos-marchan-en-chiapas/	2024-12-01T19:25:02-08:00	
Biden indulta a su hijo Hunter por considerarlo víctima de ataque...	Biden aseguró que sus rivales intentaron 'romper' a su hijo, que fue 'enjuiciado de manera selectiva e injusta' La entrada Biden indulta a su hijo Hunter por considerarlo víctima de ataques políticos aparece primero en López-Dóriga Digital.	https://lopezdoriga.com/internacional/biden-indulta-a-su-hijo-hunter-por-considerarlo-victima-de-ataques-politicos/	2024-12-01T17:05:31-08:00	
Biden encabeza un homenaje en la Casa Blanca por el Día Mundial d...	Durante el acto celebrado en el Jardín Sur (South Lawn) de la Casa Blanca, Biden tuvo palabras de elogio para los enfermos y para sus familiares La entrada Biden encabeza un homenaje en la Casa Blanca por el Día Mundial del Sida aparece primero en López-Dóriga Digital.	https://lopezdoriga.com/internacional/biden-encabeza-un-homenaje-en-la-casa-blanca-por-el-dia-mundial-del-sida/	2024-12-01T16:47:01-08:00	
Amenazas de deportaciones de Trump son 'aviso de tormenta', asegu...	El viernes pasado, la presidenta de México, Claudia Sheinbaum, cerró una semana de especulaciones sobre las amenazas arancelarias de Trump y se mostró muy confiada en que su Gobierno llegará a acuerdos La entrada Amenazas de deportaciones de Trump son 'aviso de tormenta', asegura el gobernador de Tamaulipas aparece primero en López-Dóriga Digital.	https://lopezdoriga.com/nacional/amenazas-de-deportaciones-de-trump-son-aviso-de-tormenta-asegura-el-gobernador-de-tamaulipas/	2024-12-01T16:09:21-08:00	
Guerras y tensiones regionales impulsan ventas de las principales...	Las 41 compañías estadounidenses en el 'top 100' registraron unos ingresos de 317 mil millones de dólares, un 2.5 % más que el año anterior y la mitad del total mundial La entrada Guerras y tensiones regionales impulsan ventas de las principales firmas armamentísticas aparece primero en López-Dóriga Digital.	https://lopezdoriga.com/economia-y-finanzas/guerras-y-tensiones-regionales-impulsan-ventas-de-las-principales-firmas-armamentisticas/	2024-12-01T15:49:26-08:00	
Claudia Sheinbaum asiste a la toma de posesión de Rocío Nahle	Rocío Nahle agradeció la asistencia de Sheinbaum Pardo y anunció que firmará un convenio para la paz con estados vecinos La entrada Claudia Sheinbaum asiste a la toma de posesión de Rocío Nahle aparece primero en López-Dóriga Digital.	https://lopezdoriga.com/nacional/claudia-sheinbaum-asiste-a-la-toma-de-posesion-de-rocio-nahle/	2024-12-01T14:46:00-08:00	
Queman en EE.UU. banderas de advertencias para marcar el final de...	La temporada de este año en el Atlántico tuvo una actividad superior a la media y acumuló 18 tormentas con nombre La entrada Queman en EE.UU. banderas de advertencias para marcar el final de la temporada de huracanes aparece primero en López-Dóriga Digital.	https://lopezdoriga.com/internacional/queman-en-ee-uu-banderas-de-advertencias-para-marcar-el-final-de-la-temporada-de-huracanes/	2024-12-01T14:10:49-08:00	
Instituto Nacional de Cardiología vive 'situación crítica', expre...	El director del Instituto Nacional de Cardiología expuso que se enfrentan dificultades para la adquisición de dispositivos médicos, alimento adecuado para el personal o financiamiento para construcción La entrada Instituto Nacional de Cardiología vive 'situación crítica', expresa director aparece primero en López-Dóriga Digital.	https://lopezdoriga.com/nacional/instituto-nacional-de-cardiologia-vive-situacion-critica-expresa-director/	2024-12-01T13:02:18-08:00	
Rector de la UNAM, Leonardo Lomelí, presenta su libro ‘Revolución...	El rector de la UNAM presentó su libro 'Revolución y reconstrucción', sobre la construcción del Estado moderno mexicano La entrada Rector de la UNAM, Leonardo Lomelí, presenta su libro 'Revolución y reconstrucción' en la FIL aparece primero en López-Dóriga Digital.	https://lopezdoriga.com/nacional/rector-unam-leonardo-lomeli-presenta-libro-revolucion-y-reconstruccion-fil/	2024-12-01T12:52:02-08:00	
Masacre en Guanajuato dejó 8 muertos, aclara Fiscalía	Sujetos armados dispararon contra puestos de cajeta a la entrada de Apaseo el Grande; el saldo es de ocho muertos La entrada Masacre en Guanajuato dejó 8 muertos, aclara Fiscalía aparece primero en López-Dóriga Digital.	https://lopezdoriga.com/nacional/guanajuato-masacre-puestos-cajeta-deja-8-muertos/	2024-12-01T12:10:44-08:00	
Jornada de violencia deja 6 muertos y 3 heridos en Cancún	En menos de 24 horas se registraron en Cancún cinco ataques armados que dejaron seis personas muertas La entrada Jornada de violencia deja 6 muertos y 3 heridos en Cancún aparece primero en López-Dóriga Digital.	https://lopezdoriga.com/nacional/cancun-jornada-violencia-deja-6-muertos-3-heridos/	2024-12-01T11:22:55-08:00	
Nueva caravana migrante alista salida desde Tapachula rumbo a EE....	Una nueva caravana de al menos dos mil migrantes partirá este lunes desde Tapachula hacia Estados Unidos La entrada Nueva caravana migrante alista salida desde Tapachula rumbo a EE.UU. aparece primero en López-Dóriga Digital.	https://lopezdoriga.com/nacional/tapachula-nueva-caravana-migrante-alista-salida-hacia-eeuu/	2024-12-01T11:02:11-08:00	
Matan a un policía y hieren a dos más en Mazatlán	Los policías realizaban rondines de vigilancia en el fraccionamiento Pradera Dorada de Mazatlán cuando fueron agredidos a disparos La entrada Matan a un policía y hieren a dos más en Mazatlán aparece primero en López-Dóriga Digital.	https://lopezdoriga.com/nacional/sinaloa-matan-policia-hieren-dos-mas-mazatlan/	2024-12-01T10:15:54-08:00	
Misa dominical desde la Basílica de Guadalupe (1-12-2024)	Sigue la misa desde la Basílica de Guadalupe; encabeza monseñor Carlos Aguiar Retes La entrada Misa dominical desde la Basílica de Guadalupe (1-12-2024) aparece primero en López-Dóriga Digital.	https://lopezdoriga.com/lopez-doriga-tv/misa-dominical-desde-la-basilica-de-guadalupe-1-12-2024/	2024-12-01T10:02:50-08:00	
Trump califica de 'muy productivo' el encuentro que mantuvo con T...	Trump y Trudeau cenaron la noche del viernes en Mar-a-Lago, la residencia en el sur de Florida del expresidente estadounidense La entrada Trump califica de 'muy productivo' el encuentro que mantuvo con Trudeau aparece primero en López-Dóriga Digital.	https://lopezdoriga.com/internacional/trump-califica-muy-productivo-encuentro-mantuvo-trudeau/	2024-11-30T12:43:27-08:00	
Activan Alerta Amarilla por frío en 6 alcaldías de la CDMX para e...	Protección Civil de la Ciudad de México activó la Alerta Amarilla para la mañana del domingo 1 de diciembre La entrada Activan Alerta Amarilla por frío en 6 alcaldías de la CDMX para este domingo aparece primero en López-Dóriga Digital.	https://lopezdoriga.com/nacional/activan-alerta-amarilla-frio-6-alcaldias-cdmx-domingo-1-diciembre-2024/	2024-11-30T12:29:45-08:00	
Detienen a dos sicarios del ‘Mochomito’ tras enfrentamiento en Cu...	Fuerzas federales detuvieron a dos presuntos sicarios del 'Mochomito' tras un enfrentamiento en Culiacán, Sinaloa La entrada Detienen a dos sicarios del 'Mochomito' tras enfrentamiento en Culiacán, Sinaloa aparece primero en López-Dóriga Digital.	https://lopezdoriga.com/nacional/detienen-dos-sicarios-mochomito-enfrentamiento-culiacan-sinaloa/	2024-11-30T12:15:58-08:00	
Habrá buena relación con EE.UU.', reitera Claudia Sheinbaum	La presidenta Sheinbaum dijo que 'ya habrá tiempo' para tener una reunión con el próximo estadounidense, Donald Trump La entrada 'Habrá buena relación con EE.UU.', reitera Claudia Sheinbaum aparece primero en López-Dóriga Digital.	https://lopezdoriga.com/nacional/habra-buena-relacion-eeuu-sheinbaum/	2024-11-30T11:45:12-08:00	
Un día como hoy: 30 de noviembre	Un día como hoy, 30 de noviembre, pero de 1970, muere Alfonso Caso Andrade, arqueólogo notable e indigenista, descubridor de Monte Albán La entrada Un día como hoy: 30 de noviembre aparece primero en López-Dóriga Digital.	https://lopezdoriga.com/nacional/mexico/un-dia-como-hoy-30-de-noviembre-2/	2024-11-30T11:20:38-08:00	
Reportan sismo de 5.4 a 344 kilómetros al suroeste de Puerto Vall...	De acuerdo con la Coordinación Nacional de Protección Civil 'no se reportan variaciones en el nivel del mar' La entrada Reportan sismo de 5.4 a 344 kilómetros al suroeste de Puerto Vallarta aparece primero en López-Dóriga Digital.	https://lopezdoriga.com/sin-categoria/reportan-sismo-de-5-4-a-344-kilometros-al-suroeste-de-puerto-vallarta/	2024-11-30T08:09:07-08:00	
La empresa estatal de energía prevé apagones en el 46% de Cuba es...	La UNE prevé apagones en el 46% de Cuba en la tarde-noche cuando aumenta la demanda en medio de la grave crisis energética en el país La entrada La empresa estatal de energía prevé apagones en el 46% de Cuba este sábado aparece primero en López-Dóriga Digital.	https://lopezdoriga.com/internacional/la-empresa-estatal-de-energia-preve-apagones-en-el-46-de-cuba-este-sabado/	2024-11-30T08:08:54-08:00	
Biden es el sexto presidente de EE.UU. que hace un viaje oficial ...	Joe Biden será el sexto presidente en realizar una visita oficial a África; viajará a Angola la próxima semana La entrada Biden es el sexto presidente de EE.UU. que hace un viaje oficial a África aparece primero en López-Dóriga Digital.	https://lopezdoriga.com/internacional/biden-es-el-sexto-presidente-de-ee-uu-que-hace-un-viaje-oficial-a-africa/	2024-11-30T07:39:22-08:00	
El regreso de Trump produce incertidumbre e inestabilidad en el p...	Ante el regreso de Donald Trump a la Casa Blanca es difícil hacer un diagnóstico económico preciso sobre lo que podría suceder en 2025 La entrada El regreso de Trump produce incertidumbre e inestabilidad en el panorama económico aparece primero en López-Dóriga Digital.	https://lopezdoriga.com/lopez-doriga-tv/el-regreso-de-trump-produce-incertidumbre-e-inestabilidad-en-el-panorama-economico/	2024-11-30T06:28:53-08:00	
Tres niños mueren por el frío extremo mientras caminaban en Afgan...	Caminaban entre dos aldeas del noreste de Afganistán mientras tenía lugar una fuerte nevada murieron el viernes a causa del frío extremo La entrada Tres niños mueren por el frío extremo mientras caminaban en Afganistán aparece primero en López-Dóriga Digital.	https://lopezdoriga.com/internacional/tres-ninos-mueren-por-el-frio-extremo-mientras-caminaban-en-afganistan/	2024-11-30T05:59:58-08:00	
Trudeau se reúne con Trump en Florida tras amenaza de aranceles a...	Trudeau cenó con Trump en Mar-a-Lago el viernes por la noche. El Ministro de Seguridad Pública Dominic LeBlanc acompañó al primer ministro, según fuentes citadas por el periódico New York Times La entrada Trudeau se reúne con Trump en Florida tras amenaza de aranceles a Canadá aparece primero en López-Dóriga Digital.	https://lopezdoriga.com/internacional/trudeau-se-reune-con-trump-en-florida-tras-amenaza-de-aranceles-a-canada/	2024-11-30T05:05:38-08:00	
Recuperación de cuerpos de mineros en Pasta de Conchos y El Pinab...	Claudia Sheinbaum se reunió con familiares de las víctimas, ante quienes presentó detalles de la estrategia de rescate en ambas minas La entrada Recuperación de cuerpos de mineros en Pasta de Conchos y El Pinabete 'no se detiene', asegura Claudia Sheinbaum aparece primero en López-Dóriga Digital.	https://lopezdoriga.com/nacional/recuperacion-de-cuerpos-de-mineros-en-pasta-de-conchos-y-el-pinabete-no-se-detiene-asegura-claudia-sheinbaum/	2024-11-29T21:41:46-08:00	
California suspende la distribución de leche cruda de su mayor pr...	Las autoridades suspendieron la distribución de productos lácteos tras detectarse el virus de gripe aviar en muestras de venta al público La entrada California suspende la distribución de leche cruda de su mayor productor por gripe aviar aparece primero en López-Dóriga Digital.	https://lopezdoriga.com/internacional/california-suspende-la-distribucion-de-leche-cruda-de-su-mayor-productor-por-gripe-aviar/	2024-11-29T20:59:36-08:00	
CDC extiende vigilancia por brote de salmonela vinculado a pepino...	La distribuidora retiró los pepinos distribuidos entre el 12 de octubre y el 27 de noviembre por brote de salmonela La entrada CDC extiende vigilancia por brote de salmonela vinculado a pepinos en 19 estados aparece primero en López-Dóriga Digital.	https://lopezdoriga.com/internacional/cdc-extiende-vigilancia-por-brote-de-salmonela-vinculado-a-pepinos-en-19-estados/	2024-11-29T20:24:59-08:00	
La Bolsa Mexicana cierra noviembre con retroceso del 1.67% tras a...	Enrique Covarrubias aseguró que noviembre finalizó con una contracción de -1.67% y acumula una pérdida en lo que va del año del -13.38% La entrada La Bolsa Mexicana cierra noviembre con retroceso del 1.67% tras amenazas de Trump aparece primero en López-Dóriga Digital.	https://lopezdoriga.com/economia-y-finanzas/la-bolsa-mexicana-cierra-noviembre-con-retroceso-del-1-67-tras-amenazas-de-trump/	2024-11-29T20:24:36-08:00	
Entregan reconocimiento a Cuitláhuac García al 'peor gobernador d...	La diputada reprochó a Cuitláhuac las cifras en materia de seguridad y le entregó un reconocimiento como el 'peor gobernador de la historia' La entrada Entregan reconocimiento a Cuitláhuac García al 'peor gobernador de la historia' aparece primero en López-Dóriga Digital.	https://lopezdoriga.com/nacional/entregan-reconocimiento-a-cuitlahuac-garcia-al-peor-gobernador-de-la-historia/	2024-11-29T17:48:22-08:00	
Kapital Day 2024: Innovación, Tecnología y Finanzas	Conoce cómo la innovación y la tecnología están transformando el mundo de las finanzas en el Kapital Day 2024. La entrada Kapital Day 2024: Innovación, Tecnología y Finanzas aparece primero en López-Dóriga Digital.	https://lopezdoriga.com/economia-y-finanzas/kapital-day-2024-innovacion-tecnologia-y-finanzas/	2024-11-29T16:58:36-08:00	
México y España acuerdan programa conjunto de exposiciones en Mon...	En el encuentro para la organización de Mondiacult destacaron 'los lazos de amistad e historia compartida que unen a ambos países' La entrada México y España acuerdan programa conjunto de exposiciones en Mondiacult 2025 aparece primero en López-Dóriga Digital.	https://lopezdoriga.com/internacional/mexico-y-espana-acuerdan-programa-conjunto-de-exposiciones-en-mondiacult-2025/	2024-11-29T16:48:56-08:00	
Al menos siete congresistas demócratas en EE.UU. reciben amenazas...	Los demócratas fueron objeto de amenazas de bomba en sus casas este jueves cuando se celebraba el Día de Acción de Gracias en EE.UU. La entrada Al menos siete congresistas demócratas en EE.UU. reciben amenazas de bomba aparece primero en López-Dóriga Digital.	https://lopezdoriga.com/internacional/al-menos-siete-congresistas-democratas-en-ee-uu-reciben-amenazas-de-bomba/	2024-11-29T16:27:42-08:00	
EE.UU. pide la libertad inmediata e incondicional de periodista D...	Un tribunal de Pekín condenó este viernes al periodista Dong Yuyu de 62 años a siete años de prisión por cargos de espionaje La entrada EE.UU. pide la libertad inmediata e incondicional de periodista Dong Yuyu condenado en China aparece primero en López-Dóriga Digital.	https://lopezdoriga.com/internacional/ee-uu-pide-la-libertad-inmediata-e-incondicional-de-periodista-dong-yuyu-condenado-en-china/	2024-11-29T15:19:10-08:00	
Magistrado Juan José Olvera exige transparencia en cancelación de...	Juez habría cancelado la orden de aprehensión contra Yunes en tanto que la FGR retiró la solicitud de extradición presentada ante EE.UU. La entrada Magistrado Juan José Olvera exige transparencia en cancelación de orden de aprehensión contra Miguel Yunes aparece primero en López-Dóriga Digital.	https://lopezdoriga.com/nacional/magistrado-juan-jose-olvera-exige-transparencia-en-cancelacion-de-orden-de-aprehension-contra-miguel-yunes/	2024-11-29T15:04:41-08:00	
Revisarán agencias aduaneras para combatir contrabando de mercanc...	Entre las mercancías incautadas hay textiles, accesorios y productos provenientes de China, Bangladesh, Malasia, Vietnam e Indonesia La entrada Revisarán agencias aduaneras para combatir contrabando de mercancías asiáticas aparece primero en López-Dóriga Digital.	https://lopezdoriga.com/nacional/revisaran-agencias-aduaneras-para-combatir-contrabando-de-mercancias-asiaticas/	2024-11-29T13:39:50-08:00	
Diálogo entre Claudia Sheinbaum y Donald Trump fluyó muy bien: ca...	El secretario de Relaciones Exteriores, Juan Ramón de la Fuente, subrayó que el diálogo entre Claudia Sheinbaum y Donald Trump fluyó muy bien La entrada Diálogo entre Claudia Sheinbaum y Donald Trump fluyó muy bien: canciller aparece primero en López-Dóriga Digital.	https://lopezdoriga.com/lopez-doriga-tv/dialogo-entre-claudia-sheinbaum-y-donald-trump-fluyo-muy-bien-canciller/	2024-11-29T13:38:10-08:00	
Conversación entre Sheinbaum y Trump fluyó muy bien, marca pauta ...	El canciller Juan Ramón de la Fuente reveló detalles de la conversación telefónica entre la presidenta Sheinbaum y Donald Trump La entrada Conversación entre Sheinbaum y Trump fluyó muy bien, marca pauta de cómo debe ser el diálogo: De la Fuente aparece primero en López-Dóriga Digital.	https://lopezdoriga.com/nacional/conversacion-sheinbaum-trump-fluyo-muy-bien-marca-pauta-como-debe-ser-dialogo-de-la-fuente/	2024-11-29T12:58:49-08:00	
Zelenski sugiere que podría poner fin a la guerra en Ucrania a ca...	Es la primera vez que Zelenski insinúa un acuerdo de alto al fuego que incluye el control ruso de parte del territorio ucraniano La entrada Zelenski sugiere que podría poner fin a la guerra en Ucrania a cambio de unirse a la OTAN aparece primero en López-Dóriga Digital.	https://lopezdoriga.com/internacional/zelenski-sugiere-fin-guerra-ucrania-a-cambio-unirse-otan/	2024-11-29T12:30:04-08:00	
Solo 26.9 % de paisajes prioritarios para el jaguar en México est...	WWF alertó que hay pocas estrategias de recuperación de especies como el jaguar que están actuando al nivel que se tiene que estar actuando La entrada Solo 26.9 % de paisajes prioritarios para el jaguar en México están conservados aparece primero en López-Dóriga Digital.	https://lopezdoriga.com/nacional/mexico-solo-26-por-ciento-paisajes-prioritarios-jaguar-estan-conservados/	2024-11-29T12:05:18-08:00	
Fueron aseguradas mercancías por 7.5 mdp en Izazaga 89: Secretarí...	Marcelo Ebrard, titular de Economía, dio a conocer el resultado del operativo contra mercancías ilegales en la plaza Izazaga 89 La entrada Fueron aseguradas mercancías por 7.5 mdp en Izazaga 89: Secretaría de Economía aparece primero en López-Dóriga Digital.	https://lopezdoriga.com/nacional/fueron-aseguradas-mercancias-7-5-mdp-izazaga-89-secretaria-economia/	2024-11-29T11:56:16-08:00	
Avanza en Reino Unido legalización del suicidio asistido	De ser aprobado, el suicidio asistido aplicaría para residentes de Inglaterra o Gales con una expectativa de vida de menos de seis meses La entrada Avanza en Reino Unido legalización del suicidio asistido aparece primero en López-Dóriga Digital.	https://lopezdoriga.com/internacional/reino-unido-avanza-legalizacion-suicidio-asistido/	2024-11-29T11:40:25-08:00	
