Title	Description	Link	pubDate
↩️ A drone strike was carried out against a group of gunmen in th...	Mannie's War Room: The IDF says it launched a counterterrorism operation in the West Bank city of Tubas and the adjacent town of Tamun this morning. So far, the troops have killed a Palestinian gunman and wounded others amid exchanges of fire, the military says. Several wanted… A drone strike was carried out against a group of gunmen in the West Bank town of Tamun a short while ago, according to a military source.The strike comes amid an ongoing IDF raid on the area.	https://t.me/manniefabian/46728	2024-08-13T22:36:20-07:00
The IDF says it launched a counterterrorism operation in the West...	The IDF says it launched a counterterrorism operation in the West Bank city of Tubas and the adjacent town of Tamun this morning.So far, the troops have killed a Palestinian gunman and wounded others amid exchanges of fire, the military says.Several wanted Palestinians have also been detained, and weapons have been seized.The IDF says it will provide further details on the operation later.	https://t.me/manniefabian/46727	2024-08-13T22:28:16-07:00
🎬 A barrage of some 25 rockets was launched by Hezbollah at the ...	A barrage of some 25 rockets was launched by Hezbollah at the Upper Galilee in northern Israel a short while ago.Sirens had sounded in the Mount Meron area, including the towns of Hurfeish, Elkosh, Fassuta, and Beit Jann.The IDF says that the rockets struck open areas, causing no injuries.Hezbollah took responsibility for the attack, claiming to have targeted a military base in the area.	https://t.me/manniefabian/46726	2024-08-13T14:07:53-07:00
The IDF says that it has temporarily closed a route in southern G...	The IDF says that it has temporarily closed a route in southern Gaza's Rafah, used to deliver humanitarian aid to Palestinians, after Hamas opened fire at the area.The military does not provide further details on the incident.It says that deliveries along the route have been halted temporarily, -as the area has become an active combat zone.- -Terror activity in humanitarian areas and areas where the population is concentrated harms humanitarian coordination and the distribution of aid,- the IDF says.	https://t.me/manniefabian/46725	2024-08-13T13:59:12-07:00
Border Police officers shot dead a Palestinian teenager who was h...	Border Police officers shot dead a Palestinian teenager who was hurling Molotov cocktails with other suspects over the West Bank security barrier near Jerusalem this evening.Police say that officers were waiting in an ambush near the northeastern Jerusalem neighborhood of Pisgat Ze'ev following recent firebomb attacks in the area.The officers this evening spotted a group of suspects hurling Molotovs over the security barrier. At one point, a Border Police sniper opened fire at one of the suspects who climbed onto the wall and threw a firebomb over it, police say.The other suspects then fled the scene. Police say that the wounded Palestinian, 16, a resident of the West Bank town of Anata was taken to receive medical treatment, although his death was declared a short while later.Meanwhile, a blast in a vehicle occurred earlier this evening near the West Bank city of Hebron, wounding two Palestinians.The IDF is investigating if the blast occurred after Palestinian terror operatives tried to rig a car with bombs or they had been transporting explosive devices Troops are now carrying out searches in the town of Halhul for the remains of the car to investigate the circumstances.	https://t.me/manniefabian/46724	2024-08-13T13:48:54-07:00
🖼 Rocket sirens are sounding in the Upper Galilee. The alerts ar...	Rocket sirens are sounding in the Upper Galilee.The alerts are activated as far as Beit Jann, located some 10 kilometers from the Lebanon border.	https://t.me/manniefabian/46723	2024-08-13T13:38:32-07:00
↩️ Defense Minister Yoav Gallant thanks US Secretary of Defense L...	Mannie's War Room: US Secretary of State approves an $18.82 billion sale to Israel of F-15IA fighter jets — the Israeli variant of the advanced F-15EX — and kits for the Israeli Air Force's existing F-15 aircraft. According to the press release, the deliveries are expected… Defense Minister Yoav Gallant thanks US Secretary of Defense Lloyd Austin and Secretary of State Anthony Blinken for approving the sale of F-15IA fighter jets and other equipment to Israel. -Thank you to Secretary of Defense Austin and Secretary of State Blinken for advancing critical force buildup initiatives that assist Israel in developing and maintaining its qualitative military edge in the region. This includes incorporating F-15IAs into the IAF fleet of fighter aircraft, and providing critical munition to ensure Israel’s capabilities and security,- Gallant says on X.-As we fight to defend Israel on 7 different fronts, your message of support and commitment to Israel’s security, are clear,- he adds.	https://t.me/manniefabian/46722	2024-08-13T13:18:42-07:00
🎬 A barrage of some 15 rockets was fired from Lebanon at the Mal...	A barrage of some 15 rockets was fired from Lebanon at the Malkia area in northern Israel.According to the IDF, the rockets struck open areas, causing no injuries.Meanwhile, the IDF says it carried out drone strikes on two primed Hezbollah rocket launchers, in at-Tiri and Zibqin Video is too big	https://t.me/manniefabian/46721	2024-08-13T12:31:53-07:00
🖼 US Secretary of State approves an $18.82 billion sale to Israe...	US Secretary of State approves an $18.82 billion sale to Israel of F-15IA fighter jets — the Israeli variant of the advanced F-15EX — and kits for the Israeli Air Force's existing F-15 aircraft.According to the press release, the deliveries are expected to begin in 2029.Last year, Israel submitted a formal request to the US regarding the procurement of 25 F-15IA fighter jets, with options for 25 more.	https://t.me/manniefabian/46720	2024-08-13T12:29:31-07:00
🖼 Following Hamas's attempted rocket attack from southern Gaza's...	Following Hamas's attempted rocket attack from southern Gaza's Khan Younis on Tel Aviv today, the IDF issues a new evacuation order for Palestinians in the area.Two rockets were fired by Hamas, with one landing in the sea off the coast of Tel Aviv and the other falling short in Gaza.Col. Avichay Adraee, the IDF's Arabic-language spokesman, publishes a list of the zones that need to be evacuated.The announcement calls for Palestinians in the specified areas to evacuate to the Israeli-designated humanitarian zone.The IDF is currently carrying out an offensive in Khan Younis. Before the raid, the IDF issued evacuation orders for other areas of Khan Younis.	https://t.me/manniefabian/46719	2024-08-13T10:07:39-07:00
🎬 The Hamas terror group releases footage of it launching two lo...	The Hamas terror group releases footage of it launching two long-range rockets from the Gaza Strip at central Israel today.The video shows that Hamas used makeshift rocket launchers, instead of the standard launch pits that it would normally use to carry out long-range rocket fire on Israel.As such, one of the rockets fired today landed in the sea off the coast of Tel Aviv, while the second fell short in Gaza, according to the IDF.The IDF has assessed that Hamas still possesses the capability to carry out attacks on central Israel or Jerusalem, but the terror group does not have many long-range rockets or launchers left to use. Video is too big	https://t.me/manniefabian/46718	2024-08-13T09:42:32-07:00
↩️🎬 The IDF confirms carrying out a drone strike earlier today i...	Mannie's War Room: Lebanese media report an Israeli drone strike on a vehicle between the southern Lebanon towns of Beit Yahoun and Baraachit. No further details are immediately available. The IDF confirms carrying out a drone strike earlier today in southern Lebanon's Baraachit, killing two members of Hezbollah's so-called Southern Front unit, the terror group's regional command in southern Lebanon.Separately, tanks under the 810th -Mountains- Regional Brigade shelled Hezbollah operatives at an observation post in the Mount Dov area, the IDF says.Additionally, buildings used by Hezbollah in Chihine and Aalma ash-Shab, and an anti-tank guided missile launch post in Ayta ash-Shab, were struck, the military adds.Hezbollah today announced the death of one member in an Israeli strike, bringing the terror group's toll since October to at least 407. Video is too big	https://t.me/manniefabian/46717	2024-08-13T09:10:39-07:00
🖼 Defense Minister Yoav Gallant says Israel is closely tracking ...	Defense Minister Yoav Gallant says Israel is closely tracking its enemies, as the country expects an attack from Iran and its Lebanese proxy Hezbollah.-I am aware of the tensions and the great burden placed on the citizens of Israel. We are following what is happening, in Beirut, in Tehran, and in other places,- Gallant says during a visit to an IDF intelligence base in northern Israel.-We are engaged both in removing the threats and preparing all possibilities, in order to be able to attack wherever we decide,- he adds, according to remarks provided by his office.	https://t.me/manniefabian/46716	2024-08-13T08:56:54-07:00
🎬 The IDF releases footage of a recent airstrike on a group of g...	The IDF releases footage of a recent airstrike on a group of gunmen in southern Gaza's Rafah.The cell had been spotted by troops of the Givati Brigade using a drone, the military says.	https://t.me/manniefabian/46715	2024-08-13T08:00:09-07:00
↩️ Al Arabiya reports that two Hezbollah members were killed in t...	Mannie's War Room: Lebanese media report an Israeli drone strike on a vehicle between the southern Lebanon towns of Beit Yahoun and Baraachit. No further details are immediately available. Al Arabiya reports that two Hezbollah members were killed in the IDF strike in southern Lebanon.	https://t.me/manniefabian/46714	2024-08-13T06:40:33-07:00
According to the IDF, one rocket fired from the Gaza Strip landed...	According to the IDF, one rocket fired from the Gaza Strip landed in the sea off the coast of central Israel.A second rocket failed to cross the border and fell short in Gaza, the IDF says.	https://t.me/manniefabian/46713	2024-08-13T06:15:24-07:00
↩️ The last time Hamas fired rockets at Tel Aviv was in late May.	Mannie's War Room: Hamas claims responsibility for the rocket fire The last time Hamas fired rockets at Tel Aviv was in late May.	https://t.me/manniefabian/46712	2024-08-13T06:14:12-07:00
↩️🖼 Hamas claims responsibility for the rocket fire	Mannie's War Room: Long-range rockets were launched from the Gaza Strip at central Israel a short while ago. The projectiles apparently hit the sea. No sirens sounded. Hamas claims responsibility for the rocket fire	https://t.me/manniefabian/46710	2024-08-13T06:09:58-07:00
Long-range rockets were launched from the Gaza Strip at central I...	Long-range rockets were launched from the Gaza Strip at central Israel a short while ago. The projectiles apparently hit the sea. No sirens sounded.	https://t.me/manniefabian/46709	2024-08-13T06:05:06-07:00