Title	Description	Link	pubDate	Image
Who was behind mass killings on Syria's coast?	For several days, Syria's Mediterranean coast has been gripped by extreme violence that has seen mass killings mainly targeting members of the Alawite minority. Authorities have not provided a toll, but the Syrian Observatory for Human Rights monitor put the number of dead at 1,225 civilians, mostly Alawites. Human Rights Watch said 'hundreds' were killed.	https://www.naharnet.com/stories/en/311564-who-was-behind-mass-killings-on-syria-s-coast	2025-03-12T03:06:52-07:00	
Israel says senior Hezbollah militant, several 'suspects' hit in south strikes	The Israeli military said Tuesday it had carried out an air strike against several Hezbollah militants in the area of Froun in southern Lebanon, in addition to an earlier attack in the area of Nabatiyeh. 'Earlier today (Tuesday), several terrorists were identified in a site used by Hezbollah in the area of Froun in southern Lebanon. An IAF (air force) aircraft struck the suspects,' the army said in a statement.	https://www.naharnet.com/stories/en/311557-israel-says-senior-hezbollah-militant-several-suspects-hit-in-south-strikes	2025-03-12T02:44:30-07:00	
Israel army says senior Hezbollah militant, several 'suspects' hit in south strikes	The Israeli military said Tuesday it had carried out an air strike against several Hezbollah militants in the area of Froun in southern Lebanon, in addition to an earlier attack in the area of Nabatiyeh. 'Earlier today (Tuesday), several terrorists were identified in a site used by Hezbollah in the area of Froun in southern Lebanon. An IAF (air force) aircraft struck the suspects,' the army said in a statement.	https://www.naharnet.com/stories/en/311557-israel-army-says-senior-hezbollah-militant-several-suspects-hit-in-south-strikes	2025-03-12T02:44:30-07:00	
Ceasefire committee meets in Naqoura to discuss full implementation of 1701	The Ceasefire monitoring committee met for the sixth time in Naqoura Tuesday. UNIFIL hosted the meeting, with the United States serving as chair, and was joined by France, the Lebanese Armed Forces (LAF) and the Israel Defense Forces (IDF). The attendees discussed advancing the full implementation of U.N. Security Council Resolution 1701, the full implementation of the November 26, 2024, Cessation of Hostilities arrangement, and next steps for addressing outstanding issues between Israel and Lebanon.	https://www.naharnet.com/stories/en/311556-ceasefire-committee-meets-in-naqoura-to-discuss-full-implementation-of-1701	2025-03-12T02:35:45-07:00	
Lebanon receives four detainees released by Israel	Lebanon received four Lebanese prisoners who were detained by Israeli forces during the last war, and a fifth prisoner will be handed over tomorrow (Wednesday),' the presidency said in a statement Tuesday.	https://www.naharnet.com/stories/en/311555-lebanon-receives-four-detainees-released-by-israel	2025-03-12T02:29:31-07:00	
Israel and Lebanon agree to land border negotiations after US push	Israel and Lebanon have agreed to open negotiations to resolve longstanding disputes over the land border between them, two U.S. officials told U.S. news portal Axios in remarks published Tuesday. 'The Trump administration successfully pushed the two sides to come to the table just months after Israel invaded Lebanon as part of its war against Hezbollah. The border talks are intended to help stabilize the ceasefire brokered by the Biden administration last November,' Axios said.	https://www.naharnet.com/stories/en/311554-israel-and-lebanon-agree-to-land-border-negotiations-after-us-push	2025-03-11T09:05:48-07:00	
Ortagus says US to mediate Lebanon-Israel talks on outstanding issues	The United States announced Tuesday that it will be 'bringing together Lebanon and Israel for talks aimed at diplomatically resolving several outstanding issues between the two countries.'	https://www.naharnet.com/stories/en/311553-ortagus-says-us-to-mediate-lebanon-israel-talks-on-outstanding-issues	2025-03-11T08:41:47-07:00	
Netanyahu says Israel and Lebanon to form working groups to resolve border disputes	Israel said on Tuesday that it had agreed to release five captive Lebanese citizens as a goodwill gesture to Lebanon’s 'new president' Joseph Aoun.	https://www.naharnet.com/stories/en/311552-netanyahu-says-israel-and-lebanon-to-form-working-groups-to-resolve-border-disputes	2025-03-11T08:30:56-07:00	
Security appointments: Latest developments	Prime Minister Nawaf Salam held a meeting Tuesday with President Joseph Aoun in Baabda, reportedly over the issue of security appointments.	https://www.naharnet.com/stories/en/311545-security-appointments-latest-developments	2025-03-11T06:49:23-07:00	
Israeli fire kills 4 in Gaza Strip, 3 in the occupied West Bank	Israeli fire has killed four people and wounded 14 in the Gaza Strip over the past 24 hours, Palestinian officials said, even as a fragile ceasefire with Hamas has largely held. Israeli strikes have killed dozens of Palestinians who the army says had approached its troops or entered unauthorized areas in violation of the January truce.	https://naharnet.com/stories/en/311538-israeli-fire-kills-4-in-gaza-strip-3-in-the-occupied-west-bank	2025-03-11T05:45:19-07:00	
Israeli fire kills 4 in Gaza Strip, 3 in the occupied West Bank	Israeli fire has killed four people and wounded 14 in the Gaza Strip over the past 24 hours, Palestinian officials said, even as a fragile ceasefire with Hamas has largely held. Israeli strikes have killed dozens of Palestinians who the army says had approached its troops or entered unauthorized areas in violation of the January truce.	https://www.naharnet.com/stories/en/311538-israeli-fire-kills-4-in-gaza-strip-3-in-the-occupied-west-bank	2025-03-11T05:45:19-07:00	
Israeli air strike kills four in Gaza City	Gaza's civil defense agency reported an Israeli air strike targeting a group of people in Gaza City on Tuesday, killing four. 'There are four martyrs... as a result of an Israeli strike on a group of citizens in the Netzarim area, south of Gaza City,' agency spokesman Mahmoud Bassal told AFP, adding those killed were men in their 20s. The Israeli military said it was looking into the reports of the strike.	https://naharnet.com/stories/en/311538-israeli-air-strike-kills-four-in-gaza-city	2025-03-11T05:45:19-07:00	
LF lashes out at Deputy PM Mitri over Hezbollah arms	The Lebanese Forces has blasted Deputy Prime Minister Tarek Mitri over remarks that he voiced regarding the thorny issue of Hezbollah’s weapons, accusing him of disregarding 'the Taif Agreement, the U.N. resolutions, the latest ceasefire agreement, the presidential inauguration address and the ministerial statement.'	https://www.naharnet.com/stories/en/311537-lf-lashes-out-at-deputy-pm-mitri-over-hezbollah-arms	2025-03-11T05:40:36-07:00	
Israeli drone strikes kill two in south Lebanon	An Israeli drone bombed a car on the Roumine-Wadi Deir al-Zahrani road in south Lebanon on Tuesday, killing one person. The Israeli army radio said the target of the strike was a member of Hezbollah's 'aerial defense unit.'	https://www.naharnet.com/stories/en/311536-israeli-drone-strikes-kill-two-in-south-lebanon	2025-03-11T05:07:52-07:00	
Israeli drone kills 1 in South as 2 strikes hit van	An Israeli drone bombed a car on the Roumine-Wadi Deir al-Zahrani road in south Lebanon on Tuesday, killing one person. The Israeli army radio said the target of the strike was a member of Hezbollah's 'aerial defense unit.'	https://www.naharnet.com/stories/en/311536-israeli-drone-kills-1-in-south-as-2-strikes-hit-van	2025-03-11T05:07:52-07:00	
Israeli strike on car kills 1 in South as 2 other strikes hit valley	An Israeli drone bombed a car on the Roumine-Wadi Deir al-Zahrani road in south Lebanon on Tuesday, killing one person. The Israeli army radio said the target of the strike was a member of Hezbollah's 'aerial defense unit.'	https://www.naharnet.com/stories/en/311536-israeli-strike-on-car-kills-1-in-south-as-2-other-strikes-hit-valley	2025-03-11T05:07:52-07:00	
Israeli drone strike kills one person in south Lebanon	An Israeli drone bombed a car on the Roumine-Wadi Deir al-Zahrani road in south Lebanon on Tuesday, killing one person. The Israeli military said Saturday that it targeted a Hezbollah militant with a similar drone air strike in southern Lebanon, saying he was 'engaged in re-establishing terrorist infrastructure and directing Hezbollah terror activities.'	https://www.naharnet.com/stories/en/311536-israeli-drone-strike-kills-one-person-in-south-lebanon	2025-03-11T05:07:52-07:00	
Israeli drone strike kills one person in south Lebanon	An Israeli drone bombed a car on the Roumine-Wadi Deir al-Zahrani road in south Lebanon on Tuesday, killing one person. The Israeli military said Saturday that it targeted a Hezbollah militant with a similar drone air strike in southern Lebanon, saying he was 'engaged in re-establishing terrorist infrastructure and directing Hezbollah terror activities.'	https://naharnet.com/stories/en/311536-israeli-drone-strike-kills-one-person-in-south-lebanon	2025-03-11T05:07:52-07:00	
Fact-finding committee says Syria determined to 'prevent unlawful revenge'	A fact-finding committee formed by Syria's new authorities to investigate a wave of deadly violence said on Tuesday the country was determined to 'prevent unlawful revenge'. 'The new Syria is determined to enshrine justice and the rule of law, protect the rights and freedoms of its citizens, prevent unlawful revenge and guarantee that there is no impunity,' committee spokesman Yasser al-Farhan said at a press conference in Damascus.	https://naharnet.com/stories/en/311535-fact-finding-committee-says-syria-determined-to-prevent-unlawful-revenge	2025-03-11T04:36:11-07:00	
Fact-finding committee says Syria determined to 'prevent unlawful revenge'	A fact-finding committee formed by Syria's new authorities to investigate a wave of deadly violence said on Tuesday the country was determined to 'prevent unlawful revenge'. 'The new Syria is determined to enshrine justice and the rule of law, protect the rights and freedoms of its citizens, prevent unlawful revenge and guarantee that there is no impunity,' committee spokesman Yasser al-Farhan said at a press conference in Damascus.	https://www.naharnet.com/stories/en/311535-fact-finding-committee-says-syria-determined-to-prevent-unlawful-revenge	2025-03-11T04:36:11-07:00	
Quintet meets Berri, says seeking Israel full withdrawal	The ambassadors of the five-nation group for Lebanon met Tuesday with Speaker Nabih Berri in Ain el-Tineh.	https://naharnet.com/stories/en/311534-quintet-meets-berri-says-seeking-israel-full-withdrawal	2025-03-11T03:05:10-07:00	
Quintet meets Berri, says seeking Israel full withdrawal	The ambassadors of the five-nation group for Lebanon met Tuesday with Speaker Nabih Berri in Ain el-Tineh.	https://www.naharnet.com/stories/en/311534-quintet-meets-berri-says-seeking-israel-full-withdrawal	2025-03-11T03:05:10-07:00	
Reconstruction, disarming Hezbollah, and normalizing with Israel: Fact or myth	Although a new-appointed government has said the state should from now on be the sole bearer of arms after a 13-months-long war between Hezbollah and Israel, Deputy Prime Minister Tarek Mitri said the government would in no way disarm Hezbollah by force. 'It is not the time to take reckless risks that might take Lebanon backward, to many years ago,' Metri said Monday in a televised interview.	https://www.naharnet.com/stories/en/311533-reconstruction-disarming-hezbollah-and-normalizing-with-israel-fact-or-myth	2025-03-11T03:04:43-07:00	
Reconstruction, disarming Hezbollah, and normalizing with Israel: Fact or myth	Although a new-appointed government has said the state should from now on be the sole bearer of arms after a 13-months-long war between Hezbollah and Israel, Deputy Prime Minister Tarek Mitri said the government would in no way disarm Hezbollah by force. 'It is not the time to take reckless risks that might take Lebanon backward, to many years ago,' Metri said Monday in a televised interview.	https://naharnet.com/stories/en/311533-reconstruction-disarming-hezbollah-and-normalizing-with-israel-fact-or-myth	2025-03-11T03:04:43-07:00	
Israel to free Lebanese captives after Aoun pressure, US efforts	President Joseph Aoun held a meeting Tuesday in Baabda with the head of the ceasefire monitoring committee, U.S. General Jasper Jeffers, in the presence of U.S. Ambassador Lisa Johnson, ahead of a meeting for the committee in Naqoura, the Presidency said. 'President Aoun asked the committee chief to press Israel to implement the agreement, withdraw from the five hills and return the Lebanese captives,' the Presidency added.	https://www.naharnet.com/stories/en/311530-israel-to-free-lebanese-captives-after-aoun-pressure-us-efforts	2025-03-11T02:37:03-07:00	
Israel to free Lebanese captives after Aoun pressure, US efforts	President Joseph Aoun held a meeting Tuesday in Baabda with the head of the ceasefire monitoring committee, U.S. General Jasper Jeffers, in the presence of U.S. Ambassador Lisa Johnson, ahead of a meeting for the committee in Naqoura, the Presidency said. 'President Aoun asked the committee chief to press Israel to implement the agreement, withdraw from the five hills and return the Lebanese captives,' the Presidency added.	https://naharnet.com/stories/en/311530-israel-to-free-lebanese-captives-after-aoun-pressure-us-efforts	2025-03-11T02:37:03-07:00	
Israel to free captive Lebanese soldier after Lebanese-UNIFIL efforts	Israel will release a captive and wounded Lebanese soldier in the coming hours, following efforts carried out by the Lebanese state through the UNIFIL peacekeeping force, Al-Jadeed TV reported.	https://www.naharnet.com/stories/en/311530-israel-to-free-captive-lebanese-soldier-after-lebanese-unifil-efforts	2025-03-11T02:37:03-07:00	
Fear among Syrian Christians after deadly attacks	Members of Syria's small Christian community on the coast are living in fear after attacks killed more than 1,000 mostly Alawite civilians, with Christians reportedly caught up in the violence.	https://naharnet.com/stories/en/311529-fear-among-syrian-christians-after-deadly-attacks	2025-03-11T02:08:02-07:00	
Fear among Syrian Christians after deadly attacks	Members of Syria's small Christian community on the coast are living in fear after attacks killed more than 1,000 mostly Alawite civilians, with Christians reportedly caught up in the violence.	https://www.naharnet.com/stories/en/311529-fear-among-syrian-christians-after-deadly-attacks	2025-03-11T02:08:02-07:00	
Syrian presidency announces agreement to integrate Kurdish institutions	The Syrian presidency has announced an agreement with the head of the Kurdish-dominated Syrian Democratic Forces (SDF) to integrate the institutions of the autonomous Kurdish administration in the northeast into the national government.	https://naharnet.com/stories/en/311528-syrian-presidency-announces-agreement-to-integrate-kurdish-institutions	2025-03-11T02:04:33-07:00	
Syrian presidency announces agreement to integrate Kurdish institutions	The Syrian presidency has announced an agreement with the head of the Kurdish-dominated Syrian Democratic Forces (SDF) to integrate the institutions of the autonomous Kurdish administration in the northeast into the national government.	https://www.naharnet.com/stories/en/311528-syrian-presidency-announces-agreement-to-integrate-kurdish-institutions	2025-03-11T02:04:33-07:00	
Israel says struck Syrian air defenses to thwart 'future threats'	Israel's military said on Tuesday that its warplanes struck southern Syria overnight, targeting air defense systems and other military sites in the latest attack on the neighboring country.	https://naharnet.com/stories/en/311527-israel-says-struck-syrian-air-defenses-to-thwart-future-threats	2025-03-11T01:58:03-07:00	
Israel says struck Syrian air defenses to thwart 'future threats'	Israel's military said on Tuesday that its warplanes struck southern Syria overnight, targeting air defense systems and other military sites in the latest attack on the neighboring country.	https://www.naharnet.com/stories/en/311527-israel-says-struck-syrian-air-defenses-to-thwart-future-threats	2025-03-11T01:58:03-07:00	
Port probe back on track as Hajjar axes Oueidat ruling against Bitar	State Prosecutor Jamal al-Hajjar has re-allowed security and judicial authorities to cooperate with Beirut port blast investigator Judge Tarek Bitar, revoking ex-prosecutor Ghassan Oueidat’s ruling against him, state-run National News Agency reported on Monday.	https://naharnet.com/stories/en/311520-port-probe-back-on-track-as-hajjar-axes-oueidat-ruling-against-bitar	2025-03-10T07:17:17-07:00	
Port probe back on track as Hajjar axes Oueidat ruling against Bitar	State Prosecutor Jamal al-Hajjar has re-allowed security and judicial authorities to cooperate with Beirut port blast investigator Judge Tarek Bitar, revoking ex-prosecutor Ghassan Oueidat’s ruling against him, state-run National News Agency reported on Monday.	https://www.naharnet.com/stories/en/311520-port-probe-back-on-track-as-hajjar-axes-oueidat-ruling-against-bitar	2025-03-10T07:17:17-07:00	
Bassil says no religion allows 'bloodbath', calls for unity in Lebanon and Syria	Free Patriotic Movement chief Jebran Bassil has described the recent widespread clashes across Syria's coastal region, during which hundreds of civilians were killed, as a great danger not just to Syria 'but to Lebanon as well.' Bassil warned Sunday night against divisions in Lebanon, Syria, Iraq and Jordan and called for unity in the region's countries, praising the level of awareness of Tripoli's residents.	https://naharnet.com/stories/en/311519-bassil-says-no-religion-allows-bloodbath-calls-for-unity-in-lebanon-and-syria	2025-03-10T06:36:42-07:00	
Bassil says no religion allows 'bloodbath', calls for unity in Lebanon and Syria	Free Patriotic Movement chief Jebran Bassil has described the recent widespread clashes across Syria's coastal region, during which hundreds of civilians were killed, as a great danger not just to Syria 'but to Lebanon as well.' Bassil warned Sunday night against divisions in Lebanon, Syria, Iraq and Jordan and called for unity in the region's countries, praising the level of awareness of Tripoli's residents.	https://www.naharnet.com/stories/en/311519-bassil-says-no-religion-allows-bloodbath-calls-for-unity-in-lebanon-and-syria	2025-03-10T06:36:42-07:00	
Bassil says no religion allows 'bloodbath', calls for unity in Lebanon, Syria	Free Patriotic Movement chief Jebran Bassil has described the recent widespread clashes across Syria's coastal region, during which hundreds of civilians were killed, as a great danger not just to Syria 'but to Lebanon as well.' Bassil warned Sunday night against divisions in Lebanon, Syria, Iraq and Jordan and called for unity in the region's countries, praising the level of awareness of Tripoli's residents.	https://www.naharnet.com/stories/en/311519-bassil-says-no-religion-allows-bloodbath-calls-for-unity-in-lebanon-syria	2025-03-10T06:36:42-07:00	
Lebanon must 'break free from Iran', Israel FM tells UN envoy	Meeting with the visiting U.N. Special Coordinator for Lebanon, Israeli Foreign Minister Gideon Saar has stresses the need for Lebanon to free itself from perceived Iranian influence.	https://naharnet.com/stories/en/311518-lebanon-must-break-free-from-iran-israel-fm-tells-un-envoy	2025-03-10T06:34:24-07:00	
Lebanon must 'break free from Iran', Israel FM tells UN envoy	Meeting with the visiting U.N. Special Coordinator for Lebanon, Israeli Foreign Minister Gideon Saar has stresses the need for Lebanon to free itself from perceived Iranian influence.	https://www.naharnet.com/stories/en/311518-lebanon-must-break-free-from-iran-israel-fm-tells-un-envoy	2025-03-10T06:34:24-07:00	
Syria announces end to 'military operation' after mass killings	Syria's interim government on Monday announced the end of a days-long military operation against insurgents loyal to ousted president Bashar Assad and his family in the worst fighting since the end of the 13-year civil war in December. The Defense Ministry's announcement comes after a surprise attack by gunmen from the Alawite community on a police patrol near the port city of Lattakia Thursday spiraled into widespread clashes across Syria's coastal region, during which monitoring groups said hundreds of civilians were killed.	https://naharnet.com/stories/en/311517-syria-announces-end-to-military-operation-after-mass-killings	2025-03-10T06:12:57-07:00	
Syria announces end to 'military operation' after mass killings	Syria's interim government on Monday announced the end of a days-long military operation against insurgents loyal to ousted president Bashar Assad and his family in the worst fighting since the end of the 13-year civil war in December. The Defense Ministry's announcement comes after a surprise attack by gunmen from the Alawite community on a police patrol near the port city of Lattakia Thursday spiraled into widespread clashes across Syria's coastal region, during which monitoring groups said hundreds of civilians were killed.	https://www.naharnet.com/stories/en/311517-syria-announces-end-to-military-operation-after-mass-killings	2025-03-10T06:12:57-07:00	
Syria announces end of operation against Assad 'regime remnants'	Syria's interim government on Monday announced the end of a days-long military operation against insurgents loyal to ousted president Bashar Assad and his family in the worst fighting since the end of the 13-year civil war in December. The Defense Ministry's announcement comes after a surprise attack by gunmen from the Alawite community on a police patrol near the port city of Lattakia Thursday spiraled into widespread clashes across Syria's coastal region, during which monitoring groups said hundreds of civilians were killed.	https://www.naharnet.com/stories/en/311517-syria-announces-end-of-operation-against-assad-regime-remnants	2025-03-10T06:12:57-07:00	
Cautious calm in al-Aqbiyeh after Lebanese-Syrian clash	Cautious calm was on Monday engulfing the southern coastal town of al-Aqbiyeh after a clash between Lebanese citizens and Syrian nationals on Sunday, the National News Agency said.	https://naharnet.com/stories/en/311515-cautious-calm-in-al-aqbiyeh-after-lebanese-syrian-clash	2025-03-10T06:09:16-07:00	
Cautious calm in al-Aqbiyeh after Lebanese-Syrian clash	Cautious calm was on Monday engulfing the southern coastal town of al-Aqbiyeh after a clash between Lebanese citizens and Syrian nationals on Sunday, the National News Agency said.	https://www.naharnet.com/stories/en/311515-cautious-calm-in-al-aqbiyeh-after-lebanese-syrian-clash	2025-03-10T06:09:16-07:00	
Rajji from Jordan: Syria stability very important for Lebanon stability	Foreign Minister Youssef Rajji took part in a meeting in Jordan for Syria’s neighbors during which the conferees discussed how to assist the Syrian people in rebuilding their country in a manner that guarantees its unity, sovereignty, security and stability.	https://naharnet.com/stories/en/311514-rajji-from-jordan-syria-stability-very-important-for-lebanon-stability	2025-03-10T05:52:08-07:00	
Rajji from Jordan: Syria stability very important for Lebanon stability	Foreign Minister Youssef Rajji took part in a meeting in Jordan for Syria’s neighbors during which the conferees discussed how to assist the Syrian people in rebuilding their country in a manner that guarantees its unity, sovereignty, security and stability.	https://www.naharnet.com/stories/en/311514-rajji-from-jordan-syria-stability-very-important-for-lebanon-stability	2025-03-10T05:52:08-07:00	
Thousands of Syrians flee to Lebanon after massacres in coastal region	Thousands of Syrians from the unrest-hit coastal area have fled to neighboring Lebanon, mostly through unofficial crossings, after around 1,000 people were killed there in clashes and massacres, mostly civilians. The U.N. refugee agency said in a statement that according to local authorities, 6,078 people have arrived in about a dozen villages in northern Lebanon's Akkar province fleeing the fighting and mass killings, while arrivals in other parts of the country were still being verified.	https://naharnet.com/stories/en/311513-thousands-of-syrians-flee-to-lebanon-after-massacres-in-coastal-region	2025-03-10T05:29:04-07:00	
Thousands of Syrians flee to Lebanon after massacres in coastal region	Thousands of Syrians from the unrest-hit coastal area have fled to neighboring Lebanon, mostly through unofficial crossings, after around 1,000 people were killed there in clashes and massacres, mostly civilians. The U.N. refugee agency said in a statement that according to local authorities, 6,078 people have arrived in about a dozen villages in northern Lebanon's Akkar province fleeing the fighting and mass killings, while arrivals in other parts of the country were still being verified.	https://www.naharnet.com/stories/en/311513-thousands-of-syrians-flee-to-lebanon-after-massacres-in-coastal-region	2025-03-10T05:29:04-07:00	
Israel takes captive a wounded Lebanese soldier	Israel took captive an off-duty Lebanese soldier after he was wounded Sunday in a combing operation in the southern border town of Kfarshouba, the Al-Arabiya TV network reported on Monday.	https://www.naharnet.com/stories/en/311512-israel-takes-captive-a-wounded-lebanese-soldier	2025-03-10T05:20:46-07:00	
Qassem says state in charge of defense but Hezbollah to stay as 'resistance'	Hezbollah chief Sheikh Naim Qassem has acknowledged that arms should be exclusively in the hands of the Lebanese Army and Internal Security Forces to 'control security in Lebanon and for defense.'	https://www.naharnet.com/stories/en/311511-qassem-says-state-in-charge-of-defense-but-hezbollah-to-stay-as-resistance	2025-03-10T05:10:08-07:00	
