Title	Description	Link	pubDate	Image
Berri reportedly dismayed by Syria border clashes	Speaker Nabih Berri was 'dismayed' by the latest clashes on the Lebanese-Syrian border, fearing that they 'may turn into a sectarian war, whereas they are a conflict over smuggling routes in the first place,' a media report said.	https://www.naharnet.com/stories/en/311704-berri-reportedly-dismayed-by-syria-border-clashes	2025-03-18T05:31:07-07:00	
Netanyahu's party says far-right faction to rejoin Israel government	The far-right Otzma Yehudit party, headed by firebrand politician Itamar Ben-Gvir, will rejoin the Israeli government, a statement from Prime Minister Benjamin Netanyahu's Likud movement said on Tuesday. 'Likud and Otzma Yehudit have agreed that the Otzma Yehudit faction will return to the Israeli government today, and the ministers of Otzma Yehudit will return to the government,' said the statement, issued after the deadliest Israeli strikes on Gaza since a January ceasefire. Otzma Yehudit, meaning Jewish power, resigned in January in protest at the truce.	https://www.naharnet.com/stories/en/311703-netanyahu-s-party-says-far-right-faction-to-rejoin-israel-government	2025-03-18T05:28:33-07:00	
Report: No reconstruction without removing Hezbollah arms	The U.S., influential Western countries and most Arab nations have said that there will no funds for reconstructing the Israeli-destroyed areas in Lebanon amid the presence of 'arms outside the state’s arms,' in reference to Hezbollah’s weapons, a media report said.	https://www.naharnet.com/stories/en/311702-report-no-reconstruction-without-removing-hezbollah-arms	2025-03-18T05:11:08-07:00	
Report: Syrian forces advance in border town's Lebanese part, displacing hundreds	Armed forces belonging to Syria’s new administration made a five-kilometer incursion at 2am Tuesday into the Lebanese part of the border town of Hawsh al-Sayyed Ali and continued their advance in the morning, the town’s Lebanese mayor Ali Nassereddine said.	https://www.naharnet.com/stories/en/311701-report-syrian-forces-advance-in-border-town-s-lebanese-part-displacing-hundreds	2025-03-18T04:21:08-07:00	
Report: Syrian forces advance in border town's Lebanese part, displacing hundreds	Armed forces belonging to Syria’s new administration made a five-kilometer incursion at 2am Tuesday into the Lebanese part of the border town of Hawsh al-Sayyed Ali and continued their advance in the morning, the town’s Lebanese mayor Ali Nassereddine said.	https://naharnet.com/stories/en/311701-report-syrian-forces-advance-in-border-town-s-lebanese-part-displacing-hundreds	2025-03-18T04:21:08-07:00	
Israel says to fight on in Gaza for 'as long as hostages are not returned'	Israel will fight on in Gaza for 'as long as the hostages are not returned', Defense Minister Israel Katz said Tuesday after Israel resumed air strikes on the battered territory. 'We will not stop fighting as long as the hostages are not returned home and all our war aims are not achieved,' Katz said. Apart from the release of the remaining hostages, Israel's other main war aim is to crush Hamas.	https://www.naharnet.com/stories/en/311696-israel-says-to-fight-on-in-gaza-for-as-long-as-hostages-are-not-returned	2025-03-18T03:26:12-07:00	
Hamas official says movement 'working with mediators to curb' Israel 'aggression'	A Hamas official told AFP Tuesday that the group was 'working with mediators to curb the aggression', after Israel unleashed its deadliest strikes since a ceasefire took effect in January. 'Hamas adhered to the ceasefire agreement and implemented it precisely, but the Israeli occupation reneged on its commitment and reversed it by resuming aggression and war,' the official told AFP, adding that 'Hamas and the resistance factions are in constant session to assess the situation and working with mediators to curb the aggression.' So far, Hamas has not responded to the Israeli strikes.	https://www.naharnet.com/stories/en/311695-hamas-official-says-movement-working-with-mediators-to-curb-israel-aggression	2025-03-18T03:24:26-07:00	
Professor deported from US back in Lebanon	A Lebanese professor is back in her home country after she was expelled from the United States for attending the funeral of Hezbollah chief Sayyed Hassan Nasrallah during a trip to Beirut, her family told AFP Tuesday. Rasha Alawieh, a kidney transplant specialist and professor at the Ivy League Brown University, was detained on Thursday at Logan International Airport in Boston and deported the following day, US media reported.	https://naharnet.com/stories/en/311694-professor-deported-from-us-back-in-lebanon	2025-03-18T03:21:50-07:00	
Professor deported from US back in Lebanon	A Lebanese professor is back in her home country after she was expelled from the United States for attending the funeral of Hezbollah chief Sayyed Hassan Nasrallah during a trip to Beirut, her family told AFP Tuesday. Rasha Alawieh, a kidney transplant specialist and professor at the Ivy League Brown University, was detained on Thursday at Logan International Airport in Boston and deported the following day, US media reported.	https://www.naharnet.com/stories/en/311694-professor-deported-from-us-back-in-lebanon	2025-03-18T03:21:50-07:00	
Hamas says head of its government in Gaza killed in Israeli strike	Hamas on Tuesday named the head of its government in the Gaza Strip, Essam al-Dalis, among a list of officials it said were killed in a wave of Israeli strikes on the Palestinian territory. 'These leaders, along with their families, were martyred after being directly targeted by the Zionist occupation forces' aircraft,' said the Hamas statement, which also named interior ministry head Mahmud Abu Watfa and Bahjat Abu Sultan, director-general of the internal security service, among those killed.	https://www.naharnet.com/stories/en/311693-hamas-says-head-of-its-government-in-gaza-killed-in-israeli-strike	2025-03-18T03:13:25-07:00	
Calm returns after clashes involving Palestinian camp and northern town	Cautious calm was on Tuesday engulfing the al-Beddawi Palestinian refugee camp and the neighboring northern town of Wadi al-Nahleh near Tripoli following overnight clashes that lasted until dawn, the National News Agency said.	https://naharnet.com/stories/en/311692-calm-returns-after-clashes-involving-palestinian-camp-and-northern-town	2025-03-18T02:50:27-07:00	
Calm returns after clashes involving Palestinian camp and northern town	Cautious calm was on Tuesday engulfing the al-Beddawi Palestinian refugee camp and the neighboring northern town of Wadi al-Nahleh near Tripoli following overnight clashes that lasted until dawn, the National News Agency said.	https://www.naharnet.com/stories/en/311692-calm-returns-after-clashes-involving-palestinian-camp-and-northern-town	2025-03-18T02:50:27-07:00	
Appointment of central bank chief delayed amid 'Aoun-Salam disagreement'	Cabinet failed Monday to approve a mechanism for administrative appointments, deciding to continue discussions in Thursday’s session, which had been dedicated to naming a new central bank governor, a media report said.	https://naharnet.com/stories/en/311691-appointment-of-central-bank-chief-delayed-amid-aoun-salam-disagreement	2025-03-18T02:19:19-07:00	
Appointment of central bank chief delayed amid 'Aoun-Salam disagreement'	Cabinet failed Monday to approve a mechanism for administrative appointments, deciding to continue discussions in Thursday’s session, which had been dedicated to naming a new central bank governor, a media report said.	https://www.naharnet.com/stories/en/311691-appointment-of-central-bank-chief-delayed-amid-aoun-salam-disagreement	2025-03-18T02:19:19-07:00	
Israel resumes war on Gaza: Latest developments	Israel launched a wave of airstrikes across the Gaza Strip early Tuesday, saying it was hitting Hamas targets in its heaviest assault in the territory since a ceasefire took effect in January.	https://www.naharnet.com/stories/en/311690-israel-resumes-war-on-gaza-latest-developments	2025-03-18T02:02:56-07:00	
Houthis claim new attack on American warships, report new US strikes	Yemen's Houthis on Tuesday claimed their third attack on American warships in 48 hours, despite U.S. strikes on the Iran-backed rebels that have sparked mass protests organized by the group. The rebels also condemned Israel's wave of strikes on Gaza, which the health ministry in the Hamas-run territory said killed at least 330 people, vowing to escalate their own operations in support of ally Hamas.	https://www.naharnet.com/stories/en/311689-houthis-claim-new-attack-on-american-warships-report-new-us-strikes	2025-03-18T01:11:23-07:00	
Netanyahu's move to fire security agency chief threatens new crisis in Israel	Prime Minister Benjamin Netanyahu's bid to dismiss a top security official has threatened to plunge Israel back into deep political crisis, with opponents on Monday organizing protests and a former court president warning against the 'dangerous' move. Netanyahu on Sunday cited an 'ongoing lack of trust' as the reason for moving to sack Ronen Bar, head of the Shin Bet internal security agency, following a similar bid by the government to oust the attorney general.	https://www.naharnet.com/stories/en/311688-netanyahu-s-move-to-fire-security-agency-chief-threatens-new-crisis-in-israel	2025-03-18T01:07:25-07:00	
China urges steps to prevent 'humanitarian disaster' in Gaza	China is highly concerned about the current situation between Israel and Palestine,' foreign ministry spokeswoman Mao Ning said, calling for the parties to 'avoid any actions that could lead to an escalation of the situation, and prevent a larger-scale humanitarian disaster.'	https://www.naharnet.com/stories/en/311687-china-urges-steps-to-prevent-humanitarian-disaster-in-gaza	2025-03-18T01:05:30-07:00	
Israel army warns Gaza residents to evacuate areas near border	In a post on X, Israeli military spokesman Avichay Adraee issued a warning to residents 'specifically in the neighborhoods of Beit Hanoun, Khirbet Khuza'a, Abasan al-Kabira and Al-Jadida'. 'These designated areas are considered dangerous combat zones... For your own safety, you must evacuate immediately to the known shelters in western Gaza City and those in Khan Yunis,' the post said.	https://www.naharnet.com/stories/en/311686-israel-army-warns-gaza-residents-to-evacuate-areas-near-border	2025-03-18T01:03:38-07:00	
Trump says Iran 'will be held responsible' for Houthi attacks	U.S. President Donald Trump has declared that he will hold Iran directly responsible for any future attacks by Yemen's Tehran-backed Houthi rebels, who have targeted U.S. and other foreign ships in the Red Sea.	https://www.naharnet.com/stories/en/311685-trump-says-iran-will-be-held-responsible-for-houthi-attacks	2025-03-18T00:55:57-07:00	
Yemen's Houthis condemn Israel strikes on Gaza, vow escalation	Yemen's Houthi rebels condemned on Tuesday Israel's wave of strikes on Gaza, vowing to escalate its own operations in support of its ally Hamas after threatening to renew attacks on Israeli shipping in the Red Sea.	https://www.naharnet.com/stories/en/311684-yemen-s-houthis-condemn-israel-strikes-on-gaza-vow-escalation	2025-03-18T00:53:19-07:00	
Special Coordinator for Lebanon voices 'cautious optimism' as she briefs Security Council	Cautious optimism, Madam President, is the flavor of the day' -- these were the words of the U.N. Special Coordinator for Lebanon, Jeanine Hennis-Plasschaert, who briefed the United Nations Security Council on the implementation of resolution 1701. She used them to synopsize the recent government formation process in Lebanon, welcoming both the 'promising ministerial agenda' adopted, while noting that Lebanon’s protracted leadership vacuum had left the country’s new administration with just over one year to tackle a series of daunting challenges. Speaking alongside Under-Secretary-General for Peace Operations Jean-Pierre Lacroix, the Special Coordinator provided the Council with an overview of the security situation in the country. While noting that the cessation of hostilities continued to hold, she added that this did not mean that all military activity on Lebanese territory had ceased.	https://naharnet.com/stories/en/311683-special-coordinator-for-lebanon-voices-cautious-optimism-as-she-briefs-security-council	2025-03-18T00:49:05-07:00	
Special Coordinator for Lebanon voices 'cautious optimism' as she briefs Security Council	Cautious optimism, Madam President, is the flavor of the day' -- these were the words of the U.N. Special Coordinator for Lebanon, Jeanine Hennis-Plasschaert, who briefed the United Nations Security Council on the implementation of resolution 1701. She used them to synopsize the recent government formation process in Lebanon, welcoming both the 'promising ministerial agenda' adopted, while noting that Lebanon’s protracted leadership vacuum had left the country’s new administration with just over one year to tackle a series of daunting challenges. Speaking alongside Under-Secretary-General for Peace Operations Jean-Pierre Lacroix, the Special Coordinator provided the Council with an overview of the security situation in the country. While noting that the cessation of hostilities continued to hold, she added that this did not mean that all military activity on Lebanese territory had ceased.	https://www.naharnet.com/stories/en/311683-special-coordinator-for-lebanon-voices-cautious-optimism-as-she-briefs-security-council	2025-03-18T00:49:05-07:00	
Israel resumes its war on Gaza, killing at least 330	Israel vowed on Tuesday to continue fighting in Gaza until the return of all hostages as it unleashed its most intense strikes since a ceasefire, with the health ministry in the Hamas-run territory reporting more than 330 people killed. Hamas accused Israeli Prime Minister Benjamin Netanyahu of deciding to 'resume war' after a deadlock on extending the truce, and warned that the return to fighting could be a 'death sentence' for hostages still alive in Gaza.	https://www.naharnet.com/stories/en/311682-israel-resumes-its-war-on-gaza-killing-at-least-330	2025-03-17T22:57:29-07:00	
Israel resumes its war on Gaza, killing at least 220	Israel on Tuesday unleashed its most intense strikes on the Gaza Strip since a January ceasefire, with rescuers reporting 220 people killed, and Hamas accusing Benjamin Netanyahu of deciding to 'resume war' after a deadlock on extending the truce. The White House confirmed that Israel consulted U.S. President Donald Trump's administration before launching the wave of strikes, which rescuers said killed mostly women, children and elderly.	https://www.naharnet.com/stories/en/311682-israel-resumes-its-war-on-gaza-killing-at-least-220	2025-03-17T22:57:29-07:00	
3 dead, 14 hurt as Israel strikes south Syria	Israeli strikes hit several sites in southern Syria overnight, including in the city of Daraa. The Israeli military said it was hitting 'command centers and military sites containing weapons and military vehicles belonging to the old Syrian regime, which (the new army) are trying to make reusable.'	https://www.naharnet.com/stories/en/311681-3-dead-14-hurt-as-israel-strikes-south-syria	2025-03-17T22:52:08-07:00	
US says professor deported to Lebanon with valid visa supported Nasrallah	U.S. Homeland Security officials said that a doctor from Lebanon who was deported over the weekend despite having a U.S. visa 'openly admitted' to supporting slain Hezbollah leader Sayyed Hassan Nasrallah and attending his funeral. The department's statement, posted on social media, provides a possible explanation for Dr. Rasha Alawieh's deportation, which has sparked widespread alarm in the U.S., especially after a federal judge ordered that she not be removed until a hearing could be held. Government lawyers have said customs officials did not get word until after Alawieh was sent back to Lebanon.	https://naharnet.com/stories/en/311680-us-says-professor-deported-to-lebanon-with-valid-visa-supported-nasrallah	2025-03-17T22:42:25-07:00	
US says professor deported to Lebanon with valid visa supported Nasrallah	U.S. Homeland Security officials said that a doctor from Lebanon who was deported over the weekend despite having a U.S. visa 'openly admitted' to supporting slain Hezbollah leader Sayyed Hassan Nasrallah and attending his funeral. The department's statement, posted on social media, provides a possible explanation for Dr. Rasha Alawieh's deportation, which has sparked widespread alarm in the U.S., especially after a federal judge ordered that she not be removed until a hearing could be held. Government lawyers have said customs officials did not get word until after Alawieh was sent back to Lebanon.	https://www.naharnet.com/stories/en/311680-us-says-professor-deported-to-lebanon-with-valid-visa-supported-nasrallah	2025-03-17T22:42:25-07:00	
Ceasefire' agreed after 7 Lebanese killed and 52 hurt in Syria border clashes	The Lebanese health ministry says at least seven people were killed and 52 wounded in clashes on the border with Syria that erupted on Sunday night.	https://naharnet.com/stories/en/311679-ceasefire-agreed-after-7-lebanese-killed-and-52-hurt-in-syria-border-clashes	2025-03-17T22:26:49-07:00	
Ceasefire' agreed after 7 Lebanese killed and 52 hurt in Syria border clashes	The Lebanese health ministry said at least seven people were killed and 52 wounded in clashes on the border with Syria that erupted on Sunday night.	https://www.naharnet.com/stories/en/311679-ceasefire-agreed-after-7-lebanese-killed-and-52-hurt-in-syria-border-clashes	2025-03-17T22:26:49-07:00	
Overnight Israeli strikes target West Bekaa and South	Israeli airstrikes overnight targeted three areas in West Bekaa and the outskirts of Deir Mimas in the South. The Israeli military said it 'struck Hezbollah military sites in which Hezbollah terrorists and weapons were identified.'	https://naharnet.com/stories/en/311678-overnight-israeli-strikes-target-west-bekaa-and-south	2025-03-17T22:18:20-07:00	
Overnight Israeli strikes target West Bekaa and South	Israeli airstrikes overnight targeted three areas in West Bekaa and the outskirts of Deir Mimas in the South. The Israeli military said it 'struck Hezbollah military sites in which Hezbollah terrorists and weapons were identified.'	https://www.naharnet.com/stories/en/311678-overnight-israeli-strikes-target-west-bekaa-and-south	2025-03-17T22:18:20-07:00	
Aoun orders army to respond to fire from Syria	President Joseph Aoun said that the Lebanese Army would respond to incoming fire from neighboring Syria that authorities said had killed a child. Clashes broke out late Sunday at the Syrian-Lebanese border, with the new authorities in Damascus accusing Hezbollah of abducting three soldiers into Lebanon and killing them.	https://naharnet.com/stories/en/311677-aoun-orders-army-to-respond-to-fire-from-syria	2025-03-17T22:11:09-07:00	
Aoun orders army to respond to fire from Syria	President Joseph Aoun said that the Lebanese Army would respond to incoming fire from neighboring Syria that authorities said had killed a child. Clashes broke out late Sunday at the Syrian-Lebanese border, with the new authorities in Damascus accusing Hezbollah of abducting three soldiers into Lebanon and killing them.	https://www.naharnet.com/stories/en/311677-aoun-orders-army-to-respond-to-fire-from-syria	2025-03-17T22:11:09-07:00	
US, Houthis both vow escalation after US airstrikes target Yemen	The United States and Iran-backed Houthi rebels in Yemen are both vowing escalation after the U.S. launched airstrikes to deter the rebels from attacking military and commercial vessels on one of the world's busiest shipping corridors. The Houthi-run Health Ministry said the U.S. strikes killed at least 53 people, including five women and two children, and wounded almost 100 in the capital of Sanaa and other provinces, including Saada, the rebels' stronghold on the border with Saudi Arabia.	https://www.naharnet.com/stories/en/311670-us-houthis-both-vow-escalation-after-us-airstrikes-target-yemen	2025-03-17T08:19:00-07:00	
Lebanese Doctor with valid U.S. visa deported to Lebanon	A federal judge wants to know why a doctor from Lebanon with a U.S. visa was deported, after he ordered that she not be removed until he could hear her case. Dr. Rasha Alawieh, 34, had been granted the visa on March 11 and arrived at Boston Logan International Airport on Thursday, according to a complaint filed on her behalf by a cousin in federal court.	https://www.naharnet.com/stories/en/311669-lebanese-doctor-with-valid-u-s-visa-deported-to-lebanon	2025-03-17T08:10:33-07:00	
Lebanese Doctor with valid U.S. visa deported to Lebanon	A federal judge wants to know why a doctor from Lebanon with a U.S. visa was deported, after he ordered that she not be removed until he could hear her case. Dr. Rasha Alawieh, 34, had been granted the visa on March 11 and arrived at Boston Logan International Airport on Thursday, according to a complaint filed on her behalf by a cousin in federal court.	https://naharnet.com/stories/en/311669-lebanese-doctor-with-valid-u-s-visa-deported-to-lebanon	2025-03-17T08:10:33-07:00	
What to know about Yemen's Houthi rebels	The United States under President Donald Trump has launched a new campaign of intense airstrikes targeting Yemen's Houthi rebels. This weekend's strikes killed at least 53 people, including children, and wounded others. The campaign is likely to continue, part of a wider pressure campaign by Trump now targeting the Houthis' main benefactor, Iran, as well.	https://www.naharnet.com/stories/en/311660-what-to-know-about-yemen-s-houthi-rebels	2025-03-17T05:13:03-07:00	
Netanyahu seeks to dismiss internal security chief as power struggle boils over	Israeli Prime Minister Benjamin Netanyahu has said he will seek to dismiss the head of the internal security service this week, deepening a power struggle focused largely on who bears responsibility for the Hamas attack that sparked the war in Gaza. Netanyahu's effort to remove Ronen Bar as director of the Shin Bet comes as the security service investigates close aides of the prime minister. Netanyahu said he has had 'ongoing distrust' with Bar, and 'this distrust has grown over time.'	https://www.naharnet.com/stories/en/311659-netanyahu-seeks-to-dismiss-internal-security-chief-as-power-struggle-boils-over	2025-03-17T05:11:57-07:00	
Netanyahu seeks to dismiss Israel's internal security chief as power struggle boils over	Israeli Prime Minister Benjamin Netanyahu has said he will seek to dismiss the head of the internal security service this week, deepening a power struggle focused largely on who bears responsibility for the Hamas attack that sparked the war in Gaza. Netanyahu's effort to remove Ronen Bar as director of the Shin Bet comes as the security service investigates close aides of the prime minister. Netanyahu said he has had 'ongoing distrust' with Bar, and 'this distrust has grown over time.'	https://www.naharnet.com/stories/en/311659-netanyahu-seeks-to-dismiss-israel-s-internal-security-chief-as-power-struggle-boils-over	2025-03-17T05:11:57-07:00	
Jaber: Government will not write off deposits	The government will not resort to writing off deposits but will rather adopt an organized mechanism for returning them gradually, Finance Minister Yassine Jaber has said.	https://naharnet.com/stories/en/311656-jaber-government-will-not-write-off-deposits	2025-03-17T04:43:38-07:00	
Jaber: Government will not write off deposits	The government will not resort to writing off deposits but will rather adopt an organized mechanism for returning them gradually, Finance Minister Yassine Jaber has said.	https://www.naharnet.com/stories/en/311656-jaber-government-will-not-write-off-deposits	2025-03-17T04:43:38-07:00	
One killed in Israeli drone strike in Yohmor al-Shaqif	An Israeli drone strike killed one person and wounded three others Monday in the southern town of Yohmor al-Shaqif in the Nabatieh governorate, the Health Ministry and the National News Agency said.	https://naharnet.com/stories/en/311655-one-killed-in-israeli-drone-strike-in-yohmor-al-shaqif	2025-03-17T04:33:10-07:00	
One killed in Israeli drone strike in Yohmor al-Shaqif	An Israeli drone strike killed one person and wounded three others Monday in the southern town of Yohmor al-Shaqif in the Nabatieh governorate, the Health Ministry and the National News Agency said.	https://www.naharnet.com/stories/en/311655-one-killed-in-israeli-drone-strike-in-yohmor-al-shaqif	2025-03-17T04:33:10-07:00	
Reports: Two Lebanese slaughtered after being abducted by Syrian forces	Lebanese young men M. N. M. and A. N. M. were killed after being abducted by Syrian general security forces from their home in the al-Fadliyeh area in Lebanese territory, Annahar newspaper reported on Monday.	https://www.naharnet.com/stories/en/311654-reports-two-lebanese-slaughtered-after-being-abducted-by-syrian-forces	2025-03-17T04:04:57-07:00	
Reports: Two Lebanese slaughtered after being abducted by Syrian forces	Lebanese young men M. N. M. and A. N. M. were killed after being abducted by Syrian general security forces from their home in the al-Fadliyeh area in Lebanese territory, Annahar newspaper reported on Monday.	https://naharnet.com/stories/en/311654-reports-two-lebanese-slaughtered-after-being-abducted-by-syrian-forces	2025-03-17T04:04:57-07:00	
Bassil: Abolition of political sectarianism is an elimination of Lebanon's Christians	Free Patriotic Movement chief Jebran Bassil has noted that the FPM supports the abolition of sectarianism, 'but not political sectarianism alone.'	https://www.naharnet.com/stories/en/311653-bassil-abolition-of-political-sectarianism-is-an-elimination-of-lebanon-s-christians	2025-03-17T03:54:17-07:00	
