Title	Description	Link	pubDate	Image
US and Israel look to Africa for resettling Palestinians uprooted from Gaza	The U.S. and Israel have reached out to officials of three East African governments to discuss using their territories as potential destinations for resettling Palestinians uprooted from the Gaza Strip under President Donald Trump's proposed postwar plan, American and Israeli officials say. The contacts with Sudan, Somalia and the breakaway region of Somalia known as Somaliland reflect the determination by the U.S. and Israel to press ahead with a plan that has been widely condemned and raised serious legal and moral issues. Because all three places are poor, and in some cases wracked by violence, the proposal also casts doubt on Trump's stated goal of resettling Gaza's Palestinians in a 'beautiful area.'	https://www.naharnet.com/stories/en/311610-us-and-israel-look-to-africa-for-resettling-palestinians-uprooted-from-gaza	2025-03-14T03:21:26-07:00	
Netanyahu says Israel 'won't give up' 5 hills in Lebanon	Israeli Prime Minister Benjamin Netanyahu has said that Israel 'will not give up' the five hills deemed 'strategic' it occupies in south Lebanon.	https://naharnet.com/stories/en/311609-netanyahu-says-israel-won-t-give-up-5-hills-in-lebanon	2025-03-14T03:06:59-07:00	
Netanyahu says Israel 'won't give up' 5 hills in Lebanon	Israeli Prime Minister Benjamin Netanyahu has said that Israel 'will not give up' the five hills deemed 'strategic' it occupies in south Lebanon.	https://www.naharnet.com/stories/en/311609-netanyahu-says-israel-won-t-give-up-5-hills-in-lebanon	2025-03-14T03:06:59-07:00	
Who is Haykal, Lebanon's new army chief?	Lebanon named a new head of the armed forces Thursday to succeed Joseph Aoun, who was appointed president earlier this year. 'Brigadier General Rodolphe Haykal was named commander in chief of the armed forces,' Minister of Information Paul Morcos said after a cabinet meeting, also confirming a number of other security appointments.	https://naharnet.com/stories/en/311607-who-is-haykal-lebanon-s-new-army-chief	2025-03-14T02:12:25-07:00	
Who is Haykal, Lebanon's new army chief?	Lebanon named a new head of the armed forces Thursday to succeed Joseph Aoun, who was appointed president earlier this year. 'Brigadier General Rodolphe Haykal was named commander in chief of the armed forces,' Minister of Information Paul Morcos said after a cabinet meeting, also confirming a number of other security appointments.	https://www.naharnet.com/stories/en/311607-who-is-haykal-lebanon-s-new-army-chief	2025-03-14T02:12:25-07:00	
IMF welcomes new govt request for help on ailing economy	The International Monetary Fund on Thursday welcomed the new Lebanese government's request for support in addressing severe economic challenges. Lebanon in January elected a new president after a more than two-year vacuum, and then formed a government led by Prime Minister Nawaf Salam. In February the IMF said it was open to a new loan agreement with the country following discussions with its recently-appointed finance minister.	https://www.naharnet.com/stories/en/311606-imf-welcomes-new-govt-request-for-help-on-ailing-economy	2025-03-14T02:07:09-07:00	
Israel says hit Hezbollah arms facility in Beqaa strike	A short while ago, the IDF (military) conducted a strike on infrastructure at a site used by Hezbollah for manufacturing and storing strategic weapons in the Beqaa area in Lebanon,' the military said in a statement.	https://www.naharnet.com/stories/en/311605-israel-says-hit-hezbollah-arms-facility-in-beqaa-strike	2025-03-14T02:04:51-07:00	
Syria leader signs constitutional declaration, hailing 'new history'	Syria's interim President Ahmad al-Sharaa on Thursday signed the country's constitutional declaration, which will be enforced throughout a five-year transitional period. Sharaa said he hoped the constitutional declaration would mark the start of 'a new history for Syria, where we replace oppression with justice', as he signed the document setting out the transitional period.	https://naharnet.com/stories/en/311596-syria-leader-signs-constitutional-declaration-hailing-new-history	2025-03-13T05:24:57-07:00	
Syria leader signs constitutional declaration, hailing 'new history'	Syria's interim President Ahmad al-Sharaa on Thursday signed the country's constitutional declaration, which will be enforced throughout a five-year transitional period. Sharaa said he hoped the constitutional declaration would mark the start of 'a new history for Syria, where we replace oppression with justice', as he signed the document setting out the transitional period.	https://www.naharnet.com/stories/en/311596-syria-leader-signs-constitutional-declaration-hailing-new-history	2025-03-13T05:24:57-07:00	
Aid or division attempt? Israel sends food to Syria’s Druze	Israel says it has sent 10,000 packages of food aid to Syria’s Druze, as it seeks to forge ties with the minority to shape the country’s troubled transition from civil war. The Israeli Foreign Ministry said Thursday that the operation was conducted in recent weeks in coordination with local Druze leaders, with most of the aid delivered to the overwhelmingly Druze southern region of Sweida.	https://naharnet.com/stories/en/311593-aid-or-division-attempt-israel-sends-food-to-syria-s-druze	2025-03-13T05:17:13-07:00	
Aid or division attempt? Israel sends food to Syria’s Druze	Israel says it has sent 10,000 packages of food aid to Syria’s Druze, as it seeks to forge ties with the minority to shape the country’s troubled transition from civil war. The Israeli Foreign Ministry said Thursday that the operation was conducted in recent weeks in coordination with local Druze leaders, with most of the aid delivered to the overwhelmingly Druze southern region of Sweida.	https://www.naharnet.com/stories/en/311593-aid-or-division-attempt-israel-sends-food-to-syria-s-druze	2025-03-13T05:17:13-07:00	
Emirati diplomat with letter from Trump meets with Iran's FM	An Emirati diplomat earlier identified by Tehran as carrying a letter from U.S. President Donald Trump seeking to jump-start talks over Iran's rapidly advancing nuclear program met Wednesday with Iran's foreign minister in the Iranian capital. It is unclear how Iran will react to the letter, which Trump revealed during a television interview last week. Its intended recipient, Supreme Leader Ayatollah Ali Khamenei, has said he's not interested in talks with a 'bullying government.'	https://naharnet.com/stories/en/311592-emirati-diplomat-with-letter-from-trump-meets-with-iran-s-fm	2025-03-13T05:12:15-07:00	
Emirati diplomat with letter from Trump meets with Iran's FM	An Emirati diplomat earlier identified by Tehran as carrying a letter from U.S. President Donald Trump seeking to jump-start talks over Iran's rapidly advancing nuclear program met Wednesday with Iran's foreign minister in the Iranian capital. It is unclear how Iran will react to the letter, which Trump revealed during a television interview last week. Its intended recipient, Supreme Leader Ayatollah Ali Khamenei, has said he's not interested in talks with a 'bullying government.'	https://www.naharnet.com/stories/en/311592-emirati-diplomat-with-letter-from-trump-meets-with-iran-s-fm	2025-03-13T05:12:15-07:00	
Egypt, Hamas, PLO hail Trump remarks on not 'expelling' Palestinians	Egypt, Hamas and the Palestine Liberation Organization welcomed on Thursday remarks from US President Donald Trump after he said 'nobody's expelling any Palestinians' from the Gaza Strip. It was not immediately clear whether Trump's remarks signaled backtracking from his proposed plan to take over the Palestinian territory, displacing its population to neighboring countries.	https://naharnet.com/stories/en/311589-egypt-hamas-plo-hail-trump-remarks-on-not-expelling-palestinians	2025-03-13T04:49:09-07:00	
Egypt, Hamas, PLO hail Trump remarks on not 'expelling' Palestinians	Egypt, Hamas and the Palestine Liberation Organization welcomed on Thursday remarks from US President Donald Trump after he said 'nobody's expelling any Palestinians' from the Gaza Strip. It was not immediately clear whether Trump's remarks signaled backtracking from his proposed plan to take over the Palestinian territory, displacing its population to neighboring countries.	https://www.naharnet.com/stories/en/311589-egypt-hamas-plo-hail-trump-remarks-on-not-expelling-palestinians	2025-03-13T04:49:09-07:00	
One killed in Israel strike on Damascus building	Israel's military carried out an airstrike Thursday on a residential building on the outskirts of the Syrian capital Damascus that it said was a command center of the militant group Palestinian Islamic Jihad. The military alleged that the command center has been used to direct attacks against Israel and vowed to 'respond forcefully' to the presence of Palestinian militant groups inside Syria.	https://naharnet.com/stories/en/311588-one-killed-in-israel-strike-on-damascus-building	2025-03-13T04:41:28-07:00	
One killed in Israel strike on Damascus building	Israel's military carried out an airstrike Thursday on a residential building on the outskirts of the Syrian capital Damascus that it said was a command center of the militant group Palestinian Islamic Jihad. The military alleged that the command center has been used to direct attacks against Israel and vowed to 'respond forcefully' to the presence of Palestinian militant groups inside Syria.	https://www.naharnet.com/stories/en/311588-one-killed-in-israel-strike-on-damascus-building	2025-03-13T04:41:28-07:00	
One dead in Israel strike on Damascus building	Israel on Thursday struck a building in Damascus, Syrian state media reported, with a war monitor saying the raid on an area where Palestinian leaders are known to reside killed one person. 'Israeli aircraft targeted a building with two missiles in... Damascus, killing at least one person,' the Syrian Observatory for Human Rights monitor said, while state news agency SANA also reported the strike.	https://www.naharnet.com/stories/en/311588-one-dead-in-israel-strike-on-damascus-building	2025-03-13T04:41:28-07:00	
Cabinet approves appointments of army commander, security chiefs	The Cabinet on Thursday approved the appointment of Brig. Gen. Rudolph Haykal as army chief, Brig. Gen. Hassan Shqeir as General Security head, Brig. Gen. Raed Abdallah as Internal Security Forces chief and Brig. Gen. Edgard Lawandos as State Security head.	https://www.naharnet.com/stories/en/311587-cabinet-approves-appointments-of-army-commander-security-chiefs	2025-03-13T04:18:50-07:00	
Lebanese govt. says talks with Israel 'still indirect', rejects 'normalization'	Lebanon’s negotiations with Israel are 'still indirect' and our stance does not support 'normalization,' Information Minister Paul Morkos announced Thursday after a cabinet session.	https://www.naharnet.com/stories/en/311586-lebanese-govt-says-talks-with-israel-still-indirect-rejects-normalization	2025-03-13T03:41:13-07:00	
Kuwait frees group of jailed Americans, including contractors held on drug charges	Kuwait has released a group of American prisoners, including veterans and military contractors jailed for years on drug-related charges, in a move seen as a gesture of goodwill between two allies, a representative for the detainees told The Associated Press on Wednesday. The release follows a recent visit to the region by Adam Boehler, the Trump administration's top hostage envoy, and comes amid a continued U.S. government push to bring home American citizens jailed in foreign countries.	https://www.naharnet.com/stories/en/311585-kuwait-frees-group-of-jailed-americans-including-contractors-held-on-drug-charges	2025-03-13T02:46:28-07:00	
Kuwait frees group of jailed Americans, including contractors held on drug charges	Kuwait has released a group of American prisoners, including veterans and military contractors jailed for years on drug-related charges, in a move seen as a gesture of goodwill between two allies, a representative for the detainees told The Associated Press on Wednesday. The release follows a recent visit to the region by Adam Boehler, the Trump administration's top hostage envoy, and comes amid a continued U.S. government push to bring home American citizens jailed in foreign countries.	https://naharnet.com/stories/en/311585-kuwait-frees-group-of-jailed-americans-including-contractors-held-on-drug-charges	2025-03-13T02:46:28-07:00	
Syria flashes signs of peril and promise in week of violence and diplomacy	After Syria's longtime autocratic ruler was toppled late last year, the man who led rebel groups to victory immediately faced a new challenge: unifying the country after more than a decade of civil war. The peril and promise of Syria under interim President Ahmad al-Sharaa — the former leader of an Islamist insurgent group — were on dramatic display over the past week. After days of deadly sectarian violence, a diplomatic triumph united a powerful force in the country's northeast with the new national army.	https://www.naharnet.com/stories/en/311584-syria-flashes-signs-of-peril-and-promise-in-week-of-violence-and-diplomacy	2025-03-13T02:45:50-07:00	
Syria flashes signs of peril and promise in week of violence and diplomacy	After Syria's longtime autocratic ruler was toppled late last year, the man who led rebel groups to victory immediately faced a new challenge: unifying the country after more than a decade of civil war. The peril and promise of Syria under interim President Ahmad al-Sharaa — the former leader of an Islamist insurgent group — were on dramatic display over the past week. After days of deadly sectarian violence, a diplomatic triumph united a powerful force in the country's northeast with the new national army.	https://naharnet.com/stories/en/311584-syria-flashes-signs-of-peril-and-promise-in-week-of-violence-and-diplomacy	2025-03-13T02:45:50-07:00	
UN report accuses Israel of sexual violence, genocidal acts against Palestinians	United Nations-backed human rights experts on Thursday accused Israel of 'the systematic use of sexual, reproductive and other gender-based violence' in its war on Gaza. The allegations came in one of the most extensive reports of its kind on the issue.	https://www.naharnet.com/stories/en/311583-un-report-accuses-israel-of-sexual-violence-genocidal-acts-against-palestinians	2025-03-13T02:39:02-07:00	
Israel 'systematic' attacks on Gaza reproductive healthcare 'genocidal acts', UN says	United Nations-backed experts on Thursday accused Israel of 'the systematic use of sexual, reproductive and other gender-based violence' in its war against Hamas in the Gaza Strip. Israel’s mission to the U.N. in Geneva rejected the allegations and accused the The Commission of Inquiry on the Occupied Palestinian Territory, which was created by the U.N.-backed Human Rights Council, of relying on 'second-hand, single, uncorroborated sources.'	https://www.naharnet.com/stories/en/311583-israel-systematic-attacks-on-gaza-reproductive-healthcare-genocidal-acts-un-says	2025-03-13T02:39:02-07:00	
Israel 'systematic' attacks on Gaza reproductive healthcare 'genocidal acts', UN says	A United Nations investigation concluded Thursday that Israel carried out 'genocidal' acts in the Gaza Strip through the systematic destruction of sexual and reproductive healthcare facilities. The U.N. Commission of Inquiry found that Israeli authorities 'have destroyed in part the reproductive capacity of Palestinians in Gaza as a group through the systematic destruction of sexual and reproductive healthcare, amounting to two categories of genocidal acts', it said in a statement.	https://naharnet.com/stories/en/311583-israel-systematic-attacks-on-gaza-reproductive-healthcare-genocidal-acts-un-says	2025-03-13T02:39:02-07:00	
Israel releases fifth detainee, a soldier it kidnapped from Lebanon last week	The Lebanese army said it received on Thursday a soldier taken by Israel last weekend, after Israel handed over four other detainees earlier this week. 'The army through the International Committee of the Red Cross received (on Thursday) the soldier who was kidnapped by the Israeli enemy' on Sunday, the army said on X, adding that he had been transported to a hospital for treatment.	https://www.naharnet.com/stories/en/311581-israel-releases-fifth-detainee-a-soldier-it-kidnapped-from-lebanon-last-week	2025-03-13T02:25:00-07:00	
UK Vice Admiral reiterates support to Lebanon’s long-term stability and security	The UK Defense Senior Advisor to the Middle East and North Africa (DSAME) Vice Admiral Edward Ahlgren ended Thursday a two-day visit to Lebanon where he met with senior Lebanese and U.N. officials. Ahlgren congratulated President Joseph Aoun on his election as President and the formation of a new government, which shows hope and change for the future, as he reiterated the UK’s support for Lebanon’s long-term stability and security.	https://www.naharnet.com/stories/en/311580-uk-vice-admiral-reiterates-support-to-lebanon-s-long-term-stability-and-security	2025-03-13T02:19:26-07:00	
UK Vice Admiral reiterates UK’s support to Lebanon’s long-term stability and security	The UK Defense Senior Advisor to the Middle East and North Africa (DSAME) Vice Admiral Edward Ahlgren ended Thursday a two-day visit to Lebanon where he met with senior Lebanese and U.N. officials. Ahlgren congratulated President Joseph Aoun on his election as President and the formation of a new government, which shows hope and change for the future, as he reiterated the UK’s support for Lebanon’s long-term stability and security.	https://www.naharnet.com/stories/en/311580-uk-vice-admiral-reiterates-uk-s-support-to-lebanon-s-long-term-stability-and-security	2025-03-13T02:19:26-07:00	
Israeli official says Israel wants to 'reach normalization with Lebanon'	Against the backdrop of the U.S.-led negotiations that have opened with Lebanon, an Israeli political source has said that 'the discussions are part of a broad and comprehensive plan.' 'The Prime Minister's policy has already changed the Middle East, and we want to continue the momentum and reach normalization with Lebanon. Just as Lebanon has claims regarding the borders, so do we. We will discuss these matters,' the source told Israel’s Channel 12.	https://www.naharnet.com/stories/en/311572-israeli-official-says-israel-wants-to-reach-normalization-with-lebanon	2025-03-12T05:13:10-07:00	
Soaid's brother emerges as leading candidate for central bank chief post	Legal consultant Karim Soaid, the brother of ex-MP Fares Soaid, has emerged as the leading candidate for the central bank governor post.	https://www.naharnet.com/stories/en/311571-soaid-s-brother-emerges-as-leading-candidate-for-central-bank-chief-post	2025-03-12T04:07:11-07:00	
Govt. to approve security appointments Thursday after agreements reached	Consultations between President Joseph Aoun, Speaker Nabih Berri and Prime Minister Nawaf Salam have led to agreements over security appointments, which will be approved in one batch in Thursday’s cabinet session, media reports said.	https://www.naharnet.com/stories/en/311570-govt-to-approve-security-appointments-thursday-after-agreements-reached	2025-03-12T03:37:10-07:00	
Mahmoud Khalil didn't wear a mask, now he faces potential deportation	When protests over the Israel-Hamas war took root on Columbia University's campus last spring, Mahmoud Khalil became a familiar, outspoken figure in a student movement that soon spread to other U.S. colleges. The international-affairs graduate student was a fixture in and around the protest encampment on Columbia's Manhattan campus, serving as a spokesperson and negotiator for demonstrators who deplored Israel's military campaign in Gaza and pressed the Ivy League school to cut financial ties with Israel and companies that supported the war.	https://naharnet.com/stories/en/311568-mahmoud-khalil-didn-t-wear-a-mask-now-he-faces-potential-deportation	2025-03-12T03:31:12-07:00	
Mahmoud Khalil didn't wear a mask, now he faces potential deportation	When protests over the Israel-Hamas war took root on Columbia University's campus last spring, Mahmoud Khalil became a familiar, outspoken figure in a student movement that soon spread to other U.S. colleges. The international-affairs graduate student was a fixture in and around the protest encampment on Columbia's Manhattan campus, serving as a spokesperson and negotiator for demonstrators who deplored Israel's military campaign in Gaza and pressed the Ivy League school to cut financial ties with Israel and companies that supported the war.	https://www.naharnet.com/stories/en/311568-mahmoud-khalil-didn-t-wear-a-mask-now-he-faces-potential-deportation	2025-03-12T03:31:12-07:00	
Israeli defense minister says military watching Ahmad al-Sharaa from Mt. Hermon	Israel's defense minister warned Syria’s interim President Ahmad al-Sharaa that Israel 'is watching him from the heights of Mt. Hermon,' which Israeli forces captured as part of a buffer zone inside Syria last year, and said Israel struck 40 military targets overnight in southern Syria. Israel plans to allow members of the Druze minority from Syria to work in Israeli-controlled parts of the Golan Heights as soon as the coming week, Defense Minister Israel Katz said in a statement Tuesday issued from Mt. Hermon. He stressed that Israel plans to remain in the Syrian buffer zone for an 'indefinite period' to ensure that southern Syria remains demilitarized and does not pose a threat to residents of Israel or the Golan Heights.	https://naharnet.com/stories/en/311567-israeli-defense-minister-says-military-watching-ahmad-al-sharaa-from-mt-hermon	2025-03-12T03:23:31-07:00	
Israeli defense minister says military watching Ahmad al-Sharaa from Mt. Hermon	Israel's defense minister warned Syria’s interim President Ahmad al-Sharaa that Israel 'is watching him from the heights of Mt. Hermon,' which Israeli forces captured as part of a buffer zone inside Syria last year, and said Israel struck 40 military targets overnight in southern Syria. Israel plans to allow members of the Druze minority from Syria to work in Israeli-controlled parts of the Golan Heights as soon as the coming week, Defense Minister Israel Katz said in a statement Tuesday issued from Mt. Hermon. He stressed that Israel plans to remain in the Syrian buffer zone for an 'indefinite period' to ensure that southern Syria remains demilitarized and does not pose a threat to residents of Israel or the Golan Heights.	https://www.naharnet.com/stories/en/311567-israeli-defense-minister-says-military-watching-ahmad-al-sharaa-from-mt-hermon	2025-03-12T03:23:31-07:00	
Yemen’s Houthi rebels say they are resuming attacks on shipping	The Iran-backed rebels’ secretive leader had warned Friday that attacks against Israel-linked vessels would resume within four days if Israel didn’t let aid into Gaza. As the deadline passed Tuesday, the Houthis said they were again banning Israeli vessels from the waters off Yemen. Although no attacks were reported, the warning has put shippers on edge. The rebels targeted over 100 merchant vessels with missiles and drones, sinking two vessels and killing four sailors.	https://naharnet.com/stories/en/311566-yemen-s-houthi-rebels-say-they-are-resuming-attacks-on-shipping	2025-03-12T03:16:27-07:00	
Yemen’s Houthi rebels say they are resuming attacks on shipping	The Iran-backed rebels’ secretive leader had warned Friday that attacks against Israel-linked vessels would resume within four days if Israel didn’t let aid into Gaza. As the deadline passed Tuesday, the Houthis said they were again banning Israeli vessels from the waters off Yemen. Although no attacks were reported, the warning has put shippers on edge. The rebels targeted over 100 merchant vessels with missiles and drones, sinking two vessels and killing four sailors.	https://www.naharnet.com/stories/en/311566-yemen-s-houthi-rebels-say-they-are-resuming-attacks-on-shipping	2025-03-12T03:16:27-07:00	
Syrian Kurds celebrate deal with Damascus	Residents in northeastern Syria danced in the streets to celebrate a breakthrough pact between local Kurdish-led authorities and the new central government, while thousands of people continued to flee other areas where sectarian violence has targeted Alawites. The mostly ethnic Kurdish revelers in the northeastern city Qamishli chanted 'One, one, one — the Syrian people are one,' as cars drove by honking in celebration following Monday night's declaration, which includes a ceasefire and integration of Kurdish forces into the national army.	https://naharnet.com/stories/en/311565-syrian-kurds-celebrate-deal-with-damascus	2025-03-12T03:14:05-07:00	
Syrian Kurds celebrate deal with Damascus	Residents in northeastern Syria danced in the streets to celebrate a breakthrough pact between local Kurdish-led authorities and the new central government, while thousands of people continued to flee other areas where sectarian violence has targeted Alawites. The mostly ethnic Kurdish revelers in the northeastern city Qamishli chanted 'One, one, one — the Syrian people are one,' as cars drove by honking in celebration following Monday night's declaration, which includes a ceasefire and integration of Kurdish forces into the national army.	https://www.naharnet.com/stories/en/311565-syrian-kurds-celebrate-deal-with-damascus	2025-03-12T03:14:05-07:00	
Who was behind mass killings on Syria's coast?	For several days, Syria's Mediterranean coast has been gripped by extreme violence that has seen mass killings mainly targeting members of the Alawite minority. Authorities have not provided a toll, but the Syrian Observatory for Human Rights monitor put the number of dead at 1,225 civilians, mostly Alawites. Human Rights Watch said 'hundreds' were killed.	https://naharnet.com/stories/en/311564-who-was-behind-mass-killings-on-syria-s-coast	2025-03-12T03:06:52-07:00	
