Title	Description	Link	pubDate	Image
В центрі Тбілісі протестувальники облаштували наметове містечко т...	У столиці Грузії Тбілісі грузинська опозиція зводить барикади навколо наметового містечка. Про це у понеділок, 18 листопада, повідомляє Ехо Кавказу.	https://nv.ua/ukr/world/countries/protesti-v-gruziji-u-tbilisi-gruzinska-opoziciya-zvodit-barikadi-navkolo-nametovogo-mistechka-50467436.html	2024-11-18T10:15:00-08:00	https://static.nv.ua/shared/system/Article/posters/002/989/160/original/936b437659abe898916213db44400563.jpg?q=85&stamp=20241118201251&w=900
Противника попередили. Що змінить дозвіл Байдена на далекобійні у...	Замало і запізно — це, мабуть, перше, що спадає на думку	https://nv.ua/ukr/opinion/atacms-udari-po-rosiji-viyskoviy-ekspert-pro-naslidki-rishennya-baydena-50467412.html	2024-11-18T10:13:00-08:00	https://nv.ua/upload/nv_fix_image.jpeg
Бачив жах'. Очевидці розповіли про перші хвилини після російсько...	У понеділок, 18 листопада, російські окупанти завдали ракетного удару по Одесі, внаслідок чого загинули 10 осіб, постраждали щонайменше 47 осіб.	https://nv.ua/ukr/ukraine/events/obstril-odesi-ochevidci-rozpovili-pro-pershi-hvilini-pislya-ataki-rf-18-listopada-50467434.html	2024-11-18T10:08:00-08:00	https://static.nv.ua/shared/system/Article/posters/002/989/156/original/7fdd4e955a5f4638c2215184a56e71fa.jpg?q=85&stamp=20241118195550&w=900
ТОП-3 найкращі зарядні станції для дому не дорожче 50 тис грн	Обираємо найкращі зарядні станції для дому з ціною до 50 тис грн. Наші вимоги — висока потужність, велика ємність і швидка зарядка.	https://techno.nv.ua/ukr/gadgets/naykrashchi-zaryadni-stanciji-dlya-domu-do-50-tis-grn-50467378.html	2024-11-18T10:02:00-08:00	https://static.nv.ua/shared/system/Article/posters/002/989/039/original/d89a7b0b7d04ba8c368298ee91fa5201.jpg?q=85&stamp=20241118164602&w=900
Приголомшив друзів. 43-річний Ібрагімович забив розкішний гол п’я...	Колишній шведський форвард Златан Ібрагімович, який під час професійної кар'єри забив чимало красивих голів, знову показав свою майстерність на футбольному полі.	https://sport.nv.ua/ukr/football/video-golu-p-yatoyu-vid-zlatana-ibragimovicha-vin-prigolomshiv-svojih-druziv-50467431.html	2024-11-18T09:57:00-08:00	https://static.nv.ua/shared/system/Article/posters/002/989/150/original/c25d938c5b76fa0de1f8fa998496cc13.jpg?q=85&stamp=20241118192616&w=900
Я занадто довго воюю, щоб мене саджати'. Чому військові йдуть у ...	Офіційно в Україні 95 тисяч кримінальних справ по СЗЧ за майже два з половиною роки повномасштабної війни. Реальна цифра може бути вищою в два рази. BBC Україна вдалося поговорити з деякими з тих, хто залишив частину, і дізнатися, чи планують вони повертатися у стрій. NV публікує цей матеріал на правах інформаційної співпраці.	https://nv.ua/ukr/ukraine/events/szch-u-zsu-yake-pokarannya-yakim-porushennyam-vvazhayetsya-i-chi-dozvoleno-perevedennya-novini-ukrajini-50467283.html	2024-11-18T09:51:00-08:00	https://static.nv.ua/shared/system/Article/posters/002/988/831/original/68c707f6355678a42014a02c5b8e210c.jpg?q=85&stamp=20241118160736&w=900
Пішло не за планом. Озброєні злочинці відібрали автомобіль у футб...	Нападник Монако Джордж Іленіхен став жертвою нахабного пограбування.	https://sport.nv.ua/ukr/football/futbolista-monako-dzhordzh-ilenihen-pograbuvali-zlochinci-potrapili-v-dtp-pid-chas-vtechi-50467429.html	2024-11-18T09:41:00-08:00	https://static.nv.ua/shared/system/Article/posters/002/989/146/original/fcbd1a6d71f7af4c144aaac505119372.jpg?q=85&stamp=20241118192953&w=900
ЄС передав Україні обіцяний мільйон боєприпасів, але цього недост...	Європейський Союз передав Україні обіцяний мільйон боєприпасів, повідомив у понеділок, 18 листопада, голова європейської дипломатії Жозеп Боррель.	https://nv.ua/ukr/world/geopolitics/boyepripasi-dlya-ukrajini-yes-peredav-ukrajini-obicyaniy-milyon-snaryadiv-zayaviv-borrel-50467430.html	2024-11-18T09:31:00-08:00	https://static.nv.ua/shared/system/Article/posters/002/989/148/original/f86814bceebea7a0743bd0dc7eefb4b2.jpg?q=85&stamp=20241118192935&w=900
Ускладнення погоди. Синоптикиня попередила про штормовий вітер, с...	Синоптики заздалегідь попереджали про негоду, яку принесуть в Україну чисельні циклони та атмосферні фронти.	https://nv.ua/ukr/ukraine/events/prognoz-pogodi-na-listopad-2024-de-zavtra-bude-15-i-koli-poholodannya-snig-i-shtormoviy-viter-50467371.html	2024-11-18T09:27:00-08:00	https://static.nv.ua/shared/system/Article/posters/002/989/023/original/6a2fbcce16ea2fbd6bc977d215399a41.jpg?q=85&stamp=20241118162415&w=900
Укренерго оприлюднило графіки відключень на 19 листопада	У вівторок, 19 листопада, в Україні застосовуватимуться графіки відключення електроенергії. В Укренерго повідомили, як вони діятимуть.	https://nv.ua/ukr/ukraine/events/ukrenergo-oprilyudnilo-grafiki-vidklyuchen-na-19-listopada-50467432.html	2024-11-18T09:27:00-08:00	https://static.nv.ua/shared/system/Article/posters/002/989/152/original/7348e607ff4ceb3bb92eb49b61132f70.jpg?q=85&stamp=20241118193734&w=900
Україна досі не отримала дозволу на використання Storm Shadow для...	Україна досі не отримала дозволу наносити удари вглиб території Росії ракетами Storm Shadow, повідомляє таблоїд The Sun з посиланням на свої джерела.	https://nv.ua/ukr/ukraine/events/ukrajina-shche-ne-otrimala-dozvolu-na-vikoristannya-storm-shadow-50467428.html	2024-11-18T09:23:00-08:00	https://static.nv.ua/shared/system/Article/posters/002/989/144/original/f68b589a880af159254e400416226d4c.jpg?q=85&stamp=20241118192019&w=900
Перестань бити людей похилого віку': ексчеміпон світу жорстко ро...	Колишній чемпіон світу з боксу Тімоті Бредлі звернувся до блогера Джейка Пола (11−1, 7 КО) після його перемоги над Майком Тайсоном (50−7, 44 КО).	https://sport.nv.ua/ukr/boxing/timoti-bredli-zaklikav-dzheyka-pola-perestati-biti-lyudey-pohilogo-viku-50467427.html	2024-11-18T09:16:00-08:00	https://static.nv.ua/shared/system/Article/posters/002/989/142/original/9199269eaa1390c7f067a4e9c7341424.jpg?q=85&stamp=20241118185258&w=900
Наслідки масованого ракетного удару по Україні	У ніч з 16 на 17 листопада, а надто упродовж ранку 17 листопада, росіяни завдали масованого ракетного удару по Україні, про підготовку до якого експерти попереджали	https://nv.ua/ukr/opinion/raketniy-udar-17listopada-tom-kuper-rozpoviv-pro-naslidki-novini-ukrajini-50467418.html	2024-11-18T09:13:00-08:00	https://nv.ua/upload/nv_fix_image.jpeg
Ворог біля Покровська. Метінвест Ахметова суттєво збільшив виробн...	Група компаній Метінвест, що належить бізнесмену Рінату Ахметову, збільшила виробництво вугільного концентрату на 14% до 1,135 млн тонн у 3 кварталі порівняно з 2 кварталом.	https://biz.nv.ua/ukr/markets/metinvest-suttyevo-zbilshiv-virobnictvo-vugilnogo-koncentratu-popri-blizkist-pidpriyemstv-do-frontu-50467419.html	2024-11-18T09:04:00-08:00	https://static.nv.ua/shared/system/Article/posters/002/989/126/original/17313590f270d1f86afc4f60f8519501.jpg?q=85&stamp=20241118183943&w=900
Підтвердили нерозуміння реалій'. Зрадник Тимощук виграв суд в Ло...	Спортивний арбітражний суд у Лозанні (CAS) задовольнив апеляцію ексфутболіста Анатолія Тимощука, який вимагав зняти санкції, накладені на нього Українською асоціацією футболу (УАФ).	https://sport.nv.ua/ukr/football/anatoliy-timoshchuk-vigrav-sud-proti-ukrajinskoji-asociaciji-futbolu-50467420.html	2024-11-18T09:02:00-08:00	https://static.nv.ua/shared/system/Article/posters/002/989/128/original/87b0e581720f967e6e3f92e0b3bd1ae3.jpg?q=85&stamp=20241118184809&w=900
ЄС розширив санкції проти Ірану за передачу БПЛА та ракет Росії	Рада Євросоюзу вирішила розширити санкції проти Ірану через передачу безпілотників та ракет для війни Росії проти України. Про це повідомляється на сайті Ради ЄС у понеділок, 18 листопада.	https://nv.ua/ukr/world/geopolitics/sankciji-proti-iranu-yes-rozshiriv-obmezhuvalni-zahodi-cherez-postachannya-bpla-ta-raket-do-rf-50467424.html	2024-11-18T09:00:00-08:00	https://static.nv.ua/shared/system/Article/posters/002/989/136/original/d9a97443e1793ed1ba97b8dd3ad9044c.jpg?q=85&stamp=20241118185343&w=900
Україна заб'є та пропустить. Букмекери зробили прогноз на матч си...	У вівторок, 19 листопада, збірна України зіграє проти Албанії у рамках вирішального туру Ліги націй.	https://sport.nv.ua/ukr/football/prognoz-na-match-albaniya-ukrajina-kotiruvannya-bukmekeriv-hto-peremozhe-u-lizi-naciy-50467423.html	2024-11-18T08:56:00-08:00	https://static.nv.ua/shared/system/Article/posters/002/989/134/original/8331eaa3b1813acf5f8fac7301b84ee0.jpg?q=85&stamp=20241118185030&w=900
Залишились лічені години. GSC Game World назвала точну дату і час...	Довгоочікуваний реліз постапокаліптичного шутера від першої особи S.T.A.L.K.E.R. 2: Heart of Chornobyl відбудеться вже цього тижня.	https://techno.nv.ua/ukr/games/stalker-2-data-vihodu-50467421.html	2024-11-18T08:55:00-08:00	https://static.nv.ua/shared/system/Article/posters/002/989/130/original/c8fbe1ea3614710982a1540a2a979586.jpg?q=85&stamp=20241118184607&w=900
Дочка Кадирова побудувала бізнес на K-pop, хоча раніше таку музик...	Дочка маріонетки Кремля в Чечні Рамзана Кадирова — Табарік Кадирова — стала власницею франшизи корейського стріт-фуд ресторану Chicko, повідомляє The Moscow Times.	https://nv.ua/ukr/world/countries/tabarik-kadirova-dochka-kadirova-pobuduvala-biznes-na-k-pop-50467422.html	2024-11-18T08:51:00-08:00	https://static.nv.ua/shared/system/Article/posters/002/989/132/original/4d1a93bea109ac25fd3ca3afcb48e179.jpg?q=85&stamp=20241118184252&w=900
Йде великий сніг. Птуха попередила про різку зміну погоди по всій...	Синоптикиня Укргідрометцентру Наталія Птуха розповіла NV, в яких регіонах країни і коли очікуються сильні снігопади із зниженням температури.	https://nv.ua/ukr/ukraine/events/prognoz-pogodi-koli-vipade-do-50-sm-snigu-de-bude-viter-do-20-m-s-i-6-gradusiv-morozu-v-ukrajini-50467394.html	2024-11-18T08:49:00-08:00	https://static.nv.ua/shared/system/Article/posters/002/989/074/original/764d1cc6119d6973b677f2b6e77a05b6.jpg?q=85&stamp=20241118172759&w=900
Дозвіл є, але на що саме?	Чим жила країна 18 листопада 2024 року	https://nv.ua/ukr/opinion/bayden-dozvoliv-biti-atacms-po-rf-ostanni-novini-50467425.html	2024-11-18T08:49:00-08:00	https://nv.ua/upload/nv_fix_image.jpeg
Війна та сила мистецтва'. Інтерв'ю з Міріам Гуттманн, режисеркою...	У Нью-Йорку відбулась прем'єра документального фільму Перший ряд (Front Row) про українську балетну трупу United Ukrainian Ballet Company і українського ветерана Олександра Будько із позивним Терен. Інтерв'ю NV з режисеркою Міріам Гуттманн.	https://life.nv.ua/ukr/art/oleksandr-teren-i-ukrajinski-tancivniki-stali-geroyami-filmu-pershiy-ryad-interv-yu-z-rezhiserkoyu-50467349.html	2024-11-18T08:48:00-08:00	https://static.nv.ua/shared/system/Article/posters/002/988/976/original/225ff51525f8dba152528b8f25f728ba.jpg?q=85&stamp=20241118165758&w=900
Інтерв'ю з азовцем Скромним — про три місяці боїв за напівзахопле...	Офіцер 12-ої бригади Азов з позивним Скромний напередодні 1000 дня війни в інтерв'ю Radio NV розповів про три місяців боїв на торецькому напрямку, перспективу переговорів з РФ і необхідність реформування ЗСУ.	https://nv.ua/ukr/ukraine/events/1000-dniv-viyni-boji-za-toreck-peregovori-z-rf-i-reforma-zsu-azovec-skromniy-novini-ukrajini-50467404.html	2024-11-18T08:40:00-08:00	https://static.nv.ua/shared/system/Article/posters/002/989/095/original/ac3d82cbb9f4acc585e4978ffecc786d.jpg?q=85&stamp=20241118175630&w=900
Мудрик кращий за Голанда. Зірка збірної України потрапив у рейтин...	Футболіст збірної України та лондонського Челсі Михайло Мудрик потрапив до рейтингу найшвидших футболістів англійської Прем'єр-ліги у цьому сезоні.	https://sport.nv.ua/ukr/football/mihaylo-mudrika-krashchiy-za-erlinga-golanda-reyting-nayshvidshih-futbolistiv-apl-50467410.html	2024-11-18T08:33:00-08:00	https://static.nv.ua/shared/system/Article/posters/002/989/107/original/b65a17e92ec6dbfbbe86cff926f70320.jpg?q=85&stamp=20241118180607&w=900
Уламки летять, а я кричу — лягайте'. Свідки російської атаки по ...	Вечері у неділю, 17 листопада, армія країни-агресора Росії завдала ракетного удару по Сумах. Росіяни поцілили у критичну інфраструктуру та густонаселені райони.	https://nv.ua/ukr/ukraine/events/sumi-18-listopada-svidki-rozpovili-pro-naslidki-raketnoji-ataki-opublikovano-video-50467405.html	2024-11-18T08:29:00-08:00	https://static.nv.ua/shared/system/Article/posters/002/989/097/original/0ffa61a261dc7f941efc680dc4bd6903.jpg?q=85&stamp=20241118180850&w=900
Зеленський приїхав до Куп’янська та зустрівся з українськими війс...	У понеділок, 18 листопада, президент України Володимир Зеленський відвідав Куп’янськ у Харківській області. Про це він повідомив у відеозверненні в Telegram.	https://nv.ua/ukr/ukraine/events/volodimir-zelenskiy-18-listopada-vidvidav-kup-yansk-u-harkivskiy-oblasti-50467414.html	2024-11-18T08:28:00-08:00	https://static.nv.ua/shared/system/Article/posters/002/989/116/original/5e66a8a9bc39e4d7f831939619ab5266.jpg?q=85&stamp=20241118182045&w=900
Разом з Ібрагімовичем і Буффоном. Андрій Шевченко потрапив у топ-...	Нещодавно авторитетне видання опублікувало рейтинг 25-ти найкращих футболістів Серії А у ХХІ столітті. У десятку потрапив українець Андрій Шевченко.	https://sport.nv.ua/ukr/football/andriy-shevchenko-v-top-10-naykrashchih-gravciv-seriji-a-u-hhi-stolitti-50467415.html	2024-11-18T08:27:00-08:00	https://static.nv.ua/shared/system/Article/posters/002/989/118/original/06aced9db3472b0dc1a2b00e6b99ac97.jpg?q=85&stamp=20241118181818&w=900
У Дніпропетровській області затримали депутата за підозрою у викр...	У Дніпропетровській області правоохоронці викрили угруповання, яке викрало підприємця, мобілізованого до лав ЗСУ, і зажадало в нього 2,5 млн доларів. На чолі угруповання був місцевий депутат.	https://nv.ua/ukr/ukraine/events/yuriy-prishedko-u-dnipropetrovskiy-oblasti-zatrimali-miscevogo-deputata-50467411.html	2024-11-18T08:20:00-08:00	https://static.nv.ua/shared/system/Article/posters/002/989/109/original/5c45d770dea280afe848d4bd5b434705.jpg?q=85&stamp=20241118181118&w=900
Поблизу будинку Кейт і Вільяма. Невідомі увірвалися на ферму на т...	Невідомі чоловіки в масках увірвалися на ферму на території Віндзорського замку. Вона розташована поблизу будинку, де живуть Кейт Міддлтон і принц Вільям з дітьми.	https://life.nv.ua/ukr/znamenitosti/nevidomi-uvirvalisya-na-fermu-poblizu-domu-keyt-middlton-i-princa-vilyama-50467409.html	2024-11-18T08:19:00-08:00	https://static.nv.ua/shared/system/Article/posters/002/989/105/original/d781c3168909f61a48c24ef9f7115a9c.jpg?q=85&stamp=20241118181336&w=900
Магнітна буря накриє Україну. Метеорологи попередили, коли підско...	У листопаді вже було кілька сильних магнітних бур, невдовзі Україну накриє ще одна, але вона буде не найінтенсивнішою.	https://nv.ua/ukr/ukraine/events/magnitna-burya-sogodni-ta-nayblizhchim-chasom-meteorologi-zrobili-prognoz-naybilsh-skladnogo-dnya-50467407.html	2024-11-18T08:15:00-08:00	https://static.nv.ua/shared/system/Article/posters/002/989/101/original/a076db768f5cdedb986b312dd17efe18.jpg?q=85&stamp=20241118175210&w=900
Немає страху за Україну'. Ексгравець Дніпра спрогнозував рахунок...	У вівторок, 19 листопада, збірна України у виїзному поєдинку зіграє проти Албанії у Тирані. Ми проведемо онлайн-трансляцію зустрічі.	https://sport.nv.ua/ukr/football/albaniya-ukrajina-artur-karnoza-prognoz-na-match-ligi-naciy-50467401.html	2024-11-18T08:07:00-08:00	https://static.nv.ua/shared/system/Article/posters/002/989/087/original/a8005ef77994f25f8339ae5775af5d3e.jpg?q=85&stamp=20241118175217&w=900
Небезпечна несправність. General Motors відкликає майже півмільйо...	GM відкликає майже півмільйона автомобілів через ризик аварії	https://nv.ua/ukr/auto/news/gm-vidklikaye-mayzhe-pivmilyona-avtomobiliv-cherez-rizik-blokuvannya-kolis-50467286.html	2024-11-18T08:04:00-08:00	https://static.nv.ua/shared/system/Article/posters/002/988/839/original/0a4f988d402d69e3575c456437fafa47.jpg?q=85&stamp=20241118120657&w=900
Це є нашою метою': тренер суперника збірної України оцінив шанси...	Тренер збірної Албанії Сільвіньйо висловився про напружену турнірну розв’язку в групі Ліги націй перед поєдинком проти України. Спостерігайте онлайн за вирішальним матчем.	https://sport.nv.ua/ukr/football/albaniya-ukrajina-silvinyo-divivsya-match-proti-gruziji-trener-supernikiv-ociniv-shansi-na-peremogu-50467408.html	2024-11-18T08:02:00-08:00	https://static.nv.ua/shared/system/Article/posters/002/989/103/original/d8ad7dcccfd658672ab42e7c860081ba.jpg?q=85&stamp=20241118175512&w=900
Нагадали про полонених Азовсталі. У Нью-Йорку відбулась прем'єра ...	У суботу, 16 листопада, на фестивалі документального кіно DocNYC у Нью-Йорку відбулась прем'єра фільму Перший ряд режисерки Міріам Гуттманн, який розповідає про українську балетну трупу та танець із ветераном, який втратив ноги, Олександром Тереном.	https://life.nv.ua/ukr/art/oleksandr-teren-ta-sara-dzhessika-parker-predstavili-film-pershiy-ryad-u-nyu-yorku-foto-50467399.html	2024-11-18T08:01:00-08:00	https://static.nv.ua/shared/system/Article/posters/002/989/083/original/ad4b0f28cae5ecf9977b5691a4bd5ef5.jpg?q=85&stamp=20241118173435&w=900
Не лише вітамін С. Що їсти, щоб покращити імунітет: шість порад в...	Через похолодання можливе збільшення кількості вірусних захворювань. Ексклюзивно для NV Food нутриціологиня розповіла, що робити, щоб покращити роботу імунної системи і менше хворіти в осінньо-зимовий період.	https://nv.ua/ukr/food/eat/imunitet-shcho-jisti-shchob-pokrashchiti-imunitet-i-menshe-hvoriti-poradi-vid-nutrociologa-50467379.html	2024-11-18T07:57:00-08:00	https://static.nv.ua/shared/system/Article/posters/002/989/041/original/ffbd7ef9311ef022045728f906b4679d.jpg?q=85&stamp=20241118170221&w=900
Курив з восьми років. Девід Лінч розповів про погіршення стану зд...	Відомий американський режисер Девід Лінч, якому чотири роки тому діагностували хронічне захворювання легенів, більше не може ходити без кисневої маски.	https://life.nv.ua/ukr/znamenitosti/devid-linch-ne-peresuvayetsya-bez-kisnevoji-maski-cherez-hronichne-zahvoryuvannya-50467397.html	2024-11-18T07:49:00-08:00	https://static.nv.ua/shared/system/Article/posters/002/989/080/original/f7e8995a2bba1e7a1f7c36e7118510d9.jpg?q=85&stamp=20241118174616&w=900
Їм потрібно це переробити'. Фанати висміяли статую найкращого бо...	У Лондоні відкрили статую на честь форварда збірної Англії та мюнхенської Баварії Гаррі Кейна.	https://sport.nv.ua/ukr/football/fanati-vismiyali-statuyu-futbolista-zbirnoji-angliji-garri-keyna-foto-50467389.html	2024-11-18T07:47:00-08:00	https://static.nv.ua/shared/system/Article/posters/002/989/063/original/0f5cb2e141773e56a448477b9f4a1913.jpg?q=85&stamp=20241118174303&w=900
Одразу двохсоть'. Українська розвідка перехопила наказ російсько...	Українські розвідники перехопили розмову, у якій командири російської окупаційної армії віддають наказ розстрілювати військовополонених.	https://nv.ua/ukr/ukraine/events/rozstril-ukrajinskih-viyskovopolonenih-gur-perehopili-rozmovu-okupantiv-ta-jih-komandira-50467391.html	2024-11-18T07:41:00-08:00	https://static.nv.ua/shared/system/Article/posters/002/989/067/original/50104d1e01505ef6c93adc0875ca1c71.jpg?q=85&stamp=20241118174033&w=900
