Title	Description	Link	pubDate	Image
Кандидат у міністри оборони США виплатив $50 тис. за звинувачення...	Кандидат на посаду міністра оборони США Піт Хегсет виплатив 50 тисяч доларів жінці, яка звинуватила його в сексуальних домаганнях. Це відбулося в межах угоди про конфіденційність із потерпілою.	https://nv.ua/ukr/world/countries/skandal-u-ssha-kandidat-u-ministri-oboroni-pit-hegset-zaplativ-za-zvinuvachennya-u-domagannyah-50484214.html	2025-01-23T20:17:00-08:00	https://static.nv.ua/shared/system/Article/posters/003/025/143/original/74b6d8ca1f27e100ae54ffe58e177586.jpg?q=85&stamp=20250124061521&w=900
У Татарстані зросли одноразові виплати за участь у війні проти Ук...	Регіональна влада в Росії збільшує фінансові стимули для залучення громадян до підписання контрактів на військову службу. Нещодавно в Татарстані зросли одноразові виплати для контрактників.	https://nv.ua/ukr/world/countries/rosiya-zbilshuye-viplati-viyskovim-u-tatarstani-pidnyali-sumi-dlya-kontraktnikiv-50484213.html	2025-01-23T20:06:00-08:00	https://static.nv.ua/shared/system/Article/posters/003/025/141/original/be76e3d249cb0729ee7316243d4f7c59.jpg?q=85&stamp=20250124060031&w=900
Місячний календар на лютий 2025 року: вплив Місяця та зміни трива...	Лютий — місяць переходу від зими до весни. Він принесе нам не лише зміни в природі, а й особливості місячних фаз, які вплинуть на різні сфери життя. Розгляньмо детальніше, що чекає нас у лютому 2025 року за місячним календарем.	https://life.nv.ua/ukr/showbiz/misyachniy-kalendar-na-lyutiy-2025-spriyatlivi-dni-fazi-misyacya-ta-jihniy-vpliv-50484025.html	2025-01-23T19:57:00-08:00	https://static.nv.ua/shared/system/Article/posters/003/024/736/original/11397005ab8e0f644536d0e1b1142af1.jpg?q=85&stamp=20250123143027&w=900
Зелені свята. Коли Трійця 2025 за новим календарем ПЦУ та чому це...	Одним із найшанованіших свят у християнському календарі є Трійця, або Зелені свята. Це свято відзначає день сходження Святого Духа на апостолів і утворення християнської церкви.	https://nv.ua/ukr/ukraine/events/triycya-u-2025-roci-v-ukrajini-data-svyatkuvannya-za-novim-kalendarem-pcu-ta-tradiciji-50483731.html	2025-01-23T19:33:00-08:00	https://static.nv.ua/shared/system/Article/posters/003/024/105/original/c8590d12f23dfe45971f32f8a80b9cc9.jpg?q=85&stamp=20250122154340&w=900
Знову змістився. Північний магнітний полюс поміняв своє положення	Вчені б’ють на сполох через прискорену зміну магнітного північного полюса.	https://techno.nv.ua/ukr/popscience/pivnichniy-magnitniy-polyus-prodovzhuye-peremishchatisya-50483940.html	2025-01-23T19:30:00-08:00	https://static.nv.ua/shared/system/Article/posters/003/024/552/original/54299203ecef6cb2e9dc65dbdab1c5b4.jpg?q=85&stamp=20250123111054&w=900
Ворог просунувся біля Торецька, Покровська та в Курській області ...	Російські війська продовжують просування поблизу Торецька і Покровська Донецької області, а також у Курській області.	https://nv.ua/ukr/ukraine/events/nastup-rf-prosuvannya-okupantiv-poblizu-torecka-pokrovska-ta-v-kurskiy-oblasti-zvit-isw-50484212.html	2025-01-23T19:10:00-08:00	https://static.nv.ua/shared/system/Article/posters/003/025/139/original/f35d175b72262a7b8ac1f8c6d82071ed.jpg?q=85&stamp=20250124051020&w=900
Сенат США затвердив Джона Реткліффа директором ЦРУ	Сенат США 23 січня офіційно затвердив Джона Реткліффа на посаду директора Центрального розвідувального управління (ЦРУ). Раніше він обіймав посаду директора Національної розвідки в адміністрації Дональда Трампа.	https://nv.ua/ukr/world/countries/senat-ssha-zatverdiv-dzhona-retkliffa-direktorom-cru-detali-priznachennya-50484211.html	2025-01-23T18:48:00-08:00	https://static.nv.ua/shared/system/Article/posters/003/025/137/original/0ed138c4a7cca7bc33632d56b71d291a.jpg?q=85&stamp=20250124044706&w=900
На Київщині уламки БпЛА спричинили пожежу в будинку, на кількох п...	Уночі 24 січня унаслідок падіння уламків збитого БпЛА в одному з населених пунктів Київської області сталася пожежа в 10-поверховому житловому будинку в декількох квартирах. Фіксується руйнування фасаду на 6−9 поверхах.	https://nv.ua/ukr/kyiv/pozhezhi-u-kijivskiy-oblasti-cherez-padinnya-ulamkiv-evakuaciya-zhiteliv-50484209.html	2025-01-23T18:38:00-08:00	https://static.nv.ua/shared/system/Article/posters/003/025/133/original/8525c14d8f9728e309420710dc0a029a.jpg?q=85&stamp=20250124043657&w=900
Коли сіяти гарбузи 2025 року: вдалі дати та поради щодо посадки у...	В Україні багато садівників вирощують гарбуз, оскільки він вважається одним з найкорисніших овочів. У його плодах знаходиться значна кількість вітамінів та рідкісних речовин, які корисні для здоров’я організму.	https://life.nv.ua/ukr/lifehacks/koli-i-yak-saditi-garbuzi-v-ukrajini-navesni-2024-naykrashchi-dati-pravila-posadki-ta-pidgotovka-gruntu-50409142.html	2025-01-23T18:22:00-08:00	https://static.nv.ua/shared/system/Article/posters/002/864/030/original/0d149a92dee0a2a89c3bf0973b37175b.jpg?q=85&stamp=20240411134610&w=900
Місячний календар на січень 2025 року: особливості місяця та змін...	Січень 2025 року — це перший місяць нового року, і хоча цей час зазвичай асоціюється з холодом і зимовими святами, він також має особливе значення в астрономічному плані.	https://nv.ua/ukr/ukraine/events/misyachniy-kalendar-na-sichen-2025-fazi-misyacya-zmini-dnya-ta-chas-shodu-i-zahodu-soncya-50478620.html	2025-01-23T17:08:00-08:00	https://static.nv.ua/shared/system/Article/posters/003/013/130/original/b6228097fecd8868544ab2c9cd2f8e00.jpg?q=85&stamp=20250102163834&w=900
Брудні ігри. Instagram платить блогерам тисячі доларів, щоб вони ...	Instagram намагається залучити блогерів із TikTok у Reels, пропонуючи великі щомісячні бонуси.	https://techno.nv.ua/ukr/it-industry/breakthrough-bonus-50483671.html	2025-01-23T17:05:00-08:00	https://static.nv.ua/shared/system/Article/posters/003/023/978/original/a3d2d0e383bb36518de25f9acb779cf8.jpg?q=85&stamp=20250122133002&w=900
БпЛА атакували Московську область	У Росії триває атака ударних безпілотників. Зокрема, під ударом опинилися кілька міських округів Московської області.	https://nv.ua/ukr/world/countries/ataka-na-moskovsku-oblast-24-sichnya-novini-rosiji-50484208.html	2025-01-23T15:18:00-08:00	https://static.nv.ua/shared/system/Article/posters/003/025/131/original/197e2e7573c569389016e3760a6fdc58.jpg?q=85&stamp=20250124011700&w=900
Більше Nexus, ніж iPhone. Ймовірний дизайн нового смартфона Apple...	Чутки про нову загадкову модель смартфона від Apple iPhone 17 Air, що відрізнятиметься від решти цьогорічної лінійки, продовжують надходити.	https://techno.nv.ua/ukr/gadgets/dizayn-iphone-17-air-50483826.html	2025-01-23T15:02:00-08:00	https://static.nv.ua/shared/system/Article/posters/003/024/308/original/53705b1607e0758bfbd4e04a8653ab2a.jpg?q=85&stamp=20250122203035&w=900
Атака ударних БпЛА: ворог спрямовує дрони на кілька регіонів Укра...	У ніч на п’ятницю, 24 січня, ворог запустив групу ударних БпЛА проти України.	https://nv.ua/ukr/ukraine/events/povitryani-ataki-na-harkivshchini-chernigivshchini-ta-inshih-regionah-ukrajini-50484207.html	2025-01-23T14:53:00-08:00	https://static.nv.ua/shared/system/Article/posters/003/025/129/original/32aad9274c7467618cf3562801942eb7.jpg?q=85&stamp=20250124005222&w=900
Дрони атакували нафтозавод у Рязані	Увечері 23 січня в російській Рязані прогриміли вибухи — ударні безпілотники атакували місцевий нафтопереробний завод.	https://nv.ua/ukr/world/countries/pozhezha-i-vibuhi-bilya-ryazanskogo-npz-u-rosiji-shcho-stalosya-50484205.html	2025-01-23T14:35:00-08:00	https://static.nv.ua/shared/system/Article/posters/003/025/124/original/6bb2cfb888b013c90ef45fb2fd94df00.jpg?q=85&stamp=20250124003433&w=900
Росія втратила вдвічі більше людей, ніж Україна, але перевага на ...	Країна-агресор Росія втрачає вдвічі більше людей, ніж Україна, але досі має перевагу, пише The New York Times у четвер, 23 січня.	https://nv.ua/ukr/ukraine/events/vtrati-rosiji-ta-ukrajini-porivnyali-zmi-chomu-rf-maye-perevagu-50484202.html	2025-01-23T13:55:00-08:00	https://static.nv.ua/shared/system/Article/posters/003/025/116/original/8e1f2f96f6b11377c9618d7b3d861f62.jpg?q=85&stamp=20250123235544&w=900
Трамп наказав розсекретити всі дані про вбивство Кеннеді та Марті...	23 січня президент США Дональд Трамп підписав указ, який зобов’язує федеральний уряд розсекретити й опублікувати всі записи, пов’язані з убивствами президента Джона Кеннеді, сенатора Роберта Кеннеді та доктора Мартіна Лютера Кінга.	https://nv.ua/ukr/world/countries/ubivstvo-kennedi-tramp-nakazav-rozsekretiti-dani-novini-ssha-50484201.html	2025-01-23T13:38:00-08:00	https://static.nv.ua/shared/system/Article/posters/003/025/114/original/dc82bf8e9d070bbbae5e236a98888fe4.jpg?q=85&stamp=20250123231027&w=900
Колишня зірка Барселона здивував своїм станом після важкої травми...	Півзахисник Лос-Анджелес Гелаксі Рікард Пуч зробив пост у соціальній мережі.	https://sport.nv.ua/ukr/football/rikard-puch-foto-togo-yak-noga-futbolista-viglyadaye-pislya-rozrivu-hrestiv-50484199.html	2025-01-23T13:25:00-08:00	https://static.nv.ua/shared/system/Article/posters/003/025/110/original/078d60833fa820ec6fc2fe92bbf918dc.jpg?q=85&stamp=20250123230416&w=900
Чехія допомагає українським біженцям. Які курси можна обрати, щоб...	Разом із прибуттям тисяч біженців війни до Чехії попит на курси чеської мови значно зріс. Деякі мовні школи пропонують українцям безкоштовні уроки чеської мови. Біженці також можуть вивчати чеську мову безкоштовно, наприклад, в інтеграційних центрах або в рамках курсів, які готують регіони	https://nv.ua/ukr/ukraine/events/ukrajinci-v-chehiji-de-vivchati-chesku-movu-y-piti-na-kursi-z-nulya-abo-mayuchi-pochatkoviy-riven-50484010.html	2025-01-23T13:15:00-08:00	https://static.nv.ua/shared/system/Article/posters/003/024/703/original/5a9a14585900d36046aad8ce08ae1646.jpg?q=85&stamp=20250123134819&w=900
Китай почав таємно допомагати Ірану виробляти паливо для ракет — ...	Два іранських вантажних судна, які перевозять важливий хімічний інгредієнт для ракетного палива, вирушать із Китаю до Ірану протягом кількох тижнів, повідомляє Financial Times.	https://nv.ua/ukr/world/geopolitics/kitay-pochav-dopomagati-iranu-z-virobnictvom-raket-50484197.html	2025-01-23T13:05:00-08:00	https://static.nv.ua/shared/system/Article/posters/003/025/106/original/59e9bd630424a22243d83d59284ad25a.jpg?q=85&stamp=20250123223640&w=900
Впливає на молодість і довголіття. Як підвищити рівень гормону ро...	Ці поради можуть допомогти обійтися без замісної гормональної терапії	https://nv.ua/ukr/blogs/yak-pidvishchiti-riven-gormonu-rostu-poradi-likarya-50484157.html	2025-01-23T13:03:00-08:00	https://static.nv.ua/shared/system/Article/posters/003/025/022/original/9bdc6bd203af581571f72a3cf7ee97bc.jpg?q=85&stamp=20250123192405&w=900
В Оболонському районі Києва двоє дівчат побили 13-річну школярку,...	Правоохоронці проводять перевірку за фактом побиття 13-річної школярки в Оболонському районі столиці. Про це повідомляє поліція Києва в четвер, 23 січня.	https://nv.ua/ukr/ukraine/events/pobittya-shkolyarki-v-obolonskomu-rayoni-kiyeva-policiya-vidkrila-kriminalne-provadzhennya-50484198.html	2025-01-23T12:57:00-08:00	https://static.nv.ua/shared/system/Article/posters/003/025/108/original/46b15daedfbca7103c42301497c72767.jpg?q=85&stamp=20250123224559&w=900
Фіаско. Samsung відмовилася від функції смартфона, якою користува...	Цьогорічна версія Samsung Galaxy Ultra все ще має стилус S Pen, але його функціонал суттєво обмежили через вкрай низьку популярність багатьох інструментів.	https://techno.nv.ua/ukr/gadgets/stilus-s-pen-50484028.html	2025-01-23T12:55:00-08:00	https://static.nv.ua/shared/system/Article/posters/003/024/742/original/1e6c0031dde68c51d1c5c2fcc93f696c.jpg?q=85&stamp=20250123185733&w=900
ДПСУ затримала на кордоні 26-річного хлопця, який стверджував, що...	У пункті пропуску залізничного сполучення Могилів-Подільський прикордонники виявили 26-річного мешканця Донецької області, який стверджував що він батько трьох дітей. Про це повідомили у ДПСУ у четвер, 23 січня.	https://nv.ua/ukr/ukraine/events/peretin-kordonu-prikordonniki-zupinili-26-richnogo-feykovogo-batka-z-troma-ditmi-50484193.html	2025-01-23T12:49:00-08:00	https://static.nv.ua/shared/system/Article/posters/003/025/097/original/3a822f3099360b782f4ea92a4ffbc58b.jpg?q=85&stamp=20250123222246&w=900
Реформа добровільного призову для 18−25-річних на фінальній стаді...	Заступник керівника Офісу президента та екскомандир 93-ї окремої механізованої бригади Холодний Яр Павло Паліса повідомив, що реформа залучення до війська громадян віком 18−25 років перебуває на фінальній стадії розробки.	https://nv.ua/ukr/ukraine/events/mobilizaciya-18-25-rokiv-reforma-dobrovilnogo-prizovu-na-zavershalniy-stadiji-zayavili-v-op-50484195.html	2025-01-23T12:47:00-08:00	https://static.nv.ua/shared/system/Article/posters/003/025/102/original/c780dadca144a55efec4017f2f53a962.jpg?q=85&stamp=20250123224458&w=900
Особисто знайомі'. Кім розповів, хто є автором Telegram-каналу Н...	Очільник Миколаївської ОВА Віталій Кім розповів, хто є автором Telegram-каналу Николаевский Ванек. За його словами, це реальна людина, на ім'я Іван.	https://nv.ua/ukr/ukraine/events/nikolaevskiy-vanek-kim-rozpoviv-hto-stojit-za-telegram-kanalom-50484192.html	2025-01-23T12:45:00-08:00	https://static.nv.ua/shared/system/Article/posters/003/025/095/original/a94586ada21303393fcd5a8ca7bd9b9a.jpg?q=85&stamp=20250123220725&w=900
Одноклубник Бензема незвичним чином дізнався стать дитини, провів...	У середу, 22 січня, у матчі 16-го туру чемпіонату Саудівської Аравії Аль-Іттіхад у домашньому матчі переграв Аль-Шабаб — 2:1.	https://sport.nv.ua/ukr/football/video-togo-yak-odnoklubnik-benzema-diznavsya-stat-svoyeji-ditini-v-rozdyagalni-50484189.html	2025-01-23T12:21:00-08:00	https://static.nv.ua/shared/system/Article/posters/003/025/088/original/0ebc15f86808d67516e17d42ec501abf.jpg?q=85&stamp=20250123220114&w=900
Сили оборони відійшли з Нововасилівки на Донеччині — DeepState	Українські військові завершили оборону населеного пункту Нововасилівка, що на Покровському напрямку в Донецькій області. Про це повідомляє DeepState у четвер, 23 січня.	https://nv.ua/ukr/ukraine/events/novovasilivka-na-pokrovskomu-napryamku-okupovana-pishe-deepstate-23-sichnya-50484190.html	2025-01-23T12:20:00-08:00	https://static.nv.ua/shared/system/Article/posters/003/025/090/original/318fd68abf1c4a56abacb366b3f31536.jpg?q=85&stamp=20250123220546&w=900
Укрзалізниці поскаржилися на відсутність сполучення з Кримом та Д...	Укрзалізниця опублікувала лист, у якому 'громадянин України' поскаржився на відсутність прямого залізничного сполучення до окупованих Криму та Донецька вже десять років. Також він хотів дізнатися, з 'якої причини немає сполучення з Білоруссю'.	https://nv.ua/ukr/lifestyle/ukrzaliznici-poskarzhilisya-na-vidsutnist-spoluchennya-z-krimom-ta-doneckom-shukayut-vidpovid-50484188.html	2025-01-23T12:06:00-08:00	https://static.nv.ua/shared/system/Article/posters/003/025/086/original/389dbeed0e3a15b0fce85f9247250d53.jpg?q=85&stamp=20250123215809&w=900
Перш ніж одружитися. Три запитання, які варто поставити собі	Від цих негласних угод залежить, як складеться ваше спільне життя	https://nv.ua/ukr/blogs/tri-pitannya-yaki-varto-obgovoriti-pered-vesillyam-sekret-shchaslivogo-shlyubu-50484163.html	2025-01-23T12:03:00-08:00	https://static.nv.ua/shared/system/Article/posters/003/025/035/original/73915406807a3439c89eec67c10bb02b.jpg?q=85&stamp=20250123193958&w=900
Трамп помилував двох поліціянтів, яких засудили за вбивство афроа...	Президент США Дональд Трамп помилував двох поліціянтів у Вашингтоні, які були засуджені за вбивство у 2020 році 20-річного темношкірого чоловіка на ім'я Карон Гілтон-Браун. Про це повідомили у Біломі домі, пише Reuters.	https://nv.ua/ukr/world/countries/tramp-pomiluvav-zasudzhenih-za-vbivstvo-afroamerikancya-dvoh-policeyskih-50484183.html	2025-01-23T12:02:00-08:00	https://static.nv.ua/shared/system/Article/posters/003/025/076/original/4d0dd63e6e475e67ebc7db2d6fb28529.jpg?q=85&stamp=20250123211432&w=900
Чому розсада не проростає. Основні причини та рекомендації від до...	Наближається останній місяць зими та час висаджування першої розсади.	https://life.nv.ua/ukr/lifehacks/rozsada-pislya-zimi-shcho-robiti-yakshcho-roslini-ne-prorostayut-rekomendaciji-dosvidchenih-gorodnikiv-50483752.html	2025-01-23T11:59:00-08:00	https://static.nv.ua/shared/system/Article/posters/003/024/149/original/adea1bb313af6d3058ecaec63d843cdf.jpg?q=85&stamp=20250122162529&w=900
У Росії вперше засудили військового за мародерство — ЗМІ	Курський гарнізонний військовий суд виніс вирок російському військовому Станіславу Лопатіну, якого звинуватили в мародерстві.	https://nv.ua/ukr/world/countries/u-rosiji-viznali-fakti-maroderstva-sered-svojih-viyskovih-vineseno-pershiy-virok-50484187.html	2025-01-23T11:50:00-08:00	https://static.nv.ua/shared/system/Article/posters/003/025/084/original/18511cd2286baf8e6b4f2543f82f9cd3.jpg?q=85&stamp=20250123215027&w=900
Суд у США заблокував указ Трампа про скасування громадянства за п...	Суд у США в четвер, 23 січня, видав постанову на два тижні, яка блокує спроби президента Дональда Трампа скасувати громадянство за правом народження для дітей мігрантів. Про це повідомляє The Washington Post.	https://nv.ua/ukr/world/countries/tramp-hoche-skasuvati-gromadyanstvo-za-pravom-narodzhennya-sud-timchasovo-zablokuvav-ukaz-50484185.html	2025-01-23T11:41:00-08:00	https://static.nv.ua/shared/system/Article/posters/003/025/080/original/39931c1c2522962df24f86beeea713c2.jpg?q=85&stamp=20250123213056&w=900
У Куп’янському районі розширили зону примусової евакуації сімей і...	У четвер, 23 січня, у Куп’янському районі Харківської області запровадили примусову евакуацію родин із дітьми з чотирьох населених пунктів Великобурлуцької громади та 12 сіл Кіндрашівської громади.	https://nv.ua/ukr/ukraine/events/situaciya-v-kup-yansku-u-rayoni-vveli-obov-yazkovu-evakuaciyu-50484186.html	2025-01-23T11:39:00-08:00	https://static.nv.ua/shared/system/Article/posters/003/025/082/original/f84fe781a34cf3e83920f76e92fc6198.jpg?q=85&stamp=20250123213451&w=900
Довбик жорстко зіграв проти суперника в матчі Ліги Європи — медик...	Український форвард Артем Довбик вийшов у стартовому складі в поєдинку сьомого туру Ліги Європи АЗ — Рома.	https://sport.nv.ua/ukr/football/video-yak-artem-dovbik-vdariv-liktem-vautera-goesha-v-matchi-ligi-yevropi-mediki-zupinili-krovotechu-50484182.html	2025-01-23T11:38:00-08:00	https://static.nv.ua/shared/system/Article/posters/003/025/074/original/477f136750b3fd3b785cfbaa59b699f6.jpg?q=85&stamp=20250123210928&w=900
Юридична компанія Міллер взялася за справу дівчинки з Білої Церкв...	Юридична компанія Міллер у четвер, 23 січня, повідомила, що буде захищати у суді 12-річну дівчинку з Білої Церкви, яку побила група підлітків. Про це повідомили на сторінці компанії у Facebook.	https://nv.ua/ukr/ukraine/events/pobittya-divchinki-u-biliy-cerkvi-na-zahist-ditini-stala-yuridichna-kompaniya-miller-50484181.html	2025-01-23T11:30:00-08:00	https://static.nv.ua/shared/system/Article/posters/003/025/072/original/82ab653b98eebae185620aadbc807adc.jpg?q=85&stamp=20250123211211&w=900
