Title	Description	Link	pubDate	Image
Наша кухня простіша і ближча до землі'. Інтерв'ю з фуд-блогеркою...	Як можна розповідати про країну через її їжу, відрізняти кухні за харчовими звичками, надихатися прикладом інших у створенні сучасних страв, та позбутися радянщини на обкладинці розповіла Анна Волошина.	https://nv.ua/ukr/food/eat/anna-voloshina-ukrajinka-v-americi-prosuvaye-ukrajinsku-kuhnyu-gotuye-vecheri-ta-rozpovidaye-jizhu-shefiv-50465398.html	2024-11-17T10:37:00-08:00	https://static.nv.ua/shared/system/Article/posters/002/984/762/original/d92e9299321ceb5c8f6e1c3c0f43241b.jpg?q=85&stamp=20241111103007&w=900
Підкреслюють колорит. П’ять найпопулярніших на Гуцульщині імен	Гуцульщина — це унікальний етнографічний регіон Карпат, де здавна сформувалися своєрідні традиції, культура та звичаї. У гуцулів є свій особливий стиль одягу, традиції та діалект, який зберігає унікальні імена.	https://nv.ua/ukr/ukraine/events/ukrajinska-mova-p-yat-naypopulyarnishih-na-guculshchini-imen-50466538.html	2024-11-17T10:35:00-08:00	https://static.nv.ua/shared/system/Article/posters/002/987/241/original/b733d9ca72ba83c7af7a49ea4efd1266.jpg?q=85&stamp=20241114201615&w=900
На голові Мальдіви'. Легенда збірної України зізнався, через що ...	Колишній захисник збірної України Артем Федецький пригадав, як жартував з ексодноклубника Романа Зозулі.	https://sport.nv.ua/ukr/football/artem-fedeckiy-pro-zachisku-romana-zozuli-50467169.html	2024-11-17T10:29:00-08:00	https://static.nv.ua/shared/system/Article/posters/002/988/589/original/86a55176691efabd009e9f5e95d44d2f.jpg?q=85&stamp=20241117202006&w=900
США дозволили Україні застосовувати ATACMS для ударів углиб РФ — ...	Президент США Джо Байден у неділю, 17 листопада, дозволив Україні використовувати ракети ATACMS для ударів углиб території РФ. Про це повідомляє The New York Times з посиланням на офіційних осіб США.	https://nv.ua/ukr/ukraine/events/ssha-dozvolili-ukrajini-zastosovuvati-atacms-dlya-udariv-uglib-rf-nyt-50467168.html	2024-11-17T10:15:00-08:00	https://static.nv.ua/shared/system/Article/posters/002/988/587/original/5d4f46a822011aba0992192ebda31297.jpg?q=85&stamp=20241117201521&w=900
Велика Британія призупинила постачання Storm Shadow в Україну: Th...	Велика Британія, ймовірно, зупинила постачання в Україну крилатих ракет Storm Shadow до моменту зняття всіх обмежень на удари по території Росії. Про це повідомляє The Times у неділю, 17 листопада.	https://nv.ua/ukr/ukraine/events/storm-shadow-zmi-diznalisya-chomu-britaniya-mogla-pripiniti-peredachu-ukrajini-krilatih-raket-50467166.html	2024-11-17T10:10:00-08:00	https://static.nv.ua/shared/system/Article/posters/002/988/583/original/99adc0f463138f26c54e96596cb08a76.jpg?q=85&stamp=20241117193501&w=900
Росія атакує шахедами з півночі, у Сумах пролунав вибух	Після 16:00 Росія почала нову атаку шахедами проти України, запустивши їх з півночі, у Сумах пролунав вибух.	https://nv.ua/ukr/ukraine/events/rosiya-vvecheri-17-listopada-atakuye-shahedami-vsi-podrobici-onlayn-50467167.html	2024-11-17T09:56:00-08:00	https://static.nv.ua/shared/system/Article/posters/002/988/585/original/fd1a48c68c527f1c25e742f83a79e112.jpg?q=85&stamp=20241117195025&w=900
Шалений момент України. Легенда Карпат незадоволено оцінив кінців...	У суботу, 16 листопада, збірна України поділила очки з Грузією у рамках п’ятого туру Ліги націй.	https://sport.nv.ua/ukr/football/gruziya-ukrajina-igor-hudob-yak-pro-moment-guculyaka-ta-nazarenka-50467165.html	2024-11-17T09:47:00-08:00	https://static.nv.ua/shared/system/Article/posters/002/988/581/original/18c47d6c6f9a2492f67996a61664e351.jpg?q=85&stamp=20241117193141&w=900
Зеленський пообіцяв підписати закон про цивільні партнерства — ві...	Президент України Володимир Зеленський пообіцяв підписати закон про цивільні партнерства.	https://nv.ua/ukr/ukraine/politics/zelenskiy-poobicyav-shcho-pidpishe-zakon-pro-civilne-partnerstvo-novini-ukrajini-video-50467164.html	2024-11-17T09:30:00-08:00	https://static.nv.ua/shared/system/Article/posters/002/988/579/original/b32cb5c321413ea871dc7d9978b27bfa.jpg?q=85&stamp=20241117192547&w=900
Російські дрони та ракети залетіли на територію Молдови під час а...	Під час російської атаки на Україну у неділю, 17 листопада, дрони та ракети з РФ залетіли на територію Молдови. Про це повідомив міністр закордонних справ країни Михаїл Попсой у соцмережі X.	https://nv.ua/ukr/world/countries/rosiyska-ataka-17-listopada-na-teritoriyu-moldovi-zaletili-droni-ta-raketi-video-50467159.html	2024-11-17T09:19:00-08:00	https://static.nv.ua/shared/system/Article/posters/002/988/568/original/f9ceb4d21ad0c82d76e689ea534588cf.jpg?q=85&stamp=20241117183615&w=900
У Берліні пройшов організований російською опозицією антивоєнний ...	17 листопада в Берліні відбувся організований представниками російської опозиції антивоєнний марш із вимогами виведення російських військ з України та відставки російського диктатора Володимира Путіна.	https://nv.ua/ukr/world/geopolitics/u-berlini-vidbuvsya-antivoyenniy-marsh-rosiyskoji-opoziciji-novini-rosiji-foto-50467158.html	2024-11-17T09:00:00-08:00	https://static.nv.ua/shared/system/Article/posters/002/988/566/original/c8717d0089340fd50009aa3e1a31b584.jpg?q=85&stamp=20241117183534&w=900
Викривлене розуміння'. Учасниця Холостяка Настя Анісімова, яка з...	Блогерка Анастасія Анісімова, яка бере участь у шоу Холостяк 13 з ветераном війни Олександром Тереном, на сторінці в Instagram розповіла, що зіткнулася з образливими коментарями після того, як повідомила, що має інвалідність.	https://life.nv.ua/ukr/znamenitosti/uchasnicya-holostyak-13-nastya-anisimova-maye-invalidnist-yak-anisimova-boretsya-z-vazhkoyu-hvoroboyu-50467160.html	2024-11-17T08:58:00-08:00	https://static.nv.ua/shared/system/Article/posters/002/988/570/original/d4641052530a1bda310e1fd69f2f0652.jpg?q=85&stamp=20241117183138&w=900
У понеділок у всіх областях України будуть діяти графіки відключе...	В Укренерго ввечері у неділю, 17 листопада, повідомили про запровадження графіків відключення світла у всіх регіонах у понеділок, 18 листопада. Про це заявили у Telegram компанії.	https://nv.ua/ukr/ukraine/events/vidklyuchennya-svitla-18-listopada-v-ukrenergo-povidomili-pro-zaprovadzhennya-grafikiv-50467162.html	2024-11-17T08:55:00-08:00	https://static.nv.ua/shared/system/Article/posters/002/988/574/original/2555b7d29ad2c3f3816036b8708872af.jpg?q=85&stamp=20241117185040&w=900
Тепер для всіх. OpenAI розширила доступ до програми ChatGPT для W...	Користувачі ChatGPT без підписки тепер також мають доступ до програми OpenAI для Windows.	https://techno.nv.ua/ukr/it-industry/chatgpt-dlya-windows-50466803.html	2024-11-17T08:50:00-08:00	https://static.nv.ua/shared/system/Article/posters/002/987/814/original/4ecd17385f3410d5330dc0a095672805.jpg?q=85&stamp=20241115161703&w=900
Ніхто не виділявся, бо розслабились'. Худоб’як знайшов проблему ...	У суботу, 16 листопада, збірна України зіграла в гольову нічию проти Грузії у п’ятому турі Ліги націй.	https://sport.nv.ua/ukr/football/gruziya-ukrajina-igor-hudob-yak-pro-nichiyu-u-batumi-50467161.html	2024-11-17T08:47:00-08:00	https://static.nv.ua/shared/system/Article/posters/002/988/572/original/1916a8984fccfd6efc7866d4916c546c.jpg?q=85&stamp=20241117182954&w=900
Приїхала до Великої Британії. Тіна Кароль поділилася рідкісним фо...	Співачка Тіна Кароль у Stories опублікувала рідкісне фото з 15-річним сином Веніаміном. Зараз артистка гастролює з концертами Європою. Днями Кароль виступила у Відні. 18 листопада Кароль дасть концерт у Брюсселі, а 19 — у Лондоні.	https://life.nv.ua/ukr/znamenitosti/tina-karol-prijihala-do-sina-u-veliku-britaniyu-spivachka-pokazala-foto-z-veniaminom-50467157.html	2024-11-17T08:21:00-08:00	https://static.nv.ua/shared/system/Article/posters/002/988/564/original/52a9836a7bedfe852c57857915731843.jpg?q=85&stamp=20241117181005&w=900
Роботи-собаки патрулюють резиденцію Трампа у Флориді: на їхній но...	Приватну віллу Мар-а-Лаго в Палм-Біч у Флориді, що належить майбутньому президенту США Дональду Трампу, патрулюють роботизовані собаки-охоронці Spot. Вони нещодавно з’явилися в арсеналі Секретної служби США, повідомляє BBC у неділю, 17 листопада.	https://nv.ua/ukr/world/countries/donald-tramp-budinok-obranogo-prezidenta-ssha-patrulyuyut-sobaki-roboti-50467156.html	2024-11-17T08:18:00-08:00	https://static.nv.ua/shared/system/Article/posters/002/988/560/original/1df54a23007a2bee7a303292ebf363b1.jpg?q=85&stamp=20241117173349&w=900
Роботи-собаки патрулюють резиденцію Трампа у Флориді: на їхній но...	Приватну віллу Мар-а-Лаго в Палм-Біч у Флориді, що належить майбутньому президенту США Дональду Трампу, патрулюють роботизовані собаки-охоронці Spot. Вони нещодавно з’явилися в арсеналі Секретної служби США, повідомляє BBC у неділю, 17 листопада.	https://nv.ua/ukr/world/countries/donald-tram-budinok-obranogo-prezidenta-ssha-patrulyuyut-sobaki-roboti-50467156.html	2024-11-17T08:18:00-08:00	https://static.nv.ua/shared/system/Article/posters/002/988/560/original/1df54a23007a2bee7a303292ebf363b1.jpg?q=85&stamp=20241117173349&w=900
Північна Корея може надати Путіну для війни проти України 100 тис...	Північна Корея може надати російському диктатору Володимиру Путіну до 100 тисяч військових, щоб допомогти йому у його війні проти України, якщо альянс між Москвою і Пхеньяном продовжить поглиблюватися, повідомляє Bloomberg із посиланням на джерела, знайомі з оцінками деяких країн G20.	https://nv.ua/ukr/world/geopolitics/kndr-mozhe-vidpraviti-voyuvati-proti-ukrajini-100-tisyach-viyskovih-bloomberg-novini-ukrajini-50467154.html	2024-11-17T08:11:00-08:00	https://static.nv.ua/shared/system/Article/posters/002/988/557/original/698a407ee78a7c574592ce15747e4b5d.jpg?q=85&stamp=20241117175137&w=900
Вони у нас тільки на папері'. Леоненко вказав на найгірших гравц...	Колишній нападник київського Динамо та збірної України Віктор Леоненко розкритикував низку гравців синьо-жовтих за гру проти Грузії (1:1).	https://sport.nv.ua/ukr/football/gruziya-ukrajina-viktor-leonenko-rozkritikuvav-lideriv-komandi-rebrova-50467152.html	2024-11-17T08:02:00-08:00	https://static.nv.ua/shared/system/Article/posters/002/988/553/original/8d9a1c7e01ef27ddc6536a9ffda70d4a.jpg?q=85&stamp=20241117171603&w=900
Світові Арени майбутнього. Які сектори економіки стануть найбільш...	McKinsey Global Institute визначив 18 сфер, які у найближчому майбутньому можуть змінити світову економіку. У 2040 році вони можуть принести від $29 до $48 трлн доходу та від $2 до $6 трлн прибутку. Їхня сукупна частка у світовому ВВП може зрости з 4% до 10−16%	https://biz.nv.ua/ukr/economics/18-sfer-biznesu-yaki-budut-aktivno-rozvivatis-do-2040-roku-novini-ukrajini-50466919.html	2024-11-17T07:53:00-08:00	https://static.nv.ua/shared/system/Article/posters/002/988/057/original/42b7d9099403a06066045f1fcc0b9a78.jpg?q=85&stamp=20241115235618&w=900
Євген Синельников відповів, чи підтримує дружні стосунки з Андріє...	Режисер, продюсер і блогер Євген Синельников в інтерв'ю програмі 33 запитання від Люкс ФМ зізнався, чи може назвати свого колишнього колегу по проєкту Орел і решка Андрія Бєднякова своїм другом.	https://life.nv.ua/ukr/znamenitosti/yevgen-sinelnikov-ziznavsya-chi-spilkuyetsya-z-andriyem-byednyakovim-i-yak-vidreaguvav-na-yogo-rozluchennya-50467150.html	2024-11-17T07:28:00-08:00	https://static.nv.ua/shared/system/Article/posters/002/988/548/original/f51049af0d02c041f7ff49e5f8793118.jpg?q=85&stamp=20241117172338&w=900
У Празі протестувальники вимагають зняти український прапор з буд...	У Празі у неділю, 17 листопада, сотні людей вийшли на протест й виступають за зняття українського прапора з будівлі Національного музею, який висить там з лютого 2022 року. Про це повідомляє Радіо Свобода у соцмережі X.	https://nv.ua/ukr/world/countries/praga-protesti-17-listopada-lyudi-vimagayut-znyati-ukrajinskiy-prapor-z-budivli-u-centri-video-50467148.html	2024-11-17T07:24:00-08:00	https://static.nv.ua/shared/system/Article/posters/002/988/543/original/d7cda3e225f3ed37b443e687c27a22e8.jpg?q=85&stamp=20241117165624&w=900
То ж про що Шольц говорив із Путіним?	Телефонна розмова між канцлером ФРН Шольцем і Путіним викликала чималий інтерес. Дехто сприймає цю подію навіть як початок переговорів про завершення війни між Росією і Україною	https://nv.ua/ukr/opinion/fesenko-rozpoviv-navishcho-putin-govoriv-z-sholcem-novini-ukrajini-50467153.html	2024-11-17T07:16:00-08:00	https://nv.ua/upload/nv_fix_image.jpeg
Я казав, що ми програємо'. Легендарний Сабо відверто оцінив гру ...	У суботу, 16 листопада, збірна України зіграла внічию проти Грузії (1:1) у рамках пʼятого туру Ліги націй.	https://sport.nv.ua/ukr/football/gruziya-ukrajina-yozhef-sabo-pro-nichiyu-v-lizi-naciy-50467146.html	2024-11-17T07:14:00-08:00	https://static.nv.ua/shared/system/Article/posters/002/988/539/original/fc4261b086cff25f2039c52e705ca553.jpg?q=85&stamp=20241117162408&w=900
Наслідки масованого обстрілу Росії: українські АЕС скоротили виро...	Внаслідок ракетної атаки вранці 17 листопада були пошкоджені кілька підстанцій, від яких залежить зовнішнє живлення українських АЕС, а самі АЕС зменшили виробництво електроенергії.	https://nv.ua/ukr/ukraine/events/cherez-masovanu-ataku-ukrajinski-aes-skorotili-virobnictvo-elektroenergiji-novini-ukrajini-50467147.html	2024-11-17T07:04:00-08:00	https://static.nv.ua/shared/system/Article/posters/002/988/541/original/d22744ca792a7804b5990525971b8a54.jpg?q=85&stamp=20241117165403&w=900
В Україні панує 'розпач' після перемоги Трампа на виборах президе...	Президент України Володимир Зеленський збирається представити План стійкості з десяти пунктів, щоб підняти моральний дух українського народу, підірваний після перемоги Дональда Трампа на виборах президента США.	https://nv.ua/ukr/ukraine/politics/plan-stiykosti-zelenskiy-oprilyudnit-dokument-shchob-pidnyati-moralniy-duh-narodu-pishe-the-times-50467138.html	2024-11-17T06:55:00-08:00	https://static.nv.ua/shared/system/Article/posters/002/988/520/original/8fe28b17bdc7613ab22dfc3c44e2b92d.jpg?q=85&stamp=20241117164652&w=900
В Одеській області під час російської атаки загинули двоє енергет...	В Одеській області внаслідок масованої російської атаки у неділю, 17 листопада, загинули двоє працівників підстанції Укренерго. Про це повідомили у Telegram-каналі Укренерго.	https://nv.ua/ukr/ukraine/events/obstril-ukrajini-17-listopada-v-odeskiy-oblasti-zaginuli-dvoye-energetikiv-50467145.html	2024-11-17T06:39:00-08:00	https://static.nv.ua/shared/system/Article/posters/002/988/537/original/8662fbb248f69ced7a84f39befad60ab.jpg?q=85&stamp=20241117163640&w=900
Віком 280 млн років. Туристи натрапили на сліди стародавньої екос...	Під час звичайної прогулянки італійськими Альпами туристка Клаудія Стеффенсен та її чоловік зробили дивовижне відкриття, яке перевернуло уявлення вчених про минуле нашої планети.	https://techno.nv.ua/ukr/popscience/turist-vipadkovo-viyaviv-starodavnyu-ekosistemu-v-italiyskih-alpah-50466713.html	2024-11-17T06:30:00-08:00	https://static.nv.ua/shared/system/Article/posters/002/987/615/original/3e75cf43acb03c73bf098ddf4ce6f58e.jpg?q=85&stamp=20241115130617&w=900
Замовкни, жалюгідний невдахо'. Кривдник Майка Тайсона жорстко ві...	Колишній чемпіон світу Карл Фроч після перемоги Джейка Пола над Майком Тайсоном заявив, що переміг би боксера-блогера за один раунд.	https://sport.nv.ua/ukr/boxing/dzheyk-pol-vidpoviv-karlu-frochu-na-yogo-zayavu-pro-nokaut-v-pershomu-raundi-50467143.html	2024-11-17T06:29:00-08:00	https://static.nv.ua/shared/system/Article/posters/002/988/532/original/10eb3f0566fbaab1c650a3608beda94d.jpg?q=85&stamp=20241117155811&w=900
Німецькі Зелені обрали кандидатом у канцлери на майбутніх виборах...	Німецька Партія зелених на своєму з'їзді 17 листопада обрала Роберта Габека, який зараз є віцеканцлером, своїм кандидатом на посаду канцлера на федеральних виборах.	https://nv.ua/ukr/world/countries/vicekanclera-roberta-gabeka-obrali-kandidatom-u-kancleri-na-viborah-u-nimechchini-50467142.html	2024-11-17T06:26:00-08:00	https://static.nv.ua/shared/system/Article/posters/002/988/530/original/b8f4676c4db8d0343836217031aac51f.jpg?q=85&stamp=20241117161825&w=900
Німецькі Зелені обрали кандидатом у канцлери на майбутніх виборах...	Німецькі Зелені обрали Роберта Габека, який зараз є віцеканцлером, своїм кандидатом на посаду канцлера на федеральних виборах.	https://nv.ua/ukr/world/countries/vice-kanclera-roberta-gabeka-obrali-kandidatom-u-kancleri-na-viborah-u-nimechchini-50467142.html	2024-11-17T06:26:00-08:00	https://static.nv.ua/shared/system/Article/posters/002/988/530/original/b8f4676c4db8d0343836217031aac51f.jpg?q=85&stamp=20241117161825&w=900
Шольц пояснив свій дзвінок Путіну: Було важливо продемонструвати,...	Канцлер Німеччини Олаф Шольц заявив, що його дзвінок російському диктатору Володимиру Путіну мав нібито продемонструвати непохитність підтримки Заходом України. Про це повідомляє агентство Reuters у неділю, 17 листопада.	https://nv.ua/ukr/world/geopolitics/dzvinok-putinu-sholc-kazhe-shcho-hotiv-pokazati-putinu-nepohitnist-pidtrimki-ukrajini-50467137.html	2024-11-17T06:13:00-08:00	https://static.nv.ua/shared/system/Article/posters/002/988/518/original/5032b58749dddfeed10f76c7662fcdcd.jpg?q=85&stamp=20241117154752&w=900
Путіна не зупинити дзвінками'. Туск заявив, що наступні тижні ст...	Прем'єр-міністр Польщі Дональд Туск заявив, що новий масований удар Росії по Україні є доказом того, що дипломатія по телефону не може замінити реальну підтримку з боку Заходу.	https://nv.ua/ukr/world/geopolitics/viyna-v-ukrajini-tusk-zayaviv-shcho-putina-ne-zupiniti-dzvinkami-i-nastupni-tizhni-budut-virishalnimi-50467141.html	2024-11-17T06:09:00-08:00	https://static.nv.ua/shared/system/Article/posters/002/988/528/original/01a75148c7cd3af20e3d2edfa6537727.jpg?q=85&stamp=20241117155940&w=900
Світло обов’язково подолає темряву'. Настя Каменських показала, ...	Співачка Настя Каменських, яка без чоловіка Потапа повернулася в Україну, під час масованої атаки РФ по Україні 17 листопада ховалася в укритті на території свого заміського будинку у селищі Романків, що неподалік Конча-Заспи під Києвом.	https://life.nv.ua/ukr/znamenitosti/nastya-kamenskih-oblashtuvala-bunker-u-svoyemu-zamiskomu-budinku-v-yakomu-zhive-bez-potapa-foto-50467135.html	2024-11-17T06:05:00-08:00	https://static.nv.ua/shared/system/Article/posters/002/988/514/original/1b11e5b875b26d6a02ddf0b192b1c69e.jpg?q=85&stamp=20241117155317&w=900
Неспинна тяга до керма. Чому зросли автопродажі та які моделі маш...	NV з’ясував, що за три квартали 2024-го українці придбали на 15% більше нових автівок, ніж рік тому, а серпень взагалі видався рекордним за весь час великої війни.	https://biz.nv.ua/ukr/markets/avto-2024-yaki-modeli-ukrajinci-kuplyali-naybilshe-za-rik-i-chomu-roste-ob-yem-prodazh-50465468.html	2024-11-17T05:58:00-08:00	https://static.nv.ua/shared/system/Article/posters/002/984/923/original/a6f97df3fb5346d935bedde0941e129d.jpg?q=85&stamp=20241111130213&w=900
