Title	Description	Link	pubDate	Image
ВПО 2025. Кому автоматично продовжать виплати на проживання з 1 б...	З 1 березня 2025 року для внутрішньо переміщених осіб відбудеться автоматичне перепризначення виплат на проживання.	https://nv.ua/ukr/ukraine/events/viplati-vpo-2025-komu-avtomatichno-prodovzhat-z-1-bereznya-novini-ukrajini-50493899.html	2025-02-28T00:32:00-08:00	https://static.nv.ua/shared/system/Article/posters/003/045/989/original/b609d21f07ec84121dc6b10377a00ded.jpg?q=85&stamp=20250228101035&w=900
Ми схиляємося до цього варіанту'. Тренер Дюбуа несподівано похва...	Дон Чарльз, коуч володаря титулу IBF у суперважкій вазі Даніеля Дюбуа, висловився про можливий другий бій свого підопічного проти об'єднаного чемпіона цієї ж вагової категорії Олександра Усика.	https://sport.nv.ua/ukr/boxing/daniel-dyubua-obrav-oleksandra-usika-svojim-nastupnim-supernikom-zayaviv-trener-don-charlz-50493901.html	2025-02-28T00:31:00-08:00	https://static.nv.ua/shared/system/Article/posters/003/045/992/original/ac2e3ee1dd9066a815ed17a8e73cae8b.jpg?q=85&stamp=20250228101333&w=900
Уряд закрив систему Шлях для чоловіків, які перевозять гуманітарн...	Уряд закрив систему системи Шлях для водіїв, які перевозять гуманітарні та медичні вантажі. Тепер вони повинні мати інші підстави для виїзду з України, повідомляє Міністерство розвитку громад та територій України у п’ятницю, 28 лютого.	https://nv.ua/ukr/ukraine/events/sistemu-shlyah-zakrili-dlya-vodijiv-yaki-perevozyat-gumanitarku-y-liki-novini-ukrajini-50493904.html	2025-02-28T00:28:00-08:00	https://static.nv.ua/shared/system/Article/posters/003/045/998/original/71d41f99cf43c699490876d46d16286e.jpg?q=85&stamp=20250228102507&w=900
Знищив тьму ворогів'. У Мережі українці згадують загиблого на фр...	27 лютого на фронті загинув майданівець, захисник, операторт БПЛА Василь Ратушний. У Мережі українці згадують військового та висловлюють співчуття батькам, які втратили другого сина.	https://nv.ua/ukr/socium/vasil-ratushniy-zaginuv-u-merezhi-zgaduyut-poleglogo-zahisnika-i-brata-romana-ratushnogo-50493884.html	2025-02-28T00:23:00-08:00	https://static.nv.ua/shared/system/Article/posters/003/045/956/original/d0c4f32318a5fdb6b6a7748b89b7abe0.jpg?q=85&stamp=20250228093818&w=900
Політ закінчено. Біткоїн опускається все нижче після історичного ...	Біткоїн упав на чверть від історичного максимуму, досягнутого 20 січня, оскільки трейдери різко змінили ставки, зроблені після обрання президентом США Дональда Трампа.	https://biz.nv.ua/ukr/finance/bitkoyn-upav-na-25-vid-istorichnogo-maksimumu-pislya-inavguraciji-trampa-50493896.html	2025-02-28T00:18:00-08:00	https://static.nv.ua/shared/system/Article/posters/003/045/983/original/3decac181cb3cf25cfeee14b51bef4e7.jpg?q=85&stamp=20250228101759&w=900
Макрон після зустрічі з Трампом закликав Європу відмовитися від '...	Президент Франції Емманюель Макрон після візиту до Вашингтона та зустрічі з президентом США Дональдом Трампом закликав країни Європи бути 'більш об'єднаними та сильними, ніж будь-коли' та відмовитися від 'щасливої васальної залежності' від США.	https://nv.ua/ukr/world/geopolitics/zustrich-z-trampom-makron-zaklikav-yevropu-vidmovitisya-vid-vasalnoji-zalezhnosti-vid-ssha-50493898.html	2025-02-28T00:17:00-08:00	https://static.nv.ua/shared/system/Article/posters/003/045/987/original/a6781d4e4a34ffe6a57d8b75db1fcbda.jpg?q=85&stamp=20250228101159&w=900
Зеленський після зустрічі з Трампом дав інтерв'ю телеведучому Fox...	Телеведучий Брет Байєр для каналу Fox News взяв інтерв'ю у президента України Володимира Зеленського після його зустрічі з президентом Трампом у п’ятницю, 28 лютого, у Білому домі, повідомляє видання The Hill.	https://nv.ua/ukr/world/geopolitics/zustrich-trampa-i-zelenskogo-prezident-ukrajini-dav-interv-yu-kanalu-fox-news-50493895.html	2025-02-28T00:08:00-08:00	https://static.nv.ua/shared/system/Article/posters/003/045/981/original/b0d2e834741e3c4d54a18c1565cd4e24.jpg?q=85&stamp=20250228095947&w=900
Обговорять гарантії безпеки для України. Зеленський приїде в Лонд...	Прем'єр-міністр Великої Британії Кір Стармер проведе в Лондоні 2 березня саміт для обговорення гарантій безпеки України в разі припинення вогню. У ньому візьмуть участь президент Володимир Зеленський і понад десять лідерів інших європейських країн, пише Bloomberg у п’ятницю, 28 лютого.	https://nv.ua/ukr/world/geopolitics/zelenskiy-prijide-do-britaniji-na-zustrich-iz-18-liderami-yevropi-2-bereznya-50493889.html	2025-02-28T00:00:00-08:00	https://static.nv.ua/shared/system/Article/posters/003/045/967/original/016b8b1ec601ea126f61080b33a0d40f.jpg?q=85&stamp=20250228095639&w=900
Застосував сльозогінний газ і вдарив. На Сумщині 23-річний хлопец...	У Шостці Сумської області поліція затримала 23-річного місцевого мешканця, який, за даними правоохоронців, при перевірці у нього документів представниками ТЦК та СП поводився зухвало, відмовлявся виконувати вимоги та чинив опір.	https://nv.ua/ukr/ukraine/events/u-sumskiy-oblasti-cholovik-rozpiliv-slozoginniy-gaz-ta-vdariv-predstavnika-tck-ta-policeyskogo-50493891.html	2025-02-27T23:55:00-08:00	https://static.nv.ua/shared/system/Article/posters/003/045/971/original/f4a0c6e846737067e5d7098fb1f57cd7.jpg?q=85&stamp=20250228095620&w=900
Тренер українців головний кандидат на заміну Гвардіоли в Манчесте...	Наставник Манчестер Сіті Хосеп Гвардіола може залишити свою посаду влітку 2025 року.	https://sport.nv.ua/ukr/football/hosep-gvardiola-michel-mozhe-zaminiti-trenera-v-manchester-siti-50493892.html	2025-02-27T23:54:00-08:00	https://static.nv.ua/shared/system/Article/posters/003/045/973/original/d259ee441d0751933cab953731433b0a.jpg?q=85&stamp=20250228095356&w=900
Деякі продукти дешевшають. Ціни на один з овочів наблизились до м...	На поточному тижні українські виробники продають цибулю за ціною 7−13 грн/кг, залежно від якості та обсягів запропонованих партій продукції. І лише за цей тиждень ціни впали в середньому на 12%.	https://biz.nv.ua/ukr/economics/v-ukrajini-deshevshaye-odin-z-ovochiv-novini-ukrajini-50493887.html	2025-02-27T23:54:00-08:00	https://static.nv.ua/shared/system/Article/posters/003/045/964/original/524558b082763e410c66a3a97f308338.jpg?q=85&stamp=20250228094510&w=900
У ЗМІ оприлюднили деталі візиту Зеленського до Вашингтона	Візит президента Володимира Зеленського до США розпочнеться із зустрічі з сенаторами, після чого він проведе переговори із президентом Дональдом Трампом, повідомляє Європейська правда з посиланням на Офіс президента України.	https://nv.ua/ukr/world/geopolitics/vizit-zelenskogo-do-ssha-28-lyutogo-zmi-rozkrili-detali-shcho-vidomo-50493886.html	2025-02-27T23:53:00-08:00	https://static.nv.ua/shared/system/Article/posters/003/045/962/original/7f58ba71500d09e231af0d5126150eb0.jpg?q=85&stamp=20250228095548&w=900
Зірка Мілана перевершив досягнення легендарного експартнера Шевче...	В Італії відбувся перенесений матч дев’ятого туру Серії А-2024/25, у якому Болонья перемогла Мілан з рахунком — 2:1.	https://sport.nv.ua/ukr/football/rafael-leau-pidkoriv-istorichniy-rekord-kaka-50493885.html	2025-02-27T23:45:00-08:00	https://static.nv.ua/shared/system/Article/posters/003/045/958/original/730ecc35e1c1a1cf193df87fecf20b48.jpg?q=85&stamp=20250228093811&w=900
Пенсії, виплати ВПО, субсидії і тарифи: що і як зміниться з 1 бер...	У березні буде проіндексовано пенсії для понад 10 мільйонів українців. Виплати зростуть на 11,5%. Також у березні усім внутрішньо переміщеним особам за умови відповідності критеріям буде автоматично продовжено виплати на проживання.	https://nv.ua/ukr/ukraine/events/pensiji-viplati-vpo-subsidiji-i-tarifi-2025-shcho-zminitsya-z-1-bereznya-novini-ukrajini-50493590.html	2025-02-27T23:43:00-08:00	https://static.nv.ua/shared/system/Article/posters/003/045/332/original/e63374edacc64b523027b01d450981c8.jpg?q=85&stamp=20250227121502&w=900
Безпека в умовах воєнного стану: правила, як поводитися під час п...	Під час воєнного стану дотримання правил безпеки стає критично важливим для збереження життя та здоров’я. Від комендантської години до алгоритмів дій у разі виявлення підозрілих предметів — кожен аспект має значення.	https://nv.ua/ukr/ukraine/events/povitryana-trivoga-chogo-ne-mozhna-robiti-yak-povoditisya-y-poradi-viyskovoji-administraciji-50493880.html	2025-02-27T23:42:00-08:00	https://static.nv.ua/shared/system/Article/posters/003/045/947/original/16ec0ec2446c8aac9716ac722f0c3356.jpg?q=85&stamp=20250228093141&w=900
Трамп хоче скоротити сферу впливу Держдепу і низку посольств та к...	Президент США Дональд Трамп хоче скоротити Держдеп США, залишивши в ньому менше дипломатів, менше посольств, що працюють по всьому світу, і звузити сферу діяльності відомства.	https://nv.ua/ukr/world/geopolitics/donald-tramp-prezident-ssha-hoche-skorotiti-derzhdep-i-posolstva-po-vsomu-svitu-50493882.html	2025-02-27T23:42:00-08:00	https://static.nv.ua/shared/system/Article/posters/003/045/952/original/6b6ad30fa6ecd4209eadcbccf9581ee1.jpg?q=85&stamp=20250228094021&w=900
Щось пішло не так. На Полтавщині з’явилась вулиця Владислава Чорн...	У Лубнах на Полтавщині встановили адресну табличку вулиця Владислава Чорновола.	https://nv.ua/ukr/lifestyle/v-yacheslav-chornovil-stav-vladislavom-yak-ce-stalos-50493877.html	2025-02-27T23:36:00-08:00	https://static.nv.ua/shared/system/Article/posters/003/045/942/original/7f5527c41e3b76d4d9096b988a20b26a.jpg?q=85&stamp=20250228092949&w=900
Українські рахунки поки не відкривають. Revolut відповів на прете...	Фінтех-сервіс Revolut пропонує резидентам України рахунки лише в ЄС і не планує відкривати українські рахунки без додаткового дозволу.	https://biz.nv.ua/ukr/finance/revolut-v-ukrajini-kompaniya-vidpovila-na-zvinuvachennya-nacbanku-v-nezakonniy-diyalnosti-50493879.html	2025-02-27T23:34:00-08:00	https://static.nv.ua/shared/system/Article/posters/003/045/945/original/34124496482806eb882b584efc6b8894.jpg?q=85&stamp=20250228092029&w=900
Кінець безмитної торгівлі з ЄС? Як аграрії планують рятувати експ...	Після 5 червня 2025 року перед українськими аграріями постануть нові виклики щодо експортування продукції в країни Євросоюзу, оскільки Єврокомісія не планує продовжувати торгівлю з Україною на нинішніх безмитних умовах. Тож стейкхолдери аграрного ринку України вже шукають практичні рішення для врегулювання цього питання. Про це йшла мова на конференції 'Агросектор-2025: виклики та можливості у нових реаліях', яка відбулася в Києві 27 лютого 2025 року.	https://nv.ua/ukr/ukraine/events/yediniy-mitniy-tarif-yes-2025-chi-vidminyat-dlya-ukrajini-shcho-robiti-agrariyam-i-yaki-shlyahi-virishennya-50493767.html	2025-02-27T23:30:00-08:00	https://static.nv.ua/shared/system/Article/posters/003/045/711/original/ef4a9511aec4c94a14a30ecfcf050b4a.jpg?q=85&stamp=20250227183003&w=900
Кінець безмитної торгівлі з ЄС? Як аграрії планують рятувати експ...	Після 5 червня 2025 року перед українськими аграріями постануть нові виклики щодо експортування продукції в країни Євросоюзу, оскільки Єврокомісія не планує продовжувати торгівлю з Україною на нинішніх безмитних умовах. Тож стейкхолдери аграрного ринку України вже шукають практичні рішення для врегулювання цього питання. Про це йшла мова на конференції 'Агросектор-2025: виклики та можливості у нових реаліях', яка відбулася в Києві 27 лютого 2025 року.	https://biz.nv.ua/ukr/markets/yediniy-mitniy-tarif-yes-2025-chi-vidminyat-dlya-ukrajini-shcho-robiti-agrariyam-i-yaki-shlyahi-virishennya-50493767.html	2025-02-27T23:30:00-08:00	https://static.nv.ua/shared/system/Article/posters/003/045/711/original/ef4a9511aec4c94a14a30ecfcf050b4a.jpg?q=85&stamp=20250227183003&w=900
Безрозсудні дії': п’ять ексміністрів оборони США засудили звільн...	П’ять колишніх міністрів оборони США засудили 'безрозсудне' звільнення президентом Дональдом Трампом голови Об'єднаного комітету начальників штабів Чарльза Брауна та інших старших офіцерів. Про це вони написали у відкритому листі 27 лютого, повідомляє Reuters.	https://nv.ua/ukr/world/countries/zvilnennya-v-pentagoni-rozkritikuvali-p-yat-kolishnih-ministriv-oboroni-ssha-50493875.html	2025-02-27T23:15:00-08:00	https://static.nv.ua/shared/system/Article/posters/003/045/936/original/908409a775709c7bf6877e56a2c7215c.jpg?q=85&stamp=20250228091313&w=900
Кишинів відкладає акредитацію нового посла РФ через недружні заяв...	Через недружні заяви Кремля в Молдові відкладуть акредитацію нового посла РФ Олега Озерова.	https://nv.ua/ukr/world/geopolitics/agresiya-rf-proti-moldovi-kishiniv-vidkladaye-akreditaciyu-novogo-posla-rf-cherez-zayavi-kremlya-50493874.html	2025-02-27T23:12:00-08:00	https://static.nv.ua/shared/system/Article/posters/003/045/934/original/9ea50e947db369dde6abda6dabb014de.jpg?q=85&stamp=20250228090856&w=900
Нічна атака шахедами: ППО збила 107 зі 208 російських дронів — По...	У ніч проти п’ятниці, 28 лютого, армія РФ атакувала Україну 208 ударними БПЛА типу Shahed-131/136 та безпілотниками-імітаторами різних типів. Сили ППО знищили 107 дронів.	https://nv.ua/ukr/ukraine/events/nichna-ataka-shahedami-ppo-zbila-107-zi-208-rosiyskih-droniv-povitryani-sili-50493876.html	2025-02-27T23:11:00-08:00	https://static.nv.ua/shared/system/Article/posters/003/045/938/original/d15769a6b12f3d2b0c34d683eb43ef6f.jpg?q=85&stamp=20250228091141&w=900
Посередність і сміття'. Непереможений нокаутер образив Берінчика...	Чемпіон WBA в легкій вазі Джервонта Девіс (30−0, 28 КО) висловився про дострокову перемогу Кішона Девіса над Денисом Берінчиком у бою за звання чемпіона WBO в легкій вазі.	https://sport.nv.ua/ukr/boxing/berinchik-kishon-dzhervonta-devis-ociniv-porazku-ukrajincya-50493873.html	2025-02-27T23:11:00-08:00	https://static.nv.ua/shared/system/Article/posters/003/045/932/original/94ecb44a1b930d379e6949d975d5ef3b.jpg?q=85&stamp=20250228090801&w=900
Каллас розкритикувала Трампа за те, що він 'зачинив двері НАТО' д...	Високопоставлена дипломатка ЄС Кая Каллас заявила, що НАТО пропонує найкращі гарантії безпеки для України, та розкритикувала президента США Дональда Трампа в тому, що він піддався на російський наратив, 'зачинивши двері' Альянсу для України.	https://nv.ua/ukr/world/countries/kaya-kallas-rozkritikuvala-donalda-trampa-za-yogo-vislovlyuvannya-pro-vstup-ukrajini-v-nato-50493872.html	2025-02-27T23:05:00-08:00	https://static.nv.ua/shared/system/Article/posters/003/045/930/original/9cb93de6aedb460e205ffc6f118fcc7e.jpg?q=85&stamp=20250228090524&w=900
Чи виживе Україна без американської зброї - аналіз ВВС	Військова допомога США для України, що тривала усі три роки повномасштабної війни, може припинитися. Принаймні американський президент Дональд Трамп не відкидає цього варіанту і вважає, що тягар оборонної допомоги Києву має лягти на плечі Європи. Про те, що це означає для України, пишуть журналісти ВВС Олег Черниш та Павло Аксьонов. NV публікує їхній матеріал на правах інформаційної співпраці.	https://nv.ua/ukr/ukraine/events/dopomoga-ssha-dlya-ukrajini-mozhe-pripinitisya-chi-zmozhe-ukrajina-trimati-front-bez-amerikanskoji-zbroji-50493867.html	2025-02-27T23:04:00-08:00	https://static.nv.ua/shared/system/Article/posters/003/045/919/original/3588f05df67b799c60731492191f8178.jpg?q=85&stamp=20250228085939&w=900
Протверезний сигнал для України'. Негайне закінчення війни не зд...	Президент США Дональд Трамп, схоже, залишився байдужим до заклику прем'єр-міністра Великої Британії Кіра Стармера посилити прихильність США до захисту України, якщо і коли закінчиться війна, яку розв’язала Росія.	https://nv.ua/ukr/world/geopolitics/vizit-kira-starmera-do-trampa-podrobici-peregovoriv-u-bilomu-domi-50493866.html	2025-02-27T23:01:00-08:00	https://static.nv.ua/shared/system/Article/posters/003/045/918/original/2f03d68ca71c761e83a10fe8aa393ae5.jpg?q=85&stamp=20250228085110&w=900
Обігнати РФ і Китай. У Німеччині представили інноваційний термояд...	Новий проєкт термоядерного реактора на основі стеларатора може стати проривом в енергетиці. Технологія дає змогу безпечно і безперервно виробляти енергію без шкідливих викидів.	https://techno.nv.ua/ukr/popscience/nimechchina-predstavlyaye-innovaciyniy-proekt-termoyadernogo-reaktora-50493570.html	2025-02-27T23:00:00-08:00	https://static.nv.ua/shared/system/Article/posters/003/045/289/original/a52e5f76526f166daaf1bbcb3d32213e.jpg?q=85&stamp=20250227112924&w=900
Фанат зробив ефектне татуювання із зображенням Усика — боксер від...	Український чемпіон світу за версіями WBC, WBA, WBO та IBO в надважкій вазі Олександр Усик має багато фанатів, які його підтримують.	https://sport.nv.ua/ukr/boxing/oleksandr-usik-vidreaguvav-na-tatuyuvannya-fanata-yakiy-zobraziv-boksera-na-svoyemu-tili-foto-50493870.html	2025-02-27T22:58:00-08:00	https://static.nv.ua/shared/system/Article/posters/003/045/927/original/05da52a62e6220fc73141657fca1751e.jpg?q=85&stamp=20250228085048&w=900
Оскар 2025. Все що треба знати про цьогорічну церемонію нагородже...	2 березня у Лос-Анджелесі пройде 97-ма церемонія вручення премії Оскар. NV розповідає про цьогорічних номінантів, ведучого премії та зірок, які вручатимуть нагороди.	https://nv.ua/ukr/kultura/oskar-2025-de-divitis-kogo-nominuvali-hto-bude-vesti-ceremoniyu-50490143.html	2025-02-27T22:53:00-08:00	https://static.nv.ua/shared/system/Article/posters/003/037/900/original/d11ae5ba9c476bc918587e88c66d4b53.jpg?q=85&stamp=20250214175401&w=900
Втратимо багато теплової генерації'. В Укренерго попередили про ...	НЕК Укренерго орієнтується на зростання споживання е/е в післявоєнний період приблизно на 2% щорічно і виходу за 15 років на довоєнні показники, але з іншим енергоміксом.	https://biz.nv.ua/ukr/markets/pislya-2025-roku-mi-vtratimo-dosit-bagato-teplovoji-generaciji-ukrenergo-50493869.html	2025-02-27T22:52:00-08:00	https://static.nv.ua/shared/system/Article/posters/003/045/925/original/59cdadb244ebdf22cac124a91522d460.jpg?q=85&stamp=20250228085109&w=900
ГУР уразило передовий пункт управління окупантів у Херсонській об...	Головне управління розвідки Міноборони України уразило передовий пункт управління російських окупантів у районі села Іванівка Херсонської області.	https://nv.ua/ukr/ukraine/events/punkt-upravlinnya-rosiyan-v-ivanivci-hersonskoji-oblasti-urazilo-gur-26-lyutogo-video-50493865.html	2025-02-27T22:42:00-08:00	https://static.nv.ua/shared/system/Article/posters/003/045/916/original/12312eb9236b67191e05bc688dbb9c4b.jpg?q=85&stamp=20250228084018&w=900
Легендарний Іньєста назвав п’ять своїх найулюбленіших гравців — в...	Колишній футболіст збірної Іспанії та Барселони Андрес Іньєста взяв участь в опитуванні, обравши своїх улюблених гравців за весь час.	https://sport.nv.ua/ukr/football/andres-inyesta-hto-nayulyublenishiy-gravec-ispancya-video-50493864.html	2025-02-27T22:41:00-08:00	https://static.nv.ua/shared/system/Article/posters/003/045/912/original/648e68b11cb3cf38183eb19cbbc6d4bc.jpg?q=85&stamp=20250228082811&w=900
