Title	Description	Link	pubDate	Image
Північна Корея відправила своїх солдатів у Курську область в обмі...	Міністр закордонних справ України Андрій Сибіга у суботу, 16 листопада, заявив, що КНДР відправила своїх солдатів у Курську область РФ в обмін на російські технології.	https://nv.ua/ukr/world/geopolitics/viyska-kndr-u-kurskiy-oblasti-sibiga-zayaviv-shcho-pivnichna-koreya-hoche-otrimati-tehnologiji-rosiji-50467001.html	2024-11-16T05:34:00-08:00	https://static.nv.ua/shared/system/Article/posters/002/988/234/original/eae61e12d3e5e77932393478f51785ce.jpg?q=85&stamp=20241116150801&w=900
Встановлено новий рекорд. Відомо, скільки мільйонів приніс бій Та...	У ніч на 16 листопада в американському місті Арлінгтон на стадіоні AT&T Stadium відбулося шоу, в якому Джейк Пол переміг Майка Тайсона.	https://sport.nv.ua/ukr/boxing/mayk-tayson-dzheyk-pol-skilki-groshey-vdalosya-zarobiti-bokseram-50467000.html	2024-11-16T05:31:00-08:00	https://static.nv.ua/shared/system/Article/posters/002/988/232/original/dc8c37d23eab7e2b1a53b7d588bf5f19.jpg?q=85&stamp=20241116150317&w=900
Не означає, що я програла'. Модель Ілона Мамчур відреагувала на ...	Психолог із модельним досвідом Ілона Мамчур, яка покинула шоу Холостяк 13 із ветераном війни Олександром Тереном у третьому випуску, назвала причину, чому б не змогла побудувати стосунки з головним героєм у рамках реаліті.	https://life.nv.ua/ukr/znamenitosti/holostyak-13-vipusk-3-ilona-mamchur-nazvala-prichinu-chomu-ne-zmogla-pobuduvati-stosunki-z-terenom-50466999.html	2024-11-16T05:03:00-08:00	https://static.nv.ua/shared/system/Article/posters/002/988/230/original/dbfae29a05f07d29359f30376551d662.jpg?q=85&stamp=20241116143059&w=900
Борис Джонсон про розмову Шольца і Путіна: Ризикуємо повернутися ...	Експрем'єр Британії Борис Джонсон заявив, що телефонна розмова канцлера Німеччини Олафа Шольца і російського диктатора Володимира Путіна може призвести до того, що Росію та Україну знову розглядатимуть як 'рівноправних співрозмовників у внутрішній суперечці'.	https://nv.ua/ukr/world/geopolitics/rozmova-olafa-sholca-ta-volodimira-putina-boris-dzhonson-rozkritikuvav-kanclera-nimechchini-50466997.html	2024-11-16T04:36:00-08:00	https://static.nv.ua/shared/system/Article/posters/002/988/224/original/c503a9c0694c73713ed239087ee9d0ed.jpg?q=85&stamp=20241116143719&w=900
Блогер розтрощив телевізор після поразки Майка Тайсона від Джейка...	У суботу, 16 листопада, легендарний Майк Тайсон програв блогеру Джейку Полу.	https://sport.nv.ua/ukr/boxing/tayson-pol-video-yak-bloger-rozbiv-televizor-cherez-porazku-zaliznogo-mayka-50466998.html	2024-11-16T04:29:00-08:00	https://static.nv.ua/shared/system/Article/posters/002/988/228/original/3be38d24a5e3fba2c281ab5aec0cc708.jpg?q=85&stamp=20241116141815&w=900
Він просто тупий ідіот': жертва Усика накинувся на Пола, після й...	Колишній чемпіон у першій важкій вазі Тоні Беллью висловився з приводу перемоги Джейка Пола над Майком Тайсоном.	https://sport.nv.ua/ukr/boxing/mayk-tayson-dzheyk-pol-za-shcho-toni-bellyu-rozkritikuvav-blogera-50466994.html	2024-11-16T04:25:00-08:00	https://static.nv.ua/shared/system/Article/posters/002/988/219/original/61138f1486d9f2ae54afbfe560c5d475.jpg?q=85&stamp=20241116140240&w=900
121-й заклад в Україні. McDonald’s відкрив ще один ресторан у Киє...	15 листопада на проспекті Палладіна, 46-Б в Києві відкрився ресторан McDonald’s.	https://biz.nv.ua/ukr/consmarket/u-kiyevi-vidkrivsya-restoran-mcdonald-s-50466971.html	2024-11-16T04:23:00-08:00	https://static.nv.ua/shared/system/Article/posters/002/988/169/original/fb5ee66040783f290db5bfaefce3b2b9.jpg?q=85&stamp=20241116111328&w=900
РФ хоче витіснити ЗСУ до січня'. Розвідка Естонії прогнозує акти...	Найближчими тижнями або місяцями бої в Курській області можуть активізуватися, оскільки країна-агресор РФ спробує витіснити Сили оборони України щонайбільше в січні, заявив глава Центру розвідки Міноборони Естонії Антс Ківісельг, пише ERR.	https://nv.ua/ukr/world/countries/kurska-oblast-rozvidka-estoniji-prognozuye-aktivizaciyu-bojiv-50466996.html	2024-11-16T04:17:00-08:00	https://static.nv.ua/shared/system/Article/posters/002/988/222/original/a098e1938e0837aad22fb166931bef3b.jpg?q=85&stamp=20241116141522&w=900
Голова фонду 'Повернись живим' Тарас Чмут про Курську операцію, Т...	Тарас Чмут дав велике інтерв'ю СЕО Київстару Олександру Комарову для його авторського YouTube каналу OK Talk. Він розповів про головні проблеми та виклики Сил оборони України, вплив північнокорейських солдатів на війну, американську підтримку президента Дональда Трампа та різницю між українським і російським суспільствами. Ми зібрали головні тези цього інтерв'ю.	https://nv.ua/ukr/ukraine/events/kurska-operaciya-zsu-vikliki-pidtrimka-ssha-ta-maybutnye-ukrajinskogo-suspilstva-50466976.html	2024-11-16T04:15:00-08:00	https://static.nv.ua/shared/system/Article/posters/002/988/179/original/c2424f16f6678d5bdc767c791d1afedd.jpg?q=85&stamp=20241116114912&w=900
Вийшла на подіум. Голлі Беррі через 22 роки повторила свій культо...	58-річна голлівудська кінозірка Голлі Беррі викликала фурор, з’явившись на подіумі на заході The 1001 Seasons від бренду Elie Saab в Ер-Ріяді, в Саудівській Аравії.	https://life.nv.ua/ukr/znamenitosti/golli-berri-z-yavilasya-na-pokazi-u-saudivskiy-araviji-v-sukni-yaku-odyagala-22-roki-tomu-foto-50466992.html	2024-11-16T04:05:00-08:00	https://static.nv.ua/shared/system/Article/posters/002/988/214/original/a4d08c3c17c582a86b108097a0c4e239.jpg?q=85&stamp=20241116135239&w=900
Все життя ходить по клубах'. Стало відомо, чому Дженніфер Лопес ...	В мережі знайшли інтерв'ю Дженніфер Лопес виданню Rolling Stone, датоване 2001 роком. Там вона коментувала причину розриву з репером Шоном Комбзом, більш відомим як P Diddy.	https://life.nv.ua/ukr/znamenitosti/dzhennifer-lopes-vislovilasya-pro-rozluchennya-zi-skandalnim-reperom-p-diddy-50466991.html	2024-11-16T03:42:00-08:00	https://static.nv.ua/shared/system/Article/posters/002/988/212/original/37f9c98c572dbcb7b456fa9135fcda68.jpg?q=85&stamp=20241116134138&w=900
У Норвегії обмежать тимчасовий захист для українців: жителям з ше...	У Норвегії біженцям з шести областей України, які вважаються 'безпечними', обмежать надання прихистку. Натомість вони отримуватимуть індивідуальну оцінку їхньої потреби в захисті.	https://nv.ua/ukr/world/countries/ukrajinci-v-norvegiji-bizhencyam-z-shesti-oblastey-vidmovlyatimut-u-prihistku-novini-norvegiya-50466990.html	2024-11-16T03:36:00-08:00	https://static.nv.ua/shared/system/Article/posters/002/988/210/original/da9df43920cb22c34093a62361ba15b2.jpg?q=85&stamp=20241116133737&w=900
Несподівано. Жувальна гумка з ксилітом може запобігти передчасним...	Вчені з Університету Вашингтона зробили прорив у галузі акушерства, виявивши, що жувальна гумка з ксилітом може значно знизити ризик передчасних пологів.	https://techno.nv.ua/ukr/medicine/zhuvalna-gumka-z-ksilitom-mozhe-zapobigti-peredchasnim-pologam-50466640.html	2024-11-16T03:35:00-08:00	https://static.nv.ua/shared/system/Article/posters/002/987/458/original/5bf67cd89ee63517cb3438971641176f.jpg?q=85&stamp=20241115103609&w=900
Кров текла по всьому обличчю. Тренеру збірної Мексики розбили гол...	У рамках першого матчу плей-оф Ліги націй КОНКАКАФ Гондурас переграв Мексику — 2:0.	https://sport.nv.ua/ukr/football/video-togo-yak-treneru-meksiki-rozbili-golovu-pivnoyu-bankoyu-50466987.html	2024-11-16T03:34:00-08:00	https://static.nv.ua/shared/system/Article/posters/002/988/201/original/ffa8a63af3049606265f130d813c84a3.jpg?q=85&stamp=20241116123935&w=900
На тлі протестів. У Грузії офіційно оголосили результати виборів,...	Центральна виборча комісія Грузії офіційно оголосила підсумки парламентських виборів, які відбулися 26 жовтня. Проросійська правляча партія Грузинська мрія набрала більшість — 53,93% (89 мандатів зі 150), повідомляють Новости Грузии в суботу, 16 листопада.	https://nv.ua/ukr/world/countries/u-gruziji-oficiyno-ogolosili-rezultati-viboriv-opoziciya-viyshla-na-protesti-video-50466989.html	2024-11-16T03:19:00-08:00	https://static.nv.ua/shared/system/Article/posters/002/988/208/original/c9fb1c741fd606e15304eba2ed4790be.jpg?q=85&stamp=20241116131233&w=900
До зустрічі, космічний ковбою'. У Мережі регочуть з мемів про Ма...	Уночі, 16 листопада, боксер-блогер Джейк Пол переміг легендарного Майка Тайсона.	https://sport.nv.ua/ukr/boxing/tayson-pol-memi-pro-goli-sidnici-zaliznogo-mayka-50466984.html	2024-11-16T03:14:00-08:00	https://static.nv.ua/shared/system/Article/posters/002/988/196/original/0094463315910646682ca67697b1ecbb.jpg?q=85&stamp=20241116130020&w=900
Змінився колір шкіри'. Учасниця Холостяка 13 з ветераном війни Т...	Блогерка Анастасія Анісімова на побаченні з ветераном війни Олександром Тереном на шоу Холостяк 13 у третьому випуску розповіла, що у неї друга група інвалідності через ниркову недостатність.	https://life.nv.ua/ukr/znamenitosti/holostyak-2024-uchasnicya-nastya-anisimova-ziznalasya-shcho-boretsya-zi-smertelnoyu-hvoroboyu-foto-50466980.html	2024-11-16T03:11:00-08:00	https://static.nv.ua/shared/system/Article/posters/002/988/188/original/d25db450ff99df42ef43432f5bbfae65.jpg?q=85&stamp=20241116122017&w=900
Президент' самопроголошеної Абхазії заявив, що готовий піти у ві...	У Сухумі так званий 'президент' самопроголошеної республіки Абхазія Аслан Бжанія заявив, що готовий піти у відставку за умови, якщо опозиція залишить будівлю його 'адміністрації'.	https://nv.ua/ukr/world/countries/abhaziya-protesti-tak-zvaniy-prezident-aslan-bzhaniya-zayaviv-pro-gotovnist-piti-u-vidstavku-50466985.html	2024-11-16T02:49:00-08:00	https://static.nv.ua/shared/system/Article/posters/002/988/198/original/da791e1b7003b6dc9772fc6a35935bf0.jpg?q=85&stamp=20241116125006&w=900
Помилки ще можна виправити'. Про які проблеми в армії говорять в...	Виданню Бабель вдалося поспілкуватися з військовими й дізнатися, які найбільші проблеми їх турбують, що вони думають, зокрема про взаємодію з Генштабом, мобілізацію. Деталями в інтерв'ю Radio NV поділилася журналістка, кореспондентка Бабеля Оксана Коваленко.	https://nv.ua/ukr/ukraine/events/interv-yu-z-viyskovimi-zsu-yaki-ye-vikliki-ta-problemi-v-armiji-kovalenko-novini-ukrajini-50466974.html	2024-11-16T02:47:00-08:00	https://static.nv.ua/shared/system/Article/posters/002/988/175/original/164f54ea311fa22094426ef3203c1780.jpg?q=85&stamp=20241116115423&w=900
Чи зможе Трамп 'посадити за стіл перемовин' Україну та Росію відр...	Аналітик Ради зовнішньої політики Українська призма Євген Костогризов в інтерв'ю Radio NV оцінив, чи зможе обраний президент США Дональд Трамп 'посадити за стіл переговорів' Україну та Росію відразу після власної інавгурації.	https://nv.ua/ukr/world/geopolitics/peregovori-z-rosiyeyu-chi-zmozhe-tramp-iniciyuvati-peregovori-ukrajini-ta-rosiji-shvidko-pislya-inavguraciji-50466876.html	2024-11-16T02:44:00-08:00	https://static.nv.ua/shared/system/Article/posters/002/987/967/original/3976e57e028da940c79db6d755b2d2d7.jpg?q=85&stamp=20241115194923&w=900
Це не був хороший бій': Холіфілд оцінив поразку Майка Тайсона ві...	Колишній чемпіон світу в двох вагових категоріях Евандер Холіфілд поділився враженнями від поєдинку Джейка Пола проти Майка Тайсона.	https://sport.nv.ua/ukr/boxing/mayk-tayson-dzheyk-pol-yak-golifild-ociniv-porazku-legendi-boksu-50466983.html	2024-11-16T02:36:00-08:00	https://static.nv.ua/shared/system/Article/posters/002/988/194/original/818b41fa53929cb1db87e3e8f4add7bd.jpg?q=85&stamp=20241116122534&w=900
Говорити про нестерпні умови несправедливо': Зеленський прокомен...	Президент України Володимир Зеленський прокоментував випадки самовільного залишення частини (СЗЧ) та дезертирства у Силах оборони.	https://nv.ua/ukr/ukraine/politics/szch-zelenskiy-prokomentuvav-vipadki-dezertirstva-u-silah-oboroni-50466982.html	2024-11-16T02:25:00-08:00	https://static.nv.ua/shared/system/Article/posters/002/988/192/original/df24e69b23880fa9fe19403c0376d090.jpg?q=85&stamp=20241116122316&w=900
Австрія заявила, що з суботи Росія припинить постачання їй газу ч...	Росія заявила Австрії, що в суботу, 16 листопада, призупинить постачання їй газу через Україну, пише Reuters.	https://biz.nv.ua/ukr/markets/avstriya-zayavila-shcho-iz-suboti-rosiya-pripinit-postachati-gaz-cherez-ukrajinu-50466978.html	2024-11-16T02:22:00-08:00	https://static.nv.ua/shared/system/Article/posters/002/988/183/original/f2de1561cabca7305ff14e996d0935f6.jpg?q=85&stamp=20241116120425&w=900
Легендарний Леннокс Льюїс відреагував на поразку Майка Тайсона ві...	В американському Арлінгтоні (штат Техас) у ніч з 15 на 16 листопада відбулося боксерське шоу, в якому Джейк Пол переміг Майка Тайсона.	https://sport.nv.ua/ukr/boxing/mayk-tayson-dzheyk-pol-yak-vidreaguvav-na-biy-lennoks-lyujis-50466977.html	2024-11-16T02:16:00-08:00	https://static.nv.ua/shared/system/Article/posters/002/988/181/original/cf3ba137a587f3ae73e1b18322c0d998.jpg?q=85&stamp=20241116115257&w=900
АРМА планує реалізувати 30 тис. тонн калію білоруського виробницт...	Агентство з розшуку та менеджменту активів (АРМА) призначила на 5 грудня аукціон в системі Прозорро.Продажі з продажу 30,4 тис. тонн білоруського калію. Його загальна вартість з урахуванням митних платежів складає понад 500 млн грн.	https://biz.nv.ua/ukr/markets/arma-planuye-realizuvati-30-tis-tonn-kaliyu-biloruskogo-virobnictva-50466799.html	2024-11-16T02:01:00-08:00	https://static.nv.ua/shared/system/Article/posters/002/987/806/original/5d864ae148a1b45d3f57f838334290c9.jpg?q=85&stamp=20241115161253&w=900
Ліга націй: розклад, результати та відео всіх матчів 16 листопада	У суботу будуть зіграні заключні матчі п’ятого туру групового етапу Ліги націй. Пройдуть дев’ять поєдинків у чотирьох дивізіонах.	https://sport.nv.ua/ukr/football/liga-naciy-16-listopada-video-rozklad-rezultati-turnirna-tablicya-50466975.html	2024-11-16T01:45:00-08:00	https://static.nv.ua/shared/system/Article/posters/002/988/177/original/f0dec150eab00a6e394e21fcf4a667e0.jpg?q=85&stamp=20241116114603&w=900
Це неправильно'. Зеленський здивувався заяві секретаря РНБО щодо...	Президент України Володимир Зеленський заявив, що здивований заявою секретаря РНБО Олександра Литвиненка про плани мобілізувати ще 160 тисяч людей, заявивши, що розповсюджувати точну цифру є 'неправильним'.	https://nv.ua/ukr/ukraine/politics/volodimir-zelenskiy-zdivuvavsya-zayavi-sekretarya-rnbo-oleksandra-litvinenka-pro-mobilizaciyu-50466972.html	2024-11-16T01:43:00-08:00	https://static.nv.ua/shared/system/Article/posters/002/988/171/original/dee800ac98e80592c4fcef2513f1ecb5.jpg?q=85&stamp=20241116114354&w=900
На межі блекауту. Російські окупанти пошкодили основну лінію живл...	Внаслідок російського обстрілу пошкоджено основну лінію живлення Запорізької атомної електростанції, яка знову опинилася на межі блекауту. Про це повідомила НЕК Укренерго у суботу, 16 листопада.	https://nv.ua/ukr/ukraine/events/zaes-opinilasya-na-mezhi-blekautu-shcho-vidomo-50466973.html	2024-11-16T01:40:00-08:00	https://static.nv.ua/shared/system/Article/posters/002/988/173/original/61dd621cc241bbe5f776353fdb1cbe92.jpg?q=85&stamp=20241116113822&w=900
Майк Тайсон показав голу дупу перед боєм із Джейком Полом — відео	У ніч на 16 листопада в американському місті Арлінгтон відбулося боксерське шоу, в якому Джейк Пол переміг Майка Тайсона.	https://sport.nv.ua/ukr/boxing/video-togo-yak-netflix-pokazav-golu-dupu-mayka-taysona-pered-boyem-iz-dzheykom-polom-50466967.html	2024-11-16T01:34:00-08:00	https://static.nv.ua/shared/system/Article/posters/002/988/160/original/ef8ed980b7937c955f01fd817d8f9e0d.jpg?q=85&stamp=20241116105509&w=900
Україна стає на траєкторію Ізраїлю в оборонній галузі: що про це ...	Військовий експерт, редактор інформаційного видання Defense Express Валерій Рябих в інтерв'ю Radio NV заявив, що Україна в оборонній галузі стає на траєкторію Ізраїлю.	https://nv.ua/ukr/world/geopolitics/ukrajina-staye-na-trayektoriyu-izrajilyu-v-oboronniy-galuzi-ekspert-50466841.html	2024-11-16T01:34:00-08:00	https://static.nv.ua/shared/system/Article/posters/002/987/895/original/a184ab82dbb3273cd693b17dfc5a5c64.jpg?q=85&stamp=20241115180623&w=900
Третина від усього навчання. Скільки занять з стрільби буде в оно...	З 1 листопада термін базової загальновійськової підготовки збільшили з 30 до 45 днів, змінивши деякі дисципліни, їхній вміст, збільшивши години практичних занять.	https://nv.ua/ukr/ukraine/events/bzvp-2024-skilki-zanyat-po-strilbi-provodyat-do-vidpravki-na-front-novini-ukrajini-50466743.html	2024-11-16T01:31:00-08:00	https://static.nv.ua/shared/system/Article/posters/002/987/682/original/ecc267b16cd837d1fd74b9bff54412c6.jpg?q=85&stamp=20241115141328&w=900
Тонко відчуває контекст'. Ірина Горова розповіла, у чому секрет ...	Бізнесвумен і генеральна директорка Pomitni Ірина Горова в інтерв'ю Elle прокоментувала розрив співпраці з репером і колишнім чоловіком Потапом.	https://life.nv.ua/ukr/znamenitosti/irina-gorova-rozkrila-sekret-uspihu-dorofyeyevoji-ta-rozpovila-pro-rozriv-spivpraci-z-potapom-50466970.html	2024-11-16T01:28:00-08:00	https://static.nv.ua/shared/system/Article/posters/002/988/167/original/a37c7dcd5ecfb974511498e103c54732.jpg?q=85&stamp=20241116111559&w=900
Щось відчувають. У українців вже є плани на наступне літо — куди ...	Цьогоріч у період з 1 квітня по 31 жовтня з туроператором Join UP! Україна відпочили 188 816 українських туристів.	https://biz.nv.ua/ukr/markets/ukrajinci-vzhe-pochali-bronyuvati-turi-na-nastupne-lito-50466942.html	2024-11-16T01:24:00-08:00	https://static.nv.ua/shared/system/Article/posters/002/988/106/original/c76f7c3116f12b4378265eb96a118d9a.jpg?q=85&stamp=20241116085158&w=900
Медіадні-2024. У Києві проходить третій день конференції для меді...	З 14 по 16 листопада у Києві відбувається щорічна конференція для медіаспільноти Медіадні для редакторів, медіаменеджерів, журналістів, комунікаційників та усіх зацікавлених від Премії імені Георгія Ґонґадзе.	https://nv.ua/ukr/ukraine/events/mediadni-konferenciya-dlya-mediynikiv-u-kiyevi-z-14-po-16-listopada-onlayn-50463920.html	2024-11-16T01:07:00-08:00	https://static.nv.ua/shared/system/Article/posters/002/981/603/original/9f988a6b344c58b67086d313d791de70.jpg?q=85&stamp=20241105122401&w=900
Ситуація дійсно складна': Зеленський назвав причини просування р...	Президент України Володимир Зеленський заявив про складну ситуацію на східних напрямках фронту та повільне просування росіян. Про це він сказав в інтерв'ю Суспільному з нагоди 100-річчя Українського радіо.	https://nv.ua/ukr/ukraine/politics/zelenskiy-nazvav-prichini-prosuvannya-rosiyan-na-shodi-ukrajini-50466968.html	2024-11-16T01:06:00-08:00	https://static.nv.ua/shared/system/Article/posters/002/988/162/original/e0a470a65579efa2a7ad9284adadd184.jpg?q=85&stamp=20241116105635&w=900
