Title	Description	Link	pubDate	Image
Кремль бреше, що перемогти РФ неможливо. Які війни і як саме вже ...	Перемогти Росію на полі бою неможливо', — невтомно повторює російський диктатор Володимир Путін у зверненнях до Федеральних зборів та інших своїх виступах. Ця теза російської пропаганди давно стала частиною інфокампанії Москви, спрямованої на те, щоб союзники Києва навіть не шукали можливостей для перемоги України у розв’язаній РФ повномасштабній війні. Однак насправді Росія має чималу історію поразок, провалів і невдач у великих війнах.	https://nv.ua/ukr/premium/rosiya-prograla-cyu-viynu-spisok-viyn-i-obstavini-koli-zavdali-porazki-nibi-neperemozhniy-armiji-50484217.html	2025-01-24T21:40:00-08:00	https://static.nv.ua/shared/system/Article/posters/003/025/149/original/069a2fed160ebee2b085d03db8fce2cb.jpg?q=85&stamp=20250124163508&w=900
Мінус 1650 солдатів, сім танків та 51 БПЛА. Генштаб ЗСУ підрахува...	Країна-агресор Росія втратила на війні в Україні близько 1650 солдатів за добу. Загальні втрати армії РФ із початку повномасштабного вторгнення становлять орієнтовно 828 470 окупантів вбитими та пораненими.	https://nv.ua/ukr/ukraine/events/vtrati-rosiji-za-dobu-stanovili-1650-soldativ-genshtab-onoviv-dani-25-sichnya-50484526.html	2025-01-24T21:37:00-08:00	https://static.nv.ua/shared/system/Article/posters/003/025/816/original/d780863b67bbe69347b2c7de4341062f.jpg?q=85&stamp=20250125072709&w=900
Путін стурбований тим, як зниження цін на нафту вплине на стабіль...	Російський диктатор Володимир Путін продемонстрував, що він стурбований тим, як потенційне зниження цін на нафту вплине на його внутрішню стабільність і здатність вести війну проти України.	https://nv.ua/ukr/world/geopolitics/zayavi-donalda-trampa-pro-znizhennya-cin-na-naftu-nepokoyat-volodimira-putina-pishe-isw-50484525.html	2025-01-24T21:36:00-08:00	https://static.nv.ua/shared/system/Article/posters/003/025/814/original/01681df931ba170ffa29953b1b16bff5.jpg?q=85&stamp=20250125073637&w=900
Навіть українці помиляються. Як правильно: обезжирювати чи знежир...	Багато з нас, навіть не задумуючись, використовують у повсякденній мові слова, запозичені з інших мов, особливо з російської. Одним з таких слів є обезжирювати. Здається, що все зрозуміло: ми хочемо позбавитися жиру. Але чи правильно так казати?	https://nv.ua/ukr/ukraine/events/ukrajinska-mova-yak-pravilno-kazati-obezzhiryuvati-tilki-odin-pravilniy-variant-50484377.html	2025-01-24T21:30:00-08:00	https://static.nv.ua/shared/system/Article/posters/003/025/494/original/92227195c27845e6d70a25fc4269880b.jpg?q=85&stamp=20250124145252&w=900
Сенат США затвердив Піта Хегсета на посаді міністра оборони	Сенат США схвалив кандидатуру Піта Хегсета на посаду міністра оборони. Вирішальним під час голосування став голос віце-президента Джей Д. Венса.	https://nv.ua/ukr/world/countries/senat-ssha-zatverdiv-pita-hegseta-na-posadi-ministra-oboroni-50484522.html	2025-01-24T21:21:00-08:00	https://static.nv.ua/shared/system/Article/posters/003/025/808/original/dfaa1a0da5704bf3e6b1df9a4079a3de.jpg?q=85&stamp=20250125070551&w=900
Росіяни обстріли критичну інфраструктуру у Черкаській області: у ...	У Черкасах після російської дронової атаки у ніч на суботу, 25 січня, у деяких жителів області зникло світло. Про це повідомив очільник Черкаської ОВА Ігор Табурець.	https://nv.ua/ukr/ukraine/events/obstril-cherkas-25-sichnya-poshkodzhena-kritichna-infrastruktura-ye-chastkovi-vidklyuchennya-svitla-50484523.html	2025-01-24T21:20:00-08:00	https://static.nv.ua/shared/system/Article/posters/003/025/810/original/dbed9195be09af12c8493940999dcafd.jpg?q=85&stamp=20250125070708&w=900
Найзапаленіший нервовий вузол світової кризи	Якщо українці та українки відчують, що більше не мають ресурсу підтримувати належний рівень опору, а міжнародні партнери скористаються цим, аби припинити 'ще один неприємний конфлікт', — наслідки будуть трагічними для всіх	https://nv.ua/ukr/opinion/prognoz-dlya-ukrajinciv-maksim-butkevich-pro-2025-rik-50484432.html	2025-01-24T21:13:00-08:00	https://nv.ua/upload/nv_fix_image.jpeg
Щоб були смачними. Найкращий спосіб дозріти банани та кілька таки...	Ми всі знаємо сценарій, коли отримуємо купу перезрілих бананів із коричневими межами до чорного, які нам потрібно використати швидко — або зберігши їх у морозильній камері, або додавши в якусь солодку випічку.	https://nv.ua/ukr/food/eat/yak-dozriti-banani-shist-metodiv-dlya-togo-shchob-zeleni-frukti-stali-stiglimi-50483836.html	2025-01-24T21:11:00-08:00	https://static.nv.ua/shared/system/Article/posters/003/024/329/original/2cde64db1118f3317ab575f2b78a89b7.jpg?q=85&stamp=20250122205430&w=900
Благовіщення Пресвятої Богородиці 2025: нова дата за ПЦУ, традиці...	Благовіщення Пресвятої Богородиці — одне з найважливіших свят у християнському календарі. Воно присвячене події, коли архангел Гавриїл сповістив Діві Марії про те, що вона народить Сина Божого.	https://nv.ua/ukr/ukraine/events/yakogo-chisla-blagovishchennya-2025-data-za-novim-kalendarem-pcu-tradiciji-zvichaji-shcho-ne-mozhna-robiti-50484088.html	2025-01-24T21:10:00-08:00	https://static.nv.ua/shared/system/Article/posters/003/024/874/original/cf2162421fce13a7096de6e99f3aae23.jpg?q=85&stamp=20250123162036&w=900
Xiaomi Redmi Note 14 Pro — п’ять причин купити і одна причина цьо...	Пробуємо новинку ринку — смартфон Xiaomi Redmi Note 14 Pro з цінником від 10 тис грн.	https://techno.nv.ua/ukr/gadgets/xiaomi-redmi-note-14-pro-oglyad-50484364.html	2025-01-24T21:02:00-08:00	https://static.nv.ua/shared/system/Article/posters/003/025/468/original/2637f83bf6ec99895f9370fcb3dfce7e.jpg?q=85&stamp=20250124144057&w=900
Кортадо чи капучино? У чому різниця між двома напоями та який кра...	Що робить ці два напої унікальними?	https://nv.ua/ukr/food/eat/kapuchino-ta-kortado-shcho-ce-za-napoji-ta-v-chomu-jihni-vidminnosti-50484233.html	2025-01-24T21:00:00-08:00	https://static.nv.ua/shared/system/Article/posters/003/025/179/original/72db40125ae042460857332c75366585.jpg?q=85&stamp=20250124093107&w=900
Субсидія, іпотека, компенсації. На які опції щодо отримання житла...	Як внутрішньо переміщені особи, чиї будинки або квартири в Україні було зруйновано чи пошкоджено внаслідок бойових дій, можуть отримати тимчасове житло, оформити виплати компенсацій, та чи треба фіксувати збитки у міжнародному реєстрі.	https://nv.ua/ukr/socium/zhitlo-dlya-vpo-2025-yaki-pilgi-peredbacheno-yak-pracyuye-prihistok-hto-mozhe-otrimati-poyasnila-yurist-50484196.html	2025-01-24T20:45:00-08:00	https://static.nv.ua/shared/system/Article/posters/003/025/104/original/cbbb7be39f65462d792ec099af6f893e.jpg?q=85&stamp=20250123225020&w=900
Улюблений напій мільйонів. Де виникла кава та як вона завойовувал...	Багато речей, які ми сприймаємо як належне в нашому повсякденному житті, наприклад, чашка смачної кави, мають довгу історію, яку потрібно розкрити.	https://nv.ua/ukr/food/eat/yak-vinikla-kava-ta-yak-vona-poshirilasya-svitom-trohi-istoriji-pro-ulyubleniy-napiy-50483101.html	2025-01-24T20:33:00-08:00	https://static.nv.ua/shared/system/Article/posters/003/022/755/original/a72c4aa2cd190318b4aecc089c16ffec.jpg?q=85&stamp=20250120163954&w=900
Затонув 2500 років тому. Біля берегів Сицилії знайшли античний ко...	Під час підводної археологічної експедиції біля берегів італійського острова Сицилія було зроблено сенсаційне відкриття: вчені виявили добре збережені рештки корабля, який датують V-VI століттями до нашої ери.	https://techno.nv.ua/ukr/popscience/bilya-beregiv-siciliji-viyavleno-starodavniy-korabel-vikom-2500-rokiv-50483985.html	2025-01-24T19:30:00-08:00	https://static.nv.ua/shared/system/Article/posters/003/024/650/original/0cb43b168192880b09d8304b82472713.jpg?q=85&stamp=20250123125620&w=900
Аномальне тепло з нюансом. Синоптикиня повідомила про весняну пог...	Аномальне тепло та скорочення кількості опадів — таку погоду прогнозують синоптики на вихідні.	https://nv.ua/ukr/ukraine/events/prognoz-pogodi-na-vihidni-kudi-priyde-vesna-ta-koli-v-ukrajini-anomalne-poteplinnya-do-15-50484429.html	2025-01-24T19:29:00-08:00	https://static.nv.ua/shared/system/Article/posters/003/025/609/original/0a50ab710a09555b8e99ff841e9710ea.jpg?q=85&stamp=20250124170333&w=900
Коли смачно і зрозуміло. Десять рецептів по-українськи для романт...	Український варіант романтичної вечері на День святого Валентина може бути надзвичайно затишним і атмосферним. Він поєднує наші традиції з теплою, домашньою романтикою.	https://nv.ua/ukr/food/eat/den-svyatogo-valentina-ukrajinski-recepti-dlya-prigotuvannya-romantichnoji-vecheri-50484285.html	2025-01-24T19:24:00-08:00	https://static.nv.ua/shared/system/Article/posters/003/025/293/original/0411534787fbec77a86ccef7a391602d.jpg?q=85&stamp=20250124114122&w=900
Російські літаки скинули чотири бомби на окуповані села Донеччини...	Російські військові літаки протягом одного дня скинули чотири авіаційні бомби на населені пункти в окупованій частині Донецької області. ФАБи падали на села з різницею приблизно в годину.	https://nv.ua/ukr/ukraine/events/rosiyski-litaki-skinuli-chotiri-bombi-na-okupovani-sela-donechchini-22-sichnya-50484520.html	2025-01-24T19:21:00-08:00	https://static.nv.ua/shared/system/Article/posters/003/025/804/original/b80b0801ebec906736ef002840a0e6fb.jpg?q=85&stamp=20250125052100&w=900
Ворог атакував Київщину: у багатоповерхівці зруйновані балкони і ...	У ніч проти суботи, 25 січня, ворог атакував ударними БПЛА Київщину, є руйнування в багатоповерховому будинку і підприємстві.	https://nv.ua/ukr/kyiv/kijivsku-oblast-atakuvali-bpla-25-sichnya-novini-kiyeva-foto-50484521.html	2025-01-24T19:14:00-08:00	https://static.nv.ua/shared/system/Article/posters/003/025/806/original/8e63226489239b083708351b4580868c.jpg?q=85&stamp=20250125051636&w=900
Весняна підготовка плодових дерев. Дізнайтеся поради експертів	Вирощування фруктових дерев у саду приносить неймовірну винагороду. Такі смачні ласощі, як терпкі сливи чи солодкі персики, завжди у вас під рукою. Але щоб отримати ці смаколики, потрібно трохи попрацювати, особливо навесні.	https://life.nv.ua/ukr/lifehacks/yak-obrizati-fruktovi-dereva-navesni-poradi-ekspertiv-50483951.html	2025-01-24T18:51:00-08:00	https://static.nv.ua/shared/system/Article/posters/003/024/572/original/36b80fee04adf44d920a698c5fdf9f66.jpg?q=85&stamp=20250123112229&w=900
День ангела Григорія. Привітання з іменинами у віршах та прозі	Григорій — ім'я грецького походження, яке перекладається як бадьорий. Зустрічається у різних формах у багатьох європейських мовах: в англійській мові звучить Грегорі, французькою — Грегуар.	https://life.nv.ua/ukr/showbiz/imenini-grigoriya-vitannya-u-virshah-ta-prozi-50212813.html	2025-01-24T18:26:00-08:00	https://static.nv.ua/shared/system/Article/posters/002/447/018/original/f681b2cd81dbf5e5e0306cb7e8c53658.jpg?q=85&stamp=20220131173944&w=900
Бажаєте iPhone за $50 тисяч? Ціни на смартфони з Tiktok в США зле...	Кмітливі користувачі продають на eBay старі та нові смартфони, на яких встановлено заблокований у США TikTok, з шаленими націнками.	https://techno.nv.ua/ukr/gadgets/smartfoni-z-tiktok-50484502.html	2025-01-24T17:15:00-08:00	https://static.nv.ua/shared/system/Article/posters/003/025/765/original/8e7b0ccd05688a5cfda2829eca63363d.jpg?q=85&stamp=20250124224455&w=900
Трамп не дав Маску офіс у центрі Білого дому	Мільярдер Ілон Маск прагнув отримати офіс у центрі Білого дому, проте адміністрація президента США вирішила розмістити його Департамент ефективності державного управління в будівлі виконавчого офісу Ейзенхауера.	https://nv.ua/ukr/world/countries/ilon-mask-hotiv-ofis-u-bilomu-domi-ale-yogo-vidpravili-podali-50484518.html	2025-01-24T16:12:00-08:00	https://static.nv.ua/shared/system/Article/posters/003/025/800/original/a2badbe0fcb7734219140d77c027e012.jpg?q=85&stamp=20250125015643&w=900
Обмежено придатним' продовжать термін для перепроходження ВЛК — ...	Всі військовозобов'язані, які мають статус 'обмежено придатних', за законом повинні повторно пройти військово-лікарську комісію (ВЛК) до 4 лютого.	https://nv.ua/ukr/ukraine/events/v-ukrajini-prodovzhat-termin-pereprohodzhennya-vlk-dlya-obmezheno-pridatnih-50484517.html	2025-01-24T15:38:00-08:00	https://static.nv.ua/shared/system/Article/posters/003/025/798/original/efbe34b05c066c4c166587e2af218ca5.jpg?q=85&stamp=20250125013828&w=900
Зокрема Україні. Держдеп США призупиняє іноземну допомогу на 90 д...	Держсекретар США Марко Рубіо оголосив про призупинення витрат на більшість чинних грантів на закордонну допомогу на 90 днів.	https://nv.ua/ukr/world/geopolitics/ssha-prizupinyayut-vitrati-na-viyskovu-dopomogu-ukrajini-ta-inshi-granti-na-90-dniv-50484516.html	2025-01-24T14:57:00-08:00	https://static.nv.ua/shared/system/Article/posters/003/025/796/original/221b64c071256bd1d98bbe48e692a3d2.jpg?q=85&stamp=20250125005625&w=900
Росія атакує Україну ворожими БпЛА	У ніч проти суботи, 25 січня, зафіксовано активний рух груп безпілотних літальних апаратів (БпЛА) у низці областей України.	https://nv.ua/ukr/ukraine/events/ruh-vorozhih-bpla-v-ukrajini-operativna-situaciya-ta-napryamki-50484514.html	2025-01-24T14:46:00-08:00	https://static.nv.ua/shared/system/Article/posters/003/025/791/original/55c9f8cde19380fa86dd1a2427a5719a.jpg?q=85&stamp=20250125004429&w=900
Розумний і безплатний. У Perplexity з’явився мобільний помічник д...	Perplexity перетворила свою систему відповідей зі штучним інтелектом на мобільного помічника. Він вже працює на Android-смартфонах.	https://techno.nv.ua/ukr/innovations/perplexity-pomichnik-50484508.html	2025-01-24T14:27:00-08:00	https://static.nv.ua/shared/system/Article/posters/003/025/777/original/cb7235164e2bc3981f6828e7d3eb0c68.jpg?q=85&stamp=20250124233057&w=900
Революційна ікона Бразилії. Як дезертир Карлус Ламарка боровся з ...	56 років тому капітан Збройних сил Бразилії Карлус Ламарка утік з армії, прихопивши зі собою зброю та боєприпаси. Він створив партизанську організацію та намагався скинути владу країни, але був вбитий поліціянтами.	https://nv.ua/ukr/world/countries/bella-ciao-chomu-lamarka-borovsya-z-huntoyu-grabuvav-banki-vikradav-posla-shveycariji-istoriya-z-nv-50484466.html	2025-01-24T14:25:00-08:00	https://static.nv.ua/shared/system/Article/posters/003/025/689/original/777bc2b866105143cec74c3894f8e4a8.jpg?q=85&stamp=20250124193446&w=900
Що вирощувати в теплиці навесні: головні поради від експертів	Зима — чудовий час, щоб зайнятися своєю теплицею та аксесуарами, аби вони були чисті та готові до використання, коли настане насичений весняний сезон.	https://life.nv.ua/ukr/lifehacks/pidgotovka-teplici-do-vesni-shcho-viroshchuvati-ta-yak-doglyadati-50484407.html	2025-01-24T14:21:00-08:00	https://static.nv.ua/shared/system/Article/posters/003/025/561/original/58fde9107564c72198a0fd831d25a156.jpg?q=85&stamp=20250124161430&w=900
Журналісти ідентифікували людей, які вивезли понад 30 тисяч експо...	Розслідувачі Kyiv Independent встановили росіян, причетних до вивезення культурних цінностей із музеїв Херсона під час відступу армії країни-агресора в листопаді 2022 року. Розслідування було опубліковане в п’ятницю, 24 січня.	https://nv.ua/ukr/ukraine/events/muzeji-hersona-buli-rozgrabovani-pered-deokupaciyeyu-hto-viviz-33-tisyachi-eksponativ-50484511.html	2025-01-24T14:16:00-08:00	https://static.nv.ua/shared/system/Article/posters/003/025/783/original/b8a493a8d522c08697c84f71cdb55932.jpg?q=85&stamp=20250125001028&w=900
Трамп провів 'палку' розмову з прем'єром Данії щодо Гренландії	Президент США Дональд Трамп знову підтвердив свою рішучість взяти під контроль Гренландію під час напруженої телефонної розмови з прем'єр-міністром Данії Метте Фредеріксен.	https://nv.ua/ukr/world/geopolitics/donald-tramp-znovu-vimagaye-grenlandiyu-pogrozhuvav-daniji-sankciyami-50484509.html	2025-01-24T14:11:00-08:00	https://static.nv.ua/shared/system/Article/posters/003/025/779/original/ce076551f9fedb837b8119640747952a.jpg?q=85&stamp=20250125001029&w=900
Прокурори зняли з Менсона звинувачення в сексуальному насильстві	У п’ятницю, 24 січня, прокурори заявили, що музиканту Мериліну Менсону не пред’явлено звинувачень за численними звинуваченнями в сексуальному насильстві та домашньому насильстві.	https://life.nv.ua/ukr/znamenitosti/merilin-menson-prokurori-ne-budut-pred-yavlyati-zvinuvachennya-50484501.html	2025-01-24T14:10:00-08:00	https://static.nv.ua/shared/system/Article/posters/003/025/763/original/693d2287d9227ad3375cbb2f26a0a7cd.jpg?q=85&stamp=20250124223830&w=900
Коли розпочинається Рік Змії 2025: дати початку та фіналу святкув...	Понад мільярд людей у ​​Китаї та мільйони людей у ​​всьому світі відзначатимуть Новий рік за місячним календарем.	https://life.nv.ua/ukr/showbiz/kitayskiy-noviy-rik-2025-o-kotriy-godini-pochatok-tochniy-chas-i-taymer-50482085.html	2025-01-24T14:10:00-08:00	https://static.nv.ua/shared/system/Article/posters/003/020/550/original/da542f85962c1cf7597bc53d169fe27b.jpg?q=85&stamp=20250116115122&w=900
Проблема не в тренерах, а в ньому': експерт виніс жорсткий верди...	Відомий український тренер Олег Федорчук поділився думками щодо ігрових перспектив форварда грецького Олімпіакоса і збірної України Романа Яремчука.	https://sport.nv.ua/ukr/football/oleg-fedorchuk-prokomentuvav-gru-romana-yaremchuka-za-yevropeyski-klubi-50484507.html	2025-01-24T13:31:00-08:00	https://static.nv.ua/shared/system/Article/posters/003/025/775/original/94c26931d637bd542e054539043ba247.jpg?q=85&stamp=20250124231421&w=900
Російського боксера Повєткіна дискваліфікували на чотири роки за ...	Російський боксер Олександр Повєткін отримав чотири роки дискваліфікації за порушення антидопінгових правил.	https://sport.nv.ua/ukr/boxing/oleksandr-povyetkin-rosiyskogo-boksera-i-kolishnogo-supernika-klichka-diskvalifikuvali-za-doping-50484506.html	2025-01-24T13:07:00-08:00	https://static.nv.ua/shared/system/Article/posters/003/025/773/original/7bc61d12e976f042ee2cc3b4af5c6191.jpg?q=85&stamp=20250124230821&w=900
Мінімум зусиль. Як приготувати десерт, який порадує всю родину	Це простий спосіб зробити щось особливе	https://nv.ua/ukr/blogs/yak-zrobiti-shokoladnu-kovbasu-recept-ektora-himenesa-bravo-50484477.html	2025-01-24T13:03:00-08:00	https://static.nv.ua/shared/system/Article/posters/003/025/713/original/a059494a5d126b0a2c22c2fbed987cae.jpg?q=85&stamp=20250124201356&w=900
Оборонний комітет Ради нагадав про бойовий імунітет після затрима...	Профільний комітет Верховної Ради, реагуючи на затримання генералів та офіцерів у справі про прорив кордону на Харківщині, нагадав про принцип бойового імунітету та звільнення військовослужбовців від кримінальної відповідальності під час воєнного стану.	https://nv.ua/ukr/ukraine/events/zatrimannya-generaliv-komitet-radi-z-nacbezpeki-nagadav-pro-isnuvannya-boyovogo-imunitetu-v-ukrajini-50484503.html	2025-01-24T13:00:00-08:00	https://static.nv.ua/shared/system/Article/posters/003/025/767/original/c7c2f22f3dfcec149d62ea15ccdae54b.jpg?q=85&stamp=20250124230042&w=900
