Title	Description	Link	pubDate	Image
Перед зустріччю Зеленського і Трампа. Про що свідчать переговори ...	Політолог, голова Центру аналізу і стратегій Ігор Чаленко відповів в ефірі Radio NV, про що свідчить зустріч представників РФ та США в Стамбулі перед завтрашнім візитом президента Володимира Зеленського до президента США Дональда Трампа.	https://nv.ua/ukr/world/geopolitics/peremovini-ssha-ta-rf-v-stambuli-ce-gra-kremlya-i-dzvinochok-dlya-trampa-chalenko-novini-ukrajini-50493572.html	2025-02-27T01:50:00-08:00	https://static.nv.ua/shared/system/Article/posters/003/045/293/original/0d27c2a9bbb3d455b86b8aab9fceea87.jpg?q=85&stamp=20250227114143&w=900
Ноутбук, який змінив правила гри. 5 причин купити ASUS Zenbook DU...	Оновлений ASUS Zenbook DUO на платформі Intel Core Ultra вже доступний в Україні. Усі колишні плюси залишилися при ньому і додалися нові.	https://techno.nv.ua/ukr/gadgets/asus-zenbook-duo-z-intel-core-ultra-oglyad-harakteristiki-50491547.html	2025-02-27T01:49:00-08:00	https://static.nv.ua/shared/system/Article/posters/003/040/933/original/bf0c26de056ce92e44a8caaaf0810643.jpg?q=85&stamp=20250220104153&w=900
На Львівщині чоловік заплатить 119 гривень штрафу за те, що обмат...	Мера Ходорова на Львівщині обматюкав п’яний чоловік в парку, за це його оштрафували.	https://nv.ua/ukr/lifestyle/mera-na-lvivshchini-obmatyukali-i-zaplatyat-za-ce-shtraf-50493573.html	2025-02-27T01:47:00-08:00	https://static.nv.ua/shared/system/Article/posters/003/045/295/original/7a41d12e6936371dbfb0fe95398d47e5.jpg?q=85&stamp=20250227114337&w=900
Українці саме на цій стадії. Що зараз відбувається із психікою	Що насправді відбувається з психічним станом українців	https://nv.ua/ukr/opinion/psihika-ukrajinciv-likarka-poradila-yak-pidtrimati-sebe-pid-chas-viyni-50493569.html	2025-02-27T01:41:00-08:00	https://nv.ua/upload/nv_fix_image.jpeg
Трампу на тарілочці. Російський промисловий гігант Дерипаски виро...	Російський алюмінієвий гігант Русал створить дослідне виробництво оксиду скандію потужністю 1,5 тонни на рік.	https://biz.nv.ua/ukr/markets/rosiyskiy-promisloviy-gigant-deripaski-stvoryuye-virobnictvo-cinnogo-ridkisnozemelnogo-metalu-50493563.html	2025-02-27T01:37:00-08:00	https://static.nv.ua/shared/system/Article/posters/003/045/271/original/6bb9700a463641193a9023670fb79774.jpg?q=85&stamp=20250227111307&w=900
Український футболіст у свій день народження підписав контракт з ...	Український півзахисник Олександр Драган підписав контракт із італійською Аталантою.	https://sport.nv.ua/ukr/football/18-richniy-ukrajinskiy-futbolist-oleksandr-dragan-pidpisav-kontrakt-z-atalantoyu-50493564.html	2025-02-27T01:33:00-08:00	https://static.nv.ua/shared/system/Article/posters/003/045/273/original/855ddf09d5d83a7badfbbafa8ae503a9.jpg?q=85&stamp=20250227112107&w=900
Чутки про перемир’я не подіяли. Для української економіки погірши...	Європейський банк реконструкції та розвитку погіршив прогноз зростання економіки України у 2025 році до 3,5%.	https://biz.nv.ua/ukr/economics/yebrr-zminiv-prognoz-rozvitku-ukrajinskoji-ekonomiki-v-girshiy-bik-50493565.html	2025-02-27T01:31:00-08:00	https://static.nv.ua/shared/system/Article/posters/003/045/279/original/3870db3589b39b72946cb55f6d8a1f81.jpg?q=85&stamp=20250227111854&w=900
Удар по хакерах майбутнього. Учені створили перший у світі чип, з...	В умовах стрімкого розвитку технологій швейцарські вчені зробили вирішальний крок уперед, створивши перший у світі чип, здатний захистити квантові комп’ютери.	https://techno.nv.ua/ukr/it-industry/shveycarski-naukovi-chipi-qs7001-dlya-zahistu-danih-vid-kvantovih-atak-50493253.html	2025-02-27T01:30:00-08:00	https://static.nv.ua/shared/system/Article/posters/003/044/596/original/8654a483eafaaed6e4d610c8b8fd2d3c.jpg?q=85&stamp=20250226124406&w=900
У Китаї гурмани видають себе за родичів померлих, щоб скуштувати ...	У Китаї гурмани почали масово видавати себе за родичів померлих, аби поїсти в їдальні похоронного бюро міста Ерлонг.	https://nv.ua/ukr/lifestyle/pohoronne-byuro-kitayu-v-jidalni-proponuye-lokshinu-cherez-yaku-meshkanci-vidayut-sebe-za-rodichiv-pomerlih-50493561.html	2025-02-27T01:29:00-08:00	https://static.nv.ua/shared/system/Article/posters/003/045/267/original/af5627a06c0008c13c2951d79d08767c.jpg?q=85&stamp=20250227112702&w=900
Індекс демократії у світі опустився до найгіршого за 20 років, ли...	Демократія у світі перебуває в найгіршому стані, ніж будь-коли за останні два десятиліття, засвідчив новий рейтинг Індекс демократії, яки щороку складає The Economist.	https://nv.ua/ukr/world/countries/reyting-demokratichnih-i-avtoritarnih-krajin-svitu-na-yakomu-misci-ukrajina-rosiya-hto-pershiy-50493534.html	2025-02-27T01:28:00-08:00	https://static.nv.ua/shared/system/Article/posters/003/045/209/original/8df959b544498ee35554f506bab08020.jpg?q=85&stamp=20250227112510&w=900
Оскароносний актор Джин Гекмен і його дружина Бетсі Аракава знайд...	Тіла 95-річного голлівудського актора Джина Хекмена і його 63-річної дружини, піанистки Бетсі Аракави знайшли у їхньому будинку в Санта-Фе, штат Нью-Мексіко.	https://nv.ua/ukr/kultura/dzhin-gekmen-oskaronosniy-aktor-i-yogo-druzhina-betsi-arakava-znaydeni-mertvimi-u-santa-fe-foto-50493566.html	2025-02-27T01:25:00-08:00	https://static.nv.ua/shared/system/Article/posters/003/045/281/original/9b6a0890feade546f7ff3a93b5806d81.jpg?q=85&stamp=20250227112110&w=900
Настав час посунути Tesla. Stellantis представила систему автоном...	Stellantis представила нову систему автономного водіння STLA AutoDrive 1.0, що відповідає стандартам автоматизації SAE Level 3.	https://techno.nv.ua/ukr/popscience/stellantis-predstavila-sistemu-avtonomnogo-vodinnya-stla-autodrive-1-0-50493527.html	2025-02-27T01:24:00-08:00	https://static.nv.ua/shared/system/Article/posters/003/045/196/original/ad3af4490e6cb6b9007923343553787a.jpg?q=85&stamp=20250227102328&w=900
Варіанту не підписати вже немає'. Усі ризики щодо мінералів буду...	Варіанту не підписати зі США угоду щодо рідкісноземельних металів у України вже немає.	https://biz.nv.ua/ukr/markets/bitva-za-ridkisnozemelni-metali-naybilshi-riziki-budut-v-ugodi-nomer-dva-deputat-50493558.html	2025-02-27T01:21:00-08:00	https://static.nv.ua/shared/system/Article/posters/003/045/262/original/e87fe94487797415becb023cd0a798d0.jpg?q=85&stamp=20250227111422&w=900
Сподіваюсь, що його виправдають': Ярмоленко став на захист Мудри...	Півзахисник київського Динамо Андрій Ярмоленко висловився про допінговий скандал, пов’язаний із зіркою збірної України та Челсі Михайлом Мудриком.	https://sport.nv.ua/ukr/football/mihaylo-mudrik-ne-vzhivav-niyakogo-dopingu-andriy-yarmolenko-50493555.html	2025-02-27T01:11:00-08:00	https://static.nv.ua/shared/system/Article/posters/003/045/256/original/ce0338dc0e75c989b460ddefa9ff68e4.jpg?q=85&stamp=20250227105736&w=900
Остання версія угоди. Що їде підписувати Зеленський	Угода між Україною та США щодо створення Фонду відновлення України пройшла суттєву еволюцію	https://nv.ua/ukr/opinion/korisni-kopalini-ukrajini-shcho-pidpishe-zelenskiy-u-trampa-50493560.html	2025-02-27T01:10:00-08:00	https://nv.ua/upload/nv_fix_image.jpeg
Український нападник забив за шотландський клуб вперше за три міс...	Український нападник Гіберніана Микола Кухаревич допоміг своєму клубу обіграти Данді з рахунком 3:1 у матчі 28 туру чемпіонату Шотландії.	https://sport.nv.ua/ukr/football/mikola-kuharevich-zabiv-gol-za-gibernian-vpershe-za-tri-misyaci-video-50493550.html	2025-02-27T01:08:00-08:00	https://static.nv.ua/shared/system/Article/posters/003/045/244/original/ebdc249e0b4226f8bcfbd3019463c41d.jpg?q=85&stamp=20250227105545&w=900
Російська армія вночі та зранку завдала ударів по Костянтинівці т...	Вночі та зранку 27 лютого армія країни-агресора Росії обстріляла Костянтинівку та Слов’янськ у Донецькій області.	https://nv.ua/ukr/ukraine/events/obstril-kostyantinivki-ta-slov-yanska-27-lyutogo-shcho-vidomo-50493545.html	2025-02-27T01:06:00-08:00	https://static.nv.ua/shared/system/Article/posters/003/045/235/original/7f8aaf2b8b434c696b19f5ce73a80772.jpg?q=85&stamp=20250227105938&w=900
Через його молодий вік. У США касир не хотів продавати Тому Голла...	Зірці Людини павука Тому Голланду відмовились продавати пиво його ж бренду у магазині в США.	https://nv.ua/ukr/lifestyle/tom-golland-otrimav-vidmovu-koli-hotiv-kupiti-svoye-pivo-50493546.html	2025-02-27T01:05:00-08:00	https://static.nv.ua/shared/system/Article/posters/003/045/237/original/918149e24f98a178fe206b3510da1c0a.jpg?q=85&stamp=20250227105928&w=900
Усі розбіжності зняті'. Російські закордонні нафтові проєкти від...	Влада Іраку та автономії Курдистан врегулювали розбіжності в нафтовій сфері, що дасть змогу зупиненим російським нафтовим проєктам відновити роботу в регіоні.	https://biz.nv.ua/ukr/economics/zupineni-naftovi-proyekti-rf-na-blizkomu-shodi-vidnovlyat-robotu-50493544.html	2025-02-27T01:03:00-08:00	https://static.nv.ua/shared/system/Article/posters/003/045/233/original/7a27fc42e39978e3184061b5274b1c2d.jpg?q=85&stamp=20250227104419&w=900
Умєров офіційно призначив екскомандувача Об'єднаних сил ЗСУ Гнато...	Міністр оборони України Рустем Умєров за погодженням з президентом України призначив генерал-майора Андрія Гнатова заступником начальника Генерального штабу ЗСУ, йдеться у повідомленні Міноборони у четвер, 27 лютого.	https://nv.ua/ukr/ukraine/politics/andriya-gnatova-priznachili-zastupnikom-kerivnika-genshtabu-zsu-50493552.html	2025-02-27T00:56:00-08:00	https://static.nv.ua/shared/system/Article/posters/003/045/249/original/2609ea14c0fa68f407bdabc60f2c642a.jpg?q=85&stamp=20250227105153&w=900
Вочевидь, щось пішло не так'. Професійна армія РФ була винищена ...	Голова української розвідки Кирило Буданов розповів, що російська професійна армія була повністю винищена ще до 2023 року. Він зазначив, що окупанти воюють мобілізованими, які готувалися до бойових дій 'максимум два тижні'.	https://nv.ua/ukr/world/geopolitics/skilki-shche-mozhe-voyuvati-rf-profesiyna-armiya-rosiji-bula-vinishchena-do-2023-roku-povidomiv-budanov-50493549.html	2025-02-27T00:56:00-08:00	https://static.nv.ua/shared/system/Article/posters/003/045/242/original/5cc12247763cc5f56cd90f8f3c33b7ab.jpg?q=85&stamp=20250227105050&w=900
Зеленського запросили на саміт ЄС щодо європейської оборони і без...	Глава Європейської ради Антоніу Кошта запросив президента України Володимира Зеленського на саміт лідерів Євросоюзу, який відбудеться 6 березня і буде присвячений європейській обороні і Україні.	https://nv.ua/ukr/world/countries/volodimira-zelenskogo-zaprosili-na-samit-yes-shchodo-yevropeyskoji-oboroni-i-bezpeki-ukrajini-50493541.html	2025-02-27T00:53:00-08:00	https://static.nv.ua/shared/system/Article/posters/003/045/225/original/06f914289d213dc4026365c6ae6ebb19.jpg?q=85&stamp=20250227105342&w=900
Це була марна трата часу'. Макрон не зміг переконати Трампа нада...	Президент Франції Еммануель Макрон під час свого візиту в Білий дім 24 лютого не зміг одержати конкретних запевнень від американського лідера Дональда Трампа щодо гарантій безпеки США для України, у ЄС стурбовані.	https://nv.ua/ukr/world/geopolitics/garantiji-bezpeki-ukrajini-chi-vdalosya-makronu-perekonati-donalda-trampa-50493531.html	2025-02-27T00:41:00-08:00	https://static.nv.ua/shared/system/Article/posters/003/045/204/original/570b563ec0281d6139f919514f67322c.jpg?q=85&stamp=20250227102311&w=900
Виїзд митців і медійників за кордон: з 3 березня Мінкульт призупи...	Міністерство культури та стратегічних комунікацій України (МКСК) з 3 березня призупинить видачу листів сприяння до Державної прикордонної служби щодо виїзду з України військовозобов'язаних чоловіків, які працюють у сфері культури та медіа. Про це йдеться у повідомленні МКСК у четвер, 27 лютого.	https://nv.ua/ukr/ukraine/politics/vijizd-artistiv-ta-zhurnalistiv-za-kordon-z-3-bereznya-v-uryadi-poyasnili-novi-pravila-50493540.html	2025-02-27T00:40:00-08:00	https://static.nv.ua/shared/system/Article/posters/003/045/223/original/4c7c8c4790a83596c4d1cb9a194f9ee1.jpg?q=85&stamp=20250227103607&w=900
Звернулася до Мінкульту за допомогою. Юлі Юріній вкотре відмовили...	Етноспівачка й екссолістка гурту YUKO Юля Юріна, яка народилась в Росії, повідомила, що їй знову відмовили в отриманні українського громадянства. Цього року у неї закінчується російський закордонний паспорт, який є підставою її легального перебування в Україні.	https://life.nv.ua/ukr/znamenitosti/yuli-yuriniy-vidmovili-u-nadanni-ukrajinskogo-gromadyanstva-50493530.html	2025-02-27T00:37:00-08:00	https://static.nv.ua/shared/system/Article/posters/003/045/202/original/ad4ba6251294bad2c00a3788fde6e6c2.jpg?q=85&stamp=20250227102811&w=900
Це дуже небезпечно. Що керує зараз Трампом	Мстивість Трампа становить небезпеку для світового порядку	https://nv.ua/ukr/opinion/tramp-mstit-zelenskomu-chomu-amerika-prograye-rosiji-50493539.html	2025-02-27T00:33:00-08:00	https://nv.ua/upload/nv_fix_image.jpeg
Пенсії 2025. Чиї виплати не будуть проіндексовані з 1 березня	Уряд ухвалив рішення про здійснення індексації пенсій у 2025 році, в результаті якої пенсії понад 10 мільйонів громадян зростуть на 11,5%. Проте деякі пенсії не будуть проіндексовані.	https://biz.nv.ua/ukr/economics/indeksaciya-pensiy-2025-chiji-viplati-ne-zrostut-z-1-bereznya-novini-ukrajini-50493532.html	2025-02-27T00:32:00-08:00	https://static.nv.ua/shared/system/Article/posters/003/045/206/original/f0c8f12187ddef5d6c275b48df0a419d.jpg?q=85&stamp=20250227101856&w=900
Я назавжди втратила частину пальця'. Польська бобслеїстка зазнал...	Польська бобслеїстка Лінда Вайшевські потрапила в аварію на трасі в Лейк-Плесіді (США), де проходить чемпіонат світу.	https://sport.nv.ua/ukr/other-sport/polska-bobslejistka-linda-vayshevski-vtratila-chastinu-palcya-na-chempionati-svitu-50493529.html	2025-02-27T00:29:00-08:00	https://static.nv.ua/shared/system/Article/posters/003/045/200/original/52fc61f9914b1f4c74f35f4ba4738578.jpg?q=85&stamp=20250227101607&w=900
Лунін встановив унікальне досягнення завдяки успіху в Кубку Іспан...	У першому поєдинку півфіналу Кубка Іспанії мадридський Реал переміг Реал Сосьєдад з рахунком — 1:0.	https://sport.nv.ua/ukr/football/andriy-lunin-vstanoviv-unikalne-dosyagnennya-dlya-vorotariv-reala-cogo-sezonu-50493526.html	2025-02-27T00:29:00-08:00	https://static.nv.ua/shared/system/Article/posters/003/045/192/original/5ede36141f8e82a5f43dd63a5e16e9cd.jpg?q=85&stamp=20250227100616&w=900
Дистанційка проти офісного рабства. Скільки українців мріє про ро...	На ринку праці склався дисбаланс. Переважна більшість шукачів роботи та зайнятих спеціалістів бажають працювати у віддаленому або гібридному форматі. Проте роботодавці у більшості випадків хочуть бачити команду у офісі.	https://biz.nv.ua/ukr/markets/viddaleniy-format-roboti-hoche-obrati-mayzhe-polovina-ukrajinciv-a-chogo-hochut-robotodavci-50493525.html	2025-02-27T00:23:00-08:00	https://static.nv.ua/shared/system/Article/posters/003/045/190/original/4e7d5ca7ee590505f547e464f10bf718.jpg?q=85&stamp=20250227101204&w=900
Режисер фільму Конклав. Едвард Бергер зніме фільм за мемуарами жу...	Режисер фільму Конклав, який отримав нагороду BAFTA та претендує на Оскар, Едвард Бергер екранізує мемуари американського журналіста Евана Гершковича, якого Росія звинуватила у шпигунстві.	https://nv.ua/ukr/kultura/edvard-berger-znimit-film-na-memuari-evana-gershkovicha-50493521.html	2025-02-27T00:13:00-08:00	https://static.nv.ua/shared/system/Article/posters/003/045/180/original/00ace6eb00d7e6f46409ce291e55bf44.jpg?q=85&stamp=20250227100722&w=900
Збиття рейсу MH17. Родичі загиблих вимагають, щоб Росія визнала п...	Родичі загиблих у катастрофі рейсу MH17, який у 2014 році збили над Донецькою областю, наполягають, що без визнання Росією відповідальності за злочин не може бути надійної угоди щодо припинення війни в Україні.	https://nv.ua/ukr/world/geopolitics/mh17-rodichi-zagiblih-u-katastrofi-hochut-shchob-rf-viznala-vidpovidalnist-u-mezhah-mirnoji-ugodi-50493522.html	2025-02-27T00:09:00-08:00	https://static.nv.ua/shared/system/Article/posters/003/045/184/original/e25f425289dfe7e0af0a5c98eb240dc9.jpg?q=85&stamp=20250227100028&w=900
На фронті проведено перегрупування військ, що сповільнило просува...	Головнокомандувач ЗСУ Олександр Сирський в четвер, 27 лютого повідомив, що на фронті було вжито заходів для покращення взаємодії військових та проведено перегрупування військ, що сповільнило просування РФ на більшості загрозливих ділянок.	https://nv.ua/ukr/world/geopolitics/boji-na-donbasi-provedeno-peregrupuvannya-shcho-spovilnilo-prosuvannya-rf-povidomiv-sirskiy-50493523.html	2025-02-27T00:05:00-08:00	https://static.nv.ua/shared/system/Article/posters/003/045/186/original/896f303bebe9fb61a3a2d68962d73b27.jpg?q=85&stamp=20250227100051&w=900
Клуб українця сенсаційно вибив Ювентус з Кубка Італії - відео	Емполі, за який виступає українець Віктор Коваленко, у серії пенальті обіграв туринський Ювентус у чвертьфіналі Кубка Італії.	https://sport.nv.ua/ukr/football/empoli-viktora-kovalenka-sensaciyno-v-seriji-penalti-vibiv-yuventus-z-kubka-italiji-video-50493516.html	2025-02-27T00:04:00-08:00	https://static.nv.ua/shared/system/Article/posters/003/045/170/original/d405aedff25c133cd8185acbe483e5f8.jpg?q=85&stamp=20250227093809&w=900
Зеленський не підписуватиме другу угоду зі США про доступ до копа...	Президент України Володимир Зеленський не має наміру підписувати другу угоду зі США про доступ до рідкісноземельних корисних копалин, що настане після рамкової угоди, якщо вона не міститиме ширших гарантій безпеки, пише The Economist із посиланням на джерело в уряді України 26 лютого.	https://nv.ua/ukr/world/geopolitics/ridkisnozemelni-metali-zelenskiy-ne-pidpisuvatime-drugu-ugodu-zi-ssha-bez-garantiy-50493524.html	2025-02-27T00:04:00-08:00	https://static.nv.ua/shared/system/Article/posters/003/045/188/original/4d186f27a51ae0db9afe9b572545cd59.jpg?q=85&stamp=20250227095953&w=900
ДБР викрило двох посадовців ЗСУ, яких підозрюють організації кору...	Державне бюро розслідувань (ДБР) повідомили про підозру двом посадовцям командування одного з родів військ ЗСУ, які підозрюються в організації незаконної схеми оновлення військово-облікових даних у одному із ТЦК та СП Києва та одному із ТЦК та СП Волинської області.	https://nv.ua/ukr/ukraine/events/dvoh-posadovciv-zsu-u-kiyevi-ta-na-volini-pidozryuyut-organizaciji-korupciynoji-shemi-u-tck-50493515.html	2025-02-27T00:02:00-08:00	https://static.nv.ua/shared/system/Article/posters/003/045/168/original/fd8baa921044052e4ec26e6535d4e9ac.jpg?q=85&stamp=20250227095913&w=900
Революційне відкриття. Вчені знайшли ефективний спосіб видобутку ...	Дослідження виявило механізм, що пояснює, як золото піднімається з мантії Землі на поверхню. Довгий час залишалося загадкою, чому цей дорогоцінний метал зустрічається на поверхні, незважаючи на його схильність залишатися в надрах.	https://techno.nv.ua/ukr/popscience/nove-doslidzhennya-rozkrivaye-proces-pidyomu-zolota-z-nadr-zemli-50493243.html	2025-02-27T00:00:00-08:00	https://static.nv.ua/shared/system/Article/posters/003/044/576/original/b080ac9d2c38f34757bee17c981dece0.jpg?q=85&stamp=20250226123320&w=900
