Title	Description	Link	pubDate	Image
Реформа МСЕК 2025. Хто буде проводити оцінювання інвалідності та ...	Після того, як в Україні розпустили медико-соціальні експертні комісії, працюватимуть експертні команди лікарів. Вони і визначатимуть, чи має людина право на інвалідність.	https://nv.ua/ukr/ukraine/events/msek-2025-yaki-likari-uviydut-v-ekspertni-komandi-dlya-ocinyuvannya-invalidnosti-50483618.html	2025-01-22T23:40:00-08:00	https://static.nv.ua/shared/system/Article/posters/003/023/864/original/05697731b92181e2385cbfd1c909f07a.jpg?q=85&stamp=20250122112515&w=900
Новий контингент КНДР може опинитися на полі бою у квітні 2025: щ...	Попри те, що в найближчі місяці Північна Корея планує спрямувати у Росію новий контингент для участі у війні проти України, ці військові навряд чи матимуть значний вплив на ефективність російських операцій на полі бою.	https://nv.ua/ukr/world/countries/kndr-nadishle-novih-soldativ-u-rosiyu-koli-ce-stanetsya-i-na-shcho-vpline-u-viyni-proti-ukrajini-50483875.html	2025-01-22T23:25:00-08:00	https://static.nv.ua/shared/system/Article/posters/003/024/413/original/4194405967488d6321629032b4738698.jpg?q=85&stamp=20250123092632&w=900
Ми найбільший міжнародний донор'. Каллас відповіла на заяви Трам...	Глава дипломатії Європейського Союзу Кая Каллас відповіла президенту США Дональду Трампу, який заявив, що Європа відстає від США у допомозі Україні, і наполягла на тому, що блок повинен мати місце за столом переговорів, коли настане час мирних переговорів.	https://nv.ua/ukr/world/geopolitics/kaya-kallas-vidpovila-donaldu-trampu-na-kritiku-stosovno-dopomogi-yevropi-ukrajini-50483891.html	2025-01-22T23:15:00-08:00	https://static.nv.ua/shared/system/Article/posters/003/024/448/original/73bbe2b7389fe6744872b4dbba203204.jpg?q=85&stamp=20250123091627&w=900
Флет-вайт проти лате. Який напій більш вершковий та в чому відмін...	Незважаючи на те, що ви можете вивчити відмінності між різними напоями, це все одно легко забути.	https://nv.ua/ukr/food/eat/late-ta-flet-vayt-v-chomu-vidminnosti-napojiv-ta-yakiy-bilsh-kremoviy-50483844.html	2025-01-22T23:11:00-08:00	https://static.nv.ua/shared/system/Article/posters/003/024/346/original/b3c5405638ca669cbf3f787c9d26632c.jpg?q=85&stamp=20250122214626&w=900
Ще більше ШІ в старому дизайні. Samsung анонсувала лінійку смартф...	На заході Galaxy Unpacked 2025 Samsung представила нову лінійку смартфонів S25, що надійде у продаж наступного місяця.	https://techno.nv.ua/ukr/gadgets/galaxy-s25-50483884.html	2025-01-22T23:05:00-08:00	https://static.nv.ua/shared/system/Article/posters/003/024/430/original/c117fa2a100135c8d02e004574e2f1c5.jpg?q=85&stamp=20250123084910&w=900
Путіну більше нічого сказати? У якій ситуації опинилася Росія	Кілька ювілеїв, які Путін планує відзначити цього року. І що з цього вийде	https://nv.ua/ukr/opinion/putin-gotuyetsya-svyatkuvati-yuviley-pri-vladi-shcho-vidbuvayetsya-navkolo-kremlya-50483810.html	2025-01-22T23:03:00-08:00	https://nv.ua/upload/nv_fix_image.jpeg
Зеленський назвав вступ України в НАТО найдешевшою гарантією безп...	Президент Володимир Зеленський назвав вступ України НАТО найдешевшою гарантією безпеки. За його словами, для стримування Росії Україні необхідна мільйонна армія, а на її утримання буде працювати вся українська економіка.	https://nv.ua/ukr/ukraine/events/vstup-ukrajini-v-nato-zelenskiy-nazvav-chlenstvo-v-alyansi-naydeshevshoyu-garantiyeyu-bezpeki-50483890.html	2025-01-22T23:02:00-08:00	https://static.nv.ua/shared/system/Article/posters/003/024/444/original/a19dfca89e0149479d97aaf0bd91ae6f.jpg?q=85&stamp=20250123085620&w=900
Пушич казав, щоб пробив саме так': Судаков розповів, як вдалось ...	Півзахисник Шахтаря Георгій Судаков прокоментував свій гол з пенальті в матчі проти Бреста (2:0) у 7-му турі основного етапу Ліги чемпіонів.	https://sport.nv.ua/ukr/football/shahtar-brest-georgiy-sudakov-rozpoviv-pro-sviy-rozkishniy-gol-z-penalti-50483888.html	2025-01-22T23:01:00-08:00	https://static.nv.ua/shared/system/Article/posters/003/024/441/original/ed12a7c1dedaf8a706f562a0a269a99f.jpg?q=85&stamp=20250123085256&w=900
Після скандалу з обшуками. В Податковій розповіли, які доходи зад...	Громадяни України подали 451 декларацію про доходи, отримані від діяльності на платформі OnlyFans.	https://biz.nv.ua/ukr/markets/u-dps-povidomili-skilki-podatkiv-zadeklaruvali-ukrajinski-modeli-onlyfans-50483887.html	2025-01-22T22:58:00-08:00	https://static.nv.ua/shared/system/Article/posters/003/024/439/original/52055ff878fd1f31f470d517f294326e.jpg?q=85&stamp=20250123085352&w=900
Маск проти Трампа? Масштабний АІ-проект президента США викликав п...	Ілон Маск розкритикував ініціативу Трампа витратити $500 млрд на створення 'чисто американського ШІ'. Сем Альтман та інші лідери технологічного сектора в боргу не залишилися.	https://techno.nv.ua/ukr/it-industry/mask-proti-trampa-50483886.html	2025-01-22T22:50:00-08:00	https://static.nv.ua/shared/system/Article/posters/003/024/433/original/6c53e0c6bdd0c0da5e7af509c9c2fdfe.jpg?q=85&stamp=20250123084549&w=900
Відстрочка від мобілізації для студентів. Що треба робити, аби не...	Під час воєнного стану та мобілізації в Україні студенти вишів можуть отримати відстрочку від військової служби. Це дозволяє їм продовжувати навчання та здобувати освіту, незважаючи на складні обставини.	https://nv.ua/ukr/ukraine/events/vidstrochka-dlya-studentiv-hto-maye-pravo-yak-oformiti-pid-chas-viyni-ta-prodovzhiti-onlayn-50483740.html	2025-01-22T22:48:00-08:00	https://static.nv.ua/shared/system/Article/posters/003/024/123/original/507dbb85f6573d8eb265157491768fdf.jpg?q=85&stamp=20250122161539&w=900
Він не помилував самого себе'. Трамп не виключив розслідування щ...	Президент США Дональд Трамп не виключив можливість проведення розслідування щодо колишнього президента США Джо Байдена.	https://nv.ua/ukr/world/countries/rozsliduvannya-proti-baydena-tramp-vislovivsya-shchodo-yogo-ymovirnosti-50483880.html	2025-01-22T22:46:00-08:00	https://static.nv.ua/shared/system/Article/posters/003/024/423/original/0b0dcfe9934c68527efc446c7e2d6b45.jpg?q=85&stamp=20250123084232&w=900
Я не говорив, що нам потрібно 200 тисяч': Зеленський уточнив сво...	Президент Володимир Зеленський пояснив свою заяву про необхідність Україні 200 тисяч іноземних військових після можливого припинення вогню на фронті.	https://nv.ua/ukr/ukraine/politics/inozemni-viyska-v-ukrajini-zelenskiy-poyasniv-zayavu-pro-200-tisyach-yevropeyskih-soldativ-50483881.html	2025-01-22T22:34:00-08:00	https://static.nv.ua/shared/system/Article/posters/003/024/425/original/ea422514fa12c6a64210e37974032418.jpg?q=85&stamp=20250123082815&w=900
Уперше за 5 тис. років. У Єгипті знайшли плямисту гієну	Уперше за останні 5000 років на південному сході Єгипту було виявлено плямисту гієну.	https://techno.nv.ua/ukr/popscience/plyamista-giyena-vpershe-za-p-yat-tisyach-rokiv-z-yavilasya-v-yegipti-50483643.html	2025-01-22T22:30:00-08:00	https://static.nv.ua/shared/system/Article/posters/003/023/915/original/436089a83993ceb4016b603f1562eb52.jpg?q=85&stamp=20250122121851&w=900
Росія втратила на війні в Україні 1340 солдатів, шість танків і 6...	Війська країни-агресора Росії втратили на війні Україні приблизно 1340 військових загиблими та пораненими за добу. Загальні бойові втрати РФ з початку повномасштабного вторгнення в Україну досягли 825 320 осіб.	https://nv.ua/ukr/ukraine/events/vtrati-rosiji-u-viyni-proti-ukrajini-syagnuli-825-tisyach-viyskovih-genshtab-onoviv-dani-23-sichnya-50483879.html	2025-01-22T22:24:00-08:00	https://static.nv.ua/shared/system/Article/posters/003/024/421/original/aa3ca478083bd96268262fa30bea9ddf.jpg?q=85&stamp=20250123082455&w=900
Українці в Європі. Які країни змінили правила для біженців в 2025...	Війна змусила мільйони українців покинути свої домівки в пошуках безпеки. Європа стала місцем, де люди знайшли притулок, але з часом умови перебування в країні змінюються. 2025 рік приносить законодавчі та соціальні зміни, які суттєво вплинуть на життя українців у Європі. Варто заздалегідь ознайомитися з ключовими нововведеннями та як ці зміни вплинуть на повсякденне життя.	https://nv.ua/ukr/world/countries/ukrajinski-za-kordonom-novi-pravila-v-yevropi-ta-shcho-zminyuyut-u-2025-roci-50483675.html	2025-01-22T22:17:00-08:00	https://static.nv.ua/shared/system/Article/posters/003/023/985/original/5e9d736ceb815e139a3bef5cb5e15784.jpg?q=85&stamp=20250122133150&w=900
Безпрецедентний рівень санкцій'. Імпорт російського скрапленого ...	Санкції проти РФ ефективні, проте вони потребують вдосконалення, оскільки ключовим джерелом доходів Росії залишаються енергоносії, зокрема нафта й газ.	https://biz.nv.ua/ukr/markets/import-rosiyskogo-skraplenogo-gazu-zrostaye-yes-mav-zrobiti-bilshe-dombrovskis-50483878.html	2025-01-22T22:15:00-08:00	https://static.nv.ua/shared/system/Article/posters/003/024/419/original/320a46008b77a7707c17e4554f8fb13a.jpg?q=85&stamp=20250123080928&w=900
За участі генсека НАТО і лідерів країн. Сьогодні у Давосі проходи...	23 січня 2025 року в Давосі (Швейцарія) Фонд Віктора Пінчука та компанія EastOne проводять Український сніданок — традиційний приватний захід, організований з нагоди щорічної зустрічі Всесвітнього економічного форуму (ВЕФ).	https://nv.ua/ukr/world/geopolitics/ukrajinskiy-snidanok-u-davosi-2025-koli-vidbudetsya-yaka-tema-spisok-uchasnikiv-novini-ukrajini-50482156.html	2025-01-22T22:13:00-08:00	https://static.nv.ua/shared/system/Article/posters/003/020/700/original/c9671d42c761c4b6b197a43a0738932f.jpg?q=85&stamp=20250123081007&w=900
Повістка в ТЦК 2025: які причини неприбуття вважаються поважними ...	Під час мобілізації в Україні існують законні підстави через які громадянин має право не прийти у ТЦК після отримання повістки.	https://nv.ua/ukr/ukraine/events/mobilizaciya-v-ukrajini-koli-mozhna-ne-yti-z-povistkoyu-v-tck-povazhni-prichini-novini-ukrajini-50483782.html	2025-01-22T22:13:00-08:00	https://static.nv.ua/shared/system/Article/posters/003/024/216/original/6d2b1e4a154aae61ec1c63580230d38c.jpg?q=85&stamp=20250122172737&w=900
Мобілізація 2025. Як беруть на облік та мобілізують звільнених ум...	В Україні засуджені чоловіки можуть стати на військовий облік та мобілізуватися. Зокрема, для взяття на військовий облік засуджений подає на ім'я керівника установи покарань заяву про бажання проходити військову службу за контрактом, а установа організовує проходження засудженими медичного огляду.	https://nv.ua/ukr/ukraine/events/posilennya-mobilizaciji-yak-zvilnenim-umovno-dostrokovo-piti-sluzhiti-v-zsu-poyasnennya-yuristiv-50483361.html	2025-01-22T22:10:00-08:00	https://static.nv.ua/shared/system/Article/posters/003/023/310/original/388daf8b18d7aaf66566e90975b02e93.jpg?q=85&stamp=20250121134110&w=900
Кількість постраждалих унаслідок ракетного удару РФ по Запоріжжю ...	Кількість постраждалих унаслідок російського ракетного удару по Запоріжжю збільшилась до 24.	https://nv.ua/ukr/ukraine/events/raketniy-udar-po-zaporizhzhyu-23-sichnya-kilkist-poranenih-zbilshilas-do-24-novini-ukrajini-50483876.html	2025-01-22T22:10:00-08:00	https://static.nv.ua/shared/system/Article/posters/003/024/415/original/e97e91e86db165ab402d6a8b743c3f8f.jpg?q=85&stamp=20250123080820&w=900
На екофлоу та старлінк. Збір NV для бійців 110 бригади	NV запускає збір для бійців 110 ОМБр, які вже четвертий рік поспіль боронять Україну на Донбасі. Ціль збору 120 тис. грн на два екофлоу та старлінк	https://biz.nv.ua/ukr/finance/dopomoga-zsu-nv-zapustiv-zbir-dlya-110-ombr-50483873.html	2025-01-22T22:06:00-08:00	https://static.nv.ua/shared/system/Article/posters/003/024/409/original/f1513c65530f2afdc35e3426974a6ab6.jpg?q=85&stamp=20250123075946&w=900
Поштомати для риби. Власниця мережі Чорноморка — про відкриття ри...	Рестораторка Ольга Копилова розповіла про новинки своєї мережі — автомати для устриць та поштомати для риби.	https://nv.ua/ukr/food/restaurants/restorani-chornomorka-merezha-zapuskaye-vlasni-ribni-magazini-ta-ustrichni-avtomati-50483805.html	2025-01-22T22:05:00-08:00	https://static.nv.ua/shared/system/Article/posters/003/024/265/original/e573567e3acd9718a7daf98e4088fd87.jpg?q=85&stamp=20250122185934&w=900
Безугла заявила, що командування ЗСУ отримує багатомільйонні прем...	Нардепка Мар’яня Безугла опублікувала документ про грошові премії, які вона назвала 'преміями генералітету'. Командувач Військово-морських сил Олексій Неїжпапа відповів, що має повноваження заохотити військовослужбовців грошовими преміями.	https://nv.ua/ukr/ukraine/politics/skandal-z-premiyami-dlya-generalitetu-komanduvach-vms-vidpoviv-na-informaciyu-bezugloji-50483874.html	2025-01-22T22:01:00-08:00	https://static.nv.ua/shared/system/Article/posters/003/024/411/original/b9e481615a725b160541e7795cad5fe0.jpg?q=85&stamp=20250123075424&w=900
Курс валют НБУ. Євро зростає, долар падає	На 23 січня, Національный банк України встановив офиційний курс гривні до американського долара на рівні 42,03 грн/$.	https://biz.nv.ua/ukr/finance/kurs-dolara-yak-zminivsya-kurs-valyut-nbu-23-yanvarya-novini-ukrajini-50483877.html	2025-01-22T22:00:00-08:00	https://static.nv.ua/shared/system/Article/posters/003/024/417/original/d440ae5e7dd74d9fd4f1a2f4f53c92ce.jpg?q=85&stamp=20250123080101&w=900
Рубіо відвідає Панаму в першій закордонній поїздці на посаді держ...	Державний секретар США Марко Рубіо планує відвідати Панаму в рамках поїздки до Латинської Америки наступного тижня, повідомляє агентство Bloomberg із посиланням на джерела.	https://nv.ua/ukr/world/geopolitics/povernennya-panamskogo-kanalu-ssha-marko-rubio-planuye-vidvidati-panamu-nastupnogo-tizhnya-50483871.html	2025-01-22T21:45:00-08:00	https://static.nv.ua/shared/system/Article/posters/003/024/405/original/f2115a357c5f29cc3a5595be8e5f7457.jpg?q=85&stamp=20250123073049&w=900
Не лише молоко. Що додають у каву у різних країнах та яку каву в ...	Як ви хочете вашу каву: гарячою, міцною, з кислинкою чи з молоком? Існує безліч варіантів як зробити смак напою глибшим. Розповідаємо про незвичні додатки, про які ви могли не здогадуватися.	https://nv.ua/ukr/food/eat/yak-piti-kavu-shcho-dodayut-do-kavi-v-riznih-krajinah-svitu-50483289.html	2025-01-22T21:43:00-08:00	https://static.nv.ua/shared/system/Article/posters/003/023/154/original/e8a413c433b6a430e5fffcdd96e714dc.jpg?q=85&stamp=20250121112818&w=900
Війська РФ захопили ще одне село під Покровськом і просунулися бі...	Війська країни-агресора Росії захопили населений пункт Нововасилівка на Покровському напрямку Донецької області, повідомляють аналітики DeepState у четвер, 23 січня.	https://nv.ua/ukr/ukraine/events/boji-za-pokrovsk-rosiya-okupuvala-shche-odin-naseleniy-punkt-u-doneckiy-oblasti-karta-deepstate-50483872.html	2025-01-22T21:36:00-08:00	https://static.nv.ua/shared/system/Article/posters/003/024/407/original/55afb8709098b2bd0f873d94583835fc.jpg?q=85&stamp=20250123073202&w=900
П’ять несправедливо забутих українських слів про зиму, які змінят...	Українська мова багата на слова, які описують різноманітні явища природи, в тому числі й зимові.	https://nv.ua/ukr/ukraine/events/ukrajinska-mova-zastarili-slova-pro-zimu-yak-uriznomanitniti-movlennya-i-pokrashchiti-vimovu-50483659.html	2025-01-22T21:30:00-08:00	https://static.nv.ua/shared/system/Article/posters/003/023/953/original/a7053670972bc805a7e3e89c5c63b6b0.jpg?q=85&stamp=20250122130057&w=900
Як Трамп планує припинити війну в Україні	Трамп сигналізує, що в перші 100 днів почне формувати новий світовий порядок	https://nv.ua/ukr/opinion/yak-tramp-planuye-pripiniti-viynu-v-ukrajini-britanskiy-analitik-50483803.html	2025-01-22T21:13:00-08:00	https://nv.ua/upload/nv_fix_image.jpeg
Трамп підписав указ про визнання єменських хуситів терористами	У перші дні свого президентства Дональд Трамп підписав указ, згідно з яким єменських хуситів (також відомих як Ансар Аллах) занесуть до списку іноземних терористичних організацій у рамках закону про імміграцію та громадянство.	https://nv.ua/ukr/world/geopolitics/tramp-ogolosiv-husitiv-inozemnoyu-teroristichnoyu-organizaciyeyu-prichini-ta-naslidki-50483870.html	2025-01-22T20:59:00-08:00	https://static.nv.ua/shared/system/Article/posters/003/024/403/original/bb17bb36dd79e426934da4ca60edc76c.jpg?q=85&stamp=20250123064602&w=900
Кремль приховує реальний стан російської економіки через інфоопер...	Аналітики Інституту вивчення війни(ISW) стверджують, що російська влада розгорнула інформаційну кампанію, спрямовану на створення хибного враження про благополуччя економіки Росії, незважаючи на наявність серйозних макроекономічних проблем, які посилюються витратами на війну проти України.	https://nv.ua/ukr/ukraine/events/ekonomika-rosiji-2024-kreml-prihovuye-realniy-stan-50483869.html	2025-01-22T19:49:00-08:00	https://static.nv.ua/shared/system/Article/posters/003/024/401/original/cbe171e8123b46fec4348336e9983d11.jpg?q=85&stamp=20250123054852&w=900
Штучне сонце. Китайський термоядерний реактор поставив рекорд	Експериментальний токамак EAST, розташований у Китаї, успішно підтримував плазму за екстремально високої температури протягом 1066 секунд.	https://techno.nv.ua/ukr/popscience/kitayske-shtuchne-sonce-vstanovlyuye-noviy-svitoviy-rekord-50483637.html	2025-01-22T19:30:00-08:00	https://static.nv.ua/shared/system/Article/posters/003/023/901/original/90069a6fa13847cec8ec2d7ae05a91fe.jpg?q=85&stamp=20250122120953&w=900
Якого числа починається Великий піст 2025 в Україні за новим церк...	Після переходу на новий юліанський календар, дати церковних свят в Україні суттєво змінилися. Це стосується й одного з найважливіших постів року — Великого посту.	https://nv.ua/ukr/ukraine/events/velikiy-pist-2025-data-pochatku-ta-kincya-tradiciji-ta-osoblivosti-za-novim-kalendarem-pcu-50483448.html	2025-01-22T19:29:00-08:00	https://static.nv.ua/shared/system/Article/posters/003/023/497/original/dd07ea6f68148cd41c25acf9310ff623.jpg?q=85&stamp=20250121171338&w=900
Ворог атакував Запоріжжя: 16 поранених, серед них — рятувальники ...	На світанку 23 січня в Запоріжжі сталася серія вибухів. За попередніми даними, постраждали 16 осіб, серед яких четверо співробітників ДСНС.	https://nv.ua/ukr/ukraine/events/vibuhi-v-zaporizhzhi-23-sichnya-kilkist-postrazhdalih-zrosla-do-16-50483868.html	2025-01-22T19:22:00-08:00	https://static.nv.ua/shared/system/Article/posters/003/024/399/original/7ff6b62a44be1cf9ac3155348b498d71.jpg?q=85&stamp=20250123052220&w=900
Рада нацбезпеки США усунула співробітників, відповідальних за Укр...	Радник із національної безпеки США Майк Волц санкціонував повну перевірку десятків кадрових чиновників Білого дому. Під перевірку потрапили співробітники, які відповідають за питання поширення ядерної зброї Іраном і КНДР, кібершпигунства і війни в Україні.	https://nv.ua/ukr/world/geopolitics/rada-nacbezpeki-ssha-usunula-chinovnikiv-vidpovidalnih-za-ukrajinu-ta-iran-50483867.html	2025-01-22T19:16:00-08:00	https://static.nv.ua/shared/system/Article/posters/003/024/397/original/0fba2158dcb3e0977ffbea10de7c68ed.jpg?q=85&stamp=20250123051328&w=900
