Title	Description	Link	pubDate	Image
Суд у Львові виправдав Андрія Слюсарчука, відомого як доктор Пі	Суд виправдав Андрія Слюсарчука, відомого як доктор Пі, якого у 2014 році засудили до 8 років ув’язнення за звинуваченнями у підробці документів, шахрайстві в особливо великих розмірах та медичних втручаннях, що призвели до смерті пацієнтів.	https://nv.ua/ukr/ukraine/events/doktor-pi-sud-povnistyu-vipravdav-andriya-slyusarchuka-50466800.html	2024-11-15T06:49:00-08:00	https://static.nv.ua/shared/system/Article/posters/002/987/808/original/0d8a9707d8b4c72de1ef3b122d77d3d0.jpg?q=85&stamp=20241115164904&w=900
Ринок лікарських грибів: Як біотехнології борються з перманентним...	Навіщо я з початком повномасштабної війни інвестував у біотехнологічне виробництво мусцимоловмісних продуктів й чому вірю в нього?	https://biz.nv.ua/ukr/experts/likarski-gribi-chi-dopomagayut-vid-stresu-ta-yak-rozvivayetsya-rinok-v-ukrajini-50466690.html	2024-11-15T06:40:00-08:00	https://nv.ua/upload/nv_fix_image.jpeg
Точність вражає. Штучний інтелект навчився знаходити залишки рако...	Вчені зробили революційний прорив у галузі онкології, розробивши систему штучного інтелекту, здатну з неймовірною швидкістю і точністю виявляти ракові пухлини мозку під час операції.	https://techno.nv.ua/ukr/popscience/shtuchniy-intelekt-revolyucionizuye-neyrohirurgiyu-viyavlennya-rakovih-puhlin-za-10-sekund-50466359.html	2024-11-15T06:30:00-08:00	https://static.nv.ua/shared/system/Article/posters/002/986/857/original/a355aeb82530836e87cb15a2e506ab4a.jpg?q=85&stamp=20241114124416&w=900
Грузія — Україна. Онлайн-трансляція матчу Ліги націй	У суботу, 16 листопада, збірна України зіграє проти Грузії у пʼятому турі Ліги В. Матч відбудеться у Батумі. Це друга зустріч команд у цьогорічному розіграші турніру, перша закінчилась перемогою синьо-жовтих — 1:0.	https://sport.nv.ua/ukr/football/gruziya-ukrajina-divitisya-onlayn-translyaciyu-video-matchu-ligi-naciy-16-listopada-pryamiy-efir-50466788.html	2024-11-15T06:26:00-08:00	https://static.nv.ua/shared/system/Article/posters/002/987/781/original/91d24d604082d5b7b5a65102af7f3b31.jpg?q=85&stamp=20241115155316&w=900
Жадібне пузо, не бійся мене'. Усик кумедно звернувся до Ф’юрі, п...	Український суперважковаговик Олександр Усик звернувся до свого наступного суперника британця Тайсона Ф’юрі.	https://sport.nv.ua/ukr/boxing/oleksandr-usik-pociluvav-taysona-f-yuri-zhadibne-puzo-ne-biysya-mene-video-50466798.html	2024-11-15T06:23:00-08:00	https://static.nv.ua/shared/system/Article/posters/002/987/804/original/985190415e86f08151f112ff124b4e80.jpg?q=85&stamp=20241115160629&w=900
Для подальшого обміну. Джемілєв передасть Ердогану список важкопо...	Лідер кримськотатарського народу та народний депутат України Мустафа Джемілєв зустрівся із бійцем полку Азов Геннадієм Харченком, звільненим із російського полону. Під час зустрічі Джемілєв отримав список імен важкопоранених військовополонених.	https://nv.ua/ukr/world/geopolitics/zvilnennya-viyskovopolonenih-dzhemilyev-peredast-erdoganu-spisok-tyazhkoporanenih-azovciv-50466804.html	2024-11-15T06:21:00-08:00	https://static.nv.ua/shared/system/Article/posters/002/987/816/original/3a6e2510734d28b6bcb1a304abff2aa5.jpg?q=85&stamp=20241115161759&w=900
Дома ах*єнно'. Даша Астафʼєва показала фото з рідного містечка н...	Українська акторка, співачка і модель Даша Астафʼєва у своєму Instagram показала фото з рідного містечка Покрова, що на Дніпропетровщині.	https://life.nv.ua/ukr/znamenitosti/dasha-astaf-yeva-pokazala-kadri-z-domu-foto-50466796.html	2024-11-15T06:21:00-08:00	https://static.nv.ua/shared/system/Article/posters/002/987/800/original/11aacfbe6f81f5b51fc1a75f84c7b2d3.jpg?q=85&stamp=20241115161823&w=900
Церква 1806 року. На Сумщині внаслідок російських обстрілів руйну...	Постійні російські обстріли Сумщини пошкодили пам’ятку національного значення, церкву Різдва Пресвятої Богородиці, яку побудували понад 200 років тому.	https://life.nv.ua/ukr/art/na-sumshchini-okupanti-zruynuvali-pam-yatku-nacionalnogo-znachennya-50466794.html	2024-11-15T06:17:00-08:00	https://static.nv.ua/shared/system/Article/posters/002/987/794/original/047befebc2798603d1307b20c5274dad.jpg?q=85&stamp=20241115160132&w=900
Нардепу Тищенку продовжили домашній арешт до 23 грудня	У п’ятницю, 15 листопада, Печерський районний суд Києва продовжив домашній арешт для нардепа Миколи Тищенка до 23 грудня.	https://nv.ua/ukr/ukraine/politics/mikola-tishchenko-nardepu-prodovzhili-domashniy-aresht-50466801.html	2024-11-15T06:16:00-08:00	https://static.nv.ua/shared/system/Article/posters/002/987/810/original/d6b6773513a528365214811730405c28.jpg?q=85&stamp=20241115161520&w=900
Вперше за майже два роки. Шольц провів телефонну розмову з Путіни...	Канцлер Німеччини Олаф Шольц у п’ятницю, 15 листопада, вперше за майже два роки провів телефонну розмову із російським диктатором Володимиром Путіним. Про це повідомляє Süddeutsche Zeitung.	https://nv.ua/ukr/world/geopolitics/vpershe-za-mayzhe-dva-roki-sholc-proviv-telefonnu-rozmovu-z-putinim-50466802.html	2024-11-15T06:11:00-08:00	https://static.nv.ua/shared/system/Article/posters/002/987/812/original/dd5b7d0c1da91212051c060c0615d36f.jpg?q=85&stamp=20241115161210&w=900
Гладіатор 2. Рецензія на фільм, яких зараз не знімають — епічний,...	В український прокат вийшов фільм Гладіатор 2 — продовження першого оскароносного Гладіатора 2000 року, яке Рідлі Скотт прагнув зняти дуже давно, але ніяк не складалося.	https://life.nv.ua/ukr/art/recenziya-na-film-gladiator-2-prodovzhennya-kultovoji-strichki-ridli-skotta-2000-roku-treyler-50466785.html	2024-11-15T06:10:00-08:00	https://static.nv.ua/shared/system/Article/posters/002/987/775/original/2884afc6e4df34a7716d1c67a4805e40.jpg?q=85&stamp=20241115153811&w=900
Новий етап боротьби з Путіним. Що далі	Перемога Дональда Трампа на президентських виборах у США викликала новий виток спекуляцій щодо можливості укладення компромісної угоди з Кремлем для припинення війни в Україні	https://nv.ua/ukr/opinion/putin-chitko-zayaviv-pro-sviy-plan-yak-zahodu-zupiniti-viynu-v-ukrajini-50466750.html	2024-11-15T06:03:00-08:00	https://nv.ua/upload/nv_fix_image.jpeg
У Дніпропетровській області затримали підполковника, який змушува...	У Дніпропетровській області викрили командира військової частини, який змушував своїх підлеглих замість несення служби будувати йому будинки. Чоловіку повідомили про підозру, повідомляє Офіс генерального прокурора у п’ятницю, 15 листопада.	https://nv.ua/ukr/ukraine/events/dnipropetrovska-oblast-komandir-viyskovoji-chastini-zmushuvav-pidleglih-buduvati-budinki-50466791.html	2024-11-15T06:02:00-08:00	https://static.nv.ua/shared/system/Article/posters/002/987/788/original/6a29302a043ccddc5528b7e6c1be0bf4.jpg?q=85&stamp=20241115154548&w=900
Печерський райсуд обирає запобіжний захід нардепу Шевченку	У Печерському райсуді Києва з’явився нардеп Євгеній Шевченко, якого підозрюють у державній зраді. Про це у п’ятницю, 15 листопада, повідомляє Еспресо.	https://nv.ua/ukr/ukraine/politics/yevgeniy-shevchenko-narodnomu-deputatu-v-sudi-oberut-zapobizhniy-zahid-50466792.html	2024-11-15T05:55:00-08:00	https://static.nv.ua/shared/system/Article/posters/002/987/790/original/d3edf300d4440c9ee7fdeabd3ed32461.jpg?q=85&stamp=20241115155316&w=900
VEON розглядає IPO для українського Київстару в США у 2025 — Reut...	Телекомунікаційна група VEON розглядає можливість первинного публічного розміщення акцій (IPO) свого українського підрозділу мобільного оператора Київстар у США вже наступного року.	https://biz.nv.ua/ukr/tech/veon-rozglyadaye-ipo-dlya-ukrajinskogo-kijivstaru-v-ssha-u-2025-reuters-50466790.html	2024-11-15T05:52:00-08:00	https://static.nv.ua/shared/system/Article/posters/002/987/786/original/50572720bb98af6cc481fc1b89f7d261.jpg?q=85&stamp=20241115154228&w=900
Зʼявлятимуться сюрпризи'. Україні знадобиться до п’яти років на ...	Україні знадобиться до п’яти років на знешкодження 400 мін у Чорному морі та допомога інших чорноморських країн. Про це заявив речник ВМС ЗСУ, капітан 3-го рангу Дмитро Плетенчук на брифінгу в Media Center Ukraine.	https://nv.ua/ukr/ukraine/events/rozminuvannya-chornogo-morya-mozhe-zaynyati-blizko-p-yati-rokiv-povidomiv-pletenchuk-50466783.html	2024-11-15T05:47:00-08:00	https://static.nv.ua/shared/system/Article/posters/002/987/769/original/e8cdc1f46fcd465575cf1af2b75457dc.jpg?q=85&stamp=20241115154505&w=900
Найкращий варіант, хоч і кривавий'. У нас є єдина можливість отр...	Аналітик Ради зовнішньої політики Українська призма Євген Костогризов розповів в інтерв'ю Radio NV, як Україні співпрацювати з новообраним президентом США Дональдом Трампом, щоб отримати і достатню підтримку, і важелі впливу на РФ.	https://nv.ua/ukr/world/geopolitics/tramp-yak-diyati-shchodo-novogo-prezidenta-ssha-shchob-vin-prodovzhiv-dopomogu-analitik-novini-ukrajini-50466762.html	2024-11-15T05:35:00-08:00	https://static.nv.ua/shared/system/Article/posters/002/987/724/original/721b1e804e707aaba134f8f05b9a2b95.jpg?q=85&stamp=20241115151657&w=900
Єдиний у XXI столітті'. Ла Ліга присвятила Луніну комікс після і...	Український воротар мадридського реала Андрій Лунін відзначився гольовим пасом у матчі 13-го туру чемпіонату Іспанії з Осасуною (4:0).	https://sport.nv.ua/ukr/football/la-liga-stvorila-komiks-pro-andriya-lunina-yakiy-viddav-goloviy-pas-za-real-foto-50466781.html	2024-11-15T05:33:00-08:00	https://static.nv.ua/shared/system/Article/posters/002/987/766/original/47c2b574896dadfa86e06fbe3f219b91.jpg?q=85&stamp=20241115151909&w=900
Залишилася без дверей, вікон і без життя'. Мешканці пошкодженого...	Мешканці будинку в Одесі, який постраждав від російської атаки шахедами 14 листопада, розповіли про наслідки й руйнування. Одна з жінок сказала, що через удар її відкинуло на підлогу.	https://nv.ua/ukr/ukraine/events/odesa-obstril-14-listopada-nv-pokazalo-video-naslidkiv-ataki-shahediv-50466775.html	2024-11-15T05:32:00-08:00	https://static.nv.ua/shared/system/Article/posters/002/987/754/original/b1d15151e415a6a47aedd602f38671b2.jpg?q=85&stamp=20241115151045&w=900
У спеціальних клініках. В Ірані планують 'лікувати' жінок, які ві...	Іранська влада планує створити спеціальні клініки, в яких будуть 'лікувати' жінок, які порушують закон про носіння хіджабу у громадських містах.	https://life.nv.ua/ukr/socium/v-irani-stvoryat-likarni-dlya-zhinok-yaki-vidmovlyayutsya-nositi-hidzhab-50466774.html	2024-11-15T05:30:00-08:00	https://static.nv.ua/shared/system/Article/posters/002/987/750/original/5e924390b9668eddb07240a04c166c82.jpg?q=85&stamp=20241115152933&w=900
Ціна наступу на Покровськ і Вугледар. Зафіксовано рекордне зроста...	Підтверджені втрати країни-агресорки Росії після повномасштабного вторгнення в Україну перевищили 78 тисяч осіб.	https://nv.ua/ukr/ukraine/events/vtrati-rosiji-tempi-zrostannya-smertey-stali-rekordnimi-z-pochatku-viyni-rf-proti-ukrajini-50466771.html	2024-11-15T05:29:00-08:00	https://static.nv.ua/shared/system/Article/posters/002/987/742/original/27d134b1da1e97d2b52b58828d1393b9.jpg?q=85&stamp=20241115152248&w=900
Україна залучить гроші від Світового банку та ЄС на харчування шк...	Україна залучить понад $1 млрд пільгової позики від Світового банку.	https://biz.nv.ua/ukr/finance/ukrajina-otrimaye-1-mlrd-poziki-vid-svitovogo-banku-ta-150-mln-yevro-vid-yes-50466779.html	2024-11-15T05:23:00-08:00	https://static.nv.ua/shared/system/Article/posters/002/987/762/original/da7be59767df8e8ff9ad4e032156efda.jpg?q=85&stamp=20241115152227&w=900
Моя легенда': дружина Циганкова зворушливо привітала українця з ...	У п’ятницю, 15 листопада, вінгеру збірної України та Жирони Віктору Циганкову виповнилося 27 років.	https://sport.nv.ua/ukr/football/viktor-cigankov-yak-druzhina-ukrajincya-privitala-yogo-z-dnem-narodzhennya-50466764.html	2024-11-15T05:20:00-08:00	https://static.nv.ua/shared/system/Article/posters/002/987/728/original/eae9f65249c43fca9121a99bd074408d.jpg?q=85&stamp=20241115144758&w=900
Принципове питання'. Monatik розповів, де буде народжувати його ...	Український співак Monatik, який нещодавно розповів, як дізнався стать третьої дитини, зізнався, де буде народжувати його дружина.	https://life.nv.ua/ukr/znamenitosti/monatik-rozpoviv-de-bude-narodzhuvati-yogo-druzhina-50466768.html	2024-11-15T05:17:00-08:00	https://static.nv.ua/shared/system/Article/posters/002/987/737/original/283ff8cf511dc272ec7189fc8cf5ea94.jpg?q=85&stamp=20241115150323&w=900
Дональд Трамп збирається скасувати податкові пільги на електромоб...	Повернення Дональда Трампа в Білий дім може серйозно змінити ситуацію на автомобільному ринку США. Однією з його ініціатив може стати заміна федеральної податкової пільги в розмірі $7500, яка стимулює покупців купувати електромобілі.	https://nv.ua/ukr/auto/news/donald-tramp-zbirayetsya-skasuvati-podatkovi-pilgi-na-elektromobili-50466654.html	2024-11-15T05:16:00-08:00	https://static.nv.ua/shared/system/Article/posters/002/987/489/original/6e8702c9f2a0bd13c018ffaeeb92f73e.jpg?q=85&stamp=20241115111619&w=900
Чи справді слабшає українська ППО і чому шахеди літають над центр...	Україна входить в третю зиму великої війни з Росією, хвилюючись через стан власної протиповітряної оборони. Москва восени 2024 року зробила акцент на масовані і щоденні атаки дронами-камікадзе, але також, ймовірно, накопичує запас ракет для потужного повітряного удару. Загрози та ризики для України проаналізував журналіст ВВС Україна Олег Черниш. NV публікує його матеріал на правах інформаційної співпраці.	https://nv.ua/ukr/ukraine/events/viyna-v-ukrajini-chomu-shahedi-zalitayut-u-kijiv-ta-yak-zmicniti-ppo-ukrajini-doslidzhennya-bbc-50466722.html	2024-11-15T05:10:00-08:00	https://static.nv.ua/shared/system/Article/posters/002/987/637/original/11a3efc1704b0d131b4b31daa060d6df.jpg?q=85&stamp=20241115134801&w=900
Ізраїль знищив надсекретний центр із розробки ядерної зброї в Іра...	Ізраїльський удар наприкінці жовтня 2024 року знищив чинний надсекретний дослідницький центр зі створення ядерної зброї в іранському військовому комплексі Парчин.	https://nv.ua/ukr/world/countries/udar-izrajilyu-po-iranu-nadsekretniy-centr-iz-rozrobki-yadernoji-zbroji-znishcheno-zmi-50466772.html	2024-11-15T05:10:00-08:00	https://static.nv.ua/shared/system/Article/posters/002/987/744/original/6493a2f778fc9bbd9073b8d80498c07a.jpg?q=85&stamp=20241115150010&w=900
Вперше за майже два роки. Путін і Шольц планують сьогодні провест...	Канцлер Німеччини Олаф Шольц планує провести у пʼятницю, 15 листопада, першу за майже два роки телефонну розмову з російським диктатором Володимиром Путіним. Про це повідомляє Bloomberg, посилаючись на джерела.	https://nv.ua/ukr/world/geopolitics/15-listopada-sholc-provede-telefonnu-rozmovu-z-putinim-vpershe-za-dva-roki-50466773.html	2024-11-15T05:09:00-08:00	https://static.nv.ua/shared/system/Article/posters/002/987/746/original/547e52884fbd2d8b534dd6d752a81c8f.jpg?q=85&stamp=20241115150624&w=900
Зеленський ще не вирішив, чи підписуватиме закон про історичне зб...	Президент Володимир Зеленський досі не вирішив, чи підписуватиме закон про історичне збільшення податків, повідомляє BBC Україна із посиланням на джерела.	https://nv.ua/ukr/ukraine/politics/zbilshennya-podatkiv-v-ukrajini-zelenskiy-shche-ne-virishiv-chi-bude-pidpisuvati-zakon-bbc-ukrajina-50466763.html	2024-11-15T05:06:00-08:00	https://static.nv.ua/shared/system/Article/posters/002/987/726/original/7fc5f0c5bb17015e8b2d68ab18170887.jpg?q=85&stamp=20241115144807&w=900
Зеленський ще не вирішив, чи підписуватиме закон про історичне зб...	Президент Володимир Зеленський досі не вирішив, чи підписуватиме закон про історичне збільшення податків, повідомляє BBC Україна із посиланням на джерела.	https://nv.ua/ukr/ukraine/politics/zelenskiy-shche-ne-virishiv-chi-pidpisuvatime-zakon-pro-istorichne-zbilshennya-podatkiv-bbc-ukrajina-50466763.html	2024-11-15T05:06:00-08:00	https://static.nv.ua/shared/system/Article/posters/002/987/726/original/7fc5f0c5bb17015e8b2d68ab18170887.jpg?q=85&stamp=20241115144807&w=900
У Міноборони спростували інформацію про нібито позбавлення водійс...	У Міноборони заявили, що інформація, поширена в ЗМІ про автоматичне позбавлення водійських прав за неявку до ТЦК та СП за повісткою, не відповідає дійсності.	https://nv.ua/ukr/ukraine/events/uhilyanti-informaciya-pro-pozbavlennya-vodiyskih-prav-za-neyavku-za-povistkoyu-ne-vidpovidaye-diysnosti-50466769.html	2024-11-15T05:03:00-08:00	https://static.nv.ua/shared/system/Article/posters/002/987/739/original/eeadeda24e4aa39ef6f0b19ed6a68304.jpg?q=85&stamp=20241115150350&w=900
У Київській області чоловік у військовій формі стріляв у людину. ...	У Київській області чоловік у військовій формі стріляв у людину, яка тікала від нього. Поліція заявила, що встановлює обставини події.	https://nv.ua/ukr/kyiv/video-strilyanini-pid-kiyevom-cholovik-u-viyskoviy-formi-strilyav-u-bezzbroynogo-novini-ukrajini-50466765.html	2024-11-15T05:03:00-08:00	https://static.nv.ua/shared/system/Article/posters/002/987/730/original/03799219b5c05cd31d9c640111671bcf.jpg?q=85&stamp=20241115145001&w=900
Залужний попереджає. Що може допомогти Україні вистояти	Війна на виснаження і допомога запізнілими та малими порціями не допоможуть	https://nv.ua/ukr/opinion/zaluzhniy-pro-viynu-yak-ukrajini-vistoyati-ostanni-novini-50466749.html	2024-11-15T05:03:00-08:00	https://nv.ua/upload/nv_fix_image.jpeg
Тисячу Зеленського' почнуть виплачувати з 1 грудня: уряд схвалив...	Кабінет міністрів на засіданні у п’ятницю, 15 листопада, схвалив порядок реалізації проєкту про виплату 1000 грн усім українцям в рамках програми Зимова єПідтримка, повідомив прем'єр-міністр Денис Шмигаль.	https://nv.ua/ukr/ukraine/politics/tisyacha-zelenskogo-usi-ukrajinci-otrimayut-po-1000-grn-z-1-grudnya-50466767.html	2024-11-15T04:58:00-08:00	https://static.nv.ua/shared/system/Article/posters/002/987/735/original/0234942ab533881c98a79d3a027e1cca.jpg?q=85&stamp=20241115145608&w=900
Обіймав цю посаду ще за часів Кучми. Кабмін призначив заступника ...	Кабінет Міністрів знову призначив Анатолія Корзуна на посаду заступника міністра енергетики.	https://biz.nv.ua/ukr/economics/kabmin-priznachiv-zastupnika-ministra-energetiki-yakiy-obiymav-cyu-posadu-shche-za-chasiv-kuchmi-50466755.html	2024-11-15T04:53:00-08:00	https://static.nv.ua/shared/system/Article/posters/002/987/709/original/8d2ab6bac6f4578f5db8a6a1570bd13d.jpg?q=85&stamp=20241115143853&w=900
УЄФА привітав Циганкова з днем народження, згадавши його гол за з...	Сьогодні, 15 листопада, футболісту іспанської Жирони та збірної України Віктору Циганкову виповнилося 27 років.	https://sport.nv.ua/ukr/football/den-narodzhennya-viktora-cigankova-uyefa-privitav-futbolista-video-50466748.html	2024-11-15T04:44:00-08:00	https://static.nv.ua/shared/system/Article/posters/002/987/692/original/e17b07a13a89fddb9517c48b9201ee64.jpg?q=85&stamp=20241115143439&w=900
