Title	Description	Link	pubDate	Image
Хочемо принести стабільність'. США прагнуть досягти 'стійкого' м...	Державний секретар США Марко Рубіо заявив, що Штати прагнуть забезпечити 'стійкий' мир між Росією та Україною, щоб війна не почалася знов у майбутньому.	https://nv.ua/ukr/world/geopolitics/viyna-rosiji-proti-ukrajini-derzhsekretar-marko-rubio-zayaviv-shcho-ssha-hochut-zabezpechiti-stiykiy-mir-50483560.html	2025-01-21T23:01:00-08:00	https://static.nv.ua/shared/system/Article/posters/003/023/734/original/2f26a4fc95eea5fa05cbf14f83463cd6.jpg?q=85&stamp=20250122085343&w=900
МСЕК 2025: як оскаржити рішення експертних команд з 1 січня в Укр...	З 1 січня 2025 року медико-соціальні експертні комісії (МСЕК) замінили експертними командами лікарів.	https://nv.ua/ukr/ukraine/events/msek-2025-yak-oskarzhiti-rishennya-novih-komand-pokrokova-instrukciya-50483454.html	2025-01-21T22:59:00-08:00	https://static.nv.ua/shared/system/Article/posters/003/023/511/original/22a8fde284eafcb3681ca36ccae5b895.jpg?q=85&stamp=20250121173300&w=900
Росія втратила на війні в Україні майже дві тисячі солдатів, 11 т...	Війська країни-агресора Росії втратили на війні Україні приблизно 1950 військових загиблими та пораненими за добу. Загальні бойові втрати РФ з початку повномасштабного вторгнення в Україну досягли 823 980 осіб.	https://nv.ua/ukr/ukraine/events/vtrati-rosiji-stanom-na-22-sichnya-zrosli-na-1950-viyskovih-11-tankiv-i-60-artsistem-50483562.html	2025-01-21T22:58:00-08:00	https://static.nv.ua/shared/system/Article/posters/003/023/740/original/ab1f80447c03022e68b5595be9b31e43.jpg?q=85&stamp=20250122085851&w=900
Помилка Трубіна і три пенальті. Барселона в матчі з дев’ятьма гол...	У рамках сьомого туру Ліги чемпіонів Барселона на виїзді здобула вольову перемогу над Бенфікою — 5:4.	https://sport.nv.ua/ukr/football/benfika-barselona-videooglyad-i-rezultat-matchu-ligi-chempioniv-21-sichnya-50483559.html	2025-01-21T22:52:00-08:00	https://static.nv.ua/shared/system/Article/posters/003/023/732/original/59a57f636a35866ed39203e87f7d789a.jpg?q=85&stamp=20250122084932&w=900
У Дніпрі запрацювала друга черга реабілітаційного центру всеукраї...	Дніпровський реабілітаційний центр для поранених військових національної мережі RECOVERY збільшує реабілітаційно-лікувальні потужності вдвічі. З відкриттям другої черги тут щороку зможуть відновлюватися понад 1 200 українських воїнів, які протистоять російській агресії.	https://nv.ua/ukr/ukraine/events/reabilitaciya-viyskovih-2025-yaki-dodatkovi-poslugi-mozhut-otrimati-poraneni-v-centri-recovery-50483395.html	2025-01-21T22:50:00-08:00	https://static.nv.ua/shared/system/Article/posters/003/023/383/original/1b9dfd937b17b1e8df42e07aab283a8d.jpg?q=85&stamp=20250121192938&w=900
Росіяни захопили села Зелене та Новий Труд біля Покровська та про...	Російські окупаційні війська просуваються в Часовому Яру, на Курахівському та Покровському напрямках, де захопили села Зелене та Новий Труд на південь від Покровська.	https://nv.ua/ukr/ukraine/events/chasiv-yar-pokrovsk-kurahove-na-mapi-22-sichnya-rf-zahopila-zelene-i-noviy-trud-novini-ukrajini-50483549.html	2025-01-21T22:44:00-08:00	https://static.nv.ua/shared/system/Article/posters/003/023/713/original/81ca7297782cd71efebce5cddf0f322a.jpg?q=85&stamp=20250122084508&w=900
Трамп помилував засновника даркнет-вебсайту Silk Road, довічно ув...	Президент США Дональд Трамп у вівторок, 21 січня, помилував засновника Silk Road Росса Ульбріхта, який був засуджений до довічного ув’язнення за управління підпільним онлайн-ринком, де наркоторговці та інші особи здійснили незаконну торгівлю з використанням біткоїна на суму понад 200 мільйонів доларів.	https://nv.ua/ukr/world/countries/ross-ulbriht-donald-tramp-21-sichnya-pomiluvav-zasnovnika-darknet-vebsaytu-silk-road-50483554.html	2025-01-21T22:42:00-08:00	https://static.nv.ua/shared/system/Article/posters/003/023/723/original/2c1d69f2a5d450700fd9015a1b6753c7.jpg?q=85&stamp=20250122084107&w=900
Прощальні' санкції Байдена. Індійські банки почали блокувати пла...	Індійські банки стали блокувати платежі за нафту російського походження після посилення американських санкцій.	https://biz.nv.ua/ukr/markets/sankciji-ssha-indiyski-banki-pochali-blokuvati-platezhi-za-rosiysku-naftu-50483557.html	2025-01-21T22:39:00-08:00	https://static.nv.ua/shared/system/Article/posters/003/023/729/original/a8c2a586a48b990180736f224df07f2e.jpg?q=85&stamp=20250122083645&w=900
Світоліна зупинилася за крок від півфіналу Australian Open, прогр...	Українська тенісистка Еліна Світоліна (WTA 27) завершила виступ на Відкритому чемпіонаті Австралії 2025.	https://sport.nv.ua/ukr/tennis/australian-open-svitolina-prograla-kiz-u-chvertfinali-video-50483555.html	2025-01-21T22:33:00-08:00	https://static.nv.ua/shared/system/Article/posters/003/023/725/original/9c3b456dda04354abd269be5e3a8f78f.jpg?q=85&stamp=20250122083300&w=900
Рідкісний птах. В мережі з’явилось фото повністю чорного пінгвіна	На острові Південна Георгія фотографу вдалося зафіксувати неймовірно рідкісне видовище: королівського пінгвіна з повністю чорним оперенням.	https://techno.nv.ua/ukr/popscience/fotograf-sfotografuvav-neymovirno-ridkisnogo-povnistyu-chornogo-pingvina-50483346.html	2025-01-21T22:30:00-08:00	https://static.nv.ua/shared/system/Article/posters/003/023/277/original/f2413c8a3c13caeff2295a805a6d1d60.jpg?q=85&stamp=20250121132725&w=900
Приємні й не дуже сюрпризи 2024 року: Чи продовжиться тиск на біз...	Чому ставлення правоохоронців до бізнесу варто терміново змінювати.	https://biz.nv.ua/ukr/experts/tisk-na-biznes-v-ukrajini-ceo-smartholding-pro-golovni-problemi-yaki-zavazhayut-pracyuvati-50477256.html	2025-01-21T22:30:00-08:00	https://nv.ua/upload/nv_fix_image.jpeg
У Києві та низці областей України оголошено повітряну тривогу чер...	У середу, 22 січня, у Києві та низці областей України оголосили повітряну тривогу.	https://nv.ua/ukr/ukraine/events/u-kiyevi-ta-nizci-oblastey-ukrajini-ogoloshena-povitryana-trivoga-50483556.html	2025-01-21T22:22:00-08:00	https://static.nv.ua/shared/system/Article/posters/003/023/727/original/43aa20cf8bd337cad124384f9383bcf4.jpg?q=85&stamp=20250122082214&w=900
Пожежа в готелі на гірськолижному курорті Туреччини: кількість за...	Кількість загиблих унаслідок пожежі в готелі Grand Kartal на гірськолижному курорті Карталкая в Туреччині зросла до 76.	https://nv.ua/ukr/world/countries/pozhezha-na-girskolizhnomu-kurorti-u-turechchini-76-lyudey-zaginuli-shche-52-postrazhdali-foto-50483553.html	2025-01-21T22:20:00-08:00	https://static.nv.ua/shared/system/Article/posters/003/023/721/original/e01d327d0acb3ae5596569fdbe601acd.jpg?q=85&stamp=20250122081305&w=900
Реформа МСЕК 2025. Яку нову посаду створили для оцінювання інвалі...	Після того, як в Україні розпустили медико-соціальні експертні комісії, працюватимуть експертні команди лікарів. Вони і визначатимуть, чи має людина право на інвалідність. Допомагати експертним командам будуть адміністратори медичних закладів.	https://nv.ua/ukr/ukraine/events/msek-2025-posada-administratora-dlya-ocinyuvannya-invalidnosti-yaki-obov-yazki-50483282.html	2025-01-21T22:15:00-08:00	https://static.nv.ua/shared/system/Article/posters/003/023/138/original/ec5d7e411f66db2250436d60af18a7a6.jpg?q=85&stamp=20250121110039&w=900
Вибори в Білорусі: ЦВК заявила про рекордну явку в перший день до...	Центральна виборча комісія Білорусі заявила про рекордну явку в перший день дострокового голосування на виборах президента, які почалися 21 січня, повідомляє Білоруська служба Радіо Свобода.	https://nv.ua/ukr/world/countries/vibori-v-bilorusi-2025-cvk-zayavila-pro-rekordnu-yavku-v-pershiy-den-golosuvannya-50483551.html	2025-01-21T22:07:00-08:00	https://static.nv.ua/shared/system/Article/posters/003/023/717/original/25d56409fa9964ef5d3bdd2a6c364aa2.jpg?q=85&stamp=20250122080412&w=900
Курс валют НБУ. Гривня падає	На 22 січня, Національный банк України встановив офиційний курс гривні до американського долара на рівні 42,17 грн/$.	https://biz.nv.ua/ukr/finance/kurs-dolara-yak-zminivsya-kurs-valyut-nbu-22-yanvarya-novini-ukrajini-50483552.html	2025-01-21T22:03:00-08:00	https://static.nv.ua/shared/system/Article/posters/003/023/719/original/d2d888c0e98deedb28fc8761926d0668.jpg?q=85&stamp=20250122080102&w=900
Україна ніколи юридично не визнає окуповані території частиною Ро...	Україна ніколи не визнає окуповані території частиною країни-агресора Росії, попри можливий тиск з боку партнерів. Про це заявив президент України Володимир Зеленський під час зустрічі з представниками Міжнародної медіаради у Давосі.	https://nv.ua/ukr/ukraine/politics/peregovori-z-rosiyeyu-okupovani-teritoriji-nikoli-ne-viznayut-chastinoyu-rf-novini-ukrajini-50483550.html	2025-01-21T21:47:00-08:00	https://static.nv.ua/shared/system/Article/posters/003/023/715/original/047df5140755078512422cb57ed9aece.jpg?q=85&stamp=20250122074453&w=900
Атака шахедів по ​​Миколаєву. У місті пошкоджені багатоквартирні ...	Унаслідок атаки російських ударних дронів на Миколаїв є пошкодження багатоквартирних будинків та інших будівель, спалахнули пожежі. Про це повідомляє ДСНС зранку у середу, 22 січня.	https://nv.ua/ukr/ukraine/events/obstril-mikolayeva-21-sichnya-poshkodzheni-budinki-vinikli-pozhezhi-ta-postrazhdali-dvoye-lyudey-foto-50483548.html	2025-01-21T21:32:00-08:00	https://static.nv.ua/shared/system/Article/posters/003/023/711/original/1a06faa8856722ccbc81e197afb0f5da.jpg?q=85&stamp=20250122072426&w=900
Забудьте про голольод: ось як правильно українською мовою говорит...	Часто, особливо в зимовий період, ми чуємо, як люди вживають слово голольод для опису слизької поверхні на вулиці. Але чи є це слово правильним з погляду української мови?	https://nv.ua/ukr/ukraine/events/gololed-ukrajinskoyu-movoyu-chomu-termin-ozheledicya-pravilniy-unikayemo-rusizmiv-50483459.html	2025-01-21T21:30:00-08:00	https://static.nv.ua/shared/system/Article/posters/003/023/520/original/2d074a49a8f29e5b51021501cb370b64.jpg?q=85&stamp=20250121174147&w=900
Це крихка угода. Що провернув Трамп	Дональд Трамп почав змінювати світовий порядок задовго до своєї інавгурації, використовуючи жорстку риторику і сувору тактику	https://nv.ua/ukr/opinion/tramp-uklav-slabku-ugodu-na-blizkomu-shodi-shcho-chekaye-na-iran-ta-izrajil-50483478.html	2025-01-21T21:13:00-08:00	https://nv.ua/upload/nv_fix_image.jpeg
Пропускаєте сніданок? Нове дослідження виявило, що це може спричи...	Відсутність ранкового прийому їжі може бути не дуже корисною для вашого мозку.	https://nv.ua/ukr/food/eat/snidanok-chomu-ne-varto-propuskati-ta-yakiy-vpliv-ce-maye-na-vash-mozok-doslidzhennya-50483275.html	2025-01-21T21:05:00-08:00	https://static.nv.ua/shared/system/Article/posters/003/023/122/original/fa05f66ad2513e093da96ee3dce556b6.jpg?q=85&stamp=20250121105222&w=900
Україна відзначає День Соборності. Як возз'єднання країни у 1919 ...	22 січня Україна відзначає День Соборності — на згадку про події початку ХХ століття.	https://nv.ua/ukr/ukraine/events/den-sobornosti-yak-vozz-yednannya-krajini-u-1919-roci-dopomoglo-dobitisya-nezalezhnosti-50299061.html	2025-01-21T21:05:00-08:00	https://static.nv.ua/shared/system/Article/posters/002/628/439/original/8c57120dc0b7d055b2cef63223ac258e.jpg?q=85&stamp=20230121175348&w=900
Трамп запропонував Маску або Еллісону купити TikTok, передавши 50...	Президент США Дональд Трамп заявив, що готовий підтримати купівлю TikTok мільярдерами Ілоном Маском або Ларрі Еллісоном у рамках спільного підприємства з урядом США. Якщо соцмережу не буде продано, їй знову загрожує блокування.	https://nv.ua/ukr/world/countries/mask-abo-ellison-mozhut-kupiti-tiktok-novini-ssha-50483547.html	2025-01-21T20:54:00-08:00	https://static.nv.ua/shared/system/Article/posters/003/023/709/original/47cab125495c30b038e078195ae4dd12.jpg?q=85&stamp=20250122065009&w=900
Сили оборони відбили ворога біля Шевченка та Удачного, наступ на ...	У ніч проти 22 січня українські військові успішно відбили атаки противника поблизу населених пунктів Шевченко та Удачне. Водночас, за даними аналітичного проєкту DeepState, російські війська продовжують наступ в інших районах Донецької області.	https://nv.ua/ukr/ukraine/events/situaciya-na-fronti-22-sichnya-sili-oboroni-vidbili-ataki-shevchenka-ta-udachnogo-50483544.html	2025-01-21T20:38:00-08:00	https://static.nv.ua/shared/system/Article/posters/003/023/703/original/52e81a0c1a34146d64a0adecd20fd02b.jpg?q=85&stamp=20250122063659&w=900
З Днем Соборності України 2025. Як краще поздоровити знайомих із ...	День Соборності України — свято, яке відзначається щорічно 22 січня, у день проголошення Акта Злуки УНР і ЗУНР, що відбувся в 1919 році. Цим актом було закріплено єдність двох розділених частин єдиної незалежної України.	https://life.nv.ua/ukr/showbiz/den-sobornosti-ukrajini-privitannya-istoriya-simvol-yednosti-50481238.html	2025-01-21T20:12:00-08:00	https://static.nv.ua/shared/system/Article/posters/003/018/737/original/c9868a0213e5e575f760748edd564453.jpg?q=85&stamp=20250113160040&w=900
Несподіваний бонус. Прогулянки з собаками корисні для літніх люде...	Нове дослідження, проведене в Ірландії, виявило дивовижний зв’язок між регулярними прогулянками з собакою і здоров’ям літніх людей.	https://techno.nv.ua/ukr/popscience/progulyanki-iz-sobakoyu-klyuch-do-zdorov-ya-ta-dovgolittya-litnih-lyudey-50483337.html	2025-01-21T19:30:00-08:00	https://static.nv.ua/shared/system/Article/posters/003/023/259/original/2268bbbc2418b37d01927945e15fe355.jpg?q=85&stamp=20250121130005&w=900
Україні потрібно щонайменше 200 тис. миротворців для захисту ново...	Президент України Володимир Зеленський заявив, що для запобігання новому нападу Росії на Україну після можливого припинення вогню необхідно розмістити щонайменше 200 тисяч європейських миротворців.	https://nv.ua/ukr/world/geopolitics/zelenskiy-zaproponuvav-200-tisyach-mirotvorciv-dlya-zahistu-ukrajini-vid-novogo-vtorgnennya-rosiji-50483545.html	2025-01-21T19:21:00-08:00	https://static.nv.ua/shared/system/Article/posters/003/023/705/original/4fd8ccc7805fad48fc763ea458491a17.jpg?q=85&stamp=20250122050611&w=900
Стрітення Господнє 2025: нова дата, прикмети, традиції і як святк...	У 2025 році свято Стрітення Господнього припадає на нову дату, відповідно до нового календаря, який запровадила Православна Церква України (ПЦУ). Це свято має глибоке духовне значення і є одним із найважливіших у християнському календарі.	https://life.nv.ua/ukr/showbiz/stritennya-gospodnye-2025-po-novomu-kalendaryu-pcu-data-tradiciji-ta-prikmeti-50483092.html	2025-01-21T18:22:00-08:00	https://static.nv.ua/shared/system/Article/posters/003/022/735/original/43e83e272ec25f5ed90df054c7df72ec.jpg?q=85&stamp=20250120161733&w=900
OpenAI, SoftBank і Oracle. Трамп оголосив про найбільші інвестиці...	Президент США Дональд Трамп у вівторок, 21 січня, оголосив про масштабні інвестиції в інфраструктуру штучного інтелекту, які зроблять три провідні компанії. Планується створення спільного підприємства.	https://techno.nv.ua/ukr/it-industry/shtuchniy-intelekt-tramp-ogolosiv-pro-naybilshi-investiciji-50483543.html	2025-01-21T18:05:00-08:00	https://static.nv.ua/shared/system/Article/posters/003/023/701/original/b42a3496f7c03a8d14253177eebb0602.jpg?q=85&stamp=20250122032024&w=900
Серйозна проблема. Снодійні зупиняють важливий механізм очищення ...	Нове дослідження, проведене на мишах, продемонструвало негативний ефект від використання снодійних, що може бути пов’язаний з розвитком хвороби Альцгеймера.	https://techno.nv.ua/ukr/popscience/shkoda-snodiynih-50483348.html	2025-01-21T17:11:00-08:00	https://static.nv.ua/shared/system/Article/posters/003/023/281/original/0bee95303a364a1852b4bc88630fde53.jpg?q=85&stamp=20250121131557&w=900
Трамп пригрозив Росії новими санкціями, якщо Путін не піде на пер...	Президент США Дональд Трамп заявив про високу ймовірність введення нових санкцій проти Росії, якщо її лідер Володимир Путін не погодиться на переговори щодо врегулювання війни в Україні.	https://nv.ua/ukr/world/geopolitics/peregovori-z-rf-tramp-prigroziv-rosiji-novimi-sankciyami-50483542.html	2025-01-21T16:39:00-08:00	https://static.nv.ua/shared/system/Article/posters/003/023/699/original/d4653d7b1b143eb17c1ebdbb6d65f970.jpg?q=85&stamp=20250122023527&w=900
Перед новим сезоном. Що робити в саду та городі у лютому: підгото...	Наближається останній місяць зими, час, коли садівники та городники починають готуватися до нового сезону.	https://life.nv.ua/ukr/lifehacks/sad-i-gorod-u-lyutomu-2025-yak-pidgotuvati-do-vesni-shcho-zrobiti-yaki-roboti-provesti-50483402.html	2025-01-21T16:11:00-08:00	https://static.nv.ua/shared/system/Article/posters/003/023/398/original/e43435472dafc612381d69979b8baf6c.jpg?q=85&stamp=20250121152419&w=900
Гренландія прагне зустрічі з Трампом на тлі його погроз щодо анек...	Уряд Гренландії працює над організацією зустрічі з президентом США Дональдом Трампом після його заяв про можливе захоплення острова.	https://nv.ua/ukr/world/geopolitics/napruzhenist-mizh-ssha-ta-grenlandiyeyu-vidpovid-prem-yer-ministra-egede-na-plani-trampa-50483540.html	2025-01-21T16:11:00-08:00	https://static.nv.ua/shared/system/Article/posters/003/023/695/original/f51a7447aec16e52e9ec1decef940a53.jpg?q=85&stamp=20250122020725&w=900
Ворог атакує Україну ударними БпЛА, є пуски КАБ	Вночі 22 січня ворожі ударні безпілотники зафіксовані над кількома областями України. Є загроза ударів по населених пунктах.	https://nv.ua/ukr/ukraine/events/trivoga-v-ukrajini-ataki-bpla-22-sichnya-50483537.html	2025-01-21T15:08:00-08:00	https://static.nv.ua/shared/system/Article/posters/003/023/687/original/572e09ffebae6c9c71f140b17e356b8b.jpg?q=85&stamp=20250122010609&w=900
Наслідуючи Huawei. Samsung готує складаний Galaxy з потрійним екр...	Цьогорічна лінійка складаних пристроїв від Samsung може поповнитися новою моделлю з екраном з двома петлями для складання.	https://techno.nv.ua/ukr/gadgets/samsung-z-potriynim-ekranom-50483518.html	2025-01-21T14:55:00-08:00	https://static.nv.ua/shared/system/Article/posters/003/023/646/original/4a642d1e66c6ebbd78434ef64d5e4c68.jpg?q=85&stamp=20250121220118&w=900
Росіяни атакували Миколаїв шахедами, є пошкодження будинків, вини...	Увечері 21 січня росіяни атакували місто Миколаїв сімома шахедами. Є пошкодження багатоквартирних будинків, виникли пожежі.	https://nv.ua/ukr/ukraine/events/rosiyani-atakuvali-mikolajiv-shahedami-ye-poshkodzhennya-budinkiv-vinikli-pozhezhi-50483535.html	2025-01-21T13:46:00-08:00	https://static.nv.ua/shared/system/Article/posters/003/023/682/original/43aa20cf8bd337cad124384f9383bcf4.jpg?q=85&stamp=20250121234637&w=900
Розраховували на його досвід'. Шовковський оцінив героїчну нічию...	Головний тренер Динамо Олександр Шовковський прокоментував нічию зі стамбульським Галатасараєм (3:3) у матчі сьомого туру Ліги Європи.	https://sport.nv.ua/ukr/football/dinamo-galatasaray-oleksandr-shovkovskiy-prokomentuvav-shalenu-nichiyu-zavdyaki-yarmolenku-50483529.html	2025-01-21T13:42:00-08:00	https://static.nv.ua/shared/system/Article/posters/003/023/669/original/663c4322803eb46ad38554dbd556ed3f.jpg?q=85&stamp=20250121230810&w=900
