Title	Description	Link	pubDate	Image
Нічна атака шахедів: на Київщині загинули журналістка Тетяна Кули...	Пізно ввечері 25 лютого внаслідок влучаннядрону в приватний будинок у Бучанському районі на Київщині загинуло подружжя — журналістка Укрінформу Тетяна Кулик і, йомовірно, учений-хірург Павло Іванчов. Ідентифікація тіл, знайдених на місці згарища, триває.	https://nv.ua/ukr/socium/ataka-droniv-na-kijivshchinu-26-lyutogo-zaginula-zhurnalistka-tetyana-kulik-i-likar-hirurg-pavlo-ivanchov-50493275.html	2025-02-26T03:35:00-08:00	https://static.nv.ua/shared/system/Article/posters/003/044/646/original/ea603ed521c8b7dc45090a2b576f3f6a.jpg?q=85&stamp=20250226132842&w=900
Лавров підтвердив, що Путін пропонував США рідкісноземельні метал...	Глава МЗС РФ Сергій Лавров підтвердив, що російський диктатор Володимир Путін пропонував інвесторам зі США 'розробляти рідкісноземельні метали' не тільки на території Росії, а й на тимчасово окупованих Кремлем українських територіях.	https://nv.ua/ukr/world/geopolitics/ridkozemelni-metali-lavrov-pidtverdiv-propoziciyu-putina-dlya-amerikanciv-shchodo-rozrobki-resursiv-50493266.html	2025-02-26T03:16:00-08:00	https://static.nv.ua/shared/system/Article/posters/003/044/626/original/3ff047e0229e69344128a13443293301.jpg?q=85&stamp=20250226131558&w=900
Збирали руку три години. Колишній капітан Динамо переніс операцію...	Ексфутболіст збірної України Микола Морозюк отримав важку травму під час матчу медійної футбольної ліги за MFC ProFan.	https://sport.nv.ua/ukr/football/nikola-morozyuk-video-togo-yak-kolishniy-gravec-zbirnoji-ukrajini-perenis-operaciyu-na-ruci-50493255.html	2025-02-26T03:15:00-08:00	https://static.nv.ua/shared/system/Article/posters/003/044/600/original/aaef866043554df207baf9bd46d84c13.jpg?q=85&stamp=20250226125150&w=900
Робимо це щоночі': подружжя, яке разом 68 років, розповіло про в...	94-річний Дон Барнетта та його 93-річна дружина Мерилін зі штату Південна Дакота розповіли, чим займаються по ночах, що підтримує їхній шлюб уже 68 років.	https://nv.ua/ukr/lifestyle/shchaslivi-stosunki-amerikanska-para-podililas-sekretom-micnogo-shlyubu-50493259.html	2025-02-26T03:10:00-08:00	https://static.nv.ua/shared/system/Article/posters/003/044/612/original/b190bb7ca560295905827c24c7176ff1.jpg?q=85&stamp=20250226130012&w=900
Зеленський у День спротиву Криму російській окупації: Територіаль...	Президент України Володимир Зеленський оприлюднив пост з нагоди 11-ї річниці спротиву Криму російській окупації	https://nv.ua/ukr/ukraine/events/den-sprotivu-okupaciji-krimu-volodimir-zelenskiy-oprilyudniv-dopis-50493228.html	2025-02-26T03:09:00-08:00	https://static.nv.ua/shared/system/Article/posters/003/044/546/original/462f45bad7c1f5f5e892b47dfe5da1e1.jpg?q=85&stamp=20250226122453&w=900
Агресія Путіна проти України загрожує й Великій Британії - прем'є...	Прем'єр-міністр Великої Британії Кір Стармер переконаний, що агресія Росії проти України загрожує зокрема й мешканцям його країни.	https://nv.ua/ukr/world/geopolitics/viyna-rosiji-proti-nato-starmer-vvazhaye-shcho-agresiya-putina-proti-ukrajini-zagrozhuye-y-velikiy-britaniji-50493263.html	2025-02-26T03:09:00-08:00	https://static.nv.ua/shared/system/Article/posters/003/044/621/original/a69a781e75807e087a708bd801b8c157.jpg?q=85&stamp=20250226130444&w=900
Уперше за 40 років. Найбільшому американському фонду, який працюв...	Національний фонд за демократію (NED) заявляє, що не може отримати доступ до виділених Конгресом коштів, якими спонсорує гранти та операції.	https://biz.nv.ua/ukr/finance/naybilshomu-amerikanskomu-fondu-yakiy-pracyuvav-i-v-ukrajini-zupinili-finansuvannya-50493258.html	2025-02-26T03:09:00-08:00	https://static.nv.ua/shared/system/Article/posters/003/044/608/original/ddeb371ba891917ab9082d7fb9f17b34.jpg?q=85&stamp=20250226130559&w=900
Німецька економіка хвора. Бундесбанк отримав найбільший збиток за...	Бундесбанк за підсумками 2024 року отримав найбільші збитки за останні 45 років.	https://biz.nv.ua/ukr/finance/bundesbank-za-pidsumkami-2024-roku-otrimav-ponad-19-mlrd-yevro-zbitkiv-ostanni-novini-50493256.html	2025-02-26T03:06:00-08:00	https://static.nv.ua/shared/system/Article/posters/003/044/602/original/631506b0985c07b154822aa8fd55892e.jpg?q=85&stamp=20250226125745&w=900
Відповідь Huawei. Samsung може випустити смартфон з потрійним екр...	Пристрій з потрійним екраном може дебютувати разом зі складаними смартфонами Galaxy Fold 7 і Flip 7 влітку — на липневій події Samsung Unpacked.	https://techno.nv.ua/ukr/gadgets/samsung-galaxy-g-fold-50493105.html	2025-02-26T03:05:00-08:00	https://static.nv.ua/shared/system/Article/posters/003/044/282/original/0d1cb53a0cc5dbd674a5e6b9ce7fe991.jpg?q=85&stamp=20250225225556&w=900
Стрес на тарілці. Часте вживання їжі на винос підвищує тривожніст...	Нещодавнє дослідження виявило, що студенти, які регулярно споживають їжу на винос і ведуть малорухливий спосіб життя, стикаються з підвищеним ризиком депресії та тривожності.	https://nv.ua/ukr/food/eat/vzhivannya-jizhi-na-vinos-i-nizkiy-riven-fizichnoji-aktivnosti-sprichinyayut-depresiyu-50493152.html	2025-02-26T03:03:00-08:00	https://static.nv.ua/shared/system/Article/posters/003/044/382/original/e7ba7b05fc7c38a79489d36845965745.jpg?q=85&stamp=20250226112411&w=900
Українці вважають, що корупція гірше впливає на ситуацію в країні...	Більшість опитуваних українців (58.8%) вважають, що високий рівень корупції на державному рівні найбільш негативно впливає на ситуацію в країні.	https://nv.ua/ukr/ukraine/events/korupciya-v-ukrajini-girshe-vplivaye-na-situaciyu-nizh-rosiyski-obstrili-opituvannya-50493240.html	2025-02-26T03:03:00-08:00	https://static.nv.ua/shared/system/Article/posters/003/044/570/original/3558ea2c83dc840236f0a730687ecbd1.jpg?q=85&stamp=20250226121933&w=900
Олена Зеленська відвідала Бородянку разом із лордом Майклом Ешкро...	Перша леді України Олена Зеленська побувала в селищі Бородняка Київської області, яке три роки тому зрівняли із землею російські окупанти, наступаючи на Київ. Разом із Зеленською до Бородянки приїхав один із донаторів України лорд Майкл Ешкрофт.	https://nv.ua/ukr/socium/olena-zelenska-vidvidala-borodyanku-razom-z-britanskim-lordom-mayklom-eshkroftom-foto-50493260.html	2025-02-26T03:02:00-08:00	https://static.nv.ua/shared/system/Article/posters/003/044/614/original/3b96114d292477f5fbca450c8a212408.jpg?q=85&stamp=20250226125503&w=900
У МЗС РФ заявили, що нові переговори з представниками США відбуду...	Глава російського МЗС Сергій Лавров стверджує, що представники США і країни-агресора проведуть нові переговори 27 лютого. Вони збираються обговорити роботу посольств, заявив Лавров на пресконференції в Катарі в середу, 26 лютого, пише російське видання Медуза.	https://nv.ua/ukr/world/geopolitics/peregovori-ssha-i-rosiji-vidbudutsya-27-lyutogo-v-turechchini-50493261.html	2025-02-26T03:01:00-08:00	https://static.nv.ua/shared/system/Article/posters/003/044/616/original/780790c7a4944bd7ecb264549501dbaa.jpg?q=85&stamp=20250226125745&w=900
Це велика сума': Світоліна зізналася, у скільки їй обходиться ут...	Українська тенісистка, екстретя ракетка світу Еліна Світоліна розповіла про те, скільки грошей витрачає на підготовку до змагань.	https://sport.nv.ua/ukr/tennis/elina-svitolina-zayavila-shcho-vitrachaye-na-tenis-vid-400-do-600-tisyach-dolariv-na-rik-50493254.html	2025-02-26T02:54:00-08:00	https://static.nv.ua/shared/system/Article/posters/003/044/598/original/94796ca4b9a7e84c40b92d3d2366f793.jpg?q=85&stamp=20250226123912&w=900
У Судані військовий літак розбився у житловому районі, загинули щ...	У Судані 25 лютого розбився військовий літак, унаслідок чого загинули щонайменше 46 людей. Про це повідомляє Associated Press.	https://nv.ua/ukr/world/countries/aviakatastrofa-u-sudani-25-lyutogo-viyskoviy-litak-vpav-u-zhitlovomu-rayoni-zaginuli-46-lyudey-50493257.html	2025-02-26T02:53:00-08:00	https://static.nv.ua/shared/system/Article/posters/003/044/606/original/0611d390059c565806ab40aa92940249.jpg?q=85&stamp=20250226124928&w=900
Чергова поразка Газпрому. Арбітраж зобов’язав російського монопол...	Чеська комунальна компанія CEZ заявила в середу, 26 лютого, що виграла арбітражну справу проти російського Газпрому в якій вимагала відшкодування збитків на суму понад 1 мільярд крон ($42,16 млн).	https://biz.nv.ua/ukr/markets/arbitrazh-zobov-yazav-gazprom-splatiti-chergovu-kompensaciyu-za-porushennya-kontraktu-50493250.html	2025-02-26T02:50:00-08:00	https://static.nv.ua/shared/system/Article/posters/003/044/590/original/c8b23eb1eb36bce6a37ed59c8d319b60.jpg?q=85&stamp=20250226123945&w=900
На Дніпропетровщині видали по чотири 1,5-літрових пляшки Кока-Кол...	У селі Лозуватка Криворізького району на Дніпропетовщині здійснюють видачу гуманітарної допомоги, видають газовану воду Coca Cola.	https://nv.ua/ukr/lifestyle/gumanitarna-dopomoga-na-dnipropetrovshchini-zdiysnili-gumpidtrimku-u-viglyadi-koka-koli-50493230.html	2025-02-26T02:46:00-08:00	https://static.nv.ua/shared/system/Article/posters/003/044/550/original/47e5435009e7cb0022ff74a655c3b885.jpg?q=85&stamp=20250226124257&w=900
Союзники вирішили показати м’язи'. Розмова з Пристайком — про пр...	Дипломат, Міністр закордонних справ України у 2019−2020 роках, надзвичайний і повноважний посол України у Великій Британії у 2020−2023 роках Вадим Пристайко розповів в інтерв'ю Radio NV, як Україні пристосуватися до змін у США, що відбувається навколо угоди про рідкісноземельні метаріали, чому Будапештський меморандум не міг захистити Україну та яким чином спонукати Дональда Трампа нам допомагати.	https://nv.ua/ukr/world/geopolitics/tramp-ssha-i-viyna-do-chogo-gotuvatisya-ukrajini-ta-yevropi-pristayko-novini-ukrajini-50493196.html	2025-02-26T02:39:00-08:00	https://static.nv.ua/shared/system/Article/posters/003/044/477/original/f99f3187b7b29d53be504cf4e25b033e.jpg?q=85&stamp=20250226111341&w=900
Пили коктейлі і фотографувалися. У Лос-Анджелесі пройшла вечеря н...	25 лютого у Лос-Анджелесі пройшла вечеря номінантів на Оскар 2025, яку відвідали Демі Мур, Синтія Еріво, Аріана, Гранде, Себастьян Стен, Тімоті Шаламе тощо.	https://life.nv.ua/ukr/znamenitosti/oskar-2025-demi-mur-sintiya-erivo-ta-andriana-grande-vidvidali-vecheryu-nominantiv-50493226.html	2025-02-26T02:36:00-08:00	https://static.nv.ua/shared/system/Article/posters/003/044/542/original/a299573a1310f5aec1cba52d179b6775.jpg?q=85&stamp=20250226122243&w=900
Рада відмовилася заслухати представників уряду, які готують угоду...	Верховна Рада на засіданні у середу, 26 лютого, не підтримала проєкт постанови про виклик до парламенту представників уряду, які працюють над угодою зі США про українські корисні копалини, повідомила нардепка Ірина Геращенко.	https://nv.ua/ukr/ukraine/politics/ugoda-zi-ssha-pro-ridkisnozemi-rada-vidmovilasya-viklikati-uryad-dlya-zvitu-pro-dokument-50493245.html	2025-02-26T02:35:00-08:00	https://static.nv.ua/shared/system/Article/posters/003/044/583/original/7f9baa88cbfacba5a5dc19d658ec96f6.jpg?q=85&stamp=20250226123253&w=900
Все грандіозне в минулому'. Олімпійська чемпіонка Ірина Мерлені ...	Українська борчиня Ірина Мерлені розповіла, що займається тренерською діяльністю за кордоном.	https://sport.nv.ua/ukr/other-sport/irina-merleni-pracyuye-trenerom-u-shveciji-50493233.html	2025-02-26T02:25:00-08:00	https://static.nv.ua/shared/system/Article/posters/003/044/555/original/fe9eeff592c02464ec5fb308b5fc3584.jpg?q=85&stamp=20250226121412&w=900
Це погано і важко': Трубіна жорстко розкритикували в Португалії	Голкіпер збірної України Анатолій Трубін пропустив останню гру в складі Бенфіки, залишившись на лавці запасних.	https://sport.nv.ua/ukr/football/anatoliya-trubina-rozkritikuvali-za-gru-v-benfiki-nazvavshi-yogo-nedolik-50493239.html	2025-02-26T02:24:00-08:00	https://static.nv.ua/shared/system/Article/posters/003/044/568/original/d72bd938ddcd041bef241da56cb7df13.jpg?q=85&stamp=20250226122209&w=900
Прем'єр Румунії виступив проти відправки румунських миротворців д...	Прем'єр-міністр Румунії і голова Соціал-демократичної партії країни Марчел Чолаку виступив проти введення румунських військ в Україну.	https://nv.ua/ukr/world/geopolitics/mirotvorcha-misiya-do-ukrajini-prem-yer-rumuniji-vistupiv-proti-vidpravki-viyskovih-50493238.html	2025-02-26T02:24:00-08:00	https://static.nv.ua/shared/system/Article/posters/003/044/564/original/aeee61eb771535b56b053dac430ac5f0.jpg?q=85&stamp=20250226121544&w=900
Більшість українців вважають президента і Верховну Раду легітимни...	Українці відповіли, чи вважають президента і Верховну Раду наразі легітимними.	https://nv.ua/ukr/ukraine/politics/zelenskiy-legitimniy-prezident-zayavili-ukrajinci-v-opituvanni-socis-50493237.html	2025-02-26T02:18:00-08:00	https://static.nv.ua/shared/system/Article/posters/003/044/562/original/3e6aaaab48e0a6cab59fe907f160453d.jpg?q=85&stamp=20250226121209&w=900
Витягали бетонні шматки'. У Кривому Розі врятували собаку, який ...	У Кривому Розі ветеринарам вдалося врятувати собаку, який отримав поранення, не рухався і не гавкав внаслідок ракетної атаки РФ по місту 22 лютого.	https://nv.ua/ukr/socium/ataka-rf-po-krivomu-rogu-22-lyutogo-likari-vryatuvali-sobaku-yakiy-otrimav-vazhki-poranennya-50493229.html	2025-02-26T02:17:00-08:00	https://static.nv.ua/shared/system/Article/posters/003/044/548/original/5e50f7e23231751e2c1ebed6290cf24f.jpg?q=85&stamp=20250226121512&w=900
Президент — людина з народу'. У Білому домі заявили, що великий ...	У Білому домі пояснили появу великого синця на тильному боці правої руки президента Дональда Трампа тим, що йому доводиться щодня здійснювати рукостискання.	https://nv.ua/ukr/world/countries/donald-tramp-u-bilomu-domi-zayavili-shcho-vin-chasto-tisnuv-ruki-i-zarobiv-sobi-sinyak-50493227.html	2025-02-26T02:15:00-08:00	https://static.nv.ua/shared/system/Article/posters/003/044/544/original/5f1246bb7322ffe9da8404dd55394e0f.jpg?q=85&stamp=20250226115458&w=900
Мільярди доларів. Україна збільшила експорт зернових і олійних ку...	Експорт зернових і олійних культур у липні-січні 2024/25 маркетингового року м.р. (липень 2024 року- червень 2025 року) порівняно з аналогічним періодом минулого маркетингового року збільшився на 13,4% до $11 млрд.	https://biz.nv.ua/ukr/economics/ukrajina-zbilshila-dohid-vid-eksportu-zernovih-i-oliynih-kultur-novini-ukrajini-50493232.html	2025-02-26T02:12:00-08:00	https://static.nv.ua/shared/system/Article/posters/003/044/553/original/1ead80d802fb799591c4e7c5013cf700.jpg?q=85&stamp=20250226120320&w=900
Діяли на підтримку України. У Франції двоє працівників престижног...	Поліція Франції затримала двох чоловіків, підозрюваних у нападі на російське консульство у Марселі 24 лютого. Вони виявилися працівниками престижного наукового центру Франції.	https://nv.ua/ukr/world/countries/vibuh-bilya-rosiyskogo-konsulstva-u-marseli-zatrimanimi-viyavilisya-dvoye-francuzkih-naukovciv-50493225.html	2025-02-26T02:10:00-08:00	https://static.nv.ua/shared/system/Article/posters/003/044/540/original/434f65cda2a1563acd7d103f8a7f2d48.jpg?q=85&stamp=20250226115940&w=900
Після трьох років війни. Бізнес розповів, до чого він готується у...	Європейська Бізнес Асоціація в рамках проєкту Unlimit Ukraine спільно з OLX Україна та Райффайзен Банк представила результати дослідження Індекс настроїв малого бізнесу за 2024 рік.	https://biz.nv.ua/ukr/markets/2-z-3-msb-planuyut-rozshirennya-biznesu-u-2025-roci-50493219.html	2025-02-26T02:07:00-08:00	https://static.nv.ua/shared/system/Article/posters/003/044/527/original/4aa1add79595109748d43f283a78e8e0.jpg?q=85&stamp=20250226120240&w=900
Дончич повторив незвичайне досягнення Леброна і Вестбрука, оформи...	Зірковий баскетболіст Лос-Анджелес Лейкерс Лука Дончич уперше зіграв у НБА проти своєї колишньої команди Даллас Маверікс і відзначився трипл-даблом.	https://sport.nv.ua/ukr/other-sport/luka-donchich-zrobiv-tripl-dabl-u-matchi-leykers-dallas-i-povtoriv-dosyagnennya-lebrona-i-vestrbuka-50493220.html	2025-02-26T02:00:00-08:00	https://static.nv.ua/shared/system/Article/posters/003/044/529/original/1f72ec0cb041661897a6b009e866e7e6.jpg?q=85&stamp=20250226114505&w=900
Госпіталізація папи Римського: Ватикан порушив столітнє табу щодо...	Ватикан щодня повідомляє деталі про стан здоров’я папи Римського Франциска, якого госпіталізували з подвійним запаленням легенів 14 лютого. Це порушує одне з найбільших табу, пише Reuters 25 лютого.	https://nv.ua/ukr/world/countries/papa-rimskiy-francisk-vatikan-porushiv-stolitnye-tabu-50493221.html	2025-02-26T01:57:00-08:00	https://static.nv.ua/shared/system/Article/posters/003/044/531/original/791c631c6825ca39cfd4d8371d4a0f67.jpg?q=85&stamp=20250226115218&w=900
Окупанта 'бортанули'. У РФ таксист відмовився везти 'героя СВО', ...	У російській столиці приїжджий таксист відмовився везти пораненого російського солдатау військовій формі.	https://nv.ua/ukr/lifestyle/rosiyskogo-soldata-vidmovivsya-vezti-taksist-50493214.html	2025-02-26T01:54:00-08:00	https://static.nv.ua/shared/system/Article/posters/003/044/517/original/fd4bf5bb776ee676bf7d02cc24cb03d2.jpg?q=85&stamp=20250226114728&w=900
Два сорти капусти, які принесуть рекордний урожай: посадіть і не ...	Капуста — це один з найпопулярніших та найкорисніших овочів, який вирощують в Україні. Вона є джерелом вітамінів, мінералів та клітковини, необхідних для здорового харчування.	https://life.nv.ua/ukr/showbiz/kapusta-na-posadku-u-2025-roci-dva-naysmachnishi-sorti-i-naybilshi-golovki-yaki-obrati-50492950.html	2025-02-26T01:51:00-08:00	https://static.nv.ua/shared/system/Article/posters/003/043/957/original/c4043afe22f3426e6650b108e68157cc.jpg?q=85&stamp=20250225150442&w=900
Доплата пенсіонерам 2025: хто і як може отримати майже 1000 грн з...	Самотні пенсіонери, які потребують стороннього догляду, можуть у березні 2025 року оформити щомісячну доплату у сумі 944 грн.	https://nv.ua/ukr/ukraine/events/pensiji-2025-hto-i-yak-mozhe-otrimati-doplatu-u-1000-grn-z-1-bereznya-novini-ukrajini-50492826.html	2025-02-26T01:45:00-08:00	https://static.nv.ua/shared/system/Article/posters/003/043/684/original/281e625db994f492838685b0e22eae02.jpg?q=85&stamp=20250225104742&w=900
За сімейними обставинами. Як звільнитися зі служби в ЗСУ та отрим...	Звільнення з військової служби під час воєнного стану має кілька підстав, серед яких є - за сімейними обставинами.	https://nv.ua/ukr/ukraine/events/zvilnennya-za-simeynimi-obstavinami-dokumenti-i-yak-otrimati-akt-obstezhennya-poyasnennya-yuristiv-50493007.html	2025-02-26T01:45:00-08:00	https://static.nv.ua/shared/system/Article/posters/003/044/074/original/35da4c5e96bee15a41e8c366d457eda8.jpg?q=85&stamp=20250225171458&w=900
Найкращий снукерист світу продає будинок після розставання із зір...	Семиразовий чемпіон світу зі снукеру Ронні О’Салліван виставив на продаж свій будинок у Лондоні, де тривалий час жив з актрисою Лайлою Руасс.	https://sport.nv.ua/ukr/other-sport/ronni-o-sallivan-prodaye-sviy-budinok-u-londoni-de-zhiv-z-aktorkoyu-layloyu-ruass-foto-50493212.html	2025-02-26T01:43:00-08:00	https://static.nv.ua/shared/system/Article/posters/003/044/511/original/bb1721cfcada5ccabb8846e7a2a7012e.jpg?q=85&stamp=20250226112657&w=900
