Title	Description	Link	pubDate	Image
Літак Зеленського здійснив посадку у Лондоні - ЗМІ	Президент України Володимир Зеленський прибув до Лондона, Велика Британія, повідомляє Yahoo News.	https://nv.ua/ukr/world/countries/litak-zelenskogo-zdiysniv-posadku-u-londoni-the-independent-50494223.html	2025-03-01T03:35:00-08:00	https://static.nv.ua/shared/system/Article/posters/003/046/685/original/e8d54d5f33d41ec43df1aa820a43a6f0.jpg?q=85&stamp=20250301133959&w=900
Глава Пентагону Гегсет пригрозив Мексиці 'військовими діями', якщ...	Міністр оборони США Піт Гегсет під час першого телефонного дзвінка з вищими військовими чинами Мексики, який відбувся 31 січня, пригрозив країні військовими діями, якщо вона не виконає вимоги щодо кордону, пише The Wall Street Journal 28 лютого.	https://nv.ua/ukr/world/geopolitics/pit-gegset-prigroziv-meksici-viynoyu-yakshcho-kriza-na-kordoni-zi-ssha-prodovzhitsya-50494222.html	2025-03-01T03:31:00-08:00	https://static.nv.ua/shared/system/Article/posters/003/046/683/original/15bbe19b42f42e755d3646743b3e75ab.jpg?q=85&stamp=20250301132635&w=900
Ганебно'. Країни Балтії 'вкрай незадоволені' тим, що Британія не...	Країни Балтії були 'дуже незадоволені' тим, що Британія не запросила їхніх лідерів взяти участь у саміті щодо України, який пройде на цих вихідних, повідомляє Sky News із посиланням на європейське дипломатичне джерело.	https://nv.ua/ukr/world/countries/krajini-baltiji-nezadovoleni-tim-shcho-britaniya-ne-zaprosila-jihnih-lideriv-na-samit-shchodo-ukrajini-50494219.html	2025-03-01T03:31:00-08:00	https://static.nv.ua/shared/system/Article/posters/003/046/677/original/a69a781e75807e087a708bd801b8c157.jpg?q=85&stamp=20250301132940&w=900
Дозволяє розвинути швидкість 16 махів. У Китаї випробовують іннов...	Китай здійснив значний прорив у галузі гіперзвукових технологій, успішно протестувавши двигун, здатний розвивати швидкість 16 Махів.	https://techno.nv.ua/ukr/popscience/kitay-viprobuvav-giperzvukoviy-dvigun-shcho-rozvivaye-shvidkist-16-mahiv-50493932.html	2025-03-01T03:30:00-08:00	https://static.nv.ua/shared/system/Article/posters/003/046/061/original/313396c5012f63355810702a991891d3.jpg?q=85&stamp=20250228112639&w=900
Як світ реагує на скандал в Білому домі — ВВС Україна	Поки європейські лідери висловлюють публічну підтримку президенту України Вололимиру Зеленському, російські політики не приховують радості від скандалу, що стався в Білому домі, йдеться в огляді ВВС Україна.	https://nv.ua/ukr/world/geopolitics/skandal-u-bilomu-domi-yaka-reakciya-yevropi-rosiji-ukrajini-50494207.html	2025-03-01T03:21:00-08:00	https://static.nv.ua/shared/system/Article/posters/003/046/647/original/b5c660fc61cf50a9ae53e52da02459ee.jpg?q=85&stamp=20250301122158&w=900
Сіськадовськ не навчив'. У Мережі обурені майбутньою комедією ст...	У Мережі обговорюють фрагмент з комедії Раша Гудбай Студії Квартал 95, в якому головна героїня з Горлівки, перебуваючи в Ужгороді, наказує своєму сину говорити всім, що вони з Маріуполя і ховались на Азовсталі.	https://nv.ua/ukr/kultura/rasha-gudbay-film-kvartal-95-pro-propagandistku-z-gorlivki-viklikav-oburennya-v-merezhi-video-50494214.html	2025-03-01T03:13:00-08:00	https://static.nv.ua/shared/system/Article/posters/003/046/664/original/f6b54887934571b894354fc079f559fe.jpg?q=85&stamp=20250301125238&w=900
Запаси розтанули до весни. Україні та Європі доведеться вступити ...	В українських підземних сховищах станом на кінець лютого перебувало близько 6,3 млрд кубометрів газу, що є історичним мінімумом для цього періоду.	https://biz.nv.ua/ukr/markets/zapasi-gazu-v-ukrajini-skorotilisya-do-minimumu-zakupivli-do-nastupnogo-zimovogo-sezonu-pid-zagrozoyu-50494210.html	2025-03-01T03:13:00-08:00	https://static.nv.ua/shared/system/Article/posters/003/046/655/original/a40f7ab790fb221635fb8ceb0a793988.jpg?q=85&stamp=20250301123310&w=900
Зал вибухнув оваціями. Катрін Деньов присвятила церемонію кінопре...	У концертному залі Олімпія у Парижі відбулася ювілейна 50-та церемонія вручення кінопремії Сезар — головної кінонагороди Франції. Тріумфатором премії став кримінальний мюзикл Емілія Перес режисера Жака Одіара.	https://nv.ua/ukr/kultura/katrin-denov-vislovila-pidtrimku-ukrajini-pislya-perepalki-trampa-i-zelenskogo-video-50494208.html	2025-03-01T03:03:00-08:00	https://static.nv.ua/shared/system/Article/posters/003/046/651/original/f59e0960ac874f465e098af4e5573f22.jpg?q=85&stamp=20250301122840&w=900
Я його тоді витягнув': Сабо розповів, чому Шевченко більше не хо...	Колишній головний тренер збірної України та київського Динамо Йожеф Сабо поділився думками про те, чому зіпсувалися його стосунки з експідопічним Андрієм Шевченком, який зараз є президентом УАФ.	https://sport.nv.ua/ukr/football/yozhef-sabo-rozpoviv-pro-svoji-stosunki-z-andriyem-shevchenkom-50494213.html	2025-03-01T03:00:00-08:00	https://static.nv.ua/shared/system/Article/posters/003/046/662/original/ba8f5a7e18d6e30e332c085bf01ef122.jpg?q=85&stamp=20250301123420&w=900
Світ наляканий і токсична невизначеність завдає шкоди	Ринок акцій, і не тільки, продовжують падати. Якщо так піде й далі, та S&P 500 втратить ще декілька сотень пунктів, то Дональду Трампу, швидше за все, доведеться реагувати.	https://biz.nv.ua/ukr/experts/rinki-akciy-ta-kriptovalyuta-prodovzhuyut-padati-na-tli-zayav-i-diy-trampa-oglyad-ivana-kompana-50494200.html	2025-03-01T03:00:00-08:00	https://nv.ua/upload/nv_fix_image.jpeg
Зеленський 33 рази подякував США за підтримку України: CNN провів...	Президент України Володимир Зеленський 33 рази дякував США, їхнім посадовцям та людям за підтримку, свідчать результати факт-чекінгу, проведеного CNN.	https://nv.ua/ukr/world/geopolitics/volodimir-zelenskiy-dyakuvav-ssha-33-razi-z-pochatku-povnomasshtabnogo-vtorgnennya-50494212.html	2025-03-01T02:57:00-08:00	https://static.nv.ua/shared/system/Article/posters/003/046/660/original/0614e70c582f7cc336ef58d5b38b3d02.jpg?q=85&stamp=20250301125817&w=900
Двоє проти одного. Чому вибухнули Трамп, Венс і Зеленський	Я кілька разів продивився відео, щоб зрозуміти, чому саме вибухнули Джей Ді Венс, Дональд Трамп, і можливо, президент Володимир Зеленський їх чимось спровокував	https://nv.ua/ukr/opinion/tramp-i-vens-nakinulisya-na-zelenskogo-sich-pro-istorichnu-superechku-v-ovalnomu-kabineti-50494217.html	2025-03-01T02:57:00-08:00	https://nv.ua/upload/nv_fix_image.jpeg
Американці втомилися': речниця Білого дому заявила, що США більш...	США більше не збираються 'виписувати порожні чеки' на війну, яку країна-агресор Росія розпочала проти України. Американці 'втомилися' сплачувати рахунки на 'сотні мільярдів доларів', заявила речниця Білого дому Керолайн Левітт в ефірі Fox News у п’ятницю, 28 лютого, маючи на увазі допомогу США Україні.	https://nv.ua/ukr/world/geopolitics/kerolayn-levitt-zayavila-shcho-ssha-bilshe-ne-hochut-finansuvati-viynu-v-ukrajini-50494209.html	2025-03-01T02:31:00-08:00	https://static.nv.ua/shared/system/Article/posters/003/046/653/original/2cd50be749e2be9e90e550a2b894ad30.jpg?q=85&stamp=20250301122815&w=900
США різко посилять тиск на Україну для укладення мирної угоди і у...	У адміністрації президента США Дональда Трампа можуть посилити тиск на Україну для укладення мирної угоди та уникатимуть прямих контактів із президентом Володимиром Зеленським, повідомляє Bloomberg із посиланням на джерела.	https://nv.ua/ukr/world/geopolitics/donald-tramp-mozhe-posiliti-tisk-na-ukrajinu-dlya-dosyagnennya-mirnoji-ugodi-z-rf-pishe-bloomberg-50494202.html	2025-03-01T02:26:00-08:00	https://static.nv.ua/shared/system/Article/posters/003/046/636/original/ddb4e0101ed3ad82c4134c3a043db0e6.jpg?q=85&stamp=20250301122531&w=900
Тектонічні зміни'. У Трампа після сварки з Зеленським немає манд...	Політолог Микола Давидюк в інтерв'ю Radio NV розповів про наслідки сварки президентів України та США Володимира Зеленського та Дональда Трампа, зокрема для переговорів з Росією, а також варіанти, як цей конфлікт може вивести відносини країн на новий рівень.	https://nv.ua/ukr/world/geopolitics/tramp-vtrativ-mandat-na-peregovori-shcho-bude-pislya-svarki-z-zelenskim-politolog-novini-ukrajini-50494205.html	2025-03-01T02:18:00-08:00	https://static.nv.ua/shared/system/Article/posters/003/046/643/original/4714a2a4b58857cbd01e7e90256db836.jpg?q=85&stamp=20250301120504&w=900
Бізнес тижня. Трамп і Зеленський не підписали 'договір про копали...	Донька депутата Сергія Тарути вирішила ліквідувати успішний завод, українські меблярі змогли знайти ринки збуту в ЄС та США та як освіта може стати прибутковим проектом — статті тижня NV Бізнес	https://biz.nv.ua/ukr/economics/ugoda-pro-kopalini-likvidaciya-hevi-metal-propoziciya-putina-trampu-statti-tizhnya-pro-ekonomiku-50494195.html	2025-03-01T02:13:00-08:00	https://static.nv.ua/shared/system/Article/posters/003/046/620/original/e960c9b6db1744ad8b810bf8651b80a0.jpg?q=85&stamp=20250301111819&w=900
Прикидалися інвесторами. Нацкомісія вивела на чисту воду сім шахр...	Сім так званих інвестиційнихпроектів, які активно діють в Україні, насправді є сумнівними та ненадійними.	https://biz.nv.ua/ukr/finance/vikrili-internet-shahrajiv-nkcpfr-viyavila-sim-sumnivnih-investiciynih-proektiv-50494193.html	2025-03-01T02:12:00-08:00	https://static.nv.ua/shared/system/Article/posters/003/046/616/original/cd0a3f15980882abf21d4c747454eda4.jpg?q=85&stamp=20250301111007&w=900
Ілон Маск став батьком учотирнадцяте — матір'ю дитини є топ-менед...	Топ-менеджерка корпорації Neuralink (займається розробкою мозкових імплантатів) Шивон Зіліс повідомила, що народила четверту дитину від американського мільярдера Ілона Маска.	https://life.nv.ua/ukr/znamenitosti/u-ilona-maska-narodilasya-14-ta-ditina-matir-yu-ditini-stala-menedzherka-neuralink-shivon-zilis-50494199.html	2025-03-01T02:06:00-08:00	https://static.nv.ua/shared/system/Article/posters/003/046/630/original/6d9345a620470468c74fc3c5dca2684f.jpg?q=85&stamp=20250301120014&w=900
Дякуємо за мужність': Магучіх відреагувала на суперечку Зеленськ...	Олімпійська чемпіонка і рекордсменка світу зі стрибків у висоту Ярослава Магучіх висловила підтримку президенту України Володимиру Зеленському після його суперечки з Дональдом Трампом у Білому домі.	https://sport.nv.ua/ukr/other-sport/superechka-zelenskogo-i-trampa-v-bilomu-domi-28-lyutogo-yaroslava-maguchih-pidtrimala-lidera-ukrajini-50494203.html	2025-03-01T02:00:00-08:00	https://static.nv.ua/shared/system/Article/posters/003/046/638/original/db4a38431857c07f0e99194ab93475c7.jpg?q=85&stamp=20250301115325&w=900
13-річна Яна Степаненко, яка втратила обидві ноги через удар по К...	13-річна українка Яна Степаненко, яка втратила дві ноги внаслідок російського ракетного удару по вокзалу у Краматорську у 2022 році, взяла участь у благодійному забігу в Японії. Про це у соцмережі Х повідомляє ФК Шахтар, який організував поїздку українки.	https://nv.ua/ukr/ukraine/events/yana-stepanenko-probigla-blagodiyniy-marafon-u-tokio-foto-50494201.html	2025-03-01T01:46:00-08:00	https://static.nv.ua/shared/system/Article/posters/003/046/634/original/ca040b909cc39f22b64dcd41285fa90a.jpg?q=85&stamp=20250301114435&w=900
Там ночували футболісти. Тренувальна база Чорноморця постраждала ...	Унаслідок повітряної атаки РФ по Одеській області 28 лютого значних руйнувань зазнала навчально-тренувальна база Чорноморця в Совіньйоні.	https://sport.nv.ua/ukr/football/v-odesi-vnaslidok-ataki-rosiji-postrazhdala-trenuvalna-baza-chornomorcya-foto-50494196.html	2025-03-01T01:26:00-08:00	https://static.nv.ua/shared/system/Article/posters/003/046/622/original/826d9d9f096fa3ec33129bbe937d389c.jpg?q=85&stamp=20250301111315&w=900
Цибуля без стрілок: чотири прості поради, як виростити врожай без...	Для того щоб зібрати гарний врожай цибулі без стрілок, необхідно знати чотири прості правила її вирощування.	https://life.nv.ua/ukr/showbiz/yak-virostiti-cibulyu-bez-strilok-4-prosti-rekomendaciji-vid-dosvidchenih-gorodnikiv-50493894.html	2025-03-01T01:23:00-08:00	https://static.nv.ua/shared/system/Article/posters/003/045/979/original/e4a75716739b8b7a9a5fc17b88611706.jpg?q=85&stamp=20250228100006&w=900
Спланована провокація' та 'помилка' Зеленського: журналіст Голос...	Журналіст української редакції Голосу Америки Остап Яриш розповів про настрої у США після перепалки у Білому домі між президентом України Володимиром Зеленським та президентом Дональдом Трампом і віцепрезидентом США Джей Ді Венсом 28 лютого.	https://nv.ua/ukr/world/geopolitics/svarka-zelenskogo-z-trampom-i-vensom-zhurnalist-golosu-ameriki-rozpoviv-pro-nastroji-u-ssha-50494194.html	2025-03-01T01:17:00-08:00	https://static.nv.ua/shared/system/Article/posters/003/046/618/original/762effcfa98f11c545a9fa4fd1c7d067.jpg?q=85&stamp=20250301111252&w=900
У мужності є ім'я'. Зірка серіалу Останні з нас Педро Паскаль пі...	Чилійсько-американський актор Педро Паскаль (Останні з нас, Гра престолів, Нарко, Гладіатор) у Stories висловив свою підтримку Україні та президентові Володимиру Зеленському.	https://nv.ua/ukr/kultura/svarka-zelenskogo-i-trampa-pedro-paskal-i-alissa-milano-vislovili-svoyu-pidtrimku-ukrajini-50494186.html	2025-03-01T01:06:00-08:00	https://static.nv.ua/shared/system/Article/posters/003/046/600/original/d9ab0b91bd46885188f2ddaac154d6bb.jpg?q=85&stamp=20250301102415&w=900
У Папи Римського погіршився стан здоров’я через напад бронхоспазм...	Стан здоров’я Папи Римського Франциска погіршився після того, як у нього стався напад бронхоспазму, після чого понтифіку негайно розпочали неінвазивну механічну вентиляцію легень.	https://nv.ua/ukr/world/countries/stan-zdorov-ya-papi-rimskogo-pogirshivsya-pislya-napadu-bronhospazmu-50494189.html	2025-03-01T01:04:00-08:00	https://static.nv.ua/shared/system/Article/posters/003/046/606/original/3063097a50da177f3eb0f459df772e40.jpg?q=85&stamp=20250301110536&w=900
Неймовірна подорож. Кеті Перрі вирушить у космос з екіпажем Blue ...	Цієї весни співачка вирушить у космос у складі жіночого екіпажу Blue Origin, що стане важливою подією в історії космічних подорожей.	https://techno.nv.ua/ukr/popscience/keti-perri-virushit-u-kosmos-z-ekipazhem-blue-origin-50493922.html	2025-03-01T01:00:00-08:00	https://static.nv.ua/shared/system/Article/posters/003/046/037/original/7879f51c9347b39cf3195d8d62a72a6f.jpg?q=85&stamp=20250228111015&w=900
Зниклий безвісти військовий: як сім'я може отримати виплати	В умовах, коли війна ставить перед нашими героями та їхніми сім'ями складні випробування, важливо знати, які кроки потрібно зробити, щоб забезпечити фінансову підтримку для родин військовослужбовців, зниклих безвісти.	https://nv.ua/ukr/ukraine/events/bezvisti-znikliy-viyskoviy-2025-yaki-viplati-rodini-hto-maye-pravo-i-yak-otrimati-instrukciya-50492598.html	2025-03-01T01:00:00-08:00	https://static.nv.ua/shared/system/Article/posters/003/043/189/original/e250cc1639321b457eb09b7710cce590.jpg?q=85&stamp=20250224143216&w=900
Не вдавайте, ніби це наша вина': Стаховський звернувся до америк...	Колишня перша ракетка України Сергій Стаховський прокоментував новину про те, що адміністрація президента США Дональда Трампа розглядає можливість припинення всієї військової допомоги Україні.	https://sport.nv.ua/ukr/tennis/sergiy-stahovskiy-prokomentuvav-superechku-zelenskogo-i-trampa-v-bilomu-domi-50494188.html	2025-03-01T00:53:00-08:00	https://static.nv.ua/shared/system/Article/posters/003/046/604/original/93f616e070fb7db2d278f73d16816c27.jpg?q=85&stamp=20250301103424&w=900
Перепалка була неминучою'. Трамп примкнув до Москви і антизахідн...	Директор Інституту зовнішньополітичних досліджень Григорій Перепелиця в ефірі Radio NV пояснив розбіжності між позиціями президентів США та України Дональда Трампа та Володимира Зеленського, які призвели до 'неминучої' перепалки.	https://nv.ua/ukr/world/geopolitics/tramp-na-boci-rosiji-perepalka-z-zelenskim-bula-neminuchoyu-perepelicya-novini-ukrajini-50494191.html	2025-03-01T00:51:00-08:00	https://static.nv.ua/shared/system/Article/posters/003/046/611/original/20a3ebf2a8534ce81dc282e9e7ed2615.jpg?q=85&stamp=20250301104613&w=900
У березні в Україні завершиться термін перебронювання працівників...	Кабмін продовжив до 31 березня 2025 року термін перебронювання військовозобов'язаних співробітників критичних підприємств.	https://nv.ua/ukr/ukraine/events/bronyuvannya-vid-mobilizaciji-pracivnikiv-kritichnih-pidpriyemstv-prodovzhili-do-31-bereznya-vsi-detali-50493883.html	2025-03-01T00:40:00-08:00	https://static.nv.ua/shared/system/Article/posters/003/045/954/original/5ccb0fd629faf3941e0c6a0962cf7b3b.jpg?q=85&stamp=20250228094227&w=900
ГУР підтвердило підрив автомобіля російського окупанта у Маріупол...	У тимчасово окупованому Маріуполі Донецької області вночі 28 лютого пролунав вибух, внаслідок чого поранено російського окупанта, повідомляє Головне управління розвідки Міноборони України у суботу, 1 березня.	https://nv.ua/ukr/ukraine/events/u-mariupoli-pidirvali-avto-z-rosiyskim-okupantom-video-50494187.html	2025-03-01T00:32:00-08:00	https://static.nv.ua/shared/system/Article/posters/003/046/602/original/4e357fc1e3fe402d3ac511b004dc5239.jpg?q=85&stamp=20250301103012&w=900
Нікому нічого не можу сказати': Усик загадково висловився про по...	Чемпіон світу за версіями WBC, WBA та WBO в надважкій вазі Олександр Усик розповів про свій пояс, який президент України Володимир Зеленський привіз на зустріч з лідером США Дональдом Трампом.	https://sport.nv.ua/ukr/boxing/oleksandr-usik-rozpoviv-yakiy-poyas-zelenskiy-prinis-u-biliy-dim-na-zustrich-iz-trampom-50494185.html	2025-03-01T00:29:00-08:00	https://static.nv.ua/shared/system/Article/posters/003/046/598/original/9b3a94f6db337e0e27563a09ffa01a22.jpg?q=85&stamp=20250301100630&w=900
Золотий фонд. Ці книжки складають топ 5 легендарних кулінарних ви...	У нашу цифрову епоху гортання кулінарної книги може принести глибоке задоволення. Звісно, в інтернеті можна знайти практично будь-який рецепт, а соціальні мережі — найкращий спосіб знайти те, що в тренді. Але про це забуваєш, коли до рук потраплять ці примірники.	https://nv.ua/ukr/food/eat/legendarni-knizhki-yaki-naybilsh-viznachni-kulinarni-knigi-v-istoriji-50493960.html	2025-03-01T00:29:00-08:00	https://static.nv.ua/shared/system/Article/posters/003/046/120/original/600b58b04e75bea466a13cc58c1b939d.jpg?q=85&stamp=20250228123617&w=900
Правда і хибне уявлення. Сім міфів про вчителювання в селі	Керівниця напряму подолання освітньої нерівності ГО Навчай для України Інна Рахмістрюк розповіла NV, як вони допомагають усунути розрив в освітніх можливостях між дітьми із сіл та міст.	https://life.nv.ua/ukr/kids/pracyuvati-vchitelem-u-seli-sim-mifiv-pro-robotu-de-pravda-i-hibne-uyavlennya-50494135.html	2025-03-01T00:27:00-08:00	https://static.nv.ua/shared/system/Article/posters/003/046/492/original/76efba920a25c4acba008a70c95e220a.jpg?q=85&stamp=20250228213844&w=900
