Title	Description	Link	pubDate	Image
Ex-ROK intel chief ordered elimination of agents after 2016 North Korea missions	The former head of South Korea’s Defense Intelligence Command (KDIC) issued orders to -blow up- intelligence officers once they had completed their missions related to North Korea, according to a senior military officer testifying during a hearing on Yoon Suk-yeol’s martial law declaration. Brigadier General Park Min-woo, currently serving as deputy commander of the ROK ...	https://www.nknews.org/2025/02/ex-rok-intel-chief-ordered-elimination-of-agents-after-2016-north-korea-missions/	2025-02-04T23:37:23-08:00	https://assets.korearisk.com/uploads/2025/02/Untitled-design-500x256.png
North Korea eyes match against Russian national team after club friendlies	North Korea is hoping to face off against Russia’s national soccer team following two matches with local clubs over the past week and as a Russian coach appears to have set his sights on a DPRK player. Kim Chung Jin, the manager of the DPRK national team, reportedly stated in a recent interview after a ...	https://www.nknews.org/2025/02/north-korea-eyes-match-against-russian-national-team-after-club-friendlies/	2025-02-04T21:31:14-08:00	https://assets.korearisk.com/uploads/2025/02/NK-Baltika-500x256.jpg
Business exploration trip to North Korea raises sanctions concerns	North Korea is inviting foreign investors back into the country for a business-study trip for the first time in five years, according to Dutch firm GPI Consultancy which is facilitating the event. GPI Consultancy said last week that despite heavy sanctions on North Korea and other hurdles, it has received interest from firms that are ...	https://www.nknews.org/2025/02/business-exploration-trip-to-north-korea-raises-sanctions-concerns/	2025-02-04T16:53:00-08:00	https://assets.korearisk.com/uploads/2025/02/Copy-of-Featured-Image-Empty-63-500x256.png
North Korean arrivals to Russia mark 12-fold yearly increase in 2024	More than 13,000 North Koreans entered Russia last year, marking an over 12-fold yearly jump from 2023, official data shows, with the number of DPRK citizens visiting the country on student visas once again marked an all-time high. Over 6,400 Russians visited North Korea in the same period — the highest number since 2012 when ...	https://www.nknews.org/2025/02/north-korean-arrivals-to-russia-mark-12-fold-yearly-increase-in-2024/	2025-02-04T02:25:53-08:00	https://assets.korearisk.com/uploads/2025/02/45490733491_06e1e84813_k-500x256.jpg
North Korea’s top universities forge new links with Russian institutions	North Korean educators inked multiple deals with universities all across Russia during a recent delegation visit, eyeing student exchanges and engineering technology, including in nuclear science. A delegation from Kim Il Sung University (KISU) led by President Kim Sung Chan returned to the DPRK on Feb. 3, the Korean Central News Agency reported on Tuesday, ...	https://www.nknews.org/2025/02/north-koreas-top-universities-forge-new-links-with-russian-institutions/	2025-02-04T02:03:52-08:00	https://assets.korearisk.com/uploads/2025/02/%D0%9C%D0%93%D0%A3_%D0%B2%D0%B8%D0%B4_%D1%81_%D0%B2%D0%BE%D0%B7%D0%B4%D1%83%D1%85%D0%B0-500x256.jpg