Title	Description	Link	pubDate	Image
Russia speeds up work on bridge to North Korea despite winter weather: Report	Russia has sped up the construction of a new multimillion-dollar car bridge to North Korea across the Tumen River, according to a new report, following the start of preparatory work on the long-delayed project late last year. SI Analytics noted -rapid preparations for bridge construction- this year and released a high-resolution image of work on ...	https://www.nknews.org/2025/03/russia-speeds-up-work-on-bridge-to-north-korea-despite-winter-weather-report/	2025-03-05T23:34:32-08:00	https://assets.korearisk.com/uploads/2025/03/Featured-500x256.jpg
US-ROK to kick off major exercise on countering North Korea, first under Trump	The U.S. and South Korea will kick off large-scale spring military exercises next week with a focus on strengthening their combined defense posture against North Korea’s evolving threats, the first such drill since alliance skeptic Donald Trump’s return as U.S. president. The Freedom Shield exercise will be held from March 10 to March 20 and ...	https://www.nknews.org/2025/03/us-rok-to-kick-off-major-exercise-on-countering-north-korea-first-under-trump/	2025-03-05T21:09:10-08:00	https://assets.korearisk.com/uploads/2023/03/Ssang-Yong-2023_ROK-Marines-500x256.jpg
Errant bombs fall on village, injure 7 during US-ROK drills against North Korea	U.S.-ROK live-fire training on responding to North Korean threats ended in casualties on Thursday morning after multiple bombs -abnormally released- from a South Korean fighter jet fell on a village, according to ROK authorities. Four people sustained serious injuries and three suffered minor wounds in the incident at 10:04 a.m. in Pocheon, a South Korean ...	https://www.nknews.org/2025/03/errant-bombs-fall-on-village-injure-7-during-us-rok-drills-against-north-korea/	2025-03-05T20:48:02-08:00	https://assets.korearisk.com/uploads/2024/05/ROK-air-drills-20240527_KF-16-FA50-500x256.png
North Korean troops in Russia are learning modern drone warfare tactics: Seoul	North Korean troops sent to Russia are learning modern drone warfare tactics, Seoul’s spy agency assessed on Wednesday, suggesting deepening cooperation in unmanned aerial vehicles (UAVs). In a notice to media, the National Intelligence Service (NIS) pointed to indications that DPRK soldiers fighting Ukraine in the Kursk region are receiving training in drone operation and ...	https://www.nknews.org/2025/03/north-korean-troops-in-russia-are-learning-modern-drone-warfare-tactics-seoul/	2025-03-05T19:55:55-08:00	https://assets.korearisk.com/uploads/2023/09/Untitled-design-2023-09-17T182925.506-500x256.png
Trump pick for key post calls for ROK to do more to defend against North Korea	Donald Trump’s nominee for a top U.S. defense role warned of escalating threats from North Korea’s nuclear weapons development and cooperation with China and Russia, while endorsing the need for South Korea to do more for its own defense. Elbridge Colby, the nominee for under secretary of defense for policy, delivered the assessment in a ...	https://www.nknews.org/2025/03/trump-pick-for-key-post-calls-for-rok-to-do-more-to-defend-against-north-korea/	2025-03-05T00:46:04-08:00	https://assets.korearisk.com/uploads/2024/12/Elbridge-Colby-500x256.png
North Korean POW in Ukraine tells South Korean lawmaker that he wants to defect	A North Korean prisoner of war (POW) in Ukraine has explicitly expressed his desire to defect to South Korea, according to an ROK lawmaker, who called for Seoul to use -all- available resources to prevent the soldier’s forced repatriation after meeting him last month. Yu Yong-weon of the conservative People Power Party (PPP) disclosed audio ...	https://www.nknews.org/2025/03/north-korean-pow-in-ukraine-tells-south-korean-lawmaker-that-he-wants-to-defect/	2025-03-05T00:00:54-08:00	https://assets.korearisk.com/uploads/2025/03/Yu-Yong-weon-NK-POW-500x256.png
No South Korean aid shipments reached North Korea in 2024, first in 29 years	No South Korean humanitarian aid arrived in North Korea in 2024, the first time this has happened since Seoul first started providing assistance 29 years ago. The unification ministry announced on Wednesday that neither the ROK government nor private organizations were able to deliver assistance, attributing this to Pyongyang’s refusal to accept help as it ...	https://www.nknews.org/2025/03/no-south-korean-aid-shipments-reached-north-korea-in-2024-first-in-29-years/	2025-03-04T23:18:13-08:00	https://assets.korearisk.com/uploads/2025/03/Copy-of-Featured-Image-Empty-14-500x256.png
North Korea closes border city to tourism, less than three weeks after reopening	North Korea has closed the border city of Rason to tours, less than three weeks after opening it to non-Russian visitors for the first time in five years, according to travel industry insiders. -Rason is closed for everyone,- said Rayco Vega of KTG, a Spain-based tour company, after the firm received word from its North ...	https://www.nknews.org/2025/03/north-korea-closes-border-city-to-tourism-less-than-three-weeks-after-reopening/	2025-03-04T20:09:54-08:00	https://assets.korearisk.com/uploads/2024/10/tourism-unlikely-to-resume-2024-featured-500x256.jpg
North Korea stepping up cyberattacks on software supply chains, Seoul warns	North Korean cybercriminals have stepped up attacks targeting software supply chains in a bid to steal confidential information and core technologies from government agencies and tech companies, according to Seoul’s spy agency. The National Intelligence Service (NIS) said in a press release on Tuesday that it recently detected DPRK threat actors employing -sophisticated techniques- to ...	https://www.nknews.org/2025/03/north-korea-stepping-up-cyberattacks-on-software-supply-chains-seoul-warns/	2025-03-04T00:34:05-08:00	https://assets.korearisk.com/uploads/2025/03/North-Koreans-using-computers_NK-News-500x256.png
North Korea has restarted reactor at main nuclear site, watchdog says	A nuclear reactor at North Korea’s main nuclear research center at Yongbyon resumed operations in mid-October after a shutdown period, while the country continues to expand its uranium enrichment capabilities, according to the head of the U.N. nuclear watchdog. In a statement to the International Atomic Energy Agency (IAEA) Board of Governors on Monday, Director-General ...	https://www.nknews.org/2025/03/north-korea-has-restarted-reactor-at-main-nuclear-site-watchdog-says/	2025-03-03T21:21:26-08:00	https://assets.korearisk.com/uploads/2025/03/KJU-at-Yongbyon-uranium-enrichment-site_KCNA-20250129-500x256.png
Korea Risk Group statement on KCNA Watch purpose and complaint by KPM	KCNA Watch is an archival tool that helps journalists, researchers and policymakers study and access publicly available DPRK media in an organized and searchable format. Similar to the Internet Archive, our platform ensures that historical records remain freely accessible for long-term analysis and documentation. DPRK state media frequently alters, deletes or restricts access to its ...	https://www.nknews.org/2025/03/korea-risk-group-statement-on-kcna-watch-purpose-and-complaint-by-kpm/	2025-03-03T18:25:01-08:00	https://assets.korearisk.com/uploads/2025/03/korea-risk-group-logo-featured-iimage-500x256.jpg
North Korea says it may ‘escalate’ nuclear power demonstration in response to US	North Korean leader Kim Jong Un&#8217;s younger sister warned the U.S. it is &#8220;seriously considering&#8221; measures to &#8220;escalate&#8221; nuclear weapons-related actions in response to Washington sending an aircraft carrier to South Korea this week, according to state media. In a statement released by the Rodong Sinmun on Tuesday morning, Kim Yo Jong complained about the USS ...	https://www.nknews.org/2025/03/north-korea-says-it-may-escalate-nuclear-power-demonstration-in-response-to-us/	2025-03-03T13:37:39-08:00	https://assets.korearisk.com/uploads/2025/02/Hwasong-19-launch_KCNA-20241101-500x256.png
North Korea opens registration for Pyongyang marathon to non-Russian tourists	North Korea will allow non-Russian tourists to visit Pyongyang for the first time in over five years to compete in its premier international marathon, according to one of the event’s partners. DPRK-focused travel agency Koryo Tours announced on Monday that it is accepting applications for the Pyongyang International Marathon scheduled for April 6, after the ...	https://www.nknews.org/2025/03/north-korea-opens-registration-for-pyongyang-marathon-to-non-russian-tourists/	2025-03-03T01:50:01-08:00	https://assets.korearisk.com/uploads/2025/03/pyongyang-marathon-featured-cropped-2-500x256.jpg
UN human rights envoy calls for North Korea to use funds for people, not weapons	The U.N. special envoy for North Korean human rights has called on the DPRK to use its state funds primarily for the well-being of its people, rather than prioritizing military spending. Special Rapporteur Elizabeth Salmon makes the recommendation in her latest report to the U.N. Human Rights Council, published on Friday. In contrast to previous ...	https://www.nknews.org/2025/03/un-human-rights-envoy-calls-for-north-korea-to-use-funds-for-people-not-weapons/	2025-03-03T01:14:11-08:00	https://assets.korearisk.com/uploads/2025/03/Copy-of-Featured-Image-Empty-13-500x256.png
US aircraft carrier arrives in South Korea in first visit since Trump return	A U.S. nuclear-powered aircraft carrier arrived in South Korea on Sunday, reportedly to participate in trilateral drills including Japan, in the first carrier deployment aimed at deterring North Korea under the Trump administration. The visit by the USS Carl Vinson (CVN-70) comes approximately eight months after the USS Roosevelt&#8217;s (CVN-71) visit in June last year ...	https://www.nknews.org/2025/03/us-aircraft-carrier-arrives-in-south-korea-in-first-visit-since-trump-return/	2025-03-02T23:55:37-08:00	https://assets.korearisk.com/uploads/2025/03/carl-vinson-aircraft-carrier-march-2025-cropped-500x256.jpg
North Korea, Kursk strike deal on boosting ties as DPRK troops fight in region	Business associations for North Korea’s capital city and the Russian region of Kursk have sealed a deal on expanding economic cooperation, as DPRK soldiers fight alongside Russia forces to repel Ukraine’s incursion into the territory. The Pyongyang and Kursk chambers of commerce (COC) reached the agreement to boost -bilateral economic ties and expand opportunities for ...	https://www.nknews.org/2025/02/north-korea-kursk-strike-deal-on-boosting-ties-as-dprk-troops-fight-in-region/	2025-02-28T02:40:02-08:00	https://assets.korearisk.com/uploads/2025/02/3-10-500x256.jpg
North Korea expert Sue Mi Terry files motions to dismiss foreign influence case	Attorneys for North Korea expert Sue Mi Terry have filed pretrial motions seeking to dismiss the U.S. government&#8217;s case alleging that she worked for South Korean spies, arguing that the prosecution is legally flawed and based on coerced statements obtained through improper interrogation tactics. The motions, filed in the Southern District of New York, also ...	https://www.nknews.org/2025/02/north-korea-expert-sue-mi-terry-files-motions-to-dismiss-foreign-influence-case/	2025-02-28T01:26:10-08:00	https://assets.korearisk.com/uploads/2024/07/Copy-of-Featured-Image-Empty-2024-07-23T171403.468-500x256.png
US, ROK agree to push for ‘denuclearization of North Korea,’ not of ‘peninsula’	The U.S. and South Korea have agreed to use the phrase &#8220;denuclearization of North Korea&#8221; in public statements, rather than Pyongyang’s preferred formulation of &#8220;denuclearization of the Korean Peninsula,- according to Seoul. The decision could pose a stumbling block if the Trump administration pushes to restart negotiations with the DPRK, which could view the move ...	https://www.nknews.org/2025/02/us-rok-agree-to-push-for-denuclearization-of-north-korea-not-of-peninsula/	2025-02-28T00:12:39-08:00	https://assets.korearisk.com/uploads/2021/03/mar17-uriminzokkiri-new-unification-propaganda-poster-anti-US-featured-500x256.jpeg
North Korea to open first modern general hospital in October after 5-year delay	North Korean leader Kim Jong Un toured the country’s first -modern- general hospital on Thursday and said it will open in October, according to state media, five years after his original deadline. The Rodong Sinmun reported Friday that construction of the Pyongyang General Hospital has been -completed- and that Kim called the buildings -flawless,- but ...	https://www.nknews.org/2025/02/north-korea-to-open-first-modern-general-hospital-in-october-after-5-year-delay/	2025-02-27T21:02:33-08:00	https://assets.korearisk.com/uploads/2025/02/rodong-feb28-2025-kju-pyongyang-general-hospital-pgh-visit-inspection-6-500x256.jpg
Putin meets senior North Korean official amid negotiations around Ukraine war	Russian President Vladimir Putin held talks with a senior North Korean party official on Thursday, amid reports that Pyongyang has dispatched more troops to help fight against Ukraine. The Kremlin published only a one-sentence report announcing the meeting, along with a clip showing Putin shaking hands with secretary of the Workers’ Party of Korea Ri ...	https://www.nknews.org/2025/02/putin-meets-senior-north-korean-official-amid-negotiations-around-ukraine-war/	2025-02-27T20:26:06-08:00	https://assets.korearisk.com/uploads/2025/02/1-13-500x256.jpg
North Korea conducts cruise missile test to show nuclear attack ‘readiness’	North Korean leader Kim Jong Un oversaw a &#8220;strategic cruise missile&#8221; test on Wednesday in order to show off the military&#8217;s &#8220;readiness&#8221; to launch a nuclear attack, according to state media on Friday. The Rodong Sinmun reported that the Missile Administration launched two cruise missiles, each flying in &#8220;elliptical&#8221; routes covering around 986 miles (1,587 km) over ...	https://www.nknews.org/2025/02/north-korea-conducts-cruise-missile-test-to-show-nuclear-attack-readiness/	2025-02-27T13:53:25-08:00	https://assets.korearisk.com/uploads/2025/02/rodong-feb28-2025-kju-cruise-missile-test-500x256.jpg
In shift, South Korea’s top diplomat says nuclear armament ‘not off the table’	Developing nuclear weapons to counter North Korea is not &#8220;off the table&#8221; for South Korea, foreign minister Cho Tae-yul stated on Wednesday, appearing to shift his rhetoric on the issue amid concerns about the U.S. commitment to the ROK’s defense under Donald Trump. Speaking at a National Assembly session, Cho said that the redeployment of ...	https://www.nknews.org/2025/02/in-shift-south-koreas-top-diplomat-says-nuclear-armament-not-off-the-table/	2025-02-27T00:57:21-08:00	https://assets.korearisk.com/uploads/2025/02/Screenshot-2025-02-27-at-5.47.41%E2%80%AFPM-500x256.png
North Korea has deployed more troops to Russia to fight Ukraine, Seoul says	North Korea sent troop reinforcements to Russia’s Kursk region early this month, South Korea’s intelligence assessed on Thursday, after the DPRK contingent suffered heavy losses fighting Ukrainian forces. In a notice to media, Seoul’s National Intelligence Service (NIS) said North Korean reinforcements entered combat near Kursk in the first week of February but didn’t specify ...	https://www.nknews.org/2025/02/north-korea-has-deployed-more-troops-to-russia-to-fight-ukraine-seoul-says/	2025-02-26T23:35:53-08:00	https://assets.korearisk.com/uploads/2025/02/Military-cadets-500x256.jpg
In final defense, Yoon insists martial law was needed to counter North Korea	In his final defense before the Constitutional Court, impeached South Korean President Yoon Suk-yeol persisted in justifying his declaration of martial law as necessary to counter North Korean espionage, repeatedly accusing the opposition of acting under Pyongyang’s influence. Yoon referred to the opposition Democratic Party (DP) 48 times in his 77-page statement to the court ...	https://www.nknews.org/2025/02/in-final-defense-yoon-insists-martial-law-was-needed-to-counter-north-korea/	2025-02-26T23:33:26-08:00	https://assets.korearisk.com/uploads/2025/02/yoon_cour-500x256.png
US confirms North Korea behind record-breaking $1.5B crypto heist from Bybit	The FBI has confirmed that North Korean cybercriminals poached some $1.5 billion from the Dubai-based exchange Bybit last week, seeking information about the largest-ever cryptocurrency heist. In a public service announcement on Wednesday, the bureau linked the theft to malicious North Korean cyber activity that it tracks under the name &#8220;TraderTraitor.- -TraderTraitor actors are proceeding ...	https://www.nknews.org/2025/02/us-confirms-north-korea-behind-record-breaking-1-5b-crypto-heist-from-bybit/	2025-02-26T19:43:37-08:00	https://assets.korearisk.com/uploads/2025/02/2-11-500x256.jpg
UN envoy warns funding cuts will impair work of North Korean human rights NGOs	The U.N. special envoy for North Korean human rights has voiced concern that the funding crisis hitting nongovernmental organizations will negatively impact efforts to address abuses in the country, after the Trump administration froze billions in foreign aid. -In the past few weeks, several human rights civil society organizations based in the Republic of Korea ...	https://www.nknews.org/2025/02/un-envoy-warns-funding-cuts-will-impair-work-of-north-korean-human-rights-ngos/	2025-02-26T19:15:43-08:00	https://assets.korearisk.com/uploads/2025/02/Copy-of-Featured-Image-Empty-11-500x256.png
Kim Jong Un says army must learn from ‘combat experience’ on modern battlefields	North Korean leader Kim Jong Un called on the country’s military to learn from -real combat experience- in ongoing wars, according to state media on Wednesday, appearing to hint at the army’s troop deployment to Russia. The comments came during his second visit to elite military schools in two days, this time touring the Kang ...	https://www.nknews.org/2025/02/kim-jong-un-says-army-must-learn-from-combat-experience-on-modern-battlefields/	2025-02-25T23:11:19-08:00	https://assets.korearisk.com/uploads/2025/02/kcna-feb26-2025-2k-kju-visit-Kang-Kon-Military-Academy-KPA-23-featured-500x256.jpg
North Korean delegations to Russia eye sanctions cooperation, VIP flats, horses	The ruling parties of North Korea and Russia have vowed to forge deeper cooperation following talks this week, with Moscow emphasizing the need to work together to counter Western sanctions. Their agreement came after DPRK diplomats toured VIP property and Russia’s largest equestrian center during a separate visit, in a likely sign of North Korea’s ...	https://www.nknews.org/2025/02/north-korean-delegations-to-russia-eye-sanctions-cooperation-vip-flats-horses/	2025-02-25T22:47:49-08:00	https://assets.korearisk.com/uploads/2025/02/Ri-Hi-Yong-and-Yakushev_handshake-500x256.jpg
North Korean firm advertises illegal restaurants in China and Cambodia	A North Korean company is openly advertising its management of joint venture restaurants overseas, including in China and Cambodia, in violation of U.N. Security Council (UNSC) sanctions forbidding such operations. The latest edition of the DPRK’s Foreign Trade magazine states that Tongnam Trading Company &#8220;runs scores of JV restaurants&#8221; through agencies in China, Cambodia and ...	https://www.nknews.org/2025/02/north-korean-firm-advertises-illegal-restaurants-in-china-and-cambodia/	2025-02-25T21:02:27-08:00	https://assets.korearisk.com/uploads/2023/08/Pyongyang-Raengmyeon-Restaurant-Cambodia-before-500x256.jpg
North Koreans mourn police officer in rare mass display of grief for non-leader	Emotional displays of loyalty to the leader are commonplace on North Korean state TV, from young people thronging around Kim Jong Un with tears in their eyes to public mourning in the aftermath of Kim Jong Il’s death. But during an unusual segment that aired earlier this week, Korean Central Television (KCTV) showed the DPRK ...	https://www.nknews.org/2025/02/north-koreans-mourn-police-officer-in-rare-mass-display-of-grief-for-non-leader/	2025-02-25T00:46:52-08:00	https://assets.korearisk.com/uploads/2025/02/2025-02-23_kctv_choe-kum-chol-500x256.png
UK sanctions North Korean defense officials over troop deployment to Russia	The U.K. has imposed sanctions on North Korea’s defense minister and other senior figures linked to the deployment of DPRK troops and weapons to support Russia’s war against Ukraine, following a series of coordinated designations by other Commonwealth countries. But the U.S. stood out by declining to join its allies in announcing new sanctions on ...	https://www.nknews.org/2025/02/uk-sanctions-north-korean-defense-officials-over-troop-deployment-to-russia/	2025-02-24T23:03:58-08:00	https://assets.korearisk.com/uploads/2025/02/No-Kwang-CholBelousov-500x256.png
Kim Jong Un says army obedience top priority as troops fight in Russia’s war	North Korean leader Kim Jong Un delivered a speech on soldier obedience at a top military university on Monday, according to state media, alluding to problems that may be affecting troops fighting for Russia against Ukraine but without directly mentioning the deployment. Kim visited Kim Il Sung University of Politics, located in northern Pyongyang, to ...	https://www.nknews.org/2025/02/kim-jong-un-says-army-obedience-top-priority-as-troops-fight-in-russias-war/	2025-02-24T21:18:30-08:00	https://assets.korearisk.com/uploads/2025/02/kcna-feb25-2025-2k-kju-visits-kispu-kisup-kim-il-sung-university-of-politics-14-500x256.jpg
DPRK supplying half of Russia’s munitions with more arms to come: Ukraine	North Korea supplies half of the artillery munitions Russia uses against Ukraine and more weapons are on the way, according to an assessment from the chief of Kyiv’s intelligence. Kyrylo Budanov, the head of the Defense Intelligence of Ukraine (DIU), said during a press conference marking three years of the war on Sunday that North ...	https://www.nknews.org/2025/02/dprk-supplying-half-of-russias-munitions-with-more-arms-to-come-ukraine/	2025-02-24T00:35:38-08:00	https://assets.korearisk.com/uploads/2024/10/kcna-oct6-2024-2k-kju-drills-o-jin-u-artillery-academy-west-coast-12-500x256.jpg
North Korean fishermen hidden on Chinese trawlers in Indian Ocean for years: NGO	New research has revealed the critical role that international waters play in North Korea’s illegal overseas labor schemes. Traditionally seen as a lifeline to circumvent sanctions imposed for its nuclear and ballistic missile programs, the maritime domain now appears to play a role in the regime’s broader network of clandestine labor operations. Part of this ...	https://www.nknews.org/2025/02/north-korean-fishermen-hidden-on-chinese-trawlers-in-indian-ocean-for-years-ngo/	2025-02-23T23:00:14-08:00	https://assets.korearisk.com/uploads/2025/02/Copy-of-Featured-Image-Empty-4-500x256.png
Russian aircraft lands in North Korea before departing after just two hours	A Russian military aircraft landed at North Korea’s main airport over the weekend, aviation data shows, a month after another foreign jet made a clandestine flight to the DPRK’s capital. The Ilyushin Il-62M operated by the Russian Air Force departed from the Chkalovsky military airbase near Moscow on Friday, marking the first confirmed Russian flight ...	https://www.nknews.org/2025/02/russian-aircraft-lands-in-north-korea-before-departing-after-just-two-hours/	2025-02-23T22:18:40-08:00	https://assets.korearisk.com/uploads/2024/07/4-500x256.jpg
North Korea denounces new sanctions initiative, rejects waivers on sanctions	North Korea has denounced the inaugural meeting of a new multilateral initiative that seeks to ensure stronger enforcement of sanctions against the DPRK, while declaring that it no longer seeks waivers on -anachronistic- sanctions that it views as a violation of its sovereign rights. In a statement issued through the state-owned Korean Central News Agency ...	https://www.nknews.org/2025/02/north-korea-denounces-new-sanctions-initiative-rejects-waivers-on-sanctions/	2025-02-23T21:40:07-08:00	https://assets.korearisk.com/uploads/2025/02/MSMT_ROK-MOFA-20241018-500x256.png
OpenAI bans dozens of accounts tied to North Korean IT workers’ fake job schemes	North Korean overseas IT workers used artificial intelligence (AI) firm OpenAI’s proprietary tools to create job applications and online personas in order to generate foreign currency for the DPRK regime, prompting the U.S. firm to ban dozens of accounts linked to their fraudulent activities. OpenAI said in a press release on Friday that it discovered ...	https://www.nknews.org/2025/02/openai-bans-dozens-of-accounts-tied-to-north-korean-it-workers-fake-job-schemes/	2025-02-23T19:02:39-08:00	https://assets.korearisk.com/uploads/2025/02/KIS-University-AI-research_Tongil-Sinbo-500x256.png
North Korean soldiers adjust tactics after reentering combat in Kursk	North Korean troops have adjusted their tactics in Russia’s Kursk region, reducing the size of their assault groups and exercising greater caution in combat, according to a Ukrainian officer fighting in the area. The change comes as North Korean servicemen have suffered heavy losses and amid Kyiv’s success in hitting a DPRK-made 170mm Koksan self-propelled ...	https://www.nknews.org/2025/02/north-korean-soldiers-adjust-tactics-after-reentering-combat-in-kursk/	2025-02-21T00:18:21-08:00	https://assets.korearisk.com/uploads/2025/02/featured_dmz_officer-500x256.jpg
