Title	Description	Link	pubDate	Image
IAEA chief calls for engagement with North Korea amid nuclear arsenal concerns	The International Atomic Energy Agency (IAEA) seeks to re-engage with North Korea and establish its presence in the country, the organization’s chief said in Tokyo on Thursday, expressing concerns over the DPRK’s de-facto possession of a nuclear arsenal. Director General Rafael Mariano Grossi’s remarks came during a press conference after his talks with Japanese Prime ...	https://www.nknews.org/2025/02/iaea-chief-calls-for-engagement-with-north-korea-amid-nuclear-arsenal-concerns/	2025-02-20T22:38:57-08:00	https://assets.korearisk.com/uploads/2025/02/image-500x256.png
US deploys B-1B bomber in joint air drills with ROK amid North Korean threats	The U.S. and South Korea conducted joint air drills over the Korean Peninsula in response to the escalating nuclear and missile threats from North Korea on Thursday, marking the first time a U.S. A B-1B strategic bomber has been deployed to the region since President Donald Trump took office. The exercises, which represented this year’s ...	https://www.nknews.org/2025/02/us-deploys-b-1b-bomber-in-joint-air-drills-with-rok-amid-north-korean-threats/	2025-02-19T21:59:48-08:00	https://assets.korearisk.com/uploads/2025/02/rok-us-b-1b-500x256.png
South Korea willing to accept North Korean prisoners of war from Ukraine	South Korea has announced that it is willing to accept North Korean troops deployed to support Russia’s war efforts, after a soldier detained by Ukraine reportedly expressed a desire to defect rather than face persecution in the DPRK. In a statement issued on Wednesday, Seoul’s foreign ministry said the ROK government deems North Korean soldiers ...	https://www.nknews.org/2025/02/south-korea-willing-to-accept-north-korean-prisoners-of-war-from-ukraine/	2025-02-19T01:17:27-08:00	https://assets.korearisk.com/uploads/2025/02/North-Korean-soldier-Ri_Telegram-20250111-500x256.png
South Korean officials avoid jail for forced repatriation of DPRK fishermen	A Seoul court on Wednesday handed suspended sentences to four former high-ranking officials from the Moon Jae-in administration for their involvement in the forced repatriation of two North Korean fishermen in 2019. The suspended sentences come despite repeated criticism by NGOs and escapees over the forced repatriation of the two men to the DPRK, where ...	https://www.nknews.org/2025/02/south-korean-officials-avoid-jail-for-forced-repatriation-of-dprk-fishermen/	2025-02-19T01:03:44-08:00	https://assets.korearisk.com/uploads/2022/07/Image-from-iOS-22-500x256.jpg
Trump talks North Korean deaths in Ukraine for first time as US, Russia meet	Large numbers of North Korean soldiers have been killed in -senseless- war against Ukraine, President Donald Trump said in his first mention of DPRK troops since taking office, voicing support for ending the conflict as top U.S. and Russian diplomats held their first talks on the Ukraine peace process. Trump called it -ridiculous- that Russian ...	https://www.nknews.org/2025/02/trump-talks-north-korean-deaths-in-ukraine-for-first-time-as-us-russia-meet/	2025-02-19T00:20:13-08:00	https://assets.korearisk.com/uploads/2025/02/4-4-500x256.jpg
Cyberattack surge on unification ministry raises fears over DPRK-related data	Cyberattacks targeting South Korea’s unification ministry surged nearly threefold in 2024, raising concerns’ about potential leaks of North Korean escapees’ personal information, according to ministry data obtained by NK News. The ministry faced 1,068 cyberattack attempts in 2024, up from 397 in 2023, according to a data report provided to NK News by ruling People ...	https://www.nknews.org/2025/02/cyberattack-surge-on-unification-ministry-raises-fears-over-dprk-related-data/	2025-02-18T22:37:05-08:00	https://assets.korearisk.com/uploads/2025/02/Korea-Internet-Security-Center_KISA-500x256.png
North Korea to reopen to Chinese tourists as Pyongyang marathon revival looms	Chinese tourists are set to visit North Korea for the first time in five years next week, a Beijing-based travel agency announced amid anticipation that the Pyongyang International Marathon will resume in April after being suspended since 2019. The Zhixing Heyi tour company notified clients they could register from Monday for a four-day trip departing ...	https://www.nknews.org/2025/02/north-korea-to-reopen-to-chinese-tourists-as-pyongyang-marathon-revival-looms/	2025-02-18T21:08:31-08:00	https://assets.korearisk.com/uploads/2025/02/50886726176_1e5a876384_k-500x256.jpg
Families of abductees pressure Japan for stronger action against North Korea	The families of Japanese citizens abducted by North Korea have adopted a stronger policy demanding that Tokyo secure the immediate return of all remaining victims, as concerns grow that the abductees’ aging relatives may not live to see their return. At a joint press conference in Tokyo on Sunday, the Association of Families of Victims ...	https://www.nknews.org/2025/02/families-of-abductees-pressure-japan-for-stronger-action-against-north-korea/	2025-02-17T23:29:15-08:00	https://assets.korearisk.com/uploads/2025/02/Japan-abductees_featured-500x256.png
South Korea deploys new missile to counter North Korean artillery threats	South Korea has deployed a new tactical missile system designed to precisely target North Korea’s long-range artillery and command centers in the event of conflict, the Joint Chiefs of Staff announced Tuesday. The Korean Tactical Surface-to-Surface Missile (KTSSM), officially nicknamed -Ure (우레),- meaning thunder, is an advanced precision-guided weapon system designed to quickly neutralize North ...	https://www.nknews.org/2025/02/south-korea-deploys-new-missile-to-counter-north-korean-artillery-threats/	2025-02-17T21:25:22-08:00	https://assets.korearisk.com/uploads/2025/02/1-1-500x256.png
Pyongyang slams US, South Korea, Japan for ‘absurd’ denuclearization push	North Korea’s foreign ministry strongly rejected -outdated and absurd- calls for denuclearization from the top diplomats of the U.S., South Korea and Japan, while reiterating Pyongyang’s intent to strengthen its nuclear capabilities in response to its enemies’ -hostile threats.- In a statement issued through the state-owned Korean Central News Agency on Tuesday, the ministry lambasted ...	https://www.nknews.org/2025/02/pyongyang-slams-us-south-korea-japan-for-absurd-denuclearization-push/	2025-02-17T19:34:33-08:00	https://assets.korearisk.com/uploads/2023/11/PIC0070899-1-500x256.jpg
Three North Korean companies set to export medicinal products to Russia	Three North Korean companies are set to export their products to Russia this year in likely violation of international sanctions, official records show, after multiple DPRK firms sought entry into the Russian market amid rebounding ties in 2024. According to Russia’s Federal Service for Accreditation (FSA), a Moscow-based sole proprietor filed four import declarations in ...	https://www.nknews.org/2025/02/three-north-korean-companies-set-to-export-medicinal-products-to-russia/	2025-02-17T00:11:10-08:00	https://assets.korearisk.com/uploads/2025/02/feature-500x256.jpg
Pyongyang’s ‘rundown and outdated’ neighborhoods to be redeveloped: Kim Jong Un	North Korean leader Kim Jong Un announced that old and deteriorating neighborhoods of Pyongyang will be redeveloped in the coming years, according to state media on Monday, as he signals plans to continue yearly residential skyscraper projects. Kim made the remarks at a ceremony on Sunday kicking off construction of 10,000 homes in Pyongyang’s Hwasong ...	https://www.nknews.org/2025/02/pyongyangs-rundown-and-outdated-neighborhoods-to-be-redeveloped-kim-jong-un/	2025-02-16T22:50:19-08:00	https://assets.korearisk.com/uploads/2025/02/kcna-feb17-2025-2k-kju-hwasong-street-stage4-10k-homes-construction-groundbreaking-ceremony-11-500x256.jpg
Ukraine has ‘completely destroyed’ North Korean units in Kursk says Zelensky	Ukraine has killed all North Korean troops fighting in Russia’s Kursk region, Volodymyr Zelensky said in Munich on Saturday after flagging that Pyongyang is set to send reinforcements to aid Russia’s campaign. In his speech at the Munich Security Conference, the Ukrainian president claimed Russia had lost 20,000 soldiers in the Kursk region alone, with ...	https://www.nknews.org/2025/02/ukraine-has-completely-destroyed-north-korean-units-in-kursk-says-zelensky/	2025-02-16T20:54:41-08:00	https://assets.korearisk.com/uploads/2023/07/aank-war-3-500x256.jpg
US, South Korea, Japan pledge united front on North Korea denuclearization	The top diplomats of the U.S., South Korea and Japan reaffirmed their commitment to North Korea’s complete denuclearization and strengthening trilateral cooperation amid growing concerns over Pyongyang’s military ties with Russia. U.S. Secretary of State Marco Rubio, South Korean Foreign Minister Cho Tae-yul and Japanese Foreign Minister Takeshi Iwaya pledged to work together against Pyongyang’s ...	https://www.nknews.org/2025/02/us-south-korea-japan-pledge-united-front-on-north-korea-denuclearization/	2025-02-16T19:57:51-08:00	https://assets.korearisk.com/uploads/2025/02/US-ROK-Japan-trilateral-ministerial-meet_20250215-500x256.png
US general warns North Korea’s new ICBM could overwhelm country’s defenses	A senior U.S. military commander has warned that North Korea&#8217;s newest intercontinental ballistic missile (ICBM) could pose a direct threat to the U.S. mainland and overwhelm its defenses, marking a significant advancement in Pyongyang&#8217;s nuclear weapons capabilities. Testifying before the Senate Armed Services Committee on Thursday, U.S. Northern Command (USNORTHCOM) and North American Aerospace Defense ...	https://www.nknews.org/2025/02/us-general-warns-north-koreas-new-icbm-could-overwhelm-countrys-defenses/	2025-02-14T01:40:29-08:00	https://assets.korearisk.com/uploads/2025/02/Hwasong-19-launch_KCNA-20241101-500x256.png
North Korea rights groups fear their collapse after Musk pushes US funding cuts	The U.S. Treasury Department has frozen funds of the National Endowment for Democracy (NED), NK News has learned, imperiling groups working to improve North Korean human rights. The freeze is the latest in a series of financial and political shifts which organizations say could decimate advocacy and aid work related to North Korea. NED, a ...	https://www.nknews.org/2025/02/north-korea-rights-groups-fear-their-collapse-after-musk-pushes-us-funding-cuts/	2025-02-14T00:57:45-08:00	https://assets.korearisk.com/uploads/2025/02/Copy-of-Featured-Image-Empty-500x256.png
North Korea slams South’s acting government for driving military ‘confrontation’	North Korea accused South Korea’s acting administration of escalating inter-Korean military confrontation amid ongoing political turmoil in the country, while justifying its own military development as a necessary response to Seoul’s arms buildup and military cooperation with the U.S. The state-owned Korean Central News Agency (KCNA) on Friday criticized South Korea’s recent acquisition of MH-60R ...	https://www.nknews.org/2025/02/north-korea-slams-souths-acting-government-for-driving-military-confrontation/	2025-02-13T19:50:36-08:00	https://assets.korearisk.com/uploads/2025/02/MH-60R-Seahawk-500x256.png
North Korea informs UN agency of plan to cut air traffic communication with ROK	North Korea notified a U.N. aviation organization last year that it plans to cut off an air traffic control communication channel with South Korea starting in 2025, Seoul’s unification ministry said Wednesday. The ministry said Pyongyang informed the International Civil Aviation Organization (ICAO) of its intention to cease operations of the hotline. However, Seoul outlined ...	https://www.nknews.org/2025/02/north-korea-informs-un-agency-of-plan-to-cut-air-traffic-communication-with-rok/	2025-02-13T00:49:46-08:00	https://assets.korearisk.com/uploads/2025/02/Air-traffic-control_ROK-500x256.png
North Korean aviation officials tour leading Russian drone training center	North Korean aviation officials toured a leading Russian drone training center in what experts described as a bid to acquire technology for mass production of military unmanned aerial vehicles. A delegation from the DPRK’s National Aviation Administration visited Russia from Feb. 3-11, touring Moscow State Technical University of Civil Aviation (MSTUCA) and taking part in ...	https://www.nknews.org/2025/02/north-korean-aviation-officials-tour-leading-russian-drone-training-center/	2025-02-13T00:33:31-08:00	https://assets.korearisk.com/uploads/2025/02/5-2-500x256.jpg
Western tour companies enter North Korea for first time since pandemic	Two Western tour companies have entered North Korea for the first time since before the pandemic, potentially paving the way for non-Russian tourists to return to the isolated country after several years of -false starts.- Representatives from Koryo Tours and Young Pioneer Tours (YPT) crossed over the Chinese border to the Rason Special Economic Zone ...	https://www.nknews.org/2025/02/western-tour-companies-enter-north-korea-for-first-time-since-pandemic/	2025-02-12T19:44:07-08:00	https://assets.korearisk.com/uploads/2024/10/tourism-unlikely-to-resume-2024-featured-500x256.jpg
North Korea destroying Inter-Korean Family Reunions Center at Mt Kumgang: ROK	North Korea is dismantling the Inter-Korean Family Reunions Center at the Mount Kumgang tourist region, South Korea’s unification ministry announced on Tuesday. Spokesman Koo Byoung-sam said in a statement that the government confirmed North Korea’s unilateral demolition of the reunion facility, which was designed to host regular meetings between families separated by the Korean War. ...	https://www.nknews.org/2025/02/north-korea-destroying-inter-korean-family-reunions-center-at-mt-kumgang-rok/	2025-02-12T19:39:18-08:00	https://assets.korearisk.com/uploads/2018/08/second-round-reunion_05-500x256.jpg
Trump taps North Korea expert Allison Hooker as under secretary of state	U.S. President Donald Trump nominated Allison Hooker as under secretary of state for political affairs, a seasoned diplomat whose Korea expertise suggests Washington may pursue renewed talks with Pyongyang in the coming months and years, according to experts. Hooker, a veteran Korea specialist, played a key role in past Trump administration negotiations with Pyongyang. Her ...	https://www.nknews.org/2025/02/trump-taps-north-korea-expert-allison-hooker-as-under-secretary-of-state/	2025-02-12T18:41:55-08:00	https://assets.korearisk.com/uploads/2025/02/DvNhGT1X4AEEvlA-935x500-1-500x256.jpeg
North Korean hackers responsible for third of all virtual funds stolen last year	North Korean cybercriminals stole almost $800 million in cryptocurrency in 2024, accounting for more than a third of all stolen virtual funds worldwide last year, according to a U.S. blockchain intelligence firm. The threat posed by DPRK actors was particularly evident in -high-impact operations- as their heists were nearly five times larger than other actors’ ...	https://www.nknews.org/2025/02/north-korean-hackers-responsible-for-third-of-all-virtual-funds-stolen-last-year/	2025-02-11T20:35:28-08:00	https://assets.korearisk.com/uploads/2024/05/North-Korean-women-using-computers-500x256.png
South Korea revises support program for North Korean defectors to expand aid	South Korea has revised support programs for North Korean defectors, eliminating age restrictions for college tuition assistance and expanding access to a government savings program. The revisions to the North Korean Refugees Protection and Settlement Support Act, which took immediate effect as of Tuesday, remove the previous 35-year age limit for higher education subsidies and ...	https://www.nknews.org/2025/02/south-korea-revises-support-program-for-north-korean-defectors-to-expand-aid/	2025-02-11T20:15:47-08:00	https://assets.korearisk.com/uploads/2025/02/nkstudents-500x256.png
Kim Jong Un kicks off construction of major greenhouse farm near Chinese border	North Korean leader Kim Jong Un inaugurated what state media proclaimed as the -largest-ever greenhouse farm- on Monday, underscoring his focus on regional development and the revitalization of an area that suffered widespread flood damage last year. At the groundbreaking ceremony of the 1,112-acre (450 hectares) greenhouse farm and a vegetable science research center in ...	https://www.nknews.org/2025/02/kim-jong-un-kicks-off-construction-of-major-greenhouse-farm-near-chinese-border/	2025-02-10T23:05:40-08:00	https://assets.korearisk.com/uploads/2025/02/KJU-inaugurating-mega-greenhouse-project_KCNA-20250211-500x256.png
North Korea vows to boost nuclear arsenal after US submarine docks in Busan	North Korea vowed to strengthen its nuclear capabilities in response to what it called a -provocation- after a U.S. nuclear-powered submarine docked at a South Korean naval base. In a statement delivered by the Korean Central News Agency on Tuesday, Pyongyang’s defense ministry strongly condemned the arrival of the USS Alexandria (SSN-757), a Los Angeles-class ...	https://www.nknews.org/2025/02/north-korea-vows-to-boost-nuclear-arsenal-after-us-submarine-docks-in-busan/	2025-02-10T20:58:25-08:00	https://assets.korearisk.com/uploads/2025/02/2-500x256.png
Western travel to North Korea on hold as border issues persist	The first scheduled tours for Western tourists to North Korea have been abruptly canceled, tour operators confirmed to NK News on Monday. This reversal comes despite earlier claims of a breakthrough that would have allowed Western travelers to enter the remote Rason area starting in February. The cancellation comes as tour companies have encountered numerous ...	https://www.nknews.org/2025/02/western-travel-to-north-korea-on-hold-as-border-issues-persist/	2025-02-10T01:13:12-08:00	https://assets.korearisk.com/uploads/2021/05/tourism-travel-koryo-500x256.jpg
North Korea sent ‘thousands’ of workers to Russia, South Korea says	North Korea’s dispatch of construction workers to Russia last year is in violation of the United Nations Security Council (UNSC) sanctions, South Korea’s unification ministry on Monday said. The ministry comment was in response to a statement from the National Intelligence Service (NIS) on Sunday that &#8220;North Korea dispatched thousands of workers to construction industry ...	https://www.nknews.org/2025/02/north-korea-sent-thousands-of-workers-to-russia-south-korea-says/	2025-02-10T00:20:53-08:00	https://assets.korearisk.com/uploads/2024/09/Untitled-design-2024-09-10T155351.924-500x256.png
Russian envoy to DPRK says Moscow welcomes talks between US and North Korea	Russia’s ambassador to North Korea has said Moscow would welcome renewed dialogue between the U.S. and the DPRK after Donald Trump&#8217;s return to power, but emphasized that Washington must change its approach for there to be any progress. In a wide-ranging interview with the Russian state-owned newspaper Rossiyskaya Gazeta on Sunday, Ambassador Alexander Matsegora said ...	https://www.nknews.org/2025/02/russian-envoy-to-dprk-says-moscow-welcomes-talks-between-us-and-north-korea/	2025-02-10T00:05:19-08:00	https://assets.korearisk.com/uploads/2025/02/MatsegoraHanoi-Summit-500x256.png
South Korea’s opposition leader calls for renewed dialogue with North Korea	The leader of South Korea’s main opposition party called for renewed dialogue with North Korea on Monday, while emphasizing the need to maintain strong military readiness amid heightened tensions on the Korean Peninsula. Lee Jae-myung, leader of the Democratic Party (DP), said during a speech at the National Assembly’s plenary session that inter-Korean relations could ...	https://www.nknews.org/2025/02/south-koreas-opposition-leader-calls-for-renewed-dialogue-with-north-korea/	2025-02-09T23:12:33-08:00	https://assets.korearisk.com/uploads/2025/02/1-7-500x256.jpg
North Korean troops resume fighting in Russia’s Kursk region, Zelensky says	North Korean troops have been redeployed to fight against Ukrainian forces in Russia’s Kursk region after a brief withdrawal from the frontlines for retraining, Kyiv said, noting their tactics appear as deadly as before. DPRK soldiers have taken part in new assaults against the Ukrainian military near Kursk, President Volodymyr Zelensky said on his social ...	https://www.nknews.org/2025/02/north-korean-troops-resume-fighting-in-russias-kursk-region-zelensky-says/	2025-02-09T23:04:29-08:00	https://assets.korearisk.com/uploads/2025/02/Featured-500x256.jpg
Kim calls for stronger combat readiness while pledging support for Russia’s war	North Korean leader Kim Jong Un accused the U.S. of fueling tensions on the Korean Peninsula and provoking conflicts worldwide, reaffirming Pyongyang’s -unlimited defense buildup- during a visit to the country’s defense ministry on Saturday. He also pledged support for Russia’s war against Ukraine. Kim stressed that the DPRK must further boost its -military readiness ...	https://www.nknews.org/2025/02/kim-calls-for-stronger-combat-readiness-while-pledging-support-for-russias-war/	2025-02-08T14:53:16-08:00	https://assets.korearisk.com/uploads/2025/02/5-1-500x256.jpg
Trump, Ishiba call for North Korea’s denuclearization amid DPRK resistance	The U.S. and Japan will push for the -complete denuclearization- of North Korea, President Donald Trump and Prime Minister Shigeru Ishiba said on Friday as Trump touted his rapport with DPRK leader Kim Jong Un amid Pyongyang’s repeated refusal to give up nukes. During their first summit in Washington, Trump and Ishiba -expressed serious concerns ...	https://www.nknews.org/2025/02/trump-ishiba-call-for-north-koreas-denuclearization-amid-dprk-resistance/	2025-02-07T21:54:12-08:00	https://assets.korearisk.com/uploads/2025/02/Trump-Ishiba-500x256.jpg
North Korean GPS jamming blamed for crash of South Korean military drone	North Korea’s GPS jamming was responsible for a South Korean military surveillance drone’s crash in November last year, according to local media reports Friday, an incident that one expert told NK News signals Pyongyang has made significant strides in its electronic warfare technology. However Seoul’s defense ministry insisted the drones are operating normally and reconnaissance ...	https://www.nknews.org/2025/02/north-korean-gps-jamming-blamed-for-crash-of-south-korean-military-drone/	2025-02-07T00:19:46-08:00	https://assets.korearisk.com/uploads/2025/02/2-3-500x256.jpg
Kim Jong Un scales back scope of hospital construction at new project launch	North Korean leader Kim Jong Un kicked off a project to build three new hospitals on Thursday, according to state media, indicating the scope of public health facility construction this year will be smaller in scale than previously suggested amid long delays opening other new hospitals. But the commencement of the project nonetheless signals Kim ...	https://www.nknews.org/2025/02/kim-jong-un-scales-back-scope-of-hospital-construction-at-new-project-launch/	2025-02-07T00:14:39-08:00	https://assets.korearisk.com/uploads/2025/02/kcna-feb7-2025-2k-kju-groundbreaking-ceremony-20x10-rural-dev-project-hospital-culture-center-kangdong-gun-8-500x256.jpg
Ukraine says DPRK forces have withdrawn from Kursk, but Kyiv’s top spy disagrees	North Korean troops have reportedly withdrawn from Russia’s Kursk region, but Kyiv’s top spy insists DPRK soldiers are still fighting against Ukraine, with experts citing strategic regrouping, poor intelligence or -panic- over Donald Trump’s return as reasons for the conflicting messages. Reports about North Korean soldiers being withdrawn from combat first emerged last month, with ...	https://www.nknews.org/2025/02/ukraine-says-dprk-forces-have-withdrawn-from-kursk-but-kyivs-top-spy-disagrees/	2025-02-06T19:48:53-08:00	https://assets.korearisk.com/uploads/2025/02/1-2-1-500x256.jpg
UN office urges NGOs to improve North Korean human rights record keeping	The United Nation’s office for human rights is urging civic groups to better coordinate and standardize their efforts to record violations in North Korea, warning that a &#8220;proliferation&#8221; of separate databases could hamper consistency in record keeping. In a new report, the Office of the High Commissioner for Human Rights (OHCHclaR) on Thursday said groups ...	https://www.nknews.org/2025/02/un-office-urges-ngos-to-improve-north-korean-human-rights-record-keeping/	2025-02-05T23:55:38-08:00	https://assets.korearisk.com/uploads/2025/02/Copy-of-Featured-Image-Empty-66-500x256.png
Beijing’s ambassador to North Korea calls for return of Chinese tourists	Beijing’s ambassador to North Korea expressed hope for the return of Chinese tourists to Pyongyang on Monday, according to the embassy’s website, after a five-year absence of tour groups from the DPRK’s northern neighbor. Ambassador Wang Yajun -hopes that more Chinese tourists will visit the Pyongyang Metro in the future- — a -key tourist attraction ...	https://www.nknews.org/2025/02/beijings-ambassador-to-north-korea-calls-for-return-of-chinese-tourists/	2025-02-04T23:49:04-08:00	https://assets.korearisk.com/uploads/2025/02/chinese-embassy-feb4-2025-tour-trip-pyongyang-metro-amb-wang-yajun-5-kaeson-station-interior-hall-500x256.jpg
