Title	Description	Link	pubDate	Image
Zelensky is ready to talk with Putin if the USA and Europe do not 'abandon' Ukraine	Зеленський готовий говорити з Путіним, якщо США і Європа 'не кинуть' Україну		2025-02-09T07:34:54-08:00	
Zelensky: If we suspend martial law for the sake of elections, we will lose the army	Зеленський: Якщо ми призупинимо воєнний стан задля виборів, то втратимо армію		2025-02-09T07:10:50-08:00	
The times of political pressure are over': the Baltic countries have finally synchronized their energy s...	Часи політичного тиску закінчилися': Країни Балтії остаточно синхронізували свої енергосистеми з Європою		2025-02-09T05:53:45-08:00	
Fake business trips of officials abroad, Trump and Ukrainian minerals, liquidation of the man Yanukovych ...	Фейкові відрядження чиновників за кордон, Трамп і українські копалини, ліквідація людини Януковича – УП Тиждень		2025-02-09T05:25:43-08:00	
The police told how a Lviv man who was picked up by the TCC could end up with injuries on the highway	В поліції розповіли, як львів’янин, якого забрав ТЦК, міг опинитись з травмами на трасі		2025-02-09T04:53:43-08:00	
An employee of Lviv University who was taken away by the TCC was found on the highway: the military expla...	На трасі знайшли співробітника Львівського університету, якого забрав ТЦК: військові пояснили ситуацію		2025-02-09T03:57:45-08:00	
The Sunday Times wrote about the connection of Kulinich, suspected of treason, with the American 'lobbyis...	The Sunday Times написала про зв'язок підозрюваного в держзраді Кулініча з американським 'лобістом Зеленського'		2025-02-09T03:33:00-08:00	
Ukraine is increasing gas imports from the EU	Україна нарощує імпорт газу з ЄС		2025-02-09T01:08:36-08:00	
The Kremlin said that they could neither confirm nor deny the conversation between Trump and Putin	У Кремлі заявили, що не можуть ні підтвердити, ні спростувати розмову Трампа і Путіна		2025-02-09T00:32:18-08:00	
At night, 151 attack UAVs attacked Ukraine: air defense shot down 70 drones	Вночі Україну атакував 151 ударний БпЛА: ППО збила 70 безпілотників		2025-02-08T23:13:32-08:00	
Media: Trump spoke on the phone with Putin about the war in Ukraine	ЗМІ: Трамп говорив телефоном з Путіним про війну в Україні		2025-02-08T20:30:50-08:00	
North Korea is using the war in Ukraine to test its military potential - ISW	Північна Корея використовує війну в Україні для випробування свого військового потенціалу – ISW		2025-02-08T16:42:44-08:00	
It became known who will represent Ukraine at Eurovision 2025	Стало відомо, хто представить Україну на Євробаченні 2025		2025-02-08T13:07:08-08:00	
The Russians and North Koreans went on the offensive again in Kurshchyna, changing their tactics - 47 OMB...	Росіяни з КНДРівцями знову пішли в штурм на Курщині, змінивши тактику – 47 ОМБр		2025-02-08T10:50:22-08:00	
The head of the NATO Military Committee came to Ukraine: he met with Zelenskyi and Syrskyi	Голова Військового комітету НАТО приїхав в Україну: зустрівся з Зеленським і Сирським		2025-02-08T10:10:30-08:00	
North Korea to start production of drones developed together with Russia - NHK	КНДР почне виробництво безпілотників, розроблених разом з Росією – NHK		2025-02-08T07:46:30-08:00	
Defense forces shot down a Russian Su-25 and damaged a helicopter - 28 OMBr	Сили оборони збили російський Су-25 і пошкодили гелікоптер – 28 ОМБр		2025-02-08T07:10:00-08:00	
Zelensky: Putin is preparing to continue the war, and not only against Ukraine	Зеленський: Путін готується до продовження війни, причому не тільки проти України		2025-02-08T06:57:06-08:00	
Syrsky talked about his year in office: 377 objects in the territory of the Russian Federation were affec...	Сирський розповів про рік на посаді: уражено 377 об'єктів на території РФ		2025-02-08T06:40:35-08:00	
Ukrainian forces hit the control post in Kurshchyna: killed 20 officers - Zelenskyi	Українські сили ударили по пункту управління на Курщині: знищили 20 офіцерів – Зеленський		2025-02-08T05:25:20-08:00	
The prosecutor of the International Criminal Court, who issued a warrant for Putin's arrest, was included...	У санкційний список Трампа потрапив прокурор МКС, який видав ордер на арешт Путіна – ЗМІ		2025-02-08T04:52:28-08:00	
Scholz: The debate about peacekeepers in Ukraine is inappropriate and premature	Шольц: Дебати про миротворців в Україні недоречні і передчасні		2025-02-08T03:39:29-08:00	
Russia seized less than 20% of Ukraine's minerals - Zelenskyi	Росія захопила менше 20% корисних копалин України – Зеленський		2025-02-08T03:21:08-08:00	
All Baltic countries have officially disconnected from the Russian energy system	Усі країни Балтії офіційно від’єдналися від російської енергосистеми		2025-02-08T02:49:33-08:00	
A failure has occurred in 'Reserve+'	У 'Резерв+' стався збій		2025-02-08T01:45:08-08:00	
Lithuania and Latvia disconnected from the Russian energy system	Литва та Латвія відключилися від російської енергосистеми		2025-02-08T00:45:04-08:00	
Zelenskyi: The Ministry of Defense is developing a special contract for Ukrainians aged 18-24	Зеленський: Міноборони розробляє спецконтракт для українців 18-24 років		2025-02-07T23:59:19-08:00	
The Russians attacked Ukraine with 139 drones, 67 were shot down	Росіяни атакували Україну 139-ма безпілотниками, 67 вдалося збити		2025-02-07T23:34:57-08:00	
Trump revoked Biden's access to classified information	Трамп анулював доступ Байдена до секретної інформації		2025-02-07T18:54:04-08:00	
The Kremlin hides the extent of the negative impact on the Russian economy due to the war in Ukraine - IS...	Кремль приховує ступінь негативного впливу на економіку РФ через війну в Україні – ISW		2025-02-07T18:12:34-08:00	
Zelensky confirmed the new advance of Ukrainian troops in the Kursk region	Зеленський підтвердив нове просування українських військ у Курській області		2025-02-07T13:33:23-08:00	
After Trump's statement about the meeting, Zelensky announced weeks full of diplomacy	Після заяви Трампа про зустріч Зеленський анонсував насичені дипломатією тижні		2025-02-07T12:01:32-08:00	
Beating of a young man in the capital: four participants of the attack were informed of suspicion	Побиття юнака у столиці: чотирьом учасникам нападу повідомили про підозру		2025-02-07T11:22:03-08:00	
Zelensky said that he agrees to share minerals with the United States	Зеленський заявив, що згоден ділитися корисними копалинами із США		2025-02-07T11:06:08-08:00	
Zelenskyi: The Russian Federation again pulled North Korean soldiers into the Kursk region	Зеленський: РФ знову підтягнула північнокорейських солдатів у Курську область		2025-02-07T10:35:52-08:00	
Trump announced a meeting with Zelenskyi and a conversation with Putin	Трамп анонсував зустріч із Зеленським і розмову з Путіним		2025-02-07T10:10:34-08:00	
Klitschko's deputy was sent to custody in the case of land fraud in Kyiv	Заступника Кличка відправили під варту у справі про земельні махінації в Києві		2025-02-07T10:06:02-08:00	
In Slovakia, protests against Fico's government began again	У Словаччині знову почалися протести проти уряду Фіцо		2025-02-07T09:04:20-08:00	
The case of Komarnytskyi: the deputy of the Kyiv City Council was taken into custody and bail was set	Справа Комарницького: депутата Київради взяли під варту і встановили заставу		2025-02-07T07:50:30-08:00	
Trump declared an 'unheard of level of corruption' in USAID: 'Close this structure!'	Трамп заявив про 'нечуваний рівень корупції' у USAID: 'Закрити цю структуру!'		2025-02-07T07:48:32-08:00	
DeepState: The center of Toretsk is almost occupied, fighting continues in the city	DeepState: Центр Торецька майже окупований, у місті тривають бої		2025-02-07T06:51:59-08:00	
Against the background of subversive explosions, security measures were strengthened in the TCC and milit...	На тлі диверсійних підривів у ТЦК та військових частинах посилили заходи безпеки		2025-02-07T06:09:12-08:00	
British intelligence noted a slowdown in the Russian advance in January	Британська розвідка відзначила сповільнення російського просування у січні		2025-02-07T05:18:00-08:00	
The Defense Forces shot down an anti-aircraft missile defense system over Zaporizhzhia: the Air Force say...	Сили оборони збили КАБ над Запоріжжям: у Повітряних силах кажуть – не вперше		2025-02-07T04:43:48-08:00	
Rape of a 14-year-old girl in Transcarpathia: the perpetrators received real imprisonment	Зґвалтування 14-річної дівчинки на Закарпатті: кривдники отримали реальне ув'язнення		2025-02-07T04:20:16-08:00	
Ukraine already has preliminary decisions regarding programs financed by USAID - Stefanyshyn	Україна вже має попередні рішення щодо програм, які фінансувалися USAID – Стефанішина		2025-02-07T04:15:38-08:00	
Stefanishyna commented on the idea of ​​Ukraine joining the EU without NATO under the terms of a peace ag...	Стефанішина прокоментувала ідею про вступ України в ЄС без НАТО за умовами мирної угоди		2025-02-07T03:48:20-08:00	
Stefanchuk: 37 People's Deputies went to the USA to establish contacts. At your own expense	Стефанчук: Для налагодження контактів до США поїхали 37 нардепів. За власний кошт		2025-02-07T02:25:51-08:00	
A 32-year-old man from Bukovyna died in the TCC: the police are investigating the circumstances	У ТЦК помер 32-річний буковинець: поліція з'ясовує обставини		2025-02-07T01:46:44-08:00	
Kellogg: A pragmatic approach is needed to resolve the war in Ukraine	Келлог: Для врегулювання війни в Україні потрібен прагматичний підхід		2025-02-07T00:23:25-08:00	
A child died in the Kharkiv region from the explosion of an unknown object	На Харківщині від вибуху невідомого предмета загинула дитина		2025-02-06T23:55:04-08:00	
Russia attacked Ukraine with 112 drones: 81 drones were shot down, 31 were lost to location	Росія атакувала Україну 112 безпілотниками: 81 дрон збили, 31 – локаційно втрачений		2025-02-06T23:28:18-08:00	
ISW: The Armed Forces in Kurshchyna advanced 5 km behind the Russian defense line	ISW: ЗСУ на Курщині просунулись на 5 км за лінії оборони росіян		2025-02-06T23:26:28-08:00	
Trump is ready to double sanctions against Russia - Kellogg	Трамп готовий подвоїти санкції проти Росії – Келлог		2025-02-06T22:14:50-08:00	
40-hour flight to India: Deportees from the US were kept in shackles the entire flight	40-годинний рейс до Індії: депортованих зі США тримали в кайданах весь політ		2025-02-06T20:20:19-08:00	
A survey in Russia showed high public support for the war against Ukraine - ISW	Опитування в Росії показало високу підтримку суспільством війни проти України – ISW		2025-02-06T18:00:20-08:00	
Trump introduced sanctions against the International Criminal Court	Трамп запровадив санкції проти Міжнародного кримінального суду		2025-02-06T17:06:55-08:00	
The occupier, involved in the mass murders in the Kyiv region, was appointed deputy minister in Russia	Окупанта, причетного до масових вбивств на Київщині, у Росії призначили заступником міністра		2025-02-06T15:28:40-08:00	
Anti-aircraft defense against Russian drones operates in Kyiv and the region	У Києві та області працює ППО по російських безпілотниках		2025-02-06T13:05:34-08:00	
The singer Povaliy will be tried for collaborationism	Співачку Повалій судитимуть за колабораціонізм		2025-02-06T11:30:56-08:00	
Trump's representative: Wartime elections are a sign of a healthy democracy	Представник Трампа: Вибори під час війни – ознака здорової демократії		2025-02-06T10:16:37-08:00	
Watcher' for Kyiv and Klitschko's deputy were informed of suspicions: NABU revealed the details	Смотрящому' за Києвом та заступнику Кличка повідомили підозри: НАБУ розповіло деталі		2025-02-06T09:58:52-08:00	
Trump plans to impose sanctions on the International Criminal Court - Reuters	Трамп планує накласти санкції на Міжнародний кримінальний суд – Reuters		2025-02-06T09:10:02-08:00	
The Air Force received a new batch of F-16 fighters from the Netherlands	Повітряні сили отримали нову партію винищувачів F-16 від Нідерландів		2025-02-06T09:06:57-08:00	
Half of the Council at the Prayer Breakfast: Zelenskyi criticized deputies for frequent business trips	Половина Ради на Молитовному сніданку: Зеленський розкритикував депутатів за часті відрядження		2025-02-06T08:56:39-08:00	
AMCU allowed 'Kyivstar' to purchase Uklon	АМКУ дозволив 'Київстару' придбати Uklon		2025-02-06T08:33:28-08:00	
The fugitive People's Deputy appeared at the meeting of the Rada committee online	Нардеп-утікач з'явився на засіданні комітету Ради онлайн		2025-02-06T08:15:49-08:00	
Dialogue is medicine': the Pope called on Ukrainian youth to 'forgive enemies' for the sake of peace	Ліками є діалог': Папа Римський закликав українську молодь 'прощати ворогів' заради миру		2025-02-06T06:55:30-08:00	
Ukrainians are more afraid of rising prices than the occupation of territories - survey	Українці бояться зростання цін більше, ніж окупації територій – опитування		2025-02-06T06:31:17-08:00	
Trump's representative denied the announcement of the media: there will be no presentation of the 'peace ...	Представник Трампа спростував анонс ЗМІ: презентації 'мирного плану' в Мюнхені не буде		2025-02-06T05:59:00-08:00	
The service for a mobilized person begins on the day of sending to the army, not after taking the oath - ...	Служба для мобілізованого починається в день відправлення до в/ч, а не після присяги – Верховний суд		2025-02-06T05:19:28-08:00	
Autogas imports have fallen to a minimum since May 2022	Імпорт автогазу обвалився до мінімуму з травня 2022 року		2025-02-06T04:50:18-08:00	
Trump confirmed his 'appetite' for Gaza: 'Israel could hand over the sector after the fighting ends'	Трамп підтвердив свій 'апетит' щодо Гази: 'Ізраїль міг би передати сектор після завершення боїв'		2025-02-06T04:28:22-08:00	
Will preside instead of the USA: Britain has officially confirmed that it will convene 'Rammstein'	Головуватиме замість США: Британія офіційно підтвердила, що скликає 'Рамштайн'		2025-02-06T03:29:29-08:00	
Trump reacted to Zelenskyi's idea of ​​giving Ukraine nuclear weapons	У Трампа відреагували на ідею Зеленського дати Україні ядерну зброю		2025-02-06T03:12:48-08:00	
Ukrenergo explained why emergency power outages began in Ukraine	В 'Укренерго' пояснили, чому почалися аварійні відключення світла в Україні		2025-02-06T02:26:30-08:00	
Minister of Defense of France: The first Mirage fighters are already in Ukraine	Міністр оборони Франції: Перші винищувачі Mirage вже в Україні		2025-02-06T02:18:56-08:00	
In Poland, a team is being formed to carry out exhumations in the Ternopil region	У Польщі формують команду для проведення ексгумацій на Тернопільщині		2025-02-06T01:30:46-08:00	
DBR: Officials embezzled more than UAH 100 million for the purchase of firewood for the Armed Forces	ДБР: Посадовці розікрали понад 100 млн грн на закупівлі дров для ЗСУ		2025-02-06T00:48:10-08:00	
Ukrenergo' introduced emergency shutdowns in 8 regions	Укренерго' запровадило аварійні відключення у 8 областях		2025-02-06T00:45:53-08:00	
An air alert was announced throughout Ukraine due to the threat of ballistics	По всій Україні оголошували повітряну тривогу через загрозу балістики		2025-02-06T00:36:25-08:00	
NABU conducts searches of the 'watcher' outside Kyiv	НАБУ проводить обшуки у 'смотрящого' за Києвом		2025-02-06T00:18:50-08:00	
Reuters: The accuracy of North Korea's missiles has increased significantly in recent months after 'train...	Reuters: Точність ракет КНДР останніми місяцями значно зросла після 'тренувань' на полі бою		2025-02-06T00:11:26-08:00	
The EU is investigating the role of the Russians in the procurement of software for the secret border sys...	ЄС розслідує роль росіян у закупівлі софту для секретної прикордонної системи – FT		2025-02-05T23:38:28-08:00	
On the night of February 6, the Russian Federation attacked with 77 drones: 56 were shot down by air defe...	В ніч на 6 лютого РФ атакувала 77 дронами: 56 збила ППО, постраждали три області		2025-02-05T23:20:22-08:00	
During the 6 months of the Kursk operation, the Armed Forces of Ukraine withdrew almost 40,000 occupiers ...	За 6 місяців Курської операції ЗСУ відмінусували майже 40 тисяч окупантів – Генштаб		2025-02-05T23:17:40-08:00	
Drones hit the Russian airfield, from where the occupiers launch 'Shahedy' - General Staff	Дрони уразили російський аеродром, звідки окупанти запускають 'Шахеди' – Генштаб		2025-02-05T22:01:35-08:00	
Court suspends Trump's executive order to revoke birthright citizenship	Суд призупинив указ Трампа про скасування видачі громадянства за правом народження		2025-02-05T20:59:40-08:00	
Russia denies the sovereignty of Ukraine and emphasizes the need for further annexation - ISW	Росія заперечує суверенітет України та наголошує на необхідності подальшої анексії – ISW		2025-02-05T19:25:26-08:00	
German activists sued social network X for obstructing the monitoring of disinformation	Німецькі активісти подали до суду на соцмережу X за перешкоджання моніторингу дезінформації		2025-02-05T18:25:49-08:00	
UAVs attacked the airfield in Primorsko-Akhtarsk, from where Russia launches 'Shahedy' over Ukraine	БпЛА атакували аеродром у Приморсько-Ахтарську, звідки Росія запускає 'Шахеди' по Україні		2025-02-05T16:43:53-08:00	
The Russians are trying to gain a foothold on the right bank of the Oskil River in Kharkiv Oblast - DeepS...	Росіяни намагаються закріпитися на правому березі річки Оскіл на Харківщині – DeepState		2025-02-05T16:07:30-08:00	
Trump signed an executive order banning transgender athletes from competing in women's competitions	Трамп підписав указ про заборону трансгендерним спортсменам брати участь у жіночих змаганнях		2025-02-05T15:08:29-08:00	
The Russians hit one of the largest markets in Kharkiv with a drone	Росіяни вдарили безпілотником по одному з найбільших ринків у Харкові		2025-02-05T13:36:21-08:00	
The Cabinet of Ministers must find new sources of international aid: Zelensky signed the decree	Кабмін має знайти нові джерела міжнародної допомоги: Зеленський підписав указ		2025-02-05T12:32:38-08:00	
The troops of the Russian Federation attacked Odesa with a missile, there is a dead person	Війська РФ атакували Одещину ракетою, є загиблий		2025-02-05T12:09:37-08:00	
Ukraine introduced sanctions against the shadow fleet of the Russian Federation and kidnappers of Ukraini...	Україна ввела санкції проти тіньового флоту РФ і викрадачів української культури		2025-02-05T11:28:56-08:00	
The EU is preparing a response to Trump's tariffs: American tech giants are under attack	ЄС готує відповідь на мита Трампа: під ударом американські техногіганти		2025-02-05T10:41:55-08:00	
Bloomberg: Trump's peace plan can be presented as early as next week	Bloomberg: Мирний план Трампа можуть представити вже наступного тижня		2025-02-05T09:00:11-08:00	
Media: The next 'Ramstein' in February will not be chaired by the USA	ЗМІ: На наступному 'Рамштайні' в лютому головуватимуть не США		2025-02-05T07:54:01-08:00	
Zelensky: You will see the conditions of the Russian Federation regarding Kurshchyna when it comes to pea...	Зеленський: Ви ще побачите умови РФ щодо Курщини, коли дійде до переговорів про мир		2025-02-05T07:33:27-08:00	
An explosion near the TCC in Kamianets-Podilskyi: a man who brought a 'transfer' with explosives was kill...	Підрив біля ТЦК у Кам'янці-Подільському: загинув чоловік, який приніс 'передачу' з вибухівкою		2025-02-05T06:09:58-08:00	
Ukraine returned 150 defenders from Russian captivity	Україна повернула з російського полону 150 захисників		2025-02-05T05:23:23-08:00	
Zelensky extended martial law and mobilization until May 9	Зеленський продовжив воєнний стан і мобілізацію до 9 травня		2025-02-05T05:19:48-08:00	
