Title	Description	Link	pubDate	Image
An explosion thundered near the TCC in Kamianets-Podilskyi: the media reported on the victim	Вибух прогримів біля ТЦК у Кам'янці-Подільському: ЗМІ повідомляють про жертву		2025-02-05T04:09:58-08:00	
Deep State: The number of assault attacks by Russians falls for the seventh day in a row	Deep State: Кількість штурмових атак росіян падає сьомий день поспіль		2025-02-05T03:54:35-08:00	
The Pentagon is developing plans and determining the time for the withdrawal of all American troops from ...	Пентагон розробляє плани і визначає час виведення всіх американських військ із Сирії – ЗМІ		2025-02-05T03:53:55-08:00	
Putin declared that they are open to negotiations, despite the 'problem' with Zelensky's legitimacy	У Путіна заявили, що відкриті до переговорів, попри 'проблеми' з легітимністю Зеленського		2025-02-05T03:30:02-08:00	
The SBU found out the circumstances of the explosion in the TCC of Rivne: the Russians remotely blew up t...	СБУ з'ясувала обставини вибуху в ТЦК Рівного: росіяни дистанційно підірвали свого терориста		2025-02-05T03:14:58-08:00	
Ukrainian paratroopers captured more than 20 soldiers of the Russian Federation in Kurshchyna	Українські десантники на Курщині захопили в полон понад 20 військових РФ		2025-02-05T02:32:49-08:00	
The Kremlin confirmed contacts with Trump's team, announcing their intensification	У Кремлі підтвердили контакти з командою Трампа, заявивши про їхню інтенсифікацію		2025-02-05T02:12:39-08:00	
The defense forces targeted the Russian oil refinery and the Buk air defense system - General Staff	Сили оборони поцілили по російському нафтопереробному підприємству та ЗРК 'Бук' – Генштаб		2025-02-05T02:04:44-08:00	
Explosion near the TCC in Pavlohrad: law enforcement officers detained 3 bombers	Вибух біля ТЦК у Павлограді: правоохоронці затримали 3 підривників		2025-02-05T01:45:04-08:00	
This is not charity: Rubio believes that USAID's international aid should be in line with US national int...	Це не благодійність: Рубіо вважає, що міжнародна допомога USAID має відповідати націнтересам США		2025-02-05T01:34:05-08:00	
In Odesa, a woman and her child fell from the 16th floor and died	В Одесі жінка з дитиною впали з 16-го поверху і загинули		2025-02-05T01:04:35-08:00	
The driver was disqualified for the first time for violating the rules of military registration	Водія вперше позбавили прав за порушення правил військового обліку		2025-02-05T00:56:42-08:00	
Zelensky: Elections will be held after martial law is lifted	Зеленський: Вибори відбудуться після скасування воєнного стану		2025-02-04T23:36:55-08:00	
Anti-aircraft battle on February 5: Air defense shot down 57 attack drones in 9 regions	Протиповітряний бій 5 лютого: ППО збила 57 ударних дронів у 9 областях		2025-02-04T23:22:53-08:00	
Trump has threatened Iran with destruction if he is killed	Трамп пригрозив Ірану знищенням, якщо його уб’ють		2025-02-04T22:26:44-08:00	
Trump assures that the US is conducting 'very constructive negotiations' regarding Ukraine	Трамп запевняє, що США ведуть 'дуже конструктивні переговори' щодо України		2025-02-04T21:42:13-08:00	
Trump said that the US will 'take control' of the Gaza Strip	Трамп заявив, що США 'візьмуть під свій контроль' сектор Гази		2025-02-04T17:36:30-08:00	
The enemy attacked Kharkiv with 'Shakheds', the mayor reported on the arrivals and fires	Ворог атакував Харків 'Шахедами', мер повідомив про прильоти і пожежі		2025-02-04T16:54:10-08:00	
Zelensky: More than 45,000 Ukrainian soldiers died in the war against Russia	Зеленський: У війні проти Росії загинули понад 45 тисяч українських військових		2025-02-04T13:15:16-08:00	
Zelensky: I am ready to sit down at the negotiating table with Putin, if this is the only option	Зеленський: Я готовий сісти за стіл переговорів з Путіним, якщо це буде єдиний варіант		2025-02-04T12:49:12-08:00	
Source: In 2025, a tribunal will be created for Putin on the basis of the Council of Europe	Джерело: У 2025 для Путіна буде створений трибунал на базі Ради Європи		2025-02-04T10:25:49-08:00	
Azerbaijan received evidence that its plane was shot down by a Russian missile - mass media	Азербайджан отримав докази, що його літак збила російська ракета – ЗМІ		2025-02-04T09:53:07-08:00	
Zelensky reacted to Trump's offer to give Ukraine weapons in exchange for minerals	Зеленський відреагував на пропозицію Трампа давати Україні зброю в обмін на корисні копалини		2025-02-04T09:46:58-08:00	
Zelensky: If you do not take Ukraine into NATO, then give nuclear weapons	Зеленський: Якщо не берете Україну в НАТО, то дайте ядерну зброю		2025-02-04T08:49:12-08:00	
The OP discussed the future personal contacts of Trump and Zelensky with the US administration	В ОП обговорили з адміністрацією США майбутні особисті контакти Трампа і Зеленського		2025-02-04T08:36:07-08:00	
Russia has taken hostage two employees of ZNPP - Zelenskyi	Росія взяла у заручники двох працівників ЗАЕС – Зеленський		2025-02-04T08:30:48-08:00	
In the Rivne region, local residents blocked the checkpoint: what are they demanding	На Рівненщині місцеві мешканці блокували КПП: чого вимагають		2025-02-04T07:41:52-08:00	
Two-thirds of Germans support military aid to Ukraine - survey	Дві третини німців за військову допомогу Україні – опитування		2025-02-04T06:57:20-08:00	
The Air Force hit the Russian command post in Kurshchyna: the enemy suffered losses	Повітряні сили уразили пункт управління росіян на Курщині: ворог зазнав втрат		2025-02-04T06:43:48-08:00	
Markarova: Ukraine is ready to discuss holding elections by the end of 2025	Маркарова: Україна готова обговорювати проведення виборів до кінця 2025 року		2025-02-04T05:33:24-08:00	
The council opened a historic session, but could not adopt a work plan	Рада відкрила історичну сесію, але не змогла прийняти план роботи		2025-02-04T04:31:59-08:00	
The number of opponents of providing military aid to Ukraine has increased in Poland - survey	У Польщі зросла кількість противників надання військової допомоги Україні – опитування		2025-02-04T03:15:37-08:00	
The occupiers hit Izyum with ballistics - 4 dead, 20 wounded	Окупанти вдарили балістикою по Ізюму – 4 загиблих, 20 поранених		2025-02-04T02:19:54-08:00	
The EU will allocate 250 million euros for energy aid to Moldova, of which 60 million euros will go to Tr...	ЄС виділить Молдові 250 млн євро на енергодопомогу, з них 60 млн євро – Придністров’ю		2025-02-04T02:15:27-08:00	
The fitness trainer who insulted the military and spat at a veteran was sentenced to 6 years in prison	Фітнес-тренера, який ображав військових і плюнув у ветерана, засудили до 6 років ув’язнення		2025-02-04T01:45:52-08:00	
The Kremlin did not like Trump's offer to help Ukraine in exchange for resources	Кремлю не сподобалась пропозиція Трампа про допомогу Україні в обмін на ресурси		2025-02-04T01:41:32-08:00	
Ex-chancellor of Germany Schroeder was hospitalized due to 'burnout'	Ексканцлер Німеччини Шредер потрапив до лікарні через 'вигорання'		2025-02-04T01:28:00-08:00	
Energy companies introduced emergency shutdowns in 8 regions of Ukraine	Енергетики запровадили аварійні відключення у 8 областях України		2025-02-04T00:19:43-08:00	
About 50,000 are being transferred to the Ground Forces. military personnel of all branches of the milita...	До Сухопутних військ переводять близько 50 тис. військових усіх родів військ – джерело УП		2025-02-04T00:08:32-08:00	
Russia attacked Ukraine with 65 drones: 37 drones were shot down, 28 were lost to location	Росія атакувала Україну 65 безпілотниками: 37 дронів збили, 28 – локаційно втрачені		2025-02-03T23:41:12-08:00	
In Donetsk region and Dnipropetrovsk region, emergency shutdowns were applied - DTEK	На Донеччині і Дніпропетровщині застосували екстрені відключення – ДТЕК		2025-02-03T23:03:43-08:00	
China is retaliating with tariffs on US goods and will investigate Google	Китай вводить мита у відповідь на товари зі США і проведе розслідування щодо Google		2025-02-03T22:40:40-08:00	
Having reduced the pace of the advance in Ukraine, the Russians continue to suffer significant losses - I...	Знизивши темп просування в Україні, росіяни продовжують зазнавати значних втрат – ISW		2025-02-03T18:38:40-08:00	
Trudeau: The US will postpone customs tariffs on imports from Canada for a month	Трюдо: США відкладуть на місяць митні тарифи на імпорт з Канади		2025-02-03T15:52:52-08:00	
Reuters: The Trump administration briefly halted arms shipments to Ukraine	Reuters: Адміністрація Трампа ненадовго зупиняла поставки зброї в Україну		2025-02-03T12:42:17-08:00	
Trump wants a 'deal' with Ukraine to supply weapons in exchange for minerals	Трамп хоче 'угоду' з Україною про постачання зброї в обмін на корисні копалини		2025-02-03T11:44:31-08:00	
Trump officially appointed Kellogg as special representative for Ukraine	Трамп офіційно призначив Келлога спецпредставником з питань України		2025-02-03T11:15:17-08:00	
The USAID agency came under the control of the US State Department	Агенція USAID перейшла під контроль Держдепу США		2025-02-03T10:50:13-08:00	
Zelensky approved the plan for the transition to a new organizational structure of the Armed Forces and t...	Зеленський затвердив план переходу на нову організаційну структуру ЗСУ й створення корпусів		2025-02-03T10:28:53-08:00	
They planned a terrorist attack near the police headquarters: two agents of the Russian Federation were d...	Планували теракт біля управління поліції: у Рівному затримали двох агентів РФ		2025-02-03T09:51:05-08:00	
The Ministry of Foreign Affairs demands an investigation into the fatal beating of a Ukrainian in Slovaki...	МЗС вимагає розслідувати смертельне побиття українця у Словаччині		2025-02-03T09:09:13-08:00	
The president of Mexico says that she had a 'good talk' with Trump and he postponed the tariffs	Президентка Мексики каже, що 'гарно поговорила' з Трампом і він відклав мита		2025-02-03T08:24:59-08:00	
The court arrested a suspect in the murder of an employee of the TCC at a gas station	Суд арештував підозрюваного у вбивстві працівника ТЦК на автозаправці		2025-02-03T08:14:35-08:00	
Anton Spitsyn, the commander of the National Guard combat group 'Sharp Cartouches', died in the war	На війні загинув командир бойової групи нацгвардійців 'Гострі картузи' Антон Спіцин		2025-02-03T08:10:26-08:00	
The court released Mayor Irpen Markushyn under house arrest	Суд відпустив мера Ірпеня Маркушина під домашній арешт		2025-02-03T07:21:30-08:00	
Reuters: The Biden administration delayed arms deliveries to Ukraine in 2024	Reuters: Адміністрація Байдена затримувала поставки зброї Україні у 2024		2025-02-03T06:49:13-08:00	
A photo of a Ukrainian soldier with his head cut off by the occupiers is circulating on the Internet: his...	У мережі шириться фото українського бійця з відтятою окупантами головою: його особу встановили		2025-02-03T04:43:49-08:00	
Syrskyi: The transition of the Armed Forces to a corps structure has begun	Сирський: Почався перехід ЗСУ на корпусну структуру		2025-02-03T04:00:07-08:00	
Fighter pilot Ivan Bolotov died while performing a combat mission	Під час виконання бойового завдання загинув льотчик-винищувач Іван Болотов		2025-02-03T03:56:43-08:00	
Energy facilities in two regions of the Russian Federation were set on fire by SBU and SSO drones	Енергооб'єкти в двох областях РФ запалили безпілотники СБУ і ССО		2025-02-03T02:59:38-08:00	
In Moscow, the organizer of the 'aunties' of the Maidan, who created a battalion of the occupiers, was bl...	У Москві підірвали організатора 'тітушок' Майдану, який створив батальйон у складі окупантів		2025-02-03T02:34:50-08:00	
Georgescu tried to explain his statements about 'Romanian lands' in Ukraine	Джорджеску спробував пояснити свої заяви про 'румунські землі' в Україні		2025-02-03T01:51:51-08:00	
Emergency power outages in a number of regions of Ukraine	У низці областей України екстрені відключення світла		2025-02-02T23:59:56-08:00	
Musk said that the USA is closing the USAID program	Маск заявив, що США закривають програму USAID		2025-02-02T23:50:45-08:00	
Trump warned Americans that they could feel 'pain' in the trade war	Трамп попередив американців, що у торговій війні вони можуть відчути 'біль'		2025-02-02T23:39:35-08:00	
Air Force: 38 Russian drones were shot down over Ukraine, 25 did not reach their targets	Повітряні сили: Над Україною збили 38 російських дронів, 25 – не досягли цілей		2025-02-02T23:18:43-08:00	
Syrsky reacted to the violence against the military TCC: The guilty must be punished	Сирський відреагував на насильство щодо військових ТЦК: Винні мають понести покарання		2025-02-02T22:58:07-08:00	
Drones attacked Russian energy facilities	Дрони атакували енергетичні об'єкти Росії		2025-02-02T21:12:12-08:00	
Trump: We are negotiating with Ukraine and Russia	Трамп: Ми ведемо переговори з Україною і Росією		2025-02-02T19:08:12-08:00	
Russian occupation forces increase pressure on Andriyivka - DeepState	Російські окупаційні війська посилюють тиск на Андріївку – DeepState		2025-02-02T17:00:34-08:00	
The USA issued an ultimatum regarding the Panama Canal	США висунули ультиматум щодо Панамського каналу		2025-02-02T15:01:28-08:00	
A hundred USAID employees were sent on 'vacation', and Musk said that it was 'time to die' for the agency...	Сотню співробітників USAID відправили у 'відпустку', а Маск заявив, що агентству 'час померти' – Reuters		2025-02-02T13:48:53-08:00	
The President: The occupiers lost dozens of officers, in particular from the DPRK, due to the attack of t...	Президент: Через удар ЗСУ по Курщині окупанти втратили десятки офіцерів, зокрема з КНДР		2025-02-02T11:57:00-08:00	
Zelensky: Out of 177 billion from the USA, Ukraine received 76	Зеленський: Із 177 мільярдів від США Україна отримала 76		2025-02-02T10:43:37-08:00	
There was an explosion near the TCC in Dnipropetrovsk region, there is an injured person	Біля ТЦК на Дніпропетровщині стався вибух, є поранений		2025-02-02T09:55:36-08:00	
The scandalous 'Meduza' campaign was stopped, the materials were removed - the ambassador	Скандальну кампанію 'Медузи' припинили, матеріали видалили – посол		2025-02-02T08:35:09-08:00	
Zelensky expects a visit by Trump's special representative in the near future	Зеленський очікує візиту спецпредставника Трампа найближчим часом		2025-02-02T07:54:41-08:00	
Zelensky: We defended our independence and are closer to peace than ever	Зеленський: Ми відстояли свою незалежність і як ніколи близькі до миру		2025-02-02T06:10:45-08:00	
Zelenskyi on the conflict between the AOZ and the Ministry of Defense: Umerov clearly understands that th...	Зеленський про конфлікт АОЗ і Міноборони: Умєров чітко розуміє, що пауз в постачанні армії не має бути		2025-02-02T05:58:17-08:00	
Murder of a military TCC officer in Pyryatin: two men were informed of suspicion	Вбивство військового ТЦК у Пирятині: двом чоловікам повідомили про підозру		2025-02-02T04:59:48-08:00	
In 2022, Zaluzhny offered to advance on Belgorod to protect Kharkiv - General Nazarov	У 2022 році Залужний пропонував наступати на Бєлгород, щоб захистити Харків – генерал Назаров		2025-02-02T03:07:00-08:00	
NATO Secretary General: Ukraine will not lose the war, we must help it become stronger	Генсек НАТО: Україна не програє війну, ми маємо допомогти їй стати сильнішою		2025-02-02T01:38:39-08:00	
The government allowed booking 100% of medical workers and prosecutors of the SAP	Уряд дозволив бронювати 100% медпрацівників і прокурорів САП		2025-02-02T01:10:00-08:00	
The commander of the ground forces on the murders and attacks on the TCC: This is a red line that cannot ...	Командувач сухопутних військ про вбивства і напади на ТЦК: Це червона лінія, яку не можна перетинати		2025-02-01T23:35:02-08:00	
Zelenskyi on NATO membership: Ukraine's 800,000-strong army can be a bonus for the Alliance	Зеленський про членство в НАТО: 800-тисячна армія України може стати бонусом для Альянсу		2025-02-01T22:55:37-08:00	
Trump started a trade war with Canada, Mexico and China	Трамп розпочав торгівельну війну з Канадою, Мексикою та Китаєм		2025-02-01T19:59:58-08:00	
Russia has used a new tactic to counter Ukrainian maritime drones in the Black Sea - ISW	Росія застосувала нову тактику протидії українським морським безпілотникам у Чорному морі – ISW		2025-02-01T18:45:43-08:00	
DeepState: The Russians do not stop their assaults in the Pokrovsky direction for a single day	DeepState: Росіяни ні на день не припиняють штурмові дії на Покровському напрямку		2025-02-01T17:57:13-08:00	
In Kharkiv, a Russian drone attacked the Slobid district: a large-scale fire at a civilian enterprise	У Харкові російський дрон атакував Слобідський район: масштабна пожежа на цивільному підприємстві		2025-02-01T17:30:18-08:00	
Zelensky: Ukraine's exclusion from the war negotiations would be 'very dangerous'	Зеленський: Виключення України з переговорів щодо війни було б 'дуже небезпечним'		2025-02-01T16:54:41-08:00	
The Air Force made public the proof: the Russians hit the boarding school in Suzhi, Kurshchyna	Повітряні сили оприлюднили доказ: по інтернату в Суджі на Курщині вдарили росіяни		2025-02-01T14:05:46-08:00	
Russian attack on boarding school in Suja: 4 dead, the same number of people in serious condition	Удар росіян по інтернату в Суджі: 4 загиблих, стільки ж людей у важкому стані		2025-02-01T12:39:33-08:00	
The Ministry of Foreign Affairs condemned the advertisement of the Russian publication 'Meduza' with Ukra...	МЗС засудило рекламу російського видання 'Медуза' з кадрами українців: Цинізм і лицемірство		2025-02-01T11:30:24-08:00	
At the time of the attack by the Russian Federation, there were people who were preparing for evacuation ...	В інтернаті Суджі під час удару РФ перебували люди, які готувалися до евакуації – Генштаб		2025-02-01T10:45:17-08:00	
Zelensky: Violation of sanctions should be interpreted as complicity in war	Зеленський: Порушення санкцій має трактуватися як співучасть у війні		2025-02-01T10:35:15-08:00	
The Russians hit the boarding school in Suja, 95 people were under the rubble - the military commandant's...	Росіяни вдарили по інтернату в Суджі, 95 людей під завалами – військова комендатура		2025-02-01T09:48:35-08:00	
The SBU exposed a pro-Russian organization that tried to create an 'insurgent movement'	СБУ викрила проросійську організацію, що намагалася створити 'повстанський рух'		2025-02-01T09:13:49-08:00	
Attack on Poltava: the number of dead has increased to 8, including a child	Удар по Полтаві: кількість загиблих зросла до 8, серед них – дитина		2025-02-01T08:42:38-08:00	
Trump's special representative said that Ukraine should hold elections after the 'ceasefire'	Спецпредставник Трампа заявив, що Україна має провести вибори після 'перемир&#700;я'		2025-02-01T08:02:00-08:00	
An explosion occurred in the Rivne TCC: one person died and 6 were injured	У Рівненському ТЦК стався вибух: є загиблий і 6 поранених		2025-02-01T07:37:20-08:00	
In January, the enemy occupied the smallest territory since last August - DeepState	У січні ворог окупував найменшу територію з серпня минулого року – DeepState		2025-02-01T06:47:16-08:00	
Strike on Ukraine on February 1: Anti-aircraft defense destroyed 56 attack UAVs, there are ballistic dama...	Удар по Україні 1 лютого: ППО знищила 56 ударних БпЛА, є ураження балістикою		2025-02-01T06:30:16-08:00	
Trump's special envoy said that the US has a 'good, reliable plan' for ending the war in Ukraine	Спецпосланець Трампа заявив, що США мають 'гарний, надійний план' щодо закінчення війни в Україні		2025-02-01T04:43:01-08:00	
