Title	Description	Link	pubDate	Image
A Russian agent from Lviv who planned a terrorist attack near the SBU building was detained in Kyiv	У Києві затримали агентку РФ зі Львова, яка планувала теракт біля будівлі СБУ		2025-02-01T02:29:51-08:00	
In the Poltava region, an unknown person shot an employee of the TCC, took a machine gun and fled	На Полтавщині невідомий застрелив співробітника ТЦК, забрав автомат і втік		2025-02-01T01:44:16-08:00	
Emergency blackouts were canceled in all regions	У всіх областях скасували екстрені відключення світла		2025-02-01T01:20:21-08:00	
Zelenskyi on the Russian night attack on Ukraine: 6 people died, more support is needed	Зеленський про нічну атаку РФ по Україні: загинуло 6 людей, потрібно більше підтримки		2025-02-01T00:49:00-08:00	
The GUR responded to Fico, who accused the 'Georgian Legion' of being involved in the protests	У ГУР відповіли Фіцо, який звинуватив 'Грузинський легіон' в причетності до протестів		2025-01-31T23:10:37-08:00	
Russians hit a residential building in Poltava: 3 people died, 10 were injured	Удар росіян по житловому будинку в Полтаві: загинули 3 людини, 10 постраждалих		2025-01-31T22:42:17-08:00	
Plane crash in Philadelphia: 6 people, including a child, were in the medical plane	Авіатроща у Філадельфії: у медичному літаку знаходилось 6 людей, у тому числі дитина		2025-01-31T22:25:44-08:00	
Emergency shutdowns were introduced in a number of regions	У низці областей запровадили аварійні відключення		2025-01-31T22:03:10-08:00	
Morning attack on Kharkiv: 1 person died, 5 more injured, there is destruction	Ранковий удар по Харкову: 1 людина загинула, ще 5 поранені, є руйнування		2025-01-31T21:38:32-08:00	
The Russian army continues its 'creeping advance' to please Putin - ISW	Російська армія продовжує 'повзуче просування' на догоду Путіну – ISW		2025-01-31T21:08:08-08:00	
All over Ukraine - air alert due to missile danger	По всій Україні – повітряна тривога через ракетну небезпеку		2025-01-31T20:56:56-08:00	
Fedorov showed the consequences of a massive attack on Zaporozhye	Федоров показав наслідки масованої атаки на Запоріжжя		2025-01-31T19:10:10-08:00	
Trump wants to introduce tariffs on goods from the EU	Трамп хоче запровадити мита на товари з ЄС		2025-01-31T16:10:30-08:00	
Trump said that he and Putin could do something 'significant' to end Russia's war in Ukraine	Трамп заявив, що вони з Путіним можуть зробити щось 'значне' для припинення війни Росії в Україні		2025-01-31T14:34:50-08:00	
The number of victims due to the attack of the Russian Federation on the center of Odesa has increased to...	До семи зросла кількість постраждалих через удар РФ по середмістю Одеси		2025-01-31T13:56:25-08:00	
Missile attack on Odesa: Among the people who were at the epicenter of the attack are Norwegian diplomats	Ракетний удар по Одесі: Серед людей, які були в епіцентрі удару, є норвезькі дипломати		2025-01-31T12:39:36-08:00	
In the Romanian Mountains, they are looking for five Ukrainians, who have not been heard from for 20 days	У Румунських горах шукають п&#700;ятьох українців, від яких 20 днів немає звісток		2025-01-31T11:55:07-08:00	
Trump said that tariffs on imports from Canada and China will start on February 1	У Трампа заявили, що тарифи на імпорт із Канади і Китаю запрацюють з 1 лютого		2025-01-31T11:12:36-08:00	
Chernov became a laureate of the Sundance film festival for the film '2000 meters to Andriivka'	Чернов став лауреатом кінофестивалю 'Санденс' за фільм '2000 метрів до Андріївки'		2025-01-31T10:35:24-08:00	
Media: Trump postponed the introduction of tariffs against Canada for a month	ЗМІ: Трамп відклав запровадження тарифів проти Канади на місяць		2025-01-31T10:11:06-08:00	
A unique development: drones appeared in the army that can carry a 250-kilogram aerial bomb and overcome ...	Унікальна розробка: в армії з'явилися дрони, які можуть нести 250-кілограмову авіабомбу і долати 2 тис. км		2025-01-31T09:50:27-08:00	
Explosions rang out in Odesa: there is damage	В Одесі пролунали вибухи: є пошкодження		2025-01-31T09:35:21-08:00	
Turkey refused to unblock the work of the Russian Federation 'Mir' cards	Туреччина відмовилася розблокувати роботу карток РФ 'Мир'		2025-01-31T09:17:06-08:00	
The Netherlands will help train more than 20 Ukrainians for F-16 maintenance	Нідерланди допоможуть у підготовці понад 20 українців для обслуговування F-16		2025-01-31T09:05:41-08:00	
The Ministry of Defense allowed the Armed Forces to use 'Gromylo'	Міноборони дозволило ЗСУ використовувати 'Громило'		2025-01-31T07:28:44-08:00	
Budanov's words and the disclosure of a state secret: the SBU opened criminal proceedings	Слова Буданова і розголошення держтаємниці: СБУ відкрила кримінальне провадження		2025-01-31T07:00:03-08:00	
Poor planning, information leaks: the Ministry of Defense named the reasons for Bezrukova's dismissal	Неякісне планування, витоки інформації: Міноборони назвало причини звільнення Безрукової		2025-01-31T05:46:33-08:00	
The mayor of Ostrog, who drunkenly sang Russian songs on the Day of Remembrance of Defenders of Ukraine, ...	Звільнили мера Острога, який п'яним співав російські пісні у День пам'яті захисників України		2025-01-31T05:40:44-08:00	
The Ministry of Defense announced who will actually manage the Defense Procurement Agency	Міноборони повідомило, хто фактично керуватиме Агенцією оборонних закупівель		2025-01-31T04:37:30-08:00	
Poturaev: Poroshenko's suspension from Council meetings may be shortened, given Europe's position	Потураєв: Порошенку можуть скоротити відсторонення від засідань Ради з огляду на позицію Європи		2025-01-31T04:24:08-08:00	
The defense forces destroyed the command post of the occupiers in the Kursk region	Сили оборони знищили командний пункт окупантів у Курській області		2025-01-31T04:11:00-08:00	
Bezrukova asked Zelenskyi to intervene in the conflict surrounding AOZ	Безрукова попросила Зеленського втрутитися в конфлікт довкола АОЗ		2025-01-31T03:20:10-08:00	
The SSO commented on the withdrawal of North Korean troops from Kurshchyna	ССО прокоментували відвід військ КНДР на Курщині		2025-01-31T02:40:35-08:00	
The General Staff confirmed the damage to the Lukoil refinery in the Volgograd region of the Russian Fede...	У Генштабі підтвердили ураження НПЗ 'Лукойл' у Волгоградській області РФ		2025-01-31T02:15:50-08:00	
North Korean soldiers were withdrawn from the front line in Kurshchyna due to heavy losses - NYT	Солдатів КНДР відвели з лінії фронту на Курщині через значні втрати – NYT		2025-01-31T01:25:58-08:00	
A deputy of the Poltava Regional Council ordered the murder of a farmer in order to appropriate his busin...	Депутат Полтавської облради замовив вбивство фермера, щоб привласнити його бізнес – СБУ		2025-01-31T00:59:50-08:00	
Media: NATO plans to make an offer to Trump regarding Greenland to reduce tensions	ЗМІ: НАТО планує зробити пропозицію Трампу щодо Гренландії для зниження напруги		2025-01-31T00:59:44-08:00	
The Ministry of Justice explained the status of Bezrukova and Zhumadilov in the Defense Procurement Agenc...	Мін'юст пояснив статус Безрукової та Жумаділова в Агенції оборонних закупівель		2025-01-31T00:59:32-08:00	
The Ukrainian military is exhausted, and the shortage of personnel is worsening - The Guardian	Українські військові виснажені, а нестача кадрів загострюється – The Guardian		2025-01-31T00:03:41-08:00	
US Secretary of State on the war in Ukraine: Both sides must make concessions	Держсекретар США про війну в Україні: Обидві сторони повинні поступитись		2025-01-30T23:59:27-08:00	
Anti-aircraft battle on January 31: anti-aircraft defense shot down 59 drones in 12 regions	Протиповітряний бій 31 січня: ППО збила 59 безпілотників у 12 областях		2025-01-30T23:37:28-08:00	
46% of Danes see the US as a threat due to Trump's encroachment on Greenland	46% данців бачать у США загрозу через зазіхання Трампа на Гренландію		2025-01-30T22:38:52-08:00	
Trump threatened the BRICS countries with 100% tariffs if they create their own currency instead of the d...	Трамп пригрозив країнам БРІКС 100%-ми митами, якщо вони створять власну валюту замість долара		2025-01-30T22:10:45-08:00	
Air crash in the USA: the black boxes of the plane were found and sent for examination	Авіакатастрофа у США: знайшли і відправили на експертизу чорні скриньки літака		2025-01-30T20:18:56-08:00	
In the Russian Volgograd, drones attacked the area of ​​the refinery and oil depot - mass media	У російському Волгограді безпілотники атакували район НПЗ і нафтобази – ЗМІ		2025-01-30T18:04:40-08:00	
They slammed the door: 'Dynamo' defeated 'Russian Federation' in the last match in the Europa League	Гримнули дверима: 'Динамо' перемогло 'РФШ' в останньому матчі в Лізі Європи		2025-01-30T14:03:14-08:00	
Oil transit in the Russian port of Ust-Luga has been suspended due to a drone attack - Bloomberg	Через атаку дронів призупинився транзит нафти в російському порту Усть-Луга – Bloomberg		2025-01-30T12:49:02-08:00	
125 combat clashes took place at the front since the beginning of the day - General Staff	На фронті від початку доби відбулось 125 бойових зіткнень – Генштаб		2025-01-30T12:17:42-08:00	
The Russian attack on a high-rise building in Sumy: the death toll has increased to 9	Удар РФ по багатоповерхівці в Сумах: кількість загиблих зросла до 9		2025-01-30T10:17:33-08:00	
EU leaders may discuss Ukraine and Trump's threats against Greenland on Monday	Лідери ЄС у понеділок можуть обговорити Україну та погрози Трампа щодо Гренландії		2025-01-30T09:56:29-08:00	
Trump said that no one survived the plane crash near Washington	Трамп заявив, що в авіакатастрофі під Вашингтоном ніхто не вижив		2025-01-30T08:57:00-08:00	
In Kyiv, a moment of silence was announced in public transport	У Києві запровадили оголошення хвилини мовчання у громадському транспорті		2025-01-30T07:37:59-08:00	
Sweden gives Ukraine the largest aid package equivalent to $1.25 billion	Швеція передає Україні найбільший пакет допомоги еквівалентом $1,25 млрд		2025-01-30T07:27:14-08:00	
Zelenskyi is called to restore the work of the paralyzed Defense Procurement Agency	Зеленського закликають відновити роботу паралізованої Агенції оборонних закупівель		2025-01-30T06:16:46-08:00	
Theses of Russian propaganda': The Ministry of Foreign Affairs of Ukraine responded to the statement of ...	Тези російської пропаганди': В МЗС України відповіли на заяву румунського політика		2025-01-30T05:45:12-08:00	
PACE eventually agreed to include a reference to Putin, but without using the word 'terrorist'	У ПАРЄ зрештою погодилися включити згадку про Путіна, але без використання слова 'терорист'		2025-01-30T05:28:35-08:00	
At least 30 bodies were found at the site of the plane crash in the USA - mass media	На місці авіакатастрофи у США знайшли щонайменше 30 тіл – ЗМІ		2025-01-30T05:12:10-08:00	
The PACE adopted a resolution on peace negotiations regarding Ukraine and Europe's commitments	ПАРЄ ухвалила резолюцію про мирні переговори щодо України і зобов’язання Європи		2025-01-30T04:17:13-08:00	
Ukrenergo' warned about fake forecasts regarding the limitation of light due to cold weather	Укренерго' попередило про фейкові прогнози щодо обмеження світла через похолодання		2025-01-30T03:31:26-08:00	
Russians shelled Kramatorsk: 13 people were wounded, including children	Росіяни обстріляли Краматорськ: поранено 13 людей, у тому числі діти		2025-01-30T03:06:54-08:00	
The Rules Committee supported Poroshenko's suspension from the meetings of the Verkhovna Rada	Регламентний комітет підтримав відсторонення Порошенка від засідань Верховної Ради		2025-01-30T02:11:09-08:00	
The Novoshakhty refinery in the Rostov region stopped working again due to attacks by the TSP	Новошахтинський НПЗ у Ростовській області знову припинив роботу через атаки – ЦПД		2025-01-30T01:53:19-08:00	
The PACE was not allowed to register the draft decision declaring Putin a terrorist	У ПАРЄ не дозволили зареєструвати проєкт рішення з оголошеннням Путіна терористом		2025-01-30T01:37:57-08:00	
Cyber ​​experts at Wiz Research discovered a leak of confidential information from the DeepSeek database	Кіберфахівці Wiz Research виявили витік конфіденційної інформації з бази даних DeepSeek		2025-01-30T01:21:04-08:00	
37 Russian drones were shot down over Ukraine, but there are also hits - the Air Force	Над Україною збили 37 російських дронів, але є і влучання – Повітряні сили		2025-01-29T23:46:19-08:00	
FT: The EU is considering resuming purchases of Russian gas	FT: ЄС розглядає можливість відновлення закупівель російського газу		2025-01-29T23:40:24-08:00	
Shakhtar Donetsk captain Stepanenko left the club after 15 years of performances	Капітан донецького 'Шахтаря' Степаненко залишив клуб після 15 років виступів		2025-01-29T23:32:25-08:00	
The Romanian politician called Ukraine a 'fictitious state' and wants to seize part of it	Румунський політик назвав Україну 'вигаданою державою' і хоче загарбати її частину		2025-01-29T23:29:47-08:00	
The crash of a plane and a military helicopter in the USA: 18 people are known to have died - mass media	Катастрофа літака і військового гелікоптера у США: відомо про 18 загиблих – ЗМІ		2025-01-29T23:12:25-08:00	
Shaheda' attack on a high-rise building in Sumy: 4 dead were recovered from the rubble	Удар 'Шахеда' по багатоповерхівці в Сумах: з-під завалів дістали 4 загиблих		2025-01-29T22:19:18-08:00	
A passenger plane collided with a military helicopter and fell into a river near Washington	Пасажирський літак зіткнувся з військовим гелікоптером та впав у річку поблизу Вашингтона		2025-01-29T20:15:39-08:00	
A former US Democratic senator was sentenced to 11 years in prison for corruption	Колишнього американського сенатора-демократа засуджено до 11 років ув’язнення за корупцію		2025-01-29T19:40:48-08:00	
ISW: Putin is creating the conditions to disrupt any future peace agreements with Ukraine	ISW: Путін створює умови для порушення будь-яких майбутніх мирних угод з Україною		2025-01-29T18:39:04-08:00	
Shaheda' attack on Sumy: no one killed, seven injured	Удар 'Шахеда' по Сумах: загибель людини не підтвердилась, семеро постраждалих		2025-01-29T17:40:31-08:00	
Air defense forces are working on enemy drones in the Kyiv region	На Київщині сили ППО працюють по ворожих дронах		2025-01-29T16:07:04-08:00	
In Sumy, a Russian drone hit a high-rise building: a person died	У Сумах російський безпілотник влучив у багатоповерхівку: загинула людина		2025-01-29T14:57:18-08:00	