Title	Description	Link	pubDate	Image
Astronomers detect ferocious jet-stream winds on alien planet	Astronomers detect ferocious jet-stream winds on alien planet	https://www.reddit.com/r/worldnews/comments/1i6vzab/astronomers_detect_ferocious_jetstream_winds_on/	2025-01-21T14:57:51-08:00	https://external-preview.redd.it/bigSYplZ7lclpC7s5iAoXzJT3ZTvr865fFsCmsrl-g4.jpg?width=640&crop=smart&auto=webp&s=eb420b5b1af72a43d96a5cbaa6fcaef19dc73d22
US imposes sanctions on Sudan’s army chief over tactics in deadly civil war	US imposes sanctions on Sudan’s army chief over tactics in deadly civil war	https://www.reddit.com/r/worldnews/comments/1i6vpe3/us_imposes_sanctions_on_sudans_army_chief_over/	2025-01-21T14:45:48-08:00	https://external-preview.redd.it/K2rzOccxHXcw_yojy8ehi2OdjPRHGILtzFv81mS-bFQ.jpg?width=640&crop=smart&auto=webp&s=06918180031aaa12e22ab37fa52397b9c866a92a
Russia warns Trump against seizing Panama Canal	Russia warns Trump against seizing Panama Canal	https://www.reddit.com/r/worldnews/comments/1i6va3e/russia_warns_trump_against_seizing_panama_canal/	2025-01-21T14:27:58-08:00	https://external-preview.redd.it/5yIKQbEuEbQJwDz9UT2rXQEKSAgJfuEbEKgdbjKEM7E.jpg?width=640&crop=smart&auto=webp&s=ccb43188f72ecec13452e57ecd746a3472e8df04
Labor Insurance Fund future grim despite short-term respite: Report - Focus Taiwan	Labor Insurance Fund future grim despite short-term respite: Report - Focus Taiwan	https://www.reddit.com/r/worldnews/comments/1i6v56u/labor_insurance_fund_future_grim_despite/	2025-01-21T14:22:04-08:00	https://external-preview.redd.it/v8xIsQXFCRvVDlQiLw6eLFqUpRM0n3M8E0Vetci8yDY.jpg?width=640&crop=smart&auto=webp&s=2929b153811f5d27bd5b1d9403dce3ace398e0ca
Suspected settlers attacked Palestinian villages hours before Trump rescinded Biden sanctions	Suspected settlers attacked Palestinian villages hours before Trump rescinded Biden sanctions	https://www.reddit.com/r/InternationalNews/comments/1i6v0kp/suspected_settlers_attacked_palestinian_villages/	2025-01-21T14:16:46-08:00	
Israel considers sending captured Russian-made weapons to Ukraine, embassy reports	Israel considers sending captured Russian-made weapons to Ukraine, embassy reports	https://www.reddit.com/r/worldnews/comments/1i6uzc3/israel_considers_sending_captured_russianmade/	2025-01-21T14:15:23-08:00	https://external-preview.redd.it/JJcnd5pb_PFM9-5pFth5XAeMlVEV-dn1QUhK_OxjRmk.jpg?width=640&crop=smart&auto=webp&s=72b67076a6a985ac217ea0d04294251606d6a6e1
Russian airstrike on Kyiv kills at least three	Russian airstrike on Kyiv kills at least three	https://www.reddit.com/r/worldnews/comments/1i6urrp/russian_airstrike_on_kyiv_kills_at_least_three/	2025-01-21T14:06:29-08:00	https://external-preview.redd.it/88fMwUJqegAbhdhZb0wJBt4JGFfsUz6xO_VCEUdwEns.jpg?width=640&crop=smart&auto=webp&s=424d66d265e98e45110c7ee43f4f6116eb7f3b56
Trump’s UN ambassador pick says Israel has ‘biblical right’ to West Bank	Trump’s UN ambassador pick says Israel has ‘biblical right’ to West Bank	https://www.reddit.com/r/InternationalNews/comments/1i6uqb8/trumps_un_ambassador_pick_says_israel_has/	2025-01-21T14:04:51-08:00	https://external-preview.redd.it/rmz4-4qmkKFAmTRpHKvXuHpd9TSHglpCOiohRNdl7RE.jpg?width=640&crop=smart&auto=webp&s=1183de63b611b19211c642938571e1b27ef2b674
More than 2,400 aid trucks enter Gaza under truce, UN says no big looting issues	More than 2,400 aid trucks enter Gaza under truce, UN says no big looting issues	https://www.reddit.com/r/worldnews/comments/1i6ulzf/more_than_2400_aid_trucks_enter_gaza_under_truce/	2025-01-21T14:00:04-08:00	https://external-preview.redd.it/C8Ni12xOe9xjUySQjBUx43yeM8f2nnGRMTLRElJ3VCw.jpg?width=640&crop=smart&auto=webp&s=d8a68689cbc2007321a5c6daf2824301316efc52
Trump Makes 90 Day Foreign Aid Freeze – Ukraine Military Support Supposedly Untouched	Trump Makes 90 Day Foreign Aid Freeze – Ukraine Military Support Supposedly Untouched	https://www.reddit.com/r/worldnews/comments/1i6uczw/trump_makes_90_day_foreign_aid_freeze_ukraine/	2025-01-21T13:49:35-08:00	
Reports: U.S. green card holder carries out terror attack in Tel Aviv	Reports: U.S. green card holder carries out terror attack in Tel Aviv	https://www.reddit.com/r/worldnews/comments/1i6u5b0/reports_us_green_card_holder_carries_out_terror/	2025-01-21T13:40:37-08:00	https://external-preview.redd.it/f2dqT0uZ4_gBcog_G9KaRu2MobE7KfDcVguuqkyf3Fk.jpg?width=640&crop=smart&auto=webp&s=98a13810b2c66f60e72f47aed6ccd70ef86252b4
Swedish forces arrive in Latvia in largest deployment with NATO to date	Swedish forces arrive in Latvia in largest deployment with NATO to date	https://www.reddit.com/r/worldnews/comments/1i6u0nf/swedish_forces_arrive_in_latvia_in_largest/	2025-01-21T13:35:07-08:00	https://external-preview.redd.it/EbsB8qzgp2nPOQ20yy4dd_oTJ8IwoQ5VTbEL8eHPrQw.jpg?width=640&crop=smart&auto=webp&s=b9f38a8568de1d1da50056d473a05c5ee61bcadc
AFP probing whether anti-Semitic attacks were funded from overseas	AFP probing whether anti-Semitic attacks were funded from overseas	https://www.reddit.com/r/worldnews/comments/1i6tz2p/afp_probing_whether_antisemitic_attacks_were/	2025-01-21T13:33:13-08:00	https://external-preview.redd.it/MXBF41LuaHIIhdnwV4bpP5hnjvXZljnjtKUL5NYklkI.jpg?width=640&crop=smart&auto=webp&s=cf854ca54d021be8f67eb2c9eae1c464517f0e4a
Israeli Deputy Foreign Minister proposes transferring seized Russian-made weapons to Ukraine	Israeli Deputy Foreign Minister proposes transferring seized Russian-made weapons to Ukraine	https://www.reddit.com/r/worldnews/comments/1i6tyxn/israeli_deputy_foreign_minister_proposes/	2025-01-21T13:33:04-08:00	https://external-preview.redd.it/WD8G4HpCs6-Euv6X6u_WxvdKUuuZKspO7R-PRJCNwrw.jpg?width=640&crop=smart&auto=webp&s=6c921af4a2c9424e783ca0faf597b0c293571453
Man charged with allegedly attempting to set Sydney synagogue on fire	Man charged with allegedly attempting to set Sydney synagogue on fire	https://www.reddit.com/r/worldnews/comments/1i6tycz/man_charged_with_allegedly_attempting_to_set/	2025-01-21T13:32:21-08:00	https://external-preview.redd.it/cnRMhjSyyCzivmtvaLE-ZhBX5kl-WQaT0-PAdC2gORw.jpg?width=320&crop=smart&auto=webp&s=a0ff499062c55908ed34548b6d931d4812efecd1
US agrees to train Taiwanese navy as island mulls military exchange budget cuts	US agrees to train Taiwanese navy as island mulls military exchange budget cuts	https://www.reddit.com/r/worldnews/comments/1i6tmxj/us_agrees_to_train_taiwanese_navy_as_island_mulls/	2025-01-21T13:19:27-08:00	https://external-preview.redd.it/WPSb8X0pkV5J3eemAOuiW0zgUEOpgMiraGgd6oTv4FA.jpg?width=640&crop=smart&auto=webp&s=52d33fe9f5e3be1b1f89902439a2d1c5b0b56978
Israeli military chief to resign as tensions rise between Netanyahu, army brass	Israeli military chief to resign as tensions rise between Netanyahu, army brass	https://www.reddit.com/r/worldnews/comments/1i6t8g0/israeli_military_chief_to_resign_as_tensions_rise/	2025-01-21T13:03:00-08:00	https://external-preview.redd.it/5nom_VE_qXE6wKO9JqOq5EJbQwVnxzJiYEMnOinjZKM.jpg?width=640&crop=smart&auto=webp&s=a3d702b6e0b6abb3ce8fb721cfc18f3941ea7f74
China, Israel leading jailers of journalists, says report	China, Israel leading jailers of journalists, says report	https://www.reddit.com/r/InternationalNews/comments/1i6syxj/china_israel_leading_jailers_of_journalists_says/	2025-01-21T12:52:13-08:00	https://external-preview.redd.it/b6r9fiY0PxOYk3_in7gaxkrOxCmR_GyXaKXUS3LFi0Q.jpg?width=640&crop=smart&auto=webp&s=5df02ef18fe3ee279c64ea1a3d636cd6a313d3f5
Xi and Putin vow to deepen ties as Trump’s return sparks anxiety	Xi and Putin vow to deepen ties as Trump’s return sparks anxiety	https://www.reddit.com/r/worldnews/comments/1i6svnd/xi_and_putin_vow_to_deepen_ties_as_trumps_return/	2025-01-21T12:48:28-08:00	https://external-preview.redd.it/9cCsfrs1Y6huQUICEa8e4nzVXwPcknGjyWQn3rU9Mk8.jpg?width=640&crop=smart&auto=webp&s=81519633185d7b226b374a75c24dc64d86e3bbc6
Australian childcare center torched and vandalized with antisemitic graffiti	Australian childcare center torched and vandalized with antisemitic graffiti	https://www.reddit.com/r/worldnews/comments/1i6snnl/australian_childcare_center_torched_and/	2025-01-21T12:39:20-08:00	https://external-preview.redd.it/qUc31YOq8BYcbrD7Edsem8rRAGi34XcMEIkCYWl1XxI.jpg?width=640&crop=smart&auto=webp&s=a7ea6845eb86c4b0bb2584bfd0bc5df4a5813fc9
Israel attacks after Ceasefire deal	Israel launches 'significant' military operation in West Bank, at least eight Palestinians killed	https://www.reddit.com/r/breakingnews/comments/1i6saki/israel_attacks_after_ceasefire_deal/	2025-01-21T12:24:08-08:00	
How do you define citizenship? A multistate lawsuit against Trump could reshape the future.	How do you define citizenship? A multistate lawsuit against Trump could reshape the future.	https://www.reddit.com/r/InternationalNews/comments/1i6s63h/how_do_you_define_citizenship_a_multistate/	2025-01-21T12:18:57-08:00	https://external-preview.redd.it/FTKn_sWo9lW3SXOJPqOarEHh5EF8brn3QZYjcnPvFYA.jpg?width=640&crop=smart&auto=webp&s=2a7698cc914feebabd99137f737999d58c686ac5
West Bank - At least nine killed, dozens wounded in Israeli attack on Jenin refugee camp	West Bank - At least nine killed, dozens wounded in Israeli attack on Jenin refugee camp	https://www.reddit.com/r/InternationalNews/comments/1i6rkc0/west_bank_at_least_nine_killed_dozens_wounded_in/	2025-01-21T11:54:34-08:00	https://external-preview.redd.it/cW45NXc0M29qZWVlMSs1MNBtrqURxgZ3ZQh_lZsF1Ni9Fbhtx9M3sO8DTlre.png?width=320&crop=smart&auto=webp&s=133d25d725deac03c2151379fc750f4e57a7b31c
Photos of human remains and skeletons are emerging from Gaza.	Photos of human remains and skeletons are emerging from Gaza.	https://www.reddit.com/r/InternationalNews/comments/1i6rigs/photos_of_human_remains_and_skeletons_are/	2025-01-21T11:52:32-08:00	
Myanmar deports over 50,000 suspected online scammers to China amid crackdown	Myanmar deports over 50,000 suspected online scammers to China amid crackdown	https://www.reddit.com/r/worldnews/comments/1i6rfo8/myanmar_deports_over_50000_suspected_online/	2025-01-21T11:49:22-08:00	https://external-preview.redd.it/ww9lhQH7Hm-J37l1tc7g_USwgj8NOfl8KQ590g1LlEk.jpg?width=640&crop=smart&auto=webp&s=71de48252af93736787a259630d4860f72890029
Eight Palestinians killed as Israel launches operation in Jenin	Eight Palestinians killed as Israel launches operation in Jenin	https://www.reddit.com/r/worldnews/comments/1i6r2kx/eight_palestinians_killed_as_israel_launches/	2025-01-21T11:34:32-08:00	https://external-preview.redd.it/UZEyMMKPNrhFHdyiznEvt8CbCQE404SjagleAGqb_Qk.jpg?width=640&crop=smart&auto=webp&s=a8a55db10b6fab3da1aa7345f9719deaa0d31a72
Israeli forces shoot doctors in Jenin raid as 72 bodies found in Gaza	Israeli forces shoot doctors in Jenin raid as 72 bodies found in Gaza	https://www.reddit.com/r/InternationalNews/comments/1i6r14x/israeli_forces_shoot_doctors_in_jenin_raid_as_72/	2025-01-21T11:32:57-08:00	https://external-preview.redd.it/v0YE7T5PaLovg0Hd7ep1wjtOskMwf-5ZkJwZh4bO4rY.jpg?width=640&crop=smart&auto=webp&s=ddc0f6f4f267de0cf702f7c9205f5d0a99b9bb45
Mali rebels free Spanish man abducted by bandits in Algeria hoping to sell him to IS group	Mali rebels free Spanish man abducted by bandits in Algeria hoping to sell him to IS group	https://www.reddit.com/r/worldnews/comments/1i6qzv4/mali_rebels_free_spanish_man_abducted_by_bandits/	2025-01-21T11:31:33-08:00	https://external-preview.redd.it/JtNHNWvlbAdhxXekQVr1YAu2UPV0zHKF6_zzOlO7jJM.jpg?width=640&crop=smart&auto=webp&s=0d401eb196cda1090682ecbde5d90f2b736038fd
After ceasefire: A major Israeli operation in the West Bank kills 9 Palestinians and wounds 40	After ceasefire: A major Israeli operation in the West Bank kills 9 Palestinians and wounds 40	https://www.reddit.com/r/InternationalNews/comments/1i6qynf/after_ceasefire_a_major_israeli_operation_in_the/	2025-01-21T11:30:14-08:00	https://external-preview.redd.it/-LQNZj-SJwLG1Ddydyz_WRqFiLhYGjozwIauqjTU0Pg.jpg?width=640&crop=smart&auto=webp&s=60bed52bbf2513ffbffcc007c920ba44dc86d8d4
Israel drops case against five men accused of murdering Palestinian captive	Israel drops case against five men accused of murdering Palestinian captive	https://www.reddit.com/r/InternationalNews/comments/1i6qvff/israel_drops_case_against_five_men_accused_of/	2025-01-21T11:26:35-08:00	https://external-preview.redd.it/BBobWIUmTdAZDIM0eqq37q8AivbNCKeFdAgy3ZJeVbo.jpg?width=640&crop=smart&auto=webp&s=97258f05a4b353f4262ac9f05a1b4aa2431c4f6e
Zelenskyy says Russia-Ukraine peace deal would require 200,000 allied troops	Zelenskyy says Russia-Ukraine peace deal would require 200,000 allied troops	https://www.reddit.com/r/worldnews/comments/1i6qntt/zelenskyy_says_russiaukraine_peace_deal_would/	2025-01-21T11:17:47-08:00	https://external-preview.redd.it/iY9p7jdEYeQbhruRMU07brLwRe5K3VDUNsTIGx49InM.jpg?width=640&crop=smart&auto=webp&s=6ba90c6e4c360c7856b7977adbe1e149934f7517
Canada's inflation rate fell to 1.8% in December, with prices declining during GST break	Canada's inflation rate fell to 1.8% in December, with prices declining during GST break	https://www.reddit.com/r/worldnews/comments/1i6pwz1/canadas_inflation_rate_fell_to_18_in_december/	2025-01-21T10:47:33-08:00	https://external-preview.redd.it/gO10Tw9mh6vAzv-CY-l3JYmo-q2wxWuDVUZ8vPQ3uyM.jpg?width=320&crop=smart&auto=webp&s=dc38c4c80285ee0326b88f926cb0cc50fb886f21
Nazis (Israelis) Kidnap up to 82 Palestinians as hostages immediately after releasing Palestinian hostages.	Nazis (Israelis) Kidnap up to 82 Palestinians as hostages immediately after releasing Palestinian hostages.	https://www.reddit.com/r/InternationalNews/comments/1i6psmi/nazis_israelis_kidnap_up_to_82_palestinians_as/	2025-01-21T10:42:29-08:00	
‘Catastrophic’: Great Barrier Reef hit by its most widespread coral bleaching, study finds	‘Catastrophic’: Great Barrier Reef hit by its most widespread coral bleaching, study finds	https://www.reddit.com/r/worldnews/comments/1i6pp4o/catastrophic_great_barrier_reef_hit_by_its_most/	2025-01-21T10:38:30-08:00	https://external-preview.redd.it/CpaFUUyBtNDk9H0rWVCx8JmZU3WcnGOICBcqMXwgLNM.jpg?width=640&crop=smart&auto=webp&s=89247f30a4e313d437946a86ecb1ccb9c7b3e694
Turkey fire: Scores killed as hotel engulfed by flames in ski resort of Bolu	Turkey fire: Scores killed as hotel engulfed by flames in ski resort of Bolu	https://www.reddit.com/r/InternationalNews/comments/1i6pm0l/turkey_fire_scores_killed_as_hotel_engulfed_by/	2025-01-21T10:35:05-08:00	https://external-preview.redd.it/Xrfv8mn4FVa0OYwivgboPSZBvySB6sOAtRggiWyrxJE.jpg?width=640&crop=smart&auto=webp&s=a254dd4dab6e594d7441488097ed9246e4d17685
Netanyahu Says U.S. Gave Him Green Light to Resume Attacking Gaza Despite Ceasefire	Netanyahu Says U.S. Gave Him Green Light to Resume Attacking Gaza Despite Ceasefire	https://www.reddit.com/r/InternationalNews/comments/1i6pkc6/netanyahu_says_us_gave_him_green_light_to_resume/	2025-01-21T10:33:15-08:00	https://external-preview.redd.it/gOV47-_rhQs15rUsPRjaQcu63J31ZmTaH-273IookuQ.jpg?width=640&crop=smart&auto=webp&s=770f13ec9d21a3a1217518569c23ff449244c7b4
Cargo dropped from U.S. Osprey blown off course near Okinawan island	Cargo dropped from U.S. Osprey blown off course near Okinawan island	https://www.reddit.com/r/worldnews/comments/1i6ph95/cargo_dropped_from_us_osprey_blown_off_course/	2025-01-21T10:29:56-08:00	https://external-preview.redd.it/YHz9FDKlU5FqWnAWA1OhrBW1wsmIBEBLeuSiF2Dmjeg.jpg?width=640&crop=smart&auto=webp&s=ea33a9a57bcba8a2dcf8b0378e2be0ce61e37286
Sanctioned Russian LNG Cargo Ends Across-the-World Trip Without Finding Buyer	Sanctioned Russian LNG Cargo Ends Across-the-World Trip Without Finding Buyer	https://www.reddit.com/r/worldnews/comments/1i6oodp/sanctioned_russian_lng_cargo_ends_acrosstheworld/	2025-01-21T09:57:56-08:00	https://external-preview.redd.it/RaGpPeF-0l49iwaFGV1ELySZasm-RvSSMqM_SsVIpU4.jpg?width=640&crop=smart&auto=webp&s=26c96e6f88d974bf6e99aec5cfcbc7d34d74174d
Donald Trump has made an extreme law change on the death penalty less than 24 hours after becoming president	Donald Trump has made an extreme law change on the death penalty less than 24 hours after becoming president	https://www.reddit.com/r/InternationalNews/comments/1i6o06q/donald_trump_has_made_an_extreme_law_change_on/	2025-01-21T09:30:38-08:00	https://preview.redd.it/1kfjxgf9tdee1.png?width=640&crop=smart&auto=webp&s=4482afb2e6af95473bd00326249d493e22798edb
Mexico defends sovereignty as US seeks to label cartels as terrorists	Mexico defends sovereignty as US seeks to label cartels as terrorists	https://www.reddit.com/r/worldnews/comments/1i6ntij/mexico_defends_sovereignty_as_us_seeks_to_label/	2025-01-21T09:23:00-08:00	https://external-preview.redd.it/xVAD0cb1KuHo0A6DZtyrrUr4ug_At5x9He9JqIyt9Ww.jpg?width=640&crop=smart&auto=webp&s=5e54f75ade5992a974a24b12b46da47ad16d71ba
Saudi foreign minister says Trump does not raise risk of Iran-Israel war	Saudi foreign minister says Trump does not raise risk of Iran-Israel war	https://www.reddit.com/r/worldnews/comments/1i6nog4/saudi_foreign_minister_says_trump_does_not_raise/	2025-01-21T09:17:14-08:00	https://external-preview.redd.it/pMK4PkRGBhTWHUx1NIIKtKjD2XenEs_etNFq55TtmNw.jpg?width=640&crop=smart&auto=webp&s=20d3d8849ae122829d7d94f4fd30b9cb02ff7a17
Pelosi Sells 31K Apple and 10K Nvidia Shares, Eyes New AI and Utility Firm in a Major Portfolio Reshuffle	Pelosi Sells 31K Apple and 10K Nvidia Shares, Eyes New AI and Utility Firm in a Major Portfolio Reshuffle	https://www.reddit.com/r/InternationalNews/comments/1i6ni7n/pelosi_sells_31k_apple_and_10k_nvidia_shares_eyes/	2025-01-21T09:10:02-08:00	https://external-preview.redd.it/VEWbhlDDCVFLWScymL0_9172hh0uV1N5GddhP4w-XLc.jpg?width=640&crop=smart&auto=webp&s=07f77590f270bf9e522c53c27cc34ba166470dc5
Australian childcare center torched and sprayed with antisemitic graffiti	Australian childcare center torched and sprayed with antisemitic graffiti	https://www.reddit.com/r/worldnews/comments/1i6ngql/australian_childcare_center_torched_and_sprayed/	2025-01-21T09:08:22-08:00	https://external-preview.redd.it/qUc31YOq8BYcbrD7Edsem8rRAGi34XcMEIkCYWl1XxI.jpg?width=640&crop=smart&auto=webp&s=a7ea6845eb86c4b0bb2584bfd0bc5df4a5813fc9
India Set to Take Back 18,000 Citizens From US to Placate Trump	India Set to Take Back 18,000 Citizens From US to Placate Trump	https://www.reddit.com/r/worldnews/comments/1i6nghh/india_set_to_take_back_18000_citizens_from_us_to/	2025-01-21T09:08:06-08:00	https://external-preview.redd.it/m44MoerIVqHEKYvULS_KRaokJlLyeQ_2ntbx0HEc4OU.jpg?width=640&crop=smart&auto=webp&s=a46fe76a66d5f6c70c01aef7cfbb2748c9647427
Trump fires his former Iran envoy Brian Hook on first day.	Trump fires his former Iran envoy Brian Hook on first day.	https://www.reddit.com/r/worldnews/comments/1i6n75z/trump_fires_his_former_iran_envoy_brian_hook_on/	2025-01-21T08:57:20-08:00	https://external-preview.redd.it/HO9g42cu98zU9rk6uHpc-jX23euItIE8m9AoOQnyM4g.jpg?width=640&crop=smart&auto=webp&s=a08aff37d0c49dc1f3f9113c9777454d6f9ab31f
Khirbet Susiya, South Hebron Hills: Teenaged settlers attacked homes with stones and damage property	Khirbet Susiya, South Hebron Hills: Teenaged settlers attacked homes with stones and damage property	https://www.reddit.com/r/InternationalNews/comments/1i6n2yz/khirbet_susiya_south_hebron_hills_teenaged/	2025-01-21T08:52:16-08:00	
Dead disabled girl has same rights as unimpaired person: Japan court	Dead disabled girl has same rights as unimpaired person: Japan court	https://www.reddit.com/r/worldnews/comments/1i6mmnw/dead_disabled_girl_has_same_rights_as_unimpaired/	2025-01-21T08:33:24-08:00	
Turkey fire: Scores killed as hotel engulfed by flames in ski resort of Bolu	Turkey fire: Scores killed as hotel engulfed by flames in ski resort of Bolu	https://www.reddit.com/r/InternationalNews/comments/1i6mlt3/turkey_fire_scores_killed_as_hotel_engulfed_by/	2025-01-21T08:32:26-08:00	https://external-preview.redd.it/QUb19y81ppbxup26q7HRdomUphNq8xU8Pl2FhQSVtLc.jpg?width=640&crop=smart&auto=webp&s=b01d35ffa632506e807420a6aee222de453308f5
Oath Keepers' Rhodes and Proud Boys' Tarrio released from prison after Trump Jan. 6 clemency	Oath Keepers' Rhodes and Proud Boys' Tarrio released from prison after Trump Jan. 6 clemency	https://www.reddit.com/r/breakingnews/comments/1i6mjh2/oath_keepers_rhodes_and_proud_boys_tarrio/	2025-01-21T08:29:48-08:00	
Warsaw to turn Russian -spy- building into housing for public servants	Warsaw to turn Russian -spy- building into housing for public servants	https://www.reddit.com/r/worldnews/comments/1i6mire/warsaw_to_turn_russian_spy_building_into_housing/	2025-01-21T08:28:57-08:00	
Europe extends hand to US, warns of 'race to bottom'	Europe extends hand to US, warns of 'race to bottom'	https://www.reddit.com/r/worldnews/comments/1i6mi7v/europe_extends_hand_to_us_warns_of_race_to_bottom/	2025-01-21T08:28:19-08:00	https://external-preview.redd.it/__DZnGO-JnyIEhxvKORj240Pr9GSSeRsWNa8lUafm30.jpg?width=640&crop=smart&auto=webp&s=3142e8c2247654e05d288b2fdb16ff3db3842479
Zelenskiy says post-war security guarantee would need at least 200,000 peacekeepers	Zelenskiy says post-war security guarantee would need at least 200,000 peacekeepers	https://www.reddit.com/r/worldnews/comments/1i6mhds/zelenskiy_says_postwar_security_guarantee_would/	2025-01-21T08:27:20-08:00	https://external-preview.redd.it/sHBRARwq4_N4j97e02DhwsFOqMpyk5Yow-pwOBHrCBE.jpg?width=640&crop=smart&auto=webp&s=4dfabcd0fa8a2402082165be0d0f4d7947cdc13d
Trump's Paris climate exit will hit harder than in 2017	Trump's Paris climate exit will hit harder than in 2017	https://www.reddit.com/r/worldnews/comments/1i6mgjs/trumps_paris_climate_exit_will_hit_harder_than_in/	2025-01-21T08:26:24-08:00	https://external-preview.redd.it/H9IdpyjQUR6umAgmetEjtBKYhoZ8xjM8ZBOiEN5giKU.jpg?width=640&crop=smart&auto=webp&s=1864c62170063f91461a8a633dbc0d0c609b8121
Russia's Putin and China's Xi discuss their close ties in chat after Trump's inauguration	Russia's Putin and China's Xi discuss their close ties in chat after Trump's inauguration	https://www.reddit.com/r/InternationalNews/comments/1i6lylq/russias_putin_and_chinas_xi_discuss_their_close/	2025-01-21T08:04:50-08:00	https://external-preview.redd.it/3V5YrdY_E8Nc-ocqFEkLV-UJSyqz_L-8kCRyy37IBzw.jpg?width=640&crop=smart&auto=webp&s=a3306a14406f2db06e517017fcffc97f994cce94
Trump to lift pause on 2,000-pound bomb supply to Israel	Trump to lift pause on 2,000-pound bomb supply to Israel	https://www.reddit.com/r/InternationalNews/comments/1i6lp2t/trump_to_lift_pause_on_2000pound_bomb_supply_to/	2025-01-21T07:53:59-08:00	https://external-preview.redd.it/vq06guNP-yCO8npjeJG0K5m6sNVVHHZBcpH7jBzG63g.jpg?width=640&crop=smart&auto=webp&s=6978053e908f4aca7b3acbac66c014b2b43300e6
European court rejects Romanian far-right presidential candidate&#x27;s election appeal	European court rejects Romanian far-right presidential candidate&#x27;s election appeal	https://www.reddit.com/r/worldnews/comments/1i6ln10/european_court_rejects_romanian_farright/	2025-01-21T07:51:30-08:00	https://external-preview.redd.it/EVhDcX5oKE9Ze7NIk9zabVbDDUWqlGOmA5ozYJ9z0h4.jpg?width=640&crop=smart&auto=webp&s=4860fb77ef2bd7ecf3fe326765ca61f94ef98020
Trump to lift pause on 2,000-pound bomb supply to Israel, Walla News reports	Trump to lift pause on 2,000-pound bomb supply to Israel, Walla News reports	https://www.reddit.com/r/worldnews/comments/1i6lgkw/trump_to_lift_pause_on_2000pound_bomb_supply_to/	2025-01-21T07:43:45-08:00	https://external-preview.redd.it/vq06guNP-yCO8npjeJG0K5m6sNVVHHZBcpH7jBzG63g.jpg?width=640&crop=smart&auto=webp&s=6978053e908f4aca7b3acbac66c014b2b43300e6
VIDEO: Putin Congratulates Trump On His Presidential Inauguration & Welcomes His Efforts To Prevent World War III Says He Is -Ready To Dialogue About ...	VIDEO: Putin Congratulates Trump On His Presidential Inauguration & Welcomes His Efforts To Prevent World War III Says He Is -Ready To Dialogue About ...	https://www.reddit.com/r/InternationalNews/comments/1i6l8nd/video_putin_congratulates_trump_on_his/	2025-01-21T07:34:08-08:00	
You're Fired': Donald Trump Sacks 4 Officials Appointed By Joe Biden On Day 1	You're Fired': Donald Trump Sacks 4 Officials Appointed By Joe Biden On Day 1	https://www.reddit.com/r/InternationalNews/comments/1i6l78a/youre_fired_donald_trump_sacks_4_officials/	2025-01-21T07:32:31-08:00	https://external-preview.redd.it/ARBOXTksyU4vS2Mu_hxJgFlBzvdYj7VXGh2pWkUpFiU.jpg?width=640&crop=smart&auto=webp&s=1815311d234efcb846c5a9d372df0c569d4388c4
Israel Embarks on an ‘Extensive’ Military Operation in the West Bank	Israel Embarks on an ‘Extensive’ Military Operation in the West Bank	https://www.reddit.com/r/worldnews/comments/1i6l2hl/israel_embarks_on_an_extensive_military_operation/	2025-01-21T07:26:42-08:00	https://external-preview.redd.it/N3akdG8pD1G_RgBRTkd3VMjkjEbWdGnw1peKCDMEKzw.jpg?width=640&crop=smart&auto=webp&s=08ca124a1b7b14f8ff3fb9116e462d8ed41c78b2
Soaring cases of virus in UK as NHS asks people to stay away if they have symptoms	Soaring cases of virus in UK as NHS asks people to stay away if they have symptoms	https://www.reddit.com/r/worldnews/comments/1i6kyu8/soaring_cases_of_virus_in_uk_as_nhs_asks_people/	2025-01-21T07:22:11-08:00	https://external-preview.redd.it/sSYu67JovVfaMDjot9bffttoLaVmMeznau9jqPZbAHw.jpg?width=640&crop=smart&auto=webp&s=8311f36084d8cacf2f2d17a17a42f24a2e3d5ee6
According to the ADL saying -free Palestine- is antisemitic but doing a literal Nazi salute isn't...	According to the ADL saying -free Palestine- is antisemitic but doing a literal Nazi salute isn't...	https://www.reddit.com/r/InternationalNews/comments/1i6kwm3/according_to_the_adl_saying_free_palestine_is/	2025-01-21T07:19:27-08:00	https://preview.redd.it/9rzc1rbj6dee1.png?width=320&crop=smart&auto=webp&s=663eb9be82661f9ccf80cc7dc8a05e3e489b5e77
