Title	Description	Link	pubDate	Image
/r/WorldNews Live Thread: Russian Invasion of Ukraine Day 1062, Part 1 (Thread #1209)	/r/WorldNews Live Thread: Russian Invasion of Ukraine Day 1062, Part 1 (Thread #1209)	https://www.reddit.com/r/worldnews/comments/1i6a1qt/rworldnews_live_thread_russian_invasion_of/	2025-01-20T20:02:31-08:00	https://a.thumbs.redditmedia.com/jWqSTFxxKuo9aDK8JeM4yZL4Nb_RTA85H45u1-h63L8.jpg
More bird flu cases found in Japan; 1.44 million birds to be culled	More bird flu cases found in Japan; 1.44 million birds to be culled	https://www.reddit.com/r/worldnews/comments/1i69kk9/more_bird_flu_cases_found_in_japan_144_million/	2025-01-20T19:36:34-08:00	https://external-preview.redd.it/jCar-hz_StUCQrtCjEfZ9RZuJ56c2U86yFttUm_iv8M.jpg?width=640&crop=smart&auto=webp&s=8d121795b76a24852c75fb6e21d8d0f6dec103f4
Trump threatens 25% tariffs on Mexico and Canada on Feb. 1, punting Day 1 pledge	Trump threatens 25% tariffs on Mexico and Canada on Feb. 1, punting Day 1 pledge	https://www.reddit.com/r/worldnews/comments/1i695ew/trump_threatens_25_tariffs_on_mexico_and_canada/	2025-01-20T19:14:18-08:00	https://external-preview.redd.it/vR8HpZD5bniPvFPqdtt6K_NJjHDwIL3d-jLbQcYUEtE.jpg?width=640&crop=smart&auto=webp&s=f5a6b85c244a08859bfed269e625caa8a918ad7f
Russia relies on Soviet-era stock for bomber ‘production’	Russia relies on Soviet-era stock for bomber ‘production’	https://www.reddit.com/r/worldnews/comments/1i68ojf/russia_relies_on_sovietera_stock_for_bomber/	2025-01-20T18:50:17-08:00	
Le Monde, French newspaper of record, quits Elon Musk’s X	Le Monde, French newspaper of record, quits Elon Musk’s X	https://www.reddit.com/r/worldnews/comments/1i68o3a/le_monde_french_newspaper_of_record_quits_elon/	2025-01-20T18:49:39-08:00	https://external-preview.redd.it/xc5H51jy7dY2pV_1H2331fpSN4vNSVoQsviXjhu_-14.jpg?width=640&crop=smart&auto=webp&s=02b6d5eb80d8c7d6ee86345df1c531f23ea180c9
‘I Only Know South Korea Has Fewer Mountains’ – Testimony from Captured Pyongyang POW	‘I Only Know South Korea Has Fewer Mountains’ – Testimony from Captured Pyongyang POW	https://www.reddit.com/r/worldnews/comments/1i68ile/i_only_know_south_korea_has_fewer_mountains/	2025-01-20T18:41:46-08:00	https://external-preview.redd.it/yaFFEoeLvJUL7xgMUxff0V9imabumbVKolsFtfraVKc.jpg?width=640&crop=smart&auto=webp&s=76cbef61709e111e4f79d8cf130e0ba053f155ca
He's destroying Russia': Trump tells Putin to end Ukraine war and 'make a deal' - The Times of India	He's destroying Russia': Trump tells Putin to end Ukraine war and 'make a deal' - The Times of India	https://www.reddit.com/r/worldnews/comments/1i68igz/hes_destroying_russia_trump_tells_putin_to_end/	2025-01-20T18:41:36-08:00	https://external-preview.redd.it/V6XrmzB9AFXc6WSxRie4E_GsDvTJs5Wj-084qROWmTE.jpg?width=640&crop=smart&auto=webp&s=b0dfa4b39c0ea7646758f7d592aa0601a9089335
Non military, felon. Hmmm.	SALUTING One required act of military courtesy is the salute. Regulations governing its use are founded on military custom deeply rooted in tradition. The salute is a symbol of respect and a sign of comradeship among service personnel. The salute is simple and dignified; but, there is great significance in that gesture. It is a time-honored demonstration of courtesy among all military personnel that expresses mutual respect and pride in the service. Never resent or try to avoid saluting persons entitled to receive the salute. (The privilege of saluting is generally denied prisoners because their status is considered unworthy of the comradeship of military personnel.) The most common form of salute is the hand salute. However, there are other types, such as gun and rifle salutes, which are ...	https://www.reddit.com/r/InternationalNews/comments/1i68epo/non_military_felon_hmmm/	2025-01-20T18:36:03-08:00	https://preview.redd.it/baylybtde9ee1.jpeg?width=640&crop=smart&auto=webp&s=9780e3517097fae351000f2713b3d13d828f3c3c
Abrupt end to border app that brought nearly 1 million to US strands many in Mexico	Abrupt end to border app that brought nearly 1 million to US strands many in Mexico	https://www.reddit.com/r/worldnews/comments/1i680zq/abrupt_end_to_border_app_that_brought_nearly_1/	2025-01-20T18:16:48-08:00	https://external-preview.redd.it/jog61FG1x-OP46tLPqJ1GI_glTs-1fFVl5PT44Lghtw.jpg?width=640&crop=smart&auto=webp&s=3c98ebe752ca54c164567132d186d8491def2927
Accidents, not Russian sabotage, behind undersea cable damage, officials say	Accidents, not Russian sabotage, behind undersea cable damage, officials say	https://www.reddit.com/r/worldnews/comments/1i67idv/accidents_not_russian_sabotage_behind_undersea/	2025-01-20T17:51:11-08:00	https://external-preview.redd.it/Vj6V8ioagoMCKS98qryGGjDl53ZfeQte8hSN59AFy6A.jpg?width=640&crop=smart&auto=webp&s=32e81008dfb022d922847d70ce2c2eefa354c2ef
Israel arrests 64 Palestinians in West Bank following release of 90 prisoners as part of swap deal	Israel arrests 64 Palestinians in West Bank following release of 90 prisoners as part of swap deal	https://www.reddit.com/r/InternationalNews/comments/1i67gbp/israel_arrests_64_palestinians_in_west_bank/	2025-01-20T17:48:16-08:00	https://external-preview.redd.it/eW1vbTg4enU1OWVlMaaTY5Cwb65M_MTNyaVtkkPV9TkwCAwPqtN7cuk-W0hV.png?width=320&crop=smart&auto=webp&s=1860f76793673c36ba9ba2a27dfe00eeb3930993
Trump to remove the United States from the World Health Organization	Trump to remove the United States from the World Health Organization	https://www.reddit.com/r/worldnews/comments/1i678tj/trump_to_remove_the_united_states_from_the_world/	2025-01-20T17:37:58-08:00	https://external-preview.redd.it/Qmg5qKMmmBU94T1l68aAkUelaaCUuSJkyzSA1_d8CE0.jpg?width=640&crop=smart&auto=webp&s=26db552d6a4d17da3f60b903c690654c3eb07d95
Trump calls for U.S. to withdraw from World Health Organization	Trump calls for U.S. to withdraw from World Health Organization	https://www.reddit.com/r/InternationalNews/comments/1i6785r/trump_calls_for_us_to_withdraw_from_world_health/	2025-01-20T17:37:02-08:00	https://external-preview.redd.it/ceia2gfl9TdVUxDxIpnGZGW5lKZFPa-nk41qhAPIFXk.jpg?width=640&crop=smart&auto=webp&s=a305b80113e02d6b9df1cc824274cc24b7fd0158
Trump Withdraws U.S. from World Health Organization	Trump Withdraws U.S. from World Health Organization	https://www.reddit.com/r/worldnews/comments/1i677uj/trump_withdraws_us_from_world_health_organization/	2025-01-20T17:36:35-08:00	https://external-preview.redd.it/tj6SW0k2u6KyXB3rSkO1gGLCe9E92BA3c0ubPoe6AXw.jpg?width=640&crop=smart&auto=webp&s=330edddabb39fd87a1079e8bf61f91b3748bdc63
Trump cancels sanctions on Israeli settlers in West Bank	Trump cancels sanctions on Israeli settlers in West Bank	https://www.reddit.com/r/InternationalNews/comments/1i66qxx/trump_cancels_sanctions_on_israeli_settlers_in/	2025-01-20T17:13:18-08:00	https://external-preview.redd.it/3t8bsqmCCAMEL27nlm510oFXDpeYHa2fnpdi2gFaQ8o.jpg?width=640&crop=smart&auto=webp&s=0c772bd9c831761a6c5625a684cc5f4f7f11a2f2
Trump cancels sanctions on Israeli settlers in West Bank	Trump cancels sanctions on Israeli settlers in West Bank	https://www.reddit.com/r/worldnews/comments/1i66p02/trump_cancels_sanctions_on_israeli_settlers_in/	2025-01-20T17:10:41-08:00	https://external-preview.redd.it/3t8bsqmCCAMEL27nlm510oFXDpeYHa2fnpdi2gFaQ8o.jpg?width=640&crop=smart&auto=webp&s=0c772bd9c831761a6c5625a684cc5f4f7f11a2f2
Trump Plans to Enact 25% Tariffs on Mexico, Canada by Feb. 1	Trump Plans to Enact 25% Tariffs on Mexico, Canada by Feb. 1	https://www.reddit.com/r/worldnews/comments/1i66mwc/trump_plans_to_enact_25_tariffs_on_mexico_canada/	2025-01-20T17:07:47-08:00	https://external-preview.redd.it/KylVfSmPjBfC59WtauuyEv3ymKMSAgk50OLJ43g8BAI.jpg?width=640&crop=smart&auto=webp&s=45f59e9a0a34dfba29906bc4595666fa07a9a957
WHO Launches Global Initiative to Combat Emerging Health Threats	WHO Launches Global Initiative to Combat Emerging Health Threats	https://www.reddit.com/r/worldnews/comments/1i66m49/who_launches_global_initiative_to_combat_emerging/	2025-01-20T17:06:44-08:00	https://external-preview.redd.it/lq4iTE6hHJyid4sVmfrxW4Pe7JMl4sp05N8uRTR1GAE.jpg?width=640&crop=smart&auto=webp&s=1be5db50cf610d6ade2ba5381f53d37d628d0bae
Poll: Harris Lost Because of Gaza	Poll: Harris Lost Because of Gaza	https://www.reddit.com/r/InternationalNews/comments/1i66hy5/poll_harris_lost_because_of_gaza/	2025-01-20T17:01:06-08:00	https://external-preview.redd.it/ykNhrI-1DQD9C2r5sZsUQ4dM8lSPuB_q_o3DFgrnvPQ.jpg?width=320&crop=smart&auto=webp&s=a96c7aeaed5c0189d5f5fbd227c4cd10c2b83d92
Several world leaders, including India's Modi and China's Xi, to skip this year's World Economic Forum in Davos	Several world leaders, including India's Modi and China's Xi, to skip this year's World Economic Forum in Davos	https://www.reddit.com/r/worldnews/comments/1i65x2y/several_world_leaders_including_indias_modi_and/	2025-01-20T16:33:42-08:00	https://external-preview.redd.it/_XELgkoeJjVoVZx747tshatFd6ottox9ufCB8E6pobA.jpg?width=640&crop=smart&auto=webp&s=2bc9ed6a08f119a77316ebbbe4cbfb9bc307b2b7
Austin Tice’s mother returns to Syria	Austin Tice’s mother returns to Syria	https://www.reddit.com/r/worldnews/comments/1i65tpl/austin_tices_mother_returns_to_syria/	2025-01-20T16:29:34-08:00	https://external-preview.redd.it/4zjhtKf_YRHIVvJsNZRauEQtCqBs2OKuN_1kzbntyOQ.jpg?width=640&crop=smart&auto=webp&s=9de9f30ee183d74f838df51ed3175e3b35ab942c
Polish general fired after anti-tank mines found in Ikea warehouse	Polish general fired after anti-tank mines found in Ikea warehouse	https://www.reddit.com/r/worldnews/comments/1i657x8/polish_general_fired_after_antitank_mines_found/	2025-01-20T16:01:54-08:00	https://external-preview.redd.it/nAMe3IH9N9OtVayS9P0OOxzz0rAeXeoiyuc3AnR4nmw.jpg?width=640&crop=smart&auto=webp&s=f7d6a8218851f0fd245d297cf1d587a340484925
Donald Trump pulls US out of Paris climate agreement	Donald Trump pulls US out of Paris climate agreement	https://www.reddit.com/r/worldnews/comments/1i652fj/donald_trump_pulls_us_out_of_paris_climate/	2025-01-20T15:55:16-08:00	https://external-preview.redd.it/30xO_a2-DCYsR1dTQFX-g6MBpvC5TMa18tjba73Tubk.jpg?width=640&crop=smart&auto=webp&s=62d42cf2a8a23c424f7618fda078a0eb18a7fdb3
France’s 2024 Power Grid Was 95% Fossil Free as Nuclear, Renewables Jumped	France’s 2024 Power Grid Was 95% Fossil Free as Nuclear, Renewables Jumped	https://www.reddit.com/r/worldnews/comments/1i64pk9/frances_2024_power_grid_was_95_fossil_free_as/	2025-01-20T15:39:12-08:00	https://external-preview.redd.it/VnyfhqbGmYHxsBHmJ_gCmdlZfztagmvEC1f083aMb5w.jpg?width=640&crop=smart&auto=webp&s=9c8adec4cf2df33afd3f1b2eac93bdb026673aef
Colombia's president says ELN rebels will 'get war' as violence in the country's northeast escalates	Colombia's president says ELN rebels will 'get war' as violence in the country's northeast escalates	https://www.reddit.com/r/worldnews/comments/1i63ntv/colombias_president_says_eln_rebels_will_get_war/	2025-01-20T14:52:49-08:00	https://external-preview.redd.it/o0UhzbcQOQYXHPlbsXdd1Vl7yF5KOVV1XqBqcuEZQgo.jpg?width=640&crop=smart&auto=webp&s=13dc579a0fcfde667391a793378ad3530bbab54f
Israel targets Palestinians: More people killed in Gaza after start of truce	Israel targets Palestinians: More people killed in Gaza after start of truce	https://www.reddit.com/r/InternationalNews/comments/1i63kh3/israel_targets_palestinians_more_people_killed_in/	2025-01-20T14:48:58-08:00	https://external-preview.redd.it/NGxreTczdHA5OGVlMe0OYUfkZ4I88GZW9KZnpvmb2FUS1TmRL769DTR5Ul7m.png?width=640&crop=smart&auto=webp&s=023709e772f2a3a9a149e04a4649b3d2be31f99c
Magnitude 6.4 earthquake strikes southern Taiwan - Focus Taiwan	Magnitude 6.4 earthquake strikes southern Taiwan - Focus Taiwan	https://www.reddit.com/r/worldnews/comments/1i63eq0/magnitude_64_earthquake_strikes_southern_taiwan/	2025-01-20T14:42:11-08:00	https://external-preview.redd.it/qFCZOCuYYxvvF57OkJSxVZSMERcC1-_LEMW0og2FmgQ.jpg?width=640&crop=smart&auto=webp&s=5fa5dba6bf7268f8b7d529e108e074c6ff9716b3
Costa Rica Coffee Crisis Labor Shortage Leads to Major Crop Loss	Costa Rica Coffee Crisis Labor Shortage Leads to Major Crop Loss	https://www.reddit.com/r/worldnews/comments/1i6386q/costa_rica_coffee_crisis_labor_shortage_leads_to/	2025-01-20T14:34:25-08:00	https://external-preview.redd.it/USKGHbfmm-pAp4NvsxlVNvXFbBUxyK8UmiPpCcl4oCI.jpg?width=640&crop=smart&auto=webp&s=7e551f8b3118bf5fa7d22469acb6585f06cf4f63
Slovakia's PM Robert Fico says he intends to veto further EU financial aid to Ukraine. -President Zelensky thinks that everyone should be his servant....	Slovakia's PM Robert Fico says he intends to veto further EU financial aid to Ukraine. -President Zelensky thinks that everyone should be his servant....	https://www.reddit.com/r/InternationalNews/comments/1i62gos/slovakias_pm_robert_fico_says_he_intends_to_veto/	2025-01-20T14:02:43-08:00	https://external-preview.redd.it/MDQ2dHd3Y20xOGVlMYIDtfq0BUrGGDp5zNLZupLNeb_Tvn2cOyqGjK1tgiBD.png?width=640&crop=smart&auto=webp&s=fe8188484027fec134f7528eb172c582a85689dd
President Marcos vows to veto ‘woke’ sex education bill	President Marcos vows to veto ‘woke’ sex education bill	https://www.reddit.com/r/worldnews/comments/1i61wmh/president_marcos_vows_to_veto_woke_sex_education/	2025-01-20T13:39:44-08:00	https://external-preview.redd.it/omh27ryIThrndcupVwpZZKO9gAx9XQ7mRkK_1Peh6WU.jpg?width=640&crop=smart&auto=webp&s=ef0b9f9e06874231e7c85fe992b39abc25ed7685
Norway cool on Trump’s demand for a massive defense spending increase	Norway cool on Trump’s demand for a massive defense spending increase	https://www.reddit.com/r/worldnews/comments/1i60hhq/norway_cool_on_trumps_demand_for_a_massive/	2025-01-20T12:42:02-08:00	https://external-preview.redd.it/CnnA3wV_6QvN8oMXUErS8-F-Nhix4niLJ1xX1U9f4ys.jpg?width=640&crop=smart&auto=webp&s=4ce7db0581a61dbc03c92ab92606db788dfb535c
Russia seeks Poles to influence elections, digital affairs minister says	Russia seeks Poles to influence elections, digital affairs minister says	https://www.reddit.com/r/worldnews/comments/1i60go6/russia_seeks_poles_to_influence_elections_digital/	2025-01-20T12:41:08-08:00	
Panama's president responds to Trump saying he will -take back- canal	Panama's president responds to Trump saying he will -take back- canal	https://www.reddit.com/r/worldnews/comments/1i607oh/panamas_president_responds_to_trump_saying_he/	2025-01-20T12:31:03-08:00	https://external-preview.redd.it/wKya27N_aFV8OIUgUvrba9vXUE7YRH1YtSPDszj4GVY.jpg?width=640&crop=smart&auto=webp&s=d226d92e36accf1e2e1b8faebd58f9dbad155775
Tanzania confirms Marburg virus outbreak after initial denial	Tanzania confirms Marburg virus outbreak after initial denial	https://www.reddit.com/r/worldnews/comments/1i603kc/tanzania_confirms_marburg_virus_outbreak_after/	2025-01-20T12:26:25-08:00	https://external-preview.redd.it/kjM87MV5qIMjTlWxCujGedJBuUJRYlBFJJK3qVvLyJg.jpg?width=640&crop=smart&auto=webp&s=63c79d4d16a1a3bbd057024dcf09e17deff968e6
11 Things to Do on Inauguration Day That Are Great for Your Mental Health	11 Things to Do on Inauguration Day That Are Great for Your Mental Health	https://www.reddit.com/r/breakingnews/comments/1i600rx/11_things_to_do_on_inauguration_day_that_are/	2025-01-20T12:23:19-08:00	
Two genders, Drill, Baby, Drill: Highlights of Donald Trump Inauguration speech	Two genders, Drill, Baby, Drill: Highlights of Donald Trump Inauguration speech	https://www.reddit.com/r/InternationalNews/comments/1i5zlv6/two_genders_drill_baby_drill_highlights_of_donald/	2025-01-20T12:06:46-08:00	https://external-preview.redd.it/G7ko0Hud0L84ut3JDke0mPZ5Qd29Zfr0QFzCVAzcplk.jpg?width=640&crop=smart&auto=webp&s=a0efc2d93d3fb428c977eaefdac72c9f6b722260
Doug Ford says Trump ‘just adding more uncertainty’ about U.S. tariffs on Canadian goods	Doug Ford says Trump ‘just adding more uncertainty’ about U.S. tariffs on Canadian goods	https://www.reddit.com/r/worldnews/comments/1i5zikv/doug_ford_says_trump_just_adding_more_uncertainty/	2025-01-20T12:03:12-08:00	https://external-preview.redd.it/RJA0Pw5d3jREot_mMh4vFxw-4x4bmLlwrwAyXfZicBo.jpg?width=640&crop=smart&auto=webp&s=42bc6c8eeceacc5c97b1413a17b8baab7975be34
Biden's final humiliation: Most Americans can't name one success and will remember him for doing 'nothing'	Biden's final humiliation: Most Americans can't name one success and will remember him for doing 'nothing'	https://www.reddit.com/r/breakingnews/comments/1i5zhox/bidens_final_humiliation_most_americans_cant_name/	2025-01-20T12:02:16-08:00	
Donald Trump doesn't mention Canada in inaugural speech as Trudeau calls for unity	Donald Trump doesn't mention Canada in inaugural speech as Trudeau calls for unity	https://www.reddit.com/r/worldnews/comments/1i5zgx8/donald_trump_doesnt_mention_canada_in_inaugural/	2025-01-20T12:01:29-08:00	https://external-preview.redd.it/qqqcnlqCKjnjhmqygczV8f1ZdjAHHl0JNnOzttwHKWs.jpg?width=640&crop=smart&auto=webp&s=4b0cb489fb0a91f43bbf632ff255c0f614c09419
South Sudan curfew after revenge attacks on Sudanese people and businesses	South Sudan curfew after revenge attacks on Sudanese people and businesses	https://www.reddit.com/r/worldnews/comments/1i5yn9b/south_sudan_curfew_after_revenge_attacks_on/	2025-01-20T11:28:37-08:00	https://external-preview.redd.it/dbcREPUihUDwyNMCf-pxdo3OonF-nNKt2MhHDH77GOU.jpg?width=640&crop=smart&auto=webp&s=0e2570a1320a77159b443960549ec9f969fe7bd8
Wake up and spend more on defense, Macron tells Europe as Trump takes office	Wake up and spend more on defense, Macron tells Europe as Trump takes office	https://www.reddit.com/r/worldnews/comments/1i5yj9a/wake_up_and_spend_more_on_defense_macron_tells/	2025-01-20T11:24:03-08:00	https://external-preview.redd.it/xHG9L1RDCBAFri54o_t8i4wW36S8UxriVwRWNwllNjI.jpg?width=640&crop=smart&auto=webp&s=b9188dfe4f59b39ec7932acba1c92e0ae945e23a
Southport attacker admits murdering three girls - BBC News	Southport attacker admits murdering three girls - BBC News	https://www.reddit.com/r/InternationalNews/comments/1i5y4wt/southport_attacker_admits_murdering_three_girls/	2025-01-20T11:08:19-08:00	https://external-preview.redd.it/e8CruVqads_UU4QhLf8XGcFgtjO7fxYuan9W35PxETg.jpg?width=640&crop=smart&auto=webp&s=1e2e630d3fb2504ee0deea1abd06570bc1a21667
Britain to launch investigation into murders of three girls in Southport	Britain to launch investigation into murders of three girls in Southport	https://www.reddit.com/r/worldnews/comments/1i5y1c1/britain_to_launch_investigation_into_murders_of/	2025-01-20T11:04:20-08:00	https://external-preview.redd.it/7Ii6V6zOgfrQCxzZmV4eOKQil_RPBRYICvq9G1Zpftw.jpg?width=640&crop=smart&auto=webp&s=1e8c6b9f096bcc0a57c0e81ab63bb012d1d910fb
Iraqi parliament 'secretly' passes National Intelligence law	Iraqi parliament 'secretly' passes National Intelligence law	https://www.reddit.com/r/worldnews/comments/1i5y0xn/iraqi_parliament_secretly_passes_national/	2025-01-20T11:03:55-08:00	https://external-preview.redd.it/64g-zmKzhxhP8m2EANFEwB4089wtBNOmgmFId9OUA7o.jpg?width=320&crop=smart&auto=webp&s=da358a1e934a3f721bfa5ed75350b3dbe47f2c1d
US to withdraw from Paris agreement, expand drilling	US to withdraw from Paris agreement, expand drilling	https://www.reddit.com/r/worldnews/comments/1i5xzz8/us_to_withdraw_from_paris_agreement_expand/	2025-01-20T11:02:53-08:00	https://external-preview.redd.it/pM_oSXfyf8ootPvXWRLtA-K36NhSKrD7uEKZFLiNqfo.jpg?width=640&crop=smart&auto=webp&s=95a355cd7e532cd67d2cbd08ea039b2cb0805996
China unveils plan to build 'strong education nation' by 2035	China unveils plan to build 'strong education nation' by 2035	https://www.reddit.com/r/worldnews/comments/1i5xvpq/china_unveils_plan_to_build_strong_education/	2025-01-20T10:58:25-08:00	https://external-preview.redd.it/8ugbPDXIzgNnQzKmVbgTZfh5kTmfDBiGu9S_5UO4s8Q.jpg?width=640&crop=smart&auto=webp&s=4b5ca13c1b33e514301afd6f6d8beb2359e47563
Trump is sworn in as the 47th U.S. president	Trump is sworn in as the 47th U.S. president	https://www.reddit.com/r/InternationalNews/comments/1i5xmse/trump_is_sworn_in_as_the_47th_us_president/	2025-01-20T10:48:25-08:00	https://external-preview.redd.it/gs0BW9_lsE_RSEEJUKd6_v5JI9M_8bbe36j8R-0wBI4.jpg?width=640&crop=smart&auto=webp&s=8ff97efdd5e83d88ad2af394cfd635716bcd9bc9
Trump envoy floats plan to relocate Gaza civilians to Indonesia	Trump envoy floats plan to relocate Gaza civilians to Indonesia	https://www.reddit.com/r/InternationalNews/comments/1i5xlc4/trump_envoy_floats_plan_to_relocate_gaza/	2025-01-20T10:46:46-08:00	
Maccabi Tel Aviv, CFO: -If you go to Africa, don't be surprised when you're surrounded by monkeys-	Maccabi Tel Aviv, CFO: -If you go to Africa, don't be surprised when you're surrounded by monkeys-	https://www.reddit.com/r/InternationalNews/comments/1i5wr45/maccabi_tel_aviv_cfo_if_you_go_to_africa_dont_be/	2025-01-20T10:13:33-08:00	https://external-preview.redd.it/TSowQ9gnkd4SvA_V2mjWl0rqjlQoWiEKM0h9cLs6zOc.jpg?width=640&crop=smart&auto=webp&s=9866bd3f644c2c561f96e775068529201df2a287
Biden commutes life sentence of Leonard Peltier, Native American activist imprisoned for almost 50 years	Biden commutes life sentence of Leonard Peltier, Native American activist imprisoned for almost 50 years	https://www.reddit.com/r/InternationalNews/comments/1i5wifh/biden_commutes_life_sentence_of_leonard_peltier/	2025-01-20T10:03:58-08:00	https://external-preview.redd.it/uK3NvNStzn8YELqtYlvBKY91ajk2WlJ8S4FpSEhcMcg.jpg?width=640&crop=smart&auto=webp&s=837bc8c48c0e769421c979c1ada80983a5b3feb8
Biden pardons his family in final minutes in office	Biden pardons his family in final minutes in office	https://www.reddit.com/r/InternationalNews/comments/1i5w7h7/biden_pardons_his_family_in_final_minutes_in/	2025-01-20T09:52:13-08:00	https://external-preview.redd.it/-sE-2HDWOo8-4qUS5W8PX70trDXsoud9gDCTI_4IVu0.jpg?width=640&crop=smart&auto=webp&s=c8689ddc09abd0ad924a77c9ee5e810dcd834f59
India pushes Russia to repatriate citizens amid reports of 12 deaths, 16 missing in combat	India pushes Russia to repatriate citizens amid reports of 12 deaths, 16 missing in combat	https://www.reddit.com/r/worldnews/comments/1i5vfqk/india_pushes_russia_to_repatriate_citizens_amid/	2025-01-20T09:20:57-08:00	https://external-preview.redd.it/E3CS9dlr-HE0BAgKjpz3cN2AJYu4WvYI_ZxhzxwR9eI.jpg?width=640&crop=smart&auto=webp&s=e5d353f958053099cc81b0c39d860058531390b7
Viagra-laced ‘erectile honey’ is flooding into France, officials warn	Viagra-laced ‘erectile honey’ is flooding into France, officials warn	https://www.reddit.com/r/worldnews/comments/1i5ve8s/viagralaced_erectile_honey_is_flooding_into/	2025-01-20T09:19:11-08:00	https://external-preview.redd.it/Oo1t6lM3t9LGPGTHQrNCPNUZ9ZNmliq-13fjZlXs-Zg.jpg?width=640&crop=smart&auto=webp&s=9e51b9740d3b7a73dece519c5a73c1a4efbb335a
Japan aquarium cheers up sunfish with cardboard cutouts	Japan aquarium cheers up sunfish with cardboard cutouts	https://www.reddit.com/r/worldnews/comments/1i5v3tm/japan_aquarium_cheers_up_sunfish_with_cardboard/	2025-01-20T09:07:22-08:00	https://external-preview.redd.it/t1XBpHCZoDfLr6Y2hfnjE6wdV-15KX0iPfYO83khqPA.jpg?width=640&crop=smart&auto=webp&s=d3831ea70a3398801665c612684e65c57eae849b
🚨BREAKING: Biden has pardoned his whole family.	🚨BREAKING: Biden has pardoned his whole family.	https://www.reddit.com/r/InternationalNews/comments/1i5v3qw/breaking_biden_has_pardoned_his_whole_family/	2025-01-20T09:07:17-08:00	https://preview.redd.it/5jcn6j7kj6ee1.jpeg?width=640&crop=smart&auto=webp&s=b1f29ea96432ff19cc1c8cd69ebf5a53be18885f
Indian police arrest 44 men accused of raping teenager over five years	Indian police arrest 44 men accused of raping teenager over five years	https://www.reddit.com/r/worldnews/comments/1i5v1cj/indian_police_arrest_44_men_accused_of_raping/	2025-01-20T09:04:32-08:00	https://external-preview.redd.it/91fGheKVGkloiSBZuTZNFmQUidf5FM7eH-l3k0J76NY.jpg?width=640&crop=smart&auto=webp&s=d2a68d8cce3f316706877eabb1d6f8acd7efe8f6
Biden pardons his family in final minutes in office	Biden pardons his family in final minutes in office	https://www.reddit.com/r/InternationalNews/comments/1i5us12/biden_pardons_his_family_in_final_minutes_in/	2025-01-20T08:54:25-08:00	https://external-preview.redd.it/LuAErjrhvGjK-N_rqqWijaJqUKKZzfcIrbTstgIf5Wg.jpg?width=640&crop=smart&auto=webp&s=90f8d77d3ad566f46cc0f134cf1202a76fc33344
Biden issues preemptive pardons for Milley, Fauci and Jan. 6 committee members	Biden issues preemptive pardons for Milley, Fauci and Jan. 6 committee members	https://www.reddit.com/r/breakingnews/comments/1i5u3xa/biden_issues_preemptive_pardons_for_milley_fauci/	2025-01-20T08:27:08-08:00	
Polish right-wing brodcaster airs staged kidnapping of fugitive opposition politician	Polish right-wing brodcaster airs staged kidnapping of fugitive opposition politician	https://www.reddit.com/r/worldnews/comments/1i5u3je/polish_rightwing_brodcaster_airs_staged/	2025-01-20T08:26:42-08:00	
India to shift focus to railways from road transport in infrastructure push, say sources	India to shift focus to railways from road transport in infrastructure push, say sources	https://www.reddit.com/r/worldnews/comments/1i5u2au/india_to_shift_focus_to_railways_from_road/	2025-01-20T08:25:22-08:00	https://external-preview.redd.it/_-S0mnDbkvatgWIT6xGV026K5QcjoF3Rm3W8-pMQ6kA.jpg?width=640&crop=smart&auto=webp&s=fc167e5384e3065352ef459aadb397e7fe35c782
Trump won't impose tariffs on Canada, other countries right away: reports | CBC News	Trump won't impose tariffs on Canada, other countries right away: reports | CBC News	https://www.reddit.com/r/worldnews/comments/1i5tvkn/trump_wont_impose_tariffs_on_canada_other/	2025-01-20T08:17:27-08:00	https://external-preview.redd.it/RtoBbnatwCKE3xWyP3LBluXEN8dG9J5LO8kMDtxVkEs.jpg?width=320&crop=smart&auto=webp&s=a6ae0e120e9d38f0093f370d73d27ef9ec9a5791
Georgieva: IMF wants to move quickly on new Argentina program	Georgieva: IMF wants to move quickly on new Argentina program	https://www.reddit.com/r/worldnews/comments/1i5tnjw/georgieva_imf_wants_to_move_quickly_on_new/	2025-01-20T08:08:08-08:00	
