Title	Description	Link	pubDate	Image
Israeli settlers unleash violence onto Palestinian villages as Trump lifts sanctions	Israeli settlers unleash violence onto Palestinian villages as Trump lifts sanctions	https://www.reddit.com/r/InternationalNews/comments/1i7lw43/israeli_settlers_unleash_violence_onto/	2025-01-22T13:02:28-08:00	https://external-preview.redd.it/C17hTZt_ZQHBkADO94jGa0p9j3TZ9BeJ_qxPo0sRp8A.jpg?width=640&crop=smart&auto=webp&s=42c70ce35b8a334074eb5aab610a5442cd26fec6
EU aims high ahead of mission to India in late February	EU aims high ahead of mission to India in late February	https://www.reddit.com/r/worldnews/comments/1i7llsx/eu_aims_high_ahead_of_mission_to_india_in_late/	2025-01-22T12:50:40-08:00	https://external-preview.redd.it/mKuAnVAovFLIXQTXY0wY9hXGsVMLeLTTNVK8PLLRm1w.jpg?width=640&crop=smart&auto=webp&s=52622c7cd352daafbb7bb55214beb3f6397c0170
Danish politician tells Trump Greenland not for sale: ‘F‑‑‑ off’	Danish politician tells Trump Greenland not for sale: ‘F‑‑‑ off’	https://www.reddit.com/r/InternationalNews/comments/1i7ll3c/danish_politician_tells_trump_greenland_not_for/	2025-01-22T12:49:52-08:00	https://external-preview.redd.it/Yo7Hn5TM0Trfeyz-QPk5cbRDHQpIo2GCYKb1fI2mVnw.jpg?width=640&crop=smart&auto=webp&s=1267874f27c69ca0b819313efbb292e6334cf5f1
Panama protests ‘threat’ of force as Trump pushed to reclaim canal	Panama protests ‘threat’ of force as Trump pushed to reclaim canal	https://www.reddit.com/r/worldnews/comments/1i7ljvh/panama_protests_threat_of_force_as_trump_pushed/	2025-01-22T12:48:30-08:00	https://external-preview.redd.it/23x8llDhnasSLX1OcIh6uHeTSPIxklYIHfOysr8YvXU.jpg?width=640&crop=smart&auto=webp&s=3a47ae1114096efb4b0e60ad5c8e98aadd41f89c
Trump tasks US envoy Kellogg with ending war in Ukraine within 100 days – WSJ	Trump tasks US envoy Kellogg with ending war in Ukraine within 100 days – WSJ	https://www.reddit.com/r/worldnews/comments/1i7lbwg/trump_tasks_us_envoy_kellogg_with_ending_war_in/	2025-01-22T12:39:27-08:00	https://external-preview.redd.it/4wPwsSOKn8CYDXSd96hagOrXSEHiCMoAzk_Mc_yXcqc.jpg?width=640&crop=smart&auto=webp&s=47dc826094d033c19e865e9eac8cb26dd6982024
Trump delivers fresh tariff threats against EU and China	Trump delivers fresh tariff threats against EU and China	https://www.reddit.com/r/worldnews/comments/1i7l4qo/trump_delivers_fresh_tariff_threats_against_eu/	2025-01-22T12:31:09-08:00	https://external-preview.redd.it/m7xoaXfeZEQNMqwp8QBraR9KvtUEB7ku_8UnkiSrCZ4.jpg?width=640&crop=smart&auto=webp&s=610eac505a04ca26bcefb50316b2e20f23959dc1
New Syria government denies banning goods from Israel, Iran, Russia	New Syria government denies banning goods from Israel, Iran, Russia	https://www.reddit.com/r/worldnews/comments/1i7l3al/new_syria_government_denies_banning_goods_from/	2025-01-22T12:29:28-08:00	
New Southern California fire explodes to 3400 acres in less than 2 hours	New Southern California fire explodes to 3400 acres in less than 2 hours	https://www.reddit.com/r/breakingnews/comments/1i7l139/new_southern_california_fire_explodes_to_3400/	2025-01-22T12:26:52-08:00	
Danish politician tells Trump Greenland not for sale: ‘F‑‑‑ off’	Danish politician tells Trump Greenland not for sale: ‘F‑‑‑ off’	https://www.reddit.com/r/worldnews/comments/1i7kwzy/danish_politician_tells_trump_greenland_not_for/	2025-01-22T12:22:10-08:00	https://external-preview.redd.it/Yo7Hn5TM0Trfeyz-QPk5cbRDHQpIo2GCYKb1fI2mVnw.jpg?width=640&crop=smart&auto=webp&s=1267874f27c69ca0b819313efbb292e6334cf5f1
ISIS is still alive and kicking - and Brits should all be worried | Express Comment | Comment | Express.co.uk	ISIS is still alive and kicking - and Brits should all be worried | Express Comment | Comment | Express.co.uk	https://www.reddit.com/r/InternationalNews/comments/1i7kvco/isis_is_still_alive_and_kicking_and_brits_should/	2025-01-22T12:20:17-08:00	https://external-preview.redd.it/gnS2E1VYE47_iMNaROTU4PfpRXYa_2PzUKM70KfPBBA.jpg?width=640&crop=smart&auto=webp&s=47506289eebddd6e6bb79e69bed07e98e73fb832
The five signs China is preparing to invade Taiwan	The five signs China is preparing to invade Taiwan	https://www.reddit.com/r/worldnews/comments/1i7kk0n/the_five_signs_china_is_preparing_to_invade_taiwan/	2025-01-22T12:07:15-08:00	https://external-preview.redd.it/3m6qJLfNZ7eCV_0JeTApzFyliLv-GRSXa7bpDZOVc44.jpg?width=640&crop=smart&auto=webp&s=2777645dc3ae93d475a8c4e2418a8d366dee3a14
Ukrainian Special Ops Crush DPRK Troop Offensive in 8-Hour Standoff	Ukrainian Special Ops Crush DPRK Troop Offensive in 8-Hour Standoff	https://www.reddit.com/r/worldnews/comments/1i7kgi8/ukrainian_special_ops_crush_dprk_troop_offensive/	2025-01-22T12:03:15-08:00	https://external-preview.redd.it/MBw8kKU7IOWDJ6lPHEXfj91HXjlPHPUaJ9_Y3ypXg1M.jpg?width=640&crop=smart&auto=webp&s=68456253a5f1142e3942246e487fafd459e4a5ae
Trump tells Putin to end Ukraine war or face more sanctions	Trump tells Putin to end Ukraine war or face more sanctions	https://www.reddit.com/r/InternationalNews/comments/1i7kan8/trump_tells_putin_to_end_ukraine_war_or_face_more/	2025-01-22T11:56:48-08:00	https://external-preview.redd.it/eMu-RQAHTmd_xk2zC7Ahyd_s5whdBUOjljqXfb0aukE.jpg?width=640&crop=smart&auto=webp&s=92176a56368ee0fa0ed2b3c91f9ac220e050e7cd
Trump tells Putin to end Ukraine war or face more sanctions	Trump tells Putin to end Ukraine war or face more sanctions	https://www.reddit.com/r/worldnews/comments/1i7ka52/trump_tells_putin_to_end_ukraine_war_or_face_more/	2025-01-22T11:56:15-08:00	https://external-preview.redd.it/eMu-RQAHTmd_xk2zC7Ahyd_s5whdBUOjljqXfb0aukE.jpg?width=640&crop=smart&auto=webp&s=92176a56368ee0fa0ed2b3c91f9ac220e050e7cd
About 1,000 North Koreans killed fighting Ukraine in Kursk, officials say	About 1,000 North Koreans killed fighting Ukraine in Kursk, officials say	https://www.reddit.com/r/worldnews/comments/1i7jvx6/about_1000_north_koreans_killed_fighting_ukraine/	2025-01-22T11:40:28-08:00	https://external-preview.redd.it/J-DznhigLMY4t7axzGEuV-UAHwflsamskYNvgwY9zMI.jpg?width=640&crop=smart&auto=webp&s=8018b60cfa205110d4ea6411fad5be942b6e4861
Over 20,000 Palestinian Children Orphaned by War in Gaza	Over 20,000 Palestinian Children Orphaned by War in Gaza	https://www.reddit.com/r/InternationalNews/comments/1i7jruw/over_20000_palestinian_children_orphaned_by_war/	2025-01-22T11:35:59-08:00	https://external-preview.redd.it/iqZYonD1l8Z3UGZZuiUDBweH2Imbhj_1u6uuQvgK3QY.jpg?width=640&crop=smart&auto=webp&s=3b1b0b00dc721851295039cea9d4cd408d18c119
ICC officials worried Trump sanctions could 'shut the court down'	ICC officials worried Trump sanctions could 'shut the court down'	https://www.reddit.com/r/worldnews/comments/1i7jrck/icc_officials_worried_trump_sanctions_could_shut/	2025-01-22T11:35:26-08:00	https://external-preview.redd.it/E_FNmJrswyU9ZkbojG7_Va9X4pkM-xqkhonqQCZ-XMo.jpg?width=640&crop=smart&auto=webp&s=753c0e32ea709aa162b54992041a753cbc92d966
Iran has about 200 kg of uranium enriched to near bomb-grade, Grossi says	Iran has about 200 kg of uranium enriched to near bomb-grade, Grossi says	https://www.reddit.com/r/worldnews/comments/1i7jlet/iran_has_about_200_kg_of_uranium_enriched_to_near/	2025-01-22T11:28:51-08:00	
Top Saudi diplomat to visit Lebanon for first time in 15 years	Top Saudi diplomat to visit Lebanon for first time in 15 years	https://www.reddit.com/r/worldnews/comments/1i7jelo/top_saudi_diplomat_to_visit_lebanon_for_first/	2025-01-22T11:21:32-08:00	https://external-preview.redd.it/mzy57WlBa6bzkEoMhw26eWtRMWeTyK2pD6_O7Tl-4oQ.jpg?width=640&crop=smart&auto=webp&s=3cb88f17b7c467fea289613f4c0b748d66d649d6
One in five Ukrainians would move abroad if given the chance: survey	One in five Ukrainians would move abroad if given the chance: survey	https://www.reddit.com/r/worldnews/comments/1i7j1xj/one_in_five_ukrainians_would_move_abroad_if_given/	2025-01-22T11:07:41-08:00	https://external-preview.redd.it/x94enZkVhW0JUTcC-BuWm2tXg2UczSfJrwydwcbOgk0.jpg?width=640&crop=smart&auto=webp&s=d7e565512a792e7ed83f32ca79191e44c346f5c4
Top Iranian politician appeals to Trump to restart nuclear deal negotiations	Top Iranian politician appeals to Trump to restart nuclear deal negotiations	https://www.reddit.com/r/worldnews/comments/1i7iygn/top_iranian_politician_appeals_to_trump_to/	2025-01-22T11:03:58-08:00	https://external-preview.redd.it/qO7ZCwvfeDlCv2QWGk5W1CR3IpWnBHxiVOoPGUiNrBg.jpg?width=640&crop=smart&auto=webp&s=ede231bf7b3dbfd766db4a87c41b065972fb9f35
MF Husain: India court orders seizure of 'offensive' paintings	MF Husain: India court orders seizure of 'offensive' paintings	https://www.reddit.com/r/worldnews/comments/1i7iesj/mf_husain_india_court_orders_seizure_of_offensive/	2025-01-22T10:42:25-08:00	https://external-preview.redd.it/LNZee3oqvEpQNx0YESezghBDfQfG-B7S7UYi4yA2sFc.jpg?width=640&crop=smart&auto=webp&s=127c6a7ba3bbdbf4e7cf856cbeacd8e41b8f260f
Ireland on alert as Trump pulls US out of global tax deal	Ireland on alert as Trump pulls US out of global tax deal	https://www.reddit.com/r/worldnews/comments/1i7i9vq/ireland_on_alert_as_trump_pulls_us_out_of_global/	2025-01-22T10:37:13-08:00	https://external-preview.redd.it/Q8g6baxxTDlcMB0gtmmZjixr777BZ20JL4lO8_ryBso.jpg?width=640&crop=smart&auto=webp&s=72784b5038bdff0ff88a0d0757e6f82e47a1d839
Sudan war becomes more deadly as ethnically motivated attacks rise	Sudan war becomes more deadly as ethnically motivated attacks rise	https://www.reddit.com/r/worldnews/comments/1i7hxw1/sudan_war_becomes_more_deadly_as_ethnically/	2025-01-22T10:23:55-08:00	https://external-preview.redd.it/ycd_eSx0ntRqdjcyLb133iEMZCn71kwc5I54EoKgn6I.jpg?width=640&crop=smart&auto=webp&s=4e5c8077ffd43c6e3bcb0d6cab797cb0441f97c2
Yemen's Houthis release crew of seized cargo ship Galaxy Leader	Yemen's Houthis release crew of seized cargo ship Galaxy Leader	https://www.reddit.com/r/worldnews/comments/1i7hgl9/yemens_houthis_release_crew_of_seized_cargo_ship/	2025-01-22T10:04:37-08:00	https://external-preview.redd.it/mE1V9ruh8-TZ8S-acWwrU_1e7wBxQizvHpsQTYhZIso.jpg?width=640&crop=smart&auto=webp&s=1ee227faad9c27053a413e91a9cd5b2906eae8f5
Trump threatens Russia, others with tariffs if Ukraine deal not reached	Trump threatens Russia, others with tariffs if Ukraine deal not reached	https://www.reddit.com/r/worldnews/comments/1i7hcrl/trump_threatens_russia_others_with_tariffs_if/	2025-01-22T10:00:38-08:00	https://external-preview.redd.it/eFWToy37AT1t2IJTBYuqz8b6WGa6hlasoTwiNCzASxc.jpg?width=640&crop=smart&auto=webp&s=990b092f4b2a44e7a06fe446584cf9902e7c1c61
Tennessee high school shooting horror as student opens fire on two in cafeteria	Tennessee high school shooting horror as student opens fire on two in cafeteria	https://www.reddit.com/r/breakingnews/comments/1i7hbhw/tennessee_high_school_shooting_horror_as_student/	2025-01-22T09:59:16-08:00	
Bernie Sanders Calls Out CNN As Part of ‘Serious Problem’ of Billionaires and ‘Wall Street’ Controlling Media — During CNN Hit	Bernie Sanders Calls Out CNN As Part of ‘Serious Problem’ of Billionaires and ‘Wall Street’ Controlling Media — During CNN Hit	https://www.reddit.com/r/InternationalNews/comments/1i7h47y/bernie_sanders_calls_out_cnn_as_part_of_serious/	2025-01-22T09:50:48-08:00	https://external-preview.redd.it/ykYQCBe3KQKEUJrfbedIBlVXJwI9WHuqj0eBf7Y5_ok.jpg?width=640&crop=smart&auto=webp&s=c2efb353adb7c6873cee9e465dfe09c2d43e3ad8
22 states sue to stop Trump's order blocking birthright citizenship	22 states sue to stop Trump's order blocking birthright citizenship	https://www.reddit.com/r/breakingnews/comments/1i7h2ct/22_states_sue_to_stop_trumps_order_blocking/	2025-01-22T09:48:44-08:00	
IAEA: Trump open to new Iran nuclear deal, discussions underway	IAEA: Trump open to new Iran nuclear deal, discussions underway	https://www.reddit.com/r/worldnews/comments/1i7h17c/iaea_trump_open_to_new_iran_nuclear_deal/	2025-01-22T09:47:26-08:00	https://external-preview.redd.it/jN4tcter0542sc5pkWgv6YHy4hS0H2iSOH9e4TEKLCU.jpg?width=640&crop=smart&auto=webp&s=3b71b6fae6574acaabfd0f02f3a215d1e7d10dab
‘The end of women and children’s rights’: outrage as Iraqi law allows child marriage	‘The end of women and children’s rights’: outrage as Iraqi law allows child marriage	https://www.reddit.com/r/worldnews/comments/1i7gxrg/the_end_of_women_and_childrens_rights_outrage_as/	2025-01-22T09:43:30-08:00	https://external-preview.redd.it/cIZzbWNjrVhYSpXeP6jaG78u4NM_fpqHIDmkIb3oAwM.jpg?width=640&crop=smart&auto=webp&s=a10a12ebd4c2a005ef137e07637e0d7eeea6874b
‘Mr. Trump, f— off’: Danish politician lashes out over Greenland proposal	‘Mr. Trump, f— off’: Danish politician lashes out over Greenland proposal	https://www.reddit.com/r/worldnews/comments/1i7gr6v/mr_trump_f_off_danish_politician_lashes_out_over/	2025-01-22T09:35:54-08:00	https://external-preview.redd.it/L_B2xdAiQlPbuSyMc6PY0xBw4LbcWad1IzBehAKXeHY.jpg?width=640&crop=smart&auto=webp&s=c2642253d35dfcdb2017e19c981727d2abb160c3
Jewish professor and son of Holocaust survivors Norman Finkelstein: Israelis are euphoric about the genocide of Gaza; Israel is a lunatic society	Jewish professor and son of Holocaust survivors Norman Finkelstein: Israelis are euphoric about the genocide of Gaza; Israel is a lunatic society	https://www.reddit.com/r/InternationalNews/comments/1i7gp6x/jewish_professor_and_son_of_holocaust_survivors/	2025-01-22T09:33:41-08:00	https://external-preview.redd.it/dWN5ODd6bWV6a2VlMcm8ANmrj4lcPARdcYGdl93iOBakIDyOCg4Opo7YiIcH.png?width=640&crop=smart&auto=webp&s=c3c80de4662dab843f43afb86be8877a969fdbb4
South Korea to remove concrete barriers near runways after fatal crash	South Korea to remove concrete barriers near runways after fatal crash	https://www.reddit.com/r/worldnews/comments/1i7gnxw/south_korea_to_remove_concrete_barriers_near/	2025-01-22T09:32:13-08:00	https://external-preview.redd.it/D1qPqu9C6VdejdqytRFuQe_LNRyz4_L2k77lQUIeaZA.jpg?width=640&crop=smart&auto=webp&s=2c98bb408aa1a9fc3b987121a9b9738eaa37fe34
Japan to allow schools to exclusively use digital textbooks from 2030	Japan to allow schools to exclusively use digital textbooks from 2030	https://www.reddit.com/r/worldnews/comments/1i7gmwh/japan_to_allow_schools_to_exclusively_use_digital/	2025-01-22T09:30:57-08:00	https://external-preview.redd.it/iprUCCXSIJNoK2-4wGGKvKhZjJFegKmSG4oGkk7fpWs.jpg?width=640&crop=smart&auto=webp&s=d937bb625bb9a104fc808120c8d7ea406b349b5e
Royal Navy tracks Russian ‘spy ship’ closely after it enters UK waters	Royal Navy tracks Russian ‘spy ship’ closely after it enters UK waters	https://www.reddit.com/r/worldnews/comments/1i7fp0s/royal_navy_tracks_russian_spy_ship_closely_after/	2025-01-22T08:53:31-08:00	https://external-preview.redd.it/9r91RS5HoMkJZ4kLeus_6zE5vL17YeOcoUm_3v-Cxvo.jpg?width=640&crop=smart&auto=webp&s=553e8863217beb1e5844a4faef822f1b81d617f3
White House cheers release of two Americans freed in a swap with Taliban brokered by Biden, Qatar	White House cheers release of two Americans freed in a swap with Taliban brokered by Biden, Qatar	https://www.reddit.com/r/worldnews/comments/1i7fjca/white_house_cheers_release_of_two_americans_freed/	2025-01-22T08:46:56-08:00	https://external-preview.redd.it/COfi4RNcMmYDWn-bHGOAM0gk4SjQ33ZsLqG9gTT2AUw.jpg?width=320&crop=smart&auto=webp&s=834f06c2cccc759258422cbee74da4366802c6bf
Trump threatens Russia with sanctions, tariffs if Putin doesn't end Ukraine war	Trump threatens Russia with sanctions, tariffs if Putin doesn't end Ukraine war	https://www.reddit.com/r/worldnews/comments/1i7fdze/trump_threatens_russia_with_sanctions_tariffs_if/	2025-01-22T08:40:48-08:00	https://external-preview.redd.it/GHFS9ymlhcQGiz4wncRVrsTyrXc7fkMUujJOwkR89S4.jpg?width=640&crop=smart&auto=webp&s=3358cf9f93942e571e388c1f50cfdb7421455495
At least 10 Palestinians killed as Israel launches operation in Jenin	At least 10 Palestinians killed as Israel launches operation in Jenin	https://www.reddit.com/r/worldnews/comments/1i7fdiz/at_least_10_palestinians_killed_as_israel/	2025-01-22T08:40:18-08:00	https://external-preview.redd.it/Fj7rnxS4SkrMGSjVjsbLl1rNa9e3nnP1utiLX4YfH44.jpg?width=640&crop=smart&auto=webp&s=e31576c094bcf755d5c899442ad41585f62368b8
Danish Politician responds back to Mr.Trump’s Greenland’s interest.	Danish Politician responds back to Mr.Trump’s Greenland’s interest.	https://www.reddit.com/r/worldnews/comments/1i7ep4k/danish_politician_responds_back_to_mrtrumps/	2025-01-22T08:12:11-08:00	https://external-preview.redd.it/Qn7bIGysqSYbDhypY7YLhRd74S6dnsVqypiSWWUxJ1U.jpg?width=320&crop=smart&auto=webp&s=6623a73d84494202dec151088b45924288f09785
Palestinians confront a landscape of destruction in Gaza’s ‘ghost towns’	Palestinians confront a landscape of destruction in Gaza’s ‘ghost towns’	https://www.reddit.com/r/InternationalNews/comments/1i7eoy5/palestinians_confront_a_landscape_of_destruction/	2025-01-22T08:11:58-08:00	https://external-preview.redd.it/MHR1YzFwaGlra2VlMcmRvcXbhc053TuuRHpxV5tBi-NdH_5IgYHTquRFf6KZ.png?width=640&crop=smart&auto=webp&s=cb90a26360a7408801f59cebcf6f8441e37432cc
Birth rate in South Korea, the world's lowest, set to rise for the first time in nine years	Birth rate in South Korea, the world's lowest, set to rise for the first time in nine years	https://www.reddit.com/r/worldnews/comments/1i7emty/birth_rate_in_south_korea_the_worlds_lowest_set/	2025-01-22T08:09:31-08:00	https://external-preview.redd.it/M45yKqVqzjGuKF3P7nE5teYHcBaOt4_01Ot6xM14hY0.jpg?width=640&crop=smart&auto=webp&s=a357c03432eb3e80aaf9a065ea13441cabf56f98
Thailand tops the list as ASEAN travelers' number one dream destination	Thailand tops the list as ASEAN travelers' number one dream destination	https://www.reddit.com/r/worldnews/comments/1i7ea59/thailand_tops_the_list_as_asean_travelers_number/	2025-01-22T07:55:06-08:00	https://external-preview.redd.it/AcljY5355u9rhKfPTNDNW1sribLFfwHLPFnF69exMD8.jpg?width=640&crop=smart&auto=webp&s=bdc34e0dc37525c15940d6a1475086a57bb18f8b
UK warns Putin after Russian spy ship returns to British waters	UK warns Putin after Russian spy ship returns to British waters	https://www.reddit.com/r/worldnews/comments/1i7dt5u/uk_warns_putin_after_russian_spy_ship_returns_to/	2025-01-22T07:35:02-08:00	https://external-preview.redd.it/0B--y64rKeuaEIFwqsVCKVdUdx4w156ks47br4ME7PI.jpg?width=640&crop=smart&auto=webp&s=9f4f3742eaa8c05b745ed906566b7e4a07debaf0
Dutch government ordered to cut nitrogen emissions by 2030: Victory for Greenpeace	Dutch government ordered to cut nitrogen emissions by 2030: Victory for Greenpeace	https://www.reddit.com/r/worldnews/comments/1i7dnez/dutch_government_ordered_to_cut_nitrogen/	2025-01-22T07:28:17-08:00	https://external-preview.redd.it/sbPGx8ftNdXQ5_ooQbb1h9THrGZqwuM7ZAgRU4zAVw0.jpg?width=640&crop=smart&auto=webp&s=6a931589b69db8cf7757882e5e7fa62c43bdff6d
Turkey detains nine people over ski resort hotel fire that killed 76	Turkey detains nine people over ski resort hotel fire that killed 76	https://www.reddit.com/r/worldnews/comments/1i7d9t1/turkey_detains_nine_people_over_ski_resort_hotel/	2025-01-22T07:12:11-08:00	https://external-preview.redd.it/uKDZbKtARQRXhEueeROpLeKrHtk2-EEZhboZGv4Snys.jpg?width=640&crop=smart&auto=webp&s=976e4c24700608b73d034f90a3af321eaf9e73bb
'Fico’s lying again, but Slovakia isn’t just Fico'': an interview with Slovakia's opposition leader	'Fico’s lying again, but Slovakia isn’t just Fico'': an interview with Slovakia's opposition leader	https://www.reddit.com/r/worldnews/comments/1i7d7m8/ficos_lying_again_but_slovakia_isnt_just_fico_an/	2025-01-22T07:09:30-08:00	https://external-preview.redd.it/H7ZQSWqAkIYlk54hLbPNwPXnX2e4nmuOpzqLIlEHKb8.jpg?width=640&crop=smart&auto=webp&s=de826c9789a004297049afc98d8c3de4d4127ecc
Zelenskiy Tells Trump Ukraine Needs US Troops to Secure Peace	Zelenskiy Tells Trump Ukraine Needs US Troops to Secure Peace	https://www.reddit.com/r/worldnews/comments/1i7d55t/zelenskiy_tells_trump_ukraine_needs_us_troops_to/	2025-01-22T07:06:36-08:00	https://external-preview.redd.it/xkZX5K-ery8MhSDJ0neNKvMpjAuXo6XpmqAHJheDEmY.jpg?width=640&crop=smart&auto=webp&s=1a559dd6d7c86971145cec166fb2bf3cc981b38a
Amazon is ceasing operations in Quebec	Amazon is ceasing operations in Quebec	https://www.reddit.com/r/worldnews/comments/1i7cyzo/amazon_is_ceasing_operations_in_quebec/	2025-01-22T06:59:11-08:00	https://external-preview.redd.it/sF97gGFKRK5AZFkr_ahKOm-VzSuY7k_fLNRWrG_9Gc8.jpg?width=640&crop=smart&auto=webp&s=b3d9ff997c1933f2fafbb2b1fc17a3b2a6b87b2e
Italy’s Meloni under fire after freeing Libyan warlord	Italy’s Meloni under fire after freeing Libyan warlord	https://www.reddit.com/r/worldnews/comments/1i7cxqa/italys_meloni_under_fire_after_freeing_libyan/	2025-01-22T06:57:36-08:00	https://external-preview.redd.it/l7DhYfTGKZ9Tnzyyq92SsHvzYJqQ2aaEhJV1_vTRmkE.jpg?width=640&crop=smart&auto=webp&s=248fad005f2b637cdf96c9adadd6fbfef4f4d3d2
Google rushed to sell AI tools to Israel’s military after Hamas attack	Google rushed to sell AI tools to Israel’s military after Hamas attack	https://www.reddit.com/r/worldnews/comments/1i7clqp/google_rushed_to_sell_ai_tools_to_israels/	2025-01-22T06:42:04-08:00	https://external-preview.redd.it/P1winhZPEQREQ9dF3yHl8nObGkmADSZ04Rc4oVl3fs0.jpg?width=640&crop=smart&auto=webp&s=c79f3276eb0668820f3638ed26a2d4af8e56ed05
Amazon is closing ALL warehouses in Quebec after unionizing took place at one of the warehouses	Amazon is closing ALL warehouses in Quebec after unionizing took place at one of the warehouses	https://www.reddit.com/r/worldnews/comments/1i7cjjr/amazon_is_closing_all_warehouses_in_quebec_after/	2025-01-22T06:39:14-08:00	https://external-preview.redd.it/LH0SRtS6jUFtJORkcoWXXGNFkphYv0D9Sq0X55_BwDU.jpg?width=640&crop=smart&auto=webp&s=70083f263e33f87b9aa724b3c666c311d6016abb
‘I’m proud of Thailand’: Couples to tie the knot in mass weddings as same-sex marriage become legal	‘I’m proud of Thailand’: Couples to tie the knot in mass weddings as same-sex marriage become legal	https://www.reddit.com/r/worldnews/comments/1i7cimu/im_proud_of_thailand_couples_to_tie_the_knot_in/	2025-01-22T06:38:02-08:00	https://external-preview.redd.it/R7nyBJamR1QhCy7rM3DyghGFC-i86LLFfmOQTjkonc0.jpg?width=640&crop=smart&auto=webp&s=c23c9d2aa80fa7f1218b965a89a717fb4bb8f50f
France remains world’s most visited country with over 100 million tourists in 2024	France remains world’s most visited country with over 100 million tourists in 2024	https://www.reddit.com/r/worldnews/comments/1i7ci3l/france_remains_worlds_most_visited_country_with/	2025-01-22T06:37:21-08:00	https://external-preview.redd.it/Aovm_YsW2RHn5txAEFowEWtqCWeyi8YJplenWtNHy_M.jpg?width=640&crop=smart&auto=webp&s=193c523da9f6d7d40c5dcb9235594e5ee7187301
Ukraine's Special Forces say they killed 21 North Korean soldiers, show combat footage	Ukraine's Special Forces say they killed 21 North Korean soldiers, show combat footage	https://www.reddit.com/r/worldnews/comments/1i7cbo7/ukraines_special_forces_say_they_killed_21_north/	2025-01-22T06:29:00-08:00	https://external-preview.redd.it/wEA0p-jSmX-KTcetJ76BP9zmy4IPlPDKeS_v-QTfff8.jpg?width=320&crop=smart&auto=webp&s=025c5c747b9007ac587a780ede56ef63b4772ae5
Alarm in Asia after Trump calls North Korea a nuclear power	Alarm in Asia after Trump calls North Korea a nuclear power	https://www.reddit.com/r/InternationalNews/comments/1i7c53q/alarm_in_asia_after_trump_calls_north_korea_a/	2025-01-22T06:20:22-08:00	https://external-preview.redd.it/cYa3jmUnrnlZOF1sRua-IzsSzBsvoHPznvRV2BBUOoI.jpg?width=640&crop=smart&auto=webp&s=850dead3ef76af0e6d59899f4167dc8fed6170a3
Finland Seizes Tanker Suspected of Damaging Baltic Sea Cable – Yle	Finland Seizes Tanker Suspected of Damaging Baltic Sea Cable – Yle	https://www.reddit.com/r/worldnews/comments/1i7c50u/finland_seizes_tanker_suspected_of_damaging/	2025-01-22T06:20:16-08:00	https://external-preview.redd.it/GW5LdlDnBpqQg7MVKWlqdZfe6g6zsWylQ3vH4q689bE.jpg?width=640&crop=smart&auto=webp&s=e6582c77678e228f5e14b94c0fe2195c7f9a7883
It's Out of Control': UnitedHealth Group and Peers Charged Americans 1000% More for Drugs	It's Out of Control': UnitedHealth Group and Peers Charged Americans 1000% More for Drugs	https://www.reddit.com/r/InternationalNews/comments/1i7bgix/its_out_of_control_unitedhealth_group_and_peers/	2025-01-22T05:47:17-08:00	https://external-preview.redd.it/EhLi0xvLpnKnb5woqIS9yQ2xEZLwUopyRo5PDvSsz04.jpg?width=640&crop=smart&auto=webp&s=6f80c0da1cc7120b93a5bfc12bd0a78ab895ce99
India, US in talks to schedule Modi-Trump meeting next month: Sources - CNBC TV18	India, US in talks to schedule Modi-Trump meeting next month: Sources - CNBC TV18	https://www.reddit.com/r/worldnews/comments/1i7bf2i/india_us_in_talks_to_schedule_moditrump_meeting/	2025-01-22T05:45:17-08:00	https://external-preview.redd.it/rfb4DeAm9A3fduMiwFNPwVrO0EXRKIzezfrwISG5cJM.jpg?width=320&crop=smart&auto=webp&s=65bae148f86aa05c6afc975d950f38d6ba0a7a58
Israeli army and Palestinian Authority besiege and raid Jenin hospitals	Israeli army and Palestinian Authority besiege and raid Jenin hospitals	https://www.reddit.com/r/InternationalNews/comments/1i7bak0/israeli_army_and_palestinian_authority_besiege/	2025-01-22T05:38:48-08:00	https://external-preview.redd.it/HjbgEqvvJiJxUBWluE6m3oSb0m9u-tA0X9rQ74YZKUQ.jpg?width=640&crop=smart&auto=webp&s=f0866e24c65c77742d14cf719dc8d9e1e55f92e6
Google rushed to sell AI tools to Israel’s military after Hamas attack	Google rushed to sell AI tools to Israel’s military after Hamas attack	https://www.reddit.com/r/InternationalNews/comments/1i7b84z/google_rushed_to_sell_ai_tools_to_israels/	2025-01-22T05:35:11-08:00	https://external-preview.redd.it/P1winhZPEQREQ9dF3yHl8nObGkmADSZ04Rc4oVl3fs0.jpg?width=640&crop=smart&auto=webp&s=c79f3276eb0668820f3638ed26a2d4af8e56ed05
