Title	Description	Link	pubDate	Image
Israel-Hamas ceasefire takes effect after delay	Israel-Hamas ceasefire takes effect after delay	https://www.reddit.com/r/worldnews/comments/1i4vj7r/israelhamas_ceasefire_takes_effect_after_delay/	2025-01-19T02:21:13-08:00	https://external-preview.redd.it/FjsV3NsQFa5dewiHBa-YPfmrRe3ZvCL_WbWzWY16-mc.jpg?width=640&crop=smart&auto=webp&s=aa93112751647b70e4c552c580c94e2d76c08d48
Russian trainee pilots appear to be hunting Ukrainian civilians	Russian trainee pilots appear to be hunting Ukrainian civilians	https://www.reddit.com/r/worldnews/comments/1i4v86v/russian_trainee_pilots_appear_to_be_hunting/	2025-01-19T01:58:39-08:00	https://external-preview.redd.it/3AD91MWkzrt9GIb6ZJlBYJuumnSWi_VaQMkAtDfiwFE.jpg?width=640&crop=smart&auto=webp&s=2c310132bec8cc0a8106fb6bdd88d3ba653a5f1b
Ben-Gvir, Otzma Yehudit MKs resign from coalition over hostage deal	Ben-Gvir, Otzma Yehudit MKs resign from coalition over hostage deal	https://www.reddit.com/r/worldnews/comments/1i4v4v6/bengvir_otzma_yehudit_mks_resign_from_coalition/	2025-01-19T01:51:46-08:00	
Israel and Hamas ceasefire deal takes effect as families await hostage release	Israel and Hamas ceasefire deal takes effect as families await hostage release	https://www.reddit.com/r/worldnews/comments/1i4v340/israel_and_hamas_ceasefire_deal_takes_effect_as/	2025-01-19T01:48:20-08:00	https://external-preview.redd.it/j9nGTuA67aCo-6j0O8Iimpcl64OYZJQJPdoilkz1Jc0.jpg?width=640&crop=smart&auto=webp&s=77d0f9e5bdbff5af198dc074409273c4015ef430
Israel says ceasefire with Hamas begins, after delay	Israel says ceasefire with Hamas begins, after delay	https://www.reddit.com/r/worldnews/comments/1i4uv4t/israel_says_ceasefire_with_hamas_begins_after/	2025-01-19T01:31:47-08:00	https://external-preview.redd.it/Te_ZNqCNpjt2KdTJVqzAwLPJJOGZ18qXBgqv8YmlJSg.jpg?width=640&crop=smart&auto=webp&s=17a4d5fabd43894ce0b703e9032ec39e35f7311b
Climbers Using Xenon Gas, Which is Banned in Sports, to Climb Everest - Gripped Magazine	Climbers Using Xenon Gas, Which is Banned in Sports, to Climb Everest - Gripped Magazine	https://www.reddit.com/r/worldnews/comments/1i4ubls/climbers_using_xenon_gas_which_is_banned_in/	2025-01-19T00:50:59-08:00	https://external-preview.redd.it/op_sdrJJOVQ5U3ZFiEUfD_X_FNjfKbl5NdGLd1WkACo.jpg?width=640&crop=smart&auto=webp&s=ddf09ecb41f9436e2f184011901a7f059e4625a3
Israel’s Hostages: the Only Ones That Matter. As Israel & global media celebrate the impending release of 33 Israeli hostages, they ignore the 1,000 P...	Israel’s Hostages: the Only Ones That Matter. As Israel & global media celebrate the impending release of 33 Israeli hostages, they ignore the 1,000 P...	https://www.reddit.com/r/InternationalNews/comments/1i4uasl/israels_hostages_the_only_ones_that_matter_as/	2025-01-19T00:49:18-08:00	https://external-preview.redd.it/7oIY0NVtHBq6IBHcxPNPe3Yv8zfOeAZxXXkCaQCFihU.jpg?width=320&crop=smart&auto=webp&s=a62f841ba5931c0c40ba2c282e945d04e524a76d
Israeli forces attack Gaza after Ceasefire deal missed.	Israeli forces attack Gaza after Ceasefire deal missed.	https://www.reddit.com/r/worldnews/comments/1i4u52f/israeli_forces_attack_gaza_after_ceasefire_deal/	2025-01-19T00:37:27-08:00	https://external-preview.redd.it/XDaWhUNxrYcbnWiVS0QTZ6BHT2kGYTHexsjR0gqdkdo.jpg?width=640&crop=smart&auto=webp&s=7a862ed70f0c20ea7a1745db8089027aee923edd
US sanctions against key Orbán ally have 'strengthened' him, Hungary's PM says	US sanctions against key Orbán ally have 'strengthened' him, Hungary's PM says	https://www.reddit.com/r/worldnews/comments/1i4u4pt/us_sanctions_against_key_orbán_ally_have/	2025-01-19T00:36:44-08:00	https://external-preview.redd.it/-nHsCwaFwaspZcg1b6lbTcN5xP1VaEwymf3xCAM5vUI.jpg?width=640&crop=smart&auto=webp&s=c4b3a89b98dd28effb9cc30d6efd93970376a0d3
TikTok Banned in the US: The Rise of RedNote as a Surprising Alternative	TikTok Banned in the US: The Rise of RedNote as a Surprising Alternative	https://www.reddit.com/r/InternationalNews/comments/1i4twoo/tiktok_banned_in_the_us_the_rise_of_rednote_as_a/	2025-01-19T00:20:28-08:00	https://external-preview.redd.it/_-czNrJObcszfAXaEaFS4jxV4qHXXgewqlifH7_IeKc.jpg?width=640&crop=smart&auto=webp&s=ab4e2cbcdf6f0186fa7f275c3900a97e7f0559bb
/r/WorldNews Live Thread: Russian Invasion of Ukraine Day 1060, Part 1 (Thread #1207)	/r/WorldNews Live Thread: Russian Invasion of Ukraine Day 1060, Part 1 (Thread #1207)	https://www.reddit.com/r/worldnews/comments/1i4tiv4/rworldnews_live_thread_russian_invasion_of/	2025-01-18T23:52:15-08:00	https://a.thumbs.redditmedia.com/jWqSTFxxKuo9aDK8JeM4yZL4Nb_RTA85H45u1-h63L8.jpg
Telegram boss admits 'seriousness' of French allegations: source	Telegram boss admits 'seriousness' of French allegations: source	https://www.reddit.com/r/worldnews/comments/1i4th1g/telegram_boss_admits_seriousness_of_french/	2025-01-18T23:48:35-08:00	https://external-preview.redd.it/_U3y4vpBqCFJS4s1t0F88PfKrPwUMQtXyNlaWtbgzck.jpg?width=640&crop=smart&auto=webp&s=585b8be5eb4c3d32823498171f2c489b9a38d1b6
Sikh protests force cinemas in 3 UK cities to pull screenings of 'Emergency'	Sikh protests force cinemas in 3 UK cities to pull screenings of 'Emergency'	https://www.reddit.com/r/worldnews/comments/1i4tgxd/sikh_protests_force_cinemas_in_3_uk_cities_to/	2025-01-18T23:48:20-08:00	https://external-preview.redd.it/mhTbOMMN09akxI1bIv5t9z7kjyLuZToZZFKtAfxXKGc.jpg?width=640&crop=smart&auto=webp&s=3be1e0713c69f8b86382e772429e66e6bb6bfedf
Hambantota port: Sri Lanka inks $3.7billion deal with Chinese oil giant	Hambantota port: Sri Lanka inks $3.7billion deal with Chinese oil giant	https://www.reddit.com/r/worldnews/comments/1i4tgsn/hambantota_port_sri_lanka_inks_37billion_deal/	2025-01-18T23:48:01-08:00	https://external-preview.redd.it/fktyYuSIqmaixJsNNcQ0q3cosOEDuh2J0uPzTOh47pw.jpg?width=640&crop=smart&auto=webp&s=1683ac4490d3c834b0a198c14bed0edc7b614394
Nigeria is admitted as a partner country of the BRICS bloc	Nigeria is admitted as a partner country of the BRICS bloc	https://www.reddit.com/r/worldnews/comments/1i4tgra/nigeria_is_admitted_as_a_partner_country_of_the/	2025-01-18T23:47:56-08:00	https://external-preview.redd.it/XIovFelgId8h94AMfg0IzOlJ70gAw1M35FwrWJSfO8U.jpg?width=640&crop=smart&auto=webp&s=b9d6c5541b91855daeb38751dcd06ee02e7f8109
Escaped death by 20 mins': Sheikh Hasina claims political opponents conspired to kill her	Escaped death by 20 mins': Sheikh Hasina claims political opponents conspired to kill her	https://www.reddit.com/r/worldnews/comments/1i4tgj5/escaped_death_by_20_mins_sheikh_hasina_claims/	2025-01-18T23:47:27-08:00	https://external-preview.redd.it/0_feU1AXmnfYn17zDqd9K3v63e3wIIuPTsA-wXCvSVk.jpg?width=640&crop=smart&auto=webp&s=d48dcebeaaddd0e3789823928c8746e18bf8501d
Elon Musk says 'Make Europe Great Again' as he continues his push into European politics	Elon Musk says 'Make Europe Great Again' as he continues his push into European politics	https://www.reddit.com/r/worldnews/comments/1i4t602/elon_musk_says_make_europe_great_again_as_he/	2025-01-18T23:26:08-08:00	https://external-preview.redd.it/i2n2OeXkNbKC4kC9Q3lGwFNEs5lO0ne_2-_qw_OxU3Y.jpg?width=640&crop=smart&auto=webp&s=51bd79ecdc6b964ef2c191709388a203d61f558b
Water filtration and bright smiles	Water filtration and bright smiles	https://www.reddit.com/r/worldnews/comments/1i4sxvi/water_filtration_and_bright_smiles/	2025-01-18T23:09:59-08:00	https://external-preview.redd.it/jhyKdKDWSbU483nHCfobfnOox7l-6wwXzIV3Azgr__M.jpg?width=640&crop=smart&auto=webp&s=647271fcb769b91745a2e70c0944fa87cc975bda
Deadline passes without Gaza ceasefire as Hamas fails to provide names of first hostages to be freed	Deadline passes without Gaza ceasefire as Hamas fails to provide names of first hostages to be freed	https://www.reddit.com/r/worldnews/comments/1i4sx73/deadline_passes_without_gaza_ceasefire_as_hamas/	2025-01-18T23:08:39-08:00	https://external-preview.redd.it/0EvmAfq-AauoJ8XIYxajJ-6eWb47ONuGYz6rZxzxIPw.jpg?width=640&crop=smart&auto=webp&s=7ae036e21142867dc490d307a6c46c6e3e799002
Iran: Two supreme court judges shot dead in Tehran	Iran: Two supreme court judges shot dead in Tehran	https://www.reddit.com/r/worldnews/comments/1i4svnf/iran_two_supreme_court_judges_shot_dead_in_tehran/	2025-01-18T23:05:40-08:00	https://external-preview.redd.it/6h0AhDKPEFsYyExs7k_qI1rCCqUqlAflJKy66BGRsXE.jpg?width=640&crop=smart&auto=webp&s=11ed4738d950dbfe1232d598e0b54e79b66d4d79
Hamas already in violation of the terms of the ceasefire agreement by not sending the names of the hostages that are supposed to be released today. ID...	Hamas already in violation of the terms of the ceasefire agreement by not sending the names of the hostages that are supposed to be released today. ID...	https://www.reddit.com/r/worldnews/comments/1i4stw2/hamas_already_in_violation_of_the_terms_of_the/	2025-01-18T23:02:18-08:00	https://external-preview.redd.it/0bYjlexvqsZmFx5IKEQqK3jAIDMw6xH8qpDoPTrSH3o.jpg?width=640&crop=smart&auto=webp&s=54cb8cf1668904b9c362031ce6078e4a86fbdfe8
Ceasefire officially delayed as Hamas fails to provide names of hostages to be released	Ceasefire officially delayed as Hamas fails to provide names of hostages to be released	https://www.reddit.com/r/worldnews/comments/1i4srks/ceasefire_officially_delayed_as_hamas_fails_to/	2025-01-18T22:58:12-08:00	
An imprisoned Nobel laureate (Ales Bialiatski) underscores human rights abuses in Belarus	An imprisoned Nobel laureate (Ales Bialiatski) underscores human rights abuses in Belarus	https://www.reddit.com/r/worldnews/comments/1i4scng/an_imprisoned_nobel_laureate_ales_bialiatski/	2025-01-18T22:30:51-08:00	https://external-preview.redd.it/5TdyFbmxa0G42BaMxM8qsgbyUUjcqf55Gn8Rq-OBBvM.jpg?width=640&crop=smart&auto=webp&s=88de056a78a7f0aae54dd416125875b8439fbc81
Reports that US to impose sanctions on Sudan's army chief, Burhan	Reports that US to impose sanctions on Sudan's army chief, Burhan	https://www.reddit.com/r/InternationalNews/comments/1i4s887/reports_that_us_to_impose_sanctions_on_sudans/	2025-01-18T22:22:58-08:00	https://external-preview.redd.it/azBleHRicDE5d2RlMTnZ_UAoa1Ul4VamzV2sPxHS_81aaFoxIFUkZwNEW_fF.png?width=640&crop=smart&auto=webp&s=655bea430e1520c20c4bf5fb3f063afb2dd9fa9a
IDF secret op. brings back body of Oron Shaul - Israel News - The Jerusalem Post	IDF secret op. brings back body of Oron Shaul - Israel News - The Jerusalem Post	https://www.reddit.com/r/worldnews/comments/1i4s60c/idf_secret_op_brings_back_body_of_oron_shaul/	2025-01-18T22:19:02-08:00	
Security forces secret op. brings back body of Oron Shaul ahead of Gaza ceasefire	Security forces secret op. brings back body of Oron Shaul ahead of Gaza ceasefire	https://www.reddit.com/r/worldnews/comments/1i4s5pv/security_forces_secret_op_brings_back_body_of/	2025-01-18T22:18:30-08:00	
Netanyahu warns again that Gaza ceasefire will not begin until Hamas provides a hostage list	Netanyahu warns again that Gaza ceasefire will not begin until Hamas provides a hostage list	https://www.reddit.com/r/worldnews/comments/1i4rz3d/netanyahu_warns_again_that_gaza_ceasefire_will/	2025-01-18T22:06:41-08:00	https://external-preview.redd.it/0EvmAfq-AauoJ8XIYxajJ-6eWb47ONuGYz6rZxzxIPw.jpg?width=640&crop=smart&auto=webp&s=7ae036e21142867dc490d307a6c46c6e3e799002
Europe buying Russian gas at record speed despite cut off sanctions - Politico	Europe buying Russian gas at record speed despite cut off sanctions - Politico	https://www.reddit.com/r/worldnews/comments/1i4rvp5/europe_buying_russian_gas_at_record_speed_despite/	2025-01-18T22:00:53-08:00	https://external-preview.redd.it/A-paaJKaa9MEf3nE8ZyFnrVoWw2AHs4Dc4n8HoH43Cs.jpg?width=640&crop=smart&auto=webp&s=189c85866de5a73600555a864bb73a31d4ab4b21
Fuel tanker explosion kills 77 people in Suleja area of Nigeria	Fuel tanker explosion kills 77 people in Suleja area of Nigeria	https://www.reddit.com/r/worldnews/comments/1i4rn7f/fuel_tanker_explosion_kills_77_people_in_suleja/	2025-01-18T21:45:56-08:00	https://external-preview.redd.it/O8Rp6tNvBSiUShmi5Gj5-pqI8-yhLYP1r7DQcpTLvOw.jpg?width=640&crop=smart&auto=webp&s=94a07a8807099f51448711763f119336b6890b1e
Rwanda President Kagame slams UN troops in DRC	Rwanda President Kagame slams UN troops in DRC	https://www.reddit.com/r/InternationalNews/comments/1i4rl57/rwanda_president_kagame_slams_un_troops_in_drc/	2025-01-18T21:42:29-08:00	https://external-preview.redd.it/M3VzODRhbnQxd2RlMSk8VHdImmO0CDf7zQ5n7ZoCJXLYmDXXvD9ulx0WUZmT.png?width=640&crop=smart&auto=webp&s=5dc9db0202a30a5ea5aa077aeb542ff2d39f4854
TikTok shuts down in the United States hours ahead of a ban	TikTok shuts down in the United States hours ahead of a ban	https://www.reddit.com/r/worldnews/comments/1i4qvwc/tiktok_shuts_down_in_the_united_states_hours/	2025-01-18T21:01:17-08:00	https://external-preview.redd.it/fxyjgHnFKThOnanmAXQi66s3zZMDAWeoBnTxnENA5lQ.jpg?width=640&crop=smart&auto=webp&s=f4319c7306a5fe89b0ce780b33b562915280bac9
Exclusive: How U.S. forces and NASA could inadvertently be spying for China	Exclusive: How U.S. forces and NASA could inadvertently be spying for China	https://www.reddit.com/r/InternationalNews/comments/1i4qifi/exclusive_how_us_forces_and_nasa_could/	2025-01-18T20:40:40-08:00	https://external-preview.redd.it/uDt9dUaOBV-46Ub_Hq-i6cyUn1qK-JCNewDQprODIo4.jpg?width=640&crop=smart&auto=webp&s=3fb48f2091f624d31200bd5700710e0232de9147
Medics under siege: 'We took this photo, fearing it would be our last'	Medics under siege: 'We took this photo, fearing it would be our last'	https://www.reddit.com/r/worldnews/comments/1i4qhdy/medics_under_siege_we_took_this_photo_fearing_it/	2025-01-18T20:39:07-08:00	https://external-preview.redd.it/65kiinTI4rNpP-AtwJQNug7wtmTjucEoTWuDKtKylCQ.jpg?width=640&crop=smart&auto=webp&s=590fa4bf2bf264739bc149fc0e8759a16a2fc76d
TikTok Starts Going Dark in the U.S.	TikTok Starts Going Dark in the U.S.	https://www.reddit.com/r/worldnews/comments/1i4pw48/tiktok_starts_going_dark_in_the_us/	2025-01-18T20:08:48-08:00	https://external-preview.redd.it/ubKhwAlelPP1QugO-FCXFUoD16oyqIxoiEtWF3URG6U.jpg?width=640&crop=smart&auto=webp&s=03905beeb4d43a481e476a8f940d4c125fd42706
Economic recovery is losing steam, new ILO report says	Economic recovery is losing steam, new ILO report says	https://www.reddit.com/r/worldnews/comments/1i4ptlx/economic_recovery_is_losing_steam_new_ilo_report/	2025-01-18T20:05:14-08:00	https://external-preview.redd.it/ScIOWP4AsUN2C9vWsdu3Or2suwxqJvJBdKs0qBDaCKg.jpg?width=640&crop=smart&auto=webp&s=70fcb655b31b689bb22fd95e391e1dfa050e6b4e
TikTok is down in the US	TikTok is down in the US	https://www.reddit.com/r/InternationalNews/comments/1i4piqi/tiktok_is_down_in_the_us/	2025-01-18T19:50:18-08:00	https://external-preview.redd.it/T-_Nd8BDXMBT9itTOKLgZqeBJNBVOFG2EHo3ncqK5XU.jpg?width=640&crop=smart&auto=webp&s=e27fb254c95f091f75a861e4cdd5d5888ddb0136
Russia to prepare for war with NATO	Russia to prepare for war with NATO	https://www.reddit.com/r/worldnews/comments/1i4pbs6/russia_to_prepare_for_war_with_nato/	2025-01-18T19:40:55-08:00	https://external-preview.redd.it/l9orHcRDyb1RzR9PrwnaPD-55cdQrc-HshI8Wt9eZwk.jpg?width=640&crop=smart&auto=webp&s=21262bfc79ca1b190e84e62a38f1d08ea9484192
India, Bangladesh farmers clash over 'stolen crop', 'cutting of mango trees' | Kolkata News - The Times of India	India, Bangladesh farmers clash over 'stolen crop', 'cutting of mango trees' | Kolkata News - The Times of India	https://www.reddit.com/r/worldnews/comments/1i4only/india_bangladesh_farmers_clash_over_stolen_crop/	2025-01-18T19:04:33-08:00	https://external-preview.redd.it/0n9DY4uHYVxOdoSmgvY7wEP-bGSQdnhc78qVCHbW7Ao.jpg?width=640&crop=smart&auto=webp&s=05df8d895f2338e0474431f58cab922c7bccd187
Protesters storm South Korea court after it extends Yoon's detention	Protesters storm South Korea court after it extends Yoon's detention	https://www.reddit.com/r/worldnews/comments/1i4oamx/protesters_storm_south_korea_court_after_it/	2025-01-18T18:45:19-08:00	https://external-preview.redd.it/hPm7_JbdS6ahQcgrSO8ecLbQb8nDt3UBhPin1X2OTCI.jpg?width=640&crop=smart&auto=webp&s=ef7086f270255f2e353bb83fc025617a9cb403a1
Support for Trump’s Policies Exceeds Support for Trump	Support for Trump’s Policies Exceeds Support for Trump	https://www.reddit.com/r/breakingnews/comments/1i4oakb/support_for_trumps_policies_exceeds_support_for/	2025-01-18T18:45:12-08:00	
Patients dying in hospital corridors, say British nurses - The Times of India	Patients dying in hospital corridors, say British nurses - The Times of India	https://www.reddit.com/r/InternationalNews/comments/1i4o1p7/patients_dying_in_hospital_corridors_say_british/	2025-01-18T18:31:25-08:00	https://external-preview.redd.it/IZna03IEcnwTfhi0zyDhNDm9clYFP37zDylpujsHk2Y.jpg?width=640&crop=smart&auto=webp&s=5de3751e17df8cfcc6e4eeeb953e6ac725fd5af4
Trump’s Deportation Plan Is Said to Start Next Week in Chicago	Trump’s Deportation Plan Is Said to Start Next Week in Chicago	https://www.reddit.com/r/InternationalNews/comments/1i4ny4o/trumps_deportation_plan_is_said_to_start_next/	2025-01-18T18:26:03-08:00	https://external-preview.redd.it/kB0_eehX-jAeK54US5HV4jY1guLKEC8hCX1v4mI1c30.jpg?width=640&crop=smart&auto=webp&s=c1c60feae1f7ec8cb1fe974a76299aa4f1afa0c1
Spermageddon': global decline in sperm count could threaten humanity	Spermageddon': global decline in sperm count could threaten humanity	https://www.reddit.com/r/worldnews/comments/1i4nh1o/spermageddon_global_decline_in_sperm_count_could/	2025-01-18T18:00:58-08:00	https://external-preview.redd.it/wEKL8n2O8OmNx7pwvRIODprVtBfY8kEqznLZMXGOMqU.jpg?width=640&crop=smart&auto=webp&s=6d5ae4b1c7049f59baedcf0bb9970e9a63b81404
Study Finds a Correlation Between TikTok Use and Favorable Views of Communist China’s Human Rights Record	Study Finds a Correlation Between TikTok Use and Favorable Views of Communist China’s Human Rights Record	https://www.reddit.com/r/worldnews/comments/1i4n1bf/study_finds_a_correlation_between_tiktok_use_and/	2025-01-18T17:38:02-08:00	https://external-preview.redd.it/Hsky1rtqv8malB-cZ_FnufSj54Ra0skKgUAzu5uazFw.jpg?width=640&crop=smart&auto=webp&s=cb6aca057e25f3268f0de38ba1b813b363a58505
Iran unveils new underground naval base amid tension with US and Israel	Iran unveils new underground naval base amid tension with US and Israel	https://www.reddit.com/r/worldnews/comments/1i4mhfs/iran_unveils_new_underground_naval_base_amid/	2025-01-18T17:09:51-08:00	https://external-preview.redd.it/HEBUXOn8943o195Cf4iEzEtyi3lSYirz30a1jTs7Jys.jpg?width=108&crop=smart&auto=webp&s=78ac9f10dc259ecd2e3f6ed638093cdcca1fe826
Nvidia teams up with TSMC in silicon photonics development - Focus Taiwan	Nvidia teams up with TSMC in silicon photonics development - Focus Taiwan	https://www.reddit.com/r/worldnews/comments/1i4m2t4/nvidia_teams_up_with_tsmc_in_silicon_photonics/	2025-01-18T16:49:30-08:00	https://external-preview.redd.it/Ol49AzIzKFLzAowBULkkZ73YYMg5dUveak-hjun0ch4.jpg?width=320&crop=smart&auto=webp&s=e6293e23bf7d977b1024d9d06ecf7051c95af738
Elon Musk says 'Make Europe Great Again' as he continues his push into European politics	Elon Musk says 'Make Europe Great Again' as he continues his push into European politics	https://www.reddit.com/r/worldnews/comments/1i4ly9i/elon_musk_says_make_europe_great_again_as_he/	2025-01-18T16:43:14-08:00	https://external-preview.redd.it/i2n2OeXkNbKC4kC9Q3lGwFNEs5lO0ne_2-_qw_OxU3Y.jpg?width=640&crop=smart&auto=webp&s=51bd79ecdc6b964ef2c191709388a203d61f558b
Netanyahu issues warning ahead of Gaza ceasefire	Netanyahu issues warning ahead of Gaza ceasefire	https://www.reddit.com/r/worldnews/comments/1i4lvbq/netanyahu_issues_warning_ahead_of_gaza_ceasefire/	2025-01-18T16:39:09-08:00	https://external-preview.redd.it/ASrxQTFVljAx-tht0YjQQRgHQ9T4XP7N8RxlzHBaVSs.jpg?width=640&crop=smart&auto=webp&s=52aff893c371bcd6b29158be6707af934b6aca00
South Korean court extends President Yoon’s detention, angering supporters	South Korean court extends President Yoon’s detention, angering supporters	https://www.reddit.com/r/worldnews/comments/1i4knpi/south_korean_court_extends_president_yoons/	2025-01-18T15:39:13-08:00	https://external-preview.redd.it/xz7BWjmwRSr3GNT36Chfzz6VOpUQZtdZ0tm5-lxoc8Y.jpg?width=640&crop=smart&auto=webp&s=d11df5a8cfd32c7062ab9f2bbcafa1016408fcb4
Russia used chemical weapons 434 times in December, Ukraine's General Staff says	Russia used chemical weapons 434 times in December, Ukraine's General Staff says	https://www.reddit.com/r/worldnews/comments/1i4k73w/russia_used_chemical_weapons_434_times_in/	2025-01-18T15:16:34-08:00	https://external-preview.redd.it/a1L2Q6bwWDXbs8ghBzWw2fMyEQ8Nn7DBTBIcqE3JODU.jpg?width=640&crop=smart&auto=webp&s=ce9af7b0164048bb6af2a5c2755b24c18532df60
Ukrainian firm helped Russia build nuclear weapons labs, SBU says	Ukrainian firm helped Russia build nuclear weapons labs, SBU says	https://www.reddit.com/r/worldnews/comments/1i4jofx/ukrainian_firm_helped_russia_build_nuclear/	2025-01-18T14:51:17-08:00	https://external-preview.redd.it/1BfYy_cTOjCOqwvOVl243rqz6SjFvdgJvlRj7W129dk.jpg?width=640&crop=smart&auto=webp&s=b1989b24b092d2a4c156ef893c5a029ee2c33dc2
Germany may consider sending peacekeeping troops to Ukraine, defense minister says	Germany may consider sending peacekeeping troops to Ukraine, defense minister says	https://www.reddit.com/r/worldnews/comments/1i4jlyh/germany_may_consider_sending_peacekeeping_troops/	2025-01-18T14:48:04-08:00	https://external-preview.redd.it/_2Tn7PHAzV9ohgQtYGMXys7xjuq9za2CXI8-WQgc7s8.jpg?width=640&crop=smart&auto=webp&s=3be94e68b2201cc90d6669d14b25c07a83fd05a3
Iran unveils underground missile base amid tension with US, Israel	Iran unveils underground missile base amid tension with US, Israel	https://www.reddit.com/r/InternationalNews/comments/1i4jfsg/iran_unveils_underground_missile_base_amid/	2025-01-18T14:39:55-08:00	https://external-preview.redd.it/mp2k-Kd_ljnX3cZ-vfUhEM6XB56PD9xsO8salXGFOmg.jpg?width=640&crop=smart&auto=webp&s=8f55fbae3370df571f0b5b743a8868e280b3b0a8
Russia Sentences Navalny Lawyers to Years Behind Bars	Russia Sentences Navalny Lawyers to Years Behind Bars	https://www.reddit.com/r/worldnews/comments/1i4is1z/russia_sentences_navalny_lawyers_to_years_behind/	2025-01-18T14:08:59-08:00	https://external-preview.redd.it/InlOYD-skOZo3HBIFaj_TqZnoI64VV6OoNIv0Xv6nCI.jpg?width=640&crop=smart&auto=webp&s=7c2785e38e856bfc19755dee8f382cd6e6ed2bd5
Spaceship explosion raises questions about risk to public and environment in 2025	Spaceship explosion raises questions about risk to public and environment in 2025	https://www.reddit.com/r/worldnews/comments/1i4in57/spaceship_explosion_raises_questions_about_risk/	2025-01-18T14:02:41-08:00	
Israel reserves 'right to resume war if necessary' with US support: PM Netanyahu	Israel reserves 'right to resume war if necessary' with US support: PM Netanyahu	https://www.reddit.com/r/worldnews/comments/1i4hzsc/israel_reserves_right_to_resume_war_if_necessary/	2025-01-18T13:32:41-08:00	https://external-preview.redd.it/_U0-h04P9nyVc5kanCQfwYEktTY2ujuFxIwn6fy3kKA.jpg?width=640&crop=smart&auto=webp&s=32768c7021fb6df1e4c9a706be40f0a0d649c45a
BREAKING: NETANYAHU SAYS CEASEFIRE IS TEMPORARY Trump has assured Netanyahu that Israel will have his -full backing- to resume the war and Trump will ...	BREAKING: NETANYAHU SAYS CEASEFIRE IS TEMPORARY Trump has assured Netanyahu that Israel will have his -full backing- to resume the war and Trump will ...	https://www.reddit.com/r/InternationalNews/comments/1i4hmtv/breaking_netanyahu_says_ceasefire_is_temporary/	2025-01-18T13:16:40-08:00	
Smotrich -promises- -We will wipe the smile from the Gazans, but the screaming will remain.- There's only one solution to people as fascist and demoni...	Smotrich -promises- -We will wipe the smile from the Gazans, but the screaming will remain.- There's only one solution to people as fascist and demoni...	https://www.reddit.com/r/InternationalNews/comments/1i4hjie/smotrich_promises_we_will_wipe_the_smile_from_the/	2025-01-18T13:12:26-08:00	https://preview.redd.it/x503i3t3atde1.jpeg?width=640&crop=smart&auto=webp&s=ca6f7a075292d2d8e3e7a642fbe6bf2412340ae8
Since October 7, 2023, over 1,000 doctors and nurses have been killed in Israeli attacks on the Gaza Strip according to local authorities. Moreover, m...	Since October 7, 2023, over 1,000 doctors and nurses have been killed in Israeli attacks on the Gaza Strip according to local authorities. Moreover, m...	https://www.reddit.com/r/InternationalNews/comments/1i4hix9/since_october_7_2023_over_1000_doctors_and_nurses/	2025-01-18T13:11:41-08:00	
BREAKING: NETANYAHU SAYS CEASEFIRE IS TEMPORARY Trump has assured Netanyahu that Israel will have his -full backing- to resume the war and Trump will ...	BREAKING: NETANYAHU SAYS CEASEFIRE IS TEMPORARY Trump has assured Netanyahu that Israel will have his -full backing- to resume the war and Trump will ...	https://www.reddit.com/r/InternationalNews/comments/1i4h4cj/breaking_netanyahu_says_ceasefire_is_temporary/	2025-01-18T12:53:31-08:00	
Georgian PM highlights importance of investigating -crimes- by previous government, says opposition has -no evidence- of electoral fraud	Georgian PM highlights importance of investigating -crimes- by previous government, says opposition has -no evidence- of electoral fraud	https://www.reddit.com/r/worldnews/comments/1i4glt5/georgian_pm_highlights_importance_of/	2025-01-18T12:29:33-08:00	https://external-preview.redd.it/CrvnSlB5Vv7M5uWTT6nB15c1KqSJVEpkCqxTnhmh_DQ.jpg?width=640&crop=smart&auto=webp&s=09b25cf166390a9fa0ca2869be2392f555ae5ca5
Journalists in Haiti demand justice as they bury a second colleague killed by gangs	Journalists in Haiti demand justice as they bury a second colleague killed by gangs	https://www.reddit.com/r/worldnews/comments/1i4g7oz/journalists_in_haiti_demand_justice_as_they_bury/	2025-01-18T12:11:36-08:00	https://external-preview.redd.it/uAclNMcwsQ34kryG_cldJqy4agT5HTa7ksPFqvxhbfQ.jpg?width=640&crop=smart&auto=webp&s=cf5dfd4843fb3bd718518e341120b1fb568c4877
