Title	Description	Link	pubDate	Image
Foreign Minister Lin and his wife host welcome luncheon for Guatemala First Lady Peinado and her delegation	October 10, 2024No. 346 Minister of Foreign Affairs Lin Chia-lung and his wife hosted a welcome luncheon on October 9 for a delegation from the Republic of Guatemala led by First Lady Lucrecia Peinado. On behalf of the government, Minister Lin warmly welcomed First Lady Peinado on her first visit to Taiwan and thanked her for representing President Bernardo Ar&eacute;valo at the 2024 National Day celebrations, thereby enhancing bilateral diplomatic relations. Minister Lin stated that Taiwan and Guatemala were loyal partners that had enjoyed remarkable success in joint endeavors in such domains as public health, medicine, agricultural technology, higher education, and basic infrastructure. He pointed out that under proactive efforts by the governments of the two countries, economic and trade exchanges had grown closer. Noting that numerous Taiwanese businesses were interested in investing and setting up manufacturing facilities in Guatemala, Minister Lin said that this was a concrete outcome of economic and trade diplomacy promoted by the Ministry of Foreign Affairs in its implementation of integrated diplomacy. First Lady Peinado conveyed President Ar&eacute;valo's congratulations on Taiwan's National Day and thanked Taiwan for its long-standing assistance to Guatemala's development in various areas. Emphasizing that Taiwan was an important member of the global community, she said that Guatemala would continue supporting Taiwan's international participation. First Lady Peinado reaffirmed the importance that President Ar&eacute;valo placed on attracting business investment, as well as his keen interest in developing the semiconductor sector. She expressed the hope that the two countries would further deepen cooperation and jointly help transform Guatemala into a technologically advanced country. Minister Lin and First Lady Peinado also exchanged in-depth views on several issues, including women's empowerment, care for disadvantaged groups, talent cultivation, and bilateral collaboration. Both agreed that Taiwan and Guatemala, building on the existing solid foundation, would continue to bolster reciprocal and mutually beneficial bilateral cooperation. (E)	https://en.mofa.gov.tw/News_Content.aspx?n=1328&s=118229	2024-10-10T02:25:00-07:00	
Foreign Minister Lin hosts welcome luncheon for Saint Lucia delegation led by Senate President Reynolds and House of Assembly Speaker Francis	October 10, 2024No. 342 Minister of Foreign Affairs Lin Chia-lung hosted a luncheon on October 8 to welcome a delegation from Saint Lucia led by President of the Senate Alvina Reynolds and Speaker of the House of Assembly Claudius J. Francis. The delegation was in Taiwan to attend National Day celebrations. The two sides exchanged views on bilateral cooperation projects, developments across the Taiwan Strait and the region, and other issues. In his remarks, Minister Lin said that Saint Lucia was an important ally of Taiwan in the Caribbean. He commended the numerous achievements that the two countries had realized in their close cooperation over the years, including in such areas as education, technology, public health, infrastructure, and women's and youth empowerment. He stated that Taiwan would implement integrated diplomacy&mdash;a three-pillar policy comprising values-based diplomacy, alliance-based diplomacy, and economic and trade diplomacy&mdash;to further strengthen its partnership with Saint Lucia. Minister Lin also thanked Saint Lucia for its long-standing commitment to supporting Taiwan's international participation. He pointed out that such staunch backing had been reflected in the endorsement of Saint Lucia Foreign Minister Alva Baptiste at this year's United Nations General Assembly (UNGA) and in his emphasis that UNGA Resolution 2758 did not preclude Taiwan's meaningful involvement in the UN system. President Reynolds and Speaker Francis both expressed appreciation for Taiwan's warm and heartfelt hospitality and extended congratulations to Taiwan on the occasion of its National Day. Recognizing Taiwan's long-term assistance to Saint Lucia in education, public health, agriculture, youth development, and other domains, they pledged to build on the existing foundation of friendship and cooperation to further deepen the countries' alliance. President Reynolds and Speaker Francis first visited Taiwan in 2012. Their presence once again 12 years later to attend National Day celebrations demonstrates strong support for the diplomatic relationship between Taiwan and Saint Lucia. The delegation arrived on October 7 and will conclude its visit on October 11. (E)	https://en.mofa.gov.tw/News_Content.aspx?n=1328&s=118228	2024-10-10T02:18:00-07:00	
Foreign Minister Lin hosts welcome dinner for Tuvalu Prime Minister Teo and his wife	October 10, 2024No. 345Prime Minister of Tuvalu Feleti Penitala Teo and Madame Tausaga Teo led a delegation to Taiwan to attend National Day celebrations. Minister of Foreign Affairs Lin Chia-lung hosted a dinner for the delegation on October 9, extending a heartfelt welcome on behalf of the government.Minister Lin welcomed Prime Minister Teo on his second visit to Taiwan since assuming office in February. He said that Prime Minister Teo's presence, this time as a guest of honor at National Day celebrations, underscored the immense importance he placed on the diplomatic partnership between Taiwan and Tuvalu. Minister Lin noted that this year marked the 45th anniversary of diplomatic relations and that Tuvalu was Taiwan's longest-standing Pacific ally. He said that Taiwan would build on this existing robust foundation to further deepen cooperation with Tuvalu in such important domains as climate change, ICT, medicine and health care, talent cultivation, women's empowerment, and basic infrastructure.Minister Lin expressed special appreciation for Prime Minister Teo's staunch support for Taiwan's international participation over the years. He thanked Prime Minister Teo for speaking up for Taiwan at this year's United Nations General Assembly (UNGA), for reiterating that UNGA Resolution 2758 did not preclude Taiwan's participation in the UN, and for strongly urging the UN to include Taiwan so as to truly &ldquo;leave no one behind.&rdquo;Prime Minister Teo began his remarks by thanking Taiwan for inviting him to visit and wishing Taiwan a happy National Day and continued prosperity. He stated that in addition to attending National Day celebrations, he would also travel to southern Taiwan to engage in exchanges with fisheries operators so as to enhance bilateral fisheries cooperation. Stressing that Taiwan and Tuvalu had enjoyed an enduring friendship and realized significant achievements in many areas of collaboration, Prime Minister Teo said that the two countries would continue to work together to enhance the well-being of both their peoples. As October 9 also happened to be Prime Minister Teo's birthday, Minister Lin had prepared a birthday cake to celebrate the occasion. In the warm and cordial atmosphere of the gathering, members of the visiting delegation performed traditional Tuvaluan songs in a show of Austronesian culture. Colleagues from the Ministry of Foreign Affairs sang a selection of Taiwanese songs in return. (E)	https://en.mofa.gov.tw/News_Content.aspx?n=1328&s=118205	2024-10-09T20:07:00-07:00	
Foreign Minister Lin hosts welcome luncheon for Ukrainian parliamentary delegation	October 4, 2024 No. 329 Minister of Foreign Affairs Lin Chia-lung hosted a luncheon on October 4 to welcome a delegation of Ukrainian parliamentarians led by MP Mykola Kniazhytskyi, Cochair of the Inter-Parliamentary Alliance on China (IPAC), and MP Akhtem Chyihoz. The two sides exchanged views on the Russia-Ukraine war, the peaceful development of Ukraine, and potential cooperation projects. Minister Lin said that although Taiwan and Ukraine were geographically distant, both nations stood on the front line of democratic defense against the expansion of authoritarian regimes. He commended Ukraine for demonstrating resilience as well as defense and disaster response capabilities in its war against Russia, adding that this served as a valuable lesson and inspiration to all democratic countries. Minister Lin stated that Taiwan had actively assisted Ukraine with rebuilding critical infrastructure, schools, churches, and hospitals in the spirit of humanitarianism. He pledged that Taiwan would continue to support Ukraine through this difficult time. The members of the Ukrainian delegation thanked the government of Taiwan and expressed appreciation for Taiwan's humanitarian assistance and support. They stated that the people of Ukraine were deeply touched by Taiwan's goodwill. Noting that Taiwan and Ukraine shared the core values of freedom, democracy, and human rights, they expressed the hope that the two countries would continue to support each other and cooperate on the basis of friendship and mutual trust. Both Taiwan and Ukraine enjoy the common values shared by democracies and are faced with authoritarian expansionism. Since the outbreak of the Russia-Ukraine war in February 2022, Taiwan has extended consistent and unwavering support to Ukraine, staunchly backing democracy and freedom. Taiwan will continue to work with like-minded nations to assist Ukraine in overcoming adversity and returning to normal life as soon as possible. (E)	https://en.mofa.gov.tw/News_Content.aspx?n=1328&s=118182	2024-10-04T02:12:00-07:00	
MOFA sincerely thanks international community for taking concrete actions to support Taiwan’s UN participation	October 4, 2024No. 058The General Debate of the 79th session of the United Nations General Assembly (UNGA) concluded on September 30. The Ministry of Foreign Affairs (MOFA) sincerely thanks the diplomatic allies, like-minded countries, and friends from around the world who expressed support for Taiwan's participation in the UN and refuted China's deliberate misrepresentation of UNGA Resolution 2758 in various ways, both in the chamber and on the sidelines of the event. High-level government officials from Taiwan's diplomatic allies Paraguay, the Marshall Islands, Palau, Saint Vincent and the Grenadines, Eswatini, Tuvalu, Saint Christopher and Nevis, Saint Lucia, and Belize spoke up for Taiwan at the UN General Debate and Summit of the Future. Officials from the Marshall Islands, Palau, Tuvalu, and Saint Lucia explicitly pointed out that UNGA Resolution 2758 did not preclude Taiwan's participation in the UN system. Following similar remarks in 2022, US President Joe Biden again used his speech to the UN General Debate to spell out the United States' commitment to maintaining peace and stability across the Taiwan Strait. Australia mentioned the Taiwan Strait for the first time at the UN General Debate, with Minister for Foreign Affairs Penny Wong stating that Australia had consistently pressed China on peace and stability in the Taiwan Strait. At a US House of Representatives Committee on Foreign Affairs hearing held a few days before the UN General Debate, US Deputy Secretary of State Kurt Campbell criticized China for using UNGA Resolution 2758 as a diplomatic tool to suppress Taiwan's status. In response to a question in parliament, Dutch Minister of Foreign Affairs Caspar Veldkamp openly acknowledged that the resolution had nothing to do with Taiwan. Following a meeting on the sidelines of the UNGA held by the Group of Seven (G7) foreign ministers and the European Union high representative for foreign affairs and security policy, the chair of the meeting released a statement reaffirming the importance of cross-strait peace and stability to international security and prosperity as well as supporting Taiwan's international participation. Joint statements expressing a high regard for cross-strait peace and stability were issued after other recent high-level meetings, including the Quad leaders' summit, the seventh high-level meeting of the EU-US Dialogue on China, the US-Japan summit meeting, the UK-US Strategic Dialogue, the Japan-Australia Foreign and Defence Ministerial Consultations, the Republic of Korea-New Zealand bilateral meeting, and the Lithuania-US Strategic Dialogue on the Indo-Pacific.In terms of legislative branches, the Inter-Parliamentary Alliance on China passed a model resolution on UNGA Resolution 2758 on July 30 for its members' reference. The Australian Senate, the Dutch House of Representatives, and the Guatemalan Congress have since adopted motions in support of Taiwan based on the model resolution. The Foreign Affairs Committee of the Italian Chamber of Deputies also approved a resolution backing Taiwan's international participation, demonstrating staunch support for Taiwan.Speaking for the first time on the sidelines of the UNGA at the annual summit of the New York-based nonprofit organization Concordia through prerecorded remarks, President Lai Ching-te told the UN family that Taiwan would strive to maintain regional peace and stability and urged the international community to support Taiwan's participation. Ambassador Alexander Tah-ray Yui, Representative to the United States, held a discussion with former US Under Secretary of State for Economic Growth, Energy, and the Environment Keith Krach on cross-strait peace and security and Taiwan's campaign to participate in the UN. During the UNGA, Taiwan cohosted a seminar in New York with the United States, Japan, Australia, and Canada under the Global Cooperation and Training Framework. The event underscored Taiwan's resolve to contribute to the global community.MOFA also appreciates the unwavering support of the Legislative Yuan. A cross-party delegation of legislators&mdash;including Ngalim Tiunn, Wu Tsung-hsien, and Wu Chun-cheng&mdash;visited New York during the UNGA to provide guidance and take part in related activities. The group powerfully conveyed the strong desire of the Taiwanese people to be part of the UN system.Through an international publicity and new media campaign, the government effectively communicated Taiwan's demands for UN participation to all quarters. An op-ed by Minister of Foreign Affairs Lin Chia-lung, letters to the editor from Taiwan's overseas missions, and interviews with Taiwanese ambassadors and representatives appeared 455 times in mainstream international media outlets. These included the Diplomat, the Hill, the Washington Times, National Review, and the New York Sun in the United States; Modern Diplomacy and the European Business Review in the European Union; the National Post in Canada; Le Figaro in France; Norrbottens-Kuriren in Sweden; La Raz&oacute;n in Spain; De Telegraaf and Nederlands Dagblad in the Netherlands; Euractiv in Greece; Rzeczpospolita in Poland; La Verit&agrave; and Le Formiche in Italy; the Sankei Shimbun in Japan; the Chosun Ilbo in the Republic of Korea; the Philippine Star in the Philippines; the Hindustan Times and the Tribune in India; the Jerusalem Post in Israel; La Raz&oacute;n in Peru; the Eswatini Observer in Eswatini; La Naci&oacute;n in Paraguay; O Tempo in Brazil; Jelen in Hungary; and the Daily News in Thailand. The short promotional film IC You received more than 25.4 million views&mdash;again breaking the record for Taiwan's annual campaign. During the UNGA, MOFA and its overseas missions released 2,922 posts about Taiwan's bid on social media platforms including Facebook, X, Instagram, and Threads. The posts were seen over 48.378 million times and received an unprecedentedly warm response. A short animation video, UNity through Peace: Chip in with Taiwan, was shown on a large billboard in New York City's iconic Times Square. The advertisement featured elements including semiconductor circuits and Taiwan's contributions to achieving the UN Sustainable Development Goals (SDGs). The video conveyed Taiwan's strengths in IC technology, highlighted its image as a responsible member of the global community, and broadened worldwide recognition and support for Taiwan's call for international participation.MOFA reiterates that UNGA Resolution 2758 does not mention Taiwan. The resolution therefore has nothing to do with Taiwan and cannot serve as the basis for precluding Taiwan from the UN system and other international organizations. Taiwan is determined, willing, and able to contribute to the global community. Continuing to exclude Taiwan from multilateral endeavors will not only be a loss to humanity but also detrimental to realizing the SDGs. To uphold the UN principle of leaving no one behind, MOFA again calls on the UN to stop bowing to pressure from China and swiftly allow Taiwan's full participation. (E)	https://en.mofa.gov.tw/News_Content.aspx?n=1328&s=118187	2024-10-04T01:31:00-07:00	
MOFA strongly condemns Chinese Foreign Minister Wang for misrepresenting UNGA Resolution 2758 at 79th UNGA session	September 29, 2024No. 322The Ministry of Foreign Affairs (MOFA) strongly condemns Chinese Foreign Minister Wang Yi for his remarks at the General Debate on September 28 during the 79th session of the United Nations General Assembly (UNGA), in which he again falsely claimed that UNGA Resolution 2758 had resolved once and for all the issue of the representation of the whole of China, including Taiwan, in the UN. MOFA reiterates that the objective status quo across the Taiwan Strait and the internationally recognized reality is that neither the Republic of China (Taiwan) nor the People's Republic of China is subordinate to the other. UNGA Resolution 2758 does not mention Taiwan; nor does it confirm Taiwan to be a part of the PRC or authorize the PRC to represent Taiwan in the UN. Hence, the resolution has nothing to do with Taiwan and does not address the issue of Taiwan's representation in the UN. MOFA again stresses that only Taiwan's popularly elected government can represent Taiwan in the UN and other international organizations and events.MOFA demands that China stop misleading the international community. It also urges nations worldwide to give due attention to China's mischaracterization of UNGA Resolution 2758, which constitutes a malicious attempt to unilaterally change the status quo across the Taiwan Strait and establish a legal basis for the use of force against Taiwan. It calls on the global community to proactively take countermeasures against China's actions and work in concert to safeguard the cross-strait status quo of peace and stability and the rules-based international order. (E)	https://en.mofa.gov.tw/News_Content.aspx?n=1328&s=118160	2024-09-29T01:56:00-07:00	
MOFA response to US State Secretary Blinken reaffirming importance of cross-strait peace and stability in meeting with Chinese Foreign Minister Wang o...	September 28, 2024United States Secretary of State Antony Blinken met with China Director of the Office of the Chinese Communist Party Central Foreign Affairs Commission and Foreign Minister Wang Yi on the sidelines of the United Nations General Assembly (UNGA) on September 27. A press release later issued by the US Department of State pointed out that Secretary Blinken had emphasized the importance of maintaining peace and stability across the Taiwan Strait during the meeting. It further stated that he had also raised concerns about China's dangerous and destabilizing actions in the South China Sea as well as its support for Russia's defense industrial base.The Ministry of Foreign Affairs (MOFA) welcomes staunch US support for cross-strait peace and stability and appreciates high-level US officials reaffirming this position during interactions with Chinese counterparts. It also strongly condemns China for continuing to take actions that jeopardize the peaceful status quo at a time when the international community shares collective concerns regarding, and is striving to maintain, regional security and stability.MOFA further notes that in the press release China issued following the meeting, it again made spurious claims about Taiwan and Taiwan's relations with the United States that do not accord with reality. MOFA reiterates that neither the Republic of China (Taiwan) nor the People's Republic of China is subordinate to the other. MOFA also stresses that it is China's relentless intimidation of Taiwan and willful military expansion in the region that pose the greatest risk to regional peace and stability. Furthermore, by accommodating Russia, China has become a key supporter of Russia's invasion of Ukraine in the transatlantic region. Its provocative staging of joint military exercises with Russia in the Indo-Pacific also shows that its ambitions have become a major global threat.As President Lai Ching-te pointed out to the international community while addressing a summit held by a nonprofit organization during the UNGA, &ldquo;a stronger Taiwan is better able to promote democracy, peace, and prosperity around the world.&rdquo; He also expressed the sincere hope for &ldquo;Taiwan and other democratic nations to jointly support the democratic umbrella and counter authoritarian aggression.&rdquo; As a responsible member of the global community, Taiwan will steadfastly enhance its defense capabilities and work together with the United States and other like-minded partners to safeguard the rules-based international order and preserve peace, stability, and prosperity across the Taiwan Strait and throughout the Indo-Pacific.	https://en.mofa.gov.tw/News_Content.aspx?n=1328&s=118159	2024-09-28T01:48:00-07:00	
Taiwan to donate US$100,000 each to Vietnam, Thailand, and Myanmar to support reconstruction efforts following Typhoon Yagi	September 27, 2024No. 320Typhoon Yagi swept across Vietnam, Thailand, and Myanmar in September, triggering floods and landslides, causing many casualties, and damaging property. Despite suffering significant adverse effects themselves, Taiwan's businesspeople in affected areas displayed the warmth of the Taiwanese people, making generous donations of relief supplies and assisting with reconstruction efforts. Southeast Asian countries are close neighbors of Taiwan. The people and government of Taiwan empathize with Vietnam, Thailand, and Myanmar in the wake of the disaster. While attending the opening ceremony of the 30th World Taiwanese Chambers of Commerce annual conference and the third joint meeting of its boards of directors and supervisors on September 27, Minister of Foreign Affairs Lin Chia-lung made note of the postdisaster recovery assistance that Taiwanese businesspeople have provided and the Taiwanese spirit of compassion and resilience that they have shown in their host countries. He then announced the donation of US$100,000 in relief funds each to Vietnam, Thailand, and Myanmar. Minister Lin also expressed hope that Taiwanese companies in these three countries would soon resume normal production and operations, contribute to the local economy, and deepen friendship between Taiwan and Southeast Asian nations and their respective peoples. (E)	https://en.mofa.gov.tw/News_Content.aspx?n=1328&s=118163	2024-09-27T02:57:00-07:00	