Title	Description	Link	pubDate	Image
What's Behind Israel's Land Grab in Golan?	The Israeli military expanded their control over the Golan Heights on December 8 by seizing Syrian-controlled areas. The region has been partially occupied by Israel since the Six Day War of 1967.	https://sputnikglobe.com/20241209/whats-behind-israels-land-grab-in-golan-1121137726.html	2024-12-09T11:09:46-08:00	
Netanyahu Says Golan Heights to Forever Remain Integral Part of Israel	MOSCOW (Sputnik) - The Golan Heights will forever remain an integral part of Israel, Israeli Prime Minister Benjamin Netanyahu said on Friday.	https://sputnikglobe.com/20241209/netanyahu-says-golan-heights-to-forever-remain-integral-part-of-israel-1121137401.html	2024-12-09T10:35:59-08:00	
The Legacy of the Assad Family's Decades-Long Rule in Syria	Syrian President Bashar al-Assad's peaceful transfer of power to the armed opposition marked the end of the Assad family's 53-year rule in Syria.	https://sputnikglobe.com/20241209/the-legacy-of-the-assad-familys-decades-long-rule-in-syria-1121135974.html	2024-12-09T09:44:35-08:00	
Syria’s Crisis: Key Interests of the US, Israel, Turkiye, Iran, and Russia	The 13-year-long Syrian civil war, culminating in the fall of the Bashar al-Assad government and the risk of further fragmentation of Syria, has significant implications for both global and regional players.	https://sputnikglobe.com/20241209/syrias-crisis-key-interests-of-the-us-israel-turkiye-iran-and-russia---1121135054.html	2024-12-09T09:02:29-08:00	
Romanian Opposition Leader Calls On Allies to Create New United Political Bloc	CHISINAU (Sputnik) - Romanian opposition parties that have been fighting against the government for the past five years should unite into a single sovereign bloc, the leader of the Alliance for the Unification of Romanians (AUR), George Simion, said on Monday.	https://sputnikglobe.com/20241209/romanian-opposition-leader-calls-on-allies-to-create-new-united-political-bloc-1121137064.html	2024-12-09T08:02:00-08:00	
Putin Urges CSTO Nations to Counter Growing Bioweapon Threats	MOSCOW (Sputnik) - Some countries are developing military biological activities and it is necessary to understand what is happening there and how to counter such threats, Russian President Vladimir Putin said on Monday.	https://sputnikglobe.com/20241209/putin-urges-csto-nations-to-counter-growing-bioweapon-threats-1121137588.html	2024-12-09T07:48:00-08:00	
Yemeni Houthis Say Their Drone Hit Important Target in Israeli City of Ashdod	MOSCOW (Sputnik) - Yemen's Ansar Allah movement, also known as the Houthis, said on Monday that their drone hit an important target in the Israeli city of Ashdod.	https://sputnikglobe.com/20241209/yemeni-houthis-say-their-drone-hit-important-target-in-israeli-city-of-ashdod-1121136649.html	2024-12-09T06:43:00-08:00	
Russian Security Service Busts Ukrainian-Linked Criminal Scam Network	Russia has repeatedly warned Western countries that Ukraine's US-backed so-called 'IT army' would become a huge problem for Europeans, as more than 1,000 'call centers' in Ukraine are engaged in the extortion of money under fraudulent pretenses.	https://sputnikglobe.com/20241209/russian-security-service-busts-ukrainian-linked-criminal-scam-network-1121133559.html	2024-12-09T06:12:59-08:00	
How Fast Can the Russian Oreshnik Missile Reach Europe from Belarus?	On November 21, Russian Prssident Vladimir Putin confirmed the successful test of the Oreshnik missile, which hit a Ukrainian defense facility in Dnepropetrovsk in retaliation for the Kiev regime’s strikes deep into Russia using Western weapons.	https://sputnikglobe.com/20241209/how-fast-can-the-russian-oreshnik-missile-reach-europe-from-belarus-1121133709.html	2024-12-09T05:22:18-08:00	
What Makes the Golan Heights Crucial for Israel?	Syrian President Bashar al-Assad has transferred power to the armed opposition just days after the militants launched their advance from Idlib province. Israel has long had its own territorial ambitions in the region, relating specifically to the Golan Heights.	https://sputnikglobe.com/20241209/what-makes-the-golan-heights-crucial-for-israel-1121132234.html	2024-12-09T03:59:06-08:00	
Russian Forces Strike Key Rail and Military Infrastructure Supplying Western Arms to Ukraine	Russian forces struck railway facilities used to carry Western-supplied equipment to the Ukrainian Armed Forces, the Ministry of Defense reported.	https://sputnikglobe.com/20241209/russian-forces-strike-key-rail-and-military-infrastructure-supplying-western-arms-to-ukraine-1121131681.html	2024-12-09T03:25:26-08:00	
Russia Ensures Security of Military Bases in Syria Amid Ongoing Turmoil	Russian military forces in Syria are taking all necessary measures to ensure the security of military bases, stated Russian President's Press Secretary Dmitry Peskov. He added that the safety of Russian military bases in Syria is a very important issue.	https://sputnikglobe.com/20241209/russia-ensures-security-of-military-bases-in-syria-amid-ongoing-turmoil-1121130805.html	2024-12-09T01:54:07-08:00	
Romania Losing Sovereignty Over $200Bln of National Debt - Presidential Candidate	MOSCOW (Sputnik) - Romania is losing its sovereignty due to its rising national debt, which now exceeds $200 billion, Romanian independent presidential candidate Calin Georgescu said.	https://sputnikglobe.com/20241209/romania-losing-sovereignty-over-200bln-of-national-debt---presidential-candidate-1121130427.html	2024-12-09T01:41:38-08:00	
Turkiye Outlines Three Policy Priorities on Syria – Reports	ANKARA (Sputnik) - Turkiye has outlined three priorities in its policy on Syria and will back the opposition, Turkish newspaper Hurriyet reported on Monday, citing unnamed sources.	https://sputnikglobe.com/20241209/turkiye-outlines-three-policy-priorities-on-syria--reports-1121130287.html	2024-12-09T01:36:55-08:00	
South Korean Investigators Plan to Ban President From Leaving Country Amid Investigation	SEOUL (Sputnik) - Oh Dong-woon, the chief of the Corruption Investigation Office for High-ranking Officials (CIO), said on Monday that he had instructed his investigators to request a travel ban for the country's president, Yoon Suk-yeol, amid an investigation into temporarily martial law.	https://sputnikglobe.com/20241209/south-korean-investigators-plan-to-ban-president-from-leaving-country-amid-investigation-1121129039.html	2024-12-08T22:40:46-08:00	
Trump Says Developing Concept to End 'Ridiculous' Conflict in Ukraine	MOSCOW (Sputnik) - US President-Elect Donald Trump has said that he is developing a concept to put an end to the 'ridiculous' conflict in Ukraine.	https://sputnikglobe.com/20241209/trump-says-developing-concept-to-end-ridiculous-conflict-in-ukraine-1121128922.html	2024-12-08T22:38:02-08:00	
Hamas Delegation in Cairo Discusses Ceasefire Effort in Gaza	CAIRO (Sputnik) - The delegation of Palestinian movement Hamas has held a meeting in Cairo with Egyptian intelligence chief Maj. Gen. Hassan Mahmoud Rashad, during which they discussed ceasefire efforts in the Gaza Strip and the formation of a community support committee in the enclave, the movement said.	https://sputnikglobe.com/20241209/hamas-delegation-in-cairo-discusses-ceasefire-effort-in-gaza-1121128789.html	2024-12-08T21:55:14-08:00	
Russian Air Defense Systems Destroy 13 Ukrainian Drones Overnight - MoD	MOSCOW (Sputnik) - Russian air defense systems destroyed 13 Ukrainian drones over the Belgorod, Rostov and Astrakhan regions over the past night, the Russian Defense Ministry said on Monday.	https://sputnikglobe.com/20241209/russian-air-defense-systems-destroy-13-ukrainian-drones-overnight---mod-1121128678.html	2024-12-08T21:32:48-08:00	
Russia Not Eager to See NATO's 'Creeping Expansion' Into Asia - Deputy Foreign Minister	KUALA LUMPUR (Sputnik) - Russia does not want to see NATO's 'creeping expansion' into Asia and hopes that the region will retain its own identity, Russian Deputy Foreign Minister Andrey Rudenko said at the 15th Asian Conference of the Valdai International Discussion Club in Malaysia.	https://sputnikglobe.com/20241209/russia-not-eager-to-see-natos-creeping-expansion-into-asia---deputy-foreign-minister-1121128564.html	2024-12-08T21:27:40-08:00	
Trump Says Will Not Seek Revenge Against Political Opponents	MOSCOW (Sputnik) - US President-elect Donald Trump said on Sunday that he would not seek to settle scores with his political opponents once he took office.	https://sputnikglobe.com/20241209/trump-says-will-not-seek-revenge-against-political-opponents-1121128162.html	2024-12-08T20:29:23-08:00	
IDF Entered Syrian Territory Beyond Golan Heights First Time in Over 50 Years - Reports	MOSCOW (Sputnik) - The Israel Defense Forces (IDF) entered Syrian territory outside the Golan Heights over the weekend for the first time since the October War of 1973, the New York Times reported, citing two Israeli officials.	https://sputnikglobe.com/20241209/idf-entered-syrian-territory-beyond-golan-heights-first-time-in-over-50-years---reports-1121128018.html	2024-12-08T20:26:45-08:00	
Russian Scientists Develop New Energy Conservation Technique	Industrial production is accompanied by the release of significant amounts of thermal energy, which in most cases is irretrievably lost, dissipating into the surrounding environment. Currently, more and more attention is being paid to the development of technologies aimed at utilizing waste heat.	https://sputnikglobe.com/20241209/russian-scientists-develop-new-energy-conservation-technique--1121110875.html	2024-12-08T19:15:00-08:00	
Russian-US Trade Hits 5-Month High in October	MOSCOW, December 9 (Sputnik) - Russian-US trade increased to a five-month high in October, mainly due to a doubling of Russian goods supplies, according to Sputnik's analysis of US statistical data.	https://sputnikglobe.com/20241209/russian-us-trade-hits-5-month-high-in-october-1121127794.html	2024-12-08T19:01:55-08:00	
US to Support Efforts to Hold Accountable Those Who Helped Assad - Blinken	WASHINGTON, December 9 (Sputnik) - The United States will support international efforts to hold accountable those who helped ousted Syrian leader Bashar Assad, Secretary of State Antony Blinken said.	https://sputnikglobe.com/20241209/us-to-support-efforts-to-hold-accountable-those-who-helped-assad---blinken-1121127669.html	2024-12-08T17:23:00-08:00	
Biden Says Syria at Turning Point, But Current Situation Can Be Used for Better Future	MOSCOW, December 8 (Sputnik) - Syria is at a turning point after the sudden collapse of President Bashar Assad's government, which is an opportunity to build a better future for the Syrian people, but it also bears risk and uncertainty, US President Joe Biden said on Sunday.	https://sputnikglobe.com/20241208/biden-says-syria-at-turning-point-but-current-situation-can-be-used-for-better-future-1121127527.html	2024-12-08T15:47:00-08:00	
Why are Israel and the US Salivating Over Syria’s Break-Up?	The situation in Syria remains complex but recent developments point to potential future scenarios, Stanislav Tarasov, a political analyst and expert on the Middle East and Caucasus region, told Sputnik.	https://sputnikglobe.com/20241208/why-are-israel-and-the-us-salivating-over-syrias-break-up-1121126981.html	2024-12-08T10:29:57-08:00	
Syria's Assad and His Family Arrive in Moscow - Source	Former Syrian president Bashar al-Assad and his family have arrived in Moscow, where Russia has granted them asylum, a source in the Kremlin reported.	https://sputnikglobe.com/20241208/syrias-assad-and-his-family-arrive-in-moscow---source-1121126068.html	2024-12-08T09:52:21-08:00	
Trump's Energy Agenda: A ‘Drill, Baby, Drill’ Approach to Boost US Oil	WASHINGTON (Sputnik) - The incoming US administration will prioritize oil extraction, President-elect Donald Trump said in an interview with NBC out on Sunday.	https://sputnikglobe.com/20241208/trumps-energy-agenda-a-drill-baby-drill-approach-to-boost-us-oil-1121125916.html	2024-12-08T09:41:21-08:00	
Fast and Furious: Unveiling Russia’s Fleet of MiG Fighter Jets	December 8 marks the 85th anniversary of the legendary Mikoyan Design Bureau, now part of the consolidated Russian United Aircraft Corporation (RSK MiG). Its first design, the MiG-1 single-engine interceptor, flew in 1940, with 'MiG' being an acronym derived from the names 'Mikoyan' and 'Gurevich.'	https://sputnikglobe.com/20241208/fast-and-furious-unveiling-russias-fleet-of-mig-fighter-jets-1121124646.html	2024-12-08T05:43:57-08:00	
It's Too Early to Say the Syria Crisis is Close to an End – Pundit	Syrian President Bashar al-Assad, following negotiations with participants of the conflict, resigned from the presidency and left Syria, instructing a peaceful transfer of power, according to the Russian Foreign Ministry.	https://sputnikglobe.com/20241208/its-too-early-to-say-the-syria-crisis-is-close-to-an-end--pundit-1121123943.html	2024-12-08T04:56:06-08:00	
Syria's Assad Resigns Amid Peace Efforts, Orders Peaceful Power Handover - Russian Foreign Ministry	After negotiations with several parties involved in the Syrian conflict, Assad resigned from the presidency and left Syria, giving instructions to peacefully transfer power. Russia was not involved in the negotiations, the Russian Foreign Ministry stated on Sunday.	https://sputnikglobe.com/20241208/assad-resigns-amid-peace-efforts-orders-peaceful-power-handover---russian-foreign-ministry-1121123067.html	2024-12-08T03:32:52-08:00	
Russian Forces Liberate Blagodatnoye Settlement in Donetsk Region	Russian forces have taken control of the settlement of Blagodatnoye, the Ministry of Defense (MoD) reported.	https://sputnikglobe.com/20241208/russian-forces-liberate-blagodatnoye-settlement-in-donetsk-region-1121122516.html	2024-12-08T02:42:21-08:00	
Trump Says Zelensky Wants to 'Make Deal' to End Ukraine Conflict	MOSCOW (Sputnik) - Ukrainian President Volodymyr Zelensky would like to 'make a deal' to end the conflict in Ukraine, US President-elect Donald Trump said on Sunday, calling for an immediate ceasefire and negotiations.	https://sputnikglobe.com/20241208/trump-says-zelensky-wants-to-make-deal-to-end-ukraine-conflict-1121122110.html	2024-12-08T01:22:55-08:00	
Ruby Red Slippers From Wizard of Oz Auctioned for $32.5Mln	In The Wizard of Oz, the ruby slippers are the iconic magical shoes worn by protagonist Dorothy Gale. The sparkly bright red shoes symbolized Dorothy's journey in the story and her desire to return home.	https://sputnikglobe.com/20241208/ruby-red-slippers-from-wizard-of-oz-auctioned-for-325mln-1121121161.html	2024-12-08T00:40:53-08:00	
South Korean Parliament Speaker Calls for Immediate Suspension of Presidential Powers	SEOUL (Sputnik) - The transfer of presidential powers to the ruling party and the prime minister is unconstitutional and it is necessary to hold negotiations with the opposition for an immediate suspension of the president's duties, South Korean National Assembly Speaker Woo Won-shik said on Sunday.	https://sputnikglobe.com/20241208/south-korean-parliament-speaker-calls-for-immediate-suspension-of-presidential-powers-1121121703.html	2024-12-08T00:13:15-08:00	
Russian Air Defenses Shoot Down 46 Ukrainian Drones Overnight	MOSCOW (Sputnik) - Russian air defense systems on duty destroyed 46 Ukrainian drones over the past night, 17 of them over the Belgorod region, the Russian Defense Ministry said on Sunday.	https://sputnikglobe.com/20241208/russian-air-defenses-shoot-down-46-ukrainian-drones-overnight-1121120820.html	2024-12-07T21:00:16-08:00	
Total Aid For Ukraine Tops $119Bln Since February 2022 – Pentagon	WASHINGTON (Sputnik) - The total volume of military support for Ukraine from allies since the beginning of the Russian special military operation in February 2022 exceeded $119 billion, including $62 billion from the United States, Pentagon Chief Lloyd Austin said.	https://sputnikglobe.com/20241208/total-aid-for-ukraine-tops-119bln-since-february-2022--pentagon-1121120618.html	2024-12-07T20:50:13-08:00	
Participants in Syria Talks Call for Cessation of Hostilities in Country	DOHA (Sputnik) - Participants in the Syria talks in Doha, which include five Arab countries and three member states of the Astana negotiation process, pointed out the need to stop military actions in Syria in order to begin a political process there based on UN Security Council Resolution 2254, according to a joint statement.	https://sputnikglobe.com/20241208/participants-in-syria-talks-call-for-cessation-of-hostilities-in-country-1121120511.html	2024-12-07T20:45:17-08:00	
Over 1,000 EU Citizens Join Lawsuit Against EU President Over COVID-19 Vaccine Spending	MOSCOW (Sputnik) - More than 1,000 EU citizens have joined the legal action against European Commission President Ursula von der Leyen in the case of violations during the purchase of COVID-19 vaccines, the Belgian activist who filed the complaint, Frederic Baldan, said on Saturday.	https://sputnikglobe.com/20241208/over-1000-eu-citizens-join-lawsuit-against-eu-president-over-covid-19-vaccine-spending-1121120346.html	2024-12-07T20:40:34-08:00	
Syrian Prime Minister Ready to Cooperate With Any Government That Syrians Choose - Reports	CAIRO (Sputnik) - Syrian Prime Minister Mohammad Ghazi al-Jalali has declared his readiness to cooperate with any government that Syrians choose, Saudi broadcaster Al Arabiya reported.	https://sputnikglobe.com/20241208/syrian-prime-minister-ready-to-cooperate-with-any-government-that-syrians-choose---reports-1121120141.html	2024-12-07T20:37:44-08:00	
ATACMS Missiles, Strikes Deep Into Russia Not 'Silver Bullet' for Ukraine - White House	WASHINGTON, December 8 (Sputnik) - The transfer of American long-range ATACMS missiles to Ukraine and permission to strike deep into Russian territory will not be a 'silver bullet' for Kiev, US National Security Advisor Jake Sullivan said.	https://sputnikglobe.com/20241208/atacms-missiles-strikes-deep-into-russia-not-silver-bullet-for-ukraine---white-house-1121119857.html	2024-12-07T16:57:00-08:00	
Romanian Presidential Candidate Calls on Citizens to Protest Cancellation of 1st Round	BUCHAREST, December 7 (Sputnik) - Romanian independent presidential candidate Calin Georgescu called on his compatriots on Saturday to go to the polls anyway, despite the Romanian Constitutional Court's decision to cancel the first round of the presidential election in the country.	https://sputnikglobe.com/20241207/romanian-presidential-candidate-calls-on-citizens-to-protest-cancellation-of-1st-round-1121119980.html	2024-12-07T15:08:00-08:00	
Musk Says US Should 'Stay Out' of Other Countries' Conflicts	MOSCOW (Sputnik) - US billionaire entrepreneur Elon Musk said on Saturday that the United States should 'stay out' of other countries' conflicts unless the consequences are all-encompassing.	https://sputnikglobe.com/20241207/musk-says-us-should-stay-out-of-other-countries-conflicts-1121119598.html	2024-12-07T10:35:16-08:00	
Syrian Army Fortifying Positions Outside Damascus	BEIRUT (Sputnik) - Syrian troops have been digging in on the outskirts of Damascus, with fighting continuing in the western Homs and Hama provinces as well as in Daraa further south, the Syrian army's main command said on Saturday.	https://sputnikglobe.com/20241207/syrian-army-fortifying-positions-outside-damascus-1121119290.html	2024-12-07T10:22:44-08:00	
Annulment of Romanian Presidential Election Results is De Facto Ban on Georgescu's Victory	Romania’s Constitutional Court annulling the results of the first round of presidential election shows that the Romanian political elite was afraid of losing to Calin Georgescu, Moldavian political commentator Cornel Ciurea tells Sputnik.	https://sputnikglobe.com/20241207/annulment-of-romanian-presidential-election-results-is-de-facto-ban-on-georgescus-victory-1121118580.html	2024-12-07T09:54:25-08:00	
Iran Accuses Ukraine of Supplying Drones to Terrorists in Syria	TEHRAN (Sputnik) - Iranian National Security and Foreign Policy Council spokesman Ebrahim Rezaei accused the Ukrainian government of supplying drones to terrorists in Syria, saying Kiev must be held responsible for its actions, ICANA news agency reported on Saturday.	https://sputnikglobe.com/20241207/iran-accuses-ukraine-of-supplying-drones-to-terrorists-in-syria-1121119076.html	2024-12-07T08:54:00-08:00	
Russia Warns Against Geopolitical Use of Terrorists in Syria’s Conflict	The offensive by the Hayat Tahrir al-Sham (HTS)* terrorist group in Syria has been long in the making, and Russia will oppose attempts by the militants to alter the situation in the Syrian Arab Republic (SAR), Russian Foreign Minister Sergey Lavrov said.	https://sputnikglobe.com/20241207/russia-warns-against-geopolitical-use-of-terrorists-in-syrias-conflict-1121118122.html	2024-12-07T06:38:14-08:00	
Watch Russian Heavy Flamethrower Obliterate Ukrainian Militants' Position Near Volnovakha	The Solntsepyok (lit. ‘Scorching Sunlight’, 'Scorching Sun' or 'Blazing Sun') thermobaric rocket launch system was used to take out 45 Ukrainian militants in the Donetsk People’s Republic.	https://sputnikglobe.com/20241207/watch-russian-heavy-flamethrower-obliterate-ukrainian-militants-position-near-volnovakha-1121117100.html	2024-12-07T05:59:00-08:00	
Parliamentary Vote on South Korean President's Impeachment Fails	SEOUL (Sputnik) - A parliamentary vote to impeach South Korean President Yoon Suk-yeol over his controversial decision to impose martial law failed on Saturday after the ruling party boycotted the vote.	https://sputnikglobe.com/20241207/parliamentary-vote-on-south-korean-presidents-impeachment-fails-1121117671.html	2024-12-07T05:14:59-08:00	
Schrodinger’s Rings: Saturn to Lose Its Famous Feature Twice in 2025	The dissapearence will be purely optical. In reality, Saturn's rings won't go anywhere.	https://sputnikglobe.com/20241207/schrodingers-rings-saturn-to-lose-its-famous-feature-twice-in-2025--1121116477.html	2024-12-07T04:59:06-08:00	
Belarus to Host Russia’s Oreshnik in Response to US Missiles in Germany	The state-of-the-art missile system is due to be situated in the second half of 2025.	https://sputnikglobe.com/20241207/belarus-to-host-russias-oreshnik-in-response-to-us-missiles-in-germany-1121116997.html	2024-12-07T04:58:13-08:00	
Sergey Lavrov Speaks at Doha Forum on Global Cooperation	The Russian foreign minister's Mideast trip comes amid recent escalation in Syria where jihadist rebels launched a large-scale attack on territories loyal to President Bashar al-Assad.	https://sputnikglobe.com/20241207/sergey-lavrov-speaks-at-doha-forum-on-global-cooperation-1121115659.html	2024-12-07T04:38:14-08:00	
German Chancellor Candidate Says AfD Wants Peace in Ukraine, End of Arms Supplies to Ukraine	MOSCOW (Sputnik) - The candidate for German chancellor from the right-wing Alternative for Germany (AfD) party, Alice Weidel, said on Saturday that her party wanted there to be peace in Ukraine and called for an end of arms supplies to Kiev.	https://sputnikglobe.com/20241207/german-chancellor-candidate-says-afd-wants-peace-in-ukraine-end-of-arms-supplies-to-ukraine-1121116611.html	2024-12-07T04:11:55-08:00	
Russian Troops Liberate Berestki and Push Toward Kurakhovo	Kurakhovo is a city in the western part of the DPR, located 46 kilometers from Donetsk and 30 kilometers south of Krasnoarmeysk (Pokrovsk). It is the largest settlement in southwest Donbass still under the control of Ukrainian forces after the liberation of Ugledar.	https://sputnikglobe.com/20241207/russian-troops-liberate-berestki-and-push-toward-kurakhovo-1121115202.html	2024-12-07T03:05:24-08:00	
Roger Waters Slams US Decisions on Ukraine, Calls NATO Expansion 'Dreadful'	MOSCOW (Sputnik) - Roger Waters, a co-founder of British rock band Pink Floyd, said in an interview with Sputnik that he considers all decisions by the US authorities regarding Ukraine to be terrible.	https://sputnikglobe.com/20241207/roger-waters-slams-us-decisions-on-ukraine-calls-nato-expansion-dreadful-1121114874.html	2024-12-07T02:16:21-08:00	
Syrian, Russian Forces Launch Massive Attacks on Terrorist Positions Near Homs and Hama	Syrian troops, together with the Russian Aerospace Forces, launched massive strikes on terrorist positions and supply routes in the provinces of Homs and Hama, the Syrian Defense Ministry said.	https://sputnikglobe.com/20241207/syrian-russian-forces-launch-massive-attacks-on-terrorist-positions-near-homs-and-hama-1121114339.html	2024-12-06T23:56:05-08:00	
Instead of Fighting Terrorism, UK Shifts 'Finite Capacity' to Counter Russia	Signifying No. 10’s permanent push to reference the so-called 'Russian threat', the MI5 boss earlier claimed without providing any proof that Russia is intent on causing 'mayhem' on UK streets.	https://sputnikglobe.com/20241207/instead-of-fighting-terrorism-uk-shifts-finite-capacity-to-counter-russia-1121113308.html	2024-12-06T23:03:59-08:00	
Ghana to Hold General Election on Saturday	MOSCOW (Sputnik) - Nearly 18.8 million registered voters across Ghana will head to the polls on Saturday to elect a new president and 276 members of the country's unicameral parliament.	https://sputnikglobe.com/20241207/ghana-to-hold-general-election-on-saturday-1121113800.html	2024-12-06T22:20:01-08:00	
Israeli Forces Intercept Missile Fired From Yemen - IDF	MOSCOW (Sputnik) - The Israeli air force (IAF) intercepted a missile fired from Yemen toward Israel, the Israel Defense Forces (IDF) said on Saturday.	https://sputnikglobe.com/20241207/israeli-forces-intercept-missile-fired-from-yemen---idf-1121113506.html	2024-12-06T22:06:02-08:00	
