Title	Description	Link	pubDate	Image
Biden Admits 80,000 US Armed Forces Personnel Are in Europe to 'Deter Russia'	WASHINGTON (Sputnik) - Outgoing US President Joe Biden reported to Congress on the presence of 80,000 American troops in European countries, sent there to deter alleged Russian aggression.	https://sputnikglobe.com/20241207/biden-admits-80000-us-armed-forces-personnel-are-in-europe-to-deter-russia-1121112791.html	2024-12-06T21:06:07-08:00	
Syrian Army Defeats Terrorist Units in Homs Province	BEIRUT (Sputnik) - The Syrian Armed Forces, supported by Russian and Syrian combat aircraft, carried out a successful operation, defeating terrorist units in the north of Homs province, the Syrian Defense Ministry said in a statement.	https://sputnikglobe.com/20241207/syrian-army-defeats-terrorist-units-in-homs-province-1121112637.html	2024-12-06T20:55:10-08:00	
Over 370,000 Syrians Have Been Displaced Since Start of Hostilities – UN Spokesman	UNITED NATIONS (Sputnik) - The United Nations Office for the Coordination of Humanitarian Affairs (OCHA) says that since the start of the fighting escalations in Syria, approximately 370,000 people have been displaced, UN Spokesman Stephane Dujarric said in a statement Friday.	https://sputnikglobe.com/20241207/over-370000-syrians-have-been-displaced-since-start-of-hostilities--un-spokesman--1121112371.html	2024-12-06T20:50:28-08:00	
South Korean President Apologizes for Imposing Martial Law - Reports	MOSCOW (Sputnik) - South Korean President Yoon Suk-yeol has apologized for imposing martial law in the country and said he will not impose it again ahead of the upcoming impeachment vote, the Yonhap news agency reported, citing his statement.	https://sputnikglobe.com/20241207/south-korean-president-apologizes-for-imposing-martial-law---reports-1121112164.html	2024-12-06T20:05:24-08:00	
Prosecutor Blocks Lawsuit Against EU's Ursula von der Leyen Over Pfizergate	A Belgian court was unable to review the charges against European Commission President Ursula von der Leyen due to the intervention of the European Prosecutor's Office, according to activist and prosecution representative Frédéric Baldan.	https://sputnikglobe.com/20241206/prosecutor-blocks-lawsuit-against-eus-ursula-von-der-leyen-over-pfizergate-1121111571.html	2024-12-06T10:43:50-08:00	
Why the Clintons Need Biden's 'Blanket Pardons' More Than Other Democrats	After President Joe Biden issued an unusual blanket pardon for his son, Hunter, Democratic Congressman Ed Markey has urged the president to extend 'preemptive pardons' to other top Democrats whom Donald Trump believes 'harmed him' and might otherwise be treated by him in a 'fascistic way.'	https://sputnikglobe.com/20241206/why-the-clintons-need-bidens-blanket-pardons-more-than-other-democrats-1121111090.html	2024-12-06T10:25:43-08:00	
Russian Scientists Develop New Energy Conservation Technique	Industrial production is accompanied by the release of significant amounts of thermal energy, which in most cases is irretrievably lost, dissipating into the surrounding environment. Currently, more and more attention is being paid to the development of technologies aimed at utilizing waste heat.	https://sputnikglobe.com/20241206/russian-scientists-develop-new-energy-conservation-technique--1121110244.html	2024-12-06T08:42:12-08:00	
Union State Summit: Putin and Lukashenko Sign Security Treaty, Agree Oreshnik Deployment in Belarus	Minsk has hosted a meeting of the Supreme State Council of the Union State between Russia and Belarus to mark its 25th anniversary. Presidents Vladimir Putin and Alexander Lukashenko discussed the alliance's achievements as well as prospects for mutual cooperation and security issues. What else did the two leaders discuss?	https://sputnikglobe.com/20241206/union-state-summit-putin-and-lukashenko-sign-security-treaty-agree-oreshnik-deployment-in-belarus-1121110041.html	2024-12-06T08:37:46-08:00	
Iran Successfully Launches Saman-1 Satellite Into Orbit	TEHRAN (Sputnik) - Iran has successfully launched its homegrown Saman-1 satellite into orbit using the Simorgh satellite launch vehicle, Iranian media reported on Friday.	https://sputnikglobe.com/20241206/iran-successfully-launches-saman-1-satellite-into-orbit-1121110478.html	2024-12-06T08:33:44-08:00	
Pepe Escobar: The Syria Tragedy and the New Omni-War	Until recently, a serious geopolitical working hypothesis was that West Asia and Ukraine were two vectors of the standard Hegemon modus operandi, which is to incite and unleash Forever Wars. Now both wars are united in an Omni-War.	https://sputnikglobe.com/20241206/pepe-escobar-the-syria-tragedy-and-the-new-omni-war-1121108341.html	2024-12-06T07:42:55-08:00	
How Hardline Pro-US Policies Fuel Political Earthquakes in S. Korea, France and Germany	A series of political earthquakes has rocked France, South Korea, and Germany. Despite each crisis having its unique internal dynamics, their common thread lies in their pro-US orientation and anti-Russia policies, pundits told Sputnik.	https://sputnikglobe.com/20241206/how-hardline-pro-us-policies-fuel-political-earthquakes-in-s-korea-france-and-germany-1121108803.html	2024-12-06T06:38:23-08:00	
Romania’s Top Court Cancels Results of Presidential Election's First Round - Reports	CHISINAU (Sputnik) -The Constitutional Court of Romania on Friday ruled to cancel results of the presidential election’s first round, the local media reported, adding that the vote will be held again.	https://sputnikglobe.com/20241206/romanias-top-court-cancels-results-of-presidential-elections-first-round---reports-1121108955.html	2024-12-06T05:35:18-08:00	
Situation in Russia's Kursk Region Nearing Resolution, Rapid Recovery Expected - Kremlin	Earlier, Russian President Vladimir Putin appointed an acting governor to the region, who was dubbed by the Kremlin press office as a 'crisis manager'.	https://sputnikglobe.com/20241206/situation-in-russias-kursk-region-nearing-resolution-rapid-recovery-expected---kremlin-1121107980.html	2024-12-06T04:55:09-08:00	
West Deliberately Escalates Tensions in Ukraine - Putin	MINSK (Sputnik) - The West is deliberately escalating tensions in Ukraine, and they are to be blamed for the current situation, Russian President Vladimir Putin said on Friday.	https://sputnikglobe.com/20241206/west-deliberately-escalates-tensions-in-ukraine---putin-1121108163.html	2024-12-06T04:31:10-08:00	
Russian Forces Liberate Two Settlements in Donetsk and Launch Precision Strikes	Sukhiye Yaly and Pustynka were liberated by Russia's Vostok and Tsentr Battlegroups, respectively, the Russian Ministry of Defense reported.	https://sputnikglobe.com/20241206/russian-forces-liberate-two-settlements-in-donetsk-and-launch-precision-strikes-1121107217.html	2024-12-06T03:46:51-08:00	
Putin, Lukashenko Hold Supreme State Council Meeting of Russia-Belarus Union State	The meeting of the two presidents is scheduled to commemorate the 25th anniversary of the Treaty on the Creation of a Union State of Russia and Belarus, signed in December 1999.	https://sputnikglobe.com/20241206/putin-lukashenko-hold-supreme-state-council-meeting-of-russia-belarus-union-state-1121104660.html	2024-12-06T03:37:21-08:00	
Iran Urges Ukraine to Cease Weapon Supply to Militants in Syria	TEHRAN (Sputnik) - Ukraine needs to stop supplying US weapons to militants in Syria immediately, Mojtaba Damirchilou, the Iranian Foreign Ministry’s Eurasian Department head, said on Friday.	https://sputnikglobe.com/20241206/iran-urges-ukraine-to-cease-weapon-supply-to-militants-in-syria-1121107644.html	2024-12-06T03:32:23-08:00	
French Mayor Says Heritage Must Be Protected After Russian Monuments Demolished in Ukraine	MOSCOW (Sputnik) - The cultural and historical heritage of the Russian people, a testament to their rich history, must be protected, Bernard Gauducheau, mayor of the French city of Vanves where prominent Russian poet Marine Tsevateva once lived, told Sputnik on Friday.	https://sputnikglobe.com/20241206/french-mayor-says-heritage-must-be-protected-after-russian-monuments-demolished-in-ukraine-1121107115.html	2024-12-06T03:25:09-08:00	
Hungary Vows to Block EU Budget Draft Unless Frozen Funds Released	MOSCOW (Sputnik) - The European Union withheld some 7.5 billion euros worth of payments to Hungary from the shared budget in September 2022 over alleged rule-of-law shortcomings, but Budapest's blocking of EU funding for Ukraine's war effort prompted Brussels to release some of the funds to Hungary in December.	https://sputnikglobe.com/20241206/hungary-vows-to-block-eu-budget-draft-unless-frozen-funds-released-1121106942.html	2024-12-06T03:01:08-08:00	
Russia Recognizes That EU and US Aren't 'Center of Universe' - Ex-CIA Analyst	With BRICS gaining momentum, Russia has realized that its economy is strong enough and it can stand on its two feet, Larry Johnson said.	https://sputnikglobe.com/20241206/russia-recognizes-that-eu-and-us-arent-center-of-universe---ex-cia-analyst-1121106059.html	2024-12-06T02:44:47-08:00	
What Makes Romania So Important For US' Anti-Russia Strategy?	The first round of Romania’s presidential election saw candidate Calin Georgescu, who is critical of NATO, gain significant support, prompting a swift response from the US with veiled threats.	https://sputnikglobe.com/20241206/what-makes-romania-so-important-for-us-anti-russia-strategy-1121106389.html	2024-12-06T02:40:43-08:00	
US Boosts Platinum Imports From Russia to Maximum in 2 Years	MOSCOW (Sputnik) - Russia increased supplies of platinum to the United States in October to their maximum level in two years - $203 million, which is almost a third of all imports, Sputnik's analysis of the data of the US statistical service showed on Friday.	https://sputnikglobe.com/20241206/us-boosts-platinum-imports-from-russia-to-maximum-in-2-years-1121105084.html	2024-12-06T00:25:30-08:00	
Japan to Provide Philippines With $10.6Mln of Military Assistance - Reports	MOSCOW (Sputnik) - Japan will provide the Philippines with $10.6 million worth of military vehicles, the Philippines News Agency has reported.	https://sputnikglobe.com/20241206/japan-to-provide-philippines-with-106mln-of-military-assistance---reports-1121104523.html	2024-12-05T21:30:56-08:00	
US to Be Left Without Money If It Does Not Tackle National Debt - Musk	MOSCOW (Sputnik) - If the US does not improve the situation with rising national debt, it risks being left without money even for basic services, billionaire and future leader of US spending watchdog Elon Musk said on Friday.	https://sputnikglobe.com/20241206/us-to-be-left-without-money-if-it-does-not-tackle-national-debt---musk-1121104385.html	2024-12-05T21:20:45-08:00	
Over 280,000 People Flee Their Homes Due to Crisis in Syria - UN	MOSCOW (Sputnik) - More than 280,000 people have fled their homes due to the crisis in northwest Syria, the UN World Food Programme said.	https://sputnikglobe.com/20241206/over-280000-people-flee-their-homes-due-to-crisis-in-syria---un-1121104228.html	2024-12-05T21:15:54-08:00	
Volkswagen Workers to Go on 2nd Warning Strike on December 9	MOSCOW (Sputnik) - The second warning strike of the employees of the Volkswagen automotive giant will take place on December 9, IG Metall, the company's largest trade union, has said.	https://sputnikglobe.com/20241206/volkswagen-workers-to-go-on-2nd-warning-strike-on-december-9-1121104111.html	2024-12-05T21:09:49-08:00	
Work on BRICS Settlement Tool to Proceed Despite Trump's Threats - Russian Deputy FM	On November 30, Trump threatened the BRICS countries that he would impose 100% duties on them if they did not abandon plans to create an alternative currency to the dollar. At the same time, Russian President Vladimir Putin said earlier that it was too early to talk about the creation of a single BRICS currency.	https://sputnikglobe.com/20241206/work-on-brics-settlement-tool-to-proceed-despite-trumps-threats---russian-deputy-fm-1121103753.html	2024-12-05T20:53:55-08:00	
Romanian Presidential Candidate Georgescu Calls on US to Respect Country's Sovereignty	MOSCOW (Sputnik) - Romanian independent presidential candidate Calin Georgescu said he welcomes US attention to events in the country, but stressed that any attempts of external interference are unacceptable.	https://sputnikglobe.com/20241206/romanian-presidential-candidate-georgescu-calls-on-us-to-respect-countrys-sovereignty-1121103621.html	2024-12-05T20:47:05-08:00	
South Korean Police, Prosecution Create Teams to Look Into Martial Law - Reports	MOSCOW (Sputnik) - South Korean police and prosecutors have set up separate investigation teams to look into the martial law declared in the country earlier this week, Yonhap news agency reported Friday, citing the two agencies.	https://sputnikglobe.com/20241206/south-korean-police-prosecution-create-teams-to-look-into-martial-law---reports-1121103484.html	2024-12-05T20:36:21-08:00	
Watch Full Video of Sergey Lavrov's Interview with American Journalist Tucker Carlson	Ten months after Tucker Carlson's interview with Russian President Vladimir Putin, the American journalist returned to Moscow to talk with Russian Foreign Minister Sergey Lavrov. The conversation is devoted to the most pressing issues, including the possible dialogue between Russia and the West. Read the full text of the interview below.	https://sputnikglobe.com/20241205/watch-full-video-of-sergey-lavrovs-interview-with-american-journalist-tucker-carlson-1121102130.html	2024-12-05T15:47:00-08:00	
US May Lose 20% of Germanium Supplies Because of Chinese Restrictions	MOSCOW, December 5 (Sputnik) - The United States may lose nearly 20% of its germanium supplies, as well as almost 9% of gallium and 8% of antimony supplies because of the restrictions introduced by China earlier this week, Sputnik calculated on Thursday based on data from the US statistical service.	https://sputnikglobe.com/20241205/us-may-lose-20-of-germanium-supplies-because-of-chinese-restrictions-1121101631.html	2024-12-05T12:31:00-08:00	
Macron Accepts Prime Minister Barnier's Resignation	MOSCOW (Sputnik) - French Prime Minister Michel Barnier has submitted his resignation to President Emmanuel Macron after a vote of no confidence in his government was accepted by a majority the day before, the Elysee Palace said on Thursday.	https://sputnikglobe.com/20241205/macron-accepts-prime-minister-barniers-resignation-1121100926.html	2024-12-05T06:33:53-08:00	
‘This is Genocide’: Rights Group Accuses Israel of Deliberately Destroying Palestinians in Gaza	Amnesty chief Agnes Callamard said that 'month after month, Israel has treated Palestinians in Gaza as a subhuman group unworthy of human rights and dignity, demonstrating its intent to physically destroy them.'	https://sputnikglobe.com/20241205/this-is-genocide-rights-group-accuses-israel-of-deliberately-destroying-palestinians-in-gaza-1121100290.html	2024-12-05T06:03:45-08:00	
Oreshnik: The Ultimate Weapon On Everyone’s Mind – Putin Talks The Truth You Need To Hear	The world is buzzing: is Russia's Oreshnik missile unstoppable? Can it break through any defense system? What happens when it strikes? And can it reach the US? Putin has the answers to the questions everyone’s asking.	https://sputnikglobe.com/20241205/oreshnik-the-ultimate-weapon-on-everyones-mind--putin-talks-the-truth-you-need-to-hear-1121099927.html	2024-12-05T06:01:54-08:00	
Ukraine Loses Over 300 Soldiers in Kursk Region in Past Day	MOSCOW (Sputnik) - The Ukrainian armed forces have lost more than 300 soldiers in the Kursk region in the past day, the Russian Defense Ministry said on Thursday.	https://sputnikglobe.com/20241205/ukraine-loses-over-300-soldiers-in-kursk-region-in-past-day-1121100174.html	2024-12-05T05:55:16-08:00	
Russia Not Threatening Anyone With Nuclear Arms - Russian Foreign Ministry	MOSCOW (Sputnik) - Russia is not threatening anyone with nuclear weapons, but in connection with the Ukraine conflict it is warning of the risks of a clash between nuclear powers that could have grave consequences, Russian Foreign Ministry spokeswoman Maria Zakharova said on Thursday.	https://sputnikglobe.com/20241205/russia-not-threatening-anyone-with-nuclear-arms---russian-foreign-ministry-1121099857.html	2024-12-05T05:51:42-08:00	
Ukraine Loses Up to 560 Soldiers in Battles With Russian Western Forces	MOSCOW (Sputnik) - Russia's Zapad group of forces has eliminated up to 560 Ukrainian servicepeople in the past day, the Russian Defense Ministry said on Thursday.	https://sputnikglobe.com/20241205/ukraine-loses-up-to-560-soldiers-in-battles-with-russian-western-forces-1121097700.html	2024-12-05T05:11:20-08:00	
Fantasies About Deploying Foreign Troops in Ukraine Exacerbate the Situation – Lavrov	Russia's foreign policy chief commented on several issues of global politics while talking to media after the OSCE Ministerial Council meeting	https://sputnikglobe.com/20241205/fantasies-about-deploying-foreign-troops-in-ukraine-exacerbate-the-situation--lavrov-1121097215.html	2024-12-05T04:59:09-08:00	
Russian General Staff Head, US Counterpart Held Phone Conversation on Nov 27	MOSCOW (Sputnik) - Russian Chief of General Staff Valery Gerasimov and US Chairman of the Joint Chiefs of Staff Charles Brown held a phone conversation on November 27, and the United States was informed about military drills in Eastern Mediterranean that involved firing precision missiles, the Russian Defense Ministry said on Thursday.	https://sputnikglobe.com/20241205/russian-general-staff-head-us-counterpart-held-phone-conversation-on-nov-27-1121097003.html	2024-12-05T04:30:05-08:00	
Ukrainian Colonel Led Poisonous Munitions Attack on Kursk Region - Russian Investigators	Ukrainian Col. Pavlo Rozlach was in charge of an attack on Russia’s Kursk Region with cluster munitions filled with poisonous substances, the Russian Investigative Committee told Sputnik on Thursday.	https://sputnikglobe.com/20241205/ukrainian-colonel-led-poisonous-munitions-attack-on-kursk-region---russian-investigators-1121096868.html	2024-12-05T04:25:30-08:00	
Lavrov Holds Presser After OSCE Ministerial Meeting	The OSCE unites 57 countries from North America, Europe and Central Asia, and offers a platform for discussions on global security.	https://sputnikglobe.com/20241205/lavrov-holds-presser-after-osce-ministerial-meeting--1121094737.html	2024-12-05T04:13:57-08:00	
Global Demand for LNG to Grow to 920Mln Tonnes by 2040	MOSCOW (Sputnik) - Global demand for liquefied natural gas (LNG) will increase to 920 million tonnes by 2040, Russian energy company Novatek CEO Leonid Mikhelson said on Thursday.	https://sputnikglobe.com/20241205/global-demand-for-lng-to-grow-to-920mln-tonnes-by-2040-1121096700.html	2024-12-05T04:00:21-08:00	
Pakistan ‘Сould Open the Gates’ for Russia’s Oil and Gas Exploration – Minister	Moscow and Islamabad have continued to bolster their economic partnership, with Pakistani Maritime Affairs Minister Qaiser Ahmed Sheikh earlier telling Sputnik that trade between the two countries is expected to grow in the coming years.	https://sputnikglobe.com/20241205/pakistan-sould-open-the-gates-for-russias-oil-and-gas-exploration--minister---1121095050.html	2024-12-05T03:24:23-08:00	
US Wants to Return NATO on Political Scene by Escalating Cold War With Russia - Lavrov	VALLETTA (Sputnik) - The United States wants to bring NATO back to the political scene by escalating the Cold War with Russia, Russian Foreign Minister Sergey Lavrov said on Thursday.	https://sputnikglobe.com/20241205/us-wants-to-return-nato-on-political-scene-by-escalating-cold-war-with-russia---lavrov-1121096063.html	2024-12-05T03:02:35-08:00	
Trump's Threat to BRICS Countries Harmful to All Sides - Malaysian Minister	JAKARTA (Sputnik) - US President-elect Donald Trump's threat to impose duties on BRICS member countries will harm all parties as it hinders efforts to prevent disruptions in the global supply chain, Malaysian Minister of Investment, Trade and Industry Zafrul Abdul Aziz said on Thursday.	https://sputnikglobe.com/20241205/trumps-threat-to-brics-countries-harmful-to-all-sides---malaysian-minister-1121095782.html	2024-12-05T02:45:10-08:00	
Former Jihadist Shares How Ukraine Supports Islamic Terrorism	Ukrainian instructors trained Syrian terrorists to use kamikaze drones against the Russian army in Idlib and across Syria, a defector from the terrorist group Hay'at Tahrir al-Sham* (formerly known as Jabhat al-Nusra*) told Sputnik.	https://sputnikglobe.com/20241205/former-jihadist-shares-how-ukraine-supports-islamic-terrorism-1121094415.html	2024-12-05T02:22:39-08:00	
Protesters in Georgian Capital Disperse	TBILISI (Sputnik) - The protesters in Tbilisi have almost completely dispersed, this is the first rally in a week that has not been dispersed by the police, a Sputnik correspondent reported.	https://sputnikglobe.com/20241205/protesters-in-georgian-capital-disperse-1121093981.html	2024-12-05T02:12:12-08:00	
Bitcoin Price Reaches All-Time High of $102,000	MOSCOW (Sputnik) - The price of bitcoin has reached a new all-time high (ATH), exceeding $102,000, according to trading data.	https://sputnikglobe.com/20241205/bitcoin-price-reaches-all-time-high-of-102000-1121094287.html	2024-12-04T22:00:26-08:00	
Leader of South Korean Ruling Party Vows to Block Impeachment Against President	MOSCOW (Sputnik) - Han Dong-hoon, the leader of the ruling People Power Party, has vowed to make efforts to prevent President Yoon Suk Yeol from being impeached, the Yonhap news agency reported on Thursday.	https://sputnikglobe.com/20241205/leader-of-south-korean-ruling-party-vows-to-block-impeachment-against-president-1121093799.html	2024-12-04T21:39:22-08:00	
White House Mulls Preemptive Pardons for Biden Officials Before January 20	MOSCOW (Sputnik) - US President Joe Biden's administration is considering introducing preemptive pardons for current and former officials to protect them from possible prosecution after President-elect Donald Trump takes the Oval Office in January, media reported on Thursday, citing senior Democratic Party sources.	https://sputnikglobe.com/20241205/white-house-mulls-preemptive-pardons-for-biden-officials-before-january-20-1121093641.html	2024-12-04T21:20:29-08:00	
Russia-North Korea Strategic Agreement Enters Into Force - Report	Deputy Foreign Minister of the DPRK, Kim Jong Gyu, and Deputy Foreign Minister of the Russian Federation, Andrey Rudenko, signed the protocol on the exchange of ratification instruments.	https://sputnikglobe.com/20241205/russia-north-korea-strategic-agreement-enters-into-force---report-1121092936.html	2024-12-04T21:06:37-08:00	
Ukrainian Delegation Met With Trump Team Representatives	MOSCOW (Sputnik) - A Ukrainian delegation led by head of Ukrainian leader Volodymyr Zelensky's office Andriy Yermak met in the United States with Mike Waltz, the future national security adviser to US President-elect Donald Trump, and Keith Kellogg, Trump's pick for US envoy for Ukraine and Russia, Reuters reported, citing a source.	https://sputnikglobe.com/20241205/ukrainian-delegation-met-with-trump-team-representatives-1121093447.html	2024-12-04T21:04:45-08:00	
Israel Sends Hamas Updated Draft of Gaza Ceasefire Deal	MOSCOW (Sputnik) - Israel has handed over to Palestinian movement Hamas an updated draft agreement, which provides for the release of some Israeli hostages and a ceasefire in the Gaza Strip, media reported on Thursday, citing two Israeli officials.	https://sputnikglobe.com/20241205/israel-sends-hamas-updated-draft-of-gaza-ceasefire-deal-1121093187.html	2024-12-04T20:55:29-08:00	
How Powerful is Iran's Military That Soon May Be Unleashed Against Terrorists in Syria?	Iranian Foreign Minister Abbas Araghchi told media this week that Iran is ready to deploy its military to aid the Syrian government if it were to make such request.	https://sputnikglobe.com/20241204/how-powerful-is-irans-military-that-soon-may-be-unleashed-against-terrorists-in-syria-1121092489.html	2024-12-04T10:58:28-08:00	
Watch Russian Drone Take Out Ukrainian Armored Transport With Precise Strike	This short video shows how a moment of laxity in a combat zone can lead to fatal consequences and loss of valuable military hardware.	https://sputnikglobe.com/20241204/watch-russian-drone-take-out-ukrainian-armored-transport-with-precise-strike-1121092268.html	2024-12-04T08:34:42-08:00	
Watch Putin's Full Address at 'Russia Calling!' Investment Forum	Russian President Vladimir Putin has delivered a speech at the 'Russia Calling!' investment forum that launched in Moscow on December 4.	https://sputnikglobe.com/20241204/watch-putins-full-address-at-russia-calling-investment-forum-1121092128.html	2024-12-04T08:15:00-08:00	
Visa Already Issued by Malta For Russian FM Spokeswoman Canceled on Eve of OSCE Meeting	MOSCOW (Sputnik) - Russian Foreign Ministry spokeswoman Maria Zakharova had her visa already issued by Malta canceled on the eve of the meeting of OSCE foreign ministers, the Russian Foreign Ministry said on Wednesday.	https://sputnikglobe.com/20241204/visa-already-issued-by-malta-for-russian-fm-spokeswoman-canceled-on-eve-of-osce-meeting--1121091981.html	2024-12-04T08:01:06-08:00	
Scholz Rules Out Sending German Troops to Ukraine	MOSCOW (Sputnik) - Germany will not send troops to Ukraine, German Chancellor Olaf Scholz said on Wednesday.	https://sputnikglobe.com/20241204/scholz-rules-out-sending-german-troops-to-ukraine-1121090744.html	2024-12-04T06:44:08-08:00	
Top 5 Corruption Scandals Shaking the World	South Korean President Yoon Suk-yeol's surprise declaration of martial law has ended in fiasco. Was this a last-ditch attempt to stay in power by the lame-duck president amid his corruption scandal?	https://sputnikglobe.com/20241204/top-5-corruption-scandals-shaking-the-world-1121090556.html	2024-12-04T06:19:59-08:00	
