Title	Description	Link	pubDate	Image
White House Insists No Nukes for Ukraine But More Conventional Arms	MOSCOW (Sputnik) - The United States is focused on providing Ukraine with conventional weapons and does not consider the possibility of returning nuclear weapons to the country, White House National Security Advisor Jake Sullivan said on Sunday.	https://sputnikglobe.com/20241201/white-house-insists-no-nukes-for-ukraine-but-more-conventional-arms-1121063213.html	2024-12-01T09:22:42-08:00	
Trump’s Threat of 100% Tariffs Targeting BRICS Would Blow Up in America’s Face: Here’s Why	Donald Trump has threatened to slap BRICS members with 100% import duties if the bloc tries to create its own monetary unit or backs 'any other currency to replace the mighty dollar.' How could this look in practice? And who would stand to lose more if the president-elect made good on the threat? Sputnik asked a renowned British economist.	https://sputnikglobe.com/20241201/trumps-threat-of-100-tariffs-targeting-brics-would-blow-up-in-americas-face-heres-why-1121061233.html	2024-12-01T08:08:17-08:00	
Who is Kash Patel, Trump’s Pick to Head the FBI?	Donald Trump has repeatedly derided the FBI as a 'badly broken' agency over the years, saying it had 'lost the confidence of America.' Current FBI chief Christopher A. Wray was also the target of Trump’s criticism.	https://sputnikglobe.com/20241201/who-is-kash-patel-trumps-pick-to-head-the-fbi-1121060602.html	2024-12-01T05:36:58-08:00	
Georgian Prime Minister Rules Out Calling New Parliamentary Elections	TBILISI (Sputnik) - Georgian Prime Minister Irakli Kobakhidze on Sunday ruled out the possibility of calling new parliamentary elections amid opposition protests.	https://sputnikglobe.com/20241201/georgian-prime-minister-rules-out-calling-new-parliamentary-elections-1121060493.html	2024-12-01T04:16:21-08:00	
Which Countries Have Territorial Claims to Antarctica?	The Antarctic Treaty was signed in Washington on December 1, 1959 by the 12 countries whose scientists had been active in and around Antarctica during the International Geophysical Year (IGY) of 1957-1958. The treaty bans 'all activity relating to mineral resources, other than scientific research.'	https://sputnikglobe.com/20241201/which-countries-have-territorial-claims-to-antarctica-1121059907.html	2024-12-01T03:18:41-08:00	
Dysfunctional' Pentagon Has Hard Time Making Artillery Shells, Let Alone Upgrading Nuclear Arsenal	A Russian nonprofit has delved into the details of the US's trillion-dollar+ nuclear modernization spending, highlighting efforts to deploy an army of DoD employees to bring America's nuclear arsenal up to par. But the wasteful and inefficient US defense spending system as it's presently set up is not fit to task, says a leading US military expert.	https://sputnikglobe.com/20241201/dysfunctional-pentagon-has-hard-time-making-artillery-shells-let-alone-upgrading-nuclear-arsenal-1121059052.html	2024-12-01T03:00:02-08:00	
Russian Forces Liberate Two More Strategic Settlements, Strengthen Positions in Donetsk	MOSCOW (Sputnik) - Russia's Battlegroups Yug and Tsentr have liberated the settlements of Ilyinka and Petrovka in the Donetsk People's Republic (DPR), the Russian Defense Ministry said on Sunday.	https://sputnikglobe.com/20241201/russian-forces-liberate-two-more-strategic-settlements-strengthen-positions-in-donetsk-1121058724.html	2024-12-01T02:10:08-08:00	
Syrian Army Pushes Back Terrorists, Restores Control in Key Northern Hama Locations	DAMASCUS (Sputnik) - The Syrian army has strengthened its positions north of the city of Hama, preventing terrorists from breaking through, Syrian broadcaster Al Ikhbariyah reported on Sunday, citing a source in the country's defense ministry.	https://sputnikglobe.com/20241201/syrian-army-pushes-back-terrorists-restores-control-in-key-northern-hama-locations-1121058560.html	2024-12-01T01:39:54-08:00	
Coffee Prices May Rise 25% in 2025 Due to Bad Harvest in Brazil, Vietnam – Rating Agency	MOSCOW (Sputnik) - Coffee prices may rise by 25% in 2025, as unfavorable weather conditions will impact the harvest in Brazil and Vietnam, the world leaders in Arabica and Robusta production, Anton Trenin, an expert at the Russian Analytical Credit Rating Agency’s (ACRA) corporate ratings group, told Sputnik on Sunday.	https://sputnikglobe.com/20241201/coffee-prices-may-rise-25-in-2025-due-to-bad-harvest-in-brazil-vietnam--rating-agency-1121058298.html	2024-12-01T01:34:47-08:00	
Ukraine’s NATO Aspirations Grow Dim as Russia Steadily Advances - Reports	Volodymyr Zelensky’s 'victory plan,' outlined to US president-elect Donald Trump in September, demanded a formal invitation for Ukraine from NATO, the lifting of restrictions on strikes deep into Russia, and refusal to accept territorial losses. However, reports have indicated there has been an apparent rollback from these hardline demands.	https://sputnikglobe.com/20241201/ukraines-nato-aspirations-grow-dim-as-russia-steadily-advances---reports-1121057026.html	2024-11-30T23:40:00-08:00	
Ukrainian Troops Complain About Command Failures, Rising Desertions	As the Ukrainian Army suffers devastating losses and a growing number of desertions in the special operation zone, more soldiers are expressing growing frustration over lying commanders and a lack of equipment, the Financial Times reported.	https://sputnikglobe.com/20241201/ukrainian-troops-complain-about-command-failures-rising-desertions-1121057133.html	2024-11-30T23:17:18-08:00	
Israeli Military Intercepts Projectile Launched From Yemen - IDF	MOSCOW (Sputnik) - The Israeli Air Force (IAF) has intercepted a projectile launched from Yemen prior to its crossing into Israeli territory, the Israel Defense Forces (IDF) said on Sunday.	https://sputnikglobe.com/20241201/israeli-military-intercepts-projectile-launched-from-yemen---idf-1121056890.html	2024-11-30T22:05:19-08:00	
China Condemns US Assistance in 'Transit' of Taiwan's Administration Head	BEIJING (Sputnik) - China strongly condemns the US organization of the 'transit' of Taiwan's head of administration Lai Ching-te through their territory, and has made a stern representation to Washington, the Chinese Foreign Ministry said.	https://sputnikglobe.com/20241201/china-condemns-us-assistance-in-transit-of-taiwans-administration-head-1121056748.html	2024-11-30T22:03:20-08:00	
Romania to Hold Parliamentary Elections on Sunday	MOSCOW (Sputnik) - Romanians will go to the polls on Sunday to elect members of the 466-seat parliament for a four-year term.	https://sputnikglobe.com/20241201/romania-to-hold-parliamentary-elections-on-sunday-1121056636.html	2024-11-30T22:01:25-08:00	
Syrian Air Force Strikes Terrorist Equipment Column, Thwarting Offensive Near Aleppo	Planes of the Syrian Air Force carried out a series of strikes on a column of militant armored vehicles on the M5 Aleppo-Damascus Motorway, disrupting their offensive, a source in the country's security services told Sputnik.	https://sputnikglobe.com/20241201/syrian-air-force-strikes-terrorist-equipment-column-thwarting-offensive-near-aleppo-1121056112.html	2024-11-30T21:34:23-08:00	
Hunter Biden's Lawyers Believe His Future Under Threat From Trump's Victory - Reports	WASHINGTON (Sputnik) - Lawyers for Hunter Biden, the son of incumbent US President Joe Biden, believe that a victory by Donald Trump in the election threatens their client's future, media reported citing a 52-page report by his defense in light of his criminal sentencing in December.	https://sputnikglobe.com/20241201/hunter-bidens-lawyers-believe-his-future-under-threat-from-trumps-victory---reports-1121055432.html	2024-11-30T20:41:30-08:00	
Putin Signs Law on Federal Budget for 2025-2027	MOSCOW (Sputnik) - Russian President Vladimir Putin signed a law approving Russia's federal budget for 2025 and the planning period 2026-2027, the corresponding document is published on the legal acts portal.	https://sputnikglobe.com/20241201/putin-signs-law-on-federal-budget-for-2025-2027-1121054493.html	2024-11-30T20:31:14-08:00	
Russian Scientist on Cancer Vaccine: Melanoma, Metastases Simply Disappear After Its Use	MOSCOW (Sputnik) - After the use of the cancer vaccine, which is being developed by experts from the Gamaleya National Research Center for Epidemiology and Microbiology, melanoma is absorbed, and metastases also disappear, this is shown by preclinical studies of the drug, the center's director, Alexander Gintsburg, told Sputnik.	https://sputnikglobe.com/20241201/russian-scientist-on-cancer-vaccine-melanoma-metastases-simply-disappear-after-its-use-1121055227.html	2024-11-30T20:27:50-08:00	
Israeli Drones Conduct Reconnaissance Over Beirut, Violating Ceasefire Agreement	BEIRUT (Sputnik) - Israeli Air Force reconnaissance drones are conducting raids over Beirut, a Sputnik correspondent reported.	https://sputnikglobe.com/20241201/israeli-drones-conduct-reconnaissance-over-beirut-violating-ceasefire-agreement-1121054947.html	2024-11-30T20:21:56-08:00	
Syrian Army Reinforcements Arrive in Hama, Government Operating as Usual	CAIRO (Sputnik) - Syrian army reinforcements have arrived in Hama, government agencies are operating as usual, the governor of the province, Kamal Barmo, said.	https://sputnikglobe.com/20241201/syrian-army-reinforcements-arrive-in-hama-government-operating-as-usual-1121054784.html	2024-11-30T20:19:48-08:00	
Joint China-Russia Patrols Not Directed Against Third Countries - Defense Ministry	BEIJING (Sputnik) - Joint patrols by Russia and China are not directed against third countries and are not related to the current international and regional situation, Chinese Defense Ministry spokesman Zhang Xiaogang said on Sunday.	https://sputnikglobe.com/20241201/joint-china-russia-patrols-not-directed-against-third-countries---defense-ministry-1121054360.html	2024-11-30T20:17:01-08:00	
Trump Threatens BRICS Countries With Tariffs Unless Abandon Plans to Replace US Dollar	MOSCOW (Sputnik) - US President-elect Donald Trump said on Saturday that he would impose 100% tariffs on BRICS countries if they did not abandon plans to create an alternative currency to the US dollar.	https://sputnikglobe.com/20241201/trump-threatens-brics-countries-with-tariffs-unless-abandon-plans-to-replace-us-dollar-1121054628.html	2024-11-30T20:16:13-08:00	
Syria Capable of Destroying Terrorists With Help of Friends, Allies - Assad	CAIRO (Sputnik) - Syrian President Bashar Assad said that the country continues to defend its territorial integrity and is capable of destroying terrorists with the help of friends and allies, the Syrian leader's office said on Saturday.	https://sputnikglobe.com/20241201/syria-capable-of-destroying-terrorists-with-help-of-friends-allies---assad-1121053747.html	2024-11-30T17:15:59-08:00	
Houthis Have Trapped American Superpower in Dangerous 'Stalemate', US Media Say	The ragtag Yemeni militia’s self-imposed partial blockade of Red Sea waters to Israeli, US and ‘Israeli-linked’ commercial shipping over the past year has humbled Israel’s powerful American allies, with Western warship deployments and attempts to 'degrade' the militia’s capabilities proving fruitless to date.	https://sputnikglobe.com/20241130/houthis-have-trapped-american-superpower-in-dangerous-stalemate-us-media-say-1121053181.html	2024-11-30T10:42:15-08:00	
‘Netanyahu Needs War’, Can’t Be Trusted to Stick to Lebanon Ceasefire - Mohammad Marandi	Israeli Prime Minister Benjamin Netanyahu announced this week that he’s ordered the military to prepare for the resumption of an 'intensive war' in Lebanon if Hezbollah violated the freshly-reached ceasefire deal. Sputnik asked one of the Middle East’s most prolific international affairs observers what this could mean for the region.	https://sputnikglobe.com/20241130/netanyahu-needs-war-cant-be-trusted-to-stick-to-lebanon-ceasefire---mohammad-marandi-1121052727.html	2024-11-30T09:22:02-08:00	
Hamas Accuses Israel of Using Banned Weapons in Gaza Strip, Demands Int'l Inquiry	CAIRO (Sputnik) - The Palestinian movement Hamas on Saturday accused Israel of using internationally banned weapons in the Gaza Strip and called for the international community and the United Nations to form an investigation committee.	https://sputnikglobe.com/20241130/hamas-accuses-israel-of-using-banned-weapons-in-gaza-strip-demands-intl-inquiry-1121052908.html	2024-11-30T08:54:28-08:00	
Better Range, Bigger Warheads: How Oreshnik Could Become Even More Powerful	President Putin unveiled new details about the destructive power of the Oreshnik hypersonic ballistic missile system this week, highlighting its extreme precision compared to other ballistic missiles, and its value against fortified underground structures. Sputnik asked a veteran military observer how the missile could be even further improved.	https://sputnikglobe.com/20241130/better-range-bigger-warheads-how-oreshnik-could-become-even-more-powerful-1121052261.html	2024-11-30T08:27:57-08:00	
Aleppo Crisis: What's Really Going on in Syria?	The conflict in Syria has returned to the front pages after years of media obliviousness due to a lightning jihadist offensive on the strategic city of Aleppo. Here’s what we know right now.	https://sputnikglobe.com/20241130/aleppo-crisis-whats-really-going-on-in-syria-1121050853.html	2024-11-30T06:11:25-08:00	
Ugly Truth of Ukraine’s Criminal Use of Chemical Weapons	Politicization of the work of the Organization for the Prohibition of Chemical Weapons (OPCW) by the US and its allies is illustrated by the situation around the use of chemical weapons in Ukraine, Vladimir Tarabrin, Russian Permanent Representative to the OPCW underscored at the 107th session of the organization's Executive Council in October.	https://sputnikglobe.com/20241130/ugly-truth-of-ukraines-criminal-use-of-chemical-weapons-1121050741.html	2024-11-30T06:00:50-08:00	
Germany Identifies 2 Suspects in Nord Stream Gas Pipelines Bombing - Prosecutor General	MOSCOW (Sputnik) - German investigators have identified two suspects in the attack on the Nord Stream pipelines, Federal Public Prosecutor General Jens Rommel said on Saturday.	https://sputnikglobe.com/20241130/germany-identifies-2-suspects-in-nord-stream-gas-pipelines-bombing---prosecutor-general-1121051071.html	2024-11-30T05:33:28-08:00	
Moscow Says Takes Japan's Course on Resolving Territorial Issue Only as Formalizing Border	MOSCOW (Sputnik) - Moscow proceeds from the fact that the 'resolution of the territorial issue' with Japan can only be achieved through the international legal recognition of existing borders between the two countries, Russian Foreign Ministry spokeswoman Maria Zakharova said on Saturday.	https://sputnikglobe.com/20241130/moscow-says-takes-japans-course-on-resolving-territorial-issue-only-as-formalizing-border-1121050620.html	2024-11-30T05:16:21-08:00	
Russia’s Oreshnik: Game-Changing Weapon Offering Nuclear Force Without Fallout	High-precision Oreshnik missiles can have the same impact on enemy targets as nuclear weapons, but are far more humane due to the absence of irreversible consequences typically associated with nuclear strikes, Russian military analyst and editor-in-chief of National Defense magazine, Igor Korotchenko, told Sputnik.	https://sputnikglobe.com/20241130/russias-oreshnik-game-changing-weapon-offering-nuclear-force-without-fallout-1121049895.html	2024-11-30T03:42:42-08:00	
Russian Forces Destroy Key Ukrainian Military and Energy Infrastructure	Russian forces have struck the infrastructure of Ukrainian military airfields, the Ministry of Defense (MoD) reported.	https://sputnikglobe.com/20241130/russian-forces-destroy-key-ukrainian-military-and-energy-infrastructure-1121049159.html	2024-11-30T03:29:46-08:00	
Israeli Air Force Attacks Military Facilities in Syria Near Lebanese Border - IDF	MOSCOW (Sputnik) - The Israeli air force (IAF) has attacked military facilities in Syria near the Lebanese border that were allegedly used to smuggle weapons to Lebanese-based movement Hezbollah, which violates the current ceasefire agreement, the Israel Defense Forces (IDF) said on Saturday.	https://sputnikglobe.com/20241130/israeli-air-force-attacks-military-facilities-in-syria-near-lebanese-border---idf-1121049738.html	2024-11-30T03:22:08-08:00	
Terrorist Infiltration in Aleppo: Syrian Military Readies Reinforcements	CAIRO (Sputnik) - Terrorist groups have penetrated many areas of the Syrian city of Aleppo, the Syrian armed forces command said on Saturday, adding that the Syrian military is continuing to strike at the terrorist positions and is expecting the arrival of reinforcement.	https://sputnikglobe.com/20241130/terrorist-infiltration-in-aleppo-syrian-military-readies-reinforcements-1121049583.html	2024-11-30T02:50:35-08:00	
Switzerland's Parliament Will Never Agree to NATO Membership – Swiss Senator	MOSCOW (Sputnik) - The population and parliament of Switzerland will never agree to join NATO in the current state of affairs in the world, Swiss senator from the largest party in the country's parliament, the Democratic Union of the Center, Mauro Poggia, told Sputnik.	https://sputnikglobe.com/20241130/switzerlands-parliament-will-never-agree-to-nato-membership--swiss-senator-1121049257.html	2024-11-30T02:15:42-08:00	
New Ukrainian Law Raising Military Tax, Tax on Bank Profits Goes Into Force	MOSCOW (Sputnik) - A new controversial tax law went into effect in Ukraine on Saturday raising the military tax to 5% from 1.5%, and the tax on bank profits to 50%.	https://sputnikglobe.com/20241130/new-ukrainian-law-raising-military-tax-tax-on-bank-profits-goes-into-force-1121048912.html	2024-11-30T02:11:29-08:00	
Russian Defense Minister’s Visit to North Korea: Key Statements	Russian Defense Minister Andrei Belousov arrived in North Korea for an official visit on November 29. His previous visit to the Democratic People's Republic of Korea (DPRK) was in June, when President Vladimir Putin and North Korean leader Kim Jong-un signed the Treaty on Comprehensive Strategic Partnership between the two countries.	https://sputnikglobe.com/20241130/russian-defense-ministers-visit-to-north-korea-key-statements-1121046657.html	2024-11-30T00:48:51-08:00	
Russia Strikes Warehouse Containing ATACMS, Storm Shadow Missiles - Pro-Russian Underground Network	Over the past week, the Russian Armed Forces also launched 32 precision strikes with high-tech weapons and drones, destroying two Ukrainian Grom-2 ballistic missile launchers and a Neptune anti-ship missile launcher, the Russian Defense Ministry said.	https://sputnikglobe.com/20241130/russia-strikes-warehouse-containing-atacms-storm-shadow-missiles---pro-russian-underground-network-1121047781.html	2024-11-30T00:42:21-08:00	
Norway's Military Aid to Ukraine Rises to Over $1.5Bln in 2024 - Russian Ambassador	MOSCOW (Sputnik) - Norwegian military aid to Kiev has increased simultaneously with Western efforts to prolong and escalate the Ukraine conflict to more than $1.5 billion in 2024, Russian Ambassador to Norway Nikolai Korchunov told Sputnik.	https://sputnikglobe.com/20241130/norways-military-aid-to-ukraine-rises-to-over-15bln-in-2024---russian-ambassador-1121047620.html	2024-11-29T23:16:35-08:00	
Zelensky Complains About Unfulfilled Promises of West	Volodymyr Zelensky has complained about the failure of Ukraine's partners to meet demands to equip Ukrainian Armed Forces brigades.	https://sputnikglobe.com/20241130/zelensky-complains-about-unfulfilled-promises-of-west-1121046921.html	2024-11-29T22:39:22-08:00	
Iceland to Hold Snap Parliamentary Polls on Saturday	MOSCOW (Sputnik) - Iceland will vote in snap parliamentary elections on Saturday to elect the Nordic country’s 63-seat parliament.	https://sputnikglobe.com/20241130/iceland-to-hold-snap-parliamentary-polls-on-saturday-1121047178.html	2024-11-29T21:54:09-08:00	
Canadian PM Justin Trudeau Arrives in Florida to Meet Trump - Reports	Canada’s Prime Minister Justin Trudeau has arrived in Florida to meet with US presidential election winner Donald Trump, The Globe and Mail agency reported, citing sources.	https://sputnikglobe.com/20241130/canadian-pm-justin-trudeau-arrives-in-florida-to-meet-trump---reports-1121046329.html	2024-11-29T21:41:39-08:00	
Why Russia Needs Robotics and How Can They Be Obtained?	The robotization of industry is inevitable today due to a number of factors, says Ivan Ermolov, professor of the Russian Academy of Sciences (RAS) and Scientific Secretary of the RAS’ Scientific Council on Robotics and Mechatronics.	https://sputnikglobe.com/20241130/why-russia-needs-robotics-and-how-can-they-be-obtained-1121044652.html	2024-11-29T21:00:00-08:00	
Biden Expects to Talk to Trump Again During Transition - White House Press Pool	MOSCOW (Sputnik) - Outgoing US President Joe Biden told reporters he expects to talk to US President-elect Donald Trump again during the transition.	https://sputnikglobe.com/20241130/biden-expects-to-talk-to-trump-again-during-transition---white-house-press-pool-1121046218.html	2024-11-29T20:40:05-08:00	
Russian Deputy Foreign Minister, UAE Ambassador Discuss Middle East, North Africa - Moscow	MOSCOW (Sputnik) - Russian Deputy Foreign Minister Sergey Vershinin discussed with Ambassador of the United Arab Emirates to Moscow Mohammed Ahmed Al Jaber the situation in the Middle East, as well as in North Africa, the Russian Foreign Ministry said in a statement.	https://sputnikglobe.com/20241130/russian-deputy-foreign-minister-uae-ambassador-discuss-middle-east-north-africa---moscow-1121046112.html	2024-11-29T20:36:27-08:00	
Russian Deputy Prime Visits Niger, Discusses Cooperation in Fuel, Energy Sector	MOSCOW (Sputnik) - Russian Deputy Prime Minister Alexander Novak visited Niger and discussed the opportunities of developing practical cooperation in energy, agriculture, infrastructure projects, geological exploration and development of mineral reserves, the cabinet said in a statement.	https://sputnikglobe.com/20241130/russian-deputy-prime-visits-niger-discusses-cooperation-in-fuel-energy-sector-1121045802.html	2024-11-29T20:32:50-08:00	
Treaty Ratification With North Korea Shows Interest in Allied Ties - Russian Defense Minister	PYONGYANG (Sputnik) - Ratification of the comprehensive strategic partnership treaty between Russia and North Korea confirms the two countries' interest in the comprehensive development of allied relations, Russian Defense Minister Andrey Belousov said.	https://sputnikglobe.com/20241130/treaty-ratification-with-north-korea-shows-interest-in-allied-ties---russian-defense-minister-1121045547.html	2024-11-29T20:28:28-08:00	
Dmytro Kuleba Says Biden Cannot Discuss Ukraine's NATO Membership, Nukes	MOSCOW, November 29 (Sputnik) - Former Ukrainian Foreign Minister Dmytro Kuleba has said that incumbent US President Joe Biden thinks in terms of the Cold War and therefore cannot discuss Ukraine's possible accession to NATO and the issue of nuclear weapons.	https://sputnikglobe.com/20241130/ukraines-kuleba-says-biden-cannot-discuss-kievs-nato-membership-nukes-1121045385.html	2024-11-29T17:32:00-08:00	
UK Intel Chief Admits MI6's Role in Covert Operations in Ukraine	MOSCOW, November 29 (Sputnik) - The UK Secret Intelligence Service (SIS), better known as MI6, has been leveraging its 'heritage of covert action' to assist Ukraine, Richard Moore, its chief, said on Friday.	https://sputnikglobe.com/20241130/uk-intel-chief-admits-mi6s-role-in-covert-operations-in-ukraine-1121045260.html	2024-11-29T16:04:00-08:00	
US Military Supplier Accuses Ukraine's Police and Ministry of Defense of Corruption	Sinclair & Wilde, which supplies military uniforms to Ukraine, has accused the country's National Police and Ministry of Defense of corruption and extortion over unpaid equipment. The company made the claim in an open letter posted by BGD Legal & Consulting, its official representative.	https://sputnikglobe.com/20241129/us-military-supplier-accuses-ukraines-police-and-ministry-of-defense-of-corruption--1121044516.html	2024-11-29T10:23:30-08:00	
Canadian Journalist Faces Persecution for Branding Nazis as Nazis, Denies Allegations	A journalist in Canada has been charged with vandalizing a war memorial in Edmonton, after allegedly spraying 'Nazi Monument 14th Waffen SS' on a monument that honors members of the 14th Waffen SS Division.	https://sputnikglobe.com/20241129/canadian-journalist-faces-persecution-for-branding-nazis-as-nazis-denies-allegations-1121044207.html	2024-11-29T09:31:18-08:00	
Young Scientists Discuss How to Transform Fundamental Research Into Cutting-Edge Technology	At the IV Congress of Young Scientists in Russia's Sirius, the National Center for Physics and Mathematics (NCPM) held a discussion on how to quickly and effectively transform fundamental knowledge into world-class technology, the NCPM press office reported.	https://sputnikglobe.com/20241129/young-scientists-discuss-how-to-transform-fundamental-research-into-cutting-edge-technology-1121044028.html	2024-11-29T08:54:00-08:00	
Nuclear Arms Race With Russia and China Will Come at Cost for US – Economist	Despite kicking off nuclear arms modernization, the US is still struggling to catch up with Russia and China, according to Dmitry Stefanovich of the Moscow-based Institute of World Economy and International Relations with the Russian Academy of Sciences.	https://sputnikglobe.com/20241129/nuclear-arms-race-with-russia-and-china-will-come-at-cost-for-us--economist--1121043834.html	2024-11-29T07:57:54-08:00	
