Title	Description	Link	pubDate	Image
Lukashenko Orders Deploying Oreshnik Missile Systems in Belarus - General Staff	MINSK (Sputnik) - President of Belarus Alexander Lukashenko has ordered the deployment of the medium-range Oreshnik missile systems in the republic and the competent planning of its use, Chief of the General Staff of Belarus and First Deputy Defense Minister Pavel Muraveiko said on Thursday.	https://sputnikglobe.com/20241212/lukashenko-orders-deploying-oreshnik-missile-systems-in-belarus---general-staff-1121153645.html	2024-12-12T03:26:23-08:00	
Meta Donates $1Mln to Trump’s Fund as Part of Effort to Mend Ties	MOSCOW (Sputnik) - Meta* has confirmed a $1 million donation to US President-elect Donald Trump’s inaugural fund, signaling a significant shift in CEO Mark Zuckerberg’s approach to the incoming administration, the Wall Street Journal reported on Thursday.	https://sputnikglobe.com/20241212/meta-donates-1mln-to-trumps-fund-as-part-of-effort-to-mend-ties-1121153111.html	2024-12-12T03:20:50-08:00	
Merkel Testing Public Opinion With Recent Praise of Russian Gas, German Politician Suggests	MOSCOW (Sputnik) - The head of the German Council for Constitution and Sovereignty, Ralph Niemeyer commented on national politics in the light of governmental crisis.	https://sputnikglobe.com/20241212/merkel-testing-public-opinion-with-recent-praise-of-russian-gas-german-politician-suggests-1121152916.html	2024-12-12T03:03:23-08:00	
Russian Army Liberates Zarya Settlement in Donetsk People’s Republic	Ministry of Defense reported on the progress of the special military operation and the key achievements of the Russian Armed Forces.	https://sputnikglobe.com/20241212/russian-army-liberates-zarya-settlement-in-donetsk-peoples-republic-1121152741.html	2024-12-12T01:58:58-08:00	
IDF to Control Buffer Zone on Syria Border Until Possible to Enforce Deal	MOSCOW (Sputnik) - The Israel Defense Forces (IDF) will temporarily control the buffer zone on the Syrian border, the office of Israeli Prime Minister Benjamin Netanyahu said on Thursday.	https://sputnikglobe.com/20241212/idf-to-control-buffer-zone-on-syria-border-until-possible-to-enforce-deal-1121152606.html	2024-12-12T01:36:23-08:00	
OPEC+ Oil Production in November Above Quotas by 680,000Bpd - IEA Report	International Energy Agency (IEA) prepared its regular outlook for global energy markets.	https://sputnikglobe.com/20241212/opec-oil-production-in-november-above-quotas-by-680000bpd---iea-report-1121152273.html	2024-12-12T01:23:33-08:00	
Fico Considers Attending Victory Day Celebration in Russia in 2025 'Personal Duty'	MOSCOW (Sputnik) - Slovak Prime Minister Robert Fico said on Thursday he considers it a 'personal duty' to visit Russia for Victory Day celebration in 2025.	https://sputnikglobe.com/20241212/fico-considers-attending-victory-day-celebration-in-russia-in-2025-personal-duty-1121152090.html	2024-12-11T23:28:18-08:00	
Majority of South Koreans Believe President Yoon Should Step Down - Poll	MOSCOW (Sputnik) - At least 74.8% of South Koreans said President Yoon Suk Yeol should resign or be impeached after his failed attempt to impose martial law in the country, the Yonhap news agency reported on Thursday, citing a Realmeter poll.	https://sputnikglobe.com/20241212/majority-of-south-koreans-believe-president-yoon-should-step-down---poll-1121151947.html	2024-12-11T21:12:21-08:00	
US Reconnaissance MQ-9 Reaper Drone Downed in Syria	MOSCOW (Sputnik) - A US Air Force MQ-9 Reaper reconnaissance drone was shot down in Syria earlier this week by the US-backed Syrian Democratic Forces (SDF), a US defense official has said.	https://sputnikglobe.com/20241212/us-reconnaissance-mq-9-reaper-drone-downed-in-syria-by-allied-forces--1121151782.html	2024-12-11T20:58:34-08:00	
Eight Killed in Israel Defense Forces Strikes on Palestinians Guarding Aid Trucks	MOSCOW (Sputnik) - Eight people were killed and 30 injured in two Israeli airstrikes on groups of Palestinians guarding trucks carrying humanitarian aid to the Gaza Strip, Reuters reported, citing medics.	https://sputnikglobe.com/20241212/eight-killed-in-israel-defense-forces-strikes-on-palestinians-guarding-aid-trucks-1121151656.html	2024-12-11T20:53:59-08:00	
French Farmers Dump Hay, Tires, Manure in Dijon Protesting EU-MERCOSUR Deal	MOSCOW (Sputnik) - French farmers have dumped tonnes of hay, tyres and manure in Dijon to protest against the recent EU-MERCOSUR free trade agreement and to once again delay government aid, France Bleu reported on Thursday.	https://sputnikglobe.com/20241212/french-farmers-dump-hay-tires-manure-in-dijon-protesting-eu-mercosur-deal-1121151513.html	2024-12-11T20:45:11-08:00	
Hamas May Agree on Deal That Allows Israel to Stay in Gaza After Ceasefire	MOSCOW (Sputnik) - The Palestinian movement Hamas has said for the first time since the outbreak of the Gaza war that it might agree to a ceasefire deal with Israel that would allow Israeli forces to stay temporarily in the enclave after the fighting stops, the Wall Street Journal reported on Thursday, citing Arab mediators.	https://sputnikglobe.com/20241212/hamas-may-agree-on-deal-that-allows-israel-to-stay-in-gaza-after-ceasefire-1121151292.html	2024-12-11T20:34:14-08:00	
South Korean President Calls Mutiny Accusations Unfounded	MOSCOW (Sputnik) - South Korean President Yoon Suk-yeol said on Thursday that he does not understand the reasons why he is accused of mutiny after imposing martial law in the country.	https://sputnikglobe.com/20241212/south-korean-president-calls-mutiny-accusations-unfounded-1121150933.html	2024-12-11T20:32:45-08:00	
What is the Strategic Importance of Deir ez-Zor and Could It Cause New Kurdish-Syrian Conflict?	Syrian militants have seized the city of Deir ez-Zor from US-backed Kurdish militants. Dr Lorenzo Trombetta, a UN Consultant on Middle East, explained the province’s significance.	https://sputnikglobe.com/20241211/what-is-the-strategic-importance-of-deir-ez-zor-and-could-it-cause-new-kurdish-syrian-conflict-1121150295.html	2024-12-11T11:11:32-08:00	
Neither THAAD Nor Any Other Existing Air Defense System Can Stop Oreshnik – Expert	Claims that the US-made THAAD can intercept the Russian Oreshnik missile is nothing but propaganda, Yuri Knutov, military expert and historian of the Air Defense Forces, told Sputnik.	https://sputnikglobe.com/20241211/neither-thaad-nor-any-other-existing-air-defense-system-can-stop-oreshnik--expert-1121150054.html	2024-12-11T10:29:19-08:00	
Ukraine's Attack With ATACMS Missiles on Russia's Taganrog Airfield Won't Go Unanswered - MoD	MOSCOW (Sputnik) - Russia has established that six ATACMS missiles were used during the attack of the armed forces of Ukraine on the Taganrog airfield, the Russian Defense Ministry said on Wednesday.	https://sputnikglobe.com/20241211/ukraines-attack-with-atacms-missiles-on-russias-taganrog-airfield-wont-go-unanswered---mod-1121149807.html	2024-12-11T07:22:56-08:00	
Seizure of Frozen Russian Assets: Is EU Setting a Legal Trap for Euroclear?	Valerie Urbain, CEO of Euroclear which holds $200 billion in frozen Russian Central Bank assets, told Bloomberg that if the European Union (EU) decides to confiscate the money, the financial services company should be exempt from any liabilities.	https://sputnikglobe.com/20241211/seizure-of-frozen-russian-assets-is-eu-setting-a-legal-trap-for-euroclear-1121149600.html	2024-12-11T06:51:33-08:00	
Putin Joins Plenary Session of Russia's AI Journey 2024 Conference	Russia's AI Journey event is an annual online conference that unites renowned international experts in artificial intelligence on a single platform.	https://sputnikglobe.com/20241211/putin-joins-plenary-session-of-russias-ai-journey-2024-conference--1121147414.html	2024-12-11T06:35:03-08:00	
US Trade Row With China Spills Over to Drones, Threatens More Fallout	After the US further tightened export controls on China involving semiconductor manufacturing equipment, storage chips and other items earlier this month, Beijing warned that it would retaliate, while also saying that neither side would benefit from waging a trade war.	https://sputnikglobe.com/20241211/us-trade-row-with-china-spills-over-to-drones-threatens-more-fallout----1121149040.html	2024-12-11T05:06:40-08:00	
Find Out The Potential of Nuclear Weapons Carriers in Belarus	On November 19, Russian President Vladimir Putin signed a decree that outlines Russia's revised nuclear doctrine.	https://sputnikglobe.com/20241211/find-out-the-potential-of-nuclear-weapons-carriers-in-belarus-1121143476.html	2024-12-11T04:13:44-08:00	
Russian Forces Liberate Daryino and Plekhovo Villages in Kursk Region	The Ukrainian armed forces have lost more than 200 soldiers in the Kursk direction in the past day, the Russian Defense Ministry said on Wednesday.	https://sputnikglobe.com/20241211/russian-forces-liberate-darino-and-plekhovo-villages-in-kursk-region-1121148735.html	2024-12-11T03:24:42-08:00	
Damascus Resident Says People Not in Panic, Majority Not Leaving City	MOSCOW (Sputnik) - The situation in Damascus is relatively calm absent evidence of panic, with a number of shops and cafes trowing their doors open as majority of people appeared to have decided to stay in the capital, city resident Hassan told Sputnik.	https://sputnikglobe.com/20241211/damascus-resident-says-people-not-in-panic-majority-not-leaving-city-1121148526.html	2024-12-11T02:33:29-08:00	
Lebanese Foreign Ministry Condemns Israel's Seizure of Syrian Part of Golan Heights	BEIRUT (Sputnik) - The Lebanese authorities denounce Israel's seizure of the demilitarized buffer zone in the Golan Heights and the adjacent Syrian territories, the Lebanese Foreign Ministry said on Wednesday.	https://sputnikglobe.com/20241211/lebanese-foreign-ministry-condemns-israels-seizure-of-syrian-part-of-golan-heights-1121148402.html	2024-12-11T02:31:34-08:00	
Putin, Orban Discuss Ukrainian Conflict During Phone Talks - Kremlin	MOSCOW (Sputnik) - Russian President Vladimir Putin and Hungarian Prime Minister Viktor Orban discussed Ukrainian conflict during a phone conversation, the Kremlin said on Wednesday.	https://sputnikglobe.com/20241211/putin-orban-discuss-ukrainian-conflict-during-phone-talks---kremlin-1121148283.html	2024-12-11T02:29:39-08:00	
Anyone Claiming Stopping Russian Gas Flows to EU Isn’t Self-Destructive is Fool - Slovak MP	Reducing energy dependence on Russia became one of the European Union's top priorities after the West unleashed its sanctions campaign against Moscow in 2022. The move has backfired on the continent, leaving Europe facing a crippling energy crisis, while Russia retained its position as the world's largest gas exporter in 2023.	https://sputnikglobe.com/20241211/anyone-claiming-stopping-russian-gas-flows-to-eu-isnt-self-destructive-is-fool---slovak-mp-1121146605.html	2024-12-11T02:15:31-08:00	
Russian Foreign Ministry Condemns Ukraine's Attack on IAEA Car Heading to Zaporozhye Nuclear Plant	MOSCOW (Sputnik) - Russia condemns a drone attack by Ukraine on a vehicle carrying International Atomic Energy Agency (IAEA) staff heading to the Zaporozhye Nuclear Power Plant for a personnel rotation, Russian Foreign Ministry spokeswoman Maria Zakharova said on Wednesday.	https://sputnikglobe.com/20241211/russian-foreign-ministry-condemns-ukraines-attack-on-iaea-car-heading-to-zaporozhye-nuclear-plant-1121147069.html	2024-12-11T00:47:23-08:00	
Eurasian Economic Union, UAE Complete Talks on Economic Partnership	MOSCOW (Sputnik) - Eurasian Economic Commission Trade Minister Andrey Slepnev and UAE Foreign Trade Minister Thani bin Ahmed Al Zeyoudi have concluded negotiations on an economic partnership agreement, the commission announced on Wednesday.	https://sputnikglobe.com/20241211/eurasian-economic-union-uae-complete-talks-on-economic-partnership-1121146767.html	2024-12-10T23:57:40-08:00	
Russian Scientists Discover How Appetite Hormone Regulates Biological Clock	The influence of the hunger-stimulating hormone on the internal biological clock of mammals has been found by specialists of Samara University.	https://sputnikglobe.com/20241211/russian-scientists-discover-how-appetite-hormone-regulates-biological-clock-1121144501.html	2024-12-10T23:01:00-08:00	
Israeli Delegation Arrives in Cairo to Discuss Gaza Ceasefire Deal - Egyptian Gov’t	CAIRO (Sputnik) - A senior Israeli delegation has arrived in Cairo to discuss the Gaza ceasefire agreement, as well as the delivery of humanitarian aid to the enclave, the Egyptian State Information Service said.	https://sputnikglobe.com/20241211/israeli-delegation-arrives-in-cairo-to-discuss-gaza-ceasefire-deal---egyptian-govt-1121146335.html	2024-12-10T21:30:48-08:00	
NATO Transfers Large Amounts of Armed Vehicles to Poland - Underground	MOSCOW (Sputnik) - NATO is transferring large amounts of armed vehicles from European countries to Poland, the coordinator of the pro-Russian underground network in Nikolayev, Sergey Lebedev, told Sputnik on Wednesday.	https://sputnikglobe.com/20241211/nato-transfers-large-amounts-of-armed-vehicles-to-poland---underground-1121146212.html	2024-12-10T21:28:34-08:00	
US Imports of Chinese Vehicles Hit All-Time of $2.9Bln High in January-October	MOSCOW (Sputnik) - The export of passenger cars from China to the US has risen to an all-time high of $2.9 billion in the first 10 months of 2024, according to Sputnik calculations of US statistics.	https://sputnikglobe.com/20241211/us-imports-of-chinese-vehicles-hit-all-time-of-29bln-high-in-january-october-1121146076.html	2024-12-10T21:24:20-08:00	
South Korean Police Conduct Searches in Presidential Office, Police HQs	MOSCOW (Sputnik) - South Korean police have raided the office of President Yoon Suk-yeol, as well as police departments, as part of an investigation into Yoon’s failed attempt to impose martial law, the Yonhap news agency reported on Wednesday.	https://sputnikglobe.com/20241211/south-korean-police-conduct-searches-in-presidential-office-police-hqs-1121145916.html	2024-12-10T21:21:10-08:00	
US Repels Houthi Attacks on Its Ships in Gulf of Aden	MOSCOW (Sputnik) - The US Navy shot down drones and a missile fired at US merchant ships in the Gulf of Aden by Yemen's Ansar Allah movement, also known as the Houthis, the US Central Command (CENTCOM) said on Wednesday.	https://sputnikglobe.com/20241211/us-repels-houthi-attacks-on-its-ships-in-gulf-of-aden-1121145785.html	2024-12-10T21:16:40-08:00	
West Uses Transition in Syria as 'Smoke Screen' to Establish Presence - Ex-UK Ambassador	MOSCOW, December 11 (Sputnik) - The so-called transition period in Syria is a pretext for Western countries that need time to establish working relations with the country's new authorities, ex-UK Ambassador to Syria and Middle East expert Peter Ford has told Sputnik.	https://sputnikglobe.com/20241211/west-uses-transition-in-syria-as-smoke-screen-to-establish-presence---ex-uk-ambassador-1121145447.html	2024-12-10T17:31:00-08:00	
Biden Says Project 2025 Would be 'Disaster' for US, Region	WASHINGTON, December 10 (Sputnik) – US President Joe Biden on Tuesday warned his successor Donald Trump to not embrace Project 2025, even though the president-elect has denied on multiple occasions any connection to the concept.	https://sputnikglobe.com/20241210/biden-says-project-2025-would-be-disaster-for-us-region-1121145300.html	2024-12-10T12:21:00-08:00	
Acting Syrian Prime Minister Says Interim Government Formed, Will Operate Until Early 2025	BEIRUT, December 10 (Sputnik) - Caretaker Syrian Prime Minister Mohammed al-Bashir said on Tuesday that the country's interim government is formed and will operate until March 2025.	https://sputnikglobe.com/20241210/acting-syrian-prime-minister-says-interim-government-formed-will-operate-until-early-2025-1121145595.html	2024-12-10T12:12:00-08:00	
Israel Incursion in Syria Not a Protective Move, But Full-Blown Offensive – Middle East Expert	Having seized the Golan Heights, the Israel Defense Forces (IDF) currently occupy Quneitra province, 16 kilometers deep into Syrian territory. International watchdogs say the IDF has launched around 300 airstrikes across Syria so far.	https://sputnikglobe.com/20241210/israel-incursion-in-syria-not-a-protective-move-but-full-blown-offensive--middle-east-expert-1121145022.html	2024-12-10T11:08:29-08:00	
Yemeni Houthis Carry Out Attacks on 2 US Destroyers, Supply Ships in Gulf of Aden	DOHA (Sputnik) - Yemen's Ansar Allah movement, also known as the Houthis, said on Tuesday that it carried out rocket and drone attacks on US destroyers and supply ships in the Gulf of Aden.	https://sputnikglobe.com/20241210/yemeni-houthis-carry-out-attacks-on-2-us-destroyers-supply-ships-in-gulf-of-aden-1121144854.html	2024-12-10T09:40:29-08:00	
Australia Inks Nauru Deal Amid Battle For Clout With China in Pacific	The Government of the Republic of Nauru announced in January that it was severing diplomatic relations with Taiwan and moving to the One-China Principle, seeking to resume full diplomatic relations with China.	https://sputnikglobe.com/20241210/australia-inks-nauru-deal-amid-battle-for-clout-with-china-in-pacific--1121143175.html	2024-12-10T06:59:32-08:00	
French Jets Leave Chad After Demands of Withdrawal of French Military Contingent - Reports	MOSCOW (Sputnik) - Two French fighter jets left Chad on Tuesday after the African country demanded the withdrawal of the French military contingent, media reported, citing a source in the French armed forces.	https://sputnikglobe.com/20241210/french-jets-leave-chad-after-demands-of-withdrawal-of-french-military-contingent---reports-1121142835.html	2024-12-10T05:00:01-08:00	
What to Know About Israeli PM Netanyahu’s Corruption Trial	Benjamin Netanyahu takes the witness stand for the first time in his ongoing corruption trial on Tuesday. Ahead of the testimony, Israel’s first serving Prime Minister on trial insisted that he was eager to 'present the truth and finally explode the delusional unfounded accusations, the brutal witch hunt.'	https://sputnikglobe.com/20241210/what-to-know-about-israeli-pm-netanyahus-corruption-trial-----1121141891.html	2024-12-10T04:51:56-08:00	
US Military Grounds V-22 Osprey Fleet Amid Safety Concerns	Earlier, two US senators and one House member called for a halt to the use of all Bell Boeing V-22 Osprey aircraft due to safety concerns.	https://sputnikglobe.com/20241210/us-military-grounds-v-22-osprey-fleet-amid-safety-concerns-1121140837.html	2024-12-10T04:35:06-08:00	
Muhammad al-Bashir Authorized to Form Interim Government in Syria	Mohammed al-Bashir, the head of the so-called 'salvation government,' said on Tuesday that the Syrian opposition had authorized him to form an interim government in the country.	https://sputnikglobe.com/20241210/mohamad-bashir-says-authorized-to-form-interim-government-in-syria-1121142306.html	2024-12-10T04:24:08-08:00	
Why Has Fentanyl Become Tool For US to Shift Blame?	The Global Times provided a detailed analysis of the origins and developments of the fentanyl crisis in the US in yesterday's in-depth report, highlighting the role of the American pharmaceutical industry and the negligence of government regulatory agencies.	https://sputnikglobe.com/20241210/why-has-fentanyl-become-tool-for-us-to-shift-blame-1121141428.html	2024-12-10T03:11:23-08:00	
Polish Defense Minister Refutes Possible NATO Troops Deployment in Ukraine as Speculations	MOSCOW (Sputnik) - Polish Defense Minister Wladyslaw Kosiniak-Kamysz on Tuesday dismissed statements about the potential deployment of NATO troops to Ukraine, calling such statements 'speculations.'	https://sputnikglobe.com/20241210/polish-defense-minister-refutes-possible-nato-troops-deployment-in-ukraine-as-speculations-1121141270.html	2024-12-10T02:58:44-08:00	
Syrian Crisis: Keeping You Updated	Syrian armed groups captured the national capital of Damascus on Sunday. While Prime Minister Mohammad Ghazi al-Jalali said that he and 18 other ministers had decided to remain in Damascus, Syrian President Bashar Assad stepped down and left the country after negotiations with some participants of the conflict, said the Russian Foreign Ministry.	https://sputnikglobe.com/20241210/syrian-crisis-keeping-you-updated-1121140231.html	2024-12-10T02:40:15-08:00	
Russian Forces Liberate Zheltoye Settlement in Donetsk Region	Units of the Russian Battlegroup Tsentr have liberated the settlement of Zheltoye in the Donetsk People's Republic, the Russian Defense Ministry has reported.	https://sputnikglobe.com/20241210/russian-forces-liberate-zheltoye-settlement-in-donetsk-region-1121140969.html	2024-12-10T02:12:13-08:00	
West’s Escalation Attempts May Lead to Its Strategic Defeat – Russian Intelligence Chief	MOSCOW (Sputnik) - The West's attempts at escalation will not lead to Russia's exhaustion, as they expect, but will result in the near strategic defeat of the West itself, Director of the Russian Foreign Intelligence Service Sergei Naryshkin said on Tuesday.	https://sputnikglobe.com/20241210/wests-escalation-attempts-may-lead-to-its-strategic-defeat--russian-intelligence-chief-1121140648.html	2024-12-10T01:06:20-08:00	
Canada ‘Will Respond’ If Trump Slaps Tariffs on Canadian Goods – Reports	MOSCOW (Sputnik) - Canada will respond if US President-elect Donald Trump imposes 'unfair' tariffs on Canadian goods, US media reported on Tuesday, citing Canadian Prime Minister Justin Trudeau.	https://sputnikglobe.com/20241210/canada-will-respond-if-trump-slaps-tariffs-on-canadian-goods--reports-1121140519.html	2024-12-10T01:01:03-08:00	
Ukraine Repeatedly Refused to Take Ordinary Soldiers From Captivity	MOSCOW (Sputnik) - Ukraine has repeatedly refused to take its ordinary soldiers from captivity, Kiev is interested in other military personnel – officers, members of the ultranationalist Azov battalion*, Russian Human Rights Commissioner Tatyana Moskalkova told Sputnik.	https://sputnikglobe.com/20241210/ukraine-repeatedly-refused-to-take-ordinary-soldiers-from-captivity-1121140101.html	2024-12-09T23:40:11-08:00	
South Korean Prime Minister Calls for Stabilization in Country	SEOUL (Sputnik) - South Korean Prime Minister Han Duck-soo on Tuesday called on political leaders and civil society to make efforts to stabilize the country and unite the nation after the failed attempt to impose martial law.	https://sputnikglobe.com/20241210/south-korean-prime-minister-calls-for-stabilization-in-country-1121139774.html	2024-12-09T23:36:43-08:00	
Israeli Air Force Attacks Over 250 Military Targets in Syria Over Past 2 Days	TEL AVIV (Sputnik) - The Israeli air force has attacked more than 250 military targets in Syria since the change of power in the country, including military bases, dozens of fighter jets and helicopters, anti-aircraft missile systems and warehouses with missiles and other weapons, Israeli Army Radio reported, citing a source.	https://sputnikglobe.com/20241210/israeli-air-force-attacks-over-250-military-targets-in-syria-over-past-2-days-1121139252.html	2024-12-09T21:03:46-08:00	
Russia Does Not Understand What Part of Golan Heights Israel Considers Its Own - Nebenzia	UNITED NATIONS (Sputnik) - Russia is recording contradictory statements from Israel regarding the status of the Golan Heights and does not understand what part of this territory Israel considers its integral part, Russian Ambassador to the United Nations Vassily Nebenzia said.	https://sputnikglobe.com/20241210/russia-does-not-understand-what-part-of-golan-heights-israel-considers-its-own---nebenzia-1121139098.html	2024-12-09T21:00:17-08:00	
Orban Says Spent Day at Mar-a-Lago With Trump, Musk, Waltz	BUDAPEST (Sputnik) - Hungarian Prime Minister Viktor Orban said he had spent the day with US President-elect Donald Trump at his Mar-a-Lago estate, with future US National Security Advisor Mike Waltz and entrepreneur Elon Musk also present.	https://sputnikglobe.com/20241210/orban-says-spent-day-at-mar-a-lago-with-trump-musk-waltz-1121138962.html	2024-12-09T20:54:00-08:00	
China-Russia Trade Up 2.1% Y/Y to $222.8Bln in January-November	BEIJING (Sputnik) - Trade between China and Russia increased by 2.1% year-on-year to $222.774 billion in the first eleven months of 2024, according to data released on Tuesday by China's customs.	https://sputnikglobe.com/20241210/china-russia-trade-up-21-yy-to-2228bln-in-january-november-1121138813.html	2024-12-09T20:51:01-08:00	
Media Mogul Murdoch Loses Bid to Amend Family Trust - Reports	WASHINGTON, December 10 (Sputnik) - Conservative media mogul Rupert Murdoch has suffered his first defeat in his bid to strip his more liberal children of voting rights in order to consolidate control of his media empire with his eldest son Lachlan, who shares his views, the New York Times reported, citing a sealed court document.	https://sputnikglobe.com/20241210/media-mogul-murdoch-loses-bid-to-amend-family-trust---reports-1121138333.html	2024-12-09T19:34:00-08:00	
US Supplies Over 800 Patriot Interceptor Missiles Worth $3.26Bln to Ukraine Since 2022	The United States has supplied Ukraine with 847 advanced Patriot missiles worth $3.26 billion, following an initial $1.85 billion aid package in December 2022, according to an analysis of US Department of Defense budget reports by a Sputnik correspondent.	https://sputnikglobe.com/20241210/us-supplies-over-800-patriot-interceptor-missiles-worth-326bln-to-ukraine-since-2022-1121138487.html	2024-12-09T19:13:00-08:00	
Tehran Calls on UN Security Council to Respond to Israeli Invasion of Syria - Statement	TEHRAN, December 9 (Sputnik) - Iranian Foreign Ministry spokesman Esmail Baghaei condemned Israeli military invasion of Syria and called on the UN Security Council to react by holding Tel Aviv accountable, the Iranian Foreign Ministry said on Monday.	https://sputnikglobe.com/20241209/tehran-calls-on-un-security-council-to-respond-to-israeli-invasion-of-syria---statement-1121137954.html	2024-12-09T12:35:56-08:00	
