Title	Description	Link	pubDate	Image
Israel's Enemy in Yemen Proves Hard for U.S. to Deter	The Iranian-backed rebels have kept up a steady drumbeat of attacks in the Red Sea on commercial shipping despite a U.S. campaign to stop them.	https://www.wsj.com/articles/israels-enemy-in-yemen-proves-hard-for-u-s-to-deter-33cad2f3	2024-12-23T06:12:00-08:00	
Satellite Images Show North Korea Boosting Arms Flow to Russia	North Korea and Russia are deepening their military cooperation, as Pyongyang ramps up the supply of arms to Moscow for its war in Ukraine and receives much needed cash and oil from the Kremlin in return.	https://www.wsj.com/articles/russia-north-korea-weapons-shipment-676d7f52	2024-12-22T20:00:00-08:00	
Xi Digs In With Top-Down Economic Plan Even as China Drowns in Debt	As Beijing braces for a new showdown over trade, Xi Jinping is digging in on economic policies aimed at making China the world’s most powerful country.	https://www.wsj.com/articles/china-xi-debt-economic-plan-13aaeec1	2024-12-22T20:00:00-08:00	
Trump Threatens to Take Control of Panama Canal	In an angry rebuke, Panamanian President José Raúl Mulino says 'every square meter' of the waterway belongs to Panamanians.	https://www.wsj.com/articles/trump-threatens-to-take-control-of-panama-canal-staple-of-global-economy-fdb3ef37	2024-12-22T16:30:00-08:00	
A Visual Guide to Syria's Long Struggle for Freedom	The Middle Eastern country had been ruled by outside powers and dictators for centuries before its revolution was realized.	https://www.wsj.com/articles/a-visual-guide-to-syrias-long-struggle-for-freedom-bfd151ba	2024-12-22T07:00:00-08:00	
U.S. Navy Shoots Down Own Plane as Fresh Strikes Target Houthi Rebels in Yemen	Two U.S. Navy pilots ejected from their jet fighter over the Red Sea after it was caught in 'an apparent case of friendly-fire,' U.S. Central Command said.	https://www.wsj.com/articles/u-s-navy-shoots-down-own-plane-as-fresh-strikes-target-houthi-rebels-in-yemen-7b6a4d27	2024-12-22T00:56:00-08:00	
Ukraine Bets a Free Market for Weapons Production Can Out-Innovate Russia	While Russia is mass-producing machinery at state-owned industries, Ukraine has spawned hundreds of entrepreneur-led defense startups by slashing regulation and cutting taxes.	https://www.wsj.com/articles/ukraine-russia-weapons-manufacturing-ddbe8fdf	2024-12-21T20:00:00-08:00	
The Safaris and Carbon-Credit Projects Threatening the Serengeti's Maasai	Tanzania’s government is evicting tens of thousands of traditional herders from breathtaking natural habitats.	https://www.wsj.com/articles/the-safaris-and-carbon-credit-projects-threatening-the-serengetis-maasai-fed62644	2024-12-21T20:00:00-08:00	
Rickey Henderson, Baseball's All-Time Stolen Base Leader, Dies at Age 65	The Hall-of-Fame outfielder stole 1,406 bases in his 25-year major league career and was one of the most colorful characters ever to play the game.	https://www.wsj.com/articles/rickey-henderson-stolen-base-leader-dies-at-age-65-734d7e8a	2024-12-21T15:19:00-08:00	
Suspect in Christmas Market Ramming Had One Main Enemy: Islam	The 50-year-old psychiatrist is a well-known anti-Islam activist who seems to have felt increasingly persecuted by Germany.	https://www.wsj.com/articles/suspect-in-christmas-market-ramming-had-one-main-enemy-islam-6363d708	2024-12-21T02:18:00-08:00	
Russia Taps Soviet-Era Stockpiles as Armored-Vehicle Supply Dwindles	Moscow has stepped up efforts to refurbish old equipment, including Soviet-era tanks used as props in films, after losing an estimated 11,000 armored combat vehicles in the Ukraine war.	https://www.wsj.com/articles/russia-taps-soviet-era-stockpiles-as-armored-vehicle-supply-dwindles-6f8f8df2	2024-12-20T20:00:00-08:00	
The West Auditions Syria's New Leaders	Senior U.S. diplomats visit Damascus, as Washington and Brussels weigh lifting sanctions against the country’s transitional government.	https://www.wsj.com/articles/the-west-auditions-syrias-new-leaders-4df503ca	2024-12-20T20:00:00-08:00	
The Global Hunt for Putin's 'Sleeper Agents'	A quiet suburban mom, a hard-drinking war correspondent and an Arctic researcher were hiding in plain sight, championed by the Kremlin’s No. 1 fan of spy fiction.	https://www.wsj.com/articles/sleeper-agents-putin-global-hunt-a7978f84	2024-12-20T18:00:00-08:00	
Currency Tailspin Forces Brazil's Leader to Do the Unthinkable: Cut Spending	Brazil’s currency plunges to lowest level in 30 years after breakneck spending on pensions and social services.	https://www.wsj.com/articles/currency-tailspin-forces-brazils-leader-to-do-the-unthinkable-cut-spending-05a10d9a	2024-12-20T12:52:00-08:00	
Eight People Convicted in Trial for Beheading of French Teacher	Samuel Paty was killed in 2020 in a Paris suburb after showing caricatures of Islam’s Prophet Muhammad in class as part of a lesson on free speech.	https://www.wsj.com/articles/eight-people-convicted-in-trial-for-beheading-of-french-teacher-6674e546	2024-12-20T12:12:00-08:00	
Several Wounded After Car Rams German Christmas Market	The incident was being treated as an attack, according to officials. The suspected driver of the vehicle was detained.	https://www.wsj.com/articles/several-wounded-after-car-rams-german-christmas-market-06678562	2024-12-20T12:11:00-08:00	
Canada's NDP Commits to Help Bring Down Trudeau-Led Minority Government	Canada’s New Democratic Party issued its declaration moments before Prime Minister Trudeau was set to reveal a revamped cabinet.	https://www.wsj.com/articles/canadas-ndp-commits-to-help-bring-down-trudeau-led-minority-government-a0fc6260	2024-12-20T09:20:00-08:00	
Brevity of Some Pelicot Rape Trial Sentences Is French-Style Justice	Legal systems in Europe are often geared toward rehabilitation than punishment, but the length of some of the sentences in the trial surprised many.	https://www.wsj.com/articles/brevity-of-some-pelicot-rape-trial-sentences-is-french-style-justice-01d8e0ac	2024-12-20T07:24:00-08:00	
Elon Musk Shook Up U.S. Politics. Will the U.K. Be Next?	Musk has already helped propel Donald Trump into the White House. Now he might have his sights on another iconic address: 10 Downing Street.	https://www.wsj.com/articles/elon-musk-shook-up-u-s-politics-will-the-u-k-be-next-e14f5524	2024-12-20T06:45:00-08:00	
The Search for Missing Flight MH370 Is Back On	Malaysia plans to authorize a private robotics company to renew its search for the plane that vanished a decade ago.	https://www.wsj.com/articles/the-search-for-missing-flight-mh370-is-back-on-aa83bf51	2024-12-20T03:44:00-08:00	
China Tells Chief Economists: Be Positive, or Else	Experts at leading brokerages say they are hewing closer to the official government line in response to signs of tighter monitoring.	https://www.wsj.com/articles/china-tells-chief-economists-be-positive-or-else-fbb4dcce	2024-12-20T03:31:00-08:00	
Taiwan Is Getting Its U.S. Weaponry---but Years Behind Schedule	The five-year wait for the arrival of 38 Abrams tanks to Taiwan highlights the strains on U.S. industrial capacity as concerns grow over China.	https://www.wsj.com/articles/taiwan-is-getting-its-u-s-weaponrybut-years-behind-schedule-11c151b1	2024-12-19T20:00:00-08:00	
Israel vs. Turkey: The Intensifying Middle-East Power Struggle	Turkey and Israel are the main strategic beneficiaries of the collapse of the Syrian regime, but now they are on a collision course of their own.	https://www.wsj.com/articles/syria-us-ally-tension-israel-turkey-a8706228	2024-12-19T20:00:00-08:00	
Canada's Trudeau Preparing Cabinet Shuffle	Canadian Prime Minister Justin Trudeau is expected to unveil a revamped cabinet Friday, according to a person familiar with the matter.	https://www.wsj.com/articles/canadas-trudeau-set-to-unveil-revamped-cabinet-friday-000514e2	2024-12-19T14:36:00-08:00	
Israel's Expanded Perch on Syrian Border Puts Damascus in Its Sights	Israel’s military has seized a strategic mountain top in its contested border area with Syria and advanced on positions beyond it, reshaping the frontier potentially for the long term.	https://www.wsj.com/articles/israels-expanded-perch-on-syrian-border-puts-damascus-in-its-sights-bed2d218	2024-12-19T08:48:00-08:00	
China Lets European Investigators Board Ship Suspected of Sabotage After Weeks of Secret Talks	Beijing agrees to allow European police to question the crew of the Yi Peng 3, but only if Chinese officials are present.	https://www.wsj.com/articles/china-lets-european-investigators-board-ship-suspected-of-sabotage-after-weeks-of-secret-talks-e68a2b75	2024-12-19T04:47:00-08:00	
Putin Signals No Rush to End Ukraine War in Marathon TV Appearance	The Russian president appeared in no hurry to seek an end to the war despite President-elect Donald Trump’s vow to secure a speedy resolution.	https://www.wsj.com/articles/russia-putin-annual-press-conference-2024-9c6ffda3	2024-12-19T03:37:00-08:00	
Dominique Pelicot Jailed for 20 Years Over Rape of His Wife	A French court convicted the former husband of Gisele Pelicot and dozens of other men of raping her after he drugged her unconscious.	https://www.wsj.com/articles/gisele-pelicot-rape-trial-verdict-france-b32e22e9	2024-12-19T01:30:00-08:00	
A Tiny Arab Minority Stands Between Israel and Syria	The Arabic-speaking Druze community straddles the border between two countries—and like Israel fears Islamists.	https://www.wsj.com/articles/israel-syria-border-golan-heights-druze-0aa2f629	2024-12-18T20:00:00-08:00	
Unable to Criticize Putin, Russian Oligarchs Turn Ire on Central Banker	Russia’s business elites have found a scapegoat for the country’s economic woes: the central bank.	https://www.wsj.com/articles/unable-to-criticize-putin-russian-oligarchs-turn-ire-on-central-banker-1888bd64	2024-12-18T20:00:00-08:00	
El Salvador Made Bitcoin an Official Currency. Now It's Backtracking for IMF Loan	The agency is showing flexibility by allowing the bitcoin program to proceed in a limited way.	https://www.wsj.com/articles/el-salvador-made-bitcoin-an-official-currency-now-its-backtracking-for-imf-loan-874c6623	2024-12-18T15:45:00-08:00	
Russia Moves Air-Defense Systems, Other Advanced Weaponry From Syria to Libya, U.S.	Moscow has operated important naval and air bases in Syria in exchange for the support it provided to prop up Bashar al-Assad, the Syrian dictator who was ousted last week.	https://www.wsj.com/articles/russia-air-defense-bases-syria-libya-25810db0	2024-12-18T08:17:00-08:00	
The Troubled, Violent Lives of the Men Accused of Raping Gisèle Pelicot	Some dubbed those on trial as 'Mr. Everyman,' but more complicated portraits have emerged during the trial.	https://www.wsj.com/articles/gisele-pelicot-trial-france-men-accused-48c600b2	2024-12-18T05:21:00-08:00	
Killing of Top General Is a Message From Ukraine: You Aren't Safe---Even at Home	The attack on Lt. Gen. Igor Kirillov was part of an escalating campaign by Ukraine’s security and intelligence services to kill high-profile figures in Russia’s war effort.	https://www.wsj.com/articles/ukraine-russia-war-targeted-assassinations-kills-eca4c50f	2024-12-18T03:32:00-08:00	
Milei Says Trump Backs Argentina's Free-Market Makeover	Javier Milei is coming off a strong first year in office after implementing painful spending cuts to bring down the world’s highest inflation rate.	https://www.wsj.com/articles/milei-says-trump-backs-argentinas-free-market-makeover-81137111	2024-12-18T02:30:00-08:00	
Bangladesh's New Dawn Is Darkened by Settling of Old Scores	When the prime minister was toppled in August in a student-led uprising, it was supposed to be a fresh start for the young country. Instead, the wounds left by her rule have prompted revenge.	https://www.wsj.com/articles/bangladesh-uprising-new-leadership-struggles-d271857e	2024-12-17T20:00:00-08:00	
Canada Reveals Border-Security Plan to Avert Trump's Tariff Pledge	Officials are expected to spend up to $900 million on drones, helicopters, and new agents.	https://www.wsj.com/articles/canada-reveals-border-security-plan-to-avert-trumps-tariff-pledge-f9883f7c	2024-12-17T14:54:00-08:00	
Israel Pushes Case to Control Security in Syrian Buffer Zone, Gaza	Defense Minister Katz joins Prime Minister Netanyahu on a trip to the strategic Mt. Hermon peak in Syria.	https://www.wsj.com/articles/israel-syria-gaza-security-control-04f19b89	2024-12-17T11:15:00-08:00	
Ukraine Says It Killed Senior Russian General in Moscow Bombing	Lt. Gen. Igor Kirillov, the head of the Russian Armed Forces’ Radiological, Chemical and Biological Defence Troops, was suspected by Ukraine of ordering the use of banned chemical weapons.	https://www.wsj.com/articles/ukraine-says-it-killed-senior-russian-general-in-moscow-bombing-9e315b29	2024-12-17T00:36:00-08:00	
Indonesia Plans to Pitch Data-Center Opportunities to Elon Musk	The chairman of Indonesia’s National Economic Council said he would continue pitching business opportunities in the coming months, including the possibility of building data centers for xAI.	https://www.wsj.com/articles/indonesia-plans-to-pitch-data-center-opportunities-to-elon-musk-bae252c2	2024-12-16T22:32:00-08:00	
U.S. Fears Military Buildup by Turkey Signals Preparations for Incursion Into Syria	Kurdish officials are urging Donald Trump to press Ankara to head off an invasion.	https://www.wsj.com/articles/u-s-fears-military-buildup-by-turkey-signals-preparations-for-incursion-into-syria-1c2e88e9	2024-12-16T19:42:00-08:00	
Assad's Fall Upends the Middle East's Largest Drug Empire	The regime’s trade in captagon, a methamphetamine-like drug, helped sustain its rule and fueled war and addiction across the region.	https://www.wsj.com/articles/syria-assad-captagon-drug-trade-a8b30615	2024-12-16T18:00:00-08:00	
Syria's Aspiring Leader Promises Reform---in Due Time	Rebel leader Abu Mohammed al-Jawlani positioned himself as a statesman who can unite Syria, in a meeting with foreign journalists in Damascus.	https://www.wsj.com/articles/syria-rebel-leader-abu-mohammed-al-jawlani-interview-9901b0f9	2024-12-16T11:15:00-08:00	
Russian Tanker Wrecks Spilling Oil Into the Black Sea		https://www.wsj.com/articles/russian-tanker-wrecks-spilling-oil-into-the-black-sea-2638b24a	2024-12-16T11:12:00-08:00	
U.K. Seeks to Entice Australia, European Allies into Fighter-Jet Program	Italy and Japan have already partnered on the project, called the Global Combat Air Programme, which aims to put a new stealth fighter with supersonic capability in the skies by 2035.	https://www.wsj.com/articles/u-k-seeks-to-entice-australia-european-allies-into-fighter-jet-program-eb0d826a	2024-12-16T08:24:00-08:00	
Germany Heads Toward Early Elections After Scholz Loses Confidence Vote	Embattled German Chancellor Olaf Scholz lost a confidence vote, the first step in a sequence of events that will lead to early elections next year	https://www.wsj.com/articles/germany-heads-toward-early-elections-after-scholz-loses-confidence-vote-093b3196	2024-12-16T08:05:00-08:00	
Canada's Finance Minister Chrystia Freeland Resigns From Cabinet	Canada’s Finance Minister Chrystia Freeland said she was quitting the Liberal government cabinet, citing conflict with Prime Minister Justin Trudeau over the direction of fiscal policy.	https://www.wsj.com/articles/canadas-finance-minister-chrystia-freeland-resigns-from-cabinet-c549f77f	2024-12-16T07:09:00-08:00	
Syria's Assad Says He Fought to the End	In his first comments from exile in Moscow, the deposed dictator pushes back against criticism that he abandoned supporters.	https://www.wsj.com/articles/syria-assad-statement-civil-war-e2b29fb5	2024-12-16T07:00:00-08:00	
China Races to Squelch Unrest as Signs of Economic Malaise Spread	Knife attacks and car rammings have officials unnerved about widespread societal discontent.	https://www.wsj.com/articles/china-races-to-squelch-unrest-as-signs-of-economic-malaise-spread-a2b10065	2024-12-15T20:00:00-08:00	
Vietnam Won Big in Donald Trump's First Trade War. Now, It's a Target.	The incoming administration has signaled that a backdoor that lets manufacturers avoid China tariffs could slam shut.	https://www.wsj.com/articles/vietnam-trump-trade-war-target-4182a943	2024-12-15T20:00:00-08:00	
Syria's Christians Prepare for Holiday With Hope---and Fear	Islamist rebels now in control in Damascus have pledged full rights and equality to religious and ethnic minorities. Many Christians say time will tell.	https://www.wsj.com/articles/syrias-christians-prepare-for-holiday-with-hopeand-fear-6f4ce9cf	2024-12-15T20:00:00-08:00	
South Korea's Martial-Law Debacle Is Rooted in Cold-War History	Decades of ruthless politics fueled by pre-democracy divisions help to explain Yoon Suk Yeol’s disastrous decision to enact military control.	https://www.wsj.com/articles/south-koreas-martial-law-debacle-is-rooted-in-cold-war-history-a91f9eca	2024-12-15T03:49:00-08:00	
Hezbollah Chief Says Assad's Fall Severed Key Supply Line From Iran	The loss of the route through Syria is a blow to the Lebanese militia and its most important ally, Tehran.	https://www.wsj.com/articles/hezbollah-chief-says-assads-fall-severed-key-supply-line-from-iran-a723aed5	2024-12-15T02:34:00-08:00	
The Hunt for the Assad Dynasty's Missing Billions Begins	The family stashed away its wealth over half a century of despotic rule. Human-rights lawyers are leading efforts to find the assets—and recover them for the Syrian people.	https://www.wsj.com/articles/the-hunt-for-the-assad-dynastys-missing-billions-begins-715e7052	2024-12-14T20:00:00-08:00	
Brush With Russia in Baltic Points to New Flashpoint in NATO-Moscow Shadow War	Sabotage, warning shots, disruption of air traffic and dangerous military maneuvering are all part of the intensifying clandestine campaign in Europe, officials say.	https://www.wsj.com/articles/brush-with-russia-in-baltic-points-to-new-flashpoint-in-nato-moscow-shadow-war-08b5b182	2024-12-14T20:00:00-08:00	
India's Novel Attempts at Battling Deadly Air Pollution Are Falling Short	Residents see antismog guns and drones as 'Band-Aid' solutions for a serious air-pollution problem.	https://www.wsj.com/articles/india-air-pollution-short-term-solutions-5815e58d	2024-12-14T20:00:00-08:00	
Washington in Direct Talks With the Former Al-Qaeda Faction That Toppled Assad	U.S., allies are pressing for a swift transition in Syria to avert a descent into chaos.	https://www.wsj.com/articles/washington-in-direct-talks-with-the-former-al-qaeda-faction-that-toppled-assad-ddba4a61	2024-12-14T09:00:00-08:00	
Venezuela Never Had So Many Political Prisoners. 21 of Them Are Teens.	The adolescents are among the estimated 2,200 people the regime said it arrested in July during protests over the country’s disputed presidential election.	https://www.wsj.com/articles/venezuela-never-had-so-many-political-prisoners-21-of-them-are-teens-19675ab7	2024-12-14T05:00:00-08:00	
South Korea Impeaches President Yoon Suk Yeol Over Martial-Law Decision	The prime minister is set to assume presidential powers on an interim basis. The constitutional court will now review the vote, which could take months.	https://www.wsj.com/articles/south-korea-president-yoon-suk-yeol-impeached-49b0779c	2024-12-14T00:06:00-08:00	
Russia Begins Packing Up Military Equipment in Syria, Satellite Images Show	The air base at Khmeimim and the naval installation at Tartus had become synonymous with Russia’s intervention in Syria.	https://www.wsj.com/articles/russia-begins-packing-up-military-equipment-in-syria-satellite-images-show-6cf23db9	2024-12-13T13:50:00-08:00	
American Freed From Syrian Regime Prison Was on Levantine Pilgrimage	The man, who gave his name to Syrian authorities as Travis Timmerman, had found himself held captive for seven months alongside political prisoners and torture victims.	https://www.wsj.com/articles/american-freed-from-syrian-regime-prison-was-on-levantine-pilgrimage-412eac89	2024-12-13T06:40:00-08:00	
Alleged Chinese Agent With Links to Prince Andrew Is Barred From U.K.	The Chinese businessman has been banned from entering the U.K. after intelligence services alleged he was trying to influence the British royal on behalf of Beijing.	https://www.wsj.com/articles/alleged-chinese-agent-with-links-to-prince-andrew-is-barred-from-u-k-63b5b361	2024-12-13T06:31:00-08:00	
U.S. Ally Halts Fight Against Islamic State in Syria as It Battles Rebel Group	Washington’s main ally in Syria warned that a power vacuum in the country was leading to attacks on the group by Turkish-backed rebels, forcing it to halt its yearslong campaign against Islamic State.	https://www.wsj.com/articles/u-s-ally-halts-fight-against-islamic-state-in-syria-as-it-battles-rebel-group-f6638826	2024-12-13T04:19:00-08:00	
France's Macron Names New Prime Minister in Bid to End Political Gridlock	The French president appointed a seasoned centrist to referee between rowdy political factions.	https://www.wsj.com/articles/frances-macron-names-new-prime-minister-in-bid-to-end-political-gridlock-05dd94aa	2024-12-13T03:59:00-08:00	
Leaders of Rich Nations Are Deeply Unpopular. That Spells Trouble Ahead.	If you are in charge of a slow-growing democracy, it’s not looking good right now. Almost no leader of an industrialized country has a net-positive approval rating.	https://www.wsj.com/articles/low-approval-voter-anger-wealthy-countries-ed5c23ed	2024-12-13T03:23:00-08:00	
Trump Team Weighs Options, Including Airstrikes, to Stop Iran's Nuclear Program	Military action would break with longstanding U.S. policy of stopping Tehran’s weapons program through diplomatic means.	https://www.wsj.com/articles/trump-iran-plan-nuclear-weapons-def26f1d	2024-12-12T20:00:00-08:00	
Fall of Syrian Regime Exposes Limits of Russia's Global Ambitions	With Moscow’s money, attention and ammunition focused on its conflict with Ukraine, the Kremlin’s global power projects are in a state of slow decay.	https://www.wsj.com/articles/russia-iran-assad-middle-east-b8b36167	2024-12-12T20:00:00-08:00	
Tracking Putin's Most Feared Secret Agency---From Inside a Russian Prison and Beyond	The spy unit that arrested a Wall Street Journal reporter is leading the biggest campaign of internal repression since the Stalin era.	https://www.wsj.com/articles/evan-gershkovich-russia-putin-arrests-spies-9a75e1c3	2024-12-12T18:00:00-08:00	
Trump to Europe: Overseeing a Ukraine Cease-Fire Would Be Your Job	The president-elect told the French and Ukrainian leaders that Europe would have to shoulder most of the burden to end the conflict.	https://www.wsj.com/articles/trump-ukraine-russia-war-plan-8901d78b	2024-12-12T08:04:00-08:00	
Alton Thacker, Who Gave More Than a Million Toys to Children, Dies at 89	A retired barber and ‘year-round Santa Claus,’ he co-founded a foundation that makes wooden cars for children around the world.	https://www.wsj.com/articles/alton-thacker-dies-toys-donation-children-6aa32cbb	2024-12-12T07:00:00-08:00	
China Moves to Trump-Proof Its Economy	Leaders promised more government support for China’s struggling economy next year as they brace for another big showdown over trade.	https://www.wsj.com/articles/china-moves-to-trump-proof-its-economy-13e83e9a	2024-12-12T06:08:00-08:00	
China Comes Out Swinging as Trump Trade War Looms	Beijing is brandishing an expanded arsenal of countermeasures as President-elect Donald Trump threatens across-the-board tariffs on Chinese-made goods.	https://www.wsj.com/articles/china-us-trump-trade-war-retaliation-70523b7c	2024-12-11T20:00:00-08:00	
Executed, Executed, Dead From Sickness': The Grim Records From Syria's Notorious Prison	Syrians searching for missing loved ones are scouring the country’s most notorious prison for information and anyone still alive, while bodies of detainees recovered from the prison fill the coroner’s office.	https://www.wsj.com/articles/syria-saydnaya-prison-assad-regime-5008d638	2024-12-11T20:00:00-08:00	
Hamas Concedes on Israeli Troops in Gaza, Raising Hopes for Hostage Deal	Hamas has yielded to two of Israel’s key demands for a cease-fire deal in Gaza, Arab mediators said, raising hopes of an agreement within days despite the repeated collapse of previous talks.	https://www.wsj.com/articles/israel-gaza-palestine-ceasefire-hostage-negotiations-d599e1d1	2024-12-11T18:00:00-08:00	
David Bonderman, Private Equity Founder, Dead at 82	The TPG co-founder was known for big deals like Continental Airlines.	https://www.wsj.com/articles/david-bonderman-private-equity-tpg-dead-cae86edd	2024-12-11T11:40:00-08:00	
Syria's Factions Explained in a Map	The rebel groups and foreign powers contending to shape the country’s future.	https://www.wsj.com/articles/syria-map-control-factions-civil-war-a5730e6f	2024-12-11T11:05:00-08:00	
Suicide Bomb in Afghanistan Kills Taliban Minister Wanted by the U.S.	The Taliban accuse Islamic State of killing Khalil Haqqani in a suicide bombing.	https://www.wsj.com/articles/afghanistan-suicide-bomb-taliban-minister-haqqani-84406b97	2024-12-11T10:21:00-08:00	
Shalom Nagar, 'The Hangman' Who Executed Adolf Eichmann, Dies at 89	A former member of the Israel Defense Forces, he eventually saw it as a virtuous act. But he was haunted by it for many years.	https://www.wsj.com/articles/shalom-nagar-dies-hangman-adolf-eichmann-206a6c91	2024-12-11T07:51:00-08:00	
Syria's Post-Assad Vacuum Has Become a Shooting Range for Great Powers	The U.S., Turkey and Israel are all pursuing long-held ambitions in the country after Assad’s ouster weakened Iranian and Russian influence.	https://www.wsj.com/articles/syria-assad-power-vacuum-9f9e3067	2024-12-11T04:47:00-08:00	
South Korea's Martial-Law Chaos Deepens, With a Suicide Attempt and Raids	The legal scrutiny over the country’s leader and his cabinet over last week’s martial-law decree has accelerated.	https://www.wsj.com/articles/south-koreas-martial-law-chaos-deepens-with-a-suicide-attempt-and-raids-bdc2efe7	2024-12-10T23:44:00-08:00	
