Title	Description	Link	pubDate	Image
‘Temple Mount is Muslim-only property,’ Palestinian Authority chi...	The head of the Palestinian Authority also said that Israel doesn’t deserve membership in the world body, as he nods to anti-Israel protesters in America, saying 'we are grateful' to them. By Mike Wagenheim, JNS In an address to the U.N. General Assembly on Thursday morning, Palestinian Authority leader Mahmoud Abbas called the holiest Jewish site—the Temple Mount in Jerusalem—the 'exclusive property of Muslims' and referred to Israel as a 'terrorist state' that does not deserve membership in the United Nations. Abbas, whose presidential mandate expired in 2009–the last time P.A. elections were held–told those watching that 'the world is responsible' for what he asserted were crimes against humanity taking place in the Gaza Strip amid Israel’s defensive war against Hamas. He claimed that Israel 'took advantage of what happened' on Oct. 7, when Hamas launched a massive assault in southern Israel—murdering, raping and torturing 1,200 people and taking some 250 others hostage—to 'launch a genocide' in the Gaza Strip. Abbas also said Israel has just launched a second 'war of genocide' in Lebanon, calling into question what kind of hostilities the Jewish state could be involved in that wouldn’t qualify as one. He also referred to Israeli National Security Minister Itamar Ben-Gvir as a terrorist for calling for a Third Temple to be built on the mount. Abbas saved a heavy dose of criticism for the Biden administration. He said he 'regrets' that the White House 'furnished Israel with deadly weapons it used to kill thousands of innocent civilians' while utilizing its veto power in the U.N. Security Council three times to thwart efforts to force a ceasefire on Israel with no guarantee that its hostages would be released from Gaza. 'As long as the U.S. is supporting' Israel, posed Abbas, 'why not keep going?' He also took Washington to task for denying the Palestinians full membership in the United Nations. 'We don’t deserve membership in the eyes of America,' he stated. 'I don’t understand.' Abbas did acknowledge protesters across America who 'are marching in the streets.' Many of them have called for the end of Israel, including its inhabitants, and have expressed explicit support for terror groups; have harassed Jews verbally and physically; and have disrupted Jewish life, including on college campuses. 'We are grateful to them,' said Abbas. He laid out a 12-step laundry list of requests and demands for a 'day-after' scenario, referring to the end of the war against Hamas and end of the terror group’s governance of Gaza. Those measures have all been laid out in one form or another in various public statements by the P.A., the United Nations and other international officials. On that list was 'an end to military aggressions by terrorist settlers' in Judea and Samaria, and eastern Jerusalem. Abbas said he would be submitting a request to the General Assembly regarding what he said was Israel’s lack of qualification to hold U.N. membership. His citation for such a claim was unclear, as he referred to Israel’s acceptance of the 1947 U.N. Partition Plan, but provisions he said Israel has never accepted or implemented. He also said that he would ask the world body to pass a resolution to ensure that Israel does not obstruct a visit by Abbas to the Gaza Strip, which he says he is trying to arrange. Abbas did not fall back on Holocaust denial or revisionism—a staple of previous UNGA speeches. Israel sent what appeared to be a staffer from its U.N. mission to attend the speech. Danny Danon, Israeli Ambassador to the United Nations released a statement, pointing out that Abbas’s 26-minute speech contained no mention of Hamas. 'Since the massacre of Oct. 7, Abbas has failed to condemn Hamas for their crimes against humanity,' Danon wrote. 'The Palestinian Authority under his leadership pays salaries to terrorists who kill Israelis: Whoever kills more, Abbas pays him more. Only when he stands on the U.N. platform does he talk about a peaceful solution.' Danon said the P.A. leader’s legacy 'is one of chronic weakness in the face of terrorism and hatred.' The post 'Temple Mount is Muslim-only property,' Palestinian Authority chief tells UN appeared first on World Israel News.	https://worldisraelnews.com/temple-mount-is-muslim-only-property-palestinian-authority-chief-tells-un/	2024-09-26T23:33:19-07:00	https://worldisraelnews.com/wp-content/uploads/2024/09/AP24270543264392.jpg
Trump ally accused of being a Nazi after he changed the price of ...	Whether Lindell realized it or not, $14.88 has been identified as a Nazi symbol. By Vered Weiss, World Israel News When staunch Trump ally Mike Lindell changed the price of his pillow to $14.88, he most likely didn't expect accusations of Nazism to follow. However, white Supremacists on social media began liking his prices, and not because they were low. When Lindell lowered the price of his Standard Classic MyPillow from its usual range of between $29.99 to $49.98 down to $14.88, people began to allege that he was sending a Nazi message. Whether Lindell realized it or not, $14.88 has been identified as a Nazi symbol. The number 14 stands for a white supremacist motto that contains 14 words. David Lane, a member of the white supremacist group The Order, originated the motto: 'We must secure the existence of our people and a future for white children.' The double eights refer to the fact that 'H' is the eighth letter of the alphabet, and 88 stands for 'Heil Hitler,' both words beginning with 'H.' Lindell's MyPillow ad received 8,000 likes on X and 415 likes on Facebook. Balkanomic reposted their order of the pillows, saying: '$14.88? How could you pass up such a great deal?' An X user called 'Goy division,' whose bio shows white supremacist symbolism (including a Nazi SS-esque lightning bolt and the phrase 'Fourteen words, eighty-eight precepts'), wrote, '6,000,000 positive reviews can't be wrong.' 'Yes, I think we have a deal,' wrote one user who refers to himself as an 'ethnostatesman' and posted a picture of Pepe the Frog, a well-known white supremacist symbol. However, Mike Lindell insists it wasn't his intention to signal white supremacy, and he points out that many items at Walmart are sold for amounts ending in 88 cents. Lindell has often expressed the view that the 2020 election was rigged in favor of Joe Biden, and for his views, his pillow brand has been removed from shelves of Bed, Bath and Beyond, Kohl's, and Walmart. 'When they have a sale on a sale, right? That 88,' he said on FlashPoint, a conservative online talk show. 'I get a call from all the media around the country and the world, all the way to the Daily Mail, saying, what are you, a Nazi?' He added, 'I'm going, 'Who comes up with this stuff?'' When asked if he would change his prices from $14.88, Lindell insisted he wasn't budging. 'It's another attack on MyPillow because their CEO wants to go to paper ballots and counting. It's as simple as that,' he said. The post Trump ally accused of being a Nazi after he changed the price of his pillows appeared first on World Israel News.	https://worldisraelnews.com/trump-ally-accused-of-being-a-nazi-after-he-changed-the-price-of-his-pillows/	2024-09-26T14:11:20-07:00	https://worldisraelnews.com/wp-content/uploads/2021/01/AP_21019616979518-scaled-e1611656582549.jpg
Israeli security forces foil terror plot to bomb Jewish holy site...	Security forces said the actions are 'are even more severe when being carried out by Israeli citizens during wartime.' By Vered Weiss, World Israel News Shin Bet, Israel's security agency and the police foiled a terrorist plan to bomb Jewish holy sites in the north of Israel last month and to shoot worshippers who prayed there. On Thursday, the agencies announced the arrest of Basel Abahara, a 23-year-old who lives in the Galilee region, and two minors in mid-August. This week, they were indicted for planning terrorist acts and keeping weapons. During interrogations, Abahara admitted that he had been planning to bomb the holy sites and then to shoot Jewish worshippers there. He also said he built the explosives based on advice from contacts in Judea and Samaria. Abahara enlisted the aid of minors to carry out the attack. Shin Bet said the planning of the attack was in the early phases, and they managed to seize communication devices, bomb-making materials, and a military vest. Abahara also admitted to throwing a Molotov cocktail not far from his home. Shin Bet said in a statement that the planning of such an attack was even more severe than usual because it involved 'Israeli citizens during wartime.' 'The Shin Bet and Israel Police treat any involvement of Israeli citizens in activity that endangers the state's and citizens' security with great severity, will continue to operate accordingly under the authority afforded to them, and will use the means at their disposal to thwart threats,' they said. Last Thursday, the IDF and Shin Bet eliminated a terror leader who planned numerous attacks in Northern Samaria. Shadi Zakarneh was killed alongside other terrorists by an IAF strike on his vehicle after Shin Bet saw him traveling in Qabatiya. The strike that killed Zkarneh also eliminated two other terrorists in the vehicle, and a strike on an additional vehicle killed three others. The second vehicle was laden with explosives, and the strike caused multiple blasts. The post Israeli security forces foil terror plot to bomb Jewish holy sites appeared first on World Israel News.	https://worldisraelnews.com/israel-security-forces-foil-terror-plot-to-bomb-jewish-holy-sites/	2024-09-26T12:45:48-07:00	https://worldisraelnews.com/wp-content/uploads/2024/09/devices.jpg
Macklemore in hot water after ‘F—k America’ rant	While political statements from artists are nothing new, this one seems to have struck a nerve. By Jewish Breaking News What happens in Vegas doesn’t always stay in Vegas, especially when it comes to high-profile festival drama. Last Tuesday, Neon City Festival promoters proudly unveiled their star-studded lineup, with Grammy-winning rapper Macklemore featured among the headliners. By Monday, his name had vanished without a trace, leaving fans and industry insiders scrambling for answers. Neon City organizers have remained tight-lipped, citing only 'unforeseen circumstances' in a public statement for Macklemore’s sudden departure. However, sources close to the festival cited by Digital Music News point to a controversial performance Macklemore gave Saturday night. At a pro-Palestinian benefit concert in Seattle, the 'Thrift Shop' singer let loose with a sharp 'f—k America' during his set. While political statements from artists are nothing new, this one seems to have struck a nerve. The antisemitic rapper himself finally broke his silence yesterday with a lengthy social media post on X. While stopping short of a full apology, Macklemore admitted to getting 'caught in the moment' while performing. 'My thoughts and feelings are not always expressed perfectly or politely,' he wrote. 'Sometimes I slip up and get caught in the moment. Saturday night was one of those times.' 'But do not misconstrue the word ‘f—k’ for the word ‘hate.’ It’s different to be angry than to disown,' Macklemore continued. 'I’ve lost endorsements, I’ve lost business ties. I am still here, unwavering in my support for a Free Palestine.' Out of all the antisemitic A-listers spreading misinformation, Macklemore has been particularly harsh on Israel’s defensive war in Gaza. Just mere weeks after Hamas murdered 1,200 innocents in Israel on October 7, he signed a star-studded open letter calling for a ceasefire without preconditions. In May, he released a protest song titled 'Hind’s Hall,' ironically in support of the same violent campus takeovers being fought by congressional leaders in the Senate this week. The post Macklemore in hot water after ‘F—k America’ rant appeared first on World Israel News.	https://worldisraelnews.com/macklemore-in-hot-water-after-f-k-america-rant/	2024-09-26T10:31:30-07:00	https://worldisraelnews.com/wp-content/uploads/2024/09/macklemore.jpg
New York Mayor Eric Adams indicted following corruption probe: Re...	The case is likely to complicate any Adams bid for re-election in 2025. By Reuters and The Washington Free Beacon New York City mayor Eric Adams has been indicted after a federal corruption investigation, but the indictment is sealed and it is unclear what charges he will face, the New York Times reported on Wednesday, citing people with knowledge of the matter. The charges come after the FBI last November searched Adams' electronic devices, and in the wake of a slew of resignations by top city officials in recent weeks as multiple federal corruption investigations entangle his administration. A spokesman for the U.S. Attorney's office in Manhattan, which brought the charges, declined to comment. Adams' lawyers did not immediately respond to a request for comment. One of his lawyers has said that the mayor, a Democrat, was cooperating with an investigation but did not say what it was about. The case is likely to complicate any Adams bid for re-election in 2025. Other Democratic politicians, including New York City comptroller Brad Lander, plan to challenge Adams—once a key ally of President Joe Biden—for the party's nomination. The Times, citing a search warrant, reported in early November 2023 that federal authorities were investigating the possible acceptance by Adams' 2021 campaign of illegal donations, including by the Turkish government. The probe, conducted by the U.S. Attorney's office in Manhattan, focused on whether Adams' 2021 mayoral campaign conspired with a Brooklyn construction company to funnel foreign money into the campaign through a straw-donor scheme, the Times said. Authorities have also sought information about Adams' interactions with Israel, China, Qatar, South Korea and Uzbekistan, according to the Times. The post New York Mayor Eric Adams indicted following corruption probe: Report appeared first on World Israel News.	https://worldisraelnews.com/new-york-mayor-eric-adams-indicted-following-corruption-probe-report/	2024-09-26T10:04:36-07:00	https://worldisraelnews.com/wp-content/uploads/2022/02/AP22035507226691.jpg
Nasrallah’s dilemma: A crisis of strategic choices	Despite the setbacks, Nasrallah shows no sign of backing down from his support of Hamas. By Baruch Yedid, TPS Hezbollah leader Hassan Nasrallah is at a critical crossroads. Will he back down from fighting, or risk an Israeli invasion of Lebanon? His decision will come amid the loss of numerous key Hezbollah leaders in airstrikes, the shocking attack on the terror group’s communication devices, and the demands of his Iranian patrons. This crisis is compounded by an unprecedented wave of displacement — nearly half a million Lebanese fleeing Hezbollah strongholds in southern Lebanon and the Beqaa Valley. Thousands of Lebanese are staying in makeshift shelters while at least 5,000 have crossed into neighboring Syria. Exacerbating Nasrallah’s troubles, the displaced Lebanese are now largely dependent on international aid and may become a bargaining chip in future negotiations. On the political front, Hezbollah’s leadership appears fragmented, with reports of internal discord between the organization’s leadership and its southern military command. Nasrallah banked on the international community pressuring Israel to quickly end its war with Hamas. He expected his pre-October 7 arsenal of an estimated 200,000 rockets to deter Israel. Instead, the fighting in Gaza is approaching its first anniversary. Nasrallah has not provided Hamas with any meaningful support. The elite Radwan Force is in disarray. The sabotage of thousands of communications devices has made Hezbollah a source of ridicule. And a ground war in Lebanon is looking increasingly likely. Hezbollah figures are increasingly resorting to the rhetoric of martyrdom, indicating a growing sense of desperation. Despite the setbacks, Nasrallah shows no sign of backing down from his support of Hamas. Hezbollah still maintains significant firepower, but Iran is currently restraining Hezbollah. It is believed Iran will intervene if Hezbollah’s situation deteriorates. Tehran has invested far more in Hezbollah than Hamas. Around 63,500 residents of northern Israel were forced to evacuate their homes when Hezbollah began launching rockets and drones in October. The terror group has launched more than 9,300 rockets and drones, killing 49 people on the Israeli side. Israel has defeated Hamas enough that it is now turning its attention to safely bringing its evacuees home. Israeli officials have been calling for Hezbollah to be disarmed and removed from southern Lebanon — from all locations south of the Litani River — in compliance with UN Security Council resolution 1701, which ended the 2006 Second Lebanon War. Nasrallah can back down, sparing Lebanon from a destructive war, but lose his credibility as a leader in Iran’s so-called 'Axis of Resistance.' Or Nasrallah can fight to the end and sacrifice Lebanese lives. The post Nasrallah’s dilemma: A crisis of strategic choices appeared first on World Israel News.	https://worldisraelnews.com/nasrallahs-dilemma-a-crisis-of-strategic-choices/	2024-09-26T09:46:19-07:00	https://worldisraelnews.com/wp-content/uploads/2019/07/nasrallah.v1.jpg
Israeli airstrike kills terrorist brothers who participated in Oc...	The IDF added that forces in the Rafah area of southern Gaza have killed 15 terrorists in the last day. By Pesach Benson, TPS Two brothers who participated in Hamas’s October 7 massacre were eliminated in an Israeli airstrike in Gaza, the Israel Defense Forces said on Thursday. The IDF said Suleiman Abu-Lafi and his brother, Abdullah were killed in Rafah last week. According to the army, Suleiman smuggled weapons. From Gaza he managed to direct terror attacks in Judea and Samaria. Abdullah was a member of Palestinian Islamic Jihad. Both participated in the October 7 attacks on Israeli communities near the Gaza border. A separate airstrike killed another commander of Hamas’s Nukhba Force who also participated in the October 7 massacre. The IDF added that forces in the Rafah area of southern Gaza have killed 15 terrorists in the last day. At least 1,200 people were killed, and 252 Israelis and foreigners were taken hostage in Hamas’s attacks on Israeli communities near the Gaza border on October 7. Of the 97 remaining hostages, more than 30 have been declared dead. Hamas has also been holding captive two Israeli civilians since 2014 and 2015, and the bodies of two soldiers killed in 2014. The post Israeli airstrike kills terrorist brothers who participated in October 7 massacre appeared first on World Israel News.	https://worldisraelnews.com/israeli-airstrike-kills-terrorist-brothers-who-participated-in-october-7-massacre/	2024-09-26T09:37:28-07:00	https://worldisraelnews.com/wp-content/uploads/2024/09/idf-gaza3.jpg
30,000 Jewish visitors to make Rosh Hashanah pilgrimage to Ukrain...	Earlier this month, Ukraine warned Hasidic Jews to forgo this year’s pilgrimage to Uman due to the war with Russia. By The Algemeiner Some 30,000 Hasidic Jews will reportedly go on this year’s annual Rosh Hashanah pilgrimage to the Ukrainian city of Uman to visit the tomb of Rabbi Nachman of Breslov, the revered founder of the Breslover Hasidim. An Israeli diplomat had told The Times of Israel that the number of worshipers this year could reach a record 50,000. However, due to flight cancellations caused by escalating tensions between Israel and Hezbollah, the Iran-backed terrorist organization in Lebanon, thousands of pilgrims will not be able to make the trip, according to the Ukrainian News Agency. Citing the United Jewish Community of Ukraine and the Historical and Cultural Center of Uman charitable foundation, the news agency reported on the lower-than-expected attendance. 'This year, due to the escalation in the north of Israel, a number of airlines canceled the flights that the Hasidic pilgrims were supposed to use to reach European countries in order to get to Ukraine,' the charitable foundation said in a message. 'Although the interested parties are looking for a way out of this situation, a significant part of the thousands of pilgrims who want to get to Uman will not be able to do so.' Each year, tens of thousands of Jewish pilgrims visit Uman, a major pilgrimage site for Hasidic Jews to pray at Nachman’s tomb on the occasion of Rosh Hashanah, the Jewish New Year, which will take place next week. Up to 500 Hasidim had already arrived in Uman as of last week, with a mass arrival of pilgrims expected in the coming days, according to the State Migration Service of Ukraine. Since 2020, Ukrainian officials have warned against making the pilgrimage, first due to COVID-19 and then because of the war with Russia. The pilgrimage became more complicated when many commercial flights to Ukraine were suspended following Russia’s invasion of the country in 2022. Earlier this month, Ukraine warned Hasidic Jews to forgo this year’s pilgrimage to Uman due to the war with Russia. 'Russia’s ongoing full-scale military aggression against Ukraine poses real threats to people’s lives and safety, [making] it impossible to guarantee the safety of foreign citizens on the territory of Ukraine,' the Ukrainian Foreign Ministry said in a statement. Kyiv added that there is a 'legal regime of martial law which provides for a number of additional regulations, including restrictions on freedom of movement, a curfew and enhanced patrols, a ban on holding mass events and gatherings, as well as the application of coercive measures against persons who will not comply with the established restrictions.' Therefore, the ministry wrote, Ukraine 'urges Hasidic pilgrims to refrain from this year’s pilgrimage to Uman as part of the celebration of Rosh Hashanah.' The statement went on to say that due to the war, there are not enough bomb shelters or medical personnel in Uman, and the transportation infrastructure has been compromised due to shelling. The foreign ministry’s warning came two days after the governor of the region where Uman is located issued a similar statement to Jewish worshipers ahead of Rosh Hashanah. Like the ministry, Cherkasy Region head Igor Taburets did not say that the pilgrims would be prevented from coming but asked them not to make the trip. Nonetheless, local authorities were preparing for the pilgrimage with enhanced security measures, according to Taburets. Earlier this month, Moldova said it would not allow pilgrims to pass through the country on the way to Uman, citing security costs and the limited capacity of their facilities. Some 20,000 pilgrims used Chisinau airport last year to get to Ukraine. An alternative route into Uman has been prepared through Romania. Israeli Prime Minister Benjamin Netanyahu and Ukrainian President Volodymyr Zelenskyy spoke about preparations for the pilgrimage last month. The United States recently issued a travel warning for Uman, urging American citizens not to visit the city due to the security situation. Uman has been targeted by Russian forces on several occasions during the ongoing war. Last April, at least 20 people, including three children, were killed during a missile and drone barrage launched by the Russians. Located in the south of Ukraine in the Cherkasy region, Uman was once home to a thriving Jewish community. In 1941, however, the Nazis deported the city’s entire Jewish community, murdering 17,000 Jews and destroying the local Jewish cemetery — including Nachman’s grave, which was later recovered and relocated. Since the dissolution of the Soviet Union in 1991, several Jewish Orthodox families have moved to Uman. Last year, more than 35,000 worshipers celebrated Rosh Hashanah at the grave of Nachman, despite Ukrainian authorities issuing similar warnings as they are now about visiting the city amid war with Russia. The post 30,000 Jewish visitors to make Rosh Hashanah pilgrimage to Ukraine, fewer than expected due to Mideast conflict appeared first on World Israel News.	https://worldisraelnews.com/30000-jewish-visitors-to-make-rosh-hashanah-pilgrimage-to-ukraine-fewer-than-expected-due-to-mideast-conflict/	2024-09-26T09:22:28-07:00	https://worldisraelnews.com/wp-content/uploads/2022/07/shutterstock_1390144778.jpg
