Title	Description	Link	pubDate	Image
Golden Globes 2025’s Unforgettable Looks: Ariana Grande, Emma Stone and Demi Moore	It wasn’t long after celebrities started arriving on the red carpet at the 82nd annual Golden Globe Awards on Sunday The post Golden Globes 2025’s Unforgettable Looks: Ariana Grande, Emma Stone and Demi Moore appeared first on World Online.	https://wol.com/golden-globes-2025s-unforgettable-looks-ariana-grande-emma-stone-and-demi-moore/	2025-01-05T21:21:30-08:00	
Sen. Banks: 'I don’t think Mike Johnson would have been Speaker' without Trump	Sen. Jim Banks (R-Ind.) said Sunday he doesn’t think Speaker Mike Johnson (R-La.) would have been reelected to his leadership The post Sen. Banks: 'I don’t think Mike Johnson would have been Speaker' without Trump appeared first on World Online.	https://wol.com/sen-banks-i-dont-think-mike-johnson-would-have-been-speaker-without-trump/	2025-01-05T21:11:31-08:00	
Biden: Jan. 6 reminds us that democracy 'is never guaranteed'	President Biden said in a Sunday opinion piece for The Washington Post that the Jan. 6, 2021 attack on the The post Biden: Jan. 6 reminds us that democracy 'is never guaranteed' appeared first on World Online.	https://wol.com/biden-jan-6-reminds-us-that-democracy-is-never-guaranteed/	2025-01-05T20:40:14-08:00	
Students Charged in ‘To Catch a Predator’ TikTok Scheme	Five college students in Massachusetts are accused of luring a man to the Assumption University campus in a plot that The post Students Charged in ‘To Catch a Predator’ TikTok Scheme appeared first on World Online.	https://wol.com/students-charged-in-to-catch-a-predator-tiktok-scheme/	2025-01-05T20:26:32-08:00	
Israel Conducts Raids in Syria Amid Accusations of Cease-Fire Violations	The Israeli military said on Sunday that it has been conducting -operational raids- in recent weeks on Mount Hermon in The post Israel Conducts Raids in Syria Amid Accusations of Cease-Fire Violations appeared first on World Online.	https://wol.com/israel-conducts-raids-in-syria-amid-accusations-of-cease-fire-violations/	2025-01-05T20:18:49-08:00	
Sir Keir Starmer to launch plan for two million more NHS appointments to cut waiting times | Politics News	Sir Keir Starmer will launch his plan to deliver millions more appointments across the NHS in a bid to reduce The post Sir Keir Starmer to launch plan for two million more NHS appointments to cut waiting times | Politics News appeared first on World Online.	https://wol.com/sir-keir-starmer-to-launch-plan-for-two-million-more-nhs-appointments-to-cut-waiting-times-politics-news/	2025-01-05T20:17:33-08:00	
The Fallout from U.S. Steel	The end of a troubled takeover bid President Biden is set to officially block Nippon Steel’s $14 billion takeover of The post The Fallout from U.S. Steel appeared first on World Online.	https://wol.com/the-fallout-from-u-s-steel/	2025-01-05T20:12:14-08:00	
Trump backs massive single bill for taxes, border and energy	Incoming President Donald Trump threw his support on Sunday behind having one sweeping border, energy and tax bill. -Members of The post Trump backs massive single bill for taxes, border and energy appeared first on World Online.	https://wol.com/trump-backs-massive-single-bill-for-taxes-border-and-energy/	2025-01-05T20:09:23-08:00	
NY accused of offering NJ drivers measly $3 break on hated congestion toll in secret doomed talks	New York offered New Jersey a measly $3 discount for its drivers crossing into Manhattan to try to offset the The post NY accused of offering NJ drivers measly $3 break on hated congestion toll in secret doomed talks appeared first on World Online.	https://wol.com/ny-accused-of-offering-nj-drivers-measly-3-break-on-hated-congestion-toll-in-secret-doomed-talks/	2025-01-05T19:38:23-08:00	
BPSC exam row: Prashant Kishor, who was sitting on indefinite hunger strike, arrested | India News	NEW DELHI: Patna Police on Monday arrested Jan Suraaj chief Prashant Kishor as he continued his indefinite hunger strike at The post BPSC exam row: Prashant Kishor, who was sitting on indefinite hunger strike, arrested | India News appeared first on World Online.	https://wol.com/bpsc-exam-row-prashant-kishor-who-was-sitting-on-indefinite-hunger-strike-arrested-india-news/	2025-01-05T19:19:15-08:00	
Ukraine launches new attack in Kursk region, says Russia 'getting what it deserves'	Ukraine has launched a fresh offensive in Russia’s western Kursk region, Russian officials said Sunday, months after Kyiv’s forces poured The post Ukraine launches new attack in Kursk region, says Russia 'getting what it deserves' appeared first on World Online.	https://wol.com/ukraine-launches-new-attack-in-kursk-region-says-russia-getting-what-it-deserves/	2025-01-05T19:18:11-08:00	
Biden calls Trump a ‘genuine threat to democracy’	President Biden took a departing jab at Trump, saying that what the president-elect did was a -genuine threat to democracy.- The post Biden calls Trump a &#8216;genuine threat to democracy' appeared first on World Online.	https://wol.com/biden-calls-trump-a-genuine-threat-to-democracy/	2025-01-05T19:07:11-08:00	
Thune has privately told Trump that Hegseth has the votes to be confirmed as Defense Secretary, sources say	Senate Majority Leader John Thune has privately told President-elect Donald Trump that he believes Pete Hegseth will have the votes The post Thune has privately told Trump that Hegseth has the votes to be confirmed as Defense Secretary, sources say appeared first on World Online.	https://wol.com/thune-has-privately-told-trump-that-hegseth-has-the-votes-to-be-confirmed-as-defense-secretary-sources-say/	2025-01-05T18:36:08-08:00	
Golden Globes red carpet highlights, celebrity fashion, quotes and standout moments	The Golden Globes returned with entertainment's biggest names hitting the red carpet to show off the latest in fashion before The post Golden Globes red carpet highlights, celebrity fashion, quotes and standout moments appeared first on World Online.	https://wol.com/golden-globes-red-carpet-highlights-celebrity-fashion-quotes-and-standout-moments/	2025-01-05T18:25:18-08:00	
On the Run, a Hit Man Gives One Last Confession	There are, the hit man said, many ways to kill. A string tied between two sticks strangles with a tug The post On the Run, a Hit Man Gives One Last Confession appeared first on World Online.	https://wol.com/on-the-run-a-hit-man-gives-one-last-confession-2/	2025-01-05T18:17:25-08:00	
1/5: Face the Nation – CBS News	1/5: Face the Nation &#8211; CBS News Watch CBS News This week on -Face the Nation with Margaret Brennan,- Senate The post 1/5: Face the Nation &#8211; CBS News appeared first on World Online.	https://wol.com/1-5-face-the-nation-cbs-news/	2025-01-05T18:16:11-08:00	
4 new measles cases in Quebec outbreak, experts warn of possible exposure	By Joe Bongiorno The Canadian Press Posted January 4, 2025 2:54 pm 1 min read Descrease article font size Increase The post 4 new measles cases in Quebec outbreak, experts warn of possible exposure appeared first on World Online.	https://wol.com/4-new-measles-cases-in-quebec-outbreak-experts-warn-of-possible-exposure/	2025-01-05T18:09:09-08:00	
Amazon Prime Will Release a Melania Trump Documentary	Amazon said on Sunday that its Prime Video streaming service will release a -behind-the-scenes- documentary about Melania Trump’s life. The The post Amazon Prime Will Release a Melania Trump Documentary appeared first on World Online.	https://wol.com/amazon-prime-will-release-a-melania-trump-documentary/	2025-01-05T18:05:27-08:00	
This furry clip-on robot is the strangest thing I’ve seen at this or any CES	Mirumi is the latest strange robot from Yukai Engineering It hangs on your bag It can -react- Gadgets that elicit The post This furry clip-on robot is the strangest thing I've seen at this or any CES appeared first on World Online.	https://wol.com/this-furry-clip-on-robot-is-the-strangest-thing-ive-seen-at-this-or-any-ces/	2025-01-05T17:51:22-08:00	
Coco Gauff beats Iga Swiatek to help USA win United Cup title over Poland in Australia	Coco Gauff moved her head-to-head with Iga Swiatek one small step in the right direction with a 6-4, 6-4 win The post Coco Gauff beats Iga Swiatek to help USA win United Cup title over Poland in Australia appeared first on World Online.	https://wol.com/coco-gauff-beats-iga-swiatek-to-help-usa-win-united-cup-title-over-poland-in-australia/	2025-01-05T17:47:13-08:00	
Golden Globes winners list for 2025: Live updates	ET Live The 2025 Golden Globe Awards are off and running, honoring the best of television and film from the The post Golden Globes winners list for 2025: Live updates appeared first on World Online.	https://wol.com/golden-globes-winners-list-for-2025-live-updates/	2025-01-05T17:34:39-08:00	
Democrats' Culture Denialism	They just don't get it. Source link The post Democrats' Culture Denialism appeared first on World Online.	https://wol.com/democrats-culture-denialism/	2025-01-05T17:34:09-08:00	
Biden signs Social Security bill, says American retirees deserve 'economic security and dignity'	President Biden on Sunday signed a Social Security bill repealing two statutes that have diminished payouts to public sector workers The post Biden signs Social Security bill, says American retirees deserve 'economic security and dignity' appeared first on World Online.	https://wol.com/biden-signs-social-security-bill-says-american-retirees-deserve-economic-security-and-dignity/	2025-01-05T17:03:13-08:00	
Pelosi says violence of Jan. 6 Capitol attack 'didn't end that day'	Former House Speaker Nancy Pelosi (D-Calif.) said Sunday that the violence of the Jan. 6, 2021, attack on the U.S. The post Pelosi says violence of Jan. 6 Capitol attack 'didn't end that day' appeared first on World Online.	https://wol.com/pelosi-says-violence-of-jan-6-capitol-attack-didnt-end-that-day/	2025-01-05T16:32:28-08:00	
New Orleans Attacker Visited City Twice and Made Trips to Egypt and Canada	Months before the man behind the New Orleans terror attack plowed a truck into a New Year’s Day crowd, he The post New Orleans Attacker Visited City Twice and Made Trips to Egypt and Canada appeared first on World Online.	https://wol.com/new-orleans-attacker-visited-city-twice-and-made-trips-to-egypt-and-canada/	2025-01-05T16:24:22-08:00	
Soccer-loving nun from Brazil is world’s oldest person at nearly 117	A soccer-loving nun from Brazil is believed to have become the world's oldest living person at nearly 117 following the recent The post Soccer-loving nun from Brazil is world's oldest person at nearly 117 appeared first on World Online.	https://wol.com/soccer-loving-nun-from-brazil-is-worlds-oldest-person-at-nearly-117/	2025-01-05T16:16:36-08:00	
As he falls out with Farage, how should politicians handle Elon Musk? | Politics News	For British politicians, the question of the moment is how do you handle Elon Musk? The billionaire owner of X The post As he falls out with Farage, how should politicians handle Elon Musk? | Politics News appeared first on World Online.	https://wol.com/as-he-falls-out-with-farage-how-should-politicians-handle-elon-musk-politics-news/	2025-01-05T16:15:28-08:00	
JetBlue Fined $2 Million for Chronic Delays	The Transportation Department announced on Friday a $2 million penalty against JetBlue Airways for operating several flights on the East The post JetBlue Fined $2 Million for Chronic Delays appeared first on World Online.	https://wol.com/jetblue-fined-2-million-for-chronic-delays/	2025-01-05T16:10:12-08:00	
Chinese hackers ran amok in US telecom network for 18 months — got info on over 1 million people: report	China-linked hackers reportedly managed to sneak into a US telecommunications surveillance system network for 18 months undetected and amass data The post Chinese hackers ran amok in US telecom network for 18 months — got info on over 1 million people: report appeared first on World Online.	https://wol.com/chinese-hackers-ran-amok-in-us-telecom-network-for-18-months-got-info-on-over-1-million-people-report/	2025-01-05T16:01:28-08:00	
Top New Year’s Eve cities to celebrate in US: Did yours make the list?	A new study has revealed which cities in America are the best places to ring in the New Year, and some The post Top New Year's Eve cities to celebrate in US: Did yours make the list? appeared first on World Online.	https://wol.com/top-new-years-eve-cities-to-celebrate-in-us-did-yours-make-the-list/	2025-01-05T16:00:16-08:00	
Top GOP senators call for reform, ‘consequences’ in wake of law enforcement ‘leadership failure’	Top GOP senators criticized recent law enforcement failures by the FBI and other groups Sunday, calling on President-elect Trump's administration The post Top GOP senators call for reform, &#8216;consequences' in wake of law enforcement &#8216;leadership failure' appeared first on World Online.	https://wol.com/top-gop-senators-call-for-reform-consequences-in-wake-of-law-enforcement-leadership-failure/	2025-01-05T15:29:14-08:00	
Congress is still atoning for Mamata’s expulsion, says party veteran Pradip Bhattacharya	File picture of West Bengal Congress leader Pradip Bhattacharya. &#124; Photo Credit: The Hindu Senior West Bengal Congress leader Pradip The post Congress is still atoning for Mamata’s expulsion, says party veteran Pradip Bhattacharya appeared first on World Online.	https://wol.com/congress-is-still-atoning-for-mamatas-expulsion-says-party-veteran-pradip-bhattacharya/	2025-01-05T15:18:45-08:00	
Zelensky says 'strong' Trump can broker peace with Russia, end Ukraine war	In an interview with US podcaster Lex Fridman, Ukrainian President Volodymyr Zelensky expressed confidence in President-elect Donald Trump's ability to The post Zelensky says 'strong' Trump can broker peace with Russia, end Ukraine war appeared first on World Online.	https://wol.com/zelensky-says-strong-trump-can-broker-peace-with-russia-end-ukraine-war/	2025-01-05T15:17:29-08:00	
Israel and Hamas clash over hostage release deal as Israeli strikes in Gaza intensify	Israel and Hamas dispute the details of a new hostage release deal, with Hamas saying it has approved a list The post Israel and Hamas clash over hostage release deal as Israeli strikes in Gaza intensify appeared first on World Online.	https://wol.com/israel-and-hamas-clash-over-hostage-release-deal-as-israeli-strikes-in-gaza-intensify/	2025-01-05T15:16:13-08:00	
Full transcript of -Face the Nation with Margaret Brennan,- Jan. 5, 2025	On this -Face the Nation- broadcast, moderated by Margaret Brennan: Reps. Mike Turner, Republican of Ohio, and Jim Himes, Democrat The post Full transcript of -Face the Nation with Margaret Brennan,- Jan. 5, 2025 appeared first on World Online.	https://wol.com/full-transcript-of-face-the-nation-with-margaret-brennan-jan-5-2025/	2025-01-05T14:58:09-08:00	
State Dept To Route Censorship Office to New Hub	The State Department informed members of Congress that it plans to Source link The post State Dept To Route Censorship Office to New Hub appeared first on World Online.	https://wol.com/state-dept-to-route-censorship-office-to-new-hub/	2025-01-05T14:27:23-08:00	
Skier killed, another injured after avalanche triggered in Wyoming	A skier was killed and another injured after the group they were in triggered a large avalanche while ascending a The post Skier killed, another injured after avalanche triggered in Wyoming appeared first on World Online.	https://wol.com/skier-killed-another-injured-after-avalanche-triggered-in-wyoming/	2025-01-05T14:22:57-08:00	
Austria Coalition Talks Collapse, Raising Prospects for Far-Right Freedom Party	The far-right Freedom Party of Austria gained a realistic chance this weekend of leading the country’s next government, after talks The post Austria Coalition Talks Collapse, Raising Prospects for Far-Right Freedom Party appeared first on World Online.	https://wol.com/austria-coalition-talks-collapse-raising-prospects-for-far-right-freedom-party/	2025-01-05T14:15:58-08:00	
A Melania Trump documentary will be released by Amazon Prime Video this year	Melania Trump is the focus of a new documentary distributed by Amazon Prime Video, the streaming branch of Jeff Bezos' The post A Melania Trump documentary will be released by Amazon Prime Video this year appeared first on World Online.	https://wol.com/a-melania-trump-documentary-will-be-released-by-amazon-prime-video-this-year/	2025-01-05T14:14:35-08:00	
Social Security Fairness Act signed into law by Biden, enhancing retirement benefits for millions	President Biden on Sunday signed legislation expanding Social Security benefits for millions of retired Americans, including firefighters, police officers and The post Social Security Fairness Act signed into law by Biden, enhancing retirement benefits for millions appeared first on World Online.	https://wol.com/social-security-fairness-act-signed-into-law-by-biden-enhancing-retirement-benefits-for-millions/	2025-01-05T14:08:42-08:00	
Sen. Kelly says Intelligence Committee will get briefed this week on New Orleans attack	Sen. Mark Kelly (D-Ariz.) said Sunday that the Intelligence Committee will get briefed on the New Orleans attack this coming The post Sen. Kelly says Intelligence Committee will get briefed this week on New Orleans attack appeared first on World Online.	https://wol.com/sen-kelly-says-intelligence-committee-will-get-briefed-this-week-on-new-orleans-attack/	2025-01-05T13:56:12-08:00	
The 6 Best Marketing CRM Software for 2025	Best free CRM with available upgrades: HubSpot Best for creating email marketing campaigns: Pipedrive Best for social media marketing: Zoho The post The 6 Best Marketing CRM Software for 2025 appeared first on World Online.	https://wol.com/the-6-best-marketing-crm-software-for-2025/	2025-01-05T13:49:57-08:00	
PAK 213/1 (49 ov, Shan Masood 102*, Khurram Shahzad 8*, Marco Jansen 1/56, SA vs PAK live score, 2nd Test, day 3, Newlands, Cape Town, January 03	Jansen to Babar Azam, OUT You live by the cover-driving sword&#8230; and you edge to gully close to stumps to The post PAK 213/1 (49 ov, Shan Masood 102*, Khurram Shahzad 8*, Marco Jansen 1/56, SA vs PAK live score, 2nd Test, day 3, Newlands, Cape Town, January 03 appeared first on World Online.	https://wol.com/pak-213-1-49-ov-shan-masood-102-khurram-shahzad-8-marco-jansen-1-56-sa-vs-pak-live-score-2nd-test-day-3-newlands-cape-town-january-03/	2025-01-05T13:46:23-08:00	
Clyburn hopes Johnson will attempt to find 'common ground'	Senior Democratic Rep. Jim Clyburn on Sunday encouraged newly reelected House Speaker Mike Johnson to work with Democrats on agenda The post Clyburn hopes Johnson will attempt to find 'common ground' appeared first on World Online.	https://wol.com/clyburn-hopes-johnson-will-attempt-to-find-common-ground/	2025-01-05T13:25:27-08:00	
‘We’re going to be dismantling the deep state’	Fresh off his reelection as speaker, Mike Johnson hyped up Republicans’ ambitious agenda for the new year and pledged to The post &#8216;We're going to be dismantling the deep state' appeared first on World Online.	https://wol.com/were-going-to-be-dismantling-the-deep-state/	2025-01-05T12:54:13-08:00	
Musk renews harsh rebuke of Dems who rejected deporting sex offenders: vote out ‘every one’	Join Fox News for access to this content Plus special access to select articles and other premium content with your The post Musk renews harsh rebuke of Dems who rejected deporting sex offenders: vote out ‘every one’ appeared first on World Online.	https://wol.com/musk-renews-harsh-rebuke-of-dems-who-rejected-deporting-sex-offenders-vote-out-every-one/	2025-01-05T12:23:22-08:00	
As Life Roars Back on Bourbon Street, Locals Question City’s Priorities	At various points along Bourbon Street, people had left flowers, candles, stuffed animals and what appeared to be a tamale The post As Life Roars Back on Bourbon Street, Locals Question City’s Priorities appeared first on World Online.	https://wol.com/as-life-roars-back-on-bourbon-street-locals-question-citys-priorities/	2025-01-05T12:22:10-08:00	
Ukraine launches counterattack in Russian border region as Zelenskyy to ask allies for boost in air defenses	Ukrainian forces launched a counterattack in the western border region of Kursk, warning that Russia was -getting what it deserves.- The post Ukraine launches counterattack in Russian border region as Zelenskyy to ask allies for boost in air defenses appeared first on World Online.	https://wol.com/ukraine-launches-counterattack-in-russian-border-region-as-zelenskyy-to-ask-allies-for-boost-in-air-defenses/	2025-01-05T12:14:22-08:00	
N.Y. Judge’s Ruling Shows How Legal Issues Will Follow Trump Into Office	As President-elect Donald J. Trump prepares for his inauguration, some of the legal cases that spilled out of Mr. Trump’s The post N.Y. Judge’s Ruling Shows How Legal Issues Will Follow Trump Into Office appeared first on World Online.	https://wol.com/n-y-judges-ruling-shows-how-legal-issues-will-follow-trump-into-office/	2025-01-05T12:13:10-08:00	
Montgomery-backed Local TV swoops on Lebedev’s London Live licence | Money News	A television network majority-owned by David Montgomery, the media entrepreneur, is to snap up the licence to operate a London-focused The post Montgomery-backed Local TV swoops on Lebedev's London Live licence | Money News appeared first on World Online.	https://wol.com/montgomery-backed-local-tv-swoops-on-lebedevs-london-live-licence-money-news/	2025-01-05T12:07:25-08:00	
Read full episode transcripts of -Face the Nation with Margaret Brennan- from 2025	More than a decade of -Face the Nation- transcripts are available online: 2008, 2009, 2010, 2011, 2012, 2013, 2014, 2015, 2016, 2017, 2018, 2019, 2020, 2021, 2022, 2023 and 2024. For earlier broadcasts, contact CBS Footage Requests. And for The post Read full episode transcripts of -Face the Nation with Margaret Brennan- from 2025 appeared first on World Online.	https://wol.com/read-full-episode-transcripts-of-face-the-nation-with-margaret-brennan-from-2025/	2025-01-05T11:21:14-08:00	
153 cases under NDPS Act, 246 arrested; heroin worth crores seized in Jammu in 2024	JAMMU: In an effort to combat the growing menace of drugs, Jammu police undertook extensive operations throughout 2024, achieving significant The post 153 cases under NDPS Act, 246 arrested; heroin worth crores seized in Jammu in 2024 appeared first on World Online.	https://wol.com/153-cases-under-ndps-act-246-arrested-heroin-worth-crores-seized-in-jammu-in-2024/	2025-01-05T11:17:13-08:00	
Two Algerian TikTok influencers arrested in France on charges of inciting violence	Two Algerian men have been arrested in France following allegations they published posts inciting violence on social media platform TikTok. The post Two Algerian TikTok influencers arrested in France on charges of inciting violence appeared first on World Online.	https://wol.com/two-algerian-tiktok-influencers-arrested-in-france-on-charges-of-inciting-violence/	2025-01-05T11:15:24-08:00	
Israel Thwarts External Threats, Amplifies Internal Ones	TEL AVIV-In mid-December, the Wall Street Journal featured an upbeat interview with Israeli Prime Minister Benjamin Netanyahu. The Jewish state's The post Israel Thwarts External Threats, Amplifies Internal Ones appeared first on World Online.	https://wol.com/israel-thwarts-external-threats-amplifies-internal-ones/	2025-01-05T10:50:15-08:00	
Face the Nationn: Pelosi, Homan	Face the Nationn: Pelosi, Homan &#8211; CBS News Watch CBS News Missed the second half of the show? The latest The post Face the Nationn: Pelosi, Homan appeared first on World Online.	https://wol.com/face-the-nationn-pelosi-homan/	2025-01-05T10:21:11-08:00	
Departing Senate Environment Chair Carper pledges to 'never retire,' keep fighting climate change	Newly former Senate Environment&#160;and Public Works&#160;Committee Chair Tom Carper (D-Del.) may be departing Congress, but he&#160;told The Hill he’ll -never The post Departing Senate Environment Chair Carper pledges to 'never retire,' keep fighting climate change appeared first on World Online.	https://wol.com/departing-senate-environment-chair-carper-pledges-to-never-retire-keep-fighting-climate-change/	2025-01-05T10:19:25-08:00	
In Kosovo, Christian Converts Hope to Revive a Pre-Islamic Past	The Catholic priest stood at the altar in the hilltop church for the mass baptism, dunking dozens of heads in The post In Kosovo, Christian Converts Hope to Revive a Pre-Islamic Past appeared first on World Online.	https://wol.com/in-kosovo-christian-converts-hope-to-revive-a-pre-islamic-past/	2025-01-05T10:13:50-08:00	
Elon Musk says ‘Farage doesn’t have what it takes’ as Reform UK leader describes comment as ‘a surprise’ | Politics News	Elon Musk has said Reform UK needs a -new leader- because Nigel Farage -doesn't have what it takes-. The X The post Elon Musk says &#8216;Farage doesn't have what it takes' as Reform UK leader describes comment as &#8216;a surprise' | Politics News appeared first on World Online.	https://wol.com/elon-musk-says-farage-doesnt-have-what-it-takes-as-reform-uk-leader-describes-comment-as-a-surprise-politics-news/	2025-01-05T10:12:25-08:00	
Religious Leaders Experiment with A.I. in Sermons	To members of his synagogue, the voice that played over the speakers of Congregation Emanu El in Houston sounded just The post Religious Leaders Experiment with A.I. in Sermons appeared first on World Online.	https://wol.com/religious-leaders-experiment-with-a-i-in-sermons/	2025-01-05T10:06:12-08:00	
