Title	Description	Link	pubDate	Image
Hostage families: ‘Protests are killing our loved ones’	Israelis are 'following Sinwar's instructions' by protesting, fumes brother of kidnapped man. By World Israel News Staff Families of civilians and soldiers held captive by Hamas terrorists for almost one year are slamming the ongoing hostage release protests, which have joined forces with the anti-government Kaplan Movement, stating that the demonstrations are actually decreasing the chances that their loved ones will be freed. The Forum for Hostage Families has claimed to be a non-partisan organization advocating on behalf of all those whose loved ones were kidnapped, but some families have said that the group promotes a political agenda. Those who are in favor of military pressure as the most effective tactic for freeing the hostages established the Tikva Forum. Its members do not support the weekly Tel Aviv rallies calling for a ceasefire, where speakers often include anti-Netanyahu rhetoric in their speeches. Nadav Miran, whose brother Omri was kidnapped from Kibbutz Nahal Oz on October 7th, said that many of the hostage families had unwittingly become pawns of Hamas due to their vocal criticism of the Israeli government and participation in protests calling for a hostage deal at any cost. 'The content of the [hostage deal rallies] is now focused on toppling the government,' Miran, a member of the Tikva Forum, told Hebrew-language outlet Ynet. 'We hear [Hamas leader] Yahya Sinwar forcing the hostages to demand street protests calling for their release' in psychological warfare videos, Miran said. 'And what do Israeli citizens do? They follow Sinwar's instructions' by protesting, he added. Miran stressed that growing public pressure for a deal only makes Hamas sharpen its demands, putting the terror group in a stronger position at the negotiating table. 'Those who go to the protests are preventing a deal and killing the captives,' he said. 'Because of the demonstrations, the price [Hamas is demanding] for the hostages is increasing.' He added that it bothers him to see photos of his brother being held by the protesters. 'My brother is being used to protect their agenda. They are standing against the truth. The only one blocking a deal is Hamas, and even the Americans are saying that.' Miran's views were backed by Shimon Or, whose nephew, Avinatan, was kidnapped from the Nova Music Festival alongside his girlfriend, Noa Argamani. Demonstrators using Avinatan's photo at protests 'don't actually care about him or the other captives,' Or told Ynet. 'They have their own goals - primarily overthrowing the prime minister.' The post Hostage families: 'Protests are killing our loved ones' appeared first on World Israel News.	https://worldisraelnews.com/hostage-families-protests-are-killing-our-loved-ones/	2024-09-22T23:03:55-07:00	https://worldisraelnews.com/wp-content/uploads/2024/04/F240406EM94.jpg
Hamas chief Yahya Sinwar may have been killed – report	IDF intelligence reportedly probing possibility that Yahya Sinwar, the Hamas chief and mastermind of the October 7th invasion, may be dead. By World Israel News Staff Israel's military is currently investigating whether Hamas chief Yahya Sinwar has died, according to multiple reports carried by Hebrew media outlets late Sunday night and early Monday morning. Sinwar, the mastermind of the October 7th invasion of Israel and massacre of some 1,200 people in southwestern Israel, has not been heard from recently, leading some in the Israeli intelligence community to speculate that the leader of the terrorist group's forces in Gaza and, since August, head of the organization's politburo, may have died in an IDF airstrike several months ago. The IDF's Military Intelligence Directorate is taking seriously the possibility that Sinwar was in fact killed when Israeli warplanes bombed a tunnel where the terrorist leader was suspected to be hiding, Kan, Ma'ariv, Walla, and Ha'aretz all reported. No details were provided, however, regarding the strike in question. No clear evidence has yet been found indicating Sinwar has died, army sources cited by the reports emphasized, and the Hamas chief's possible death remains entirely speculative at this point. According to a report by The Jerusalem Post, there is no consensus within Israel's intelligence community as to the likelihood of Sinwar having been killed or the significance of his recent months-long silence. This is not the first time security officials have speculated regarding Sinwar's possible death. Multiple rumors were floated and leaked to the press last December after a lull in communications by the Hamas leader. In contrast to Israel's military intelligence establishment, the Shin Bet - the Jewish state's internal security agency and the country's primary counter-terror security service - is largely skeptical of the possibility Sinwar was killed in the airstrike in question, with the agency presuming Sinwar is still alive. The post Hamas chief Yahya Sinwar may have been killed - report appeared first on World Israel News.	https://worldisraelnews.com/hamas-chief-yahya-sinwar-may-have-been-killed-report/	2024-09-22T22:05:32-07:00	https://worldisraelnews.com/wp-content/uploads/2021/10/AP21144585755772-1.jpg
Netanyahu says half of the hostages held in Gaza are still alive ...	Netanyahu said it was Hamas, not Israel's government, that was to blame for the impasse in hostage release negotiation. By Vered Weiss, World Israel News During a closed meeting of the Foreign Affairs and Defense Committee on Sunday, Israeli Prime Minister Benjamin Netanyahu reportedly told MKs that just half of the 97 hostages remaining in Gaza are still alive. Of the hostages taken on October 7th, 33 have died after being taken as captives in Gaza. 'According to the information we have, half of the hostages in Gaza are alive,' he is quoted as saying by Army Radio. Netanyahu said it was Hamas, not Israel's government, that was to blame for the impasse in hostage release negotiation. In addition, the Prime Minister said he is mulling his generals' plans to seize northern Gaza. Last week, retired Maj. Gen. Giora Eiland presented a plan to 'change the reality on the ground' in Gaza. 'We have to tell the residents of north Gaza that they have one week to evacuate the territory, which then becomes a military zone, [a zone] in which every figure is a target and, most importantly, no supplies enter this territory,' General Eiland said. In June, American and Israeli intelligence predicted that there may be as few as 50 hostages still left alive in Gaza, the Wall Street Journal reported. The daily cited 'mediators in the hostage talks and a U.S. official familiar with the latest U.S. intelligence' as sources. Officially, on the Israeli side the IDF and Prime Minister's Office declined to comment, and on the American end the Office of the Director of National Intelligence kept mum as well when asked for a response. IDF spokesperson Daniel Hagari revealed that the IDF eliminated two terrorists who held the six murdered Israeli hostages whose bodies were recovered in late August. The IDF retrieved the bodies of Hersh Goldberg-Polin, 23, Eden Yerushalmi, 24, Ori Danino, 25, Almog Sarusi, 25, Alexander Lobanov, 32, and Carmel Gat, 40, in Rafah. They were shot in the head execution-style just two days before security forces discovered their bodies. Hagari reported that 'troops from the 162nd Division identified two terrorists emerging from an underground tunnel shaft in the Tel al-Sultan area and eliminated them during an encounter.' The post Netanyahu says half of the hostages held in Gaza are still alive - report appeared first on World Israel News.	https://worldisraelnews.com/netanyahu-says-half-of-the-hostages-still-held-in-gaza-are-still-alive-report/	2024-09-22T13:19:29-07:00	https://worldisraelnews.com/wp-content/uploads/2024/09/Netanyahu-english.png
Did an explosive beeper cause crash that killed previous Iranian ...	Gholamhossein Esmaili, the late Iranian president’s chief of staff reported that weather was not a factor in the death of President Ebrahim Raisi. By Vered Weiss, World Israel News An explosive beeper similar to those that injured and killed Hezbollah terrorists last week might have played a role in the helicopter crash that killed Iranian President Iranian president Ebrahim Raisi in May. European-based Iranian journalist posted on X that Ahmad Bakhshayesh Ardestani, a member of the Iranian parliament’s National Security and Foreign Policy Committee said Raisi may have had one of the explosive-laden beepers when he was in a helicopter shortly before his death. Iranian media claimed that the crash that killed Raisi was caused by foul weather when the helicopter collided with a fog-covered mountain. However, Gholamhossein Esmaili, the late Iranian president’s chief of staff, told state television that weather was not a factor in the death of President Ebrahim Raisi. Esmaili was traveling in one of the two other helicopters in the air entourage that was making its way back from a ceremony inaugurating a dam on the border with Azerbaijan. 'The weather was clear, and completely bright and fine' when the flight began, he said. About half an hour into their trip, Raisi’s pilot ordered the three to rise above clouds that were on their level, but after about '30 seconds, [my] pilot noticed that the main helicopter was not with us,' he said. An offensive last week involved spontaneous explosion of thousands of beepers used by Hezbollah terrorists, wounding thousands and killing at least 37. Additional injuries and deaths occurred on Wednesday in Lebanon and in Syria, where 19 IRGC terrorists were killed and 150 were injured. A former commander of British military forces in Afghanistan, Colonel Richard Kemp, praised the beeper offensive against Hezbollah as 'precise and discriminatory' and effective at weakening the morale and capacity of the Lebanese terror group. Israel’s outsmarting them with this terror attack has led to Hezbollah’s 'demoralization.' Kemp also praised the mission because it effectively targeted only terrorists and limited civilian casualties. The post Did an explosive beeper cause crash that killed previous Iranian president? appeared first on World Israel News.	https://worldisraelnews.com/did-an-explosive-beeper-cause-crash-that-killed-previous-iranian-president/	2024-09-22T12:52:23-07:00	https://worldisraelnews.com/wp-content/uploads/2024/05/raisi.jpg
Explosive beeper may have caused crash that killed previous Irani...	Gholamhossein Esmaili, the late Iranian president’s chief of staff reported that weather was not a factor in the death of President Ebrahim Raisi. By Vered Weiss, World Israel News An explosive beeper similar to those that injured and killed Hezbollah terrorists last week might have played a role in the helicopter crash that killed Iranian President Iranian president Ebrahim Raisi in May. European-based Iranian journalist posted on X that Ahmad Bakhshayesh Ardestani, a member of the Iranian parliament’s National Security and Foreign Policy Committee said Raisi may have had one of the explosive-laden beepers when he was in a helicopter shortly before his death. Iranian media claimed that the crash that killed Raisi was caused by foul weather when the helicopter collided with a fog-covered mountain. However, Gholamhossein Esmaili, the late Iranian president’s chief of staff, told state television that weather was not a factor in the death of President Ebrahim Raisi. Esmaili was traveling in one of the two other helicopters in the air entourage that was making its way back from a ceremony inaugurating a dam on the border with Azerbaijan. 'The weather was clear, and completely bright and fine' when the flight began, he said. About half an hour into their trip, Raisi’s pilot ordered the three to rise above clouds that were on their level, but after about '30 seconds, [my] pilot noticed that the main helicopter was not with us,' he said. An offensive last week involved spontaneous explosion of thousands of beepers used by Hezbollah terrorists, wounding thousands and killing at least 37. Additional injuries and deaths occurred on Wednesday in Lebanon and in Syria, where 19 IRGC terrorists were killed and 150 were injured. A former commander of British military forces in Afghanistan, Colonel Richard Kemp, praised the beeper offensive against Hezbollah as 'precise and discriminatory' and effective at weakening the morale and capacity of the Lebanese terror group. Israel’s outsmarting them with this terror attack has led to Hezbollah’s 'demoralization.' Kemp also praised the mission because it effectively targeted only terrorists and limited civilian casualties. The post Explosive beeper may have caused crash that killed previous Iranian President Raisi appeared first on World Israel News.	https://worldisraelnews.com/explosive-beeper-may-have-caused-crash-that-killed-previous-iranian-president-raisi/	2024-09-22T12:52:23-07:00	https://worldisraelnews.com/wp-content/uploads/2024/05/raisi.jpg
DeSantis: Two-state solution ‘stepping stone’ to end of Israel	In his address, DeSantis, who has cracked down on violent university demonstrations and fought against the boycott of Israel, said that chants of 'From the River to the Sea' common at the protests were calls for genocide. By JNS The two-state solution long backed by successive U.S. administrations and the international community to resolve the Israeli-Palestinian conflict is a 'canard' that Palestinians view as a 'stepping stone to the destruction of Israel,' Florida Gov. Ron DeSantis said on Friday. 'It’s important for us in the United States to be very clear-eyed about what it means to be a strong ally of the State of Israel, and that means we should not embrace the canard of a two-state solution,' the Republican told the Israeli American Council summit in Washington. 'That is not seeking to have peace. They are seeking that as a stepping stone to the destruction of the Jewish state, and that is not acceptable!' In his address, the staunchly pro-Israel governor, who has cracked down on violent university demonstrations against Israel in the Sunshine State and fought against the boycott of Israel, said that chants of 'From the River to the Sea' common at the protests were calls for genocide. 'What you’re seeing on these college campuses, no question, is a lot of virulent antisemitism, a lot of hate. When you say, ‘From the River to the Sea’, you are chanting in favor of a second Holocaust. That’s what that means. 'I do think some of these students are just ignorant. I don’t think they even understand what they’re talking about. You hear some of them talking about ‘End the occupation of Palestine’. And I just think they need a little history lesson: There has never been a Palestinian Arab state!' DeSantis continued. He then offered a crash course in Israel 101. 'Prior to the First World War, you had hundreds of years of occupation under the Ottoman Empire. It was not a Palestinian Arab state. Then you had the British Mandate for Palestine. Then you had a Partition Plan from the U.N.—Jewish state and Arab state,' DeSantis said. 'The Jews accepted the state and founded Israel. The Arabs rejected the state and they went to war to try to eradicate Israel, and they lost. And they went to war again and they lost in 1967 and 1973 and throughout the intifadas, and so on! That land historically has no stronger connection to any group of people except the Jewish people. It goes about thousands of years. Read your Bible!' Earlier this year, DeSantis signed into laws bill on antisemitism and on Jewish school security, including one which codifies the International Holocaust Remembrance Alliance’s (IHRA) working definition of antisemitism, and another allocating state security funding for full-time Jewish day schools and preschools. He has also spoken out against the often violent campus demonstrations against Jewish students this past year, saying that he would not allow that to happen in Florida, which has become a go-to state for Jews fleeing New York. The post DeSantis: Two-state solution ‘stepping stone’ to end of Israel appeared first on World Israel News.	https://worldisraelnews.com/desantis-two-state-solution-stepping-stone-to-end-of-israel/	2024-09-22T10:26:58-07:00	https://worldisraelnews.com/wp-content/uploads/2023/03/AP23066687252325-e1678442802217.jpg
Iran’s ‘Torture Master’ dies after brain surgery	He was involved in suppressing student protests in 2009 and was accused of personally escalating sentences for political prisoners. By Jewish Breaking News A notorious Iranian interrogator has reportedly died following brain surgery on Saturday. Reza Seraj’s career in Iran’s security apparatus spanned decades and was marked by controversy. Beginning in the 1990s, he rose through the ranks as a senior interrogator within IRGC Intelligence. Operating under the alias 'Alavi,' Seraj became notorious for extracting forced confessions through pressure and torture. Throughout his career, Seraj held various high-ranking positions, including head of the Student Basij, political deputy of Sarallah Headquarters in Tehran, and head of the Special IRGC Intelligence Directorate. He was involved in suppressing student protests in 2009 and was accused of personally escalating sentences for political prisoners, according to Iran International. In 2023, the US Treasury Department sanctioned Seraj for his role in overseas assassination plots and human rights abuses in Iran. He was also implicated in violent incidents against inmates, including the 'Black Thursday' attack in Evin Prison in 2014. Despite accusations from former political prisoners and activists about his involvement in torture and forced confessions, IRGC Commander-in-Chief Hossein Salami praised Seraj for his role in confronting anti-government protests. 'Seraj played a significant role in confronting sedition and raising awareness in dealing with various deviations that threatened the Islamic Revolution,' Salami said in a statement. The post Iran’s ‘Torture Master’ dies after brain surgery appeared first on World Israel News.	https://worldisraelnews.com/irans-torture-master-dies-after-brain-surgery/	2024-09-22T10:13:09-07:00	https://worldisraelnews.com/wp-content/uploads/2024/09/reza-seraj.jpg
French president slams Netanyahu for causing ‘full-scale’ war, Bi...	On Thursday, France voted in favor of a United Nations General Assembly resolution proposed by the Palestinian Authority to impose sanctions and an arms embargo on Israel. By JNS Israeli Prime Minister Benjamin Netanyahu and French President Emmanuel Macron held a difficult conversation last week over the escalating situation in Lebanon, Israel’s Channel 12 reported on Friday. According to the report, Macron, who initiated the call, hurled harsh accusations at the Israeli premier for leading Israel and Lebanon to the brink of a full-scale war. 'The responsibility to prevent escalation is yours. You can opt for a diplomatic solution. This is the moment to show leadership and responsibility. Your activity in the north is pushing the region to war,' Macron was quoted in the report as saying. Netanyahu replied: 'Instead of putting the pressure on us, it’s about time you pressured Hezbollah. We will bring our residents back home [in the north]. This is the decision we made this week and we will act on it.' On Thursday, France voted in favor of a United Nations General Assembly resolution proposed by the Palestinian Authority to impose sanctions and an arms embargo on Israel. Israeli officials expressed their disappointment over Paris’s stance, including its inability to put diplomatic pressure on Hezbollah to end its hostilities, Channel 12 reported. 'You, the French, do what you still think you must diplomatically do and we will do what we must do,' senior officials in Jerusalem said in the report. A French source noted that 'a diplomatic agreement in the north is still possible, on condition that all sides take responsibility. The latest security developments are worrying because they fuel a new dynamic of escalation.' Macron expressed his sympathies with the Lebanese people in footage uploaded to X, saying that 'escalation is in no one’s interest.' In the wake of the two-day attack across Lebanon in which pagers and walkie-talkie communication devices held by Hezbollah operatives exploded, killing dozens and injuring thousands more, Macron noted that Lebanon should not 'live in fear of an imminent war.' He said that 'nothing—no regional adventure, no private interests, no faithfulness to any cause whatsoever—is worth launching a conflict in Lebanon over. Lebanon’s integrity, security and sovereignty must be preserved,' he added. This was not the first time Macron has been critical of Israel and Netanyahu. In March, he said that the forcible transfer of Gazans from Rafah ahead of a prospective Israeli military operation in the city would constitute a 'war crime.' The French president further stated that Paris was planning to circulate a draft resolution at the U.N. Security Council calling for 'an immediate and lasting ceasefire.' The post French president slams Netanyahu for causing 'full-scale' war, Bibi bites back appeared first on World Israel News.	https://worldisraelnews.com/french-president-slams-netanyahu-for-causing-full-scale-war-bibi-bites-back/	2024-09-22T09:40:05-07:00	https://worldisraelnews.com/wp-content/uploads/2023/10/WhatsApp-Image-2023-10-24-at-11.47.43_c96d44b3.jpg
Netanyahu, Macron exchange harsh words over escalation in war wit...	On Thursday, France voted in favor of a United Nations General Assembly resolution proposed by the Palestinian Authority to impose sanctions and an arms embargo on Israel. By JNS Israeli Prime Minister Benjamin Netanyahu and French President Emmanuel Macron held a difficult conversation last week over the escalating situation in Lebanon, Israel’s Channel 12 reported on Friday. According to the report, Macron, who initiated the call, hurled harsh accusations at the Israeli premier for leading Israel and Lebanon to the brink of a full-scale war. 'The responsibility to prevent escalation is yours. You can opt for a diplomatic solution. This is the moment to show leadership and responsibility. Your activity in the north is pushing the region to war,' Macron was quoted in the report as saying. Netanyahu replied: 'Instead of putting the pressure on us, it’s about time you pressured Hezbollah. We will bring our residents back home [in the north]. This is the decision we made this week and we will act on it.' On Thursday, France voted in favor of a United Nations General Assembly resolution proposed by the Palestinian Authority to impose sanctions and an arms embargo on Israel. Israeli officials expressed their disappointment over Paris’s stance, including its inability to put diplomatic pressure on Hezbollah to end its hostilities, Channel 12 reported. 'You, the French, do what you still think you must diplomatically do and we will do what we must do,' senior officials in Jerusalem said in the report. A French source noted that 'a diplomatic agreement in the north is still possible, on condition that all sides take responsibility. The latest security developments are worrying because they fuel a new dynamic of escalation.' Macron expressed his sympathies with the Lebanese people in footage uploaded to X, saying that 'escalation is in no one’s interest.' In the wake of the two-day attack across Lebanon in which pagers and walkie-talkie communication devices held by Hezbollah operatives exploded, killing dozens and injuring thousands more, Macron noted that Lebanon should not 'live in fear of an imminent war.' He said that 'nothing—no regional adventure, no private interests, no faithfulness to any cause whatsoever—is worth launching a conflict in Lebanon over. Lebanon’s integrity, security and sovereignty must be preserved,' he added. This was not the first time Macron has been critical of Israel and Netanyahu. In March, he said that the forcible transfer of Gazans from Rafah ahead of a prospective Israeli military operation in the city would constitute a 'war crime.' The French president further stated that Paris was planning to circulate a draft resolution at the U.N. Security Council calling for 'an immediate and lasting ceasefire.' The post Netanyahu, Macron exchange harsh words over escalation in war with Hezbollah: Report appeared first on World Israel News.	https://worldisraelnews.com/netanyahu-macron-exchange-harsh-words-over-escalation-in-war-with-hezbollah-report/	2024-09-22T09:40:05-07:00	https://worldisraelnews.com/wp-content/uploads/2023/10/WhatsApp-Image-2023-10-24-at-11.47.43_c96d44b3.jpg
