Title	Description	Link	pubDate	Image
NYT Connections today — my hints and answers for Monday, December 30 (game #568)	Good morning! Let's play Connections, the NYT's clever word game that challenges you to group answers in various categories. It The post NYT Connections today — my hints and answers for Monday, December 30 (game #568) appeared first on World Online.	https://wol.com/nyt-connections-today-my-hints-and-answers-for-monday-december-30-game-568/	2024-12-29T17:06:29-08:00	
ZIM vs AFG 2024/25, Zimbabwe vs Afghanistan 1st Test, Day 4, Bulawayo Match Report, December 26 – 30, 2024	Afghanistan 515 for 3 (Rahmat 234, Shahidi 179*, Muzarabani 1-52) trail Zimbabwe 586 by 71 runs Rain had the final The post ZIM vs AFG 2024/25, Zimbabwe vs Afghanistan 1st Test, Day 4, Bulawayo Match Report, December 26 &#8211; 30, 2024 appeared first on World Online.	https://wol.com/zim-vs-afg-2024-25-zimbabwe-vs-afghanistan-1st-test-day-4-bulawayo-match-report-december-26-30-2024/	2024-12-29T17:00:25-08:00	
Biden praises Jimmy Carter as example of -simple decency-	President Biden on Sunday evening praised the late President Jimmy Carter as an example of -simple decency- in brief remarks, hours after The post Biden praises Jimmy Carter as example of -simple decency- appeared first on World Online.	https://wol.com/biden-praises-jimmy-carter-as-example-of-simple-decency/	2024-12-29T16:53:20-08:00	
179 killed in South Korea airplane crash	179 killed in South Korea airplane crash &#8211; CBS News Watch CBS News All 175 passengers and four crew members The post 179 killed in South Korea airplane crash appeared first on World Online.	https://wol.com/179-killed-in-south-korea-airplane-crash/	2024-12-29T16:47:21-08:00	
Major political consequences for Farage, Badenoch and the Tories ahead in 2025 | Politics News	British voters are in for a relatively untroubled 2025, after the -Year of Elections- which saw a new government in The post Major political consequences for Farage, Badenoch and the Tories ahead in 2025 | Politics News appeared first on World Online.	https://wol.com/major-political-consequences-for-farage-badenoch-and-the-tories-ahead-in-2025-politics-news/	2024-12-29T16:44:11-08:00	
Trump, Biden react to death of former President Jimmy Carter	President-elect Trump and President Biden reacted to the death of former President Jimmy Carter on Sunday, with Trump saying, -we The post Trump, Biden react to death of former President Jimmy Carter appeared first on World Online.	https://wol.com/trump-biden-react-to-death-of-former-president-jimmy-carter/	2024-12-29T16:39:28-08:00	
Jimmy Carter, former president and Nobel Peace Prize winner, dies at age 100	Jimmy Carter, the 39th president of the United States, died Sunday at the age of 100. Though he served only The post Jimmy Carter, former president and Nobel Peace Prize winner, dies at age 100 appeared first on World Online.	https://wol.com/jimmy-carter-former-president-and-nobel-peace-prize-winner-dies-at-age-100/	2024-12-29T16:08:10-08:00	
Fight over spending stopgap foreshadows funding challenges in new Congress	The messy government shutdown fight this month foreshadows some of the challenges House Republicans could face next year, as a The post Fight over spending stopgap foreshadows funding challenges in new Congress appeared first on World Online.	https://wol.com/fight-over-spending-stopgap-foreshadows-funding-challenges-in-new-congress/	2024-12-29T15:37:07-08:00	
Man on vacation goes viral for blunt answer to question: ‘No, I’m not having fun’	Some people may want to consider being a bit more … diplomatic. That's the overall assessment of commenters on a The post Man on vacation goes viral for blunt answer to question: &#8216;No, I'm not having fun' appeared first on World Online.	https://wol.com/man-on-vacation-goes-viral-for-blunt-answer-to-question-no-im-not-having-fun/	2024-12-29T15:28:08-08:00	
DNC chair candidate O'Malley says he’s 'probably one of the best operational turnaround leaders' in party	Former Maryland Gov. Martin O’Malley, who is running to be the next chair of the Democratic National Committee (DNC), described The post DNC chair candidate O'Malley says he’s 'probably one of the best operational turnaround leaders' in party appeared first on World Online.	https://wol.com/dnc-chair-candidate-omalley-says-hes-probably-one-of-the-best-operational-turnaround-leaders-in-party/	2024-12-29T15:06:19-08:00	
Jimmy Carter remembered as statesman and humanitarian as world leaders respond to his death at 100	The death on Sunday of former President Jimmy Carter, the nation's oldest former president in history, quickly prompted tributes from The post Jimmy Carter remembered as statesman and humanitarian as world leaders respond to his death at 100 appeared first on World Online.	https://wol.com/jimmy-carter-remembered-as-statesman-and-humanitarian-as-world-leaders-respond-to-his-death-at-100/	2024-12-29T14:52:19-08:00	
Brazil police probe deadly, arsenic-laced Christmas cake that killed 3	Authorities in Brazil launched an investigation after three women died and several others were hospitalized after a family ate an The post Brazil police probe deadly, arsenic-laced Christmas cake that killed 3 appeared first on World Online.	https://wol.com/brazil-police-probe-deadly-arsenic-laced-christmas-cake-that-killed-3/	2024-12-29T14:46:32-08:00	
Former President Jimmy Carter dead at 100	Jimmy Carter had such confidence in his improbable path to the White House that he bet Americans worn down by The post Former President Jimmy Carter dead at 100 appeared first on World Online.	https://wol.com/former-president-jimmy-carter-dead-at-100/	2024-12-29T14:43:17-08:00	
President Biden praises Jimmy Carter as ‘extraordinary leader’ after his death	President Joe Biden on Sunday called Jimmy Carter -an extraordinary leader, statesman and humanitarian- as he joined the chorus of The post President Biden praises Jimmy Carter as &#8216;extraordinary leader' after his death appeared first on World Online.	https://wol.com/president-biden-praises-jimmy-carter-as-extraordinary-leader-after-his-death/	2024-12-29T14:35:16-08:00	
Will not allow Bangladesh’s troubles to spill into WB: DGP	Director General of West Bengal Police Rajeev Kumar &#124; Photo Credit: ANI Director General of West Bengal Police Rajeev Kumar The post Will not allow Bangladesh’s troubles to spill into WB: DGP appeared first on World Online.	https://wol.com/will-not-allow-bangladeshs-troubles-to-spill-into-wb-dgp/	2024-12-29T14:34:11-08:00	
Azerbaijan's president says Russia unintentionally shot down crashed jetliner	Azerbaijan’s President Ilham Aliyev said that Russia unintentionally shot down an Azerbaijani Airlines flight that crashed in Kazakhstan on Wednesday, killing The post Azerbaijan's president says Russia unintentionally shot down crashed jetliner appeared first on World Online.	https://wol.com/azerbaijans-president-says-russia-unintentionally-shot-down-crashed-jetliner/	2024-12-29T14:32:14-08:00	
Jimmy Carter: A pictorial retrospective	Join Fox News for access to this content You have reached your maximum number of articles. Log in or create The post Jimmy Carter: A pictorial retrospective appeared first on World Online.	https://wol.com/jimmy-carter-a-pictorial-retrospective/	2024-12-29T14:04:07-08:00	
Jimmy Carter set the standard for the modern post-presidency	Elected in the aftermath of the Watergate scandal that brought down President Richard Nixon, Jimmy Carter, the former governor of The post Jimmy Carter set the standard for the modern post-presidency appeared first on World Online.	https://wol.com/jimmy-carter-set-the-standard-for-the-modern-post-presidency/	2024-12-29T13:33:10-08:00	
7 Ways to Stop VoIP DDoS Attacks from Crashing Your Phones	A distributed denial-of-service (DDoS) attack vector attempts to overwhelm a VoIP server with phony user requests. Because this massive volume The post 7 Ways to Stop VoIP DDoS Attacks from Crashing Your Phones appeared first on World Online.	https://wol.com/7-ways-to-stop-voip-ddos-attacks-from-crashing-your-phones/	2024-12-29T13:05:16-08:00	
Immigration Moratorium Now	Immigration Moratorium Now Source link The post Immigration Moratorium Now appeared first on World Online.	https://wol.com/immigration-moratorium-now/	2024-12-29T13:02:37-08:00	
WATCH: Eagles’ A.J. Brown hurls Tanner McKee’s first NFL TD pass into crowd, offers signed jersey for ball	Getty Images The Philadelphia Eagles are in total control against the Dallas Cowboys, and in the midst of another touchdown The post WATCH: Eagles' A.J. Brown hurls Tanner McKee's first NFL TD pass into crowd, offers signed jersey for ball appeared first on World Online.	https://wol.com/watch-eagles-a-j-brown-hurls-tanner-mckees-first-nfl-td-pass-into-crowd-offers-signed-jersey-for-ball/	2024-12-29T12:59:17-08:00	
2 Oregon men in died from exposure after going to search for Sasquatch in Washington state	Two men were found dead Saturday in a forest in southwestern Washington, where they disappeared last week while searching for The post 2 Oregon men in died from exposure after going to search for Sasquatch in Washington state appeared first on World Online.	https://wol.com/2-oregon-men-in-died-from-exposure-after-going-to-search-for-sasquatch-in-washington-state/	2024-12-29T12:51:15-08:00	
Flight evacuated after landing incident in Halifax	The Transportation Safety Board of Canada is investigating an incident involving a plane at the Halifax Stanfield International Airport, which The post Flight evacuated after landing incident in Halifax appeared first on World Online.	https://wol.com/flight-evacuated-after-landing-incident-in-halifax/	2024-12-29T12:45:31-08:00	
Face the Nation: Wen, Bhave, Rubenstein	Face the Nation: Wen, Bhave, Rubenstein &#8211; CBS News Watch CBS News Missed the second half of the show? The The post Face the Nation: Wen, Bhave, Rubenstein appeared first on World Online.	https://wol.com/face-the-nation-wen-bhave-rubenstein/	2024-12-29T12:42:32-08:00	
Syria's new leader says elections could take up to four years	Organising elections in Syria could take up to four years and drafting a new constitution could take three years, Ahmed al-Sharaa, The post Syria's new leader says elections could take up to four years appeared first on World Online.	https://wol.com/syrias-new-leader-says-elections-could-take-up-to-four-years/	2024-12-29T12:40:14-08:00	
Schmitt on H-1B program: 'American workers have been left behind by this economy'	Republican Sen. Eric Schmitt (Mo.) said that U.S. workers -have been left behind by this economy- during a discussion on The post Schmitt on H-1B program: 'American workers have been left behind by this economy' appeared first on World Online.	https://wol.com/schmitt-on-h-1b-program-american-workers-have-been-left-behind-by-this-economy/	2024-12-29T12:31:18-08:00	
Denmark needs to forget dog sleds and come up with real defense for Greenland: ex-Trump nat’l security adviser	Denmark needs to do more than add dog sleds to defend Greenland, given its icy territory has it -on the The post Denmark needs to forget dog sleds and come up with real defense for Greenland: ex-Trump nat'l security adviser appeared first on World Online.	https://wol.com/denmark-needs-to-forget-dog-sleds-and-come-up-with-real-defense-for-greenland-ex-trump-natl-security-adviser/	2024-12-29T12:00:15-08:00	
12/29: Face the Nation – CBS News	12/29: Face the Nation &#8211; CBS News Watch CBS News This week on -Face the Nation with Margaret Brennan,- Dr. The post 12/29: Face the Nation &#8211; CBS News appeared first on World Online.	https://wol.com/12-29-face-the-nation-cbs-news/	2024-12-29T11:29:13-08:00	
Cardin: Trump's Panama comments affect 'America's credibility globally'	Sen. Ben Cardin (D-Md.), outgoing chair of the Senate Foreign Relations Committee, said on Sunday that President-elect Trump’s remarks about The post Cardin: Trump's Panama comments affect 'America's credibility globally' appeared first on World Online.	https://wol.com/cardin-trumps-panama-comments-affect-americas-credibility-globally/	2024-12-29T10:58:27-08:00	
Full transcript of -Face the Nation with Margaret Brennan,- Dec. 29, 2024	On this -Face the Nation- broadcast, moderated by Major Garrett: Jan Crawford, Robert Costa, Scott MacFarlane, Ed O'Keefe and Caitlin The post Full transcript of -Face the Nation with Margaret Brennan,- Dec. 29, 2024 appeared first on World Online.	https://wol.com/full-transcript-of-face-the-nation-with-margaret-brennan-dec-29-2024/	2024-12-29T10:50:18-08:00	
Gaza babies struggle with hypothermia as temperatures drop and war continues around them	At least four infants have died of hypothermia in recent weeks in the Gaza Strip, where hundreds of thousands of The post Gaza babies struggle with hypothermia as temperatures drop and war continues around them appeared first on World Online.	https://wol.com/gaza-babies-struggle-with-hypothermia-as-temperatures-drop-and-war-continues-around-them/	2024-12-29T10:44:26-08:00	
Labour would lose almost 200 seats in ‘highly unstable’ parliament if election held today, poll suggests | Politics News	Labour would lose its majority and nearly 200 seats if a general election was held today, a new mega poll The post Labour would lose almost 200 seats in &#8216;highly unstable' parliament if election held today, poll suggests | Politics News appeared first on World Online.	https://wol.com/labour-would-lose-almost-200-seats-in-highly-unstable-parliament-if-election-held-today-poll-suggests-politics-news/	2024-12-29T10:41:10-08:00	
Almost 170,000 retail jobs lost in 2024 – and there could be even more next year | Money News	Almost 170,000 retail workers lost their jobs this year after the collapse of major high street chains, according to data. The post Almost 170,000 retail jobs lost in 2024 &#8211; and there could be even more next year | Money News appeared first on World Online.	https://wol.com/almost-170000-retail-jobs-lost-in-2024-and-there-could-be-even-more-next-year-money-news/	2024-12-29T10:34:08-08:00	
Underwater Krishna-Godavari basin landslide can trigger tsunami: Scientists	PANAJI: A recently discovered landslide in Krishna-Godavari basin, reaching between 950m and 1.1km below the ocean surface, could pose a The post Underwater Krishna-Godavari basin landslide can trigger tsunami: Scientists appeared first on World Online.	https://wol.com/underwater-krishna-godavari-basin-landslide-can-trigger-tsunami-scientists/	2024-12-29T10:32:51-08:00	
Salomé Zourabichvili: Georgia's first female president	Outgoing Georgian President Salomé Zourabichvili became the country's first female president in 2018 with the support of the governing party Georgian The post Salomé Zourabichvili: Georgia's first female president appeared first on World Online.	https://wol.com/salome-zourabichvili-georgias-first-female-president/	2024-12-29T10:31:31-08:00	
Chris Sununu brushes off Elon Musk’s potential conflicts of interest, warns a ‘car crash of financial crises coming’	Outgoing New Hampshire Gov. Chris Sununu (R) brushed aside Elon Musk’s potential conflicts of interest while praising the tech baron’s The post Chris Sununu brushes off Elon Musk's potential conflicts of interest, warns a &#8216;car crash of financial crises coming' appeared first on World Online.	https://wol.com/chris-sununu-brushes-off-elon-musks-potential-conflicts-of-interest-warns-a-car-crash-of-financial-crises-coming/	2024-12-29T10:27:21-08:00	
Eric Schmitt blasts ‘abuse’ of H-1B visa program, says Americans ‘shouldn’t train their foreign replacements’	Sen. Eric Schmitt, R-Mo., says H1-B visas are being -abused- in the U.S. and argues that many American workers are The post Eric Schmitt blasts &#8216;abuse' of H-1B visa program, says Americans &#8216;shouldn't train their foreign replacements' appeared first on World Online.	https://wol.com/eric-schmitt-blasts-abuse-of-h-1b-visa-program-says-americans-shouldnt-train-their-foreign-replacements/	2024-12-29T09:56:13-08:00	
Delta Begins Rollout of Free Wi-Fi on Long-Haul International Routes	Dark/Light Mode (21/08/24) Delta has started rolling out free Wi-Fi on select long-haul international routes, with most transatlantic flights expected The post Delta Begins Rollout of Free Wi-Fi on Long-Haul International Routes appeared first on World Online.	https://wol.com/delta-begins-rollout-of-free-wi-fi-on-long-haul-international-routes/	2024-12-29T09:27:22-08:00	
2024 Correspondents’ Panel: A look back at the year’s biggest stories and 2025 predictions	2024 Correspondents' Panel: A look back at the year's biggest stories and 2025 predictions &#8211; CBS News Watch CBS News The post 2024 Correspondents' Panel: A look back at the year's biggest stories and 2025 predictions appeared first on World Online.	https://wol.com/2024-correspondents-panel-a-look-back-at-the-years-biggest-stories-and-2025-predictions/	2024-12-29T09:25:13-08:00	
Thousands of widely-used public workspaces are leaking data	Many organizations using Postman workspaces are putting their data at risk Researchers found tens of thousands of publicly accessible workspaces The post Thousands of widely-used public workspaces are leaking data appeared first on World Online.	https://wol.com/thousands-of-widely-used-public-workspaces-are-leaking-data/	2024-12-29T09:04:14-08:00	
Players released in Brazil after alleged racist incident	Dec 28, 2024, 03:42 PM ET Four players from the River Plate women's team who were arrested for an alleged The post Players released in Brazil after alleged racist incident appeared first on World Online.	https://wol.com/players-released-in-brazil-after-alleged-racist-incident/	2024-12-29T08:58:14-08:00	
Where the Tech Right and Restrictionists Can Agree	In the 1968 Cold War thriller Ice Station Zebra, Patrick McGoohan's British spy character explains to the American submarine captain The post Where the Tech Right and Restrictionists Can Agree appeared first on World Online.	https://wol.com/where-the-tech-right-and-restrictionists-can-agree/	2024-12-29T08:54:21-08:00	
Norovirus cases are surging in parts of the U.S. this winter, CDC data show	Minnesota health officials concerned about rise in norovirus cases Minnesota health officials concerned about rise in norovirus cases 01:52 Cases The post Norovirus cases are surging in parts of the U.S. this winter, CDC data show appeared first on World Online.	https://wol.com/norovirus-cases-are-surging-in-parts-of-the-u-s-this-winter-cdc-data-show/	2024-12-29T08:49:20-08:00	
Azerbaijan’s president says Russia unintentionally shot down jetliner that crashed in Kazakhstan	The president of Azerbaijan said Sunday that the passenger plane that crashed last week, killing 38 people, was unintentionally shot The post Azerbaijan's president says Russia unintentionally shot down jetliner that crashed in Kazakhstan appeared first on World Online.	https://wol.com/azerbaijans-president-says-russia-unintentionally-shot-down-jetliner-that-crashed-in-kazakhstan/	2024-12-29T08:43:23-08:00	
David Rubenstein on -Face the Nation- | Full interview	David Rubenstein on -Face the Nation- &#124; Full interview &#8211; CBS News Watch CBS News Watch Major Garrett's full interview The post David Rubenstein on -Face the Nation- | Full interview appeared first on World Online.	https://wol.com/david-rubenstein-on-face-the-nation-full-interview/	2024-12-29T08:40:11-08:00	
Book excerpt: -The Hidden Globe: How Wealth Hacks the World- by Atossa Araxia Abrahamian	Riverhead We may receive an affiliate commission from anything you buy from this article. You may think you have a The post Book excerpt: -The Hidden Globe: How Wealth Hacks the World- by Atossa Araxia Abrahamian appeared first on World Online.	https://wol.com/book-excerpt-the-hidden-globe-how-wealth-hacks-the-world-by-atossa-araxia-abrahamian/	2024-12-29T08:33:34-08:00	
Sununu says Trump has ‘definitely not’ permanently changed the GOP	New Hampshire Gov. Chris Sununu, a moderate Republican, said on Sunday that he does not think President-elect Trump has permanently The post Sununu says Trump has ‘definitely not’ permanently changed the GOP appeared first on World Online.	https://wol.com/sununu-says-trump-has-definitely-not-permanently-changed-the-gop/	2024-12-29T08:23:31-08:00	
Elon Musk backs Germany’s far-right party ahead of upcoming elections	Tech entrepreneur Elon Musk caused uproar after backing Germany's far-right party in a major newspaper ahead of key parliamentary elections The post Elon Musk backs Germany's far-right party ahead of upcoming elections appeared first on World Online.	https://wol.com/elon-musk-backs-germanys-far-right-party-ahead-of-upcoming-elections/	2024-12-29T07:52:10-08:00	
Taliban leader bans windows overlooking places 'usually used by women'	Afghanistan's Taliban leader has ordered that new residential buildings are constructed without windows looking onto -places usually used by women- The post Taliban leader bans windows overlooking places 'usually used by women' appeared first on World Online.	https://wol.com/taliban-leader-bans-windows-overlooking-places-usually-used-by-women/	2024-12-29T07:39:07-08:00	
The Book Report: Ron Charles on the best books of 2024	By Washington Post book critic Ron Charles 2024 was full of fascinating (-Creation Lake-), moving (-Someone Like Us-), alarming (-Eruption-), The post The Book Report: Ron Charles on the best books of 2024 appeared first on World Online.	https://wol.com/the-book-report-ron-charles-on-the-best-books-of-2024/	2024-12-29T07:26:47-08:00	
Sen. Kim signals openness to Stefanik, Rubio, but has ‘real concerns’ about Patel, Hegseth	Sen. Andy Kim (D-N.J.) on Sunday signaled an openness to supporting Rep. Elise Stefanik (R-N.Y.) and Sen. Marco Rubio (R-Fla.) The post Sen. Kim signals openness to Stefanik, Rubio, but has ‘real concerns’ about Patel, Hegseth appeared first on World Online.	https://wol.com/sen-kim-signals-openness-to-stefanik-rubio-but-has-real-concerns-about-patel-hegseth/	2024-12-29T07:21:27-08:00	
How Japanese mochi brings communities in America together	How Japanese mochi brings communities in America together &#8211; CBS News Watch CBS News Mochi, a doughy cake made from The post How Japanese mochi brings communities in America together appeared first on World Online.	https://wol.com/how-japanese-mochi-brings-communities-in-america-together/	2024-12-29T06:48:11-08:00	
North Korea’s Kim Jong Un vows to implement -toughest- anti-U.S. policy before Trump takes office	North Korean leader Kim Jong Un vowed to implement the -toughest- anti-U.S. policy, state media reported Sunday, less than a The post North Korea's Kim Jong Un vows to implement -toughest- anti-U.S. policy before Trump takes office appeared first on World Online.	https://wol.com/north-koreas-kim-jong-un-vows-to-implement-toughest-anti-u-s-policy-before-trump-takes-office/	2024-12-29T06:42:32-08:00	
Govt. committed to implement Rythu Bharosa against all odds: Bhatti	Deputy Chief Minister Mallu Bhatti Vikramarka has asserted that the government is committed to provide investment subsidy to farmers assured The post Govt. committed to implement Rythu Bharosa against all odds: Bhatti appeared first on World Online.	https://wol.com/govt-committed-to-implement-rythu-bharosa-against-all-odds-bhatti/	2024-12-29T06:31:36-08:00	
French government faces 'huge challenge' to rebuild Mayotte, specialist says	France's new Prime Minister Francois Bayrou is scheduled to visit the French Indian Ocean territory of Mayotte, which was devastated The post French government faces 'huge challenge' to rebuild Mayotte, specialist says appeared first on World Online.	https://wol.com/french-government-faces-huge-challenge-to-rebuild-mayotte-specialist-says/	2024-12-29T06:30:32-08:00	
Kansas once required voters to prove citizenship. That didn’t work out so well	TOPEKA, Kan. — Republicans made claims about illegal voting by noncitizens a centerpiece of their 2024 campaign messaging and plan The post Kansas once required voters to prove citizenship. That didn't work out so well appeared first on World Online.	https://wol.com/kansas-once-required-voters-to-prove-citizenship-that-didnt-work-out-so-well/	2024-12-29T06:19:27-08:00	
Key Alzheimer’s Breakthrough Identifies Stress-Related Cellular Mechanism Driving the Disease	Scientists investigating Alzheimer’s disease have made a key breakthrough, identifying a vital cellular mechanism driving the most common cause of The post Key Alzheimer’s Breakthrough Identifies Stress-Related Cellular Mechanism Driving the Disease appeared first on World Online.	https://wol.com/key-alzheimers-breakthrough-identifies-stress-related-cellular-mechanism-driving-the-disease/	2024-12-29T05:53:24-08:00	
Transcript: Philanthropist and author David Rubenstein on -Face the Nation with Margaret Brennan,- Dec. 29, 2024	The following is the full transcript of an interview with David Rubenstein, philanthropist and author, on -Face the Nation with The post Transcript: Philanthropist and author David Rubenstein on -Face the Nation with Margaret Brennan,- Dec. 29, 2024 appeared first on World Online.	https://wol.com/transcript-philanthropist-and-author-david-rubenstein-on-face-the-nation-with-margaret-brennan-dec-29-2024/	2024-12-29T05:48:23-08:00	
When to Use Cloud Network Security (And When to Avoid It)	From data storage to business applications and beyond, companies of all sizes rely on the cloud for day-to-day operations and The post When to Use Cloud Network Security (And When to Avoid It) appeared first on World Online.	https://wol.com/when-to-use-cloud-network-security-and-when-to-avoid-it/	2024-12-29T05:03:13-08:00	
