Title	Description	Link	pubDate	Image
Trump orbit blasts FBI for initial terror response: ‘When they fail, Americans die’	President-elect Donald Trump's allies are excoriating the FBI for its initial characterization of the brutal car attack in New Orleans The post Trump orbit blasts FBI for initial terror response: &#8216;When they fail, Americans die' appeared first on World Online.	https://wol.com/trump-orbit-blasts-fbi-for-initial-terror-response-when-they-fail-americans-die/	2025-01-02T08:46:25-08:00	
With a nod to her mentor Shirley Chisholm, Rep. Barbara Lee exits Congress as a renegade herself	WASHINGTON — Rep. Barbara Lee has always stood apart, a matter-of-fact renegade with a long list of firsts. In high The post With a nod to her mentor Shirley Chisholm, Rep. Barbara Lee exits Congress as a renegade herself appeared first on World Online.	https://wol.com/with-a-nod-to-her-mentor-shirley-chisholm-rep-barbara-lee-exits-congress-as-a-renegade-herself/	2025-01-02T08:15:11-08:00	
FBI to brief House Homeland Security Committee on New Orleans attack	New Orleans attack: What we know a day later What we know about the New Orleans truck attack, one day The post FBI to brief House Homeland Security Committee on New Orleans attack appeared first on World Online.	https://wol.com/fbi-to-brief-house-homeland-security-committee-on-new-orleans-attack/	2025-01-02T07:44:29-08:00	
How a cosmetology school is teaching students to care for diverse hair and skin	How a cosmetology school is teaching students to care for diverse hair and skin &#8211; CBS News Watch CBS News The post How a cosmetology school is teaching students to care for diverse hair and skin appeared first on World Online.	https://wol.com/how-a-cosmetology-school-is-teaching-students-to-care-for-diverse-hair-and-skin/	2025-01-02T07:42:11-08:00	
Suspected Chinese underwater spy drone found by fishermen in waters off the Philippines	A submarine drone suspected to be from China was recovered in waters off the central Philippines, police said on Thursday, The post Suspected Chinese underwater spy drone found by fishermen in waters off the Philippines appeared first on World Online.	https://wol.com/suspected-chinese-underwater-spy-drone-found-by-fishermen-in-waters-off-the-philippines/	2025-01-02T07:36:26-08:00	
Biden to award Presidential Citizens Medal to Liz Cheney, Bennie Thompson, who led Jan. 6 select committee	Washington — President Biden announced Thursday that he is awarding the Presidential Citizens Medal to Rep. Bennie Thompson and former The post Biden to award Presidential Citizens Medal to Liz Cheney, Bennie Thompson, who led Jan. 6 select committee appeared first on World Online.	https://wol.com/biden-to-award-presidential-citizens-medal-to-liz-cheney-bennie-thompson-who-led-jan-6-select-committee/	2025-01-02T07:33:13-08:00	
Tesla sales decline 1.1% in 2024, the company’s first annual sales drop in a decade	Tesla sales for the 2024 short of 2023 numbers, as a 2.3% increase in global sales in the fourth quarter The post Tesla sales decline 1.1% in 2024, the company's first annual sales drop in a decade appeared first on World Online.	https://wol.com/tesla-sales-decline-1-1-in-2024-the-companys-first-annual-sales-drop-in-a-decade/	2025-01-02T07:22:06-08:00	
Schumer backs Wikler for DNC chair	Senate Majority Leader Chuck Schumer (D-N.Y.) announced Thursday that he’s throwing his support behind Ben Wikler, the chair of the The post Schumer backs Wikler for DNC chair appeared first on World Online.	https://wol.com/schumer-backs-wikler-for-dnc-chair/	2025-01-02T07:12:14-08:00	
Finance dept. yet to answer queries by UDF MLAs in Assembly on KFC investment	Two separate questions by United Democratic Front (UDF) MLAs in the Kerala Assembly on the Kerala Financial Corporation (KFC) decision The post Finance dept. yet to answer queries by UDF MLAs in Assembly on KFC investment appeared first on World Online.	https://wol.com/finance-dept-yet-to-answer-queries-by-udf-mlas-in-assembly-on-kfc-investment/	2025-01-02T06:56:11-08:00	
Romania and Bulgaria join the EU's visa-free Schengen zone	Romania and Bulgaria officially joined the EU's visa-free Schengen zone on January 1 despite having been European Union members since The post Romania and Bulgaria join the EU's visa-free Schengen zone appeared first on World Online.	https://wol.com/romania-and-bulgaria-join-the-eus-visa-free-schengen-zone/	2025-01-02T06:54:21-08:00	
Warning signs for conservatives who want to draft Trump in their spending war	Conservatives who want to slash the federal budget are hoping they can enlist President-elect Donald Trump and Elon Musk to The post Warning signs for conservatives who want to draft Trump in their spending war appeared first on World Online.	https://wol.com/warning-signs-for-conservatives-who-want-to-draft-trump-in-their-spending-war/	2025-01-02T06:41:32-08:00	
Trump says US is ‘laughing stock’ after New Orleans terror attack, Tesla Cybertruck explosion	President-elect Donald Trump on Thursday ripped the US as a -disaster- and global -laughing stock- in the wake of the The post Trump says US is &#8216;laughing stock' after New Orleans terror attack, Tesla Cybertruck explosion appeared first on World Online.	https://wol.com/trump-says-us-is-laughing-stock-after-new-orleans-terror-attack-tesla-cybertruck-explosion/	2025-01-02T06:10:11-08:00	
SNP spends more money on meals for Scottish prisoners than for hospital patients in NHS care	Prisoners serving time in Scottish prisons are better fed than patients under NHS care, according to fresh figures revealed in The post SNP spends more money on meals for Scottish prisoners than for hospital patients in NHS care appeared first on World Online.	https://wol.com/snp-spends-more-money-on-meals-for-scottish-prisoners-than-for-hospital-patients-in-nhs-care/	2025-01-02T06:01:12-08:00	
White House reacts to deadly New Orleans attack that killed at least 15	White House reacts to deadly New Orleans attack that killed at least 15 &#8211; CBS News Watch CBS News With The post White House reacts to deadly New Orleans attack that killed at least 15 appeared first on World Online.	https://wol.com/white-house-reacts-to-deadly-new-orleans-attack-that-killed-at-least-15/	2025-01-02T05:41:10-08:00	
Police raid Jeju Air offices after crash killed 179 people in South Korea; airline CEO banned from leaving country	South Korean police raided the offices of Jeju Air and the operator of Muan International Airport Thursday as they step up a The post Police raid Jeju Air offices after crash killed 179 people in South Korea; airline CEO banned from leaving country appeared first on World Online.	https://wol.com/police-raid-jeju-air-offices-after-crash-killed-179-people-in-south-korea-airline-ceo-banned-from-leaving-country/	2025-01-02T05:35:30-08:00	
TechRepublic Premium Editorial Calendar: Policies, Hiring Kits, and Glossaries for Download	1 Select your asset download type Please select the purchase download type below. I accept the TechRepublic Premium Terms of The post TechRepublic Premium Editorial Calendar: Policies, Hiring Kits, and Glossaries for Download appeared first on World Online.	https://wol.com/techrepublic-premium-editorial-calendar-policies-hiring-kits-and-glossaries-for-download/	2025-01-02T05:29:27-08:00	
Dhaka Capital 174/9 v Durbar Rajshahi 179/3 *	Dhaka Capital 174/9 v Durbar Rajshahi 179/3 * Source link The post Dhaka Capital 174/9 v Durbar Rajshahi 179/3 * appeared first on World Online.	https://wol.com/dhaka-capital-174-9-v-durbar-rajshahi-179-3/	2025-01-02T05:25:12-08:00	
Why Mike Johnson’s bid to remain House speaker could be a struggle despite Trump’s support	WASHINGTON — WASHINGTON (AP) — Mike Johnson is fighting for his political life, again. The Louisiana Republican's hold on the The post Why Mike Johnson's bid to remain House speaker could be a struggle despite Trump's support appeared first on World Online.	https://wol.com/why-mike-johnsons-bid-to-remain-house-speaker-could-be-a-struggle-despite-trumps-support/	2025-01-02T05:08:14-08:00	
Ohio updates election forms to support transgender candidates	Ohio Secretary of State Frank LaRose's (R) office has changed declaration forms to help prevent transgender candidates from being disqualified The post Ohio updates election forms to support transgender candidates appeared first on World Online.	https://wol.com/ohio-updates-election-forms-to-support-transgender-candidates/	2025-01-02T04:37:22-08:00	
Derrick Van Orden targets Chip Roy over speakership vote: ‘Chip is fighting to keep his brand marketable’	As House Speaker Mike Johnson aims to retain his role, Rep. Derrick Van Orden, R-Wisc., targeted fellow Republican Rep. Chip The post Derrick Van Orden targets Chip Roy over speakership vote: &#8216;Chip is fighting to keep his brand marketable' appeared first on World Online.	https://wol.com/derrick-van-orden-targets-chip-roy-over-speakership-vote-chip-is-fighting-to-keep-his-brand-marketable/	2025-01-02T04:06:09-08:00	
Rare gold coin worth thousands dropped into Salvation Army bucket by anonymous holiday donor	Join Fox News for access to this content You have reached your maximum number of articles. Log in or create The post Rare gold coin worth thousands dropped into Salvation Army bucket by anonymous holiday donor appeared first on World Online.	https://wol.com/rare-gold-coin-worth-thousands-dropped-into-salvation-army-bucket-by-anonymous-holiday-donor/	2025-01-02T03:42:24-08:00	
The 119th Congress begins tomorrow. Here’s what to know for the 2025 session.	Washington — The 119th Congress begins Friday with Republicans in full control of the House and Senate for the first The post The 119th Congress begins tomorrow. Here's what to know for the 2025 session. appeared first on World Online.	https://wol.com/the-119th-congress-begins-tomorrow-heres-what-to-know-for-the-2025-session/	2025-01-02T03:40:17-08:00	
New Year Offers Legacy Media a Chance for Redemption	New Year Offers Legacy Media a Chance for Redemption Source link The post New Year Offers Legacy Media a Chance for Redemption appeared first on World Online.	https://wol.com/new-year-offers-legacy-media-a-chance-for-redemption/	2025-01-02T03:35:20-08:00	
Progressives face an existential crisis under Trump	Progressives in Washington are facing an existential crisis like never before as they brace for the incoming Trump administration.&#160; Not The post Progressives face an existential crisis under Trump appeared first on World Online.	https://wol.com/progressives-face-an-existential-crisis-under-trump/	2025-01-02T03:04:21-08:00	
Employment rate surges under Modi regime, standing at 36%: Mansukh Mandaviya | India News	Union labour minister Dr. Mansukh Mandaviya announced on Thursday that India’s employment ratio has made a significant growth under Modi’s The post Employment rate surges under Modi regime, standing at 36%: Mansukh Mandaviya | India News appeared first on World Online.	https://wol.com/employment-rate-surges-under-modi-regime-standing-at-36-mansukh-mandaviya-india-news/	2025-01-02T02:55:12-08:00	
From Sydney to Paris and New York, world welcomes 2025 with fireworks and festivities	Revellers across the world watched spectacular firework displays as they welcomed 2025 and waved goodbye to a year marked by The post From Sydney to Paris and New York, world welcomes 2025 with fireworks and festivities appeared first on World Online.	https://wol.com/from-sydney-to-paris-and-new-york-world-welcomes-2025-with-fireworks-and-festivities/	2025-01-02T02:53:14-08:00	
New Syrian FM on first official visit to Saudi Arabia aims for regional reset	On his first official visit to Saudi Arabia since Bashar al-Assad's ouster, Syrian Foreign Minister Assaad al-Shibani said he hoped The post New Syrian FM on first official visit to Saudi Arabia aims for regional reset appeared first on World Online.	https://wol.com/new-syrian-fm-on-first-official-visit-to-saudi-arabia-aims-for-regional-reset/	2025-01-02T01:56:11-08:00	
New Orleans attack under investigation after driver slams into crowd, killing at least 15	New Orleans attack under investigation after driver slams into crowd, killing at least 15 &#8211; CBS News Watch CBS News The post New Orleans attack under investigation after driver slams into crowd, killing at least 15 appeared first on World Online.	https://wol.com/new-orleans-attack-under-investigation-after-driver-slams-into-crowd-killing-at-least-15/	2025-01-02T01:39:37-08:00	
Montenegro shooting spree sees gunman kill 12 people including 2 children before turning gun on himself	Podgorica, Montenegro — A gunman who started a shooting spree at a restaurant in southern Montenegro killed a total of The post Montenegro shooting spree sees gunman kill 12 people including 2 children before turning gun on himself appeared first on World Online.	https://wol.com/montenegro-shooting-spree-sees-gunman-kill-12-people-including-2-children-before-turning-gun-on-himself/	2025-01-02T01:33:10-08:00	
What to know about race for speaker of the House	The House of Representatives will soon vote for a speaker of the House to lead the chamber for the next The post What to know about race for speaker of the House appeared first on World Online.	https://wol.com/what-to-know-about-race-for-speaker-of-the-house/	2025-01-02T01:31:36-08:00	
Quordle today – my hints and answers for Thursday, January 2 (game #1074)	Quordle was one of the original Wordle alternatives and is still going strong now more than 1,000 games later. It The post Quordle today – my hints and answers for Thursday, January 2 (game #1074) appeared first on World Online.	https://wol.com/quordle-today-my-hints-and-answers-for-thursday-january-2-game-1074/	2025-01-02T01:27:45-08:00	
Aus vs India SCG Test Gautam Gambhir says ‘everything under control’ in the Indian team	India coach Gautam Gambhir was strong in saying he has -everything under control- in the dressing room but admitted he The post Aus vs India SCG Test Gautam Gambhir says &#8216;everything under control' in the Indian team appeared first on World Online.	https://wol.com/aus-vs-india-scg-test-gautam-gambhir-says-everything-under-control-in-the-indian-team/	2025-01-02T01:24:13-08:00	
Carter reflected on 1980 Olympic boycott: ‘A bad decision’	COLORADO SPRINGS, Colo. — It was a decision that robbed hundreds of athletes of their once-in-a-lifetime chance at Olympic glory, The post Carter reflected on 1980 Olympic boycott: ‘A bad decision’ appeared first on World Online.	https://wol.com/carter-reflected-on-1980-olympic-boycott-a-bad-decision/	2025-01-02T00:28:39-08:00	
Rudy Giuliani fights to save his Yankees World Series rings from $148 million verdict	NEW YORK — Ruth. Gehrig. DiMaggio. Mantle. Giuliani? As Rudy Giuliani’s life gets stripped for parts to satisfy a $148 The post Rudy Giuliani fights to save his Yankees World Series rings from $148 million verdict appeared first on World Online.	https://wol.com/rudy-giuliani-fights-to-save-his-yankees-world-series-rings-from-148-million-verdict/	2025-01-01T23:57:46-08:00	
Cybertruck explosion outside Trump Hotel in Las Vegas investigated as possible terror attack	Cybertruck explosion outside Trump Hotel in Las Vegas investigated as possible terror attack &#8211; CBS News Watch CBS News A The post Cybertruck explosion outside Trump Hotel in Las Vegas investigated as possible terror attack appeared first on World Online.	https://wol.com/cybertruck-explosion-outside-trump-hotel-in-las-vegas-investigated-as-possible-terror-attack/	2025-01-01T23:38:09-08:00	
1/1: CBS Evening News – CBS News	1/1: CBS Evening News &#8211; CBS News Watch CBS News New Orleans attack under investigation after driver slams into crowd, The post 1/1: CBS Evening News &#8211; CBS News appeared first on World Online.	https://wol.com/1-1-cbs-evening-news-cbs-news/	2025-01-01T23:31:23-08:00	
Biden giving second highest civilian award to leaders of Jan. 6 congressional panel	President Joe Biden is bestowing the second highest civilian medal on Liz Cheney and Bennie Thompson — the lawmakers who The post Biden giving second highest civilian award to leaders of Jan. 6 congressional panel appeared first on World Online.	https://wol.com/biden-giving-second-highest-civilian-award-to-leaders-of-jan-6-congressional-panel/	2025-01-01T23:26:22-08:00	
Biden to give Presidential Citizens Medal to January 6 panel leaders Cheney and Thompson	President Joe Biden is bestowing the second highest civilian medal on Liz Cheney and Bennie Thompson — the lawmakers who led The post Biden to give Presidential Citizens Medal to January 6 panel leaders Cheney and Thompson appeared first on World Online.	https://wol.com/biden-to-give-presidential-citizens-medal-to-january-6-panel-leaders-cheney-and-thompson/	2025-01-01T22:55:21-08:00	
Centre should restore statehood soon: Omar Abdullah	Jammu and Kashmir Chief Minister Omar Abdullah &#124; Photo Credit: ANI Chief Minister Omar Abdullah Thursday (January 2, 2025) expressed The post Centre should restore statehood soon: Omar Abdullah appeared first on World Online.	https://wol.com/centre-should-restore-statehood-soon-omar-abdullah/	2025-01-01T22:54:16-08:00	
World ushers in New Year with fireworks, light shows and music	From Sydney to Mumbai to Paris to Rio de Janeiro, communities around the world welcomed 2025 with spectacular light shows, The post World ushers in New Year with fireworks, light shows and music appeared first on World Online.	https://wol.com/world-ushers-in-new-year-with-fireworks-light-shows-and-music/	2025-01-01T22:52:12-08:00	
Minor Hotels to Open Anantara Resort Ubud Bali in October	Dark/Light Mode (27/08/24) Minor Hotels has confirmed that it will soon open the second Anantara resort in Bali, Indonesia. Located The post Minor Hotels to Open Anantara Resort Ubud Bali in October appeared first on World Online.	https://wol.com/minor-hotels-to-open-anantara-resort-ubud-bali-in-october/	2025-01-01T21:41:12-08:00	
Fireworks explosion in Hawaii kills at least 3 people, injures at least 20	A New Year's Eve fireworks explosion in a Honolulu-area neighborhood killed at least three people and critically injured at least 20 The post Fireworks explosion in Hawaii kills at least 3 people, injures at least 20 appeared first on World Online.	https://wol.com/fireworks-explosion-in-hawaii-kills-at-least-3-people-injures-at-least-20/	2025-01-01T21:37:14-08:00	
Driver runs down 2 New Zealand police officers, killing 1	A driver ran down two New Zealand police officers as they patrolled on foot in the early hours of New Year's Day, The post Driver runs down 2 New Zealand police officers, killing 1 appeared first on World Online.	https://wol.com/driver-runs-down-2-new-zealand-police-officers-killing-1/	2025-01-01T21:30:21-08:00	
Yes, Analog Phones Work Just Fine Over a VoIP Gateway	Thinking about switching to Voice over Internet Protocol (VoIP) so you can make calls over the internet instead of landlines? The post Yes, Analog Phones Work Just Fine Over a VoIP Gateway appeared first on World Online.	https://wol.com/yes-analog-phones-work-just-fine-over-a-voip-gateway/	2025-01-01T21:26:13-08:00	
Notre Dame vs. Georgia odds, line: 2025 College Football Playoff picks, Sugar Bowl prediction by proven model	The seventh-seeded Notre Dame Fighting Irish will battle the second-seeded Georgia Bulldogs in the College Football Playoff quarterfinals at the The post Notre Dame vs. Georgia odds, line: 2025 College Football Playoff picks, Sugar Bowl prediction by proven model appeared first on World Online.	https://wol.com/notre-dame-vs-georgia-odds-line-2025-college-football-playoff-picks-sugar-bowl-prediction-by-proven-model/	2025-01-01T21:23:35-08:00	
Victims of Bourbon Street attack in New Orleans include former Princeton football star, aspiring nurse, loving dad	At least 15 people were killed during a deadly attack on New Year's Day when a driver slammed into a crowd celebrating The post Victims of Bourbon Street attack in New Orleans include former Princeton football star, aspiring nurse, loving dad appeared first on World Online.	https://wol.com/victims-of-bourbon-street-attack-in-new-orleans-include-former-princeton-football-star-aspiring-nurse-loving-dad/	2025-01-01T19:36:28-08:00	
Digital divide: Working computers in just 57% of India’s schools, internet in 54% | India News	India's school infrastructure presents a mixed picture of progress and persistent challenges, as highlighted in the Unified District Information System The post Digital divide: Working computers in just 57% of India's schools, internet in 54% | India News appeared first on World Online.	https://wol.com/digital-divide-working-computers-in-just-57-of-indias-schools-internet-in-54-india-news/	2025-01-01T18:53:18-08:00	
Milan prohibits all outdoor smoking in Italy's toughest ban to date	Milan enforces Italy's strictest smoking ban, fining individuals 40 to 240 euros for smoking on city streets or crowded public The post Milan prohibits all outdoor smoking in Italy's toughest ban to date appeared first on World Online.	https://wol.com/milan-prohibits-all-outdoor-smoking-in-italys-toughest-ban-to-date/	2025-01-01T18:51:24-08:00	
The Speaker’s Lobby: The Hitchhiker’s Guide to Electing a House Speaker	Join Fox News for access to this content You have reached your maximum number of articles. Log in or create The post The Speaker’s Lobby: The Hitchhiker’s Guide to Electing a House Speaker appeared first on World Online.	https://wol.com/the-speakers-lobby-the-hitchhikers-guide-to-electing-a-house-speaker/	2025-01-01T18:16:29-08:00	
What can we learn about avian flu as more details released of B.C. teen’s case?	While it may never be known if the B.C. teenager hospitalized with a severe case of avian influenza, H5n1, will The post What can we learn about avian flu as more details released of B.C. teen’s case? appeared first on World Online.	https://wol.com/what-can-we-learn-about-avian-flu-as-more-details-released-of-b-c-teens-case/	2025-01-01T18:00:34-08:00	
CBS News reporter’s firsthand account of deadly New Orleans attack	CBS News reporter's firsthand account of deadly New Orleans attack &#8211; CBS News Watch CBS News CBS News national reporter The post CBS News reporter's firsthand account of deadly New Orleans attack appeared first on World Online.	https://wol.com/cbs-news-reporters-firsthand-account-of-deadly-new-orleans-attack/	2025-01-01T17:35:36-08:00	
Russian man arrested for allegedly running travel agency for gay customers found dead in custody in Moscow	Putin crackdown widening after Navalny death Putin crackdown widens, Russian-American arrested and charged with treason 04:11 A Russian man arrested The post Russian man arrested for allegedly running travel agency for gay customers found dead in custody in Moscow appeared first on World Online.	https://wol.com/russian-man-arrested-for-allegedly-running-travel-agency-for-gay-customers-found-dead-in-custody-in-moscow/	2025-01-01T17:28:49-08:00	
Suspected people smugglers face travel bans and social media curbs under tightened laws | Politics News	Suspected people smugglers face travel bans and restrictions on their mobile phone and social media use under new government proposals. The post Suspected people smugglers face travel bans and social media curbs under tightened laws | Politics News appeared first on World Online.	https://wol.com/suspected-people-smugglers-face-travel-bans-and-social-media-curbs-under-tightened-laws-politics-news/	2025-01-01T17:26:14-08:00	
NYT Connections today — my hints and answers for Thursday, January 2 (game #571)	Good morning! Let's play Connections, the NYT's clever word game that challenges you to group answers in various categories. It The post NYT Connections today — my hints and answers for Thursday, January 2 (game #571) appeared first on World Online.	https://wol.com/nyt-connections-today-my-hints-and-answers-for-thursday-january-2-game-571/	2025-01-01T17:25:11-08:00	
Saints’ Rizzi says all members of team safe following attack	Katherine Terrell, ESPN Staff WriterJan 1, 2025, 07:43 PM ET Close Katherine Terrell came back to ESPN to cover the The post Saints' Rizzi says all members of team safe following attack appeared first on World Online.	https://wol.com/saints-rizzi-says-all-members-of-team-safe-following-attack/	2025-01-01T17:22:09-08:00	
Trump to hold DC rally day before inauguration	President-elect Trump will hold a rally in Washington the day before he is set to be inaugurated for a second The post Trump to hold DC rally day before inauguration appeared first on World Online.	https://wol.com/trump-to-hold-dc-rally-day-before-inauguration/	2025-01-01T16:12:43-08:00	
Palestinian Authority takes Al Jazeera off air after coverage of Jenin clashes	The Palestinian Authority on Wednesday suspended Al Jazeera broadcasts across the Palestinian territories, accusing the Qatar-based channel of -interference- in The post Palestinian Authority takes Al Jazeera off air after coverage of Jenin clashes appeared first on World Online.	https://wol.com/palestinian-authority-takes-al-jazeera-off-air-after-coverage-of-jenin-clashes/	2025-01-01T15:54:10-08:00	
New Year’s Eve storm could make Northern Lights visible in US as Americans ring in 2025	For the last time before the New Year, the stunning colors of the aurora borealis might be visible for those The post New Year's Eve storm could make Northern Lights visible in US as Americans ring in 2025 appeared first on World Online.	https://wol.com/new-years-eve-storm-could-make-northern-lights-visible-in-us-as-americans-ring-in-2025/	2025-01-01T15:40:28-08:00	
