Title	Description	Link	pubDate	Image
Israeli fighter jets hit 1,600 Hezbollah terror targets in Lebano...	The IDF instructed civilians to move away from homes where Hezbollah has stored munitions. By Joshua Marks, JNS The Israeli Air Force struck over 1,600 Hezbollah targets in Southern Lebanon and the Bekaa Valley over the past 24 hours as part of 'Operation Northern Arrows,' according to the Israeli military. Among the targets hit was a terror cell that launched 20 rockets in three barrages at the Afula and HaAmakim areas in northern Israel overnight Monday. The launchers used in those attacks were also destroyed. Also overnight, Israel Defense Forces artillery and tanks struck additional Hezbollah targets in the area of Ayta ash Shab and Ramyeh in Southern Lebanon. The overnight strikes came after Monday’s massive Israeli aerial offensive, during which fighter jets hit rocket launchers, command posts and structures, including civilian residences, used by Hezbollah to store munitions. According to the Lebanese Health Ministry, 558 people were killed and 1,835 were wounded in the Israeli attacks. The ministry’s figures did not distinguish between combatants and noncombatants. Thousands of Lebanese have evacuated from the south as Israel’s offensive against Hezbollah terror targets intensifies after the IDF instructed civilians to move away from homes where Hezbollah has stored munitions. In addition to Southern Lebanon, the IAF continued striking Hezbollah terror targets in the Bekaa Valley deep inside Lebanese territory on Tuesday morning. Hezbollah continued to launch rocket attacks on Tuesday, firing more than 100 rockets at northern Israel and causing multiple injuries, including a 25-year-old man moderately wounded by shrapnel during a barrage towards the Mount Carmel area. Sirens sounded in the northern Israeli coastal city of Nahariya and surrounding areas. Two rockets from Lebanon fell into the sea, according to the IDF. There were no injuries or damage. Rocket alerts were also heard in communities in the Galilee region and near the large port city of Haifa. Rocket fire was reported in Afula and Nazareth. A 58-year-old woman was lightly injured by shrapnel in the Druze village of Yarka in the Western Galilee, according to the Magen David Adom emergency service. She was transported to the Galilee Medical Center in Nahariya along with a 61-year-old man suffering from anxiety. They were both sitting in a car. MDA teams were also treating several people injured on their way to shelters and additional anxiety cases. Also, a supermarket was reportedly damaged by shrapnel in the Arab town of Tamra in the Lower Galilee and several fires were reported following a heavy barrage in the area of Kiryat Shmona, including blazes at municipal warehouses. The evacuated border town has been continuously targeted over the past year. Sirens were also activated in Tel Hai, Kfar Giladi, Metula, and other towns in the region. Since Friday, Hezbollah has launched hundreds of rockets at Israel, forcing over a million people to run to bomb shelters. On Monday, Iran’s Lebanese terror proxy fired deeper into Israeli territory than it had since joining the war in support of Hamas on Oct. 8, including at Haifa and northern Samaria. Hezbollah has fired more than 8,800 rockets, missiles and unmanned aerial vehicles (UAVs) toward Israel since Oct. 8. The strikes have forced over 60,000 Israelis to evacuate from northern communities, severely impacting daily life in the region. Jerusalem has ramped up its rhetoric and escalated attacks on Hezbollah since recently adding the return of residents to the north as an official war goal. The government on Monday evening approved the declaration of a 'special emergency situation' countrywide, granting authorities more powers to ensure the safety of the civilian population. The declaration will expire after 48 hours unless extended by Cabinet ministers. There were no specific changes to the Home Front Command instructions for areas of Israel outside of the northern region. However, there were changes to some border area communities, with no in-person educational activities in the Megido area, Yokneam Illit, Daliyat al-Karmel and Isfiya. The IDF Home Front Command had already cancelled school for communities from Haifa northwards. Meanwhile, foreign airlines continue to suspend flights to and from Ben Gurion Airport. Wizz Air, British Airways and Azerbaijan Airlines canceled flights on Tuesday. The Lufthansa Group, which includes Lufthansa Airlines, SWISS, Austrian Airlines, Brussels Airlines and Eurowings, announced on Monday that it was extending its suspension of flights to Ben Gurion Airport until Oct. 14. On Monday night, the IDF provided video and photographic documentation of how Hezbollah stores munitions inside the homes of civilians in Southern Lebanon, including images of a long-range missile on a hydraulic system in the attic of a home in the village of Houmine al-Tahta. 'It is ready to launch from an opening in the roof. Under the attic, on the first floor, a Lebanese family lives, serving as a human shield,' IDF Spokesman Rear Adm. Daniel Hagari said in a press conference. 'This is an immediate and real threat to Israeli civilians, and we have an obligation to remove it,' he added. Also, the IDF released video footage of an airstrike against a Lebanese home where Hezbollah had stored munitions. The video shows a rocket flying out of the building after the strike and hitting an adjacent house. The post Israeli fighter jets hit 1,600 Hezbollah terror targets in Lebanon in 24 hours appeared first on World Israel News.	https://worldisraelnews.com/israeli-fighter-jets-hit-1600-hezbollah-terror-targets-in-lebanon-in-24-hours/	2024-09-24T13:15:21-07:00	https://worldisraelnews.com/wp-content/uploads/2024/06/airstrikes-in-Lebanon.jpg
‘I know Matan is alive with 10 others underground,’ hostage’s mot...	Einav Zangauker: 'In my opinion, there are no more than 30 to 35 hostages still alive.' By Vered Weiss, World Israel News Einav Zangauker, the mother of hostage Matan Zangauker, said in an interview with Reshet Bet on Tuesday morning that she believes her son is alive and is being held underground with ten other hostages. Zangauker said she receives regular updates, and according to the most recent one, she concludes her son is still alive and is confined underground, most likely in Gaza's extensive tunnels. 'I know that Matan is held with less than 10 other hostages that are also alive, and the fear is great,' she said in the interview. She continued, 'Therefore, it is an urgent task to save those still alive.' Zangauker also said it is imperative to bring the bodies of the fallen soldiers and slain hostages back to Israel so their families can have closure. She expressed concern that with the conflict escalating in the north, the hostages and their families will be forgotten. Acknowledging there are no easy answers, she said, 'We as hostage families would like to see a diplomatic solution to the conflict on the northern front so we can focus on returning the hostages.' Then again, she added that Israelis in the north can't be expected to tolerate constant attacks without a strong military response. Zangauker expressed skepticism concerning Israeli Prime Minister's comments earlier in the week that 50 of the 97 hostage held in Gaza are still alive. She told Army radio Monday, 'The prime minister is lying. We know, the families, that the number is far smaller than the number cited by the prime minister.' She added that the families of hostages receive intelligence and updates from the military and this information, she concludes that 'in my opinion, there are no more than 30 to 35 hostage still alive.' 'There are no [significant] contacts between the Israeli team and the mediators,' she said, and 'Hamas is not involved.' The Americans, preoccupied with the upcoming elections, basically 'given up' their efforts, at least for the time being. The post 'I know Matan is alive with 10 others underground,' hostage's mother says appeared first on World Israel News.	https://worldisraelnews.com/i-know-matan-is-alive-with-10-others-underground-hostages-mother-says/	2024-09-24T12:55:12-07:00	https://worldisraelnews.com/wp-content/uploads/2024/07/matan-hostage.jpg
Beirut strike: IDF kills head of Hezbollah’s missile array	The top terrorist also planned the October 2000 kidnapping of IDF Staff Sgts. Benny Avraham, Adi Avitan and Omar Souad from the Mount Dov border area. By Akiva Van Koningsveld, JNS The Israel Defense Forces on Tuesday afternoon carried out a second precision strike in Beirut’s Dahiyeh district in as many days, killing Ibrahim Qubaisi, who heads Hezbollah’s missile and rocket array. The strike came less than 24 hours after the attempted assassination of Hezbollah’s No. 3 terrorist commander, Ali Karaki, in the same area. Qubaisi joined Hezbollah in the 1980s and held a series of key positions in the terror organization, according to the IDF. As part of his role, he 'was responsible for the planning and execution of many terrorist actions against the IDF forces and Israeli citizens,' the army said. 'Qubaisi commanded Hezbollah’s various missile units, including the precision missile units. Over the years and during the [current] war, he was responsible for launches towards the Israeli home front. Qubaisi was a central source of knowledge in the field of missiles and was close to the senior military leadership of Hezbollah,' the IDF continued. The top terrorist also planned the October 2000 kidnapping of IDF Staff Sgts. Benny Avraham, Adi Avitan and Omar Souad from the Mount Dov border area. The soldiers were killed by their captors either during or shortly after their abduction, and their remains were only returned to Israel four years later as part of a terrorist release deal with Hezbollah. According to the Israeli military, Qubaisi was surrounded by 'other key commanders in Hezbollah’s missile and rocket array' when the attack was launched. At least five other people were killed and several more were injured in the airstrike, according to initial Lebanese reports. ברייקינג: צה'ל תקף באופן ממוקד ברובע הדחייה בביירות pic.twitter.com/jke51sMFfx &mdash; איתי בלומנטל Itay Blumental (@ItayBlumental) September 24, 2024 Aftermath of strike in BEIRUT pic.twitter.com/NRArOU6oZJ &mdash; Open Source Intel (@Osint613) September 24, 2024 Following the strike in Beirut, Hezbollah launched a massive rocket barrage at Israel’s north, triggering air-raid sirens, including in the Upper Galilee city of Safed. No injuries were reported in the attacks. Israel’s Channel 12 said that more than 100 projectiles were launched at the Jewish state within one hour, with the Golan Regional Council telling residents to stay near bomb shelters and avoid public gatherings. 𝗜𝗦𝗥𝗔𝗘𝗟 𝗨𝗡𝗗𝗘𝗥 𝗔𝗧𝗧𝗔𝗖𝗞 | Israeli media describing the sky over Safed as 'total madness' right now pic.twitter.com/smTV6IxJhc &mdash; Jewish News Syndicate (@JNS_org) September 24, 2024 Tuesday’s aerial attack marked the fifth time that the Israeli army struck the Lebanese capital since Hezbollah joined the war against the Jewish state in support of Palestinian Hamas in the wake of the Oct. 7 massacre. On Monday night, Israeli Air Force jets targeted Karaki, Hezbollah’s highest-ranking remaining commander following Friday’s targeted killing of Ibrahim Aqil. Karaki commands Hezbollah’s southern front, which is responsible for the terror army’s cross-border attacks on Israel. In an official statement issued three hours after the strike, Hezbollah claimed that the top terrorist was still alive and 'moved to a safe place.' Unnamed Israeli officials told Israel Hayom on Tuesday that Karaki survived the strike, saying that the use of smaller bombs with the goal of minimizing civilian casualties contributed to the operation’s failure. On Friday, the IDF took credit for a targeted airstrike in the Dahiyeh neighborhood that killed more than a dozen senior Hezbollah terrorist officials, including Aqil, who was also wanted by the United States over his involvement in the 1983 bombing of the U.S. embassy in Beirut. On July 30, Israeli Air Force fighter jets carried out a targeted killing in south Beirut of Hezbollah’s No. 2 'military' commander, Fuad Shukr. Hezbollah has attacked Israel nearly daily since Oct. 8, 2023, firing thousands of rockets, missiles and drones. The attacks have killed more than 40 people and caused widespread damage. Tens of thousands of Israeli civilians remain internally displaced due to the violence. Throughout the day on Tuesday, the Israeli Air Force struck over 1,600 Hezbollah terror targets in Southern Lebanon and the Bekaa Valley as part of 'Operation Northern Arrows,' according to the Israeli military. Jerusalem has escalated attacks on Hezbollah since adding the return of evacuated Israeli civilians to the north as an official war goal on Sept. 17. The post Beirut strike: IDF kills head of Hezbollah’s missile array appeared first on World Israel News.	https://worldisraelnews.com/beirut-strike-idf-kills-head-of-hezbollahs-missile-array/	2024-09-24T10:27:23-07:00	https://worldisraelnews.com/wp-content/uploads/2024/09/beirut-strike.jpg
Biden not giving up on Gaza ceasefire, hostages, White House says	Biden will huddle with world leaders gathered in New York to work on a ceasefire and hostage deal in Gaza. By The Algemeiner and Reuters US President Joe Biden is determined to bring about a Gaza ceasefire and hostage deal with Hamas while also seeking to de-escalate tensions on Israel’s border with Lebanon, White House national security adviser Jake Sullivan said on Tuesday. 'He absolutely hasn’t given up,' Sullivan said in an interview with MSNBC hours before Biden addresses the UN General Assembly for the last time as president. Biden will huddle with world leaders gathered in New York to work on a ceasefire and hostage deal in Gaza and avert an all-out war in the Middle East, Sullivan said. He acknowledged challenges in getting both Israeli Prime Minister Benjamin Netanyahu and Hamas leader Yahya Sinwar across the line and said Hamas and Sinwar in particular 'don’t want to do a deal.' 'But we’re determined to keep at it,' Sullivan said. The United States has worked to contain tensions in the region since Hamas’s Oct. 7 massacre across southern Israel in which the Palestinian terror group murdered 1,200 people and kidnapped 251 hostages. Israel responded with an ongoing military campaign in neighboring Hamas-ruled Gaza aimed at freeing the hostages and dismantling Hamas’s military and governing capabilities. The simmering conflict with Hezbollah at Israel’s northern border has spiked on and off since Oct. 7 and it is spiking now, he said. 'But we have averted it in those previous spikes, and I believe that we can still find a path forward to get de-escalation between Israel and across that northern border between Israel and Lebanon and bring about a diplomatic solution that allows people to return to their home,' Sullivan said. The post Biden not giving up on Gaza ceasefire, hostages, White House says appeared first on World Israel News.	https://worldisraelnews.com/biden-not-giving-up-on-gaza-ceasefire-hostages-white-house-says/	2024-09-24T10:14:21-07:00	https://worldisraelnews.com/wp-content/uploads/2024/09/biden-admin-UN.jpg
Voters agree: Calling Trump a ‘threat to democracy’ prompts polit...	The poll found that even over a third of 'liberal' respondents agreed that calling Trump a 'threat to democracy' led to the attempts on his life. By Blake Mauro, The Washington Free Beacon The majority of voters agree that 'irresponsible rhetoric,' such as calling a political adversary a 'threat to democracy,' has led to the recent assassination attempts on former president Donald Trump. The poll, conducted by the Senate Opportunity Fund, found that 57 percent of voters somewhat or strongly agree that 'labeling a political opponent a threat to democracy is irresponsible rhetoric which leads to political violence, like assassination attempts.' The poll comes just a week after authorities arrested the suspect in the second attempt on Trump's life in less than two months. Republicans, including Trump, have blamed the multiple assassination attempts against the former president on Democrats' claims that Trump is a 'threat to democracy.' Most voters align with Republicans' views on the issue, the poll found. The poll found that even over a third of 'liberal' respondents agreed that calling Trump a 'threat to democracy' led to the attempts on his life. Half of 'moderate' voters and 79 percent of 'conservative' respondents agreed this kind of language leads to political violence. The most recent would-be assassin, Ryan Wesley Routh, often reiterated Democrats' claim that Trump is an 'existential threat' to American 'democracy.' 'Democracy is on the ballot' this year, and 'we cannot lose,' Routh posted on social media, echoing the anti-Trump rhetoric used by Vice President Kamala Harris and President Joe Biden. On Sept. 15, Routh pushed the muzzle of an AK-47 through the perimeter of Trump's West Palm Beach golf course in Florida, hoping to take the former president's life. Before he got a shot off, a Secret Service agent saw Routh's barrel and fired multiple shots, forcing Routh to flee the course. He was soon arrested. Democrats and the mainstream media, however, have not only downplayed Routh's assassination attempt but also blamed Trump for inciting violence against himself. Former Democratic National Committee chairwoman Donna Brazile, for example, authored a piece in The Hill titled 'Trump's Rhetoric Has Caused Violence, Not Democrats Calling Him a Threat to Democracy,' while ABC News published the headline 'Trump Blames Democrats for Heated Environment Despite His Own Inflammatory Rhetoric.' Even after two assassination attempts on Trump, Democrats have continued to call their chief political opponent a 'threat to democracy.' Just one day after the second assassination attempt, former secretary of state Hillary Clinton told MSNBC that Trump is a 'danger to our country and the world.' Similarly, on Monday morning, MSNBC host Joe Scarborough said that Trump was absolutely a 'threat to democracy.' The first attempt on Trump's life was on July 13 at a Pennsylvania rally. The gunman, Thomas Matthew Crooks, killed one attendee and wounded three others, including Trump, before being killed by a Secret Service counter-sniper. The post Voters agree: Calling Trump a 'threat to democracy' prompts political violence appeared first on World Israel News.	https://worldisraelnews.com/voters-agree-calling-trump-a-threat-to-democracy-prompts-political-violence/	2024-09-24T10:05:39-07:00	https://worldisraelnews.com/wp-content/uploads/2024/07/trump-assassination-attempt.jpg
Police break up Hamas money-laundering ring in Jerusalem	During the raid, law enforcement confiscated over 200,000 shekels in cash, checks worth one million shekels, and various electronics. By Pesach Benson, TPS Israeli authorities arrested five suspected Hamas operatives on the outskirts of Jerusalem in an operation targeting individuals involved in financing and laundering funds for the terror group, the Israeli Police said on Tuesday. The primary suspect, believed to be a key figure in Hamas, was arrested in the Shuafat refugee camp in eastern Jerusalem. Authorities allege that the suspect and others have been using a chain of supermarkets in the Shuafat and Anata refugee camps to funnel money into Hamas’s activities. During the raid, law enforcement confiscated over 200,000 shekels ($53,000) in cash, checks worth one million shekels ($265,000), numerous cell phones, documents, DVRs, construction plans, tablets, and computer drives, along with several bags of business receipts linked to the laundering of terrorist funds. All five suspects, along with the seized materials, have been handed over to the Jerusalem Police and the Tax Authority for further investigation. Since October 7, Israel has arrested around 5,261 Palestinian terror suspects in Judea and Samaria, of whom 2,070 of whom are associated with Hamas. The post Police break up Hamas money-laundering ring in Jerusalem appeared first on World Israel News.	https://worldisraelnews.com/police-break-up-hamas-money-laundering-ring-in-jerusalem/	2024-09-24T09:44:24-07:00	https://worldisraelnews.com/wp-content/uploads/2022/07/509f9f23-3e0a-4722-b7a7-35f228a4e938.jpg
In General Assembly speech, UN head takes shots at Israel	The U.N. head also questioned how the world could 'accept a one-state future that includes such a large number of Palestinians without any freedom, rights or dignity?' By Mike Wagenheim, JNS António Guterres, secretary-general of the United Nations, opened the U.N. General Assembly’s high-level debate week by repeatedly criticizing the Jewish state. Complaining of a 'world of impunity,' Guterres assessed that 'a growing number of governments and others feel entitled to a ‘get out of jail free’ card.' 'They can trample international law. They can violate the United Nations charter,' he said on Tuesday. 'They can turn a blind eye to international human rights conventions or the decisions of international courts.' 'We see this age of impunity everywhere,' including in the Middle East, Guterres added. The secretary-general, who is largely persona non grata to Israeli diplomats due to what pro-Israel critics largely view as his justification of the Hamas’s terrorist attacks, murder and atrocities in southern Israel on Oct. 7 and his repeated critiques of Israeli military operations in response to attacks from Hamas, Hezbollah and others. He has said that Hamas’s attack didn’t occur 'in a vacuum.' Guterres said that Gaza 'is a nonstop nightmare that threatens to take the entire region with it,' adding, 'look no further than Lebanon. We must do everything in our power to prevent Lebanon from becoming another Gaza.' 'Nothing can justify the collective punishment of the Palestinian people. The speed and scale of the killing and destruction in Gaza are unlike anything in my years as secretary-general,' he added. 'More than 200 of our own staff have been killed, many with their families.' The U.N. head did not mention that internationally-designated terror groups control both Lebanon and Gaza, and that those groups attacked Israel, launching the nearly year-long conflict in the region. 'Nothing can justify the abhorrent acts of terror committed by Hamas on Oct. 7 or the taking of hostages—both of which I have repeatedly condemned,' Guterres said. Guterres called on the international community to 'mobilize for an immediate ceasefire, the immediate and unconditional release of all hostages and the beginning of an irreversible process towards a two-state solution.' 'For those who go on undermining that goal with more settlements, more land grabs, more incitement—I ask: What is the alternative?' he said on Tuesday. The U.N. head also questioned how the world could 'accept a one-state future that includes such a large number of Palestinians without any freedom, rights or dignity?' In his speech, Guterres did not mention Israeli security concerns. The post In General Assembly speech, UN head takes shots at Israel appeared first on World Israel News.	https://worldisraelnews.com/in-general-assembly-speech-un-head-takes-shots-at-israel/	2024-09-24T09:37:02-07:00	https://worldisraelnews.com/wp-content/uploads/2024/09/shutterstock_2375040059-scaled.jpg
