Title	Description	Link	pubDate	Image
Number of Hezbollah terrorists killed or wounded by beepers likel...	The estimation is that there are many dozens of dead, if not more.' By Vered Weiss, World Israel News Although the official number indicates that a dozen Hezbollah terrorists have been killed over the last two days by exploding pagers, it is most likely higher than what has been reported. Ronen Bergman, who writes for the New York Times and Yediot Ahronoth, says the number of people killed by the beeper explosions is higher than the reported 12 yesterday and 14 today. 'The estimation is that there are many dozens of dead, if not more,' he said. In addition, the mission caused massive damage to Hezbollah's Radwan unit, which has lost much of its leadership. Israel has not commented on the deadly explosions, which are widely attributed to Israel. The offensive on Tuesday involved the spontaneous explosion of thousands of beepers used by Hezbollah terrorists, wounding thousands and killing over a dozen, according to reports. Additional injuries and deaths occurred on Wednesday in Lebanon and in Syria, where 19 IRGC terrorists were killed and 150 were injured. A former commander of British military forces in Afghanistan, Colonel Richard Kemp, praised the beeper offensive against Hezbollah as 'precise and discriminatory' and effective at weakening the morale and capacity of the Lebanese terror group. Israel’s outsmarting them with this terror attack has led to Hezbollah’s 'demoralization.' Kemp also praised the mission because it effectively targeted only terrorists and limited civilian casualties. 'It’s hard to think of a more precise and discriminating method of attack than detonating pagers known to be specifically assigned to individual terrorists, using devices that limit the potential for collateral damage.' He added that the exploding beepers were intended only for terrorists who are 'legitimate and lawful targets for attack as Israel seeks to defend its citizens from violent aggression,' he said. Kemp added that three distinctive characteristics of the mission made it particularly effective. First, the mission resulted in extensive damage to Hezbollah, second it engendered anxiety in Hezbollah members and may discourage others from joining and third, it has humiliated Hezbollah on the world stage. The post Number of Hezbollah terrorists killed or wounded by beepers likely higher than official reports appeared first on World Israel News.	https://worldisraelnews.com/number-of-hezbollah-terrorists-killed-or-wounded-by-beepers-higher-than-official-reports/	2024-09-18T15:08:10-07:00	https://worldisraelnews.com/wp-content/uploads/2024/09/Hazbollah-pager-explosion.png
Former commander calls beeper offensive against Hezbollah ‘precis...	Exploding beepers were intended only for terrorists who are 'legitimate and lawful targets for attack as Israel seeks to defend its citizens from violent aggression.' By Vered Weiss, World Israel News The former commander of British military forces in Afghanistan, Colonel Richard Kemp, praised the beeper offensive against Hezbollah as 'precise and discriminatory' and effective at weakening the morale and capacity of the Lebanese terror group. The offensive on Tuesday involved the spontaneous explosion of thousands of beepers used by Hezbollah terrorists, wounding thousands and killing over a dozen. Additional injuries and deaths occurred on Wednesday in Lebanon and in Syria, where 19 IRGC terrorists were killed and 150 were injured. Kemp told Israel National News that three salient factors make the beeper mission uniquely effective. 'First, it will have done immense damage to the terrorist organization, taking a large number of its fighters and leaders out in one go. Plus, of course, it severely undermines their communications capability,' Kemp said. He added, 'Second, it will have intimidated Hezbollah, potentially frightening some members into leaving the group or scaring off recruits from joining.' Kemp explained, 'The psychological impact will be enormous, with every Hezbollah terrorist now fearing that almost everything he owns or touches, including cars, guns, laptops, radios, and other electrical items, could potentially be weaponized against them.' He added the constant anxiety Hezbollah members may feel now is a 'far cry from the supposed glory of battlefield martyrdom they were promised.' In addition, Hezbollah may retreat from the notion of a full-scale offensive against Israel since now they realize their terror group operations and technology have been infiltrated. 'Third, it has humiliated Hezbollah, a terrorist organization that struts its power on the world stage, presenting itself as one of the strongest armies in the Middle East.' Israel's outsmarting them with this terror attack has led to Hezbollah's 'demoralization.' Kemp also praised the mission because it effectively targeted only terrorists and limited civilian casualties. 'It’s hard to think of a more precise and discriminating method of attack than detonating pagers known to be specifically assigned to individual terrorists, using devices that limit the potential for collateral damage.' He added that the exploding beepers were intended only for terrorists who are 'legitimate and lawful targets for attack as Israel seeks to defend its citizens from violent aggression,' he said. The post Former commander calls beeper offensive against Hezbollah 'precise and discriminating' appeared first on World Israel News.	https://worldisraelnews.com/former-commander-calls-beeper-offensive-against-hezbollah-precise-and-discriminating/	2024-09-18T13:40:26-07:00	https://worldisraelnews.com/wp-content/uploads/2022/06/Richard-Kemp-at-United-Nations.v1-1.jpg
UN bans Israel’s right to self-defense, calls for removal of Jews...	Only 14 countries, including the United States, joined Israel in opposing the resolution. By Mike Wagenheim, JNS Jerusalem’s Old City and Jude and Samaria must be judenrein within a year, according to a Palestinian-drafted resolution, which the U.N. General Assembly passed on Wednesday. The resolution, which passed by a 124-14 margin with 43 abstentions, is meant to give force to a July advisory opinion by the International Court of Justice, which declared Israeli presence to be illegal in any area over the 1949 armistice line. More than 40 countries sponsored the resolution, which was the first that Palestinians filed after being granted unprecedented privileges, for a non-U.N. member, earlier this year. The resolution calls on the Israel Defense Forces to withdraw completely from Judea and Samaria, eastern Jerusalem and Gaza within 12 months, which means evacuating all Jewish communities beyond the armistice line, including Jerusalem’s Old City. It also bans arms sales to the IDF of any equipment that would be expected reasonably to be used in the territory over the 1949 lines and calls for a boycott of all products produced by Jews in those areas. The resolution text lacks any mention of Israeli security concerns, historic ties to the lands or Hamas’s terror attacks in Israel on Oct. 7. The vote came after a day of debate on Tuesday. Argentina, Czechia, Fiji, Hungary, Malawi, Micronesia, Nauru, Palau, Papua New Guinea, Paraguay, Tonga, Tuvalu and the United States joined Israel in opposing the resolution. Notably, Germany, the United Kingdom, Canada, Italy, Ukraine and Australia were among those who abstained. General Assembly resolutions have no legal force, but the resolution’s passage on Wednesday is expected to be used in international courts and other fora to seek additional action against the Jewish state. It is widely expected that the Palestinians will request that the U.N. Security Council take up the issue. Security Council resolutions are binding, but the United States would be expected to thwart such an effort, including with its veto power. ‘Further fuel on worldwide antisemitism’ Danny Danon, Israel’s ambassador to the United Nations, called it 'a shameful decision that backs the Palestinian Authority’s diplomatic terrorism.' He added that the General Assembly 'continues to dance to the music of the Palestinian Authority, which backs the Hamas murderers.' Before the vote, U.N. Secretary-General António Guterres told reporters he would back the implementation of the resolution should it pass. Seth Riklin and Daniel Mariaschin, president and CEO respectively of B’nai B’rith International, said that the international nonprofit is 'appalled' by the 'atrocious' resolution. 'B’nai B’rith International strongly condemns the U.N. General Assembly’s passage of the first resolution officially sponsored by Palestinians days after they became the first non-member state group further upgraded to many member state privileges at the U.N. General Assembly, despite the world body’s own rules and practices,' the duo stated. 'Coming from an assembly in which Arab and other pro-Palestinian governments wield an automatic majority to annually condemn Israel more than all other countries combined, the motion is unprecedented in its shamelessly one-sided endorsement of Palestinian claims and political demands, and further erodes the U.N.’s credibility as a serious contributor to promoting conflict-resolution and universal human rights,' they added. 'Shame on all countries that enabled this atrocious affront to justice and peace as part of the latest UNGA ’emergency session’ on the Middle East that does nothing to help seriously address and settle the emergency,' Riklin and Mariaschin said. Arsen Ostrovsky and Nadav Steinman, CEO and board chair respectively of the International Legal Forum, stated that 'today, simply put, the United Nations has become the diplomatic arm of Hamas' and that the resolution 'is just the latest in a litany of obscenely one-sided anti-Israel resolutions at the U.N. since Oct. 7.' 'All it does is reward the murderers, rapists and abductors of Hamas while pouring further fuel on worldwide antisemitism and eroding whatever remaining credibility of the already problematic and politicized International Court of Justice, upon which this resolution is meant to be based,' they added. 'Ultimately, peace will only prevail when Hamas is defeated and the hostages are released, not through tiresome antics and pyrrhic Palestinian ‘victories’ at the U.N.' The post UN bans Israel's right to self-defense, calls for removal of Jews from Jerusalem's Old City appeared first on World Israel News.	https://worldisraelnews.com/un-bans-israels-right-to-self-defense-calls-for-removal-of-jews-from-jerusalems-old-city/	2024-09-18T11:03:50-07:00	https://worldisraelnews.com/wp-content/uploads/2024/09/UN-vote.jpg
UN General Assembly passes resolution calling for Jerusalem Old C...	Argentina, Czechia, Fiji, Hungary, Malawi, Micronesia, Nauru, Palau, Papua New Guinea, Paraguay, Tonga, Tuvalu and the United States joined Israel in opposing the resolution. By Mike Wagenheim, JNS Jerusalem’s Old City and Jude and Samaria must be judenrein within a year, according to a Palestinian-drafted resolution, which the U.N. General Assembly passed on Wednesday. The resolution, which passed by a 124-14 margin with 43 abstentions, is meant to give force to a July advisory opinion by the International Court of Justice, which declared Israeli presence to be illegal in any area over the 1949 armistice line. More than 40 countries sponsored the resolution, which was the first that Palestinians filed after being granted unprecedented privileges, for a non-U.N. member, earlier this year. The resolution calls on the Israel Defense Forces to withdraw completely from Judea and Samaria, eastern Jerusalem and Gaza within 12 months, which means evacuating all Jewish communities beyond the armistice line, including Jerusalem’s Old City. It also bans arms sales to the IDF of any equipment that would be expected reasonably to be used in the territory over the 1949 lines and calls for a boycott of all products produced by Jews in those areas. The resolution text lacks any mention of Israeli security concerns, historic ties to the lands or Hamas’s terror attacks in Israel on Oct. 7. The vote came after a day of debate on Tuesday. Argentina, Czechia, Fiji, Hungary, Malawi, Micronesia, Nauru, Palau, Papua New Guinea, Paraguay, Tonga, Tuvalu and the United States joined Israel in opposing the resolution. Notably, Germany, the United Kingdom, Canada, Italy, Ukraine and Australia were among those who abstained. General Assembly resolutions have no legal force, but the resolution’s passage on Wednesday is expected to be used in international courts and other fora to seek additional action against the Jewish state. It is widely expected that the Palestinians will request that the U.N. Security Council take up the issue. Security Council resolutions are binding, but the United States would be expected to thwart such an effort, including with its veto power. ‘Further fuel on worldwide antisemitism’ Danny Danon, Israel’s ambassador to the United Nations, called it 'a shameful decision that backs the Palestinian Authority’s diplomatic terrorism.' He added that the General Assembly 'continues to dance to the music of the Palestinian Authority, which backs the Hamas murderers.' Before the vote, U.N. Secretary-General António Guterres told reporters he would back the implementation of the resolution should it pass. Seth Riklin and Daniel Mariaschin, president and CEO respectively of B’nai B’rith International, said that the international nonprofit is 'appalled' by the 'atrocious' resolution. 'B’nai B’rith International strongly condemns the U.N. General Assembly’s passage of the first resolution officially sponsored by Palestinians days after they became the first non-member state group further upgraded to many member state privileges at the U.N. General Assembly, despite the world body’s own rules and practices,' the duo stated. 'Coming from an assembly in which Arab and other pro-Palestinian governments wield an automatic majority to annually condemn Israel more than all other countries combined, the motion is unprecedented in its shamelessly one-sided endorsement of Palestinian claims and political demands, and further erodes the U.N.’s credibility as a serious contributor to promoting conflict-resolution and universal human rights,' they added. 'Shame on all countries that enabled this atrocious affront to justice and peace as part of the latest UNGA ’emergency session’ on the Middle East that does nothing to help seriously address and settle the emergency,' Riklin and Mariaschin said. Arsen Ostrovsky and Nadav Steinman, CEO and board chair respectively of the International Legal Forum, stated that 'today, simply put, the United Nations has become the diplomatic arm of Hamas' and that the resolution 'is just the latest in a litany of obscenely one-sided anti-Israel resolutions at the U.N. since Oct. 7.' 'All it does is reward the murderers, rapists and abductors of Hamas while pouring further fuel on worldwide antisemitism and eroding whatever remaining credibility of the already problematic and politicized International Court of Justice, upon which this resolution is meant to be based,' they added. 'Ultimately, peace will only prevail when Hamas is defeated and the hostages are released, not through tiresome antics and pyrrhic Palestinian ‘victories’ at the U.N.' The post UN General Assembly passes resolution calling for Jerusalem Old City to be Jew-free appeared first on World Israel News.	https://worldisraelnews.com/un-general-assembly-passes-resolution-calling-for-jerusalem-old-city-to-be-jew-free/	2024-09-18T11:03:50-07:00	https://worldisraelnews.com/wp-content/uploads/2024/09/UN-vote.jpg
Finland’s president defends decisions to buy Israeli arms, not re...	President Alexander Stubb, who took office in March, has defined his and Finland’s new foreign policy stance as 'values-based realism.' By Reuters and The Algemeiner Finland’s President Alexander Stubb defended his country’s decision to buy arms from Israel despite the war in Gaza, saying it had no link to Finland’s unwillingness to recognize an independent Palestinian state at the present time. Finland is acquiring a ground based, high altitude, missile defense system called David’s Sling from Israel. Helsinki considers the system a high priority for its own defense due to neighboring Russia’s ongoing missile attacks on civilian and military targets in Ukraine. Stubb, who took office in March, has defined his and Finland’s new foreign policy stance as 'values-based realism,' which he has said was about 'achieving things in the world as it is,' instead of 'promoting only the world how I want to see it.' In an interview with Reuters on Tuesday, Stubb said the time was not right to recognize a Palestinian state, even though its Nordic neighbors, Sweden, Iceland, and most recently Norway, have done so. 'In the case of Israel and Palestine, values-based realism is prevalent in our thinking on the recognition of Palestine in the sense that we want that recognition, not if, but when it happens, to have an impact towards a two-state solution and a peaceful solution,' he said. Last month, Stubb told Finnish diplomats that Finland’s recognition of a Palestinian state was 'a matter of time' and that the right time would be picked strategically to promote peace in the Middle East. He said the decision had 'nothing to do with' the arms deal with Israel. 'In that one, I only look at realism, in other words, the fact that we need those weapons. So that’s when I look at Finnish security.' The post Finland’s president defends decisions to buy Israeli arms, not recognize Palestinian state appeared first on World Israel News.	https://worldisraelnews.com/finlands-president-defends-decisions-to-buy-israeli-arms-not-recognize-palestinian-state/	2024-09-18T10:54:10-07:00	https://worldisraelnews.com/wp-content/uploads/2024/09/shutterstock_2481455061-scaled.jpg
More Hezbollah comms devices explode across Lebanon, killing 14	At least one of the blasts took place in the vicinity of a funeral for terrorists killed on Tuesday. By Akiva Van Koningsveld, JNS More communications devices used by Hezbollah terrorists exploded on Wednesday afternoon across the group’s main stronghold in Beirut and in Southern Lebanon, Reuters reported, citing a security source. According to Lebanon’s Health Ministry, at least fourteen Hezbollah operatives were killed in the latest series of device explosions. In addition, some 400 terrorists were said to have sustained wounds. At least one of the blasts took place in the vicinity of a funeral for terrorists killed on Tuesday, when thousands of Hezbollah pagers detonated all over the country, according to eyewitness reports. The Hezbollah devices that exploded late Wednesday afternoon are hand-held walkie-talkies, a Lebanese security source told Reuters. Axios cited sources familiar with the matter as saying that the radios, which were booby-trapped in advance by Israeli intelligence, were part of the terror group’s emergency communications systems that were supposed to be used during a conflict with the Israel Defense Forces. תיעוד | פיצוץ מכשיר בביירות בזמן הלווית אחד ממחבלי חזבאללה שחוסלו אתמול@Doron_Kadosh pic.twitter.com/rT6dlmutpb &mdash; גלצ (@GLZRadio) September 18, 2024 On Tuesday, more than 2,700 Hezbollah operatives were wounded and at least 12 were killed across Lebanon when their pagers exploded, with the terrorist organization saying it held Israel 'fully responsible.' Speaking at a Wednesday funeral for several of the terrorists killed the day prior, Hezbollah executive council head Hashem Safieddine vowed a 'bloodily unique revenge' against the Jewish state, local reports said. 'Tomorrow, the leader of Hezbollah will speak and all will be revealed,' Safieddine said. 'We will be in a new situation and a new confrontation with this enemy.' The Israel Defense Forces declined to comment on Tuesday’s incident, which came just hours after the Israeli Cabinet added the return of citizens displaced from their homes in the north to the country’s war goals, bringing a potential major clash with Hezbollah closer to reality. Iran-backed Hezbollah has attacked Israel nearly daily since Oct. 8, firing thousands of rockets, missiles and drones. The attacks have so far killed more than 40 people and caused widespread damage. Tens of thousands of civilians remain internally displaced due to the violence. Israeli Prime Minister Benjamin Netanyahu told U.S. envoy Amos Hochstein this week that displaced Israelis will not be able to return home without strong military or diplomatic action against Hezbollah. Netanyahu 'made it very clear that it will not be possible to return our residents without a fundamental change in the security situation in the north,' Netanyahu’s office stated after a Monday meeting in Tel Aviv. Jerusalem will 'ultimately do what is necessary to safeguard its security and return the residents of the north securely to their homes,' he vowed. The post More Hezbollah comms devices explode across Lebanon, killing 14 appeared first on World Israel News.	https://worldisraelnews.com/more-hezbollah-comms-devices-explode-across-beirut-southern-lebanon/	2024-09-18T10:01:15-07:00	https://worldisraelnews.com/wp-content/uploads/2024/09/hezbollah-walkie.jpg
Holocaust mass grave found in Belarusian town	Estimates suggest that between 3,000 and 4,000 Jews from Stresyn and neighboring towns fell victim to the Holocaust. By Jewish Breaking News A small Belarusian town now stands as a sobering testament to the Holocaust’s devastation after the discovery this week of a mass grave holding Jewish victims. Once home to a thriving Jewish community, Stresyn and its surrounding Gomel region bore witness to the Holocaust’s devastation. In 1939, Jews comprised nearly 30% of the area’s population, with around 40,000 residents. While many managed to flee before the Nazi occupation in 1941, those who remained faced confinement in three ghettos with staggeringly high mortality rates. Estimates suggest that between 3,000 and 4,000 Jews from Stresyn and neighboring towns fell victim to the Holocaust. Among the 23 bodies found on Tuesday were those of 12 adults and 11 children, the youngest barely a year old and the oldest child just seven. While the remains showed no obvious signs of execution, the discovery of keys and a corroded rifle bullet within the burial site hints at the horror experienced by Stresyn’s Jewish community during the Final Solution. Local authorities suggest that these individuals likely succumbed to the inhumane conditions within the ghetto, where Jewish residents were forcibly relocated after having their property looted by the invading Nazis. According to state news agency Balta, a local resident uncovered the remains during routine agricultural work nearly 15 years ago. Despite widespread community knowledge about the ghetto’s Jewish victims, the grave’s existence curiously remained unreported until now. The post Holocaust mass grave found in Belarusian town appeared first on World Israel News.	https://worldisraelnews.com/holocaust-mass-grave-found-in-belarusian-town/	2024-09-18T09:37:08-07:00	https://worldisraelnews.com/wp-content/uploads/2024/09/GettyImages-1500841081.jpg
